  1   0.000000     10.0.1.3 -> 10.0.1.2     TCP 43250 > glrpc [SYN] Seq=0 Win=5840 Len=0 MSS=1460 TSV=4027423 TSER=0 WS=6
  2   0.000292     10.0.1.2 -> 10.0.1.3     TCP glrpc > 43250 [SYN, ACK] Seq=0 Ack=1 Win=14480 Len=0 MSS=1460 TSV=4080967 TSER=4027423 WS=6
  3   0.000316     10.0.1.3 -> 10.0.1.2     TCP 43250 > glrpc [ACK] Seq=1 Ack=1 Win=5888 Len=0 TSV=4027423 TSER=4080967
153504  16.544408     10.0.1.3 -> 10.0.1.2     TCP 43250 > glrpc [FIN, ACK] Seq=90301 Ack=150345301 Win=1990144 Len=0 TSV=4031559 TSER=4085091
153505  16.544868     10.0.1.2 -> 10.0.1.3     TCP glrpc > 43250 [FIN, ACK] Seq=150345301 Ack=90302 Win=64128 Len=0 TSV=4085103 TSER=4031559
================================================================================
IPv4 Conversations
Filter:<No Filter>
                                               |       <-      | |       ->      | |     Total     |
                                               | Frames  Bytes | | Frames  Bytes | | Frames  Bytes |
10.0.1.3             <-> 10.0.1.2              104274 157227392   49232   3339620  153506 160567012
================================================================================
  1   0.000000     10.0.1.3 -> 10.0.1.2     TCP 43252 > glrpc [SYN] Seq=0 Win=5840 Len=0 MSS=1460 TSV=4033623 TSER=0 WS=6
  2   0.000267     10.0.1.2 -> 10.0.1.3     TCP glrpc > 43252 [SYN, ACK] Seq=0 Ack=1 Win=14480 Len=0 MSS=1460 TSV=4087167 TSER=4033623 WS=6
  3   0.000291     10.0.1.3 -> 10.0.1.2     TCP 43252 > glrpc [ACK] Seq=1 Ack=1 Win=5888 Len=0 TSV=4033623 TSER=4087167
153395  16.568820     10.0.1.3 -> 10.0.1.2     TCP 43252 > glrpc [FIN, ACK] Seq=90301 Ack=150345301 Win=1991296 Len=0 TSV=4037765 TSER=4091291
153396  16.569338     10.0.1.2 -> 10.0.1.3     TCP glrpc > 43252 [FIN, ACK] Seq=150345301 Ack=90302 Win=64128 Len=0 TSV=4091310 TSER=4037765
================================================================================
IPv4 Conversations
Filter:<No Filter>
                                               |       <-      | |       ->      | |     Total     |
                                               | Frames  Bytes | | Frames  Bytes | | Frames  Bytes |
10.0.1.3             <-> 10.0.1.2              104272 157227260   49125   3332558  153397 160559818
================================================================================
  1   0.000000     10.0.1.3 -> 10.0.1.2     TCP 43254 > glrpc [SYN] Seq=0 Win=5840 Len=0 MSS=1460 TSV=4039845 TSER=0 WS=6
  2   0.000285     10.0.1.2 -> 10.0.1.3     TCP glrpc > 43254 [SYN, ACK] Seq=0 Ack=1 Win=14480 Len=0 MSS=1460 TSV=4093390 TSER=4039845 WS=6
  3   0.000307     10.0.1.3 -> 10.0.1.2     TCP 43254 > glrpc [ACK] Seq=1 Ack=1 Win=5888 Len=0 TSV=4039845 TSER=4093390
153349  16.564429     10.0.1.3 -> 10.0.1.2     TCP 43254 > glrpc [FIN, ACK] Seq=90301 Ack=150345301 Win=1975680 Len=0 TSV=4043986 TSER=4097501
153350  16.564899     10.0.1.2 -> 10.0.1.3     TCP glrpc > 43254 [FIN, ACK] Seq=150345301 Ack=90302 Win=64128 Len=0 TSV=4097531 TSER=4043986
================================================================================
IPv4 Conversations
Filter:<No Filter>
                                               |       <-      | |       ->      | |     Total     |
                                               | Frames  Bytes | | Frames  Bytes | | Frames  Bytes |
10.0.1.3             <-> 10.0.1.2              104276 157227524   49075   3329258  153351 160556782
================================================================================
  1   0.000000     10.0.1.3 -> 10.0.1.2     TCP 43256 > glrpc [SYN] Seq=0 Win=5840 Len=0 MSS=1460 TSV=4046060 TSER=0 WS=6
  2   0.000369     10.0.1.2 -> 10.0.1.3     TCP glrpc > 43256 [SYN, ACK] Seq=0 Ack=1 Win=14480 Len=0 MSS=1460 TSV=4099605 TSER=4046060 WS=6
  3   0.000395     10.0.1.3 -> 10.0.1.2     TCP 43256 > glrpc [ACK] Seq=1 Ack=1 Win=5888 Len=0 TSV=4046060 TSER=4099605
152517  16.568123     10.0.1.3 -> 10.0.1.2     TCP 43256 > glrpc [FIN, ACK] Seq=90301 Ack=150345301 Win=1988416 Len=0 TSV=4050202 TSER=4103718
152518  16.568582     10.0.1.2 -> 10.0.1.3     TCP glrpc > 43256 [FIN, ACK] Seq=150345301 Ack=90302 Win=64128 Len=0 TSV=4103747 TSER=4050202
================================================================================
IPv4 Conversations
Filter:<No Filter>
                                               |       <-      | |       ->      | |     Total     |
                                               | Frames  Bytes | | Frames  Bytes | | Frames  Bytes |
10.0.1.3             <-> 10.0.1.2              104275 157227458   48244   3274412  152519 160501870
================================================================================
  1   0.000000     10.0.1.3 -> 10.0.1.2     TCP 38897 > glrpc [SYN] Seq=0 Win=5840 Len=0 MSS=1460 TSV=4052255 TSER=0 WS=6
  2   0.000278     10.0.1.2 -> 10.0.1.3     TCP glrpc > 38897 [SYN, ACK] Seq=0 Ack=1 Win=14480 Len=0 MSS=1460 TSV=4105801 TSER=4052255 WS=6
  3   0.000300     10.0.1.3 -> 10.0.1.2     TCP 38897 > glrpc [ACK] Seq=1 Ack=1 Win=5888 Len=0 TSV=4052255 TSER=4105801
153327  16.569928     10.0.1.3 -> 10.0.1.2     TCP 38897 > glrpc [FIN, ACK] Seq=90301 Ack=150345301 Win=1866816 Len=0 TSV=4056397 TSER=4109928
153328  16.570376     10.0.1.2 -> 10.0.1.3     TCP glrpc > 38897 [FIN, ACK] Seq=150345301 Ack=90302 Win=64128 Len=0 TSV=4109943 TSER=4056397
================================================================================
IPv4 Conversations
Filter:<No Filter>
                                               |       <-      | |       ->      | |     Total     |
                                               | Frames  Bytes | | Frames  Bytes | | Frames  Bytes |
10.0.1.3             <-> 10.0.1.2              104269 157227062   49060   3328268  153329 160555330
================================================================================
  1   0.000000     10.0.1.3 -> 10.0.1.2     TCP 38899 > glrpc [SYN] Seq=0 Win=5840 Len=0 MSS=1460 TSV=4058454 TSER=0 WS=6
  2   0.000362     10.0.1.2 -> 10.0.1.3     TCP glrpc > 38899 [SYN, ACK] Seq=0 Ack=1 Win=14480 Len=0 MSS=1460 TSV=4112000 TSER=4058454 WS=6
  3   0.000386     10.0.1.3 -> 10.0.1.2     TCP 38899 > glrpc [ACK] Seq=1 Ack=1 Win=5888 Len=0 TSV=4058454 TSER=4112000
153429  16.538957     10.0.1.3 -> 10.0.1.2     TCP 38899 > glrpc [FIN, ACK] Seq=90301 Ack=150345301 Win=1978560 Len=0 TSV=4062589 TSER=4116119
153430  16.539406     10.0.1.2 -> 10.0.1.3     TCP glrpc > 38899 [FIN, ACK] Seq=150345301 Ack=90302 Win=64128 Len=0 TSV=4116135 TSER=4062589
================================================================================
IPv4 Conversations
Filter:<No Filter>
                                               |       <-      | |       ->      | |     Total     |
                                               | Frames  Bytes | | Frames  Bytes | | Frames  Bytes |
10.0.1.3             <-> 10.0.1.2              104269 157227062   49162   3335000  153431 160562062
================================================================================
  1   0.000000     10.0.1.3 -> 10.0.1.2     TCP 38901 > glrpc [SYN] Seq=0 Win=5840 Len=0 MSS=1460 TSV=4064653 TSER=0 WS=6
  2   0.000315     10.0.1.2 -> 10.0.1.3     TCP glrpc > 38901 [SYN, ACK] Seq=0 Ack=1 Win=14480 Len=0 MSS=1460 TSV=4118200 TSER=4064653 WS=6
  3   0.000337     10.0.1.3 -> 10.0.1.2     TCP 38901 > glrpc [ACK] Seq=1 Ack=1 Win=5888 Len=0 TSV=4064653 TSER=4118200
153646  16.516267     10.0.1.3 -> 10.0.1.2     TCP 38901 > glrpc [FIN, ACK] Seq=90301 Ack=150345301 Win=1993024 Len=0 TSV=4068782 TSER=4122322
153647  16.516730     10.0.1.2 -> 10.0.1.3     TCP glrpc > 38901 [FIN, ACK] Seq=150345301 Ack=90302 Win=64128 Len=0 TSV=4122329 TSER=4068782
================================================================================
IPv4 Conversations
Filter:<No Filter>
                                               |       <-      | |       ->      | |     Total     |
                                               | Frames  Bytes | | Frames  Bytes | | Frames  Bytes |
10.0.1.3             <-> 10.0.1.2              104278 157227656   49370   3348728  153648 160576384
================================================================================
  1   0.000000     10.0.1.3 -> 10.0.1.2     TCP 38903 > glrpc [SYN] Seq=0 Win=5840 Len=0 MSS=1460 TSV=4070858 TSER=0 WS=6
  2   0.000295     10.0.1.2 -> 10.0.1.3     TCP glrpc > 38903 [SYN, ACK] Seq=0 Ack=1 Win=14480 Len=0 MSS=1460 TSV=4124405 TSER=4070858 WS=6
  3   0.000317     10.0.1.3 -> 10.0.1.2     TCP 38903 > glrpc [ACK] Seq=1 Ack=1 Win=5888 Len=0 TSV=4070858 TSER=4124405
153608  16.586027     10.0.1.3 -> 10.0.1.2     TCP 38903 > glrpc [FIN, ACK] Seq=90301 Ack=150345301 Win=1981312 Len=0 TSV=4075005 TSER=4128538
153609  16.586489     10.0.1.2 -> 10.0.1.3     TCP glrpc > 38903 [FIN, ACK] Seq=150345301 Ack=90302 Win=64128 Len=0 TSV=4128552 TSER=4075005
================================================================================
IPv4 Conversations
Filter:<No Filter>
                                               |       <-      | |       ->      | |     Total     |
                                               | Frames  Bytes | | Frames  Bytes | | Frames  Bytes |
10.0.1.3             <-> 10.0.1.2              104274 157227392   49336   3346484  153610 160573876
================================================================================
  1   0.000000     10.0.1.3 -> 10.0.1.2     TCP 38907 > glrpc [SYN] Seq=0 Win=5840 Len=0 MSS=1460 TSV=4077073 TSER=0 WS=6
  2   0.000298     10.0.1.2 -> 10.0.1.3     TCP glrpc > 38907 [SYN, ACK] Seq=0 Ack=1 Win=14480 Len=0 MSS=1460 TSV=4130621 TSER=4077073 WS=6
  3   0.000320     10.0.1.3 -> 10.0.1.2     TCP 38907 > glrpc [ACK] Seq=1 Ack=1 Win=5888 Len=0 TSV=4077073 TSER=4130621
153786  16.683080     10.0.1.3 -> 10.0.1.2     TCP 38907 > glrpc [FIN, ACK] Seq=90301 Ack=150345301 Win=1931648 Len=0 TSV=4081244 TSER=4134762
153787  16.683558     10.0.1.2 -> 10.0.1.3     TCP glrpc > 38907 [FIN, ACK] Seq=150345301 Ack=90302 Win=64128 Len=0 TSV=4134792 TSER=4081244
================================================================================
IPv4 Conversations
Filter:<No Filter>
                                               |       <-      | |       ->      | |     Total     |
                                               | Frames  Bytes | | Frames  Bytes | | Frames  Bytes |
10.0.1.3             <-> 10.0.1.2              104275 157227458   49513   3358166  153788 160585624
================================================================================
  1   0.000000     10.0.1.3 -> 10.0.1.2     TCP 38909 > glrpc [SYN] Seq=0 Win=5840 Len=0 MSS=1460 TSV=4083301 TSER=0 WS=6
  2   0.000293     10.0.1.2 -> 10.0.1.3     TCP glrpc > 38909 [SYN, ACK] Seq=0 Ack=1 Win=14480 Len=0 MSS=1460 TSV=4136849 TSER=4083301 WS=6
  3   0.000319     10.0.1.3 -> 10.0.1.2     TCP 38909 > glrpc [ACK] Seq=1 Ack=1 Win=5888 Len=0 TSV=4083301 TSER=4136849
153805  16.608418     10.0.1.3 -> 10.0.1.2     TCP 38909 > glrpc [FIN, ACK] Seq=90301 Ack=150345301 Win=1972800 Len=0 TSV=4087453 TSER=4140986
153806  16.608860     10.0.1.2 -> 10.0.1.3     TCP glrpc > 38909 [FIN, ACK] Seq=150345301 Ack=90302 Win=64128 Len=0 TSV=4141002 TSER=4087453
================================================================================
IPv4 Conversations
Filter:<No Filter>
                                               |       <-      | |       ->      | |     Total     |
                                               | Frames  Bytes | | Frames  Bytes | | Frames  Bytes |
10.0.1.3             <-> 10.0.1.2              104272 157227260   49535   3359618  153807 160586878
================================================================================
  1   0.000000     10.0.1.3 -> 10.0.1.2     TCP 38911 > glrpc [SYN] Seq=0 Win=5840 Len=0 MSS=1460 TSV=4089531 TSER=0 WS=6
  2   0.000293     10.0.1.2 -> 10.0.1.3     TCP glrpc > 38911 [SYN, ACK] Seq=0 Ack=1 Win=14480 Len=0 MSS=1460 TSV=4143079 TSER=4089531 WS=6
  3   0.000315     10.0.1.3 -> 10.0.1.2     TCP 38911 > glrpc [ACK] Seq=1 Ack=1 Win=5888 Len=0 TSV=4089531 TSER=4143079
153564  16.556212     10.0.1.3 -> 10.0.1.2     TCP 38911 > glrpc [FIN, ACK] Seq=90301 Ack=150345301 Win=1784768 Len=0 TSV=4093670 TSER=4147189
153565  16.556657     10.0.1.2 -> 10.0.1.3     TCP glrpc > 38911 [FIN, ACK] Seq=150345301 Ack=90302 Win=64128 Len=0 TSV=4147218 TSER=4093670
================================================================================
IPv4 Conversations
Filter:<No Filter>
                                               |       <-      | |       ->      | |     Total     |
                                               | Frames  Bytes | | Frames  Bytes | | Frames  Bytes |
10.0.1.3             <-> 10.0.1.2              104274 157227392   49292   3343580  153566 160570972
================================================================================
  1   0.000000     10.0.1.3 -> 10.0.1.2     TCP 38913 > glrpc [SYN] Seq=0 Win=5840 Len=0 MSS=1460 TSV=4095738 TSER=0 WS=6
  2   0.000262     10.0.1.2 -> 10.0.1.3     TCP glrpc > 38913 [SYN, ACK] Seq=0 Ack=1 Win=14480 Len=0 MSS=1460 TSV=4149286 TSER=4095738 WS=6
  3   0.000284     10.0.1.3 -> 10.0.1.2     TCP 38913 > glrpc [ACK] Seq=1 Ack=1 Win=5888 Len=0 TSV=4095738 TSER=4149286
153392  16.550535     10.0.1.3 -> 10.0.1.2     TCP 38913 > glrpc [FIN, ACK] Seq=90301 Ack=150345301 Win=1844800 Len=0 TSV=4099875 TSER=4153410
153393  16.551011     10.0.1.2 -> 10.0.1.3     TCP glrpc > 38913 [FIN, ACK] Seq=150345301 Ack=90302 Win=64128 Len=0 TSV=4153424 TSER=4099875
================================================================================
IPv4 Conversations
Filter:<No Filter>
                                               |       <-      | |       ->      | |     Total     |
                                               | Frames  Bytes | | Frames  Bytes | | Frames  Bytes |
10.0.1.3             <-> 10.0.1.2              104283 157227986   49111   3331634  153394 160559620
================================================================================
  1   0.000000     10.0.1.3 -> 10.0.1.2     TCP 38915 > glrpc [SYN] Seq=0 Win=5840 Len=0 MSS=1460 TSV=4101955 TSER=0 WS=6
  2   0.000333     10.0.1.2 -> 10.0.1.3     TCP glrpc > 38915 [SYN, ACK] Seq=0 Ack=1 Win=14480 Len=0 MSS=1460 TSV=4155505 TSER=4101955 WS=6
  3   0.000353     10.0.1.3 -> 10.0.1.2     TCP 38915 > glrpc [ACK] Seq=1 Ack=1 Win=5888 Len=0 TSV=4101956 TSER=4155505
153242  16.632688     10.0.1.3 -> 10.0.1.2     TCP 38915 > glrpc [FIN, ACK] Seq=90301 Ack=150345301 Win=1924288 Len=0 TSV=4106114 TSER=4159646
153243  16.633130     10.0.1.2 -> 10.0.1.3     TCP glrpc > 38915 [FIN, ACK] Seq=150345301 Ack=90302 Win=64128 Len=0 TSV=4159663 TSER=4106114
================================================================================
IPv4 Conversations
Filter:<No Filter>
                                               |       <-      | |       ->      | |     Total     |
                                               | Frames  Bytes | | Frames  Bytes | | Frames  Bytes |
10.0.1.3             <-> 10.0.1.2              104268 157226996   48976   3322724  153244 160549720
================================================================================
  1   0.000000     10.0.1.3 -> 10.0.1.2     TCP 38917 > glrpc [SYN] Seq=0 Win=5840 Len=0 MSS=1460 TSV=4108183 TSER=0 WS=6
  2   0.000369     10.0.1.2 -> 10.0.1.3     TCP glrpc > 38917 [SYN, ACK] Seq=0 Ack=1 Win=14480 Len=0 MSS=1460 TSV=4161733 TSER=4108183 WS=6
  3   0.000390     10.0.1.3 -> 10.0.1.2     TCP 38917 > glrpc [ACK] Seq=1 Ack=1 Win=5888 Len=0 TSV=4108183 TSER=4161733
153423  16.530845     10.0.1.3 -> 10.0.1.2     TCP 38917 > glrpc [FIN, ACK] Seq=90301 Ack=150345301 Win=1844800 Len=0 TSV=4112316 TSER=4165851
153424  16.531266     10.0.1.2 -> 10.0.1.3     TCP glrpc > 38917 [FIN, ACK] Seq=150345301 Ack=90302 Win=64128 Len=0 TSV=4165866 TSER=4112316
================================================================================
IPv4 Conversations
Filter:<No Filter>
                                               |       <-      | |       ->      | |     Total     |
                                               | Frames  Bytes | | Frames  Bytes | | Frames  Bytes |
10.0.1.3             <-> 10.0.1.2              104280 157227788   49145   3333878  153425 160561666
================================================================================
  1   0.000000     10.0.1.3 -> 10.0.1.2     TCP 38919 > glrpc [SYN] Seq=0 Win=5840 Len=0 MSS=1460 TSV=4114395 TSER=0 WS=6
  2   0.000319     10.0.1.2 -> 10.0.1.3     TCP glrpc > 38919 [SYN, ACK] Seq=0 Ack=1 Win=14480 Len=0 MSS=1460 TSV=4167945 TSER=4114395 WS=6
  3   0.000341     10.0.1.3 -> 10.0.1.2     TCP 38919 > glrpc [ACK] Seq=1 Ack=1 Win=5888 Len=0 TSV=4114395 TSER=4167945
153430  16.586222     10.0.1.3 -> 10.0.1.2     TCP 38919 > glrpc [FIN, ACK] Seq=90301 Ack=150345301 Win=1988416 Len=0 TSV=4118541 TSER=4172062
153431  16.586668     10.0.1.2 -> 10.0.1.3     TCP glrpc > 38919 [FIN, ACK] Seq=150345301 Ack=90302 Win=64128 Len=0 TSV=4172092 TSER=4118541
================================================================================
IPv4 Conversations
Filter:<No Filter>
                                               |       <-      | |       ->      | |     Total     |
                                               | Frames  Bytes | | Frames  Bytes | | Frames  Bytes |
10.0.1.3             <-> 10.0.1.2              104276 157227524   49156   3334604  153432 160562128
================================================================================
  1   0.000000     10.0.1.3 -> 10.0.1.2     TCP 38921 > glrpc [SYN] Seq=0 Win=5840 Len=0 MSS=1460 TSV=4120615 TSER=0 WS=6
  2   0.000298     10.0.1.2 -> 10.0.1.3     TCP glrpc > 38921 [SYN, ACK] Seq=0 Ack=1 Win=14480 Len=0 MSS=1460 TSV=4174166 TSER=4120615 WS=6
  3   0.000318     10.0.1.3 -> 10.0.1.2     TCP 38921 > glrpc [ACK] Seq=1 Ack=1 Win=5888 Len=0 TSV=4120615 TSER=4174166
153726  16.554342     10.0.1.3 -> 10.0.1.2     TCP 38921 > glrpc [FIN, ACK] Seq=90301 Ack=150345301 Win=1989952 Len=0 TSV=4124754 TSER=4178276
153727  16.554787     10.0.1.2 -> 10.0.1.3     TCP glrpc > 38921 [FIN, ACK] Seq=150345301 Ack=90302 Win=64128 Len=0 TSV=4178305 TSER=4124754
================================================================================
IPv4 Conversations
Filter:<No Filter>
                                               |       <-      | |       ->      | |     Total     |
                                               | Frames  Bytes | | Frames  Bytes | | Frames  Bytes |
10.0.1.3             <-> 10.0.1.2              104276 157227524   49452   3354140  153728 160581664
================================================================================
  1   0.000000     10.0.1.3 -> 10.0.1.2     TCP 36238 > glrpc [SYN] Seq=0 Win=5840 Len=0 MSS=1460 TSV=4126842 TSER=0 WS=6
  2   0.000364     10.0.1.2 -> 10.0.1.3     TCP glrpc > 36238 [SYN, ACK] Seq=0 Ack=1 Win=14480 Len=0 MSS=1460 TSV=4180393 TSER=4126842 WS=6
  3   0.000385     10.0.1.3 -> 10.0.1.2     TCP 36238 > glrpc [ACK] Seq=1 Ack=1 Win=5888 Len=0 TSV=4126842 TSER=4180393
153232  16.570675     10.0.1.3 -> 10.0.1.2     TCP 36238 > glrpc [FIN, ACK] Seq=90301 Ack=150345301 Win=1957696 Len=0 TSV=4130985 TSER=4184506
153233  16.571211     10.0.1.2 -> 10.0.1.3     TCP glrpc > 36238 [FIN, ACK] Seq=150345301 Ack=90302 Win=64128 Len=0 TSV=4184536 TSER=4130985
================================================================================
IPv4 Conversations
Filter:<No Filter>
                                               |       <-      | |       ->      | |     Total     |
                                               | Frames  Bytes | | Frames  Bytes | | Frames  Bytes |
10.0.1.3             <-> 10.0.1.2              104273 157227326   48961   3321734  153234 160549060
================================================================================
  1   0.000000     10.0.1.3 -> 10.0.1.2     TCP 36240 > glrpc [SYN] Seq=0 Win=5840 Len=0 MSS=1460 TSV=4133053 TSER=0 WS=6
  2   0.000289     10.0.1.2 -> 10.0.1.3     TCP glrpc > 36240 [SYN, ACK] Seq=0 Ack=1 Win=14480 Len=0 MSS=1460 TSV=4186605 TSER=4133053 WS=6
  3   0.000313     10.0.1.3 -> 10.0.1.2     TCP 36240 > glrpc [ACK] Seq=1 Ack=1 Win=5888 Len=0 TSV=4133054 TSER=4186605
153362  16.615333     10.0.1.3 -> 10.0.1.2     TCP 36240 > glrpc [FIN, ACK] Seq=90301 Ack=150345301 Win=1990144 Len=0 TSV=4137207 TSER=4190742
153363  16.615792     10.0.1.2 -> 10.0.1.3     TCP glrpc > 36240 [FIN, ACK] Seq=150345301 Ack=90302 Win=64128 Len=0 TSV=4190759 TSER=4137207
================================================================================
IPv4 Conversations
Filter:<No Filter>
                                               |       <-      | |       ->      | |     Total     |
                                               | Frames  Bytes | | Frames  Bytes | | Frames  Bytes |
10.0.1.3             <-> 10.0.1.2              104270 157227128   49094   3330512  153364 160557640
================================================================================
  1   0.000000     10.0.1.3 -> 10.0.1.2     TCP 36242 > glrpc [SYN] Seq=0 Win=5840 Len=0 MSS=1460 TSV=4139279 TSER=0 WS=6
  2   0.000294     10.0.1.2 -> 10.0.1.3     TCP glrpc > 36242 [SYN, ACK] Seq=0 Ack=1 Win=14480 Len=0 MSS=1460 TSV=4192831 TSER=4139279 WS=6
  3   0.000316     10.0.1.3 -> 10.0.1.2     TCP 36242 > glrpc [ACK] Seq=1 Ack=1 Win=5888 Len=0 TSV=4139279 TSER=4192831
153432  16.578186     10.0.1.3 -> 10.0.1.2     TCP 36242 > glrpc [FIN, ACK] Seq=90301 Ack=150345301 Win=1785728 Len=0 TSV=4143423 TSER=4196946
153433  16.578650     10.0.1.2 -> 10.0.1.3     TCP glrpc > 36242 [FIN, ACK] Seq=150345301 Ack=90302 Win=64128 Len=0 TSV=4196976 TSER=4143423
================================================================================
IPv4 Conversations
Filter:<No Filter>
                                               |       <-      | |       ->      | |     Total     |
                                               | Frames  Bytes | | Frames  Bytes | | Frames  Bytes |
10.0.1.3             <-> 10.0.1.2              104274 157227392   49160   3334868  153434 160562260
================================================================================
  1   0.000000     10.0.1.3 -> 10.0.1.2     TCP 36244 > glrpc [SYN] Seq=0 Win=5840 Len=0 MSS=1460 TSV=4145485 TSER=0 WS=6
  2   0.000280     10.0.1.2 -> 10.0.1.3     TCP glrpc > 36244 [SYN, ACK] Seq=0 Ack=1 Win=14480 Len=0 MSS=1460 TSV=4199038 TSER=4145485 WS=6
  3   0.000302     10.0.1.3 -> 10.0.1.2     TCP 36244 > glrpc [ACK] Seq=1 Ack=1 Win=5888 Len=0 TSV=4145485 TSER=4199038
153493  16.592071     10.0.1.3 -> 10.0.1.2     TCP 36244 > glrpc [FIN, ACK] Seq=90301 Ack=150345301 Win=1984384 Len=0 TSV=4149633 TSER=4203154
153494  16.592513     10.0.1.2 -> 10.0.1.3     TCP glrpc > 36244 [FIN, ACK] Seq=150345301 Ack=90302 Win=64128 Len=0 TSV=4203186 TSER=4149633
================================================================================
IPv4 Conversations
Filter:<No Filter>
                                               |       <-      | |       ->      | |     Total     |
                                               | Frames  Bytes | | Frames  Bytes | | Frames  Bytes |
10.0.1.3             <-> 10.0.1.2              104273 157227326   49222   3338960  153495 160566286
================================================================================
