  1   0.000000     10.0.1.3 -> 10.0.1.2     TCP 33805 > glrpc [SYN] Seq=0 Win=5840 Len=0 MSS=1460 TSV=3937122 TSER=0 WS=6
  2   0.000278     10.0.1.2 -> 10.0.1.3     TCP glrpc > 33805 [SYN, ACK] Seq=0 Ack=1 Win=14480 Len=0 MSS=1460 TSV=3990659 TSER=3937122 WS=6
  3   0.000299     10.0.1.3 -> 10.0.1.2     TCP 33805 > glrpc [ACK] Seq=1 Ack=1 Win=5888 Len=0 TSV=3937122 TSER=3990659
102180  11.068557     10.0.1.3 -> 10.0.1.2     TCP 33805 > glrpc [FIN, ACK] Seq=60201 Ack=100230201 Win=1778496 Len=0 TSV=3939889 TSER=3993411
102181  11.069018     10.0.1.2 -> 10.0.1.3     TCP glrpc > 33805 [FIN, ACK] Seq=100230201 Ack=60202 Win=64128 Len=0 TSV=3993426 TSER=3939889
================================================================================
IPv4 Conversations
Filter:<No Filter>
                                               |       <-      | |       ->      | |     Total     |
                                               | Frames  Bytes | | Frames  Bytes | | Frames  Bytes |
10.0.1.3             <-> 10.0.1.2               69524 104818792   32658   2215636  102182 107034428
================================================================================
  1   0.000000     10.0.1.3 -> 10.0.1.2     TCP 33807 > glrpc [SYN] Seq=0 Win=5840 Len=0 MSS=1460 TSV=3941633 TSER=0 WS=6
  2   0.000293     10.0.1.2 -> 10.0.1.3     TCP glrpc > 33807 [SYN, ACK] Seq=0 Ack=1 Win=14480 Len=0 MSS=1460 TSV=3995170 TSER=3941633 WS=6
  3   0.000315     10.0.1.3 -> 10.0.1.2     TCP 33807 > glrpc [ACK] Seq=1 Ack=1 Win=5888 Len=0 TSV=3941633 TSER=3995170
101829  11.053974     10.0.1.3 -> 10.0.1.2     TCP 33807 > glrpc [FIN, ACK] Seq=60201 Ack=100230201 Win=1897728 Len=0 TSV=3944396 TSER=3997921
101830  11.054423     10.0.1.2 -> 10.0.1.3     TCP glrpc > 33807 [FIN, ACK] Seq=100230201 Ack=60202 Win=64128 Len=0 TSV=3997934 TSER=3944396
================================================================================
IPv4 Conversations
Filter:<No Filter>
                                               |       <-      | |       ->      | |     Total     |
                                               | Frames  Bytes | | Frames  Bytes | | Frames  Bytes |
10.0.1.3             <-> 10.0.1.2               69519 104818462   32312   2192800  101831 107011262
================================================================================
  1   0.000000     10.0.1.3 -> 10.0.1.2     TCP 33809 > glrpc [SYN] Seq=0 Win=5840 Len=0 MSS=1460 TSV=3946133 TSER=0 WS=6
  2   0.000307     10.0.1.2 -> 10.0.1.3     TCP glrpc > 33809 [SYN, ACK] Seq=0 Ack=1 Win=14480 Len=0 MSS=1460 TSV=3999670 TSER=3946133 WS=6
  3   0.000329     10.0.1.3 -> 10.0.1.2     TCP 33809 > glrpc [ACK] Seq=1 Ack=1 Win=5888 Len=0 TSV=3946133 TSER=3999670
102311  11.088175     10.0.1.3 -> 10.0.1.2     TCP 33809 > glrpc [FIN, ACK] Seq=60201 Ack=100230201 Win=1840960 Len=0 TSV=3948905 TSER=4002429
102312  11.088639     10.0.1.2 -> 10.0.1.3     TCP glrpc > 33809 [FIN, ACK] Seq=100230201 Ack=60202 Win=64128 Len=0 TSV=4002442 TSER=3948905
================================================================================
IPv4 Conversations
Filter:<No Filter>
                                               |       <-      | |       ->      | |     Total     |
                                               | Frames  Bytes | | Frames  Bytes | | Frames  Bytes |
10.0.1.3             <-> 10.0.1.2               69518 104818396   32795   2224678  102313 107043074
================================================================================
  1   0.000000     10.0.1.3 -> 10.0.1.2     TCP 33811 > glrpc [SYN] Seq=0 Win=5840 Len=0 MSS=1460 TSV=3950649 TSER=0 WS=6
  2   0.000288     10.0.1.2 -> 10.0.1.3     TCP glrpc > 33811 [SYN, ACK] Seq=0 Ack=1 Win=14480 Len=0 MSS=1460 TSV=4004187 TSER=3950649 WS=6
  3   0.000311     10.0.1.3 -> 10.0.1.2     TCP 33811 > glrpc [ACK] Seq=1 Ack=1 Win=5888 Len=0 TSV=3950649 TSER=4004187
102265  11.114199     10.0.1.3 -> 10.0.1.2     TCP 33811 > glrpc [FIN, ACK] Seq=60201 Ack=100230201 Win=1990144 Len=0 TSV=3953427 TSER=4006937
102266  11.114676     10.0.1.2 -> 10.0.1.3     TCP glrpc > 33811 [FIN, ACK] Seq=100230201 Ack=60202 Win=64128 Len=0 TSV=4006965 TSER=3953427
================================================================================
IPv4 Conversations
Filter:<No Filter>
                                               |       <-      | |       ->      | |     Total     |
                                               | Frames  Bytes | | Frames  Bytes | | Frames  Bytes |
10.0.1.3             <-> 10.0.1.2               69518 104818396   32749   2221642  102267 107040038
================================================================================
  1   0.000000     10.0.1.3 -> 10.0.1.2     TCP 33813 > glrpc [SYN] Seq=0 Win=5840 Len=0 MSS=1460 TSV=3955170 TSER=0 WS=6
  2   0.000321     10.0.1.2 -> 10.0.1.3     TCP glrpc > 33813 [SYN, ACK] Seq=0 Ack=1 Win=14480 Len=0 MSS=1460 TSV=4008708 TSER=3955170 WS=6
  3   0.000338     10.0.1.3 -> 10.0.1.2     TCP 33813 > glrpc [ACK] Seq=1 Ack=1 Win=5888 Len=0 TSV=3955170 TSER=4008708
102171  11.095561     10.0.1.3 -> 10.0.1.2     TCP 33813 > glrpc [FIN, ACK] Seq=60201 Ack=100230201 Win=1990144 Len=0 TSV=3957943 TSER=4011466
102172  11.096044     10.0.1.2 -> 10.0.1.3     TCP glrpc > 33813 [FIN, ACK] Seq=100230201 Ack=60202 Win=64128 Len=0 TSV=4011482 TSER=3957943
================================================================================
IPv4 Conversations
Filter:<No Filter>
                                               |       <-      | |       ->      | |     Total     |
                                               | Frames  Bytes | | Frames  Bytes | | Frames  Bytes |
10.0.1.3             <-> 10.0.1.2               69512 104818000   32661   2215834  102173 107033834
================================================================================
  1   0.000000     10.0.1.3 -> 10.0.1.2     TCP 33815 > glrpc [SYN] Seq=0 Win=5840 Len=0 MSS=1460 TSV=3959683 TSER=0 WS=6
  2   0.000293     10.0.1.2 -> 10.0.1.3     TCP glrpc > 33815 [SYN, ACK] Seq=0 Ack=1 Win=14480 Len=0 MSS=1460 TSV=4013221 TSER=3959683 WS=6
  3   0.000316     10.0.1.3 -> 10.0.1.2     TCP 33815 > glrpc [ACK] Seq=1 Ack=1 Win=5888 Len=0 TSV=3959683 TSER=4013221
102176  11.062443     10.0.1.3 -> 10.0.1.2     TCP 33815 > glrpc [FIN, ACK] Seq=60201 Ack=100230201 Win=1862144 Len=0 TSV=3962448 TSER=4015957
102177  11.062915     10.0.1.2 -> 10.0.1.3     TCP glrpc > 33815 [FIN, ACK] Seq=100230201 Ack=60202 Win=64128 Len=0 TSV=4015987 TSER=3962448
================================================================================
IPv4 Conversations
Filter:<No Filter>
                                               |       <-      | |       ->      | |     Total     |
                                               | Frames  Bytes | | Frames  Bytes | | Frames  Bytes |
10.0.1.3             <-> 10.0.1.2               69521 104818594   32657   2215570  102178 107034164
================================================================================
  1   0.000000     10.0.1.3 -> 10.0.1.2     TCP 33817 > glrpc [SYN] Seq=0 Win=5840 Len=0 MSS=1460 TSV=3964187 TSER=0 WS=6
  2   0.000294     10.0.1.2 -> 10.0.1.3     TCP glrpc > 33817 [SYN, ACK] Seq=0 Ack=1 Win=14480 Len=0 MSS=1460 TSV=4017726 TSER=3964187 WS=6
  3   0.000313     10.0.1.3 -> 10.0.1.2     TCP 33817 > glrpc [ACK] Seq=1 Ack=1 Win=5888 Len=0 TSV=3964187 TSER=4017726
102309  11.060260     10.0.1.3 -> 10.0.1.2     TCP 33817 > glrpc [FIN, ACK] Seq=60201 Ack=100230201 Win=1981312 Len=0 TSV=3966952 TSER=4020482
102310  11.060712     10.0.1.2 -> 10.0.1.3     TCP glrpc > 33817 [FIN, ACK] Seq=100230201 Ack=60202 Win=64128 Len=0 TSV=4020491 TSER=3966952
================================================================================
IPv4 Conversations
Filter:<No Filter>
                                               |       <-      | |       ->      | |     Total     |
                                               | Frames  Bytes | | Frames  Bytes | | Frames  Bytes |
10.0.1.3             <-> 10.0.1.2               69521 104818594   32790   2224348  102311 107042942
================================================================================
  1   0.000000     10.0.1.3 -> 10.0.1.2     TCP 33819 > glrpc [SYN] Seq=0 Win=5840 Len=0 MSS=1460 TSV=3968686 TSER=0 WS=6
  2   0.000299     10.0.1.2 -> 10.0.1.3     TCP glrpc > 33819 [SYN, ACK] Seq=0 Ack=1 Win=14480 Len=0 MSS=1460 TSV=4022225 TSER=3968686 WS=6
  3   0.000323     10.0.1.3 -> 10.0.1.2     TCP 33819 > glrpc [ACK] Seq=1 Ack=1 Win=5888 Len=0 TSV=3968687 TSER=4022225
101923  11.063150     10.0.1.3 -> 10.0.1.2     TCP 33819 > glrpc [FIN, ACK] Seq=60201 Ack=100230201 Win=1981440 Len=0 TSV=3971452 TSER=4024963
101924  11.063609     10.0.1.2 -> 10.0.1.3     TCP glrpc > 33819 [FIN, ACK] Seq=100230201 Ack=60202 Win=64128 Len=0 TSV=4024992 TSER=3971452
================================================================================
IPv4 Conversations
Filter:<No Filter>
                                               |       <-      | |       ->      | |     Total     |
                                               | Frames  Bytes | | Frames  Bytes | | Frames  Bytes |
10.0.1.3             <-> 10.0.1.2               69519 104818462   32406   2199004  101925 107017466
================================================================================
  1   0.000000     10.0.1.3 -> 10.0.1.2     TCP 33823 > glrpc [SYN] Seq=0 Win=5840 Len=0 MSS=1460 TSV=3973203 TSER=0 WS=6
  2   0.000295     10.0.1.2 -> 10.0.1.3     TCP glrpc > 33823 [SYN, ACK] Seq=0 Ack=1 Win=14480 Len=0 MSS=1460 TSV=4026742 TSER=3973203 WS=6
  3   0.000318     10.0.1.3 -> 10.0.1.2     TCP 33823 > glrpc [ACK] Seq=1 Ack=1 Win=5888 Len=0 TSV=3973203 TSER=4026742
101852  11.049727     10.0.1.3 -> 10.0.1.2     TCP 33823 > glrpc [FIN, ACK] Seq=60201 Ack=100230201 Win=1844672 Len=0 TSV=3975965 TSER=4029474
101853  11.050196     10.0.1.2 -> 10.0.1.3     TCP glrpc > 33823 [FIN, ACK] Seq=100230201 Ack=60202 Win=64128 Len=0 TSV=4029505 TSER=3975965
================================================================================
IPv4 Conversations
Filter:<No Filter>
                                               |       <-      | |       ->      | |     Total     |
                                               | Frames  Bytes | | Frames  Bytes | | Frames  Bytes |
10.0.1.3             <-> 10.0.1.2               69517 104818330   32337   2194450  101854 107012780
================================================================================
  1   0.000000     10.0.1.3 -> 10.0.1.2     TCP 43225 > glrpc [SYN] Seq=0 Win=5840 Len=0 MSS=1460 TSV=3977706 TSER=0 WS=6
  2   0.000293     10.0.1.2 -> 10.0.1.3     TCP glrpc > 43225 [SYN, ACK] Seq=0 Ack=1 Win=14480 Len=0 MSS=1460 TSV=4031245 TSER=3977706 WS=6
  3   0.000315     10.0.1.3 -> 10.0.1.2     TCP 43225 > glrpc [ACK] Seq=1 Ack=1 Win=5888 Len=0 TSV=3977706 TSER=4031245
102042  11.105564     10.0.1.3 -> 10.0.1.2     TCP 43225 > glrpc [FIN, ACK] Seq=60201 Ack=100230201 Win=1972608 Len=0 TSV=3980482 TSER=4034009
102043  11.106051     10.0.1.2 -> 10.0.1.3     TCP glrpc > 43225 [FIN, ACK] Seq=100230201 Ack=60202 Win=64128 Len=0 TSV=4034022 TSER=3980482
================================================================================
IPv4 Conversations
Filter:<No Filter>
                                               |       <-      | |       ->      | |     Total     |
                                               | Frames  Bytes | | Frames  Bytes | | Frames  Bytes |
10.0.1.3             <-> 10.0.1.2               69515 104818198   32529   2207122  102044 107025320
================================================================================
  1   0.000000     10.0.1.3 -> 10.0.1.2     TCP 43227 > glrpc [SYN] Seq=0 Win=5840 Len=0 MSS=1460 TSV=3982224 TSER=0 WS=6
  2   0.000311     10.0.1.2 -> 10.0.1.3     TCP glrpc > 43227 [SYN, ACK] Seq=0 Ack=1 Win=14480 Len=0 MSS=1460 TSV=4035764 TSER=3982224 WS=6
  3   0.000331     10.0.1.3 -> 10.0.1.2     TCP 43227 > glrpc [ACK] Seq=1 Ack=1 Win=5888 Len=0 TSV=3982224 TSER=4035764
102191  11.069070     10.0.1.3 -> 10.0.1.2     TCP 43227 > glrpc [FIN, ACK] Seq=60201 Ack=100230201 Win=1787648 Len=0 TSV=3984991 TSER=4038519
102192  11.069565     10.0.1.2 -> 10.0.1.3     TCP glrpc > 43227 [FIN, ACK] Seq=100230201 Ack=60202 Win=64128 Len=0 TSV=4038531 TSER=3984991
================================================================================
IPv4 Conversations
Filter:<No Filter>
                                               |       <-      | |       ->      | |     Total     |
                                               | Frames  Bytes | | Frames  Bytes | | Frames  Bytes |
10.0.1.3             <-> 10.0.1.2               69516 104818264   32677   2216890  102193 107035154
================================================================================
  1   0.000000     10.0.1.3 -> 10.0.1.2     TCP 43229 > glrpc [SYN] Seq=0 Win=5840 Len=0 MSS=1460 TSV=3986728 TSER=0 WS=6
  2   0.000317     10.0.1.2 -> 10.0.1.3     TCP glrpc > 43229 [SYN, ACK] Seq=0 Ack=1 Win=14480 Len=0 MSS=1460 TSV=4040269 TSER=3986728 WS=6
  3   0.000338     10.0.1.3 -> 10.0.1.2     TCP 43229 > glrpc [ACK] Seq=1 Ack=1 Win=5888 Len=0 TSV=3986729 TSER=4040269
102070  11.061329     10.0.1.3 -> 10.0.1.2     TCP 43229 > glrpc [FIN, ACK] Seq=60201 Ack=100230201 Win=1973248 Len=0 TSV=3989494 TSER=4043025
102071  11.061842     10.0.1.2 -> 10.0.1.3     TCP glrpc > 43229 [FIN, ACK] Seq=100230201 Ack=60202 Win=64128 Len=0 TSV=4043034 TSER=3989494
================================================================================
IPv4 Conversations
Filter:<No Filter>
                                               |       <-      | |       ->      | |     Total     |
                                               | Frames  Bytes | | Frames  Bytes | | Frames  Bytes |
10.0.1.3             <-> 10.0.1.2               69512 104818000   32560   2209168  102072 107027168
================================================================================
  1   0.000000     10.0.1.3 -> 10.0.1.2     TCP 43232 > glrpc [SYN] Seq=0 Win=5840 Len=0 MSS=1460 TSV=3991226 TSER=0 WS=6
  2   0.000299     10.0.1.2 -> 10.0.1.3     TCP glrpc > 43232 [SYN, ACK] Seq=0 Ack=1 Win=14480 Len=0 MSS=1460 TSV=4044767 TSER=3991226 WS=6
  3   0.000323     10.0.1.3 -> 10.0.1.2     TCP 43232 > glrpc [ACK] Seq=1 Ack=1 Win=5888 Len=0 TSV=3991226 TSER=4044767
101944  11.068162     10.0.1.3 -> 10.0.1.2     TCP 43232 > glrpc [FIN, ACK] Seq=60201 Ack=100230201 Win=1875456 Len=0 TSV=3993993 TSER=4047504
101945  11.068630     10.0.1.2 -> 10.0.1.3     TCP glrpc > 43232 [FIN, ACK] Seq=100230201 Ack=60202 Win=64128 Len=0 TSV=4047534 TSER=3993993
================================================================================
IPv4 Conversations
Filter:<No Filter>
                                               |       <-      | |       ->      | |     Total     |
                                               | Frames  Bytes | | Frames  Bytes | | Frames  Bytes |
10.0.1.3             <-> 10.0.1.2               69515 104818198   32431   2200654  101946 107018852
================================================================================
  1   0.000000     10.0.1.3 -> 10.0.1.2     TCP 43234 > glrpc [SYN] Seq=0 Win=5840 Len=0 MSS=1460 TSV=3995729 TSER=0 WS=6
  2   0.000292     10.0.1.2 -> 10.0.1.3     TCP glrpc > 43234 [SYN, ACK] Seq=0 Ack=1 Win=14480 Len=0 MSS=1460 TSV=4049271 TSER=3995729 WS=6
  3   0.000313     10.0.1.3 -> 10.0.1.2     TCP 43234 > glrpc [ACK] Seq=1 Ack=1 Win=5888 Len=0 TSV=3995730 TSER=4049271
102278  11.107868     10.0.1.3 -> 10.0.1.2     TCP 43234 > glrpc [FIN, ACK] Seq=60201 Ack=100230201 Win=1990144 Len=0 TSV=3998506 TSER=4052038
102279  11.108348     10.0.1.2 -> 10.0.1.3     TCP glrpc > 43234 [FIN, ACK] Seq=100230201 Ack=60202 Win=64128 Len=0 TSV=4052048 TSER=3998506
================================================================================
IPv4 Conversations
Filter:<No Filter>
                                               |       <-      | |       ->      | |     Total     |
                                               | Frames  Bytes | | Frames  Bytes | | Frames  Bytes |
10.0.1.3             <-> 10.0.1.2               69518 104818396   32762   2222500  102280 107040896
================================================================================
  1   0.000000     10.0.1.3 -> 10.0.1.2     TCP 43238 > glrpc [SYN] Seq=0 Win=5840 Len=0 MSS=1460 TSV=4000250 TSER=0 WS=6
  2   0.000301     10.0.1.2 -> 10.0.1.3     TCP glrpc > 43238 [SYN, ACK] Seq=0 Ack=1 Win=14480 Len=0 MSS=1460 TSV=4053791 TSER=4000250 WS=6
  3   0.000323     10.0.1.3 -> 10.0.1.2     TCP 43238 > glrpc [ACK] Seq=1 Ack=1 Win=5888 Len=0 TSV=4000250 TSER=4053791
102125  11.093307     10.0.1.3 -> 10.0.1.2     TCP 43238 > glrpc [FIN, ACK] Seq=60201 Ack=100230201 Win=1854272 Len=0 TSV=4003023 TSER=4056535
102126  11.093776     10.0.1.2 -> 10.0.1.3     TCP glrpc > 43238 [FIN, ACK] Seq=100230201 Ack=60202 Win=64128 Len=0 TSV=4056565 TSER=4003023
================================================================================
IPv4 Conversations
Filter:<No Filter>
                                               |       <-      | |       ->      | |     Total     |
                                               | Frames  Bytes | | Frames  Bytes | | Frames  Bytes |
10.0.1.3             <-> 10.0.1.2               69518 104818396   32609   2212402  102127 107030798
================================================================================
  1   0.000000     10.0.1.3 -> 10.0.1.2     TCP 43240 > glrpc [SYN] Seq=0 Win=5840 Len=0 MSS=1460 TSV=4004765 TSER=0 WS=6
  2   0.000363     10.0.1.2 -> 10.0.1.3     TCP glrpc > 43240 [SYN, ACK] Seq=0 Ack=1 Win=14480 Len=0 MSS=1460 TSV=4058307 TSER=4004765 WS=6
  3   0.000385     10.0.1.3 -> 10.0.1.2     TCP 43240 > glrpc [ACK] Seq=1 Ack=1 Win=5888 Len=0 TSV=4004765 TSER=4058307
102077  11.106724     10.0.1.3 -> 10.0.1.2     TCP 43240 > glrpc [FIN, ACK] Seq=60201 Ack=100230201 Win=1956608 Len=0 TSV=4007541 TSER=4061055
102078  11.107205     10.0.1.2 -> 10.0.1.3     TCP glrpc > 43240 [FIN, ACK] Seq=100230201 Ack=60202 Win=64128 Len=0 TSV=4061084 TSER=4007541
================================================================================
IPv4 Conversations
Filter:<No Filter>
                                               |       <-      | |       ->      | |     Total     |
                                               | Frames  Bytes | | Frames  Bytes | | Frames  Bytes |
10.0.1.3             <-> 10.0.1.2               69518 104818396   32561   2209234  102079 107027630
================================================================================
  1   0.000000     10.0.1.3 -> 10.0.1.2     TCP 43242 > glrpc [SYN] Seq=0 Win=5840 Len=0 MSS=1460 TSV=4009298 TSER=0 WS=6
  2   0.000283     10.0.1.2 -> 10.0.1.3     TCP glrpc > 43242 [SYN, ACK] Seq=0 Ack=1 Win=14480 Len=0 MSS=1460 TSV=4062840 TSER=4009298 WS=6
  3   0.000305     10.0.1.3 -> 10.0.1.2     TCP 43242 > glrpc [ACK] Seq=1 Ack=1 Win=5888 Len=0 TSV=4009298 TSER=4062840
101791  11.126315     10.0.1.3 -> 10.0.1.2     TCP 43242 > glrpc [FIN, ACK] Seq=60201 Ack=100230201 Win=1859264 Len=0 TSV=4012080 TSER=4065592
101792  11.126769     10.0.1.2 -> 10.0.1.3     TCP glrpc > 43242 [FIN, ACK] Seq=100230201 Ack=60202 Win=64128 Len=0 TSV=4065622 TSER=4012080
================================================================================
IPv4 Conversations
Filter:<No Filter>
                                               |       <-      | |       ->      | |     Total     |
                                               | Frames  Bytes | | Frames  Bytes | | Frames  Bytes |
10.0.1.3             <-> 10.0.1.2               69514 104818132   32279   2190622  101793 107008754
================================================================================
  1   0.000000     10.0.1.3 -> 10.0.1.2     TCP 43244 > glrpc [SYN] Seq=0 Win=5840 Len=0 MSS=1460 TSV=4013826 TSER=0 WS=6
  2   0.000311     10.0.1.2 -> 10.0.1.3     TCP glrpc > 43244 [SYN, ACK] Seq=0 Ack=1 Win=14480 Len=0 MSS=1460 TSV=4067368 TSER=4013826 WS=6
  3   0.000334     10.0.1.3 -> 10.0.1.2     TCP 43244 > glrpc [ACK] Seq=1 Ack=1 Win=5888 Len=0 TSV=4013826 TSER=4067368
102309  11.117842     10.0.1.3 -> 10.0.1.2     TCP 43244 > glrpc [FIN, ACK] Seq=60201 Ack=100230201 Win=1972096 Len=0 TSV=4016605 TSER=4070119
102310  11.118340     10.0.1.2 -> 10.0.1.3     TCP glrpc > 43244 [FIN, ACK] Seq=100230201 Ack=60202 Win=64128 Len=0 TSV=4070148 TSER=4016605
================================================================================
IPv4 Conversations
Filter:<No Filter>
                                               |       <-      | |       ->      | |     Total     |
                                               | Frames  Bytes | | Frames  Bytes | | Frames  Bytes |
10.0.1.3             <-> 10.0.1.2               69517 104818330   32794   2224612  102311 107042942
================================================================================
  1   0.000000     10.0.1.3 -> 10.0.1.2     TCP 43246 > glrpc [SYN] Seq=0 Win=5840 Len=0 MSS=1460 TSV=4018346 TSER=0 WS=6
  2   0.000293     10.0.1.2 -> 10.0.1.3     TCP glrpc > 43246 [SYN, ACK] Seq=0 Ack=1 Win=14480 Len=0 MSS=1460 TSV=4071889 TSER=4018346 WS=6
  3   0.000315     10.0.1.3 -> 10.0.1.2     TCP 43246 > glrpc [ACK] Seq=1 Ack=1 Win=5888 Len=0 TSV=4018347 TSER=4071889
102485  11.190385     10.0.1.3 -> 10.0.1.2     TCP 43246 > glrpc [FIN, ACK] Seq=60201 Ack=100230201 Win=1981440 Len=0 TSV=4021144 TSER=4074658
102486  11.190870     10.0.1.2 -> 10.0.1.3     TCP glrpc > 43246 [FIN, ACK] Seq=100230201 Ack=60202 Win=64128 Len=0 TSV=4074687 TSER=4021144
================================================================================
IPv4 Conversations
Filter:<No Filter>
                                               |       <-      | |       ->      | |     Total     |
                                               | Frames  Bytes | | Frames  Bytes | | Frames  Bytes |
10.0.1.3             <-> 10.0.1.2               69516 104818264   32971   2236294  102487 107054558
================================================================================
  1   0.000000     10.0.1.3 -> 10.0.1.2     TCP 43248 > glrpc [SYN] Seq=0 Win=5840 Len=0 MSS=1460 TSV=4022891 TSER=0 WS=6
  2   0.000270     10.0.1.2 -> 10.0.1.3     TCP glrpc > 43248 [SYN, ACK] Seq=0 Ack=1 Win=14480 Len=0 MSS=1460 TSV=4076434 TSER=4022891 WS=6
  3   0.000294     10.0.1.3 -> 10.0.1.2     TCP 43248 > glrpc [ACK] Seq=1 Ack=1 Win=5888 Len=0 TSV=4022891 TSER=4076434
102258  11.147150     10.0.1.3 -> 10.0.1.2     TCP 43248 > glrpc [FIN, ACK] Seq=60201 Ack=100230201 Win=1972224 Len=0 TSV=4025678 TSER=4079201
102259  11.147583     10.0.1.2 -> 10.0.1.3     TCP glrpc > 43248 [FIN, ACK] Seq=100230201 Ack=60202 Win=64128 Len=0 TSV=4079221 TSER=4025678
================================================================================
IPv4 Conversations
Filter:<No Filter>
                                               |       <-      | |       ->      | |     Total     |
                                               | Frames  Bytes | | Frames  Bytes | | Frames  Bytes |
10.0.1.3             <-> 10.0.1.2               69522 104818660   32738   2220916  102260 107039576
================================================================================
