  1   0.000000     10.0.1.3 -> 10.0.1.2     TCP 57986 > glrpc [SYN] Seq=0 Win=5840 Len=0 MSS=1460 TSV=3664568 TSER=0 WS=6
  2   0.000301     10.0.1.2 -> 10.0.1.3     TCP glrpc > 57986 [SYN, ACK] Seq=0 Ack=1 Win=14480 Len=0 MSS=1460 TSV=3696742 TSER=3664568 WS=6
  3   0.000324     10.0.1.3 -> 10.0.1.2     TCP 57986 > glrpc [ACK] Seq=1 Ack=1 Win=5888 Len=0 TSV=3664568 TSER=3696742
100588  11.132126     10.0.1.3 -> 10.0.1.2     TCP 57986 > glrpc [FIN, ACK] Seq=60201 Ack=100230201 Win=1988416 Len=0 TSV=3667351 TSER=3699510
100589  11.132541     10.0.1.2 -> 10.0.1.3     TCP glrpc > 57986 [FIN, ACK] Seq=100230201 Ack=60202 Win=64128 Len=0 TSV=3699525 TSER=3667351
  1   0.000000     10.0.1.3 -> 10.0.1.2     TCP 57988 > glrpc [SYN] Seq=0 Win=5840 Len=0 MSS=1460 TSV=3670147 TSER=0 WS=6
  2   0.000290     10.0.1.2 -> 10.0.1.3     TCP glrpc > 57988 [SYN, ACK] Seq=0 Ack=1 Win=14480 Len=0 MSS=1460 TSV=3702321 TSER=3670147 WS=6
  3   0.000313     10.0.1.3 -> 10.0.1.2     TCP 57988 > glrpc [ACK] Seq=1 Ack=1 Win=5888 Len=0 TSV=3670147 TSER=3702321
89380  11.150428     10.0.1.3 -> 10.0.1.2     TCP [TCP ACKed lost segment] [TCP Previous segment lost] 57988 > glrpc [FIN, ACK] Seq=60201 Ack=100230201 Win=1988416 Len=0 TSV=3672935 TSER=3705033
89381  11.150892     10.0.1.2 -> 10.0.1.3     TCP glrpc > 57988 [FIN, ACK] Seq=100230201 Ack=60202 Win=64128 Len=0 TSV=3705109 TSER=3672935
  1   0.000000     10.0.1.3 -> 10.0.1.2     TCP 41602 > glrpc [SYN] Seq=0 Win=5840 Len=0 MSS=1460 TSV=3675608 TSER=0 WS=6
  2   0.000371     10.0.1.2 -> 10.0.1.3     TCP glrpc > 41602 [SYN, ACK] Seq=0 Ack=1 Win=14480 Len=0 MSS=1460 TSV=3707782 TSER=3675608 WS=6
  3   0.000393     10.0.1.3 -> 10.0.1.2     TCP 41602 > glrpc [ACK] Seq=1 Ack=1 Win=5888 Len=0 TSV=3675608 TSER=3707782
  1   0.000000     10.0.1.3 -> 10.0.1.2     TCP 41604 > glrpc [SYN] Seq=0 Win=5840 Len=0 MSS=1460 TSV=3681080 TSER=0 WS=6
  2   0.000300     10.0.1.2 -> 10.0.1.3     TCP glrpc > 41604 [SYN, ACK] Seq=0 Ack=1 Win=14480 Len=0 MSS=1460 TSV=3713254 TSER=3681080 WS=6
  3   0.000323     10.0.1.3 -> 10.0.1.2     TCP 41604 > glrpc [ACK] Seq=1 Ack=1 Win=5888 Len=0 TSV=3681080 TSER=3713254
  1   0.000000     10.0.1.3 -> 10.0.1.2     TCP 41606 > glrpc [SYN] Seq=0 Win=5840 Len=0 MSS=1460 TSV=3686530 TSER=0 WS=6
  2   0.000287     10.0.1.2 -> 10.0.1.3     TCP glrpc > 41606 [SYN, ACK] Seq=0 Ack=1 Win=14480 Len=0 MSS=1460 TSV=3718706 TSER=3686530 WS=6
  3   0.000308     10.0.1.3 -> 10.0.1.2     TCP 41606 > glrpc [ACK] Seq=1 Ack=1 Win=5888 Len=0 TSV=3686530 TSER=3718706
91981  11.279224     10.0.1.3 -> 10.0.1.2     TCP [TCP ACKed lost segment] [TCP Previous segment lost] 41606 > glrpc [FIN, ACK] Seq=60201 Ack=100230201 Win=1990144 Len=0 TSV=3689350 TSER=3721443
91982  11.279678     10.0.1.2 -> 10.0.1.3     TCP glrpc > 41606 [FIN, ACK] Seq=100230201 Ack=60202 Win=64128 Len=0 TSV=3721526 TSER=3689350
  1   0.000000     10.0.1.3 -> 10.0.1.2     TCP 41608 > glrpc [SYN] Seq=0 Win=5840 Len=0 MSS=1460 TSV=3692035 TSER=0 WS=6
  2   0.000300     10.0.1.2 -> 10.0.1.3     TCP glrpc > 41608 [SYN, ACK] Seq=0 Ack=1 Win=14480 Len=0 MSS=1460 TSV=3724211 TSER=3692035 WS=6
  3   0.000321     10.0.1.3 -> 10.0.1.2     TCP 41608 > glrpc [ACK] Seq=1 Ack=1 Win=5888 Len=0 TSV=3692035 TSER=3724211
100877  11.163065     10.0.1.3 -> 10.0.1.2     TCP 41608 > glrpc [FIN, ACK] Seq=60201 Ack=100230201 Win=1989952 Len=0 TSV=3694826 TSER=3726969
100878  11.163455     10.0.1.2 -> 10.0.1.3     TCP glrpc > 41608 [FIN, ACK] Seq=100230201 Ack=60202 Win=64128 Len=0 TSV=3727002 TSER=3694826
  1   0.000000     10.0.1.3 -> 10.0.1.2     TCP 41610 > glrpc [SYN] Seq=0 Win=5840 Len=0 MSS=1460 TSV=3697595 TSER=0 WS=6
  2   0.000301     10.0.1.2 -> 10.0.1.3     TCP glrpc > 41610 [SYN, ACK] Seq=0 Ack=1 Win=14480 Len=0 MSS=1460 TSV=3729771 TSER=3697595 WS=6
  3   0.000322     10.0.1.3 -> 10.0.1.2     TCP 41610 > glrpc [ACK] Seq=1 Ack=1 Win=5888 Len=0 TSV=3697595 TSER=3729771
  1   0.000000     10.0.1.3 -> 10.0.1.2     TCP 41612 > glrpc [SYN] Seq=0 Win=5840 Len=0 MSS=1460 TSV=3703049 TSER=0 WS=6
  2   0.000255     10.0.1.2 -> 10.0.1.3     TCP glrpc > 41612 [SYN, ACK] Seq=0 Ack=1 Win=14480 Len=0 MSS=1460 TSV=3735226 TSER=3703049 WS=6
  3   0.000278     10.0.1.3 -> 10.0.1.2     TCP 41612 > glrpc [ACK] Seq=1 Ack=1 Win=5888 Len=0 TSV=3703049 TSER=3735226
100837  11.199390     10.0.1.3 -> 10.0.1.2     TCP 41612 > glrpc [FIN, ACK] Seq=60201 Ack=100230201 Win=1998272 Len=0 TSV=3705849 TSER=3737995
100838  11.199838     10.0.1.2 -> 10.0.1.3     TCP glrpc > 41612 [FIN, ACK] Seq=100230201 Ack=60202 Win=64128 Len=0 TSV=3738026 TSER=3705849
  1   0.000000     10.0.1.3 -> 10.0.1.2     TCP 41614 > glrpc [SYN] Seq=0 Win=5840 Len=0 MSS=1460 TSV=3708613 TSER=0 WS=6
  2   0.000317     10.0.1.2 -> 10.0.1.3     TCP glrpc > 41614 [SYN, ACK] Seq=0 Ack=1 Win=14480 Len=0 MSS=1460 TSV=3740790 TSER=3708613 WS=6
  3   0.000339     10.0.1.3 -> 10.0.1.2     TCP 41614 > glrpc [ACK] Seq=1 Ack=1 Win=5888 Len=0 TSV=3708613 TSER=3740790
101533  11.084544     10.0.1.3 -> 10.0.1.2     TCP 41614 > glrpc [FIN, ACK] Seq=60201 Ack=100230201 Win=1989952 Len=0 TSV=3711384 TSER=3743531
101534  11.084988     10.0.1.2 -> 10.0.1.3     TCP glrpc > 41614 [FIN, ACK] Seq=100230201 Ack=60202 Win=64128 Len=0 TSV=3743561 TSER=3711384
  1   0.000000     10.0.1.3 -> 10.0.1.2     TCP 41616 > glrpc [SYN] Seq=0 Win=5840 Len=0 MSS=1460 TSV=3714157 TSER=0 WS=6
  2   0.000318     10.0.1.2 -> 10.0.1.3     TCP glrpc > 41616 [SYN, ACK] Seq=0 Ack=1 Win=14480 Len=0 MSS=1460 TSV=3746335 TSER=3714157 WS=6
  3   0.000340     10.0.1.3 -> 10.0.1.2     TCP 41616 > glrpc [ACK] Seq=1 Ack=1 Win=5888 Len=0 TSV=3714157 TSER=3746335
  1   0.000000     10.0.1.3 -> 10.0.1.2     TCP 41618 > glrpc [SYN] Seq=0 Win=5840 Len=0 MSS=1460 TSV=3719608 TSER=0 WS=6
  2   0.000271     10.0.1.2 -> 10.0.1.3     TCP glrpc > 41618 [SYN, ACK] Seq=0 Ack=1 Win=14480 Len=0 MSS=1460 TSV=3751785 TSER=3719608 WS=6
  3   0.000293     10.0.1.3 -> 10.0.1.2     TCP 41618 > glrpc [ACK] Seq=1 Ack=1 Win=5888 Len=0 TSV=3719608 TSER=3751785
  1   0.000000     10.0.1.3 -> 10.0.1.2     TCP 41620 > glrpc [SYN] Seq=0 Win=5840 Len=0 MSS=1460 TSV=3725079 TSER=0 WS=6
  2   0.000291     10.0.1.2 -> 10.0.1.3     TCP glrpc > 41620 [SYN, ACK] Seq=0 Ack=1 Win=14480 Len=0 MSS=1460 TSV=3757257 TSER=3725079 WS=6
  3   0.000313     10.0.1.3 -> 10.0.1.2     TCP 41620 > glrpc [ACK] Seq=1 Ack=1 Win=5888 Len=0 TSV=3725079 TSER=3757257
101108  11.020626     10.0.1.3 -> 10.0.1.2     TCP 41620 > glrpc [FIN, ACK] Seq=60201 Ack=100230201 Win=1988416 Len=0 TSV=3727834 TSER=3759995
101109  11.021003     10.0.1.2 -> 10.0.1.3     TCP glrpc > 41620 [FIN, ACK] Seq=100230201 Ack=60202 Win=64128 Len=0 TSV=3760012 TSER=3727834
  1   0.000000     10.0.1.3 -> 10.0.1.2     TCP 41622 > glrpc [SYN] Seq=0 Win=5840 Len=0 MSS=1460 TSV=3730755 TSER=0 WS=6
  2   0.000285     10.0.1.2 -> 10.0.1.3     TCP glrpc > 41622 [SYN, ACK] Seq=0 Ack=1 Win=14480 Len=0 MSS=1460 TSV=3762934 TSER=3730755 WS=6
  3   0.000306     10.0.1.3 -> 10.0.1.2     TCP 41622 > glrpc [ACK] Seq=1 Ack=1 Win=5888 Len=0 TSV=3730755 TSER=3762934
  1   0.000000     10.0.1.3 -> 10.0.1.2     TCP 41624 > glrpc [SYN] Seq=0 Win=5840 Len=0 MSS=1460 TSV=3736195 TSER=0 WS=6
  2   0.000317     10.0.1.2 -> 10.0.1.3     TCP glrpc > 41624 [SYN, ACK] Seq=0 Ack=1 Win=14480 Len=0 MSS=1460 TSV=3768374 TSER=3736195 WS=6
  3   0.000341     10.0.1.3 -> 10.0.1.2     TCP 41624 > glrpc [ACK] Seq=1 Ack=1 Win=5888 Len=0 TSV=3736195 TSER=3768374
101009  11.102773     10.0.1.3 -> 10.0.1.2     TCP 41624 > glrpc [FIN, ACK] Seq=60201 Ack=100230201 Win=1984192 Len=0 TSV=3738971 TSER=3771142
101010  11.103212     10.0.1.2 -> 10.0.1.3     TCP glrpc > 41624 [FIN, ACK] Seq=100230201 Ack=60202 Win=64128 Len=0 TSV=3771150 TSER=3738971
  1   0.000000     10.0.1.3 -> 10.0.1.2     TCP 41626 > glrpc [SYN] Seq=0 Win=5840 Len=0 MSS=1460 TSV=3741788 TSER=0 WS=6
  2   0.000314     10.0.1.2 -> 10.0.1.3     TCP glrpc > 41626 [SYN, ACK] Seq=0 Ack=1 Win=14480 Len=0 MSS=1460 TSV=3773967 TSER=3741788 WS=6
  3   0.000335     10.0.1.3 -> 10.0.1.2     TCP 41626 > glrpc [ACK] Seq=1 Ack=1 Win=5888 Len=0 TSV=3741788 TSER=3773967
100904  11.093803     10.0.1.3 -> 10.0.1.2     TCP 41626 > glrpc [FIN, ACK] Seq=60201 Ack=100230201 Win=1993024 Len=0 TSV=3744561 TSER=3776725
100905  11.094190     10.0.1.2 -> 10.0.1.3     TCP glrpc > 41626 [FIN, ACK] Seq=100230201 Ack=60202 Win=64128 Len=0 TSV=3776741 TSER=3744561
  1   0.000000     10.0.1.3 -> 10.0.1.2     TCP 41628 > glrpc [SYN] Seq=0 Win=5840 Len=0 MSS=1460 TSV=3747356 TSER=0 WS=6
  2   0.000318     10.0.1.2 -> 10.0.1.3     TCP glrpc > 41628 [SYN, ACK] Seq=0 Ack=1 Win=14480 Len=0 MSS=1460 TSV=3779536 TSER=3747356 WS=6
  3   0.000342     10.0.1.3 -> 10.0.1.2     TCP 41628 > glrpc [ACK] Seq=1 Ack=1 Win=5888 Len=0 TSV=3747356 TSER=3779536
100752  11.012046     10.0.1.3 -> 10.0.1.2     TCP 41628 > glrpc [FIN, ACK] Seq=60201 Ack=100230201 Win=1990144 Len=0 TSV=3750109 TSER=3782272
100753  11.012463     10.0.1.2 -> 10.0.1.3     TCP glrpc > 41628 [FIN, ACK] Seq=100230201 Ack=60202 Win=64128 Len=0 TSV=3782289 TSER=3750109
  1   0.000000     10.0.1.3 -> 10.0.1.2     TCP 53423 > glrpc [SYN] Seq=0 Win=5840 Len=0 MSS=1460 TSV=3752870 TSER=0 WS=6
  2   0.000309     10.0.1.2 -> 10.0.1.3     TCP glrpc > 53423 [SYN, ACK] Seq=0 Ack=1 Win=14480 Len=0 MSS=1460 TSV=3785050 TSER=3752870 WS=6
  3   0.000333     10.0.1.3 -> 10.0.1.2     TCP 53423 > glrpc [ACK] Seq=1 Ack=1 Win=5888 Len=0 TSV=3752870 TSER=3785050
100790  11.006451     10.0.1.3 -> 10.0.1.2     TCP 53423 > glrpc [FIN, ACK] Seq=60201 Ack=100230201 Win=1973568 Len=0 TSV=3755621 TSER=3787772
100791  11.006900     10.0.1.2 -> 10.0.1.3     TCP glrpc > 53423 [FIN, ACK] Seq=100230201 Ack=60202 Win=64128 Len=0 TSV=3787802 TSER=3755621
  1   0.000000     10.0.1.3 -> 10.0.1.2     TCP 53425 > glrpc [SYN] Seq=0 Win=5840 Len=0 MSS=1460 TSV=3758397 TSER=0 WS=6
  2   0.000317     10.0.1.2 -> 10.0.1.3     TCP glrpc > 53425 [SYN, ACK] Seq=0 Ack=1 Win=14480 Len=0 MSS=1460 TSV=3790577 TSER=3758397 WS=6
  3   0.000343     10.0.1.3 -> 10.0.1.2     TCP 53425 > glrpc [ACK] Seq=1 Ack=1 Win=5888 Len=0 TSV=3758397 TSER=3790577
101462  11.084701     10.0.1.3 -> 10.0.1.2     TCP 53425 > glrpc [FIN, ACK] Seq=60201 Ack=100230201 Win=1989952 Len=0 TSV=3761168 TSER=3793319
101463  11.085145     10.0.1.2 -> 10.0.1.3     TCP glrpc > 53425 [FIN, ACK] Seq=100230201 Ack=60202 Win=64128 Len=0 TSV=3793349 TSER=3761168
  1   0.000000     10.0.1.3 -> 10.0.1.2     TCP 53427 > glrpc [SYN] Seq=0 Win=5840 Len=0 MSS=1460 TSV=3763958 TSER=0 WS=6
  2   0.000299     10.0.1.2 -> 10.0.1.3     TCP glrpc > 53427 [SYN, ACK] Seq=0 Ack=1 Win=14480 Len=0 MSS=1460 TSV=3796139 TSER=3763958 WS=6
  3   0.000321     10.0.1.3 -> 10.0.1.2     TCP 53427 > glrpc [ACK] Seq=1 Ack=1 Win=5888 Len=0 TSV=3763958 TSER=3796139
84690  11.053007     10.0.1.3 -> 10.0.1.2     TCP [TCP ACKed lost segment] [TCP Previous segment lost] 53427 > glrpc [FIN, ACK] Seq=60201 Ack=100230201 Win=2004480 Len=0 TSV=3766721 TSER=3798870
84691  11.053424     10.0.1.2 -> 10.0.1.3     TCP glrpc > 53427 [FIN, ACK] Seq=100230201 Ack=60202 Win=64128 Len=0 TSV=3798902 TSER=3766721
  1   0.000000     10.0.1.3 -> 10.0.1.2     TCP 53429 > glrpc [SYN] Seq=0 Win=5840 Len=0 MSS=1460 TSV=3769343 TSER=0 WS=6
  2   0.000296     10.0.1.2 -> 10.0.1.3     TCP glrpc > 53429 [SYN, ACK] Seq=0 Ack=1 Win=14480 Len=0 MSS=1460 TSV=3801524 TSER=3769343 WS=6
  3   0.000317     10.0.1.3 -> 10.0.1.2     TCP 53429 > glrpc [ACK] Seq=1 Ack=1 Win=5888 Len=0 TSV=3769343 TSER=3801524
101200  10.982975     10.0.1.3 -> 10.0.1.2     TCP 53429 > glrpc [FIN, ACK] Seq=60201 Ack=100230201 Win=2004608 Len=0 TSV=3772089 TSER=3804256
101201  10.983438     10.0.1.2 -> 10.0.1.3     TCP glrpc > 53429 [FIN, ACK] Seq=100230201 Ack=60202 Win=64128 Len=0 TSV=3804270 TSER=3772089
