  1   0.000000     10.0.1.3 -> 10.0.1.2     TCP 53431 > glrpc [SYN] Seq=0 Win=5840 Len=0 MSS=1460 TSV=3774909 TSER=0 WS=6
  2   0.000368     10.0.1.2 -> 10.0.1.3     TCP glrpc > 53431 [SYN, ACK] Seq=0 Ack=1 Win=14480 Len=0 MSS=1460 TSV=3807091 TSER=3774909 WS=6
  3   0.000389     10.0.1.3 -> 10.0.1.2     TCP 53431 > glrpc [ACK] Seq=1 Ack=1 Win=5888 Len=0 TSV=3774909 TSER=3807091
152390  19.342790     10.0.1.3 -> 10.0.1.2     TCP 53431 > glrpc [FIN, ACK] Seq=90301 Ack=150345301 Win=1990144 Len=0 TSV=3779745 TSER=3811209
152391  19.343279     10.0.1.2 -> 10.0.1.3     TCP glrpc > 53431 [FIN, ACK] Seq=150345301 Ack=90302 Win=64128 Len=0 TSV=3811927 TSER=3779745
  1   0.000000     10.0.1.3 -> 10.0.1.2     TCP 53433 > glrpc [SYN] Seq=0 Win=5840 Len=0 MSS=1460 TSV=3783035 TSER=0 WS=6
  2   0.000304     10.0.1.2 -> 10.0.1.3     TCP glrpc > 53433 [SYN, ACK] Seq=0 Ack=1 Win=14480 Len=0 MSS=1460 TSV=3815217 TSER=3783035 WS=6
  3   0.000332     10.0.1.3 -> 10.0.1.2     TCP 53433 > glrpc [ACK] Seq=1 Ack=1 Win=5888 Len=0 TSV=3783035 TSER=3815217
151948  19.041071     10.0.1.3 -> 10.0.1.2     TCP 53433 > glrpc [FIN, ACK] Seq=90301 Ack=150345301 Win=2004608 Len=0 TSV=3787795 TSER=3819336
151949  19.041546     10.0.1.2 -> 10.0.1.3     TCP glrpc > 53433 [FIN, ACK] Seq=150345301 Ack=90302 Win=64128 Len=0 TSV=3819978 TSER=3787795
  1   0.000000     10.0.1.3 -> 10.0.1.2     TCP 53435 > glrpc [SYN] Seq=0 Win=5840 Len=0 MSS=1460 TSV=3791048 TSER=0 WS=6
  2   0.000309     10.0.1.2 -> 10.0.1.3     TCP glrpc > 53435 [SYN, ACK] Seq=0 Ack=1 Win=14480 Len=0 MSS=1460 TSV=3823231 TSER=3791048 WS=6
  3   0.000333     10.0.1.3 -> 10.0.1.2     TCP 53435 > glrpc [ACK] Seq=1 Ack=1 Win=5888 Len=0 TSV=3791049 TSER=3823231
152058  19.276038     10.0.1.3 -> 10.0.1.2     TCP 53435 > glrpc [FIN, ACK] Seq=90301 Ack=150345301 Win=2001152 Len=0 TSV=3795867 TSER=3827389
152059  19.276522     10.0.1.2 -> 10.0.1.3     TCP glrpc > 53435 [FIN, ACK] Seq=150345301 Ack=90302 Win=64128 Len=0 TSV=3828051 TSER=3795867
  1   0.000000     10.0.1.3 -> 10.0.1.2     TCP 53437 > glrpc [SYN] Seq=0 Win=5840 Len=0 MSS=1460 TSV=3799103 TSER=0 WS=6
  2   0.000336     10.0.1.2 -> 10.0.1.3     TCP glrpc > 53437 [SYN, ACK] Seq=0 Ack=1 Win=14480 Len=0 MSS=1460 TSV=3831287 TSER=3799103 WS=6
  3   0.000360     10.0.1.3 -> 10.0.1.2     TCP 53437 > glrpc [ACK] Seq=1 Ack=1 Win=5888 Len=0 TSV=3799103 TSER=3831287
151764  19.008816     10.0.1.3 -> 10.0.1.2     TCP 53437 > glrpc [FIN, ACK] Seq=90301 Ack=150345301 Win=2001728 Len=0 TSV=3803855 TSER=3835378
151765  19.009252     10.0.1.2 -> 10.0.1.3     TCP glrpc > 53437 [FIN, ACK] Seq=150345301 Ack=90302 Win=64128 Len=0 TSV=3836039 TSER=3803855
  1   0.000000     10.0.1.3 -> 10.0.1.2     TCP 53440 > glrpc [SYN] Seq=0 Win=5840 Len=0 MSS=1460 TSV=3807084 TSER=0 WS=6
  2   0.000313     10.0.1.2 -> 10.0.1.3     TCP glrpc > 53440 [SYN, ACK] Seq=0 Ack=1 Win=14480 Len=0 MSS=1460 TSV=3839268 TSER=3807084 WS=6
  3   0.000336     10.0.1.3 -> 10.0.1.2     TCP 53440 > glrpc [ACK] Seq=1 Ack=1 Win=5888 Len=0 TSV=3807084 TSER=3839268
131653  16.539254     10.0.1.3 -> 10.0.1.2     TCP 53440 > glrpc [FIN, ACK] Seq=90301 Ack=150345301 Win=2004608 Len=0 TSV=3811219 TSER=3843374
131654  16.539669     10.0.1.2 -> 10.0.1.3     TCP glrpc > 53440 [FIN, ACK] Seq=150345301 Ack=90302 Win=64128 Len=0 TSV=3843404 TSER=3811219
  1   0.000000     10.0.1.3 -> 10.0.1.2     TCP 53442 > glrpc [SYN] Seq=0 Win=5840 Len=0 MSS=1460 TSV=3814279 TSER=0 WS=6
  2   0.000273     10.0.1.2 -> 10.0.1.3     TCP glrpc > 53442 [SYN, ACK] Seq=0 Ack=1 Win=14480 Len=0 MSS=1460 TSV=3846464 TSER=3814279 WS=6
  3   0.000295     10.0.1.3 -> 10.0.1.2     TCP 53442 > glrpc [ACK] Seq=1 Ack=1 Win=5888 Len=0 TSV=3814279 TSER=3846464
151628  16.506193     10.0.1.3 -> 10.0.1.2     TCP 53442 > glrpc [FIN, ACK] Seq=90301 Ack=150345301 Win=2004480 Len=0 TSV=3818406 TSER=3850576
151629  16.506622     10.0.1.2 -> 10.0.1.3     TCP glrpc > 53442 [FIN, ACK] Seq=150345301 Ack=90302 Win=64128 Len=0 TSV=3850591 TSER=3818406
  1   0.000000     10.0.1.3 -> 10.0.1.2     TCP 53444 > glrpc [SYN] Seq=0 Win=5840 Len=0 MSS=1460 TSV=3821697 TSER=0 WS=6
  2   0.000307     10.0.1.2 -> 10.0.1.3     TCP glrpc > 53444 [SYN, ACK] Seq=0 Ack=1 Win=14480 Len=0 MSS=1460 TSV=3853883 TSER=3821697 WS=6
  3   0.000322     10.0.1.3 -> 10.0.1.2     TCP 53444 > glrpc [ACK] Seq=1 Ack=1 Win=5888 Len=0 TSV=3821697 TSER=3853883
152142  19.936939     10.0.1.3 -> 10.0.1.2     TCP 53444 > glrpc [FIN, ACK] Seq=90301 Ack=150345301 Win=1995776 Len=0 TSV=3826681 TSER=3858104
152143  19.937400     10.0.1.2 -> 10.0.1.3     TCP glrpc > 53444 [FIN, ACK] Seq=150345301 Ack=90302 Win=64128 Len=0 TSV=3858867 TSER=3826681
  1   0.000000     10.0.1.3 -> 10.0.1.2     TCP 51083 > glrpc [SYN] Seq=0 Win=5840 Len=0 MSS=1460 TSV=3829945 TSER=0 WS=6
  2   0.000295     10.0.1.2 -> 10.0.1.3     TCP glrpc > 51083 [SYN, ACK] Seq=0 Ack=1 Win=14480 Len=0 MSS=1460 TSV=3862132 TSER=3829945 WS=6
  3   0.000318     10.0.1.3 -> 10.0.1.2     TCP 51083 > glrpc [ACK] Seq=1 Ack=1 Win=5888 Len=0 TSV=3829946 TSER=3862132
152712  19.033620     10.0.1.3 -> 10.0.1.2     TCP 51083 > glrpc [FIN, ACK] Seq=90301 Ack=150345301 Win=2001728 Len=0 TSV=3834704 TSER=3866258
152713  19.034092     10.0.1.2 -> 10.0.1.3     TCP glrpc > 51083 [FIN, ACK] Seq=150345301 Ack=90302 Win=64128 Len=0 TSV=3866890 TSER=3834704
  1   0.000000     10.0.1.3 -> 10.0.1.2     TCP 51085 > glrpc [SYN] Seq=0 Win=5840 Len=0 MSS=1460 TSV=3838012 TSER=0 WS=6
  2   0.000301     10.0.1.2 -> 10.0.1.3     TCP glrpc > 51085 [SYN, ACK] Seq=0 Ack=1 Win=14480 Len=0 MSS=1460 TSV=3870199 TSER=3838012 WS=6
  3   0.000323     10.0.1.3 -> 10.0.1.2     TCP 51085 > glrpc [ACK] Seq=1 Ack=1 Win=5888 Len=0 TSV=3838012 TSER=3870199
151849  16.492512     10.0.1.3 -> 10.0.1.2     TCP 51085 > glrpc [FIN, ACK] Seq=90301 Ack=150345301 Win=2001536 Len=0 TSV=3842135 TSER=3874304
151850  16.492951     10.0.1.2 -> 10.0.1.3     TCP glrpc > 51085 [FIN, ACK] Seq=150345301 Ack=90302 Win=64128 Len=0 TSV=3874322 TSER=3842135
  1   0.000000     10.0.1.3 -> 10.0.1.2     TCP 51087 > glrpc [SYN] Seq=0 Win=5840 Len=0 MSS=1460 TSV=3845377 TSER=0 WS=6
  2   0.000283     10.0.1.2 -> 10.0.1.3     TCP glrpc > 51087 [SYN, ACK] Seq=0 Ack=1 Win=14480 Len=0 MSS=1460 TSV=3877564 TSER=3845377 WS=6
  3   0.000305     10.0.1.3 -> 10.0.1.2     TCP 51087 > glrpc [ACK] Seq=1 Ack=1 Win=5888 Len=0 TSV=3845377 TSER=3877564
152156  16.539065     10.0.1.3 -> 10.0.1.2     TCP 51087 > glrpc [FIN, ACK] Seq=90301 Ack=150345301 Win=2004608 Len=0 TSV=3849512 TSER=3881670
152157  16.539525     10.0.1.2 -> 10.0.1.3     TCP glrpc > 51087 [FIN, ACK] Seq=150345301 Ack=90302 Win=64128 Len=0 TSV=3881700 TSER=3849512
  1   0.000000     10.0.1.3 -> 10.0.1.2     TCP 51089 > glrpc [SYN] Seq=0 Win=5840 Len=0 MSS=1460 TSV=3852761 TSER=0 WS=6
  2   0.000270     10.0.1.2 -> 10.0.1.3     TCP glrpc > 51089 [SYN, ACK] Seq=0 Ack=1 Win=14480 Len=0 MSS=1460 TSV=3884949 TSER=3852761 WS=6
  3   0.000291     10.0.1.3 -> 10.0.1.2     TCP 51089 > glrpc [ACK] Seq=1 Ack=1 Win=5888 Len=0 TSV=3852761 TSER=3884949
151984  16.567616     10.0.1.3 -> 10.0.1.2     TCP 51089 > glrpc [FIN, ACK] Seq=90301 Ack=150345301 Win=2004608 Len=0 TSV=3856903 TSER=3889075
151985  16.568062     10.0.1.2 -> 10.0.1.3     TCP glrpc > 51089 [FIN, ACK] Seq=150345301 Ack=90302 Win=64128 Len=0 TSV=3889091 TSER=3856903
  1   0.000000     10.0.1.3 -> 10.0.1.2     TCP 51091 > glrpc [SYN] Seq=0 Win=5840 Len=0 MSS=1460 TSV=3860129 TSER=0 WS=6
  2   0.000280     10.0.1.2 -> 10.0.1.3     TCP glrpc > 51091 [SYN, ACK] Seq=0 Ack=1 Win=14480 Len=0 MSS=1460 TSV=3892318 TSER=3860129 WS=6
  3   0.000302     10.0.1.3 -> 10.0.1.2     TCP 51091 > glrpc [ACK] Seq=1 Ack=1 Win=5888 Len=0 TSV=3860129 TSER=3892318
151733  16.540340     10.0.1.3 -> 10.0.1.2     TCP 51091 > glrpc [FIN, ACK] Seq=90301 Ack=150345301 Win=2004608 Len=0 TSV=3864264 TSER=3896422
151734  16.540791     10.0.1.2 -> 10.0.1.3     TCP glrpc > 51091 [FIN, ACK] Seq=150345301 Ack=90302 Win=64128 Len=0 TSV=3896453 TSER=3864264
  1   0.000000     10.0.1.3 -> 10.0.1.2     TCP 51093 > glrpc [SYN] Seq=0 Win=5840 Len=0 MSS=1460 TSV=3867510 TSER=0 WS=6
  2   0.000281     10.0.1.2 -> 10.0.1.3     TCP glrpc > 51093 [SYN, ACK] Seq=0 Ack=1 Win=14480 Len=0 MSS=1460 TSV=3899699 TSER=3867510 WS=6
  3   0.000304     10.0.1.3 -> 10.0.1.2     TCP 51093 > glrpc [ACK] Seq=1 Ack=1 Win=5888 Len=0 TSV=3867510 TSER=3899699
151894  16.538675     10.0.1.3 -> 10.0.1.2     TCP 51093 > glrpc [FIN, ACK] Seq=90301 Ack=150345301 Win=2004608 Len=0 TSV=3871645 TSER=3903819
151895  16.539079     10.0.1.2 -> 10.0.1.3     TCP glrpc > 51093 [FIN, ACK] Seq=150345301 Ack=90302 Win=64128 Len=0 TSV=3903834 TSER=3871645
  1   0.000000     10.0.1.3 -> 10.0.1.2     TCP 51095 > glrpc [SYN] Seq=0 Win=5840 Len=0 MSS=1460 TSV=3874889 TSER=0 WS=6
  2   0.000315     10.0.1.2 -> 10.0.1.3     TCP glrpc > 51095 [SYN, ACK] Seq=0 Ack=1 Win=14480 Len=0 MSS=1460 TSV=3907079 TSER=3874889 WS=6
  3   0.000335     10.0.1.3 -> 10.0.1.2     TCP 51095 > glrpc [ACK] Seq=1 Ack=1 Win=5888 Len=0 TSV=3874889 TSER=3907079
149518  16.393296     10.0.1.3 -> 10.0.1.2     TCP 51095 > glrpc [FIN, ACK] Seq=90301 Ack=150345301 Win=1990144 Len=0 TSV=3878987 TSER=3911160
149519  16.393708     10.0.1.2 -> 10.0.1.3     TCP glrpc > 51095 [FIN, ACK] Seq=150345301 Ack=90302 Win=64128 Len=0 TSV=3911177 TSER=3878987
  1   0.000000     10.0.1.3 -> 10.0.1.2     TCP 51097 > glrpc [SYN] Seq=0 Win=5840 Len=0 MSS=1460 TSV=3882211 TSER=0 WS=6
  2   0.000314     10.0.1.2 -> 10.0.1.3     TCP glrpc > 51097 [SYN, ACK] Seq=0 Ack=1 Win=14480 Len=0 MSS=1460 TSV=3914401 TSER=3882211 WS=6
  3   0.000330     10.0.1.3 -> 10.0.1.2     TCP 51097 > glrpc [ACK] Seq=1 Ack=1 Win=5888 Len=0 TSV=3882211 TSER=3914401
151643  16.504278     10.0.1.3 -> 10.0.1.2     TCP 51097 > glrpc [FIN, ACK] Seq=90301 Ack=150345301 Win=2004608 Len=0 TSV=3886337 TSER=3918496
151644  16.504750     10.0.1.2 -> 10.0.1.3     TCP glrpc > 51097 [FIN, ACK] Seq=150345301 Ack=90302 Win=64128 Len=0 TSV=3918528 TSER=3886337
  1   0.000000     10.0.1.3 -> 10.0.1.2     TCP 51099 > glrpc [SYN] Seq=0 Win=5840 Len=0 MSS=1460 TSV=3889608 TSER=0 WS=6
  2   0.000311     10.0.1.2 -> 10.0.1.3     TCP glrpc > 51099 [SYN, ACK] Seq=0 Ack=1 Win=14480 Len=0 MSS=1460 TSV=3921799 TSER=3889608 WS=6
  3   0.000336     10.0.1.3 -> 10.0.1.2     TCP 51099 > glrpc [ACK] Seq=1 Ack=1 Win=5888 Len=0 TSV=3889609 TSER=3921799
151571  19.743923     10.0.1.3 -> 10.0.1.2     TCP 51099 > glrpc [FIN, ACK] Seq=90301 Ack=150345301 Win=2006336 Len=0 TSV=3894544 TSER=3925964
151572  19.744349     10.0.1.2 -> 10.0.1.3     TCP glrpc > 51099 [FIN, ACK] Seq=150345301 Ack=90302 Win=64128 Len=0 TSV=3926735 TSER=3894544
  1   0.000000     10.0.1.3 -> 10.0.1.2     TCP 51101 > glrpc [SYN] Seq=0 Win=5840 Len=0 MSS=1460 TSV=3897842 TSER=0 WS=6
  2   0.000368     10.0.1.2 -> 10.0.1.3     TCP glrpc > 51101 [SYN, ACK] Seq=0 Ack=1 Win=14480 Len=0 MSS=1460 TSV=3930033 TSER=3897842 WS=6
  3   0.000391     10.0.1.3 -> 10.0.1.2     TCP 51101 > glrpc [ACK] Seq=1 Ack=1 Win=5888 Len=0 TSV=3897842 TSER=3930033
151646  19.809543     10.0.1.3 -> 10.0.1.2     TCP 51101 > glrpc [FIN, ACK] Seq=90301 Ack=150345301 Win=2004608 Len=0 TSV=3902794 TSER=3934160
151647  19.810019     10.0.1.2 -> 10.0.1.3     TCP glrpc > 51101 [FIN, ACK] Seq=150345301 Ack=90302 Win=64128 Len=0 TSV=3934986 TSER=3902794
  1   0.000000     10.0.1.3 -> 10.0.1.2     TCP 36048 > glrpc [SYN] Seq=0 Win=5840 Len=0 MSS=1460 TSV=3906025 TSER=0 WS=6
  2   0.000306     10.0.1.2 -> 10.0.1.3     TCP glrpc > 36048 [SYN, ACK] Seq=0 Ack=1 Win=14480 Len=0 MSS=1460 TSV=3938216 TSER=3906025 WS=6
  3   0.000331     10.0.1.3 -> 10.0.1.2     TCP 36048 > glrpc [ACK] Seq=1 Ack=1 Win=5888 Len=0 TSV=3906025 TSER=3938216
151938  19.163047     10.0.1.3 -> 10.0.1.2     TCP 36048 > glrpc [FIN, ACK] Seq=90301 Ack=150345301 Win=2004480 Len=0 TSV=3910815 TSER=3942317
151939  19.163524     10.0.1.2 -> 10.0.1.3     TCP glrpc > 36048 [FIN, ACK] Seq=150345301 Ack=90302 Win=64128 Len=0 TSV=3943008 TSER=3910815
  1   0.000000     10.0.1.3 -> 10.0.1.2     TCP 36050 > glrpc [SYN] Seq=0 Win=5840 Len=0 MSS=1460 TSV=3914131 TSER=0 WS=6
  2   0.000295     10.0.1.2 -> 10.0.1.3     TCP glrpc > 36050 [SYN, ACK] Seq=0 Ack=1 Win=14480 Len=0 MSS=1460 TSV=3946324 TSER=3914131 WS=6
  3   0.000316     10.0.1.3 -> 10.0.1.2     TCP 36050 > glrpc [ACK] Seq=1 Ack=1 Win=5888 Len=0 TSV=3914131 TSER=3946324
151988  20.226816     10.0.1.3 -> 10.0.1.2     TCP 36050 > glrpc [FIN, ACK] Seq=90301 Ack=150345301 Win=1993024 Len=0 TSV=3919188 TSER=3950697
151989  20.227274     10.0.1.2 -> 10.0.1.3     TCP glrpc > 36050 [FIN, ACK] Seq=150345301 Ack=90302 Win=64128 Len=0 TSV=3951381 TSER=3919188
  1   0.000000     10.0.1.3 -> 10.0.1.2     TCP 36052 > glrpc [SYN] Seq=0 Win=5840 Len=0 MSS=1460 TSV=3922427 TSER=0 WS=6
  2   0.000284     10.0.1.2 -> 10.0.1.3     TCP glrpc > 36052 [SYN, ACK] Seq=0 Ack=1 Win=14480 Len=0 MSS=1460 TSV=3954620 TSER=3922427 WS=6
  3   0.000305     10.0.1.3 -> 10.0.1.2     TCP 36052 > glrpc [ACK] Seq=1 Ack=1 Win=5888 Len=0 TSV=3922427 TSER=3954620
151850  19.380415     10.0.1.3 -> 10.0.1.2     TCP 36052 > glrpc [FIN, ACK] Seq=90301 Ack=150345301 Win=2004608 Len=0 TSV=3927272 TSER=3958733
151851  19.380876     10.0.1.2 -> 10.0.1.3     TCP glrpc > 36052 [FIN, ACK] Seq=150345301 Ack=90302 Win=64128 Len=0 TSV=3959466 TSER=3927272
