  1   0.000000     10.0.1.3 -> 10.0.1.2     TCP 36614 > glrpc [SYN] Seq=0 Win=5840 Len=0 MSS=1460 TSV=4117523 TSER=0 WS=6
  2   0.000316     10.0.1.2 -> 10.0.1.3     TCP glrpc > 36614 [SYN, ACK] Seq=0 Ack=1 Win=14480 Len=0 MSS=1460 TSV=4149731 TSER=4117523 WS=6
  3   0.000339     10.0.1.3 -> 10.0.1.2     TCP 36614 > glrpc [ACK] Seq=1 Ack=1 Win=5888 Len=0 TSV=4117523 TSER=4149731
254179  27.786773     10.0.1.3 -> 10.0.1.2     TCP 36614 > glrpc [FIN, ACK] Seq=150501 Ack=250575501 Win=2004608 Len=0 TSV=4124470 TSER=4156665
254180  27.787199     10.0.1.2 -> 10.0.1.3     TCP glrpc > 36614 [FIN, ACK] Seq=250575501 Ack=150502 Win=109120 Len=0 TSV=4156678 TSER=4124470
  1   0.000000     10.0.1.3 -> 10.0.1.2     TCP 48677 > glrpc [SYN] Seq=0 Win=5840 Len=0 MSS=1460 TSV=4128680 TSER=0 WS=6
  2   0.000363     10.0.1.2 -> 10.0.1.3     TCP glrpc > 48677 [SYN, ACK] Seq=0 Ack=1 Win=14480 Len=0 MSS=1460 TSV=4160889 TSER=4128680 WS=6
  3   0.000386     10.0.1.3 -> 10.0.1.2     TCP 48677 > glrpc [ACK] Seq=1 Ack=1 Win=5888 Len=0 TSV=4128680 TSER=4160889
254649  27.803723     10.0.1.3 -> 10.0.1.2     TCP 48677 > glrpc [FIN, ACK] Seq=150501 Ack=250575501 Win=2004608 Len=0 TSV=4135631 TSER=4167829
254650  27.804134     10.0.1.2 -> 10.0.1.3     TCP glrpc > 48677 [FIN, ACK] Seq=250575501 Ack=150502 Win=104832 Len=0 TSV=4167840 TSER=4135631
  1   0.000000     10.0.1.3 -> 10.0.1.2     TCP 48679 > glrpc [SYN] Seq=0 Win=5840 Len=0 MSS=1460 TSV=4139824 TSER=0 WS=6
  2   0.000336     10.0.1.2 -> 10.0.1.3     TCP glrpc > 48679 [SYN, ACK] Seq=0 Ack=1 Win=14480 Len=0 MSS=1460 TSV=4172034 TSER=4139824 WS=6
  3   0.000358     10.0.1.3 -> 10.0.1.2     TCP 48679 > glrpc [ACK] Seq=1 Ack=1 Win=5888 Len=0 TSV=4139824 TSER=4172034
247141  27.651721     10.0.1.3 -> 10.0.1.2     TCP 48679 > glrpc [FIN, ACK] Seq=150501 Ack=250575501 Win=2001536 Len=0 TSV=4146737 TSER=4178934
247142  27.652148     10.0.1.2 -> 10.0.1.3     TCP glrpc > 48679 [FIN, ACK] Seq=250575501 Ack=150502 Win=100544 Len=0 TSV=4178947 TSER=4146737
  1   0.000000     10.0.1.3 -> 10.0.1.2     TCP 48681 > glrpc [SYN] Seq=0 Win=5840 Len=0 MSS=1460 TSV=4150920 TSER=0 WS=6
  2   0.000300     10.0.1.2 -> 10.0.1.3     TCP glrpc > 48681 [SYN, ACK] Seq=0 Ack=1 Win=14480 Len=0 MSS=1460 TSV=4183131 TSER=4150920 WS=6
  3   0.000324     10.0.1.3 -> 10.0.1.2     TCP 48681 > glrpc [ACK] Seq=1 Ack=1 Win=5888 Len=0 TSV=4150921 TSER=4183131
254429  27.685918     10.0.1.3 -> 10.0.1.2     TCP 48681 > glrpc [FIN, ACK] Seq=150501 Ack=250575501 Win=2004608 Len=0 TSV=4157842 TSER=4190024
254430  27.686357     10.0.1.2 -> 10.0.1.3     TCP glrpc > 48681 [FIN, ACK] Seq=250575501 Ack=150502 Win=104832 Len=0 TSV=4190053 TSER=4157842
  1   0.000000     10.0.1.3 -> 10.0.1.2     TCP 48683 > glrpc [SYN] Seq=0 Win=5840 Len=0 MSS=1460 TSV=4162082 TSER=0 WS=6
  2   0.000363     10.0.1.2 -> 10.0.1.3     TCP glrpc > 48683 [SYN, ACK] Seq=0 Ack=1 Win=14480 Len=0 MSS=1460 TSV=4194293 TSER=4162082 WS=6
  3   0.000385     10.0.1.3 -> 10.0.1.2     TCP 48683 > glrpc [ACK] Seq=1 Ack=1 Win=5888 Len=0 TSV=4162082 TSER=4194293
254559  27.863124     10.0.1.3 -> 10.0.1.2     TCP 48683 > glrpc [FIN, ACK] Seq=150501 Ack=250575501 Win=2004608 Len=0 TSV=4169048 TSER=4201249
254560  27.863541     10.0.1.2 -> 10.0.1.3     TCP glrpc > 48683 [FIN, ACK] Seq=250575501 Ack=150502 Win=104832 Len=0 TSV=4201259 TSER=4169048
  1   0.000000     10.0.1.3 -> 10.0.1.2     TCP 48685 > glrpc [SYN] Seq=0 Win=5840 Len=0 MSS=1460 TSV=4173296 TSER=0 WS=6
  2   0.000301     10.0.1.2 -> 10.0.1.3     TCP glrpc > 48685 [SYN, ACK] Seq=0 Ack=1 Win=14480 Len=0 MSS=1460 TSV=4205508 TSER=4173296 WS=6
  3   0.000322     10.0.1.3 -> 10.0.1.2     TCP 48685 > glrpc [ACK] Seq=1 Ack=1 Win=5888 Len=0 TSV=4173296 TSER=4205508
254934  27.885840     10.0.1.3 -> 10.0.1.2     TCP 48685 > glrpc [FIN, ACK] Seq=150501 Ack=250575501 Win=2004608 Len=0 TSV=4180267 TSER=4212450
254935  27.886253     10.0.1.2 -> 10.0.1.3     TCP glrpc > 48685 [FIN, ACK] Seq=250575501 Ack=150502 Win=107008 Len=0 TSV=4212480 TSER=4180267
  1   0.000000     10.0.1.3 -> 10.0.1.2     TCP 48687 > glrpc [SYN] Seq=0 Win=5840 Len=0 MSS=1460 TSV=4184487 TSER=0 WS=6
  2   0.000315     10.0.1.2 -> 10.0.1.3     TCP glrpc > 48687 [SYN, ACK] Seq=0 Ack=1 Win=14480 Len=0 MSS=1460 TSV=4216699 TSER=4184487 WS=6
  3   0.000338     10.0.1.3 -> 10.0.1.2     TCP 48687 > glrpc [ACK] Seq=1 Ack=1 Win=5888 Len=0 TSV=4184487 TSER=4216699
246362  27.638098     10.0.1.3 -> 10.0.1.2     TCP 48687 > glrpc [FIN, ACK] Seq=150501 Ack=250575501 Win=2001728 Len=0 TSV=4191396 TSER=4223592
246363  27.638540     10.0.1.2 -> 10.0.1.3     TCP glrpc > 48687 [FIN, ACK] Seq=250575501 Ack=150502 Win=100544 Len=0 TSV=4223609 TSER=4191396
  1   0.000000     10.0.1.3 -> 10.0.1.2     TCP 48689 > glrpc [SYN] Seq=0 Win=5840 Len=0 MSS=1460 TSV=4195508 TSER=0 WS=6
  2   0.000284     10.0.1.2 -> 10.0.1.3     TCP glrpc > 48689 [SYN, ACK] Seq=0 Ack=1 Win=14480 Len=0 MSS=1460 TSV=4227722 TSER=4195508 WS=6
  3   0.000309     10.0.1.3 -> 10.0.1.2     TCP 48689 > glrpc [ACK] Seq=1 Ack=1 Win=5888 Len=0 TSV=4195508 TSER=4227722
254706  27.935590     10.0.1.3 -> 10.0.1.2     TCP 48689 > glrpc [FIN, ACK] Seq=150501 Ack=250575501 Win=2004608 Len=0 TSV=4202492 TSER=4234676
254707  27.935984     10.0.1.2 -> 10.0.1.3     TCP glrpc > 48689 [FIN, ACK] Seq=250575501 Ack=150502 Win=104832 Len=0 TSV=4234706 TSER=4202492
  1   0.000000     10.0.1.3 -> 10.0.1.2     TCP 43383 > glrpc [SYN] Seq=0 Win=5840 Len=0 MSS=1460 TSV=4206779 TSER=0 WS=6
  2   0.000371     10.0.1.2 -> 10.0.1.3     TCP glrpc > 43383 [SYN, ACK] Seq=0 Ack=1 Win=14480 Len=0 MSS=1460 TSV=4238993 TSER=4206779 WS=6
  3   0.000393     10.0.1.3 -> 10.0.1.2     TCP 43383 > glrpc [ACK] Seq=1 Ack=1 Win=5888 Len=0 TSV=4206779 TSER=4238993
254571  27.695355     10.0.1.3 -> 10.0.1.2     TCP 43383 > glrpc [FIN, ACK] Seq=150501 Ack=250575501 Win=2001728 Len=0 TSV=4213702 TSER=4245900
254572  27.695794     10.0.1.2 -> 10.0.1.3     TCP glrpc > 43383 [FIN, ACK] Seq=250575501 Ack=150502 Win=104832 Len=0 TSV=4245918 TSER=4213702
  1   0.000000     10.0.1.3 -> 10.0.1.2     TCP 43385 > glrpc [SYN] Seq=0 Win=5840 Len=0 MSS=1460 TSV=4217963 TSER=0 WS=6
  2   0.000298     10.0.1.2 -> 10.0.1.3     TCP glrpc > 43385 [SYN, ACK] Seq=0 Ack=1 Win=14480 Len=0 MSS=1460 TSV=4250178 TSER=4217963 WS=6
  3   0.000321     10.0.1.3 -> 10.0.1.2     TCP 43385 > glrpc [ACK] Seq=1 Ack=1 Win=5888 Len=0 TSV=4217963 TSER=4250178
253802  27.627073     10.0.1.3 -> 10.0.1.2     TCP 43385 > glrpc [FIN, ACK] Seq=150501 Ack=250575501 Win=2004608 Len=0 TSV=4224870 TSER=4257074
253803  27.627505     10.0.1.2 -> 10.0.1.3     TCP glrpc > 43385 [FIN, ACK] Seq=250575501 Ack=150502 Win=104832 Len=0 TSV=4257086 TSER=4224870
  1   0.000000     10.0.1.3 -> 10.0.1.2     TCP 43387 > glrpc [SYN] Seq=0 Win=5840 Len=0 MSS=1460 TSV=4229011 TSER=0 WS=6
  2   0.000314     10.0.1.2 -> 10.0.1.3     TCP glrpc > 43387 [SYN, ACK] Seq=0 Ack=1 Win=14480 Len=0 MSS=1460 TSV=4261227 TSER=4229011 WS=6
  3   0.000335     10.0.1.3 -> 10.0.1.2     TCP 43387 > glrpc [ACK] Seq=1 Ack=1 Win=5888 Len=0 TSV=4229011 TSER=4261227
242789  27.784477     10.0.1.3 -> 10.0.1.2     TCP 43387 > glrpc [FIN, ACK] Seq=150501 Ack=250575501 Win=1993024 Len=0 TSV=4235957 TSER=4268145
242790  27.784913     10.0.1.2 -> 10.0.1.3     TCP glrpc > 43387 [FIN, ACK] Seq=250575501 Ack=150502 Win=104832 Len=0 TSV=4268174 TSER=4235957
  1   0.000000     10.0.1.3 -> 10.0.1.2     TCP 43389 > glrpc [SYN] Seq=0 Win=5840 Len=0 MSS=1460 TSV=4240056 TSER=0 WS=6
  2   0.000297     10.0.1.2 -> 10.0.1.3     TCP glrpc > 43389 [SYN, ACK] Seq=0 Ack=1 Win=14480 Len=0 MSS=1460 TSV=4272273 TSER=4240056 WS=6
  3   0.000320     10.0.1.3 -> 10.0.1.2     TCP 43389 > glrpc [ACK] Seq=1 Ack=1 Win=5888 Len=0 TSV=4240056 TSER=4272273
244676  27.917959     10.0.1.3 -> 10.0.1.2     TCP 43389 > glrpc [FIN, ACK] Seq=150501 Ack=250575501 Win=2007552 Len=0 TSV=4247035 TSER=4279220
244677  27.918387     10.0.1.2 -> 10.0.1.3     TCP glrpc > 43389 [FIN, ACK] Seq=250575501 Ack=150502 Win=100544 Len=0 TSV=4279253 TSER=4247035
  1   0.000000     10.0.1.3 -> 10.0.1.2     TCP 43391 > glrpc [SYN] Seq=0 Win=5840 Len=0 MSS=1460 TSV=4251128 TSER=0 WS=6
  2   0.000284     10.0.1.2 -> 10.0.1.3     TCP glrpc > 43391 [SYN, ACK] Seq=0 Ack=1 Win=14480 Len=0 MSS=1460 TSV=4283346 TSER=4251128 WS=6
  3   0.000305     10.0.1.3 -> 10.0.1.2     TCP 43391 > glrpc [ACK] Seq=1 Ack=1 Win=5888 Len=0 TSV=4251128 TSER=4283346
241691  27.979182     10.0.1.3 -> 10.0.1.2     TCP 43391 > glrpc [FIN, ACK] Seq=150501 Ack=250575501 Win=2004608 Len=0 TSV=4258123 TSER=4290311
241692  27.979592     10.0.1.2 -> 10.0.1.3     TCP glrpc > 43391 [FIN, ACK] Seq=250575501 Ack=150502 Win=111296 Len=0 TSV=4290341 TSER=4258123
  1   0.000000     10.0.1.3 -> 10.0.1.2     TCP 43393 > glrpc [SYN] Seq=0 Win=5840 Len=0 MSS=1460 TSV=4262162 TSER=0 WS=6
  2   0.000301     10.0.1.2 -> 10.0.1.3     TCP glrpc > 43393 [SYN, ACK] Seq=0 Ack=1 Win=14480 Len=0 MSS=1460 TSV=4294380 TSER=4262162 WS=6
  3   0.000324     10.0.1.3 -> 10.0.1.2     TCP 43393 > glrpc [ACK] Seq=1 Ack=1 Win=5888 Len=0 TSV=4262162 TSER=4294380
239434  27.768669     10.0.1.3 -> 10.0.1.2     TCP 43393 > glrpc [FIN, ACK] Seq=150501 Ack=250575501 Win=2004608 Len=0 TSV=4269104 TSER=4301292
239435  27.769107     10.0.1.2 -> 10.0.1.3     TCP glrpc > 43393 [FIN, ACK] Seq=250575501 Ack=150502 Win=100544 Len=0 TSV=4301323 TSER=4269104
  1   0.000000     10.0.1.3 -> 10.0.1.2     TCP 43395 > glrpc [SYN] Seq=0 Win=5840 Len=0 MSS=1460 TSV=4273215 TSER=0 WS=6
  2   0.000359     10.0.1.2 -> 10.0.1.3     TCP glrpc > 43395 [SYN, ACK] Seq=0 Ack=1 Win=14480 Len=0 MSS=1460 TSV=4305434 TSER=4273215 WS=6
  3   0.000383     10.0.1.3 -> 10.0.1.2     TCP 43395 > glrpc [ACK] Seq=1 Ack=1 Win=5888 Len=0 TSV=4273215 TSER=4305434
243686  28.529317     10.0.1.3 -> 10.0.1.2     TCP 43395 > glrpc [FIN, ACK] Seq=150501 Ack=250575501 Win=2004032 Len=0 TSV=4280347 TSER=4312371
243687  28.529806     10.0.1.2 -> 10.0.1.3     TCP glrpc > 43395 [FIN, ACK] Seq=250575501 Ack=150502 Win=109120 Len=0 TSV=4312567 TSER=4280347
  1   0.000000     10.0.1.3 -> 10.0.1.2     TCP 33145 > glrpc [SYN] Seq=0 Win=5840 Len=0 MSS=1460 TSV=4284416 TSER=0 WS=6
  2   0.000294     10.0.1.2 -> 10.0.1.3     TCP glrpc > 33145 [SYN, ACK] Seq=0 Ack=1 Win=14480 Len=0 MSS=1460 TSV=4316636 TSER=4284416 WS=6
  3   0.000316     10.0.1.3 -> 10.0.1.2     TCP 33145 > glrpc [ACK] Seq=1 Ack=1 Win=5888 Len=0 TSV=4284416 TSER=4316636
242841  27.706545     10.0.1.3 -> 10.0.1.2     TCP 33145 > glrpc [FIN, ACK] Seq=150501 Ack=250575501 Win=2004608 Len=0 TSV=4291343 TSER=4323552
242842  27.706905     10.0.1.2 -> 10.0.1.3     TCP glrpc > 33145 [FIN, ACK] Seq=250575501 Ack=150502 Win=104832 Len=0 TSV=4323564 TSER=4291343
  1   0.000000     10.0.1.3 -> 10.0.1.2     TCP 33147 > glrpc [SYN] Seq=0 Win=5840 Len=0 MSS=1460 TSV=4295429 TSER=0 WS=6
  2   0.000370     10.0.1.2 -> 10.0.1.3     TCP glrpc > 33147 [SYN, ACK] Seq=0 Ack=1 Win=14480 Len=0 MSS=1460 TSV=4327650 TSER=4295429 WS=6
  3   0.000393     10.0.1.3 -> 10.0.1.2     TCP 33147 > glrpc [ACK] Seq=1 Ack=1 Win=5888 Len=0 TSV=4295429 TSER=4327650
240660  28.825613     10.0.1.3 -> 10.0.1.2     TCP 33147 > glrpc [FIN, ACK] Seq=150501 Ack=250575501 Win=2004608 Len=0 TSV=4302635 TSER=4334548
240661  28.826001     10.0.1.2 -> 10.0.1.3     TCP glrpc > 33147 [FIN, ACK] Seq=250575501 Ack=150502 Win=102720 Len=0 TSV=4334857 TSER=4302635
  1   0.000000     10.0.1.3 -> 10.0.1.2     TCP 33149 > glrpc [SYN] Seq=0 Win=5840 Len=0 MSS=1460 TSV=4306688 TSER=0 WS=6
  2   0.000315     10.0.1.2 -> 10.0.1.3     TCP glrpc > 33149 [SYN, ACK] Seq=0 Ack=1 Win=14480 Len=0 MSS=1460 TSV=4338910 TSER=4306688 WS=6
  3   0.000337     10.0.1.3 -> 10.0.1.2     TCP 33149 > glrpc [ACK] Seq=1 Ack=1 Win=5888 Len=0 TSV=4306688 TSER=4338910
241767  27.639455     10.0.1.3 -> 10.0.1.2     TCP 33149 > glrpc [FIN, ACK] Seq=150501 Ack=250575501 Win=2004608 Len=0 TSV=4313598 TSER=4345791
241768  27.639853     10.0.1.2 -> 10.0.1.3     TCP glrpc > 33149 [FIN, ACK] Seq=250575501 Ack=150502 Win=104832 Len=0 TSV=4345820 TSER=4313598
  1   0.000000     10.0.1.3 -> 10.0.1.2     TCP 33151 > glrpc [SYN] Seq=0 Win=5840 Len=0 MSS=1460 TSV=4317717 TSER=0 WS=6
  2   0.000281     10.0.1.2 -> 10.0.1.3     TCP glrpc > 33151 [SYN, ACK] Seq=0 Ack=1 Win=14480 Len=0 MSS=1460 TSV=4349940 TSER=4317717 WS=6
  3   0.000304     10.0.1.3 -> 10.0.1.2     TCP 33151 > glrpc [ACK] Seq=1 Ack=1 Win=5888 Len=0 TSV=4317717 TSER=4349940
253966  27.741896     10.0.1.3 -> 10.0.1.2     TCP 33151 > glrpc [FIN, ACK] Seq=150501 Ack=250575501 Win=2004608 Len=0 TSV=4324653 TSER=4356845
253967  27.742305     10.0.1.2 -> 10.0.1.3     TCP glrpc > 33151 [FIN, ACK] Seq=250575501 Ack=150502 Win=102720 Len=0 TSV=4356876 TSER=4324653
  1   0.000000     10.0.1.3 -> 10.0.1.2     TCP 33153 > glrpc [SYN] Seq=0 Win=5840 Len=0 MSS=1460 TSV=4328866 TSER=0 WS=6
  2   0.000365     10.0.1.2 -> 10.0.1.3     TCP glrpc > 33153 [SYN, ACK] Seq=0 Ack=1 Win=14480 Len=0 MSS=1460 TSV=4361090 TSER=4328866 WS=6
  3   0.000389     10.0.1.3 -> 10.0.1.2     TCP 33153 > glrpc [ACK] Seq=1 Ack=1 Win=5888 Len=0 TSV=4328866 TSER=4361090
254695  27.721073     10.0.1.3 -> 10.0.1.2     TCP 33153 > glrpc [FIN, ACK] Seq=150501 Ack=250575501 Win=2001728 Len=0 TSV=4335797 TSER=4367991
254696  27.721549     10.0.1.2 -> 10.0.1.3     TCP glrpc > 33153 [FIN, ACK] Seq=250575501 Ack=150502 Win=107008 Len=0 TSV=4368021 TSER=4335797
