  1   0.000000     10.0.1.3 -> 10.0.1.2     TCP 47185 > glrpc [SYN] Seq=0 Win=5840 Len=0 MSS=1460 TSV=4309720 TSER=0 WS=6
  2   0.000308     10.0.1.2 -> 10.0.1.3     TCP glrpc > 47185 [SYN, ACK] Seq=0 Ack=1 Win=14480 Len=0 MSS=1460 TSV=4363285 TSER=4309720 WS=6
  3   0.000329     10.0.1.3 -> 10.0.1.2     TCP 47185 > glrpc [ACK] Seq=1 Ack=1 Win=5888 Len=0 TSV=4309720 TSER=4363285
256311  27.524900     10.0.1.3 -> 10.0.1.2     TCP 47185 > glrpc [FIN, ACK] Seq=150501 Ack=250575501 Win=1910784 Len=0 TSV=4316601 TSER=4370136
256312  27.525335     10.0.1.2 -> 10.0.1.3     TCP glrpc > 47185 [FIN, ACK] Seq=250575501 Ack=150502 Win=100544 Len=0 TSV=4370166 TSER=4316601
================================================================================
IPv4 Conversations
Filter:<No Filter>
                                               |       <-      | |       ->      | |     Total     |
                                               | Frames  Bytes | | Frames  Bytes | | Frames  Bytes |
10.0.1.3             <-> 10.0.1.2              173796 262046044   82517   5596630  256313 267642674
================================================================================
  1   0.000000     10.0.1.3 -> 10.0.1.2     TCP 47187 > glrpc [SYN] Seq=0 Win=5840 Len=0 MSS=1460 TSV=4319322 TSER=0 WS=6
  2   0.000283     10.0.1.2 -> 10.0.1.3     TCP glrpc > 47187 [SYN, ACK] Seq=0 Ack=1 Win=14480 Len=0 MSS=1460 TSV=4372888 TSER=4319322 WS=6
  3   0.000305     10.0.1.3 -> 10.0.1.2     TCP 47187 > glrpc [ACK] Seq=1 Ack=1 Win=5888 Len=0 TSV=4319322 TSER=4372888
256301  27.464586     10.0.1.3 -> 10.0.1.2     TCP 47187 > glrpc [FIN, ACK] Seq=150501 Ack=250575501 Win=1990144 Len=0 TSV=4326188 TSER=4379737
256302  27.465044     10.0.1.2 -> 10.0.1.3     TCP glrpc > 47187 [FIN, ACK] Seq=250575501 Ack=150502 Win=100544 Len=0 TSV=4379754 TSER=4326188
================================================================================
IPv4 Conversations
Filter:<No Filter>
                                               |       <-      | |       ->      | |     Total     |
                                               | Frames  Bytes | | Frames  Bytes | | Frames  Bytes |
10.0.1.3             <-> 10.0.1.2              173793 262045846   82510   5596168  256303 267642014
================================================================================
  1   0.000000     10.0.1.3 -> 10.0.1.2     TCP 47189 > glrpc [SYN] Seq=0 Win=5840 Len=0 MSS=1460 TSV=4328903 TSER=0 WS=6
  2   0.000265     10.0.1.2 -> 10.0.1.3     TCP glrpc > 47189 [SYN, ACK] Seq=0 Ack=1 Win=14480 Len=0 MSS=1460 TSV=4382469 TSER=4328903 WS=6
  3   0.000288     10.0.1.3 -> 10.0.1.2     TCP 47189 > glrpc [ACK] Seq=1 Ack=1 Win=5888 Len=0 TSV=4328903 TSER=4382469
256111  27.541312     10.0.1.3 -> 10.0.1.2     TCP 47189 > glrpc [FIN, ACK] Seq=150501 Ack=250575501 Win=1991296 Len=0 TSV=4335788 TSER=4389343
256112  27.541788     10.0.1.2 -> 10.0.1.3     TCP glrpc > 47189 [FIN, ACK] Seq=250575501 Ack=150502 Win=102720 Len=0 TSV=4389355 TSER=4335788
================================================================================
IPv4 Conversations
Filter:<No Filter>
                                               |       <-      | |       ->      | |     Total     |
                                               | Frames  Bytes | | Frames  Bytes | | Frames  Bytes |
10.0.1.3             <-> 10.0.1.2              173787 262045450   82326   5584024  256113 267629474
================================================================================
  1   0.000000     10.0.1.3 -> 10.0.1.2     TCP 47191 > glrpc [SYN] Seq=0 Win=5840 Len=0 MSS=1460 TSV=4338518 TSER=0 WS=6
  2   0.000294     10.0.1.2 -> 10.0.1.3     TCP glrpc > 47191 [SYN, ACK] Seq=0 Ack=1 Win=14480 Len=0 MSS=1460 TSV=4392085 TSER=4338518 WS=6
  3   0.000317     10.0.1.3 -> 10.0.1.2     TCP 47191 > glrpc [ACK] Seq=1 Ack=1 Win=5888 Len=0 TSV=4338518 TSER=4392085
256693  27.535966     10.0.1.3 -> 10.0.1.2     TCP 47191 > glrpc [FIN, ACK] Seq=150501 Ack=250575501 Win=1990144 Len=0 TSV=4345402 TSER=4398941
256694  27.536332     10.0.1.2 -> 10.0.1.3     TCP glrpc > 47191 [FIN, ACK] Seq=250575501 Ack=150502 Win=109120 Len=0 TSV=4398970 TSER=4345402
================================================================================
IPv4 Conversations
Filter:<No Filter>
                                               |       <-      | |       ->      | |     Total     |
                                               | Frames  Bytes | | Frames  Bytes | | Frames  Bytes |
10.0.1.3             <-> 10.0.1.2              173794 262045912   82901   5621974  256695 267667886
================================================================================
  1   0.000000     10.0.1.3 -> 10.0.1.2     TCP 47193 > glrpc [SYN] Seq=0 Win=5840 Len=0 MSS=1460 TSV=4348082 TSER=0 WS=6
  2   0.000282     10.0.1.2 -> 10.0.1.3     TCP glrpc > 47193 [SYN, ACK] Seq=0 Ack=1 Win=14480 Len=0 MSS=1460 TSV=4401650 TSER=4348082 WS=6
  3   0.000304     10.0.1.3 -> 10.0.1.2     TCP 47193 > glrpc [ACK] Seq=1 Ack=1 Win=5888 Len=0 TSV=4348082 TSER=4401650
256471  27.339676     10.0.1.3 -> 10.0.1.2     TCP 47193 > glrpc [FIN, ACK] Seq=150501 Ack=250575501 Win=1990144 Len=0 TSV=4354917 TSER=4408470
256472  27.340103     10.0.1.2 -> 10.0.1.3     TCP glrpc > 47193 [FIN, ACK] Seq=250575501 Ack=150502 Win=100544 Len=0 TSV=4408485 TSER=4354917
================================================================================
IPv4 Conversations
Filter:<No Filter>
                                               |       <-      | |       ->      | |     Total     |
                                               | Frames  Bytes | | Frames  Bytes | | Frames  Bytes |
10.0.1.3             <-> 10.0.1.2              173794 262045912   82679   5607322  256473 267653234
================================================================================
  1   0.000000     10.0.1.3 -> 10.0.1.2     TCP 38174 > glrpc [SYN] Seq=0 Win=5840 Len=0 MSS=1460 TSV=4357646 TSER=0 WS=6
  2   0.000301     10.0.1.2 -> 10.0.1.3     TCP glrpc > 38174 [SYN, ACK] Seq=0 Ack=1 Win=14480 Len=0 MSS=1460 TSV=4411215 TSER=4357646 WS=6
  3   0.000326     10.0.1.3 -> 10.0.1.2     TCP 38174 > glrpc [ACK] Seq=1 Ack=1 Win=5888 Len=0 TSV=4357646 TSER=4411215
256483  27.354837     10.0.1.3 -> 10.0.1.2     TCP 38174 > glrpc [FIN, ACK] Seq=150501 Ack=250575501 Win=1990144 Len=0 TSV=4364485 TSER=4418039
256484  27.355254     10.0.1.2 -> 10.0.1.3     TCP glrpc > 38174 [FIN, ACK] Seq=250575501 Ack=150502 Win=102720 Len=0 TSV=4418054 TSER=4364485
================================================================================
IPv4 Conversations
Filter:<No Filter>
                                               |       <-      | |       ->      | |     Total     |
                                               | Frames  Bytes | | Frames  Bytes | | Frames  Bytes |
10.0.1.3             <-> 10.0.1.2              173778 262044856   82707   5609170  256485 267654026
================================================================================
  1   0.000000     10.0.1.3 -> 10.0.1.2     TCP 38176 > glrpc [SYN] Seq=0 Win=5840 Len=0 MSS=1460 TSV=4367223 TSER=0 WS=6
  2   0.000368     10.0.1.2 -> 10.0.1.3     TCP glrpc > 38176 [SYN, ACK] Seq=0 Ack=1 Win=14480 Len=0 MSS=1460 TSV=4420792 TSER=4367223 WS=6
  3   0.000390     10.0.1.3 -> 10.0.1.2     TCP 38176 > glrpc [ACK] Seq=1 Ack=1 Win=5888 Len=0 TSV=4367223 TSER=4420792
256474  27.294566     10.0.1.3 -> 10.0.1.2     TCP 38176 > glrpc [FIN, ACK] Seq=150501 Ack=250575501 Win=1988416 Len=0 TSV=4374046 TSER=4427586
256475  27.294960     10.0.1.2 -> 10.0.1.3     TCP glrpc > 38176 [FIN, ACK] Seq=250575501 Ack=150502 Win=102720 Len=0 TSV=4427616 TSER=4374046
================================================================================
IPv4 Conversations
Filter:<No Filter>
                                               |       <-      | |       ->      | |     Total     |
                                               | Frames  Bytes | | Frames  Bytes | | Frames  Bytes |
10.0.1.3             <-> 10.0.1.2              173803 262046506   82673   5606926  256476 267653432
================================================================================
  1   0.000000     10.0.1.3 -> 10.0.1.2     TCP 38180 > glrpc [SYN] Seq=0 Win=5840 Len=0 MSS=1460 TSV=4376753 TSER=0 WS=6
  2   0.000300     10.0.1.2 -> 10.0.1.3     TCP glrpc > 38180 [SYN, ACK] Seq=0 Ack=1 Win=14480 Len=0 MSS=1460 TSV=4430323 TSER=4376753 WS=6
  3   0.000323     10.0.1.3 -> 10.0.1.2     TCP 38180 > glrpc [ACK] Seq=1 Ack=1 Win=5888 Len=0 TSV=4376754 TSER=4430323
256271  27.367441     10.0.1.3 -> 10.0.1.2     TCP 38180 > glrpc [FIN, ACK] Seq=150501 Ack=250575501 Win=1990144 Len=0 TSV=4383595 TSER=4437154
256272  27.367868     10.0.1.2 -> 10.0.1.3     TCP glrpc > 38180 [FIN, ACK] Seq=250575501 Ack=150502 Win=100544 Len=0 TSV=4437166 TSER=4383595
================================================================================
IPv4 Conversations
Filter:<No Filter>
                                               |       <-      | |       ->      | |     Total     |
                                               | Frames  Bytes | | Frames  Bytes | | Frames  Bytes |
10.0.1.3             <-> 10.0.1.2              173797 262046110   82476   5593924  256273 267640034
================================================================================
  1   0.000000     10.0.1.3 -> 10.0.1.2     TCP 38182 > glrpc [SYN] Seq=0 Win=5840 Len=0 MSS=1460 TSV=4386323 TSER=0 WS=6
  2   0.000270     10.0.1.2 -> 10.0.1.3     TCP glrpc > 38182 [SYN, ACK] Seq=0 Ack=1 Win=14480 Len=0 MSS=1460 TSV=4439893 TSER=4386323 WS=6
  3   0.000292     10.0.1.3 -> 10.0.1.2     TCP 38182 > glrpc [ACK] Seq=1 Ack=1 Win=5888 Len=0 TSV=4386323 TSER=4439893
256578  27.492831     10.0.1.3 -> 10.0.1.2     TCP 38182 > glrpc [FIN, ACK] Seq=150501 Ack=250575501 Win=1988416 Len=0 TSV=4393196 TSER=4446746
256579  27.493259     10.0.1.2 -> 10.0.1.3     TCP glrpc > 38182 [FIN, ACK] Seq=250575501 Ack=150502 Win=102720 Len=0 TSV=4446767 TSER=4393196
================================================================================
IPv4 Conversations
Filter:<No Filter>
                                               |       <-      | |       ->      | |     Total     |
                                               | Frames  Bytes | | Frames  Bytes | | Frames  Bytes |
10.0.1.3             <-> 10.0.1.2              173800 262046308   82780   5613988  256580 267660296
================================================================================
  1   0.000000     10.0.1.3 -> 10.0.1.2     TCP 38184 > glrpc [SYN] Seq=0 Win=5840 Len=0 MSS=1460 TSV=4395927 TSER=0 WS=6
  2   0.000299     10.0.1.2 -> 10.0.1.3     TCP glrpc > 38184 [SYN, ACK] Seq=0 Ack=1 Win=14480 Len=0 MSS=1460 TSV=4449498 TSER=4395927 WS=6
  3   0.000321     10.0.1.3 -> 10.0.1.2     TCP 38184 > glrpc [ACK] Seq=1 Ack=1 Win=5888 Len=0 TSV=4395927 TSER=4449498
256917  27.546069     10.0.1.3 -> 10.0.1.2     TCP 38184 > glrpc [FIN, ACK] Seq=150501 Ack=250575501 Win=1990144 Len=0 TSV=4402813 TSER=4456373
256918  27.546536     10.0.1.2 -> 10.0.1.3     TCP glrpc > 38184 [FIN, ACK] Seq=250575501 Ack=150502 Win=100544 Len=0 TSV=4456385 TSER=4402813
================================================================================
IPv4 Conversations
Filter:<No Filter>
                                               |       <-      | |       ->      | |     Total     |
                                               | Frames  Bytes | | Frames  Bytes | | Frames  Bytes |
10.0.1.3             <-> 10.0.1.2              173797 262046110   83122   5636560  256919 267682670
================================================================================
  1   0.000000     10.0.1.3 -> 10.0.1.2     TCP 38186 > glrpc [SYN] Seq=0 Win=5840 Len=0 MSS=1460 TSV=4405532 TSER=0 WS=6
  2   0.000294     10.0.1.2 -> 10.0.1.3     TCP glrpc > 38186 [SYN, ACK] Seq=0 Ack=1 Win=14480 Len=0 MSS=1460 TSV=4459104 TSER=4405532 WS=6
  3   0.000317     10.0.1.3 -> 10.0.1.2     TCP 38186 > glrpc [ACK] Seq=1 Ack=1 Win=5888 Len=0 TSV=4405532 TSER=4459104
256686  27.448698     10.0.1.3 -> 10.0.1.2     TCP 38186 > glrpc [FIN, ACK] Seq=150501 Ack=250575501 Win=1988416 Len=0 TSV=4412395 TSER=4465952
256687  27.449131     10.0.1.2 -> 10.0.1.3     TCP glrpc > 38186 [FIN, ACK] Seq=250575501 Ack=150502 Win=104832 Len=0 TSV=4465967 TSER=4412395
================================================================================
IPv4 Conversations
Filter:<No Filter>
                                               |       <-      | |       ->      | |     Total     |
                                               | Frames  Bytes | | Frames  Bytes | | Frames  Bytes |
10.0.1.3             <-> 10.0.1.2              173778 262044856   82910   5622568  256688 267667424
================================================================================
  1   0.000000     10.0.1.3 -> 10.0.1.2     TCP 38188 > glrpc [SYN] Seq=0 Win=5840 Len=0 MSS=1460 TSV=4415104 TSER=0 WS=6
  2   0.000273     10.0.1.2 -> 10.0.1.3     TCP glrpc > 38188 [SYN, ACK] Seq=0 Ack=1 Win=14480 Len=0 MSS=1460 TSV=4468677 TSER=4415104 WS=6
  3   0.000294     10.0.1.3 -> 10.0.1.2     TCP 38188 > glrpc [ACK] Seq=1 Ack=1 Win=5888 Len=0 TSV=4415104 TSER=4468677
256556  27.480283     10.0.1.3 -> 10.0.1.2     TCP 38188 > glrpc [FIN, ACK] Seq=150501 Ack=250575501 Win=1993024 Len=0 TSV=4421974 TSER=4475536
256557  27.480734     10.0.1.2 -> 10.0.1.3     TCP glrpc > 38188 [FIN, ACK] Seq=250575501 Ack=150502 Win=100544 Len=0 TSV=4475548 TSER=4421974
================================================================================
IPv4 Conversations
Filter:<No Filter>
                                               |       <-      | |       ->      | |     Total     |
                                               | Frames  Bytes | | Frames  Bytes | | Frames  Bytes |
10.0.1.3             <-> 10.0.1.2              173795 262045978   82763   5612866  256558 267658844
================================================================================
  1   0.000000     10.0.1.3 -> 10.0.1.2     TCP 38190 > glrpc [SYN] Seq=0 Win=5840 Len=0 MSS=1460 TSV=4424749 TSER=0 WS=6
  2   0.000290     10.0.1.2 -> 10.0.1.3     TCP glrpc > 38190 [SYN, ACK] Seq=0 Ack=1 Win=14480 Len=0 MSS=1460 TSV=4478323 TSER=4424749 WS=6
  3   0.000313     10.0.1.3 -> 10.0.1.2     TCP 38190 > glrpc [ACK] Seq=1 Ack=1 Win=5888 Len=0 TSV=4424749 TSER=4478323
256794  27.590214     10.0.1.3 -> 10.0.1.2     TCP 38190 > glrpc [FIN, ACK] Seq=150501 Ack=250575501 Win=1995968 Len=0 TSV=4431647 TSER=4485191
256795  27.590585     10.0.1.2 -> 10.0.1.3     TCP glrpc > 38190 [FIN, ACK] Seq=250575501 Ack=150502 Win=104832 Len=0 TSV=4485221 TSER=4431647
================================================================================
IPv4 Conversations
Filter:<No Filter>
                                               |       <-      | |       ->      | |     Total     |
                                               | Frames  Bytes | | Frames  Bytes | | Frames  Bytes |
10.0.1.3             <-> 10.0.1.2              173802 262046440   82994   5628112  256796 267674552
================================================================================
  1   0.000000     10.0.1.3 -> 10.0.1.2     TCP 42874 > glrpc [SYN] Seq=0 Win=5840 Len=0 MSS=1460 TSV=4434373 TSER=0 WS=6
  2   0.000286     10.0.1.2 -> 10.0.1.3     TCP glrpc > 42874 [SYN, ACK] Seq=0 Ack=1 Win=14480 Len=0 MSS=1460 TSV=4487948 TSER=4434373 WS=6
  3   0.000307     10.0.1.3 -> 10.0.1.2     TCP 42874 > glrpc [ACK] Seq=1 Ack=1 Win=5888 Len=0 TSV=4434373 TSER=4487948
256758  27.444573     10.0.1.3 -> 10.0.1.2     TCP 42874 > glrpc [FIN, ACK] Seq=150501 Ack=250575501 Win=1990144 Len=0 TSV=4441234 TSER=4494793
256759  27.444998     10.0.1.2 -> 10.0.1.3     TCP glrpc > 42874 [FIN, ACK] Seq=250575501 Ack=150502 Win=102720 Len=0 TSV=4494809 TSER=4441234
================================================================================
IPv4 Conversations
Filter:<No Filter>
                                               |       <-      | |       ->      | |     Total     |
                                               | Frames  Bytes | | Frames  Bytes | | Frames  Bytes |
10.0.1.3             <-> 10.0.1.2              173791 262045714   82969   5626462  256760 267672176
================================================================================
  1   0.000000     10.0.1.3 -> 10.0.1.2     TCP 42877 > glrpc [SYN] Seq=0 Win=5840 Len=0 MSS=1460 TSV=4443913 TSER=0 WS=6
  2   0.000323     10.0.1.2 -> 10.0.1.3     TCP glrpc > 42877 [SYN, ACK] Seq=0 Ack=1 Win=14480 Len=0 MSS=1460 TSV=4497489 TSER=4443913 WS=6
  3   0.000346     10.0.1.3 -> 10.0.1.2     TCP 42877 > glrpc [ACK] Seq=1 Ack=1 Win=5888 Len=0 TSV=4443913 TSER=4497489
256653  27.512755     10.0.1.3 -> 10.0.1.2     TCP 42877 > glrpc [FIN, ACK] Seq=150501 Ack=250575501 Win=1993024 Len=0 TSV=4450792 TSER=4504337
256654  27.513178     10.0.1.2 -> 10.0.1.3     TCP glrpc > 42877 [FIN, ACK] Seq=250575501 Ack=150502 Win=100544 Len=0 TSV=4504367 TSER=4450792
================================================================================
IPv4 Conversations
Filter:<No Filter>
                                               |       <-      | |       ->      | |     Total     |
                                               | Frames  Bytes | | Frames  Bytes | | Frames  Bytes |
10.0.1.3             <-> 10.0.1.2              173801 262046374   82854   5618872  256655 267665246
================================================================================
  1   0.000000     10.0.1.3 -> 10.0.1.2     TCP 42881 > glrpc [SYN] Seq=0 Win=5840 Len=0 MSS=1460 TSV=4453517 TSER=0 WS=6
  2   0.000303     10.0.1.2 -> 10.0.1.3     TCP glrpc > 42881 [SYN, ACK] Seq=0 Ack=1 Win=14480 Len=0 MSS=1460 TSV=4507093 TSER=4453517 WS=6
  3   0.000323     10.0.1.3 -> 10.0.1.2     TCP 42881 > glrpc [ACK] Seq=1 Ack=1 Win=5888 Len=0 TSV=4453517 TSER=4507093
256423  27.566312     10.0.1.3 -> 10.0.1.2     TCP 42881 > glrpc [FIN, ACK] Seq=150501 Ack=250575501 Win=1993024 Len=0 TSV=4460409 TSER=4513954
256424  27.566757     10.0.1.2 -> 10.0.1.3     TCP glrpc > 42881 [FIN, ACK] Seq=250575501 Ack=150502 Win=102720 Len=0 TSV=4513985 TSER=4460409
================================================================================
IPv4 Conversations
Filter:<No Filter>
                                               |       <-      | |       ->      | |     Total     |
                                               | Frames  Bytes | | Frames  Bytes | | Frames  Bytes |
10.0.1.3             <-> 10.0.1.2              173796 262046044   82629   5604022  256425 267650066
================================================================================
  1   0.000000     10.0.1.3 -> 10.0.1.2     TCP 42883 > glrpc [SYN] Seq=0 Win=5840 Len=0 MSS=1460 TSV=4463121 TSER=0 WS=6
  2   0.000305     10.0.1.2 -> 10.0.1.3     TCP glrpc > 42883 [SYN, ACK] Seq=0 Ack=1 Win=14480 Len=0 MSS=1460 TSV=4516697 TSER=4463121 WS=6
  3   0.000324     10.0.1.3 -> 10.0.1.2     TCP 42883 > glrpc [ACK] Seq=1 Ack=1 Win=5888 Len=0 TSV=4463121 TSER=4516697
256273  27.537724     10.0.1.3 -> 10.0.1.2     TCP 42883 > glrpc [FIN, ACK] Seq=150501 Ack=250575501 Win=1993024 Len=0 TSV=4470005 TSER=4523551
256274  27.538188     10.0.1.2 -> 10.0.1.3     TCP glrpc > 42883 [FIN, ACK] Seq=250575501 Ack=150502 Win=100544 Len=0 TSV=4523582 TSER=4470005
================================================================================
IPv4 Conversations
Filter:<No Filter>
                                               |       <-      | |       ->      | |     Total     |
                                               | Frames  Bytes | | Frames  Bytes | | Frames  Bytes |
10.0.1.3             <-> 10.0.1.2              173787 262045450   82488   5594716  256275 267640166
================================================================================
  1   0.000000     10.0.1.3 -> 10.0.1.2     TCP 42885 > glrpc [SYN] Seq=0 Win=5840 Len=0 MSS=1460 TSV=4472720 TSER=0 WS=6
  2   0.000304     10.0.1.2 -> 10.0.1.3     TCP glrpc > 42885 [SYN, ACK] Seq=0 Ack=1 Win=14480 Len=0 MSS=1460 TSV=4526297 TSER=4472720 WS=6
  3   0.000326     10.0.1.3 -> 10.0.1.2     TCP 42885 > glrpc [ACK] Seq=1 Ack=1 Win=5888 Len=0 TSV=4472720 TSER=4526297
256409  27.600835     10.0.1.3 -> 10.0.1.2     TCP 42885 > glrpc [FIN, ACK] Seq=150501 Ack=250575501 Win=1993024 Len=0 TSV=4479620 TSER=4533167
256410  27.601268     10.0.1.2 -> 10.0.1.3     TCP glrpc > 42885 [FIN, ACK] Seq=250575501 Ack=150502 Win=104832 Len=0 TSV=4533198 TSER=4479620
================================================================================
IPv4 Conversations
Filter:<No Filter>
                                               |       <-      | |       ->      | |     Total     |
                                               | Frames  Bytes | | Frames  Bytes | | Frames  Bytes |
10.0.1.3             <-> 10.0.1.2              173794 262045912   82617   5603230  256411 267649142
================================================================================
  1   0.000000     10.0.1.3 -> 10.0.1.2     TCP 42887 > glrpc [SYN] Seq=0 Win=5840 Len=0 MSS=1460 TSV=4482323 TSER=0 WS=6
  2   0.000295     10.0.1.2 -> 10.0.1.3     TCP glrpc > 42887 [SYN, ACK] Seq=0 Ack=1 Win=14480 Len=0 MSS=1460 TSV=4535901 TSER=4482323 WS=6
  3   0.000316     10.0.1.3 -> 10.0.1.2     TCP 42887 > glrpc [ACK] Seq=1 Ack=1 Win=5888 Len=0 TSV=4482323 TSER=4535901
256705  27.480234     10.0.1.3 -> 10.0.1.2     TCP 42887 > glrpc [FIN, ACK] Seq=150501 Ack=250575501 Win=1993024 Len=0 TSV=4489193 TSER=4542760
256706  27.480653     10.0.1.2 -> 10.0.1.3     TCP glrpc > 42887 [FIN, ACK] Seq=250575501 Ack=150502 Win=102720 Len=0 TSV=4542771 TSER=4489193
================================================================================
IPv4 Conversations
Filter:<No Filter>
                                               |       <-      | |       ->      | |     Total     |
                                               | Frames  Bytes | | Frames  Bytes | | Frames  Bytes |
10.0.1.3             <-> 10.0.1.2              173793 262045846   82914   5622832  256707 267668678
================================================================================
  1   0.000000     10.0.1.3 -> 10.0.1.2     TCP 42889 > glrpc [SYN] Seq=0 Win=5840 Len=0 MSS=1460 TSV=4491913 TSER=0 WS=6
  2   0.000296     10.0.1.2 -> 10.0.1.3     TCP glrpc > 42889 [SYN, ACK] Seq=0 Ack=1 Win=14480 Len=0 MSS=1460 TSV=4545492 TSER=4491913 WS=6
  3   0.000318     10.0.1.3 -> 10.0.1.2     TCP 42889 > glrpc [ACK] Seq=1 Ack=1 Win=5888 Len=0 TSV=4491913 TSER=4545492
256513  27.534614     10.0.1.3 -> 10.0.1.2     TCP 42889 > glrpc [FIN, ACK] Seq=150501 Ack=250575501 Win=1993024 Len=0 TSV=4498797 TSER=4552364
256514  27.535034     10.0.1.2 -> 10.0.1.3     TCP glrpc > 42889 [FIN, ACK] Seq=250575501 Ack=150502 Win=102720 Len=0 TSV=4552376 TSER=4498797
================================================================================
IPv4 Conversations
Filter:<No Filter>
                                               |       <-      | |       ->      | |     Total     |
                                               | Frames  Bytes | | Frames  Bytes | | Frames  Bytes |
10.0.1.3             <-> 10.0.1.2              173788 262045516   82727   5610490  256515 267656006
================================================================================
