  1   0.000000     10.0.1.3 -> 10.0.1.2     TCP 36054 > glrpc [SYN] Seq=0 Win=5840 Len=0 MSS=1460 TSV=3930494 TSER=0 WS=6
  2   0.000333     10.0.1.2 -> 10.0.1.3     TCP glrpc > 36054 [SYN, ACK] Seq=0 Ack=1 Win=14480 Len=0 MSS=1460 TSV=3962687 TSER=3930494 WS=6
  3   0.000355     10.0.1.3 -> 10.0.1.2     TCP 36054 > glrpc [ACK] Seq=1 Ack=1 Win=5888 Len=0 TSV=3930494 TSER=3962687
203137  22.055515     10.0.1.3 -> 10.0.1.2     TCP 36054 > glrpc [FIN, ACK] Seq=120401 Ack=200460401 Win=2001728 Len=0 TSV=3936008 TSER=3968172
203138  22.055953     10.0.1.2 -> 10.0.1.3     TCP glrpc > 36054 [FIN, ACK] Seq=200460401 Ack=120402 Win=64128 Len=0 TSV=3968202 TSER=3936008
  1   0.000000     10.0.1.3 -> 10.0.1.2     TCP 36056 > glrpc [SYN] Seq=0 Win=5840 Len=0 MSS=1460 TSV=3939764 TSER=0 WS=6
  2   0.000282     10.0.1.2 -> 10.0.1.3     TCP glrpc > 36056 [SYN, ACK] Seq=0 Ack=1 Win=14480 Len=0 MSS=1460 TSV=3971958 TSER=3939764 WS=6
  3   0.000303     10.0.1.3 -> 10.0.1.2     TCP 36056 > glrpc [ACK] Seq=1 Ack=1 Win=5888 Len=0 TSV=3939764 TSER=3971958
202718  24.463149     10.0.1.3 -> 10.0.1.2     TCP 36056 > glrpc [FIN, ACK] Seq=120401 Ack=200460401 Win=2004608 Len=0 TSV=3945880 TSER=3978063
202719  24.463619     10.0.1.2 -> 10.0.1.3     TCP glrpc > 36056 [FIN, ACK] Seq=200460401 Ack=120402 Win=64128 Len=0 TSV=3978075 TSER=3945880
  1   0.000000     10.0.1.3 -> 10.0.1.2     TCP 36058 > glrpc [SYN] Seq=0 Win=5840 Len=0 MSS=1460 TSV=3949591 TSER=0 WS=6
  2   0.000284     10.0.1.2 -> 10.0.1.3     TCP glrpc > 36058 [SYN, ACK] Seq=0 Ack=1 Win=14480 Len=0 MSS=1460 TSV=3981786 TSER=3949591 WS=6
  3   0.000305     10.0.1.3 -> 10.0.1.2     TCP 36058 > glrpc [ACK] Seq=1 Ack=1 Win=5888 Len=0 TSV=3949591 TSER=3981786
202712  22.255929     10.0.1.3 -> 10.0.1.2     TCP 36058 > glrpc [FIN, ACK] Seq=120401 Ack=200460401 Win=2004608 Len=0 TSV=3955155 TSER=3987343
202713  22.256351     10.0.1.2 -> 10.0.1.3     TCP glrpc > 36058 [FIN, ACK] Seq=200460401 Ack=120402 Win=64128 Len=0 TSV=3987351 TSER=3955155
  1   0.000000     10.0.1.3 -> 10.0.1.2     TCP 36060 > glrpc [SYN] Seq=0 Win=5840 Len=0 MSS=1460 TSV=3958864 TSER=0 WS=6
  2   0.000308     10.0.1.2 -> 10.0.1.3     TCP glrpc > 36060 [SYN, ACK] Seq=0 Ack=1 Win=14480 Len=0 MSS=1460 TSV=3991060 TSER=3958864 WS=6
  3   0.000325     10.0.1.3 -> 10.0.1.2     TCP 36060 > glrpc [ACK] Seq=1 Ack=1 Win=5888 Len=0 TSV=3958864 TSER=3991060
203079  22.047690     10.0.1.3 -> 10.0.1.2     TCP 36060 > glrpc [FIN, ACK] Seq=120401 Ack=200460401 Win=2004480 Len=0 TSV=3964376 TSER=3996541
203080  22.048113     10.0.1.2 -> 10.0.1.3     TCP glrpc > 36060 [FIN, ACK] Seq=200460401 Ack=120402 Win=64128 Len=0 TSV=3996572 TSER=3964376
  1   0.000000     10.0.1.3 -> 10.0.1.2     TCP 36062 > glrpc [SYN] Seq=0 Win=5840 Len=0 MSS=1460 TSV=3968099 TSER=0 WS=6
  2   0.000302     10.0.1.2 -> 10.0.1.3     TCP glrpc > 36062 [SYN, ACK] Seq=0 Ack=1 Win=14480 Len=0 MSS=1460 TSV=4000296 TSER=3968099 WS=6
  3   0.000324     10.0.1.3 -> 10.0.1.2     TCP 36062 > glrpc [ACK] Seq=1 Ack=1 Win=5888 Len=0 TSV=3968099 TSER=4000296
203594  21.995586     10.0.1.3 -> 10.0.1.2     TCP 36062 > glrpc [FIN, ACK] Seq=120401 Ack=200460401 Win=2004608 Len=0 TSV=3973598 TSER=4005763
203595  21.996028     10.0.1.2 -> 10.0.1.3     TCP glrpc > 36062 [FIN, ACK] Seq=200460401 Ack=120402 Win=64128 Len=0 TSV=4005795 TSER=3973598
  1   0.000000     10.0.1.3 -> 10.0.1.2     TCP 35767 > glrpc [SYN] Seq=0 Win=5840 Len=0 MSS=1460 TSV=3977332 TSER=0 WS=6
  2   0.000294     10.0.1.2 -> 10.0.1.3     TCP glrpc > 35767 [SYN, ACK] Seq=0 Ack=1 Win=14480 Len=0 MSS=1460 TSV=4009529 TSER=3977332 WS=6
  3   0.000317     10.0.1.3 -> 10.0.1.2     TCP 35767 > glrpc [ACK] Seq=1 Ack=1 Win=5888 Len=0 TSV=3977332 TSER=4009529
185999  22.113466     10.0.1.3 -> 10.0.1.2     TCP 35767 > glrpc [FIN, ACK] Seq=120401 Ack=200460401 Win=2001536 Len=0 TSV=3982860 TSER=4015043
186000  22.113895     10.0.1.2 -> 10.0.1.3     TCP glrpc > 35767 [FIN, ACK] Seq=200460401 Ack=120402 Win=64128 Len=0 TSV=4015058 TSER=3982860
  1   0.000000     10.0.1.3 -> 10.0.1.2     TCP 35769 > glrpc [SYN] Seq=0 Win=5840 Len=0 MSS=1460 TSV=3986522 TSER=0 WS=6
  2   0.000272     10.0.1.2 -> 10.0.1.3     TCP glrpc > 35769 [SYN, ACK] Seq=0 Ack=1 Win=14480 Len=0 MSS=1460 TSV=4018720 TSER=3986522 WS=6
  3   0.000294     10.0.1.3 -> 10.0.1.2     TCP 35769 > glrpc [ACK] Seq=1 Ack=1 Win=5888 Len=0 TSV=3986522 TSER=4018720
202951  21.995334     10.0.1.3 -> 10.0.1.2     TCP 35769 > glrpc [FIN, ACK] Seq=120401 Ack=200460401 Win=2004032 Len=0 TSV=3992021 TSER=4024187
202952  21.995779     10.0.1.2 -> 10.0.1.3     TCP glrpc > 35769 [FIN, ACK] Seq=200460401 Ack=120402 Win=64128 Len=0 TSV=4024219 TSER=3992021
  1   0.000000     10.0.1.3 -> 10.0.1.2     TCP 35771 > glrpc [SYN] Seq=0 Win=5840 Len=0 MSS=1460 TSV=3995777 TSER=0 WS=6
  2   0.000283     10.0.1.2 -> 10.0.1.3     TCP glrpc > 35771 [SYN, ACK] Seq=0 Ack=1 Win=14480 Len=0 MSS=1460 TSV=4027976 TSER=3995777 WS=6
  3   0.000304     10.0.1.3 -> 10.0.1.2     TCP 35771 > glrpc [ACK] Seq=1 Ack=1 Win=5888 Len=0 TSV=3995777 TSER=4027976
203225  22.155762     10.0.1.3 -> 10.0.1.2     TCP 35771 > glrpc [FIN, ACK] Seq=120401 Ack=200460401 Win=2004608 Len=0 TSV=4001316 TSER=4033504
203226  22.156210     10.0.1.2 -> 10.0.1.3     TCP glrpc > 35771 [FIN, ACK] Seq=200460401 Ack=120402 Win=64128 Len=0 TSV=4033515 TSER=4001316
  1   0.000000     10.0.1.3 -> 10.0.1.2     TCP 35773 > glrpc [SYN] Seq=0 Win=5840 Len=0 MSS=1460 TSV=4005077 TSER=0 WS=6
  2   0.000359     10.0.1.2 -> 10.0.1.3     TCP glrpc > 35773 [SYN, ACK] Seq=0 Ack=1 Win=14480 Len=0 MSS=1460 TSV=4037276 TSER=4005077 WS=6
  3   0.000382     10.0.1.3 -> 10.0.1.2     TCP 35773 > glrpc [ACK] Seq=1 Ack=1 Win=5888 Len=0 TSV=4005077 TSER=4037276
202980  22.248603     10.0.1.3 -> 10.0.1.2     TCP 35773 > glrpc [FIN, ACK] Seq=120401 Ack=200460401 Win=2007552 Len=0 TSV=4010639 TSER=4042810
202981  22.249025     10.0.1.2 -> 10.0.1.3     TCP glrpc > 35773 [FIN, ACK] Seq=200460401 Ack=120402 Win=64128 Len=0 TSV=4042839 TSER=4010639
  1   0.000000     10.0.1.3 -> 10.0.1.2     TCP 35775 > glrpc [SYN] Seq=0 Win=5840 Len=0 MSS=1460 TSV=4014349 TSER=0 WS=6
  2   0.000317     10.0.1.2 -> 10.0.1.3     TCP glrpc > 35775 [SYN, ACK] Seq=0 Ack=1 Win=14480 Len=0 MSS=1460 TSV=4046549 TSER=4014349 WS=6
  3   0.000338     10.0.1.3 -> 10.0.1.2     TCP 35775 > glrpc [ACK] Seq=1 Ack=1 Win=5888 Len=0 TSV=4014349 TSER=4046549
202596  24.835576     10.0.1.3 -> 10.0.1.2     TCP 35775 > glrpc [FIN, ACK] Seq=120401 Ack=200460401 Win=2004608 Len=0 TSV=4020558 TSER=4052751
202597  24.835993     10.0.1.2 -> 10.0.1.3     TCP glrpc > 35775 [FIN, ACK] Seq=200460401 Ack=120402 Win=64128 Len=0 TSV=4052759 TSER=4020558
  1   0.000000     10.0.1.3 -> 10.0.1.2     TCP 35777 > glrpc [SYN] Seq=0 Win=5840 Len=0 MSS=1460 TSV=4024259 TSER=0 WS=6
  2   0.000292     10.0.1.2 -> 10.0.1.3     TCP glrpc > 35777 [SYN, ACK] Seq=0 Ack=1 Win=14480 Len=0 MSS=1460 TSV=4056460 TSER=4024259 WS=6
  3   0.000306     10.0.1.3 -> 10.0.1.2     TCP 35777 > glrpc [ACK] Seq=1 Ack=1 Win=5888 Len=0 TSV=4024259 TSER=4056460
187466  22.298781     10.0.1.3 -> 10.0.1.2     TCP 35777 > glrpc [FIN, ACK] Seq=120401 Ack=200460401 Win=2016192 Len=0 TSV=4029834 TSER=4062004
187467  22.299208     10.0.1.2 -> 10.0.1.3     TCP glrpc > 35777 [FIN, ACK] Seq=200460401 Ack=120402 Win=64128 Len=0 TSV=4062035 TSER=4029834
  1   0.000000     10.0.1.3 -> 10.0.1.2     TCP 35779 > glrpc [SYN] Seq=0 Win=5840 Len=0 MSS=1460 TSV=4033401 TSER=0 WS=6
  2   0.000292     10.0.1.2 -> 10.0.1.3     TCP glrpc > 35779 [SYN, ACK] Seq=0 Ack=1 Win=14480 Len=0 MSS=1460 TSV=4065602 TSER=4033401 WS=6
  3   0.000316     10.0.1.3 -> 10.0.1.2     TCP 35779 > glrpc [ACK] Seq=1 Ack=1 Win=5888 Len=0 TSV=4033401 TSER=4065602
202683  22.161131     10.0.1.3 -> 10.0.1.2     TCP 35779 > glrpc [FIN, ACK] Seq=120401 Ack=200460401 Win=2004608 Len=0 TSV=4038941 TSER=4071111
202684  22.161584     10.0.1.2 -> 10.0.1.3     TCP glrpc > 35779 [FIN, ACK] Seq=200460401 Ack=120402 Win=64128 Len=0 TSV=4071143 TSER=4038941
  1   0.000000     10.0.1.3 -> 10.0.1.2     TCP 35781 > glrpc [SYN] Seq=0 Win=5840 Len=0 MSS=1460 TSV=4042643 TSER=0 WS=6
  2   0.000320     10.0.1.2 -> 10.0.1.3     TCP glrpc > 35781 [SYN, ACK] Seq=0 Ack=1 Win=14480 Len=0 MSS=1460 TSV=4074846 TSER=4042643 WS=6
  3   0.000343     10.0.1.3 -> 10.0.1.2     TCP 35781 > glrpc [ACK] Seq=1 Ack=1 Win=5888 Len=0 TSV=4042643 TSER=4074846
203274  22.261445     10.0.1.3 -> 10.0.1.2     TCP 35781 > glrpc [FIN, ACK] Seq=120401 Ack=200460401 Win=2004608 Len=0 TSV=4048209 TSER=4080380
203275  22.261872     10.0.1.2 -> 10.0.1.3     TCP glrpc > 35781 [FIN, ACK] Seq=200460401 Ack=120402 Win=64128 Len=0 TSV=4080411 TSER=4048209
  1   0.000000     10.0.1.3 -> 10.0.1.2     TCP 36600 > glrpc [SYN] Seq=0 Win=5840 Len=0 MSS=1460 TSV=4051915 TSER=0 WS=6
  2   0.000290     10.0.1.2 -> 10.0.1.3     TCP glrpc > 36600 [SYN, ACK] Seq=0 Ack=1 Win=14480 Len=0 MSS=1460 TSV=4084117 TSER=4051915 WS=6
  3   0.000311     10.0.1.3 -> 10.0.1.2     TCP 36600 > glrpc [ACK] Seq=1 Ack=1 Win=5888 Len=0 TSV=4051915 TSER=4084117
195641  23.724834     10.0.1.3 -> 10.0.1.2     TCP 36600 > glrpc [FIN, ACK] Seq=120401 Ack=200460401 Win=2004608 Len=0 TSV=4057845 TSER=4090036
195642  23.725268     10.0.1.2 -> 10.0.1.3     TCP glrpc > 36600 [FIN, ACK] Seq=200460401 Ack=120402 Win=64128 Len=0 TSV=4090049 TSER=4057845
  1   0.000000     10.0.1.3 -> 10.0.1.2     TCP 36602 > glrpc [SYN] Seq=0 Win=5840 Len=0 MSS=1460 TSV=4061483 TSER=0 WS=6
  2   0.000297     10.0.1.2 -> 10.0.1.3     TCP glrpc > 36602 [SYN, ACK] Seq=0 Ack=1 Win=14480 Len=0 MSS=1460 TSV=4093686 TSER=4061483 WS=6
  3   0.000325     10.0.1.3 -> 10.0.1.2     TCP 36602 > glrpc [ACK] Seq=1 Ack=1 Win=5888 Len=0 TSV=4061483 TSER=4093686
202924  22.258517     10.0.1.3 -> 10.0.1.2     TCP 36602 > glrpc [FIN, ACK] Seq=120401 Ack=200460401 Win=2004608 Len=0 TSV=4067048 TSER=4099238
202925  22.258921     10.0.1.2 -> 10.0.1.3     TCP glrpc > 36602 [FIN, ACK] Seq=200460401 Ack=120402 Win=64128 Len=0 TSV=4099251 TSER=4067048
  1   0.000000     10.0.1.3 -> 10.0.1.2     TCP 36604 > glrpc [SYN] Seq=0 Win=5840 Len=0 MSS=1460 TSV=4070756 TSER=0 WS=6
  2   0.000320     10.0.1.2 -> 10.0.1.3     TCP glrpc > 36604 [SYN, ACK] Seq=0 Ack=1 Win=14480 Len=0 MSS=1460 TSV=4102960 TSER=4070756 WS=6
  3   0.000342     10.0.1.3 -> 10.0.1.2     TCP 36604 > glrpc [ACK] Seq=1 Ack=1 Win=5888 Len=0 TSV=4070756 TSER=4102960
203449  22.184593     10.0.1.3 -> 10.0.1.2     TCP 36604 > glrpc [FIN, ACK] Seq=120401 Ack=200460401 Win=2004480 Len=0 TSV=4076302 TSER=4108478
203450  22.185031     10.0.1.2 -> 10.0.1.3     TCP glrpc > 36604 [FIN, ACK] Seq=200460401 Ack=120402 Win=64128 Len=0 TSV=4108507 TSER=4076302
  1   0.000000     10.0.1.3 -> 10.0.1.2     TCP 36606 > glrpc [SYN] Seq=0 Win=5840 Len=0 MSS=1460 TSV=4080022 TSER=0 WS=6
  2   0.000315     10.0.1.2 -> 10.0.1.3     TCP glrpc > 36606 [SYN, ACK] Seq=0 Ack=1 Win=14480 Len=0 MSS=1460 TSV=4112227 TSER=4080022 WS=6
  3   0.000335     10.0.1.3 -> 10.0.1.2     TCP 36606 > glrpc [ACK] Seq=1 Ack=1 Win=5888 Len=0 TSV=4080022 TSER=4112227
203092  22.145271     10.0.1.3 -> 10.0.1.2     TCP 36606 > glrpc [FIN, ACK] Seq=120401 Ack=200460401 Win=2004480 Len=0 TSV=4085558 TSER=4117747
203093  22.145708     10.0.1.2 -> 10.0.1.3     TCP glrpc > 36606 [FIN, ACK] Seq=200460401 Ack=120402 Win=64128 Len=0 TSV=4117764 TSER=4085558
  1   0.000000     10.0.1.3 -> 10.0.1.2     TCP 36608 > glrpc [SYN] Seq=0 Win=5840 Len=0 MSS=1460 TSV=4089271 TSER=0 WS=6
  2   0.000315     10.0.1.2 -> 10.0.1.3     TCP glrpc > 36608 [SYN, ACK] Seq=0 Ack=1 Win=14480 Len=0 MSS=1460 TSV=4121477 TSER=4089271 WS=6
  3   0.000335     10.0.1.3 -> 10.0.1.2     TCP 36608 > glrpc [ACK] Seq=1 Ack=1 Win=5888 Len=0 TSV=4089271 TSER=4121477
203214  23.654209     10.0.1.3 -> 10.0.1.2     TCP 36608 > glrpc [FIN, ACK] Seq=120401 Ack=200460401 Win=1998848 Len=0 TSV=4095185 TSER=4127381
203215  23.654658     10.0.1.2 -> 10.0.1.3     TCP glrpc > 36608 [FIN, ACK] Seq=200460401 Ack=120402 Win=64128 Len=0 TSV=4127391 TSER=4095185
  1   0.000000     10.0.1.3 -> 10.0.1.2     TCP 36610 > glrpc [SYN] Seq=0 Win=5840 Len=0 MSS=1460 TSV=4098920 TSER=0 WS=6
  2   0.000290     10.0.1.2 -> 10.0.1.3     TCP glrpc > 36610 [SYN, ACK] Seq=0 Ack=1 Win=14480 Len=0 MSS=1460 TSV=4131126 TSER=4098920 WS=6
  3   0.000312     10.0.1.3 -> 10.0.1.2     TCP 36610 > glrpc [ACK] Seq=1 Ack=1 Win=5888 Len=0 TSV=4098920 TSER=4131126
203378  22.169619     10.0.1.3 -> 10.0.1.2     TCP 36610 > glrpc [FIN, ACK] Seq=120401 Ack=200460401 Win=2004608 Len=0 TSV=4104462 TSER=4136637
203379  22.170022     10.0.1.2 -> 10.0.1.3     TCP glrpc > 36610 [FIN, ACK] Seq=200460401 Ack=120402 Win=64128 Len=0 TSV=4136669 TSER=4104462
  1   0.000000     10.0.1.3 -> 10.0.1.2     TCP 36612 > glrpc [SYN] Seq=0 Win=5840 Len=0 MSS=1460 TSV=4108192 TSER=0 WS=6
  2   0.000302     10.0.1.2 -> 10.0.1.3     TCP glrpc > 36612 [SYN, ACK] Seq=0 Ack=1 Win=14480 Len=0 MSS=1460 TSV=4140399 TSER=4108192 WS=6
  3   0.000324     10.0.1.3 -> 10.0.1.2     TCP 36612 > glrpc [ACK] Seq=1 Ack=1 Win=5888 Len=0 TSV=4108192 TSER=4140399
203731  22.261783     10.0.1.3 -> 10.0.1.2     TCP 36612 > glrpc [FIN, ACK] Seq=120401 Ack=200460401 Win=1995968 Len=0 TSV=4113758 TSER=4145954
203732  22.262163     10.0.1.2 -> 10.0.1.3     TCP glrpc > 36612 [FIN, ACK] Seq=200460401 Ack=120402 Win=64128 Len=0 TSV=4145965 TSER=4113758
