  1   0.000000     10.0.1.3 -> 10.0.1.2     TCP 36248 > glrpc [SYN] Seq=0 Win=5840 Len=0 MSS=1460 TSV=4151692 TSER=0 WS=6
  2   0.000271     10.0.1.2 -> 10.0.1.3     TCP glrpc > 36248 [SYN, ACK] Seq=0 Ack=1 Win=14480 Len=0 MSS=1460 TSV=4205245 TSER=4151692 WS=6
  3   0.000294     10.0.1.3 -> 10.0.1.2     TCP 36248 > glrpc [ACK] Seq=1 Ack=1 Win=5888 Len=0 TSV=4151692 TSER=4205245
204977  22.030512     10.0.1.3 -> 10.0.1.2     TCP 36248 > glrpc [FIN, ACK] Seq=120401 Ack=200460401 Win=1988416 Len=0 TSV=4157199 TSER=4210743
204978  22.030968     10.0.1.2 -> 10.0.1.3     TCP glrpc > 36248 [FIN, ACK] Seq=200460401 Ack=120402 Win=64128 Len=0 TSV=4210753 TSER=4157199
================================================================================
IPv4 Conversations
Filter:<No Filter>
                                               |       <-      | |       ->      | |     Total     |
                                               | Frames  Bytes | | Frames  Bytes | | Frames  Bytes |
10.0.1.3             <-> 10.0.1.2              139047 209637510   65932   4471920  204979 214109430
================================================================================
  1   0.000000     10.0.1.3 -> 10.0.1.2     TCP 36250 > glrpc [SYN] Seq=0 Win=5840 Len=0 MSS=1460 TSV=4159592 TSER=0 WS=6
  2   0.000313     10.0.1.2 -> 10.0.1.3     TCP glrpc > 36250 [SYN, ACK] Seq=0 Ack=1 Win=14480 Len=0 MSS=1460 TSV=4213146 TSER=4159592 WS=6
  3   0.000335     10.0.1.3 -> 10.0.1.2     TCP 36250 > glrpc [ACK] Seq=1 Ack=1 Win=5888 Len=0 TSV=4159592 TSER=4213146
204998  22.066472     10.0.1.3 -> 10.0.1.2     TCP 36250 > glrpc [FIN, ACK] Seq=120401 Ack=200460401 Win=1990144 Len=0 TSV=4165109 TSER=4218632
204999  22.066882     10.0.1.2 -> 10.0.1.3     TCP glrpc > 36250 [FIN, ACK] Seq=200460401 Ack=120402 Win=64128 Len=0 TSV=4218663 TSER=4165109
================================================================================
IPv4 Conversations
Filter:<No Filter>
                                               |       <-      | |       ->      | |     Total     |
                                               | Frames  Bytes | | Frames  Bytes | | Frames  Bytes |
10.0.1.3             <-> 10.0.1.2              139032 209636520   65968   4474296  205000 214110816
================================================================================
  1   0.000000     10.0.1.3 -> 10.0.1.2     TCP 36252 > glrpc [SYN] Seq=0 Win=5840 Len=0 MSS=1460 TSV=4167494 TSER=0 WS=6
  2   0.000269     10.0.1.2 -> 10.0.1.3     TCP glrpc > 36252 [SYN, ACK] Seq=0 Ack=1 Win=14480 Len=0 MSS=1460 TSV=4221048 TSER=4167494 WS=6
  3   0.000293     10.0.1.3 -> 10.0.1.2     TCP 36252 > glrpc [ACK] Seq=1 Ack=1 Win=5888 Len=0 TSV=4167494 TSER=4221048
205119  22.017616     10.0.1.3 -> 10.0.1.2     TCP 36252 > glrpc [FIN, ACK] Seq=120401 Ack=200460401 Win=1993024 Len=0 TSV=4172998 TSER=4226543
205120  22.018075     10.0.1.2 -> 10.0.1.3     TCP glrpc > 36252 [FIN, ACK] Seq=200460401 Ack=120402 Win=64128 Len=0 TSV=4226553 TSER=4172998
================================================================================
IPv4 Conversations
Filter:<No Filter>
                                               |       <-      | |       ->      | |     Total     |
                                               | Frames  Bytes | | Frames  Bytes | | Frames  Bytes |
10.0.1.3             <-> 10.0.1.2              139028 209636256   66093   4482546  205121 214118802
================================================================================
  1   0.000000     10.0.1.3 -> 10.0.1.2     TCP 36254 > glrpc [SYN] Seq=0 Win=5840 Len=0 MSS=1460 TSV=4175389 TSER=0 WS=6
  2   0.000375     10.0.1.2 -> 10.0.1.3     TCP glrpc > 36254 [SYN, ACK] Seq=0 Ack=1 Win=14480 Len=0 MSS=1460 TSV=4228944 TSER=4175389 WS=6
  3   0.000398     10.0.1.3 -> 10.0.1.2     TCP 36254 > glrpc [ACK] Seq=1 Ack=1 Win=5888 Len=0 TSV=4175389 TSER=4228944
204708  22.097806     10.0.1.3 -> 10.0.1.2     TCP 36254 > glrpc [FIN, ACK] Seq=120401 Ack=200460401 Win=1982720 Len=0 TSV=4180913 TSER=4234450
204709  22.098308     10.0.1.2 -> 10.0.1.3     TCP glrpc > 36254 [FIN, ACK] Seq=200460401 Ack=120402 Win=64128 Len=0 TSV=4234469 TSER=4180913
================================================================================
IPv4 Conversations
Filter:<No Filter>
                                               |       <-      | |       ->      | |     Total     |
                                               | Frames  Bytes | | Frames  Bytes | | Frames  Bytes |
10.0.1.3             <-> 10.0.1.2              139030 209636388   65680   4455288  204710 214091676
================================================================================
  1   0.000000     10.0.1.3 -> 10.0.1.2     TCP 36256 > glrpc [SYN] Seq=0 Win=5840 Len=0 MSS=1460 TSV=4183303 TSER=0 WS=6
  2   0.000298     10.0.1.2 -> 10.0.1.3     TCP glrpc > 36256 [SYN, ACK] Seq=0 Ack=1 Win=14480 Len=0 MSS=1460 TSV=4236858 TSER=4183303 WS=6
  3   0.000318     10.0.1.3 -> 10.0.1.2     TCP 36256 > glrpc [ACK] Seq=1 Ack=1 Win=5888 Len=0 TSV=4183303 TSER=4236858
205140  22.097981     10.0.1.3 -> 10.0.1.2     TCP 36256 > glrpc [FIN, ACK] Seq=120401 Ack=200460401 Win=1993024 Len=0 TSV=4188827 TSER=4242354
205141  22.098432     10.0.1.2 -> 10.0.1.3     TCP glrpc > 36256 [FIN, ACK] Seq=200460401 Ack=120402 Win=64128 Len=0 TSV=4242383 TSER=4188827
================================================================================
IPv4 Conversations
Filter:<No Filter>
                                               |       <-      | |       ->      | |     Total     |
                                               | Frames  Bytes | | Frames  Bytes | | Frames  Bytes |
10.0.1.3             <-> 10.0.1.2              139031 209636454   66111   4483734  205142 214120188
================================================================================
  1   0.000000     10.0.1.3 -> 10.0.1.2     TCP 36258 > glrpc [SYN] Seq=0 Win=5840 Len=0 MSS=1460 TSV=4191224 TSER=0 WS=6
  2   0.000280     10.0.1.2 -> 10.0.1.3     TCP glrpc > 36258 [SYN, ACK] Seq=0 Ack=1 Win=14480 Len=0 MSS=1460 TSV=4244780 TSER=4191224 WS=6
  3   0.000302     10.0.1.3 -> 10.0.1.2     TCP 36258 > glrpc [ACK] Seq=1 Ack=1 Win=5888 Len=0 TSV=4191224 TSER=4244780
205122  21.994222     10.0.1.3 -> 10.0.1.2     TCP 36258 > glrpc [FIN, ACK] Seq=120401 Ack=200460401 Win=1987264 Len=0 TSV=4196722 TSER=4250262
205123  21.994705     10.0.1.2 -> 10.0.1.3     TCP glrpc > 36258 [FIN, ACK] Seq=200460401 Ack=120402 Win=64128 Len=0 TSV=4250279 TSER=4196722
================================================================================
IPv4 Conversations
Filter:<No Filter>
                                               |       <-      | |       ->      | |     Total     |
                                               | Frames  Bytes | | Frames  Bytes | | Frames  Bytes |
10.0.1.3             <-> 10.0.1.2              139036 209636784   66088   4482216  205124 214119000
================================================================================
  1   0.000000     10.0.1.3 -> 10.0.1.2     TCP 36260 > glrpc [SYN] Seq=0 Win=5840 Len=0 MSS=1460 TSV=4199107 TSER=0 WS=6
  2   0.000278     10.0.1.2 -> 10.0.1.3     TCP glrpc > 36260 [SYN, ACK] Seq=0 Ack=1 Win=14480 Len=0 MSS=1460 TSV=4252664 TSER=4199107 WS=6
  3   0.000299     10.0.1.3 -> 10.0.1.2     TCP 36260 > glrpc [ACK] Seq=1 Ack=1 Win=5888 Len=0 TSV=4199107 TSER=4252664
205220  22.055738     10.0.1.3 -> 10.0.1.2     TCP 36260 > glrpc [FIN, ACK] Seq=120401 Ack=200460401 Win=1995968 Len=0 TSV=4204621 TSER=4258148
205221  22.056159     10.0.1.2 -> 10.0.1.3     TCP glrpc > 36260 [FIN, ACK] Seq=200460401 Ack=120402 Win=64128 Len=0 TSV=4258178 TSER=4204621
================================================================================
IPv4 Conversations
Filter:<No Filter>
                                               |       <-      | |       ->      | |     Total     |
                                               | Frames  Bytes | | Frames  Bytes | | Frames  Bytes |
10.0.1.3             <-> 10.0.1.2              139039 209636982   66183   4488486  205222 214125468
================================================================================
  1   0.000000     10.0.1.3 -> 10.0.1.2     TCP 40140 > glrpc [SYN] Seq=0 Win=5840 Len=0 MSS=1460 TSV=4207018 TSER=0 WS=6
  2   0.000292     10.0.1.2 -> 10.0.1.3     TCP glrpc > 40140 [SYN, ACK] Seq=0 Ack=1 Win=14480 Len=0 MSS=1460 TSV=4260575 TSER=4207018 WS=6
  3   0.000316     10.0.1.3 -> 10.0.1.2     TCP 40140 > glrpc [ACK] Seq=1 Ack=1 Win=5888 Len=0 TSV=4207018 TSER=4260575
204847  22.063050     10.0.1.3 -> 10.0.1.2     TCP 40140 > glrpc [FIN, ACK] Seq=120401 Ack=200460401 Win=1969856 Len=0 TSV=4212534 TSER=4266075
204848  22.063513     10.0.1.2 -> 10.0.1.3     TCP glrpc > 40140 [FIN, ACK] Seq=200460401 Ack=120402 Win=64128 Len=0 TSV=4266092 TSER=4212534
================================================================================
IPv4 Conversations
Filter:<No Filter>
                                               |       <-      | |       ->      | |     Total     |
                                               | Frames  Bytes | | Frames  Bytes | | Frames  Bytes |
10.0.1.3             <-> 10.0.1.2              139042 209637180   65807   4463670  204849 214100850
================================================================================
  1   0.000000     10.0.1.3 -> 10.0.1.2     TCP 40142 > glrpc [SYN] Seq=0 Win=5840 Len=0 MSS=1460 TSV=4214931 TSER=0 WS=6
  2   0.000316     10.0.1.2 -> 10.0.1.3     TCP glrpc > 40142 [SYN, ACK] Seq=0 Ack=1 Win=14480 Len=0 MSS=1460 TSV=4268489 TSER=4214931 WS=6
  3   0.000339     10.0.1.3 -> 10.0.1.2     TCP 40142 > glrpc [ACK] Seq=1 Ack=1 Win=5888 Len=0 TSV=4214931 TSER=4268489
204960  22.042564     10.0.1.3 -> 10.0.1.2     TCP 40142 > glrpc [FIN, ACK] Seq=120401 Ack=200460401 Win=1990144 Len=0 TSV=4220442 TSER=4273987
204961  22.043009     10.0.1.2 -> 10.0.1.3     TCP glrpc > 40142 [FIN, ACK] Seq=200460401 Ack=120402 Win=64128 Len=0 TSV=4274000 TSER=4220442
================================================================================
IPv4 Conversations
Filter:<No Filter>
                                               |       <-      | |       ->      | |     Total     |
                                               | Frames  Bytes | | Frames  Bytes | | Frames  Bytes |
10.0.1.3             <-> 10.0.1.2              139036 209636784   65926   4471524  204962 214108308
================================================================================
  1   0.000000     10.0.1.3 -> 10.0.1.2     TCP 40144 > glrpc [SYN] Seq=0 Win=5840 Len=0 MSS=1460 TSV=4222839 TSER=0 WS=6
  2   0.000321     10.0.1.2 -> 10.0.1.3     TCP glrpc > 40144 [SYN, ACK] Seq=0 Ack=1 Win=14480 Len=0 MSS=1460 TSV=4276397 TSER=4222839 WS=6
  3   0.000342     10.0.1.3 -> 10.0.1.2     TCP 40144 > glrpc [ACK] Seq=1 Ack=1 Win=5888 Len=0 TSV=4222839 TSER=4276397
205098  22.094344     10.0.1.3 -> 10.0.1.2     TCP 40144 > glrpc [FIN, ACK] Seq=120401 Ack=200460401 Win=1992896 Len=0 TSV=4228363 TSER=4281891
205099  22.094762     10.0.1.2 -> 10.0.1.3     TCP glrpc > 40144 [FIN, ACK] Seq=200460401 Ack=120402 Win=64128 Len=0 TSV=4281921 TSER=4228363
================================================================================
IPv4 Conversations
Filter:<No Filter>
                                               |       <-      | |       ->      | |     Total     |
                                               | Frames  Bytes | | Frames  Bytes | | Frames  Bytes |
10.0.1.3             <-> 10.0.1.2              139024 209635992   66076   4481424  205100 214117416
================================================================================
  1   0.000000     10.0.1.3 -> 10.0.1.2     TCP 40148 > glrpc [SYN] Seq=0 Win=5840 Len=0 MSS=1460 TSV=4230751 TSER=0 WS=6
  2   0.000296     10.0.1.2 -> 10.0.1.3     TCP glrpc > 40148 [SYN, ACK] Seq=0 Ack=1 Win=14480 Len=0 MSS=1460 TSV=4284311 TSER=4230751 WS=6
  3   0.000316     10.0.1.3 -> 10.0.1.2     TCP 40148 > glrpc [ACK] Seq=1 Ack=1 Win=5888 Len=0 TSV=4230752 TSER=4284311
204673  22.075674     10.0.1.3 -> 10.0.1.2     TCP 40148 > glrpc [FIN, ACK] Seq=120401 Ack=200460401 Win=1989952 Len=0 TSV=4236270 TSER=4289800
204674  22.076124     10.0.1.2 -> 10.0.1.3     TCP glrpc > 40148 [FIN, ACK] Seq=200460401 Ack=120402 Win=64128 Len=0 TSV=4289830 TSER=4236270
================================================================================
IPv4 Conversations
Filter:<No Filter>
                                               |       <-      | |       ->      | |     Total     |
                                               | Frames  Bytes | | Frames  Bytes | | Frames  Bytes |
10.0.1.3             <-> 10.0.1.2              139042 209637180   65633   4452186  204675 214089366
================================================================================
  1   0.000000     10.0.1.3 -> 10.0.1.2     TCP 40150 > glrpc [SYN] Seq=0 Win=5840 Len=0 MSS=1460 TSV=4238655 TSER=0 WS=6
  2   0.000288     10.0.1.2 -> 10.0.1.3     TCP glrpc > 40150 [SYN, ACK] Seq=0 Ack=1 Win=14480 Len=0 MSS=1460 TSV=4292214 TSER=4238655 WS=6
  3   0.000313     10.0.1.3 -> 10.0.1.2     TCP 40150 > glrpc [ACK] Seq=1 Ack=1 Win=5888 Len=0 TSV=4238655 TSER=4292214
205421  22.055867     10.0.1.3 -> 10.0.1.2     TCP 40150 > glrpc [FIN, ACK] Seq=120401 Ack=200460401 Win=1990144 Len=0 TSV=4244169 TSER=4297699
205422  22.056288     10.0.1.2 -> 10.0.1.3     TCP glrpc > 40150 [FIN, ACK] Seq=200460401 Ack=120402 Win=64128 Len=0 TSV=4297729 TSER=4244169
================================================================================
IPv4 Conversations
Filter:<No Filter>
                                               |       <-      | |       ->      | |     Total     |
                                               | Frames  Bytes | | Frames  Bytes | | Frames  Bytes |
10.0.1.3             <-> 10.0.1.2              139044 209637312   66379   4501422  205423 214138734
================================================================================
  1   0.000000     10.0.1.3 -> 10.0.1.2     TCP 40152 > glrpc [SYN] Seq=0 Win=5840 Len=0 MSS=1460 TSV=4246544 TSER=0 WS=6
  2   0.000302     10.0.1.2 -> 10.0.1.3     TCP glrpc > 40152 [SYN, ACK] Seq=0 Ack=1 Win=14480 Len=0 MSS=1460 TSV=4300104 TSER=4246544 WS=6
  3   0.000325     10.0.1.3 -> 10.0.1.2     TCP 40152 > glrpc [ACK] Seq=1 Ack=1 Win=5888 Len=0 TSV=4246544 TSER=4300104
205224  22.065285     10.0.1.3 -> 10.0.1.2     TCP 40152 > glrpc [FIN, ACK] Seq=120401 Ack=200460401 Win=1980864 Len=0 TSV=4252061 TSER=4305591
205225  22.065745     10.0.1.2 -> 10.0.1.3     TCP glrpc > 40152 [FIN, ACK] Seq=200460401 Ack=120402 Win=64128 Len=0 TSV=4305621 TSER=4252061
================================================================================
IPv4 Conversations
Filter:<No Filter>
                                               |       <-      | |       ->      | |     Total     |
                                               | Frames  Bytes | | Frames  Bytes | | Frames  Bytes |
10.0.1.3             <-> 10.0.1.2              139031 209636454   66195   4489278  205226 214125732
================================================================================
  1   0.000000     10.0.1.3 -> 10.0.1.2     TCP 40154 > glrpc [SYN] Seq=0 Win=5840 Len=0 MSS=1460 TSV=4254426 TSER=0 WS=6
  2   0.000373     10.0.1.2 -> 10.0.1.3     TCP glrpc > 40154 [SYN, ACK] Seq=0 Ack=1 Win=14480 Len=0 MSS=1460 TSV=4307986 TSER=4254426 WS=6
  3   0.000396     10.0.1.3 -> 10.0.1.2     TCP 40154 > glrpc [ACK] Seq=1 Ack=1 Win=5888 Len=0 TSV=4254426 TSER=4307986
204772  21.997515     10.0.1.3 -> 10.0.1.2     TCP 40154 > glrpc [FIN, ACK] Seq=120401 Ack=200460401 Win=1875520 Len=0 TSV=4259925 TSER=4313453
204773  21.998216     10.0.1.2 -> 10.0.1.3     TCP glrpc > 40154 [FIN, ACK] Seq=200460401 Ack=120402 Win=64128 Len=0 TSV=4313486 TSER=4259925
================================================================================
IPv4 Conversations
Filter:<No Filter>
                                               |       <-      | |       ->      | |     Total     |
                                               | Frames  Bytes | | Frames  Bytes | | Frames  Bytes |
10.0.1.3             <-> 10.0.1.2              139026 209636124   65748   4459776  204774 214095900
================================================================================
  1   0.000000     10.0.1.3 -> 10.0.1.2     TCP 40156 > glrpc [SYN] Seq=0 Win=5840 Len=0 MSS=1460 TSV=4262309 TSER=0 WS=6
  2   0.000277     10.0.1.2 -> 10.0.1.3     TCP glrpc > 40156 [SYN, ACK] Seq=0 Ack=1 Win=14480 Len=0 MSS=1460 TSV=4315871 TSER=4262309 WS=6
  3   0.000299     10.0.1.3 -> 10.0.1.2     TCP 40156 > glrpc [ACK] Seq=1 Ack=1 Win=5888 Len=0 TSV=4262309 TSER=4315871
204999  22.186201     10.0.1.3 -> 10.0.1.2     TCP 40156 > glrpc [FIN, ACK] Seq=120401 Ack=200460401 Win=1993024 Len=0 TSV=4267856 TSER=4321386
205000  22.186636     10.0.1.2 -> 10.0.1.3     TCP glrpc > 40156 [FIN, ACK] Seq=200460401 Ack=120402 Win=64128 Len=0 TSV=4321418 TSER=4267856
================================================================================
IPv4 Conversations
Filter:<No Filter>
                                               |       <-      | |       ->      | |     Total     |
                                               | Frames  Bytes | | Frames  Bytes | | Frames  Bytes |
10.0.1.3             <-> 10.0.1.2              139035 209636718   65966   4474164  205001 214110882
================================================================================
  1   0.000000     10.0.1.3 -> 10.0.1.2     TCP 40158 > glrpc [SYN] Seq=0 Win=5840 Len=0 MSS=1460 TSV=4270244 TSER=0 WS=6
  2   0.000290     10.0.1.2 -> 10.0.1.3     TCP glrpc > 40158 [SYN, ACK] Seq=0 Ack=1 Win=14480 Len=0 MSS=1460 TSV=4323806 TSER=4270244 WS=6
  3   0.000312     10.0.1.3 -> 10.0.1.2     TCP 40158 > glrpc [ACK] Seq=1 Ack=1 Win=5888 Len=0 TSV=4270244 TSER=4323806
204876  21.983091     10.0.1.3 -> 10.0.1.2     TCP 40158 > glrpc [FIN, ACK] Seq=120401 Ack=200460401 Win=1878912 Len=0 TSV=4275740 TSER=4329270
204877  21.983517     10.0.1.2 -> 10.0.1.3     TCP glrpc > 40158 [FIN, ACK] Seq=200460401 Ack=120402 Win=64128 Len=0 TSV=4329302 TSER=4275740
================================================================================
IPv4 Conversations
Filter:<No Filter>
                                               |       <-      | |       ->      | |     Total     |
                                               | Frames  Bytes | | Frames  Bytes | | Frames  Bytes |
10.0.1.3             <-> 10.0.1.2              139031 209636454   65847   4466310  204878 214102764
================================================================================
  1   0.000000     10.0.1.3 -> 10.0.1.2     TCP 47175 > glrpc [SYN] Seq=0 Win=5840 Len=0 MSS=1460 TSV=4278126 TSER=0 WS=6
  2   0.000309     10.0.1.2 -> 10.0.1.3     TCP glrpc > 47175 [SYN, ACK] Seq=0 Ack=1 Win=14480 Len=0 MSS=1460 TSV=4331688 TSER=4278126 WS=6
  3   0.000333     10.0.1.3 -> 10.0.1.2     TCP 47175 > glrpc [ACK] Seq=1 Ack=1 Win=5888 Len=0 TSV=4278126 TSER=4331688
204565  22.055318     10.0.1.3 -> 10.0.1.2     TCP 47175 > glrpc [FIN, ACK] Seq=120401 Ack=200460401 Win=1924800 Len=0 TSV=4283639 TSER=4337171
204566  22.055764     10.0.1.2 -> 10.0.1.3     TCP glrpc > 47175 [FIN, ACK] Seq=200460401 Ack=120402 Win=64128 Len=0 TSV=4337202 TSER=4283639
================================================================================
IPv4 Conversations
Filter:<No Filter>
                                               |       <-      | |       ->      | |     Total     |
                                               | Frames  Bytes | | Frames  Bytes | | Frames  Bytes |
10.0.1.3             <-> 10.0.1.2              139032 209636520   65535   4445718  204567 214082238
================================================================================
  1   0.000000     10.0.1.3 -> 10.0.1.2     TCP 47177 > glrpc [SYN] Seq=0 Win=5840 Len=0 MSS=1460 TSV=4286038 TSER=0 WS=6
  2   0.000290     10.0.1.2 -> 10.0.1.3     TCP glrpc > 47177 [SYN, ACK] Seq=0 Ack=1 Win=14480 Len=0 MSS=1460 TSV=4339601 TSER=4286038 WS=6
  3   0.000313     10.0.1.3 -> 10.0.1.2     TCP 47177 > glrpc [ACK] Seq=1 Ack=1 Win=5888 Len=0 TSV=4286038 TSER=4339601
205054  22.054609     10.0.1.3 -> 10.0.1.2     TCP 47177 > glrpc [FIN, ACK] Seq=120401 Ack=200460401 Win=1960000 Len=0 TSV=4291552 TSER=4345084
205055  22.055067     10.0.1.2 -> 10.0.1.3     TCP glrpc > 47177 [FIN, ACK] Seq=200460401 Ack=120402 Win=64128 Len=0 TSV=4345115 TSER=4291552
================================================================================
IPv4 Conversations
Filter:<No Filter>
                                               |       <-      | |       ->      | |     Total     |
                                               | Frames  Bytes | | Frames  Bytes | | Frames  Bytes |
10.0.1.3             <-> 10.0.1.2              139023 209635926   66033   4478586  205056 214114512
================================================================================
  1   0.000000     10.0.1.3 -> 10.0.1.2     TCP 47179 > glrpc [SYN] Seq=0 Win=5840 Len=0 MSS=1460 TSV=4293926 TSER=0 WS=6
  2   0.000277     10.0.1.2 -> 10.0.1.3     TCP glrpc > 47179 [SYN, ACK] Seq=0 Ack=1 Win=14480 Len=0 MSS=1460 TSV=4347490 TSER=4293926 WS=6
  3   0.000296     10.0.1.3 -> 10.0.1.2     TCP 47179 > glrpc [ACK] Seq=1 Ack=1 Win=5888 Len=0 TSV=4293926 TSER=4347490
204865  21.998706     10.0.1.3 -> 10.0.1.2     TCP 47179 > glrpc [FIN, ACK] Seq=120401 Ack=200460401 Win=1984384 Len=0 TSV=4299426 TSER=4352961
204866  21.999128     10.0.1.2 -> 10.0.1.3     TCP glrpc > 47179 [FIN, ACK] Seq=200460401 Ack=120402 Win=64128 Len=0 TSV=4352990 TSER=4299426
================================================================================
IPv4 Conversations
Filter:<No Filter>
                                               |       <-      | |       ->      | |     Total     |
                                               | Frames  Bytes | | Frames  Bytes | | Frames  Bytes |
10.0.1.3             <-> 10.0.1.2              139041 209637114   65826   4464924  204867 214102038
================================================================================
  1   0.000000     10.0.1.3 -> 10.0.1.2     TCP 47183 > glrpc [SYN] Seq=0 Win=5840 Len=0 MSS=1460 TSV=4301810 TSER=0 WS=6
  2   0.000318     10.0.1.2 -> 10.0.1.3     TCP glrpc > 47183 [SYN, ACK] Seq=0 Ack=1 Win=14480 Len=0 MSS=1460 TSV=4355374 TSER=4301810 WS=6
  3   0.000340     10.0.1.3 -> 10.0.1.2     TCP 47183 > glrpc [ACK] Seq=1 Ack=1 Win=5888 Len=0 TSV=4301810 TSER=4355374
205144  22.045154     10.0.1.3 -> 10.0.1.2     TCP 47183 > glrpc [FIN, ACK] Seq=120401 Ack=200460401 Win=1990144 Len=0 TSV=4307322 TSER=4360874
205145  22.045624     10.0.1.2 -> 10.0.1.3     TCP glrpc > 47183 [FIN, ACK] Seq=200460401 Ack=120402 Win=64128 Len=0 TSV=4360886 TSER=4307322
================================================================================
IPv4 Conversations
Filter:<No Filter>
                                               |       <-      | |       ->      | |     Total     |
                                               | Frames  Bytes | | Frames  Bytes | | Frames  Bytes |
10.0.1.3             <-> 10.0.1.2              139037 209636850   66109   4483602  205146 214120452
================================================================================
