  1   0.000000     10.0.1.3 -> 10.0.1.2     TCP 55175 > glrpc [SYN] Seq=0 Win=5840 Len=0 MSS=1460 TSV=4603064 TSER=0 WS=6
  2   0.000298     10.0.1.2 -> 10.0.1.3     TCP glrpc > 55175 [SYN, ACK] Seq=0 Ack=1 Win=14480 Len=0 MSS=1460 TSV=4635309 TSER=4603064 WS=6
  3   0.000319     10.0.1.3 -> 10.0.1.2     TCP 55175 > glrpc [ACK] Seq=1 Ack=1 Win=5888 Len=0 TSV=4603064 TSER=4635309
339201  38.724048     10.0.1.3 -> 10.0.1.2     TCP 55175 > glrpc [FIN, ACK] Seq=210701 Ack=350805701 Win=2004608 Len=0 TSV=4612745 TSER=4644981
339202  38.724471     10.0.1.2 -> 10.0.1.3     TCP glrpc > 55175 [FIN, ACK] Seq=350805701 Ack=210702 Win=130048 Len=0 TSV=4644990 TSER=4612745
  1   0.000000     10.0.1.3 -> 10.0.1.2     TCP 55177 > glrpc [SYN] Seq=0 Win=5840 Len=0 MSS=1460 TSV=4617680 TSER=0 WS=6
  2   0.000302     10.0.1.2 -> 10.0.1.3     TCP glrpc > 55177 [SYN, ACK] Seq=0 Ack=1 Win=14480 Len=0 MSS=1460 TSV=4649925 TSER=4617680 WS=6
  3   0.000325     10.0.1.3 -> 10.0.1.2     TCP 55177 > glrpc [ACK] Seq=1 Ack=1 Win=5888 Len=0 TSV=4617680 TSER=4649925
338405  38.643568     10.0.1.3 -> 10.0.1.2     TCP 55177 > glrpc [FIN, ACK] Seq=210701 Ack=350805701 Win=2004608 Len=0 TSV=4627341 TSER=4659557
338406  38.643994     10.0.1.2 -> 10.0.1.3     TCP glrpc > 55177 [FIN, ACK] Seq=350805701 Ack=210702 Win=130048 Len=0 TSV=4659587 TSER=4627341
  1   0.000000     10.0.1.3 -> 10.0.1.2     TCP 55179 > glrpc [SYN] Seq=0 Win=5840 Len=0 MSS=1460 TSV=4632272 TSER=0 WS=6
  2   0.000367     10.0.1.2 -> 10.0.1.3     TCP glrpc > 55179 [SYN, ACK] Seq=0 Ack=1 Win=14480 Len=0 MSS=1460 TSV=4664519 TSER=4632272 WS=6
  3   0.000387     10.0.1.3 -> 10.0.1.2     TCP 55179 > glrpc [ACK] Seq=1 Ack=1 Win=5888 Len=0 TSV=4632272 TSER=4664519
313547  39.236562     10.0.1.3 -> 10.0.1.2     TCP 55179 > glrpc [FIN, ACK] Seq=210701 Ack=350805701 Win=2004608 Len=0 TSV=4642081 TSER=4674314
313548  39.236988     10.0.1.2 -> 10.0.1.3     TCP glrpc > 55179 [FIN, ACK] Seq=350805701 Ack=210702 Win=132480 Len=0 TSV=4674329 TSER=4642081
  1   0.000000     10.0.1.3 -> 10.0.1.2     TCP 55181 > glrpc [SYN] Seq=0 Win=5840 Len=0 MSS=1460 TSV=4646870 TSER=0 WS=6
  2   0.000336     10.0.1.2 -> 10.0.1.3     TCP glrpc > 55181 [SYN, ACK] Seq=0 Ack=1 Win=14480 Len=0 MSS=1460 TSV=4679118 TSER=4646870 WS=6
  3   0.000358     10.0.1.3 -> 10.0.1.2     TCP 55181 > glrpc [ACK] Seq=1 Ack=1 Win=5888 Len=0 TSV=4646870 TSER=4679118
345581  38.567252     10.0.1.3 -> 10.0.1.2     TCP 55181 > glrpc [FIN, ACK] Seq=210701 Ack=350805701 Win=2004608 Len=0 TSV=4656512 TSER=4688731
345582  38.567685     10.0.1.2 -> 10.0.1.3     TCP glrpc > 55181 [FIN, ACK] Seq=350805701 Ack=210702 Win=130048 Len=0 TSV=4688760 TSER=4656512
  1   0.000000     10.0.1.3 -> 10.0.1.2     TCP 44932 > glrpc [SYN] Seq=0 Win=5840 Len=0 MSS=1460 TSV=4661548 TSER=0 WS=6
  2   0.000318     10.0.1.2 -> 10.0.1.3     TCP glrpc > 44932 [SYN, ACK] Seq=0 Ack=1 Win=14480 Len=0 MSS=1460 TSV=4693797 TSER=4661548 WS=6
  3   0.000342     10.0.1.3 -> 10.0.1.2     TCP 44932 > glrpc [ACK] Seq=1 Ack=1 Win=5888 Len=0 TSV=4661548 TSER=4693797
347599  38.825313     10.0.1.3 -> 10.0.1.2     TCP 44932 > glrpc [FIN, ACK] Seq=210701 Ack=350805701 Win=2004608 Len=0 TSV=4671255 TSER=4703475
347600  38.825735     10.0.1.2 -> 10.0.1.3     TCP glrpc > 44932 [FIN, ACK] Seq=350805701 Ack=210702 Win=130048 Len=0 TSV=4703504 TSER=4671255
  1   0.000000     10.0.1.3 -> 10.0.1.2     TCP 44934 > glrpc [SYN] Seq=0 Win=5840 Len=0 MSS=1460 TSV=4676483 TSER=0 WS=6
  2   0.000300     10.0.1.2 -> 10.0.1.3     TCP glrpc > 44934 [SYN, ACK] Seq=0 Ack=1 Win=14480 Len=0 MSS=1460 TSV=4708733 TSER=4676483 WS=6
  3   0.000322     10.0.1.3 -> 10.0.1.2     TCP 44934 > glrpc [ACK] Seq=1 Ack=1 Win=5888 Len=0 TSV=4676483 TSER=4708733
349029  38.563029     10.0.1.3 -> 10.0.1.2     TCP 44934 > glrpc [FIN, ACK] Seq=210701 Ack=350805701 Win=2001536 Len=0 TSV=4686124 TSER=4718363
349030  38.563428     10.0.1.2 -> 10.0.1.3     TCP glrpc > 44934 [FIN, ACK] Seq=350805701 Ack=210702 Win=130048 Len=0 TSV=4718374 TSER=4686124
  1   0.000000     10.0.1.3 -> 10.0.1.2     TCP 44936 > glrpc [SYN] Seq=0 Win=5840 Len=0 MSS=1460 TSV=4691189 TSER=0 WS=6
  2   0.000297     10.0.1.2 -> 10.0.1.3     TCP glrpc > 44936 [SYN, ACK] Seq=0 Ack=1 Win=14480 Len=0 MSS=1460 TSV=4723441 TSER=4691189 WS=6
  3   0.000321     10.0.1.3 -> 10.0.1.2     TCP 44936 > glrpc [ACK] Seq=1 Ack=1 Win=5888 Len=0 TSV=4691190 TSER=4723441
356636  38.658642     10.0.1.3 -> 10.0.1.2     TCP 44936 > glrpc [FIN, ACK] Seq=210701 Ack=350805701 Win=2004608 Len=0 TSV=4700854 TSER=4733092
356637  38.659077     10.0.1.2 -> 10.0.1.3     TCP glrpc > 44936 [FIN, ACK] Seq=350805701 Ack=210702 Win=128832 Len=0 TSV=4733106 TSER=4700854
  1   0.000000     10.0.1.3 -> 10.0.1.2     TCP 44938 > glrpc [SYN] Seq=0 Win=5840 Len=0 MSS=1460 TSV=4705991 TSER=0 WS=6
  2   0.000318     10.0.1.2 -> 10.0.1.3     TCP glrpc > 44938 [SYN, ACK] Seq=0 Ack=1 Win=14480 Len=0 MSS=1460 TSV=4738243 TSER=4705991 WS=6
  3   0.000341     10.0.1.3 -> 10.0.1.2     TCP 44938 > glrpc [ACK] Seq=1 Ack=1 Win=5888 Len=0 TSV=4705991 TSER=4738243
347423  38.769898     10.0.1.3 -> 10.0.1.2     TCP 44938 > glrpc [FIN, ACK] Seq=210701 Ack=350805701 Win=2004608 Len=0 TSV=4715684 TSER=4747907
347424  38.770344     10.0.1.2 -> 10.0.1.3     TCP glrpc > 44938 [FIN, ACK] Seq=350805701 Ack=210702 Win=130048 Len=0 TSV=4747937 TSER=4715684
  1   0.000000     10.0.1.3 -> 10.0.1.2     TCP 44940 > glrpc [SYN] Seq=0 Win=5840 Len=0 MSS=1460 TSV=4720712 TSER=0 WS=6
  2   0.000320     10.0.1.2 -> 10.0.1.3     TCP glrpc > 44940 [SYN, ACK] Seq=0 Ack=1 Win=14480 Len=0 MSS=1460 TSV=4752965 TSER=4720712 WS=6
  3   0.000335     10.0.1.3 -> 10.0.1.2     TCP 44940 > glrpc [ACK] Seq=1 Ack=1 Win=5888 Len=0 TSV=4720712 TSER=4752965
347705  38.844470     10.0.1.3 -> 10.0.1.2     TCP 44940 > glrpc [FIN, ACK] Seq=210701 Ack=350805701 Win=2004608 Len=0 TSV=4730423 TSER=4762669
347706  38.844927     10.0.1.2 -> 10.0.1.3     TCP glrpc > 44940 [FIN, ACK] Seq=350805701 Ack=210702 Win=130048 Len=0 TSV=4762677 TSER=4730423
  1   0.000000     10.0.1.3 -> 10.0.1.2     TCP 44996 > glrpc [SYN] Seq=0 Win=5840 Len=0 MSS=1460 TSV=4735564 TSER=0 WS=6
  2   0.000290     10.0.1.2 -> 10.0.1.3     TCP glrpc > 44996 [SYN, ACK] Seq=0 Ack=1 Win=14480 Len=0 MSS=1460 TSV=4767818 TSER=4735564 WS=6
  3   0.000312     10.0.1.3 -> 10.0.1.2     TCP 44996 > glrpc [ACK] Seq=1 Ack=1 Win=5888 Len=0 TSV=4735564 TSER=4767818
346580  39.088652     10.0.1.3 -> 10.0.1.2     TCP 44996 > glrpc [FIN, ACK] Seq=210701 Ack=350805701 Win=2013312 Len=0 TSV=4745336 TSER=4777573
346581  39.089060     10.0.1.2 -> 10.0.1.3     TCP glrpc > 44996 [FIN, ACK] Seq=350805701 Ack=210702 Win=130048 Len=0 TSV=4777591 TSER=4745336
  1   0.000000     10.0.1.3 -> 10.0.1.2     TCP 44998 > glrpc [SYN] Seq=0 Win=5840 Len=0 MSS=1460 TSV=4750420 TSER=0 WS=6
  2   0.000304     10.0.1.2 -> 10.0.1.3     TCP glrpc > 44998 [SYN, ACK] Seq=0 Ack=1 Win=14480 Len=0 MSS=1460 TSV=4782675 TSER=4750420 WS=6
  3   0.000325     10.0.1.3 -> 10.0.1.2     TCP 44998 > glrpc [ACK] Seq=1 Ack=1 Win=5888 Len=0 TSV=4750420 TSER=4782675
336830  39.039360     10.0.1.3 -> 10.0.1.2     TCP 44998 > glrpc [FIN, ACK] Seq=210701 Ack=350805701 Win=2004608 Len=0 TSV=4760179 TSER=4792427
336831  39.039819     10.0.1.2 -> 10.0.1.3     TCP glrpc > 44998 [FIN, ACK] Seq=350805701 Ack=210702 Win=130048 Len=0 TSV=4792436 TSER=4760179
  1   0.000000     10.0.1.3 -> 10.0.1.2     TCP 45000 > glrpc [SYN] Seq=0 Win=5840 Len=0 MSS=1460 TSV=4765112 TSER=0 WS=6
  2   0.000286     10.0.1.2 -> 10.0.1.3     TCP glrpc > 45000 [SYN, ACK] Seq=0 Ack=1 Win=14480 Len=0 MSS=1460 TSV=4797369 TSER=4765112 WS=6
  3   0.000309     10.0.1.3 -> 10.0.1.2     TCP 45000 > glrpc [ACK] Seq=1 Ack=1 Win=5888 Len=0 TSV=4765112 TSER=4797369
356018  38.843812     10.0.1.3 -> 10.0.1.2     TCP 45000 > glrpc [FIN, ACK] Seq=210701 Ack=350805701 Win=2004480 Len=0 TSV=4774823 TSER=4807070
356019  38.844244     10.0.1.2 -> 10.0.1.3     TCP glrpc > 45000 [FIN, ACK] Seq=350805701 Ack=210702 Win=131264 Len=0 TSV=4807080 TSER=4774823
  1   0.000000     10.0.1.3 -> 10.0.1.2     TCP 45002 > glrpc [SYN] Seq=0 Win=5840 Len=0 MSS=1460 TSV=4779974 TSER=0 WS=6
  2   0.000316     10.0.1.2 -> 10.0.1.3     TCP glrpc > 45002 [SYN, ACK] Seq=0 Ack=1 Win=14480 Len=0 MSS=1460 TSV=4812231 TSER=4779974 WS=6
  3   0.000337     10.0.1.3 -> 10.0.1.2     TCP 45002 > glrpc [ACK] Seq=1 Ack=1 Win=5888 Len=0 TSV=4779974 TSER=4812231
346116  38.821827     10.0.1.3 -> 10.0.1.2     TCP 45002 > glrpc [FIN, ACK] Seq=210701 Ack=350805701 Win=2004608 Len=0 TSV=4789679 TSER=4821906
346117  38.822496     10.0.1.2 -> 10.0.1.3     TCP glrpc > 45002 [FIN, ACK] Seq=350805701 Ack=210702 Win=128832 Len=0 TSV=4821937 TSER=4789679
  1   0.000000     10.0.1.3 -> 10.0.1.2     TCP 45004 > glrpc [SYN] Seq=0 Win=5840 Len=0 MSS=1460 TSV=4794743 TSER=0 WS=6
  2   0.000317     10.0.1.2 -> 10.0.1.3     TCP glrpc > 45004 [SYN, ACK] Seq=0 Ack=1 Win=14480 Len=0 MSS=1460 TSV=4827001 TSER=4794743 WS=6
  3   0.000337     10.0.1.3 -> 10.0.1.2     TCP 45004 > glrpc [ACK] Seq=1 Ack=1 Win=5888 Len=0 TSV=4794743 TSER=4827001
356342  38.764698     10.0.1.3 -> 10.0.1.2     TCP 45004 > glrpc [FIN, ACK] Seq=210701 Ack=350805701 Win=2013312 Len=0 TSV=4804434 TSER=4836683
356343  38.765080     10.0.1.2 -> 10.0.1.3     TCP glrpc > 45004 [FIN, ACK] Seq=350805701 Ack=210702 Win=130048 Len=0 TSV=4836693 TSER=4804434
  1   0.000000     10.0.1.3 -> 10.0.1.2     TCP 39888 > glrpc [SYN] Seq=0 Win=5840 Len=0 MSS=1460 TSV=4809630 TSER=0 WS=6
  2   0.000289     10.0.1.2 -> 10.0.1.3     TCP glrpc > 39888 [SYN, ACK] Seq=0 Ack=1 Win=14480 Len=0 MSS=1460 TSV=4841890 TSER=4809630 WS=6
  3   0.000311     10.0.1.3 -> 10.0.1.2     TCP 39888 > glrpc [ACK] Seq=1 Ack=1 Win=5888 Len=0 TSV=4809630 TSER=4841890
356339  38.930245     10.0.1.3 -> 10.0.1.2     TCP 39888 > glrpc [FIN, ACK] Seq=210701 Ack=350805701 Win=2004480 Len=0 TSV=4819363 TSER=4851613
356340  38.930663     10.0.1.2 -> 10.0.1.3     TCP glrpc > 39888 [FIN, ACK] Seq=350805701 Ack=210702 Win=130048 Len=0 TSV=4851623 TSER=4819363
  1   0.000000     10.0.1.3 -> 10.0.1.2     TCP 39890 > glrpc [SYN] Seq=0 Win=5840 Len=0 MSS=1460 TSV=4824437 TSER=0 WS=6
  2   0.000365     10.0.1.2 -> 10.0.1.3     TCP glrpc > 39890 [SYN, ACK] Seq=0 Ack=1 Win=14480 Len=0 MSS=1460 TSV=4856697 TSER=4824437 WS=6
  3   0.000387     10.0.1.3 -> 10.0.1.2     TCP 39890 > glrpc [ACK] Seq=1 Ack=1 Win=5888 Len=0 TSV=4824437 TSER=4856697
334675  38.733902     10.0.1.3 -> 10.0.1.2     TCP 39890 > glrpc [FIN, ACK] Seq=210701 Ack=350805701 Win=2004480 Len=0 TSV=4834120 TSER=4866371
334676  38.734337     10.0.1.2 -> 10.0.1.3     TCP glrpc > 39890 [FIN, ACK] Seq=350805701 Ack=210702 Win=130048 Len=0 TSV=4866382 TSER=4834120
  1   0.000000     10.0.1.3 -> 10.0.1.2     TCP 39892 > glrpc [SYN] Seq=0 Win=5840 Len=0 MSS=1460 TSV=4839023 TSER=0 WS=6
  2   0.000272     10.0.1.2 -> 10.0.1.3     TCP glrpc > 39892 [SYN, ACK] Seq=0 Ack=1 Win=14480 Len=0 MSS=1460 TSV=4871285 TSER=4839023 WS=6
  3   0.000293     10.0.1.3 -> 10.0.1.2     TCP 39892 > glrpc [ACK] Seq=1 Ack=1 Win=5888 Len=0 TSV=4839023 TSER=4871285
328438  39.102637     10.0.1.3 -> 10.0.1.2     TCP 39892 > glrpc [FIN, ACK] Seq=210701 Ack=350805701 Win=2010432 Len=0 TSV=4848798 TSER=4881031
328439  39.103068     10.0.1.2 -> 10.0.1.3     TCP glrpc > 39892 [FIN, ACK] Seq=350805701 Ack=210702 Win=131264 Len=0 TSV=4881061 TSER=4848798
  1   0.000000     10.0.1.3 -> 10.0.1.2     TCP 39894 > glrpc [SYN] Seq=0 Win=5840 Len=0 MSS=1460 TSV=4853660 TSER=0 WS=6
  2   0.000367     10.0.1.2 -> 10.0.1.3     TCP glrpc > 39894 [SYN, ACK] Seq=0 Ack=1 Win=14480 Len=0 MSS=1460 TSV=4885923 TSER=4853660 WS=6
  3   0.000390     10.0.1.3 -> 10.0.1.2     TCP 39894 > glrpc [ACK] Seq=1 Ack=1 Win=5888 Len=0 TSV=4853660 TSER=4885923
333902  39.034016     10.0.1.3 -> 10.0.1.2     TCP 39894 > glrpc [FIN, ACK] Seq=210701 Ack=350805701 Win=2004608 Len=0 TSV=4863418 TSER=4895652
333903  39.034424     10.0.1.2 -> 10.0.1.3     TCP glrpc > 39894 [FIN, ACK] Seq=350805701 Ack=210702 Win=130048 Len=0 TSV=4895682 TSER=4863418
  1   0.000000     10.0.1.3 -> 10.0.1.2     TCP 39896 > glrpc [SYN] Seq=0 Win=5840 Len=0 MSS=1460 TSV=4868311 TSER=0 WS=6
  2   0.000288     10.0.1.2 -> 10.0.1.3     TCP glrpc > 39896 [SYN, ACK] Seq=0 Ack=1 Win=14480 Len=0 MSS=1460 TSV=4900575 TSER=4868311 WS=6
  3   0.000310     10.0.1.3 -> 10.0.1.2     TCP 39896 > glrpc [ACK] Seq=1 Ack=1 Win=5888 Len=0 TSV=4868311 TSER=4900575
356544  39.002220     10.0.1.3 -> 10.0.1.2     TCP 39896 > glrpc [FIN, ACK] Seq=210701 Ack=350805701 Win=2004480 Len=0 TSV=4878061 TSER=4910295
356545  39.002632     10.0.1.2 -> 10.0.1.3     TCP glrpc > 39896 [FIN, ACK] Seq=350805701 Ack=210702 Win=130048 Len=0 TSV=4910327 TSER=4878061
  1   0.000000     10.0.1.3 -> 10.0.1.2     TCP 41091 > glrpc [SYN] Seq=0 Win=5840 Len=0 MSS=1460 TSV=4883254 TSER=0 WS=6
  2   0.000319     10.0.1.2 -> 10.0.1.3     TCP glrpc > 41091 [SYN, ACK] Seq=0 Ack=1 Win=14480 Len=0 MSS=1460 TSV=4915519 TSER=4883254 WS=6
  3   0.000341     10.0.1.3 -> 10.0.1.2     TCP 41091 > glrpc [ACK] Seq=1 Ack=1 Win=5888 Len=0 TSV=4883254 TSER=4915519
322054  38.540551     10.0.1.3 -> 10.0.1.2     TCP 41091 > glrpc [FIN, ACK] Seq=210701 Ack=350805701 Win=2004608 Len=0 TSV=4892889 TSER=4925127
322055  38.540969     10.0.1.2 -> 10.0.1.3     TCP glrpc > 41091 [FIN, ACK] Seq=350805701 Ack=210702 Win=130048 Len=0 TSV=4925155 TSER=4892889
