  1   0.000000     10.0.1.3 -> 10.0.1.2     TCP 33155 > glrpc [SYN] Seq=0 Win=5840 Len=0 MSS=1460 TSV=4340077 TSER=0 WS=6
  2   0.000315     10.0.1.2 -> 10.0.1.3     TCP glrpc > 33155 [SYN, ACK] Seq=0 Ack=1 Win=14480 Len=0 MSS=1460 TSV=4372301 TSER=4340077 WS=6
  3   0.000335     10.0.1.3 -> 10.0.1.2     TCP 33155 > glrpc [ACK] Seq=1 Ack=1 Win=5888 Len=0 TSV=4340077 TSER=4372301
305386  35.175462     10.0.1.3 -> 10.0.1.2     TCP 33155 > glrpc [FIN, ACK] Seq=180601 Ack=300690601 Win=2004608 Len=0 TSV=4348871 TSER=4380598
305387  35.175895     10.0.1.2 -> 10.0.1.3     TCP glrpc > 33155 [FIN, ACK] Seq=300690601 Ack=180602 Win=127680 Len=0 TSV=4381096 TSER=4348871
  1   0.000000     10.0.1.3 -> 10.0.1.2     TCP 52226 > glrpc [SYN] Seq=0 Win=5840 Len=0 MSS=1460 TSV=4353595 TSER=0 WS=6
  2   0.000307     10.0.1.2 -> 10.0.1.3     TCP glrpc > 52226 [SYN, ACK] Seq=0 Ack=1 Win=14480 Len=0 MSS=1460 TSV=4385821 TSER=4353595 WS=6
  3   0.000330     10.0.1.3 -> 10.0.1.2     TCP 52226 > glrpc [ACK] Seq=1 Ack=1 Win=5888 Len=0 TSV=4353595 TSER=4385821
305858  35.564793     10.0.1.3 -> 10.0.1.2     TCP 52226 > glrpc [FIN, ACK] Seq=180601 Ack=300690601 Win=2004608 Len=0 TSV=4362486 TSER=4394105
305859  35.565270     10.0.1.2 -> 10.0.1.3     TCP glrpc > 52226 [FIN, ACK] Seq=300690601 Ack=180602 Win=127680 Len=0 TSV=4394713 TSER=4362486
  1   0.000000     10.0.1.3 -> 10.0.1.2     TCP 52228 > glrpc [SYN] Seq=0 Win=5840 Len=0 MSS=1460 TSV=4367179 TSER=0 WS=6
  2   0.000282     10.0.1.2 -> 10.0.1.3     TCP glrpc > 52228 [SYN, ACK] Seq=0 Ack=1 Win=14480 Len=0 MSS=1460 TSV=4399406 TSER=4367179 WS=6
  3   0.000304     10.0.1.3 -> 10.0.1.2     TCP 52228 > glrpc [ACK] Seq=1 Ack=1 Win=5888 Len=0 TSV=4367179 TSER=4399406
305042  35.277595     10.0.1.3 -> 10.0.1.2     TCP 52228 > glrpc [FIN, ACK] Seq=180601 Ack=300690601 Win=2004608 Len=0 TSV=4375999 TSER=4407712
305043  35.278016     10.0.1.2 -> 10.0.1.3     TCP glrpc > 52228 [FIN, ACK] Seq=300690601 Ack=180602 Win=130048 Len=0 TSV=4408226 TSER=4375999
  1   0.000000     10.0.1.3 -> 10.0.1.2     TCP 52230 > glrpc [SYN] Seq=0 Win=5840 Len=0 MSS=1460 TSV=4380682 TSER=0 WS=6
  2   0.000266     10.0.1.2 -> 10.0.1.3     TCP glrpc > 52230 [SYN, ACK] Seq=0 Ack=1 Win=14480 Len=0 MSS=1460 TSV=4412910 TSER=4380682 WS=6
  3   0.000290     10.0.1.3 -> 10.0.1.2     TCP 52230 > glrpc [ACK] Seq=1 Ack=1 Win=5888 Len=0 TSV=4380683 TSER=4412910
282251  33.101589     10.0.1.3 -> 10.0.1.2     TCP 52230 > glrpc [FIN, ACK] Seq=180601 Ack=300690601 Win=2004608 Len=0 TSV=4388958 TSER=4421171
282252  33.102032     10.0.1.2 -> 10.0.1.3     TCP glrpc > 52230 [FIN, ACK] Seq=300690601 Ack=180602 Win=130048 Len=0 TSV=4421186 TSER=4388958
  1   0.000000     10.0.1.3 -> 10.0.1.2     TCP 52232 > glrpc [SYN] Seq=0 Win=5840 Len=0 MSS=1460 TSV=4393421 TSER=0 WS=6
  2   0.000284     10.0.1.2 -> 10.0.1.3     TCP glrpc > 52232 [SYN, ACK] Seq=0 Ack=1 Win=14480 Len=0 MSS=1460 TSV=4425649 TSER=4393421 WS=6
  3   0.000308     10.0.1.3 -> 10.0.1.2     TCP 52232 > glrpc [ACK] Seq=1 Ack=1 Win=5888 Len=0 TSV=4393421 TSER=4425649
292832  33.296489     10.0.1.3 -> 10.0.1.2     TCP 52232 > glrpc [FIN, ACK] Seq=180601 Ack=300690601 Win=2007552 Len=0 TSV=4401745 TSER=4433946
292833  33.296935     10.0.1.2 -> 10.0.1.3     TCP glrpc > 52232 [FIN, ACK] Seq=300690601 Ack=180602 Win=128832 Len=0 TSV=4433974 TSER=4401745
  1   0.000000     10.0.1.3 -> 10.0.1.2     TCP 52234 > glrpc [SYN] Seq=0 Win=5840 Len=0 MSS=1460 TSV=4406342 TSER=0 WS=6
  2   0.000320     10.0.1.2 -> 10.0.1.3     TCP glrpc > 52234 [SYN, ACK] Seq=0 Ack=1 Win=14480 Len=0 MSS=1460 TSV=4438571 TSER=4406342 WS=6
  3   0.000341     10.0.1.3 -> 10.0.1.2     TCP 52234 > glrpc [ACK] Seq=1 Ack=1 Win=5888 Len=0 TSV=4406342 TSER=4438571
290643  33.273908     10.0.1.3 -> 10.0.1.2     TCP 52234 > glrpc [FIN, ACK] Seq=180601 Ack=300690601 Win=2004608 Len=0 TSV=4414660 TSER=4446875
290644  33.274267     10.0.1.2 -> 10.0.1.3     TCP glrpc > 52234 [FIN, ACK] Seq=300690601 Ack=180602 Win=128832 Len=0 TSV=4446890 TSER=4414660
  1   0.000000     10.0.1.3 -> 10.0.1.2     TCP 52236 > glrpc [SYN] Seq=0 Win=5840 Len=0 MSS=1460 TSV=4419155 TSER=0 WS=6
  2   0.000318     10.0.1.2 -> 10.0.1.3     TCP glrpc > 52236 [SYN, ACK] Seq=0 Ack=1 Win=14480 Len=0 MSS=1460 TSV=4451386 TSER=4419155 WS=6
  3   0.000339     10.0.1.3 -> 10.0.1.2     TCP 52236 > glrpc [ACK] Seq=1 Ack=1 Win=5888 Len=0 TSV=4419155 TSER=4451386
304565  33.171728     10.0.1.3 -> 10.0.1.2     TCP 52236 > glrpc [FIN, ACK] Seq=180601 Ack=300690601 Win=2004480 Len=0 TSV=4427448 TSER=4459666
304566  33.172182     10.0.1.2 -> 10.0.1.3     TCP glrpc > 52236 [FIN, ACK] Seq=300690601 Ack=180602 Win=127680 Len=0 TSV=4459679 TSER=4427448
  1   0.000000     10.0.1.3 -> 10.0.1.2     TCP 41129 > glrpc [SYN] Seq=0 Win=5840 Len=0 MSS=1460 TSV=4432187 TSER=0 WS=6
  2   0.000331     10.0.1.2 -> 10.0.1.3     TCP glrpc > 41129 [SYN, ACK] Seq=0 Ack=1 Win=14480 Len=0 MSS=1460 TSV=4464418 TSER=4432187 WS=6
  3   0.000351     10.0.1.3 -> 10.0.1.2     TCP 41129 > glrpc [ACK] Seq=1 Ack=1 Win=5888 Len=0 TSV=4432187 TSER=4464418
304974  33.518502     10.0.1.3 -> 10.0.1.2     TCP 41129 > glrpc [FIN, ACK] Seq=180601 Ack=300690601 Win=2004608 Len=0 TSV=4440566 TSER=4472787
304975  33.518925     10.0.1.2 -> 10.0.1.3     TCP glrpc > 41129 [FIN, ACK] Seq=300690601 Ack=180602 Win=132480 Len=0 TSV=4472798 TSER=4440566
  1   0.000000     10.0.1.3 -> 10.0.1.2     TCP 41131 > glrpc [SYN] Seq=0 Win=5840 Len=0 MSS=1460 TSV=4445198 TSER=0 WS=6
  2   0.000292     10.0.1.2 -> 10.0.1.3     TCP glrpc > 41131 [SYN, ACK] Seq=0 Ack=1 Win=14480 Len=0 MSS=1460 TSV=4477431 TSER=4445198 WS=6
  3   0.000316     10.0.1.3 -> 10.0.1.2     TCP 41131 > glrpc [ACK] Seq=1 Ack=1 Win=5888 Len=0 TSV=4445199 TSER=4477431
298006  35.941507     10.0.1.3 -> 10.0.1.2     TCP 41131 > glrpc [FIN, ACK] Seq=180601 Ack=300690601 Win=2004480 Len=0 TSV=4454184 TSER=4485734
298007  35.941967     10.0.1.2 -> 10.0.1.3     TCP glrpc > 41131 [FIN, ACK] Seq=300690601 Ack=180602 Win=130048 Len=0 TSV=4486417 TSER=4454184
  1   0.000000     10.0.1.3 -> 10.0.1.2     TCP 41133 > glrpc [SYN] Seq=0 Win=5840 Len=0 MSS=1460 TSV=4458767 TSER=0 WS=6
  2   0.000291     10.0.1.2 -> 10.0.1.3     TCP glrpc > 41133 [SYN, ACK] Seq=0 Ack=1 Win=14480 Len=0 MSS=1460 TSV=4491000 TSER=4458767 WS=6
  3   0.000312     10.0.1.3 -> 10.0.1.2     TCP 41133 > glrpc [ACK] Seq=1 Ack=1 Win=5888 Len=0 TSV=4458767 TSER=4491000
282451  33.294629     10.0.1.3 -> 10.0.1.2     TCP 41133 > glrpc [FIN, ACK] Seq=180601 Ack=300690601 Win=1993024 Len=0 TSV=4467091 TSER=4499309
282452  33.295035     10.0.1.2 -> 10.0.1.3     TCP glrpc > 41133 [FIN, ACK] Seq=300690601 Ack=180602 Win=131264 Len=0 TSV=4499325 TSER=4467091
  1   0.000000     10.0.1.3 -> 10.0.1.2     TCP 41135 > glrpc [SYN] Seq=0 Win=5840 Len=0 MSS=1460 TSV=4471532 TSER=0 WS=6
  2   0.000300     10.0.1.2 -> 10.0.1.3     TCP glrpc > 41135 [SYN, ACK] Seq=0 Ack=1 Win=14480 Len=0 MSS=1460 TSV=4503767 TSER=4471532 WS=6
  3   0.000322     10.0.1.3 -> 10.0.1.2     TCP 41135 > glrpc [ACK] Seq=1 Ack=1 Win=5888 Len=0 TSV=4471532 TSER=4503767
285350  33.191800     10.0.1.3 -> 10.0.1.2     TCP 41135 > glrpc [FIN, ACK] Seq=180601 Ack=300690601 Win=2004608 Len=0 TSV=4479830 TSER=4512053
285351  33.192210     10.0.1.2 -> 10.0.1.3     TCP glrpc > 41135 [FIN, ACK] Seq=300690601 Ack=180602 Win=130048 Len=0 TSV=4512065 TSER=4479830
  1   0.000000     10.0.1.3 -> 10.0.1.2     TCP 41137 > glrpc [SYN] Seq=0 Win=5840 Len=0 MSS=1460 TSV=4484312 TSER=0 WS=6
  2   0.000267     10.0.1.2 -> 10.0.1.3     TCP glrpc > 41137 [SYN, ACK] Seq=0 Ack=1 Win=14480 Len=0 MSS=1460 TSV=4516547 TSER=4484312 WS=6
  3   0.000288     10.0.1.3 -> 10.0.1.2     TCP 41137 > glrpc [ACK] Seq=1 Ack=1 Win=5888 Len=0 TSV=4484312 TSER=4516547
305762  33.412181     10.0.1.3 -> 10.0.1.2     TCP 41137 > glrpc [FIN, ACK] Seq=180601 Ack=300690601 Win=2004608 Len=0 TSV=4492665 TSER=4524886
305763  33.412605     10.0.1.2 -> 10.0.1.3     TCP glrpc > 41137 [FIN, ACK] Seq=300690601 Ack=180602 Win=130048 Len=0 TSV=4524901 TSER=4492665
  1   0.000000     10.0.1.3 -> 10.0.1.2     TCP 41139 > glrpc [SYN] Seq=0 Win=5840 Len=0 MSS=1460 TSV=4497298 TSER=0 WS=6
  2   0.000293     10.0.1.2 -> 10.0.1.3     TCP glrpc > 41139 [SYN, ACK] Seq=0 Ack=1 Win=14480 Len=0 MSS=1460 TSV=4529534 TSER=4497298 WS=6
  3   0.000312     10.0.1.3 -> 10.0.1.2     TCP 41139 > glrpc [ACK] Seq=1 Ack=1 Win=5888 Len=0 TSV=4497298 TSER=4529534
287570  33.518736     10.0.1.3 -> 10.0.1.2     TCP 41139 > glrpc [FIN, ACK] Seq=180601 Ack=300690601 Win=2004608 Len=0 TSV=4505677 TSER=4537884
287571  33.519174     10.0.1.2 -> 10.0.1.3     TCP glrpc > 41139 [FIN, ACK] Seq=300690601 Ack=180602 Win=131264 Len=0 TSV=4537914 TSER=4505677
  1   0.000000     10.0.1.3 -> 10.0.1.2     TCP 33539 > glrpc [SYN] Seq=0 Win=5840 Len=0 MSS=1460 TSV=4510132 TSER=0 WS=6
  2   0.000270     10.0.1.2 -> 10.0.1.3     TCP glrpc > 33539 [SYN, ACK] Seq=0 Ack=1 Win=14480 Len=0 MSS=1460 TSV=4542369 TSER=4510132 WS=6
  3   0.000293     10.0.1.3 -> 10.0.1.2     TCP 33539 > glrpc [ACK] Seq=1 Ack=1 Win=5888 Len=0 TSV=4510132 TSER=4542369
288015  33.998199     10.0.1.3 -> 10.0.1.2     TCP 33539 > glrpc [FIN, ACK] Seq=180601 Ack=300690601 Win=2004608 Len=0 TSV=4518632 TSER=4550840
288016  33.998619     10.0.1.2 -> 10.0.1.3     TCP glrpc > 33539 [FIN, ACK] Seq=300690601 Ack=180602 Win=131264 Len=0 TSV=4550869 TSER=4518632
  1   0.000000     10.0.1.3 -> 10.0.1.2     TCP 33541 > glrpc [SYN] Seq=0 Win=5840 Len=0 MSS=1460 TSV=4523252 TSER=0 WS=6
  2   0.000369     10.0.1.2 -> 10.0.1.3     TCP glrpc > 33541 [SYN, ACK] Seq=0 Ack=1 Win=14480 Len=0 MSS=1460 TSV=4555490 TSER=4523252 WS=6
  3   0.000391     10.0.1.3 -> 10.0.1.2     TCP 33541 > glrpc [ACK] Seq=1 Ack=1 Win=5888 Len=0 TSV=4523252 TSER=4555490
304954  33.135250     10.0.1.3 -> 10.0.1.2     TCP 33541 > glrpc [FIN, ACK] Seq=180601 Ack=300690601 Win=2004608 Len=0 TSV=4531536 TSER=4563744
304955  33.135668     10.0.1.2 -> 10.0.1.3     TCP glrpc > 33541 [FIN, ACK] Seq=300690601 Ack=180602 Win=128832 Len=0 TSV=4563775 TSER=4531536
  1   0.000000     10.0.1.3 -> 10.0.1.2     TCP 33543 > glrpc [SYN] Seq=0 Win=5840 Len=0 MSS=1460 TSV=4536159 TSER=0 WS=6
  2   0.000314     10.0.1.2 -> 10.0.1.3     TCP glrpc > 33543 [SYN, ACK] Seq=0 Ack=1 Win=14480 Len=0 MSS=1460 TSV=4568398 TSER=4536159 WS=6
  3   0.000344     10.0.1.3 -> 10.0.1.2     TCP 33543 > glrpc [ACK] Seq=1 Ack=1 Win=5888 Len=0 TSV=4536159 TSER=4568398
306128  35.246354     10.0.1.3 -> 10.0.1.2     TCP 33543 > glrpc [FIN, ACK] Seq=180601 Ack=300690601 Win=2004608 Len=0 TSV=4544971 TSER=4576632
306129  35.246808     10.0.1.2 -> 10.0.1.3     TCP glrpc > 33543 [FIN, ACK] Seq=300690601 Ack=180602 Win=128832 Len=0 TSV=4577210 TSER=4544971
  1   0.000000     10.0.1.3 -> 10.0.1.2     TCP 33545 > glrpc [SYN] Seq=0 Win=5840 Len=0 MSS=1460 TSV=4549685 TSER=0 WS=6
  2   0.000311     10.0.1.2 -> 10.0.1.3     TCP glrpc > 33545 [SYN, ACK] Seq=0 Ack=1 Win=14480 Len=0 MSS=1460 TSV=4581925 TSER=4549685 WS=6
  3   0.000332     10.0.1.3 -> 10.0.1.2     TCP 33545 > glrpc [ACK] Seq=1 Ack=1 Win=5888 Len=0 TSV=4549685 TSER=4581925
294001  33.254438     10.0.1.3 -> 10.0.1.2     TCP 33545 > glrpc [FIN, ACK] Seq=180601 Ack=300690601 Win=2004608 Len=0 TSV=4557999 TSER=4590208
294002  33.254895     10.0.1.2 -> 10.0.1.3     TCP glrpc > 33545 [FIN, ACK] Seq=300690601 Ack=180602 Win=128832 Len=0 TSV=4590239 TSER=4557999
  1   0.000000     10.0.1.3 -> 10.0.1.2     TCP 33547 > glrpc [SYN] Seq=0 Win=5840 Len=0 MSS=1460 TSV=4563056 TSER=0 WS=6
  2   0.000317     10.0.1.2 -> 10.0.1.3     TCP glrpc > 33547 [SYN, ACK] Seq=0 Ack=1 Win=14480 Len=0 MSS=1460 TSV=4595297 TSER=4563056 WS=6
  3   0.000339     10.0.1.3 -> 10.0.1.2     TCP 33547 > glrpc [ACK] Seq=1 Ack=1 Win=5888 Len=0 TSV=4563056 TSER=4595297
305646  33.171496     10.0.1.3 -> 10.0.1.2     TCP 33547 > glrpc [FIN, ACK] Seq=180601 Ack=300690601 Win=2004608 Len=0 TSV=4571349 TSER=4603558
305647  33.171912     10.0.1.2 -> 10.0.1.3     TCP glrpc > 33547 [FIN, ACK] Seq=300690601 Ack=180602 Win=128832 Len=0 TSV=4603591 TSER=4571349
  1   0.000000     10.0.1.3 -> 10.0.1.2     TCP 55171 > glrpc [SYN] Seq=0 Win=5840 Len=0 MSS=1460 TSV=4576009 TSER=0 WS=6
  2   0.000316     10.0.1.2 -> 10.0.1.3     TCP glrpc > 55171 [SYN, ACK] Seq=0 Ack=1 Win=14480 Len=0 MSS=1460 TSV=4608252 TSER=4576009 WS=6
  3   0.000339     10.0.1.3 -> 10.0.1.2     TCP 55171 > glrpc [ACK] Seq=1 Ack=1 Win=5888 Len=0 TSV=4576009 TSER=4608252
305673  35.852360     10.0.1.3 -> 10.0.1.2     TCP 55171 > glrpc [FIN, ACK] Seq=180601 Ack=300690601 Win=1995776 Len=0 TSV=4584973 TSER=4616520
305674  35.852810     10.0.1.2 -> 10.0.1.3     TCP glrpc > 55171 [FIN, ACK] Seq=300690601 Ack=180602 Win=127680 Len=0 TSV=4617216 TSER=4584973
  1   0.000000     10.0.1.3 -> 10.0.1.2     TCP 55173 > glrpc [SYN] Seq=0 Win=5840 Len=0 MSS=1460 TSV=4589650 TSER=0 WS=6
  2   0.000284     10.0.1.2 -> 10.0.1.3     TCP glrpc > 55173 [SYN, ACK] Seq=0 Ack=1 Win=14480 Len=0 MSS=1460 TSV=4621893 TSER=4589650 WS=6
  3   0.000306     10.0.1.3 -> 10.0.1.2     TCP 55173 > glrpc [ACK] Seq=1 Ack=1 Win=5888 Len=0 TSV=4589650 TSER=4621893
305052  34.636672     10.0.1.3 -> 10.0.1.2     TCP 55173 > glrpc [FIN, ACK] Seq=180601 Ack=300690601 Win=2004608 Len=0 TSV=4598309 TSER=4630537
305053  34.637107     10.0.1.2 -> 10.0.1.3     TCP glrpc > 55173 [FIN, ACK] Seq=300690601 Ack=180602 Win=146944 Len=0 TSV=4630553 TSER=4598309
