  1   0.000000     10.0.1.3 -> 10.0.1.2     TCP 35247 > glrpc [SYN] Seq=0 Win=5840 Len=0 MSS=1460 TSV=4501496 TSER=0 WS=6
  2   0.000301     10.0.1.2 -> 10.0.1.3     TCP glrpc > 35247 [SYN, ACK] Seq=0 Ack=1 Win=14480 Len=0 MSS=1460 TSV=4555075 TSER=4501496 WS=6
  3   0.000320     10.0.1.3 -> 10.0.1.2     TCP 35247 > glrpc [ACK] Seq=1 Ack=1 Win=5888 Len=0 TSV=4501496 TSER=4555075
307914  33.069068     10.0.1.3 -> 10.0.1.2     TCP 35247 > glrpc [FIN, ACK] Seq=180601 Ack=300690601 Win=1995968 Len=0 TSV=4509763 TSER=4563331
307915  33.069499     10.0.1.2 -> 10.0.1.3     TCP glrpc > 35247 [FIN, ACK] Seq=300690601 Ack=180602 Win=128832 Len=0 TSV=4563343 TSER=4509763
================================================================================
IPv4 Conversations
Filter:<No Filter>
                                               |       <-      | |       ->      | |     Total     |
                                               | Frames  Bytes | | Frames  Bytes | | Frames  Bytes |
10.0.1.3             <-> 10.0.1.2              208552 314455040   99364   6738632  307916 321193672
================================================================================
  1   0.000000     10.0.1.3 -> 10.0.1.2     TCP 35249 > glrpc [SYN] Seq=0 Win=5840 Len=0 MSS=1460 TSV=4512815 TSER=0 WS=6
  2   0.000322     10.0.1.2 -> 10.0.1.3     TCP glrpc > 35249 [SYN, ACK] Seq=0 Ack=1 Win=14480 Len=0 MSS=1460 TSV=4566395 TSER=4512815 WS=6
  3   0.000346     10.0.1.3 -> 10.0.1.2     TCP 35249 > glrpc [ACK] Seq=1 Ack=1 Win=5888 Len=0 TSV=4512815 TSER=4566395
307659  33.041865     10.0.1.3 -> 10.0.1.2     TCP 35249 > glrpc [FIN, ACK] Seq=180601 Ack=300690601 Win=1987264 Len=0 TSV=4521075 TSER=4574627
307660  33.042272     10.0.1.2 -> 10.0.1.3     TCP glrpc > 35249 [FIN, ACK] Seq=300690601 Ack=180602 Win=130048 Len=0 TSV=4574656 TSER=4521075
================================================================================
IPv4 Conversations
Filter:<No Filter>
                                               |       <-      | |       ->      | |     Total     |
                                               | Frames  Bytes | | Frames  Bytes | | Frames  Bytes |
10.0.1.3             <-> 10.0.1.2              208547 314454710   99114   6722132  307661 321176842
================================================================================
  1   0.000000     10.0.1.3 -> 10.0.1.2     TCP 35252 > glrpc [SYN] Seq=0 Win=5840 Len=0 MSS=1460 TSV=4524138 TSER=0 WS=6
  2   0.000284     10.0.1.2 -> 10.0.1.3     TCP glrpc > 35252 [SYN, ACK] Seq=0 Ack=1 Win=14480 Len=0 MSS=1460 TSV=4577720 TSER=4524138 WS=6
  3   0.000302     10.0.1.3 -> 10.0.1.2     TCP 35252 > glrpc [ACK] Seq=1 Ack=1 Win=5888 Len=0 TSV=4524138 TSER=4577720
308074  33.179564     10.0.1.3 -> 10.0.1.2     TCP 35252 > glrpc [FIN, ACK] Seq=180601 Ack=300690601 Win=1984384 Len=0 TSV=4532433 TSER=4586000
308075  33.179997     10.0.1.2 -> 10.0.1.3     TCP glrpc > 35252 [FIN, ACK] Seq=300690601 Ack=180602 Win=130048 Len=0 TSV=4586015 TSER=4532433
================================================================================
IPv4 Conversations
Filter:<No Filter>
                                               |       <-      | |       ->      | |     Total     |
                                               | Frames  Bytes | | Frames  Bytes | | Frames  Bytes |
10.0.1.3             <-> 10.0.1.2              208550 314454908   99526   6749324  308076 321204232
================================================================================
  1   0.000000     10.0.1.3 -> 10.0.1.2     TCP 35255 > glrpc [SYN] Seq=0 Win=5840 Len=0 MSS=1460 TSV=4535481 TSER=0 WS=6
  2   0.000292     10.0.1.2 -> 10.0.1.3     TCP glrpc > 35255 [SYN, ACK] Seq=0 Ack=1 Win=14480 Len=0 MSS=1460 TSV=4589062 TSER=4535481 WS=6
  3   0.000315     10.0.1.3 -> 10.0.1.2     TCP 35255 > glrpc [ACK] Seq=1 Ack=1 Win=5888 Len=0 TSV=4535481 TSER=4589062
307707  33.027207     10.0.1.3 -> 10.0.1.2     TCP 35255 > glrpc [FIN, ACK] Seq=180601 Ack=300690601 Win=1988416 Len=0 TSV=4543737 TSER=4597289
307708  33.027615     10.0.1.2 -> 10.0.1.3     TCP glrpc > 35255 [FIN, ACK] Seq=300690601 Ack=180602 Win=130048 Len=0 TSV=4597320 TSER=4543737
================================================================================
IPv4 Conversations
Filter:<No Filter>
                                               |       <-      | |       ->      | |     Total     |
                                               | Frames  Bytes | | Frames  Bytes | | Frames  Bytes |
10.0.1.3             <-> 10.0.1.2              208547 314454710   99162   6725300  307709 321180010
================================================================================
  1   0.000000     10.0.1.3 -> 10.0.1.2     TCP 35257 > glrpc [SYN] Seq=0 Win=5840 Len=0 MSS=1460 TSV=4546817 TSER=0 WS=6
  2   0.000293     10.0.1.2 -> 10.0.1.3     TCP glrpc > 35257 [SYN, ACK] Seq=0 Ack=1 Win=14480 Len=0 MSS=1460 TSV=4600400 TSER=4546817 WS=6
  3   0.000316     10.0.1.3 -> 10.0.1.2     TCP 35257 > glrpc [ACK] Seq=1 Ack=1 Win=5888 Len=0 TSV=4546817 TSER=4600400
307819  33.049831     10.0.1.3 -> 10.0.1.2     TCP 35257 > glrpc [FIN, ACK] Seq=180601 Ack=300690601 Win=1993024 Len=0 TSV=4555080 TSER=4608646
307820  33.050210     10.0.1.2 -> 10.0.1.3     TCP glrpc > 35257 [FIN, ACK] Seq=300690601 Ack=180602 Win=130048 Len=0 TSV=4608663 TSER=4555080
================================================================================
IPv4 Conversations
Filter:<No Filter>
                                               |       <-      | |       ->      | |     Total     |
                                               | Frames  Bytes | | Frames  Bytes | | Frames  Bytes |
10.0.1.3             <-> 10.0.1.2              208551 314454974   99270   6732428  307821 321187402
================================================================================
  1   0.000000     10.0.1.3 -> 10.0.1.2     TCP 35259 > glrpc [SYN] Seq=0 Win=5840 Len=0 MSS=1460 TSV=4558106 TSER=0 WS=6
  2   0.000312     10.0.1.2 -> 10.0.1.3     TCP glrpc > 35259 [SYN, ACK] Seq=0 Ack=1 Win=14480 Len=0 MSS=1460 TSV=4611690 TSER=4558106 WS=6
  3   0.000337     10.0.1.3 -> 10.0.1.2     TCP 35259 > glrpc [ACK] Seq=1 Ack=1 Win=5888 Len=0 TSV=4558106 TSER=4611690
308060  32.937390     10.0.1.3 -> 10.0.1.2     TCP 35259 > glrpc [FIN, ACK] Seq=180601 Ack=300690601 Win=1975680 Len=0 TSV=4566340 TSER=4619910
308061  32.937803     10.0.1.2 -> 10.0.1.3     TCP glrpc > 35259 [FIN, ACK] Seq=300690601 Ack=180602 Win=130048 Len=0 TSV=4619925 TSER=4566340
================================================================================
IPv4 Conversations
Filter:<No Filter>
                                               |       <-      | |       ->      | |     Total     |
                                               | Frames  Bytes | | Frames  Bytes | | Frames  Bytes |
10.0.1.3             <-> 10.0.1.2              208555 314455238   99507   6748070  308062 321203308
================================================================================
  1   0.000000     10.0.1.3 -> 10.0.1.2     TCP 35261 > glrpc [SYN] Seq=0 Win=5840 Len=0 MSS=1460 TSV=4569406 TSER=0 WS=6
  2   0.000296     10.0.1.2 -> 10.0.1.3     TCP glrpc > 35261 [SYN, ACK] Seq=0 Ack=1 Win=14480 Len=0 MSS=1460 TSV=4622991 TSER=4569406 WS=6
  3   0.000320     10.0.1.3 -> 10.0.1.2     TCP 35261 > glrpc [ACK] Seq=1 Ack=1 Win=5888 Len=0 TSV=4569407 TSER=4622991
307909  33.037798     10.0.1.3 -> 10.0.1.2     TCP 35261 > glrpc [FIN, ACK] Seq=180601 Ack=300690601 Win=1988416 Len=0 TSV=4577666 TSER=4631241
307910  33.038531     10.0.1.2 -> 10.0.1.3     TCP glrpc > 35261 [FIN, ACK] Seq=300690601 Ack=180602 Win=128832 Len=0 TSV=4631251 TSER=4577666
================================================================================
IPv4 Conversations
Filter:<No Filter>
                                               |       <-      | |       ->      | |     Total     |
                                               | Frames  Bytes | | Frames  Bytes | | Frames  Bytes |
10.0.1.3             <-> 10.0.1.2              208546 314454644   99365   6738698  307911 321193342
================================================================================
  1   0.000000     10.0.1.3 -> 10.0.1.2     TCP 32826 > glrpc [SYN] Seq=0 Win=5840 Len=0 MSS=1460 TSV=4580727 TSER=0 WS=6
  2   0.000304     10.0.1.2 -> 10.0.1.3     TCP glrpc > 32826 [SYN, ACK] Seq=0 Ack=1 Win=14480 Len=0 MSS=1460 TSV=4634312 TSER=4580727 WS=6
  3   0.000328     10.0.1.3 -> 10.0.1.2     TCP 32826 > glrpc [ACK] Seq=1 Ack=1 Win=5888 Len=0 TSV=4580727 TSER=4634312
307992  33.036367     10.0.1.3 -> 10.0.1.2     TCP 32826 > glrpc [FIN, ACK] Seq=180601 Ack=300690601 Win=1990144 Len=0 TSV=4588986 TSER=4642541
307993  33.036815     10.0.1.2 -> 10.0.1.3     TCP glrpc > 32826 [FIN, ACK] Seq=300690601 Ack=180602 Win=128832 Len=0 TSV=4642572 TSER=4588986
================================================================================
IPv4 Conversations
Filter:<No Filter>
                                               |       <-      | |       ->      | |     Total     |
                                               | Frames  Bytes | | Frames  Bytes | | Frames  Bytes |
10.0.1.3             <-> 10.0.1.2              208549 314454842   99445   6743978  307994 321198820
================================================================================
  1   0.000000     10.0.1.3 -> 10.0.1.2     TCP 32828 > glrpc [SYN] Seq=0 Win=5840 Len=0 MSS=1460 TSV=4592015 TSER=0 WS=6
  2   0.000284     10.0.1.2 -> 10.0.1.3     TCP glrpc > 32828 [SYN, ACK] Seq=0 Ack=1 Win=14480 Len=0 MSS=1460 TSV=4645602 TSER=4592015 WS=6
  3   0.000306     10.0.1.3 -> 10.0.1.2     TCP 32828 > glrpc [ACK] Seq=1 Ack=1 Win=5888 Len=0 TSV=4592016 TSER=4645602
308419  33.114705     10.0.1.3 -> 10.0.1.2     TCP 32828 > glrpc [FIN, ACK] Seq=180601 Ack=300690601 Win=1993024 Len=0 TSV=4600294 TSER=4653852
308420  33.115162     10.0.1.2 -> 10.0.1.3     TCP glrpc > 32828 [FIN, ACK] Seq=300690601 Ack=180602 Win=128832 Len=0 TSV=4653881 TSER=4600294
================================================================================
IPv4 Conversations
Filter:<No Filter>
                                               |       <-      | |       ->      | |     Total     |
                                               | Frames  Bytes | | Frames  Bytes | | Frames  Bytes |
10.0.1.3             <-> 10.0.1.2              208555 314455238   99866   6771764  308421 321227002
================================================================================
  1   0.000000     10.0.1.3 -> 10.0.1.2     TCP 32832 > glrpc [SYN] Seq=0 Win=5840 Len=0 MSS=1460 TSV=4603355 TSER=0 WS=6
  2   0.000285     10.0.1.2 -> 10.0.1.3     TCP glrpc > 32832 [SYN, ACK] Seq=0 Ack=1 Win=14480 Len=0 MSS=1460 TSV=4656942 TSER=4603355 WS=6
  3   0.000307     10.0.1.3 -> 10.0.1.2     TCP 32832 > glrpc [ACK] Seq=1 Ack=1 Win=5888 Len=0 TSV=4603355 TSER=4656942
308033  33.074767     10.0.1.3 -> 10.0.1.2     TCP 32832 > glrpc [FIN, ACK] Seq=180601 Ack=300690601 Win=1993024 Len=0 TSV=4611624 TSER=4665181
308034  33.075218     10.0.1.2 -> 10.0.1.3     TCP glrpc > 32832 [FIN, ACK] Seq=300690601 Ack=180602 Win=130048 Len=0 TSV=4665211 TSER=4611624
================================================================================
IPv4 Conversations
Filter:<No Filter>
                                               |       <-      | |       ->      | |     Total     |
                                               | Frames  Bytes | | Frames  Bytes | | Frames  Bytes |
10.0.1.3             <-> 10.0.1.2              208553 314455106   99482   6746420  308035 321201526
================================================================================
  1   0.000000     10.0.1.3 -> 10.0.1.2     TCP 32834 > glrpc [SYN] Seq=0 Win=5840 Len=0 MSS=1460 TSV=4614662 TSER=0 WS=6
  2   0.000286     10.0.1.2 -> 10.0.1.3     TCP glrpc > 32834 [SYN, ACK] Seq=0 Ack=1 Win=14480 Len=0 MSS=1460 TSV=4668250 TSER=4614662 WS=6
  3   0.000307     10.0.1.3 -> 10.0.1.2     TCP 32834 > glrpc [ACK] Seq=1 Ack=1 Win=5888 Len=0 TSV=4614662 TSER=4668250
307651  33.606706     10.0.1.3 -> 10.0.1.2     TCP 32834 > glrpc [FIN, ACK] Seq=180601 Ack=300690601 Win=1990144 Len=0 TSV=4623063 TSER=4676508
307652  33.607117     10.0.1.2 -> 10.0.1.3     TCP glrpc > 32834 [FIN, ACK] Seq=300690601 Ack=180602 Win=128832 Len=0 TSV=4676652 TSER=4623063
================================================================================
IPv4 Conversations
Filter:<No Filter>
                                               |       <-      | |       ->      | |     Total     |
                                               | Frames  Bytes | | Frames  Bytes | | Frames  Bytes |
10.0.1.3             <-> 10.0.1.2              208548 314454776   99105   6721538  307653 321176314
================================================================================
  1   0.000000     10.0.1.3 -> 10.0.1.2     TCP 32836 > glrpc [SYN] Seq=0 Win=5840 Len=0 MSS=1460 TSV=4626116 TSER=0 WS=6
  2   0.000319     10.0.1.2 -> 10.0.1.3     TCP glrpc > 32836 [SYN, ACK] Seq=0 Ack=1 Win=14480 Len=0 MSS=1460 TSV=4679705 TSER=4626116 WS=6
  3   0.000344     10.0.1.3 -> 10.0.1.2     TCP 32836 > glrpc [ACK] Seq=1 Ack=1 Win=5888 Len=0 TSV=4626116 TSER=4679705
307600  33.042469     10.0.1.3 -> 10.0.1.2     TCP 32836 > glrpc [FIN, ACK] Seq=180601 Ack=300690601 Win=1988416 Len=0 TSV=4634377 TSER=4687951
307601  33.042917     10.0.1.2 -> 10.0.1.3     TCP glrpc > 32836 [FIN, ACK] Seq=300690601 Ack=180602 Win=128832 Len=0 TSV=4687966 TSER=4634377
================================================================================
IPv4 Conversations
Filter:<No Filter>
                                               |       <-      | |       ->      | |     Total     |
                                               | Frames  Bytes | | Frames  Bytes | | Frames  Bytes |
10.0.1.3             <-> 10.0.1.2              208559 314455502   99043   6717446  307602 321172948
================================================================================
  1   0.000000     10.0.1.3 -> 10.0.1.2     TCP 32838 > glrpc [SYN] Seq=0 Win=5840 Len=0 MSS=1460 TSV=4637436 TSER=0 WS=6
  2   0.000279     10.0.1.2 -> 10.0.1.3     TCP glrpc > 32838 [SYN, ACK] Seq=0 Ack=1 Win=14480 Len=0 MSS=1460 TSV=4691025 TSER=4637436 WS=6
  3   0.000298     10.0.1.3 -> 10.0.1.2     TCP 32838 > glrpc [ACK] Seq=1 Ack=1 Win=5888 Len=0 TSV=4637436 TSER=4691025
307918  33.087042     10.0.1.3 -> 10.0.1.2     TCP 32838 > glrpc [FIN, ACK] Seq=180601 Ack=300690601 Win=1995968 Len=0 TSV=4645708 TSER=4699268
307919  33.087465     10.0.1.2 -> 10.0.1.3     TCP glrpc > 32838 [FIN, ACK] Seq=300690601 Ack=180602 Win=128832 Len=0 TSV=4699298 TSER=4645708
================================================================================
IPv4 Conversations
Filter:<No Filter>
                                               |       <-      | |       ->      | |     Total     |
                                               | Frames  Bytes | | Frames  Bytes | | Frames  Bytes |
10.0.1.3             <-> 10.0.1.2              208547 314454710   99373   6739226  307920 321193936
================================================================================
  1   0.000000     10.0.1.3 -> 10.0.1.2     TCP 32840 > glrpc [SYN] Seq=0 Win=5840 Len=0 MSS=1460 TSV=4648734 TSER=0 WS=6
  2   0.000312     10.0.1.2 -> 10.0.1.3     TCP glrpc > 32840 [SYN, ACK] Seq=0 Ack=1 Win=14480 Len=0 MSS=1460 TSV=4702325 TSER=4648734 WS=6
  3   0.000334     10.0.1.3 -> 10.0.1.2     TCP 32840 > glrpc [ACK] Seq=1 Ack=1 Win=5888 Len=0 TSV=4648734 TSER=4702325
307218  33.890261     10.0.1.3 -> 10.0.1.2     TCP 32840 > glrpc [FIN, ACK] Seq=180601 Ack=300690601 Win=1998848 Len=0 TSV=4657207 TSER=4710770
307219  33.890712     10.0.1.2 -> 10.0.1.3     TCP glrpc > 32840 [FIN, ACK] Seq=300690601 Ack=180602 Win=130048 Len=0 TSV=4710798 TSER=4657207
================================================================================
IPv4 Conversations
Filter:<No Filter>
                                               |       <-      | |       ->      | |     Total     |
                                               | Frames  Bytes | | Frames  Bytes | | Frames  Bytes |
10.0.1.3             <-> 10.0.1.2              208555 314455238   98665   6692498  307220 321147736
================================================================================
  1   0.000000     10.0.1.3 -> 10.0.1.2     TCP 52306 > glrpc [SYN] Seq=0 Win=5840 Len=0 MSS=1460 TSV=4660242 TSER=0 WS=6
  2   0.000309     10.0.1.2 -> 10.0.1.3     TCP glrpc > 52306 [SYN, ACK] Seq=0 Ack=1 Win=14480 Len=0 MSS=1460 TSV=4713833 TSER=4660242 WS=6
  3   0.000330     10.0.1.3 -> 10.0.1.2     TCP 52306 > glrpc [ACK] Seq=1 Ack=1 Win=5888 Len=0 TSV=4660242 TSER=4713833
307901  33.055883     10.0.1.3 -> 10.0.1.2     TCP 52306 > glrpc [FIN, ACK] Seq=180601 Ack=300690601 Win=1984384 Len=0 TSV=4668506 TSER=4722087
307902  33.056316     10.0.1.2 -> 10.0.1.3     TCP glrpc > 52306 [FIN, ACK] Seq=300690601 Ack=180602 Win=130048 Len=0 TSV=4722098 TSER=4668506
================================================================================
IPv4 Conversations
Filter:<No Filter>
                                               |       <-      | |       ->      | |     Total     |
                                               | Frames  Bytes | | Frames  Bytes | | Frames  Bytes |
10.0.1.3             <-> 10.0.1.2              208544 314454512   99359   6738302  307903 321192814
================================================================================
  1   0.000000     10.0.1.3 -> 10.0.1.2     TCP 52308 > glrpc [SYN] Seq=0 Win=5840 Len=0 MSS=1460 TSV=4671553 TSER=0 WS=6
  2   0.000318     10.0.1.2 -> 10.0.1.3     TCP glrpc > 52308 [SYN, ACK] Seq=0 Ack=1 Win=14480 Len=0 MSS=1460 TSV=4725145 TSER=4671553 WS=6
  3   0.000342     10.0.1.3 -> 10.0.1.2     TCP 52308 > glrpc [ACK] Seq=1 Ack=1 Win=5888 Len=0 TSV=4671553 TSER=4725145
308157  33.120547     10.0.1.3 -> 10.0.1.2     TCP 52308 > glrpc [FIN, ACK] Seq=180601 Ack=300690601 Win=1990144 Len=0 TSV=4679833 TSER=4733414
308158  33.120956     10.0.1.2 -> 10.0.1.3     TCP glrpc > 52308 [FIN, ACK] Seq=300690601 Ack=180602 Win=130048 Len=0 TSV=4733426 TSER=4679833
================================================================================
IPv4 Conversations
Filter:<No Filter>
                                               |       <-      | |       ->      | |     Total     |
                                               | Frames  Bytes | | Frames  Bytes | | Frames  Bytes |
10.0.1.3             <-> 10.0.1.2              208553 314455106   99606   6754604  308159 321209710
================================================================================
  1   0.000000     10.0.1.3 -> 10.0.1.2     TCP 52312 > glrpc [SYN] Seq=0 Win=5840 Len=0 MSS=1460 TSV=4682873 TSER=0 WS=6
  2   0.000304     10.0.1.2 -> 10.0.1.3     TCP glrpc > 52312 [SYN, ACK] Seq=0 Ack=1 Win=14480 Len=0 MSS=1460 TSV=4736466 TSER=4682873 WS=6
  3   0.000332     10.0.1.3 -> 10.0.1.2     TCP 52312 > glrpc [ACK] Seq=1 Ack=1 Win=5888 Len=0 TSV=4682873 TSER=4736466
308215  33.075779     10.0.1.3 -> 10.0.1.2     TCP 52312 > glrpc [FIN, ACK] Seq=180601 Ack=300690601 Win=1990144 Len=0 TSV=4691142 TSER=4744708
308216  33.076229     10.0.1.2 -> 10.0.1.3     TCP glrpc > 52312 [FIN, ACK] Seq=300690601 Ack=180602 Win=130048 Len=0 TSV=4744736 TSER=4691142
================================================================================
IPv4 Conversations
Filter:<No Filter>
                                               |       <-      | |       ->      | |     Total     |
                                               | Frames  Bytes | | Frames  Bytes | | Frames  Bytes |
10.0.1.3             <-> 10.0.1.2              208554 314455172   99663   6758366  308217 321213538
================================================================================
  1   0.000000     10.0.1.3 -> 10.0.1.2     TCP 52314 > glrpc [SYN] Seq=0 Win=5840 Len=0 MSS=1460 TSV=4694206 TSER=0 WS=6
  2   0.000274     10.0.1.2 -> 10.0.1.3     TCP glrpc > 52314 [SYN, ACK] Seq=0 Ack=1 Win=14480 Len=0 MSS=1460 TSV=4747801 TSER=4694206 WS=6
  3   0.000298     10.0.1.3 -> 10.0.1.2     TCP 52314 > glrpc [ACK] Seq=1 Ack=1 Win=5888 Len=0 TSV=4694207 TSER=4747801
308257  33.161613     10.0.1.3 -> 10.0.1.2     TCP 52314 > glrpc [FIN, ACK] Seq=180601 Ack=300690601 Win=1968704 Len=0 TSV=4702497 TSER=4756073
308258  33.162041     10.0.1.2 -> 10.0.1.3     TCP glrpc > 52314 [FIN, ACK] Seq=300690601 Ack=180602 Win=128832 Len=0 TSV=4756092 TSER=4702497
================================================================================
IPv4 Conversations
Filter:<No Filter>
                                               |       <-      | |       ->      | |     Total     |
                                               | Frames  Bytes | | Frames  Bytes | | Frames  Bytes |
10.0.1.3             <-> 10.0.1.2              208542 314454380   99717   6761930  308259 321216310
================================================================================
  1   0.000000     10.0.1.3 -> 10.0.1.2     TCP 52316 > glrpc [SYN] Seq=0 Win=5840 Len=0 MSS=1460 TSV=4705535 TSER=0 WS=6
  2   0.000302     10.0.1.2 -> 10.0.1.3     TCP glrpc > 52316 [SYN, ACK] Seq=0 Ack=1 Win=14480 Len=0 MSS=1460 TSV=4759130 TSER=4705535 WS=6
  3   0.000322     10.0.1.3 -> 10.0.1.2     TCP 52316 > glrpc [ACK] Seq=1 Ack=1 Win=5888 Len=0 TSV=4705535 TSER=4759130
307602  33.168203     10.0.1.3 -> 10.0.1.2     TCP 52316 > glrpc [FIN, ACK] Seq=180601 Ack=300690601 Win=1989952 Len=0 TSV=4713827 TSER=4767413
307603  33.168881     10.0.1.2 -> 10.0.1.3     TCP glrpc > 52316 [FIN, ACK] Seq=300690601 Ack=180602 Win=130048 Len=0 TSV=4767422 TSER=4713827
================================================================================
IPv4 Conversations
Filter:<No Filter>
                                               |       <-      | |       ->      | |     Total     |
                                               | Frames  Bytes | | Frames  Bytes | | Frames  Bytes |
10.0.1.3             <-> 10.0.1.2              208555 314455238   99049   6717842  307604 321173080
================================================================================
  1   0.000000     10.0.1.3 -> 10.0.1.2     TCP 52318 > glrpc [SYN] Seq=0 Win=5840 Len=0 MSS=1460 TSV=4716870 TSER=0 WS=6
  2   0.000295     10.0.1.2 -> 10.0.1.3     TCP glrpc > 52318 [SYN, ACK] Seq=0 Ack=1 Win=14480 Len=0 MSS=1460 TSV=4770466 TSER=4716870 WS=6
  3   0.000318     10.0.1.3 -> 10.0.1.2     TCP 52318 > glrpc [ACK] Seq=1 Ack=1 Win=5888 Len=0 TSV=4716870 TSER=4770466
307613  33.120046     10.0.1.3 -> 10.0.1.2     TCP 52318 > glrpc [FIN, ACK] Seq=180601 Ack=300690601 Win=1880320 Len=0 TSV=4725150 TSER=4778716
307614  33.120460     10.0.1.2 -> 10.0.1.3     TCP glrpc > 52318 [FIN, ACK] Seq=300690601 Ack=180602 Win=128832 Len=0 TSV=4778746 TSER=4725150
================================================================================
IPv4 Conversations
Filter:<No Filter>
                                               |       <-      | |       ->      | |     Total     |
                                               | Frames  Bytes | | Frames  Bytes | | Frames  Bytes |
10.0.1.3             <-> 10.0.1.2              208546 314454644   99069   6719162  307615 321173806
================================================================================
