  1   0.000000     10.0.1.3 -> 10.0.1.2     TCP 53466 > glrpc [SYN] Seq=0 Win=5840 Len=0 MSS=1460 TSV=4728210 TSER=0 WS=6
  2   0.000308     10.0.1.2 -> 10.0.1.3     TCP glrpc > 53466 [SYN, ACK] Seq=0 Ack=1 Win=14480 Len=0 MSS=1460 TSV=4781806 TSER=4728210 WS=6
  3   0.000333     10.0.1.3 -> 10.0.1.2     TCP 53466 > glrpc [ACK] Seq=1 Ack=1 Win=5888 Len=0 TSV=4728210 TSER=4781806
359250  38.634927     10.0.1.3 -> 10.0.1.2     TCP 53466 > glrpc [FIN, ACK] Seq=210701 Ack=350805701 Win=1990144 Len=0 TSV=4737869 TSER=4791450
359251  38.635375     10.0.1.2 -> 10.0.1.3     TCP glrpc > 53466 [FIN, ACK] Seq=350805701 Ack=210702 Win=130048 Len=0 TSV=4791466 TSER=4737869
================================================================================
IPv4 Conversations
Filter:<No Filter>
                                               |       <-      | |       ->      | |     Total     |
                                               | Frames  Bytes | | Frames  Bytes | | Frames  Bytes |
10.0.1.3             <-> 10.0.1.2              243307 366863970  115945   7863078  359252 374727048
================================================================================
  1   0.000000     10.0.1.3 -> 10.0.1.2     TCP 53468 > glrpc [SYN] Seq=0 Win=5840 Len=0 MSS=1460 TSV=4741266 TSER=0 WS=6
  2   0.000298     10.0.1.2 -> 10.0.1.3     TCP glrpc > 53468 [SYN, ACK] Seq=0 Ack=1 Win=14480 Len=0 MSS=1460 TSV=4794863 TSER=4741266 WS=6
  3   0.000323     10.0.1.3 -> 10.0.1.2     TCP 53468 > glrpc [ACK] Seq=1 Ack=1 Win=5888 Len=0 TSV=4741266 TSER=4794863
359261  38.640011     10.0.1.3 -> 10.0.1.2     TCP 53468 > glrpc [FIN, ACK] Seq=210701 Ack=350805701 Win=1988416 Len=0 TSV=4750925 TSER=4804494
359262  38.640448     10.0.1.2 -> 10.0.1.3     TCP glrpc > 53468 [FIN, ACK] Seq=350805701 Ack=210702 Win=130048 Len=0 TSV=4804524 TSER=4750925
================================================================================
IPv4 Conversations
Filter:<No Filter>
                                               |       <-      | |       ->      | |     Total     |
                                               | Frames  Bytes | | Frames  Bytes | | Frames  Bytes |
10.0.1.3             <-> 10.0.1.2              243315 366864498  115948   7863276  359263 374727774
================================================================================
  1   0.000000     10.0.1.3 -> 10.0.1.2     TCP 53472 > glrpc [SYN] Seq=0 Win=5840 Len=0 MSS=1460 TSV=4754300 TSER=0 WS=6
  2   0.000304     10.0.1.2 -> 10.0.1.3     TCP glrpc > 53472 [SYN, ACK] Seq=0 Ack=1 Win=14480 Len=0 MSS=1460 TSV=4807898 TSER=4754300 WS=6
  3   0.000324     10.0.1.3 -> 10.0.1.2     TCP 53472 > glrpc [ACK] Seq=1 Ack=1 Win=5888 Len=0 TSV=4754300 TSER=4807898
359676  38.610794     10.0.1.3 -> 10.0.1.2     TCP 53472 > glrpc [FIN, ACK] Seq=210701 Ack=350805701 Win=1991296 Len=0 TSV=4763952 TSER=4817523
359677  38.611211     10.0.1.2 -> 10.0.1.3     TCP glrpc > 53472 [FIN, ACK] Seq=350805701 Ack=210702 Win=130048 Len=0 TSV=4817552 TSER=4763952
================================================================================
IPv4 Conversations
Filter:<No Filter>
                                               |       <-      | |       ->      | |     Total     |
                                               | Frames  Bytes | | Frames  Bytes | | Frames  Bytes |
10.0.1.3             <-> 10.0.1.2              243301 366863574  116377   7891590  359678 374755164
================================================================================
  1   0.000000     10.0.1.3 -> 10.0.1.2     TCP 53474 > glrpc [SYN] Seq=0 Win=5840 Len=0 MSS=1460 TSV=4767344 TSER=0 WS=6
  2   0.000318     10.0.1.2 -> 10.0.1.3     TCP glrpc > 53474 [SYN, ACK] Seq=0 Ack=1 Win=14480 Len=0 MSS=1460 TSV=4820943 TSER=4767344 WS=6
  3   0.000341     10.0.1.3 -> 10.0.1.2     TCP 53474 > glrpc [ACK] Seq=1 Ack=1 Win=5888 Len=0 TSV=4767344 TSER=4820943
358956  38.309342     10.0.1.3 -> 10.0.1.2     TCP 53474 > glrpc [FIN, ACK] Seq=210701 Ack=350805701 Win=1990144 Len=0 TSV=4776921 TSER=4830507
358957  38.309718     10.0.1.2 -> 10.0.1.3     TCP glrpc > 53474 [FIN, ACK] Seq=350805701 Ack=210702 Win=130048 Len=0 TSV=4830521 TSER=4776921
================================================================================
IPv4 Conversations
Filter:<No Filter>
                                               |       <-      | |       ->      | |     Total     |
                                               | Frames  Bytes | | Frames  Bytes | | Frames  Bytes |
10.0.1.3             <-> 10.0.1.2              243317 366864630  115641   7843014  358958 374707644
================================================================================
  1   0.000000     10.0.1.3 -> 10.0.1.2     TCP 53476 > glrpc [SYN] Seq=0 Win=5840 Len=0 MSS=1460 TSV=4780328 TSER=0 WS=6
  2   0.000337     10.0.1.2 -> 10.0.1.3     TCP glrpc > 53476 [SYN, ACK] Seq=0 Ack=1 Win=14480 Len=0 MSS=1460 TSV=4833929 TSER=4780328 WS=6
  3   0.000359     10.0.1.3 -> 10.0.1.2     TCP 53476 > glrpc [ACK] Seq=1 Ack=1 Win=5888 Len=0 TSV=4780328 TSER=4833929
359471  38.403952     10.0.1.3 -> 10.0.1.2     TCP 53476 > glrpc [FIN, ACK] Seq=210701 Ack=350805701 Win=1990144 Len=0 TSV=4789929 TSER=4843503
359472  38.404325     10.0.1.2 -> 10.0.1.3     TCP glrpc > 53476 [FIN, ACK] Seq=350805701 Ack=210702 Win=130048 Len=0 TSV=4843531 TSER=4789929
================================================================================
IPv4 Conversations
Filter:<No Filter>
                                               |       <-      | |       ->      | |     Total     |
                                               | Frames  Bytes | | Frames  Bytes | | Frames  Bytes |
10.0.1.3             <-> 10.0.1.2              243308 366864036  116165   7877598  359473 374741634
================================================================================
  1   0.000000     10.0.1.3 -> 10.0.1.2     TCP 53479 > glrpc [SYN] Seq=0 Win=5840 Len=0 MSS=1460 TSV=4793338 TSER=0 WS=6
  2   0.000297     10.0.1.2 -> 10.0.1.3     TCP glrpc > 53479 [SYN, ACK] Seq=0 Ack=1 Win=14480 Len=0 MSS=1460 TSV=4846940 TSER=4793338 WS=6
  3   0.000319     10.0.1.3 -> 10.0.1.2     TCP 53479 > glrpc [ACK] Seq=1 Ack=1 Win=5888 Len=0 TSV=4793339 TSER=4846940
359199  38.273904     10.0.1.3 -> 10.0.1.2     TCP 53479 > glrpc [FIN, ACK] Seq=210701 Ack=350805701 Win=1991296 Len=0 TSV=4802907 TSER=4856481
359200  38.274291     10.0.1.2 -> 10.0.1.3     TCP glrpc > 53479 [FIN, ACK] Seq=350805701 Ack=210702 Win=130048 Len=0 TSV=4856509 TSER=4802907
================================================================================
IPv4 Conversations
Filter:<No Filter>
                                               |       <-      | |       ->      | |     Total     |
                                               | Frames  Bytes | | Frames  Bytes | | Frames  Bytes |
10.0.1.3             <-> 10.0.1.2              243313 366864366  115888   7859316  359201 374723682
================================================================================
  1   0.000000     10.0.1.3 -> 10.0.1.2     TCP 52707 > glrpc [SYN] Seq=0 Win=5840 Len=0 MSS=1460 TSV=4806266 TSER=0 WS=6
  2   0.000320     10.0.1.2 -> 10.0.1.3     TCP glrpc > 52707 [SYN, ACK] Seq=0 Ack=1 Win=14480 Len=0 MSS=1460 TSV=4859869 TSER=4806266 WS=6
  3   0.000346     10.0.1.3 -> 10.0.1.2     TCP 52707 > glrpc [ACK] Seq=1 Ack=1 Win=5888 Len=0 TSV=4806266 TSER=4859869
359396  38.846637     10.0.1.3 -> 10.0.1.2     TCP 52707 > glrpc [FIN, ACK] Seq=210701 Ack=350805701 Win=1988416 Len=0 TSV=4815978 TSER=4869550
359397  38.847001     10.0.1.2 -> 10.0.1.3     TCP glrpc > 52707 [FIN, ACK] Seq=350805701 Ack=210702 Win=130048 Len=0 TSV=4869581 TSER=4815978
================================================================================
IPv4 Conversations
Filter:<No Filter>
                                               |       <-      | |       ->      | |     Total     |
                                               | Frames  Bytes | | Frames  Bytes | | Frames  Bytes |
10.0.1.3             <-> 10.0.1.2              243306 366863904  116092   7872780  359398 374736684
================================================================================
  1   0.000000     10.0.1.3 -> 10.0.1.2     TCP 52709 > glrpc [SYN] Seq=0 Win=5840 Len=0 MSS=1460 TSV=4819342 TSER=0 WS=6
  2   0.000317     10.0.1.2 -> 10.0.1.3     TCP glrpc > 52709 [SYN, ACK] Seq=0 Ack=1 Win=14480 Len=0 MSS=1460 TSV=4872945 TSER=4819342 WS=6
  3   0.000337     10.0.1.3 -> 10.0.1.2     TCP 52709 > glrpc [ACK] Seq=1 Ack=1 Win=5888 Len=0 TSV=4819342 TSER=4872945
359371  38.255444     10.0.1.3 -> 10.0.1.2     TCP 52709 > glrpc [FIN, ACK] Seq=210701 Ack=350805701 Win=1988416 Len=0 TSV=4828906 TSER=4882498
359372  38.255842     10.0.1.2 -> 10.0.1.3     TCP glrpc > 52709 [FIN, ACK] Seq=350805701 Ack=210702 Win=130048 Len=0 TSV=4882510 TSER=4828906
================================================================================
IPv4 Conversations
Filter:<No Filter>
                                               |       <-      | |       ->      | |     Total     |
                                               | Frames  Bytes | | Frames  Bytes | | Frames  Bytes |
10.0.1.3             <-> 10.0.1.2              243306 366863904  116067   7871130  359373 374735034
================================================================================
  1   0.000000     10.0.1.3 -> 10.0.1.2     TCP 52713 > glrpc [SYN] Seq=0 Win=5840 Len=0 MSS=1460 TSV=4832273 TSER=0 WS=6
  2   0.000308     10.0.1.2 -> 10.0.1.3     TCP glrpc > 52713 [SYN, ACK] Seq=0 Ack=1 Win=14480 Len=0 MSS=1460 TSV=4885877 TSER=4832273 WS=6
  3   0.000335     10.0.1.3 -> 10.0.1.2     TCP 52713 > glrpc [ACK] Seq=1 Ack=1 Win=5888 Len=0 TSV=4832273 TSER=4885877
359402  38.305703     10.0.1.3 -> 10.0.1.2     TCP 52713 > glrpc [FIN, ACK] Seq=210701 Ack=350805701 Win=1987264 Len=0 TSV=4841849 TSER=4895436
359403  38.306089     10.0.1.2 -> 10.0.1.3     TCP glrpc > 52713 [FIN, ACK] Seq=350805701 Ack=210702 Win=130048 Len=0 TSV=4895454 TSER=4841849
================================================================================
IPv4 Conversations
Filter:<No Filter>
                                               |       <-      | |       ->      | |     Total     |
                                               | Frames  Bytes | | Frames  Bytes | | Frames  Bytes |
10.0.1.3             <-> 10.0.1.2              243310 366864168  116094   7872912  359404 374737080
================================================================================
  1   0.000000     10.0.1.3 -> 10.0.1.2     TCP 52715 > glrpc [SYN] Seq=0 Win=5840 Len=0 MSS=1460 TSV=4845224 TSER=0 WS=6
  2   0.000309     10.0.1.2 -> 10.0.1.3     TCP glrpc > 52715 [SYN, ACK] Seq=0 Ack=1 Win=14480 Len=0 MSS=1460 TSV=4898830 TSER=4845224 WS=6
  3   0.000332     10.0.1.3 -> 10.0.1.2     TCP 52715 > glrpc [ACK] Seq=1 Ack=1 Win=5888 Len=0 TSV=4845224 TSER=4898830
359041  38.304028     10.0.1.3 -> 10.0.1.2     TCP 52715 > glrpc [FIN, ACK] Seq=210701 Ack=350805701 Win=1895360 Len=0 TSV=4854800 TSER=4908388
359042  38.304451     10.0.1.2 -> 10.0.1.3     TCP glrpc > 52715 [FIN, ACK] Seq=350805701 Ack=210702 Win=130048 Len=0 TSV=4908406 TSER=4854800
================================================================================
IPv4 Conversations
Filter:<No Filter>
                                               |       <-      | |       ->      | |     Total     |
                                               | Frames  Bytes | | Frames  Bytes | | Frames  Bytes |
10.0.1.3             <-> 10.0.1.2              243298 366863376  115745   7849878  359043 374713254
================================================================================
  1   0.000000     10.0.1.3 -> 10.0.1.2     TCP 52717 > glrpc [SYN] Seq=0 Win=5840 Len=0 MSS=1460 TSV=4858181 TSER=0 WS=6
  2   0.000296     10.0.1.2 -> 10.0.1.3     TCP glrpc > 52717 [SYN, ACK] Seq=0 Ack=1 Win=14480 Len=0 MSS=1460 TSV=4911787 TSER=4858181 WS=6
  3   0.000317     10.0.1.3 -> 10.0.1.2     TCP 52717 > glrpc [ACK] Seq=1 Ack=1 Win=5888 Len=0 TSV=4858181 TSER=4911787
359278  38.317963     10.0.1.3 -> 10.0.1.2     TCP 52717 > glrpc [FIN, ACK] Seq=210701 Ack=350805701 Win=1988416 Len=0 TSV=4867760 TSER=4921353
359279  38.318359     10.0.1.2 -> 10.0.1.3     TCP glrpc > 52717 [FIN, ACK] Seq=350805701 Ack=210702 Win=128832 Len=0 TSV=4921367 TSER=4867760
================================================================================
IPv4 Conversations
Filter:<No Filter>
                                               |       <-      | |       ->      | |     Total     |
                                               | Frames  Bytes | | Frames  Bytes | | Frames  Bytes |
10.0.1.3             <-> 10.0.1.2              243313 366864366  115967   7864530  359280 374728896
================================================================================
  1   0.000000     10.0.1.3 -> 10.0.1.2     TCP 52719 > glrpc [SYN] Seq=0 Win=5840 Len=0 MSS=1460 TSV=4871134 TSER=0 WS=6
  2   0.000290     10.0.1.2 -> 10.0.1.3     TCP glrpc > 52719 [SYN, ACK] Seq=0 Ack=1 Win=14480 Len=0 MSS=1460 TSV=4924742 TSER=4871134 WS=6
  3   0.000320     10.0.1.3 -> 10.0.1.2     TCP 52719 > glrpc [ACK] Seq=1 Ack=1 Win=5888 Len=0 TSV=4871134 TSER=4924742
359284  38.313895     10.0.1.3 -> 10.0.1.2     TCP 52719 > glrpc [FIN, ACK] Seq=210701 Ack=350805701 Win=1993024 Len=0 TSV=4880713 TSER=4934291
359285  38.314291     10.0.1.2 -> 10.0.1.3     TCP glrpc > 52719 [FIN, ACK] Seq=350805701 Ack=210702 Win=130048 Len=0 TSV=4934321 TSER=4880713
================================================================================
IPv4 Conversations
Filter:<No Filter>
                                               |       <-      | |       ->      | |     Total     |
                                               | Frames  Bytes | | Frames  Bytes | | Frames  Bytes |
10.0.1.3             <-> 10.0.1.2              243310 366864168  115976   7865124  359286 374729292
================================================================================
  1   0.000000     10.0.1.3 -> 10.0.1.2     TCP 45767 > glrpc [SYN] Seq=0 Win=5840 Len=0 MSS=1460 TSV=4884061 TSER=0 WS=6
  2   0.000301     10.0.1.2 -> 10.0.1.3     TCP glrpc > 45767 [SYN, ACK] Seq=0 Ack=1 Win=14480 Len=0 MSS=1460 TSV=4937670 TSER=4884061 WS=6
  3   0.000323     10.0.1.3 -> 10.0.1.2     TCP 45767 > glrpc [ACK] Seq=1 Ack=1 Win=5888 Len=0 TSV=4884061 TSER=4937670
359355  38.307757     10.0.1.3 -> 10.0.1.2     TCP 45767 > glrpc [FIN, ACK] Seq=210701 Ack=350805701 Win=1989952 Len=0 TSV=4893638 TSER=4947219
359356  38.308154     10.0.1.2 -> 10.0.1.3     TCP glrpc > 45767 [FIN, ACK] Seq=350805701 Ack=210702 Win=130048 Len=0 TSV=4947247 TSER=4893638
================================================================================
IPv4 Conversations
Filter:<No Filter>
                                               |       <-      | |       ->      | |     Total     |
                                               | Frames  Bytes | | Frames  Bytes | | Frames  Bytes |
10.0.1.3             <-> 10.0.1.2              243304 366863772  116053   7870206  359357 374733978
================================================================================
  1   0.000000     10.0.1.3 -> 10.0.1.2     TCP 45771 > glrpc [SYN] Seq=0 Win=5840 Len=0 MSS=1460 TSV=4897064 TSER=0 WS=6
  2   0.000361     10.0.1.2 -> 10.0.1.3     TCP glrpc > 45771 [SYN, ACK] Seq=0 Ack=1 Win=14480 Len=0 MSS=1460 TSV=4950674 TSER=4897064 WS=6
  3   0.000384     10.0.1.3 -> 10.0.1.2     TCP 45771 > glrpc [ACK] Seq=1 Ack=1 Win=5888 Len=0 TSV=4897064 TSER=4950674
359579  38.379292     10.0.1.3 -> 10.0.1.2     TCP 45771 > glrpc [FIN, ACK] Seq=210701 Ack=350805701 Win=1993024 Len=0 TSV=4906659 TSER=4960238
359580  38.379680     10.0.1.2 -> 10.0.1.3     TCP glrpc > 45771 [FIN, ACK] Seq=350805701 Ack=210702 Win=130048 Len=0 TSV=4960269 TSER=4906659
================================================================================
IPv4 Conversations
Filter:<No Filter>
                                               |       <-      | |       ->      | |     Total     |
                                               | Frames  Bytes | | Frames  Bytes | | Frames  Bytes |
10.0.1.3             <-> 10.0.1.2              243304 366863772  116277   7884990  359581 374748762
================================================================================
  1   0.000000     10.0.1.3 -> 10.0.1.2     TCP 45775 > glrpc [SYN] Seq=0 Win=5840 Len=0 MSS=1460 TSV=4910056 TSER=0 WS=6
  2   0.000275     10.0.1.2 -> 10.0.1.3     TCP glrpc > 45775 [SYN, ACK] Seq=0 Ack=1 Win=14480 Len=0 MSS=1460 TSV=4963666 TSER=4910056 WS=6
  3   0.000298     10.0.1.3 -> 10.0.1.2     TCP 45775 > glrpc [ACK] Seq=1 Ack=1 Win=5888 Len=0 TSV=4910056 TSER=4963666
359236  38.531589     10.0.1.3 -> 10.0.1.2     TCP 45775 > glrpc [FIN, ACK] Seq=210701 Ack=350805701 Win=2004480 Len=0 TSV=4919688 TSER=4973269
359237  38.532022     10.0.1.2 -> 10.0.1.3     TCP glrpc > 45775 [FIN, ACK] Seq=350805701 Ack=210702 Win=130048 Len=0 TSV=4973299 TSER=4919688
================================================================================
IPv4 Conversations
Filter:<No Filter>
                                               |       <-      | |       ->      | |     Total     |
                                               | Frames  Bytes | | Frames  Bytes | | Frames  Bytes |
10.0.1.3             <-> 10.0.1.2              243307 366863970  115931   7862154  359238 374726124
================================================================================
  1   0.000000     10.0.1.3 -> 10.0.1.2     TCP 45777 > glrpc [SYN] Seq=0 Win=5840 Len=0 MSS=1460 TSV=4923064 TSER=0 WS=6
  2   0.000277     10.0.1.2 -> 10.0.1.3     TCP glrpc > 45777 [SYN, ACK] Seq=0 Ack=1 Win=14480 Len=0 MSS=1460 TSV=4976675 TSER=4923064 WS=6
  3   0.000298     10.0.1.3 -> 10.0.1.2     TCP 45777 > glrpc [ACK] Seq=1 Ack=1 Win=5888 Len=0 TSV=4923064 TSER=4976675
359309  38.364405     10.0.1.3 -> 10.0.1.2     TCP 45777 > glrpc [FIN, ACK] Seq=210701 Ack=350805701 Win=1998848 Len=0 TSV=4932655 TSER=4986237
359310  38.364783     10.0.1.2 -> 10.0.1.3     TCP glrpc > 45777 [FIN, ACK] Seq=350805701 Ack=210702 Win=130048 Len=0 TSV=4986267 TSER=4932655
================================================================================
IPv4 Conversations
Filter:<No Filter>
                                               |       <-      | |       ->      | |     Total     |
                                               | Frames  Bytes | | Frames  Bytes | | Frames  Bytes |
10.0.1.3             <-> 10.0.1.2              243319 366864762  115992   7866180  359311 374730942
================================================================================
  1   0.000000     10.0.1.3 -> 10.0.1.2     TCP 45779 > glrpc [SYN] Seq=0 Win=5840 Len=0 MSS=1460 TSV=4936036 TSER=0 WS=6
  2   0.000289     10.0.1.2 -> 10.0.1.3     TCP glrpc > 45779 [SYN, ACK] Seq=0 Ack=1 Win=14480 Len=0 MSS=1460 TSV=4989649 TSER=4936036 WS=6
  3   0.000310     10.0.1.3 -> 10.0.1.2     TCP 45779 > glrpc [ACK] Seq=1 Ack=1 Win=5888 Len=0 TSV=4936036 TSER=4989649
359534  38.719086     10.0.1.3 -> 10.0.1.2     TCP 45779 > glrpc [FIN, ACK] Seq=210701 Ack=350805701 Win=2004480 Len=0 TSV=4945716 TSER=4999233
359535  38.719476     10.0.1.2 -> 10.0.1.3     TCP glrpc > 45779 [FIN, ACK] Seq=350805701 Ack=210702 Win=131264 Len=0 TSV=4999329 TSER=4945716
================================================================================
IPv4 Conversations
Filter:<No Filter>
                                               |       <-      | |       ->      | |     Total     |
                                               | Frames  Bytes | | Frames  Bytes | | Frames  Bytes |
10.0.1.3             <-> 10.0.1.2              243315 366864498  116221   7881294  359536 374745792
================================================================================
  1   0.000000     10.0.1.3 -> 10.0.1.2     TCP 45781 > glrpc [SYN] Seq=0 Win=5840 Len=0 MSS=1460 TSV=4949075 TSER=0 WS=6
  2   0.000318     10.0.1.2 -> 10.0.1.3     TCP glrpc > 45781 [SYN, ACK] Seq=0 Ack=1 Win=14480 Len=0 MSS=1460 TSV=5002689 TSER=4949075 WS=6
  3   0.000340     10.0.1.3 -> 10.0.1.2     TCP 45781 > glrpc [ACK] Seq=1 Ack=1 Win=5888 Len=0 TSV=4949075 TSER=5002689
359116  38.273052     10.0.1.3 -> 10.0.1.2     TCP 45781 > glrpc [FIN, ACK] Seq=210701 Ack=350805701 Win=2004608 Len=0 TSV=4958644 TSER=5012228
359117  38.273470     10.0.1.2 -> 10.0.1.3     TCP glrpc > 45781 [FIN, ACK] Seq=350805701 Ack=210702 Win=130048 Len=0 TSV=5012258 TSER=4958644
================================================================================
IPv4 Conversations
Filter:<No Filter>
                                               |       <-      | |       ->      | |     Total     |
                                               | Frames  Bytes | | Frames  Bytes | | Frames  Bytes |
10.0.1.3             <-> 10.0.1.2              243304 366863772  115814   7854432  359118 374718204
================================================================================
  1   0.000000     10.0.1.3 -> 10.0.1.2     TCP 35753 > glrpc [SYN] Seq=0 Win=5840 Len=0 MSS=1460 TSV=4961999 TSER=0 WS=6
  2   0.000285     10.0.1.2 -> 10.0.1.3     TCP glrpc > 35753 [SYN, ACK] Seq=0 Ack=1 Win=14480 Len=0 MSS=1460 TSV=5015613 TSER=4961999 WS=6
  3   0.000307     10.0.1.3 -> 10.0.1.2     TCP 35753 > glrpc [ACK] Seq=1 Ack=1 Win=5888 Len=0 TSV=4961999 TSER=5015613
359693  38.436765     10.0.1.3 -> 10.0.1.2     TCP 35753 > glrpc [FIN, ACK] Seq=210701 Ack=350805701 Win=1998848 Len=0 TSV=4971608 TSER=5025192
359694  38.437190     10.0.1.2 -> 10.0.1.3     TCP glrpc > 35753 [FIN, ACK] Seq=350805701 Ack=210702 Win=130048 Len=0 TSV=5025223 TSER=4971608
================================================================================
IPv4 Conversations
Filter:<No Filter>
                                               |       <-      | |       ->      | |     Total     |
                                               | Frames  Bytes | | Frames  Bytes | | Frames  Bytes |
10.0.1.3             <-> 10.0.1.2              243298 366863376  116397   7892910  359695 374756286
================================================================================
  1   0.000000     10.0.1.3 -> 10.0.1.2     TCP 35757 > glrpc [SYN] Seq=0 Win=5840 Len=0 MSS=1460 TSV=4974998 TSER=0 WS=6
  2   0.000292     10.0.1.2 -> 10.0.1.3     TCP glrpc > 35757 [SYN, ACK] Seq=0 Ack=1 Win=14480 Len=0 MSS=1460 TSV=5028613 TSER=4974998 WS=6
  3   0.000313     10.0.1.3 -> 10.0.1.2     TCP 35757 > glrpc [ACK] Seq=1 Ack=1 Win=5888 Len=0 TSV=4974998 TSER=5028613
359249  38.361833     10.0.1.3 -> 10.0.1.2     TCP 35757 > glrpc [FIN, ACK] Seq=210701 Ack=350805701 Win=1993024 Len=0 TSV=4984588 TSER=5038175
359250  38.362250     10.0.1.2 -> 10.0.1.3     TCP glrpc > 35757 [FIN, ACK] Seq=350805701 Ack=210702 Win=130048 Len=0 TSV=5038204 TSER=4984588
================================================================================
IPv4 Conversations
Filter:<No Filter>
                                               |       <-      | |       ->      | |     Total     |
                                               | Frames  Bytes | | Frames  Bytes | | Frames  Bytes |
10.0.1.3             <-> 10.0.1.2              243298 366863376  115953   7863606  359251 374726982
================================================================================
