  1   0.000000     10.0.1.3 -> 10.0.1.2     TCP 41093 > glrpc [SYN] Seq=0 Win=5840 Len=0 MSS=1460 TSV=4897679 TSER=0 WS=6
  2   0.000294     10.0.1.2 -> 10.0.1.3     TCP glrpc > 41093 [SYN, ACK] Seq=0 Ack=1 Win=14480 Len=0 MSS=1460 TSV=4929945 TSER=4897679 WS=6
  3   0.000313     10.0.1.3 -> 10.0.1.2     TCP 41093 > glrpc [ACK] Seq=1 Ack=1 Win=5888 Len=0 TSV=4897679 TSER=4929945
392583  45.366922     10.0.1.3 -> 10.0.1.2     TCP 41093 > glrpc [FIN, ACK] Seq=240801 Ack=400920801 Win=2004608 Len=0 TSV=4909021 TSER=4941034
392584  45.367386     10.0.1.2 -> 10.0.1.3     TCP glrpc > 41093 [FIN, ACK] Seq=400920801 Ack=240802 Win=131264 Len=0 TSV=4941288 TSER=4909021
  1   0.000000     10.0.1.3 -> 10.0.1.2     TCP 41095 > glrpc [SYN] Seq=0 Win=5840 Len=0 MSS=1460 TSV=4914482 TSER=0 WS=6
  2   0.000335     10.0.1.2 -> 10.0.1.3     TCP glrpc > 41095 [SYN, ACK] Seq=0 Ack=1 Win=14480 Len=0 MSS=1460 TSV=4946749 TSER=4914482 WS=6
  3   0.000359     10.0.1.3 -> 10.0.1.2     TCP 41095 > glrpc [ACK] Seq=1 Ack=1 Win=5888 Len=0 TSV=4914482 TSER=4946749
396734  44.093603     10.0.1.3 -> 10.0.1.2     TCP 41095 > glrpc [FIN, ACK] Seq=240801 Ack=400920801 Win=2004608 Len=0 TSV=4925505 TSER=4957756
396735  44.094033     10.0.1.2 -> 10.0.1.3     TCP glrpc > 41095 [FIN, ACK] Seq=400920801 Ack=240802 Win=130048 Len=0 TSV=4957773 TSER=4925505
  1   0.000000     10.0.1.3 -> 10.0.1.2     TCP 41097 > glrpc [SYN] Seq=0 Win=5840 Len=0 MSS=1460 TSV=4931091 TSER=0 WS=6
  2   0.000284     10.0.1.2 -> 10.0.1.3     TCP glrpc > 41097 [SYN, ACK] Seq=0 Ack=1 Win=14480 Len=0 MSS=1460 TSV=4963360 TSER=4931091 WS=6
  3   0.000305     10.0.1.3 -> 10.0.1.2     TCP 41097 > glrpc [ACK] Seq=1 Ack=1 Win=5888 Len=0 TSV=4931091 TSER=4963360
407357  44.431683     10.0.1.3 -> 10.0.1.2     TCP 41097 > glrpc [FIN, ACK] Seq=240801 Ack=400920801 Win=2004608 Len=0 TSV=4942199 TSER=4974436
407358  44.432132     10.0.1.2 -> 10.0.1.3     TCP glrpc > 41097 [FIN, ACK] Seq=400920801 Ack=240802 Win=130048 Len=0 TSV=4974468 TSER=4942199
  1   0.000000     10.0.1.3 -> 10.0.1.2     TCP 41099 > glrpc [SYN] Seq=0 Win=5840 Len=0 MSS=1460 TSV=4948118 TSER=0 WS=6
  2   0.000308     10.0.1.2 -> 10.0.1.3     TCP glrpc > 41099 [SYN, ACK] Seq=0 Ack=1 Win=14480 Len=0 MSS=1460 TSV=4980388 TSER=4948118 WS=6
  3   0.000332     10.0.1.3 -> 10.0.1.2     TCP 41099 > glrpc [ACK] Seq=1 Ack=1 Win=5888 Len=0 TSV=4948118 TSER=4980388
396265  45.119263     10.0.1.3 -> 10.0.1.2     TCP 41099 > glrpc [FIN, ACK] Seq=240801 Ack=400920801 Win=2004608 Len=0 TSV=4959398 TSER=4991425
396266  45.119704     10.0.1.2 -> 10.0.1.3     TCP glrpc > 41099 [FIN, ACK] Seq=400920801 Ack=240802 Win=128832 Len=0 TSV=4991669 TSER=4959398
  1   0.000000     10.0.1.3 -> 10.0.1.2     TCP 37993 > glrpc [SYN] Seq=0 Win=5840 Len=0 MSS=1460 TSV=4964921 TSER=0 WS=6
  2   0.000272     10.0.1.2 -> 10.0.1.3     TCP glrpc > 37993 [SYN, ACK] Seq=0 Ack=1 Win=14480 Len=0 MSS=1460 TSV=4997192 TSER=4964921 WS=6
  3   0.000311     10.0.1.3 -> 10.0.1.2     TCP 37993 > glrpc [ACK] Seq=1 Ack=1 Win=5888 Len=0 TSV=4964921 TSER=4997192
387902  46.405381     10.0.1.3 -> 10.0.1.2     TCP 37993 > glrpc [FIN, ACK] Seq=240801 Ack=400920801 Win=2007552 Len=0 TSV=4976522 TSER=5008705
387903  46.405827     10.0.1.2 -> 10.0.1.3     TCP glrpc > 37993 [FIN, ACK] Seq=400920801 Ack=240802 Win=149312 Len=0 TSV=5008794 TSER=4976522
  1   0.000000     10.0.1.3 -> 10.0.1.2     TCP 37995 > glrpc [SYN] Seq=0 Win=5840 Len=0 MSS=1460 TSV=4981943 TSER=0 WS=6
  2   0.000261     10.0.1.2 -> 10.0.1.3     TCP glrpc > 37995 [SYN, ACK] Seq=0 Ack=1 Win=14480 Len=0 MSS=1460 TSV=5014216 TSER=4981943 WS=6
  3   0.000286     10.0.1.3 -> 10.0.1.2     TCP 37995 > glrpc [ACK] Seq=1 Ack=1 Win=5888 Len=0 TSV=4981943 TSER=5014216
377626  44.421677     10.0.1.3 -> 10.0.1.2     TCP 37995 > glrpc [FIN, ACK] Seq=240801 Ack=400920801 Win=2004608 Len=0 TSV=4993049 TSER=5025294
377627  44.422066     10.0.1.2 -> 10.0.1.3     TCP glrpc > 37995 [FIN, ACK] Seq=400920801 Ack=240802 Win=130048 Len=0 TSV=5025322 TSER=4993049
  1   0.000000     10.0.1.3 -> 10.0.1.2     TCP 37997 > glrpc [SYN] Seq=0 Win=5840 Len=0 MSS=1460 TSV=4998407 TSER=0 WS=6
  2   0.000277     10.0.1.2 -> 10.0.1.3     TCP glrpc > 37997 [SYN, ACK] Seq=0 Ack=1 Win=14480 Len=0 MSS=1460 TSV=5030680 TSER=4998407 WS=6
  3   0.000298     10.0.1.3 -> 10.0.1.2     TCP 37997 > glrpc [ACK] Seq=1 Ack=1 Win=5888 Len=0 TSV=4998407 TSER=5030680
360263  44.391180     10.0.1.3 -> 10.0.1.2     TCP 37997 > glrpc [FIN, ACK] Seq=240801 Ack=400920801 Win=2007552 Len=0 TSV=5009504 TSER=5041764
360264  44.391566     10.0.1.2 -> 10.0.1.3     TCP glrpc > 37997 [FIN, ACK] Seq=400920801 Ack=240802 Win=130048 Len=0 TSV=5041779 TSER=5009504
  1   0.000000     10.0.1.3 -> 10.0.1.2     TCP 37999 > glrpc [SYN] Seq=0 Win=5840 Len=0 MSS=1460 TSV=5014689 TSER=0 WS=6
  2   0.000305     10.0.1.2 -> 10.0.1.3     TCP glrpc > 37999 [SYN, ACK] Seq=0 Ack=1 Win=14480 Len=0 MSS=1460 TSV=5046964 TSER=5014689 WS=6
  3   0.000329     10.0.1.3 -> 10.0.1.2     TCP 37999 > glrpc [ACK] Seq=1 Ack=1 Win=5888 Len=0 TSV=5014689 TSER=5046964
407529  44.165747     10.0.1.3 -> 10.0.1.2     TCP 37999 > glrpc [FIN, ACK] Seq=240801 Ack=400920801 Win=2004608 Len=0 TSV=5025730 TSER=5057977
407530  44.166202     10.0.1.2 -> 10.0.1.3     TCP glrpc > 37999 [FIN, ACK] Seq=400920801 Ack=240802 Win=130048 Len=0 TSV=5058006 TSER=5025730
  1   0.000000     10.0.1.3 -> 10.0.1.2     TCP 54766 > glrpc [SYN] Seq=0 Win=5840 Len=0 MSS=1460 TSV=5031379 TSER=0 WS=6
  2   0.000306     10.0.1.2 -> 10.0.1.3     TCP glrpc > 54766 [SYN, ACK] Seq=0 Ack=1 Win=14480 Len=0 MSS=1460 TSV=5063656 TSER=5031379 WS=6
  3   0.000328     10.0.1.3 -> 10.0.1.2     TCP 54766 > glrpc [ACK] Seq=1 Ack=1 Win=5888 Len=0 TSV=5031380 TSER=5063656
381578  44.144596     10.0.1.3 -> 10.0.1.2     TCP 54766 > glrpc [FIN, ACK] Seq=240801 Ack=400920801 Win=2004608 Len=0 TSV=5042416 TSER=5074687
381579  44.145028     10.0.1.2 -> 10.0.1.3     TCP glrpc > 54766 [FIN, ACK] Seq=400920801 Ack=240802 Win=130048 Len=0 TSV=5074693 TSER=5042416
  1   0.000000     10.0.1.3 -> 10.0.1.2     TCP 54768 > glrpc [SYN] Seq=0 Win=5840 Len=0 MSS=1460 TSV=5047769 TSER=0 WS=6
  2   0.000317     10.0.1.2 -> 10.0.1.3     TCP glrpc > 54768 [SYN, ACK] Seq=0 Ack=1 Win=14480 Len=0 MSS=1460 TSV=5080047 TSER=5047769 WS=6
  3   0.000341     10.0.1.3 -> 10.0.1.2     TCP 54768 > glrpc [ACK] Seq=1 Ack=1 Win=5888 Len=0 TSV=5047769 TSER=5080047
406841  44.116412     10.0.1.3 -> 10.0.1.2     TCP 54768 > glrpc [FIN, ACK] Seq=240801 Ack=400920801 Win=2004608 Len=0 TSV=5058798 TSER=5091066
406842  44.116832     10.0.1.2 -> 10.0.1.3     TCP glrpc > 54768 [FIN, ACK] Seq=400920801 Ack=240802 Win=130048 Len=0 TSV=5091077 TSER=5058798
  1   0.000000     10.0.1.3 -> 10.0.1.2     TCP 54770 > glrpc [SYN] Seq=0 Win=5840 Len=0 MSS=1460 TSV=5064419 TSER=0 WS=6
  2   0.000291     10.0.1.2 -> 10.0.1.3     TCP glrpc > 54770 [SYN, ACK] Seq=0 Ack=1 Win=14480 Len=0 MSS=1460 TSV=5096698 TSER=5064419 WS=6
  3   0.000313     10.0.1.3 -> 10.0.1.2     TCP 54770 > glrpc [ACK] Seq=1 Ack=1 Win=5888 Len=0 TSV=5064419 TSER=5096698
391953  45.621640     10.0.1.3 -> 10.0.1.2     TCP 54770 > glrpc [FIN, ACK] Seq=240801 Ack=400920801 Win=2004608 Len=0 TSV=5075824 TSER=5107779
391954  45.622102     10.0.1.2 -> 10.0.1.3     TCP glrpc > 54770 [FIN, ACK] Seq=400920801 Ack=240802 Win=130048 Len=0 TSV=5108104 TSER=5075824
  1   0.000000     10.0.1.3 -> 10.0.1.2     TCP 54772 > glrpc [SYN] Seq=0 Win=5840 Len=0 MSS=1460 TSV=5081305 TSER=0 WS=6
  2   0.000282     10.0.1.2 -> 10.0.1.3     TCP glrpc > 54772 [SYN, ACK] Seq=0 Ack=1 Win=14480 Len=0 MSS=1460 TSV=5113586 TSER=5081305 WS=6
  3   0.000303     10.0.1.3 -> 10.0.1.2     TCP 54772 > glrpc [ACK] Seq=1 Ack=1 Win=5888 Len=0 TSV=5081305 TSER=5113586
407435  44.321542     10.0.1.3 -> 10.0.1.2     TCP 54772 > glrpc [FIN, ACK] Seq=240801 Ack=400920801 Win=2004608 Len=0 TSV=5092386 TSER=5124636
407436  44.322011     10.0.1.2 -> 10.0.1.3     TCP glrpc > 54772 [FIN, ACK] Seq=400920801 Ack=240802 Win=130048 Len=0 TSV=5124667 TSER=5092386
  1   0.000000     10.0.1.3 -> 10.0.1.2     TCP 54774 > glrpc [SYN] Seq=0 Win=5840 Len=0 MSS=1460 TSV=5098214 TSER=0 WS=6
  2   0.000311     10.0.1.2 -> 10.0.1.3     TCP glrpc > 54774 [SYN, ACK] Seq=0 Ack=1 Win=14480 Len=0 MSS=1460 TSV=5130495 TSER=5098214 WS=6
  3   0.000334     10.0.1.3 -> 10.0.1.2     TCP 54774 > glrpc [ACK] Seq=1 Ack=1 Win=5888 Len=0 TSV=5098214 TSER=5130495
404085  44.343385     10.0.1.3 -> 10.0.1.2     TCP 54774 > glrpc [FIN, ACK] Seq=240801 Ack=400920801 Win=2004608 Len=0 TSV=5109299 TSER=5141551
404086  44.343759     10.0.1.2 -> 10.0.1.3     TCP glrpc > 54774 [FIN, ACK] Seq=400920801 Ack=240802 Win=131264 Len=0 TSV=5141582 TSER=5109299
  1   0.000000     10.0.1.3 -> 10.0.1.2     TCP 58467 > glrpc [SYN] Seq=0 Win=5840 Len=0 MSS=1460 TSV=5114906 TSER=0 WS=6
  2   0.000298     10.0.1.2 -> 10.0.1.3     TCP glrpc > 58467 [SYN, ACK] Seq=0 Ack=1 Win=14480 Len=0 MSS=1460 TSV=5147188 TSER=5114906 WS=6
  3   0.000319     10.0.1.3 -> 10.0.1.2     TCP 58467 > glrpc [ACK] Seq=1 Ack=1 Win=5888 Len=0 TSV=5114906 TSER=5147188
401817  45.141595     10.0.1.3 -> 10.0.1.2     TCP 58467 > glrpc [FIN, ACK] Seq=240801 Ack=400920801 Win=2016192 Len=0 TSV=5126191 TSER=5158385
401818  45.142059     10.0.1.2 -> 10.0.1.3     TCP glrpc > 58467 [FIN, ACK] Seq=400920801 Ack=240802 Win=133696 Len=0 TSV=5158475 TSER=5126191
  1   0.000000     10.0.1.3 -> 10.0.1.2     TCP 58469 > glrpc [SYN] Seq=0 Win=5840 Len=0 MSS=1460 TSV=5131836 TSER=0 WS=6
  2   0.000303     10.0.1.2 -> 10.0.1.3     TCP glrpc > 58469 [SYN, ACK] Seq=0 Ack=1 Win=14480 Len=0 MSS=1460 TSV=5164120 TSER=5131836 WS=6
  3   0.000326     10.0.1.3 -> 10.0.1.2     TCP 58469 > glrpc [ACK] Seq=1 Ack=1 Win=5888 Len=0 TSV=5131836 TSER=5164120
407333  44.214700     10.0.1.3 -> 10.0.1.2     TCP 58469 > glrpc [FIN, ACK] Seq=240801 Ack=400920801 Win=2004608 Len=0 TSV=5142890 TSER=5175145
407334  44.215120     10.0.1.2 -> 10.0.1.3     TCP glrpc > 58469 [FIN, ACK] Seq=400920801 Ack=240802 Win=128832 Len=0 TSV=5175174 TSER=5142890
  1   0.000000     10.0.1.3 -> 10.0.1.2     TCP 58471 > glrpc [SYN] Seq=0 Win=5840 Len=0 MSS=1460 TSV=5148541 TSER=0 WS=6
  2   0.000295     10.0.1.2 -> 10.0.1.3     TCP glrpc > 58471 [SYN, ACK] Seq=0 Ack=1 Win=14480 Len=0 MSS=1460 TSV=5180827 TSER=5148541 WS=6
  3   0.000318     10.0.1.3 -> 10.0.1.2     TCP 58471 > glrpc [ACK] Seq=1 Ack=1 Win=5888 Len=0 TSV=5148542 TSER=5180827
379977  46.849908     10.0.1.3 -> 10.0.1.2     TCP 58471 > glrpc [FIN, ACK] Seq=240801 Ack=400920801 Win=2004608 Len=0 TSV=5160254 TSER=5191858
379978  46.850391     10.0.1.2 -> 10.0.1.3     TCP glrpc > 58471 [FIN, ACK] Seq=400920801 Ack=240802 Win=130048 Len=0 TSV=5192540 TSER=5160254
  1   0.000000     10.0.1.3 -> 10.0.1.2     TCP 58473 > glrpc [SYN] Seq=0 Win=5840 Len=0 MSS=1460 TSV=5165599 TSER=0 WS=6
  2   0.000299     10.0.1.2 -> 10.0.1.3     TCP glrpc > 58473 [SYN, ACK] Seq=0 Ack=1 Win=14480 Len=0 MSS=1460 TSV=5197886 TSER=5165599 WS=6
  3   0.000320     10.0.1.3 -> 10.0.1.2     TCP 58473 > glrpc [ACK] Seq=1 Ack=1 Win=5888 Len=0 TSV=5165600 TSER=5197886
385580  44.581078     10.0.1.3 -> 10.0.1.2     TCP 58473 > glrpc [FIN, ACK] Seq=240801 Ack=400920801 Win=2004608 Len=0 TSV=5176745 TSER=5208909
385581  44.581536     10.0.1.2 -> 10.0.1.3     TCP glrpc > 58473 [FIN, ACK] Seq=400920801 Ack=240802 Win=131264 Len=0 TSV=5209032 TSER=5176745
  1   0.000000     10.0.1.3 -> 10.0.1.2     TCP 41188 > glrpc [SYN] Seq=0 Win=5840 Len=0 MSS=1460 TSV=5182112 TSER=0 WS=6
  2   0.000292     10.0.1.2 -> 10.0.1.3     TCP glrpc > 41188 [SYN, ACK] Seq=0 Ack=1 Win=14480 Len=0 MSS=1460 TSV=5214400 TSER=5182112 WS=6
  3   0.000316     10.0.1.3 -> 10.0.1.2     TCP 41188 > glrpc [ACK] Seq=1 Ack=1 Win=5888 Len=0 TSV=5182112 TSER=5214400
401703  44.251790     10.0.1.3 -> 10.0.1.2     TCP 41188 > glrpc [FIN, ACK] Seq=240801 Ack=400920801 Win=2004480 Len=0 TSV=5193175 TSER=5225451
401704  44.252261     10.0.1.2 -> 10.0.1.3     TCP glrpc > 41188 [FIN, ACK] Seq=400920801 Ack=240802 Win=130048 Len=0 TSV=5225464 TSER=5193175
  1   0.000000     10.0.1.3 -> 10.0.1.2     TCP 41190 > glrpc [SYN] Seq=0 Win=5840 Len=0 MSS=1460 TSV=5198786 TSER=0 WS=6
  2   0.000286     10.0.1.2 -> 10.0.1.3     TCP glrpc > 41190 [SYN, ACK] Seq=0 Ack=1 Win=14480 Len=0 MSS=1460 TSV=5231076 TSER=5198786 WS=6
  3   0.000305     10.0.1.3 -> 10.0.1.2     TCP 41190 > glrpc [ACK] Seq=1 Ack=1 Win=5888 Len=0 TSV=5198786 TSER=5231076
401070  44.333073     10.0.1.3 -> 10.0.1.2     TCP 41190 > glrpc [FIN, ACK] Seq=240801 Ack=400920801 Win=2004608 Len=0 TSV=5209870 TSER=5242130
401071  44.333510     10.0.1.2 -> 10.0.1.3     TCP glrpc > 41190 [FIN, ACK] Seq=400920801 Ack=240802 Win=128832 Len=0 TSV=5242160 TSER=5209870
  1   0.000000     10.0.1.3 -> 10.0.1.2     TCP 41192 > glrpc [SYN] Seq=0 Win=5840 Len=0 MSS=1460 TSV=5215367 TSER=0 WS=6
  2   0.000373     10.0.1.2 -> 10.0.1.3     TCP glrpc > 41192 [SYN, ACK] Seq=0 Ack=1 Win=14480 Len=0 MSS=1460 TSV=5247658 TSER=5215367 WS=6
  3   0.000398     10.0.1.3 -> 10.0.1.2     TCP 41192 > glrpc [ACK] Seq=1 Ack=1 Win=5888 Len=0 TSV=5215367 TSER=5247658
385372  45.045291     10.0.1.3 -> 10.0.1.2     TCP 41192 > glrpc [FIN, ACK] Seq=240801 Ack=400920801 Win=2004608 Len=0 TSV=5226629 TSER=5258753
385373  45.045751     10.0.1.2 -> 10.0.1.3     TCP glrpc > 41192 [FIN, ACK] Seq=400920801 Ack=240802 Win=130048 Len=0 TSV=5258920 TSER=5226629
