  1   0.000000     10.0.1.3 -> 10.0.1.2     TCP 35759 > glrpc [SYN] Seq=0 Win=5840 Len=0 MSS=1460 TSV=4987958 TSER=0 WS=6
  2   0.000359     10.0.1.2 -> 10.0.1.3     TCP glrpc > 35759 [SYN, ACK] Seq=0 Ack=1 Win=14480 Len=0 MSS=1460 TSV=5041574 TSER=4987958 WS=6
  3   0.000381     10.0.1.3 -> 10.0.1.2     TCP 35759 > glrpc [ACK] Seq=1 Ack=1 Win=5888 Len=0 TSV=4987958 TSER=5041574
410541  43.831517     10.0.1.3 -> 10.0.1.2     TCP 35759 > glrpc [FIN, ACK] Seq=240801 Ack=400920801 Win=1990144 Len=0 TSV=4998915 TSER=5052502
410542  43.832062     10.0.1.2 -> 10.0.1.3     TCP glrpc > 35759 [FIN, ACK] Seq=400920801 Ack=240802 Win=130048 Len=0 TSV=5052532 TSER=4998915
================================================================================
IPv4 Conversations
Filter:<No Filter>
                                               |       <-      | |       ->      | |     Total     |
                                               | Frames  Bytes | | Frames  Bytes | | Frames  Bytes |
10.0.1.3             <-> 10.0.1.2              278082 419274220  132461   8983234  410543 428257454
================================================================================
  1   0.000000     10.0.1.3 -> 10.0.1.2     TCP 35761 > glrpc [SYN] Seq=0 Win=5840 Len=0 MSS=1460 TSV=5002605 TSER=0 WS=6
  2   0.000310     10.0.1.2 -> 10.0.1.3     TCP glrpc > 35761 [SYN, ACK] Seq=0 Ack=1 Win=14480 Len=0 MSS=1460 TSV=5056222 TSER=5002605 WS=6
  3   0.000331     10.0.1.3 -> 10.0.1.2     TCP 35761 > glrpc [ACK] Seq=1 Ack=1 Win=5888 Len=0 TSV=5002605 TSER=5056222
411173  43.741511     10.0.1.3 -> 10.0.1.2     TCP 35761 > glrpc [FIN, ACK] Seq=240801 Ack=400920801 Win=1993024 Len=0 TSV=5013540 TSER=5067128
411174  43.741922     10.0.1.2 -> 10.0.1.3     TCP glrpc > 35761 [FIN, ACK] Seq=400920801 Ack=240802 Win=130048 Len=0 TSV=5067158 TSER=5013540
================================================================================
IPv4 Conversations
Filter:<No Filter>
                                               |       <-      | |       ->      | |     Total     |
                                               | Frames  Bytes | | Frames  Bytes | | Frames  Bytes |
10.0.1.3             <-> 10.0.1.2              278057 419272570  133118   9026596  411175 428299166
================================================================================
  1   0.000000     10.0.1.3 -> 10.0.1.2     TCP 35763 > glrpc [SYN] Seq=0 Win=5840 Len=0 MSS=1460 TSV=5017220 TSER=0 WS=6
  2   0.000302     10.0.1.2 -> 10.0.1.3     TCP glrpc > 35763 [SYN, ACK] Seq=0 Ack=1 Win=14480 Len=0 MSS=1460 TSV=5070838 TSER=5017220 WS=6
  3   0.000326     10.0.1.3 -> 10.0.1.2     TCP 35763 > glrpc [ACK] Seq=1 Ack=1 Win=5888 Len=0 TSV=5017220 TSER=5070838
411338  43.882425     10.0.1.3 -> 10.0.1.2     TCP 35763 > glrpc [FIN, ACK] Seq=240801 Ack=400920801 Win=1991296 Len=0 TSV=5028190 TSER=5081791
411339  43.882820     10.0.1.2 -> 10.0.1.3     TCP glrpc > 35763 [FIN, ACK] Seq=400920801 Ack=240802 Win=130048 Len=0 TSV=5081810 TSER=5028190
================================================================================
IPv4 Conversations
Filter:<No Filter>
                                               |       <-      | |       ->      | |     Total     |
                                               | Frames  Bytes | | Frames  Bytes | | Frames  Bytes |
10.0.1.3             <-> 10.0.1.2              278064 419273032  133276   9037024  411340 428310056
================================================================================
  1   0.000000     10.0.1.3 -> 10.0.1.2     TCP 53809 > glrpc [SYN] Seq=0 Win=5840 Len=0 MSS=1460 TSV=5031872 TSER=0 WS=6
  2   0.000264     10.0.1.2 -> 10.0.1.3     TCP glrpc > 53809 [SYN, ACK] Seq=0 Ack=1 Win=14480 Len=0 MSS=1460 TSV=5085492 TSER=5031872 WS=6
  3   0.000281     10.0.1.3 -> 10.0.1.2     TCP 53809 > glrpc [ACK] Seq=1 Ack=1 Win=5888 Len=0 TSV=5031873 TSER=5085492
410420  43.656846     10.0.1.3 -> 10.0.1.2     TCP 53809 > glrpc [FIN, ACK] Seq=240801 Ack=400920801 Win=1998848 Len=0 TSV=5042787 TSER=5096392
410421  43.657225     10.0.1.2 -> 10.0.1.3     TCP glrpc > 53809 [FIN, ACK] Seq=400920801 Ack=240802 Win=130048 Len=0 TSV=5096407 TSER=5042787
================================================================================
IPv4 Conversations
Filter:<No Filter>
                                               |       <-      | |       ->      | |     Total     |
                                               | Frames  Bytes | | Frames  Bytes | | Frames  Bytes |
10.0.1.3             <-> 10.0.1.2              278070 419273428  132352   8976040  410422 428249468
================================================================================
  1   0.000000     10.0.1.3 -> 10.0.1.2     TCP 53812 > glrpc [SYN] Seq=0 Win=5840 Len=0 MSS=1460 TSV=5046484 TSER=0 WS=6
  2   0.000293     10.0.1.2 -> 10.0.1.3     TCP glrpc > 53812 [SYN, ACK] Seq=0 Ack=1 Win=14480 Len=0 MSS=1460 TSV=5100104 TSER=5046484 WS=6
  3   0.000315     10.0.1.3 -> 10.0.1.2     TCP 53812 > glrpc [ACK] Seq=1 Ack=1 Win=5888 Len=0 TSV=5046484 TSER=5100104
410508  45.276546     10.0.1.3 -> 10.0.1.2     TCP 53812 > glrpc [FIN, ACK] Seq=240801 Ack=400920801 Win=1995968 Len=0 TSV=5057803 TSER=5111396
410509  45.296374     10.0.1.2 -> 10.0.1.3     TCP glrpc > 53812 [FIN, ACK] Seq=400920801 Ack=240802 Win=130048 Len=0 TSV=5111429 TSER=5057803
================================================================================
IPv4 Conversations
Filter:<No Filter>
                                               |       <-      | |       ->      | |     Total     |
                                               | Frames  Bytes | | Frames  Bytes | | Frames  Bytes |
10.0.1.3             <-> 10.0.1.2              278077 419273890  132433   8981386  410510 428255276
================================================================================
  1   0.000000     10.0.1.3 -> 10.0.1.2     TCP 53816 > glrpc [SYN] Seq=0 Win=5840 Len=0 MSS=1460 TSV=5061465 TSER=0 WS=6
  2   0.000369     10.0.1.2 -> 10.0.1.3     TCP glrpc > 53816 [SYN, ACK] Seq=0 Ack=1 Win=14480 Len=0 MSS=1460 TSV=5115086 TSER=5061465 WS=6
  3   0.000390     10.0.1.3 -> 10.0.1.2     TCP 53816 > glrpc [ACK] Seq=1 Ack=1 Win=5888 Len=0 TSV=5061465 TSER=5115086
410612  45.035588     10.0.1.3 -> 10.0.1.2     TCP 53816 > glrpc [FIN, ACK] Seq=240801 Ack=400920801 Win=1990144 Len=0 TSV=5072724 TSER=5126315
410613  45.051008     10.0.1.2 -> 10.0.1.3     TCP glrpc > 53816 [FIN, ACK] Seq=400920801 Ack=240802 Win=130048 Len=0 TSV=5126350 TSER=5072724
================================================================================
IPv4 Conversations
Filter:<No Filter>
                                               |       <-      | |       ->      | |     Total     |
                                               | Frames  Bytes | | Frames  Bytes | | Frames  Bytes |
10.0.1.3             <-> 10.0.1.2              278076 419273824  132538   8988316  410614 428262140
================================================================================
  1   0.000000     10.0.1.3 -> 10.0.1.2     TCP 53818 > glrpc [SYN] Seq=0 Win=5840 Len=0 MSS=1460 TSV=5076411 TSER=0 WS=6
  2   0.000296     10.0.1.2 -> 10.0.1.3     TCP glrpc > 53818 [SYN, ACK] Seq=0 Ack=1 Win=14480 Len=0 MSS=1460 TSV=5130034 TSER=5076411 WS=6
  3   0.000318     10.0.1.3 -> 10.0.1.2     TCP 53818 > glrpc [ACK] Seq=1 Ack=1 Win=5888 Len=0 TSV=5076411 TSER=5130034
410813  44.025865     10.0.1.3 -> 10.0.1.2     TCP 53818 > glrpc [FIN, ACK] Seq=240801 Ack=400920801 Win=1990144 Len=0 TSV=5087417 TSER=5141012
410814  44.026281     10.0.1.2 -> 10.0.1.3     TCP glrpc > 53818 [FIN, ACK] Seq=400920801 Ack=240802 Win=130048 Len=0 TSV=5141041 TSER=5087417
================================================================================
IPv4 Conversations
Filter:<No Filter>
                                               |       <-      | |       ->      | |     Total     |
                                               | Frames  Bytes | | Frames  Bytes | | Frames  Bytes |
10.0.1.3             <-> 10.0.1.2              278065 419273098  132750   9002308  410815 428275406
================================================================================
  1   0.000000     10.0.1.3 -> 10.0.1.2     TCP 53820 > glrpc [SYN] Seq=0 Win=5840 Len=0 MSS=1460 TSV=5091104 TSER=0 WS=6
  2   0.000283     10.0.1.2 -> 10.0.1.3     TCP glrpc > 53820 [SYN, ACK] Seq=0 Ack=1 Win=14480 Len=0 MSS=1460 TSV=5144728 TSER=5091104 WS=6
  3   0.000305     10.0.1.3 -> 10.0.1.2     TCP 53820 > glrpc [ACK] Seq=1 Ack=1 Win=5888 Len=0 TSV=5091104 TSER=5144728
410548  43.799946     10.0.1.3 -> 10.0.1.2     TCP 53820 > glrpc [FIN, ACK] Seq=240801 Ack=400920801 Win=1990144 Len=0 TSV=5102054 TSER=5155649
410549  43.800329     10.0.1.2 -> 10.0.1.3     TCP glrpc > 53820 [FIN, ACK] Seq=400920801 Ack=240802 Win=128832 Len=0 TSV=5155679 TSER=5102054
================================================================================
IPv4 Conversations
Filter:<No Filter>
                                               |       <-      | |       ->      | |     Total     |
                                               | Frames  Bytes | | Frames  Bytes | | Frames  Bytes |
10.0.1.3             <-> 10.0.1.2              278063 419272966  132487   8984950  410550 428257916
================================================================================
  1   0.000000     10.0.1.3 -> 10.0.1.2     TCP 50912 > glrpc [SYN] Seq=0 Win=5840 Len=0 MSS=1460 TSV=5105740 TSER=0 WS=6
  2   0.000277     10.0.1.2 -> 10.0.1.3     TCP glrpc > 50912 [SYN, ACK] Seq=0 Ack=1 Win=14480 Len=0 MSS=1460 TSV=5159365 TSER=5105740 WS=6
  3   0.000298     10.0.1.3 -> 10.0.1.2     TCP 50912 > glrpc [ACK] Seq=1 Ack=1 Win=5888 Len=0 TSV=5105740 TSER=5159365
409938  43.727714     10.0.1.3 -> 10.0.1.2     TCP 50912 > glrpc [FIN, ACK] Seq=240801 Ack=400920801 Win=1991296 Len=0 TSV=5116672 TSER=5170287
409939  43.728079     10.0.1.2 -> 10.0.1.3     TCP glrpc > 50912 [FIN, ACK] Seq=400920801 Ack=240802 Win=130048 Len=0 TSV=5170298 TSER=5116672
================================================================================
IPv4 Conversations
Filter:<No Filter>
                                               |       <-      | |       ->      | |     Total     |
                                               | Frames  Bytes | | Frames  Bytes | | Frames  Bytes |
10.0.1.3             <-> 10.0.1.2              278065 419273098  131875   8944558  409940 428217656
================================================================================
  1   0.000000     10.0.1.3 -> 10.0.1.2     TCP 50915 > glrpc [SYN] Seq=0 Win=5840 Len=0 MSS=1460 TSV=5120338 TSER=0 WS=6
  2   0.000291     10.0.1.2 -> 10.0.1.3     TCP glrpc > 50915 [SYN, ACK] Seq=0 Ack=1 Win=14480 Len=0 MSS=1460 TSV=5173965 TSER=5120338 WS=6
  3   0.000314     10.0.1.3 -> 10.0.1.2     TCP 50915 > glrpc [ACK] Seq=1 Ack=1 Win=5888 Len=0 TSV=5120338 TSER=5173965
410619  43.728673     10.0.1.3 -> 10.0.1.2     TCP 50915 > glrpc [FIN, ACK] Seq=240801 Ack=400920801 Win=1993024 Len=0 TSV=5131271 TSER=5184867
410620  43.729064     10.0.1.2 -> 10.0.1.3     TCP glrpc > 50915 [FIN, ACK] Seq=400920801 Ack=240802 Win=130048 Len=0 TSV=5184898 TSER=5131271
================================================================================
IPv4 Conversations
Filter:<No Filter>
                                               |       <-      | |       ->      | |     Total     |
                                               | Frames  Bytes | | Frames  Bytes | | Frames  Bytes |
10.0.1.3             <-> 10.0.1.2              278057 419272570  132564   8990032  410621 428262602
================================================================================
  1   0.000000     10.0.1.3 -> 10.0.1.2     TCP 50919 > glrpc [SYN] Seq=0 Win=5840 Len=0 MSS=1460 TSV=5134973 TSER=0 WS=6
  2   0.000302     10.0.1.2 -> 10.0.1.3     TCP glrpc > 50919 [SYN, ACK] Seq=0 Ack=1 Win=14480 Len=0 MSS=1460 TSV=5188600 TSER=5134973 WS=6
  3   0.000338     10.0.1.3 -> 10.0.1.2     TCP 50919 > glrpc [ACK] Seq=1 Ack=1 Win=5888 Len=0 TSV=5134973 TSER=5188600
411099  43.751054     10.0.1.3 -> 10.0.1.2     TCP 50919 > glrpc [FIN, ACK] Seq=240801 Ack=400920801 Win=1993024 Len=0 TSV=5145911 TSER=5199523
411100  43.751446     10.0.1.2 -> 10.0.1.3     TCP glrpc > 50919 [FIN, ACK] Seq=400920801 Ack=240802 Win=130048 Len=0 TSV=5199539 TSER=5145911
================================================================================
IPv4 Conversations
Filter:<No Filter>
                                               |       <-      | |       ->      | |     Total     |
                                               | Frames  Bytes | | Frames  Bytes | | Frames  Bytes |
10.0.1.3             <-> 10.0.1.2              278059 419272702  133042   9021580  411101 428294282
================================================================================
  1   0.000000     10.0.1.3 -> 10.0.1.2     TCP 50921 > glrpc [SYN] Seq=0 Win=5840 Len=0 MSS=1460 TSV=5149631 TSER=0 WS=6
  2   0.000277     10.0.1.2 -> 10.0.1.3     TCP glrpc > 50921 [SYN, ACK] Seq=0 Ack=1 Win=14480 Len=0 MSS=1460 TSV=5203259 TSER=5149631 WS=6
  3   0.000298     10.0.1.3 -> 10.0.1.2     TCP 50921 > glrpc [ACK] Seq=1 Ack=1 Win=5888 Len=0 TSV=5149631 TSER=5203259
410755  43.722309     10.0.1.3 -> 10.0.1.2     TCP 50921 > glrpc [FIN, ACK] Seq=240801 Ack=400920801 Win=1993024 Len=0 TSV=5160561 TSER=5214180
410756  43.722686     10.0.1.2 -> 10.0.1.3     TCP glrpc > 50921 [FIN, ACK] Seq=400920801 Ack=240802 Win=130048 Len=0 TSV=5214191 TSER=5160561
================================================================================
IPv4 Conversations
Filter:<No Filter>
                                               |       <-      | |       ->      | |     Total     |
                                               | Frames  Bytes | | Frames  Bytes | | Frames  Bytes |
10.0.1.3             <-> 10.0.1.2              278071 419273494  132686   8998084  410757 428271578
================================================================================
  1   0.000000     10.0.1.3 -> 10.0.1.2     TCP 50923 > glrpc [SYN] Seq=0 Win=5840 Len=0 MSS=1460 TSV=5164266 TSER=0 WS=6
  2   0.000294     10.0.1.2 -> 10.0.1.3     TCP glrpc > 50923 [SYN, ACK] Seq=0 Ack=1 Win=14480 Len=0 MSS=1460 TSV=5217896 TSER=5164266 WS=6
  3   0.000316     10.0.1.3 -> 10.0.1.2     TCP 50923 > glrpc [ACK] Seq=1 Ack=1 Win=5888 Len=0 TSV=5164266 TSER=5217896
411247  43.958856     10.0.1.3 -> 10.0.1.2     TCP 50923 > glrpc [FIN, ACK] Seq=240801 Ack=400920801 Win=1992896 Len=0 TSV=5175256 TSER=5228857
411248  43.959242     10.0.1.2 -> 10.0.1.3     TCP glrpc > 50923 [FIN, ACK] Seq=400920801 Ack=240802 Win=130048 Len=0 TSV=5228886 TSER=5175256
================================================================================
IPv4 Conversations
Filter:<No Filter>
                                               |       <-      | |       ->      | |     Total     |
                                               | Frames  Bytes | | Frames  Bytes | | Frames  Bytes |
10.0.1.3             <-> 10.0.1.2              278063 419272966  133186   9031084  411249 428304050
================================================================================
  1   0.000000     10.0.1.3 -> 10.0.1.2     TCP 53772 > glrpc [SYN] Seq=0 Win=5840 Len=0 MSS=1460 TSV=5178952 TSER=0 WS=6
  2   0.000283     10.0.1.2 -> 10.0.1.3     TCP glrpc > 53772 [SYN, ACK] Seq=0 Ack=1 Win=14480 Len=0 MSS=1460 TSV=5232583 TSER=5178952 WS=6
  3   0.000304     10.0.1.3 -> 10.0.1.2     TCP 53772 > glrpc [ACK] Seq=1 Ack=1 Win=5888 Len=0 TSV=5178952 TSER=5232583
411102  43.885415     10.0.1.3 -> 10.0.1.2     TCP 53772 > glrpc [FIN, ACK] Seq=240801 Ack=400920801 Win=1989568 Len=0 TSV=5189924 TSER=5243526
411103  43.885795     10.0.1.2 -> 10.0.1.3     TCP glrpc > 53772 [FIN, ACK] Seq=400920801 Ack=240802 Win=128832 Len=0 TSV=5243555 TSER=5189924
================================================================================
IPv4 Conversations
Filter:<No Filter>
                                               |       <-      | |       ->      | |     Total     |
                                               | Frames  Bytes | | Frames  Bytes | | Frames  Bytes |
10.0.1.3             <-> 10.0.1.2              278063 419272966  133041   9021514  411104 428294480
================================================================================
  1   0.000000     10.0.1.3 -> 10.0.1.2     TCP 53774 > glrpc [SYN] Seq=0 Win=5840 Len=0 MSS=1460 TSV=5193617 TSER=0 WS=6
  2   0.000297     10.0.1.2 -> 10.0.1.3     TCP glrpc > 53774 [SYN, ACK] Seq=0 Ack=1 Win=14480 Len=0 MSS=1460 TSV=5247249 TSER=5193617 WS=6
  3   0.000321     10.0.1.3 -> 10.0.1.2     TCP 53774 > glrpc [ACK] Seq=1 Ack=1 Win=5888 Len=0 TSV=5193617 TSER=5247249
410875  43.867813     10.0.1.3 -> 10.0.1.2     TCP 53774 > glrpc [FIN, ACK] Seq=240801 Ack=400920801 Win=1998848 Len=0 TSV=5204584 TSER=5258186
410876  43.868234     10.0.1.2 -> 10.0.1.3     TCP glrpc > 53774 [FIN, ACK] Seq=400920801 Ack=240802 Win=131264 Len=0 TSV=5258217 TSER=5204584
================================================================================
IPv4 Conversations
Filter:<No Filter>
                                               |       <-      | |       ->      | |     Total     |
                                               | Frames  Bytes | | Frames  Bytes | | Frames  Bytes |
10.0.1.3             <-> 10.0.1.2              278064 419273032  132813   9006466  410877 428279498
================================================================================
  1   0.000000     10.0.1.3 -> 10.0.1.2     TCP 53778 > glrpc [SYN] Seq=0 Win=5840 Len=0 MSS=1460 TSV=5208263 TSER=0 WS=6
  2   0.000296     10.0.1.2 -> 10.0.1.3     TCP glrpc > 53778 [SYN, ACK] Seq=0 Ack=1 Win=14480 Len=0 MSS=1460 TSV=5261895 TSER=5208263 WS=6
  3   0.000318     10.0.1.3 -> 10.0.1.2     TCP 53778 > glrpc [ACK] Seq=1 Ack=1 Win=5888 Len=0 TSV=5208263 TSER=5261895
410851  43.702855     10.0.1.3 -> 10.0.1.2     TCP 53778 > glrpc [FIN, ACK] Seq=240801 Ack=400920801 Win=1990144 Len=0 TSV=5219188 TSER=5272792
410852  43.703279     10.0.1.2 -> 10.0.1.3     TCP glrpc > 53778 [FIN, ACK] Seq=400920801 Ack=240802 Win=130048 Len=0 TSV=5272822 TSER=5219188
================================================================================
IPv4 Conversations
Filter:<No Filter>
                                               |       <-      | |       ->      | |     Total     |
                                               | Frames  Bytes | | Frames  Bytes | | Frames  Bytes |
10.0.1.3             <-> 10.0.1.2              278065 419273098  132788   9004816  410853 428277914
================================================================================
  1   0.000000     10.0.1.3 -> 10.0.1.2     TCP 53780 > glrpc [SYN] Seq=0 Win=5840 Len=0 MSS=1460 TSV=5222867 TSER=0 WS=6
  2   0.000295     10.0.1.2 -> 10.0.1.3     TCP glrpc > 53780 [SYN, ACK] Seq=0 Ack=1 Win=14480 Len=0 MSS=1460 TSV=5276501 TSER=5222867 WS=6
  3   0.000316     10.0.1.3 -> 10.0.1.2     TCP 53780 > glrpc [ACK] Seq=1 Ack=1 Win=5888 Len=0 TSV=5222867 TSER=5276501
410800  43.880988     10.0.1.3 -> 10.0.1.2     TCP 53780 > glrpc [FIN, ACK] Seq=240801 Ack=400920801 Win=1990144 Len=0 TSV=5233838 TSER=5287460
410801  43.881371     10.0.1.2 -> 10.0.1.3     TCP glrpc > 53780 [FIN, ACK] Seq=400920801 Ack=240802 Win=130048 Len=0 TSV=5287472 TSER=5233838
================================================================================
IPv4 Conversations
Filter:<No Filter>
                                               |       <-      | |       ->      | |     Total     |
                                               | Frames  Bytes | | Frames  Bytes | | Frames  Bytes |
10.0.1.3             <-> 10.0.1.2              278063 419272966  132739   9001582  410802 428274548
================================================================================
  1   0.000000     10.0.1.3 -> 10.0.1.2     TCP 53782 > glrpc [SYN] Seq=0 Win=5840 Len=0 MSS=1460 TSV=5237531 TSER=0 WS=6
  2   0.000267     10.0.1.2 -> 10.0.1.3     TCP glrpc > 53782 [SYN, ACK] Seq=0 Ack=1 Win=14480 Len=0 MSS=1460 TSV=5291166 TSER=5237531 WS=6
  3   0.000288     10.0.1.3 -> 10.0.1.2     TCP 53782 > glrpc [ACK] Seq=1 Ack=1 Win=5888 Len=0 TSV=5237531 TSER=5291166
410797  43.752601     10.0.1.3 -> 10.0.1.2     TCP 53782 > glrpc [FIN, ACK] Seq=240801 Ack=400920801 Win=1991296 Len=0 TSV=5248469 TSER=5302090
410798  43.752993     10.0.1.2 -> 10.0.1.3     TCP glrpc > 53782 [FIN, ACK] Seq=400920801 Ack=240802 Win=130048 Len=0 TSV=5302105 TSER=5248469
================================================================================
IPv4 Conversations
Filter:<No Filter>
                                               |       <-      | |       ->      | |     Total     |
                                               | Frames  Bytes | | Frames  Bytes | | Frames  Bytes |
10.0.1.3             <-> 10.0.1.2              278066 419273164  132733   9001186  410799 428274350
================================================================================
  1   0.000000     10.0.1.3 -> 10.0.1.2     TCP 52570 > glrpc [SYN] Seq=0 Win=5840 Len=0 MSS=1460 TSV=5252129 TSER=0 WS=6
  2   0.000289     10.0.1.2 -> 10.0.1.3     TCP glrpc > 52570 [SYN, ACK] Seq=0 Ack=1 Win=14480 Len=0 MSS=1460 TSV=5305765 TSER=5252129 WS=6
  3   0.000310     10.0.1.3 -> 10.0.1.2     TCP 52570 > glrpc [ACK] Seq=1 Ack=1 Win=5888 Len=0 TSV=5252129 TSER=5305765
410900  43.776677     10.0.1.3 -> 10.0.1.2     TCP 52570 > glrpc [FIN, ACK] Seq=240801 Ack=400920801 Win=1988416 Len=0 TSV=5263073 TSER=5316678
410901  43.777110     10.0.1.2 -> 10.0.1.3     TCP glrpc > 52570 [FIN, ACK] Seq=400920801 Ack=240802 Win=130048 Len=0 TSV=5316710 TSER=5263073
================================================================================
IPv4 Conversations
Filter:<No Filter>
                                               |       <-      | |       ->      | |     Total     |
                                               | Frames  Bytes | | Frames  Bytes | | Frames  Bytes |
10.0.1.3             <-> 10.0.1.2              278068 419273296  132834   9007852  410902 428281148
================================================================================
  1   0.000000     10.0.1.3 -> 10.0.1.2     TCP 52572 > glrpc [SYN] Seq=0 Win=5840 Len=0 MSS=1460 TSV=5266799 TSER=0 WS=6
  2   0.000313     10.0.1.2 -> 10.0.1.3     TCP glrpc > 52572 [SYN, ACK] Seq=0 Ack=1 Win=14480 Len=0 MSS=1460 TSV=5320436 TSER=5266799 WS=6
  3   0.000335     10.0.1.3 -> 10.0.1.2     TCP 52572 > glrpc [ACK] Seq=1 Ack=1 Win=5888 Len=0 TSV=5266799 TSER=5320436
410988  43.866912     10.0.1.3 -> 10.0.1.2     TCP 52572 > glrpc [FIN, ACK] Seq=240801 Ack=400920801 Win=1990144 Len=0 TSV=5277766 TSER=5331395
410989  43.867323     10.0.1.2 -> 10.0.1.3     TCP glrpc > 52572 [FIN, ACK] Seq=400920801 Ack=240802 Win=131264 Len=0 TSV=5331404 TSER=5277766
================================================================================
IPv4 Conversations
Filter:<No Filter>
                                               |       <-      | |       ->      | |     Total     |
                                               | Frames  Bytes | | Frames  Bytes | | Frames  Bytes |
10.0.1.3             <-> 10.0.1.2              278053 419272306  132937   9014650  410990 428286956
================================================================================
