  1   0.000000     10.0.1.3 -> 10.0.1.2     TCP 52576 > glrpc [SYN] Seq=0 Win=5840 Len=0 MSS=1460 TSV=5281457 TSER=0 WS=6
  2   0.000301     10.0.1.2 -> 10.0.1.3     TCP glrpc > 52576 [SYN, ACK] Seq=0 Ack=1 Win=14480 Len=0 MSS=1460 TSV=5335095 TSER=5281457 WS=6
  3   0.000324     10.0.1.3 -> 10.0.1.2     TCP 52576 > glrpc [ACK] Seq=1 Ack=1 Win=5888 Len=0 TSV=5281457 TSER=5335095
461838  49.356635     10.0.1.3 -> 10.0.1.2     TCP 52576 > glrpc [FIN, ACK] Seq=270901 Ack=451035901 Win=1993024 Len=0 TSV=5293796 TSER=5347405
461839  49.357018     10.0.1.2 -> 10.0.1.3     TCP glrpc > 52576 [FIN, ACK] Seq=451035901 Ack=270902 Win=131264 Len=0 TSV=5347435 TSER=5293796
================================================================================
IPv4 Conversations
Filter:<No Filter>
                                               |       <-      | |       ->      | |     Total     |
                                               | Frames  Bytes | | Frames  Bytes | | Frames  Bytes |
10.0.1.3             <-> 10.0.1.2              312835 471683018  149005  10105238  461840 481788256
================================================================================
  1   0.000000     10.0.1.3 -> 10.0.1.2     TCP 52578 > glrpc [SYN] Seq=0 Win=5840 Len=0 MSS=1460 TSV=5297794 TSER=0 WS=6
  2   0.000318     10.0.1.2 -> 10.0.1.3     TCP glrpc > 52578 [SYN, ACK] Seq=0 Ack=1 Win=14480 Len=0 MSS=1460 TSV=5351433 TSER=5297794 WS=6
  3   0.000343     10.0.1.3 -> 10.0.1.2     TCP 52578 > glrpc [ACK] Seq=1 Ack=1 Win=5888 Len=0 TSV=5297794 TSER=5351433
462016  49.179410     10.0.1.3 -> 10.0.1.2     TCP 52578 > glrpc [FIN, ACK] Seq=270901 Ack=451035901 Win=1989952 Len=0 TSV=5310088 TSER=5363700
462017  49.179824     10.0.1.2 -> 10.0.1.3     TCP glrpc > 52578 [FIN, ACK] Seq=451035901 Ack=270902 Win=130048 Len=0 TSV=5363729 TSER=5310088
================================================================================
IPv4 Conversations
Filter:<No Filter>
                                               |       <-      | |       ->      | |     Total     |
                                               | Frames  Bytes | | Frames  Bytes | | Frames  Bytes |
10.0.1.3             <-> 10.0.1.2              312831 471682754  149187  10117250  462018 481800004
================================================================================
  1   0.000000     10.0.1.3 -> 10.0.1.2     TCP 52580 > glrpc [SYN] Seq=0 Win=5840 Len=0 MSS=1460 TSV=5314116 TSER=0 WS=6
  2   0.000337     10.0.1.2 -> 10.0.1.3     TCP glrpc > 52580 [SYN, ACK] Seq=0 Ack=1 Win=14480 Len=0 MSS=1460 TSV=5367756 TSER=5314116 WS=6
  3   0.000361     10.0.1.3 -> 10.0.1.2     TCP 52580 > glrpc [ACK] Seq=1 Ack=1 Win=5888 Len=0 TSV=5314116 TSER=5367756
462000  49.295869     10.0.1.3 -> 10.0.1.2     TCP 52580 > glrpc [FIN, ACK] Seq=270901 Ack=451035901 Win=1990144 Len=0 TSV=5326439 TSER=5380068
462001  49.296273     10.0.1.2 -> 10.0.1.3     TCP glrpc > 52580 [FIN, ACK] Seq=451035901 Ack=270902 Win=130048 Len=0 TSV=5380081 TSER=5326439
================================================================================
IPv4 Conversations
Filter:<No Filter>
                                               |       <-      | |       ->      | |     Total     |
                                               | Frames  Bytes | | Frames  Bytes | | Frames  Bytes |
10.0.1.3             <-> 10.0.1.2              312839 471683282  149163  10115666  462002 481798948
================================================================================
  1   0.000000     10.0.1.3 -> 10.0.1.2     TCP 55009 > glrpc [SYN] Seq=0 Win=5840 Len=0 MSS=1460 TSV=5330456 TSER=0 WS=6
  2   0.000315     10.0.1.2 -> 10.0.1.3     TCP glrpc > 55009 [SYN, ACK] Seq=0 Ack=1 Win=14480 Len=0 MSS=1460 TSV=5384098 TSER=5330456 WS=6
  3   0.000336     10.0.1.3 -> 10.0.1.2     TCP 55009 > glrpc [ACK] Seq=1 Ack=1 Win=5888 Len=0 TSV=5330456 TSER=5384098
462013  49.262423     10.0.1.3 -> 10.0.1.2     TCP 55009 > glrpc [FIN, ACK] Seq=270901 Ack=451035901 Win=1995968 Len=0 TSV=5342771 TSER=5396382
462014  49.262802     10.0.1.2 -> 10.0.1.3     TCP glrpc > 55009 [FIN, ACK] Seq=451035901 Ack=270902 Win=130048 Len=0 TSV=5396414 TSER=5342771
================================================================================
IPv4 Conversations
Filter:<No Filter>
                                               |       <-      | |       ->      | |     Total     |
                                               | Frames  Bytes | | Frames  Bytes | | Frames  Bytes |
10.0.1.3             <-> 10.0.1.2              312809 471681302  149206  10118504  462015 481799806
================================================================================
  1   0.000000     10.0.1.3 -> 10.0.1.2     TCP 55012 > glrpc [SYN] Seq=0 Win=5840 Len=0 MSS=1460 TSV=5346791 TSER=0 WS=6
  2   0.000372     10.0.1.2 -> 10.0.1.3     TCP glrpc > 55012 [SYN, ACK] Seq=0 Ack=1 Win=14480 Len=0 MSS=1460 TSV=5400434 TSER=5346791 WS=6
  3   0.000395     10.0.1.3 -> 10.0.1.2     TCP 55012 > glrpc [ACK] Seq=1 Ack=1 Win=5888 Len=0 TSV=5346791 TSER=5400434
462139  49.576887     10.0.1.3 -> 10.0.1.2     TCP 55012 > glrpc [FIN, ACK] Seq=270901 Ack=451035901 Win=1992896 Len=0 TSV=5359185 TSER=5412815
462140  49.577241     10.0.1.2 -> 10.0.1.3     TCP glrpc > 55012 [FIN, ACK] Seq=451035901 Ack=270902 Win=130048 Len=0 TSV=5412829 TSER=5359185
================================================================================
IPv4 Conversations
Filter:<No Filter>
                                               |       <-      | |       ->      | |     Total     |
                                               | Frames  Bytes | | Frames  Bytes | | Frames  Bytes |
10.0.1.3             <-> 10.0.1.2              312833 471682886  149308  10125236  462141 481808122
================================================================================
  1   0.000000     10.0.1.3 -> 10.0.1.2     TCP 55016 > glrpc [SYN] Seq=0 Win=5840 Len=0 MSS=1460 TSV=5363193 TSER=0 WS=6
  2   0.000275     10.0.1.2 -> 10.0.1.3     TCP glrpc > 55016 [SYN, ACK] Seq=0 Ack=1 Win=14480 Len=0 MSS=1460 TSV=5416837 TSER=5363193 WS=6
  3   0.000296     10.0.1.3 -> 10.0.1.2     TCP 55016 > glrpc [ACK] Seq=1 Ack=1 Win=5888 Len=0 TSV=5363193 TSER=5416837
462369  49.226776     10.0.1.3 -> 10.0.1.2     TCP 55016 > glrpc [FIN, ACK] Seq=270901 Ack=451035901 Win=1991296 Len=0 TSV=5375500 TSER=5429114
462370  49.227145     10.0.1.2 -> 10.0.1.3     TCP glrpc > 55016 [FIN, ACK] Seq=451035901 Ack=270902 Win=130048 Len=0 TSV=5429145 TSER=5375500
================================================================================
IPv4 Conversations
Filter:<No Filter>
                                               |       <-      | |       ->      | |     Total     |
                                               | Frames  Bytes | | Frames  Bytes | | Frames  Bytes |
10.0.1.3             <-> 10.0.1.2              312831 471682754  149540  10140548  462371 481823302
================================================================================
  1   0.000000     10.0.1.3 -> 10.0.1.2     TCP 55018 > glrpc [SYN] Seq=0 Win=5840 Len=0 MSS=1460 TSV=5379572 TSER=0 WS=6
  2   0.000319     10.0.1.2 -> 10.0.1.3     TCP glrpc > 55018 [SYN, ACK] Seq=0 Ack=1 Win=14480 Len=0 MSS=1460 TSV=5433218 TSER=5379572 WS=6
  3   0.000343     10.0.1.3 -> 10.0.1.2     TCP 55018 > glrpc [ACK] Seq=1 Ack=1 Win=5888 Len=0 TSV=5379572 TSER=5433218
462282  49.606833     10.0.1.3 -> 10.0.1.2     TCP 55018 > glrpc [FIN, ACK] Seq=270901 Ack=451035901 Win=1993024 Len=0 TSV=5391974 TSER=5445590
462283  49.620118     10.0.1.2 -> 10.0.1.3     TCP glrpc > 55018 [FIN, ACK] Seq=451035901 Ack=270902 Win=130048 Len=0 TSV=5445624 TSER=5391974
================================================================================
IPv4 Conversations
Filter:<No Filter>
                                               |       <-      | |       ->      | |     Total     |
                                               | Frames  Bytes | | Frames  Bytes | | Frames  Bytes |
10.0.1.3             <-> 10.0.1.2              312830 471682688  149454  10134872  462284 481817560
================================================================================
  1   0.000000     10.0.1.3 -> 10.0.1.2     TCP 55020 > glrpc [SYN] Seq=0 Win=5840 Len=0 MSS=1460 TSV=5395984 TSER=0 WS=6
  2   0.000305     10.0.1.2 -> 10.0.1.3     TCP glrpc > 55020 [SYN, ACK] Seq=0 Ack=1 Win=14480 Len=0 MSS=1460 TSV=5449631 TSER=5395984 WS=6
  3   0.000325     10.0.1.3 -> 10.0.1.2     TCP 55020 > glrpc [ACK] Seq=1 Ack=1 Win=5888 Len=0 TSV=5395984 TSER=5449631
462120  49.351931     10.0.1.3 -> 10.0.1.2     TCP 55020 > glrpc [FIN, ACK] Seq=270901 Ack=451035901 Win=1990144 Len=0 TSV=5408322 TSER=5461953
462121  49.352353     10.0.1.2 -> 10.0.1.3     TCP glrpc > 55020 [FIN, ACK] Seq=451035901 Ack=270902 Win=130048 Len=0 TSV=5461970 TSER=5408322
================================================================================
IPv4 Conversations
Filter:<No Filter>
                                               |       <-      | |       ->      | |     Total     |
                                               | Frames  Bytes | | Frames  Bytes | | Frames  Bytes |
10.0.1.3             <-> 10.0.1.2              312830 471682688  149292  10124180  462122 481806868
================================================================================
  1   0.000000     10.0.1.3 -> 10.0.1.2     TCP 54506 > glrpc [SYN] Seq=0 Win=5840 Len=0 MSS=1460 TSV=5412310 TSER=0 WS=6
  2   0.000294     10.0.1.2 -> 10.0.1.3     TCP glrpc > 54506 [SYN, ACK] Seq=0 Ack=1 Win=14480 Len=0 MSS=1460 TSV=5465958 TSER=5412310 WS=6
  3   0.000317     10.0.1.3 -> 10.0.1.2     TCP 54506 > glrpc [ACK] Seq=1 Ack=1 Win=5888 Len=0 TSV=5412310 TSER=5465958
462120  49.837339     10.0.1.3 -> 10.0.1.2     TCP 54506 > glrpc [FIN, ACK] Seq=270901 Ack=451035901 Win=1975680 Len=0 TSV=5424769 TSER=5478388
462121  49.837756     10.0.1.2 -> 10.0.1.3     TCP glrpc > 54506 [FIN, ACK] Seq=451035901 Ack=270902 Win=130048 Len=0 TSV=5478418 TSER=5424769
================================================================================
IPv4 Conversations
Filter:<No Filter>
                                               |       <-      | |       ->      | |     Total     |
                                               | Frames  Bytes | | Frames  Bytes | | Frames  Bytes |
10.0.1.3             <-> 10.0.1.2              312826 471682424  149296  10124444  462122 481806868
================================================================================
  1   0.000000     10.0.1.3 -> 10.0.1.2     TCP 54510 > glrpc [SYN] Seq=0 Win=5840 Len=0 MSS=1460 TSV=5428805 TSER=0 WS=6
  2   0.000356     10.0.1.2 -> 10.0.1.3     TCP glrpc > 54510 [SYN, ACK] Seq=0 Ack=1 Win=14480 Len=0 MSS=1460 TSV=5482454 TSER=5428805 WS=6
  3   0.000377     10.0.1.3 -> 10.0.1.2     TCP 54510 > glrpc [ACK] Seq=1 Ack=1 Win=5888 Len=0 TSV=5428805 TSER=5482454
462085  49.186788     10.0.1.3 -> 10.0.1.2     TCP 54510 > glrpc [FIN, ACK] Seq=270901 Ack=451035901 Win=1991296 Len=0 TSV=5441101 TSER=5494721
462086  49.187155     10.0.1.2 -> 10.0.1.3     TCP glrpc > 54510 [FIN, ACK] Seq=451035901 Ack=270902 Win=130048 Len=0 TSV=5494752 TSER=5441101
================================================================================
IPv4 Conversations
Filter:<No Filter>
                                               |       <-      | |       ->      | |     Total     |
                                               | Frames  Bytes | | Frames  Bytes | | Frames  Bytes |
10.0.1.3             <-> 10.0.1.2              312826 471682424  149261  10122134  462087 481804558
================================================================================
  1   0.000000     10.0.1.3 -> 10.0.1.2     TCP 54512 > glrpc [SYN] Seq=0 Win=5840 Len=0 MSS=1460 TSV=5445093 TSER=0 WS=6
  2   0.000289     10.0.1.2 -> 10.0.1.3     TCP glrpc > 54512 [SYN, ACK] Seq=0 Ack=1 Win=14480 Len=0 MSS=1460 TSV=5498744 TSER=5445093 WS=6
  3   0.000302     10.0.1.3 -> 10.0.1.2     TCP 54512 > glrpc [ACK] Seq=1 Ack=1 Win=5888 Len=0 TSV=5445093 TSER=5498744
462468  49.208230     10.0.1.3 -> 10.0.1.2     TCP 54512 > glrpc [FIN, ACK] Seq=270901 Ack=451035901 Win=1991296 Len=0 TSV=5457395 TSER=5511034
462469  49.208599     10.0.1.2 -> 10.0.1.3     TCP glrpc > 54512 [FIN, ACK] Seq=451035901 Ack=270902 Win=130048 Len=0 TSV=5511047 TSER=5457395
================================================================================
IPv4 Conversations
Filter:<No Filter>
                                               |       <-      | |       ->      | |     Total     |
                                               | Frames  Bytes | | Frames  Bytes | | Frames  Bytes |
10.0.1.3             <-> 10.0.1.2              312823 471682226  149647  10147610  462470 481829836
================================================================================
  1   0.000000     10.0.1.3 -> 10.0.1.2     TCP 54514 > glrpc [SYN] Seq=0 Win=5840 Len=0 MSS=1460 TSV=5461439 TSER=0 WS=6
  2   0.000317     10.0.1.2 -> 10.0.1.3     TCP glrpc > 54514 [SYN, ACK] Seq=0 Ack=1 Win=14480 Len=0 MSS=1460 TSV=5515091 TSER=5461439 WS=6
  3   0.000341     10.0.1.3 -> 10.0.1.2     TCP 54514 > glrpc [ACK] Seq=1 Ack=1 Win=5888 Len=0 TSV=5461439 TSER=5515091
461717  49.214123     10.0.1.3 -> 10.0.1.2     TCP 54514 > glrpc [FIN, ACK] Seq=270901 Ack=451035901 Win=1972608 Len=0 TSV=5473742 TSER=5527366
461718  49.214488     10.0.1.2 -> 10.0.1.3     TCP glrpc > 54514 [FIN, ACK] Seq=451035901 Ack=270902 Win=130048 Len=0 TSV=5527395 TSER=5473742
================================================================================
IPv4 Conversations
Filter:<No Filter>
                                               |       <-      | |       ->      | |     Total     |
                                               | Frames  Bytes | | Frames  Bytes | | Frames  Bytes |
10.0.1.3             <-> 10.0.1.2              312829 471682622  148890  10097648  461719 481780270
================================================================================
  1   0.000000     10.0.1.3 -> 10.0.1.2     TCP 38050 > glrpc [SYN] Seq=0 Win=5840 Len=0 MSS=1460 TSV=5477795 TSER=0 WS=6
  2   0.000300     10.0.1.2 -> 10.0.1.3     TCP glrpc > 38050 [SYN, ACK] Seq=0 Ack=1 Win=14480 Len=0 MSS=1460 TSV=5531448 TSER=5477795 WS=6
  3   0.000322     10.0.1.3 -> 10.0.1.2     TCP 38050 > glrpc [ACK] Seq=1 Ack=1 Win=5888 Len=0 TSV=5477795 TSER=5531448
462461  49.328003     10.0.1.3 -> 10.0.1.2     TCP 38050 > glrpc [FIN, ACK] Seq=270901 Ack=451035901 Win=1988416 Len=0 TSV=5490127 TSER=5543753
462462  49.328424     10.0.1.2 -> 10.0.1.3     TCP glrpc > 38050 [FIN, ACK] Seq=451035901 Ack=270902 Win=130048 Len=0 TSV=5543781 TSER=5490127
================================================================================
IPv4 Conversations
Filter:<No Filter>
                                               |       <-      | |       ->      | |     Total     |
                                               | Frames  Bytes | | Frames  Bytes | | Frames  Bytes |
10.0.1.3             <-> 10.0.1.2              312835 471683018  149628  10146356  462463 481829374
================================================================================
  1   0.000000     10.0.1.3 -> 10.0.1.2     TCP 38052 > glrpc [SYN] Seq=0 Win=5840 Len=0 MSS=1460 TSV=5494196 TSER=0 WS=6
  2   0.000287     10.0.1.2 -> 10.0.1.3     TCP glrpc > 38052 [SYN, ACK] Seq=0 Ack=1 Win=14480 Len=0 MSS=1460 TSV=5547851 TSER=5494196 WS=6
  3   0.000302     10.0.1.3 -> 10.0.1.2     TCP 38052 > glrpc [ACK] Seq=1 Ack=1 Win=5888 Len=0 TSV=5494197 TSER=5547851
462093  49.222762     10.0.1.3 -> 10.0.1.2     TCP 38052 > glrpc [FIN, ACK] Seq=270901 Ack=451035901 Win=2004608 Len=0 TSV=5506502 TSER=5560126
462094  49.223156     10.0.1.2 -> 10.0.1.3     TCP glrpc > 38052 [FIN, ACK] Seq=451035901 Ack=270902 Win=130048 Len=0 TSV=5560158 TSER=5506502
================================================================================
IPv4 Conversations
Filter:<No Filter>
                                               |       <-      | |       ->      | |     Total     |
                                               | Frames  Bytes | | Frames  Bytes | | Frames  Bytes |
10.0.1.3             <-> 10.0.1.2              312824 471682292  149271  10122794  462095 481805086
================================================================================
  1   0.000000     10.0.1.3 -> 10.0.1.2     TCP 38057 > glrpc [SYN] Seq=0 Win=5840 Len=0 MSS=1460 TSV=5510508 TSER=0 WS=6
  2   0.000302     10.0.1.2 -> 10.0.1.3     TCP glrpc > 38057 [SYN, ACK] Seq=0 Ack=1 Win=14480 Len=0 MSS=1460 TSV=5564163 TSER=5510508 WS=6
  3   0.000325     10.0.1.3 -> 10.0.1.2     TCP 38057 > glrpc [ACK] Seq=1 Ack=1 Win=5888 Len=0 TSV=5510508 TSER=5564163
462042  49.212169     10.0.1.3 -> 10.0.1.2     TCP 38057 > glrpc [FIN, ACK] Seq=270901 Ack=451035901 Win=1991296 Len=0 TSV=5522810 TSER=5576436
462043  49.212619     10.0.1.2 -> 10.0.1.3     TCP glrpc > 38057 [FIN, ACK] Seq=451035901 Ack=270902 Win=130048 Len=0 TSV=5576467 TSER=5522810
================================================================================
IPv4 Conversations
Filter:<No Filter>
                                               |       <-      | |       ->      | |     Total     |
                                               | Frames  Bytes | | Frames  Bytes | | Frames  Bytes |
10.0.1.3             <-> 10.0.1.2              312835 471683018  149209  10118702  462044 481801720
================================================================================
  1   0.000000     10.0.1.3 -> 10.0.1.2     TCP 38059 > glrpc [SYN] Seq=0 Win=5840 Len=0 MSS=1460 TSV=5526848 TSER=0 WS=6
  2   0.000316     10.0.1.2 -> 10.0.1.3     TCP glrpc > 38059 [SYN, ACK] Seq=0 Ack=1 Win=14480 Len=0 MSS=1460 TSV=5580505 TSER=5526848 WS=6
  3   0.000337     10.0.1.3 -> 10.0.1.2     TCP 38059 > glrpc [ACK] Seq=1 Ack=1 Win=5888 Len=0 TSV=5526848 TSER=5580505
461967  49.270128     10.0.1.3 -> 10.0.1.2     TCP 38059 > glrpc [FIN, ACK] Seq=270901 Ack=451035901 Win=1993024 Len=0 TSV=5539165 TSER=5592811
461968  49.271325     10.0.1.2 -> 10.0.1.3     TCP glrpc > 38059 [FIN, ACK] Seq=451035901 Ack=270902 Win=131264 Len=0 TSV=5592824 TSER=5539165
================================================================================
IPv4 Conversations
Filter:<No Filter>
                                               |       <-      | |       ->      | |     Total     |
                                               | Frames  Bytes | | Frames  Bytes | | Frames  Bytes |
10.0.1.3             <-> 10.0.1.2              312818 471681896  149151  10114874  461969 481796770
================================================================================
  1   0.000000     10.0.1.3 -> 10.0.1.2     TCP 38061 > glrpc [SYN] Seq=0 Win=5840 Len=0 MSS=1460 TSV=5543183 TSER=0 WS=6
  2   0.000354     10.0.1.2 -> 10.0.1.3     TCP glrpc > 38061 [SYN, ACK] Seq=0 Ack=1 Win=14480 Len=0 MSS=1460 TSV=5596842 TSER=5543183 WS=6
  3   0.000377     10.0.1.3 -> 10.0.1.2     TCP 38061 > glrpc [ACK] Seq=1 Ack=1 Win=5888 Len=0 TSV=5543184 TSER=5596842
461829  49.163372     10.0.1.3 -> 10.0.1.2     TCP 38061 > glrpc [FIN, ACK] Seq=270901 Ack=451035901 Win=1988416 Len=0 TSV=5555474 TSER=5609105
461830  49.163788     10.0.1.2 -> 10.0.1.3     TCP glrpc > 38061 [FIN, ACK] Seq=451035901 Ack=270902 Win=130048 Len=0 TSV=5609133 TSER=5555474
================================================================================
IPv4 Conversations
Filter:<No Filter>
                                               |       <-      | |       ->      | |     Total     |
                                               | Frames  Bytes | | Frames  Bytes | | Frames  Bytes |
10.0.1.3             <-> 10.0.1.2              312825 471682358  149006  10105304  461831 481787662
================================================================================
  1   0.000000     10.0.1.3 -> 10.0.1.2     TCP 59783 > glrpc [SYN] Seq=0 Win=5840 Len=0 MSS=1460 TSV=5559498 TSER=0 WS=6
  2   0.000302     10.0.1.2 -> 10.0.1.3     TCP glrpc > 59783 [SYN, ACK] Seq=0 Ack=1 Win=14480 Len=0 MSS=1460 TSV=5613157 TSER=5559498 WS=6
  3   0.000324     10.0.1.3 -> 10.0.1.2     TCP 59783 > glrpc [ACK] Seq=1 Ack=1 Win=5888 Len=0 TSV=5559498 TSER=5613157
462357  50.120002     10.0.1.3 -> 10.0.1.2     TCP 59783 > glrpc [FIN, ACK] Seq=270901 Ack=451035901 Win=1989952 Len=0 TSV=5572028 TSER=5625659
462358  50.120395     10.0.1.2 -> 10.0.1.3     TCP glrpc > 59783 [FIN, ACK] Seq=451035901 Ack=270902 Win=128832 Len=0 TSV=5625688 TSER=5572028
================================================================================
IPv4 Conversations
Filter:<No Filter>
                                               |       <-      | |       ->      | |     Total     |
                                               | Frames  Bytes | | Frames  Bytes | | Frames  Bytes |
10.0.1.3             <-> 10.0.1.2              312822 471682160  149537  10140350  462359 481822510
================================================================================
  1   0.000000     10.0.1.3 -> 10.0.1.2     TCP 59787 > glrpc [SYN] Seq=0 Win=5840 Len=0 MSS=1460 TSV=5576051 TSER=0 WS=6
  2   0.000301     10.0.1.2 -> 10.0.1.3     TCP glrpc > 59787 [SYN, ACK] Seq=0 Ack=1 Win=14480 Len=0 MSS=1460 TSV=5629712 TSER=5576051 WS=6
  3   0.000323     10.0.1.3 -> 10.0.1.2     TCP 59787 > glrpc [ACK] Seq=1 Ack=1 Win=5888 Len=0 TSV=5576051 TSER=5629712
461164  49.308463     10.0.1.3 -> 10.0.1.2     TCP 59787 > glrpc [FIN, ACK] Seq=270901 Ack=451035901 Win=1990144 Len=0 TSV=5588378 TSER=5642022
461165  49.308868     10.0.1.2 -> 10.0.1.3     TCP glrpc > 59787 [FIN, ACK] Seq=451035901 Ack=270902 Win=130048 Len=0 TSV=5642040 TSER=5588378
================================================================================
IPv4 Conversations
Filter:<No Filter>
                                               |       <-      | |       ->      | |     Total     |
                                               | Frames  Bytes | | Frames  Bytes | | Frames  Bytes |
10.0.1.3             <-> 10.0.1.2              312834 471682952  148332  10060820  461166 481743772
================================================================================
  1   0.000000     10.0.1.3 -> 10.0.1.2     TCP 59790 > glrpc [SYN] Seq=0 Win=5840 Len=0 MSS=1460 TSV=5592417 TSER=0 WS=6
  2   0.000285     10.0.1.2 -> 10.0.1.3     TCP glrpc > 59790 [SYN, ACK] Seq=0 Ack=1 Win=14480 Len=0 MSS=1460 TSV=5646079 TSER=5592417 WS=6
  3   0.000305     10.0.1.3 -> 10.0.1.2     TCP 59790 > glrpc [ACK] Seq=1 Ack=1 Win=5888 Len=0 TSV=5592417 TSER=5646079
462498  49.217154     10.0.1.3 -> 10.0.1.2     TCP 59790 > glrpc [FIN, ACK] Seq=270901 Ack=451035901 Win=1990144 Len=0 TSV=5604722 TSER=5658355
462499  49.217556     10.0.1.2 -> 10.0.1.3     TCP glrpc > 59790 [FIN, ACK] Seq=451035901 Ack=270902 Win=130048 Len=0 TSV=5658384 TSER=5604722
================================================================================
IPv4 Conversations
Filter:<No Filter>
                                               |       <-      | |       ->      | |     Total     |
                                               | Frames  Bytes | | Frames  Bytes | | Frames  Bytes |
10.0.1.3             <-> 10.0.1.2              312826 471682424  149674  10149392  462500 481831816
================================================================================
