  1   0.000000     10.0.1.3 -> 10.0.1.2     TCP 41195 > glrpc [SYN] Seq=0 Win=5840 Len=0 MSS=1460 TSV=5232161 TSER=0 WS=6
  2   0.000272     10.0.1.2 -> 10.0.1.3     TCP glrpc > 41195 [SYN, ACK] Seq=0 Ack=1 Win=14480 Len=0 MSS=1460 TSV=5264452 TSER=5232161 WS=6
  3   0.000295     10.0.1.3 -> 10.0.1.2     TCP 41195 > glrpc [ACK] Seq=1 Ack=1 Win=5888 Len=0 TSV=5232161 TSER=5264452
458503  51.775432     10.0.1.3 -> 10.0.1.2     TCP 41195 > glrpc [FIN, ACK] Seq=270901 Ack=451035901 Win=2007552 Len=0 TSV=5245105 TSER=5277380
458504  51.775846     10.0.1.2 -> 10.0.1.3     TCP glrpc > 41195 [FIN, ACK] Seq=451035901 Ack=270902 Win=149312 Len=0 TSV=5277397 TSER=5245105
  1   0.000000     10.0.1.3 -> 10.0.1.2     TCP 47065 > glrpc [SYN] Seq=0 Win=5840 Len=0 MSS=1460 TSV=5251297 TSER=0 WS=6
  2   0.000292     10.0.1.2 -> 10.0.1.3     TCP glrpc > 47065 [SYN, ACK] Seq=0 Ack=1 Win=14480 Len=0 MSS=1460 TSV=5283590 TSER=5251297 WS=6
  3   0.000315     10.0.1.3 -> 10.0.1.2     TCP 47065 > glrpc [ACK] Seq=1 Ack=1 Win=5888 Len=0 TSV=5251297 TSER=5283590
438727  49.702007     10.0.1.3 -> 10.0.1.2     TCP 47065 > glrpc [FIN, ACK] Seq=270901 Ack=451035901 Win=2004608 Len=0 TSV=5263723 TSER=5296006
438728  49.702437     10.0.1.2 -> 10.0.1.3     TCP glrpc > 47065 [FIN, ACK] Seq=451035901 Ack=270902 Win=131264 Len=0 TSV=5296017 TSER=5263723
  1   0.000000     10.0.1.3 -> 10.0.1.2     TCP 47067 > glrpc [SYN] Seq=0 Win=5840 Len=0 MSS=1460 TSV=5269708 TSER=0 WS=6
  2   0.000289     10.0.1.2 -> 10.0.1.3     TCP glrpc > 47067 [SYN, ACK] Seq=0 Ack=1 Win=14480 Len=0 MSS=1460 TSV=5302003 TSER=5269708 WS=6
  3   0.000313     10.0.1.3 -> 10.0.1.2     TCP 47067 > glrpc [ACK] Seq=1 Ack=1 Win=5888 Len=0 TSV=5269709 TSER=5302003
  1   0.000000     10.0.1.3 -> 10.0.1.2     TCP 47069 > glrpc [SYN] Seq=0 Win=5840 Len=0 MSS=1460 TSV=5288125 TSER=0 WS=6
  2   0.000317     10.0.1.2 -> 10.0.1.3     TCP glrpc > 47069 [SYN, ACK] Seq=0 Ack=1 Win=14480 Len=0 MSS=1460 TSV=5320421 TSER=5288125 WS=6
  3   0.000341     10.0.1.3 -> 10.0.1.2     TCP 47069 > glrpc [ACK] Seq=1 Ack=1 Win=5888 Len=0 TSV=5288125 TSER=5320421
440691  49.698636     10.0.1.3 -> 10.0.1.2     TCP 47069 > glrpc [FIN, ACK] Seq=270901 Ack=451035901 Win=2004608 Len=0 TSV=5300550 TSER=5332831
440692  49.699052     10.0.1.2 -> 10.0.1.3     TCP glrpc > 47069 [FIN, ACK] Seq=451035901 Ack=270902 Win=130048 Len=0 TSV=5332846 TSER=5300550
  1   0.000000     10.0.1.3 -> 10.0.1.2     TCP 47071 > glrpc [SYN] Seq=0 Win=5840 Len=0 MSS=1460 TSV=5306489 TSER=0 WS=6
  2   0.000335     10.0.1.2 -> 10.0.1.3     TCP glrpc > 47071 [SYN, ACK] Seq=0 Ack=1 Win=14480 Len=0 MSS=1460 TSV=5338786 TSER=5306489 WS=6
  3   0.000358     10.0.1.3 -> 10.0.1.2     TCP 47071 > glrpc [ACK] Seq=1 Ack=1 Win=5888 Len=0 TSV=5306489 TSER=5338786
458650  49.999801     10.0.1.3 -> 10.0.1.2     TCP 47071 > glrpc [FIN, ACK] Seq=270901 Ack=451035901 Win=2004608 Len=0 TSV=5318989 TSER=5351258
458651  50.000202     10.0.1.2 -> 10.0.1.3     TCP glrpc > 47071 [FIN, ACK] Seq=451035901 Ack=270902 Win=128832 Len=0 TSV=5351287 TSER=5318989
  1   0.000000     10.0.1.3 -> 10.0.1.2     TCP 47073 > glrpc [SYN] Seq=0 Win=5840 Len=0 MSS=1460 TSV=5325034 TSER=0 WS=6
  2   0.000283     10.0.1.2 -> 10.0.1.3     TCP glrpc > 47073 [SYN, ACK] Seq=0 Ack=1 Win=14480 Len=0 MSS=1460 TSV=5357333 TSER=5325034 WS=6
  3   0.000305     10.0.1.3 -> 10.0.1.2     TCP 47073 > glrpc [ACK] Seq=1 Ack=1 Win=5888 Len=0 TSV=5325034 TSER=5357333
457931  49.669393     10.0.1.3 -> 10.0.1.2     TCP 47073 > glrpc [FIN, ACK] Seq=270901 Ack=451035901 Win=2004608 Len=0 TSV=5337452 TSER=5369723
457932  49.669822     10.0.1.2 -> 10.0.1.3     TCP glrpc > 47073 [FIN, ACK] Seq=451035901 Ack=270902 Win=131264 Len=0 TSV=5369751 TSER=5337452
  1   0.000000     10.0.1.3 -> 10.0.1.2     TCP 34064 > glrpc [SYN] Seq=0 Win=5840 Len=0 MSS=1460 TSV=5343631 TSER=0 WS=6
  2   0.000311     10.0.1.2 -> 10.0.1.3     TCP glrpc > 34064 [SYN, ACK] Seq=0 Ack=1 Win=14480 Len=0 MSS=1460 TSV=5375930 TSER=5343631 WS=6
  3   0.000333     10.0.1.3 -> 10.0.1.2     TCP 34064 > glrpc [ACK] Seq=1 Ack=1 Win=5888 Len=0 TSV=5343631 TSER=5375930
433427  49.871898     10.0.1.3 -> 10.0.1.2     TCP 34064 > glrpc [FIN, ACK] Seq=270901 Ack=451035901 Win=2001728 Len=0 TSV=5356098 TSER=5388371
433428  49.872318     10.0.1.2 -> 10.0.1.3     TCP glrpc > 34064 [FIN, ACK] Seq=451035901 Ack=270902 Win=131264 Len=0 TSV=5388399 TSER=5356098
  1   0.000000     10.0.1.3 -> 10.0.1.2     TCP 34066 > glrpc [SYN] Seq=0 Win=5840 Len=0 MSS=1460 TSV=5362096 TSER=0 WS=6
  2   0.000275     10.0.1.2 -> 10.0.1.3     TCP glrpc > 34066 [SYN, ACK] Seq=0 Ack=1 Win=14480 Len=0 MSS=1460 TSV=5394398 TSER=5362096 WS=6
  3   0.000312     10.0.1.3 -> 10.0.1.2     TCP 34066 > glrpc [ACK] Seq=1 Ack=1 Win=5888 Len=0 TSV=5362097 TSER=5394398
  1   0.000000     10.0.1.3 -> 10.0.1.2     TCP 34068 > glrpc [SYN] Seq=0 Win=5840 Len=0 MSS=1460 TSV=5380546 TSER=0 WS=6
  2   0.000301     10.0.1.2 -> 10.0.1.3     TCP glrpc > 34068 [SYN, ACK] Seq=0 Ack=1 Win=14480 Len=0 MSS=1460 TSV=5412849 TSER=5380546 WS=6
  3   0.000323     10.0.1.3 -> 10.0.1.2     TCP 34068 > glrpc [ACK] Seq=1 Ack=1 Win=5888 Len=0 TSV=5380546 TSER=5412849
443496  49.782339     10.0.1.3 -> 10.0.1.2     TCP 34068 > glrpc [FIN, ACK] Seq=270901 Ack=451035901 Win=2007552 Len=0 TSV=5392992 TSER=5425267
443497  49.782770     10.0.1.2 -> 10.0.1.3     TCP glrpc > 34068 [FIN, ACK] Seq=451035901 Ack=270902 Win=130048 Len=0 TSV=5425296 TSER=5392992
  1   0.000000     10.0.1.3 -> 10.0.1.2     TCP 34070 > glrpc [SYN] Seq=0 Win=5840 Len=0 MSS=1460 TSV=5398916 TSER=0 WS=6
  2   0.000367     10.0.1.2 -> 10.0.1.3     TCP glrpc > 34070 [SYN, ACK] Seq=0 Ack=1 Win=14480 Len=0 MSS=1460 TSV=5431220 TSER=5398916 WS=6
  3   0.000388     10.0.1.3 -> 10.0.1.2     TCP 34070 > glrpc [ACK] Seq=1 Ack=1 Win=5888 Len=0 TSV=5398916 TSER=5431220
434653  49.933810     10.0.1.3 -> 10.0.1.2     TCP 34070 > glrpc [FIN, ACK] Seq=270901 Ack=451035901 Win=2004608 Len=0 TSV=5411399 TSER=5443673
434654  49.934225     10.0.1.2 -> 10.0.1.3     TCP glrpc > 34070 [FIN, ACK] Seq=451035901 Ack=270902 Win=131264 Len=0 TSV=5443704 TSER=5411399
  1   0.000000     10.0.1.3 -> 10.0.1.2     TCP 35295 > glrpc [SYN] Seq=0 Win=5840 Len=0 MSS=1460 TSV=5417244 TSER=0 WS=6
  2   0.000296     10.0.1.2 -> 10.0.1.3     TCP glrpc > 35295 [SYN, ACK] Seq=0 Ack=1 Win=14480 Len=0 MSS=1460 TSV=5449550 TSER=5417244 WS=6
  3   0.000318     10.0.1.3 -> 10.0.1.2     TCP 35295 > glrpc [ACK] Seq=1 Ack=1 Win=5888 Len=0 TSV=5417244 TSER=5449550
409961  49.696778     10.0.1.3 -> 10.0.1.2     TCP 35295 > glrpc [FIN, ACK] Seq=270901 Ack=451035901 Win=2004608 Len=0 TSV=5429668 TSER=5461945
409962  49.697214     10.0.1.2 -> 10.0.1.3     TCP glrpc > 35295 [FIN, ACK] Seq=451035901 Ack=270902 Win=130048 Len=0 TSV=5461975 TSER=5429668
  1   0.000000     10.0.1.3 -> 10.0.1.2     TCP 35297 > glrpc [SYN] Seq=0 Win=5840 Len=0 MSS=1460 TSV=5435311 TSER=0 WS=6
  2   0.000365     10.0.1.2 -> 10.0.1.3     TCP glrpc > 35297 [SYN, ACK] Seq=0 Ack=1 Win=14480 Len=0 MSS=1460 TSV=5467618 TSER=5435311 WS=6
  3   0.000390     10.0.1.3 -> 10.0.1.2     TCP 35297 > glrpc [ACK] Seq=1 Ack=1 Win=5888 Len=0 TSV=5435311 TSER=5467618
428674  49.749526     10.0.1.3 -> 10.0.1.2     TCP 35297 > glrpc [FIN, ACK] Seq=270901 Ack=451035901 Win=2004608 Len=0 TSV=5447748 TSER=5480046
428675  49.749966     10.0.1.2 -> 10.0.1.3     TCP glrpc > 35297 [FIN, ACK] Seq=451035901 Ack=270902 Win=128832 Len=0 TSV=5480056 TSER=5447748
  1   0.000000     10.0.1.3 -> 10.0.1.2     TCP 35299 > glrpc [SYN] Seq=0 Win=5840 Len=0 MSS=1460 TSV=5453524 TSER=0 WS=6
  2   0.000302     10.0.1.2 -> 10.0.1.3     TCP glrpc > 35299 [SYN, ACK] Seq=0 Ack=1 Win=14480 Len=0 MSS=1460 TSV=5485832 TSER=5453524 WS=6
  3   0.000323     10.0.1.3 -> 10.0.1.2     TCP 35299 > glrpc [ACK] Seq=1 Ack=1 Win=5888 Len=0 TSV=5453524 TSER=5485832
443415  51.033947     10.0.1.3 -> 10.0.1.2     TCP 35299 > glrpc [FIN, ACK] Seq=270901 Ack=451035901 Win=2004608 Len=0 TSV=5466283 TSER=5498575
443416  51.034329     10.0.1.2 -> 10.0.1.3     TCP glrpc > 35299 [FIN, ACK] Seq=451035901 Ack=270902 Win=142080 Len=0 TSV=5498592 TSER=5466283
  1   0.000000     10.0.1.3 -> 10.0.1.2     TCP 35301 > glrpc [SYN] Seq=0 Win=5840 Len=0 MSS=1460 TSV=5472364 TSER=0 WS=6
  2   0.000285     10.0.1.2 -> 10.0.1.3     TCP glrpc > 35301 [SYN, ACK] Seq=0 Ack=1 Win=14480 Len=0 MSS=1460 TSV=5504674 TSER=5472364 WS=6
  3   0.000306     10.0.1.3 -> 10.0.1.2     TCP 35301 > glrpc [ACK] Seq=1 Ack=1 Win=5888 Len=0 TSV=5472364 TSER=5504674
458658  49.865510     10.0.1.3 -> 10.0.1.2     TCP 35301 > glrpc [FIN, ACK] Seq=270901 Ack=451035901 Win=2004480 Len=0 TSV=5484831 TSER=5517127
458659  49.865922     10.0.1.2 -> 10.0.1.3     TCP glrpc > 35301 [FIN, ACK] Seq=451035901 Ack=270902 Win=131264 Len=0 TSV=5517141 TSER=5484831
  1   0.000000     10.0.1.3 -> 10.0.1.2     TCP 35640 > glrpc [SYN] Seq=0 Win=5840 Len=0 MSS=1460 TSV=5490946 TSER=0 WS=6
  2   0.000303     10.0.1.2 -> 10.0.1.3     TCP glrpc > 35640 [SYN, ACK] Seq=0 Ack=1 Win=14480 Len=0 MSS=1460 TSV=5523257 TSER=5490946 WS=6
  3   0.000324     10.0.1.3 -> 10.0.1.2     TCP 35640 > glrpc [ACK] Seq=1 Ack=1 Win=5888 Len=0 TSV=5490946 TSER=5523257
430018  51.653780     10.0.1.3 -> 10.0.1.2     TCP 35640 > glrpc [FIN, ACK] Seq=270901 Ack=451035901 Win=2004608 Len=0 TSV=5503860 TSER=5536157
430019  51.654202     10.0.1.2 -> 10.0.1.3     TCP glrpc > 35640 [FIN, ACK] Seq=451035901 Ack=270902 Win=150528 Len=0 TSV=5536172 TSER=5503860
  1   0.000000     10.0.1.3 -> 10.0.1.2     TCP 35642 > glrpc [SYN] Seq=0 Win=5840 Len=0 MSS=1460 TSV=5509670 TSER=0 WS=6
  2   0.000371     10.0.1.2 -> 10.0.1.3     TCP glrpc > 35642 [SYN, ACK] Seq=0 Ack=1 Win=14480 Len=0 MSS=1460 TSV=5541982 TSER=5509670 WS=6
  3   0.000392     10.0.1.3 -> 10.0.1.2     TCP 35642 > glrpc [ACK] Seq=1 Ack=1 Win=5888 Len=0 TSV=5509670 TSER=5541982
458659  49.892243     10.0.1.3 -> 10.0.1.2     TCP 35642 > glrpc [FIN, ACK] Seq=270901 Ack=451035901 Win=2004608 Len=0 TSV=5522143 TSER=5554441
458660  49.892694     10.0.1.2 -> 10.0.1.3     TCP glrpc > 35642 [FIN, ACK] Seq=451035901 Ack=270902 Win=130048 Len=0 TSV=5554456 TSER=5522143
  1   0.000000     10.0.1.3 -> 10.0.1.2     TCP 35644 > glrpc [SYN] Seq=0 Win=5840 Len=0 MSS=1460 TSV=5528368 TSER=0 WS=6
  2   0.000285     10.0.1.2 -> 10.0.1.3     TCP glrpc > 35644 [SYN, ACK] Seq=0 Ack=1 Win=14480 Len=0 MSS=1460 TSV=5560682 TSER=5528368 WS=6
  3   0.000306     10.0.1.3 -> 10.0.1.2     TCP 35644 > glrpc [ACK] Seq=1 Ack=1 Win=5888 Len=0 TSV=5528368 TSER=5560682
458784  50.161510     10.0.1.3 -> 10.0.1.2     TCP 35644 > glrpc [FIN, ACK] Seq=270901 Ack=451035901 Win=2004608 Len=0 TSV=5540908 TSER=5573193
458785  50.161920     10.0.1.2 -> 10.0.1.3     TCP glrpc > 35644 [FIN, ACK] Seq=451035901 Ack=270902 Win=132480 Len=0 TSV=5573223 TSER=5540908
  1   0.000000     10.0.1.3 -> 10.0.1.2     TCP 35646 > glrpc [SYN] Seq=0 Win=5840 Len=0 MSS=1460 TSV=5547065 TSER=0 WS=6
  2   0.000285     10.0.1.2 -> 10.0.1.3     TCP glrpc > 35646 [SYN, ACK] Seq=0 Ack=1 Win=14480 Len=0 MSS=1460 TSV=5579381 TSER=5547065 WS=6
  3   0.000306     10.0.1.3 -> 10.0.1.2     TCP 35646 > glrpc [ACK] Seq=1 Ack=1 Win=5888 Len=0 TSV=5547065 TSER=5579381
431638  49.760505     10.0.1.3 -> 10.0.1.2     TCP 35646 > glrpc [FIN, ACK] Seq=270901 Ack=451035901 Win=2007552 Len=0 TSV=5559506 TSER=5591792
431639  49.760945     10.0.1.2 -> 10.0.1.3     TCP glrpc > 35646 [FIN, ACK] Seq=451035901 Ack=270902 Win=130048 Len=0 TSV=5591822 TSER=5559506
  1   0.000000     10.0.1.3 -> 10.0.1.2     TCP 44367 > glrpc [SYN] Seq=0 Win=5840 Len=0 MSS=1460 TSV=5565464 TSER=0 WS=6
  2   0.000303     10.0.1.2 -> 10.0.1.3     TCP glrpc > 44367 [SYN, ACK] Seq=0 Ack=1 Win=14480 Len=0 MSS=1460 TSV=5597780 TSER=5565464 WS=6
  3   0.000327     10.0.1.3 -> 10.0.1.2     TCP 44367 > glrpc [ACK] Seq=1 Ack=1 Win=5888 Len=0 TSV=5565464 TSER=5597780
434016  53.278234     10.0.1.3 -> 10.0.1.2     TCP 44367 > glrpc [FIN, ACK] Seq=270901 Ack=451035901 Win=2004480 Len=0 TSV=5578783 TSER=5611072
434017  53.278664     10.0.1.2 -> 10.0.1.3     TCP glrpc > 44367 [FIN, ACK] Seq=451035901 Ack=270902 Win=154112 Len=0 TSV=5611101 TSER=5578783
  1   0.000000     10.0.1.3 -> 10.0.1.2     TCP 44369 > glrpc [SYN] Seq=0 Win=5840 Len=0 MSS=1460 TSV=5585105 TSER=0 WS=6
  2   0.000349     10.0.1.2 -> 10.0.1.3     TCP glrpc > 44369 [SYN, ACK] Seq=0 Ack=1 Win=14480 Len=0 MSS=1460 TSV=5617423 TSER=5585105 WS=6
  3   0.000373     10.0.1.3 -> 10.0.1.2     TCP 44369 > glrpc [ACK] Seq=1 Ack=1 Win=5888 Len=0 TSV=5585105 TSER=5617423
439195  50.089614     10.0.1.3 -> 10.0.1.2     TCP 44369 > glrpc [FIN, ACK] Seq=270901 Ack=451035901 Win=2004608 Len=0 TSV=5597627 TSER=5629938
439196  50.090020     10.0.1.2 -> 10.0.1.3     TCP glrpc > 44369 [FIN, ACK] Seq=451035901 Ack=270902 Win=128832 Len=0 TSV=5629946 TSER=5597627
