  1   0.000000     10.0.1.3 -> 10.0.1.2     TCP 38996 > glrpc [SYN] Seq=0 Win=5840 Len=0 MSS=1460 TSV=3590474 TSER=0 WS=6
  2   0.000296     10.0.1.2 -> 10.0.1.3     TCP glrpc > 38996 [SYN, ACK] Seq=0 Ack=1 Win=14480 Len=0 MSS=1460 TSV=3622642 TSER=3590474 WS=6
  3   0.000319     10.0.1.3 -> 10.0.1.2     TCP 38996 > glrpc [ACK] Seq=1 Ack=1 Win=5888 Len=0 TSV=3590474 TSER=3622642
50027   5.664009     10.0.1.3 -> 10.0.1.2     TCP 38996 > glrpc [FIN, ACK] Seq=30101 Ack=50115101 Win=1969856 Len=0 TSV=3591890 TSER=3624028
50028   5.664441     10.0.1.2 -> 10.0.1.3     TCP glrpc > 38996 [FIN, ACK] Seq=50115101 Ack=30102 Win=64128 Len=0 TSV=3624058 TSER=3591890
  1   0.000000     10.0.1.3 -> 10.0.1.2     TCP 38998 > glrpc [SYN] Seq=0 Win=5840 Len=0 MSS=1460 TSV=3594199 TSER=0 WS=6
  2   0.000274     10.0.1.2 -> 10.0.1.3     TCP glrpc > 38998 [SYN, ACK] Seq=0 Ack=1 Win=14480 Len=0 MSS=1460 TSV=3626368 TSER=3594199 WS=6
  3   0.000295     10.0.1.3 -> 10.0.1.2     TCP 38998 > glrpc [ACK] Seq=1 Ack=1 Win=5888 Len=0 TSV=3594199 TSER=3626368
50107   5.697492     10.0.1.3 -> 10.0.1.2     TCP 38998 > glrpc [FIN, ACK] Seq=30101 Ack=50115101 Win=1946112 Len=0 TSV=3595624 TSER=3627762
50108   5.697929     10.0.1.2 -> 10.0.1.3     TCP glrpc > 38998 [FIN, ACK] Seq=50115101 Ack=30102 Win=64128 Len=0 TSV=3627792 TSER=3595624
  1   0.000000     10.0.1.3 -> 10.0.1.2     TCP 39000 > glrpc [SYN] Seq=0 Win=5840 Len=0 MSS=1460 TSV=3597932 TSER=0 WS=6
  2   0.000300     10.0.1.2 -> 10.0.1.3     TCP glrpc > 39000 [SYN, ACK] Seq=0 Ack=1 Win=14480 Len=0 MSS=1460 TSV=3630100 TSER=3597932 WS=6
  3   0.000321     10.0.1.3 -> 10.0.1.2     TCP 39000 > glrpc [ACK] Seq=1 Ack=1 Win=5888 Len=0 TSV=3597932 TSER=3630100
50096   5.609860     10.0.1.3 -> 10.0.1.2     TCP 39000 > glrpc [FIN, ACK] Seq=30101 Ack=50115101 Win=1969280 Len=0 TSV=3599334 TSER=3631488
50097   5.610290     10.0.1.2 -> 10.0.1.3     TCP glrpc > 39000 [FIN, ACK] Seq=50115101 Ack=30102 Win=64128 Len=0 TSV=3631503 TSER=3599334
  1   0.000000     10.0.1.3 -> 10.0.1.2     TCP 57952 > glrpc [SYN] Seq=0 Win=5840 Len=0 MSS=1460 TSV=3601646 TSER=0 WS=6
  2   0.000291     10.0.1.2 -> 10.0.1.3     TCP glrpc > 57952 [SYN, ACK] Seq=0 Ack=1 Win=14480 Len=0 MSS=1460 TSV=3633815 TSER=3601646 WS=6
  3   0.000313     10.0.1.3 -> 10.0.1.2     TCP 57952 > glrpc [ACK] Seq=1 Ack=1 Win=5888 Len=0 TSV=3601646 TSER=3633815
49768   5.532850     10.0.1.3 -> 10.0.1.2     TCP 57952 > glrpc [FIN, ACK] Seq=30101 Ack=50115101 Win=1969280 Len=0 TSV=3603029 TSER=3635170
49769   5.533316     10.0.1.2 -> 10.0.1.3     TCP glrpc > 57952 [FIN, ACK] Seq=50115101 Ack=30102 Win=64128 Len=0 TSV=3635198 TSER=3603029
  1   0.000000     10.0.1.3 -> 10.0.1.2     TCP 57954 > glrpc [SYN] Seq=0 Win=5840 Len=0 MSS=1460 TSV=3605347 TSER=0 WS=6
  2   0.000277     10.0.1.2 -> 10.0.1.3     TCP glrpc > 57954 [SYN, ACK] Seq=0 Ack=1 Win=14480 Len=0 MSS=1460 TSV=3637517 TSER=3605347 WS=6
  3   0.000298     10.0.1.3 -> 10.0.1.2     TCP 57954 > glrpc [ACK] Seq=1 Ack=1 Win=5888 Len=0 TSV=3605347 TSER=3637517
49580   5.582097     10.0.1.3 -> 10.0.1.2     TCP 57954 > glrpc [FIN, ACK] Seq=30101 Ack=50115101 Win=1975104 Len=0 TSV=3606743 TSER=3638905
49581   5.582525     10.0.1.2 -> 10.0.1.3     TCP glrpc > 57954 [FIN, ACK] Seq=50115101 Ack=30102 Win=64128 Len=0 TSV=3638912 TSER=3606743
  1   0.000000     10.0.1.3 -> 10.0.1.2     TCP 57956 > glrpc [SYN] Seq=0 Win=5840 Len=0 MSS=1460 TSV=3609059 TSER=0 WS=6
  2   0.000295     10.0.1.2 -> 10.0.1.3     TCP glrpc > 57956 [SYN, ACK] Seq=0 Ack=1 Win=14480 Len=0 MSS=1460 TSV=3641228 TSER=3609059 WS=6
  3   0.000320     10.0.1.3 -> 10.0.1.2     TCP 57956 > glrpc [ACK] Seq=1 Ack=1 Win=5888 Len=0 TSV=3609059 TSER=3641228
49749   5.572182     10.0.1.3 -> 10.0.1.2     TCP 57956 > glrpc [FIN, ACK] Seq=30101 Ack=50115101 Win=1931648 Len=0 TSV=3610452 TSER=3642610
49750   5.572624     10.0.1.2 -> 10.0.1.3     TCP glrpc > 57956 [FIN, ACK] Seq=50115101 Ack=30102 Win=64128 Len=0 TSV=3642621 TSER=3610452
  1   0.000000     10.0.1.3 -> 10.0.1.2     TCP 57958 > glrpc [SYN] Seq=0 Win=5840 Len=0 MSS=1460 TSV=3612768 TSER=0 WS=6
  2   0.000288     10.0.1.2 -> 10.0.1.3     TCP glrpc > 57958 [SYN, ACK] Seq=0 Ack=1 Win=14480 Len=0 MSS=1460 TSV=3644937 TSER=3612768 WS=6
  3   0.000309     10.0.1.3 -> 10.0.1.2     TCP 57958 > glrpc [ACK] Seq=1 Ack=1 Win=5888 Len=0 TSV=3612768 TSER=3644937
50190   5.513839     10.0.1.3 -> 10.0.1.2     TCP 57958 > glrpc [FIN, ACK] Seq=30101 Ack=50115101 Win=1989952 Len=0 TSV=3614146 TSER=3646301
50191   5.514255     10.0.1.2 -> 10.0.1.3     TCP glrpc > 57958 [FIN, ACK] Seq=50115101 Ack=30102 Win=64128 Len=0 TSV=3646316 TSER=3614146
  1   0.000000     10.0.1.3 -> 10.0.1.2     TCP 57960 > glrpc [SYN] Seq=0 Win=5840 Len=0 MSS=1460 TSV=3616450 TSER=0 WS=6
  2   0.000271     10.0.1.2 -> 10.0.1.3     TCP glrpc > 57960 [SYN, ACK] Seq=0 Ack=1 Win=14480 Len=0 MSS=1460 TSV=3648619 TSER=3616450 WS=6
  3   0.000294     10.0.1.3 -> 10.0.1.2     TCP 57960 > glrpc [ACK] Seq=1 Ack=1 Win=5888 Len=0 TSV=3616450 TSER=3648619
49790   5.623161     10.0.1.3 -> 10.0.1.2     TCP 57960 > glrpc [FIN, ACK] Seq=30101 Ack=50115101 Win=2004608 Len=0 TSV=3617855 TSER=3650017
49791   5.623617     10.0.1.2 -> 10.0.1.3     TCP glrpc > 57960 [FIN, ACK] Seq=50115101 Ack=30102 Win=64128 Len=0 TSV=3650025 TSER=3617855
  1   0.000000     10.0.1.3 -> 10.0.1.2     TCP 57962 > glrpc [SYN] Seq=0 Win=5840 Len=0 MSS=1460 TSV=3620153 TSER=0 WS=6
  2   0.000281     10.0.1.2 -> 10.0.1.3     TCP glrpc > 57962 [SYN, ACK] Seq=0 Ack=1 Win=14480 Len=0 MSS=1460 TSV=3652323 TSER=3620153 WS=6
  3   0.000302     10.0.1.3 -> 10.0.1.2     TCP 57962 > glrpc [ACK] Seq=1 Ack=1 Win=5888 Len=0 TSV=3620153 TSER=3652323
50178   5.552830     10.0.1.3 -> 10.0.1.2     TCP 57962 > glrpc [FIN, ACK] Seq=30101 Ack=50115101 Win=1952512 Len=0 TSV=3621541 TSER=3653700
50179   5.553257     10.0.1.2 -> 10.0.1.3     TCP glrpc > 57962 [FIN, ACK] Seq=50115101 Ack=30102 Win=64128 Len=0 TSV=3653712 TSER=3621541
  1   0.000000     10.0.1.3 -> 10.0.1.2     TCP 57964 > glrpc [SYN] Seq=0 Win=5840 Len=0 MSS=1460 TSV=3623867 TSER=0 WS=6
  2   0.000298     10.0.1.2 -> 10.0.1.3     TCP glrpc > 57964 [SYN, ACK] Seq=0 Ack=1 Win=14480 Len=0 MSS=1460 TSV=3656038 TSER=3623867 WS=6
  3   0.000324     10.0.1.3 -> 10.0.1.2     TCP 57964 > glrpc [ACK] Seq=1 Ack=1 Win=5888 Len=0 TSV=3623867 TSER=3656038
50107   5.553250     10.0.1.3 -> 10.0.1.2     TCP 57964 > glrpc [FIN, ACK] Seq=30101 Ack=50115101 Win=1969856 Len=0 TSV=3625255 TSER=3657395
50108   5.553638     10.0.1.2 -> 10.0.1.3     TCP glrpc > 57964 [FIN, ACK] Seq=50115101 Ack=30102 Win=64128 Len=0 TSV=3657426 TSER=3625255
  1   0.000000     10.0.1.3 -> 10.0.1.2     TCP 57966 > glrpc [SYN] Seq=0 Win=5840 Len=0 MSS=1460 TSV=3627570 TSER=0 WS=6
  2   0.000300     10.0.1.2 -> 10.0.1.3     TCP glrpc > 57966 [SYN, ACK] Seq=0 Ack=1 Win=14480 Len=0 MSS=1460 TSV=3659741 TSER=3627570 WS=6
  3   0.000323     10.0.1.3 -> 10.0.1.2     TCP 57966 > glrpc [ACK] Seq=1 Ack=1 Win=5888 Len=0 TSV=3627570 TSER=3659741
50578   5.586769     10.0.1.3 -> 10.0.1.2     TCP 57966 > glrpc [FIN, ACK] Seq=30101 Ack=50115101 Win=1975104 Len=0 TSV=3628967 TSER=3661130
50579   5.587216     10.0.1.2 -> 10.0.1.3     TCP glrpc > 57966 [FIN, ACK] Seq=50115101 Ack=30102 Win=64128 Len=0 TSV=3661138 TSER=3628967
  1   0.000000     10.0.1.3 -> 10.0.1.2     TCP 57968 > glrpc [SYN] Seq=0 Win=5840 Len=0 MSS=1460 TSV=3631278 TSER=0 WS=6
  2   0.000366     10.0.1.2 -> 10.0.1.3     TCP glrpc > 57968 [SYN, ACK] Seq=0 Ack=1 Win=14480 Len=0 MSS=1460 TSV=3663449 TSER=3631278 WS=6
  3   0.000388     10.0.1.3 -> 10.0.1.2     TCP 57968 > glrpc [ACK] Seq=1 Ack=1 Win=5888 Len=0 TSV=3631278 TSER=3663449
50233   5.542081     10.0.1.3 -> 10.0.1.2     TCP 57968 > glrpc [FIN, ACK] Seq=30101 Ack=50115101 Win=1859584 Len=0 TSV=3632664 TSER=3664819
50234   5.542496     10.0.1.2 -> 10.0.1.3     TCP glrpc > 57968 [FIN, ACK] Seq=50115101 Ack=30102 Win=64128 Len=0 TSV=3664835 TSER=3632664
  1   0.000000     10.0.1.3 -> 10.0.1.2     TCP 57970 > glrpc [SYN] Seq=0 Win=5840 Len=0 MSS=1460 TSV=3634997 TSER=0 WS=6
  2   0.000296     10.0.1.2 -> 10.0.1.3     TCP glrpc > 57970 [SYN, ACK] Seq=0 Ack=1 Win=14480 Len=0 MSS=1460 TSV=3667168 TSER=3634997 WS=6
  3   0.000318     10.0.1.3 -> 10.0.1.2     TCP 57970 > glrpc [ACK] Seq=1 Ack=1 Win=5888 Len=0 TSV=3634997 TSER=3667168
49792   5.532070     10.0.1.3 -> 10.0.1.2     TCP 57970 > glrpc [FIN, ACK] Seq=30101 Ack=50115101 Win=1988416 Len=0 TSV=3636380 TSER=3668541
49793   5.532495     10.0.1.2 -> 10.0.1.3     TCP glrpc > 57970 [FIN, ACK] Seq=50115101 Ack=30102 Win=64128 Len=0 TSV=3668551 TSER=3636380
  1   0.000000     10.0.1.3 -> 10.0.1.2     TCP 57972 > glrpc [SYN] Seq=0 Win=5840 Len=0 MSS=1460 TSV=3638690 TSER=0 WS=6
  2   0.000282     10.0.1.2 -> 10.0.1.3     TCP glrpc > 57972 [SYN, ACK] Seq=0 Ack=1 Win=14480 Len=0 MSS=1460 TSV=3670861 TSER=3638690 WS=6
  3   0.000307     10.0.1.3 -> 10.0.1.2     TCP 57972 > glrpc [ACK] Seq=1 Ack=1 Win=5888 Len=0 TSV=3638690 TSER=3670861
49804   5.507393     10.0.1.3 -> 10.0.1.2     TCP 57972 > glrpc [FIN, ACK] Seq=30101 Ack=50115101 Win=1978560 Len=0 TSV=3640067 TSER=3672209
49805   5.507798     10.0.1.2 -> 10.0.1.3     TCP glrpc > 57972 [FIN, ACK] Seq=50115101 Ack=30102 Win=64128 Len=0 TSV=3672238 TSER=3640067
  1   0.000000     10.0.1.3 -> 10.0.1.2     TCP 57974 > glrpc [SYN] Seq=0 Win=5840 Len=0 MSS=1460 TSV=3642364 TSER=0 WS=6
  2   0.000292     10.0.1.2 -> 10.0.1.3     TCP glrpc > 57974 [SYN, ACK] Seq=0 Ack=1 Win=14480 Len=0 MSS=1460 TSV=3674536 TSER=3642364 WS=6
  3   0.000312     10.0.1.3 -> 10.0.1.2     TCP 57974 > glrpc [ACK] Seq=1 Ack=1 Win=5888 Len=0 TSV=3642364 TSER=3674536
50052   5.482992     10.0.1.3 -> 10.0.1.2     TCP 57974 > glrpc [FIN, ACK] Seq=30101 Ack=50115101 Win=1984384 Len=0 TSV=3643735 TSER=3675878
50053   5.483451     10.0.1.2 -> 10.0.1.3     TCP glrpc > 57974 [FIN, ACK] Seq=50115101 Ack=30102 Win=64128 Len=0 TSV=3675907 TSER=3643735
  1   0.000000     10.0.1.3 -> 10.0.1.2     TCP 57976 > glrpc [SYN] Seq=0 Win=5840 Len=0 MSS=1460 TSV=3646042 TSER=0 WS=6
  2   0.000290     10.0.1.2 -> 10.0.1.3     TCP glrpc > 57976 [SYN, ACK] Seq=0 Ack=1 Win=14480 Len=0 MSS=1460 TSV=3678215 TSER=3646042 WS=6
  3   0.000313     10.0.1.3 -> 10.0.1.2     TCP 57976 > glrpc [ACK] Seq=1 Ack=1 Win=5888 Len=0 TSV=3646042 TSER=3678215
50346   5.539484     10.0.1.3 -> 10.0.1.2     TCP 57976 > glrpc [FIN, ACK] Seq=30101 Ack=50115101 Win=1990144 Len=0 TSV=3647427 TSER=3679571
50347   5.539948     10.0.1.2 -> 10.0.1.3     TCP glrpc > 57976 [FIN, ACK] Seq=50115101 Ack=30102 Win=64128 Len=0 TSV=3679600 TSER=3647427
  1   0.000000     10.0.1.3 -> 10.0.1.2     TCP 57978 > glrpc [SYN] Seq=0 Win=5840 Len=0 MSS=1460 TSV=3649750 TSER=0 WS=6
  2   0.000367     10.0.1.2 -> 10.0.1.3     TCP glrpc > 57978 [SYN, ACK] Seq=0 Ack=1 Win=14480 Len=0 MSS=1460 TSV=3681923 TSER=3649750 WS=6
  3   0.000391     10.0.1.3 -> 10.0.1.2     TCP 57978 > glrpc [ACK] Seq=1 Ack=1 Win=5888 Len=0 TSV=3649751 TSER=3681923
50241   5.516648     10.0.1.3 -> 10.0.1.2     TCP 57978 > glrpc [FIN, ACK] Seq=30101 Ack=50115101 Win=1972224 Len=0 TSV=3651130 TSER=3683272
50242   5.517114     10.0.1.2 -> 10.0.1.3     TCP glrpc > 57978 [FIN, ACK] Seq=50115101 Ack=30102 Win=64128 Len=0 TSV=3683302 TSER=3651130
  1   0.000000     10.0.1.3 -> 10.0.1.2     TCP 57980 > glrpc [SYN] Seq=0 Win=5840 Len=0 MSS=1460 TSV=3653441 TSER=0 WS=6
  2   0.000305     10.0.1.2 -> 10.0.1.3     TCP glrpc > 57980 [SYN, ACK] Seq=0 Ack=1 Win=14480 Len=0 MSS=1460 TSV=3685614 TSER=3653441 WS=6
  3   0.000330     10.0.1.3 -> 10.0.1.2     TCP 57980 > glrpc [ACK] Seq=1 Ack=1 Win=5888 Len=0 TSV=3653441 TSER=3685614
49951   5.540403     10.0.1.3 -> 10.0.1.2     TCP 57980 > glrpc [FIN, ACK] Seq=30101 Ack=50115101 Win=1961792 Len=0 TSV=3654826 TSER=3686968
49952   5.540860     10.0.1.2 -> 10.0.1.3     TCP glrpc > 57980 [FIN, ACK] Seq=50115101 Ack=30102 Win=64128 Len=0 TSV=3686999 TSER=3654826
  1   0.000000     10.0.1.3 -> 10.0.1.2     TCP 57982 > glrpc [SYN] Seq=0 Win=5840 Len=0 MSS=1460 TSV=3657137 TSER=0 WS=6
  2   0.000292     10.0.1.2 -> 10.0.1.3     TCP glrpc > 57982 [SYN, ACK] Seq=0 Ack=1 Win=14480 Len=0 MSS=1460 TSV=3689310 TSER=3657137 WS=6
  3   0.000314     10.0.1.3 -> 10.0.1.2     TCP 57982 > glrpc [ACK] Seq=1 Ack=1 Win=5888 Len=0 TSV=3657137 TSER=3689310
50270   5.571497     10.0.1.3 -> 10.0.1.2     TCP 57982 > glrpc [FIN, ACK] Seq=30101 Ack=50115101 Win=1986688 Len=0 TSV=3658530 TSER=3690673
50271   5.571978     10.0.1.2 -> 10.0.1.3     TCP glrpc > 57982 [FIN, ACK] Seq=50115101 Ack=30102 Win=64128 Len=0 TSV=3690703 TSER=3658530
  1   0.000000     10.0.1.3 -> 10.0.1.2     TCP 57984 > glrpc [SYN] Seq=0 Win=5840 Len=0 MSS=1460 TSV=3660855 TSER=0 WS=6
  2   0.000286     10.0.1.2 -> 10.0.1.3     TCP glrpc > 57984 [SYN, ACK] Seq=0 Ack=1 Win=14480 Len=0 MSS=1460 TSV=3693028 TSER=3660855 WS=6
  3   0.000301     10.0.1.3 -> 10.0.1.2     TCP 57984 > glrpc [ACK] Seq=1 Ack=1 Win=5888 Len=0 TSV=3660855 TSER=3693028
49704   5.535837     10.0.1.3 -> 10.0.1.2     TCP 57984 > glrpc [FIN, ACK] Seq=30101 Ack=50115101 Win=1988416 Len=0 TSV=3662239 TSER=3694381
49705   5.536235     10.0.1.2 -> 10.0.1.3     TCP glrpc > 57984 [FIN, ACK] Seq=50115101 Ack=30102 Win=64128 Len=0 TSV=3694412 TSER=3662239
