  1   0.000000     10.0.1.3 -> 10.0.1.2     TCP 59792 > glrpc [SYN] Seq=0 Win=5840 Len=0 MSS=1460 TSV=5608766 TSER=0 WS=6
  2   0.000299     10.0.1.2 -> 10.0.1.3     TCP glrpc > 59792 [SYN, ACK] Seq=0 Ack=1 Win=14480 Len=0 MSS=1460 TSV=5662430 TSER=5608766 WS=6
  3   0.000322     10.0.1.3 -> 10.0.1.2     TCP 59792 > glrpc [ACK] Seq=1 Ack=1 Win=5888 Len=0 TSV=5608767 TSER=5662430
513746  54.845298     10.0.1.3 -> 10.0.1.2     TCP 59792 > glrpc [FIN, ACK] Seq=301001 Ack=501151001 Win=1978560 Len=0 TSV=5622478 TSER=5676114
513747  54.845700     10.0.1.2 -> 10.0.1.3     TCP glrpc > 59792 [FIN, ACK] Seq=501151001 Ack=301002 Win=154112 Len=0 TSV=5676142 TSER=5622478
================================================================================
IPv4 Conversations
Filter:<No Filter>
                                               |       <-      | |       ->      | |     Total     |
                                               | Frames  Bytes | | Frames  Bytes | | Frames  Bytes |
10.0.1.3             <-> 10.0.1.2              347577 524091090  166171  11268294  513748 535359384
================================================================================
  1   0.000000     10.0.1.3 -> 10.0.1.2     TCP 45955 > glrpc [SYN] Seq=0 Win=5840 Len=0 MSS=1460 TSV=5626815 TSER=0 WS=6
  2   0.000283     10.0.1.2 -> 10.0.1.3     TCP glrpc > 45955 [SYN, ACK] Seq=0 Ack=1 Win=14480 Len=0 MSS=1460 TSV=5680480 TSER=5626815 WS=6
  3   0.000304     10.0.1.3 -> 10.0.1.2     TCP 45955 > glrpc [ACK] Seq=1 Ack=1 Win=5888 Len=0 TSV=5626815 TSER=5680480
513837  55.595554     10.0.1.3 -> 10.0.1.2     TCP 45955 > glrpc [FIN, ACK] Seq=301001 Ack=501151001 Win=1993024 Len=0 TSV=5640714 TSER=5694366
513838  55.595912     10.0.1.2 -> 10.0.1.3     TCP glrpc > 45955 [FIN, ACK] Seq=501151001 Ack=301002 Win=150528 Len=0 TSV=5694380 TSER=5640714
================================================================================
IPv4 Conversations
Filter:<No Filter>
                                               |       <-      | |       ->      | |     Total     |
                                               | Frames  Bytes | | Frames  Bytes | | Frames  Bytes |
10.0.1.3             <-> 10.0.1.2              347582 524091420  166257  11273970  513839 535365390
================================================================================
  1   0.000000     10.0.1.3 -> 10.0.1.2     TCP 45957 > glrpc [SYN] Seq=0 Win=5840 Len=0 MSS=1460 TSV=5645091 TSER=0 WS=6
  2   0.000365     10.0.1.2 -> 10.0.1.3     TCP glrpc > 45957 [SYN, ACK] Seq=0 Ack=1 Win=14480 Len=0 MSS=1460 TSV=5698757 TSER=5645091 WS=6
  3   0.000387     10.0.1.3 -> 10.0.1.2     TCP 45957 > glrpc [ACK] Seq=1 Ack=1 Win=5888 Len=0 TSV=5645091 TSER=5698757
513590  54.766257     10.0.1.3 -> 10.0.1.2     TCP 45957 > glrpc [FIN, ACK] Seq=301001 Ack=501151001 Win=1989952 Len=0 TSV=5658782 TSER=5712420
513591  54.766603     10.0.1.2 -> 10.0.1.3     TCP glrpc > 45957 [FIN, ACK] Seq=501151001 Ack=301002 Win=155328 Len=0 TSV=5712449 TSER=5658782
================================================================================
IPv4 Conversations
Filter:<No Filter>
                                               |       <-      | |       ->      | |     Total     |
                                               | Frames  Bytes | | Frames  Bytes | | Frames  Bytes |
10.0.1.3             <-> 10.0.1.2              347569 524090562  166023  11258526  513592 535349088
================================================================================
  1   0.000000     10.0.1.3 -> 10.0.1.2     TCP 45961 > glrpc [SYN] Seq=0 Win=5840 Len=0 MSS=1460 TSV=5663104 TSER=0 WS=6
  2   0.000301     10.0.1.2 -> 10.0.1.3     TCP glrpc > 45961 [SYN, ACK] Seq=0 Ack=1 Win=14480 Len=0 MSS=1460 TSV=5716771 TSER=5663104 WS=6
  3   0.000324     10.0.1.3 -> 10.0.1.2     TCP 45961 > glrpc [ACK] Seq=1 Ack=1 Win=5888 Len=0 TSV=5663104 TSER=5716771
513711  54.830106     10.0.1.3 -> 10.0.1.2     TCP 45961 > glrpc [FIN, ACK] Seq=301001 Ack=501151001 Win=1998848 Len=0 TSV=5676812 TSER=5730452
513712  54.830534     10.0.1.2 -> 10.0.1.3     TCP glrpc > 45961 [FIN, ACK] Seq=501151001 Ack=301002 Win=155328 Len=0 TSV=5730480 TSER=5676812
================================================================================
IPv4 Conversations
Filter:<No Filter>
                                               |       <-      | |       ->      | |     Total     |
                                               | Frames  Bytes | | Frames  Bytes | | Frames  Bytes |
10.0.1.3             <-> 10.0.1.2              347585 524091618  166128  11265456  513713 535357074
================================================================================
  1   0.000000     10.0.1.3 -> 10.0.1.2     TCP 45963 > glrpc [SYN] Seq=0 Win=5840 Len=0 MSS=1460 TSV=5681143 TSER=0 WS=6
  2   0.000285     10.0.1.2 -> 10.0.1.3     TCP glrpc > 45963 [SYN, ACK] Seq=0 Ack=1 Win=14480 Len=0 MSS=1460 TSV=5734811 TSER=5681143 WS=6
  3   0.000308     10.0.1.3 -> 10.0.1.2     TCP 45963 > glrpc [ACK] Seq=1 Ack=1 Win=5888 Len=0 TSV=5681143 TSER=5734811
513212  54.831129     10.0.1.3 -> 10.0.1.2     TCP 45963 > glrpc [FIN, ACK] Seq=301001 Ack=501151001 Win=2004608 Len=0 TSV=5694851 TSER=5748510
513213  54.831556     10.0.1.2 -> 10.0.1.3     TCP glrpc > 45963 [FIN, ACK] Seq=501151001 Ack=301002 Win=155328 Len=0 TSV=5748520 TSER=5694851
================================================================================
IPv4 Conversations
Filter:<No Filter>
                                               |       <-      | |       ->      | |     Total     |
                                               | Frames  Bytes | | Frames  Bytes | | Frames  Bytes |
10.0.1.3             <-> 10.0.1.2              347566 524090364  165648  11233776  513214 535324140
================================================================================
  1   0.000000     10.0.1.3 -> 10.0.1.2     TCP ssr-servermgr > glrpc [SYN] Seq=0 Win=5840 Len=0 MSS=1460 TSV=5699172 TSER=0 WS=6
  2   0.000295     10.0.1.2 -> 10.0.1.3     TCP glrpc > ssr-servermgr [SYN, ACK] Seq=0 Ack=1 Win=14480 Len=0 MSS=1460 TSV=5752842 TSER=5699172 WS=6
  3   0.000319     10.0.1.3 -> 10.0.1.2     TCP ssr-servermgr > glrpc [ACK] Seq=1 Ack=1 Win=5888 Len=0 TSV=5699172 TSER=5752842
513478  54.931494     10.0.1.3 -> 10.0.1.2     TCP ssr-servermgr > glrpc [FIN, ACK] Seq=301001 Ack=501151001 Win=1993024 Len=0 TSV=5712905 TSER=5766546
513479  54.931912     10.0.1.2 -> 10.0.1.3     TCP glrpc > ssr-servermgr [FIN, ACK] Seq=501151001 Ack=301002 Win=149312 Len=0 TSV=5766576 TSER=5712905
================================================================================
IPv4 Conversations
Filter:<No Filter>
                                               |       <-      | |       ->      | |     Total     |
                                               | Frames  Bytes | | Frames  Bytes | | Frames  Bytes |
10.0.1.3             <-> 10.0.1.2              347593 524092146  165887  11249550  513480 535341696
================================================================================
  1   0.000000     10.0.1.3 -> 10.0.1.2     TCP 57737 > glrpc [SYN] Seq=0 Win=5840 Len=0 MSS=1460 TSV=5717282 TSER=0 WS=6
  2   0.000273     10.0.1.2 -> 10.0.1.3     TCP glrpc > 57737 [SYN, ACK] Seq=0 Ack=1 Win=14480 Len=0 MSS=1460 TSV=5770953 TSER=5717282 WS=6
  3   0.000294     10.0.1.3 -> 10.0.1.2     TCP 57737 > glrpc [ACK] Seq=1 Ack=1 Win=5888 Len=0 TSV=5717282 TSER=5770953
512931  55.375888     10.0.1.3 -> 10.0.1.2     TCP 57737 > glrpc [FIN, ACK] Seq=301001 Ack=501151001 Win=1995968 Len=0 TSV=5731126 TSER=5784783
512932  55.376329     10.0.1.2 -> 10.0.1.3     TCP glrpc > 57737 [FIN, ACK] Seq=501151001 Ack=301002 Win=150528 Len=0 TSV=5784798 TSER=5731126
================================================================================
IPv4 Conversations
Filter:<No Filter>
                                               |       <-      | |       ->      | |     Total     |
                                               | Frames  Bytes | | Frames  Bytes | | Frames  Bytes |
10.0.1.3             <-> 10.0.1.2              347564 524090232  165369  11215362  512933 535305594
================================================================================
  1   0.000000     10.0.1.3 -> 10.0.1.2     TCP 57741 > glrpc [SYN] Seq=0 Win=5840 Len=0 MSS=1460 TSV=5735500 TSER=0 WS=6
  2   0.000283     10.0.1.2 -> 10.0.1.3     TCP glrpc > 57741 [SYN, ACK] Seq=0 Ack=1 Win=14480 Len=0 MSS=1460 TSV=5789173 TSER=5735500 WS=6
  3   0.000308     10.0.1.3 -> 10.0.1.2     TCP 57741 > glrpc [ACK] Seq=1 Ack=1 Win=5888 Len=0 TSV=5735500 TSER=5789173
513058  54.845672     10.0.1.3 -> 10.0.1.2     TCP 57741 > glrpc [FIN, ACK] Seq=301001 Ack=501151001 Win=1989952 Len=0 TSV=5749212 TSER=5802868
513059  54.846030     10.0.1.2 -> 10.0.1.3     TCP glrpc > 57741 [FIN, ACK] Seq=501151001 Ack=301002 Win=155328 Len=0 TSV=5802885 TSER=5749212
================================================================================
IPv4 Conversations
Filter:<No Filter>
                                               |       <-      | |       ->      | |     Total     |
                                               | Frames  Bytes | | Frames  Bytes | | Frames  Bytes |
10.0.1.3             <-> 10.0.1.2              347589 524091882  165471  11222094  513060 535313976
================================================================================
  1   0.000000     10.0.1.3 -> 10.0.1.2     TCP 57743 > glrpc [SYN] Seq=0 Win=5840 Len=0 MSS=1460 TSV=5753572 TSER=0 WS=6
  2   0.000363     10.0.1.2 -> 10.0.1.3     TCP glrpc > 57743 [SYN, ACK] Seq=0 Ack=1 Win=14480 Len=0 MSS=1460 TSV=5807246 TSER=5753572 WS=6
  3   0.000387     10.0.1.3 -> 10.0.1.2     TCP 57743 > glrpc [ACK] Seq=1 Ack=1 Win=5888 Len=0 TSV=5753572 TSER=5807246
513922  54.663130     10.0.1.3 -> 10.0.1.2     TCP 57743 > glrpc [FIN, ACK] Seq=301001 Ack=501151001 Win=1995968 Len=0 TSV=5767238 TSER=5820900
513923  54.663486     10.0.1.2 -> 10.0.1.3     TCP glrpc > 57743 [FIN, ACK] Seq=501151001 Ack=301002 Win=150528 Len=0 TSV=5820913 TSER=5767238
================================================================================
IPv4 Conversations
Filter:<No Filter>
                                               |       <-      | |       ->      | |     Total     |
                                               | Frames  Bytes | | Frames  Bytes | | Frames  Bytes |
10.0.1.3             <-> 10.0.1.2              347602 524092740  166322  11278260  513924 535371000
================================================================================
  1   0.000000     10.0.1.3 -> 10.0.1.2     TCP 57746 > glrpc [SYN] Seq=0 Win=5840 Len=0 MSS=1460 TSV=5771553 TSER=0 WS=6
  2   0.000307     10.0.1.2 -> 10.0.1.3     TCP glrpc > 57746 [SYN, ACK] Seq=0 Ack=1 Win=14480 Len=0 MSS=1460 TSV=5825229 TSER=5771553 WS=6
  3   0.000328     10.0.1.3 -> 10.0.1.2     TCP 57746 > glrpc [ACK] Seq=1 Ack=1 Win=5888 Len=0 TSV=5771554 TSER=5825229
510123  54.544299     10.0.1.3 -> 10.0.1.2     TCP 57746 > glrpc [FIN, ACK] Seq=301001 Ack=501151001 Win=2001728 Len=0 TSV=5785189 TSER=5838835
510124  54.544754     10.0.1.2 -> 10.0.1.3     TCP glrpc > 57746 [FIN, ACK] Seq=501151001 Ack=301002 Win=146944 Len=0 TSV=5838866 TSER=5785189
================================================================================
IPv4 Conversations
Filter:<No Filter>
                                               |       <-      | |       ->      | |     Total     |
                                               | Frames  Bytes | | Frames  Bytes | | Frames  Bytes |
10.0.1.3             <-> 10.0.1.2              347587 524091750  162538  11028516  510125 535120266
================================================================================
  1   0.000000     10.0.1.3 -> 10.0.1.2     TCP 56174 > glrpc [SYN] Seq=0 Win=5840 Len=0 MSS=1460 TSV=5789549 TSER=0 WS=6
  2   0.000307     10.0.1.2 -> 10.0.1.3     TCP glrpc > 56174 [SYN, ACK] Seq=0 Ack=1 Win=14480 Len=0 MSS=1460 TSV=5843226 TSER=5789549 WS=6
  3   0.000330     10.0.1.3 -> 10.0.1.2     TCP 56174 > glrpc [ACK] Seq=1 Ack=1 Win=5888 Len=0 TSV=5789550 TSER=5843226
512449  54.864328     10.0.1.3 -> 10.0.1.2     TCP 56174 > glrpc [FIN, ACK] Seq=301001 Ack=501151001 Win=1998848 Len=0 TSV=5803265 TSER=5856929
512450  54.864716     10.0.1.2 -> 10.0.1.3     TCP glrpc > 56174 [FIN, ACK] Seq=501151001 Ack=301002 Win=149312 Len=0 TSV=5856943 TSER=5803265
================================================================================
IPv4 Conversations
Filter:<No Filter>
                                               |       <-      | |       ->      | |     Total     |
                                               | Frames  Bytes | | Frames  Bytes | | Frames  Bytes |
10.0.1.3             <-> 10.0.1.2              347582 524091420  164869  11182362  512451 535273782
================================================================================
  1   0.000000     10.0.1.3 -> 10.0.1.2     TCP 56178 > glrpc [SYN] Seq=0 Win=5840 Len=0 MSS=1460 TSV=5807658 TSER=0 WS=6
  2   0.000312     10.0.1.2 -> 10.0.1.3     TCP glrpc > 56178 [SYN, ACK] Seq=0 Ack=1 Win=14480 Len=0 MSS=1460 TSV=5861337 TSER=5807658 WS=6
  3   0.000334     10.0.1.3 -> 10.0.1.2     TCP 56178 > glrpc [ACK] Seq=1 Ack=1 Win=5888 Len=0 TSV=5807658 TSER=5861337
511531  54.853076     10.0.1.3 -> 10.0.1.2     TCP 56178 > glrpc [FIN, ACK] Seq=301001 Ack=501151001 Win=1995968 Len=0 TSV=5821372 TSER=5875021
511532  54.853461     10.0.1.2 -> 10.0.1.3     TCP glrpc > 56178 [FIN, ACK] Seq=501151001 Ack=301002 Win=154112 Len=0 TSV=5875051 TSER=5821372
================================================================================
IPv4 Conversations
Filter:<No Filter>
                                               |       <-      | |       ->      | |     Total     |
                                               | Frames  Bytes | | Frames  Bytes | | Frames  Bytes |
10.0.1.3             <-> 10.0.1.2              347592 524092080  163941  11121114  511533 535213194
================================================================================
  1   0.000000     10.0.1.3 -> 10.0.1.2     TCP 56180 > glrpc [SYN] Seq=0 Win=5840 Len=0 MSS=1460 TSV=5825702 TSER=0 WS=6
  2   0.000283     10.0.1.2 -> 10.0.1.3     TCP glrpc > 56180 [SYN, ACK] Seq=0 Ack=1 Win=14480 Len=0 MSS=1460 TSV=5879381 TSER=5825702 WS=6
  3   0.000305     10.0.1.3 -> 10.0.1.2     TCP 56180 > glrpc [ACK] Seq=1 Ack=1 Win=5888 Len=0 TSV=5825702 TSER=5879381
511426  54.909903     10.0.1.3 -> 10.0.1.2     TCP 56180 > glrpc [FIN, ACK] Seq=301001 Ack=501151001 Win=1988416 Len=0 TSV=5839429 TSER=5893097
511427  54.910299     10.0.1.2 -> 10.0.1.3     TCP glrpc > 56180 [FIN, ACK] Seq=501151001 Ack=301002 Win=149312 Len=0 TSV=5893110 TSER=5839429
================================================================================
IPv4 Conversations
Filter:<No Filter>
                                               |       <-      | |       ->      | |     Total     |
                                               | Frames  Bytes | | Frames  Bytes | | Frames  Bytes |
10.0.1.3             <-> 10.0.1.2              347590 524091948  163838  11114316  511428 535206264
================================================================================
  1   0.000000     10.0.1.3 -> 10.0.1.2     TCP 56182 > glrpc [SYN] Seq=0 Win=5840 Len=0 MSS=1460 TSV=5843800 TSER=0 WS=6
  2   0.000318     10.0.1.2 -> 10.0.1.3     TCP glrpc > 56182 [SYN, ACK] Seq=0 Ack=1 Win=14480 Len=0 MSS=1460 TSV=5897481 TSER=5843800 WS=6
  3   0.000344     10.0.1.3 -> 10.0.1.2     TCP 56182 > glrpc [ACK] Seq=1 Ack=1 Win=5888 Len=0 TSV=5843800 TSER=5897481
512084  54.791593     10.0.1.3 -> 10.0.1.2     TCP 56182 > glrpc [FIN, ACK] Seq=301001 Ack=501151001 Win=1993024 Len=0 TSV=5857498 TSER=5911148
512085  54.791962     10.0.1.2 -> 10.0.1.3     TCP glrpc > 56182 [FIN, ACK] Seq=501151001 Ack=301002 Win=149312 Len=0 TSV=5911180 TSER=5857498
================================================================================
IPv4 Conversations
Filter:<No Filter>
                                               |       <-      | |       ->      | |     Total     |
                                               | Frames  Bytes | | Frames  Bytes | | Frames  Bytes |
10.0.1.3             <-> 10.0.1.2              347582 524091420  164504  11158272  512086 535249692
================================================================================
  1   0.000000     10.0.1.3 -> 10.0.1.2     TCP 39551 > glrpc [SYN] Seq=0 Win=5840 Len=0 MSS=1460 TSV=5861873 TSER=0 WS=6
  2   0.000315     10.0.1.2 -> 10.0.1.3     TCP glrpc > 39551 [SYN, ACK] Seq=0 Ack=1 Win=14480 Len=0 MSS=1460 TSV=5915555 TSER=5861873 WS=6
  3   0.000335     10.0.1.3 -> 10.0.1.2     TCP 39551 > glrpc [ACK] Seq=1 Ack=1 Win=5888 Len=0 TSV=5861873 TSER=5915555
511731  54.927817     10.0.1.3 -> 10.0.1.2     TCP 39551 > glrpc [FIN, ACK] Seq=301001 Ack=501151001 Win=1993024 Len=0 TSV=5875605 TSER=5929270
511732  54.928208     10.0.1.2 -> 10.0.1.3     TCP glrpc > 39551 [FIN, ACK] Seq=501151001 Ack=301002 Win=154112 Len=0 TSV=5929288 TSER=5875605
================================================================================
IPv4 Conversations
Filter:<No Filter>
                                               |       <-      | |       ->      | |     Total     |
                                               | Frames  Bytes | | Frames  Bytes | | Frames  Bytes |
10.0.1.3             <-> 10.0.1.2              347581 524091354  164152  11135040  511733 535226394
================================================================================
  1   0.000000     10.0.1.3 -> 10.0.1.2     TCP 39555 > glrpc [SYN] Seq=0 Win=5840 Len=0 MSS=1460 TSV=5879991 TSER=0 WS=6
  2   0.000271     10.0.1.2 -> 10.0.1.3     TCP glrpc > 39555 [SYN, ACK] Seq=0 Ack=1 Win=14480 Len=0 MSS=1460 TSV=5933674 TSER=5879991 WS=6
  3   0.000292     10.0.1.3 -> 10.0.1.2     TCP 39555 > glrpc [ACK] Seq=1 Ack=1 Win=5888 Len=0 TSV=5879991 TSER=5933674
511550  55.127583     10.0.1.3 -> 10.0.1.2     TCP 39555 > glrpc [FIN, ACK] Seq=301001 Ack=501151001 Win=2010432 Len=0 TSV=5893773 TSER=5947426
511551  55.127941     10.0.1.2 -> 10.0.1.3     TCP glrpc > 39555 [FIN, ACK] Seq=501151001 Ack=301002 Win=149312 Len=0 TSV=5947457 TSER=5893773
================================================================================
IPv4 Conversations
Filter:<No Filter>
                                               |       <-      | |       ->      | |     Total     |
                                               | Frames  Bytes | | Frames  Bytes | | Frames  Bytes |
10.0.1.3             <-> 10.0.1.2              347581 524091354  163971  11123094  511552 535214448
================================================================================
  1   0.000000     10.0.1.3 -> 10.0.1.2     TCP 39558 > glrpc [SYN] Seq=0 Win=5840 Len=0 MSS=1460 TSV=5898080 TSER=0 WS=6
  2   0.000274     10.0.1.2 -> 10.0.1.3     TCP glrpc > 39558 [SYN, ACK] Seq=0 Ack=1 Win=14480 Len=0 MSS=1460 TSV=5951765 TSER=5898080 WS=6
  3   0.000298     10.0.1.3 -> 10.0.1.2     TCP 39558 > glrpc [ACK] Seq=1 Ack=1 Win=5888 Len=0 TSV=5898080 TSER=5951765
513535  54.972754     10.0.1.3 -> 10.0.1.2     TCP 39558 > glrpc [FIN, ACK] Seq=301001 Ack=501151001 Win=1969856 Len=0 TSV=5911823 TSER=5965492
513536  54.973129     10.0.1.2 -> 10.0.1.3     TCP glrpc > 39558 [FIN, ACK] Seq=501151001 Ack=301002 Win=150528 Len=0 TSV=5965509 TSER=5911823
================================================================================
IPv4 Conversations
Filter:<No Filter>
                                               |       <-      | |       ->      | |     Total     |
                                               | Frames  Bytes | | Frames  Bytes | | Frames  Bytes |
10.0.1.3             <-> 10.0.1.2              347598 524092476  165939  11252982  513537 535345458
================================================================================
  1   0.000000     10.0.1.3 -> 10.0.1.2     TCP 39561 > glrpc [SYN] Seq=0 Win=5840 Len=0 MSS=1460 TSV=5916156 TSER=0 WS=6
  2   0.000318     10.0.1.2 -> 10.0.1.3     TCP glrpc > 39561 [SYN, ACK] Seq=0 Ack=1 Win=14480 Len=0 MSS=1460 TSV=5969843 TSER=5916156 WS=6
  3   0.000340     10.0.1.3 -> 10.0.1.2     TCP 39561 > glrpc [ACK] Seq=1 Ack=1 Win=5888 Len=0 TSV=5916156 TSER=5969843
513158  55.107826     10.0.1.3 -> 10.0.1.2     TCP 39561 > glrpc [FIN, ACK] Seq=301001 Ack=501151001 Win=1991296 Len=0 TSV=5929933 TSER=5983608
513159  55.108217     10.0.1.2 -> 10.0.1.3     TCP glrpc > 39561 [FIN, ACK] Seq=501151001 Ack=301002 Win=149312 Len=0 TSV=5983621 TSER=5929933
================================================================================
IPv4 Conversations
Filter:<No Filter>
                                               |       <-      | |       ->      | |     Total     |
                                               | Frames  Bytes | | Frames  Bytes | | Frames  Bytes |
10.0.1.3             <-> 10.0.1.2              347581 524091354  165579  11229222  513160 535320576
================================================================================
  1   0.000000     10.0.1.3 -> 10.0.1.2     TCP 57563 > glrpc [SYN] Seq=0 Win=5840 Len=0 MSS=1460 TSV=5934260 TSER=0 WS=6
  2   0.000299     10.0.1.2 -> 10.0.1.3     TCP glrpc > 57563 [SYN, ACK] Seq=0 Ack=1 Win=14480 Len=0 MSS=1460 TSV=5987948 TSER=5934260 WS=6
  3   0.000320     10.0.1.3 -> 10.0.1.2     TCP 57563 > glrpc [ACK] Seq=1 Ack=1 Win=5888 Len=0 TSV=5934260 TSER=5987948
513839  55.004447     10.0.1.3 -> 10.0.1.2     TCP 57563 > glrpc [FIN, ACK] Seq=301001 Ack=501151001 Win=1981440 Len=0 TSV=5948011 TSER=6001670
513840  55.004841     10.0.1.2 -> 10.0.1.3     TCP glrpc > 57563 [FIN, ACK] Seq=501151001 Ack=301002 Win=154112 Len=0 TSV=6001700 TSER=5948011
================================================================================
IPv4 Conversations
Filter:<No Filter>
                                               |       <-      | |       ->      | |     Total     |
                                               | Frames  Bytes | | Frames  Bytes | | Frames  Bytes |
10.0.1.3             <-> 10.0.1.2              347579 524091222  166262  11274300  513841 535365522
================================================================================
  1   0.000000     10.0.1.3 -> 10.0.1.2     TCP 57567 > glrpc [SYN] Seq=0 Win=5840 Len=0 MSS=1460 TSV=5952359 TSER=0 WS=6
  2   0.000281     10.0.1.2 -> 10.0.1.3     TCP glrpc > 57567 [SYN, ACK] Seq=0 Ack=1 Win=14480 Len=0 MSS=1460 TSV=6006048 TSER=5952359 WS=6
  3   0.000303     10.0.1.3 -> 10.0.1.2     TCP 57567 > glrpc [ACK] Seq=1 Ack=1 Win=5888 Len=0 TSV=5952359 TSER=6006048
513759  55.061813     10.0.1.3 -> 10.0.1.2     TCP 57567 > glrpc [FIN, ACK] Seq=301001 Ack=501151001 Win=1990144 Len=0 TSV=5966125 TSER=6019786
513760  55.062229     10.0.1.2 -> 10.0.1.3     TCP glrpc > 57567 [FIN, ACK] Seq=501151001 Ack=301002 Win=155328 Len=0 TSV=6019815 TSER=5966125
================================================================================
IPv4 Conversations
Filter:<No Filter>
                                               |       <-      | |       ->      | |     Total     |
                                               | Frames  Bytes | | Frames  Bytes | | Frames  Bytes |
10.0.1.3             <-> 10.0.1.2              347585 524091618  166176  11268624  513761 535360242
================================================================================
