  1   0.000000     10.0.1.3 -> 10.0.1.2     TCP 41721 > glrpc [SYN] Seq=0 Win=5840 Len=0 MSS=1460 TSV=3880854 TSER=0 WS=6
  2   0.000291     10.0.1.2 -> 10.0.1.3     TCP glrpc > 41721 [SYN, ACK] Seq=0 Ack=1 Win=14480 Len=0 MSS=1460 TSV=3934386 TSER=3880854 WS=6
  3   0.000313     10.0.1.3 -> 10.0.1.2     TCP 41721 > glrpc [ACK] Seq=1 Ack=1 Win=5888 Len=0 TSV=3880854 TSER=3934386
50540   5.659119     10.0.1.3 -> 10.0.1.2     TCP 41721 > glrpc [FIN, ACK] Seq=30101 Ack=50115101 Win=1823872 Len=0 TSV=3882268 TSER=3935770
50541   5.659565     10.0.1.2 -> 10.0.1.3     TCP glrpc > 41721 [FIN, ACK] Seq=50115101 Ack=30102 Win=64128 Len=0 TSV=3935801 TSER=3882268
================================================================================
IPv4 Conversations
Filter:<No Filter>
                                               |       <-      | |       ->      | |     Total     |
                                               | Frames  Bytes | | Frames  Bytes | | Frames  Bytes |
10.0.1.3             <-> 10.0.1.2               34758  52409136   15784   1071852   50542  53480988
================================================================================
  1   0.000000     10.0.1.3 -> 10.0.1.2     TCP 41723 > glrpc [SYN] Seq=0 Win=5840 Len=0 MSS=1460 TSV=3883683 TSER=0 WS=6
  2   0.000281     10.0.1.2 -> 10.0.1.3     TCP glrpc > 41723 [SYN, ACK] Seq=0 Ack=1 Win=14480 Len=0 MSS=1460 TSV=3937216 TSER=3883683 WS=6
  3   0.000303     10.0.1.3 -> 10.0.1.2     TCP 41723 > glrpc [ACK] Seq=1 Ack=1 Win=5888 Len=0 TSV=3883683 TSER=3937216
50843   5.619842     10.0.1.3 -> 10.0.1.2     TCP 41723 > glrpc [FIN, ACK] Seq=30101 Ack=50115101 Win=1736960 Len=0 TSV=3885088 TSER=3938593
50844   5.620327     10.0.1.2 -> 10.0.1.3     TCP glrpc > 41723 [FIN, ACK] Seq=50115101 Ack=30102 Win=64128 Len=0 TSV=3938621 TSER=3885088
================================================================================
IPv4 Conversations
Filter:<No Filter>
                                               |       <-      | |       ->      | |     Total     |
                                               | Frames  Bytes | | Frames  Bytes | | Frames  Bytes |
10.0.1.3             <-> 10.0.1.2               34757  52409070   16088   1091916   50845  53500986
================================================================================
  1   0.000000     10.0.1.3 -> 10.0.1.2     TCP 41725 > glrpc [SYN] Seq=0 Win=5840 Len=0 MSS=1460 TSV=3886507 TSER=0 WS=6
  2   0.000358     10.0.1.2 -> 10.0.1.3     TCP glrpc > 41725 [SYN, ACK] Seq=0 Ack=1 Win=14480 Len=0 MSS=1460 TSV=3940040 TSER=3886507 WS=6
  3   0.000380     10.0.1.3 -> 10.0.1.2     TCP 41725 > glrpc [ACK] Seq=1 Ack=1 Win=5888 Len=0 TSV=3886507 TSER=3940040
50713   5.585267     10.0.1.3 -> 10.0.1.2     TCP 41725 > glrpc [FIN, ACK] Seq=30101 Ack=50115101 Win=1785216 Len=0 TSV=3887903 TSER=3941422
50714   5.585727     10.0.1.2 -> 10.0.1.3     TCP glrpc > 41725 [FIN, ACK] Seq=50115101 Ack=30102 Win=64128 Len=0 TSV=3941436 TSER=3887903
================================================================================
IPv4 Conversations
Filter:<No Filter>
                                               |       <-      | |       ->      | |     Total     |
                                               | Frames  Bytes | | Frames  Bytes | | Frames  Bytes |
10.0.1.3             <-> 10.0.1.2               34757  52409070   15958   1083336   50715  53492406
================================================================================
  1   0.000000     10.0.1.3 -> 10.0.1.2     TCP 41727 > glrpc [SYN] Seq=0 Win=5840 Len=0 MSS=1460 TSV=3889320 TSER=0 WS=6
  2   0.000289     10.0.1.2 -> 10.0.1.3     TCP glrpc > 41727 [SYN, ACK] Seq=0 Ack=1 Win=14480 Len=0 MSS=1460 TSV=3942853 TSER=3889320 WS=6
  3   0.000314     10.0.1.3 -> 10.0.1.2     TCP 41727 > glrpc [ACK] Seq=1 Ack=1 Win=5888 Len=0 TSV=3889320 TSER=3942853
50820   5.562341     10.0.1.3 -> 10.0.1.2     TCP 41727 > glrpc [FIN, ACK] Seq=30101 Ack=50115101 Win=1873600 Len=0 TSV=3890710 TSER=3944227
50821   5.562821     10.0.1.2 -> 10.0.1.3     TCP glrpc > 41727 [FIN, ACK] Seq=50115101 Ack=30102 Win=64128 Len=0 TSV=3944243 TSER=3890710
================================================================================
IPv4 Conversations
Filter:<No Filter>
                                               |       <-      | |       ->      | |     Total     |
                                               | Frames  Bytes | | Frames  Bytes | | Frames  Bytes |
10.0.1.3             <-> 10.0.1.2               34757  52409070   16065   1090398   50822  53499468
================================================================================
  1   0.000000     10.0.1.3 -> 10.0.1.2     TCP 41729 > glrpc [SYN] Seq=0 Win=5840 Len=0 MSS=1460 TSV=3892125 TSER=0 WS=6
  2   0.000288     10.0.1.2 -> 10.0.1.3     TCP glrpc > 41729 [SYN, ACK] Seq=0 Ack=1 Win=14480 Len=0 MSS=1460 TSV=3945658 TSER=3892125 WS=6
  3   0.000310     10.0.1.3 -> 10.0.1.2     TCP 41729 > glrpc [ACK] Seq=1 Ack=1 Win=5888 Len=0 TSV=3892125 TSER=3945658
50811   5.573291     10.0.1.3 -> 10.0.1.2     TCP 41729 > glrpc [FIN, ACK] Seq=30101 Ack=50115101 Win=1893440 Len=0 TSV=3893518 TSER=3947040
50812   5.573780     10.0.1.2 -> 10.0.1.3     TCP glrpc > 41729 [FIN, ACK] Seq=50115101 Ack=30102 Win=64128 Len=0 TSV=3947052 TSER=3893518
================================================================================
IPv4 Conversations
Filter:<No Filter>
                                               |       <-      | |       ->      | |     Total     |
                                               | Frames  Bytes | | Frames  Bytes | | Frames  Bytes |
10.0.1.3             <-> 10.0.1.2               34759  52409202   16054   1089672   50813  53498874
================================================================================
  1   0.000000     10.0.1.3 -> 10.0.1.2     TCP 41731 > glrpc [SYN] Seq=0 Win=5840 Len=0 MSS=1460 TSV=3894940 TSER=0 WS=6
  2   0.000295     10.0.1.2 -> 10.0.1.3     TCP glrpc > 41731 [SYN, ACK] Seq=0 Ack=1 Win=14480 Len=0 MSS=1460 TSV=3948474 TSER=3894940 WS=6
  3   0.000319     10.0.1.3 -> 10.0.1.2     TCP 41731 > glrpc [ACK] Seq=1 Ack=1 Win=5888 Len=0 TSV=3894940 TSER=3948474
50791   5.584822     10.0.1.3 -> 10.0.1.2     TCP 41731 > glrpc [FIN, ACK] Seq=30101 Ack=50115101 Win=1709440 Len=0 TSV=3896336 TSER=3949841
50792   5.585269     10.0.1.2 -> 10.0.1.3     TCP glrpc > 41731 [FIN, ACK] Seq=50115101 Ack=30102 Win=64128 Len=0 TSV=3949870 TSER=3896336
================================================================================
IPv4 Conversations
Filter:<No Filter>
                                               |       <-      | |       ->      | |     Total     |
                                               | Frames  Bytes | | Frames  Bytes | | Frames  Bytes |
10.0.1.3             <-> 10.0.1.2               34758  52409136   16035   1088418   50793  53497554
================================================================================
  1   0.000000     10.0.1.3 -> 10.0.1.2     TCP 41733 > glrpc [SYN] Seq=0 Win=5840 Len=0 MSS=1460 TSV=3897758 TSER=0 WS=6
  2   0.000361     10.0.1.2 -> 10.0.1.3     TCP glrpc > 41733 [SYN, ACK] Seq=0 Ack=1 Win=14480 Len=0 MSS=1460 TSV=3951291 TSER=3897758 WS=6
  3   0.000385     10.0.1.3 -> 10.0.1.2     TCP 41733 > glrpc [ACK] Seq=1 Ack=1 Win=5888 Len=0 TSV=3897758 TSER=3951291
50575   5.567780     10.0.1.3 -> 10.0.1.2     TCP 41733 > glrpc [FIN, ACK] Seq=30101 Ack=50115101 Win=1780928 Len=0 TSV=3899149 TSER=3952669
50576   5.568259     10.0.1.2 -> 10.0.1.3     TCP glrpc > 41733 [FIN, ACK] Seq=50115101 Ack=30102 Win=64128 Len=0 TSV=3952684 TSER=3899149
================================================================================
IPv4 Conversations
Filter:<No Filter>
                                               |       <-      | |       ->      | |     Total     |
                                               | Frames  Bytes | | Frames  Bytes | | Frames  Bytes |
10.0.1.3             <-> 10.0.1.2               34763  52409466   15814   1073832   50577  53483298
================================================================================
  1   0.000000     10.0.1.3 -> 10.0.1.2     TCP 33777 > glrpc [SYN] Seq=0 Win=5840 Len=0 MSS=1460 TSV=3900570 TSER=0 WS=6
  2   0.000284     10.0.1.2 -> 10.0.1.3     TCP glrpc > 33777 [SYN, ACK] Seq=0 Ack=1 Win=14480 Len=0 MSS=1460 TSV=3954104 TSER=3900570 WS=6
  3   0.000305     10.0.1.3 -> 10.0.1.2     TCP 33777 > glrpc [ACK] Seq=1 Ack=1 Win=5888 Len=0 TSV=3900570 TSER=3954104
50713   5.572934     10.0.1.3 -> 10.0.1.2     TCP 33777 > glrpc [FIN, ACK] Seq=30101 Ack=50115101 Win=1731200 Len=0 TSV=3901963 TSER=3955485
50714   5.573398     10.0.1.2 -> 10.0.1.3     TCP glrpc > 33777 [FIN, ACK] Seq=50115101 Ack=30102 Win=64128 Len=0 TSV=3955497 TSER=3901963
================================================================================
IPv4 Conversations
Filter:<No Filter>
                                               |       <-      | |       ->      | |     Total     |
                                               | Frames  Bytes | | Frames  Bytes | | Frames  Bytes |
10.0.1.3             <-> 10.0.1.2               34757  52409070   15958   1083336   50715  53492406
================================================================================
  1   0.000000     10.0.1.3 -> 10.0.1.2     TCP 33779 > glrpc [SYN] Seq=0 Win=5840 Len=0 MSS=1460 TSV=3903380 TSER=0 WS=6
  2   0.000308     10.0.1.2 -> 10.0.1.3     TCP glrpc > 33779 [SYN, ACK] Seq=0 Ack=1 Win=14480 Len=0 MSS=1460 TSV=3956914 TSER=3903380 WS=6
  3   0.000328     10.0.1.3 -> 10.0.1.2     TCP 33779 > glrpc [ACK] Seq=1 Ack=1 Win=5888 Len=0 TSV=3903380 TSER=3956914
50970   5.559136     10.0.1.3 -> 10.0.1.2     TCP 33779 > glrpc [FIN, ACK] Seq=30101 Ack=50115101 Win=1855488 Len=0 TSV=3904769 TSER=3958275
50971   5.559617     10.0.1.2 -> 10.0.1.3     TCP glrpc > 33779 [FIN, ACK] Seq=50115101 Ack=30102 Win=64128 Len=0 TSV=3958304 TSER=3904769
================================================================================
IPv4 Conversations
Filter:<No Filter>
                                               |       <-      | |       ->      | |     Total     |
                                               | Frames  Bytes | | Frames  Bytes | | Frames  Bytes |
10.0.1.3             <-> 10.0.1.2               34761  52409334   16211   1100034   50972  53509368
================================================================================
  1   0.000000     10.0.1.3 -> 10.0.1.2     TCP 33781 > glrpc [SYN] Seq=0 Win=5840 Len=0 MSS=1460 TSV=3906191 TSER=0 WS=6
  2   0.000323     10.0.1.2 -> 10.0.1.3     TCP glrpc > 33781 [SYN, ACK] Seq=0 Ack=1 Win=14480 Len=0 MSS=1460 TSV=3959725 TSER=3906191 WS=6
  3   0.000347     10.0.1.3 -> 10.0.1.2     TCP 33781 > glrpc [ACK] Seq=1 Ack=1 Win=5888 Len=0 TSV=3906191 TSER=3959725
50792   5.587446     10.0.1.3 -> 10.0.1.2     TCP 33781 > glrpc [FIN, ACK] Seq=30101 Ack=50115101 Win=1694208 Len=0 TSV=3907588 TSER=3961093
50793   5.587936     10.0.1.2 -> 10.0.1.3     TCP glrpc > 33781 [FIN, ACK] Seq=50115101 Ack=30102 Win=64128 Len=0 TSV=3961122 TSER=3907588
================================================================================
IPv4 Conversations
Filter:<No Filter>
                                               |       <-      | |       ->      | |     Total     |
                                               | Frames  Bytes | | Frames  Bytes | | Frames  Bytes |
10.0.1.3             <-> 10.0.1.2               34758  52409136   16036   1088484   50794  53497620
================================================================================
  1   0.000000     10.0.1.3 -> 10.0.1.2     TCP 33783 > glrpc [SYN] Seq=0 Win=5840 Len=0 MSS=1460 TSV=3909008 TSER=0 WS=6
  2   0.000366     10.0.1.2 -> 10.0.1.3     TCP glrpc > 33783 [SYN, ACK] Seq=0 Ack=1 Win=14480 Len=0 MSS=1460 TSV=3962542 TSER=3909008 WS=6
  3   0.000387     10.0.1.3 -> 10.0.1.2     TCP 33783 > glrpc [ACK] Seq=1 Ack=1 Win=5888 Len=0 TSV=3909008 TSER=3962542
50876   5.574427     10.0.1.3 -> 10.0.1.2     TCP 33783 > glrpc [FIN, ACK] Seq=30101 Ack=50115101 Win=1734080 Len=0 TSV=3910401 TSER=3963906
50877   5.574878     10.0.1.2 -> 10.0.1.3     TCP glrpc > 33783 [FIN, ACK] Seq=50115101 Ack=30102 Win=64128 Len=0 TSV=3963936 TSER=3910401
================================================================================
IPv4 Conversations
Filter:<No Filter>
                                               |       <-      | |       ->      | |     Total     |
                                               | Frames  Bytes | | Frames  Bytes | | Frames  Bytes |
10.0.1.3             <-> 10.0.1.2               34759  52409202   16119   1093962   50878  53503164
================================================================================
  1   0.000000     10.0.1.3 -> 10.0.1.2     TCP 33785 > glrpc [SYN] Seq=0 Win=5840 Len=0 MSS=1460 TSV=3911823 TSER=0 WS=6
  2   0.000295     10.0.1.2 -> 10.0.1.3     TCP glrpc > 33785 [SYN, ACK] Seq=0 Ack=1 Win=14480 Len=0 MSS=1460 TSV=3965358 TSER=3911823 WS=6
  3   0.000319     10.0.1.3 -> 10.0.1.2     TCP 33785 > glrpc [ACK] Seq=1 Ack=1 Win=5888 Len=0 TSV=3911823 TSER=3965358
51001   5.602609     10.0.1.3 -> 10.0.1.2     TCP 33785 > glrpc [FIN, ACK] Seq=30101 Ack=50115101 Win=1786880 Len=0 TSV=3913223 TSER=3966730
51002   5.603076     10.0.1.2 -> 10.0.1.3     TCP glrpc > 33785 [FIN, ACK] Seq=50115101 Ack=30102 Win=64128 Len=0 TSV=3966758 TSER=3913223
================================================================================
IPv4 Conversations
Filter:<No Filter>
                                               |       <-      | |       ->      | |     Total     |
                                               | Frames  Bytes | | Frames  Bytes | | Frames  Bytes |
10.0.1.3             <-> 10.0.1.2               34760  52409268   16243   1102146   51003  53511414
================================================================================
  1   0.000000     10.0.1.3 -> 10.0.1.2     TCP 33787 > glrpc [SYN] Seq=0 Win=5840 Len=0 MSS=1460 TSV=3914645 TSER=0 WS=6
  2   0.000265     10.0.1.2 -> 10.0.1.3     TCP glrpc > 33787 [SYN, ACK] Seq=0 Ack=1 Win=14480 Len=0 MSS=1460 TSV=3968180 TSER=3914645 WS=6
  3   0.000286     10.0.1.3 -> 10.0.1.2     TCP 33787 > glrpc [ACK] Seq=1 Ack=1 Win=5888 Len=0 TSV=3914645 TSER=3968180
50779   5.572232     10.0.1.3 -> 10.0.1.2     TCP 33787 > glrpc [FIN, ACK] Seq=30101 Ack=50115101 Win=1773696 Len=0 TSV=3916038 TSER=3969558
50780   5.572727     10.0.1.2 -> 10.0.1.3     TCP glrpc > 33787 [FIN, ACK] Seq=50115101 Ack=30102 Win=64128 Len=0 TSV=3969573 TSER=3916038
================================================================================
IPv4 Conversations
Filter:<No Filter>
                                               |       <-      | |       ->      | |     Total     |
                                               | Frames  Bytes | | Frames  Bytes | | Frames  Bytes |
10.0.1.3             <-> 10.0.1.2               34760  52409268   16021   1087494   50781  53496762
================================================================================
  1   0.000000     10.0.1.3 -> 10.0.1.2     TCP 33789 > glrpc [SYN] Seq=0 Win=5840 Len=0 MSS=1460 TSV=3917454 TSER=0 WS=6
  2   0.000366     10.0.1.2 -> 10.0.1.3     TCP glrpc > 33789 [SYN, ACK] Seq=0 Ack=1 Win=14480 Len=0 MSS=1460 TSV=3970989 TSER=3917454 WS=6
  3   0.000390     10.0.1.3 -> 10.0.1.2     TCP 33789 > glrpc [ACK] Seq=1 Ack=1 Win=5888 Len=0 TSV=3917454 TSER=3970989
50828   5.600883     10.0.1.3 -> 10.0.1.2     TCP 33789 > glrpc [FIN, ACK] Seq=30101 Ack=50115101 Win=1993024 Len=0 TSV=3918854 TSER=3972360
50829   5.601382     10.0.1.2 -> 10.0.1.3     TCP glrpc > 33789 [FIN, ACK] Seq=50115101 Ack=30102 Win=64128 Len=0 TSV=3972389 TSER=3918854
================================================================================
IPv4 Conversations
Filter:<No Filter>
                                               |       <-      | |       ->      | |     Total     |
                                               | Frames  Bytes | | Frames  Bytes | | Frames  Bytes |
10.0.1.3             <-> 10.0.1.2               34761  52409334   16069   1090662   50830  53499996
================================================================================
  1   0.000000     10.0.1.3 -> 10.0.1.2     TCP 33791 > glrpc [SYN] Seq=0 Win=5840 Len=0 MSS=1460 TSV=3920270 TSER=0 WS=6
  2   0.000277     10.0.1.2 -> 10.0.1.3     TCP glrpc > 33791 [SYN, ACK] Seq=0 Ack=1 Win=14480 Len=0 MSS=1460 TSV=3973806 TSER=3920270 WS=6
  3   0.000298     10.0.1.3 -> 10.0.1.2     TCP 33791 > glrpc [ACK] Seq=1 Ack=1 Win=5888 Len=0 TSV=3920270 TSER=3973806
50685   5.554668     10.0.1.3 -> 10.0.1.2     TCP 33791 > glrpc [FIN, ACK] Seq=30101 Ack=50115101 Win=1957696 Len=0 TSV=3921659 TSER=3975184
50686   5.555106     10.0.1.2 -> 10.0.1.3     TCP glrpc > 33791 [FIN, ACK] Seq=50115101 Ack=30102 Win=64128 Len=0 TSV=3975194 TSER=3921659
================================================================================
IPv4 Conversations
Filter:<No Filter>
                                               |       <-      | |       ->      | |     Total     |
                                               | Frames  Bytes | | Frames  Bytes | | Frames  Bytes |
10.0.1.3             <-> 10.0.1.2               34759  52409202   15928   1081356   50687  53490558
================================================================================
  1   0.000000     10.0.1.3 -> 10.0.1.2     TCP 33793 > glrpc [SYN] Seq=0 Win=5840 Len=0 MSS=1460 TSV=3923070 TSER=0 WS=6
  2   0.000290     10.0.1.2 -> 10.0.1.3     TCP glrpc > 33793 [SYN, ACK] Seq=0 Ack=1 Win=14480 Len=0 MSS=1460 TSV=3976606 TSER=3923070 WS=6
  3   0.000310     10.0.1.3 -> 10.0.1.2     TCP 33793 > glrpc [ACK] Seq=1 Ack=1 Win=5888 Len=0 TSV=3923070 TSER=3976606
51011   5.566906     10.0.1.3 -> 10.0.1.2     TCP 33793 > glrpc [FIN, ACK] Seq=30101 Ack=50115101 Win=1778496 Len=0 TSV=3924462 TSER=3977970
51012   5.567362     10.0.1.2 -> 10.0.1.3     TCP glrpc > 33793 [FIN, ACK] Seq=50115101 Ack=30102 Win=64128 Len=0 TSV=3977998 TSER=3924462
================================================================================
IPv4 Conversations
Filter:<No Filter>
                                               |       <-      | |       ->      | |     Total     |
                                               | Frames  Bytes | | Frames  Bytes | | Frames  Bytes |
10.0.1.3             <-> 10.0.1.2               34764  52409532   16249   1102542   51013  53512074
================================================================================
  1   0.000000     10.0.1.3 -> 10.0.1.2     TCP 33797 > glrpc [SYN] Seq=0 Win=5840 Len=0 MSS=1460 TSV=3925883 TSER=0 WS=6
  2   0.000267     10.0.1.2 -> 10.0.1.3     TCP glrpc > 33797 [SYN, ACK] Seq=0 Ack=1 Win=14480 Len=0 MSS=1460 TSV=3979419 TSER=3925883 WS=6
  3   0.000292     10.0.1.3 -> 10.0.1.2     TCP 33797 > glrpc [ACK] Seq=1 Ack=1 Win=5888 Len=0 TSV=3925883 TSER=3979419
50976   5.555571     10.0.1.3 -> 10.0.1.2     TCP 33797 > glrpc [FIN, ACK] Seq=30101 Ack=50115101 Win=1925888 Len=0 TSV=3927272 TSER=3980781
50977   5.556044     10.0.1.2 -> 10.0.1.3     TCP glrpc > 33797 [FIN, ACK] Seq=50115101 Ack=30102 Win=64128 Len=0 TSV=3980808 TSER=3927272
================================================================================
IPv4 Conversations
Filter:<No Filter>
                                               |       <-      | |       ->      | |     Total     |
                                               | Frames  Bytes | | Frames  Bytes | | Frames  Bytes |
10.0.1.3             <-> 10.0.1.2               34757  52409070   16221   1100694   50978  53509764
================================================================================
  1   0.000000     10.0.1.3 -> 10.0.1.2     TCP 33799 > glrpc [SYN] Seq=0 Win=5840 Len=0 MSS=1460 TSV=3928693 TSER=0 WS=6
  2   0.000280     10.0.1.2 -> 10.0.1.3     TCP glrpc > 33799 [SYN, ACK] Seq=0 Ack=1 Win=14480 Len=0 MSS=1460 TSV=3982230 TSER=3928693 WS=6
  3   0.000305     10.0.1.3 -> 10.0.1.2     TCP 33799 > glrpc [ACK] Seq=1 Ack=1 Win=5888 Len=0 TSV=3928693 TSER=3982230
50684   5.578748     10.0.1.3 -> 10.0.1.2     TCP 33799 > glrpc [FIN, ACK] Seq=30101 Ack=50115101 Win=1752448 Len=0 TSV=3930088 TSER=3983595
50685   5.579223     10.0.1.2 -> 10.0.1.3     TCP glrpc > 33799 [FIN, ACK] Seq=50115101 Ack=30102 Win=64128 Len=0 TSV=3983624 TSER=3930088
================================================================================
IPv4 Conversations
Filter:<No Filter>
                                               |       <-      | |       ->      | |     Total     |
                                               | Frames  Bytes | | Frames  Bytes | | Frames  Bytes |
10.0.1.3             <-> 10.0.1.2               34766  52409664   15920   1080828   50686  53490492
================================================================================
  1   0.000000     10.0.1.3 -> 10.0.1.2     TCP 33801 > glrpc [SYN] Seq=0 Win=5840 Len=0 MSS=1460 TSV=3931505 TSER=0 WS=6
  2   0.000368     10.0.1.2 -> 10.0.1.3     TCP glrpc > 33801 [SYN, ACK] Seq=0 Ack=1 Win=14480 Len=0 MSS=1460 TSV=3985042 TSER=3931505 WS=6
  3   0.000391     10.0.1.3 -> 10.0.1.2     TCP 33801 > glrpc [ACK] Seq=1 Ack=1 Win=5888 Len=0 TSV=3931506 TSER=3985042
50805   5.577011     10.0.1.3 -> 10.0.1.2     TCP 33801 > glrpc [FIN, ACK] Seq=30101 Ack=50115101 Win=1967552 Len=0 TSV=3932900 TSER=3986405
50806   5.577470     10.0.1.2 -> 10.0.1.3     TCP glrpc > 33801 [FIN, ACK] Seq=50115101 Ack=30102 Win=64128 Len=0 TSV=3986436 TSER=3932900
================================================================================
IPv4 Conversations
Filter:<No Filter>
                                               |       <-      | |       ->      | |     Total     |
                                               | Frames  Bytes | | Frames  Bytes | | Frames  Bytes |
10.0.1.3             <-> 10.0.1.2               34761  52409334   16046   1089144   50807  53498478
================================================================================
  1   0.000000     10.0.1.3 -> 10.0.1.2     TCP 33803 > glrpc [SYN] Seq=0 Win=5840 Len=0 MSS=1460 TSV=3934314 TSER=0 WS=6
  2   0.000280     10.0.1.2 -> 10.0.1.3     TCP glrpc > 33803 [SYN, ACK] Seq=0 Ack=1 Win=14480 Len=0 MSS=1460 TSV=3987851 TSER=3934314 WS=6
  3   0.000301     10.0.1.3 -> 10.0.1.2     TCP 33803 > glrpc [ACK] Seq=1 Ack=1 Win=5888 Len=0 TSV=3934314 TSER=3987851
51012   5.571520     10.0.1.3 -> 10.0.1.2     TCP 33803 > glrpc [FIN, ACK] Seq=30101 Ack=50115101 Win=1946112 Len=0 TSV=3935707 TSER=3989227
51013   5.571987     10.0.1.2 -> 10.0.1.3     TCP glrpc > 33803 [FIN, ACK] Seq=50115101 Ack=30102 Win=64128 Len=0 TSV=3989244 TSER=3935707
================================================================================
IPv4 Conversations
Filter:<No Filter>
                                               |       <-      | |       ->      | |     Total     |
                                               | Frames  Bytes | | Frames  Bytes | | Frames  Bytes |
10.0.1.3             <-> 10.0.1.2               34757  52409070   16257   1103070   51014  53512140
================================================================================
