  1   0.000000     10.0.1.3 -> 10.0.1.2     TCP 44371 > glrpc [SYN] Seq=0 Win=5840 Len=0 MSS=1460 TSV=5603552 TSER=0 WS=6
  2   0.000314     10.0.1.2 -> 10.0.1.3     TCP glrpc > 44371 [SYN, ACK] Seq=0 Ack=1 Win=14480 Len=0 MSS=1460 TSV=5635871 TSER=5603552 WS=6
  3   0.000333     10.0.1.3 -> 10.0.1.2     TCP 44371 > glrpc [ACK] Seq=1 Ack=1 Win=5888 Len=0 TSV=5603552 TSER=5635871
509905  57.786961     10.0.1.3 -> 10.0.1.2     TCP 44371 > glrpc [FIN, ACK] Seq=301001 Ack=501151001 Win=2004608 Len=0 TSV=5617998 TSER=5650308
509906  57.787422     10.0.1.2 -> 10.0.1.3     TCP glrpc > 44371 [FIN, ACK] Seq=501151001 Ack=301002 Win=152960 Len=0 TSV=5650319 TSER=5617998
  1   0.000000     10.0.1.3 -> 10.0.1.2     TCP 44373 > glrpc [SYN] Seq=0 Win=5840 Len=0 MSS=1460 TSV=5624944 TSER=0 WS=6
  2   0.000320     10.0.1.2 -> 10.0.1.3     TCP glrpc > 44373 [SYN, ACK] Seq=0 Ack=1 Win=14480 Len=0 MSS=1460 TSV=5657266 TSER=5624944 WS=6
  3   0.000345     10.0.1.3 -> 10.0.1.2     TCP 44373 > glrpc [ACK] Seq=1 Ack=1 Win=5888 Len=0 TSV=5624944 TSER=5657266
463848  55.367057     10.0.1.3 -> 10.0.1.2     TCP 44373 > glrpc [FIN, ACK] Seq=301001 Ack=501151001 Win=2004608 Len=0 TSV=5638786 TSER=5671088
463849  55.367489     10.0.1.2 -> 10.0.1.3     TCP glrpc > 44373 [FIN, ACK] Seq=501151001 Ack=301002 Win=146944 Len=0 TSV=5671108 TSER=5638786
  1   0.000000     10.0.1.3 -> 10.0.1.2     TCP 33888 > glrpc [SYN] Seq=0 Win=5840 Len=0 MSS=1460 TSV=5645010 TSER=0 WS=6
  2   0.000285     10.0.1.2 -> 10.0.1.3     TCP glrpc > 33888 [SYN, ACK] Seq=0 Ack=1 Win=14480 Len=0 MSS=1460 TSV=5677333 TSER=5645010 WS=6
  3   0.000307     10.0.1.3 -> 10.0.1.2     TCP 33888 > glrpc [ACK] Seq=1 Ack=1 Win=5888 Len=0 TSV=5645010 TSER=5677333
499510  55.247401     10.0.1.3 -> 10.0.1.2     TCP 33888 > glrpc [FIN, ACK] Seq=301001 Ack=501151001 Win=2004608 Len=0 TSV=5658822 TSER=5691139
499511  55.247846     10.0.1.2 -> 10.0.1.3     TCP glrpc > 33888 [FIN, ACK] Seq=501151001 Ack=301002 Win=150528 Len=0 TSV=5691146 TSER=5658822
  1   0.000000     10.0.1.3 -> 10.0.1.2     TCP 33890 > glrpc [SYN] Seq=0 Win=5840 Len=0 MSS=1460 TSV=5665978 TSER=0 WS=6
  2   0.000282     10.0.1.2 -> 10.0.1.3     TCP glrpc > 33890 [SYN, ACK] Seq=0 Ack=1 Win=14480 Len=0 MSS=1460 TSV=5698302 TSER=5665978 WS=6
  3   0.000306     10.0.1.3 -> 10.0.1.2     TCP 33890 > glrpc [ACK] Seq=1 Ack=1 Win=5888 Len=0 TSV=5665978 TSER=5698302
510651  59.043750     10.0.1.3 -> 10.0.1.2     TCP 33890 > glrpc [FIN, ACK] Seq=301001 Ack=501151001 Win=2009280 Len=0 TSV=5680739 TSER=5713033
510652  59.044192     10.0.1.2 -> 10.0.1.3     TCP glrpc > 33890 [FIN, ACK] Seq=501151001 Ack=301002 Win=150528 Len=0 TSV=5713064 TSER=5680739
  1   0.000000     10.0.1.3 -> 10.0.1.2     TCP 33892 > glrpc [SYN] Seq=0 Win=5840 Len=0 MSS=1460 TSV=5687545 TSER=0 WS=6
  2   0.000317     10.0.1.2 -> 10.0.1.3     TCP glrpc > 33892 [SYN, ACK] Seq=0 Ack=1 Win=14480 Len=0 MSS=1460 TSV=5719871 TSER=5687545 WS=6
  3   0.000340     10.0.1.3 -> 10.0.1.2     TCP 33892 > glrpc [ACK] Seq=1 Ack=1 Win=5888 Len=0 TSV=5687545 TSER=5719871
499596  55.545318     10.0.1.3 -> 10.0.1.2     TCP 33892 > glrpc [FIN, ACK] Seq=301001 Ack=501151001 Win=2004608 Len=0 TSV=5701432 TSER=5733739
499597  55.545756     10.0.1.2 -> 10.0.1.3     TCP glrpc > 33892 [FIN, ACK] Seq=501151001 Ack=301002 Win=158976 Len=0 TSV=5733758 TSER=5701432
  1   0.000000     10.0.1.3 -> 10.0.1.2     TCP 39633 > glrpc [SYN] Seq=0 Win=5840 Len=0 MSS=1460 TSV=5708448 TSER=0 WS=6
  2   0.000300     10.0.1.2 -> 10.0.1.3     TCP glrpc > 39633 [SYN, ACK] Seq=0 Ack=1 Win=14480 Len=0 MSS=1460 TSV=5740776 TSER=5708448 WS=6
  3   0.000319     10.0.1.3 -> 10.0.1.2     TCP 39633 > glrpc [ACK] Seq=1 Ack=1 Win=5888 Len=0 TSV=5708449 TSER=5740776
496807  57.975383     10.0.1.3 -> 10.0.1.2     TCP 39633 > glrpc [FIN, ACK] Seq=301001 Ack=501151001 Win=2004480 Len=0 TSV=5722942 TSER=5755260
496808  57.975788     10.0.1.2 -> 10.0.1.3     TCP glrpc > 39633 [FIN, ACK] Seq=501151001 Ack=301002 Win=154112 Len=0 TSV=5755271 TSER=5722942
  1   0.000000     10.0.1.3 -> 10.0.1.2     TCP 39635 > glrpc [SYN] Seq=0 Win=5840 Len=0 MSS=1460 TSV=5729439 TSER=0 WS=6
  2   0.000291     10.0.1.2 -> 10.0.1.3     TCP glrpc > 39635 [SYN, ACK] Seq=0 Ack=1 Win=14480 Len=0 MSS=1460 TSV=5761768 TSER=5729439 WS=6
  3   0.000316     10.0.1.3 -> 10.0.1.2     TCP 39635 > glrpc [ACK] Seq=1 Ack=1 Win=5888 Len=0 TSV=5729439 TSER=5761768
493872  55.505861     10.0.1.3 -> 10.0.1.2     TCP 39635 > glrpc [FIN, ACK] Seq=301001 Ack=501151001 Win=2004608 Len=0 TSV=5743315 TSER=5775616
493873  55.506268     10.0.1.2 -> 10.0.1.3     TCP glrpc > 39635 [FIN, ACK] Seq=501151001 Ack=301002 Win=156544 Len=0 TSV=5775646 TSER=5743315
  1   0.000000     10.0.1.3 -> 10.0.1.2     TCP 39638 > glrpc [SYN] Seq=0 Win=5840 Len=0 MSS=1460 TSV=5750029 TSER=0 WS=6
  2   0.000321     10.0.1.2 -> 10.0.1.3     TCP glrpc > 39638 [SYN, ACK] Seq=0 Ack=1 Win=14480 Len=0 MSS=1460 TSV=5782359 TSER=5750029 WS=6
  3   0.000342     10.0.1.3 -> 10.0.1.2     TCP 39638 > glrpc [ACK] Seq=1 Ack=1 Win=5888 Len=0 TSV=5750029 TSER=5782359
475631  55.589536     10.0.1.3 -> 10.0.1.2     TCP 39638 > glrpc [FIN, ACK] Seq=301001 Ack=501151001 Win=2004608 Len=0 TSV=5763926 TSER=5796250
475632  55.589978     10.0.1.2 -> 10.0.1.3     TCP glrpc > 39638 [FIN, ACK] Seq=501151001 Ack=301002 Win=163776 Len=0 TSV=5796258 TSER=5763926
  1   0.000000     10.0.1.3 -> 10.0.1.2     TCP 39640 > glrpc [SYN] Seq=0 Win=5840 Len=0 MSS=1460 TSV=5770180 TSER=0 WS=6
  2   0.000304     10.0.1.2 -> 10.0.1.3     TCP glrpc > 39640 [SYN, ACK] Seq=0 Ack=1 Win=14480 Len=0 MSS=1460 TSV=5802512 TSER=5770180 WS=6
  3   0.000328     10.0.1.3 -> 10.0.1.2     TCP 39640 > glrpc [ACK] Seq=1 Ack=1 Win=5888 Len=0 TSV=5770180 TSER=5802512
509827  55.228313     10.0.1.3 -> 10.0.1.2     TCP 39640 > glrpc [FIN, ACK] Seq=301001 Ack=501151001 Win=2017920 Len=0 TSV=5783987 TSER=5816290
509828  55.228767     10.0.1.2 -> 10.0.1.3     TCP glrpc > 39640 [FIN, ACK] Seq=501151001 Ack=301002 Win=162560 Len=0 TSV=5816320 TSER=5783987
  1   0.000000     10.0.1.3 -> 10.0.1.2     TCP 34641 > glrpc [SYN] Seq=0 Win=5840 Len=0 MSS=1460 TSV=5790802 TSER=0 WS=6
  2   0.000319     10.0.1.2 -> 10.0.1.3     TCP glrpc > 34641 [SYN, ACK] Seq=0 Ack=1 Win=14480 Len=0 MSS=1460 TSV=5823136 TSER=5790802 WS=6
  3   0.000340     10.0.1.3 -> 10.0.1.2     TCP 34641 > glrpc [ACK] Seq=1 Ack=1 Win=5888 Len=0 TSV=5790803 TSER=5823136
509563  56.416125     10.0.1.3 -> 10.0.1.2     TCP 34641 > glrpc [FIN, ACK] Seq=301001 Ack=501151001 Win=2004608 Len=0 TSV=5804906 TSER=5837211
509564  56.416546     10.0.1.2 -> 10.0.1.3     TCP glrpc > 34641 [FIN, ACK] Seq=501151001 Ack=301002 Win=146112 Len=0 TSV=5837241 TSER=5804906
  1   0.000000     10.0.1.3 -> 10.0.1.2     TCP 34643 > glrpc [SYN] Seq=0 Win=5840 Len=0 MSS=1460 TSV=5811897 TSER=0 WS=6
  2   0.000314     10.0.1.2 -> 10.0.1.3     TCP glrpc > 34643 [SYN, ACK] Seq=0 Ack=1 Win=14480 Len=0 MSS=1460 TSV=5844232 TSER=5811897 WS=6
  3   0.000336     10.0.1.3 -> 10.0.1.2     TCP 34643 > glrpc [ACK] Seq=1 Ack=1 Win=5888 Len=0 TSV=5811897 TSER=5844232
497455  55.475360     10.0.1.3 -> 10.0.1.2     TCP 34643 > glrpc [FIN, ACK] Seq=301001 Ack=501151001 Win=2004608 Len=0 TSV=5825765 TSER=5858090
497456  55.475788     10.0.1.2 -> 10.0.1.3     TCP glrpc > 34643 [FIN, ACK] Seq=501151001 Ack=301002 Win=158976 Len=0 TSV=5858102 TSER=5825765
  1   0.000000     10.0.1.3 -> 10.0.1.2     TCP 34645 > glrpc [SYN] Seq=0 Win=5840 Len=0 MSS=1460 TSV=5832194 TSER=0 WS=6
  2   0.000303     10.0.1.2 -> 10.0.1.3     TCP glrpc > 34645 [SYN, ACK] Seq=0 Ack=1 Win=14480 Len=0 MSS=1460 TSV=5864531 TSER=5832194 WS=6
  3   0.000323     10.0.1.3 -> 10.0.1.2     TCP 34645 > glrpc [ACK] Seq=1 Ack=1 Win=5888 Len=0 TSV=5832194 TSER=5864531
502281  55.499883     10.0.1.3 -> 10.0.1.2     TCP 34645 > glrpc [FIN, ACK] Seq=301001 Ack=501151001 Win=2004608 Len=0 TSV=5846069 TSER=5878379
502282  55.500333     10.0.1.2 -> 10.0.1.3     TCP glrpc > 34645 [FIN, ACK] Seq=501151001 Ack=301002 Win=167360 Len=0 TSV=5878407 TSER=5846069
  1   0.000000     10.0.1.3 -> 10.0.1.2     TCP 45835 > glrpc [SYN] Seq=0 Win=5840 Len=0 MSS=1460 TSV=5852584 TSER=0 WS=6
  2   0.000285     10.0.1.2 -> 10.0.1.3     TCP glrpc > 45835 [SYN, ACK] Seq=0 Ack=1 Win=14480 Len=0 MSS=1460 TSV=5884922 TSER=5852584 WS=6
  3   0.000305     10.0.1.3 -> 10.0.1.2     TCP 45835 > glrpc [ACK] Seq=1 Ack=1 Win=5888 Len=0 TSV=5852584 TSER=5884922
502257  55.608511     10.0.1.3 -> 10.0.1.2     TCP 45835 > glrpc [FIN, ACK] Seq=301001 Ack=501151001 Win=2004608 Len=0 TSV=5866486 TSER=5898817
502258  55.608938     10.0.1.2 -> 10.0.1.3     TCP glrpc > 45835 [FIN, ACK] Seq=501151001 Ack=301002 Win=156544 Len=0 TSV=5898825 TSER=5866486
  1   0.000000     10.0.1.3 -> 10.0.1.2     TCP 45837 > glrpc [SYN] Seq=0 Win=5840 Len=0 MSS=1460 TSV=5872892 TSER=0 WS=6
  2   0.000267     10.0.1.2 -> 10.0.1.3     TCP glrpc > 45837 [SYN, ACK] Seq=0 Ack=1 Win=14480 Len=0 MSS=1460 TSV=5905231 TSER=5872892 WS=6
  3   0.000287     10.0.1.3 -> 10.0.1.2     TCP 45837 > glrpc [ACK] Seq=1 Ack=1 Win=5888 Len=0 TSV=5872892 TSER=5905231
495341  55.466819     10.0.1.3 -> 10.0.1.2     TCP 45837 > glrpc [FIN, ACK] Seq=301001 Ack=501151001 Win=2004608 Len=0 TSV=5886758 TSER=5919068
495342  55.467233     10.0.1.2 -> 10.0.1.3     TCP glrpc > 45837 [FIN, ACK] Seq=501151001 Ack=301002 Win=155328 Len=0 TSV=5919099 TSER=5886758
  1   0.000000     10.0.1.3 -> 10.0.1.2     TCP 45839 > glrpc [SYN] Seq=0 Win=5840 Len=0 MSS=1460 TSV=5893137 TSER=0 WS=6
  2   0.000277     10.0.1.2 -> 10.0.1.3     TCP glrpc > 45839 [SYN, ACK] Seq=0 Ack=1 Win=14480 Len=0 MSS=1460 TSV=5925478 TSER=5893137 WS=6
  3   0.000298     10.0.1.3 -> 10.0.1.2     TCP 45839 > glrpc [ACK] Seq=1 Ack=1 Win=5888 Len=0 TSV=5893137 TSER=5925478
509399  56.631364     10.0.1.3 -> 10.0.1.2     TCP 45839 > glrpc [FIN, ACK] Seq=301001 Ack=501151001 Win=2004608 Len=0 TSV=5907295 TSER=5939608
509400  56.631794     10.0.1.2 -> 10.0.1.3     TCP glrpc > 45839 [FIN, ACK] Seq=501151001 Ack=301002 Win=144512 Len=0 TSV=5939637 TSER=5907295
  1   0.000000     10.0.1.3 -> 10.0.1.2     TCP 45841 > glrpc [SYN] Seq=0 Win=5840 Len=0 MSS=1460 TSV=5914259 TSER=0 WS=6
  2   0.000322     10.0.1.2 -> 10.0.1.3     TCP glrpc > 45841 [SYN, ACK] Seq=0 Ack=1 Win=14480 Len=0 MSS=1460 TSV=5946602 TSER=5914259 WS=6
  3   0.000344     10.0.1.3 -> 10.0.1.2     TCP 45841 > glrpc [ACK] Seq=1 Ack=1 Win=5888 Len=0 TSV=5914259 TSER=5946602
508070  55.321910     10.0.1.3 -> 10.0.1.2     TCP 45841 > glrpc [FIN, ACK] Seq=301001 Ack=501151001 Win=2004608 Len=0 TSV=5928089 TSER=5960403
508071  55.322354     10.0.1.2 -> 10.0.1.3     TCP glrpc > 45841 [FIN, ACK] Seq=501151001 Ack=301002 Win=167360 Len=0 TSV=5960433 TSER=5928089
  1   0.000000     10.0.1.3 -> 10.0.1.2     TCP 42401 > glrpc [SYN] Seq=0 Win=5840 Len=0 MSS=1460 TSV=5935039 TSER=0 WS=6
  2   0.000294     10.0.1.2 -> 10.0.1.3     TCP glrpc > 42401 [SYN, ACK] Seq=0 Ack=1 Win=14480 Len=0 MSS=1460 TSV=5967383 TSER=5935039 WS=6
  3   0.000315     10.0.1.3 -> 10.0.1.2     TCP 42401 > glrpc [ACK] Seq=1 Ack=1 Win=5888 Len=0 TSV=5935039 TSER=5967383
472479  55.522914     10.0.1.3 -> 10.0.1.2     TCP [TCP ACKed lost segment] [TCP Previous segment lost] 42401 > glrpc [FIN, ACK] Seq=301001 Ack=501151001 Win=2004608 Len=0 TSV=5948920 TSER=5981251
472480  55.523361     10.0.1.2 -> 10.0.1.3     TCP glrpc > 42401 [FIN, ACK] Seq=501151001 Ack=301002 Win=155328 Len=0 TSV=5981265 TSER=5948920
  1   0.000000     10.0.1.3 -> 10.0.1.2     TCP 42403 > glrpc [SYN] Seq=0 Win=5840 Len=0 MSS=1460 TSV=5955128 TSER=0 WS=6
  2   0.000291     10.0.1.2 -> 10.0.1.3     TCP glrpc > 42403 [SYN, ACK] Seq=0 Ack=1 Win=14480 Len=0 MSS=1460 TSV=5987474 TSER=5955128 WS=6
  3   0.000316     10.0.1.3 -> 10.0.1.2     TCP 42403 > glrpc [ACK] Seq=1 Ack=1 Win=5888 Len=0 TSV=5955128 TSER=5987474
484667  55.243473     10.0.1.3 -> 10.0.1.2     TCP 42403 > glrpc [FIN, ACK] Seq=301001 Ack=501151001 Win=2010432 Len=0 TSV=5968939 TSER=6001272
484668  55.243887     10.0.1.2 -> 10.0.1.3     TCP glrpc > 42403 [FIN, ACK] Seq=501151001 Ack=301002 Win=157760 Len=0 TSV=6001286 TSER=5968939
  1   0.000000     10.0.1.3 -> 10.0.1.2     TCP 42405 > glrpc [SYN] Seq=0 Win=5840 Len=0 MSS=1460 TSV=5975180 TSER=0 WS=6
  2   0.000375     10.0.1.2 -> 10.0.1.3     TCP glrpc > 42405 [SYN, ACK] Seq=0 Ack=1 Win=14480 Len=0 MSS=1460 TSV=6007527 TSER=5975180 WS=6
  3   0.000397     10.0.1.3 -> 10.0.1.2     TCP 42405 > glrpc [ACK] Seq=1 Ack=1 Win=5888 Len=0 TSV=5975180 TSER=6007527
481549  55.533367     10.0.1.3 -> 10.0.1.2     TCP 42405 > glrpc [FIN, ACK] Seq=301001 Ack=501151001 Win=2020864 Len=0 TSV=5989063 TSER=6021382
481550  55.533827     10.0.1.2 -> 10.0.1.3     TCP glrpc > 42405 [FIN, ACK] Seq=501151001 Ack=301002 Win=164992 Len=0 TSV=6021412 TSER=5989063
  1   0.000000     10.0.1.3 -> 10.0.1.2     TCP 42407 > glrpc [SYN] Seq=0 Win=5840 Len=0 MSS=1460 TSV=5995307 TSER=0 WS=6
  2   0.000303     10.0.1.2 -> 10.0.1.3     TCP glrpc > 42407 [SYN, ACK] Seq=0 Ack=1 Win=14480 Len=0 MSS=1460 TSV=6027656 TSER=5995307 WS=6
  3   0.000323     10.0.1.3 -> 10.0.1.2     TCP 42407 > glrpc [ACK] Seq=1 Ack=1 Win=5888 Len=0 TSV=5995307 TSER=6027656
510060  55.045068     10.0.1.3 -> 10.0.1.2     TCP 42407 > glrpc [FIN, ACK] Seq=301001 Ack=501151001 Win=2004480 Len=0 TSV=6009068 TSER=6041407
510061  55.045439     10.0.1.2 -> 10.0.1.3     TCP glrpc > 42407 [FIN, ACK] Seq=501151001 Ack=301002 Win=154112 Len=0 TSV=6041418 TSER=6009068
