  1   0.000000     10.0.1.3 -> 10.0.1.2     TCP 57790 > http-alt [SYN] Seq=0 Win=5840 Len=0 MSS=1460 TSV=775535 TSER=0 WS=6
  2   0.000317     10.0.1.2 -> 10.0.1.3     TCP http-alt > 57790 [SYN, ACK] Seq=0 Ack=1 Win=14480 Len=0 MSS=1460 TSV=807491 TSER=775535 WS=6
  3   0.000340     10.0.1.3 -> 10.0.1.2     TCP 57790 > http-alt [ACK] Seq=1 Ack=1 Win=5888 Len=0 TSV=775535 TSER=807491
  1   0.000000     10.0.1.3 -> 10.0.1.2     TCP 57792 > http-alt [SYN] Seq=0 Win=5840 Len=0 MSS=1460 TSV=782702 TSER=0 WS=6
  2   0.000284     10.0.1.2 -> 10.0.1.3     TCP http-alt > 57792 [SYN, ACK] Seq=0 Ack=1 Win=14480 Len=0 MSS=1460 TSV=814659 TSER=782702 WS=6
  3   0.000307     10.0.1.3 -> 10.0.1.2     TCP 57792 > http-alt [ACK] Seq=1 Ack=1 Win=5888 Len=0 TSV=782702 TSER=814659
143646  12.848248     10.0.1.3 -> 10.0.1.2     TCP 57792 > http-alt [FIN, ACK] Seq=327 Ack=150146645 Win=2580480 Len=0 TSV=785915 TSER=817811
143647  12.848576     10.0.1.2 -> 10.0.1.3     TCP http-alt > 57792 [FIN, ACK] Seq=150146645 Ack=328 Win=15552 Len=0 TSV=817871 TSER=785915
  1   0.000000     10.0.1.3 -> 10.0.1.2     TCP 57794 > http-alt [SYN] Seq=0 Win=5840 Len=0 MSS=1460 TSV=789340 TSER=0 WS=6
  2   0.000273     10.0.1.2 -> 10.0.1.3     TCP http-alt > 57794 [SYN, ACK] Seq=0 Ack=1 Win=14480 Len=0 MSS=1460 TSV=821298 TSER=789340 WS=6
  3   0.000294     10.0.1.3 -> 10.0.1.2     TCP 57794 > http-alt [ACK] Seq=1 Ack=1 Win=5888 Len=0 TSV=789340 TSER=821298
  1   0.000000     10.0.1.3 -> 10.0.1.2     TCP 57796 > http-alt [SYN] Seq=0 Win=5840 Len=0 MSS=1460 TSV=796086 TSER=0 WS=6
  2   0.000307     10.0.1.2 -> 10.0.1.3     TCP http-alt > 57796 [SYN, ACK] Seq=0 Ack=1 Win=14480 Len=0 MSS=1460 TSV=828043 TSER=796086 WS=6
  3   0.000328     10.0.1.3 -> 10.0.1.2     TCP 57796 > http-alt [ACK] Seq=1 Ack=1 Win=5888 Len=0 TSV=796086 TSER=828043
  1   0.000000     10.0.1.3 -> 10.0.1.2     TCP 57798 > http-alt [SYN] Seq=0 Win=5840 Len=0 MSS=1460 TSV=802884 TSER=0 WS=6
  2   0.000310     10.0.1.2 -> 10.0.1.3     TCP http-alt > 57798 [SYN, ACK] Seq=0 Ack=1 Win=14480 Len=0 MSS=1460 TSV=834841 TSER=802884 WS=6
  3   0.000333     10.0.1.3 -> 10.0.1.2     TCP 57798 > http-alt [ACK] Seq=1 Ack=1 Win=5888 Len=0 TSV=802884 TSER=834841
153187  12.821916     10.0.1.3 -> 10.0.1.2     TCP 57798 > http-alt [FIN, ACK] Seq=327 Ack=150146645 Win=2580480 Len=0 TSV=806089 TSER=837988
153188  12.822283     10.0.1.2 -> 10.0.1.3     TCP http-alt > 57798 [FIN, ACK] Seq=150146645 Ack=328 Win=15552 Len=0 TSV=838047 TSER=806089
  1   0.000000     10.0.1.3 -> 10.0.1.2     TCP 57800 > http-alt [SYN] Seq=0 Win=5840 Len=0 MSS=1460 TSV=810130 TSER=0 WS=6
  2   0.000281     10.0.1.2 -> 10.0.1.3     TCP http-alt > 57800 [SYN, ACK] Seq=0 Ack=1 Win=14480 Len=0 MSS=1460 TSV=842089 TSER=810130 WS=6
  3   0.000303     10.0.1.3 -> 10.0.1.2     TCP 57800 > http-alt [ACK] Seq=1 Ack=1 Win=5888 Len=0 TSV=810130 TSER=842089
152486  12.828558     10.0.1.3 -> 10.0.1.2     TCP 57800 > http-alt [FIN, ACK] Seq=327 Ack=150146645 Win=2568768 Len=0 TSV=813337 TSER=845236
152487  12.828890     10.0.1.2 -> 10.0.1.3     TCP http-alt > 57800 [FIN, ACK] Seq=150146645 Ack=328 Win=15552 Len=0 TSV=845296 TSER=813337
  1   0.000000     10.0.1.3 -> 10.0.1.2     TCP 57802 > http-alt [SYN] Seq=0 Win=5840 Len=0 MSS=1460 TSV=817336 TSER=0 WS=6
  2   0.000266     10.0.1.2 -> 10.0.1.3     TCP http-alt > 57802 [SYN, ACK] Seq=0 Ack=1 Win=14480 Len=0 MSS=1460 TSV=849295 TSER=817336 WS=6
  3   0.000288     10.0.1.3 -> 10.0.1.2     TCP 57802 > http-alt [ACK] Seq=1 Ack=1 Win=5888 Len=0 TSV=817336 TSER=849295
152459  12.830571     10.0.1.3 -> 10.0.1.2     TCP 57802 > http-alt [FIN, ACK] Seq=327 Ack=150146645 Win=2563008 Len=0 TSV=820544 TSER=852443
152460  12.830888     10.0.1.2 -> 10.0.1.3     TCP http-alt > 57802 [FIN, ACK] Seq=150146645 Ack=328 Win=15552 Len=0 TSV=852503 TSER=820544
  1   0.000000     10.0.1.3 -> 10.0.1.2     TCP 57804 > http-alt [SYN] Seq=0 Win=5840 Len=0 MSS=1460 TSV=824419 TSER=0 WS=6
  2   0.000299     10.0.1.2 -> 10.0.1.3     TCP http-alt > 57804 [SYN, ACK] Seq=0 Ack=1 Win=14480 Len=0 MSS=1460 TSV=856379 TSER=824419 WS=6
  3   0.000322     10.0.1.3 -> 10.0.1.2     TCP 57804 > http-alt [ACK] Seq=1 Ack=1 Win=5888 Len=0 TSV=824420 TSER=856379
154845  14.879522     10.0.1.2 -> 10.0.1.3     TCP [TCP ACKed lost segment] [TCP Previous segment lost] http-alt > 57804 [FIN, ACK] Seq=150146645 Ack=328 Win=15552 Len=0 TSV=860099 TSER=828140
  1   0.000000     10.0.1.3 -> 10.0.1.2     TCP 50889 > http-alt [SYN] Seq=0 Win=5840 Len=0 MSS=1460 TSV=832298 TSER=0 WS=6
  2   0.000277     10.0.1.2 -> 10.0.1.3     TCP http-alt > 50889 [SYN, ACK] Seq=0 Ack=1 Win=14480 Len=0 MSS=1460 TSV=864259 TSER=832298 WS=6
  3   0.000298     10.0.1.3 -> 10.0.1.2     TCP 50889 > http-alt [ACK] Seq=1 Ack=1 Win=5888 Len=0 TSV=832298 TSER=864259
  1   0.000000     10.0.1.3 -> 10.0.1.2     TCP 50891 > http-alt [SYN] Seq=0 Win=5840 Len=0 MSS=1460 TSV=839585 TSER=0 WS=6
  2   0.000302     10.0.1.2 -> 10.0.1.3     TCP http-alt > 50891 [SYN, ACK] Seq=0 Ack=1 Win=14480 Len=0 MSS=1460 TSV=871546 TSER=839585 WS=6
  3   0.000326     10.0.1.3 -> 10.0.1.2     TCP 50891 > http-alt [ACK] Seq=1 Ack=1 Win=5888 Len=0 TSV=839585 TSER=871546
151744  12.827579     10.0.1.3 -> 10.0.1.2     TCP 50891 > http-alt [FIN, ACK] Seq=327 Ack=150146645 Win=2580480 Len=0 TSV=842792 TSER=874693
151745  12.827946     10.0.1.2 -> 10.0.1.3     TCP http-alt > 50891 [FIN, ACK] Seq=150146645 Ack=328 Win=15552 Len=0 TSV=874753 TSER=842792
  1   0.000000     10.0.1.3 -> 10.0.1.2     TCP 50893 > http-alt [SYN] Seq=0 Win=5840 Len=0 MSS=1460 TSV=846775 TSER=0 WS=6
  2   0.000290     10.0.1.2 -> 10.0.1.3     TCP http-alt > 50893 [SYN, ACK] Seq=0 Ack=1 Win=14480 Len=0 MSS=1460 TSV=878737 TSER=846775 WS=6
  3   0.000310     10.0.1.3 -> 10.0.1.2     TCP 50893 > http-alt [ACK] Seq=1 Ack=1 Win=5888 Len=0 TSV=846775 TSER=878737
140660  12.819956     10.0.1.3 -> 10.0.1.2     TCP 50893 > http-alt [FIN, ACK] Seq=327 Ack=150146645 Win=2580480 Len=0 TSV=849981 TSER=881883
140661  12.820284     10.0.1.2 -> 10.0.1.3     TCP http-alt > 50893 [FIN, ACK] Seq=150146645 Ack=328 Win=15552 Len=0 TSV=881942 TSER=849981
  1   0.000000     10.0.1.3 -> 10.0.1.2     TCP 50895 > http-alt [SYN] Seq=0 Win=5840 Len=0 MSS=1460 TSV=853606 TSER=0 WS=6
  2   0.000368     10.0.1.2 -> 10.0.1.3     TCP http-alt > 50895 [SYN, ACK] Seq=0 Ack=1 Win=14480 Len=0 MSS=1460 TSV=885568 TSER=853606 WS=6
  3   0.000391     10.0.1.3 -> 10.0.1.2     TCP 50895 > http-alt [ACK] Seq=1 Ack=1 Win=5888 Len=0 TSV=853606 TSER=885568
  1   0.000000     10.0.1.3 -> 10.0.1.2     TCP 50897 > http-alt [SYN] Seq=0 Win=5840 Len=0 MSS=1460 TSV=860951 TSER=0 WS=6
  2   0.000298     10.0.1.2 -> 10.0.1.3     TCP http-alt > 50897 [SYN, ACK] Seq=0 Ack=1 Win=14480 Len=0 MSS=1460 TSV=892913 TSER=860951 WS=6
  3   0.000320     10.0.1.3 -> 10.0.1.2     TCP 50897 > http-alt [ACK] Seq=1 Ack=1 Win=5888 Len=0 TSV=860951 TSER=892913
152637  12.827887     10.0.1.3 -> 10.0.1.2     TCP 50897 > http-alt [FIN, ACK] Seq=327 Ack=150146645 Win=2554304 Len=0 TSV=864158 TSER=896061
152638  12.828258     10.0.1.2 -> 10.0.1.3     TCP http-alt > 50897 [FIN, ACK] Seq=150146645 Ack=328 Win=15552 Len=0 TSV=896120 TSER=864158
  1   0.000000     10.0.1.3 -> 10.0.1.2     TCP 50899 > http-alt [SYN] Seq=0 Win=5840 Len=0 MSS=1460 TSV=868158 TSER=0 WS=6
  2   0.000330     10.0.1.2 -> 10.0.1.3     TCP http-alt > 50899 [SYN, ACK] Seq=0 Ack=1 Win=14480 Len=0 MSS=1460 TSV=900121 TSER=868158 WS=6
  3   0.000351     10.0.1.3 -> 10.0.1.2     TCP 50899 > http-alt [ACK] Seq=1 Ack=1 Win=5888 Len=0 TSV=868158 TSER=900121
151396  12.824457     10.0.1.3 -> 10.0.1.2     TCP 50899 > http-alt [FIN, ACK] Seq=327 Ack=150146645 Win=2580352 Len=0 TSV=871364 TSER=903267
151397  12.824826     10.0.1.2 -> 10.0.1.3     TCP http-alt > 50899 [FIN, ACK] Seq=150146645 Ack=328 Win=15552 Len=0 TSV=903327 TSER=871364
  1   0.000000     10.0.1.3 -> 10.0.1.2     TCP 50901 > http-alt [SYN] Seq=0 Win=5840 Len=0 MSS=1460 TSV=875458 TSER=0 WS=6
  2   0.000313     10.0.1.2 -> 10.0.1.3     TCP http-alt > 50901 [SYN, ACK] Seq=0 Ack=1 Win=14480 Len=0 MSS=1460 TSV=907421 TSER=875458 WS=6
  3   0.000335     10.0.1.3 -> 10.0.1.2     TCP 50901 > http-alt [ACK] Seq=1 Ack=1 Win=5888 Len=0 TSV=875458 TSER=907421
152843  12.830890     10.0.1.3 -> 10.0.1.2     TCP 50901 > http-alt [FIN, ACK] Seq=327 Ack=150146645 Win=2568768 Len=0 TSV=878666 TSER=910569
152844  12.831233     10.0.1.2 -> 10.0.1.3     TCP http-alt > 50901 [FIN, ACK] Seq=150146645 Ack=328 Win=15552 Len=0 TSV=910629 TSER=878666
  1   0.000000     10.0.1.3 -> 10.0.1.2     TCP 50903 > http-alt [SYN] Seq=0 Win=5840 Len=0 MSS=1460 TSV=882149 TSER=0 WS=6
  2   0.000270     10.0.1.2 -> 10.0.1.3     TCP http-alt > 50903 [SYN, ACK] Seq=0 Ack=1 Win=14480 Len=0 MSS=1460 TSV=914113 TSER=882149 WS=6
  3   0.000291     10.0.1.3 -> 10.0.1.2     TCP 50903 > http-alt [ACK] Seq=1 Ack=1 Win=5888 Len=0 TSV=882149 TSER=914113
152846  12.832118     10.0.1.3 -> 10.0.1.2     TCP [TCP ACKed lost segment] 50903 > http-alt [FIN, ACK] Seq=327 Ack=150146645 Win=2580480 Len=0 TSV=885357 TSER=917262
152847  12.832475     10.0.1.2 -> 10.0.1.3     TCP http-alt > 50903 [FIN, ACK] Seq=150146645 Ack=328 Win=15552 Len=0 TSV=917321 TSER=885357
  1   0.000000     10.0.1.3 -> 10.0.1.2     TCP 50905 > http-alt [SYN] Seq=0 Win=5840 Len=0 MSS=1460 TSV=889306 TSER=0 WS=6
  2   0.000285     10.0.1.2 -> 10.0.1.3     TCP http-alt > 50905 [SYN, ACK] Seq=0 Ack=1 Win=14480 Len=0 MSS=1460 TSV=921271 TSER=889306 WS=6
  3   0.000306     10.0.1.3 -> 10.0.1.2     TCP 50905 > http-alt [ACK] Seq=1 Ack=1 Win=5888 Len=0 TSV=889306 TSER=921271
155173  12.827462     10.0.1.3 -> 10.0.1.2     TCP 50905 > http-alt [FIN, ACK] Seq=327 Ack=150146645 Win=2580480 Len=0 TSV=892513 TSER=924417
155174  12.827823     10.0.1.2 -> 10.0.1.3     TCP http-alt > 50905 [FIN, ACK] Seq=150146645 Ack=328 Win=15552 Len=0 TSV=924478 TSER=892513
  1   0.000000     10.0.1.3 -> 10.0.1.2     TCP 50907 > http-alt [SYN] Seq=0 Win=5840 Len=0 MSS=1460 TSV=896620 TSER=0 WS=6
  2   0.000283     10.0.1.2 -> 10.0.1.3     TCP http-alt > 50907 [SYN, ACK] Seq=0 Ack=1 Win=14480 Len=0 MSS=1460 TSV=928585 TSER=896620 WS=6
  3   0.000305     10.0.1.3 -> 10.0.1.2     TCP 50907 > http-alt [ACK] Seq=1 Ack=1 Win=5888 Len=0 TSV=896620 TSER=928585
152367  12.829861     10.0.1.3 -> 10.0.1.2     TCP 50907 > http-alt [FIN, ACK] Seq=327 Ack=150146645 Win=2580480 Len=0 TSV=899827 TSER=931732
152368  12.830264     10.0.1.2 -> 10.0.1.3     TCP http-alt > 50907 [FIN, ACK] Seq=150146645 Ack=328 Win=15552 Len=0 TSV=931793 TSER=899827
  1   0.000000     10.0.1.3 -> 10.0.1.2     TCP 57949 > http-alt [SYN] Seq=0 Win=5840 Len=0 MSS=1460 TSV=903749 TSER=0 WS=6
  2   0.000319     10.0.1.2 -> 10.0.1.3     TCP http-alt > 57949 [SYN, ACK] Seq=0 Ack=1 Win=14480 Len=0 MSS=1460 TSV=935715 TSER=903749 WS=6
  3   0.000341     10.0.1.3 -> 10.0.1.2     TCP 57949 > http-alt [ACK] Seq=1 Ack=1 Win=5888 Len=0 TSV=903749 TSER=935715
151751  12.826070     10.0.1.3 -> 10.0.1.2     TCP 57949 > http-alt [FIN, ACK] Seq=327 Ack=150146645 Win=2580480 Len=0 TSV=906956 TSER=938861
151752  12.826416     10.0.1.2 -> 10.0.1.3     TCP http-alt > 57949 [FIN, ACK] Seq=150146645 Ack=328 Win=15552 Len=0 TSV=938921 TSER=906956
  1   0.000000     10.0.1.3 -> 10.0.1.2     TCP 57951 > http-alt [SYN] Seq=0 Win=5840 Len=0 MSS=1460 TSV=910517 TSER=0 WS=6
  2   0.000258     10.0.1.2 -> 10.0.1.3     TCP http-alt > 57951 [SYN, ACK] Seq=0 Ack=1 Win=14480 Len=0 MSS=1460 TSV=942483 TSER=910517 WS=6
  3   0.000276     10.0.1.3 -> 10.0.1.2     TCP 57951 > http-alt [ACK] Seq=1 Ack=1 Win=5888 Len=0 TSV=910517 TSER=942483
152567  12.834687     10.0.1.3 -> 10.0.1.2     TCP 57951 > http-alt [FIN, ACK] Seq=327 Ack=150146645 Win=2571648 Len=0 TSV=913726 TSER=945631
152568  12.835031     10.0.1.2 -> 10.0.1.3     TCP http-alt > 57951 [FIN, ACK] Seq=150146645 Ack=328 Win=15552 Len=0 TSV=945692 TSER=913726
