  1   0.000000     10.0.1.3 -> 10.0.1.2     TCP 56074 > http-alt [SYN] Seq=0 Win=5840 Len=0 MSS=1460 TSV=658063 TSER=0 WS=6
  2   0.000276     10.0.1.2 -> 10.0.1.3     TCP http-alt > 56074 [SYN, ACK] Seq=0 Ack=1 Win=14480 Len=0 MSS=1460 TSV=690010 TSER=658063 WS=6
  3   0.000297     10.0.1.3 -> 10.0.1.2     TCP 56074 > http-alt [ACK] Seq=1 Ack=1 Win=5888 Len=0 TSV=658063 TSER=690010
102932   8.567282     10.0.1.3 -> 10.0.1.2     TCP 56074 > http-alt [FIN, ACK] Seq=327 Ack=100097820 Win=2580480 Len=0 TSV=660205 TSER=692092
102933   8.567610     10.0.1.2 -> 10.0.1.3     TCP http-alt > 56074 [FIN, ACK] Seq=100097820 Ack=328 Win=15552 Len=0 TSV=692152 TSER=660205
  1   0.000000     10.0.1.3 -> 10.0.1.2     TCP 56076 > http-alt [SYN] Seq=0 Win=5840 Len=0 MSS=1460 TSV=663659 TSER=0 WS=6
  2   0.000379     10.0.1.2 -> 10.0.1.3     TCP http-alt > 56076 [SYN, ACK] Seq=0 Ack=1 Win=14480 Len=0 MSS=1460 TSV=695607 TSER=663659 WS=6
  3   0.000400     10.0.1.3 -> 10.0.1.2     TCP 56076 > http-alt [ACK] Seq=1 Ack=1 Win=5888 Len=0 TSV=663660 TSER=695607
103147   8.562949     10.0.1.3 -> 10.0.1.2     TCP 56076 > http-alt [FIN, ACK] Seq=327 Ack=100097820 Win=2580480 Len=0 TSV=665800 TSER=697689
103148   8.563297     10.0.1.2 -> 10.0.1.3     TCP http-alt > 56076 [FIN, ACK] Seq=100097820 Ack=328 Win=15552 Len=0 TSV=697748 TSER=665800
  1   0.000000     10.0.1.3 -> 10.0.1.2     TCP 56078 > http-alt [SYN] Seq=0 Win=5840 Len=0 MSS=1460 TSV=671873 TSER=0 WS=6
  2   0.000302     10.0.1.2 -> 10.0.1.3     TCP http-alt > 56078 [SYN, ACK] Seq=0 Ack=1 Win=14480 Len=0 MSS=1460 TSV=703821 TSER=671873 WS=6
  3   0.000325     10.0.1.3 -> 10.0.1.2     TCP 56078 > http-alt [ACK] Seq=1 Ack=1 Win=5888 Len=0 TSV=671873 TSER=703821
103016   8.565219     10.0.1.3 -> 10.0.1.2     TCP 56078 > http-alt [FIN, ACK] Seq=327 Ack=100097820 Win=2580480 Len=0 TSV=674014 TSER=705903
103017   8.565571     10.0.1.2 -> 10.0.1.3     TCP http-alt > 56078 [FIN, ACK] Seq=100097820 Ack=328 Win=15552 Len=0 TSV=705962 TSER=674014
  1   0.000000     10.0.1.3 -> 10.0.1.2     TCP 37957 > http-alt [SYN] Seq=0 Win=5840 Len=0 MSS=1460 TSV=677396 TSER=0 WS=6
  2   0.000295     10.0.1.2 -> 10.0.1.3     TCP http-alt > 37957 [SYN, ACK] Seq=0 Ack=1 Win=14480 Len=0 MSS=1460 TSV=709345 TSER=677396 WS=6
  3   0.000319     10.0.1.3 -> 10.0.1.2     TCP 37957 > http-alt [ACK] Seq=1 Ack=1 Win=5888 Len=0 TSV=677397 TSER=709345
  1   0.000000     10.0.1.3 -> 10.0.1.2     TCP 37959 > http-alt [SYN] Seq=0 Win=5840 Len=0 MSS=1460 TSV=682875 TSER=0 WS=6
  2   0.000368     10.0.1.2 -> 10.0.1.3     TCP http-alt > 37959 [SYN, ACK] Seq=0 Ack=1 Win=14480 Len=0 MSS=1460 TSV=714824 TSER=682875 WS=6
  3   0.000390     10.0.1.3 -> 10.0.1.2     TCP 37959 > http-alt [ACK] Seq=1 Ack=1 Win=5888 Len=0 TSV=682875 TSER=714824
  1   0.000000     10.0.1.3 -> 10.0.1.2     TCP 37961 > http-alt [SYN] Seq=0 Win=5840 Len=0 MSS=1460 TSV=688406 TSER=0 WS=6
  2   0.000270     10.0.1.2 -> 10.0.1.3     TCP http-alt > 37961 [SYN, ACK] Seq=0 Ack=1 Win=14480 Len=0 MSS=1460 TSV=720355 TSER=688406 WS=6
  3   0.000292     10.0.1.3 -> 10.0.1.2     TCP 37961 > http-alt [ACK] Seq=1 Ack=1 Win=5888 Len=0 TSV=688406 TSER=720355
103285   8.615660     10.0.1.3 -> 10.0.1.2     TCP 37961 > http-alt [FIN, ACK] Seq=327 Ack=100097820 Win=2580480 Len=0 TSV=690560 TSER=722450
103286   8.615994     10.0.1.2 -> 10.0.1.3     TCP http-alt > 37961 [FIN, ACK] Seq=100097820 Ack=328 Win=15552 Len=0 TSV=722510 TSER=690560
  1   0.000000     10.0.1.3 -> 10.0.1.2     TCP 37963 > http-alt [SYN] Seq=0 Win=5840 Len=0 MSS=1460 TSV=694003 TSER=0 WS=6
  2   0.000270     10.0.1.2 -> 10.0.1.3     TCP http-alt > 37963 [SYN, ACK] Seq=0 Ack=1 Win=14480 Len=0 MSS=1460 TSV=725953 TSER=694003 WS=6
  3   0.000289     10.0.1.3 -> 10.0.1.2     TCP 37963 > http-alt [ACK] Seq=1 Ack=1 Win=5888 Len=0 TSV=694004 TSER=725953
103411   8.567407     10.0.1.3 -> 10.0.1.2     TCP 37963 > http-alt [FIN, ACK] Seq=327 Ack=100097820 Win=2580480 Len=0 TSV=696145 TSER=728034
103412   8.567772     10.0.1.2 -> 10.0.1.3     TCP http-alt > 37963 [FIN, ACK] Seq=100097820 Ack=328 Win=15552 Len=0 TSV=728095 TSER=696145
  1   0.000000     10.0.1.3 -> 10.0.1.2     TCP 37965 > http-alt [SYN] Seq=0 Win=5840 Len=0 MSS=1460 TSV=700567 TSER=0 WS=6
  2   0.000319     10.0.1.2 -> 10.0.1.3     TCP http-alt > 37965 [SYN, ACK] Seq=0 Ack=1 Win=14480 Len=0 MSS=1460 TSV=732517 TSER=700567 WS=6
  3   0.000341     10.0.1.3 -> 10.0.1.2     TCP 37965 > http-alt [ACK] Seq=1 Ack=1 Win=5888 Len=0 TSV=700567 TSER=732517
103149   8.567086     10.0.1.3 -> 10.0.1.2     TCP 37965 > http-alt [FIN, ACK] Seq=327 Ack=100097820 Win=2580480 Len=0 TSV=702709 TSER=734598
103150   8.567420     10.0.1.2 -> 10.0.1.3     TCP http-alt > 37965 [FIN, ACK] Seq=100097820 Ack=328 Win=15552 Len=0 TSV=734659 TSER=702709
  1   0.000000     10.0.1.3 -> 10.0.1.2     TCP 37967 > http-alt [SYN] Seq=0 Win=5840 Len=0 MSS=1460 TSV=706175 TSER=0 WS=6
  2   0.000313     10.0.1.2 -> 10.0.1.3     TCP http-alt > 37967 [SYN, ACK] Seq=0 Ack=1 Win=14480 Len=0 MSS=1460 TSV=738126 TSER=706175 WS=6
  3   0.000333     10.0.1.3 -> 10.0.1.2     TCP 37967 > http-alt [ACK] Seq=1 Ack=1 Win=5888 Len=0 TSV=706176 TSER=738126
103036   8.573167     10.0.1.3 -> 10.0.1.2     TCP 37967 > http-alt [FIN, ACK] Seq=327 Ack=100097820 Win=2580480 Len=0 TSV=708319 TSER=740208
103037   8.573512     10.0.1.2 -> 10.0.1.3     TCP http-alt > 37967 [FIN, ACK] Seq=100097820 Ack=328 Win=15552 Len=0 TSV=740270 TSER=708319
  1   0.000000     10.0.1.3 -> 10.0.1.2     TCP 37969 > http-alt [SYN] Seq=0 Win=5840 Len=0 MSS=1460 TSV=711738 TSER=0 WS=6
  2   0.000372     10.0.1.2 -> 10.0.1.3     TCP http-alt > 37969 [SYN, ACK] Seq=0 Ack=1 Win=14480 Len=0 MSS=1460 TSV=743689 TSER=711738 WS=6
  3   0.000397     10.0.1.3 -> 10.0.1.2     TCP 37969 > http-alt [ACK] Seq=1 Ack=1 Win=5888 Len=0 TSV=711738 TSER=743689
  1   0.000000     10.0.1.3 -> 10.0.1.2     TCP 37971 > http-alt [SYN] Seq=0 Win=5840 Len=0 MSS=1460 TSV=716837 TSER=0 WS=6
  2   0.000309     10.0.1.2 -> 10.0.1.3     TCP http-alt > 37971 [SYN, ACK] Seq=0 Ack=1 Win=14480 Len=0 MSS=1460 TSV=748789 TSER=716837 WS=6
  3   0.000334     10.0.1.3 -> 10.0.1.2     TCP 37971 > http-alt [ACK] Seq=1 Ack=1 Win=5888 Len=0 TSV=716837 TSER=748789
103306   8.564131     10.0.1.3 -> 10.0.1.2     TCP 37971 > http-alt [FIN, ACK] Seq=327 Ack=100097820 Win=2580480 Len=0 TSV=718978 TSER=750870
103307   8.564482     10.0.1.2 -> 10.0.1.3     TCP http-alt > 37971 [FIN, ACK] Seq=100097820 Ack=328 Win=15552 Len=0 TSV=750930 TSER=718978
  1   0.000000     10.0.1.3 -> 10.0.1.2     TCP 37973 > http-alt [SYN] Seq=0 Win=5840 Len=0 MSS=1460 TSV=722498 TSER=0 WS=6
  2   0.000394     10.0.1.2 -> 10.0.1.3     TCP http-alt > 37973 [SYN, ACK] Seq=0 Ack=1 Win=14480 Len=0 MSS=1460 TSV=754449 TSER=722498 WS=6
  3   0.000420     10.0.1.3 -> 10.0.1.2     TCP 37973 > http-alt [ACK] Seq=1 Ack=1 Win=5888 Len=0 TSV=722498 TSER=754449
  1   0.000000     10.0.1.3 -> 10.0.1.2     TCP 37975 > http-alt [SYN] Seq=0 Win=5840 Len=0 MSS=1460 TSV=730737 TSER=0 WS=6
  2   0.000298     10.0.1.2 -> 10.0.1.3     TCP http-alt > 37975 [SYN, ACK] Seq=0 Ack=1 Win=14480 Len=0 MSS=1460 TSV=762689 TSER=730737 WS=6
  3   0.000323     10.0.1.3 -> 10.0.1.2     TCP 37975 > http-alt [ACK] Seq=1 Ack=1 Win=5888 Len=0 TSV=730737 TSER=762689
103227   8.563334     10.0.1.3 -> 10.0.1.2     TCP 37975 > http-alt [FIN, ACK] Seq=327 Ack=100097820 Win=2580480 Len=0 TSV=732878 TSER=764771
103228   8.563696     10.0.1.2 -> 10.0.1.3     TCP http-alt > 37975 [FIN, ACK] Seq=100097820 Ack=328 Win=15552 Len=0 TSV=764830 TSER=732878
  1   0.000000     10.0.1.3 -> 10.0.1.2     TCP 37977 > http-alt [SYN] Seq=0 Win=5840 Len=0 MSS=1460 TSV=736096 TSER=0 WS=6
  2   0.000316     10.0.1.2 -> 10.0.1.3     TCP http-alt > 37977 [SYN, ACK] Seq=0 Ack=1 Win=14480 Len=0 MSS=1460 TSV=768050 TSER=736096 WS=6
  3   0.000338     10.0.1.3 -> 10.0.1.2     TCP 37977 > http-alt [ACK] Seq=1 Ack=1 Win=5888 Len=0 TSV=736097 TSER=768050
103195   8.559375     10.0.1.3 -> 10.0.1.2     TCP 37977 > http-alt [FIN, ACK] Seq=327 Ack=100097820 Win=2580480 Len=0 TSV=738236 TSER=770131
103196   8.559800     10.0.1.2 -> 10.0.1.3     TCP http-alt > 37977 [FIN, ACK] Seq=100097820 Ack=328 Win=15552 Len=0 TSV=770190 TSER=738236
  1   0.000000     10.0.1.3 -> 10.0.1.2     TCP 37979 > http-alt [SYN] Seq=0 Win=5840 Len=0 MSS=1460 TSV=741636 TSER=0 WS=6
  2   0.000318     10.0.1.2 -> 10.0.1.3     TCP http-alt > 37979 [SYN, ACK] Seq=0 Ack=1 Win=14480 Len=0 MSS=1460 TSV=773589 TSER=741636 WS=6
  3   0.000340     10.0.1.3 -> 10.0.1.2     TCP 37979 > http-alt [ACK] Seq=1 Ack=1 Win=5888 Len=0 TSV=741636 TSER=773589
  1   0.000000     10.0.1.3 -> 10.0.1.2     TCP 37981 > http-alt [SYN] Seq=0 Win=5840 Len=0 MSS=1460 TSV=746870 TSER=0 WS=6
  2   0.000302     10.0.1.2 -> 10.0.1.3     TCP http-alt > 37981 [SYN, ACK] Seq=0 Ack=1 Win=14480 Len=0 MSS=1460 TSV=778824 TSER=746870 WS=6
  3   0.000322     10.0.1.3 -> 10.0.1.2     TCP 37981 > http-alt [ACK] Seq=1 Ack=1 Win=5888 Len=0 TSV=746870 TSER=778824
  1   0.000000     10.0.1.3 -> 10.0.1.2     TCP 57782 > http-alt [SYN] Seq=0 Win=5840 Len=0 MSS=1460 TSV=752343 TSER=0 WS=6
  2   0.000300     10.0.1.2 -> 10.0.1.3     TCP http-alt > 57782 [SYN, ACK] Seq=0 Ack=1 Win=14480 Len=0 MSS=1460 TSV=784297 TSER=752343 WS=6
  3   0.000323     10.0.1.3 -> 10.0.1.2     TCP 57782 > http-alt [ACK] Seq=1 Ack=1 Win=5888 Len=0 TSV=752343 TSER=784297
103076   8.563932     10.0.1.3 -> 10.0.1.2     TCP 57782 > http-alt [FIN, ACK] Seq=327 Ack=100097820 Win=2580480 Len=0 TSV=754484 TSER=786379
103077   8.564307     10.0.1.2 -> 10.0.1.3     TCP http-alt > 57782 [FIN, ACK] Seq=100097820 Ack=328 Win=15552 Len=0 TSV=786438 TSER=754484
  1   0.000000     10.0.1.3 -> 10.0.1.2     TCP 57784 > http-alt [SYN] Seq=0 Win=5840 Len=0 MSS=1460 TSV=757988 TSER=0 WS=6
  2   0.000332     10.0.1.2 -> 10.0.1.3     TCP http-alt > 57784 [SYN, ACK] Seq=0 Ack=1 Win=14480 Len=0 MSS=1460 TSV=789943 TSER=757988 WS=6
  3   0.000355     10.0.1.3 -> 10.0.1.2     TCP 57784 > http-alt [ACK] Seq=1 Ack=1 Win=5888 Len=0 TSV=757989 TSER=789943
103103   8.567760     10.0.1.3 -> 10.0.1.2     TCP 57784 > http-alt [FIN, ACK] Seq=327 Ack=100097820 Win=2580480 Len=0 TSV=760130 TSER=792026
103104   8.568070     10.0.1.2 -> 10.0.1.3     TCP http-alt > 57784 [FIN, ACK] Seq=100097820 Ack=328 Win=15552 Len=0 TSV=792085 TSER=760130
  1   0.000000     10.0.1.3 -> 10.0.1.2     TCP 57786 > http-alt [SYN] Seq=0 Win=5840 Len=0 MSS=1460 TSV=763514 TSER=0 WS=6
  2   0.000307     10.0.1.2 -> 10.0.1.3     TCP http-alt > 57786 [SYN, ACK] Seq=0 Ack=1 Win=14480 Len=0 MSS=1460 TSV=795468 TSER=763514 WS=6
  3   0.000328     10.0.1.3 -> 10.0.1.2     TCP 57786 > http-alt [ACK] Seq=1 Ack=1 Win=5888 Len=0 TSV=763514 TSER=795468
103080   8.569337     10.0.1.3 -> 10.0.1.2     TCP 57786 > http-alt [FIN, ACK] Seq=327 Ack=100097820 Win=2560064 Len=0 TSV=765656 TSER=797552
103081   8.569704     10.0.1.2 -> 10.0.1.3     TCP http-alt > 57786 [FIN, ACK] Seq=100097820 Ack=328 Win=15552 Len=0 TSV=797611 TSER=765656
  1   0.000000     10.0.1.3 -> 10.0.1.2     TCP 57788 > http-alt [SYN] Seq=0 Win=5840 Len=0 MSS=1460 TSV=769092 TSER=0 WS=6
  2   0.000302     10.0.1.2 -> 10.0.1.3     TCP http-alt > 57788 [SYN, ACK] Seq=0 Ack=1 Win=14480 Len=0 MSS=1460 TSV=801047 TSER=769092 WS=6
  3   0.000324     10.0.1.3 -> 10.0.1.2     TCP 57788 > http-alt [ACK] Seq=1 Ack=1 Win=5888 Len=0 TSV=769092 TSER=801047
