  1   0.000000     10.0.1.3 -> 10.0.1.2     TCP 34255 > http-alt [SYN] Seq=0 Win=5840 Len=0 MSS=1460 TSV=6668868 TSER=0 WS=6
  2   0.000266     10.0.1.2 -> 10.0.1.3     TCP http-alt > 34255 [SYN, ACK] Seq=0 Ack=1 Win=14480 Len=0 MSS=1460 TSV=6722611 TSER=6668868 WS=6
  3   0.000288     10.0.1.3 -> 10.0.1.2     TCP 34255 > http-alt [ACK] Seq=1 Ack=1 Win=5888 Len=0 TSV=6668868 TSER=6722611
154817  12.835064     10.0.1.3 -> 10.0.1.2     TCP 34255 > http-alt [FIN, ACK] Seq=327 Ack=150146645 Win=2580480 Len=0 TSV=6672077 TSER=6725759
154818  12.835433     10.0.1.2 -> 10.0.1.3     TCP http-alt > 34255 [FIN, ACK] Seq=150146645 Ack=328 Win=15552 Len=0 TSV=6725820 TSER=6672077
================================================================================
IPv4 Conversations
Filter:<No Filter>
                                               |       <-      | |       ->      | |     Total     |
                                               | Frames  Bytes | | Frames  Bytes | | Frames  Bytes |
10.0.1.3             <-> 10.0.1.2              103703 156991050   51116   3373990  154819 160365040
================================================================================
  1   0.000000     10.0.1.3 -> 10.0.1.2     TCP 34257 > http-alt [SYN] Seq=0 Win=5840 Len=0 MSS=1460 TSV=6674914 TSER=0 WS=6
  2   0.000273     10.0.1.2 -> 10.0.1.3     TCP http-alt > 34257 [SYN, ACK] Seq=0 Ack=1 Win=14480 Len=0 MSS=1460 TSV=6728658 TSER=6674914 WS=6
  3   0.000292     10.0.1.3 -> 10.0.1.2     TCP 34257 > http-alt [ACK] Seq=1 Ack=1 Win=5888 Len=0 TSV=6674914 TSER=6728658
155580  12.828473     10.0.1.3 -> 10.0.1.2     TCP 34257 > http-alt [FIN, ACK] Seq=327 Ack=150146645 Win=2580480 Len=0 TSV=6678121 TSER=6731804
155581  12.828834     10.0.1.2 -> 10.0.1.3     TCP http-alt > 34257 [FIN, ACK] Seq=150146645 Ack=328 Win=15552 Len=0 TSV=6731865 TSER=6678121
================================================================================
IPv4 Conversations
Filter:<No Filter>
                                               |       <-      | |       ->      | |     Total     |
                                               | Frames  Bytes | | Frames  Bytes | | Frames  Bytes |
10.0.1.3             <-> 10.0.1.2              103699 156990786   51883   3424612  155582 160415398
================================================================================
  1   0.000000     10.0.1.3 -> 10.0.1.2     TCP 50665 > http-alt [SYN] Seq=0 Win=5840 Len=0 MSS=1460 TSV=6680997 TSER=0 WS=6
  2   0.000294     10.0.1.2 -> 10.0.1.3     TCP http-alt > 50665 [SYN, ACK] Seq=0 Ack=1 Win=14480 Len=0 MSS=1460 TSV=6734741 TSER=6680997 WS=6
  3   0.000316     10.0.1.3 -> 10.0.1.2     TCP 50665 > http-alt [ACK] Seq=1 Ack=1 Win=5888 Len=0 TSV=6680997 TSER=6734741
155631  12.882980     10.0.1.3 -> 10.0.1.2     TCP 50665 > http-alt [FIN, ACK] Seq=327 Ack=150146645 Win=2580480 Len=0 TSV=6684218 TSER=6737902
155632  12.883352     10.0.1.2 -> 10.0.1.3     TCP http-alt > 50665 [FIN, ACK] Seq=150146645 Ack=328 Win=15552 Len=0 TSV=6737962 TSER=6684218
================================================================================
IPv4 Conversations
Filter:<No Filter>
                                               |       <-      | |       ->      | |     Total     |
                                               | Frames  Bytes | | Frames  Bytes | | Frames  Bytes |
10.0.1.3             <-> 10.0.1.2              103706 156991248   51927   3427516  155633 160418764
================================================================================
  1   0.000000     10.0.1.3 -> 10.0.1.2     TCP 50668 > http-alt [SYN] Seq=0 Win=5840 Len=0 MSS=1460 TSV=6687072 TSER=0 WS=6
  2   0.000268     10.0.1.2 -> 10.0.1.3     TCP http-alt > 50668 [SYN, ACK] Seq=0 Ack=1 Win=14480 Len=0 MSS=1460 TSV=6740816 TSER=6687072 WS=6
  3   0.000289     10.0.1.3 -> 10.0.1.2     TCP 50668 > http-alt [ACK] Seq=1 Ack=1 Win=5888 Len=0 TSV=6687072 TSER=6740816
155563  12.833056     10.0.1.3 -> 10.0.1.2     TCP 50668 > http-alt [FIN, ACK] Seq=327 Ack=150146645 Win=2580352 Len=0 TSV=6690280 TSER=6743963
155564  12.833439     10.0.1.2 -> 10.0.1.3     TCP http-alt > 50668 [FIN, ACK] Seq=150146645 Ack=328 Win=15552 Len=0 TSV=6744025 TSER=6690280
================================================================================
IPv4 Conversations
Filter:<No Filter>
                                               |       <-      | |       ->      | |     Total     |
                                               | Frames  Bytes | | Frames  Bytes | | Frames  Bytes |
10.0.1.3             <-> 10.0.1.2              103704 156991116   51861   3423160  155565 160414276
================================================================================
  1   0.000000     10.0.1.3 -> 10.0.1.2     TCP 50670 > http-alt [SYN] Seq=0 Win=5840 Len=0 MSS=1460 TSV=6693132 TSER=0 WS=6
  2   0.000311     10.0.1.2 -> 10.0.1.3     TCP http-alt > 50670 [SYN, ACK] Seq=0 Ack=1 Win=14480 Len=0 MSS=1460 TSV=6746877 TSER=6693132 WS=6
  3   0.000332     10.0.1.3 -> 10.0.1.2     TCP 50670 > http-alt [ACK] Seq=1 Ack=1 Win=5888 Len=0 TSV=6693132 TSER=6746877
155493  12.825709     10.0.1.3 -> 10.0.1.2     TCP 50670 > http-alt [FIN, ACK] Seq=327 Ack=150146645 Win=2580480 Len=0 TSV=6696338 TSER=6750025
155494  12.826087     10.0.1.2 -> 10.0.1.3     TCP http-alt > 50670 [FIN, ACK] Seq=150146645 Ack=328 Win=15552 Len=0 TSV=6750084 TSER=6696338
================================================================================
IPv4 Conversations
Filter:<No Filter>
                                               |       <-      | |       ->      | |     Total     |
                                               | Frames  Bytes | | Frames  Bytes | | Frames  Bytes |
10.0.1.3             <-> 10.0.1.2              103703 156991050   51792   3418606  155495 160409656
================================================================================
  1   0.000000     10.0.1.3 -> 10.0.1.2     TCP 50673 > http-alt [SYN] Seq=0 Win=5840 Len=0 MSS=1460 TSV=6699183 TSER=0 WS=6
  2   0.000275     10.0.1.2 -> 10.0.1.3     TCP http-alt > 50673 [SYN, ACK] Seq=0 Ack=1 Win=14480 Len=0 MSS=1460 TSV=6752929 TSER=6699183 WS=6
  3   0.000299     10.0.1.3 -> 10.0.1.2     TCP 50673 > http-alt [ACK] Seq=1 Ack=1 Win=5888 Len=0 TSV=6699183 TSER=6752929
155570  12.832088     10.0.1.3 -> 10.0.1.2     TCP 50673 > http-alt [FIN, ACK] Seq=327 Ack=150146645 Win=2580480 Len=0 TSV=6702391 TSER=6756076
155571  12.832465     10.0.1.2 -> 10.0.1.3     TCP http-alt > 50673 [FIN, ACK] Seq=150146645 Ack=328 Win=15552 Len=0 TSV=6756137 TSER=6702391
================================================================================
IPv4 Conversations
Filter:<No Filter>
                                               |       <-      | |       ->      | |     Total     |
                                               | Frames  Bytes | | Frames  Bytes | | Frames  Bytes |
10.0.1.3             <-> 10.0.1.2              103706 156991248   51866   3423490  155572 160414738
================================================================================
  1   0.000000     10.0.1.3 -> 10.0.1.2     TCP 50676 > http-alt [SYN] Seq=0 Win=5840 Len=0 MSS=1460 TSV=6705251 TSER=0 WS=6
  2   0.000361     10.0.1.2 -> 10.0.1.3     TCP http-alt > 50676 [SYN, ACK] Seq=0 Ack=1 Win=14480 Len=0 MSS=1460 TSV=6758997 TSER=6705251 WS=6
  3   0.000386     10.0.1.3 -> 10.0.1.2     TCP 50676 > http-alt [ACK] Seq=1 Ack=1 Win=5888 Len=0 TSV=6705251 TSER=6758997
155517  12.830677     10.0.1.3 -> 10.0.1.2     TCP 50676 > http-alt [FIN, ACK] Seq=327 Ack=150146645 Win=2580480 Len=0 TSV=6708458 TSER=6762144
155518  12.831046     10.0.1.2 -> 10.0.1.3     TCP http-alt > 50676 [FIN, ACK] Seq=150146645 Ack=328 Win=15552 Len=0 TSV=6762205 TSER=6708458
================================================================================
IPv4 Conversations
Filter:<No Filter>
                                               |       <-      | |       ->      | |     Total     |
                                               | Frames  Bytes | | Frames  Bytes | | Frames  Bytes |
10.0.1.3             <-> 10.0.1.2              103700 156990852   51819   3420388  155519 160411240
================================================================================
  1   0.000000     10.0.1.3 -> 10.0.1.2     TCP 50678 > http-alt [SYN] Seq=0 Win=5840 Len=0 MSS=1460 TSV=6711312 TSER=0 WS=6
  2   0.000365     10.0.1.2 -> 10.0.1.3     TCP http-alt > 50678 [SYN, ACK] Seq=0 Ack=1 Win=14480 Len=0 MSS=1460 TSV=6765058 TSER=6711312 WS=6
  3   0.000387     10.0.1.3 -> 10.0.1.2     TCP 50678 > http-alt [ACK] Seq=1 Ack=1 Win=5888 Len=0 TSV=6711312 TSER=6765058
155539  12.833078     10.0.1.3 -> 10.0.1.2     TCP 50678 > http-alt [FIN, ACK] Seq=327 Ack=150146645 Win=2580480 Len=0 TSV=6714520 TSER=6768205
155540  12.833454     10.0.1.2 -> 10.0.1.3     TCP http-alt > 50678 [FIN, ACK] Seq=150146645 Ack=328 Win=15552 Len=0 TSV=6768267 TSER=6714520
================================================================================
IPv4 Conversations
Filter:<No Filter>
                                               |       <-      | |       ->      | |     Total     |
                                               | Frames  Bytes | | Frames  Bytes | | Frames  Bytes |
10.0.1.3             <-> 10.0.1.2              103708 156991380   51833   3421312  155541 160412692
================================================================================
  1   0.000000     10.0.1.3 -> 10.0.1.2     TCP 50680 > http-alt [SYN] Seq=0 Win=5840 Len=0 MSS=1460 TSV=6717371 TSER=0 WS=6
  2   0.000303     10.0.1.2 -> 10.0.1.3     TCP http-alt > 50680 [SYN, ACK] Seq=0 Ack=1 Win=14480 Len=0 MSS=1460 TSV=6771118 TSER=6717371 WS=6
  3   0.000325     10.0.1.3 -> 10.0.1.2     TCP 50680 > http-alt [ACK] Seq=1 Ack=1 Win=5888 Len=0 TSV=6717371 TSER=6771118
155620  12.828160     10.0.1.3 -> 10.0.1.2     TCP 50680 > http-alt [FIN, ACK] Seq=327 Ack=150146645 Win=2580480 Len=0 TSV=6720578 TSER=6774266
155621  12.828529     10.0.1.2 -> 10.0.1.3     TCP http-alt > 50680 [FIN, ACK] Seq=150146645 Ack=328 Win=15552 Len=0 TSV=6774325 TSER=6720578
================================================================================
IPv4 Conversations
Filter:<No Filter>
                                               |       <-      | |       ->      | |     Total     |
                                               | Frames  Bytes | | Frames  Bytes | | Frames  Bytes |
10.0.1.3             <-> 10.0.1.2              103702 156990984   51920   3427054  155622 160418038
================================================================================
  1   0.000000     10.0.1.3 -> 10.0.1.2     TCP 50682 > http-alt [SYN] Seq=0 Win=5840 Len=0 MSS=1460 TSV=6723459 TSER=0 WS=6
  2   0.000270     10.0.1.2 -> 10.0.1.3     TCP http-alt > 50682 [SYN, ACK] Seq=0 Ack=1 Win=14480 Len=0 MSS=1460 TSV=6777206 TSER=6723459 WS=6
  3   0.000293     10.0.1.3 -> 10.0.1.2     TCP 50682 > http-alt [ACK] Seq=1 Ack=1 Win=5888 Len=0 TSV=6723459 TSER=6777206
155554  12.833086     10.0.1.3 -> 10.0.1.2     TCP 50682 > http-alt [FIN, ACK] Seq=327 Ack=150146645 Win=2580480 Len=0 TSV=6726667 TSER=6780355
155555  12.833462     10.0.1.2 -> 10.0.1.3     TCP http-alt > 50682 [FIN, ACK] Seq=150146645 Ack=328 Win=15552 Len=0 TSV=6780415 TSER=6726667
================================================================================
IPv4 Conversations
Filter:<No Filter>
                                               |       <-      | |       ->      | |     Total     |
                                               | Frames  Bytes | | Frames  Bytes | | Frames  Bytes |
10.0.1.3             <-> 10.0.1.2              103700 156990852   51856   3422830  155556 160413682
================================================================================
  1   0.000000     10.0.1.3 -> 10.0.1.2     TCP 50684 > http-alt [SYN] Seq=0 Win=5840 Len=0 MSS=1460 TSV=6729545 TSER=0 WS=6
  2   0.000286     10.0.1.2 -> 10.0.1.3     TCP http-alt > 50684 [SYN, ACK] Seq=0 Ack=1 Win=14480 Len=0 MSS=1460 TSV=6783293 TSER=6729545 WS=6
  3   0.000307     10.0.1.3 -> 10.0.1.2     TCP 50684 > http-alt [ACK] Seq=1 Ack=1 Win=5888 Len=0 TSV=6729545 TSER=6783293
155873  12.827390     10.0.1.3 -> 10.0.1.2     TCP 50684 > http-alt [FIN, ACK] Seq=327 Ack=150146645 Win=2554304 Len=0 TSV=6732752 TSER=6786440
155874  12.827764     10.0.1.2 -> 10.0.1.3     TCP http-alt > 50684 [FIN, ACK] Seq=150146645 Ack=328 Win=15552 Len=0 TSV=6786500 TSER=6732752
================================================================================
IPv4 Conversations
Filter:<No Filter>
                                               |       <-      | |       ->      | |     Total     |
                                               | Frames  Bytes | | Frames  Bytes | | Frames  Bytes |
10.0.1.3             <-> 10.0.1.2              103738 156993360   52137   3441376  155875 160434736
================================================================================
  1   0.000000     10.0.1.3 -> 10.0.1.2     TCP 50686 > http-alt [SYN] Seq=0 Win=5840 Len=0 MSS=1460 TSV=6735616 TSER=0 WS=6
  2   0.000279     10.0.1.2 -> 10.0.1.3     TCP http-alt > 50686 [SYN, ACK] Seq=0 Ack=1 Win=14480 Len=0 MSS=1460 TSV=6789364 TSER=6735616 WS=6
  3   0.000300     10.0.1.3 -> 10.0.1.2     TCP 50686 > http-alt [ACK] Seq=1 Ack=1 Win=5888 Len=0 TSV=6735616 TSER=6789364
155705  12.830498     10.0.1.3 -> 10.0.1.2     TCP 50686 > http-alt [FIN, ACK] Seq=327 Ack=150146645 Win=2580480 Len=0 TSV=6738824 TSER=6792511
155706  12.830873     10.0.1.2 -> 10.0.1.3     TCP http-alt > 50686 [FIN, ACK] Seq=150146645 Ack=328 Win=15552 Len=0 TSV=6792572 TSER=6738824
================================================================================
IPv4 Conversations
Filter:<No Filter>
                                               |       <-      | |       ->      | |     Total     |
                                               | Frames  Bytes | | Frames  Bytes | | Frames  Bytes |
10.0.1.3             <-> 10.0.1.2              103752 156994284   51955   3429364  155707 160423648
================================================================================
  1   0.000000     10.0.1.3 -> 10.0.1.2     TCP 50688 > http-alt [SYN] Seq=0 Win=5840 Len=0 MSS=1460 TSV=6741690 TSER=0 WS=6
  2   0.000365     10.0.1.2 -> 10.0.1.3     TCP http-alt > 50688 [SYN, ACK] Seq=0 Ack=1 Win=14480 Len=0 MSS=1460 TSV=6795438 TSER=6741690 WS=6
  3   0.000388     10.0.1.3 -> 10.0.1.2     TCP 50688 > http-alt [ACK] Seq=1 Ack=1 Win=5888 Len=0 TSV=6741690 TSER=6795438
155578  12.825974     10.0.1.3 -> 10.0.1.2     TCP 50688 > http-alt [FIN, ACK] Seq=327 Ack=150146645 Win=2580480 Len=0 TSV=6744896 TSER=6798586
155579  12.826327     10.0.1.2 -> 10.0.1.3     TCP http-alt > 50688 [FIN, ACK] Seq=150146645 Ack=328 Win=15552 Len=0 TSV=6798645 TSER=6744896
================================================================================
IPv4 Conversations
Filter:<No Filter>
                                               |       <-      | |       ->      | |     Total     |
                                               | Frames  Bytes | | Frames  Bytes | | Frames  Bytes |
10.0.1.3             <-> 10.0.1.2              103705 156991182   51875   3424084  155580 160415266
================================================================================
  1   0.000000     10.0.1.3 -> 10.0.1.2     TCP 50690 > http-alt [SYN] Seq=0 Win=5840 Len=0 MSS=1460 TSV=6747748 TSER=0 WS=6
  2   0.000294     10.0.1.2 -> 10.0.1.3     TCP http-alt > 50690 [SYN, ACK] Seq=0 Ack=1 Win=14480 Len=0 MSS=1460 TSV=6801497 TSER=6747748 WS=6
  3   0.000317     10.0.1.3 -> 10.0.1.2     TCP 50690 > http-alt [ACK] Seq=1 Ack=1 Win=5888 Len=0 TSV=6747748 TSER=6801497
155693  12.822439     10.0.1.3 -> 10.0.1.2     TCP 50690 > http-alt [FIN, ACK] Seq=327 Ack=150146645 Win=2580480 Len=0 TSV=6750953 TSER=6804643
155694  12.822824     10.0.1.2 -> 10.0.1.3     TCP http-alt > 50690 [FIN, ACK] Seq=150146645 Ack=328 Win=15552 Len=0 TSV=6804703 TSER=6750953
================================================================================
IPv4 Conversations
Filter:<No Filter>
                                               |       <-      | |       ->      | |     Total     |
                                               | Frames  Bytes | | Frames  Bytes | | Frames  Bytes |
10.0.1.3             <-> 10.0.1.2              103719 156992106   51976   3430750  155695 160422856
================================================================================
  1   0.000000     10.0.1.3 -> 10.0.1.2     TCP 47674 > http-alt [SYN] Seq=0 Win=5840 Len=0 MSS=1460 TSV=6753816 TSER=0 WS=6
  2   0.000314     10.0.1.2 -> 10.0.1.3     TCP http-alt > 47674 [SYN, ACK] Seq=0 Ack=1 Win=14480 Len=0 MSS=1460 TSV=6807565 TSER=6753816 WS=6
  3   0.000336     10.0.1.3 -> 10.0.1.2     TCP 47674 > http-alt [ACK] Seq=1 Ack=1 Win=5888 Len=0 TSV=6753816 TSER=6807565
155493  12.826354     10.0.1.3 -> 10.0.1.2     TCP 47674 > http-alt [FIN, ACK] Seq=327 Ack=150146645 Win=2580480 Len=0 TSV=6757022 TSER=6810712
155494  12.826731     10.0.1.2 -> 10.0.1.3     TCP http-alt > 47674 [FIN, ACK] Seq=150146645 Ack=328 Win=15552 Len=0 TSV=6810772 TSER=6757022
================================================================================
IPv4 Conversations
Filter:<No Filter>
                                               |       <-      | |       ->      | |     Total     |
                                               | Frames  Bytes | | Frames  Bytes | | Frames  Bytes |
10.0.1.3             <-> 10.0.1.2              103700 156990852   51795   3418804  155495 160409656
================================================================================
  1   0.000000     10.0.1.3 -> 10.0.1.2     TCP 47676 > http-alt [SYN] Seq=0 Win=5840 Len=0 MSS=1460 TSV=6759881 TSER=0 WS=6
  2   0.000314     10.0.1.2 -> 10.0.1.3     TCP http-alt > 47676 [SYN, ACK] Seq=0 Ack=1 Win=14480 Len=0 MSS=1460 TSV=6813632 TSER=6759881 WS=6
  3   0.000336     10.0.1.3 -> 10.0.1.2     TCP 47676 > http-alt [ACK] Seq=1 Ack=1 Win=5888 Len=0 TSV=6759882 TSER=6813632
155709  12.825752     10.0.1.3 -> 10.0.1.2     TCP 47676 > http-alt [FIN, ACK] Seq=327 Ack=150146645 Win=2580480 Len=0 TSV=6763088 TSER=6816779
155710  12.826127     10.0.1.2 -> 10.0.1.3     TCP http-alt > 47676 [FIN, ACK] Seq=150146645 Ack=328 Win=15552 Len=0 TSV=6816838 TSER=6763088
================================================================================
IPv4 Conversations
Filter:<No Filter>
                                               |       <-      | |       ->      | |     Total     |
                                               | Frames  Bytes | | Frames  Bytes | | Frames  Bytes |
10.0.1.3             <-> 10.0.1.2              103704 156991116   52007   3432796  155711 160423912
================================================================================
  1   0.000000     10.0.1.3 -> 10.0.1.2     TCP 47678 > http-alt [SYN] Seq=0 Win=5840 Len=0 MSS=1460 TSV=6765951 TSER=0 WS=6
  2   0.000267     10.0.1.2 -> 10.0.1.3     TCP http-alt > 47678 [SYN, ACK] Seq=0 Ack=1 Win=14480 Len=0 MSS=1460 TSV=6819701 TSER=6765951 WS=6
  3   0.000292     10.0.1.3 -> 10.0.1.2     TCP 47678 > http-alt [ACK] Seq=1 Ack=1 Win=5888 Len=0 TSV=6765951 TSER=6819701
155667  12.833245     10.0.1.3 -> 10.0.1.2     TCP 47678 > http-alt [FIN, ACK] Seq=327 Ack=150146645 Win=2580480 Len=0 TSV=6769159 TSER=6822849
155668  12.833594     10.0.1.2 -> 10.0.1.3     TCP http-alt > 47678 [FIN, ACK] Seq=150146645 Ack=328 Win=15552 Len=0 TSV=6822910 TSER=6769159
================================================================================
IPv4 Conversations
Filter:<No Filter>
                                               |       <-      | |       ->      | |     Total     |
                                               | Frames  Bytes | | Frames  Bytes | | Frames  Bytes |
10.0.1.3             <-> 10.0.1.2              103730 156992832   51939   3428308  155669 160421140
================================================================================
  1   0.000000     10.0.1.3 -> 10.0.1.2     TCP 47680 > http-alt [SYN] Seq=0 Win=5840 Len=0 MSS=1460 TSV=6772021 TSER=0 WS=6
  2   0.000318     10.0.1.2 -> 10.0.1.3     TCP http-alt > 47680 [SYN, ACK] Seq=0 Ack=1 Win=14480 Len=0 MSS=1460 TSV=6825772 TSER=6772021 WS=6
  3   0.000341     10.0.1.3 -> 10.0.1.2     TCP 47680 > http-alt [ACK] Seq=1 Ack=1 Win=5888 Len=0 TSV=6772021 TSER=6825772
155654  12.840278     10.0.1.3 -> 10.0.1.2     TCP 47680 > http-alt [FIN, ACK] Seq=327 Ack=150146645 Win=2580480 Len=0 TSV=6775231 TSER=6828922
155655  12.840638     10.0.1.2 -> 10.0.1.3     TCP http-alt > 47680 [FIN, ACK] Seq=150146645 Ack=328 Win=15552 Len=0 TSV=6828983 TSER=6775231
================================================================================
IPv4 Conversations
Filter:<No Filter>
                                               |       <-      | |       ->      | |     Total     |
                                               | Frames  Bytes | | Frames  Bytes | | Frames  Bytes |
10.0.1.3             <-> 10.0.1.2              103705 156991182   51951   3429100  155656 160420282
================================================================================
  1   0.000000     10.0.1.3 -> 10.0.1.2     TCP 47684 > http-alt [SYN] Seq=0 Win=5840 Len=0 MSS=1460 TSV=6778100 TSER=0 WS=6
  2   0.000298     10.0.1.2 -> 10.0.1.3     TCP http-alt > 47684 [SYN, ACK] Seq=0 Ack=1 Win=14480 Len=0 MSS=1460 TSV=6831852 TSER=6778100 WS=6
  3   0.000322     10.0.1.3 -> 10.0.1.2     TCP 47684 > http-alt [ACK] Seq=1 Ack=1 Win=5888 Len=0 TSV=6778100 TSER=6831852
155595  12.828676     10.0.1.3 -> 10.0.1.2     TCP 47684 > http-alt [FIN, ACK] Seq=327 Ack=150146645 Win=2580480 Len=0 TSV=6781307 TSER=6834999
155596  12.829055     10.0.1.2 -> 10.0.1.3     TCP http-alt > 47684 [FIN, ACK] Seq=150146645 Ack=328 Win=15552 Len=0 TSV=6835059 TSER=6781307
================================================================================
IPv4 Conversations
Filter:<No Filter>
                                               |       <-      | |       ->      | |     Total     |
                                               | Frames  Bytes | | Frames  Bytes | | Frames  Bytes |
10.0.1.3             <-> 10.0.1.2              103713 156991710   51884   3424678  155597 160416388
================================================================================
  1   0.000000     10.0.1.3 -> 10.0.1.2     TCP 47686 > http-alt [SYN] Seq=0 Win=5840 Len=0 MSS=1460 TSV=6784169 TSER=0 WS=6
  2   0.000316     10.0.1.2 -> 10.0.1.3     TCP http-alt > 47686 [SYN, ACK] Seq=0 Ack=1 Win=14480 Len=0 MSS=1460 TSV=6837921 TSER=6784169 WS=6
  3   0.000342     10.0.1.3 -> 10.0.1.2     TCP 47686 > http-alt [ACK] Seq=1 Ack=1 Win=5888 Len=0 TSV=6784169 TSER=6837921
155543  12.825211     10.0.1.3 -> 10.0.1.2     TCP 47686 > http-alt [FIN, ACK] Seq=327 Ack=150146645 Win=2580480 Len=0 TSV=6787375 TSER=6841067
155544  12.825591     10.0.1.2 -> 10.0.1.3     TCP http-alt > 47686 [FIN, ACK] Seq=150146645 Ack=328 Win=15552 Len=0 TSV=6841128 TSER=6787375
================================================================================
IPv4 Conversations
Filter:<No Filter>
                                               |       <-      | |       ->      | |     Total     |
                                               | Frames  Bytes | | Frames  Bytes | | Frames  Bytes |
10.0.1.3             <-> 10.0.1.2              103701 156990918   51844   3422038  155545 160412956
================================================================================
