  1   0.000000     10.0.1.3 -> 10.0.1.2     TCP 49972 > http-alt [SYN] Seq=0 Win=5840 Len=0 MSS=1460 TSV=1094588 TSER=0 WS=6
  2   0.000316     10.0.1.2 -> 10.0.1.3     TCP http-alt > 49972 [SYN, ACK] Seq=0 Ack=1 Win=14480 Len=0 MSS=1460 TSV=1126568 TSER=1094588 WS=6
  3   0.000338     10.0.1.3 -> 10.0.1.2     TCP 49972 > http-alt [ACK] Seq=1 Ack=1 Win=5888 Len=0 TSV=1094588 TSER=1126568
236408  21.345666     10.0.1.3 -> 10.0.1.2     TCP 49972 > http-alt [FIN, ACK] Seq=327 Ack=250244301 Win=2580480 Len=0 TSV=1099925 TSER=1131845
236409  21.345992     10.0.1.2 -> 10.0.1.3     TCP http-alt > 49972 [FIN, ACK] Seq=250244301 Ack=328 Win=15552 Len=0 TSV=1131905 TSER=1099925
  1   0.000000     10.0.1.3 -> 10.0.1.2     TCP 49974 > http-alt [SYN] Seq=0 Win=5840 Len=0 MSS=1460 TSV=1104815 TSER=0 WS=6
  2   0.000302     10.0.1.2 -> 10.0.1.3     TCP http-alt > 49974 [SYN, ACK] Seq=0 Ack=1 Win=14480 Len=0 MSS=1460 TSV=1136796 TSER=1104815 WS=6
  3   0.000323     10.0.1.3 -> 10.0.1.2     TCP 49974 > http-alt [ACK] Seq=1 Ack=1 Win=5888 Len=0 TSV=1104815 TSER=1136796
240585  21.347337     10.0.1.3 -> 10.0.1.2     TCP 49974 > http-alt [FIN, ACK] Seq=327 Ack=250244301 Win=2580480 Len=0 TSV=1110152 TSER=1142074
240586  21.347686     10.0.1.2 -> 10.0.1.3     TCP http-alt > 49974 [FIN, ACK] Seq=250244301 Ack=328 Win=15552 Len=0 TSV=1142133 TSER=1110152
  1   0.000000     10.0.1.3 -> 10.0.1.2     TCP 49976 > http-alt [SYN] Seq=0 Win=5840 Len=0 MSS=1460 TSV=1115309 TSER=0 WS=6
  2   0.000304     10.0.1.2 -> 10.0.1.3     TCP http-alt > 49976 [SYN, ACK] Seq=0 Ack=1 Win=14480 Len=0 MSS=1460 TSV=1147290 TSER=1115309 WS=6
  3   0.000327     10.0.1.3 -> 10.0.1.2     TCP 49976 > http-alt [ACK] Seq=1 Ack=1 Win=5888 Len=0 TSV=1115309 TSER=1147290
234096  21.347493     10.0.1.3 -> 10.0.1.2     TCP 49976 > http-alt [FIN, ACK] Seq=327 Ack=250244301 Win=2580480 Len=0 TSV=1120646 TSER=1152567
234097  21.347819     10.0.1.2 -> 10.0.1.3     TCP http-alt > 49976 [FIN, ACK] Seq=250244301 Ack=328 Win=15552 Len=0 TSV=1152628 TSER=1120646
  1   0.000000     10.0.1.3 -> 10.0.1.2     TCP 50088 > http-alt [SYN] Seq=0 Win=5840 Len=0 MSS=1460 TSV=1125669 TSER=0 WS=6
  2   0.000318     10.0.1.2 -> 10.0.1.3     TCP http-alt > 50088 [SYN, ACK] Seq=0 Ack=1 Win=14480 Len=0 MSS=1460 TSV=1157651 TSER=1125669 WS=6
  3   0.000339     10.0.1.3 -> 10.0.1.2     TCP 50088 > http-alt [ACK] Seq=1 Ack=1 Win=5888 Len=0 TSV=1125669 TSER=1157651
256872  21.344106     10.0.1.3 -> 10.0.1.2     TCP 50088 > http-alt [FIN, ACK] Seq=327 Ack=250244301 Win=2580480 Len=0 TSV=1131005 TSER=1162928
256873  21.344576     10.0.1.2 -> 10.0.1.3     TCP http-alt > 50088 [FIN, ACK] Seq=250244301 Ack=328 Win=15552 Len=0 TSV=1162988 TSER=1131005
  1   0.000000     10.0.1.3 -> 10.0.1.2     TCP 50090 > http-alt [SYN] Seq=0 Win=5840 Len=0 MSS=1460 TSV=1137056 TSER=0 WS=6
  2   0.000363     10.0.1.2 -> 10.0.1.3     TCP http-alt > 50090 [SYN, ACK] Seq=0 Ack=1 Win=14480 Len=0 MSS=1460 TSV=1169039 TSER=1137056 WS=6
  3   0.000384     10.0.1.3 -> 10.0.1.2     TCP 50090 > http-alt [ACK] Seq=1 Ack=1 Win=5888 Len=0 TSV=1137056 TSER=1169039
225570  21.348114     10.0.1.3 -> 10.0.1.2     TCP 50090 > http-alt [FIN, ACK] Seq=327 Ack=250244301 Win=2580480 Len=0 TSV=1142393 TSER=1174316
225571  21.348519     10.0.1.2 -> 10.0.1.3     TCP http-alt > 50090 [FIN, ACK] Seq=250244301 Ack=328 Win=15552 Len=0 TSV=1174376 TSER=1142393
  1   0.000000     10.0.1.3 -> 10.0.1.2     TCP 50092 > http-alt [SYN] Seq=0 Win=5840 Len=0 MSS=1460 TSV=1147175 TSER=0 WS=6
  2   0.000300     10.0.1.2 -> 10.0.1.3     TCP http-alt > 50092 [SYN, ACK] Seq=0 Ack=1 Win=14480 Len=0 MSS=1460 TSV=1179159 TSER=1147175 WS=6
  3   0.000324     10.0.1.3 -> 10.0.1.2     TCP 50092 > http-alt [ACK] Seq=1 Ack=1 Win=5888 Len=0 TSV=1147175 TSER=1179159
253497  21.347507     10.0.1.3 -> 10.0.1.2     TCP 50092 > http-alt [FIN, ACK] Seq=327 Ack=250244301 Win=2580480 Len=0 TSV=1152512 TSER=1184437
253498  21.347857     10.0.1.2 -> 10.0.1.3     TCP http-alt > 50092 [FIN, ACK] Seq=250244301 Ack=328 Win=15552 Len=0 TSV=1184496 TSER=1152512
  1   0.000000     10.0.1.3 -> 10.0.1.2     TCP 50094 > http-alt [SYN] Seq=0 Win=5840 Len=0 MSS=1460 TSV=1157591 TSER=0 WS=6
  2   0.000364     10.0.1.2 -> 10.0.1.3     TCP http-alt > 50094 [SYN, ACK] Seq=0 Ack=1 Win=14480 Len=0 MSS=1460 TSV=1189576 TSER=1157591 WS=6
  3   0.000388     10.0.1.3 -> 10.0.1.2     TCP 50094 > http-alt [ACK] Seq=1 Ack=1 Win=5888 Len=0 TSV=1157591 TSER=1189576
255080  21.356461     10.0.1.3 -> 10.0.1.2     TCP 50094 > http-alt [FIN, ACK] Seq=327 Ack=250244301 Win=2580480 Len=0 TSV=1162930 TSER=1194854
255081  21.356777     10.0.1.2 -> 10.0.1.3     TCP http-alt > 50094 [FIN, ACK] Seq=250244301 Ack=328 Win=15552 Len=0 TSV=1194915 TSER=1162930
  1   0.000000     10.0.1.3 -> 10.0.1.2     TCP 50096 > http-alt [SYN] Seq=0 Win=5840 Len=0 MSS=1460 TSV=1168218 TSER=0 WS=6
  2   0.000300     10.0.1.2 -> 10.0.1.3     TCP http-alt > 50096 [SYN, ACK] Seq=0 Ack=1 Win=14480 Len=0 MSS=1460 TSV=1200203 TSER=1168218 WS=6
  3   0.000322     10.0.1.3 -> 10.0.1.2     TCP 50096 > http-alt [ACK] Seq=1 Ack=1 Win=5888 Len=0 TSV=1168218 TSER=1200203
249323  21.347425     10.0.1.3 -> 10.0.1.2     TCP 50096 > http-alt [FIN, ACK] Seq=327 Ack=250244301 Win=2580480 Len=0 TSV=1173555 TSER=1205480
249324  21.347773     10.0.1.2 -> 10.0.1.3     TCP http-alt > 50096 [FIN, ACK] Seq=250244301 Ack=328 Win=15552 Len=0 TSV=1205541 TSER=1173555
  1   0.000000     10.0.1.3 -> 10.0.1.2     TCP 50098 > http-alt [SYN] Seq=0 Win=5840 Len=0 MSS=1460 TSV=1178471 TSER=0 WS=6
  2   0.000312     10.0.1.2 -> 10.0.1.3     TCP http-alt > 50098 [SYN, ACK] Seq=0 Ack=1 Win=14480 Len=0 MSS=1460 TSV=1210458 TSER=1178471 WS=6
  3   0.000334     10.0.1.3 -> 10.0.1.2     TCP 50098 > http-alt [ACK] Seq=1 Ack=1 Win=5888 Len=0 TSV=1178471 TSER=1210458
250379  21.347349     10.0.1.3 -> 10.0.1.2     TCP 50098 > http-alt [FIN, ACK] Seq=327 Ack=250244301 Win=2580480 Len=0 TSV=1183808 TSER=1215736
250380  21.347711     10.0.1.2 -> 10.0.1.3     TCP http-alt > 50098 [FIN, ACK] Seq=250244301 Ack=328 Win=15552 Len=0 TSV=1215795 TSER=1183808
  1   0.000000     10.0.1.3 -> 10.0.1.2     TCP 50100 > http-alt [SYN] Seq=0 Win=5840 Len=0 MSS=1460 TSV=1189118 TSER=0 WS=6
  2   0.000315     10.0.1.2 -> 10.0.1.3     TCP http-alt > 50100 [SYN, ACK] Seq=0 Ack=1 Win=14480 Len=0 MSS=1460 TSV=1221105 TSER=1189118 WS=6
  3   0.000339     10.0.1.3 -> 10.0.1.2     TCP 50100 > http-alt [ACK] Seq=1 Ack=1 Win=5888 Len=0 TSV=1189118 TSER=1221105
  1   0.000000     10.0.1.3 -> 10.0.1.2     TCP 43686 > http-alt [SYN] Seq=0 Win=5840 Len=0 MSS=1460 TSV=1203237 TSER=0 WS=6
  2   0.000303     10.0.1.2 -> 10.0.1.3     TCP http-alt > 43686 [SYN, ACK] Seq=0 Ack=1 Win=14480 Len=0 MSS=1460 TSV=1235225 TSER=1203237 WS=6
  3   0.000329     10.0.1.3 -> 10.0.1.2     TCP 43686 > http-alt [ACK] Seq=1 Ack=1 Win=5888 Len=0 TSV=1203237 TSER=1235225
247848  21.352869     10.0.1.3 -> 10.0.1.2     TCP 43686 > http-alt [FIN, ACK] Seq=327 Ack=250244301 Win=2580480 Len=0 TSV=1208576 TSER=1240504
247849  21.353202     10.0.1.2 -> 10.0.1.3     TCP http-alt > 43686 [FIN, ACK] Seq=250244301 Ack=328 Win=15552 Len=0 TSV=1240564 TSER=1208576
  1   0.000000     10.0.1.3 -> 10.0.1.2     TCP 43688 > http-alt [SYN] Seq=0 Win=5840 Len=0 MSS=1460 TSV=1213319 TSER=0 WS=6
  2   0.000295     10.0.1.2 -> 10.0.1.3     TCP http-alt > 43688 [SYN, ACK] Seq=0 Ack=1 Win=14480 Len=0 MSS=1460 TSV=1245308 TSER=1213319 WS=6
  3   0.000318     10.0.1.3 -> 10.0.1.2     TCP 43688 > http-alt [ACK] Seq=1 Ack=1 Win=5888 Len=0 TSV=1213319 TSER=1245308
244389  21.347850     10.0.1.3 -> 10.0.1.2     TCP 43688 > http-alt [FIN, ACK] Seq=327 Ack=250244301 Win=2580480 Len=0 TSV=1218656 TSER=1250586
244390  21.348205     10.0.1.2 -> 10.0.1.3     TCP http-alt > 43688 [FIN, ACK] Seq=250244301 Ack=328 Win=15552 Len=0 TSV=1250645 TSER=1218656
  1   0.000000     10.0.1.3 -> 10.0.1.2     TCP 43690 > http-alt [SYN] Seq=0 Win=5840 Len=0 MSS=1460 TSV=1223635 TSER=0 WS=6
  2   0.000285     10.0.1.2 -> 10.0.1.3     TCP http-alt > 43690 [SYN, ACK] Seq=0 Ack=1 Win=14480 Len=0 MSS=1460 TSV=1255625 TSER=1223635 WS=6
  3   0.000306     10.0.1.3 -> 10.0.1.2     TCP 43690 > http-alt [ACK] Seq=1 Ack=1 Win=5888 Len=0 TSV=1223635 TSER=1255625
  1   0.000000     10.0.1.3 -> 10.0.1.2     TCP 43692 > http-alt [SYN] Seq=0 Win=5840 Len=0 MSS=1460 TSV=1234319 TSER=0 WS=6
  2   0.000317     10.0.1.2 -> 10.0.1.3     TCP http-alt > 43692 [SYN, ACK] Seq=0 Ack=1 Win=14480 Len=0 MSS=1460 TSV=1266309 TSER=1234319 WS=6
  3   0.000347     10.0.1.3 -> 10.0.1.2     TCP 43692 > http-alt [ACK] Seq=1 Ack=1 Win=5888 Len=0 TSV=1234319 TSER=1266309
254963  21.348335     10.0.1.3 -> 10.0.1.2     TCP 43692 > http-alt [FIN, ACK] Seq=327 Ack=250244301 Win=2580480 Len=0 TSV=1239656 TSER=1271587
254964  21.348679     10.0.1.2 -> 10.0.1.3     TCP http-alt > 43692 [FIN, ACK] Seq=250244301 Ack=328 Win=15552 Len=0 TSV=1271647 TSER=1239656
  1   0.000000     10.0.1.3 -> 10.0.1.2     TCP 43694 > http-alt [SYN] Seq=0 Win=5840 Len=0 MSS=1460 TSV=1244778 TSER=0 WS=6
  2   0.000333     10.0.1.2 -> 10.0.1.3     TCP http-alt > 43694 [SYN, ACK] Seq=0 Ack=1 Win=14480 Len=0 MSS=1460 TSV=1276769 TSER=1244778 WS=6
  3   0.000353     10.0.1.3 -> 10.0.1.2     TCP 43694 > http-alt [ACK] Seq=1 Ack=1 Win=5888 Len=0 TSV=1244778 TSER=1276769
258302  21.352830     10.0.1.3 -> 10.0.1.2     TCP 43694 > http-alt [FIN, ACK] Seq=327 Ack=250244301 Win=2580480 Len=0 TSV=1250116 TSER=1282047
258303  21.353177     10.0.1.2 -> 10.0.1.3     TCP http-alt > 43694 [FIN, ACK] Seq=250244301 Ack=328 Win=15552 Len=0 TSV=1282108 TSER=1250116
  1   0.000000     10.0.1.3 -> 10.0.1.2     TCP 43696 > http-alt [SYN] Seq=0 Win=5840 Len=0 MSS=1460 TSV=1255181 TSER=0 WS=6
  2   0.000384     10.0.1.2 -> 10.0.1.3     TCP http-alt > 43696 [SYN, ACK] Seq=0 Ack=1 Win=14480 Len=0 MSS=1460 TSV=1287174 TSER=1255181 WS=6
  3   0.000408     10.0.1.3 -> 10.0.1.2     TCP 43696 > http-alt [ACK] Seq=1 Ack=1 Win=5888 Len=0 TSV=1255181 TSER=1287174
  1   0.000000     10.0.1.3 -> 10.0.1.2     TCP 43698 > http-alt [SYN] Seq=0 Win=5840 Len=0 MSS=1460 TSV=1265342 TSER=0 WS=6
  2   0.000302     10.0.1.2 -> 10.0.1.3     TCP http-alt > 43698 [SYN, ACK] Seq=0 Ack=1 Win=14480 Len=0 MSS=1460 TSV=1297335 TSER=1265342 WS=6
  3   0.000326     10.0.1.3 -> 10.0.1.2     TCP 43698 > http-alt [ACK] Seq=1 Ack=1 Win=5888 Len=0 TSV=1265342 TSER=1297335
251155  21.348224     10.0.1.3 -> 10.0.1.2     TCP 43698 > http-alt [FIN, ACK] Seq=327 Ack=250244301 Win=2580480 Len=0 TSV=1270679 TSER=1302613
251156  21.348598     10.0.1.2 -> 10.0.1.3     TCP http-alt > 43698 [FIN, ACK] Seq=250244301 Ack=328 Win=15552 Len=0 TSV=1302672 TSER=1270679
  1   0.000000     10.0.1.3 -> 10.0.1.2     TCP 37538 > http-alt [SYN] Seq=0 Win=5840 Len=0 MSS=1460 TSV=1275672 TSER=0 WS=6
  2   0.000307     10.0.1.2 -> 10.0.1.3     TCP http-alt > 37538 [SYN, ACK] Seq=0 Ack=1 Win=14480 Len=0 MSS=1460 TSV=1307665 TSER=1275672 WS=6
  3   0.000328     10.0.1.3 -> 10.0.1.2     TCP 37538 > http-alt [ACK] Seq=1 Ack=1 Win=5888 Len=0 TSV=1275672 TSER=1307665
235724  21.344699     10.0.1.3 -> 10.0.1.2     TCP 37538 > http-alt [FIN, ACK] Seq=327 Ack=250244301 Win=2580480 Len=0 TSV=1281008 TSER=1312943
235725  21.345072     10.0.1.2 -> 10.0.1.3     TCP http-alt > 37538 [FIN, ACK] Seq=250244301 Ack=328 Win=15552 Len=0 TSV=1313002 TSER=1281008
  1   0.000000     10.0.1.3 -> 10.0.1.2     TCP 37540 > http-alt [SYN] Seq=0 Win=5840 Len=0 MSS=1460 TSV=1285948 TSER=0 WS=6
  2   0.000272     10.0.1.2 -> 10.0.1.3     TCP http-alt > 37540 [SYN, ACK] Seq=0 Ack=1 Win=14480 Len=0 MSS=1460 TSV=1317943 TSER=1285948 WS=6
  3   0.000293     10.0.1.3 -> 10.0.1.2     TCP 37540 > http-alt [ACK] Seq=1 Ack=1 Win=5888 Len=0 TSV=1285948 TSER=1317943
231522  21.349172     10.0.1.3 -> 10.0.1.2     TCP 37540 > http-alt [FIN, ACK] Seq=327 Ack=250244301 Win=2580480 Len=0 TSV=1291285 TSER=1323220
231523  21.349526     10.0.1.2 -> 10.0.1.3     TCP http-alt > 37540 [FIN, ACK] Seq=250244301 Ack=328 Win=15552 Len=0 TSV=1323280 TSER=1291285
  1   0.000000     10.0.1.3 -> 10.0.1.2     TCP 37542 > http-alt [SYN] Seq=0 Win=5840 Len=0 MSS=1460 TSV=1296600 TSER=0 WS=6
  2   0.000301     10.0.1.2 -> 10.0.1.3     TCP http-alt > 37542 [SYN, ACK] Seq=0 Ack=1 Win=14480 Len=0 MSS=1460 TSV=1328595 TSER=1296600 WS=6
  3   0.000323     10.0.1.3 -> 10.0.1.2     TCP 37542 > http-alt [ACK] Seq=1 Ack=1 Win=5888 Len=0 TSV=1296600 TSER=1328595
251061  21.351097     10.0.1.3 -> 10.0.1.2     TCP 37542 > http-alt [FIN, ACK] Seq=327 Ack=250244301 Win=2580480 Len=0 TSV=1301938 TSER=1333873
251062  21.351463     10.0.1.2 -> 10.0.1.3     TCP http-alt > 37542 [FIN, ACK] Seq=250244301 Ack=328 Win=15552 Len=0 TSV=1333934 TSER=1301938
