  1   0.000000     10.0.1.3 -> 10.0.1.2     TCP 47688 > http-alt [SYN] Seq=0 Win=5840 Len=0 MSS=1460 TSV=6790243 TSER=0 WS=6
  2   0.000374     10.0.1.2 -> 10.0.1.3     TCP http-alt > 47688 [SYN, ACK] Seq=0 Ack=1 Win=14480 Len=0 MSS=1460 TSV=6843995 TSER=6790243 WS=6
  3   0.000396     10.0.1.3 -> 10.0.1.2     TCP 47688 > http-alt [ACK] Seq=1 Ack=1 Win=5888 Len=0 TSV=6790243 TSER=6843995
207500  17.295900     10.0.1.3 -> 10.0.1.2     TCP 47688 > http-alt [FIN, ACK] Seq=327 Ack=200195476 Win=2580480 Len=0 TSV=6794567 TSER=6848260
207501  17.296301     10.0.1.2 -> 10.0.1.3     TCP http-alt > 47688 [FIN, ACK] Seq=200195476 Ack=328 Win=15552 Len=0 TSV=6848319 TSER=6794567
================================================================================
IPv4 Conversations
Filter:<No Filter>
                                               |       <-      | |       ->      | |     Total     |
                                               | Frames  Bytes | | Frames  Bytes | | Frames  Bytes |
10.0.1.3             <-> 10.0.1.2              138356 209326979   69146   4563970  207502 213890949
================================================================================
  1   0.000000     10.0.1.3 -> 10.0.1.2     TCP 47690 > http-alt [SYN] Seq=0 Win=5840 Len=0 MSS=1460 TSV=6797754 TSER=0 WS=6
  2   0.000319     10.0.1.2 -> 10.0.1.3     TCP http-alt > 47690 [SYN, ACK] Seq=0 Ack=1 Win=14480 Len=0 MSS=1460 TSV=6851507 TSER=6797754 WS=6
  3   0.000344     10.0.1.3 -> 10.0.1.2     TCP 47690 > http-alt [ACK] Seq=1 Ack=1 Win=5888 Len=0 TSV=6797754 TSER=6851507
207551  17.084235     10.0.1.3 -> 10.0.1.2     TCP 47690 > http-alt [FIN, ACK] Seq=327 Ack=200195476 Win=2568768 Len=0 TSV=6802025 TSER=6855720
207552  17.084610     10.0.1.2 -> 10.0.1.3     TCP http-alt > 47690 [FIN, ACK] Seq=200195476 Ack=328 Win=15552 Len=0 TSV=6855779 TSER=6802025
================================================================================
IPv4 Conversations
Filter:<No Filter>
                                               |       <-      | |       ->      | |     Total     |
                                               | Frames  Bytes | | Frames  Bytes | | Frames  Bytes |
10.0.1.3             <-> 10.0.1.2              138262 209320775   69291   4573540  207553 213894315
================================================================================
  1   0.000000     10.0.1.3 -> 10.0.1.2     TCP 47692 > http-alt [SYN] Seq=0 Win=5840 Len=0 MSS=1460 TSV=6805214 TSER=0 WS=6
  2   0.000295     10.0.1.2 -> 10.0.1.3     TCP http-alt > 47692 [SYN, ACK] Seq=0 Ack=1 Win=14480 Len=0 MSS=1460 TSV=6858967 TSER=6805214 WS=6
  3   0.000316     10.0.1.3 -> 10.0.1.2     TCP 47692 > http-alt [ACK] Seq=1 Ack=1 Win=5888 Len=0 TSV=6805214 TSER=6858967
207255  17.124101     10.0.1.3 -> 10.0.1.2     TCP 47692 > http-alt [FIN, ACK] Seq=327 Ack=200195476 Win=2580480 Len=0 TSV=6809495 TSER=6863188
207256  17.124479     10.0.1.2 -> 10.0.1.3     TCP http-alt > 47692 [FIN, ACK] Seq=200195476 Ack=328 Win=15552 Len=0 TSV=6863248 TSER=6809495
================================================================================
IPv4 Conversations
Filter:<No Filter>
                                               |       <-      | |       ->      | |     Total     |
                                               | Frames  Bytes | | Frames  Bytes | | Frames  Bytes |
10.0.1.3             <-> 10.0.1.2              138287 209322425   68970   4552354  207257 213874779
================================================================================
  1   0.000000     10.0.1.3 -> 10.0.1.2     TCP 47694 > http-alt [SYN] Seq=0 Win=5840 Len=0 MSS=1460 TSV=6812674 TSER=0 WS=6
  2   0.000291     10.0.1.2 -> 10.0.1.3     TCP http-alt > 47694 [SYN, ACK] Seq=0 Ack=1 Win=14480 Len=0 MSS=1460 TSV=6866427 TSER=6812674 WS=6
  3   0.000315     10.0.1.3 -> 10.0.1.2     TCP 47694 > http-alt [ACK] Seq=1 Ack=1 Win=5888 Len=0 TSV=6812674 TSER=6866427
207301  17.092873     10.0.1.3 -> 10.0.1.2     TCP 47694 > http-alt [FIN, ACK] Seq=327 Ack=200195476 Win=2574592 Len=0 TSV=6816946 TSER=6870640
207302  17.093271     10.0.1.2 -> 10.0.1.3     TCP http-alt > 47694 [FIN, ACK] Seq=200195476 Ack=328 Win=15552 Len=0 TSV=6870701 TSER=6816946
================================================================================
IPv4 Conversations
Filter:<No Filter>
                                               |       <-      | |       ->      | |     Total     |
                                               | Frames  Bytes | | Frames  Bytes | | Frames  Bytes |
10.0.1.3             <-> 10.0.1.2              138268 209321171   69035   4556644  207303 213877815
================================================================================
  1   0.000000     10.0.1.3 -> 10.0.1.2     TCP 47696 > http-alt [SYN] Seq=0 Win=5840 Len=0 MSS=1460 TSV=6820146 TSER=0 WS=6
  2   0.000300     10.0.1.2 -> 10.0.1.3     TCP http-alt > 47696 [SYN, ACK] Seq=0 Ack=1 Win=14480 Len=0 MSS=1460 TSV=6873901 TSER=6820146 WS=6
  3   0.000322     10.0.1.3 -> 10.0.1.2     TCP 47696 > http-alt [ACK] Seq=1 Ack=1 Win=5888 Len=0 TSV=6820146 TSER=6873901
207118  17.084363     10.0.1.3 -> 10.0.1.2     TCP 47696 > http-alt [FIN, ACK] Seq=327 Ack=200195476 Win=2580480 Len=0 TSV=6824417 TSER=6878113
207119  17.084723     10.0.1.2 -> 10.0.1.3     TCP http-alt > 47696 [FIN, ACK] Seq=200195476 Ack=328 Win=15552 Len=0 TSV=6878172 TSER=6824417
================================================================================
IPv4 Conversations
Filter:<No Filter>
                                               |       <-      | |       ->      | |     Total     |
                                               | Frames  Bytes | | Frames  Bytes | | Frames  Bytes |
10.0.1.3             <-> 10.0.1.2              138261 209320709   68859   4545028  207120 213865737
================================================================================
  1   0.000000     10.0.1.3 -> 10.0.1.2     TCP 46658 > http-alt [SYN] Seq=0 Win=5840 Len=0 MSS=1460 TSV=6827618 TSER=0 WS=6
  2   0.000311     10.0.1.2 -> 10.0.1.3     TCP http-alt > 46658 [SYN, ACK] Seq=0 Ack=1 Win=14480 Len=0 MSS=1460 TSV=6881373 TSER=6827618 WS=6
  3   0.000335     10.0.1.3 -> 10.0.1.2     TCP 46658 > http-alt [ACK] Seq=1 Ack=1 Win=5888 Len=0 TSV=6827618 TSER=6881373
207194  17.086705     10.0.1.3 -> 10.0.1.2     TCP 46658 > http-alt [FIN, ACK] Seq=327 Ack=200195476 Win=2580480 Len=0 TSV=6831890 TSER=6885586
207195  17.087066     10.0.1.2 -> 10.0.1.3     TCP http-alt > 46658 [FIN, ACK] Seq=200195476 Ack=328 Win=15552 Len=0 TSV=6885645 TSER=6831890
================================================================================
IPv4 Conversations
Filter:<No Filter>
                                               |       <-      | |       ->      | |     Total     |
                                               | Frames  Bytes | | Frames  Bytes | | Frames  Bytes |
10.0.1.3             <-> 10.0.1.2              138268 209321171   68928   4549582  207196 213870753
================================================================================
  1   0.000000     10.0.1.3 -> 10.0.1.2     TCP 46660 > http-alt [SYN] Seq=0 Win=5840 Len=0 MSS=1460 TSV=6835112 TSER=0 WS=6
  2   0.000294     10.0.1.2 -> 10.0.1.3     TCP http-alt > 46660 [SYN, ACK] Seq=0 Ack=1 Win=14480 Len=0 MSS=1460 TSV=6888867 TSER=6835112 WS=6
  3   0.000316     10.0.1.3 -> 10.0.1.2     TCP 46660 > http-alt [ACK] Seq=1 Ack=1 Win=5888 Len=0 TSV=6835112 TSER=6888867
207361  17.086962     10.0.1.3 -> 10.0.1.2     TCP 46660 > http-alt [FIN, ACK] Seq=327 Ack=200195476 Win=2580480 Len=0 TSV=6839384 TSER=6893079
207362  17.087332     10.0.1.2 -> 10.0.1.3     TCP http-alt > 46660 [FIN, ACK] Seq=200195476 Ack=328 Win=15552 Len=0 TSV=6893140 TSER=6839384
================================================================================
IPv4 Conversations
Filter:<No Filter>
                                               |       <-      | |       ->      | |     Total     |
                                               | Frames  Bytes | | Frames  Bytes | | Frames  Bytes |
10.0.1.3             <-> 10.0.1.2              138265 209320973   69098   4560802  207363 213881775
================================================================================
  1   0.000000     10.0.1.3 -> 10.0.1.2     TCP 46662 > http-alt [SYN] Seq=0 Win=5840 Len=0 MSS=1460 TSV=6842577 TSER=0 WS=6
  2   0.000302     10.0.1.2 -> 10.0.1.3     TCP http-alt > 46662 [SYN, ACK] Seq=0 Ack=1 Win=14480 Len=0 MSS=1460 TSV=6896333 TSER=6842577 WS=6
  3   0.000323     10.0.1.3 -> 10.0.1.2     TCP 46662 > http-alt [ACK] Seq=1 Ack=1 Win=5888 Len=0 TSV=6842577 TSER=6896333
208557  17.237617     10.0.1.3 -> 10.0.1.2     TCP 46662 > http-alt [FIN, ACK] Seq=327 Ack=200195476 Win=2580480 Len=0 TSV=6846886 TSER=6900583
208558  17.237993     10.0.1.2 -> 10.0.1.3     TCP http-alt > 46662 [FIN, ACK] Seq=200195476 Ack=328 Win=15552 Len=0 TSV=6900643 TSER=6846886
================================================================================
IPv4 Conversations
Filter:<No Filter>
                                               |       <-      | |       ->      | |     Total     |
                                               | Frames  Bytes | | Frames  Bytes | | Frames  Bytes |
10.0.1.3             <-> 10.0.1.2              138858 209360111   69701   4600600  208559 213960711
================================================================================
  1   0.000000     10.0.1.3 -> 10.0.1.2     TCP 46666 > http-alt [SYN] Seq=0 Win=5840 Len=0 MSS=1460 TSV=6850088 TSER=0 WS=6
  2   0.000301     10.0.1.2 -> 10.0.1.3     TCP http-alt > 46666 [SYN, ACK] Seq=0 Ack=1 Win=14480 Len=0 MSS=1460 TSV=6903844 TSER=6850088 WS=6
  3   0.000324     10.0.1.3 -> 10.0.1.2     TCP 46666 > http-alt [ACK] Seq=1 Ack=1 Win=5888 Len=0 TSV=6850088 TSER=6903844
207247  17.115011     10.0.1.3 -> 10.0.1.2     TCP 46666 > http-alt [FIN, ACK] Seq=327 Ack=200195476 Win=2580480 Len=0 TSV=6854366 TSER=6908064
207248  17.115385     10.0.1.2 -> 10.0.1.3     TCP http-alt > 46666 [FIN, ACK] Seq=200195476 Ack=328 Win=15552 Len=0 TSV=6908124 TSER=6854366
================================================================================
IPv4 Conversations
Filter:<No Filter>
                                               |       <-      | |       ->      | |     Total     |
                                               | Frames  Bytes | | Frames  Bytes | | Frames  Bytes |
10.0.1.3             <-> 10.0.1.2              138270 209321303   68979   4552948  207249 213874251
================================================================================
  1   0.000000     10.0.1.3 -> 10.0.1.2     TCP 46668 > http-alt [SYN] Seq=0 Win=5840 Len=0 MSS=1460 TSV=6857565 TSER=0 WS=6
  2   0.000280     10.0.1.2 -> 10.0.1.3     TCP http-alt > 46668 [SYN, ACK] Seq=0 Ack=1 Win=14480 Len=0 MSS=1460 TSV=6911322 TSER=6857565 WS=6
  3   0.000302     10.0.1.3 -> 10.0.1.2     TCP 46668 > http-alt [ACK] Seq=1 Ack=1 Win=5888 Len=0 TSV=6857565 TSER=6911322
207365  17.092303     10.0.1.3 -> 10.0.1.2     TCP 46668 > http-alt [FIN, ACK] Seq=327 Ack=200195476 Win=2580480 Len=0 TSV=6861838 TSER=6915534
207366  17.092654     10.0.1.2 -> 10.0.1.3     TCP http-alt > 46668 [FIN, ACK] Seq=200195476 Ack=328 Win=15552 Len=0 TSV=6915596 TSER=6861838
================================================================================
IPv4 Conversations
Filter:<No Filter>
                                               |       <-      | |       ->      | |     Total     |
                                               | Frames  Bytes | | Frames  Bytes | | Frames  Bytes |
10.0.1.3             <-> 10.0.1.2              138267 209321105   69100   4560934  207367 213882039
================================================================================
  1   0.000000     10.0.1.3 -> 10.0.1.2     TCP 46670 > http-alt [SYN] Seq=0 Win=5840 Len=0 MSS=1460 TSV=6865026 TSER=0 WS=6
  2   0.000317     10.0.1.2 -> 10.0.1.3     TCP http-alt > 46670 [SYN, ACK] Seq=0 Ack=1 Win=14480 Len=0 MSS=1460 TSV=6918784 TSER=6865026 WS=6
  3   0.000342     10.0.1.3 -> 10.0.1.2     TCP 46670 > http-alt [ACK] Seq=1 Ack=1 Win=5888 Len=0 TSV=6865026 TSER=6918784
207317  17.093509     10.0.1.3 -> 10.0.1.2     TCP 46670 > http-alt [FIN, ACK] Seq=327 Ack=200195476 Win=2580480 Len=0 TSV=6869299 TSER=6922997
207318  17.093886     10.0.1.2 -> 10.0.1.3     TCP http-alt > 46670 [FIN, ACK] Seq=200195476 Ack=328 Win=15552 Len=0 TSV=6923057 TSER=6869299
================================================================================
IPv4 Conversations
Filter:<No Filter>
                                               |       <-      | |       ->      | |     Total     |
                                               | Frames  Bytes | | Frames  Bytes | | Frames  Bytes |
10.0.1.3             <-> 10.0.1.2              138268 209321171   69051   4557700  207319 213878871
================================================================================
  1   0.000000     10.0.1.3 -> 10.0.1.2     TCP 46672 > http-alt [SYN] Seq=0 Win=5840 Len=0 MSS=1460 TSV=6872488 TSER=0 WS=6
  2   0.000293     10.0.1.2 -> 10.0.1.3     TCP http-alt > 46672 [SYN, ACK] Seq=0 Ack=1 Win=14480 Len=0 MSS=1460 TSV=6926246 TSER=6872488 WS=6
  3   0.000317     10.0.1.3 -> 10.0.1.2     TCP 46672 > http-alt [ACK] Seq=1 Ack=1 Win=5888 Len=0 TSV=6872488 TSER=6926246
207239  17.087194     10.0.1.3 -> 10.0.1.2     TCP 46672 > http-alt [FIN, ACK] Seq=327 Ack=200195476 Win=2580480 Len=0 TSV=6876760 TSER=6930459
207240  17.087595     10.0.1.2 -> 10.0.1.3     TCP http-alt > 46672 [FIN, ACK] Seq=200195476 Ack=328 Win=15552 Len=0 TSV=6930518 TSER=6876760
================================================================================
IPv4 Conversations
Filter:<No Filter>
                                               |       <-      | |       ->      | |     Total     |
                                               | Frames  Bytes | | Frames  Bytes | | Frames  Bytes |
10.0.1.3             <-> 10.0.1.2              138260 209320643   68981   4553080  207241 213873723
================================================================================
  1   0.000000     10.0.1.3 -> 10.0.1.2     TCP 46674 > http-alt [SYN] Seq=0 Win=5840 Len=0 MSS=1460 TSV=6879953 TSER=0 WS=6
  2   0.000300     10.0.1.2 -> 10.0.1.3     TCP http-alt > 46674 [SYN, ACK] Seq=0 Ack=1 Win=14480 Len=0 MSS=1460 TSV=6933712 TSER=6879953 WS=6
  3   0.000323     10.0.1.3 -> 10.0.1.2     TCP 46674 > http-alt [ACK] Seq=1 Ack=1 Win=5888 Len=0 TSV=6879953 TSER=6933712
207405  17.087942     10.0.1.3 -> 10.0.1.2     TCP 46674 > http-alt [FIN, ACK] Seq=327 Ack=200195476 Win=2577472 Len=0 TSV=6884225 TSER=6937925
207406  17.088299     10.0.1.2 -> 10.0.1.3     TCP http-alt > 46674 [FIN, ACK] Seq=200195476 Ack=328 Win=15552 Len=0 TSV=6937985 TSER=6884225
================================================================================
IPv4 Conversations
Filter:<No Filter>
                                               |       <-      | |       ->      | |     Total     |
                                               | Frames  Bytes | | Frames  Bytes | | Frames  Bytes |
10.0.1.3             <-> 10.0.1.2              138273 209321501   69134   4563178  207407 213884679
================================================================================
  1   0.000000     10.0.1.3 -> 10.0.1.2     TCP 46676 > http-alt [SYN] Seq=0 Win=5840 Len=0 MSS=1460 TSV=6887423 TSER=0 WS=6
  2   0.000318     10.0.1.2 -> 10.0.1.3     TCP http-alt > 46676 [SYN, ACK] Seq=0 Ack=1 Win=14480 Len=0 MSS=1460 TSV=6941183 TSER=6887423 WS=6
  3   0.000343     10.0.1.3 -> 10.0.1.2     TCP 46676 > http-alt [ACK] Seq=1 Ack=1 Win=5888 Len=0 TSV=6887423 TSER=6941183
207372  17.086366     10.0.1.3 -> 10.0.1.2     TCP 46676 > http-alt [FIN, ACK] Seq=327 Ack=200195476 Win=2580480 Len=0 TSV=6891695 TSER=6945395
207373  17.086720     10.0.1.2 -> 10.0.1.3     TCP http-alt > 46676 [FIN, ACK] Seq=200195476 Ack=328 Win=15552 Len=0 TSV=6945455 TSER=6891695
================================================================================
IPv4 Conversations
Filter:<No Filter>
                                               |       <-      | |       ->      | |     Total     |
                                               | Frames  Bytes | | Frames  Bytes | | Frames  Bytes |
10.0.1.3             <-> 10.0.1.2              138268 209321171   69106   4561330  207374 213882501
================================================================================
  1   0.000000     10.0.1.3 -> 10.0.1.2     TCP 46678 > http-alt [SYN] Seq=0 Win=5840 Len=0 MSS=1460 TSV=6894893 TSER=0 WS=6
  2   0.000283     10.0.1.2 -> 10.0.1.3     TCP http-alt > 46678 [SYN, ACK] Seq=0 Ack=1 Win=14480 Len=0 MSS=1460 TSV=6948654 TSER=6894893 WS=6
  3   0.000305     10.0.1.3 -> 10.0.1.2     TCP 46678 > http-alt [ACK] Seq=1 Ack=1 Win=5888 Len=0 TSV=6894893 TSER=6948654
207294  17.086205     10.0.1.3 -> 10.0.1.2     TCP 46678 > http-alt [FIN, ACK] Seq=327 Ack=200195476 Win=2580480 Len=0 TSV=6899165 TSER=6952866
207295  17.086586     10.0.1.2 -> 10.0.1.3     TCP http-alt > 46678 [FIN, ACK] Seq=200195476 Ack=328 Win=15552 Len=0 TSV=6952926 TSER=6899165
================================================================================
IPv4 Conversations
Filter:<No Filter>
                                               |       <-      | |       ->      | |     Total     |
                                               | Frames  Bytes | | Frames  Bytes | | Frames  Bytes |
10.0.1.3             <-> 10.0.1.2              138268 209321171   69028   4556182  207296 213877353
================================================================================
  1   0.000000     10.0.1.3 -> 10.0.1.2     TCP 40932 > http-alt [SYN] Seq=0 Win=5840 Len=0 MSS=1460 TSV=6902366 TSER=0 WS=6
  2   0.000305     10.0.1.2 -> 10.0.1.3     TCP http-alt > 40932 [SYN, ACK] Seq=0 Ack=1 Win=14480 Len=0 MSS=1460 TSV=6956127 TSER=6902366 WS=6
  3   0.000328     10.0.1.3 -> 10.0.1.2     TCP 40932 > http-alt [ACK] Seq=1 Ack=1 Win=5888 Len=0 TSV=6902366 TSER=6956127
207448  17.086305     10.0.1.3 -> 10.0.1.2     TCP 40932 > http-alt [FIN, ACK] Seq=327 Ack=200195476 Win=2580480 Len=0 TSV=6906638 TSER=6960338
207449  17.086698     10.0.1.2 -> 10.0.1.3     TCP http-alt > 40932 [FIN, ACK] Seq=200195476 Ack=328 Win=15552 Len=0 TSV=6960399 TSER=6906638
================================================================================
IPv4 Conversations
Filter:<No Filter>
                                               |       <-      | |       ->      | |     Total     |
                                               | Frames  Bytes | | Frames  Bytes | | Frames  Bytes |
10.0.1.3             <-> 10.0.1.2              138279 209321897   69171   4565620  207450 213887517
================================================================================
  1   0.000000     10.0.1.3 -> 10.0.1.2     TCP 40934 > http-alt [SYN] Seq=0 Win=5840 Len=0 MSS=1460 TSV=6909828 TSER=0 WS=6
  2   0.000288     10.0.1.2 -> 10.0.1.3     TCP http-alt > 40934 [SYN, ACK] Seq=0 Ack=1 Win=14480 Len=0 MSS=1460 TSV=6963589 TSER=6909828 WS=6
  3   0.000311     10.0.1.3 -> 10.0.1.2     TCP 40934 > http-alt [ACK] Seq=1 Ack=1 Win=5888 Len=0 TSV=6909828 TSER=6963589
207546  17.094031     10.0.1.3 -> 10.0.1.2     TCP 40934 > http-alt [FIN, ACK] Seq=327 Ack=200195476 Win=2580480 Len=0 TSV=6914101 TSER=6967802
207547  17.094434     10.0.1.2 -> 10.0.1.3     TCP http-alt > 40934 [FIN, ACK] Seq=200195476 Ack=328 Win=15552 Len=0 TSV=6967863 TSER=6914101
================================================================================
IPv4 Conversations
Filter:<No Filter>
                                               |       <-      | |       ->      | |     Total     |
                                               | Frames  Bytes | | Frames  Bytes | | Frames  Bytes |
10.0.1.3             <-> 10.0.1.2              138321 209324669   69227   4569316  207548 213893985
================================================================================
  1   0.000000     10.0.1.3 -> 10.0.1.2     TCP 40936 > http-alt [SYN] Seq=0 Win=5840 Len=0 MSS=1460 TSV=6917276 TSER=0 WS=6
  2   0.000277     10.0.1.2 -> 10.0.1.3     TCP http-alt > 40936 [SYN, ACK] Seq=0 Ack=1 Win=14480 Len=0 MSS=1460 TSV=6971038 TSER=6917276 WS=6
  3   0.000298     10.0.1.3 -> 10.0.1.2     TCP 40936 > http-alt [ACK] Seq=1 Ack=1 Win=5888 Len=0 TSV=6917276 TSER=6971038
215194  17.412365     10.0.1.3 -> 10.0.1.2     TCP 40936 > http-alt [FIN, ACK] Seq=327 Ack=200195476 Win=2557184 Len=0 TSV=6921629 TSER=6975332
215195  17.412720     10.0.1.2 -> 10.0.1.3     TCP http-alt > 40936 [FIN, ACK] Seq=200195476 Ack=328 Win=15552 Len=0 TSV=6975391 TSER=6921629
================================================================================
IPv4 Conversations
Filter:<No Filter>
                                               |       <-      | |       ->      | |     Total     |
                                               | Frames  Bytes | | Frames  Bytes | | Frames  Bytes |
10.0.1.3             <-> 10.0.1.2              141868 209558771   73328   4839982  215196 214398753
================================================================================
  1   0.000000     10.0.1.3 -> 10.0.1.2     TCP 40940 > http-alt [SYN] Seq=0 Win=5840 Len=0 MSS=1460 TSV=6924858 TSER=0 WS=6
  2   0.000309     10.0.1.2 -> 10.0.1.3     TCP http-alt > 40940 [SYN, ACK] Seq=0 Ack=1 Win=14480 Len=0 MSS=1460 TSV=6978621 TSER=6924858 WS=6
  3   0.000330     10.0.1.3 -> 10.0.1.2     TCP 40940 > http-alt [ACK] Seq=1 Ack=1 Win=5888 Len=0 TSV=6924858 TSER=6978621
224421  25.217365     10.0.1.3 -> 10.0.1.2     TCP 40940 > http-alt [FIN, ACK] Seq=327 Ack=200195476 Win=2580480 Len=0 TSV=6931162 TSER=6984897
224423  25.508503     10.0.1.2 -> 10.0.1.3     TCP http-alt > 40940 [FIN, ACK] Seq=200195476 Ack=328 Win=15552 Len=0 TSV=6984998 TSER=6931162
================================================================================
IPv4 Conversations
Filter:<No Filter>
                                               |       <-      | |       ->      | |     Total     |
                                               | Frames  Bytes | | Frames  Bytes | | Frames  Bytes |
10.0.1.3             <-> 10.0.1.2              146313 209852141   78111   5155660  224424 215007801
================================================================================
  1   0.000000     10.0.1.3 -> 10.0.1.2     TCP 40942 > http-alt [SYN] Seq=0 Win=5840 Len=0 MSS=1460 TSV=6934476 TSER=0 WS=6
  2   0.000296     10.0.1.2 -> 10.0.1.3     TCP http-alt > 40942 [SYN, ACK] Seq=0 Ack=1 Win=14480 Len=0 MSS=1460 TSV=6988239 TSER=6934476 WS=6
  3   0.000323     10.0.1.3 -> 10.0.1.2     TCP 40942 > http-alt [ACK] Seq=1 Ack=1 Win=5888 Len=0 TSV=6934476 TSER=6988239
221071  59.001127     10.0.1.3 -> 10.0.1.2     TCP 40942 > http-alt [FIN, ACK] Seq=327 Ack=200195476 Win=2580480 Len=0 TSV=6949226 TSER=7002958
221072  59.001522     10.0.1.2 -> 10.0.1.3     TCP http-alt > 40942 [FIN, ACK] Seq=200195476 Ack=328 Win=15552 Len=0 TSV=7002990 TSER=6949226
================================================================================
IPv4 Conversations
Filter:<No Filter>
                                               |       <-      | |       ->      | |     Total     |
                                               | Frames  Bytes | | Frames  Bytes | | Frames  Bytes |
10.0.1.3             <-> 10.0.1.2              144613 209739941   76460   5046694  221073 214786635
================================================================================
