  1   0.000000     10.0.1.3 -> 10.0.1.2     TCP 57953 > http-alt [SYN] Seq=0 Win=5840 Len=0 MSS=1460 TSV=917760 TSER=0 WS=6
  2   0.000252     10.0.1.2 -> 10.0.1.3     TCP http-alt > 57953 [SYN, ACK] Seq=0 Ack=1 Win=14480 Len=0 MSS=1460 TSV=949727 TSER=917760 WS=6
  3   0.000273     10.0.1.3 -> 10.0.1.2     TCP 57953 > http-alt [ACK] Seq=1 Ack=1 Win=5888 Len=0 TSV=917760 TSER=949727
188524  17.093939     10.0.1.3 -> 10.0.1.2     TCP 57953 > http-alt [FIN, ACK] Seq=327 Ack=200195476 Win=2580480 Len=0 TSV=922033 TSER=953939
188525  17.094282     10.0.1.2 -> 10.0.1.3     TCP http-alt > 57953 [FIN, ACK] Seq=200195476 Ack=328 Win=15552 Len=0 TSV=954000 TSER=922033
  1   0.000000     10.0.1.3 -> 10.0.1.2     TCP 57955 > http-alt [SYN] Seq=0 Win=5840 Len=0 MSS=1460 TSV=926480 TSER=0 WS=6
  2   0.000297     10.0.1.2 -> 10.0.1.3     TCP http-alt > 57955 [SYN, ACK] Seq=0 Ack=1 Win=14480 Len=0 MSS=1460 TSV=958447 TSER=926480 WS=6
  3   0.000322     10.0.1.3 -> 10.0.1.2     TCP 57955 > http-alt [ACK] Seq=1 Ack=1 Win=5888 Len=0 TSV=926480 TSER=958447
187685  17.086743     10.0.1.3 -> 10.0.1.2     TCP 57955 > http-alt [FIN, ACK] Seq=327 Ack=200195476 Win=2580480 Len=0 TSV=930752 TSER=962659
187686  17.087122     10.0.1.2 -> 10.0.1.3     TCP http-alt > 57955 [FIN, ACK] Seq=200195476 Ack=328 Win=15552 Len=0 TSV=962719 TSER=930752
  1   0.000000     10.0.1.3 -> 10.0.1.2     TCP 57957 > http-alt [SYN] Seq=0 Win=5840 Len=0 MSS=1460 TSV=935325 TSER=0 WS=6
  2   0.000269     10.0.1.2 -> 10.0.1.3     TCP http-alt > 57957 [SYN, ACK] Seq=0 Ack=1 Win=14480 Len=0 MSS=1460 TSV=967292 TSER=935325 WS=6
  3   0.000293     10.0.1.3 -> 10.0.1.2     TCP 57957 > http-alt [ACK] Seq=1 Ack=1 Win=5888 Len=0 TSV=935325 TSER=967292
191246  17.086028     10.0.1.3 -> 10.0.1.2     TCP 57957 > http-alt [FIN, ACK] Seq=327 Ack=200195476 Win=2580480 Len=0 TSV=939596 TSER=971505
191247  17.086362     10.0.1.2 -> 10.0.1.3     TCP http-alt > 57957 [FIN, ACK] Seq=200195476 Ack=328 Win=15552 Len=0 TSV=971564 TSER=939596
  1   0.000000     10.0.1.3 -> 10.0.1.2     TCP 57959 > http-alt [SYN] Seq=0 Win=5840 Len=0 MSS=1460 TSV=943985 TSER=0 WS=6
  2   0.000282     10.0.1.2 -> 10.0.1.3     TCP http-alt > 57959 [SYN, ACK] Seq=0 Ack=1 Win=14480 Len=0 MSS=1460 TSV=975954 TSER=943985 WS=6
  3   0.000303     10.0.1.3 -> 10.0.1.2     TCP 57959 > http-alt [ACK] Seq=1 Ack=1 Win=5888 Len=0 TSV=943985 TSER=975954
204053  17.086546     10.0.1.3 -> 10.0.1.2     TCP 57959 > http-alt [FIN, ACK] Seq=327 Ack=200195476 Win=2580480 Len=0 TSV=948257 TSER=980166
204054  17.086910     10.0.1.2 -> 10.0.1.3     TCP http-alt > 57959 [FIN, ACK] Seq=200195476 Ack=328 Win=15552 Len=0 TSV=980226 TSER=948257
  1   0.000000     10.0.1.3 -> 10.0.1.2     TCP 57961 > http-alt [SYN] Seq=0 Win=5840 Len=0 MSS=1460 TSV=952863 TSER=0 WS=6
  2   0.000332     10.0.1.2 -> 10.0.1.3     TCP http-alt > 57961 [SYN, ACK] Seq=0 Ack=1 Win=14480 Len=0 MSS=1460 TSV=984832 TSER=952863 WS=6
  3   0.000351     10.0.1.3 -> 10.0.1.2     TCP 57961 > http-alt [ACK] Seq=1 Ack=1 Win=5888 Len=0 TSV=952863 TSER=984832
201957  17.085205     10.0.1.3 -> 10.0.1.2     TCP 57961 > http-alt [FIN, ACK] Seq=327 Ack=200195476 Win=2560064 Len=0 TSV=957134 TSER=989044
201958  17.085557     10.0.1.2 -> 10.0.1.3     TCP http-alt > 57961 [FIN, ACK] Seq=200195476 Ack=328 Win=15552 Len=0 TSV=989103 TSER=957134
  1   0.000000     10.0.1.3 -> 10.0.1.2     TCP 57963 > http-alt [SYN] Seq=0 Win=5840 Len=0 MSS=1460 TSV=961725 TSER=0 WS=6
  2   0.000292     10.0.1.2 -> 10.0.1.3     TCP http-alt > 57963 [SYN, ACK] Seq=0 Ack=1 Win=14480 Len=0 MSS=1460 TSV=993695 TSER=961725 WS=6
  3   0.000315     10.0.1.3 -> 10.0.1.2     TCP 57963 > http-alt [ACK] Seq=1 Ack=1 Win=5888 Len=0 TSV=961725 TSER=993695
174708  18.302582     10.0.1.3 -> 10.0.1.2     TCP 57963 > http-alt [FIN, ACK] Seq=327 Ack=200195476 Win=2580480 Len=0 TSV=966301 TSER=997908
174709  18.302975     10.0.1.2 -> 10.0.1.3     TCP http-alt > 57963 [FIN, ACK] Seq=200195476 Ack=328 Win=15552 Len=0 TSV=998271 TSER=966301
  1   0.000000     10.0.1.3 -> 10.0.1.2     TCP 57965 > http-alt [SYN] Seq=0 Win=5840 Len=0 MSS=1460 TSV=970457 TSER=0 WS=6
  2   0.000298     10.0.1.2 -> 10.0.1.3     TCP http-alt > 57965 [SYN, ACK] Seq=0 Ack=1 Win=14480 Len=0 MSS=1460 TSV=1002428 TSER=970457 WS=6
  3   0.000318     10.0.1.3 -> 10.0.1.2     TCP 57965 > http-alt [ACK] Seq=1 Ack=1 Win=5888 Len=0 TSV=970457 TSER=1002428
181721  17.270092     10.0.1.3 -> 10.0.1.2     TCP 57965 > http-alt [FIN, ACK] Seq=327 Ack=200195476 Win=2560064 Len=0 TSV=974775 TSER=1006642
181722  17.270464     10.0.1.2 -> 10.0.1.3     TCP http-alt > 57965 [FIN, ACK] Seq=200195476 Ack=328 Win=15552 Len=0 TSV=1006745 TSER=974775
  1   0.000000     10.0.1.3 -> 10.0.1.2     TCP 56482 > http-alt [SYN] Seq=0 Win=5840 Len=0 MSS=1460 TSV=979074 TSER=0 WS=6
  2   0.000366     10.0.1.2 -> 10.0.1.3     TCP http-alt > 56482 [SYN, ACK] Seq=0 Ack=1 Win=14480 Len=0 MSS=1460 TSV=1011045 TSER=979074 WS=6
  3   0.000388     10.0.1.3 -> 10.0.1.2     TCP 56482 > http-alt [ACK] Seq=1 Ack=1 Win=5888 Len=0 TSV=979074 TSER=1011045
198742  17.086929     10.0.1.3 -> 10.0.1.2     TCP 56482 > http-alt [FIN, ACK] Seq=327 Ack=200195476 Win=2580480 Len=0 TSV=983345 TSER=1015259
198743  17.087287     10.0.1.2 -> 10.0.1.3     TCP http-alt > 56482 [FIN, ACK] Seq=200195476 Ack=328 Win=15552 Len=0 TSV=1015317 TSER=983345
  1   0.000000     10.0.1.3 -> 10.0.1.2     TCP 56484 > http-alt [SYN] Seq=0 Win=5840 Len=0 MSS=1460 TSV=987449 TSER=0 WS=6
  2   0.000267     10.0.1.2 -> 10.0.1.3     TCP http-alt > 56484 [SYN, ACK] Seq=0 Ack=1 Win=14480 Len=0 MSS=1460 TSV=1019421 TSER=987449 WS=6
  3   0.000288     10.0.1.3 -> 10.0.1.2     TCP 56484 > http-alt [ACK] Seq=1 Ack=1 Win=5888 Len=0 TSV=987449 TSER=1019421
203585  17.087234     10.0.1.3 -> 10.0.1.2     TCP 56484 > http-alt [FIN, ACK] Seq=327 Ack=200195476 Win=2580480 Len=0 TSV=991721 TSER=1023634
203586  17.087584     10.0.1.2 -> 10.0.1.3     TCP http-alt > 56484 [FIN, ACK] Seq=200195476 Ack=328 Win=15552 Len=0 TSV=1023693 TSER=991721
  1   0.000000     10.0.1.3 -> 10.0.1.2     TCP 56486 > http-alt [SYN] Seq=0 Win=5840 Len=0 MSS=1460 TSV=996050 TSER=0 WS=6
  2   0.000265     10.0.1.2 -> 10.0.1.3     TCP http-alt > 56486 [SYN, ACK] Seq=0 Ack=1 Win=14480 Len=0 MSS=1460 TSV=1028022 TSER=996050 WS=6
  3   0.000287     10.0.1.3 -> 10.0.1.2     TCP 56486 > http-alt [ACK] Seq=1 Ack=1 Win=5888 Len=0 TSV=996050 TSER=1028022
203553  17.087274     10.0.1.3 -> 10.0.1.2     TCP 56486 > http-alt [FIN, ACK] Seq=327 Ack=200195476 Win=2580480 Len=0 TSV=1000322 TSER=1032234
203554  17.087637     10.0.1.2 -> 10.0.1.3     TCP http-alt > 56486 [FIN, ACK] Seq=200195476 Ack=328 Win=15552 Len=0 TSV=1032295 TSER=1000322
  1   0.000000     10.0.1.3 -> 10.0.1.2     TCP 56488 > http-alt [SYN] Seq=0 Win=5840 Len=0 MSS=1460 TSV=1004756 TSER=0 WS=6
  2   0.000285     10.0.1.2 -> 10.0.1.3     TCP http-alt > 56488 [SYN, ACK] Seq=0 Ack=1 Win=14480 Len=0 MSS=1460 TSV=1036729 TSER=1004756 WS=6
  3   0.000308     10.0.1.3 -> 10.0.1.2     TCP 56488 > http-alt [ACK] Seq=1 Ack=1 Win=5888 Len=0 TSV=1004756 TSER=1036729
200616  17.087207     10.0.1.3 -> 10.0.1.2     TCP 56488 > http-alt [FIN, ACK] Seq=327 Ack=200195476 Win=2580480 Len=0 TSV=1009028 TSER=1040942
200617  17.087520     10.0.1.2 -> 10.0.1.3     TCP http-alt > 56488 [FIN, ACK] Seq=200195476 Ack=328 Win=15552 Len=0 TSV=1041002 TSER=1009028
  1   0.000000     10.0.1.3 -> 10.0.1.2     TCP 56490 > http-alt [SYN] Seq=0 Win=5840 Len=0 MSS=1460 TSV=1016034 TSER=0 WS=6
  2   0.000319     10.0.1.2 -> 10.0.1.3     TCP http-alt > 56490 [SYN, ACK] Seq=0 Ack=1 Win=14480 Len=0 MSS=1460 TSV=1048008 TSER=1016034 WS=6
  3   0.000344     10.0.1.3 -> 10.0.1.2     TCP 56490 > http-alt [ACK] Seq=1 Ack=1 Win=5888 Len=0 TSV=1016034 TSER=1048008
203955  17.091579     10.0.1.3 -> 10.0.1.2     TCP 56490 > http-alt [FIN, ACK] Seq=327 Ack=200195476 Win=2580480 Len=0 TSV=1020307 TSER=1052221
203956  17.091957     10.0.1.2 -> 10.0.1.3     TCP http-alt > 56490 [FIN, ACK] Seq=200195476 Ack=328 Win=15552 Len=0 TSV=1052281 TSER=1020307
  1   0.000000     10.0.1.3 -> 10.0.1.2     TCP 56492 > http-alt [SYN] Seq=0 Win=5840 Len=0 MSS=1460 TSV=1024846 TSER=0 WS=6
  2   0.000271     10.0.1.2 -> 10.0.1.3     TCP http-alt > 56492 [SYN, ACK] Seq=0 Ack=1 Win=14480 Len=0 MSS=1460 TSV=1056821 TSER=1024846 WS=6
  3   0.000294     10.0.1.3 -> 10.0.1.2     TCP 56492 > http-alt [ACK] Seq=1 Ack=1 Win=5888 Len=0 TSV=1024846 TSER=1056821
203184  17.090134     10.0.1.3 -> 10.0.1.2     TCP 56492 > http-alt [FIN, ACK] Seq=327 Ack=200195476 Win=2580480 Len=0 TSV=1029118 TSER=1061033
203185  17.090511     10.0.1.2 -> 10.0.1.3     TCP http-alt > 56492 [FIN, ACK] Seq=200195476 Ack=328 Win=15552 Len=0 TSV=1061093 TSER=1029118
  1   0.000000     10.0.1.3 -> 10.0.1.2     TCP 56494 > http-alt [SYN] Seq=0 Win=5840 Len=0 MSS=1460 TSV=1033732 TSER=0 WS=6
  2   0.000310     10.0.1.2 -> 10.0.1.3     TCP http-alt > 56494 [SYN, ACK] Seq=0 Ack=1 Win=14480 Len=0 MSS=1460 TSV=1065708 TSER=1033732 WS=6
  3   0.000332     10.0.1.3 -> 10.0.1.2     TCP 56494 > http-alt [ACK] Seq=1 Ack=1 Win=5888 Len=0 TSV=1033732 TSER=1065708
203714  17.080924     10.0.1.3 -> 10.0.1.2     TCP 56494 > http-alt [FIN, ACK] Seq=327 Ack=200195476 Win=2580480 Len=0 TSV=1038003 TSER=1069919
203715  17.081269     10.0.1.2 -> 10.0.1.3     TCP http-alt > 56494 [FIN, ACK] Seq=200195476 Ack=328 Win=15552 Len=0 TSV=1069978 TSER=1038003
  1   0.000000     10.0.1.3 -> 10.0.1.2     TCP 56496 > http-alt [SYN] Seq=0 Win=5840 Len=0 MSS=1460 TSV=1042250 TSER=0 WS=6
  2   0.000362     10.0.1.2 -> 10.0.1.3     TCP http-alt > 56496 [SYN, ACK] Seq=0 Ack=1 Win=14480 Len=0 MSS=1460 TSV=1074226 TSER=1042250 WS=6
  3   0.000384     10.0.1.3 -> 10.0.1.2     TCP 56496 > http-alt [ACK] Seq=1 Ack=1 Win=5888 Len=0 TSV=1042250 TSER=1074226
200686  17.087574     10.0.1.3 -> 10.0.1.2     TCP 56496 > http-alt [FIN, ACK] Seq=327 Ack=200195476 Win=2577472 Len=0 TSV=1046522 TSER=1078439
200687  17.087956     10.0.1.2 -> 10.0.1.3     TCP http-alt > 56496 [FIN, ACK] Seq=200195476 Ack=328 Win=15552 Len=0 TSV=1078498 TSER=1046522
  1   0.000000     10.0.1.3 -> 10.0.1.2     TCP 49962 > http-alt [SYN] Seq=0 Win=5840 Len=0 MSS=1460 TSV=1051111 TSER=0 WS=6
  2   0.000315     10.0.1.2 -> 10.0.1.3     TCP http-alt > 49962 [SYN, ACK] Seq=0 Ack=1 Win=14480 Len=0 MSS=1460 TSV=1083088 TSER=1051111 WS=6
  3   0.000336     10.0.1.3 -> 10.0.1.2     TCP 49962 > http-alt [ACK] Seq=1 Ack=1 Win=5888 Len=0 TSV=1051111 TSER=1083088
204078  17.089609     10.0.1.3 -> 10.0.1.2     TCP 49962 > http-alt [FIN, ACK] Seq=327 Ack=200195476 Win=2580480 Len=0 TSV=1055383 TSER=1087301
204079  17.089968     10.0.1.2 -> 10.0.1.3     TCP http-alt > 49962 [FIN, ACK] Seq=200195476 Ack=328 Win=15552 Len=0 TSV=1087361 TSER=1055383
  1   0.000000     10.0.1.3 -> 10.0.1.2     TCP 49964 > http-alt [SYN] Seq=0 Win=5840 Len=0 MSS=1460 TSV=1059566 TSER=0 WS=6
  2   0.000280     10.0.1.2 -> 10.0.1.3     TCP http-alt > 49964 [SYN, ACK] Seq=0 Ack=1 Win=14480 Len=0 MSS=1460 TSV=1091544 TSER=1059566 WS=6
  3   0.000301     10.0.1.3 -> 10.0.1.2     TCP 49964 > http-alt [ACK] Seq=1 Ack=1 Win=5888 Len=0 TSV=1059566 TSER=1091544
204295  17.086810     10.0.1.3 -> 10.0.1.2     TCP 49964 > http-alt [FIN, ACK] Seq=327 Ack=200195476 Win=2580480 Len=0 TSV=1063838 TSER=1095755
204296  17.087166     10.0.1.2 -> 10.0.1.3     TCP http-alt > 49964 [FIN, ACK] Seq=200195476 Ack=328 Win=15552 Len=0 TSV=1095816 TSER=1063838
  1   0.000000     10.0.1.3 -> 10.0.1.2     TCP 49966 > http-alt [SYN] Seq=0 Win=5840 Len=0 MSS=1460 TSV=1068433 TSER=0 WS=6
  2   0.000388     10.0.1.2 -> 10.0.1.3     TCP http-alt > 49966 [SYN, ACK] Seq=0 Ack=1 Win=14480 Len=0 MSS=1460 TSV=1100411 TSER=1068433 WS=6
  3   0.000410     10.0.1.3 -> 10.0.1.2     TCP 49966 > http-alt [ACK] Seq=1 Ack=1 Win=5888 Len=0 TSV=1068433 TSER=1100411
204949  17.090859     10.0.1.3 -> 10.0.1.2     TCP 49966 > http-alt [FIN, ACK] Seq=327 Ack=200195476 Win=2580480 Len=0 TSV=1072706 TSER=1104625
204950  17.091241     10.0.1.2 -> 10.0.1.3     TCP http-alt > 49966 [FIN, ACK] Seq=200195476 Ack=328 Win=15552 Len=0 TSV=1104684 TSER=1072706
  1   0.000000     10.0.1.3 -> 10.0.1.2     TCP 49968 > http-alt [SYN] Seq=0 Win=5840 Len=0 MSS=1460 TSV=1077224 TSER=0 WS=6
  2   0.000273     10.0.1.2 -> 10.0.1.3     TCP http-alt > 49968 [SYN, ACK] Seq=0 Ack=1 Win=14480 Len=0 MSS=1460 TSV=1109203 TSER=1077224 WS=6
  3   0.000289     10.0.1.3 -> 10.0.1.2     TCP 49968 > http-alt [ACK] Seq=1 Ack=1 Win=5888 Len=0 TSV=1077224 TSER=1109203
201586  17.088478     10.0.1.3 -> 10.0.1.2     TCP 49968 > http-alt [FIN, ACK] Seq=327 Ack=200195476 Win=2580480 Len=0 TSV=1081496 TSER=1113416
201587  17.088826     10.0.1.2 -> 10.0.1.3     TCP http-alt > 49968 [FIN, ACK] Seq=200195476 Ack=328 Win=15552 Len=0 TSV=1113475 TSER=1081496
  1   0.000000     10.0.1.3 -> 10.0.1.2     TCP 49970 > http-alt [SYN] Seq=0 Win=5840 Len=0 MSS=1460 TSV=1085948 TSER=0 WS=6
  2   0.000352     10.0.1.2 -> 10.0.1.3     TCP http-alt > 49970 [SYN, ACK] Seq=0 Ack=1 Win=14480 Len=0 MSS=1460 TSV=1117927 TSER=1085948 WS=6
  3   0.000376     10.0.1.3 -> 10.0.1.2     TCP 49970 > http-alt [ACK] Seq=1 Ack=1 Win=5888 Len=0 TSV=1085948 TSER=1117927
185799  17.216530     10.0.1.3 -> 10.0.1.2     TCP 49970 > http-alt [FIN, ACK] Seq=327 Ack=200195476 Win=2580480 Len=0 TSV=1090252 TSER=1122140
185800  17.216883     10.0.1.2 -> 10.0.1.3     TCP http-alt > 49970 [FIN, ACK] Seq=200195476 Ack=328 Win=15552 Len=0 TSV=1122232 TSER=1090252
