  1   0.000000     10.0.1.3 -> 10.0.1.2     TCP 40944 > http-alt [SYN] Seq=0 Win=5840 Len=0 MSS=1460 TSV=6952497 TSER=0 WS=6
  2   0.000291     10.0.1.2 -> 10.0.1.3     TCP http-alt > 40944 [SYN, ACK] Seq=0 Ack=1 Win=14480 Len=0 MSS=1460 TSV=7006261 TSER=6952497 WS=6
  3   0.000312     10.0.1.3 -> 10.0.1.2     TCP 40944 > http-alt [ACK] Seq=1 Ack=1 Win=5888 Len=0 TSV=6952497 TSER=7006261
259572  22.269779     10.0.1.3 -> 10.0.1.2     TCP 40944 > http-alt [FIN, ACK] Seq=327 Ack=250244301 Win=2580480 Len=0 TSV=6958064 TSER=7011769
259573  22.270185     10.0.1.2 -> 10.0.1.3     TCP http-alt > 40944 [FIN, ACK] Seq=250244301 Ack=328 Win=15552 Len=0 TSV=7011829 TSER=6958064
================================================================================
IPv4 Conversations
Filter:<No Filter>
                                               |       <-      | |       ->      | |     Total     |
                                               | Frames  Bytes | | Frames  Bytes | | Frames  Bytes |
10.0.1.3             <-> 10.0.1.2              173041 261665014   86533   5711512  259574 267376526
================================================================================
  1   0.000000     10.0.1.3 -> 10.0.1.2     TCP 40946 > http-alt [SYN] Seq=0 Win=5840 Len=0 MSS=1460 TSV=6961617 TSER=0 WS=6
  2   0.000283     10.0.1.2 -> 10.0.1.3     TCP http-alt > 40946 [SYN, ACK] Seq=0 Ack=1 Win=14480 Len=0 MSS=1460 TSV=7015383 TSER=6961617 WS=6
  3   0.000305     10.0.1.3 -> 10.0.1.2     TCP 40946 > http-alt [ACK] Seq=1 Ack=1 Win=5888 Len=0 TSV=6961617 TSER=7015383
259205  21.351438     10.0.1.3 -> 10.0.1.2     TCP 40946 > http-alt [FIN, ACK] Seq=327 Ack=250244301 Win=2580480 Len=0 TSV=6966955 TSER=7020660
259206  21.351805     10.0.1.2 -> 10.0.1.3     TCP http-alt > 40946 [FIN, ACK] Seq=250244301 Ack=328 Win=15552 Len=0 TSV=7020721 TSER=6966955
================================================================================
IPv4 Conversations
Filter:<No Filter>
                                               |       <-      | |       ->      | |     Total     |
                                               | Frames  Bytes | | Frames  Bytes | | Frames  Bytes |
10.0.1.3             <-> 10.0.1.2              172877 261654190   86330   5698114  259207 267352304
================================================================================
  1   0.000000     10.0.1.3 -> 10.0.1.2     TCP 40948 > http-alt [SYN] Seq=0 Win=5840 Len=0 MSS=1460 TSV=6970517 TSER=0 WS=6
  2   0.000275     10.0.1.2 -> 10.0.1.3     TCP http-alt > 40948 [SYN, ACK] Seq=0 Ack=1 Win=14480 Len=0 MSS=1460 TSV=7024283 TSER=6970517 WS=6
  3   0.000298     10.0.1.3 -> 10.0.1.2     TCP 40948 > http-alt [ACK] Seq=1 Ack=1 Win=5888 Len=0 TSV=6970517 TSER=7024283
259108  21.358286     10.0.1.3 -> 10.0.1.2     TCP 40948 > http-alt [FIN, ACK] Seq=327 Ack=250244301 Win=2580480 Len=0 TSV=6975857 TSER=7029564
259109  21.358706     10.0.1.2 -> 10.0.1.3     TCP http-alt > 40948 [FIN, ACK] Seq=250244301 Ack=328 Win=15552 Len=0 TSV=7029623 TSER=6975857
================================================================================
IPv4 Conversations
Filter:<No Filter>
                                               |       <-      | |       ->      | |     Total     |
                                               | Frames  Bytes | | Frames  Bytes | | Frames  Bytes |
10.0.1.3             <-> 10.0.1.2              172830 261651088   86280   5694814  259110 267345902
================================================================================
  1   0.000000     10.0.1.3 -> 10.0.1.2     TCP 58156 > http-alt [SYN] Seq=0 Win=5840 Len=0 MSS=1460 TSV=6979389 TSER=0 WS=6
  2   0.000288     10.0.1.2 -> 10.0.1.3     TCP http-alt > 58156 [SYN, ACK] Seq=0 Ack=1 Win=14480 Len=0 MSS=1460 TSV=7033155 TSER=6979389 WS=6
  3   0.000312     10.0.1.3 -> 10.0.1.2     TCP 58156 > http-alt [ACK] Seq=1 Ack=1 Win=5888 Len=0 TSV=6979389 TSER=7033155
259122  21.347611     10.0.1.3 -> 10.0.1.2     TCP 58156 > http-alt [FIN, ACK] Seq=327 Ack=250244301 Win=2580480 Len=0 TSV=6984725 TSER=7038434
259123  21.347968     10.0.1.2 -> 10.0.1.3     TCP http-alt > 58156 [FIN, ACK] Seq=250244301 Ack=328 Win=15552 Len=0 TSV=7038493 TSER=6984725
================================================================================
IPv4 Conversations
Filter:<No Filter>
                                               |       <-      | |       ->      | |     Total     |
                                               | Frames  Bytes | | Frames  Bytes | | Frames  Bytes |
10.0.1.3             <-> 10.0.1.2              172903 261655906   86221   5690920  259124 267346826
================================================================================
  1   0.000000     10.0.1.3 -> 10.0.1.2     TCP 58158 > http-alt [SYN] Seq=0 Win=5840 Len=0 MSS=1460 TSV=6988283 TSER=0 WS=6
  2   0.000300     10.0.1.2 -> 10.0.1.3     TCP http-alt > 58158 [SYN, ACK] Seq=0 Ack=1 Win=14480 Len=0 MSS=1460 TSV=7042050 TSER=6988283 WS=6
  3   0.000322     10.0.1.3 -> 10.0.1.2     TCP 58158 > http-alt [ACK] Seq=1 Ack=1 Win=5888 Len=0 TSV=6988283 TSER=7042050
259188  21.347849     10.0.1.3 -> 10.0.1.2     TCP 58158 > http-alt [FIN, ACK] Seq=327 Ack=250244301 Win=2580480 Len=0 TSV=6993620 TSER=7047328
259189  21.348215     10.0.1.2 -> 10.0.1.3     TCP http-alt > 58158 [FIN, ACK] Seq=250244301 Ack=328 Win=15552 Len=0 TSV=7047388 TSER=6993620
================================================================================
IPv4 Conversations
Filter:<No Filter>
                                               |       <-      | |       ->      | |     Total     |
                                               | Frames  Bytes | | Frames  Bytes | | Frames  Bytes |
10.0.1.3             <-> 10.0.1.2              172864 261653332   86326   5697850  259190 267351182
================================================================================
  1   0.000000     10.0.1.3 -> 10.0.1.2     TCP 58160 > http-alt [SYN] Seq=0 Win=5840 Len=0 MSS=1460 TSV=6997151 TSER=0 WS=6
  2   0.000310     10.0.1.2 -> 10.0.1.3     TCP http-alt > 58160 [SYN, ACK] Seq=0 Ack=1 Win=14480 Len=0 MSS=1460 TSV=7050918 TSER=6997151 WS=6
  3   0.000332     10.0.1.3 -> 10.0.1.2     TCP 58160 > http-alt [ACK] Seq=1 Ack=1 Win=5888 Len=0 TSV=6997151 TSER=7050918
259102  21.349816     10.0.1.3 -> 10.0.1.2     TCP 58160 > http-alt [FIN, ACK] Seq=327 Ack=250244301 Win=2580480 Len=0 TSV=7002488 TSER=7056196
259103  21.350168     10.0.1.2 -> 10.0.1.3     TCP http-alt > 58160 [FIN, ACK] Seq=250244301 Ack=328 Win=15552 Len=0 TSV=7056256 TSER=7002488
================================================================================
IPv4 Conversations
Filter:<No Filter>
                                               |       <-      | |       ->      | |     Total     |
                                               | Frames  Bytes | | Frames  Bytes | | Frames  Bytes |
10.0.1.3             <-> 10.0.1.2              172831 261651154   86273   5694352  259104 267345506
================================================================================
  1   0.000000     10.0.1.3 -> 10.0.1.2     TCP 58164 > http-alt [SYN] Seq=0 Win=5840 Len=0 MSS=1460 TSV=7006013 TSER=0 WS=6
  2   0.000271     10.0.1.2 -> 10.0.1.3     TCP http-alt > 58164 [SYN, ACK] Seq=0 Ack=1 Win=14480 Len=0 MSS=1460 TSV=7059782 TSER=7006013 WS=6
  3   0.000293     10.0.1.3 -> 10.0.1.2     TCP 58164 > http-alt [ACK] Seq=1 Ack=1 Win=5888 Len=0 TSV=7006013 TSER=7059782
258974  21.354958     10.0.1.3 -> 10.0.1.2     TCP 58164 > http-alt [FIN, ACK] Seq=327 Ack=250244301 Win=2580480 Len=0 TSV=7011352 TSER=7065060
258975  21.355325     10.0.1.2 -> 10.0.1.3     TCP http-alt > 58164 [FIN, ACK] Seq=250244301 Ack=328 Win=15552 Len=0 TSV=7065121 TSER=7011352
================================================================================
IPv4 Conversations
Filter:<No Filter>
                                               |       <-      | |       ->      | |     Total     |
                                               | Frames  Bytes | | Frames  Bytes | | Frames  Bytes |
10.0.1.3             <-> 10.0.1.2              172829 261651022   86147   5686036  258976 267337058
================================================================================
  1   0.000000     10.0.1.3 -> 10.0.1.2     TCP 58166 > http-alt [SYN] Seq=0 Win=5840 Len=0 MSS=1460 TSV=7014881 TSER=0 WS=6
  2   0.000363     10.0.1.2 -> 10.0.1.3     TCP http-alt > 58166 [SYN, ACK] Seq=0 Ack=1 Win=14480 Len=0 MSS=1460 TSV=7068651 TSER=7014881 WS=6
  3   0.000384     10.0.1.3 -> 10.0.1.2     TCP 58166 > http-alt [ACK] Seq=1 Ack=1 Win=5888 Len=0 TSV=7014882 TSER=7068651
258904  21.345471     10.0.1.3 -> 10.0.1.2     TCP 58166 > http-alt [FIN, ACK] Seq=327 Ack=250244301 Win=2580480 Len=0 TSV=7020218 TSER=7073929
258905  21.345874     10.0.1.2 -> 10.0.1.3     TCP http-alt > 58166 [FIN, ACK] Seq=250244301 Ack=328 Win=15552 Len=0 TSV=7073988 TSER=7020218
================================================================================
IPv4 Conversations
Filter:<No Filter>
                                               |       <-      | |       ->      | |     Total     |
                                               | Frames  Bytes | | Frames  Bytes | | Frames  Bytes |
10.0.1.3             <-> 10.0.1.2              172832 261651220   86074   5681218  258906 267332438
================================================================================
  1   0.000000     10.0.1.3 -> 10.0.1.2     TCP 58168 > http-alt [SYN] Seq=0 Win=5840 Len=0 MSS=1460 TSV=7023755 TSER=0 WS=6
  2   0.000302     10.0.1.2 -> 10.0.1.3     TCP http-alt > 58168 [SYN, ACK] Seq=0 Ack=1 Win=14480 Len=0 MSS=1460 TSV=7077524 TSER=7023755 WS=6
  3   0.000326     10.0.1.3 -> 10.0.1.2     TCP 58168 > http-alt [ACK] Seq=1 Ack=1 Win=5888 Len=0 TSV=7023755 TSER=7077524
259005  21.350308     10.0.1.3 -> 10.0.1.2     TCP 58168 > http-alt [FIN, ACK] Seq=327 Ack=250244301 Win=2580480 Len=0 TSV=7029092 TSER=7082803
259006  21.350702     10.0.1.2 -> 10.0.1.3     TCP http-alt > 58168 [FIN, ACK] Seq=250244301 Ack=328 Win=15552 Len=0 TSV=7082862 TSER=7029092
================================================================================
IPv4 Conversations
Filter:<No Filter>
                                               |       <-      | |       ->      | |     Total     |
                                               | Frames  Bytes | | Frames  Bytes | | Frames  Bytes |
10.0.1.3             <-> 10.0.1.2              172833 261651286   86174   5687818  259007 267339104
================================================================================
  1   0.000000     10.0.1.3 -> 10.0.1.2     TCP 58170 > http-alt [SYN] Seq=0 Win=5840 Len=0 MSS=1460 TSV=7032628 TSER=0 WS=6
  2   0.000290     10.0.1.2 -> 10.0.1.3     TCP http-alt > 58170 [SYN, ACK] Seq=0 Ack=1 Win=14480 Len=0 MSS=1460 TSV=7086399 TSER=7032628 WS=6
  3   0.000312     10.0.1.3 -> 10.0.1.2     TCP 58170 > http-alt [ACK] Seq=1 Ack=1 Win=5888 Len=0 TSV=7032628 TSER=7086399
259140  21.386881     10.0.1.3 -> 10.0.1.2     TCP 58170 > http-alt [FIN, ACK] Seq=327 Ack=250244301 Win=2580480 Len=0 TSV=7037975 TSER=7091686
259141  21.387258     10.0.1.2 -> 10.0.1.3     TCP http-alt > 58170 [FIN, ACK] Seq=250244301 Ack=328 Win=15552 Len=0 TSV=7091746 TSER=7037975
================================================================================
IPv4 Conversations
Filter:<No Filter>
                                               |       <-      | |       ->      | |     Total     |
                                               | Frames  Bytes | | Frames  Bytes | | Frames  Bytes |
10.0.1.3             <-> 10.0.1.2              172850 261652408   86292   5695606  259142 267348014
================================================================================
  1   0.000000     10.0.1.3 -> 10.0.1.2     TCP 58172 > http-alt [SYN] Seq=0 Win=5840 Len=0 MSS=1460 TSV=7041512 TSER=0 WS=6
  2   0.000287     10.0.1.2 -> 10.0.1.3     TCP http-alt > 58172 [SYN, ACK] Seq=0 Ack=1 Win=14480 Len=0 MSS=1460 TSV=7095284 TSER=7041512 WS=6
  3   0.000309     10.0.1.3 -> 10.0.1.2     TCP 58172 > http-alt [ACK] Seq=1 Ack=1 Win=5888 Len=0 TSV=7041512 TSER=7095284
259121  21.352756     10.0.1.3 -> 10.0.1.2     TCP 58172 > http-alt [FIN, ACK] Seq=327 Ack=250244301 Win=2580480 Len=0 TSV=7046851 TSER=7100562
259122  21.353111     10.0.1.2 -> 10.0.1.3     TCP http-alt > 58172 [FIN, ACK] Seq=250244301 Ack=328 Win=15552 Len=0 TSV=7100622 TSER=7046851
================================================================================
IPv4 Conversations
Filter:<No Filter>
                                               |       <-      | |       ->      | |     Total     |
                                               | Frames  Bytes | | Frames  Bytes | | Frames  Bytes |
10.0.1.3             <-> 10.0.1.2              172845 261652078   86278   5694682  259123 267346760
================================================================================
  1   0.000000     10.0.1.3 -> 10.0.1.2     TCP 53418 > http-alt [SYN] Seq=0 Win=5840 Len=0 MSS=1460 TSV=7050375 TSER=0 WS=6
  2   0.000300     10.0.1.2 -> 10.0.1.3     TCP http-alt > 53418 [SYN, ACK] Seq=0 Ack=1 Win=14480 Len=0 MSS=1460 TSV=7104147 TSER=7050375 WS=6
  3   0.000322     10.0.1.3 -> 10.0.1.2     TCP 53418 > http-alt [ACK] Seq=1 Ack=1 Win=5888 Len=0 TSV=7050375 TSER=7104147
259034  21.347839     10.0.1.3 -> 10.0.1.2     TCP 53418 > http-alt [FIN, ACK] Seq=327 Ack=250244301 Win=2580480 Len=0 TSV=7055712 TSER=7109425
259035  21.348180     10.0.1.2 -> 10.0.1.3     TCP http-alt > 53418 [FIN, ACK] Seq=250244301 Ack=328 Win=15552 Len=0 TSV=7109484 TSER=7055712
================================================================================
IPv4 Conversations
Filter:<No Filter>
                                               |       <-      | |       ->      | |     Total     |
                                               | Frames  Bytes | | Frames  Bytes | | Frames  Bytes |
10.0.1.3             <-> 10.0.1.2              172837 261651550   86199   5689468  259036 267341018
================================================================================
  1   0.000000     10.0.1.3 -> 10.0.1.2     TCP 53420 > http-alt [SYN] Seq=0 Win=5840 Len=0 MSS=1460 TSV=7059238 TSER=0 WS=6
  2   0.000278     10.0.1.2 -> 10.0.1.3     TCP http-alt > 53420 [SYN, ACK] Seq=0 Ack=1 Win=14480 Len=0 MSS=1460 TSV=7113010 TSER=7059238 WS=6
  3   0.000303     10.0.1.3 -> 10.0.1.2     TCP 53420 > http-alt [ACK] Seq=1 Ack=1 Win=5888 Len=0 TSV=7059238 TSER=7113010
259021  21.353909     10.0.1.3 -> 10.0.1.2     TCP 53420 > http-alt [FIN, ACK] Seq=327 Ack=250244301 Win=2580480 Len=0 TSV=7064576 TSER=7118289
259022  21.354313     10.0.1.2 -> 10.0.1.3     TCP http-alt > 53420 [FIN, ACK] Seq=250244301 Ack=328 Win=15552 Len=0 TSV=7118349 TSER=7064576
================================================================================
IPv4 Conversations
Filter:<No Filter>
                                               |       <-      | |       ->      | |     Total     |
                                               | Frames  Bytes | | Frames  Bytes | | Frames  Bytes |
10.0.1.3             <-> 10.0.1.2              172836 261651484   86187   5688676  259023 267340160
================================================================================
  1   0.000000     10.0.1.3 -> 10.0.1.2     TCP 53422 > http-alt [SYN] Seq=0 Win=5840 Len=0 MSS=1460 TSV=7068118 TSER=0 WS=6
  2   0.000316     10.0.1.2 -> 10.0.1.3     TCP http-alt > 53422 [SYN, ACK] Seq=0 Ack=1 Win=14480 Len=0 MSS=1460 TSV=7121892 TSER=7068118 WS=6
  3   0.000338     10.0.1.3 -> 10.0.1.2     TCP 53422 > http-alt [ACK] Seq=1 Ack=1 Win=5888 Len=0 TSV=7068118 TSER=7121892
259427  21.343280     10.0.1.3 -> 10.0.1.2     TCP 53422 > http-alt [FIN, ACK] Seq=327 Ack=250244301 Win=2568768 Len=0 TSV=7073454 TSER=7127169
259428  21.343653     10.0.1.2 -> 10.0.1.3     TCP http-alt > 53422 [FIN, ACK] Seq=250244301 Ack=328 Win=15552 Len=0 TSV=7127228 TSER=7073454
================================================================================
IPv4 Conversations
Filter:<No Filter>
                                               |       <-      | |       ->      | |     Total     |
                                               | Frames  Bytes | | Frames  Bytes | | Frames  Bytes |
10.0.1.3             <-> 10.0.1.2              172827 261650890   86602   5716066  259429 267366956
================================================================================
  1   0.000000     10.0.1.3 -> 10.0.1.2     TCP 53426 > http-alt [SYN] Seq=0 Win=5840 Len=0 MSS=1460 TSV=7076989 TSER=0 WS=6
  2   0.000270     10.0.1.2 -> 10.0.1.3     TCP http-alt > 53426 [SYN, ACK] Seq=0 Ack=1 Win=14480 Len=0 MSS=1460 TSV=7130763 TSER=7076989 WS=6
  3   0.000292     10.0.1.3 -> 10.0.1.2     TCP 53426 > http-alt [ACK] Seq=1 Ack=1 Win=5888 Len=0 TSV=7076989 TSER=7130763
259102  21.350504     10.0.1.3 -> 10.0.1.2     TCP 53426 > http-alt [FIN, ACK] Seq=327 Ack=250244301 Win=2580480 Len=0 TSV=7082327 TSER=7136042
259103  21.350851     10.0.1.2 -> 10.0.1.3     TCP http-alt > 53426 [FIN, ACK] Seq=250244301 Ack=328 Win=15552 Len=0 TSV=7136101 TSER=7082327
================================================================================
IPv4 Conversations
Filter:<No Filter>
                                               |       <-      | |       ->      | |     Total     |
                                               | Frames  Bytes | | Frames  Bytes | | Frames  Bytes |
10.0.1.3             <-> 10.0.1.2              172831 261651154   86273   5694352  259104 267345506
================================================================================
  1   0.000000     10.0.1.3 -> 10.0.1.2     TCP 53428 > http-alt [SYN] Seq=0 Win=5840 Len=0 MSS=1460 TSV=7085856 TSER=0 WS=6
  2   0.000296     10.0.1.2 -> 10.0.1.3     TCP http-alt > 53428 [SYN, ACK] Seq=0 Ack=1 Win=14480 Len=0 MSS=1460 TSV=7139631 TSER=7085856 WS=6
  3   0.000320     10.0.1.3 -> 10.0.1.2     TCP 53428 > http-alt [ACK] Seq=1 Ack=1 Win=5888 Len=0 TSV=7085856 TSER=7139631
259184  21.355193     10.0.1.3 -> 10.0.1.2     TCP 53428 > http-alt [FIN, ACK] Seq=327 Ack=250244301 Win=2580480 Len=0 TSV=7091195 TSER=7144909
259185  21.355493     10.0.1.2 -> 10.0.1.3     TCP http-alt > 53428 [FIN, ACK] Seq=250244301 Ack=328 Win=15552 Len=0 TSV=7144970 TSER=7091195
================================================================================
IPv4 Conversations
Filter:<No Filter>
                                               |       <-      | |       ->      | |     Total     |
                                               | Frames  Bytes | | Frames  Bytes | | Frames  Bytes |
10.0.1.3             <-> 10.0.1.2              172833 261651286   86353   5699632  259186 267350918
================================================================================
  1   0.000000     10.0.1.3 -> 10.0.1.2     TCP 53430 > http-alt [SYN] Seq=0 Win=5840 Len=0 MSS=1460 TSV=7094730 TSER=0 WS=6
  2   0.000365     10.0.1.2 -> 10.0.1.3     TCP http-alt > 53430 [SYN, ACK] Seq=0 Ack=1 Win=14480 Len=0 MSS=1460 TSV=7148505 TSER=7094730 WS=6
  3   0.000388     10.0.1.3 -> 10.0.1.2     TCP 53430 > http-alt [ACK] Seq=1 Ack=1 Win=5888 Len=0 TSV=7094730 TSER=7148505
259069  21.391224     10.0.1.3 -> 10.0.1.2     TCP 53430 > http-alt [FIN, ACK] Seq=327 Ack=250244301 Win=2580480 Len=0 TSV=7100077 TSER=7153792
259070  21.391625     10.0.1.2 -> 10.0.1.3     TCP http-alt > 53430 [FIN, ACK] Seq=250244301 Ack=328 Win=15552 Len=0 TSV=7153853 TSER=7100077
================================================================================
IPv4 Conversations
Filter:<No Filter>
                                               |       <-      | |       ->      | |     Total     |
                                               | Frames  Bytes | | Frames  Bytes | | Frames  Bytes |
10.0.1.3             <-> 10.0.1.2              172844 261652012   86227   5691316  259071 267343328
================================================================================
  1   0.000000     10.0.1.3 -> 10.0.1.2     TCP 53432 > http-alt [SYN] Seq=0 Win=5840 Len=0 MSS=1460 TSV=7103635 TSER=0 WS=6
  2   0.000300     10.0.1.2 -> 10.0.1.3     TCP http-alt > 53432 [SYN, ACK] Seq=0 Ack=1 Win=14480 Len=0 MSS=1460 TSV=7157411 TSER=7103635 WS=6
  3   0.000320     10.0.1.3 -> 10.0.1.2     TCP 53432 > http-alt [ACK] Seq=1 Ack=1 Win=5888 Len=0 TSV=7103635 TSER=7157411
259129  21.341598     10.0.1.3 -> 10.0.1.2     TCP 53432 > http-alt [FIN, ACK] Seq=327 Ack=250244301 Win=2580480 Len=0 TSV=7108971 TSER=7162688
259130  21.341953     10.0.1.2 -> 10.0.1.3     TCP http-alt > 53432 [FIN, ACK] Seq=250244301 Ack=328 Win=15552 Len=0 TSV=7162747 TSER=7108971
================================================================================
IPv4 Conversations
Filter:<No Filter>
                                               |       <-      | |       ->      | |     Total     |
                                               | Frames  Bytes | | Frames  Bytes | | Frames  Bytes |
10.0.1.3             <-> 10.0.1.2              172833 261651286   86298   5696002  259131 267347288
================================================================================
  1   0.000000     10.0.1.3 -> 10.0.1.2     TCP 53434 > http-alt [SYN] Seq=0 Win=5840 Len=0 MSS=1460 TSV=7112492 TSER=0 WS=6
  2   0.000294     10.0.1.2 -> 10.0.1.3     TCP http-alt > 53434 [SYN, ACK] Seq=0 Ack=1 Win=14480 Len=0 MSS=1460 TSV=7166268 TSER=7112492 WS=6
  3   0.000316     10.0.1.3 -> 10.0.1.2     TCP 53434 > http-alt [ACK] Seq=1 Ack=1 Win=5888 Len=0 TSV=7112492 TSER=7166268
259026  21.351354     10.0.1.3 -> 10.0.1.2     TCP 53434 > http-alt [FIN, ACK] Seq=327 Ack=250244301 Win=2580480 Len=0 TSV=7117829 TSER=7171547
259027  21.351749     10.0.1.2 -> 10.0.1.3     TCP http-alt > 53434 [FIN, ACK] Seq=250244301 Ack=328 Win=15552 Len=0 TSV=7171607 TSER=7117829
================================================================================
IPv4 Conversations
Filter:<No Filter>
                                               |       <-      | |       ->      | |     Total     |
                                               | Frames  Bytes | | Frames  Bytes | | Frames  Bytes |
10.0.1.3             <-> 10.0.1.2              172878 261654256   86150   5686234  259028 267340490
================================================================================
  1   0.000000     10.0.1.3 -> 10.0.1.2     TCP 53436 > http-alt [SYN] Seq=0 Win=5840 Len=0 MSS=1460 TSV=7121361 TSER=0 WS=6
  2   0.000284     10.0.1.2 -> 10.0.1.3     TCP http-alt > 53436 [SYN, ACK] Seq=0 Ack=1 Win=14480 Len=0 MSS=1460 TSV=7175139 TSER=7121361 WS=6
  3   0.000306     10.0.1.3 -> 10.0.1.2     TCP 53436 > http-alt [ACK] Seq=1 Ack=1 Win=5888 Len=0 TSV=7121361 TSER=7175139
259130  21.344285     10.0.1.3 -> 10.0.1.2     TCP 53436 > http-alt [FIN, ACK] Seq=327 Ack=250244301 Win=2580480 Len=0 TSV=7126697 TSER=7180416
259131  21.344688     10.0.1.2 -> 10.0.1.3     TCP http-alt > 53436 [FIN, ACK] Seq=250244301 Ack=328 Win=15552 Len=0 TSV=7180475 TSER=7126697
================================================================================
IPv4 Conversations
Filter:<No Filter>
                                               |       <-      | |       ->      | |     Total     |
                                               | Frames  Bytes | | Frames  Bytes | | Frames  Bytes |
10.0.1.3             <-> 10.0.1.2              172887 261654850   86245   5692504  259132 267347354
================================================================================
