  1   0.000000     10.0.1.3 -> 10.0.1.2     TCP 50713 > http-alt [SYN] Seq=0 Win=5840 Len=0 MSS=1460 TSV=7130355 TSER=0 WS=6
  2   0.000298     10.0.1.2 -> 10.0.1.3     TCP http-alt > 50713 [SYN, ACK] Seq=0 Ack=1 Win=14480 Len=0 MSS=1460 TSV=7184133 TSER=7130355 WS=6
  3   0.000320     10.0.1.3 -> 10.0.1.2     TCP 50713 > http-alt [ACK] Seq=1 Ack=1 Win=5888 Len=0 TSV=7130355 TSER=7184133
310856  25.605985     10.0.1.3 -> 10.0.1.2     TCP 50713 > http-alt [FIN, ACK] Seq=327 Ack=300293132 Win=2580480 Len=0 TSV=7136756 TSER=7190475
310857  25.606356     10.0.1.2 -> 10.0.1.3     TCP http-alt > 50713 [FIN, ACK] Seq=300293132 Ack=328 Win=15552 Len=0 TSV=7190535 TSER=7136756
================================================================================
IPv4 Conversations
Filter:<No Filter>
                                               |       <-      | |       ->      | |     Total     |
                                               | Frames  Bytes | | Frames  Bytes | | Frames  Bytes |
10.0.1.3             <-> 10.0.1.2              207419 313982793  103439   6827308  310858 320810101
================================================================================
  1   0.000000     10.0.1.3 -> 10.0.1.2     TCP 50716 > http-alt [SYN] Seq=0 Win=5840 Len=0 MSS=1460 TSV=7140623 TSER=0 WS=6
  2   0.000311     10.0.1.2 -> 10.0.1.3     TCP http-alt > 50716 [SYN, ACK] Seq=0 Ack=1 Win=14480 Len=0 MSS=1460 TSV=7194402 TSER=7140623 WS=6
  3   0.000337     10.0.1.3 -> 10.0.1.2     TCP 50716 > http-alt [ACK] Seq=1 Ack=1 Win=5888 Len=0 TSV=7140623 TSER=7194402
310811  25.606928     10.0.1.3 -> 10.0.1.2     TCP 50716 > http-alt [FIN, ACK] Seq=327 Ack=300293132 Win=2580480 Len=0 TSV=7147025 TSER=7200745
310812  25.607291     10.0.1.2 -> 10.0.1.3     TCP http-alt > 50716 [FIN, ACK] Seq=300293132 Ack=328 Win=15552 Len=0 TSV=7200804 TSER=7147025
================================================================================
IPv4 Conversations
Filter:<No Filter>
                                               |       <-      | |       ->      | |     Total     |
                                               | Frames  Bytes | | Frames  Bytes | | Frames  Bytes |
10.0.1.3             <-> 10.0.1.2              207397 313981341  103416   6825790  310813 320807131
================================================================================
  1   0.000000     10.0.1.3 -> 10.0.1.2     TCP 50720 > http-alt [SYN] Seq=0 Win=5840 Len=0 MSS=1460 TSV=7150935 TSER=0 WS=6
  2   0.000286     10.0.1.2 -> 10.0.1.3     TCP http-alt > 50720 [SYN, ACK] Seq=0 Ack=1 Win=14480 Len=0 MSS=1460 TSV=7204714 TSER=7150935 WS=6
  3   0.000308     10.0.1.3 -> 10.0.1.2     TCP 50720 > http-alt [ACK] Seq=1 Ack=1 Win=5888 Len=0 TSV=7150935 TSER=7204714
311217  25.615582     10.0.1.3 -> 10.0.1.2     TCP 50720 > http-alt [FIN, ACK] Seq=327 Ack=300293132 Win=2560064 Len=0 TSV=7157339 TSER=7211059
311218  25.615932     10.0.1.2 -> 10.0.1.3     TCP http-alt > 50720 [FIN, ACK] Seq=300293132 Ack=328 Win=15552 Len=0 TSV=7211119 TSER=7157339
================================================================================
IPv4 Conversations
Filter:<No Filter>
                                               |       <-      | |       ->      | |     Total     |
                                               | Frames  Bytes | | Frames  Bytes | | Frames  Bytes |
10.0.1.3             <-> 10.0.1.2              207450 313984839  103769   6849088  311219 320833927
================================================================================
  1   0.000000     10.0.1.3 -> 10.0.1.2     TCP 50722 > http-alt [SYN] Seq=0 Win=5840 Len=0 MSS=1460 TSV=7161207 TSER=0 WS=6
  2   0.000317     10.0.1.2 -> 10.0.1.3     TCP http-alt > 50722 [SYN, ACK] Seq=0 Ack=1 Win=14480 Len=0 MSS=1460 TSV=7214987 TSER=7161207 WS=6
  3   0.000340     10.0.1.3 -> 10.0.1.2     TCP 50722 > http-alt [ACK] Seq=1 Ack=1 Win=5888 Len=0 TSV=7161207 TSER=7214987
311023  25.614869     10.0.1.3 -> 10.0.1.2     TCP 50722 > http-alt [FIN, ACK] Seq=327 Ack=300293132 Win=2580480 Len=0 TSV=7167610 TSER=7221332
311024  25.615227     10.0.1.2 -> 10.0.1.3     TCP http-alt > 50722 [FIN, ACK] Seq=300293132 Ack=328 Win=15552 Len=0 TSV=7221392 TSER=7167610
================================================================================
IPv4 Conversations
Filter:<No Filter>
                                               |       <-      | |       ->      | |     Total     |
                                               | Frames  Bytes | | Frames  Bytes | | Frames  Bytes |
10.0.1.3             <-> 10.0.1.2              207428 313983387  103597   6837736  311025 320821123
================================================================================
  1   0.000000     10.0.1.3 -> 10.0.1.2     TCP 50724 > http-alt [SYN] Seq=0 Win=5840 Len=0 MSS=1460 TSV=7171664 TSER=0 WS=6
  2   0.000314     10.0.1.2 -> 10.0.1.3     TCP http-alt > 50724 [SYN, ACK] Seq=0 Ack=1 Win=14480 Len=0 MSS=1460 TSV=7225445 TSER=7171664 WS=6
  3   0.000334     10.0.1.3 -> 10.0.1.2     TCP 50724 > http-alt [ACK] Seq=1 Ack=1 Win=5888 Len=0 TSV=7171664 TSER=7225445
310864  25.616463     10.0.1.3 -> 10.0.1.2     TCP 50724 > http-alt [FIN, ACK] Seq=327 Ack=300293132 Win=2580480 Len=0 TSV=7178068 TSER=7231789
310865  25.616845     10.0.1.2 -> 10.0.1.3     TCP http-alt > 50724 [FIN, ACK] Seq=300293132 Ack=328 Win=15552 Len=0 TSV=7231850 TSER=7178068
================================================================================
IPv4 Conversations
Filter:<No Filter>
                                               |       <-      | |       ->      | |     Total     |
                                               | Frames  Bytes | | Frames  Bytes | | Frames  Bytes |
10.0.1.3             <-> 10.0.1.2              207396 313981275  103470   6829354  310866 320810629
================================================================================
  1   0.000000     10.0.1.3 -> 10.0.1.2     TCP 50726 > http-alt [SYN] Seq=0 Win=5840 Len=0 MSS=1460 TSV=7181951 TSER=0 WS=6
  2   0.000287     10.0.1.2 -> 10.0.1.3     TCP http-alt > 50726 [SYN, ACK] Seq=0 Ack=1 Win=14480 Len=0 MSS=1460 TSV=7235733 TSER=7181951 WS=6
  3   0.000312     10.0.1.3 -> 10.0.1.2     TCP 50726 > http-alt [ACK] Seq=1 Ack=1 Win=5888 Len=0 TSV=7181951 TSER=7235733
311361  25.607864     10.0.1.3 -> 10.0.1.2     TCP 50726 > http-alt [FIN, ACK] Seq=327 Ack=300293132 Win=2560064 Len=0 TSV=7188353 TSER=7242077
311362  25.608235     10.0.1.2 -> 10.0.1.3     TCP http-alt > 50726 [FIN, ACK] Seq=300293132 Ack=328 Win=15552 Len=0 TSV=7242136 TSER=7188353
================================================================================
IPv4 Conversations
Filter:<No Filter>
                                               |       <-      | |       ->      | |     Total     |
                                               | Frames  Bytes | | Frames  Bytes | | Frames  Bytes |
10.0.1.3             <-> 10.0.1.2              207437 313983981  103926   6859450  311363 320843431
================================================================================
  1   0.000000     10.0.1.3 -> 10.0.1.2     TCP 50728 > http-alt [SYN] Seq=0 Win=5840 Len=0 MSS=1460 TSV=7192228 TSER=0 WS=6
  2   0.000358     10.0.1.2 -> 10.0.1.3     TCP http-alt > 50728 [SYN, ACK] Seq=0 Ack=1 Win=14480 Len=0 MSS=1460 TSV=7246010 TSER=7192228 WS=6
  3   0.000382     10.0.1.3 -> 10.0.1.2     TCP 50728 > http-alt [ACK] Seq=1 Ack=1 Win=5888 Len=0 TSV=7192228 TSER=7246010
310823  25.614112     10.0.1.3 -> 10.0.1.2     TCP 50728 > http-alt [FIN, ACK] Seq=327 Ack=300293132 Win=2580480 Len=0 TSV=7198631 TSER=7252355
310824  25.614487     10.0.1.2 -> 10.0.1.3     TCP http-alt > 50728 [FIN, ACK] Seq=300293132 Ack=328 Win=15552 Len=0 TSV=7252414 TSER=7198631
================================================================================
IPv4 Conversations
Filter:<No Filter>
                                               |       <-      | |       ->      | |     Total     |
                                               | Frames  Bytes | | Frames  Bytes | | Frames  Bytes |
10.0.1.3             <-> 10.0.1.2              207426 313983255  103399   6824668  310825 320807923
================================================================================
  1   0.000000     10.0.1.3 -> 10.0.1.2     TCP 39027 > http-alt [SYN] Seq=0 Win=5840 Len=0 MSS=1460 TSV=7202540 TSER=0 WS=6
  2   0.000336     10.0.1.2 -> 10.0.1.3     TCP http-alt > 39027 [SYN, ACK] Seq=0 Ack=1 Win=14480 Len=0 MSS=1460 TSV=7256324 TSER=7202540 WS=6
  3   0.000359     10.0.1.3 -> 10.0.1.2     TCP 39027 > http-alt [ACK] Seq=1 Ack=1 Win=5888 Len=0 TSV=7202540 TSER=7256324
310851  25.615420     10.0.1.3 -> 10.0.1.2     TCP 39027 > http-alt [FIN, ACK] Seq=327 Ack=300293132 Win=2580480 Len=0 TSV=7208944 TSER=7262668
310852  25.615813     10.0.1.2 -> 10.0.1.3     TCP http-alt > 39027 [FIN, ACK] Seq=300293132 Ack=328 Win=15552 Len=0 TSV=7262728 TSER=7208944
================================================================================
IPv4 Conversations
Filter:<No Filter>
                                               |       <-      | |       ->      | |     Total     |
                                               | Frames  Bytes | | Frames  Bytes | | Frames  Bytes |
10.0.1.3             <-> 10.0.1.2              207401 313981605  103452   6828166  310853 320809771
================================================================================
  1   0.000000     10.0.1.3 -> 10.0.1.2     TCP 39029 > http-alt [SYN] Seq=0 Win=5840 Len=0 MSS=1460 TSV=7212898 TSER=0 WS=6
  2   0.000270     10.0.1.2 -> 10.0.1.3     TCP http-alt > 39029 [SYN, ACK] Seq=0 Ack=1 Win=14480 Len=0 MSS=1460 TSV=7266683 TSER=7212898 WS=6
  3   0.000292     10.0.1.3 -> 10.0.1.2     TCP 39029 > http-alt [ACK] Seq=1 Ack=1 Win=5888 Len=0 TSV=7212899 TSER=7266683
310687  25.618607     10.0.1.3 -> 10.0.1.2     TCP 39029 > http-alt [FIN, ACK] Seq=327 Ack=300293132 Win=2580480 Len=0 TSV=7219303 TSER=7273028
310688  25.618963     10.0.1.2 -> 10.0.1.3     TCP http-alt > 39029 [FIN, ACK] Seq=300293132 Ack=328 Win=15552 Len=0 TSV=7273088 TSER=7219303
================================================================================
IPv4 Conversations
Filter:<No Filter>
                                               |       <-      | |       ->      | |     Total     |
                                               | Frames  Bytes | | Frames  Bytes | | Frames  Bytes |
10.0.1.3             <-> 10.0.1.2              207451 313984905  103238   6814042  310689 320798947
================================================================================
  1   0.000000     10.0.1.3 -> 10.0.1.2     TCP 39031 > http-alt [SYN] Seq=0 Win=5840 Len=0 MSS=1460 TSV=7223163 TSER=0 WS=6
  2   0.000271     10.0.1.2 -> 10.0.1.3     TCP http-alt > 39031 [SYN, ACK] Seq=0 Ack=1 Win=14480 Len=0 MSS=1460 TSV=7276948 TSER=7223163 WS=6
  3   0.000294     10.0.1.3 -> 10.0.1.2     TCP 39031 > http-alt [ACK] Seq=1 Ack=1 Win=5888 Len=0 TSV=7223163 TSER=7276948
310871  25.612475     10.0.1.3 -> 10.0.1.2     TCP 39031 > http-alt [FIN, ACK] Seq=327 Ack=300293132 Win=2580480 Len=0 TSV=7229566 TSER=7283292
310872  25.612806     10.0.1.2 -> 10.0.1.3     TCP http-alt > 39031 [FIN, ACK] Seq=300293132 Ack=328 Win=15552 Len=0 TSV=7283352 TSER=7229566
================================================================================
IPv4 Conversations
Filter:<No Filter>
                                               |       <-      | |       ->      | |     Total     |
                                               | Frames  Bytes | | Frames  Bytes | | Frames  Bytes |
10.0.1.3             <-> 10.0.1.2              207443 313984377  103430   6826714  310873 320811091
================================================================================
  1   0.000000     10.0.1.3 -> 10.0.1.2     TCP 39035 > http-alt [SYN] Seq=0 Win=5840 Len=0 MSS=1460 TSV=7233456 TSER=0 WS=6
  2   0.000362     10.0.1.2 -> 10.0.1.3     TCP http-alt > 39035 [SYN, ACK] Seq=0 Ack=1 Win=14480 Len=0 MSS=1460 TSV=7287242 TSER=7233456 WS=6
  3   0.000388     10.0.1.3 -> 10.0.1.2     TCP 39035 > http-alt [ACK] Seq=1 Ack=1 Win=5888 Len=0 TSV=7233456 TSER=7287242
310863  25.606098     10.0.1.3 -> 10.0.1.2     TCP 39035 > http-alt [FIN, ACK] Seq=327 Ack=300293132 Win=2580480 Len=0 TSV=7239857 TSER=7293585
310864  25.606504     10.0.1.2 -> 10.0.1.3     TCP http-alt > 39035 [FIN, ACK] Seq=300293132 Ack=328 Win=15552 Len=0 TSV=7293644 TSER=7239857
================================================================================
IPv4 Conversations
Filter:<No Filter>
                                               |       <-      | |       ->      | |     Total     |
                                               | Frames  Bytes | | Frames  Bytes | | Frames  Bytes |
10.0.1.3             <-> 10.0.1.2              207399 313981473  103466   6829090  310865 320810563
================================================================================
  1   0.000000     10.0.1.3 -> 10.0.1.2     TCP 39037 > http-alt [SYN] Seq=0 Win=5840 Len=0 MSS=1460 TSV=7243751 TSER=0 WS=6
  2   0.000319     10.0.1.2 -> 10.0.1.3     TCP http-alt > 39037 [SYN, ACK] Seq=0 Ack=1 Win=14480 Len=0 MSS=1460 TSV=7297538 TSER=7243751 WS=6
  3   0.000345     10.0.1.3 -> 10.0.1.2     TCP 39037 > http-alt [ACK] Seq=1 Ack=1 Win=5888 Len=0 TSV=7243751 TSER=7297538
310781  25.615765     10.0.1.3 -> 10.0.1.2     TCP 39037 > http-alt [FIN, ACK] Seq=327 Ack=300293132 Win=2580480 Len=0 TSV=7250155 TSER=7303881
310782  25.616131     10.0.1.2 -> 10.0.1.3     TCP http-alt > 39037 [FIN, ACK] Seq=300293132 Ack=328 Win=15552 Len=0 TSV=7303942 TSER=7250155
================================================================================
IPv4 Conversations
Filter:<No Filter>
                                               |       <-      | |       ->      | |     Total     |
                                               | Frames  Bytes | | Frames  Bytes | | Frames  Bytes |
10.0.1.3             <-> 10.0.1.2              207421 313982925  103362   6822226  310783 320805151
================================================================================
  1   0.000000     10.0.1.3 -> 10.0.1.2     TCP 39039 > http-alt [SYN] Seq=0 Win=5840 Len=0 MSS=1460 TSV=7254148 TSER=0 WS=6
  2   0.000301     10.0.1.2 -> 10.0.1.3     TCP http-alt > 39039 [SYN, ACK] Seq=0 Ack=1 Win=14480 Len=0 MSS=1460 TSV=7307935 TSER=7254148 WS=6
  3   0.000324     10.0.1.3 -> 10.0.1.2     TCP 39039 > http-alt [ACK] Seq=1 Ack=1 Win=5888 Len=0 TSV=7254148 TSER=7307935
310761  25.620556     10.0.1.3 -> 10.0.1.2     TCP 39039 > http-alt [FIN, ACK] Seq=327 Ack=300293132 Win=2580480 Len=0 TSV=7260553 TSER=7314279
310762  25.620942     10.0.1.2 -> 10.0.1.3     TCP http-alt > 39039 [FIN, ACK] Seq=300293132 Ack=328 Win=15552 Len=0 TSV=7314341 TSER=7260553
================================================================================
IPv4 Conversations
Filter:<No Filter>
                                               |       <-      | |       ->      | |     Total     |
                                               | Frames  Bytes | | Frames  Bytes | | Frames  Bytes |
10.0.1.3             <-> 10.0.1.2              207411 313982265  103352   6821566  310763 320803831
================================================================================
  1   0.000000     10.0.1.3 -> 10.0.1.2     TCP 39041 > http-alt [SYN] Seq=0 Win=5840 Len=0 MSS=1460 TSV=7264393 TSER=0 WS=6
  2   0.000305     10.0.1.2 -> 10.0.1.3     TCP http-alt > 39041 [SYN, ACK] Seq=0 Ack=1 Win=14480 Len=0 MSS=1460 TSV=7318181 TSER=7264393 WS=6
  3   0.000329     10.0.1.3 -> 10.0.1.2     TCP 39041 > http-alt [ACK] Seq=1 Ack=1 Win=5888 Len=0 TSV=7264393 TSER=7318181
310624  25.611657     10.0.1.3 -> 10.0.1.2     TCP 39041 > http-alt [FIN, ACK] Seq=327 Ack=300293132 Win=2577472 Len=0 TSV=7270796 TSER=7324525
310625  25.612003     10.0.1.2 -> 10.0.1.3     TCP http-alt > 39041 [FIN, ACK] Seq=300293132 Ack=328 Win=15552 Len=0 TSV=7324585 TSER=7270796
================================================================================
IPv4 Conversations
Filter:<No Filter>
                                               |       <-      | |       ->      | |     Total     |
                                               | Frames  Bytes | | Frames  Bytes | | Frames  Bytes |
10.0.1.3             <-> 10.0.1.2              207389 313980813  103237   6813976  310626 320794789
================================================================================
  1   0.000000     10.0.1.3 -> 10.0.1.2     TCP 39044 > http-alt [SYN] Seq=0 Win=5840 Len=0 MSS=1460 TSV=7274646 TSER=0 WS=6
  2   0.000293     10.0.1.2 -> 10.0.1.3     TCP http-alt > 39044 [SYN, ACK] Seq=0 Ack=1 Win=14480 Len=0 MSS=1460 TSV=7328435 TSER=7274646 WS=6
  3   0.000315     10.0.1.3 -> 10.0.1.2     TCP 39044 > http-alt [ACK] Seq=1 Ack=1 Win=5888 Len=0 TSV=7274646 TSER=7328435
310922  25.616290     10.0.1.3 -> 10.0.1.2     TCP 39044 > http-alt [FIN, ACK] Seq=327 Ack=300293132 Win=2580480 Len=0 TSV=7281050 TSER=7334779
310923  25.616651     10.0.1.2 -> 10.0.1.3     TCP http-alt > 39044 [FIN, ACK] Seq=300293132 Ack=328 Win=15552 Len=0 TSV=7334840 TSER=7281050
================================================================================
IPv4 Conversations
Filter:<No Filter>
                                               |       <-      | |       ->      | |     Total     |
                                               | Frames  Bytes | | Frames  Bytes | | Frames  Bytes |
10.0.1.3             <-> 10.0.1.2              207485 313987149  103439   6827308  310924 320814457
================================================================================
  1   0.000000     10.0.1.3 -> 10.0.1.2     TCP 51456 > http-alt [SYN] Seq=0 Win=5840 Len=0 MSS=1460 TSV=7284933 TSER=0 WS=6
  2   0.000350     10.0.1.2 -> 10.0.1.3     TCP http-alt > 51456 [SYN, ACK] Seq=0 Ack=1 Win=14480 Len=0 MSS=1460 TSV=7338723 TSER=7284933 WS=6
  3   0.000371     10.0.1.3 -> 10.0.1.2     TCP 51456 > http-alt [ACK] Seq=1 Ack=1 Win=5888 Len=0 TSV=7284933 TSER=7338723
310750  25.606119     10.0.1.3 -> 10.0.1.2     TCP 51456 > http-alt [FIN, ACK] Seq=327 Ack=300293132 Win=2580480 Len=0 TSV=7291335 TSER=7345066
310751  25.606520     10.0.1.2 -> 10.0.1.3     TCP http-alt > 51456 [FIN, ACK] Seq=300293132 Ack=328 Win=15552 Len=0 TSV=7345125 TSER=7291335
================================================================================
IPv4 Conversations
Filter:<No Filter>
                                               |       <-      | |       ->      | |     Total     |
                                               | Frames  Bytes | | Frames  Bytes | | Frames  Bytes |
10.0.1.3             <-> 10.0.1.2              207399 313981473  103353   6821632  310752 320803105
================================================================================
  1   0.000000     10.0.1.3 -> 10.0.1.2     TCP 51458 > http-alt [SYN] Seq=0 Win=5840 Len=0 MSS=1460 TSV=7295206 TSER=0 WS=6
  2   0.000296     10.0.1.2 -> 10.0.1.3     TCP http-alt > 51458 [SYN, ACK] Seq=0 Ack=1 Win=14480 Len=0 MSS=1460 TSV=7348997 TSER=7295206 WS=6
  3   0.000318     10.0.1.3 -> 10.0.1.2     TCP 51458 > http-alt [ACK] Seq=1 Ack=1 Win=5888 Len=0 TSV=7295206 TSER=7348997
310874  25.609258     10.0.1.3 -> 10.0.1.2     TCP 51458 > http-alt [FIN, ACK] Seq=327 Ack=300293132 Win=2580480 Len=0 TSV=7301609 TSER=7355339
310875  25.609665     10.0.1.2 -> 10.0.1.3     TCP http-alt > 51458 [FIN, ACK] Seq=300293132 Ack=328 Win=15552 Len=0 TSV=7355400 TSER=7301609
================================================================================
IPv4 Conversations
Filter:<No Filter>
                                               |       <-      | |       ->      | |     Total     |
                                               | Frames  Bytes | | Frames  Bytes | | Frames  Bytes |
10.0.1.3             <-> 10.0.1.2              207445 313984509  103431   6826780  310876 320811289
================================================================================
  1   0.000000     10.0.1.3 -> 10.0.1.2     TCP 51462 > http-alt [SYN] Seq=0 Win=5840 Len=0 MSS=1460 TSV=7305482 TSER=0 WS=6
  2   0.000301     10.0.1.2 -> 10.0.1.3     TCP http-alt > 51462 [SYN, ACK] Seq=0 Ack=1 Win=14480 Len=0 MSS=1460 TSV=7359274 TSER=7305482 WS=6
  3   0.000326     10.0.1.3 -> 10.0.1.2     TCP 51462 > http-alt [ACK] Seq=1 Ack=1 Win=5888 Len=0 TSV=7305482 TSER=7359274
311235  25.615103     10.0.1.3 -> 10.0.1.2     TCP 51462 > http-alt [FIN, ACK] Seq=327 Ack=300293132 Win=2557184 Len=0 TSV=7311886 TSER=7365617
311236  25.615458     10.0.1.2 -> 10.0.1.3     TCP http-alt > 51462 [FIN, ACK] Seq=300293132 Ack=328 Win=15552 Len=0 TSV=7365678 TSER=7311886
================================================================================
IPv4 Conversations
Filter:<No Filter>
                                               |       <-      | |       ->      | |     Total     |
                                               | Frames  Bytes | | Frames  Bytes | | Frames  Bytes |
10.0.1.3             <-> 10.0.1.2              207396 313981275  103841   6853840  311237 320835115
================================================================================
  1   0.000000     10.0.1.3 -> 10.0.1.2     TCP 51464 > http-alt [SYN] Seq=0 Win=5840 Len=0 MSS=1460 TSV=7315778 TSER=0 WS=6
  2   0.000301     10.0.1.2 -> 10.0.1.3     TCP http-alt > 51464 [SYN, ACK] Seq=0 Ack=1 Win=14480 Len=0 MSS=1460 TSV=7369570 TSER=7315778 WS=6
  3   0.000323     10.0.1.3 -> 10.0.1.2     TCP 51464 > http-alt [ACK] Seq=1 Ack=1 Win=5888 Len=0 TSV=7315778 TSER=7369570
310688  25.617110     10.0.1.3 -> 10.0.1.2     TCP 51464 > http-alt [FIN, ACK] Seq=327 Ack=300293132 Win=2580480 Len=0 TSV=7322183 TSER=7375915
310689  25.617490     10.0.1.2 -> 10.0.1.3     TCP http-alt > 51464 [FIN, ACK] Seq=300293132 Ack=328 Win=15552 Len=0 TSV=7375975 TSER=7322183
================================================================================
IPv4 Conversations
Filter:<No Filter>
                                               |       <-      | |       ->      | |     Total     |
                                               | Frames  Bytes | | Frames  Bytes | | Frames  Bytes |
10.0.1.3             <-> 10.0.1.2              207397 313981341  103293   6817672  310690 320799013
================================================================================
  1   0.000000     10.0.1.3 -> 10.0.1.2     TCP 51466 > http-alt [SYN] Seq=0 Win=5840 Len=0 MSS=1460 TSV=7326061 TSER=0 WS=6
  2   0.000316     10.0.1.2 -> 10.0.1.3     TCP http-alt > 51466 [SYN, ACK] Seq=0 Ack=1 Win=14480 Len=0 MSS=1460 TSV=7379854 TSER=7326061 WS=6
  3   0.000342     10.0.1.3 -> 10.0.1.2     TCP 51466 > http-alt [ACK] Seq=1 Ack=1 Win=5888 Len=0 TSV=7326061 TSER=7379854
310714  25.609929     10.0.1.3 -> 10.0.1.2     TCP 51466 > http-alt [FIN, ACK] Seq=327 Ack=300293132 Win=2580480 Len=0 TSV=7332464 TSER=7386198
310715  25.610311     10.0.1.2 -> 10.0.1.3     TCP http-alt > 51466 [FIN, ACK] Seq=300293132 Ack=328 Win=15552 Len=0 TSV=7386257 TSER=7332464
================================================================================
IPv4 Conversations
Filter:<No Filter>
                                               |       <-      | |       ->      | |     Total     |
                                               | Frames  Bytes | | Frames  Bytes | | Frames  Bytes |
10.0.1.3             <-> 10.0.1.2              207401 313981605  103315   6819124  310716 320800729
================================================================================
