  1   0.000000     10.0.1.3 -> 10.0.1.2     TCP 52288 > http-alt [SYN] Seq=0 Win=5840 Len=0 MSS=1460 TSV=1555634 TSER=0 WS=6
  2   0.000338     10.0.1.2 -> 10.0.1.3     TCP http-alt > 52288 [SYN, ACK] Seq=0 Ack=1 Win=14480 Len=0 MSS=1460 TSV=1587648 TSER=1555634 WS=6
  3   0.000362     10.0.1.3 -> 10.0.1.2     TCP 52288 > http-alt [ACK] Seq=1 Ack=1 Win=5888 Len=0 TSV=1555634 TSER=1587648
361845  29.870348     10.0.1.3 -> 10.0.1.2     TCP 52288 > http-alt [FIN, ACK] Seq=327 Ack=350341957 Win=2580480 Len=0 TSV=1563101 TSER=1595057
361846  29.870768     10.0.1.2 -> 10.0.1.3     TCP http-alt > 52288 [FIN, ACK] Seq=350341957 Ack=328 Win=15552 Len=0 TSV=1595116 TSER=1563101
  1   0.000000     10.0.1.3 -> 10.0.1.2     TCP 52290 > http-alt [SYN] Seq=0 Win=5840 Len=0 MSS=1460 TSV=1570470 TSER=0 WS=6
  2   0.000338     10.0.1.2 -> 10.0.1.3     TCP http-alt > 52290 [SYN, ACK] Seq=0 Ack=1 Win=14480 Len=0 MSS=1460 TSV=1602486 TSER=1570470 WS=6
  3   0.000358     10.0.1.3 -> 10.0.1.2     TCP 52290 > http-alt [ACK] Seq=1 Ack=1 Win=5888 Len=0 TSV=1570470 TSER=1602486
358121  29.874649     10.0.1.3 -> 10.0.1.2     TCP 52290 > http-alt [FIN, ACK] Seq=327 Ack=350341957 Win=2580480 Len=0 TSV=1577938 TSER=1609895
358122  29.875023     10.0.1.2 -> 10.0.1.3     TCP http-alt > 52290 [FIN, ACK] Seq=350341957 Ack=328 Win=15552 Len=0 TSV=1609955 TSER=1577938
  1   0.000000     10.0.1.3 -> 10.0.1.2     TCP 42266 > http-alt [SYN] Seq=0 Win=5840 Len=0 MSS=1460 TSV=1584113 TSER=0 WS=6
  2   0.000303     10.0.1.2 -> 10.0.1.3     TCP http-alt > 42266 [SYN, ACK] Seq=0 Ack=1 Win=14480 Len=0 MSS=1460 TSV=1616130 TSER=1584113 WS=6
  3   0.000324     10.0.1.3 -> 10.0.1.2     TCP 42266 > http-alt [ACK] Seq=1 Ack=1 Win=5888 Len=0 TSV=1584113 TSER=1616130
345153  29.869093     10.0.1.3 -> 10.0.1.2     TCP 42266 > http-alt [FIN, ACK] Seq=327 Ack=350341957 Win=2580480 Len=0 TSV=1591580 TSER=1623537
345154  29.869471     10.0.1.2 -> 10.0.1.3     TCP http-alt > 42266 [FIN, ACK] Seq=350341957 Ack=328 Win=15552 Len=0 TSV=1623598 TSER=1591580
  1   0.000000     10.0.1.3 -> 10.0.1.2     TCP 42268 > http-alt [SYN] Seq=0 Win=5840 Len=0 MSS=1460 TSV=1597570 TSER=0 WS=6
  2   0.000300     10.0.1.2 -> 10.0.1.3     TCP http-alt > 42268 [SYN, ACK] Seq=0 Ack=1 Win=14480 Len=0 MSS=1460 TSV=1629588 TSER=1597570 WS=6
  3   0.000323     10.0.1.3 -> 10.0.1.2     TCP 42268 > http-alt [ACK] Seq=1 Ack=1 Win=5888 Len=0 TSV=1597570 TSER=1629588
356006  29.871853     10.0.1.3 -> 10.0.1.2     TCP 42268 > http-alt [FIN, ACK] Seq=327 Ack=350341957 Win=2580480 Len=0 TSV=1605038 TSER=1636996
356007  29.872225     10.0.1.2 -> 10.0.1.3     TCP http-alt > 42268 [FIN, ACK] Seq=350341957 Ack=328 Win=15552 Len=0 TSV=1637056 TSER=1605038
  1   0.000000     10.0.1.3 -> 10.0.1.2     TCP 42270 > http-alt [SYN] Seq=0 Win=5840 Len=0 MSS=1460 TSV=1611244 TSER=0 WS=6
  2   0.000320     10.0.1.2 -> 10.0.1.3     TCP http-alt > 42270 [SYN, ACK] Seq=0 Ack=1 Win=14480 Len=0 MSS=1460 TSV=1643263 TSER=1611244 WS=6
  3   0.000343     10.0.1.3 -> 10.0.1.2     TCP 42270 > http-alt [ACK] Seq=1 Ack=1 Win=5888 Len=0 TSV=1611244 TSER=1643263
331898  29.872291     10.0.1.3 -> 10.0.1.2     TCP 42270 > http-alt [FIN, ACK] Seq=327 Ack=350341957 Win=2580480 Len=0 TSV=1618712 TSER=1650672
331899  29.872636     10.0.1.2 -> 10.0.1.3     TCP http-alt > 42270 [FIN, ACK] Seq=350341957 Ack=328 Win=15552 Len=0 TSV=1650732 TSER=1618712
  1   0.000000     10.0.1.3 -> 10.0.1.2     TCP 42272 > http-alt [SYN] Seq=0 Win=5840 Len=0 MSS=1460 TSV=1624519 TSER=0 WS=6
  2   0.000301     10.0.1.2 -> 10.0.1.3     TCP http-alt > 42272 [SYN, ACK] Seq=0 Ack=1 Win=14480 Len=0 MSS=1460 TSV=1656539 TSER=1624519 WS=6
  3   0.000322     10.0.1.3 -> 10.0.1.2     TCP 42272 > http-alt [ACK] Seq=1 Ack=1 Win=5888 Len=0 TSV=1624520 TSER=1656539
361495  29.869629     10.0.1.3 -> 10.0.1.2     TCP 42272 > http-alt [FIN, ACK] Seq=327 Ack=350341957 Win=2580480 Len=0 TSV=1631987 TSER=1663947
361496  29.869999     10.0.1.2 -> 10.0.1.3     TCP http-alt > 42272 [FIN, ACK] Seq=350341957 Ack=328 Win=15552 Len=0 TSV=1664007 TSER=1631987
  1   0.000000     10.0.1.3 -> 10.0.1.2     TCP 42274 > http-alt [SYN] Seq=0 Win=5840 Len=0 MSS=1460 TSV=1638128 TSER=0 WS=6
  2   0.000300     10.0.1.2 -> 10.0.1.3     TCP http-alt > 42274 [SYN, ACK] Seq=0 Ack=1 Win=14480 Len=0 MSS=1460 TSV=1670149 TSER=1638128 WS=6
  3   0.000331     10.0.1.3 -> 10.0.1.2     TCP 42274 > http-alt [ACK] Seq=1 Ack=1 Win=5888 Len=0 TSV=1638128 TSER=1670149
361650  29.875239     10.0.1.3 -> 10.0.1.2     TCP 42274 > http-alt [FIN, ACK] Seq=327 Ack=350341957 Win=2560064 Len=0 TSV=1645597 TSER=1677559
361651  29.875574     10.0.1.2 -> 10.0.1.3     TCP http-alt > 42274 [FIN, ACK] Seq=350341957 Ack=328 Win=15552 Len=0 TSV=1677619 TSER=1645597
  1   0.000000     10.0.1.3 -> 10.0.1.2     TCP 39287 > http-alt [SYN] Seq=0 Win=5840 Len=0 MSS=1460 TSV=1653593 TSER=0 WS=6
  2   0.000374     10.0.1.2 -> 10.0.1.3     TCP http-alt > 39287 [SYN, ACK] Seq=0 Ack=1 Win=14480 Len=0 MSS=1460 TSV=1685615 TSER=1653593 WS=6
  3   0.000397     10.0.1.3 -> 10.0.1.2     TCP 39287 > http-alt [ACK] Seq=1 Ack=1 Win=5888 Len=0 TSV=1653593 TSER=1685615
356345  29.869090     10.0.1.3 -> 10.0.1.2     TCP 39287 > http-alt [FIN, ACK] Seq=327 Ack=350341957 Win=2580480 Len=0 TSV=1661060 TSER=1693023
356346  29.869458     10.0.1.2 -> 10.0.1.3     TCP http-alt > 39287 [FIN, ACK] Seq=350341957 Ack=328 Win=15552 Len=0 TSV=1693083 TSER=1661060
  1   0.000000     10.0.1.3 -> 10.0.1.2     TCP 39289 > http-alt [SYN] Seq=0 Win=5840 Len=0 MSS=1460 TSV=1668934 TSER=0 WS=6
  2   0.000363     10.0.1.2 -> 10.0.1.3     TCP http-alt > 39289 [SYN, ACK] Seq=0 Ack=1 Win=14480 Len=0 MSS=1460 TSV=1700957 TSER=1668934 WS=6
  3   0.000386     10.0.1.3 -> 10.0.1.2     TCP 39289 > http-alt [ACK] Seq=1 Ack=1 Win=5888 Len=0 TSV=1668934 TSER=1700957
361823  29.871346     10.0.1.3 -> 10.0.1.2     TCP 39289 > http-alt [FIN, ACK] Seq=327 Ack=350341957 Win=2560064 Len=0 TSV=1676402 TSER=1708366
361824  29.871704     10.0.1.2 -> 10.0.1.3     TCP http-alt > 39289 [FIN, ACK] Seq=350341957 Ack=328 Win=15552 Len=0 TSV=1708425 TSER=1676402
  1   0.000000     10.0.1.3 -> 10.0.1.2     TCP 39291 > http-alt [SYN] Seq=0 Win=5840 Len=0 MSS=1460 TSV=1682798 TSER=0 WS=6
  2   0.000352     10.0.1.2 -> 10.0.1.3     TCP http-alt > 39291 [SYN, ACK] Seq=0 Ack=1 Win=14480 Len=0 MSS=1460 TSV=1714822 TSER=1682798 WS=6
  3   0.000378     10.0.1.3 -> 10.0.1.2     TCP 39291 > http-alt [ACK] Seq=1 Ack=1 Win=5888 Len=0 TSV=1682798 TSER=1714822
351440  29.868221     10.0.1.3 -> 10.0.1.2     TCP 39291 > http-alt [FIN, ACK] Seq=327 Ack=350341957 Win=2568768 Len=0 TSV=1690265 TSER=1722230
351441  29.868594     10.0.1.2 -> 10.0.1.3     TCP http-alt > 39291 [FIN, ACK] Seq=350341957 Ack=328 Win=15552 Len=0 TSV=1722290 TSER=1690265
  1   0.000000     10.0.1.3 -> 10.0.1.2     TCP 39294 > http-alt [SYN] Seq=0 Win=5840 Len=0 MSS=1460 TSV=1696375 TSER=0 WS=6
  2   0.000272     10.0.1.2 -> 10.0.1.3     TCP http-alt > 39294 [SYN, ACK] Seq=0 Ack=1 Win=14480 Len=0 MSS=1460 TSV=1728400 TSER=1696375 WS=6
  3   0.000290     10.0.1.3 -> 10.0.1.2     TCP 39294 > http-alt [ACK] Seq=1 Ack=1 Win=5888 Len=0 TSV=1696375 TSER=1728400
360516  29.871480     10.0.1.3 -> 10.0.1.2     TCP 39294 > http-alt [FIN, ACK] Seq=327 Ack=350341957 Win=2580480 Len=0 TSV=1703843 TSER=1735809
360517  29.871852     10.0.1.2 -> 10.0.1.3     TCP http-alt > 39294 [FIN, ACK] Seq=350341957 Ack=328 Win=15552 Len=0 TSV=1735869 TSER=1703843
  1   0.000000     10.0.1.3 -> 10.0.1.2     TCP 39296 > http-alt [SYN] Seq=0 Win=5840 Len=0 MSS=1460 TSV=1710038 TSER=0 WS=6
  2   0.000307     10.0.1.2 -> 10.0.1.3     TCP http-alt > 39296 [SYN, ACK] Seq=0 Ack=1 Win=14480 Len=0 MSS=1460 TSV=1742064 TSER=1710038 WS=6
  3   0.000328     10.0.1.3 -> 10.0.1.2     TCP 39296 > http-alt [ACK] Seq=1 Ack=1 Win=5888 Len=0 TSV=1710038 TSER=1742064
335124  31.331824     10.0.1.3 -> 10.0.1.2     TCP 39296 > http-alt [FIN, ACK] Seq=327 Ack=350341957 Win=2580480 Len=0 TSV=1717871 TSER=1749836
335125  31.332193     10.0.1.2 -> 10.0.1.3     TCP http-alt > 39296 [FIN, ACK] Seq=350341957 Ack=328 Win=15552 Len=0 TSV=1749898 TSER=1717871
  1   0.000000     10.0.1.3 -> 10.0.1.2     TCP 39298 > http-alt [SYN] Seq=0 Win=5840 Len=0 MSS=1460 TSV=1723883 TSER=0 WS=6
  2   0.000317     10.0.1.2 -> 10.0.1.3     TCP http-alt > 39298 [SYN, ACK] Seq=0 Ack=1 Win=14480 Len=0 MSS=1460 TSV=1755911 TSER=1723883 WS=6
  3   0.000338     10.0.1.3 -> 10.0.1.2     TCP 39298 > http-alt [ACK] Seq=1 Ack=1 Win=5888 Len=0 TSV=1723883 TSER=1755911
320972  29.874116     10.0.1.3 -> 10.0.1.2     TCP 39298 > http-alt [FIN, ACK] Seq=327 Ack=350341957 Win=2580480 Len=0 TSV=1731352 TSER=1763319
320973  29.874469     10.0.1.2 -> 10.0.1.3     TCP http-alt > 39298 [FIN, ACK] Seq=350341957 Ack=328 Win=15552 Len=0 TSV=1763380 TSER=1731352
  1   0.000000     10.0.1.3 -> 10.0.1.2     TCP 40561 > http-alt [SYN] Seq=0 Win=5840 Len=0 MSS=1460 TSV=1737236 TSER=0 WS=6
  2   0.000350     10.0.1.2 -> 10.0.1.3     TCP http-alt > 40561 [SYN, ACK] Seq=0 Ack=1 Win=14480 Len=0 MSS=1460 TSV=1769264 TSER=1737236 WS=6
  3   0.000374     10.0.1.3 -> 10.0.1.2     TCP 40561 > http-alt [ACK] Seq=1 Ack=1 Win=5888 Len=0 TSV=1737236 TSER=1769264
326052  30.181724     10.0.1.3 -> 10.0.1.2     TCP 40561 > http-alt [FIN, ACK] Seq=327 Ack=350341957 Win=2580480 Len=0 TSV=1744781 TSER=1776755
326053  30.182083     10.0.1.2 -> 10.0.1.3     TCP http-alt > 40561 [FIN, ACK] Seq=350341957 Ack=328 Win=15552 Len=0 TSV=1776810 TSER=1744781
  1   0.000000     10.0.1.3 -> 10.0.1.2     TCP 40563 > http-alt [SYN] Seq=0 Win=5840 Len=0 MSS=1460 TSV=1750204 TSER=0 WS=6
  2   0.000317     10.0.1.2 -> 10.0.1.3     TCP http-alt > 40563 [SYN, ACK] Seq=0 Ack=1 Win=14480 Len=0 MSS=1460 TSV=1782234 TSER=1750204 WS=6
  3   0.000340     10.0.1.3 -> 10.0.1.2     TCP 40563 > http-alt [ACK] Seq=1 Ack=1 Win=5888 Len=0 TSV=1750204 TSER=1782234
345823  29.869737     10.0.1.3 -> 10.0.1.2     TCP 40563 > http-alt [FIN, ACK] Seq=327 Ack=350341957 Win=2580480 Len=0 TSV=1757671 TSER=1789642
345824  29.870092     10.0.1.2 -> 10.0.1.3     TCP http-alt > 40563 [FIN, ACK] Seq=350341957 Ack=328 Win=15552 Len=0 TSV=1789702 TSER=1757671
  1   0.000000     10.0.1.3 -> 10.0.1.2     TCP 40565 > http-alt [SYN] Seq=0 Win=5840 Len=0 MSS=1460 TSV=1763399 TSER=0 WS=6
  2   0.000319     10.0.1.2 -> 10.0.1.3     TCP http-alt > 40565 [SYN, ACK] Seq=0 Ack=1 Win=14480 Len=0 MSS=1460 TSV=1795430 TSER=1763399 WS=6
  3   0.000342     10.0.1.3 -> 10.0.1.2     TCP 40565 > http-alt [ACK] Seq=1 Ack=1 Win=5888 Len=0 TSV=1763399 TSER=1795430
346979  29.867259     10.0.1.3 -> 10.0.1.2     TCP 40565 > http-alt [FIN, ACK] Seq=327 Ack=350341957 Win=2580480 Len=0 TSV=1770866 TSER=1802838
346980  29.867636     10.0.1.2 -> 10.0.1.3     TCP http-alt > 40565 [FIN, ACK] Seq=350341957 Ack=328 Win=15552 Len=0 TSV=1802897 TSER=1770866
  1   0.000000     10.0.1.3 -> 10.0.1.2     TCP 40567 > http-alt [SYN] Seq=0 Win=5840 Len=0 MSS=1460 TSV=1776935 TSER=0 WS=6
  2   0.000302     10.0.1.2 -> 10.0.1.3     TCP http-alt > 40567 [SYN, ACK] Seq=0 Ack=1 Win=14480 Len=0 MSS=1460 TSV=1808966 TSER=1776935 WS=6
  3   0.000325     10.0.1.3 -> 10.0.1.2     TCP 40567 > http-alt [ACK] Seq=1 Ack=1 Win=5888 Len=0 TSV=1776935 TSER=1808966
361299  29.869084     10.0.1.3 -> 10.0.1.2     TCP 40567 > http-alt [FIN, ACK] Seq=327 Ack=350341957 Win=2580480 Len=0 TSV=1784402 TSER=1816374
361300  29.869459     10.0.1.2 -> 10.0.1.3     TCP http-alt > 40567 [FIN, ACK] Seq=350341957 Ack=328 Win=15552 Len=0 TSV=1816434 TSER=1784402
  3   1.033518     10.0.1.3 -> 10.0.1.2     TCP 40569 > http-alt [SYN] Seq=0 Win=5840 Len=0 MSS=1460 TSV=1790931 TSER=0 WS=6
  4   1.033888     10.0.1.2 -> 10.0.1.3     TCP http-alt > 40569 [SYN, ACK] Seq=0 Ack=1 Win=14480 Len=0 MSS=1460 TSV=1822963 TSER=1790931 WS=6
  5   1.033909     10.0.1.3 -> 10.0.1.2     TCP 40569 > http-alt [ACK] Seq=1 Ack=1 Win=5888 Len=0 TSV=1790931 TSER=1822963
360948  30.908883     10.0.1.3 -> 10.0.1.2     TCP 40569 > http-alt [FIN, ACK] Seq=327 Ack=350341957 Win=2580480 Len=0 TSV=1798400 TSER=1830372
360949  30.909271     10.0.1.2 -> 10.0.1.3     TCP http-alt > 40569 [FIN, ACK] Seq=350341957 Ack=328 Win=15552 Len=0 TSV=1830433 TSER=1798400
  1   0.000000     10.0.1.3 -> 10.0.1.2     TCP 45016 > http-alt [SYN] Seq=0 Win=5840 Len=0 MSS=1460 TSV=1804593 TSER=0 WS=6
  2   0.000296     10.0.1.2 -> 10.0.1.3     TCP http-alt > 45016 [SYN, ACK] Seq=0 Ack=1 Win=14480 Len=0 MSS=1460 TSV=1836627 TSER=1804593 WS=6
  3   0.000318     10.0.1.3 -> 10.0.1.2     TCP 45016 > http-alt [ACK] Seq=1 Ack=1 Win=5888 Len=0 TSV=1804593 TSER=1836627
361663  29.873119     10.0.1.3 -> 10.0.1.2     TCP 45016 > http-alt [FIN, ACK] Seq=327 Ack=350341957 Win=2565888 Len=0 TSV=1812062 TSER=1844036
361664  29.873468     10.0.1.2 -> 10.0.1.3     TCP http-alt > 45016 [FIN, ACK] Seq=350341957 Ack=328 Win=15552 Len=0 TSV=1844096 TSER=1812062
  1   0.000000     10.0.1.3 -> 10.0.1.2     TCP 45020 > http-alt [SYN] Seq=0 Win=5840 Len=0 MSS=1460 TSV=1818726 TSER=0 WS=6
  2   0.000297     10.0.1.2 -> 10.0.1.3     TCP http-alt > 45020 [SYN, ACK] Seq=0 Ack=1 Win=14480 Len=0 MSS=1460 TSV=1850761 TSER=1818726 WS=6
  3   0.000319     10.0.1.3 -> 10.0.1.2     TCP 45020 > http-alt [ACK] Seq=1 Ack=1 Win=5888 Len=0 TSV=1818726 TSER=1850761
361964  29.873181     10.0.1.3 -> 10.0.1.2     TCP 45020 > http-alt [FIN, ACK] Seq=327 Ack=350341957 Win=2565888 Len=0 TSV=1826194 TSER=1858169
361965  29.873582     10.0.1.2 -> 10.0.1.3     TCP http-alt > 45020 [FIN, ACK] Seq=350341957 Ack=328 Win=15552 Len=0 TSV=1858229 TSER=1826194
