  1   0.000000     10.0.1.3 -> 10.0.1.2     TCP 37544 > http-alt [SYN] Seq=0 Win=5840 Len=0 MSS=1460 TSV=1306903 TSER=0 WS=6
  2   0.000268     10.0.1.2 -> 10.0.1.3     TCP http-alt > 37544 [SYN, ACK] Seq=0 Ack=1 Win=14480 Len=0 MSS=1460 TSV=1338899 TSER=1306903 WS=6
  3   0.000289     10.0.1.3 -> 10.0.1.2     TCP 37544 > http-alt [ACK] Seq=1 Ack=1 Win=5888 Len=0 TSV=1306903 TSER=1338899
282737  25.611470     10.0.1.3 -> 10.0.1.2     TCP 37544 > http-alt [FIN, ACK] Seq=327 Ack=300293132 Win=2580480 Len=0 TSV=1313306 TSER=1345242
282738  25.611825     10.0.1.2 -> 10.0.1.3     TCP http-alt > 37544 [FIN, ACK] Seq=300293132 Ack=328 Win=15552 Len=0 TSV=1345302 TSER=1313306
  1   0.000000     10.0.1.3 -> 10.0.1.2     TCP 37546 > http-alt [SYN] Seq=0 Win=5840 Len=0 MSS=1460 TSV=1318628 TSER=0 WS=6
  2   0.000294     10.0.1.2 -> 10.0.1.3     TCP http-alt > 37546 [SYN, ACK] Seq=0 Ack=1 Win=14480 Len=0 MSS=1460 TSV=1350625 TSER=1318628 WS=6
  3   0.000317     10.0.1.3 -> 10.0.1.2     TCP 37546 > http-alt [ACK] Seq=1 Ack=1 Win=5888 Len=0 TSV=1318628 TSER=1350625
307221  25.609026     10.0.1.3 -> 10.0.1.2     TCP 37546 > http-alt [FIN, ACK] Seq=327 Ack=300293132 Win=2580480 Len=0 TSV=1325030 TSER=1356967
307222  25.609410     10.0.1.2 -> 10.0.1.3     TCP http-alt > 37546 [FIN, ACK] Seq=300293132 Ack=328 Win=15552 Len=0 TSV=1357028 TSER=1325030
  1   0.000000     10.0.1.3 -> 10.0.1.2     TCP 37548 > http-alt [SYN] Seq=0 Win=5840 Len=0 MSS=1460 TSV=1330728 TSER=0 WS=6
  2   0.000295     10.0.1.2 -> 10.0.1.3     TCP http-alt > 37548 [SYN, ACK] Seq=0 Ack=1 Win=14480 Len=0 MSS=1460 TSV=1362726 TSER=1330728 WS=6
  3   0.000319     10.0.1.3 -> 10.0.1.2     TCP 37548 > http-alt [ACK] Seq=1 Ack=1 Win=5888 Len=0 TSV=1330729 TSER=1362726
  1   0.000000     10.0.1.3 -> 10.0.1.2     TCP 37550 > http-alt [SYN] Seq=0 Win=5840 Len=0 MSS=1460 TSV=1346714 TSER=0 WS=6
  2   0.000373     10.0.1.2 -> 10.0.1.3     TCP http-alt > 37550 [SYN, ACK] Seq=0 Ack=1 Win=14480 Len=0 MSS=1460 TSV=1378713 TSER=1346714 WS=6
  3   0.000397     10.0.1.3 -> 10.0.1.2     TCP 37550 > http-alt [ACK] Seq=1 Ack=1 Win=5888 Len=0 TSV=1346715 TSER=1378713
306551  25.607390     10.0.1.3 -> 10.0.1.2     TCP 37550 > http-alt [FIN, ACK] Seq=327 Ack=300293132 Win=2580480 Len=0 TSV=1353116 TSER=1385057
306552  25.607769     10.0.1.2 -> 10.0.1.3     TCP http-alt > 37550 [FIN, ACK] Seq=300293132 Ack=328 Win=15552 Len=0 TSV=1385116 TSER=1353116
  1   0.000000     10.0.1.3 -> 10.0.1.2     TCP 47655 > http-alt [SYN] Seq=0 Win=5840 Len=0 MSS=1460 TSV=1358435 TSER=0 WS=6
  2   0.000292     10.0.1.2 -> 10.0.1.3     TCP http-alt > 47655 [SYN, ACK] Seq=0 Ack=1 Win=14480 Len=0 MSS=1460 TSV=1390435 TSER=1358435 WS=6
  3   0.000316     10.0.1.3 -> 10.0.1.2     TCP 47655 > http-alt [ACK] Seq=1 Ack=1 Win=5888 Len=0 TSV=1358436 TSER=1390435
249299  25.615055     10.0.1.3 -> 10.0.1.2     TCP 47655 > http-alt [FIN, ACK] Seq=327 Ack=300293132 Win=2580480 Len=0 TSV=1364839 TSER=1396779
249300  25.615445     10.0.1.2 -> 10.0.1.3     TCP http-alt > 47655 [FIN, ACK] Seq=300293132 Ack=328 Win=15552 Len=0 TSV=1396840 TSER=1364839
  1   0.000000     10.0.1.3 -> 10.0.1.2     TCP 47657 > http-alt [SYN] Seq=0 Win=5840 Len=0 MSS=1460 TSV=1373632 TSER=0 WS=6
  2   0.000294     10.0.1.2 -> 10.0.1.3     TCP http-alt > 47657 [SYN, ACK] Seq=0 Ack=1 Win=14480 Len=0 MSS=1460 TSV=1405633 TSER=1373632 WS=6
  3   0.000315     10.0.1.3 -> 10.0.1.2     TCP 47657 > http-alt [ACK] Seq=1 Ack=1 Win=5888 Len=0 TSV=1373632 TSER=1405633
298976  25.610987     10.0.1.3 -> 10.0.1.2     TCP 47657 > http-alt [FIN, ACK] Seq=327 Ack=300293132 Win=2580480 Len=0 TSV=1380035 TSER=1411977
298977  25.611364     10.0.1.2 -> 10.0.1.3     TCP http-alt > 47657 [FIN, ACK] Seq=300293132 Ack=328 Win=15552 Len=0 TSV=1412036 TSER=1380035
  1   0.000000     10.0.1.3 -> 10.0.1.2     TCP 47659 > http-alt [SYN] Seq=0 Win=5840 Len=0 MSS=1460 TSV=1385216 TSER=0 WS=6
  2   0.000349     10.0.1.2 -> 10.0.1.3     TCP http-alt > 47659 [SYN, ACK] Seq=0 Ack=1 Win=14480 Len=0 MSS=1460 TSV=1417218 TSER=1385216 WS=6
  3   0.000377     10.0.1.3 -> 10.0.1.2     TCP 47659 > http-alt [ACK] Seq=1 Ack=1 Win=5888 Len=0 TSV=1385216 TSER=1417218
304412  25.617413     10.0.1.3 -> 10.0.1.2     TCP 47659 > http-alt [FIN, ACK] Seq=327 Ack=300293132 Win=2580480 Len=0 TSV=1391620 TSER=1423562
304413  25.617748     10.0.1.2 -> 10.0.1.3     TCP http-alt > 47659 [FIN, ACK] Seq=300293132 Ack=328 Win=15552 Len=0 TSV=1423623 TSER=1391620
  1   0.000000     10.0.1.3 -> 10.0.1.2     TCP 47661 > http-alt [SYN] Seq=0 Win=5840 Len=0 MSS=1460 TSV=1397798 TSER=0 WS=6
  2   0.000361     10.0.1.2 -> 10.0.1.3     TCP http-alt > 47661 [SYN, ACK] Seq=0 Ack=1 Win=14480 Len=0 MSS=1460 TSV=1429801 TSER=1397798 WS=6
  3   0.000386     10.0.1.3 -> 10.0.1.2     TCP 47661 > http-alt [ACK] Seq=1 Ack=1 Win=5888 Len=0 TSV=1397798 TSER=1429801
307679  25.610181     10.0.1.3 -> 10.0.1.2     TCP 47661 > http-alt [FIN, ACK] Seq=327 Ack=300293132 Win=2580480 Len=0 TSV=1404200 TSER=1436144
307680  25.610527     10.0.1.2 -> 10.0.1.3     TCP http-alt > 47661 [FIN, ACK] Seq=300293132 Ack=328 Win=15552 Len=0 TSV=1436204 TSER=1404200
  1   0.000000     10.0.1.3 -> 10.0.1.2     TCP 47663 > http-alt [SYN] Seq=0 Win=5840 Len=0 MSS=1460 TSV=1409459 TSER=0 WS=6
  2   0.000279     10.0.1.2 -> 10.0.1.3     TCP http-alt > 47663 [SYN, ACK] Seq=0 Ack=1 Win=14480 Len=0 MSS=1460 TSV=1441463 TSER=1409459 WS=6
  3   0.000300     10.0.1.3 -> 10.0.1.2     TCP 47663 > http-alt [ACK] Seq=1 Ack=1 Win=5888 Len=0 TSV=1409459 TSER=1441463
305779  25.616280     10.0.1.3 -> 10.0.1.2     TCP 47663 > http-alt [FIN, ACK] Seq=327 Ack=300293132 Win=2580480 Len=0 TSV=1415863 TSER=1447807
305780  25.616603     10.0.1.2 -> 10.0.1.3     TCP http-alt > 47663 [FIN, ACK] Seq=300293132 Ack=328 Win=15552 Len=0 TSV=1447868 TSER=1415863
  1   0.000000     10.0.1.3 -> 10.0.1.2     TCP 47665 > http-alt [SYN] Seq=0 Win=5840 Len=0 MSS=1460 TSV=1423939 TSER=0 WS=6
  2   0.000302     10.0.1.2 -> 10.0.1.3     TCP http-alt > 47665 [SYN, ACK] Seq=0 Ack=1 Win=14480 Len=0 MSS=1460 TSV=1455944 TSER=1423939 WS=6
  3   0.000324     10.0.1.3 -> 10.0.1.2     TCP 47665 > http-alt [ACK] Seq=1 Ack=1 Win=5888 Len=0 TSV=1423939 TSER=1455944
280391  25.609805     10.0.1.3 -> 10.0.1.2     TCP 47665 > http-alt [FIN, ACK] Seq=327 Ack=300293132 Win=2580480 Len=0 TSV=1430342 TSER=1462288
280392  25.610166     10.0.1.2 -> 10.0.1.3     TCP http-alt > 47665 [FIN, ACK] Seq=300293132 Ack=328 Win=15552 Len=0 TSV=1462347 TSER=1430342
  1   0.000000     10.0.1.3 -> 10.0.1.2     TCP 36284 > http-alt [SYN] Seq=0 Win=5840 Len=0 MSS=1460 TSV=1435469 TSER=0 WS=6
  2   0.000283     10.0.1.2 -> 10.0.1.3     TCP http-alt > 36284 [SYN, ACK] Seq=0 Ack=1 Win=14480 Len=0 MSS=1460 TSV=1467475 TSER=1435469 WS=6
  3   0.000305     10.0.1.3 -> 10.0.1.2     TCP 36284 > http-alt [ACK] Seq=1 Ack=1 Win=5888 Len=0 TSV=1435469 TSER=1467475
304779  25.607121     10.0.1.3 -> 10.0.1.2     TCP 36284 > http-alt [FIN, ACK] Seq=327 Ack=300293132 Win=2580480 Len=0 TSV=1441871 TSER=1473818
304780  25.607508     10.0.1.2 -> 10.0.1.3     TCP http-alt > 36284 [FIN, ACK] Seq=300293132 Ack=328 Win=15552 Len=0 TSV=1473877 TSER=1441871
  1   0.000000     10.0.1.3 -> 10.0.1.2     TCP 36286 > http-alt [SYN] Seq=0 Win=5840 Len=0 MSS=1460 TSV=1447682 TSER=0 WS=6
  2   0.000294     10.0.1.2 -> 10.0.1.3     TCP http-alt > 36286 [SYN, ACK] Seq=0 Ack=1 Win=14480 Len=0 MSS=1460 TSV=1479689 TSER=1447682 WS=6
  3   0.000315     10.0.1.3 -> 10.0.1.2     TCP 36286 > http-alt [ACK] Seq=1 Ack=1 Win=5888 Len=0 TSV=1447682 TSER=1479689
281396  25.615555     10.0.1.3 -> 10.0.1.2     TCP 36286 > http-alt [FIN, ACK] Seq=327 Ack=300293132 Win=2580480 Len=0 TSV=1454086 TSER=1486033
281397  25.615871     10.0.1.2 -> 10.0.1.3     TCP http-alt > 36286 [FIN, ACK] Seq=300293132 Ack=328 Win=15552 Len=0 TSV=1486093 TSER=1454086
  1   0.000000     10.0.1.3 -> 10.0.1.2     TCP 36288 > http-alt [SYN] Seq=0 Win=5840 Len=0 MSS=1460 TSV=1459475 TSER=0 WS=6
  2   0.000318     10.0.1.2 -> 10.0.1.3     TCP http-alt > 36288 [SYN, ACK] Seq=0 Ack=1 Win=14480 Len=0 MSS=1460 TSV=1491483 TSER=1459475 WS=6
  3   0.000341     10.0.1.3 -> 10.0.1.2     TCP 36288 > http-alt [ACK] Seq=1 Ack=1 Win=5888 Len=0 TSV=1459475 TSER=1491483
299701  25.607431     10.0.1.3 -> 10.0.1.2     TCP 36288 > http-alt [FIN, ACK] Seq=327 Ack=300293132 Win=2580480 Len=0 TSV=1465877 TSER=1497826
299702  25.607798     10.0.1.2 -> 10.0.1.3     TCP http-alt > 36288 [FIN, ACK] Seq=300293132 Ack=328 Win=15552 Len=0 TSV=1497885 TSER=1465877
  1   0.000000     10.0.1.3 -> 10.0.1.2     TCP 36290 > http-alt [SYN] Seq=0 Win=5840 Len=0 MSS=1460 TSV=1471242 TSER=0 WS=6
  2   0.000299     10.0.1.2 -> 10.0.1.3     TCP http-alt > 36290 [SYN, ACK] Seq=0 Ack=1 Win=14480 Len=0 MSS=1460 TSV=1503250 TSER=1471242 WS=6
  3   0.000327     10.0.1.3 -> 10.0.1.2     TCP 36290 > http-alt [ACK] Seq=1 Ack=1 Win=5888 Len=0 TSV=1471242 TSER=1503250
303910  25.606556     10.0.1.3 -> 10.0.1.2     TCP 36290 > http-alt [FIN, ACK] Seq=327 Ack=300293132 Win=2580480 Len=0 TSV=1477644 TSER=1509594
303911  25.606954     10.0.1.2 -> 10.0.1.3     TCP http-alt > 36290 [FIN, ACK] Seq=300293132 Ack=328 Win=15552 Len=0 TSV=1509653 TSER=1477644
  1   0.000000     10.0.1.3 -> 10.0.1.2     TCP 36292 > http-alt [SYN] Seq=0 Win=5840 Len=0 MSS=1460 TSV=1483689 TSER=0 WS=6
  2   0.000272     10.0.1.2 -> 10.0.1.3     TCP http-alt > 36292 [SYN, ACK] Seq=0 Ack=1 Win=14480 Len=0 MSS=1460 TSV=1515698 TSER=1483689 WS=6
  3   0.000293     10.0.1.3 -> 10.0.1.2     TCP 36292 > http-alt [ACK] Seq=1 Ack=1 Win=5888 Len=0 TSV=1483689 TSER=1515698
287060  25.605182     10.0.1.3 -> 10.0.1.2     TCP 36292 > http-alt [FIN, ACK] Seq=327 Ack=300293132 Win=2580480 Len=0 TSV=1490090 TSER=1522040
287061  25.605587     10.0.1.2 -> 10.0.1.3     TCP http-alt > 36292 [FIN, ACK] Seq=300293132 Ack=328 Win=15552 Len=0 TSV=1522100 TSER=1490090
  1   0.000000     10.0.1.3 -> 10.0.1.2     TCP 36294 > http-alt [SYN] Seq=0 Win=5840 Len=0 MSS=1460 TSV=1495724 TSER=0 WS=6
  2   0.000269     10.0.1.2 -> 10.0.1.3     TCP http-alt > 36294 [SYN, ACK] Seq=0 Ack=1 Win=14480 Len=0 MSS=1460 TSV=1527735 TSER=1495724 WS=6
  3   0.000285     10.0.1.3 -> 10.0.1.2     TCP 36294 > http-alt [ACK] Seq=1 Ack=1 Win=5888 Len=0 TSV=1495724 TSER=1527735
308758  25.615149     10.0.1.3 -> 10.0.1.2     TCP 36294 > http-alt [FIN, ACK] Seq=327 Ack=300293132 Win=2580480 Len=0 TSV=1502128 TSER=1534078
308759  25.615538     10.0.1.2 -> 10.0.1.3     TCP http-alt > 36294 [FIN, ACK] Seq=300293132 Ack=328 Win=15552 Len=0 TSV=1534139 TSER=1502128
  1   0.000000     10.0.1.3 -> 10.0.1.2     TCP 52280 > http-alt [SYN] Seq=0 Win=5840 Len=0 MSS=1460 TSV=1507839 TSER=0 WS=6
  2   0.000296     10.0.1.2 -> 10.0.1.3     TCP http-alt > 52280 [SYN, ACK] Seq=0 Ack=1 Win=14480 Len=0 MSS=1460 TSV=1539850 TSER=1507839 WS=6
  3   0.000319     10.0.1.3 -> 10.0.1.2     TCP 52280 > http-alt [ACK] Seq=1 Ack=1 Win=5888 Len=0 TSV=1507839 TSER=1539850
309664  25.605938     10.0.1.3 -> 10.0.1.2     TCP 52280 > http-alt [FIN, ACK] Seq=327 Ack=300293132 Win=2580480 Len=0 TSV=1514240 TSER=1546192
309665  25.606457     10.0.1.2 -> 10.0.1.3     TCP http-alt > 52280 [FIN, ACK] Seq=300293132 Ack=328 Win=15552 Len=0 TSV=1546252 TSER=1514240
  1   0.000000     10.0.1.3 -> 10.0.1.2     TCP 52282 > http-alt [SYN] Seq=0 Win=5840 Len=0 MSS=1460 TSV=1519993 TSER=0 WS=6
  2   0.000337     10.0.1.2 -> 10.0.1.3     TCP http-alt > 52282 [SYN, ACK] Seq=0 Ack=1 Win=14480 Len=0 MSS=1460 TSV=1552005 TSER=1519993 WS=6
  3   0.000356     10.0.1.3 -> 10.0.1.2     TCP 52282 > http-alt [ACK] Seq=1 Ack=1 Win=5888 Len=0 TSV=1519993 TSER=1552005
297437  25.609528     10.0.1.3 -> 10.0.1.2     TCP 52282 > http-alt [FIN, ACK] Seq=327 Ack=300293132 Win=2580480 Len=0 TSV=1526395 TSER=1558348
297438  25.609900     10.0.1.2 -> 10.0.1.3     TCP http-alt > 52282 [FIN, ACK] Seq=300293132 Ack=328 Win=15552 Len=0 TSV=1558408 TSER=1526395
  1   0.000000     10.0.1.3 -> 10.0.1.2     TCP 52284 > http-alt [SYN] Seq=0 Win=5840 Len=0 MSS=1460 TSV=1532033 TSER=0 WS=6
  2   0.000278     10.0.1.2 -> 10.0.1.3     TCP http-alt > 52284 [SYN, ACK] Seq=0 Ack=1 Win=14480 Len=0 MSS=1460 TSV=1564046 TSER=1532033 WS=6
  3   0.000302     10.0.1.3 -> 10.0.1.2     TCP 52284 > http-alt [ACK] Seq=1 Ack=1 Win=5888 Len=0 TSV=1532033 TSER=1564046
295192  25.601404     10.0.1.3 -> 10.0.1.2     TCP 52284 > http-alt [FIN, ACK] Seq=327 Ack=300293132 Win=2580480 Len=0 TSV=1538433 TSER=1570387
295193  25.601755     10.0.1.2 -> 10.0.1.3     TCP http-alt > 52284 [FIN, ACK] Seq=300293132 Ack=328 Win=15552 Len=0 TSV=1570446 TSER=1538433
  1   0.000000     10.0.1.3 -> 10.0.1.2     TCP 52286 > http-alt [SYN] Seq=0 Win=5840 Len=0 MSS=1460 TSV=1544090 TSER=0 WS=6
  2   0.000400     10.0.1.2 -> 10.0.1.3     TCP http-alt > 52286 [SYN, ACK] Seq=0 Ack=1 Win=14480 Len=0 MSS=1460 TSV=1576104 TSER=1544090 WS=6
  3   0.000420     10.0.1.3 -> 10.0.1.2     TCP 52286 > http-alt [ACK] Seq=1 Ack=1 Win=5888 Len=0 TSV=1544090 TSER=1576104
299054  25.607840     10.0.1.3 -> 10.0.1.2     TCP 52286 > http-alt [FIN, ACK] Seq=327 Ack=300293132 Win=2580480 Len=0 TSV=1550492 TSER=1582446
299055  25.608198     10.0.1.2 -> 10.0.1.3     TCP http-alt > 52286 [FIN, ACK] Seq=300293132 Ack=328 Win=15552 Len=0 TSV=1582506 TSER=1550492
