  1   0.000000     10.0.1.3 -> 10.0.1.2     TCP 51468 > http-alt [SYN] Seq=0 Win=5840 Len=0 MSS=1460 TSV=7336344 TSER=0 WS=6
  2   0.000305     10.0.1.2 -> 10.0.1.3     TCP http-alt > 51468 [SYN, ACK] Seq=0 Ack=1 Win=14480 Len=0 MSS=1460 TSV=7390138 TSER=7336344 WS=6
  3   0.000327     10.0.1.3 -> 10.0.1.2     TCP 51468 > http-alt [ACK] Seq=1 Ack=1 Win=5888 Len=0 TSV=7336344 TSER=7390138
362550  29.874958     10.0.1.3 -> 10.0.1.2     TCP 51468 > http-alt [FIN, ACK] Seq=327 Ack=350341957 Win=2580480 Len=0 TSV=7343812 TSER=7397547
362551  29.875343     10.0.1.2 -> 10.0.1.3     TCP http-alt > 51468 [FIN, ACK] Seq=350341957 Ack=328 Win=15552 Len=0 TSV=7397607 TSER=7343812
================================================================================
IPv4 Conversations
Filter:<No Filter>
                                               |       <-      | |       ->      | |     Total     |
                                               | Frames  Bytes | | Frames  Bytes | | Frames  Bytes |
10.0.1.3             <-> 10.0.1.2              242019 366315218  120533   7955512  362552 374270730
================================================================================
  1   0.000000     10.0.1.3 -> 10.0.1.2     TCP 51471 > http-alt [SYN] Seq=0 Win=5840 Len=0 MSS=1460 TSV=7348045 TSER=0 WS=6
  2   0.000281     10.0.1.2 -> 10.0.1.3     TCP http-alt > 51471 [SYN, ACK] Seq=0 Ack=1 Win=14480 Len=0 MSS=1460 TSV=7401840 TSER=7348045 WS=6
  3   0.000300     10.0.1.3 -> 10.0.1.2     TCP 51471 > http-alt [ACK] Seq=1 Ack=1 Win=5888 Len=0 TSV=7348045 TSER=7401840
361973  29.870381     10.0.1.3 -> 10.0.1.2     TCP 51471 > http-alt [FIN, ACK] Seq=327 Ack=350341957 Win=2580480 Len=0 TSV=7355513 TSER=7409248
361974  29.870794     10.0.1.2 -> 10.0.1.3     TCP http-alt > 51471 [FIN, ACK] Seq=350341957 Ack=328 Win=15552 Len=0 TSV=7409308 TSER=7355513
================================================================================
IPv4 Conversations
Filter:<No Filter>
                                               |       <-      | |       ->      | |     Total     |
                                               | Frames  Bytes | | Frames  Bytes | | Frames  Bytes |
10.0.1.3             <-> 10.0.1.2              241959 366311258  120016   7921390  361975 374232648
================================================================================
  1   0.000000     10.0.1.3 -> 10.0.1.2     TCP 33800 > http-alt [SYN] Seq=0 Win=5840 Len=0 MSS=1460 TSV=7359689 TSER=0 WS=6
  2   0.000319     10.0.1.2 -> 10.0.1.3     TCP http-alt > 33800 [SYN, ACK] Seq=0 Ack=1 Win=14480 Len=0 MSS=1460 TSV=7413485 TSER=7359689 WS=6
  3   0.000345     10.0.1.3 -> 10.0.1.2     TCP 33800 > http-alt [ACK] Seq=1 Ack=1 Win=5888 Len=0 TSV=7359689 TSER=7413485
362590  29.868863     10.0.1.3 -> 10.0.1.2     TCP 33800 > http-alt [FIN, ACK] Seq=327 Ack=350341957 Win=2580480 Len=0 TSV=7367157 TSER=7420893
362591  29.869223     10.0.1.2 -> 10.0.1.3     TCP http-alt > 33800 [FIN, ACK] Seq=350341957 Ack=328 Win=15552 Len=0 TSV=7420953 TSER=7367157
================================================================================
IPv4 Conversations
Filter:<No Filter>
                                               |       <-      | |       ->      | |     Total     |
                                               | Frames  Bytes | | Frames  Bytes | | Frames  Bytes |
10.0.1.3             <-> 10.0.1.2              241966 366311720  120626   7961650  362592 374273370
================================================================================
  1   0.000000     10.0.1.3 -> 10.0.1.2     TCP 33802 > http-alt [SYN] Seq=0 Win=5840 Len=0 MSS=1460 TSV=7371376 TSER=0 WS=6
  2   0.000376     10.0.1.2 -> 10.0.1.3     TCP http-alt > 33802 [SYN, ACK] Seq=0 Ack=1 Win=14480 Len=0 MSS=1460 TSV=7425173 TSER=7371376 WS=6
  3   0.000397     10.0.1.3 -> 10.0.1.2     TCP 33802 > http-alt [ACK] Seq=1 Ack=1 Win=5888 Len=0 TSV=7371376 TSER=7425173
362622  29.879552     10.0.1.3 -> 10.0.1.2     TCP 33802 > http-alt [FIN, ACK] Seq=327 Ack=350341957 Win=2580480 Len=0 TSV=7378846 TSER=7432582
362623  29.879928     10.0.1.2 -> 10.0.1.3     TCP http-alt > 33802 [FIN, ACK] Seq=350341957 Ack=328 Win=15552 Len=0 TSV=7432643 TSER=7378846
================================================================================
IPv4 Conversations
Filter:<No Filter>
                                               |       <-      | |       ->      | |     Total     |
                                               | Frames  Bytes | | Frames  Bytes | | Frames  Bytes |
10.0.1.3             <-> 10.0.1.2              241961 366311390  120663   7964092  362624 374275482
================================================================================
  1   0.000000     10.0.1.3 -> 10.0.1.2     TCP 33806 > http-alt [SYN] Seq=0 Win=5840 Len=0 MSS=1460 TSV=7383030 TSER=0 WS=6
  2   0.000293     10.0.1.2 -> 10.0.1.3     TCP http-alt > 33806 [SYN, ACK] Seq=0 Ack=1 Win=14480 Len=0 MSS=1460 TSV=7436827 TSER=7383030 WS=6
  3   0.000318     10.0.1.3 -> 10.0.1.2     TCP 33806 > http-alt [ACK] Seq=1 Ack=1 Win=5888 Len=0 TSV=7383030 TSER=7436827
362693  29.875683     10.0.1.3 -> 10.0.1.2     TCP 33806 > http-alt [FIN, ACK] Seq=327 Ack=350341957 Win=2580480 Len=0 TSV=7390499 TSER=7444236
362694  29.876036     10.0.1.2 -> 10.0.1.3     TCP http-alt > 33806 [FIN, ACK] Seq=350341957 Ack=328 Win=15552 Len=0 TSV=7444296 TSER=7390499
================================================================================
IPv4 Conversations
Filter:<No Filter>
                                               |       <-      | |       ->      | |     Total     |
                                               | Frames  Bytes | | Frames  Bytes | | Frames  Bytes |
10.0.1.3             <-> 10.0.1.2              242003 366314162  120692   7966006  362695 374280168
================================================================================
  1   0.000000     10.0.1.3 -> 10.0.1.2     TCP 33808 > http-alt [SYN] Seq=0 Win=5840 Len=0 MSS=1460 TSV=7394729 TSER=0 WS=6
  2   0.000318     10.0.1.2 -> 10.0.1.3     TCP http-alt > 33808 [SYN, ACK] Seq=0 Ack=1 Win=14480 Len=0 MSS=1460 TSV=7448528 TSER=7394729 WS=6
  3   0.000341     10.0.1.3 -> 10.0.1.2     TCP 33808 > http-alt [ACK] Seq=1 Ack=1 Win=5888 Len=0 TSV=7394729 TSER=7448528
362681  29.876100     10.0.1.3 -> 10.0.1.2     TCP 33808 > http-alt [FIN, ACK] Seq=327 Ack=350341957 Win=2580480 Len=0 TSV=7402199 TSER=7455938
362682  29.876456     10.0.1.2 -> 10.0.1.3     TCP http-alt > 33808 [FIN, ACK] Seq=350341957 Ack=328 Win=15552 Len=0 TSV=7455997 TSER=7402199
================================================================================
IPv4 Conversations
Filter:<No Filter>
                                               |       <-      | |       ->      | |     Total     |
                                               | Frames  Bytes | | Frames  Bytes | | Frames  Bytes |
10.0.1.3             <-> 10.0.1.2              241989 366313238  120694   7966138  362683 374279376
================================================================================
  1   0.000000     10.0.1.3 -> 10.0.1.2     TCP 33810 > http-alt [SYN] Seq=0 Win=5840 Len=0 MSS=1460 TSV=7406390 TSER=0 WS=6
  2   0.000302     10.0.1.2 -> 10.0.1.3     TCP http-alt > 33810 [SYN, ACK] Seq=0 Ack=1 Win=14480 Len=0 MSS=1460 TSV=7460189 TSER=7406390 WS=6
  3   0.000326     10.0.1.3 -> 10.0.1.2     TCP 33810 > http-alt [ACK] Seq=1 Ack=1 Win=5888 Len=0 TSV=7406391 TSER=7460189
362573  29.876232     10.0.1.3 -> 10.0.1.2     TCP 33810 > http-alt [FIN, ACK] Seq=327 Ack=350341957 Win=2580480 Len=0 TSV=7413859 TSER=7467598
362574  29.876623     10.0.1.2 -> 10.0.1.3     TCP http-alt > 33810 [FIN, ACK] Seq=350341957 Ack=328 Win=15552 Len=0 TSV=7467659 TSER=7413859
================================================================================
IPv4 Conversations
Filter:<No Filter>
                                               |       <-      | |       ->      | |     Total     |
                                               | Frames  Bytes | | Frames  Bytes | | Frames  Bytes |
10.0.1.3             <-> 10.0.1.2              241970 366311984  120605   7960264  362575 374272248
================================================================================
  1   0.000000     10.0.1.3 -> 10.0.1.2     TCP 33812 > http-alt [SYN] Seq=0 Win=5840 Len=0 MSS=1460 TSV=7418100 TSER=0 WS=6
  2   0.000283     10.0.1.2 -> 10.0.1.3     TCP http-alt > 33812 [SYN, ACK] Seq=0 Ack=1 Win=14480 Len=0 MSS=1460 TSV=7471900 TSER=7418100 WS=6
  3   0.000309     10.0.1.3 -> 10.0.1.2     TCP 33812 > http-alt [ACK] Seq=1 Ack=1 Win=5888 Len=0 TSV=7418100 TSER=7471900
362560  29.868639     10.0.1.3 -> 10.0.1.2     TCP 33812 > http-alt [FIN, ACK] Seq=327 Ack=350341957 Win=2580480 Len=0 TSV=7425567 TSER=7479309
362561  29.869032     10.0.1.2 -> 10.0.1.3     TCP http-alt > 33812 [FIN, ACK] Seq=350341957 Ack=328 Win=15552 Len=0 TSV=7479368 TSER=7425567
================================================================================
IPv4 Conversations
Filter:<No Filter>
                                               |       <-      | |       ->      | |     Total     |
                                               | Frames  Bytes | | Frames  Bytes | | Frames  Bytes |
10.0.1.3             <-> 10.0.1.2              241990 366313304  120572   7958086  362562 374271390
================================================================================
  1   0.000000     10.0.1.3 -> 10.0.1.2     TCP 41557 > http-alt [SYN] Seq=0 Win=5840 Len=0 MSS=1460 TSV=7429772 TSER=0 WS=6
  2   0.000305     10.0.1.2 -> 10.0.1.3     TCP http-alt > 41557 [SYN, ACK] Seq=0 Ack=1 Win=14480 Len=0 MSS=1460 TSV=7483573 TSER=7429772 WS=6
  3   0.000327     10.0.1.3 -> 10.0.1.2     TCP 41557 > http-alt [ACK] Seq=1 Ack=1 Win=5888 Len=0 TSV=7429772 TSER=7483573
362494  29.868220     10.0.1.3 -> 10.0.1.2     TCP 41557 > http-alt [FIN, ACK] Seq=327 Ack=350341957 Win=2580480 Len=0 TSV=7437239 TSER=7490981
362495  29.868601     10.0.1.2 -> 10.0.1.3     TCP http-alt > 41557 [FIN, ACK] Seq=350341957 Ack=328 Win=15552 Len=0 TSV=7491040 TSER=7437239
================================================================================
IPv4 Conversations
Filter:<No Filter>
                                               |       <-      | |       ->      | |     Total     |
                                               | Frames  Bytes | | Frames  Bytes | | Frames  Bytes |
10.0.1.3             <-> 10.0.1.2              241962 366311456  120534   7955578  362496 374267034
================================================================================
  1   0.000000     10.0.1.3 -> 10.0.1.2     TCP 41559 > http-alt [SYN] Seq=0 Win=5840 Len=0 MSS=1460 TSV=7441442 TSER=0 WS=6
  2   0.000319     10.0.1.2 -> 10.0.1.3     TCP http-alt > 41559 [SYN, ACK] Seq=0 Ack=1 Win=14480 Len=0 MSS=1460 TSV=7495243 TSER=7441442 WS=6
  3   0.000342     10.0.1.3 -> 10.0.1.2     TCP 41559 > http-alt [ACK] Seq=1 Ack=1 Win=5888 Len=0 TSV=7441442 TSER=7495243
363047  29.870922     10.0.1.3 -> 10.0.1.2     TCP 41559 > http-alt [FIN, ACK] Seq=327 Ack=350341957 Win=2563008 Len=0 TSV=7448910 TSER=7502653
363048  29.871329     10.0.1.2 -> 10.0.1.3     TCP http-alt > 41559 [FIN, ACK] Seq=350341957 Ack=328 Win=15552 Len=0 TSV=7502712 TSER=7448910
================================================================================
IPv4 Conversations
Filter:<No Filter>
                                               |       <-      | |       ->      | |     Total     |
                                               | Frames  Bytes | | Frames  Bytes | | Frames  Bytes |
10.0.1.3             <-> 10.0.1.2              241976 366312380  121073   7991152  363049 374303532
================================================================================
  1   0.000000     10.0.1.3 -> 10.0.1.2     TCP 41563 > http-alt [SYN] Seq=0 Win=5840 Len=0 MSS=1460 TSV=7453185 TSER=0 WS=6
  2   0.000262     10.0.1.2 -> 10.0.1.3     TCP http-alt > 41563 [SYN, ACK] Seq=0 Ack=1 Win=14480 Len=0 MSS=1460 TSV=7506987 TSER=7453185 WS=6
  3   0.000285     10.0.1.3 -> 10.0.1.2     TCP 41563 > http-alt [ACK] Seq=1 Ack=1 Win=5888 Len=0 TSV=7453185 TSER=7506987
362695  29.868676     10.0.1.3 -> 10.0.1.2     TCP 41563 > http-alt [FIN, ACK] Seq=327 Ack=350341957 Win=2580480 Len=0 TSV=7460652 TSER=7514397
362696  29.869086     10.0.1.2 -> 10.0.1.3     TCP http-alt > 41563 [FIN, ACK] Seq=350341957 Ack=328 Win=15552 Len=0 TSV=7514455 TSER=7460652
================================================================================
IPv4 Conversations
Filter:<No Filter>
                                               |       <-      | |       ->      | |     Total     |
                                               | Frames  Bytes | | Frames  Bytes | | Frames  Bytes |
10.0.1.3             <-> 10.0.1.2              241961 366311390  120736   7968910  362697 374280300
================================================================================
  1   0.000000     10.0.1.3 -> 10.0.1.2     TCP 41565 > http-alt [SYN] Seq=0 Win=5840 Len=0 MSS=1460 TSV=7464864 TSER=0 WS=6
  2   0.000301     10.0.1.2 -> 10.0.1.3     TCP http-alt > 41565 [SYN, ACK] Seq=0 Ack=1 Win=14480 Len=0 MSS=1460 TSV=7518667 TSER=7464864 WS=6
  3   0.000326     10.0.1.3 -> 10.0.1.2     TCP 41565 > http-alt [ACK] Seq=1 Ack=1 Win=5888 Len=0 TSV=7464864 TSER=7518667
363057  29.886434     10.0.1.3 -> 10.0.1.2     TCP 41565 > http-alt [FIN, ACK] Seq=327 Ack=350341957 Win=2560064 Len=0 TSV=7472335 TSER=7526076
363058  29.886832     10.0.1.2 -> 10.0.1.3     TCP http-alt > 41565 [FIN, ACK] Seq=350341957 Ack=328 Win=15552 Len=0 TSV=7526139 TSER=7472335
================================================================================
IPv4 Conversations
Filter:<No Filter>
                                               |       <-      | |       ->      | |     Total     |
                                               | Frames  Bytes | | Frames  Bytes | | Frames  Bytes |
10.0.1.3             <-> 10.0.1.2              241957 366311126  121102   7993066  363059 374304192
================================================================================
  1   0.000000     10.0.1.3 -> 10.0.1.2     TCP 41567 > http-alt [SYN] Seq=0 Win=5840 Len=0 MSS=1460 TSV=7476563 TSER=0 WS=6
  2   0.000320     10.0.1.2 -> 10.0.1.3     TCP http-alt > 41567 [SYN, ACK] Seq=0 Ack=1 Win=14480 Len=0 MSS=1460 TSV=7530368 TSER=7476563 WS=6
  3   0.000346     10.0.1.3 -> 10.0.1.2     TCP 41567 > http-alt [ACK] Seq=1 Ack=1 Win=5888 Len=0 TSV=7476563 TSER=7530368
362124  29.877101     10.0.1.3 -> 10.0.1.2     TCP 41567 > http-alt [FIN, ACK] Seq=327 Ack=350341957 Win=2580480 Len=0 TSV=7484032 TSER=7537777
362125  29.877463     10.0.1.2 -> 10.0.1.3     TCP http-alt > 41567 [FIN, ACK] Seq=350341957 Ack=328 Win=15552 Len=0 TSV=7537837 TSER=7484032
================================================================================
IPv4 Conversations
Filter:<No Filter>
                                               |       <-      | |       ->      | |     Total     |
                                               | Frames  Bytes | | Frames  Bytes | | Frames  Bytes |
10.0.1.3             <-> 10.0.1.2              241960 366311324  120166   7931290  362126 374242614
================================================================================
  1   0.000000     10.0.1.3 -> 10.0.1.2     TCP 41569 > http-alt [SYN] Seq=0 Win=5840 Len=0 MSS=1460 TSV=7488251 TSER=0 WS=6
  2   0.000306     10.0.1.2 -> 10.0.1.3     TCP http-alt > 41569 [SYN, ACK] Seq=0 Ack=1 Win=14480 Len=0 MSS=1460 TSV=7542056 TSER=7488251 WS=6
  3   0.000329     10.0.1.3 -> 10.0.1.2     TCP 41569 > http-alt [ACK] Seq=1 Ack=1 Win=5888 Len=0 TSV=7488251 TSER=7542056
362575  29.877382     10.0.1.3 -> 10.0.1.2     TCP 41569 > http-alt [FIN, ACK] Seq=327 Ack=350341957 Win=2580480 Len=0 TSV=7495720 TSER=7549465
362576  29.877764     10.0.1.2 -> 10.0.1.3     TCP http-alt > 41569 [FIN, ACK] Seq=350341957 Ack=328 Win=15552 Len=0 TSV=7549526 TSER=7495720
================================================================================
IPv4 Conversations
Filter:<No Filter>
                                               |       <-      | |       ->      | |     Total     |
                                               | Frames  Bytes | | Frames  Bytes | | Frames  Bytes |
10.0.1.3             <-> 10.0.1.2              241982 366312776  120595   7959604  362577 374272380
================================================================================
  1   0.000000     10.0.1.3 -> 10.0.1.2     TCP 41571 > http-alt [SYN] Seq=0 Win=5840 Len=0 MSS=1460 TSV=7499949 TSER=0 WS=6
  2   0.000304     10.0.1.2 -> 10.0.1.3     TCP http-alt > 41571 [SYN, ACK] Seq=0 Ack=1 Win=14480 Len=0 MSS=1460 TSV=7553755 TSER=7499949 WS=6
  3   0.000326     10.0.1.3 -> 10.0.1.2     TCP 41571 > http-alt [ACK] Seq=1 Ack=1 Win=5888 Len=0 TSV=7499949 TSER=7553755
362708  29.875648     10.0.1.3 -> 10.0.1.2     TCP 41571 > http-alt [FIN, ACK] Seq=327 Ack=350341957 Win=2580480 Len=0 TSV=7507418 TSER=7561165
362709  29.876061     10.0.1.2 -> 10.0.1.3     TCP http-alt > 41571 [FIN, ACK] Seq=350341957 Ack=328 Win=15552 Len=0 TSV=7561224 TSER=7507418
================================================================================
IPv4 Conversations
Filter:<No Filter>
                                               |       <-      | |       ->      | |     Total     |
                                               | Frames  Bytes | | Frames  Bytes | | Frames  Bytes |
10.0.1.3             <-> 10.0.1.2              241998 366313832  120712   7967326  362710 374281158
================================================================================
  1   0.000000     10.0.1.3 -> 10.0.1.2     TCP 60275 > http-alt [SYN] Seq=0 Win=5840 Len=0 MSS=1460 TSV=7511633 TSER=0 WS=6
  2   0.000306     10.0.1.2 -> 10.0.1.3     TCP http-alt > 60275 [SYN, ACK] Seq=0 Ack=1 Win=14480 Len=0 MSS=1460 TSV=7565440 TSER=7511633 WS=6
  3   0.000329     10.0.1.3 -> 10.0.1.2     TCP 60275 > http-alt [ACK] Seq=1 Ack=1 Win=5888 Len=0 TSV=7511634 TSER=7565440
362768  29.876511     10.0.1.3 -> 10.0.1.2     TCP 60275 > http-alt [FIN, ACK] Seq=327 Ack=350341957 Win=2580480 Len=0 TSV=7519103 TSER=7572851
362769  29.876923     10.0.1.2 -> 10.0.1.3     TCP http-alt > 60275 [FIN, ACK] Seq=350341957 Ack=328 Win=15552 Len=0 TSV=7572910 TSER=7519103
================================================================================
IPv4 Conversations
Filter:<No Filter>
                                               |       <-      | |       ->      | |     Total     |
                                               | Frames  Bytes | | Frames  Bytes | | Frames  Bytes |
10.0.1.3             <-> 10.0.1.2              242055 366317594  120715   7967524  362770 374285118
================================================================================
  1   0.000000     10.0.1.3 -> 10.0.1.2     TCP 60277 > http-alt [SYN] Seq=0 Win=5840 Len=0 MSS=1460 TSV=7523318 TSER=0 WS=6
  2   0.000287     10.0.1.2 -> 10.0.1.3     TCP http-alt > 60277 [SYN, ACK] Seq=0 Ack=1 Win=14480 Len=0 MSS=1460 TSV=7577126 TSER=7523318 WS=6
  3   0.000309     10.0.1.3 -> 10.0.1.2     TCP 60277 > http-alt [ACK] Seq=1 Ack=1 Win=5888 Len=0 TSV=7523318 TSER=7577126
362495  29.877963     10.0.1.3 -> 10.0.1.2     TCP 60277 > http-alt [FIN, ACK] Seq=327 Ack=350341957 Win=2580480 Len=0 TSV=7530788 TSER=7584536
362496  29.878358     10.0.1.2 -> 10.0.1.3     TCP http-alt > 60277 [FIN, ACK] Seq=350341957 Ack=328 Win=15552 Len=0 TSV=7584596 TSER=7530788
================================================================================
IPv4 Conversations
Filter:<No Filter>
                                               |       <-      | |       ->      | |     Total     |
                                               | Frames  Bytes | | Frames  Bytes | | Frames  Bytes |
10.0.1.3             <-> 10.0.1.2              241963 366311522  120534   7955578  362497 374267100
================================================================================
  1   0.000000     10.0.1.3 -> 10.0.1.2     TCP 60281 > http-alt [SYN] Seq=0 Win=5840 Len=0 MSS=1460 TSV=7535000 TSER=0 WS=6
  2   0.000298     10.0.1.2 -> 10.0.1.3     TCP http-alt > 60281 [SYN, ACK] Seq=0 Ack=1 Win=14480 Len=0 MSS=1460 TSV=7588809 TSER=7535000 WS=6
  3   0.000326     10.0.1.3 -> 10.0.1.2     TCP 60281 > http-alt [ACK] Seq=1 Ack=1 Win=5888 Len=0 TSV=7535001 TSER=7588809
362540  29.876688     10.0.1.3 -> 10.0.1.2     TCP 60281 > http-alt [FIN, ACK] Seq=327 Ack=350341957 Win=2580480 Len=0 TSV=7542469 TSER=7596218
362541  29.877056     10.0.1.2 -> 10.0.1.3     TCP http-alt > 60281 [FIN, ACK] Seq=350341957 Ack=328 Win=15552 Len=0 TSV=7596279 TSER=7542469
================================================================================
IPv4 Conversations
Filter:<No Filter>
                                               |       <-      | |       ->      | |     Total     |
                                               | Frames  Bytes | | Frames  Bytes | | Frames  Bytes |
10.0.1.3             <-> 10.0.1.2              241997 366313766  120545   7956304  362542 374270070
================================================================================
  1   0.000000     10.0.1.3 -> 10.0.1.2     TCP 60283 > http-alt [SYN] Seq=0 Win=5840 Len=0 MSS=1460 TSV=7546662 TSER=0 WS=6
  2   0.000366     10.0.1.2 -> 10.0.1.3     TCP http-alt > 60283 [SYN, ACK] Seq=0 Ack=1 Win=14480 Len=0 MSS=1460 TSV=7600471 TSER=7546662 WS=6
  3   0.000387     10.0.1.3 -> 10.0.1.2     TCP 60283 > http-alt [ACK] Seq=1 Ack=1 Win=5888 Len=0 TSV=7546662 TSER=7600471
362621  29.873878     10.0.1.3 -> 10.0.1.2     TCP 60283 > http-alt [FIN, ACK] Seq=327 Ack=350341957 Win=2580480 Len=0 TSV=7554130 TSER=7607880
362622  29.874302     10.0.1.2 -> 10.0.1.3     TCP http-alt > 60283 [FIN, ACK] Seq=350341957 Ack=328 Win=15552 Len=0 TSV=7607940 TSER=7554130
================================================================================
IPv4 Conversations
Filter:<No Filter>
                                               |       <-      | |       ->      | |     Total     |
                                               | Frames  Bytes | | Frames  Bytes | | Frames  Bytes |
10.0.1.3             <-> 10.0.1.2              241975 366312314  120648   7963102  362623 374275416
================================================================================
  1   0.000000     10.0.1.3 -> 10.0.1.2     TCP 60285 > http-alt [SYN] Seq=0 Win=5840 Len=0 MSS=1460 TSV=7558355 TSER=0 WS=6
  2   0.000307     10.0.1.2 -> 10.0.1.3     TCP http-alt > 60285 [SYN, ACK] Seq=0 Ack=1 Win=14480 Len=0 MSS=1460 TSV=7612166 TSER=7558355 WS=6
  3   0.000330     10.0.1.3 -> 10.0.1.2     TCP 60285 > http-alt [ACK] Seq=1 Ack=1 Win=5888 Len=0 TSV=7558355 TSER=7612166
362635  29.878055     10.0.1.3 -> 10.0.1.2     TCP 60285 > http-alt [FIN, ACK] Seq=327 Ack=350341957 Win=2580480 Len=0 TSV=7565825 TSER=7619576
362636  29.878446     10.0.1.2 -> 10.0.1.3     TCP http-alt > 60285 [FIN, ACK] Seq=350341957 Ack=328 Win=15552 Len=0 TSV=7619636 TSER=7565825
================================================================================
IPv4 Conversations
Filter:<No Filter>
                                               |       <-      | |       ->      | |     Total     |
                                               | Frames  Bytes | | Frames  Bytes | | Frames  Bytes |
10.0.1.3             <-> 10.0.1.2              242028 366315812  120609   7960528  362637 374276340
================================================================================
