  1   0.000000     10.0.1.3 -> 10.0.1.2     TCP 43582 > http-alt [SYN] Seq=0 Win=5840 Len=0 MSS=1460 TSV=7832236 TSER=0 WS=6
  2   0.000283     10.0.1.2 -> 10.0.1.3     TCP http-alt > 43582 [SYN, ACK] Seq=0 Ack=1 Win=14480 Len=0 MSS=1460 TSV=7886068 TSER=7832236 WS=6
  3   0.000308     10.0.1.3 -> 10.0.1.2     TCP 43582 > http-alt [ACK] Seq=1 Ack=1 Win=5888 Len=0 TSV=7832236 TSER=7886068
466096  38.412796     10.0.1.3 -> 10.0.1.2     TCP 43582 > http-alt [FIN, ACK] Seq=327 Ack=450439613 Win=2580480 Len=0 TSV=7841840 TSER=7895608
466097  38.413219     10.0.1.2 -> 10.0.1.3     TCP http-alt > 43582 [FIN, ACK] Seq=450439613 Ack=328 Win=15552 Len=0 TSV=7895672 TSER=7841840
================================================================================
IPv4 Conversations
Filter:<No Filter>
                                               |       <-      | |       ->      | |     Total     |
                                               | Frames  Bytes | | Frames  Bytes | | Frames  Bytes |
10.0.1.3             <-> 10.0.1.2              311129 470974134  154969  10228288  466098 481202422
================================================================================
  1   0.000000     10.0.1.3 -> 10.0.1.2     TCP 43584 > http-alt [SYN] Seq=0 Win=5840 Len=0 MSS=1460 TSV=7846719 TSER=0 WS=6
  2   0.000312     10.0.1.2 -> 10.0.1.3     TCP http-alt > 43584 [SYN, ACK] Seq=0 Ack=1 Win=14480 Len=0 MSS=1460 TSV=7900552 TSER=7846719 WS=6
  3   0.000337     10.0.1.3 -> 10.0.1.2     TCP 43584 > http-alt [ACK] Seq=1 Ack=1 Win=5888 Len=0 TSV=7846720 TSER=7900552
466116  38.394628     10.0.1.3 -> 10.0.1.2     TCP 43584 > http-alt [FIN, ACK] Seq=327 Ack=450439613 Win=2580480 Len=0 TSV=7856318 TSER=7910091
466117  38.394991     10.0.1.2 -> 10.0.1.3     TCP http-alt > 43584 [FIN, ACK] Seq=450439613 Ack=328 Win=15552 Len=0 TSV=7910151 TSER=7856318
================================================================================
IPv4 Conversations
Filter:<No Filter>
                                               |       <-      | |       ->      | |     Total     |
                                               | Frames  Bytes | | Frames  Bytes | | Frames  Bytes |
10.0.1.3             <-> 10.0.1.2              311110 470972880  155008  10230862  466118 481203742
================================================================================
  1   0.000000     10.0.1.3 -> 10.0.1.2     TCP 43586 > http-alt [SYN] Seq=0 Win=5840 Len=0 MSS=1460 TSV=7861250 TSER=0 WS=6
  2   0.000318     10.0.1.2 -> 10.0.1.3     TCP http-alt > 43586 [SYN, ACK] Seq=0 Ack=1 Win=14480 Len=0 MSS=1460 TSV=7915084 TSER=7861250 WS=6
  3   0.000344     10.0.1.3 -> 10.0.1.2     TCP 43586 > http-alt [ACK] Seq=1 Ack=1 Win=5888 Len=0 TSV=7861250 TSER=7915084
466972  38.405728     10.0.1.3 -> 10.0.1.2     TCP 43586 > http-alt [FIN, ACK] Seq=327 Ack=450439613 Win=2557184 Len=0 TSV=7870852 TSER=7924625
466973  38.406123     10.0.1.2 -> 10.0.1.3     TCP http-alt > 43586 [FIN, ACK] Seq=450439613 Ack=328 Win=15552 Len=0 TSV=7924686 TSER=7870852
================================================================================
IPv4 Conversations
Filter:<No Filter>
                                               |       <-      | |       ->      | |     Total     |
                                               | Frames  Bytes | | Frames  Bytes | | Frames  Bytes |
10.0.1.3             <-> 10.0.1.2              311153 470975718  155821  10284520  466974 481260238
================================================================================
  1   0.000000     10.0.1.3 -> 10.0.1.2     TCP 50742 > http-alt [SYN] Seq=0 Win=5840 Len=0 MSS=1460 TSV=7875758 TSER=0 WS=6
  2   0.000313     10.0.1.2 -> 10.0.1.3     TCP http-alt > 50742 [SYN, ACK] Seq=0 Ack=1 Win=14480 Len=0 MSS=1460 TSV=7929593 TSER=7875758 WS=6
  3   0.000338     10.0.1.3 -> 10.0.1.2     TCP 50742 > http-alt [ACK] Seq=1 Ack=1 Win=5888 Len=0 TSV=7875758 TSER=7929593
466135  38.396540     10.0.1.3 -> 10.0.1.2     TCP 50742 > http-alt [FIN, ACK] Seq=327 Ack=450439613 Win=2580480 Len=0 TSV=7885358 TSER=7939133
466136  38.396901     10.0.1.2 -> 10.0.1.3     TCP http-alt > 50742 [FIN, ACK] Seq=450439613 Ack=328 Win=15552 Len=0 TSV=7939193 TSER=7885358
================================================================================
IPv4 Conversations
Filter:<No Filter>
                                               |       <-      | |       ->      | |     Total     |
                                               | Frames  Bytes | | Frames  Bytes | | Frames  Bytes |
10.0.1.3             <-> 10.0.1.2              311087 470971362  155050  10233634  466137 481204996
================================================================================
  1   0.000000     10.0.1.3 -> 10.0.1.2     TCP 50744 > http-alt [SYN] Seq=0 Win=5840 Len=0 MSS=1460 TSV=7890212 TSER=0 WS=6
  2   0.000297     10.0.1.2 -> 10.0.1.3     TCP http-alt > 50744 [SYN, ACK] Seq=0 Ack=1 Win=14480 Len=0 MSS=1460 TSV=7944047 TSER=7890212 WS=6
  3   0.000320     10.0.1.3 -> 10.0.1.2     TCP 50744 > http-alt [ACK] Seq=1 Ack=1 Win=5888 Len=0 TSV=7890212 TSER=7944047
465915  38.396541     10.0.1.3 -> 10.0.1.2     TCP 50744 > http-alt [FIN, ACK] Seq=327 Ack=450439613 Win=2580480 Len=0 TSV=7899811 TSER=7953586
465916  38.396924     10.0.1.2 -> 10.0.1.3     TCP http-alt > 50744 [FIN, ACK] Seq=450439613 Ack=328 Win=15552 Len=0 TSV=7953647 TSER=7899811
================================================================================
IPv4 Conversations
Filter:<No Filter>
                                               |       <-      | |       ->      | |     Total     |
                                               | Frames  Bytes | | Frames  Bytes | | Frames  Bytes |
10.0.1.3             <-> 10.0.1.2              311091 470971626  154826  10218850  465917 481190476
================================================================================
  1   0.000000     10.0.1.3 -> 10.0.1.2     TCP 50748 > http-alt [SYN] Seq=0 Win=5840 Len=0 MSS=1460 TSV=7904722 TSER=0 WS=6
  2   0.000292     10.0.1.2 -> 10.0.1.3     TCP http-alt > 50748 [SYN, ACK] Seq=0 Ack=1 Win=14480 Len=0 MSS=1460 TSV=7958559 TSER=7904722 WS=6
  3   0.000309     10.0.1.3 -> 10.0.1.2     TCP 50748 > http-alt [ACK] Seq=1 Ack=1 Win=5888 Len=0 TSV=7904722 TSER=7958559
466028  38.389901     10.0.1.3 -> 10.0.1.2     TCP 50748 > http-alt [FIN, ACK] Seq=327 Ack=450439613 Win=2580480 Len=0 TSV=7914320 TSER=7968097
466029  38.390276     10.0.1.2 -> 10.0.1.3     TCP http-alt > 50748 [FIN, ACK] Seq=450439613 Ack=328 Win=15552 Len=0 TSV=7968157 TSER=7914320
================================================================================
IPv4 Conversations
Filter:<No Filter>
                                               |       <-      | |       ->      | |     Total     |
                                               | Frames  Bytes | | Frames  Bytes | | Frames  Bytes |
10.0.1.3             <-> 10.0.1.2              311107 470972682  154923  10225252  466030 481197934
================================================================================
  1   0.000000     10.0.1.3 -> 10.0.1.2     TCP 50750 > http-alt [SYN] Seq=0 Win=5840 Len=0 MSS=1460 TSV=7919198 TSER=0 WS=6
  2   0.000311     10.0.1.2 -> 10.0.1.3     TCP http-alt > 50750 [SYN, ACK] Seq=0 Ack=1 Win=14480 Len=0 MSS=1460 TSV=7973036 TSER=7919198 WS=6
  3   0.000331     10.0.1.3 -> 10.0.1.2     TCP 50750 > http-alt [ACK] Seq=1 Ack=1 Win=5888 Len=0 TSV=7919198 TSER=7973036
466287  38.397180     10.0.1.3 -> 10.0.1.2     TCP 50750 > http-alt [FIN, ACK] Seq=327 Ack=450439613 Win=2580480 Len=0 TSV=7928797 TSER=7982574
466288  38.397547     10.0.1.2 -> 10.0.1.3     TCP http-alt > 50750 [FIN, ACK] Seq=450439613 Ack=328 Win=15552 Len=0 TSV=7982636 TSER=7928797
================================================================================
IPv4 Conversations
Filter:<No Filter>
                                               |       <-      | |       ->      | |     Total     |
                                               | Frames  Bytes | | Frames  Bytes | | Frames  Bytes |
10.0.1.3             <-> 10.0.1.2              311120 470973540  155169  10241488  466289 481215028
================================================================================
  1   0.000000     10.0.1.3 -> 10.0.1.2     TCP 50752 > http-alt [SYN] Seq=0 Win=5840 Len=0 MSS=1460 TSV=7933682 TSER=0 WS=6
  2   0.000281     10.0.1.2 -> 10.0.1.3     TCP http-alt > 50752 [SYN, ACK] Seq=0 Ack=1 Win=14480 Len=0 MSS=1460 TSV=7987521 TSER=7933682 WS=6
  3   0.000302     10.0.1.3 -> 10.0.1.2     TCP 50752 > http-alt [ACK] Seq=1 Ack=1 Win=5888 Len=0 TSV=7933682 TSER=7987521
466092  38.396140     10.0.1.3 -> 10.0.1.2     TCP 50752 > http-alt [FIN, ACK] Seq=327 Ack=450439613 Win=2580480 Len=0 TSV=7943281 TSER=7997060
466093  38.396449     10.0.1.2 -> 10.0.1.3     TCP http-alt > 50752 [FIN, ACK] Seq=450439613 Ack=328 Win=15552 Len=0 TSV=7997121 TSER=7943281
================================================================================
IPv4 Conversations
Filter:<No Filter>
                                               |       <-      | |       ->      | |     Total     |
                                               | Frames  Bytes | | Frames  Bytes | | Frames  Bytes |
10.0.1.3             <-> 10.0.1.2              311113 470973078  154981  10229080  466094 481202158
================================================================================
  1   0.000000     10.0.1.3 -> 10.0.1.2     TCP 50755 > http-alt [SYN] Seq=0 Win=5840 Len=0 MSS=1460 TSV=7948182 TSER=0 WS=6
  2   0.000295     10.0.1.2 -> 10.0.1.3     TCP http-alt > 50755 [SYN, ACK] Seq=0 Ack=1 Win=14480 Len=0 MSS=1460 TSV=8002022 TSER=7948182 WS=6
  3   0.000317     10.0.1.3 -> 10.0.1.2     TCP 50755 > http-alt [ACK] Seq=1 Ack=1 Win=5888 Len=0 TSV=7948182 TSER=8002022
466163  38.386587     10.0.1.3 -> 10.0.1.2     TCP 50755 > http-alt [FIN, ACK] Seq=327 Ack=450439613 Win=2580480 Len=0 TSV=7957778 TSER=8011559
466164  38.386964     10.0.1.2 -> 10.0.1.3     TCP http-alt > 50755 [FIN, ACK] Seq=450439613 Ack=328 Win=15552 Len=0 TSV=8011619 TSER=7957778
================================================================================
IPv4 Conversations
Filter:<No Filter>
                                               |       <-      | |       ->      | |     Total     |
                                               | Frames  Bytes | | Frames  Bytes | | Frames  Bytes |
10.0.1.3             <-> 10.0.1.2              311090 470971560  155075  10235284  466165 481206844
================================================================================
  1   0.000000     10.0.1.3 -> 10.0.1.2     TCP 58748 > http-alt [SYN] Seq=0 Win=5840 Len=0 MSS=1460 TSV=7962801 TSER=0 WS=6
  2   0.000280     10.0.1.2 -> 10.0.1.3     TCP http-alt > 58748 [SYN, ACK] Seq=0 Ack=1 Win=14480 Len=0 MSS=1460 TSV=8016641 TSER=7962801 WS=6
  3   0.000301     10.0.1.3 -> 10.0.1.2     TCP 58748 > http-alt [ACK] Seq=1 Ack=1 Win=5888 Len=0 TSV=7962801 TSER=8016641
466058  38.396692     10.0.1.3 -> 10.0.1.2     TCP 58748 > http-alt [FIN, ACK] Seq=327 Ack=450439613 Win=2580480 Len=0 TSV=7972400 TSER=8026182
466059  38.397029     10.0.1.2 -> 10.0.1.3     TCP http-alt > 58748 [FIN, ACK] Seq=450439613 Ack=328 Win=15552 Len=0 TSV=8026241 TSER=7972400
================================================================================
IPv4 Conversations
Filter:<No Filter>
                                               |       <-      | |       ->      | |     Total     |
                                               | Frames  Bytes | | Frames  Bytes | | Frames  Bytes |
10.0.1.3             <-> 10.0.1.2              311145 470975190  154915  10224724  466060 481199914
================================================================================
  1   0.000000     10.0.1.3 -> 10.0.1.2     TCP 58752 > http-alt [SYN] Seq=0 Win=5840 Len=0 MSS=1460 TSV=7977275 TSER=0 WS=6
  2   0.000299     10.0.1.2 -> 10.0.1.3     TCP http-alt > 58752 [SYN, ACK] Seq=0 Ack=1 Win=14480 Len=0 MSS=1460 TSV=8031117 TSER=7977275 WS=6
  3   0.000323     10.0.1.3 -> 10.0.1.2     TCP 58752 > http-alt [ACK] Seq=1 Ack=1 Win=5888 Len=0 TSV=7977275 TSER=8031117
466073  38.398722     10.0.1.3 -> 10.0.1.2     TCP 58752 > http-alt [FIN, ACK] Seq=327 Ack=450439613 Win=2580480 Len=0 TSV=7986874 TSER=8040656
466074  38.399077     10.0.1.2 -> 10.0.1.3     TCP http-alt > 58752 [FIN, ACK] Seq=450439613 Ack=328 Win=15552 Len=0 TSV=8040717 TSER=7986874
================================================================================
IPv4 Conversations
Filter:<No Filter>
                                               |       <-      | |       ->      | |     Total     |
                                               | Frames  Bytes | | Frames  Bytes | | Frames  Bytes |
10.0.1.3             <-> 10.0.1.2              311120 470973540  154955  10227364  466075 481200904
================================================================================
  1   0.000000     10.0.1.3 -> 10.0.1.2     TCP 58754 > http-alt [SYN] Seq=0 Win=5840 Len=0 MSS=1460 TSV=7991770 TSER=0 WS=6
  2   0.000314     10.0.1.2 -> 10.0.1.3     TCP http-alt > 58754 [SYN, ACK] Seq=0 Ack=1 Win=14480 Len=0 MSS=1460 TSV=8045614 TSER=7991770 WS=6
  3   0.000334     10.0.1.3 -> 10.0.1.2     TCP 58754 > http-alt [ACK] Seq=1 Ack=1 Win=5888 Len=0 TSV=7991770 TSER=8045614
466160  38.391886     10.0.1.3 -> 10.0.1.2     TCP 58754 > http-alt [FIN, ACK] Seq=327 Ack=450439613 Win=2580480 Len=0 TSV=8001368 TSER=8055153
466161  38.392264     10.0.1.2 -> 10.0.1.3     TCP http-alt > 58754 [FIN, ACK] Seq=450439613 Ack=328 Win=15552 Len=0 TSV=8055212 TSER=8001368
================================================================================
IPv4 Conversations
Filter:<No Filter>
                                               |       <-      | |       ->      | |     Total     |
                                               | Frames  Bytes | | Frames  Bytes | | Frames  Bytes |
10.0.1.3             <-> 10.0.1.2              311200 470978820  154962  10227826  466162 481206646
================================================================================
  1   0.000000     10.0.1.3 -> 10.0.1.2     TCP 58756 > http-alt [SYN] Seq=0 Win=5840 Len=0 MSS=1460 TSV=8006267 TSER=0 WS=6
  2   0.000294     10.0.1.2 -> 10.0.1.3     TCP http-alt > 58756 [SYN, ACK] Seq=0 Ack=1 Win=14480 Len=0 MSS=1460 TSV=8060111 TSER=8006267 WS=6
  3   0.000315     10.0.1.3 -> 10.0.1.2     TCP 58756 > http-alt [ACK] Seq=1 Ack=1 Win=5888 Len=0 TSV=8006267 TSER=8060111
466116  38.397504     10.0.1.3 -> 10.0.1.2     TCP 58756 > http-alt [FIN, ACK] Seq=327 Ack=450439613 Win=2580480 Len=0 TSV=8015866 TSER=8069651
466117  38.397825     10.0.1.2 -> 10.0.1.3     TCP http-alt > 58756 [FIN, ACK] Seq=450439613 Ack=328 Win=15552 Len=0 TSV=8069711 TSER=8015866
================================================================================
IPv4 Conversations
Filter:<No Filter>
                                               |       <-      | |       ->      | |     Total     |
                                               | Frames  Bytes | | Frames  Bytes | | Frames  Bytes |
10.0.1.3             <-> 10.0.1.2              311105 470972550  155013  10231192  466118 481203742
================================================================================
  1   0.000000     10.0.1.3 -> 10.0.1.2     TCP 58758 > http-alt [SYN] Seq=0 Win=5840 Len=0 MSS=1460 TSV=8020778 TSER=0 WS=6
  2   0.000321     10.0.1.2 -> 10.0.1.3     TCP http-alt > 58758 [SYN, ACK] Seq=0 Ack=1 Win=14480 Len=0 MSS=1460 TSV=8074624 TSER=8020778 WS=6
  3   0.000345     10.0.1.3 -> 10.0.1.2     TCP 58758 > http-alt [ACK] Seq=1 Ack=1 Win=5888 Len=0 TSV=8020779 TSER=8074624
466081  38.641151     10.0.1.3 -> 10.0.1.2     TCP 58758 > http-alt [FIN, ACK] Seq=327 Ack=450439613 Win=2580480 Len=0 TSV=8030439 TSER=8084164
466082  38.641508     10.0.1.2 -> 10.0.1.3     TCP http-alt > 58758 [FIN, ACK] Seq=450439613 Ack=328 Win=15552 Len=0 TSV=8084285 TSER=8030439
================================================================================
IPv4 Conversations
Filter:<No Filter>
                                               |       <-      | |       ->      | |     Total     |
                                               | Frames  Bytes | | Frames  Bytes | | Frames  Bytes |
10.0.1.3             <-> 10.0.1.2              311087 470971362  154996  10230070  466083 481201432
================================================================================
  1   0.000000     10.0.1.3 -> 10.0.1.2     TCP 40147 > http-alt [SYN] Seq=0 Win=5840 Len=0 MSS=1460 TSV=8035306 TSER=0 WS=6
  2   0.000303     10.0.1.2 -> 10.0.1.3     TCP http-alt > 40147 [SYN, ACK] Seq=0 Ack=1 Win=14480 Len=0 MSS=1460 TSV=8089152 TSER=8035306 WS=6
  3   0.000325     10.0.1.3 -> 10.0.1.2     TCP 40147 > http-alt [ACK] Seq=1 Ack=1 Win=5888 Len=0 TSV=8035306 TSER=8089152
466063  38.394004     10.0.1.3 -> 10.0.1.2     TCP 40147 > http-alt [FIN, ACK] Seq=327 Ack=450439613 Win=2580480 Len=0 TSV=8044904 TSER=8098693
466064  38.394371     10.0.1.2 -> 10.0.1.3     TCP http-alt > 40147 [FIN, ACK] Seq=450439613 Ack=328 Win=15552 Len=0 TSV=8098752 TSER=8044904
================================================================================
IPv4 Conversations
Filter:<No Filter>
                                               |       <-      | |       ->      | |     Total     |
                                               | Frames  Bytes | | Frames  Bytes | | Frames  Bytes |
10.0.1.3             <-> 10.0.1.2              311093 470971758  154972  10228486  466065 481200244
================================================================================
  1   0.000000     10.0.1.3 -> 10.0.1.2     TCP 40151 > http-alt [SYN] Seq=0 Win=5840 Len=0 MSS=1460 TSV=8049777 TSER=0 WS=6
  2   0.000300     10.0.1.2 -> 10.0.1.3     TCP http-alt > 40151 [SYN, ACK] Seq=0 Ack=1 Win=14480 Len=0 MSS=1460 TSV=8103624 TSER=8049777 WS=6
  3   0.000324     10.0.1.3 -> 10.0.1.2     TCP 40151 > http-alt [ACK] Seq=1 Ack=1 Win=5888 Len=0 TSV=8049777 TSER=8103624
466258  38.396152     10.0.1.3 -> 10.0.1.2     TCP 40151 > http-alt [FIN, ACK] Seq=327 Ack=450439613 Win=2580480 Len=0 TSV=8059376 TSER=8113164
466259  38.396481     10.0.1.2 -> 10.0.1.3     TCP http-alt > 40151 [FIN, ACK] Seq=450439613 Ack=328 Win=15552 Len=0 TSV=8113224 TSER=8059376
================================================================================
IPv4 Conversations
Filter:<No Filter>
                                               |       <-      | |       ->      | |     Total     |
                                               | Frames  Bytes | | Frames  Bytes | | Frames  Bytes |
10.0.1.3             <-> 10.0.1.2              311128 470974068  155132  10239046  466260 481213114
================================================================================
  1   0.000000     10.0.1.3 -> 10.0.1.2     TCP 40153 > http-alt [SYN] Seq=0 Win=5840 Len=0 MSS=1460 TSV=8064263 TSER=0 WS=6
  2   0.000291     10.0.1.2 -> 10.0.1.3     TCP http-alt > 40153 [SYN, ACK] Seq=0 Ack=1 Win=14480 Len=0 MSS=1460 TSV=8118112 TSER=8064263 WS=6
  3   0.000311     10.0.1.3 -> 10.0.1.2     TCP 40153 > http-alt [ACK] Seq=1 Ack=1 Win=5888 Len=0 TSV=8064263 TSER=8118112
466077  38.404850     10.0.1.3 -> 10.0.1.2     TCP 40153 > http-alt [FIN, ACK] Seq=327 Ack=450439613 Win=2580480 Len=0 TSV=8073865 TSER=8127653
466078  38.405160     10.0.1.2 -> 10.0.1.3     TCP http-alt > 40153 [FIN, ACK] Seq=450439613 Ack=328 Win=15552 Len=0 TSV=8127714 TSER=8073865
================================================================================
IPv4 Conversations
Filter:<No Filter>
                                               |       <-      | |       ->      | |     Total     |
                                               | Frames  Bytes | | Frames  Bytes | | Frames  Bytes |
10.0.1.3             <-> 10.0.1.2              311133 470974398  154946  10226770  466079 481201168
================================================================================
  1   0.000000     10.0.1.3 -> 10.0.1.2     TCP 40155 > http-alt [SYN] Seq=0 Win=5840 Len=0 MSS=1460 TSV=8078732 TSER=0 WS=6
  2   0.000306     10.0.1.2 -> 10.0.1.3     TCP http-alt > 40155 [SYN, ACK] Seq=0 Ack=1 Win=14480 Len=0 MSS=1460 TSV=8132582 TSER=8078732 WS=6
  3   0.000330     10.0.1.3 -> 10.0.1.2     TCP 40155 > http-alt [ACK] Seq=1 Ack=1 Win=5888 Len=0 TSV=8078732 TSER=8132582
466142  38.396633     10.0.1.3 -> 10.0.1.2     TCP 40155 > http-alt [FIN, ACK] Seq=327 Ack=450439613 Win=2580480 Len=0 TSV=8088331 TSER=8142121
466143  38.396984     10.0.1.2 -> 10.0.1.3     TCP http-alt > 40155 [FIN, ACK] Seq=450439613 Ack=328 Win=15552 Len=0 TSV=8142182 TSER=8088331
================================================================================
IPv4 Conversations
Filter:<No Filter>
                                               |       <-      | |       ->      | |     Total     |
                                               | Frames  Bytes | | Frames  Bytes | | Frames  Bytes |
10.0.1.3             <-> 10.0.1.2              311092 470971692  155052  10233766  466144 481205458
================================================================================
  1   0.000000     10.0.1.3 -> 10.0.1.2     TCP 40157 > http-alt [SYN] Seq=0 Win=5840 Len=0 MSS=1460 TSV=8093190 TSER=0 WS=6
  2   0.000372     10.0.1.2 -> 10.0.1.3     TCP http-alt > 40157 [SYN, ACK] Seq=0 Ack=1 Win=14480 Len=0 MSS=1460 TSV=8147041 TSER=8093190 WS=6
  3   0.000394     10.0.1.3 -> 10.0.1.2     TCP 40157 > http-alt [ACK] Seq=1 Ack=1 Win=5888 Len=0 TSV=8093190 TSER=8147041
466664  38.392847     10.0.1.3 -> 10.0.1.2     TCP 40157 > http-alt [FIN, ACK] Seq=327 Ack=450439613 Win=2557184 Len=0 TSV=8102788 TSER=8156581
466665  38.393189     10.0.1.2 -> 10.0.1.3     TCP http-alt > 40157 [FIN, ACK] Seq=450439613 Ack=328 Win=15552 Len=0 TSV=8156640 TSER=8102788
================================================================================
IPv4 Conversations
Filter:<No Filter>
                                               |       <-      | |       ->      | |     Total     |
                                               | Frames  Bytes | | Frames  Bytes | | Frames  Bytes |
10.0.1.3             <-> 10.0.1.2              311089 470971494  155577  10268416  466666 481239910
================================================================================
  1   0.000000     10.0.1.3 -> 10.0.1.2     TCP 41084 > http-alt [SYN] Seq=0 Win=5840 Len=0 MSS=1460 TSV=8107683 TSER=0 WS=6
  2   0.000305     10.0.1.2 -> 10.0.1.3     TCP http-alt > 41084 [SYN, ACK] Seq=0 Ack=1 Win=14480 Len=0 MSS=1460 TSV=8161535 TSER=8107683 WS=6
  3   0.000327     10.0.1.3 -> 10.0.1.2     TCP 41084 > http-alt [ACK] Seq=1 Ack=1 Win=5888 Len=0 TSV=8107683 TSER=8161535
466266  38.395257     10.0.1.3 -> 10.0.1.2     TCP 41084 > http-alt [FIN, ACK] Seq=327 Ack=450439613 Win=2580480 Len=0 TSV=8117282 TSER=8171073
466267  38.395597     10.0.1.2 -> 10.0.1.3     TCP http-alt > 41084 [FIN, ACK] Seq=450439613 Ack=328 Win=15552 Len=0 TSV=8171134 TSER=8117282
================================================================================
IPv4 Conversations
Filter:<No Filter>
                                               |       <-      | |       ->      | |     Total     |
                                               | Frames  Bytes | | Frames  Bytes | | Frames  Bytes |
10.0.1.3             <-> 10.0.1.2              311145 470975190  155123  10238452  466268 481213642
================================================================================
