  1   0.000000     10.0.1.3 -> 10.0.1.2     TCP 49581 > http-alt [SYN] Seq=0 Win=5840 Len=0 MSS=1460 TSV=2142636 TSER=0 WS=6
  2   0.000294     10.0.1.2 -> 10.0.1.3     TCP http-alt > 49581 [SYN, ACK] Seq=0 Ack=1 Win=14480 Len=0 MSS=1460 TSV=2174695 TSER=2142636 WS=6
  3   0.000316     10.0.1.3 -> 10.0.1.2     TCP 49581 > http-alt [ACK] Seq=1 Ack=1 Win=5888 Len=0 TSV=2142636 TSER=2174695
464827  38.396722     10.0.1.3 -> 10.0.1.2     TCP 49581 > http-alt [FIN, ACK] Seq=327 Ack=450439613 Win=2580480 Len=0 TSV=2152235 TSER=2184234
464828  38.397086     10.0.1.2 -> 10.0.1.3     TCP http-alt > 49581 [FIN, ACK] Seq=450439613 Ack=328 Win=15552 Len=0 TSV=2184295 TSER=2152235
  1   0.000000     10.0.1.3 -> 10.0.1.2     TCP 49583 > http-alt [SYN] Seq=0 Win=5840 Len=0 MSS=1460 TSV=2159640 TSER=0 WS=6
  2   0.000287     10.0.1.2 -> 10.0.1.3     TCP http-alt > 49583 [SYN, ACK] Seq=0 Ack=1 Win=14480 Len=0 MSS=1460 TSV=2191700 TSER=2159640 WS=6
  3   0.000311     10.0.1.3 -> 10.0.1.2     TCP 49583 > http-alt [ACK] Seq=1 Ack=1 Win=5888 Len=0 TSV=2159640 TSER=2191700
438998  38.395453     10.0.1.3 -> 10.0.1.2     TCP 49583 > http-alt [FIN, ACK] Seq=327 Ack=450439613 Win=2568768 Len=0 TSV=2169239 TSER=2201239
438999  38.395872     10.0.1.2 -> 10.0.1.3     TCP http-alt > 49583 [FIN, ACK] Seq=450439613 Ack=328 Win=15552 Len=0 TSV=2201299 TSER=2169239
  1   0.000000     10.0.1.3 -> 10.0.1.2     TCP 34913 > http-alt [SYN] Seq=0 Win=5840 Len=0 MSS=1460 TSV=2176071 TSER=0 WS=6
  2   0.000293     10.0.1.2 -> 10.0.1.3     TCP http-alt > 34913 [SYN, ACK] Seq=0 Ack=1 Win=14480 Len=0 MSS=1460 TSV=2208132 TSER=2176071 WS=6
  3   0.000314     10.0.1.3 -> 10.0.1.2     TCP 34913 > http-alt [ACK] Seq=1 Ack=1 Win=5888 Len=0 TSV=2176071 TSER=2208132
464130  38.395473     10.0.1.3 -> 10.0.1.2     TCP 34913 > http-alt [FIN, ACK] Seq=327 Ack=450439613 Win=2580480 Len=0 TSV=2185669 TSER=2217671
464131  38.395851     10.0.1.2 -> 10.0.1.3     TCP http-alt > 34913 [FIN, ACK] Seq=450439613 Ack=328 Win=15552 Len=0 TSV=2217732 TSER=2185669
  1   0.000000     10.0.1.3 -> 10.0.1.2     TCP 34915 > http-alt [SYN] Seq=0 Win=5840 Len=0 MSS=1460 TSV=2193514 TSER=0 WS=6
  2   0.000321     10.0.1.2 -> 10.0.1.3     TCP http-alt > 34915 [SYN, ACK] Seq=0 Ack=1 Win=14480 Len=0 MSS=1460 TSV=2225577 TSER=2193514 WS=6
  3   0.000347     10.0.1.3 -> 10.0.1.2     TCP 34915 > http-alt [ACK] Seq=1 Ack=1 Win=5888 Len=0 TSV=2193514 TSER=2225577
426485  38.399403     10.0.1.3 -> 10.0.1.2     TCP 34915 > http-alt [FIN, ACK] Seq=327 Ack=450439613 Win=2560064 Len=0 TSV=2203114 TSER=2235117
426486  38.399778     10.0.1.2 -> 10.0.1.3     TCP http-alt > 34915 [FIN, ACK] Seq=450439613 Ack=328 Win=15552 Len=0 TSV=2235178 TSER=2203114
  1   0.000000     10.0.1.3 -> 10.0.1.2     TCP 34917 > http-alt [SYN] Seq=0 Win=5840 Len=0 MSS=1460 TSV=2210550 TSER=0 WS=6
  2   0.000305     10.0.1.2 -> 10.0.1.3     TCP http-alt > 34917 [SYN, ACK] Seq=0 Ack=1 Win=14480 Len=0 MSS=1460 TSV=2242614 TSER=2210550 WS=6
  3   0.000329     10.0.1.3 -> 10.0.1.2     TCP 34917 > http-alt [ACK] Seq=1 Ack=1 Win=5888 Len=0 TSV=2210550 TSER=2242614
464021  38.397158     10.0.1.3 -> 10.0.1.2     TCP 34917 > http-alt [FIN, ACK] Seq=327 Ack=450439613 Win=2580480 Len=0 TSV=2220149 TSER=2252153
464022  38.397530     10.0.1.2 -> 10.0.1.3     TCP http-alt > 34917 [FIN, ACK] Seq=450439613 Ack=328 Win=15552 Len=0 TSV=2252214 TSER=2220149
  1   0.000000     10.0.1.3 -> 10.0.1.2     TCP 34920 > http-alt [SYN] Seq=0 Win=5840 Len=0 MSS=1460 TSV=2227073 TSER=0 WS=6
  2   0.000317     10.0.1.2 -> 10.0.1.3     TCP http-alt > 34920 [SYN, ACK] Seq=0 Ack=1 Win=14480 Len=0 MSS=1460 TSV=2259139 TSER=2227073 WS=6
  3   0.000341     10.0.1.3 -> 10.0.1.2     TCP 34920 > http-alt [ACK] Seq=1 Ack=1 Win=5888 Len=0 TSV=2227073 TSER=2259139
463866  38.388034     10.0.1.3 -> 10.0.1.2     TCP 34920 > http-alt [FIN, ACK] Seq=327 Ack=450439613 Win=2580480 Len=0 TSV=2236670 TSER=2268677
463867  38.388456     10.0.1.2 -> 10.0.1.3     TCP http-alt > 34920 [FIN, ACK] Seq=450439613 Ack=328 Win=15552 Len=0 TSV=2268736 TSER=2236670
  1   0.000000     10.0.1.3 -> 10.0.1.2     TCP 34922 > http-alt [SYN] Seq=0 Win=5840 Len=0 MSS=1460 TSV=2244319 TSER=0 WS=6
  2   0.000301     10.0.1.2 -> 10.0.1.3     TCP http-alt > 34922 [SYN, ACK] Seq=0 Ack=1 Win=14480 Len=0 MSS=1460 TSV=2276386 TSER=2244319 WS=6
  3   0.000323     10.0.1.3 -> 10.0.1.2     TCP 34922 > http-alt [ACK] Seq=1 Ack=1 Win=5888 Len=0 TSV=2244319 TSER=2276386
453867  40.560496     10.0.1.3 -> 10.0.1.2     TCP 34922 > http-alt [FIN, ACK] Seq=327 Ack=450439613 Win=2580480 Len=0 TSV=2254460 TSER=2285924
453868  40.560867     10.0.1.2 -> 10.0.1.3     TCP http-alt > 34922 [FIN, ACK] Seq=450439613 Ack=328 Win=15552 Len=0 TSV=2286527 TSER=2254460
  1   0.000000     10.0.1.3 -> 10.0.1.2     TCP 38412 > http-alt [SYN] Seq=0 Win=5840 Len=0 MSS=1460 TSV=2261693 TSER=0 WS=6
  2   0.000301     10.0.1.2 -> 10.0.1.3     TCP http-alt > 38412 [SYN, ACK] Seq=0 Ack=1 Win=14480 Len=0 MSS=1460 TSV=2293761 TSER=2261693 WS=6
  3   0.000325     10.0.1.3 -> 10.0.1.2     TCP 38412 > http-alt [ACK] Seq=1 Ack=1 Win=5888 Len=0 TSV=2261693 TSER=2293761
430270  38.391079     10.0.1.3 -> 10.0.1.2     TCP 38412 > http-alt [FIN, ACK] Seq=327 Ack=450439613 Win=2580480 Len=0 TSV=2271290 TSER=2303298
430271  38.391466     10.0.1.2 -> 10.0.1.3     TCP http-alt > 38412 [FIN, ACK] Seq=450439613 Ack=328 Win=15552 Len=0 TSV=2303359 TSER=2271290
  1   0.000000     10.0.1.3 -> 10.0.1.2     TCP 38414 > http-alt [SYN] Seq=0 Win=5840 Len=0 MSS=1460 TSV=2278163 TSER=0 WS=6
  2   0.000372     10.0.1.2 -> 10.0.1.3     TCP http-alt > 38414 [SYN, ACK] Seq=0 Ack=1 Win=14480 Len=0 MSS=1460 TSV=2310232 TSER=2278163 WS=6
  3   0.000394     10.0.1.3 -> 10.0.1.2     TCP 38414 > http-alt [ACK] Seq=1 Ack=1 Win=5888 Len=0 TSV=2278163 TSER=2310232
445524  38.397420     10.0.1.3 -> 10.0.1.2     TCP 38414 > http-alt [FIN, ACK] Seq=327 Ack=450439613 Win=2580480 Len=0 TSV=2287762 TSER=2319771
445525  38.397766     10.0.1.2 -> 10.0.1.3     TCP http-alt > 38414 [FIN, ACK] Seq=450439613 Ack=328 Win=15552 Len=0 TSV=2319832 TSER=2287762
  1   0.000000     10.0.1.3 -> 10.0.1.2     TCP 38416 > http-alt [SYN] Seq=0 Win=5840 Len=0 MSS=1460 TSV=2294388 TSER=0 WS=6
  2   0.000269     10.0.1.2 -> 10.0.1.3     TCP http-alt > 38416 [SYN, ACK] Seq=0 Ack=1 Win=14480 Len=0 MSS=1460 TSV=2326458 TSER=2294388 WS=6
  3   0.000290     10.0.1.3 -> 10.0.1.2     TCP 38416 > http-alt [ACK] Seq=1 Ack=1 Win=5888 Len=0 TSV=2294388 TSER=2326458
442862  38.396485     10.0.1.3 -> 10.0.1.2     TCP 38416 > http-alt [FIN, ACK] Seq=327 Ack=450439613 Win=2580480 Len=0 TSV=2303986 TSER=2335997
442863  38.396860     10.0.1.2 -> 10.0.1.3     TCP http-alt > 38416 [FIN, ACK] Seq=450439613 Ack=328 Win=15552 Len=0 TSV=2336058 TSER=2303986
  1   0.000000     10.0.1.3 -> 10.0.1.2     TCP 38418 > http-alt [SYN] Seq=0 Win=5840 Len=0 MSS=1460 TSV=2311226 TSER=0 WS=6
  2   0.000300     10.0.1.2 -> 10.0.1.3     TCP http-alt > 38418 [SYN, ACK] Seq=0 Ack=1 Win=14480 Len=0 MSS=1460 TSV=2343298 TSER=2311226 WS=6
  3   0.000322     10.0.1.3 -> 10.0.1.2     TCP 38418 > http-alt [ACK] Seq=1 Ack=1 Win=5888 Len=0 TSV=2311226 TSER=2343298
  1   0.000000     10.0.1.3 -> 10.0.1.2     TCP 38408 > http-alt [SYN] Seq=0 Win=5840 Len=0 MSS=1460 TSV=2328077 TSER=0 WS=6
  2   0.000309     10.0.1.2 -> 10.0.1.3     TCP http-alt > 38408 [SYN, ACK] Seq=0 Ack=1 Win=14480 Len=0 MSS=1460 TSV=2360150 TSER=2328077 WS=6
  3   0.000333     10.0.1.3 -> 10.0.1.2     TCP 38408 > http-alt [ACK] Seq=1 Ack=1 Win=5888 Len=0 TSV=2328077 TSER=2360150
448968  38.389697     10.0.1.3 -> 10.0.1.2     TCP 38408 > http-alt [FIN, ACK] Seq=327 Ack=450439613 Win=2580480 Len=0 TSV=2337674 TSER=2369688
448969  38.390050     10.0.1.2 -> 10.0.1.3     TCP http-alt > 38408 [FIN, ACK] Seq=450439613 Ack=328 Win=15552 Len=0 TSV=2369748 TSER=2337674
  1   0.000000     10.0.1.3 -> 10.0.1.2     TCP 38410 > http-alt [SYN] Seq=0 Win=5840 Len=0 MSS=1460 TSV=2347546 TSER=0 WS=6
  2   0.000281     10.0.1.2 -> 10.0.1.3     TCP http-alt > 38410 [SYN, ACK] Seq=0 Ack=1 Win=14480 Len=0 MSS=1460 TSV=2379621 TSER=2347546 WS=6
  3   0.000303     10.0.1.3 -> 10.0.1.2     TCP 38410 > http-alt [ACK] Seq=1 Ack=1 Win=5888 Len=0 TSV=2347546 TSER=2379621
435673  38.392510     10.0.1.3 -> 10.0.1.2     TCP 38410 > http-alt [FIN, ACK] Seq=327 Ack=450439613 Win=2580480 Len=0 TSV=2357144 TSER=2389159
435674  38.392845     10.0.1.2 -> 10.0.1.3     TCP http-alt > 38410 [FIN, ACK] Seq=450439613 Ack=328 Win=15552 Len=0 TSV=2389220 TSER=2357144
  1   0.000000     10.0.1.3 -> 10.0.1.2     TCP 38412 > http-alt [SYN] Seq=0 Win=5840 Len=0 MSS=1460 TSV=2367777 TSER=0 WS=6
  2   0.000301     10.0.1.2 -> 10.0.1.3     TCP http-alt > 38412 [SYN, ACK] Seq=0 Ack=1 Win=14480 Len=0 MSS=1460 TSV=2399853 TSER=2367777 WS=6
  3   0.000324     10.0.1.3 -> 10.0.1.2     TCP 38412 > http-alt [ACK] Seq=1 Ack=1 Win=5888 Len=0 TSV=2367777 TSER=2399853
431879  38.394193     10.0.1.3 -> 10.0.1.2     TCP 38412 > http-alt [FIN, ACK] Seq=327 Ack=450439613 Win=2580480 Len=0 TSV=2377375 TSER=2409392
431880  38.394505     10.0.1.2 -> 10.0.1.3     TCP http-alt > 38412 [FIN, ACK] Seq=450439613 Ack=328 Win=15552 Len=0 TSV=2409452 TSER=2377375
  1   0.000000     10.0.1.3 -> 10.0.1.2     TCP 38414 > http-alt [SYN] Seq=0 Win=5840 Len=0 MSS=1460 TSV=2384834 TSER=0 WS=6
  2   0.000287     10.0.1.2 -> 10.0.1.3     TCP http-alt > 38414 [SYN, ACK] Seq=0 Ack=1 Win=14480 Len=0 MSS=1460 TSV=2416911 TSER=2384834 WS=6
  3   0.000308     10.0.1.3 -> 10.0.1.2     TCP 38414 > http-alt [ACK] Seq=1 Ack=1 Win=5888 Len=0 TSV=2384834 TSER=2416911
436257  38.397245     10.0.1.3 -> 10.0.1.2     TCP 38414 > http-alt [FIN, ACK] Seq=327 Ack=450439613 Win=2580480 Len=0 TSV=2394433 TSER=2426451
436258  38.397626     10.0.1.2 -> 10.0.1.3     TCP http-alt > 38414 [FIN, ACK] Seq=450439613 Ack=328 Win=15552 Len=0 TSV=2426511 TSER=2394433
  1   0.000000     10.0.1.3 -> 10.0.1.2     TCP 36125 > http-alt [SYN] Seq=0 Win=5840 Len=0 MSS=1460 TSV=2401787 TSER=0 WS=6
  2   0.000309     10.0.1.2 -> 10.0.1.3     TCP http-alt > 36125 [SYN, ACK] Seq=0 Ack=1 Win=14480 Len=0 MSS=1460 TSV=2433865 TSER=2401787 WS=6
  3   0.000325     10.0.1.3 -> 10.0.1.2     TCP 36125 > http-alt [ACK] Seq=1 Ack=1 Win=5888 Len=0 TSV=2401787 TSER=2433865
464886  38.390523     10.0.1.3 -> 10.0.1.2     TCP 36125 > http-alt [FIN, ACK] Seq=327 Ack=450439613 Win=2580480 Len=0 TSV=2411384 TSER=2443404
464887  38.390885     10.0.1.2 -> 10.0.1.3     TCP http-alt > 36125 [FIN, ACK] Seq=450439613 Ack=328 Win=15552 Len=0 TSV=2443464 TSER=2411384
  1   0.000000     10.0.1.3 -> 10.0.1.2     TCP 36127 > http-alt [SYN] Seq=0 Win=5840 Len=0 MSS=1460 TSV=2418225 TSER=0 WS=6
  2   0.000284     10.0.1.2 -> 10.0.1.3     TCP http-alt > 36127 [SYN, ACK] Seq=0 Ack=1 Win=14480 Len=0 MSS=1460 TSV=2450305 TSER=2418225 WS=6
  3   0.000307     10.0.1.3 -> 10.0.1.2     TCP 36127 > http-alt [ACK] Seq=1 Ack=1 Win=5888 Len=0 TSV=2418225 TSER=2450305
420742  38.387191     10.0.1.3 -> 10.0.1.2     TCP 36127 > http-alt [FIN, ACK] Seq=327 Ack=450439613 Win=2580480 Len=0 TSV=2427822 TSER=2459843
420743  38.387559     10.0.1.2 -> 10.0.1.3     TCP http-alt > 36127 [FIN, ACK] Seq=450439613 Ack=328 Win=15552 Len=0 TSV=2459902 TSER=2427822
  1   0.000000     10.0.1.3 -> 10.0.1.2     TCP 36129 > http-alt [SYN] Seq=0 Win=5840 Len=0 MSS=1460 TSV=2437065 TSER=0 WS=6
  2   0.000320     10.0.1.2 -> 10.0.1.3     TCP http-alt > 36129 [SYN, ACK] Seq=0 Ack=1 Win=14480 Len=0 MSS=1460 TSV=2469146 TSER=2437065 WS=6
  3   0.000347     10.0.1.3 -> 10.0.1.2     TCP 36129 > http-alt [ACK] Seq=1 Ack=1 Win=5888 Len=0 TSV=2437065 TSER=2469146
431147  38.392793     10.0.1.3 -> 10.0.1.2     TCP 36129 > http-alt [FIN, ACK] Seq=327 Ack=450439613 Win=2580480 Len=0 TSV=2446663 TSER=2478684
431148  38.393201     10.0.1.2 -> 10.0.1.3     TCP http-alt > 36129 [FIN, ACK] Seq=450439613 Ack=328 Win=15552 Len=0 TSV=2478745 TSER=2446663
  1   0.000000     10.0.1.3 -> 10.0.1.2     TCP 36131 > http-alt [SYN] Seq=0 Win=5840 Len=0 MSS=1460 TSV=2453879 TSER=0 WS=6
  2   0.000370     10.0.1.2 -> 10.0.1.3     TCP http-alt > 36131 [SYN, ACK] Seq=0 Ack=1 Win=14480 Len=0 MSS=1460 TSV=2485961 TSER=2453879 WS=6
  3   0.000394     10.0.1.3 -> 10.0.1.2     TCP 36131 > http-alt [ACK] Seq=1 Ack=1 Win=5888 Len=0 TSV=2453879 TSER=2485961
411569  38.389984     10.0.1.3 -> 10.0.1.2     TCP 36131 > http-alt [FIN, ACK] Seq=327 Ack=450439613 Win=2580480 Len=0 TSV=2463476 TSER=2495501
411570  38.390386     10.0.1.2 -> 10.0.1.3     TCP http-alt > 36131 [FIN, ACK] Seq=450439613 Ack=328 Win=15552 Len=0 TSV=2495560 TSER=2463476
  1   0.000000     10.0.1.3 -> 10.0.1.2     TCP 36133 > http-alt [SYN] Seq=0 Win=5840 Len=0 MSS=1460 TSV=2470229 TSER=0 WS=6
  2   0.000294     10.0.1.2 -> 10.0.1.3     TCP http-alt > 36133 [SYN, ACK] Seq=0 Ack=1 Win=14480 Len=0 MSS=1460 TSV=2502313 TSER=2470229 WS=6
  3   0.000316     10.0.1.3 -> 10.0.1.2     TCP 36133 > http-alt [ACK] Seq=1 Ack=1 Win=5888 Len=0 TSV=2470230 TSER=2502313
445140  38.396261     10.0.1.3 -> 10.0.1.2     TCP 36133 > http-alt [FIN, ACK] Seq=327 Ack=450439613 Win=2580480 Len=0 TSV=2479828 TSER=2511853
445141  38.396620     10.0.1.2 -> 10.0.1.3     TCP http-alt > 36133 [FIN, ACK] Seq=450439613 Ack=328 Win=15552 Len=0 TSV=2511913 TSER=2479828
