  1   0.000000     10.0.1.3 -> 10.0.1.2     TCP 60287 > http-alt [SYN] Seq=0 Win=5840 Len=0 MSS=1460 TSV=7570022 TSER=0 WS=6
  2   0.000309     10.0.1.2 -> 10.0.1.3     TCP http-alt > 60287 [SYN, ACK] Seq=0 Ack=1 Win=14480 Len=0 MSS=1460 TSV=7623834 TSER=7570022 WS=6
  3   0.000329     10.0.1.3 -> 10.0.1.2     TCP 60287 > http-alt [ACK] Seq=1 Ack=1 Win=5888 Len=0 TSV=7570023 TSER=7623834
414355  34.137712     10.0.1.3 -> 10.0.1.2     TCP 60287 > http-alt [FIN, ACK] Seq=327 Ack=400390788 Win=2580480 Len=0 TSV=7578557 TSER=7632308
414356  34.138119     10.0.1.2 -> 10.0.1.3     TCP http-alt > 60287 [FIN, ACK] Seq=400390788 Ack=328 Win=15552 Len=0 TSV=7632369 TSER=7578557
================================================================================
IPv4 Conversations
Filter:<No Filter>
                                               |       <-      | |       ->      | |     Total     |
                                               | Frames  Bytes | | Frames  Bytes | | Frames  Bytes |
10.0.1.3             <-> 10.0.1.2              276531 418641841  137826   9096850  414357 427738691
================================================================================
  1   0.000000     10.0.1.3 -> 10.0.1.2     TCP 52313 > http-alt [SYN] Seq=0 Win=5840 Len=0 MSS=1460 TSV=7583100 TSER=0 WS=6
  2   0.000300     10.0.1.2 -> 10.0.1.3     TCP http-alt > 52313 [SYN, ACK] Seq=0 Ack=1 Win=14480 Len=0 MSS=1460 TSV=7636912 TSER=7583100 WS=6
  3   0.000322     10.0.1.3 -> 10.0.1.2     TCP 52313 > http-alt [ACK] Seq=1 Ack=1 Win=5888 Len=0 TSV=7583100 TSER=7636912
414451  34.135865     10.0.1.3 -> 10.0.1.2     TCP 52313 > http-alt [FIN, ACK] Seq=327 Ack=400390788 Win=2580480 Len=0 TSV=7591634 TSER=7645387
414452  34.136260     10.0.1.2 -> 10.0.1.3     TCP http-alt > 52313 [FIN, ACK] Seq=400390788 Ack=328 Win=15552 Len=0 TSV=7645447 TSER=7591634
================================================================================
IPv4 Conversations
Filter:<No Filter>
                                               |       <-      | |       ->      | |     Total     |
                                               | Frames  Bytes | | Frames  Bytes | | Frames  Bytes |
10.0.1.3             <-> 10.0.1.2              276615 418647385  137838   9097642  414453 427745027
================================================================================
  1   0.000000     10.0.1.3 -> 10.0.1.2     TCP 52315 > http-alt [SYN] Seq=0 Win=5840 Len=0 MSS=1460 TSV=7596204 TSER=0 WS=6
  2   0.000304     10.0.1.2 -> 10.0.1.3     TCP http-alt > 52315 [SYN, ACK] Seq=0 Ack=1 Win=14480 Len=0 MSS=1460 TSV=7650017 TSER=7596204 WS=6
  3   0.000328     10.0.1.3 -> 10.0.1.2     TCP 52315 > http-alt [ACK] Seq=1 Ack=1 Win=5888 Len=0 TSV=7596204 TSER=7650017
414378  34.138294     10.0.1.3 -> 10.0.1.2     TCP 52315 > http-alt [FIN, ACK] Seq=327 Ack=400390788 Win=2580480 Len=0 TSV=7604738 TSER=7658493
414379  34.138656     10.0.1.2 -> 10.0.1.3     TCP http-alt > 52315 [FIN, ACK] Seq=400390788 Ack=328 Win=15552 Len=0 TSV=7658552 TSER=7604738
================================================================================
IPv4 Conversations
Filter:<No Filter>
                                               |       <-      | |       ->      | |     Total     |
                                               | Frames  Bytes | | Frames  Bytes | | Frames  Bytes |
10.0.1.3             <-> 10.0.1.2              276591 418645801  137789   9094408  414380 427740209
================================================================================
  1   0.000000     10.0.1.3 -> 10.0.1.2     TCP 52319 > http-alt [SYN] Seq=0 Win=5840 Len=0 MSS=1460 TSV=7609247 TSER=0 WS=6
  2   0.000300     10.0.1.2 -> 10.0.1.3     TCP http-alt > 52319 [SYN, ACK] Seq=0 Ack=1 Win=14480 Len=0 MSS=1460 TSV=7663061 TSER=7609247 WS=6
  3   0.000320     10.0.1.3 -> 10.0.1.2     TCP 52319 > http-alt [ACK] Seq=1 Ack=1 Win=5888 Len=0 TSV=7609247 TSER=7663061
414067  34.137436     10.0.1.3 -> 10.0.1.2     TCP 52319 > http-alt [FIN, ACK] Seq=327 Ack=400390788 Win=2580480 Len=0 TSV=7617781 TSER=7671536
414068  34.137831     10.0.1.2 -> 10.0.1.3     TCP http-alt > 52319 [FIN, ACK] Seq=400390788 Ack=328 Win=15552 Len=0 TSV=7671596 TSER=7617781
================================================================================
IPv4 Conversations
Filter:<No Filter>
                                               |       <-      | |       ->      | |     Total     |
                                               | Frames  Bytes | | Frames  Bytes | | Frames  Bytes |
10.0.1.3             <-> 10.0.1.2              276543 418642633  137526   9077050  414069 427719683
================================================================================
  1   0.000000     10.0.1.3 -> 10.0.1.2     TCP 52321 > http-alt [SYN] Seq=0 Win=5840 Len=0 MSS=1460 TSV=7622306 TSER=0 WS=6
  2   0.000316     10.0.1.2 -> 10.0.1.3     TCP http-alt > 52321 [SYN, ACK] Seq=0 Ack=1 Win=14480 Len=0 MSS=1460 TSV=7676121 TSER=7622306 WS=6
  3   0.000338     10.0.1.3 -> 10.0.1.2     TCP 52321 > http-alt [ACK] Seq=1 Ack=1 Win=5888 Len=0 TSV=7622306 TSER=7676121
414467  34.137030     10.0.1.3 -> 10.0.1.2     TCP 52321 > http-alt [FIN, ACK] Seq=327 Ack=400390788 Win=2580480 Len=0 TSV=7630840 TSER=7684596
414468  34.137372     10.0.1.2 -> 10.0.1.3     TCP http-alt > 52321 [FIN, ACK] Seq=400390788 Ack=328 Win=15552 Len=0 TSV=7684656 TSER=7630840
================================================================================
IPv4 Conversations
Filter:<No Filter>
                                               |       <-      | |       ->      | |     Total     |
                                               | Frames  Bytes | | Frames  Bytes | | Frames  Bytes |
10.0.1.3             <-> 10.0.1.2              276584 418645339  137885   9100744  414469 427746083
================================================================================
  1   0.000000     10.0.1.3 -> 10.0.1.2     TCP 52323 > http-alt [SYN] Seq=0 Win=5840 Len=0 MSS=1460 TSV=7635416 TSER=0 WS=6
  2   0.000285     10.0.1.2 -> 10.0.1.3     TCP http-alt > 52323 [SYN, ACK] Seq=0 Ack=1 Win=14480 Len=0 MSS=1460 TSV=7689232 TSER=7635416 WS=6
  3   0.000309     10.0.1.3 -> 10.0.1.2     TCP 52323 > http-alt [ACK] Seq=1 Ack=1 Win=5888 Len=0 TSV=7635416 TSER=7689232
414246  34.138095     10.0.1.3 -> 10.0.1.2     TCP 52323 > http-alt [FIN, ACK] Seq=327 Ack=400390788 Win=2580480 Len=0 TSV=7643950 TSER=7697706
414247  34.138461     10.0.1.2 -> 10.0.1.3     TCP http-alt > 52323 [FIN, ACK] Seq=400390788 Ack=328 Win=15552 Len=0 TSV=7697767 TSER=7643950
================================================================================
IPv4 Conversations
Filter:<No Filter>
                                               |       <-      | |       ->      | |     Total     |
                                               | Frames  Bytes | | Frames  Bytes | | Frames  Bytes |
10.0.1.3             <-> 10.0.1.2              276586 418645471  137662   9086026  414248 427731497
================================================================================
  1   0.000000     10.0.1.3 -> 10.0.1.2     TCP 52325 > http-alt [SYN] Seq=0 Win=5840 Len=0 MSS=1460 TSV=7648492 TSER=0 WS=6
  2   0.000270     10.0.1.2 -> 10.0.1.3     TCP http-alt > 52325 [SYN, ACK] Seq=0 Ack=1 Win=14480 Len=0 MSS=1460 TSV=7702309 TSER=7648492 WS=6
  3   0.000292     10.0.1.3 -> 10.0.1.2     TCP 52325 > http-alt [ACK] Seq=1 Ack=1 Win=5888 Len=0 TSV=7648492 TSER=7702309
413924  34.130866     10.0.1.3 -> 10.0.1.2     TCP 52325 > http-alt [FIN, ACK] Seq=327 Ack=400390788 Win=2580480 Len=0 TSV=7657025 TSER=7710783
413925  34.131223     10.0.1.2 -> 10.0.1.3     TCP http-alt > 52325 [FIN, ACK] Seq=400390788 Ack=328 Win=15552 Len=0 TSV=7710843 TSER=7657025
================================================================================
IPv4 Conversations
Filter:<No Filter>
                                               |       <-      | |       ->      | |     Total     |
                                               | Frames  Bytes | | Frames  Bytes | | Frames  Bytes |
10.0.1.3             <-> 10.0.1.2              276527 418641577  137399   9068668  413926 427710245
================================================================================
  1   0.000000     10.0.1.3 -> 10.0.1.2     TCP 33835 > http-alt [SYN] Seq=0 Win=5840 Len=0 MSS=1460 TSV=7661579 TSER=0 WS=6
  2   0.000285     10.0.1.2 -> 10.0.1.3     TCP http-alt > 33835 [SYN, ACK] Seq=0 Ack=1 Win=14480 Len=0 MSS=1460 TSV=7715397 TSER=7661579 WS=6
  3   0.000308     10.0.1.3 -> 10.0.1.2     TCP 33835 > http-alt [ACK] Seq=1 Ack=1 Win=5888 Len=0 TSV=7661579 TSER=7715397
414389  34.673871     10.0.1.3 -> 10.0.1.2     TCP 33835 > http-alt [FIN, ACK] Seq=327 Ack=400390788 Win=2580480 Len=0 TSV=7670248 TSER=7723872
414390  34.674267     10.0.1.2 -> 10.0.1.3     TCP http-alt > 33835 [FIN, ACK] Seq=400390788 Ack=328 Win=15552 Len=0 TSV=7724066 TSER=7670248
================================================================================
IPv4 Conversations
Filter:<No Filter>
                                               |       <-      | |       ->      | |     Total     |
                                               | Frames  Bytes | | Frames  Bytes | | Frames  Bytes |
10.0.1.3             <-> 10.0.1.2              276580 418645075  137811   9095860  414391 427740935
================================================================================
  1   0.000000     10.0.1.3 -> 10.0.1.2     TCP 33839 > http-alt [SYN] Seq=0 Win=5840 Len=0 MSS=1460 TSV=7674792 TSER=0 WS=6
  2   0.000303     10.0.1.2 -> 10.0.1.3     TCP http-alt > 33839 [SYN, ACK] Seq=0 Ack=1 Win=14480 Len=0 MSS=1460 TSV=7728611 TSER=7674792 WS=6
  3   0.000325     10.0.1.3 -> 10.0.1.2     TCP 33839 > http-alt [ACK] Seq=1 Ack=1 Win=5888 Len=0 TSV=7674792 TSER=7728611
414161  34.134825     10.0.1.3 -> 10.0.1.2     TCP 33839 > http-alt [FIN, ACK] Seq=327 Ack=400390788 Win=2580480 Len=0 TSV=7683325 TSER=7737084
414162  34.135185     10.0.1.2 -> 10.0.1.3     TCP http-alt > 33839 [FIN, ACK] Seq=400390788 Ack=328 Win=15552 Len=0 TSV=7737145 TSER=7683325
================================================================================
IPv4 Conversations
Filter:<No Filter>
                                               |       <-      | |       ->      | |     Total     |
                                               | Frames  Bytes | | Frames  Bytes | | Frames  Bytes |
10.0.1.3             <-> 10.0.1.2              276558 418643623  137605   9082264  414163 427725887
================================================================================
  1   0.000000     10.0.1.3 -> 10.0.1.2     TCP 33841 > http-alt [SYN] Seq=0 Win=5840 Len=0 MSS=1460 TSV=7687874 TSER=0 WS=6
  2   0.000301     10.0.1.2 -> 10.0.1.3     TCP http-alt > 33841 [SYN, ACK] Seq=0 Ack=1 Win=14480 Len=0 MSS=1460 TSV=7741694 TSER=7687874 WS=6
  3   0.000324     10.0.1.3 -> 10.0.1.2     TCP 33841 > http-alt [ACK] Seq=1 Ack=1 Win=5888 Len=0 TSV=7687874 TSER=7741694
414534  34.521589     10.0.1.3 -> 10.0.1.2     TCP 33841 > http-alt [FIN, ACK] Seq=327 Ack=400390788 Win=2580480 Len=0 TSV=7696504 TSER=7750168
414535  34.521962     10.0.1.2 -> 10.0.1.3     TCP http-alt > 33841 [FIN, ACK] Seq=400390788 Ack=328 Win=15552 Len=0 TSV=7750325 TSER=7696504
================================================================================
IPv4 Conversations
Filter:<No Filter>
                                               |       <-      | |       ->      | |     Total     |
                                               | Frames  Bytes | | Frames  Bytes | | Frames  Bytes |
10.0.1.3             <-> 10.0.1.2              276615 418647385  137921   9103120  414536 427750505
================================================================================
  1   0.000000     10.0.1.3 -> 10.0.1.2     TCP 33843 > http-alt [SYN] Seq=0 Win=5840 Len=0 MSS=1460 TSV=7701063 TSER=0 WS=6
  2   0.000310     10.0.1.2 -> 10.0.1.3     TCP http-alt > 33843 [SYN, ACK] Seq=0 Ack=1 Win=14480 Len=0 MSS=1460 TSV=7754884 TSER=7701063 WS=6
  3   0.000334     10.0.1.3 -> 10.0.1.2     TCP 33843 > http-alt [ACK] Seq=1 Ack=1 Win=5888 Len=0 TSV=7701063 TSER=7754884
414541  34.126142     10.0.1.3 -> 10.0.1.2     TCP 33843 > http-alt [FIN, ACK] Seq=327 Ack=400390788 Win=2580480 Len=0 TSV=7709594 TSER=7763357
414542  34.126504     10.0.1.2 -> 10.0.1.3     TCP http-alt > 33843 [FIN, ACK] Seq=400390788 Ack=328 Win=15552 Len=0 TSV=7763416 TSER=7709594
================================================================================
IPv4 Conversations
Filter:<No Filter>
                                               |       <-      | |       ->      | |     Total     |
                                               | Frames  Bytes | | Frames  Bytes | | Frames  Bytes |
10.0.1.3             <-> 10.0.1.2              276574 418644679  137969   9106288  414543 427750967
================================================================================
  1   0.000000     10.0.1.3 -> 10.0.1.2     TCP 33845 > http-alt [SYN] Seq=0 Win=5840 Len=0 MSS=1460 TSV=7714165 TSER=0 WS=6
  2   0.000371     10.0.1.2 -> 10.0.1.3     TCP http-alt > 33845 [SYN, ACK] Seq=0 Ack=1 Win=14480 Len=0 MSS=1460 TSV=7767987 TSER=7714165 WS=6
  3   0.000393     10.0.1.3 -> 10.0.1.2     TCP 33845 > http-alt [ACK] Seq=1 Ack=1 Win=5888 Len=0 TSV=7714165 TSER=7767987
414321  34.431836     10.0.1.3 -> 10.0.1.2     TCP 33845 > http-alt [FIN, ACK] Seq=327 Ack=400390788 Win=2580480 Len=0 TSV=7722773 TSER=7776463
414322  34.432201     10.0.1.2 -> 10.0.1.3     TCP http-alt > 33845 [FIN, ACK] Seq=400390788 Ack=328 Win=15552 Len=0 TSV=7776596 TSER=7722773
================================================================================
IPv4 Conversations
Filter:<No Filter>
                                               |       <-      | |       ->      | |     Total     |
                                               | Frames  Bytes | | Frames  Bytes | | Frames  Bytes |
10.0.1.3             <-> 10.0.1.2              276569 418644349  137754   9092098  414323 427736447
================================================================================
  1   0.000000     10.0.1.3 -> 10.0.1.2     TCP 41391 > http-alt [SYN] Seq=0 Win=5840 Len=0 MSS=1460 TSV=7727369 TSER=0 WS=6
  2   0.000297     10.0.1.2 -> 10.0.1.3     TCP http-alt > 41391 [SYN, ACK] Seq=0 Ack=1 Win=14480 Len=0 MSS=1460 TSV=7781192 TSER=7727369 WS=6
  3   0.000319     10.0.1.3 -> 10.0.1.2     TCP 41391 > http-alt [ACK] Seq=1 Ack=1 Win=5888 Len=0 TSV=7727369 TSER=7781192
413975  34.137214     10.0.1.3 -> 10.0.1.2     TCP 41391 > http-alt [FIN, ACK] Seq=327 Ack=400390788 Win=2580480 Len=0 TSV=7735903 TSER=7789666
413976  34.137580     10.0.1.2 -> 10.0.1.3     TCP http-alt > 41391 [FIN, ACK] Seq=400390788 Ack=328 Win=15552 Len=0 TSV=7789727 TSER=7735903
================================================================================
IPv4 Conversations
Filter:<No Filter>
                                               |       <-      | |       ->      | |     Total     |
                                               | Frames  Bytes | | Frames  Bytes | | Frames  Bytes |
10.0.1.3             <-> 10.0.1.2              276548 418642963  137429   9070648  413977 427713611
================================================================================
  1   0.000000     10.0.1.3 -> 10.0.1.2     TCP 41393 > http-alt [SYN] Seq=0 Win=5840 Len=0 MSS=1460 TSV=7740429 TSER=0 WS=6
  2   0.000271     10.0.1.2 -> 10.0.1.3     TCP http-alt > 41393 [SYN, ACK] Seq=0 Ack=1 Win=14480 Len=0 MSS=1460 TSV=7794253 TSER=7740429 WS=6
  3   0.000295     10.0.1.3 -> 10.0.1.2     TCP 41393 > http-alt [ACK] Seq=1 Ack=1 Win=5888 Len=0 TSV=7740429 TSER=7794253
414340  34.395666     10.0.1.3 -> 10.0.1.2     TCP 41393 > http-alt [FIN, ACK] Seq=327 Ack=400390788 Win=2580480 Len=0 TSV=7749028 TSER=7802728
414341  34.396072     10.0.1.2 -> 10.0.1.3     TCP http-alt > 41393 [FIN, ACK] Seq=400390788 Ack=328 Win=15552 Len=0 TSV=7802853 TSER=7749028
================================================================================
IPv4 Conversations
Filter:<No Filter>
                                               |       <-      | |       ->      | |     Total     |
                                               | Frames  Bytes | | Frames  Bytes | | Frames  Bytes |
10.0.1.3             <-> 10.0.1.2              276522 418641247  137820   9096454  414342 427737701
================================================================================
  1   0.000000     10.0.1.3 -> 10.0.1.2     TCP 41397 > http-alt [SYN] Seq=0 Win=5840 Len=0 MSS=1460 TSV=7753600 TSER=0 WS=6
  2   0.000285     10.0.1.2 -> 10.0.1.3     TCP http-alt > 41397 [SYN, ACK] Seq=0 Ack=1 Win=14480 Len=0 MSS=1460 TSV=7807425 TSER=7753600 WS=6
  3   0.000307     10.0.1.3 -> 10.0.1.2     TCP 41397 > http-alt [ACK] Seq=1 Ack=1 Win=5888 Len=0 TSV=7753600 TSER=7807425
414389  34.129896     10.0.1.3 -> 10.0.1.2     TCP 41397 > http-alt [FIN, ACK] Seq=327 Ack=400390788 Win=2580480 Len=0 TSV=7762133 TSER=7815898
414390  34.130271     10.0.1.2 -> 10.0.1.3     TCP http-alt > 41397 [FIN, ACK] Seq=400390788 Ack=328 Win=15552 Len=0 TSV=7815958 TSER=7762133
================================================================================
IPv4 Conversations
Filter:<No Filter>
                                               |       <-      | |       ->      | |     Total     |
                                               | Frames  Bytes | | Frames  Bytes | | Frames  Bytes |
10.0.1.3             <-> 10.0.1.2              276545 418642765  137846   9098170  414391 427740935
================================================================================
  1   0.000000     10.0.1.3 -> 10.0.1.2     TCP 41399 > http-alt [SYN] Seq=0 Win=5840 Len=0 MSS=1460 TSV=7766700 TSER=0 WS=6
  2   0.000269     10.0.1.2 -> 10.0.1.3     TCP http-alt > 41399 [SYN, ACK] Seq=0 Ack=1 Win=14480 Len=0 MSS=1460 TSV=7820526 TSER=7766700 WS=6
  3   0.000291     10.0.1.3 -> 10.0.1.2     TCP 41399 > http-alt [ACK] Seq=1 Ack=1 Win=5888 Len=0 TSV=7766700 TSER=7820526
414418  34.127040     10.0.1.3 -> 10.0.1.2     TCP 41399 > http-alt [FIN, ACK] Seq=327 Ack=400390788 Win=2580480 Len=0 TSV=7775232 TSER=7829000
414419  34.127449     10.0.1.2 -> 10.0.1.3     TCP http-alt > 41399 [FIN, ACK] Seq=400390788 Ack=328 Win=15552 Len=0 TSV=7829059 TSER=7775232
================================================================================
IPv4 Conversations
Filter:<No Filter>
                                               |       <-      | |       ->      | |     Total     |
                                               | Frames  Bytes | | Frames  Bytes | | Frames  Bytes |
10.0.1.3             <-> 10.0.1.2              276603 418646593  137817   9096256  414420 427742849
================================================================================
  1   0.000000     10.0.1.3 -> 10.0.1.2     TCP 41401 > http-alt [SYN] Seq=0 Win=5840 Len=0 MSS=1460 TSV=7779822 TSER=0 WS=6
  2   0.000292     10.0.1.2 -> 10.0.1.3     TCP http-alt > 41401 [SYN, ACK] Seq=0 Ack=1 Win=14480 Len=0 MSS=1460 TSV=7833649 TSER=7779822 WS=6
  3   0.000314     10.0.1.3 -> 10.0.1.2     TCP 41401 > http-alt [ACK] Seq=1 Ack=1 Win=5888 Len=0 TSV=7779822 TSER=7833649
414792  34.281263     10.0.1.3 -> 10.0.1.2     TCP 41401 > http-alt [FIN, ACK] Seq=327 Ack=400390788 Win=2580480 Len=0 TSV=7788392 TSER=7842161
414793  34.281676     10.0.1.2 -> 10.0.1.3     TCP http-alt > 41401 [FIN, ACK] Seq=400390788 Ack=328 Win=15552 Len=0 TSV=7842220 TSER=7788392
================================================================================
IPv4 Conversations
Filter:<No Filter>
                                               |       <-      | |       ->      | |     Total     |
                                               | Frames  Bytes | | Frames  Bytes | | Frames  Bytes |
10.0.1.3             <-> 10.0.1.2              276772 418657747  138022   9109786  414794 427767533
================================================================================
  1   0.000000     10.0.1.3 -> 10.0.1.2     TCP 41403 > http-alt [SYN] Seq=0 Win=5840 Len=0 MSS=1460 TSV=7792936 TSER=0 WS=6
  2   0.000319     10.0.1.2 -> 10.0.1.3     TCP http-alt > 41403 [SYN, ACK] Seq=0 Ack=1 Win=14480 Len=0 MSS=1460 TSV=7846764 TSER=7792936 WS=6
  3   0.000343     10.0.1.3 -> 10.0.1.2     TCP 41403 > http-alt [ACK] Seq=1 Ack=1 Win=5888 Len=0 TSV=7792936 TSER=7846764
414212  34.451556     10.0.1.3 -> 10.0.1.2     TCP 41403 > http-alt [FIN, ACK] Seq=327 Ack=400390788 Win=2580480 Len=0 TSV=7801549 TSER=7855239
414213  34.451936     10.0.1.2 -> 10.0.1.3     TCP http-alt > 41403 [FIN, ACK] Seq=400390788 Ack=328 Win=15552 Len=0 TSV=7855378 TSER=7801549
================================================================================
IPv4 Conversations
Filter:<No Filter>
                                               |       <-      | |       ->      | |     Total     |
                                               | Frames  Bytes | | Frames  Bytes | | Frames  Bytes |
10.0.1.3             <-> 10.0.1.2              276553 418643293  137661   9085960  414214 427729253
================================================================================
  1   0.000000     10.0.1.3 -> 10.0.1.2     TCP 43576 > http-alt [SYN] Seq=0 Win=5840 Len=0 MSS=1460 TSV=7806099 TSER=0 WS=6
  2   0.000309     10.0.1.2 -> 10.0.1.3     TCP http-alt > 43576 [SYN, ACK] Seq=0 Ack=1 Win=14480 Len=0 MSS=1460 TSV=7859929 TSER=7806099 WS=6
  3   0.000332     10.0.1.3 -> 10.0.1.2     TCP 43576 > http-alt [ACK] Seq=1 Ack=1 Win=5888 Len=0 TSV=7806099 TSER=7859929
414274  34.142286     10.0.1.3 -> 10.0.1.2     TCP 43576 > http-alt [FIN, ACK] Seq=327 Ack=400390788 Win=2580480 Len=0 TSV=7814635 TSER=7868404
414275  34.142676     10.0.1.2 -> 10.0.1.3     TCP http-alt > 43576 [FIN, ACK] Seq=400390788 Ack=328 Win=15552 Len=0 TSV=7868465 TSER=7814635
================================================================================
IPv4 Conversations
Filter:<No Filter>
                                               |       <-      | |       ->      | |     Total     |
                                               | Frames  Bytes | | Frames  Bytes | | Frames  Bytes |
10.0.1.3             <-> 10.0.1.2              276523 418641313  137753   9092032  414276 427733345
================================================================================
  1   0.000000     10.0.1.3 -> 10.0.1.2     TCP 43578 > http-alt [SYN] Seq=0 Win=5840 Len=0 MSS=1460 TSV=7819192 TSER=0 WS=6
  2   0.000297     10.0.1.2 -> 10.0.1.3     TCP http-alt > 43578 [SYN, ACK] Seq=0 Ack=1 Win=14480 Len=0 MSS=1460 TSV=7873023 TSER=7819192 WS=6
  3   0.000322     10.0.1.3 -> 10.0.1.2     TCP 43578 > http-alt [ACK] Seq=1 Ack=1 Win=5888 Len=0 TSV=7819192 TSER=7873023
414543  34.137665     10.0.1.3 -> 10.0.1.2     TCP 43578 > http-alt [FIN, ACK] Seq=327 Ack=400390788 Win=2580480 Len=0 TSV=7827727 TSER=7881497
414544  34.138068     10.0.1.2 -> 10.0.1.3     TCP http-alt > 43578 [FIN, ACK] Seq=400390788 Ack=328 Win=15552 Len=0 TSV=7881558 TSER=7827727
================================================================================
IPv4 Conversations
Filter:<No Filter>
                                               |       <-      | |       ->      | |     Total     |
                                               | Frames  Bytes | | Frames  Bytes | | Frames  Bytes |
10.0.1.3             <-> 10.0.1.2              276590 418645735  137955   9105364  414545 427751099
================================================================================
