  1   0.000000     10.0.1.3 -> 10.0.1.2     TCP 45022 > http-alt [SYN] Seq=0 Win=5840 Len=0 MSS=1460 TSV=1832375 TSER=0 WS=6
  2   0.000280     10.0.1.2 -> 10.0.1.3     TCP http-alt > 45022 [SYN, ACK] Seq=0 Ack=1 Win=14480 Len=0 MSS=1460 TSV=1864411 TSER=1832375 WS=6
  3   0.000306     10.0.1.3 -> 10.0.1.2     TCP 45022 > http-alt [ACK] Seq=1 Ack=1 Win=5888 Len=0 TSV=1832375 TSER=1864411
394385  34.137426     10.0.1.3 -> 10.0.1.2     TCP 45022 > http-alt [FIN, ACK] Seq=327 Ack=400390788 Win=2580480 Len=0 TSV=1840909 TSER=1872886
394386  34.137796     10.0.1.2 -> 10.0.1.3     TCP http-alt > 45022 [FIN, ACK] Seq=400390788 Ack=328 Win=15552 Len=0 TSV=1872946 TSER=1840909
  1   0.000000     10.0.1.3 -> 10.0.1.2     TCP 45024 > http-alt [SYN] Seq=0 Win=5840 Len=0 MSS=1460 TSV=1847444 TSER=0 WS=6
  2   0.000319     10.0.1.2 -> 10.0.1.3     TCP http-alt > 45024 [SYN, ACK] Seq=0 Ack=1 Win=14480 Len=0 MSS=1460 TSV=1879481 TSER=1847444 WS=6
  3   0.000340     10.0.1.3 -> 10.0.1.2     TCP 45024 > http-alt [ACK] Seq=1 Ack=1 Win=5888 Len=0 TSV=1847445 TSER=1879481
413123  34.128838     10.0.1.3 -> 10.0.1.2     TCP 45024 > http-alt [FIN, ACK] Seq=327 Ack=400390788 Win=2580480 Len=0 TSV=1855976 TSER=1887955
413124  34.129189     10.0.1.2 -> 10.0.1.3     TCP http-alt > 45024 [FIN, ACK] Seq=400390788 Ack=328 Win=15552 Len=0 TSV=1888014 TSER=1855976
  1   0.000000     10.0.1.3 -> 10.0.1.2     TCP 45026 > http-alt [SYN] Seq=0 Win=5840 Len=0 MSS=1460 TSV=1862826 TSER=0 WS=6
  2   0.000304     10.0.1.2 -> 10.0.1.3     TCP http-alt > 45026 [SYN, ACK] Seq=0 Ack=1 Win=14480 Len=0 MSS=1460 TSV=1894863 TSER=1862826 WS=6
  3   0.000327     10.0.1.3 -> 10.0.1.2     TCP 45026 > http-alt [ACK] Seq=1 Ack=1 Win=5888 Len=0 TSV=1862826 TSER=1894863
379828  34.136774     10.0.1.3 -> 10.0.1.2     TCP 45026 > http-alt [FIN, ACK] Seq=327 Ack=400390788 Win=2580480 Len=0 TSV=1871360 TSER=1903339
379829  34.137158     10.0.1.2 -> 10.0.1.3     TCP http-alt > 45026 [FIN, ACK] Seq=400390788 Ack=328 Win=15552 Len=0 TSV=1903398 TSER=1871360
  1   0.000000     10.0.1.3 -> 10.0.1.2     TCP 48783 > http-alt [SYN] Seq=0 Win=5840 Len=0 MSS=1460 TSV=1878020 TSER=0 WS=6
  2   0.000281     10.0.1.2 -> 10.0.1.3     TCP http-alt > 48783 [SYN, ACK] Seq=0 Ack=1 Win=14480 Len=0 MSS=1460 TSV=1910059 TSER=1878020 WS=6
  3   0.000303     10.0.1.3 -> 10.0.1.2     TCP 48783 > http-alt [ACK] Seq=1 Ack=1 Win=5888 Len=0 TSV=1878020 TSER=1910059
401045  35.056569     10.0.1.3 -> 10.0.1.2     TCP 48783 > http-alt [FIN, ACK] Seq=327 Ack=400390788 Win=2580480 Len=0 TSV=1886784 TSER=1918533
401046  35.056930     10.0.1.2 -> 10.0.1.3     TCP http-alt > 48783 [FIN, ACK] Seq=400390788 Ack=328 Win=15552 Len=0 TSV=1918824 TSER=1886784
  1   0.000000     10.0.1.3 -> 10.0.1.2     TCP 48788 > http-alt [SYN] Seq=0 Win=5840 Len=0 MSS=1460 TSV=1893503 TSER=0 WS=6
  2   0.000282     10.0.1.2 -> 10.0.1.3     TCP http-alt > 48788 [SYN, ACK] Seq=0 Ack=1 Win=14480 Len=0 MSS=1460 TSV=1925543 TSER=1893503 WS=6
  3   0.000301     10.0.1.3 -> 10.0.1.2     TCP 48788 > http-alt [ACK] Seq=1 Ack=1 Win=5888 Len=0 TSV=1893503 TSER=1925543
  1   0.000000     10.0.1.3 -> 10.0.1.2     TCP 48790 > http-alt [SYN] Seq=0 Win=5840 Len=0 MSS=1460 TSV=1908698 TSER=0 WS=6
  2   0.000293     10.0.1.2 -> 10.0.1.3     TCP http-alt > 48790 [SYN, ACK] Seq=0 Ack=1 Win=14480 Len=0 MSS=1460 TSV=1940739 TSER=1908698 WS=6
  3   0.000311     10.0.1.3 -> 10.0.1.2     TCP 48790 > http-alt [ACK] Seq=1 Ack=1 Win=5888 Len=0 TSV=1908698 TSER=1940739
369640  34.140945     10.0.1.3 -> 10.0.1.2     TCP 48790 > http-alt [FIN, ACK] Seq=327 Ack=400390788 Win=2580480 Len=0 TSV=1917233 TSER=1949216
369641  34.141319     10.0.1.2 -> 10.0.1.3     TCP http-alt > 48790 [FIN, ACK] Seq=400390788 Ack=328 Win=15552 Len=0 TSV=1949275 TSER=1917233
  1   0.000000     10.0.1.3 -> 10.0.1.2     TCP 48792 > http-alt [SYN] Seq=0 Win=5840 Len=0 MSS=1460 TSV=1923599 TSER=0 WS=6
  2   0.000292     10.0.1.2 -> 10.0.1.3     TCP http-alt > 48792 [SYN, ACK] Seq=0 Ack=1 Win=14480 Len=0 MSS=1460 TSV=1955641 TSER=1923599 WS=6
  3   0.000314     10.0.1.3 -> 10.0.1.2     TCP 48792 > http-alt [ACK] Seq=1 Ack=1 Win=5888 Len=0 TSV=1923599 TSER=1955641
352938  34.130386     10.0.1.3 -> 10.0.1.2     TCP 48792 > http-alt [FIN, ACK] Seq=327 Ack=400390788 Win=2580480 Len=0 TSV=1932131 TSER=1964115
352939  34.130762     10.0.1.2 -> 10.0.1.3     TCP http-alt > 48792 [FIN, ACK] Seq=400390788 Ack=328 Win=15552 Len=0 TSV=1964175 TSER=1932131
  1   0.000000     10.0.1.3 -> 10.0.1.2     TCP 48794 > http-alt [SYN] Seq=0 Win=5840 Len=0 MSS=1460 TSV=1939692 TSER=0 WS=6
  2   0.000359     10.0.1.2 -> 10.0.1.3     TCP http-alt > 48794 [SYN, ACK] Seq=0 Ack=1 Win=14480 Len=0 MSS=1460 TSV=1971735 TSER=1939692 WS=6
  3   0.000381     10.0.1.3 -> 10.0.1.2     TCP 48794 > http-alt [ACK] Seq=1 Ack=1 Win=5888 Len=0 TSV=1939692 TSER=1971735
372230  34.146504     10.0.1.3 -> 10.0.1.2     TCP 48794 > http-alt [FIN, ACK] Seq=327 Ack=400390788 Win=2580480 Len=0 TSV=1948228 TSER=1980212
372231  34.146887     10.0.1.2 -> 10.0.1.3     TCP http-alt > 48794 [FIN, ACK] Seq=400390788 Ack=328 Win=15552 Len=0 TSV=1980272 TSER=1948228
  1   0.000000     10.0.1.3 -> 10.0.1.2     TCP 43419 > http-alt [SYN] Seq=0 Win=5840 Len=0 MSS=1460 TSV=1957121 TSER=0 WS=6
  2   0.000302     10.0.1.2 -> 10.0.1.3     TCP http-alt > 43419 [SYN, ACK] Seq=0 Ack=1 Win=14480 Len=0 MSS=1460 TSV=1989166 TSER=1957121 WS=6
  3   0.000324     10.0.1.3 -> 10.0.1.2     TCP 43419 > http-alt [ACK] Seq=1 Ack=1 Win=5888 Len=0 TSV=1957121 TSER=1989166
413191  34.136532     10.0.1.3 -> 10.0.1.2     TCP 43419 > http-alt [FIN, ACK] Seq=327 Ack=400390788 Win=2580480 Len=0 TSV=1965655 TSER=1997639
413192  34.139514     10.0.1.2 -> 10.0.1.3     TCP http-alt > 43419 [FIN, ACK] Seq=400390788 Ack=328 Win=15552 Len=0 TSV=1997701 TSER=1965655
  1   0.000000     10.0.1.3 -> 10.0.1.2     TCP 43421 > http-alt [SYN] Seq=0 Win=5840 Len=0 MSS=1460 TSV=1972480 TSER=0 WS=6
  2   0.000374     10.0.1.2 -> 10.0.1.3     TCP http-alt > 43421 [SYN, ACK] Seq=0 Ack=1 Win=14480 Len=0 MSS=1460 TSV=2004526 TSER=1972480 WS=6
  3   0.000398     10.0.1.3 -> 10.0.1.2     TCP 43421 > http-alt [ACK] Seq=1 Ack=1 Win=5888 Len=0 TSV=1972480 TSER=2004526
375366  34.140256     10.0.1.3 -> 10.0.1.2     TCP 43421 > http-alt [FIN, ACK] Seq=327 Ack=400390788 Win=2580480 Len=0 TSV=1981015 TSER=2013001
375367  34.140661     10.0.1.2 -> 10.0.1.3     TCP http-alt > 43421 [FIN, ACK] Seq=400390788 Ack=328 Win=15552 Len=0 TSV=2013062 TSER=1981015
  1   0.000000     10.0.1.3 -> 10.0.1.2     TCP 43423 > http-alt [SYN] Seq=0 Win=5840 Len=0 MSS=1460 TSV=1987847 TSER=0 WS=6
  2   0.000288     10.0.1.2 -> 10.0.1.3     TCP http-alt > 43423 [SYN, ACK] Seq=0 Ack=1 Win=14480 Len=0 MSS=1460 TSV=2019895 TSER=1987847 WS=6
  3   0.000312     10.0.1.3 -> 10.0.1.2     TCP 43423 > http-alt [ACK] Seq=1 Ack=1 Win=5888 Len=0 TSV=1987847 TSER=2019895
385407  34.136549     10.0.1.3 -> 10.0.1.2     TCP 43423 > http-alt [FIN, ACK] Seq=327 Ack=400390788 Win=2580480 Len=0 TSV=1996382 TSER=2028369
385408  34.136942     10.0.1.2 -> 10.0.1.3     TCP http-alt > 43423 [FIN, ACK] Seq=400390788 Ack=328 Win=15552 Len=0 TSV=2028430 TSER=1996382
  1   0.000000     10.0.1.3 -> 10.0.1.2     TCP 43427 > http-alt [SYN] Seq=0 Win=5840 Len=0 MSS=1460 TSV=2002360 TSER=0 WS=6
  2   0.000303     10.0.1.2 -> 10.0.1.3     TCP http-alt > 43427 [SYN, ACK] Seq=0 Ack=1 Win=14480 Len=0 MSS=1460 TSV=2034409 TSER=2002360 WS=6
  3   0.000327     10.0.1.3 -> 10.0.1.2     TCP 43427 > http-alt [ACK] Seq=1 Ack=1 Win=5888 Len=0 TSV=2002361 TSER=2034409
377970  34.131679     10.0.1.3 -> 10.0.1.2     TCP 43427 > http-alt [FIN, ACK] Seq=327 Ack=400390788 Win=2580480 Len=0 TSV=2010893 TSER=2042883
377971  34.132044     10.0.1.2 -> 10.0.1.3     TCP http-alt > 43427 [FIN, ACK] Seq=400390788 Ack=328 Win=15552 Len=0 TSV=2042942 TSER=2010893
  1   0.000000     10.0.1.3 -> 10.0.1.2     TCP 43429 > http-alt [SYN] Seq=0 Win=5840 Len=0 MSS=1460 TSV=2017350 TSER=0 WS=6
  2   0.000294     10.0.1.2 -> 10.0.1.3     TCP http-alt > 43429 [SYN, ACK] Seq=0 Ack=1 Win=14480 Len=0 MSS=1460 TSV=2049400 TSER=2017350 WS=6
  3   0.000315     10.0.1.3 -> 10.0.1.2     TCP 43429 > http-alt [ACK] Seq=1 Ack=1 Win=5888 Len=0 TSV=2017350 TSER=2049400
367474  34.134980     10.0.1.3 -> 10.0.1.2     TCP 43429 > http-alt [FIN, ACK] Seq=327 Ack=400390788 Win=2580480 Len=0 TSV=2025884 TSER=2057873
367475  34.135389     10.0.1.2 -> 10.0.1.3     TCP http-alt > 43429 [FIN, ACK] Seq=400390788 Ack=328 Win=15552 Len=0 TSV=2057934 TSER=2025884
  1   0.000000     10.0.1.3 -> 10.0.1.2     TCP 56814 > http-alt [SYN] Seq=0 Win=5840 Len=0 MSS=1460 TSV=2032745 TSER=0 WS=6
  2   0.000324     10.0.1.2 -> 10.0.1.3     TCP http-alt > 56814 [SYN, ACK] Seq=0 Ack=1 Win=14480 Len=0 MSS=1460 TSV=2064796 TSER=2032745 WS=6
  3   0.000346     10.0.1.3 -> 10.0.1.2     TCP 56814 > http-alt [ACK] Seq=1 Ack=1 Win=5888 Len=0 TSV=2032745 TSER=2064796
412891  34.137270     10.0.1.3 -> 10.0.1.2     TCP 56814 > http-alt [FIN, ACK] Seq=327 Ack=400390788 Win=2580480 Len=0 TSV=2041280 TSER=2073271
412892  34.137677     10.0.1.2 -> 10.0.1.3     TCP http-alt > 56814 [FIN, ACK] Seq=400390788 Ack=328 Win=15552 Len=0 TSV=2073331 TSER=2041280
  1   0.000000     10.0.1.3 -> 10.0.1.2     TCP 56816 > http-alt [SYN] Seq=0 Win=5840 Len=0 MSS=1460 TSV=2047511 TSER=0 WS=6
  2   0.000299     10.0.1.2 -> 10.0.1.3     TCP http-alt > 56816 [SYN, ACK] Seq=0 Ack=1 Win=14480 Len=0 MSS=1460 TSV=2079563 TSER=2047511 WS=6
  3   0.000320     10.0.1.3 -> 10.0.1.2     TCP 56816 > http-alt [ACK] Seq=1 Ack=1 Win=5888 Len=0 TSV=2047511 TSER=2079563
413239  34.127737     10.0.1.3 -> 10.0.1.2     TCP 56816 > http-alt [FIN, ACK] Seq=327 Ack=400390788 Win=2580480 Len=0 TSV=2056043 TSER=2088036
413240  34.128124     10.0.1.2 -> 10.0.1.3     TCP http-alt > 56816 [FIN, ACK] Seq=400390788 Ack=328 Win=15552 Len=0 TSV=2088096 TSER=2056043
  1   0.000000     10.0.1.3 -> 10.0.1.2     TCP 56818 > http-alt [SYN] Seq=0 Win=5840 Len=0 MSS=1460 TSV=2062996 TSER=0 WS=6
  2   0.000303     10.0.1.2 -> 10.0.1.3     TCP http-alt > 56818 [SYN, ACK] Seq=0 Ack=1 Win=14480 Len=0 MSS=1460 TSV=2095049 TSER=2062996 WS=6
  3   0.000327     10.0.1.3 -> 10.0.1.2     TCP 56818 > http-alt [ACK] Seq=1 Ack=1 Win=5888 Len=0 TSV=2062996 TSER=2095049
378365  34.131096     10.0.1.3 -> 10.0.1.2     TCP 56818 > http-alt [FIN, ACK] Seq=327 Ack=400390788 Win=2580480 Len=0 TSV=2071529 TSER=2103522
378366  34.131465     10.0.1.2 -> 10.0.1.3     TCP http-alt > 56818 [FIN, ACK] Seq=400390788 Ack=328 Win=15552 Len=0 TSV=2103583 TSER=2071529
  1   0.000000     10.0.1.3 -> 10.0.1.2     TCP 56822 > http-alt [SYN] Seq=0 Win=5840 Len=0 MSS=1460 TSV=2077790 TSER=0 WS=6
  2   0.000281     10.0.1.2 -> 10.0.1.3     TCP http-alt > 56822 [SYN, ACK] Seq=0 Ack=1 Win=14480 Len=0 MSS=1460 TSV=2109845 TSER=2077790 WS=6
  3   0.000301     10.0.1.3 -> 10.0.1.2     TCP 56822 > http-alt [ACK] Seq=1 Ack=1 Win=5888 Len=0 TSV=2077790 TSER=2109845
413539  34.135607     10.0.1.3 -> 10.0.1.2     TCP 56822 > http-alt [FIN, ACK] Seq=327 Ack=400390788 Win=2580480 Len=0 TSV=2086324 TSER=2118319
413540  34.135979     10.0.1.2 -> 10.0.1.3     TCP http-alt > 56822 [FIN, ACK] Seq=400390788 Ack=328 Win=15552 Len=0 TSV=2118379 TSER=2086324
  1   0.000000     10.0.1.3 -> 10.0.1.2     TCP 56824 > http-alt [SYN] Seq=0 Win=5840 Len=0 MSS=1460 TSV=2097135 TSER=0 WS=6
  2   0.000370     10.0.1.2 -> 10.0.1.3     TCP http-alt > 56824 [SYN, ACK] Seq=0 Ack=1 Win=14480 Len=0 MSS=1460 TSV=2129190 TSER=2097135 WS=6
  3   0.000392     10.0.1.3 -> 10.0.1.2     TCP 56824 > http-alt [ACK] Seq=1 Ack=1 Win=5888 Len=0 TSV=2097135 TSER=2129190
392768  34.136428     10.0.1.3 -> 10.0.1.2     TCP 56824 > http-alt [FIN, ACK] Seq=327 Ack=400390788 Win=2580480 Len=0 TSV=2105669 TSER=2137665
392769  34.136824     10.0.1.2 -> 10.0.1.3     TCP http-alt > 56824 [FIN, ACK] Seq=400390788 Ack=328 Win=15552 Len=0 TSV=2137725 TSER=2105669
  1   0.000000     10.0.1.3 -> 10.0.1.2     TCP 49577 > http-alt [SYN] Seq=0 Win=5840 Len=0 MSS=1460 TSV=2112296 TSER=0 WS=6
  2   0.000376     10.0.1.2 -> 10.0.1.3     TCP http-alt > 49577 [SYN, ACK] Seq=0 Ack=1 Win=14480 Len=0 MSS=1460 TSV=2144353 TSER=2112296 WS=6
  3   0.000398     10.0.1.3 -> 10.0.1.2     TCP 49577 > http-alt [ACK] Seq=1 Ack=1 Win=5888 Len=0 TSV=2112296 TSER=2144353
384608  34.130503     10.0.1.3 -> 10.0.1.2     TCP 49577 > http-alt [FIN, ACK] Seq=327 Ack=400390788 Win=2560064 Len=0 TSV=2120829 TSER=2152828
384609  34.130911     10.0.1.2 -> 10.0.1.3     TCP http-alt > 49577 [FIN, ACK] Seq=400390788 Ack=328 Win=15552 Len=0 TSV=2152886 TSER=2120829
  1   0.000000     10.0.1.3 -> 10.0.1.2     TCP 49579 > http-alt [SYN] Seq=0 Win=5840 Len=0 MSS=1460 TSV=2127305 TSER=0 WS=6
  2   0.000313     10.0.1.2 -> 10.0.1.3     TCP http-alt > 49579 [SYN, ACK] Seq=0 Ack=1 Win=14480 Len=0 MSS=1460 TSV=2159363 TSER=2127305 WS=6
  3   0.000332     10.0.1.3 -> 10.0.1.2     TCP 49579 > http-alt [ACK] Seq=1 Ack=1 Win=5888 Len=0 TSV=2127306 TSER=2159363
377387  34.134205     10.0.1.3 -> 10.0.1.2     TCP 49579 > http-alt [FIN, ACK] Seq=327 Ack=400390788 Win=2580480 Len=0 TSV=2135839 TSER=2167837
377388  34.134602     10.0.1.2 -> 10.0.1.3     TCP http-alt > 49579 [FIN, ACK] Seq=400390788 Ack=328 Win=15552 Len=0 TSV=2167897 TSER=2135839
