  1   0.000000     10.0.1.3 -> 10.0.1.2     TCP 53292 > http-alt [SYN] Seq=0 Win=5840 Len=0 MSS=1460 TSV=2486827 TSER=0 WS=6
  2   0.000369     10.0.1.2 -> 10.0.1.3     TCP http-alt > 53292 [SYN, ACK] Seq=0 Ack=1 Win=14480 Len=0 MSS=1460 TSV=2518912 TSER=2486827 WS=6
  3   0.000394     10.0.1.3 -> 10.0.1.2     TCP 53292 > http-alt [ACK] Seq=1 Ack=1 Win=5888 Len=0 TSV=2486827 TSER=2518912
480507  42.652012     10.0.1.3 -> 10.0.1.2     TCP 53292 > http-alt [FIN, ACK] Seq=327 Ack=500488444 Win=2580480 Len=0 TSV=2497490 TSER=2529516
480508  42.652369     10.0.1.2 -> 10.0.1.3     TCP http-alt > 53292 [FIN, ACK] Seq=500488444 Ack=328 Win=15552 Len=0 TSV=2529576 TSER=2497490
  1   0.000000     10.0.1.3 -> 10.0.1.2     TCP 53294 > http-alt [SYN] Seq=0 Win=5840 Len=0 MSS=1460 TSV=2505457 TSER=0 WS=6
  2   0.000303     10.0.1.2 -> 10.0.1.3     TCP http-alt > 53294 [SYN, ACK] Seq=0 Ack=1 Win=14480 Len=0 MSS=1460 TSV=2537544 TSER=2505457 WS=6
  3   0.000325     10.0.1.3 -> 10.0.1.2     TCP 53294 > http-alt [ACK] Seq=1 Ack=1 Win=5888 Len=0 TSV=2505458 TSER=2537544
480379  42.658696     10.0.1.3 -> 10.0.1.2     TCP 53294 > http-alt [FIN, ACK] Seq=327 Ack=500488444 Win=2580480 Len=0 TSV=2516122 TSER=2548148
480380  42.659089     10.0.1.2 -> 10.0.1.3     TCP http-alt > 53294 [FIN, ACK] Seq=500488444 Ack=328 Win=15552 Len=0 TSV=2548209 TSER=2516122
  1   0.000000     10.0.1.3 -> 10.0.1.2     TCP 53296 > http-alt [SYN] Seq=0 Win=5840 Len=0 MSS=1460 TSV=2526024 TSER=0 WS=6
  2   0.000297     10.0.1.2 -> 10.0.1.3     TCP http-alt > 53296 [SYN, ACK] Seq=0 Ack=1 Win=14480 Len=0 MSS=1460 TSV=2558111 TSER=2526024 WS=6
  3   0.000320     10.0.1.3 -> 10.0.1.2     TCP 53296 > http-alt [ACK] Seq=1 Ack=1 Win=5888 Len=0 TSV=2526024 TSER=2558111
497770  42.656625     10.0.1.3 -> 10.0.1.2     TCP 53296 > http-alt [FIN, ACK] Seq=327 Ack=500488444 Win=2580480 Len=0 TSV=2536688 TSER=2568716
497771  42.656965     10.0.1.2 -> 10.0.1.3     TCP http-alt > 53296 [FIN, ACK] Seq=500488444 Ack=328 Win=15552 Len=0 TSV=2568776 TSER=2536688
  1   0.000000     10.0.1.3 -> 10.0.1.2     TCP 53298 > http-alt [SYN] Seq=0 Win=5840 Len=0 MSS=1460 TSV=2544485 TSER=0 WS=6
  2   0.000299     10.0.1.2 -> 10.0.1.3     TCP http-alt > 53298 [SYN, ACK] Seq=0 Ack=1 Win=14480 Len=0 MSS=1460 TSV=2576574 TSER=2544485 WS=6
  3   0.000322     10.0.1.3 -> 10.0.1.2     TCP 53298 > http-alt [ACK] Seq=1 Ack=1 Win=5888 Len=0 TSV=2544485 TSER=2576574
482520  42.658533     10.0.1.3 -> 10.0.1.2     TCP 53298 > http-alt [FIN, ACK] Seq=327 Ack=500488444 Win=2580480 Len=0 TSV=2555150 TSER=2587179
482521  42.658915     10.0.1.2 -> 10.0.1.3     TCP http-alt > 53298 [FIN, ACK] Seq=500488444 Ack=328 Win=15552 Len=0 TSV=2587239 TSER=2555150
  1   0.000000     10.0.1.3 -> 10.0.1.2     TCP 57158 > http-alt [SYN] Seq=0 Win=5840 Len=0 MSS=1460 TSV=2562602 TSER=0 WS=6
  2   0.000368     10.0.1.2 -> 10.0.1.3     TCP http-alt > 57158 [SYN, ACK] Seq=0 Ack=1 Win=14480 Len=0 MSS=1460 TSV=2594692 TSER=2562602 WS=6
  3   0.000391     10.0.1.3 -> 10.0.1.2     TCP 57158 > http-alt [ACK] Seq=1 Ack=1 Win=5888 Len=0 TSV=2562602 TSER=2594692
516327  42.658150     10.0.1.3 -> 10.0.1.2     TCP 57158 > http-alt [FIN, ACK] Seq=327 Ack=500488444 Win=2580480 Len=0 TSV=2573266 TSER=2605297
516328  42.658560     10.0.1.2 -> 10.0.1.3     TCP http-alt > 57158 [FIN, ACK] Seq=500488444 Ack=328 Win=15552 Len=0 TSV=2605358 TSER=2573266
  1   0.000000     10.0.1.3 -> 10.0.1.2     TCP 57160 > http-alt [SYN] Seq=0 Win=5840 Len=0 MSS=1460 TSV=2581064 TSER=0 WS=6
  2   0.000240     10.0.1.2 -> 10.0.1.3     TCP http-alt > 57160 [SYN, ACK] Seq=0 Ack=1 Win=14480 Len=0 MSS=1460 TSV=2613156 TSER=2581064 WS=6
  3   0.000263     10.0.1.3 -> 10.0.1.2     TCP 57160 > http-alt [ACK] Seq=1 Ack=1 Win=5888 Len=0 TSV=2581064 TSER=2613156
491660  42.658741     10.0.1.3 -> 10.0.1.2     TCP 57160 > http-alt [FIN, ACK] Seq=327 Ack=500488444 Win=2580480 Len=0 TSV=2591729 TSER=2623762
491661  42.659139     10.0.1.2 -> 10.0.1.3     TCP http-alt > 57160 [FIN, ACK] Seq=500488444 Ack=328 Win=15552 Len=0 TSV=2623822 TSER=2591729
  1   0.000000     10.0.1.3 -> 10.0.1.2     TCP 57163 > http-alt [SYN] Seq=0 Win=5840 Len=0 MSS=1460 TSV=2599367 TSER=0 WS=6
  2   0.000292     10.0.1.2 -> 10.0.1.3     TCP http-alt > 57163 [SYN, ACK] Seq=0 Ack=1 Win=14480 Len=0 MSS=1460 TSV=2631460 TSER=2599367 WS=6
  3   0.000312     10.0.1.3 -> 10.0.1.2     TCP 57163 > http-alt [ACK] Seq=1 Ack=1 Win=5888 Len=0 TSV=2599367 TSER=2631460
492419  42.955622     10.0.1.3 -> 10.0.1.2     TCP 57163 > http-alt [FIN, ACK] Seq=327 Ack=500488444 Win=2580480 Len=0 TSV=2610105 TSER=2642138
492420  42.956000     10.0.1.2 -> 10.0.1.3     TCP http-alt > 57163 [FIN, ACK] Seq=500488444 Ack=328 Win=15552 Len=0 TSV=2642200 TSER=2610105
  1   0.000000     10.0.1.3 -> 10.0.1.2     TCP 57165 > http-alt [SYN] Seq=0 Win=5840 Len=0 MSS=1460 TSV=2618053 TSER=0 WS=6
  2   0.000289     10.0.1.2 -> 10.0.1.3     TCP http-alt > 57165 [SYN, ACK] Seq=0 Ack=1 Win=14480 Len=0 MSS=1460 TSV=2650148 TSER=2618053 WS=6
  3   0.000313     10.0.1.3 -> 10.0.1.2     TCP 57165 > http-alt [ACK] Seq=1 Ack=1 Win=5888 Len=0 TSV=2618053 TSER=2650148
504414  42.659075     10.0.1.3 -> 10.0.1.2     TCP 57165 > http-alt [FIN, ACK] Seq=327 Ack=500488444 Win=2580480 Len=0 TSV=2628718 TSER=2660752
504415  42.659433     10.0.1.2 -> 10.0.1.3     TCP http-alt > 57165 [FIN, ACK] Seq=500488444 Ack=328 Win=15552 Len=0 TSV=2660814 TSER=2628718
  1   0.000000     10.0.1.3 -> 10.0.1.2     TCP 48761 > http-alt [SYN] Seq=0 Win=5840 Len=0 MSS=1460 TSV=2636567 TSER=0 WS=6
  2   0.000309     10.0.1.2 -> 10.0.1.3     TCP http-alt > 48761 [SYN, ACK] Seq=0 Ack=1 Win=14480 Len=0 MSS=1460 TSV=2668663 TSER=2636567 WS=6
  3   0.000335     10.0.1.3 -> 10.0.1.2     TCP 48761 > http-alt [ACK] Seq=1 Ack=1 Win=5888 Len=0 TSV=2636567 TSER=2668663
516405  42.657358     10.0.1.3 -> 10.0.1.2     TCP 48761 > http-alt [FIN, ACK] Seq=327 Ack=500488444 Win=2580480 Len=0 TSV=2647231 TSER=2679267
516406  42.657749     10.0.1.2 -> 10.0.1.3     TCP http-alt > 48761 [FIN, ACK] Seq=500488444 Ack=328 Win=15552 Len=0 TSV=2679328 TSER=2647231
  1   0.000000     10.0.1.3 -> 10.0.1.2     TCP 48763 > http-alt [SYN] Seq=0 Win=5840 Len=0 MSS=1460 TSV=2655173 TSER=0 WS=6
  2   0.000295     10.0.1.2 -> 10.0.1.3     TCP http-alt > 48763 [SYN, ACK] Seq=0 Ack=1 Win=14480 Len=0 MSS=1460 TSV=2687271 TSER=2655173 WS=6
  3   0.000321     10.0.1.3 -> 10.0.1.2     TCP 48763 > http-alt [ACK] Seq=1 Ack=1 Win=5888 Len=0 TSV=2655173 TSER=2687271
493201  42.648209     10.0.1.3 -> 10.0.1.2     TCP 48763 > http-alt [FIN, ACK] Seq=327 Ack=500488444 Win=2580480 Len=0 TSV=2665836 TSER=2697875
493202  42.648598     10.0.1.2 -> 10.0.1.3     TCP http-alt > 48763 [FIN, ACK] Seq=500488444 Ack=328 Win=15552 Len=0 TSV=2697934 TSER=2665836
  1   0.000000     10.0.1.3 -> 10.0.1.2     TCP 48765 > http-alt [SYN] Seq=0 Win=5840 Len=0 MSS=1460 TSV=2673839 TSER=0 WS=6
  2   0.000319     10.0.1.2 -> 10.0.1.3     TCP http-alt > 48765 [SYN, ACK] Seq=0 Ack=1 Win=14480 Len=0 MSS=1460 TSV=2705938 TSER=2673839 WS=6
  3   0.000344     10.0.1.3 -> 10.0.1.2     TCP 48765 > http-alt [ACK] Seq=1 Ack=1 Win=5888 Len=0 TSV=2673839 TSER=2705938
487497  42.656648     10.0.1.3 -> 10.0.1.2     TCP 48765 > http-alt [FIN, ACK] Seq=327 Ack=500488444 Win=2580480 Len=0 TSV=2684504 TSER=2716543
487498  42.657019     10.0.1.2 -> 10.0.1.3     TCP http-alt > 48765 [FIN, ACK] Seq=500488444 Ack=328 Win=15552 Len=0 TSV=2716603 TSER=2684504
  1   0.000000     10.0.1.3 -> 10.0.1.2     TCP 48767 > http-alt [SYN] Seq=0 Win=5840 Len=0 MSS=1460 TSV=2692517 TSER=0 WS=6
  2   0.000302     10.0.1.2 -> 10.0.1.3     TCP http-alt > 48767 [SYN, ACK] Seq=0 Ack=1 Win=14480 Len=0 MSS=1460 TSV=2724617 TSER=2692517 WS=6
  3   0.000322     10.0.1.3 -> 10.0.1.2     TCP 48767 > http-alt [ACK] Seq=1 Ack=1 Win=5888 Len=0 TSV=2692517 TSER=2724617
484619  42.662686     10.0.1.3 -> 10.0.1.2     TCP 48767 > http-alt [FIN, ACK] Seq=327 Ack=500488444 Win=2580480 Len=0 TSV=2703182 TSER=2735223
484620  42.663001     10.0.1.2 -> 10.0.1.3     TCP http-alt > 48767 [FIN, ACK] Seq=500488444 Ack=328 Win=15552 Len=0 TSV=2735283 TSER=2703182
  1   0.000000     10.0.1.3 -> 10.0.1.2     TCP 51481 > http-alt [SYN] Seq=0 Win=5840 Len=0 MSS=1460 TSV=2710669 TSER=0 WS=6
  2   0.000296     10.0.1.2 -> 10.0.1.3     TCP http-alt > 51481 [SYN, ACK] Seq=0 Ack=1 Win=14480 Len=0 MSS=1460 TSV=2742770 TSER=2710669 WS=6
  3   0.000320     10.0.1.3 -> 10.0.1.2     TCP 51481 > http-alt [ACK] Seq=1 Ack=1 Win=5888 Len=0 TSV=2710669 TSER=2742770
483979  42.652787     10.0.1.3 -> 10.0.1.2     TCP 51481 > http-alt [FIN, ACK] Seq=327 Ack=500488444 Win=2580480 Len=0 TSV=2721332 TSER=2753375
483980  42.653153     10.0.1.2 -> 10.0.1.3     TCP http-alt > 51481 [FIN, ACK] Seq=500488444 Ack=328 Win=15552 Len=0 TSV=2753434 TSER=2721332
  1   0.000000     10.0.1.3 -> 10.0.1.2     TCP 51483 > http-alt [SYN] Seq=0 Win=5840 Len=0 MSS=1460 TSV=2728356 TSER=0 WS=6
  2   0.000311     10.0.1.2 -> 10.0.1.3     TCP http-alt > 51483 [SYN, ACK] Seq=0 Ack=1 Win=14480 Len=0 MSS=1460 TSV=2760459 TSER=2728356 WS=6
  3   0.000333     10.0.1.3 -> 10.0.1.2     TCP 51483 > http-alt [ACK] Seq=1 Ack=1 Win=5888 Len=0 TSV=2728356 TSER=2760459
516761  42.654042     10.0.1.3 -> 10.0.1.2     TCP 51483 > http-alt [FIN, ACK] Seq=327 Ack=500488444 Win=2574592 Len=0 TSV=2739019 TSER=2771063
516762  42.654381     10.0.1.2 -> 10.0.1.3     TCP http-alt > 51483 [FIN, ACK] Seq=500488444 Ack=328 Win=15552 Len=0 TSV=2771123 TSER=2739019
  1   0.000000     10.0.1.3 -> 10.0.1.2     TCP 51485 > http-alt [SYN] Seq=0 Win=5840 Len=0 MSS=1460 TSV=2749141 TSER=0 WS=6
  2   0.000308     10.0.1.2 -> 10.0.1.3     TCP http-alt > 51485 [SYN, ACK] Seq=0 Ack=1 Win=14480 Len=0 MSS=1460 TSV=2781246 TSER=2749141 WS=6
  3   0.000331     10.0.1.3 -> 10.0.1.2     TCP 51485 > http-alt [ACK] Seq=1 Ack=1 Win=5888 Len=0 TSV=2749141 TSER=2781246
517015  42.653306     10.0.1.3 -> 10.0.1.2     TCP 51485 > http-alt [FIN, ACK] Seq=327 Ack=500488444 Win=2580480 Len=0 TSV=2759804 TSER=2791851
517016  42.653649     10.0.1.2 -> 10.0.1.3     TCP http-alt > 51485 [FIN, ACK] Seq=500488444 Ack=328 Win=15552 Len=0 TSV=2791910 TSER=2759804
  1   0.000000     10.0.1.3 -> 10.0.1.2     TCP 51487 > http-alt [SYN] Seq=0 Win=5840 Len=0 MSS=1460 TSV=2767874 TSER=0 WS=6
  2   0.000319     10.0.1.2 -> 10.0.1.3     TCP http-alt > 51487 [SYN, ACK] Seq=0 Ack=1 Win=14480 Len=0 MSS=1460 TSV=2799980 TSER=2767874 WS=6
  3   0.000342     10.0.1.3 -> 10.0.1.2     TCP 51487 > http-alt [ACK] Seq=1 Ack=1 Win=5888 Len=0 TSV=2767874 TSER=2799980
448471  42.660060     10.0.1.3 -> 10.0.1.2     TCP 51487 > http-alt [FIN, ACK] Seq=327 Ack=500488444 Win=2580480 Len=0 TSV=2778539 TSER=2810586
448472  42.660423     10.0.1.2 -> 10.0.1.3     TCP http-alt > 51487 [FIN, ACK] Seq=500488444 Ack=328 Win=15552 Len=0 TSV=2810646 TSER=2778539
  1   0.000000     10.0.1.3 -> 10.0.1.2     TCP 33930 > http-alt [SYN] Seq=0 Win=5840 Len=0 MSS=1460 TSV=2788528 TSER=0 WS=6
  2   0.000339     10.0.1.2 -> 10.0.1.3     TCP http-alt > 33930 [SYN, ACK] Seq=0 Ack=1 Win=14480 Len=0 MSS=1460 TSV=2820635 TSER=2788528 WS=6
  3   0.000362     10.0.1.3 -> 10.0.1.2     TCP 33930 > http-alt [ACK] Seq=1 Ack=1 Win=5888 Len=0 TSV=2788528 TSER=2820635
483060  42.654221     10.0.1.3 -> 10.0.1.2     TCP 33930 > http-alt [FIN, ACK] Seq=327 Ack=500488444 Win=2557184 Len=0 TSV=2799191 TSER=2831240
483061  42.654558     10.0.1.2 -> 10.0.1.3     TCP http-alt > 33930 [FIN, ACK] Seq=500488444 Ack=328 Win=15552 Len=0 TSV=2831299 TSER=2799191
  1   0.000000     10.0.1.3 -> 10.0.1.2     TCP 33932 > http-alt [SYN] Seq=0 Win=5840 Len=0 MSS=1460 TSV=2806544 TSER=0 WS=6
  2   0.000317     10.0.1.2 -> 10.0.1.3     TCP http-alt > 33932 [SYN, ACK] Seq=0 Ack=1 Win=14480 Len=0 MSS=1460 TSV=2838653 TSER=2806544 WS=6
  3   0.000339     10.0.1.3 -> 10.0.1.2     TCP 33932 > http-alt [ACK] Seq=1 Ack=1 Win=5888 Len=0 TSV=2806544 TSER=2838653
483689  42.819541     10.0.1.3 -> 10.0.1.2     TCP 33932 > http-alt [FIN, ACK] Seq=327 Ack=500488444 Win=2580480 Len=0 TSV=2817249 TSER=2849258
483690  42.819855     10.0.1.2 -> 10.0.1.3     TCP http-alt > 33932 [FIN, ACK] Seq=500488444 Ack=328 Win=15552 Len=0 TSV=2849359 TSER=2817249
  1   0.000000     10.0.1.3 -> 10.0.1.2     TCP 33934 > http-alt [SYN] Seq=0 Win=5840 Len=0 MSS=1460 TSV=2824831 TSER=0 WS=6
  2   0.000299     10.0.1.2 -> 10.0.1.3     TCP http-alt > 33934 [SYN, ACK] Seq=0 Ack=1 Win=14480 Len=0 MSS=1460 TSV=2856941 TSER=2824831 WS=6
  3   0.000324     10.0.1.3 -> 10.0.1.2     TCP 33934 > http-alt [ACK] Seq=1 Ack=1 Win=5888 Len=0 TSV=2824831 TSER=2856941
492424  42.655948     10.0.1.3 -> 10.0.1.2     TCP 33934 > http-alt [FIN, ACK] Seq=327 Ack=500488444 Win=2580480 Len=0 TSV=2835495 TSER=2867547
492425  42.656297     10.0.1.2 -> 10.0.1.3     TCP http-alt > 33934 [FIN, ACK] Seq=500488444 Ack=328 Win=15552 Len=0 TSV=2867606 TSER=2835495
  1   0.000000     10.0.1.3 -> 10.0.1.2     TCP 33936 > http-alt [SYN] Seq=0 Win=5840 Len=0 MSS=1460 TSV=2843283 TSER=0 WS=6
  2   0.000400     10.0.1.2 -> 10.0.1.3     TCP http-alt > 33936 [SYN, ACK] Seq=0 Ack=1 Win=14480 Len=0 MSS=1460 TSV=2875395 TSER=2843283 WS=6
  3   0.000422     10.0.1.3 -> 10.0.1.2     TCP 33936 > http-alt [ACK] Seq=1 Ack=1 Win=5888 Len=0 TSV=2843283 TSER=2875395
516551  42.656136     10.0.1.3 -> 10.0.1.2     TCP 33936 > http-alt [FIN, ACK] Seq=327 Ack=500488444 Win=2580480 Len=0 TSV=2853947 TSER=2885999
516552  42.656495     10.0.1.2 -> 10.0.1.3     TCP http-alt > 33936 [FIN, ACK] Seq=500488444 Ack=328 Win=15552 Len=0 TSV=2886059 TSER=2853947
