  1   0.000000     10.0.1.3 -> 10.0.1.2     TCP 44917 > http-alt [SYN] Seq=0 Win=5840 Len=0 MSS=1460 TSV=573365 TSER=0 WS=6
  2   0.000324     10.0.1.2 -> 10.0.1.3     TCP http-alt > 44917 [SYN, ACK] Seq=0 Ack=1 Win=14480 Len=0 MSS=1460 TSV=605306 TSER=573365 WS=6
  3   0.000350     10.0.1.3 -> 10.0.1.2     TCP 44917 > http-alt [ACK] Seq=1 Ack=1 Win=5888 Len=0 TSV=573365 TSER=605306
51317   4.297674     10.0.1.3 -> 10.0.1.2     TCP 44917 > http-alt [FIN, ACK] Seq=326 Ack=50048989 Win=2580480 Len=0 TSV=574439 TSER=606321
51318   4.298031     10.0.1.2 -> 10.0.1.3     TCP http-alt > 44917 [FIN, ACK] Seq=50048989 Ack=327 Win=15552 Len=0 TSV=606380 TSER=574439
  1   0.000000     10.0.1.3 -> 10.0.1.2     TCP 44919 > http-alt [SYN] Seq=0 Win=5840 Len=0 MSS=1460 TSV=577319 TSER=0 WS=6
  2   0.000392     10.0.1.2 -> 10.0.1.3     TCP http-alt > 44919 [SYN, ACK] Seq=0 Ack=1 Win=14480 Len=0 MSS=1460 TSV=609260 TSER=577319 WS=6
  3   0.000412     10.0.1.3 -> 10.0.1.2     TCP 44919 > http-alt [ACK] Seq=1 Ack=1 Win=5888 Len=0 TSV=577319 TSER=609260
51313   4.313732     10.0.1.3 -> 10.0.1.2     TCP 44919 > http-alt [FIN, ACK] Seq=326 Ack=50048989 Win=2580480 Len=0 TSV=578398 TSER=610278
51314   4.314103     10.0.1.2 -> 10.0.1.3     TCP http-alt > 44919 [FIN, ACK] Seq=50048989 Ack=327 Win=15552 Len=0 TSV=610339 TSER=578398
  1   0.000000     10.0.1.3 -> 10.0.1.2     TCP 44921 > http-alt [SYN] Seq=0 Win=5840 Len=0 MSS=1460 TSV=581342 TSER=0 WS=6
  2   0.000271     10.0.1.2 -> 10.0.1.3     TCP http-alt > 44921 [SYN, ACK] Seq=0 Ack=1 Win=14480 Len=0 MSS=1460 TSV=613283 TSER=581342 WS=6
  3   0.000295     10.0.1.3 -> 10.0.1.2     TCP 44921 > http-alt [ACK] Seq=1 Ack=1 Win=5888 Len=0 TSV=581342 TSER=613283
51586   4.303421     10.0.1.3 -> 10.0.1.2     TCP 44921 > http-alt [FIN, ACK] Seq=326 Ack=50048989 Win=2580480 Len=0 TSV=582418 TSER=614299
51587   4.303787     10.0.1.2 -> 10.0.1.3     TCP http-alt > 44921 [FIN, ACK] Seq=50048989 Ack=327 Win=15552 Len=0 TSV=614359 TSER=582418
  1   0.000000     10.0.1.3 -> 10.0.1.2     TCP 44923 > http-alt [SYN] Seq=0 Win=5840 Len=0 MSS=1460 TSV=586968 TSER=0 WS=6
  2   0.000351     10.0.1.2 -> 10.0.1.3     TCP http-alt > 44923 [SYN, ACK] Seq=0 Ack=1 Win=14480 Len=0 MSS=1460 TSV=618909 TSER=586968 WS=6
  3   0.000376     10.0.1.3 -> 10.0.1.2     TCP 44923 > http-alt [ACK] Seq=1 Ack=1 Win=5888 Len=0 TSV=586968 TSER=618909
51454   4.311932     10.0.1.3 -> 10.0.1.2     TCP 44923 > http-alt [FIN, ACK] Seq=326 Ack=50048989 Win=2580480 Len=0 TSV=588046 TSER=619927
51455   4.312285     10.0.1.2 -> 10.0.1.3     TCP http-alt > 44923 [FIN, ACK] Seq=50048989 Ack=327 Win=15552 Len=0 TSV=619988 TSER=588046
  1   0.000000     10.0.1.3 -> 10.0.1.2     TCP 44925 > http-alt [SYN] Seq=0 Win=5840 Len=0 MSS=1460 TSV=590932 TSER=0 WS=6
  2   0.000410     10.0.1.2 -> 10.0.1.3     TCP http-alt > 44925 [SYN, ACK] Seq=0 Ack=1 Win=14480 Len=0 MSS=1460 TSV=622874 TSER=590932 WS=6
  3   0.000432     10.0.1.3 -> 10.0.1.2     TCP 44925 > http-alt [ACK] Seq=1 Ack=1 Win=5888 Len=0 TSV=590932 TSER=622874
51708   4.309510     10.0.1.3 -> 10.0.1.2     TCP 44925 > http-alt [FIN, ACK] Seq=326 Ack=50048989 Win=2580480 Len=0 TSV=592009 TSER=623891
51709   4.309871     10.0.1.2 -> 10.0.1.3     TCP http-alt > 44925 [FIN, ACK] Seq=50048989 Ack=327 Win=15552 Len=0 TSV=623951 TSER=592009
  1   0.000000     10.0.1.3 -> 10.0.1.2     TCP 44927 > http-alt [SYN] Seq=0 Win=5840 Len=0 MSS=1460 TSV=594932 TSER=0 WS=6
  2   0.000318     10.0.1.2 -> 10.0.1.3     TCP http-alt > 44927 [SYN, ACK] Seq=0 Ack=1 Win=14480 Len=0 MSS=1460 TSV=626875 TSER=594932 WS=6
  3   0.000340     10.0.1.3 -> 10.0.1.2     TCP 44927 > http-alt [ACK] Seq=1 Ack=1 Win=5888 Len=0 TSV=594932 TSER=626875
51596   4.304002     10.0.1.3 -> 10.0.1.2     TCP 44927 > http-alt [FIN, ACK] Seq=326 Ack=50048989 Win=2580480 Len=0 TSV=596008 TSER=627891
51597   4.304396     10.0.1.2 -> 10.0.1.3     TCP http-alt > 44927 [FIN, ACK] Seq=50048989 Ack=327 Win=15552 Len=0 TSV=627951 TSER=596008
  1   0.000000     10.0.1.3 -> 10.0.1.2     TCP 44929 > http-alt [SYN] Seq=0 Win=5840 Len=0 MSS=1460 TSV=598760 TSER=0 WS=6
  2   0.000284     10.0.1.2 -> 10.0.1.3     TCP http-alt > 44929 [SYN, ACK] Seq=0 Ack=1 Win=14480 Len=0 MSS=1460 TSV=630703 TSER=598760 WS=6
  3   0.000308     10.0.1.3 -> 10.0.1.2     TCP 44929 > http-alt [ACK] Seq=1 Ack=1 Win=5888 Len=0 TSV=598760 TSER=630703
51668   4.297695     10.0.1.3 -> 10.0.1.2     TCP 44929 > http-alt [FIN, ACK] Seq=326 Ack=50048989 Win=2580480 Len=0 TSV=599835 TSER=631719
51669   4.298035     10.0.1.2 -> 10.0.1.3     TCP http-alt > 44929 [FIN, ACK] Seq=50048989 Ack=327 Win=15552 Len=0 TSV=631777 TSER=599835
  1   0.000000     10.0.1.3 -> 10.0.1.2     TCP 56047 > http-alt [SYN] Seq=0 Win=5840 Len=0 MSS=1460 TSV=602698 TSER=0 WS=6
  2   0.000299     10.0.1.2 -> 10.0.1.3     TCP http-alt > 56047 [SYN, ACK] Seq=0 Ack=1 Win=14480 Len=0 MSS=1460 TSV=634641 TSER=602698 WS=6
  3   0.000322     10.0.1.3 -> 10.0.1.2     TCP 56047 > http-alt [ACK] Seq=1 Ack=1 Win=5888 Len=0 TSV=602698 TSER=634641
51677   4.311562     10.0.1.3 -> 10.0.1.2     TCP 56047 > http-alt [FIN, ACK] Seq=326 Ack=50048989 Win=2580480 Len=0 TSV=603776 TSER=635659
51678   4.311923     10.0.1.2 -> 10.0.1.3     TCP http-alt > 56047 [FIN, ACK] Seq=50048989 Ack=327 Win=15552 Len=0 TSV=635719 TSER=603776
  1   0.000000     10.0.1.3 -> 10.0.1.2     TCP 56049 > http-alt [SYN] Seq=0 Win=5840 Len=0 MSS=1460 TSV=606189 TSER=0 WS=6
  2   0.000333     10.0.1.2 -> 10.0.1.3     TCP http-alt > 56049 [SYN, ACK] Seq=0 Ack=1 Win=14480 Len=0 MSS=1460 TSV=638132 TSER=606189 WS=6
  3   0.000354     10.0.1.3 -> 10.0.1.2     TCP 56049 > http-alt [ACK] Seq=1 Ack=1 Win=5888 Len=0 TSV=606189 TSER=638132
51813   4.311519     10.0.1.3 -> 10.0.1.2     TCP 56049 > http-alt [FIN, ACK] Seq=326 Ack=50048989 Win=2580480 Len=0 TSV=607267 TSER=639150
51814   4.311901     10.0.1.2 -> 10.0.1.3     TCP http-alt > 56049 [FIN, ACK] Seq=50048989 Ack=327 Win=15552 Len=0 TSV=639210 TSER=607267
  1   0.000000     10.0.1.3 -> 10.0.1.2     TCP 56051 > http-alt [SYN] Seq=0 Win=5840 Len=0 MSS=1460 TSV=610224 TSER=0 WS=6
  2   0.000298     10.0.1.2 -> 10.0.1.3     TCP http-alt > 56051 [SYN, ACK] Seq=0 Ack=1 Win=14480 Len=0 MSS=1460 TSV=642167 TSER=610224 WS=6
  3   0.000322     10.0.1.3 -> 10.0.1.2     TCP 56051 > http-alt [ACK] Seq=1 Ack=1 Win=5888 Len=0 TSV=610224 TSER=642167
51683   4.302894     10.0.1.3 -> 10.0.1.2     TCP 56051 > http-alt [FIN, ACK] Seq=326 Ack=50048989 Win=2580480 Len=0 TSV=611299 TSER=643183
51684   4.303236     10.0.1.2 -> 10.0.1.3     TCP http-alt > 56051 [FIN, ACK] Seq=50048989 Ack=327 Win=15552 Len=0 TSV=643243 TSER=611299
  1   0.000000     10.0.1.3 -> 10.0.1.2     TCP 56053 > http-alt [SYN] Seq=0 Win=5840 Len=0 MSS=1460 TSV=613829 TSER=0 WS=6
  2   0.000308     10.0.1.2 -> 10.0.1.3     TCP http-alt > 56053 [SYN, ACK] Seq=0 Ack=1 Win=14480 Len=0 MSS=1460 TSV=645773 TSER=613829 WS=6
  3   0.000327     10.0.1.3 -> 10.0.1.2     TCP 56053 > http-alt [ACK] Seq=1 Ack=1 Win=5888 Len=0 TSV=613829 TSER=645773
51639   4.352223     10.0.1.3 -> 10.0.1.2     TCP 56053 > http-alt [FIN, ACK] Seq=326 Ack=50048989 Win=2580480 Len=0 TSV=614917 TSER=646800
51640   4.352577     10.0.1.2 -> 10.0.1.3     TCP http-alt > 56053 [FIN, ACK] Seq=50048989 Ack=327 Win=15552 Len=0 TSV=646861 TSER=614917
  1   0.000000     10.0.1.3 -> 10.0.1.2     TCP 56055 > http-alt [SYN] Seq=0 Win=5840 Len=0 MSS=1460 TSV=620273 TSER=0 WS=6
  2   0.000271     10.0.1.2 -> 10.0.1.3     TCP http-alt > 56055 [SYN, ACK] Seq=0 Ack=1 Win=14480 Len=0 MSS=1460 TSV=652217 TSER=620273 WS=6
  3   0.000294     10.0.1.3 -> 10.0.1.2     TCP 56055 > http-alt [ACK] Seq=1 Ack=1 Win=5888 Len=0 TSV=620273 TSER=652217
51891   4.304744     10.0.1.3 -> 10.0.1.2     TCP 56055 > http-alt [FIN, ACK] Seq=326 Ack=50048989 Win=2580480 Len=0 TSV=621349 TSER=653233
51892   4.305097     10.0.1.2 -> 10.0.1.3     TCP http-alt > 56055 [FIN, ACK] Seq=50048989 Ack=327 Win=15552 Len=0 TSV=653293 TSER=621349
  1   0.000000     10.0.1.3 -> 10.0.1.2     TCP 56057 > http-alt [SYN] Seq=0 Win=5840 Len=0 MSS=1460 TSV=624218 TSER=0 WS=6
  2   0.000274     10.0.1.2 -> 10.0.1.3     TCP http-alt > 56057 [SYN, ACK] Seq=0 Ack=1 Win=14480 Len=0 MSS=1460 TSV=656163 TSER=624218 WS=6
  3   0.000291     10.0.1.3 -> 10.0.1.2     TCP 56057 > http-alt [ACK] Seq=1 Ack=1 Win=5888 Len=0 TSV=624218 TSER=656163
51444   4.304335     10.0.1.3 -> 10.0.1.2     TCP 56057 > http-alt [FIN, ACK] Seq=326 Ack=50048989 Win=2580480 Len=0 TSV=625294 TSER=657179
51445   4.304667     10.0.1.2 -> 10.0.1.3     TCP http-alt > 56057 [FIN, ACK] Seq=50048989 Ack=327 Win=15552 Len=0 TSV=657239 TSER=625294
  1   0.000000     10.0.1.3 -> 10.0.1.2     TCP 56059 > http-alt [SYN] Seq=0 Win=5840 Len=0 MSS=1460 TSV=628097 TSER=0 WS=6
  2   0.000287     10.0.1.2 -> 10.0.1.3     TCP http-alt > 56059 [SYN, ACK] Seq=0 Ack=1 Win=14480 Len=0 MSS=1460 TSV=660042 TSER=628097 WS=6
  3   0.000307     10.0.1.3 -> 10.0.1.2     TCP 56059 > http-alt [ACK] Seq=1 Ack=1 Win=5888 Len=0 TSV=628097 TSER=660042
51558   4.304283     10.0.1.3 -> 10.0.1.2     TCP 56059 > http-alt [FIN, ACK] Seq=326 Ack=50048989 Win=2580480 Len=0 TSV=629173 TSER=661059
51559   4.304638     10.0.1.2 -> 10.0.1.3     TCP http-alt > 56059 [FIN, ACK] Seq=50048989 Ack=327 Win=15552 Len=0 TSV=661118 TSER=629173
  1   0.000000     10.0.1.3 -> 10.0.1.2     TCP 56061 > http-alt [SYN] Seq=0 Win=5840 Len=0 MSS=1460 TSV=632040 TSER=0 WS=6
  2   0.000365     10.0.1.2 -> 10.0.1.3     TCP http-alt > 56061 [SYN, ACK] Seq=0 Ack=1 Win=14480 Len=0 MSS=1460 TSV=663985 TSER=632040 WS=6
  3   0.000387     10.0.1.3 -> 10.0.1.2     TCP 56061 > http-alt [ACK] Seq=1 Ack=1 Win=5888 Len=0 TSV=632040 TSER=663985
51647   4.303543     10.0.1.3 -> 10.0.1.2     TCP 56061 > http-alt [FIN, ACK] Seq=326 Ack=50048989 Win=2580480 Len=0 TSV=633116 TSER=665000
51648   4.303884     10.0.1.2 -> 10.0.1.3     TCP http-alt > 56061 [FIN, ACK] Seq=50048989 Ack=327 Win=15552 Len=0 TSV=665061 TSER=633116
  1   0.000000     10.0.1.3 -> 10.0.1.2     TCP 56063 > http-alt [SYN] Seq=0 Win=5840 Len=0 MSS=1460 TSV=635978 TSER=0 WS=6
  2   0.000324     10.0.1.2 -> 10.0.1.3     TCP http-alt > 56063 [SYN, ACK] Seq=0 Ack=1 Win=14480 Len=0 MSS=1460 TSV=667923 TSER=635978 WS=6
  3   0.000346     10.0.1.3 -> 10.0.1.2     TCP 56063 > http-alt [ACK] Seq=1 Ack=1 Win=5888 Len=0 TSV=635978 TSER=667923
51510   4.306646     10.0.1.3 -> 10.0.1.2     TCP 56063 > http-alt [FIN, ACK] Seq=326 Ack=50048989 Win=2580480 Len=0 TSV=637055 TSER=668941
51511   4.307002     10.0.1.2 -> 10.0.1.3     TCP http-alt > 56063 [FIN, ACK] Seq=50048989 Ack=327 Win=15552 Len=0 TSV=669000 TSER=637055
  1   0.000000     10.0.1.3 -> 10.0.1.2     TCP 56065 > http-alt [SYN] Seq=0 Win=5840 Len=0 MSS=1460 TSV=642580 TSER=0 WS=6
  2   0.000319     10.0.1.2 -> 10.0.1.3     TCP http-alt > 56065 [SYN, ACK] Seq=0 Ack=1 Win=14480 Len=0 MSS=1460 TSV=674526 TSER=642580 WS=6
  3   0.000341     10.0.1.3 -> 10.0.1.2     TCP 56065 > http-alt [ACK] Seq=1 Ack=1 Win=5888 Len=0 TSV=642580 TSER=674526
51692   4.309573     10.0.1.3 -> 10.0.1.2     TCP 56065 > http-alt [FIN, ACK] Seq=326 Ack=50048989 Win=2580480 Len=0 TSV=643658 TSER=675544
51693   4.309935     10.0.1.2 -> 10.0.1.3     TCP http-alt > 56065 [FIN, ACK] Seq=50048989 Ack=327 Win=15552 Len=0 TSV=675603 TSER=643658
  1   0.000000     10.0.1.3 -> 10.0.1.2     TCP 56067 > http-alt [SYN] Seq=0 Win=5840 Len=0 MSS=1460 TSV=646513 TSER=0 WS=6
  2   0.000296     10.0.1.2 -> 10.0.1.3     TCP http-alt > 56067 [SYN, ACK] Seq=0 Ack=1 Win=14480 Len=0 MSS=1460 TSV=678460 TSER=646513 WS=6
  3   0.000321     10.0.1.3 -> 10.0.1.2     TCP 56067 > http-alt [ACK] Seq=1 Ack=1 Win=5888 Len=0 TSV=646513 TSER=678460
51854   4.299815     10.0.1.3 -> 10.0.1.2     TCP 56067 > http-alt [FIN, ACK] Seq=326 Ack=50048989 Win=2580480 Len=0 TSV=647588 TSER=679476
51855   4.300203     10.0.1.2 -> 10.0.1.3     TCP http-alt > 56067 [FIN, ACK] Seq=50048989 Ack=327 Win=15552 Len=0 TSV=679535 TSER=647588
  1   0.000000     10.0.1.3 -> 10.0.1.2     TCP 56069 > http-alt [SYN] Seq=0 Win=5840 Len=0 MSS=1460 TSV=650173 TSER=0 WS=6
  2   0.000295     10.0.1.2 -> 10.0.1.3     TCP http-alt > 56069 [SYN, ACK] Seq=0 Ack=1 Win=14480 Len=0 MSS=1460 TSV=682119 TSER=650173 WS=6
  3   0.000316     10.0.1.3 -> 10.0.1.2     TCP 56069 > http-alt [ACK] Seq=1 Ack=1 Win=5888 Len=0 TSV=650173 TSER=682119
51718   4.300713     10.0.1.3 -> 10.0.1.2     TCP 56069 > http-alt [FIN, ACK] Seq=326 Ack=50048989 Win=2580480 Len=0 TSV=651248 TSER=683135
51719   4.301055     10.0.1.2 -> 10.0.1.3     TCP http-alt > 56069 [FIN, ACK] Seq=50048989 Ack=327 Win=15552 Len=0 TSV=683195 TSER=651248
  1   0.000000     10.0.1.3 -> 10.0.1.2     TCP 56072 > http-alt [SYN] Seq=0 Win=5840 Len=0 MSS=1460 TSV=654164 TSER=0 WS=6
  2   0.000274     10.0.1.2 -> 10.0.1.3     TCP http-alt > 56072 [SYN, ACK] Seq=0 Ack=1 Win=14480 Len=0 MSS=1460 TSV=686111 TSER=654164 WS=6
  3   0.000292     10.0.1.3 -> 10.0.1.2     TCP 56072 > http-alt [ACK] Seq=1 Ack=1 Win=5888 Len=0 TSV=654164 TSER=686111
50080   4.306697     10.0.1.3 -> 10.0.1.2     TCP 56072 > http-alt [FIN, ACK] Seq=326 Ack=50048989 Win=2580480 Len=0 TSV=655240 TSER=687127
50081   4.307049     10.0.1.2 -> 10.0.1.3     TCP http-alt > 56072 [FIN, ACK] Seq=50048989 Ack=327 Win=15552 Len=0 TSV=687187 TSER=655240
