  1   0.000000     10.0.1.3 -> 10.0.1.2     TCP 43717 > http-alt [SYN] Seq=0 Win=5840 Len=0 MSS=1460 TSV=6510269 TSER=0 WS=6
  2   0.000439     10.0.1.2 -> 10.0.1.3     TCP http-alt > 43717 [SYN, ACK] Seq=0 Ack=1 Win=14480 Len=0 MSS=1460 TSV=6564001 TSER=6510269 WS=6
  3   0.000460     10.0.1.3 -> 10.0.1.2     TCP 43717 > http-alt [ACK] Seq=1 Ack=1 Win=5888 Len=0 TSV=6510270 TSER=6564001
52033   4.306003     10.0.1.3 -> 10.0.1.2     TCP 43717 > http-alt [FIN, ACK] Seq=326 Ack=50048989 Win=2580480 Len=0 TSV=6511346 TSER=6565018
52034   4.306357     10.0.1.2 -> 10.0.1.3     TCP http-alt > 43717 [FIN, ACK] Seq=50048989 Ack=327 Win=15552 Len=0 TSV=6565077 TSER=6511346
================================================================================
IPv4 Conversations
Filter:<No Filter>
                                               |       <-      | |       ->      | |     Total     |
                                               | Frames  Bytes | | Frames  Bytes | | Frames  Bytes |
10.0.1.3             <-> 10.0.1.2               34573  52330814   17462   1152825   52035  53483639
================================================================================
  1   0.000000     10.0.1.3 -> 10.0.1.2     TCP 43719 > http-alt [SYN] Seq=0 Win=5840 Len=0 MSS=1460 TSV=6513533 TSER=0 WS=6
  2   0.000339     10.0.1.2 -> 10.0.1.3     TCP http-alt > 43719 [SYN, ACK] Seq=0 Ack=1 Win=14480 Len=0 MSS=1460 TSV=6567264 TSER=6513533 WS=6
  3   0.000363     10.0.1.3 -> 10.0.1.2     TCP 43719 > http-alt [ACK] Seq=1 Ack=1 Win=5888 Len=0 TSV=6513533 TSER=6567264
52013   4.314200     10.0.1.3 -> 10.0.1.2     TCP 43719 > http-alt [FIN, ACK] Seq=326 Ack=50048989 Win=2580480 Len=0 TSV=6514612 TSER=6568282
52014   4.314537     10.0.1.2 -> 10.0.1.3     TCP http-alt > 43719 [FIN, ACK] Seq=50048989 Ack=327 Win=15552 Len=0 TSV=6568343 TSER=6514612
================================================================================
IPv4 Conversations
Filter:<No Filter>
                                               |       <-      | |       ->      | |     Total     |
                                               | Frames  Bytes | | Frames  Bytes | | Frames  Bytes |
10.0.1.3             <-> 10.0.1.2               34574  52330880   17441   1151439   52015  53482319
================================================================================
  1   0.000000     10.0.1.3 -> 10.0.1.2     TCP 43721 > http-alt [SYN] Seq=0 Win=5840 Len=0 MSS=1460 TSV=6516791 TSER=0 WS=6
  2   0.000291     10.0.1.2 -> 10.0.1.3     TCP http-alt > 43721 [SYN, ACK] Seq=0 Ack=1 Win=14480 Len=0 MSS=1460 TSV=6570523 TSER=6516791 WS=6
  3   0.000312     10.0.1.3 -> 10.0.1.2     TCP 43721 > http-alt [ACK] Seq=1 Ack=1 Win=5888 Len=0 TSV=6516792 TSER=6570523
52085   4.304212     10.0.1.3 -> 10.0.1.2     TCP 43721 > http-alt [FIN, ACK] Seq=326 Ack=50048989 Win=2580480 Len=0 TSV=6517868 TSER=6571540
52086   4.304565     10.0.1.2 -> 10.0.1.3     TCP http-alt > 43721 [FIN, ACK] Seq=50048989 Ack=327 Win=15552 Len=0 TSV=6571599 TSER=6517868
================================================================================
IPv4 Conversations
Filter:<No Filter>
                                               |       <-      | |       ->      | |     Total     |
                                               | Frames  Bytes | | Frames  Bytes | | Frames  Bytes |
10.0.1.3             <-> 10.0.1.2               34577  52331078   17510   1155993   52087  53487071
================================================================================
  1   0.000000     10.0.1.3 -> 10.0.1.2     TCP 43723 > http-alt [SYN] Seq=0 Win=5840 Len=0 MSS=1460 TSV=6520051 TSER=0 WS=6
  2   0.000296     10.0.1.2 -> 10.0.1.3     TCP http-alt > 43723 [SYN, ACK] Seq=0 Ack=1 Win=14480 Len=0 MSS=1460 TSV=6573783 TSER=6520051 WS=6
  3   0.000312     10.0.1.3 -> 10.0.1.2     TCP 43723 > http-alt [ACK] Seq=1 Ack=1 Win=5888 Len=0 TSV=6520051 TSER=6573783
52057   4.300814     10.0.1.3 -> 10.0.1.2     TCP 43723 > http-alt [FIN, ACK] Seq=326 Ack=50048989 Win=2580480 Len=0 TSV=6521126 TSER=6574800
52058   4.301172     10.0.1.2 -> 10.0.1.3     TCP http-alt > 43723 [FIN, ACK] Seq=50048989 Ack=327 Win=15552 Len=0 TSV=6574858 TSER=6521126
================================================================================
IPv4 Conversations
Filter:<No Filter>
                                               |       <-      | |       ->      | |     Total     |
                                               | Frames  Bytes | | Frames  Bytes | | Frames  Bytes |
10.0.1.3             <-> 10.0.1.2               34576  52331012   17483   1154211   52059  53485223
================================================================================
  1   0.000000     10.0.1.3 -> 10.0.1.2     TCP 43725 > http-alt [SYN] Seq=0 Win=5840 Len=0 MSS=1460 TSV=6523310 TSER=0 WS=6
  2   0.000291     10.0.1.2 -> 10.0.1.3     TCP http-alt > 43725 [SYN, ACK] Seq=0 Ack=1 Win=14480 Len=0 MSS=1460 TSV=6577043 TSER=6523310 WS=6
  3   0.000316     10.0.1.3 -> 10.0.1.2     TCP 43725 > http-alt [ACK] Seq=1 Ack=1 Win=5888 Len=0 TSV=6523311 TSER=6577043
52081   4.307339     10.0.1.3 -> 10.0.1.2     TCP 43725 > http-alt [FIN, ACK] Seq=326 Ack=50048989 Win=2580480 Len=0 TSV=6524387 TSER=6578060
52082   4.307694     10.0.1.2 -> 10.0.1.3     TCP http-alt > 43725 [FIN, ACK] Seq=50048989 Ack=327 Win=15552 Len=0 TSV=6578119 TSER=6524387
================================================================================
IPv4 Conversations
Filter:<No Filter>
                                               |       <-      | |       ->      | |     Total     |
                                               | Frames  Bytes | | Frames  Bytes | | Frames  Bytes |
10.0.1.3             <-> 10.0.1.2               34599  52332530   17484   1154277   52083  53486807
================================================================================
  1   0.000000     10.0.1.3 -> 10.0.1.2     TCP 47087 > http-alt [SYN] Seq=0 Win=5840 Len=0 MSS=1460 TSV=6526578 TSER=0 WS=6
  2   0.000293     10.0.1.2 -> 10.0.1.3     TCP http-alt > 47087 [SYN, ACK] Seq=0 Ack=1 Win=14480 Len=0 MSS=1460 TSV=6580310 TSER=6526578 WS=6
  3   0.000315     10.0.1.3 -> 10.0.1.2     TCP 47087 > http-alt [ACK] Seq=1 Ack=1 Win=5888 Len=0 TSV=6526578 TSER=6580310
52123   4.304990     10.0.1.3 -> 10.0.1.2     TCP 47087 > http-alt [FIN, ACK] Seq=326 Ack=50048989 Win=2580480 Len=0 TSV=6527654 TSER=6581328
52124   4.305368     10.0.1.2 -> 10.0.1.3     TCP http-alt > 47087 [FIN, ACK] Seq=50048989 Ack=327 Win=15552 Len=0 TSV=6581387 TSER=6527654
================================================================================
IPv4 Conversations
Filter:<No Filter>
                                               |       <-      | |       ->      | |     Total     |
                                               | Frames  Bytes | | Frames  Bytes | | Frames  Bytes |
10.0.1.3             <-> 10.0.1.2               34577  52331078   17548   1158501   52125  53489579
================================================================================
  1   0.000000     10.0.1.3 -> 10.0.1.2     TCP 47089 > http-alt [SYN] Seq=0 Win=5840 Len=0 MSS=1460 TSV=6529835 TSER=0 WS=6
  2   0.000319     10.0.1.2 -> 10.0.1.3     TCP http-alt > 47089 [SYN, ACK] Seq=0 Ack=1 Win=14480 Len=0 MSS=1460 TSV=6583568 TSER=6529835 WS=6
  3   0.000342     10.0.1.3 -> 10.0.1.2     TCP 47089 > http-alt [ACK] Seq=1 Ack=1 Win=5888 Len=0 TSV=6529835 TSER=6583568
52048   4.307502     10.0.1.3 -> 10.0.1.2     TCP 47089 > http-alt [FIN, ACK] Seq=326 Ack=50048989 Win=2580480 Len=0 TSV=6530912 TSER=6584586
52049   4.307904     10.0.1.2 -> 10.0.1.3     TCP http-alt > 47089 [FIN, ACK] Seq=50048989 Ack=327 Win=15552 Len=0 TSV=6584645 TSER=6530912
================================================================================
IPv4 Conversations
Filter:<No Filter>
                                               |       <-      | |       ->      | |     Total     |
                                               | Frames  Bytes | | Frames  Bytes | | Frames  Bytes |
10.0.1.3             <-> 10.0.1.2               34576  52331012   17474   1153617   52050  53484629
================================================================================
  1   0.000000     10.0.1.3 -> 10.0.1.2     TCP 47091 > http-alt [SYN] Seq=0 Win=5840 Len=0 MSS=1460 TSV=6533096 TSER=0 WS=6
  2   0.000319     10.0.1.2 -> 10.0.1.3     TCP http-alt > 47091 [SYN, ACK] Seq=0 Ack=1 Win=14480 Len=0 MSS=1460 TSV=6586829 TSER=6533096 WS=6
  3   0.000341     10.0.1.3 -> 10.0.1.2     TCP 47091 > http-alt [ACK] Seq=1 Ack=1 Win=5888 Len=0 TSV=6533096 TSER=6586829
52205   4.307881     10.0.1.3 -> 10.0.1.2     TCP 47091 > http-alt [FIN, ACK] Seq=326 Ack=50048989 Win=2580480 Len=0 TSV=6534173 TSER=6587846
52206   4.308241     10.0.1.2 -> 10.0.1.3     TCP http-alt > 47091 [FIN, ACK] Seq=50048989 Ack=327 Win=15552 Len=0 TSV=6587906 TSER=6534173
================================================================================
IPv4 Conversations
Filter:<No Filter>
                                               |       <-      | |       ->      | |     Total     |
                                               | Frames  Bytes | | Frames  Bytes | | Frames  Bytes |
10.0.1.3             <-> 10.0.1.2               34608  52333124   17599   1161867   52207  53494991
================================================================================
  1   0.000000     10.0.1.3 -> 10.0.1.2     TCP 47093 > http-alt [SYN] Seq=0 Win=5840 Len=0 MSS=1460 TSV=6536357 TSER=0 WS=6
  2   0.000295     10.0.1.2 -> 10.0.1.3     TCP http-alt > 47093 [SYN, ACK] Seq=0 Ack=1 Win=14480 Len=0 MSS=1460 TSV=6590091 TSER=6536357 WS=6
  3   0.000320     10.0.1.3 -> 10.0.1.2     TCP 47093 > http-alt [ACK] Seq=1 Ack=1 Win=5888 Len=0 TSV=6536357 TSER=6590091
52131   4.305658     10.0.1.3 -> 10.0.1.2     TCP 47093 > http-alt [FIN, ACK] Seq=326 Ack=50048989 Win=2580480 Len=0 TSV=6537434 TSER=6591108
52132   4.306051     10.0.1.2 -> 10.0.1.3     TCP http-alt > 47093 [FIN, ACK] Seq=50048989 Ack=327 Win=15552 Len=0 TSV=6591167 TSER=6537434
================================================================================
IPv4 Conversations
Filter:<No Filter>
                                               |       <-      | |       ->      | |     Total     |
                                               | Frames  Bytes | | Frames  Bytes | | Frames  Bytes |
10.0.1.3             <-> 10.0.1.2               34576  52331012   17557   1159095   52133  53490107
================================================================================
  1   0.000000     10.0.1.3 -> 10.0.1.2     TCP 47095 > http-alt [SYN] Seq=0 Win=5840 Len=0 MSS=1460 TSV=6539613 TSER=0 WS=6
  2   0.000317     10.0.1.2 -> 10.0.1.3     TCP http-alt > 47095 [SYN, ACK] Seq=0 Ack=1 Win=14480 Len=0 MSS=1460 TSV=6593346 TSER=6539613 WS=6
  3   0.000337     10.0.1.3 -> 10.0.1.2     TCP 47095 > http-alt [ACK] Seq=1 Ack=1 Win=5888 Len=0 TSV=6539613 TSER=6593346
52139   4.306628     10.0.1.3 -> 10.0.1.2     TCP 47095 > http-alt [FIN, ACK] Seq=326 Ack=50048989 Win=2580480 Len=0 TSV=6540689 TSER=6594364
52140   4.307011     10.0.1.2 -> 10.0.1.3     TCP http-alt > 47095 [FIN, ACK] Seq=50048989 Ack=327 Win=15552 Len=0 TSV=6594423 TSER=6540689
================================================================================
IPv4 Conversations
Filter:<No Filter>
                                               |       <-      | |       ->      | |     Total     |
                                               | Frames  Bytes | | Frames  Bytes | | Frames  Bytes |
10.0.1.3             <-> 10.0.1.2               34598  52332464   17543   1158171   52141  53490635
================================================================================
  1   0.000000     10.0.1.3 -> 10.0.1.2     TCP 47097 > http-alt [SYN] Seq=0 Win=5840 Len=0 MSS=1460 TSV=6542879 TSER=0 WS=6
  2   0.000318     10.0.1.2 -> 10.0.1.3     TCP http-alt > 47097 [SYN, ACK] Seq=0 Ack=1 Win=14480 Len=0 MSS=1460 TSV=6596613 TSER=6542879 WS=6
  3   0.000344     10.0.1.3 -> 10.0.1.2     TCP 47097 > http-alt [ACK] Seq=1 Ack=1 Win=5888 Len=0 TSV=6542879 TSER=6596613
52120   4.303550     10.0.1.3 -> 10.0.1.2     TCP 47097 > http-alt [FIN, ACK] Seq=326 Ack=50048989 Win=2580480 Len=0 TSV=6543956 TSER=6597629
52121   4.303945     10.0.1.2 -> 10.0.1.3     TCP http-alt > 47097 [FIN, ACK] Seq=50048989 Ack=327 Win=15552 Len=0 TSV=6597689 TSER=6543956
================================================================================
IPv4 Conversations
Filter:<No Filter>
                                               |       <-      | |       ->      | |     Total     |
                                               | Frames  Bytes | | Frames  Bytes | | Frames  Bytes |
10.0.1.3             <-> 10.0.1.2               34575  52330946   17547   1158435   52122  53489381
================================================================================
  1   0.000000     10.0.1.3 -> 10.0.1.2     TCP 47099 > http-alt [SYN] Seq=0 Win=5840 Len=0 MSS=1460 TSV=6546137 TSER=0 WS=6
  2   0.000300     10.0.1.2 -> 10.0.1.3     TCP http-alt > 47099 [SYN, ACK] Seq=0 Ack=1 Win=14480 Len=0 MSS=1460 TSV=6599870 TSER=6546137 WS=6
  3   0.000320     10.0.1.3 -> 10.0.1.2     TCP 47099 > http-alt [ACK] Seq=1 Ack=1 Win=5888 Len=0 TSV=6546137 TSER=6599870
52175   4.307518     10.0.1.3 -> 10.0.1.2     TCP 47099 > http-alt [FIN, ACK] Seq=326 Ack=50048989 Win=2580480 Len=0 TSV=6547213 TSER=6600887
52176   4.307886     10.0.1.2 -> 10.0.1.3     TCP http-alt > 47099 [FIN, ACK] Seq=50048989 Ack=327 Win=15552 Len=0 TSV=6600947 TSER=6547213
================================================================================
IPv4 Conversations
Filter:<No Filter>
                                               |       <-      | |       ->      | |     Total     |
                                               | Frames  Bytes | | Frames  Bytes | | Frames  Bytes |
10.0.1.3             <-> 10.0.1.2               34572  52330748   17605   1162263   52177  53493011
================================================================================
  1   0.000000     10.0.1.3 -> 10.0.1.2     TCP 47103 > http-alt [SYN] Seq=0 Win=5840 Len=0 MSS=1460 TSV=6549398 TSER=0 WS=6
  2   0.000300     10.0.1.2 -> 10.0.1.3     TCP http-alt > 47103 [SYN, ACK] Seq=0 Ack=1 Win=14480 Len=0 MSS=1460 TSV=6603132 TSER=6549398 WS=6
  3   0.000322     10.0.1.3 -> 10.0.1.2     TCP 47103 > http-alt [ACK] Seq=1 Ack=1 Win=5888 Len=0 TSV=6549398 TSER=6603132
52127   4.306350     10.0.1.3 -> 10.0.1.2     TCP 47103 > http-alt [FIN, ACK] Seq=326 Ack=50048989 Win=2580480 Len=0 TSV=6550474 TSER=6604149
52128   4.306716     10.0.1.2 -> 10.0.1.3     TCP http-alt > 47103 [FIN, ACK] Seq=50048989 Ack=327 Win=15552 Len=0 TSV=6604209 TSER=6550474
================================================================================
IPv4 Conversations
Filter:<No Filter>
                                               |       <-      | |       ->      | |     Total     |
                                               | Frames  Bytes | | Frames  Bytes | | Frames  Bytes |
10.0.1.3             <-> 10.0.1.2               34577  52331078   17552   1158765   52129  53489843
================================================================================
  1   0.000000     10.0.1.3 -> 10.0.1.2     TCP 47105 > http-alt [SYN] Seq=0 Win=5840 Len=0 MSS=1460 TSV=6552656 TSER=0 WS=6
  2   0.000267     10.0.1.2 -> 10.0.1.3     TCP http-alt > 47105 [SYN, ACK] Seq=0 Ack=1 Win=14480 Len=0 MSS=1460 TSV=6606391 TSER=6552656 WS=6
  3   0.000291     10.0.1.3 -> 10.0.1.2     TCP 47105 > http-alt [ACK] Seq=1 Ack=1 Win=5888 Len=0 TSV=6552656 TSER=6606391
52150   4.307512     10.0.1.3 -> 10.0.1.2     TCP 47105 > http-alt [FIN, ACK] Seq=326 Ack=50048989 Win=2580480 Len=0 TSV=6553733 TSER=6607408
52151   4.307888     10.0.1.2 -> 10.0.1.3     TCP http-alt > 47105 [FIN, ACK] Seq=50048989 Ack=327 Win=15552 Len=0 TSV=6607468 TSER=6553733
================================================================================
IPv4 Conversations
Filter:<No Filter>
                                               |       <-      | |       ->      | |     Total     |
                                               | Frames  Bytes | | Frames  Bytes | | Frames  Bytes |
10.0.1.3             <-> 10.0.1.2               34575  52330946   17577   1160415   52152  53491361
================================================================================
  1   0.000000     10.0.1.3 -> 10.0.1.2     TCP 47107 > http-alt [SYN] Seq=0 Win=5840 Len=0 MSS=1460 TSV=6555927 TSER=0 WS=6
  2   0.000330     10.0.1.2 -> 10.0.1.3     TCP http-alt > 47107 [SYN, ACK] Seq=0 Ack=1 Win=14480 Len=0 MSS=1460 TSV=6609661 TSER=6555927 WS=6
  3   0.000353     10.0.1.3 -> 10.0.1.2     TCP 47107 > http-alt [ACK] Seq=1 Ack=1 Win=5888 Len=0 TSV=6555927 TSER=6609661
52101   4.307649     10.0.1.3 -> 10.0.1.2     TCP 47107 > http-alt [FIN, ACK] Seq=326 Ack=50048989 Win=2580480 Len=0 TSV=6557004 TSER=6610679
52102   4.308024     10.0.1.2 -> 10.0.1.3     TCP http-alt > 47107 [FIN, ACK] Seq=50048989 Ack=327 Win=15552 Len=0 TSV=6610738 TSER=6557004
================================================================================
IPv4 Conversations
Filter:<No Filter>
                                               |       <-      | |       ->      | |     Total     |
                                               | Frames  Bytes | | Frames  Bytes | | Frames  Bytes |
10.0.1.3             <-> 10.0.1.2               34571  52330682   17532   1157445   52103  53488127
================================================================================
  1   0.000000     10.0.1.3 -> 10.0.1.2     TCP 47109 > http-alt [SYN] Seq=0 Win=5840 Len=0 MSS=1460 TSV=6559190 TSER=0 WS=6
  2   0.000289     10.0.1.2 -> 10.0.1.3     TCP http-alt > 47109 [SYN, ACK] Seq=0 Ack=1 Win=14480 Len=0 MSS=1460 TSV=6612925 TSER=6559190 WS=6
  3   0.000311     10.0.1.3 -> 10.0.1.2     TCP 47109 > http-alt [ACK] Seq=1 Ack=1 Win=5888 Len=0 TSV=6559191 TSER=6612925
52006   4.313075     10.0.1.3 -> 10.0.1.2     TCP 47109 > http-alt [FIN, ACK] Seq=326 Ack=50048989 Win=2580480 Len=0 TSV=6560269 TSER=6613943
52007   4.313457     10.0.1.2 -> 10.0.1.3     TCP http-alt > 47109 [FIN, ACK] Seq=50048989 Ack=327 Win=15552 Len=0 TSV=6614004 TSER=6560269
================================================================================
IPv4 Conversations
Filter:<No Filter>
                                               |       <-      | |       ->      | |     Total     |
                                               | Frames  Bytes | | Frames  Bytes | | Frames  Bytes |
10.0.1.3             <-> 10.0.1.2               34575  52330946   17433   1150911   52008  53481857
================================================================================
  1   0.000000     10.0.1.3 -> 10.0.1.2     TCP 47111 > http-alt [SYN] Seq=0 Win=5840 Len=0 MSS=1460 TSV=6562451 TSER=0 WS=6
  2   0.000295     10.0.1.2 -> 10.0.1.3     TCP http-alt > 47111 [SYN, ACK] Seq=0 Ack=1 Win=14480 Len=0 MSS=1460 TSV=6616187 TSER=6562451 WS=6
  3   0.000320     10.0.1.3 -> 10.0.1.2     TCP 47111 > http-alt [ACK] Seq=1 Ack=1 Win=5888 Len=0 TSV=6562451 TSER=6616187
52252   4.306543     10.0.1.3 -> 10.0.1.2     TCP 47111 > http-alt [FIN, ACK] Seq=326 Ack=50048989 Win=2580480 Len=0 TSV=6563528 TSER=6617204
52253   4.306923     10.0.1.2 -> 10.0.1.3     TCP http-alt > 47111 [FIN, ACK] Seq=50048989 Ack=327 Win=15552 Len=0 TSV=6617263 TSER=6563528
================================================================================
IPv4 Conversations
Filter:<No Filter>
                                               |       <-      | |       ->      | |     Total     |
                                               | Frames  Bytes | | Frames  Bytes | | Frames  Bytes |
10.0.1.3             <-> 10.0.1.2               34608  52333124   17646   1164969   52254  53498093
================================================================================
  1   0.000000     10.0.1.3 -> 10.0.1.2     TCP 47113 > http-alt [SYN] Seq=0 Win=5840 Len=0 MSS=1460 TSV=6565717 TSER=0 WS=6
  2   0.000310     10.0.1.2 -> 10.0.1.3     TCP http-alt > 47113 [SYN, ACK] Seq=0 Ack=1 Win=14480 Len=0 MSS=1460 TSV=6619453 TSER=6565717 WS=6
  3   0.000332     10.0.1.3 -> 10.0.1.2     TCP 47113 > http-alt [ACK] Seq=1 Ack=1 Win=5888 Len=0 TSV=6565717 TSER=6619453
52145   4.308821     10.0.1.3 -> 10.0.1.2     TCP 47113 > http-alt [FIN, ACK] Seq=326 Ack=50048989 Win=2580480 Len=0 TSV=6566795 TSER=6620470
52146   4.309161     10.0.1.2 -> 10.0.1.3     TCP http-alt > 47113 [FIN, ACK] Seq=50048989 Ack=327 Win=15552 Len=0 TSV=6620530 TSER=6566795
================================================================================
IPv4 Conversations
Filter:<No Filter>
                                               |       <-      | |       ->      | |     Total     |
                                               | Frames  Bytes | | Frames  Bytes | | Frames  Bytes |
10.0.1.3             <-> 10.0.1.2               34575  52330946   17572   1160085   52147  53491031
================================================================================
  1   0.000000     10.0.1.3 -> 10.0.1.2     TCP 47115 > http-alt [SYN] Seq=0 Win=5840 Len=0 MSS=1460 TSV=6568978 TSER=0 WS=6
  2   0.000315     10.0.1.2 -> 10.0.1.3     TCP http-alt > 47115 [SYN, ACK] Seq=0 Ack=1 Win=14480 Len=0 MSS=1460 TSV=6622714 TSER=6568978 WS=6
  3   0.000338     10.0.1.3 -> 10.0.1.2     TCP 47115 > http-alt [ACK] Seq=1 Ack=1 Win=5888 Len=0 TSV=6568978 TSER=6622714
52100   4.310011     10.0.1.3 -> 10.0.1.2     TCP 47115 > http-alt [FIN, ACK] Seq=326 Ack=50048989 Win=2580480 Len=0 TSV=6570056 TSER=6623731
52101   4.310403     10.0.1.2 -> 10.0.1.3     TCP http-alt > 47115 [FIN, ACK] Seq=50048989 Ack=327 Win=15552 Len=0 TSV=6623791 TSER=6570056
================================================================================
IPv4 Conversations
Filter:<No Filter>
                                               |       <-      | |       ->      | |     Total     |
                                               | Frames  Bytes | | Frames  Bytes | | Frames  Bytes |
10.0.1.3             <-> 10.0.1.2               34572  52330748   17530   1157313   52102  53488061
================================================================================
  1   0.000000     10.0.1.3 -> 10.0.1.2     TCP 47117 > http-alt [SYN] Seq=0 Win=5840 Len=0 MSS=1460 TSV=6572240 TSER=0 WS=6
  2   0.000298     10.0.1.2 -> 10.0.1.3     TCP http-alt > 47117 [SYN, ACK] Seq=0 Ack=1 Win=14480 Len=0 MSS=1460 TSV=6625976 TSER=6572240 WS=6
  3   0.000323     10.0.1.3 -> 10.0.1.2     TCP 47117 > http-alt [ACK] Seq=1 Ack=1 Win=5888 Len=0 TSV=6572241 TSER=6625976
52151   4.314922     10.0.1.3 -> 10.0.1.2     TCP 47117 > http-alt [FIN, ACK] Seq=326 Ack=50048989 Win=2580480 Len=0 TSV=6573319 TSER=6626995
52152   4.315277     10.0.1.2 -> 10.0.1.3     TCP http-alt > 47117 [FIN, ACK] Seq=50048989 Ack=327 Win=15552 Len=0 TSV=6627055 TSER=6573319
================================================================================
IPv4 Conversations
Filter:<No Filter>
                                               |       <-      | |       ->      | |     Total     |
                                               | Frames  Bytes | | Frames  Bytes | | Frames  Bytes |
10.0.1.3             <-> 10.0.1.2               34607  52333058   17546   1158369   52153  53491427
================================================================================
