  1   0.000000     10.0.1.3 -> 10.0.1.2     TCP 41086 > http-alt [SYN] Seq=0 Win=5840 Len=0 MSS=1460 TSV=8122187 TSER=0 WS=6
  2   0.000303     10.0.1.2 -> 10.0.1.3     TCP http-alt > 41086 [SYN, ACK] Seq=0 Ack=1 Win=14480 Len=0 MSS=1460 TSV=8176040 TSER=8122187 WS=6
  3   0.000324     10.0.1.3 -> 10.0.1.2     TCP 41086 > http-alt [ACK] Seq=1 Ack=1 Win=5888 Len=0 TSV=8122187 TSER=8176040
518070  42.658978     10.0.1.3 -> 10.0.1.2     TCP 41086 > http-alt [FIN, ACK] Seq=327 Ack=500488444 Win=2580480 Len=0 TSV=8132852 TSER=8186645
518071  42.659309     10.0.1.2 -> 10.0.1.3     TCP http-alt > 41086 [FIN, ACK] Seq=500488444 Ack=328 Win=15552 Len=0 TSV=8186706 TSER=8132852
================================================================================
IPv4 Conversations
Filter:<No Filter>
                                               |       <-      | |       ->      | |     Total     |
                                               | Frames  Bytes | | Frames  Bytes | | Frames  Bytes |
10.0.1.3             <-> 10.0.1.2              345714 523305575  172358  11375962  518072 534681537
================================================================================
  1   0.000000     10.0.1.3 -> 10.0.1.2     TCP 41090 > http-alt [SYN] Seq=0 Win=5840 Len=0 MSS=1460 TSV=8138095 TSER=0 WS=6
  2   0.000362     10.0.1.2 -> 10.0.1.3     TCP http-alt > 41090 [SYN, ACK] Seq=0 Ack=1 Win=14480 Len=0 MSS=1460 TSV=8191950 TSER=8138095 WS=6
  3   0.000389     10.0.1.3 -> 10.0.1.2     TCP 41090 > http-alt [ACK] Seq=1 Ack=1 Win=5888 Len=0 TSV=8138095 TSER=8191950
517685  42.650134     10.0.1.3 -> 10.0.1.2     TCP 41090 > http-alt [FIN, ACK] Seq=327 Ack=500488444 Win=2580480 Len=0 TSV=8148758 TSER=8202554
517686  42.650516     10.0.1.2 -> 10.0.1.3     TCP http-alt > 41090 [FIN, ACK] Seq=500488444 Ack=328 Win=15552 Len=0 TSV=8202613 TSER=8148758
================================================================================
IPv4 Conversations
Filter:<No Filter>
                                               |       <-      | |       ->      | |     Total     |
                                               | Frames  Bytes | | Frames  Bytes | | Frames  Bytes |
10.0.1.3             <-> 10.0.1.2              345651 523301417  172036  11354710  517687 534656127
================================================================================
  1   0.000000     10.0.1.3 -> 10.0.1.2     TCP 41092 > http-alt [SYN] Seq=0 Win=5840 Len=0 MSS=1460 TSV=8154002 TSER=0 WS=6
  2   0.000318     10.0.1.2 -> 10.0.1.3     TCP http-alt > 41092 [SYN, ACK] Seq=0 Ack=1 Win=14480 Len=0 MSS=1460 TSV=8207858 TSER=8154002 WS=6
  3   0.000340     10.0.1.3 -> 10.0.1.2     TCP 41092 > http-alt [ACK] Seq=1 Ack=1 Win=5888 Len=0 TSV=8154002 TSER=8207858
517814  42.655201     10.0.1.3 -> 10.0.1.2     TCP 41092 > http-alt [FIN, ACK] Seq=327 Ack=500488444 Win=2580480 Len=0 TSV=8164666 TSER=8218462
517815  42.655598     10.0.1.2 -> 10.0.1.3     TCP http-alt > 41092 [FIN, ACK] Seq=500488444 Ack=328 Win=15552 Len=0 TSV=8218522 TSER=8164666
================================================================================
IPv4 Conversations
Filter:<No Filter>
                                               |       <-      | |       ->      | |     Total     |
                                               | Frames  Bytes | | Frames  Bytes | | Frames  Bytes |
10.0.1.3             <-> 10.0.1.2              345654 523301615  172162  11363026  517816 534664641
================================================================================
  1   0.000000     10.0.1.3 -> 10.0.1.2     TCP 41094 > http-alt [SYN] Seq=0 Win=5840 Len=0 MSS=1460 TSV=8169888 TSER=0 WS=6
  2   0.000317     10.0.1.2 -> 10.0.1.3     TCP http-alt > 41094 [SYN, ACK] Seq=0 Ack=1 Win=14480 Len=0 MSS=1460 TSV=8223745 TSER=8169888 WS=6
  3   0.000337     10.0.1.3 -> 10.0.1.2     TCP 41094 > http-alt [ACK] Seq=1 Ack=1 Win=5888 Len=0 TSV=8169888 TSER=8223745
518341  42.655453     10.0.1.3 -> 10.0.1.2     TCP 41094 > http-alt [FIN, ACK] Seq=327 Ack=500488444 Win=2568768 Len=0 TSV=8180552 TSER=8234349
518342  42.655796     10.0.1.2 -> 10.0.1.3     TCP http-alt > 41094 [FIN, ACK] Seq=500488444 Ack=328 Win=15552 Len=0 TSV=8234409 TSER=8180552
================================================================================
IPv4 Conversations
Filter:<No Filter>
                                               |       <-      | |       ->      | |     Total     |
                                               | Frames  Bytes | | Frames  Bytes | | Frames  Bytes |
10.0.1.3             <-> 10.0.1.2              345649 523301285  172694  11398138  518343 534699423
================================================================================
  1   0.000000     10.0.1.3 -> 10.0.1.2     TCP 56048 > http-alt [SYN] Seq=0 Win=5840 Len=0 MSS=1460 TSV=8185741 TSER=0 WS=6
  2   0.000367     10.0.1.2 -> 10.0.1.3     TCP http-alt > 56048 [SYN, ACK] Seq=0 Ack=1 Win=14480 Len=0 MSS=1460 TSV=8239599 TSER=8185741 WS=6
  3   0.000390     10.0.1.3 -> 10.0.1.2     TCP 56048 > http-alt [ACK] Seq=1 Ack=1 Win=5888 Len=0 TSV=8185741 TSER=8239599
517419  42.652622     10.0.1.3 -> 10.0.1.2     TCP 56048 > http-alt [FIN, ACK] Seq=327 Ack=500488444 Win=2580480 Len=0 TSV=8196404 TSER=8250202
517420  42.652943     10.0.1.2 -> 10.0.1.3     TCP http-alt > 56048 [FIN, ACK] Seq=500488444 Ack=328 Win=15552 Len=0 TSV=8250263 TSER=8196404
================================================================================
IPv4 Conversations
Filter:<No Filter>
                                               |       <-      | |       ->      | |     Total     |
                                               | Frames  Bytes | | Frames  Bytes | | Frames  Bytes |
10.0.1.3             <-> 10.0.1.2              345684 523303595  171737  11334976  517421 534638571
================================================================================
  1   0.000000     10.0.1.3 -> 10.0.1.2     TCP 56052 > http-alt [SYN] Seq=0 Win=5840 Len=0 MSS=1460 TSV=8201589 TSER=0 WS=6
  2   0.000405     10.0.1.2 -> 10.0.1.3     TCP http-alt > 56052 [SYN, ACK] Seq=0 Ack=1 Win=14480 Len=0 MSS=1460 TSV=8255448 TSER=8201589 WS=6
  3   0.000426     10.0.1.3 -> 10.0.1.2     TCP 56052 > http-alt [ACK] Seq=1 Ack=1 Win=5888 Len=0 TSV=8201589 TSER=8255448
517828  42.656481     10.0.1.3 -> 10.0.1.2     TCP 56052 > http-alt [FIN, ACK] Seq=327 Ack=500488444 Win=2580480 Len=0 TSV=8212253 TSER=8266053
517829  42.656822     10.0.1.2 -> 10.0.1.3     TCP http-alt > 56052 [FIN, ACK] Seq=500488444 Ack=328 Win=15552 Len=0 TSV=8266113 TSER=8212253
================================================================================
IPv4 Conversations
Filter:<No Filter>
                                               |       <-      | |       ->      | |     Total     |
                                               | Frames  Bytes | | Frames  Bytes | | Frames  Bytes |
10.0.1.3             <-> 10.0.1.2              345664 523302275  172166  11363290  517830 534665565
================================================================================
  1   0.000000     10.0.1.3 -> 10.0.1.2     TCP 56054 > http-alt [SYN] Seq=0 Win=5840 Len=0 MSS=1460 TSV=8217469 TSER=0 WS=6
  2   0.000285     10.0.1.2 -> 10.0.1.3     TCP http-alt > 56054 [SYN, ACK] Seq=0 Ack=1 Win=14480 Len=0 MSS=1460 TSV=8271330 TSER=8217469 WS=6
  3   0.000307     10.0.1.3 -> 10.0.1.2     TCP 56054 > http-alt [ACK] Seq=1 Ack=1 Win=5888 Len=0 TSV=8217469 TSER=8271330
518210  42.653053     10.0.1.3 -> 10.0.1.2     TCP 56054 > http-alt [FIN, ACK] Seq=327 Ack=500488444 Win=2580480 Len=0 TSV=8228133 TSER=8281934
518211  42.653412     10.0.1.2 -> 10.0.1.3     TCP http-alt > 56054 [FIN, ACK] Seq=500488444 Ack=328 Win=15552 Len=0 TSV=8281994 TSER=8228133
================================================================================
IPv4 Conversations
Filter:<No Filter>
                                               |       <-      | |       ->      | |     Total     |
                                               | Frames  Bytes | | Frames  Bytes | | Frames  Bytes |
10.0.1.3             <-> 10.0.1.2              345760 523308611  172452  11382166  518212 534690777
================================================================================
  1   0.000000     10.0.1.3 -> 10.0.1.2     TCP 56056 > http-alt [SYN] Seq=0 Win=5840 Len=0 MSS=1460 TSV=8233347 TSER=0 WS=6
  2   0.000366     10.0.1.2 -> 10.0.1.3     TCP http-alt > 56056 [SYN, ACK] Seq=0 Ack=1 Win=14480 Len=0 MSS=1460 TSV=8287208 TSER=8233347 WS=6
  3   0.000391     10.0.1.3 -> 10.0.1.2     TCP 56056 > http-alt [ACK] Seq=1 Ack=1 Win=5888 Len=0 TSV=8233347 TSER=8287208
518007  42.657638     10.0.1.3 -> 10.0.1.2     TCP 56056 > http-alt [FIN, ACK] Seq=327 Ack=500488444 Win=2580480 Len=0 TSV=8244011 TSER=8297813
518008  42.658020     10.0.1.2 -> 10.0.1.3     TCP http-alt > 56056 [FIN, ACK] Seq=500488444 Ack=328 Win=15552 Len=0 TSV=8297874 TSER=8244011
================================================================================
IPv4 Conversations
Filter:<No Filter>
                                               |       <-      | |       ->      | |     Total     |
                                               | Frames  Bytes | | Frames  Bytes | | Frames  Bytes |
10.0.1.3             <-> 10.0.1.2              345748 523307819  172261  11369560  518009 534677379
================================================================================
  1   0.000000     10.0.1.3 -> 10.0.1.2     TCP 56058 > http-alt [SYN] Seq=0 Win=5840 Len=0 MSS=1460 TSV=8249220 TSER=0 WS=6
  2   0.000403     10.0.1.2 -> 10.0.1.3     TCP http-alt > 56058 [SYN, ACK] Seq=0 Ack=1 Win=14480 Len=0 MSS=1460 TSV=8303083 TSER=8249220 WS=6
  3   0.000427     10.0.1.3 -> 10.0.1.2     TCP 56058 > http-alt [ACK] Seq=1 Ack=1 Win=5888 Len=0 TSV=8249220 TSER=8303083
517682  42.653638     10.0.1.3 -> 10.0.1.2     TCP 56058 > http-alt [FIN, ACK] Seq=327 Ack=500488444 Win=2580480 Len=0 TSV=8259883 TSER=8313686
517683  42.653990     10.0.1.2 -> 10.0.1.3     TCP http-alt > 56058 [FIN, ACK] Seq=500488444 Ack=328 Win=15552 Len=0 TSV=8313747 TSER=8259883
================================================================================
IPv4 Conversations
Filter:<No Filter>
                                               |       <-      | |       ->      | |     Total     |
                                               | Frames  Bytes | | Frames  Bytes | | Frames  Bytes |
10.0.1.3             <-> 10.0.1.2              345649 523301285  172035  11354644  517684 534655929
================================================================================
  1   0.000000     10.0.1.3 -> 10.0.1.2     TCP 59371 > http-alt [SYN] Seq=0 Win=5840 Len=0 MSS=1460 TSV=8265107 TSER=0 WS=6
  2   0.000276     10.0.1.2 -> 10.0.1.3     TCP http-alt > 59371 [SYN, ACK] Seq=0 Ack=1 Win=14480 Len=0 MSS=1460 TSV=8318970 TSER=8265107 WS=6
  3   0.000299     10.0.1.3 -> 10.0.1.2     TCP 59371 > http-alt [ACK] Seq=1 Ack=1 Win=5888 Len=0 TSV=8265107 TSER=8318970
517978  42.652737     10.0.1.3 -> 10.0.1.2     TCP 59371 > http-alt [FIN, ACK] Seq=327 Ack=500488444 Win=2580480 Len=0 TSV=8275770 TSER=8329576
517979  42.653075     10.0.1.2 -> 10.0.1.3     TCP http-alt > 59371 [FIN, ACK] Seq=500488444 Ack=328 Win=15552 Len=0 TSV=8329634 TSER=8275770
================================================================================
IPv4 Conversations
Filter:<No Filter>
                                               |       <-      | |       ->      | |     Total     |
                                               | Frames  Bytes | | Frames  Bytes | | Frames  Bytes |
10.0.1.3             <-> 10.0.1.2              345711 523305377  172269  11370088  517980 534675465
================================================================================
  1   0.000000     10.0.1.3 -> 10.0.1.2     TCP 59375 > http-alt [SYN] Seq=0 Win=5840 Len=0 MSS=1460 TSV=8281046 TSER=0 WS=6
  2   0.000282     10.0.1.2 -> 10.0.1.3     TCP http-alt > 59375 [SYN, ACK] Seq=0 Ack=1 Win=14480 Len=0 MSS=1460 TSV=8334911 TSER=8281046 WS=6
  3   0.000303     10.0.1.3 -> 10.0.1.2     TCP 59375 > http-alt [ACK] Seq=1 Ack=1 Win=5888 Len=0 TSV=8281046 TSER=8334911
517683  42.656196     10.0.1.3 -> 10.0.1.2     TCP 59375 > http-alt [FIN, ACK] Seq=327 Ack=500488444 Win=2580480 Len=0 TSV=8291710 TSER=8345515
517684  42.656599     10.0.1.2 -> 10.0.1.3     TCP http-alt > 59375 [FIN, ACK] Seq=500488444 Ack=328 Win=15552 Len=0 TSV=8345576 TSER=8291710
================================================================================
IPv4 Conversations
Filter:<No Filter>
                                               |       <-      | |       ->      | |     Total     |
                                               | Frames  Bytes | | Frames  Bytes | | Frames  Bytes |
10.0.1.3             <-> 10.0.1.2              345648 523301219  172037  11354776  517685 534655995
================================================================================
  1   0.000000     10.0.1.3 -> 10.0.1.2     TCP 59377 > http-alt [SYN] Seq=0 Win=5840 Len=0 MSS=1460 TSV=8296886 TSER=0 WS=6
  2   0.000303     10.0.1.2 -> 10.0.1.3     TCP http-alt > 59377 [SYN, ACK] Seq=0 Ack=1 Win=14480 Len=0 MSS=1460 TSV=8350752 TSER=8296886 WS=6
  3   0.000324     10.0.1.3 -> 10.0.1.2     TCP 59377 > http-alt [ACK] Seq=1 Ack=1 Win=5888 Len=0 TSV=8296886 TSER=8350752
517959  42.652286     10.0.1.3 -> 10.0.1.2     TCP 59377 > http-alt [FIN, ACK] Seq=327 Ack=500488444 Win=2580480 Len=0 TSV=8307548 TSER=8361357
517960  42.652631     10.0.1.2 -> 10.0.1.3     TCP http-alt > 59377 [FIN, ACK] Seq=500488444 Ack=328 Win=15552 Len=0 TSV=8361416 TSER=8307548
================================================================================
IPv4 Conversations
Filter:<No Filter>
                                               |       <-      | |       ->      | |     Total     |
                                               | Frames  Bytes | | Frames  Bytes | | Frames  Bytes |
10.0.1.3             <-> 10.0.1.2              345705 523304981  172256  11369230  517961 534674211
================================================================================
  1   0.000000     10.0.1.3 -> 10.0.1.2     TCP 59379 > http-alt [SYN] Seq=0 Win=5840 Len=0 MSS=1460 TSV=8312758 TSER=0 WS=6
  2   0.000285     10.0.1.2 -> 10.0.1.3     TCP http-alt > 59379 [SYN, ACK] Seq=0 Ack=1 Win=14480 Len=0 MSS=1460 TSV=8366626 TSER=8312758 WS=6
  3   0.000306     10.0.1.3 -> 10.0.1.2     TCP 59379 > http-alt [ACK] Seq=1 Ack=1 Win=5888 Len=0 TSV=8312758 TSER=8366626
517954  42.650133     10.0.1.3 -> 10.0.1.2     TCP 59379 > http-alt [FIN, ACK] Seq=327 Ack=500488444 Win=2580480 Len=0 TSV=8323421 TSER=8377229
517955  42.650484     10.0.1.2 -> 10.0.1.3     TCP http-alt > 59379 [FIN, ACK] Seq=500488444 Ack=328 Win=15552 Len=0 TSV=8377289 TSER=8323421
================================================================================
IPv4 Conversations
Filter:<No Filter>
                                               |       <-      | |       ->      | |     Total     |
                                               | Frames  Bytes | | Frames  Bytes | | Frames  Bytes |
10.0.1.3             <-> 10.0.1.2              345693 523304189  172263  11369692  517956 534673881
================================================================================
  1   0.000000     10.0.1.3 -> 10.0.1.2     TCP 48048 > http-alt [SYN] Seq=0 Win=5840 Len=0 MSS=1460 TSV=8328687 TSER=0 WS=6
  2   0.000281     10.0.1.2 -> 10.0.1.3     TCP http-alt > 48048 [SYN, ACK] Seq=0 Ack=1 Win=14480 Len=0 MSS=1460 TSV=8382556 TSER=8328687 WS=6
  3   0.000302     10.0.1.3 -> 10.0.1.2     TCP 48048 > http-alt [ACK] Seq=1 Ack=1 Win=5888 Len=0 TSV=8328687 TSER=8382556
518115  42.655943     10.0.1.3 -> 10.0.1.2     TCP 48048 > http-alt [FIN, ACK] Seq=327 Ack=500488444 Win=2580480 Len=0 TSV=8339351 TSER=8393161
518116  42.656281     10.0.1.2 -> 10.0.1.3     TCP http-alt > 48048 [FIN, ACK] Seq=500488444 Ack=328 Win=15552 Len=0 TSV=8393221 TSER=8339351
================================================================================
IPv4 Conversations
Filter:<No Filter>
                                               |       <-      | |       ->      | |     Total     |
                                               | Frames  Bytes | | Frames  Bytes | | Frames  Bytes |
10.0.1.3             <-> 10.0.1.2              345752 523308083  172365  11376424  518117 534684507
================================================================================
  1   0.000000     10.0.1.3 -> 10.0.1.2     TCP 48050 > http-alt [SYN] Seq=0 Win=5840 Len=0 MSS=1460 TSV=8344569 TSER=0 WS=6
  2   0.000419     10.0.1.2 -> 10.0.1.3     TCP http-alt > 48050 [SYN, ACK] Seq=0 Ack=1 Win=14480 Len=0 MSS=1460 TSV=8398439 TSER=8344569 WS=6
  3   0.000444     10.0.1.3 -> 10.0.1.2     TCP 48050 > http-alt [ACK] Seq=1 Ack=1 Win=5888 Len=0 TSV=8344569 TSER=8398439
517826  42.655832     10.0.1.3 -> 10.0.1.2     TCP 48050 > http-alt [FIN, ACK] Seq=327 Ack=500488444 Win=2580480 Len=0 TSV=8355233 TSER=8409043
517827  42.656186     10.0.1.2 -> 10.0.1.3     TCP http-alt > 48050 [FIN, ACK] Seq=500488444 Ack=328 Win=15552 Len=0 TSV=8409104 TSER=8355233
================================================================================
IPv4 Conversations
Filter:<No Filter>
                                               |       <-      | |       ->      | |     Total     |
                                               | Frames  Bytes | | Frames  Bytes | | Frames  Bytes |
10.0.1.3             <-> 10.0.1.2              345688 523303859  172140  11361574  517828 534665433
================================================================================
  1   0.000000     10.0.1.3 -> 10.0.1.2     TCP 48054 > http-alt [SYN] Seq=0 Win=5840 Len=0 MSS=1460 TSV=8360454 TSER=0 WS=6
  2   0.000323     10.0.1.2 -> 10.0.1.3     TCP http-alt > 48054 [SYN, ACK] Seq=0 Ack=1 Win=14480 Len=0 MSS=1460 TSV=8414325 TSER=8360454 WS=6
  3   0.000347     10.0.1.3 -> 10.0.1.2     TCP 48054 > http-alt [ACK] Seq=1 Ack=1 Win=5888 Len=0 TSV=8360454 TSER=8414325
517704  42.654263     10.0.1.3 -> 10.0.1.2     TCP 48054 > http-alt [FIN, ACK] Seq=327 Ack=500488444 Win=2580480 Len=0 TSV=8371118 TSER=8424928
517705  42.654571     10.0.1.2 -> 10.0.1.3     TCP http-alt > 48054 [FIN, ACK] Seq=500488444 Ack=328 Win=15552 Len=0 TSV=8424990 TSER=8371118
================================================================================
IPv4 Conversations
Filter:<No Filter>
                                               |       <-      | |       ->      | |     Total     |
                                               | Frames  Bytes | | Frames  Bytes | | Frames  Bytes |
10.0.1.3             <-> 10.0.1.2              345651 523301417  172055  11355964  517706 534657381
================================================================================
  1   0.000000     10.0.1.3 -> 10.0.1.2     TCP 48056 > http-alt [SYN] Seq=0 Win=5840 Len=0 MSS=1460 TSV=8376307 TSER=0 WS=6
  2   0.000288     10.0.1.2 -> 10.0.1.3     TCP http-alt > 48056 [SYN, ACK] Seq=0 Ack=1 Win=14480 Len=0 MSS=1460 TSV=8430179 TSER=8376307 WS=6
  3   0.000307     10.0.1.3 -> 10.0.1.2     TCP 48056 > http-alt [ACK] Seq=1 Ack=1 Win=5888 Len=0 TSV=8376307 TSER=8430179
517872  43.504488     10.0.1.3 -> 10.0.1.2     TCP 48056 > http-alt [FIN, ACK] Seq=327 Ack=500488444 Win=2580480 Len=0 TSV=8387183 TSER=8440785
517873  43.504890     10.0.1.2 -> 10.0.1.3     TCP http-alt > 48056 [FIN, ACK] Seq=500488444 Ack=328 Win=15552 Len=0 TSV=8441056 TSER=8387183
================================================================================
IPv4 Conversations
Filter:<No Filter>
                                               |       <-      | |       ->      | |     Total     |
                                               | Frames  Bytes | | Frames  Bytes | | Frames  Bytes |
10.0.1.3             <-> 10.0.1.2              345654 523301615  172220  11366854  517874 534668469
================================================================================
  1   0.000000     10.0.1.3 -> 10.0.1.2     TCP 48059 > http-alt [SYN] Seq=0 Win=5840 Len=0 MSS=1460 TSV=8392398 TSER=0 WS=6
  2   0.000317     10.0.1.2 -> 10.0.1.3     TCP http-alt > 48059 [SYN, ACK] Seq=0 Ack=1 Win=14480 Len=0 MSS=1460 TSV=8446271 TSER=8392398 WS=6
  3   0.000338     10.0.1.3 -> 10.0.1.2     TCP 48059 > http-alt [ACK] Seq=1 Ack=1 Win=5888 Len=0 TSV=8392398 TSER=8446271
517856  42.656406     10.0.1.3 -> 10.0.1.2     TCP 48059 > http-alt [FIN, ACK] Seq=327 Ack=500488444 Win=2580480 Len=0 TSV=8403061 TSER=8456876
517857  42.656757     10.0.1.2 -> 10.0.1.3     TCP http-alt > 48059 [FIN, ACK] Seq=500488444 Ack=328 Win=15552 Len=0 TSV=8456936 TSER=8403061
================================================================================
IPv4 Conversations
Filter:<No Filter>
                                               |       <-      | |       ->      | |     Total     |
                                               | Frames  Bytes | | Frames  Bytes | | Frames  Bytes |
10.0.1.3             <-> 10.0.1.2              345652 523301483  172206  11365930  517858 534667413
================================================================================
  1   0.000000     10.0.1.3 -> 10.0.1.2     TCP 57122 > http-alt [SYN] Seq=0 Win=5840 Len=0 MSS=1460 TSV=8408268 TSER=0 WS=6
  2   0.000270     10.0.1.2 -> 10.0.1.3     TCP http-alt > 57122 [SYN, ACK] Seq=0 Ack=1 Win=14480 Len=0 MSS=1460 TSV=8462142 TSER=8408268 WS=6
  3   0.000293     10.0.1.3 -> 10.0.1.2     TCP 57122 > http-alt [ACK] Seq=1 Ack=1 Win=5888 Len=0 TSV=8408268 TSER=8462142
517976  42.656716     10.0.1.3 -> 10.0.1.2     TCP 57122 > http-alt [FIN, ACK] Seq=327 Ack=500488444 Win=2580480 Len=0 TSV=8418932 TSER=8472747
517977  42.657121     10.0.1.2 -> 10.0.1.3     TCP http-alt > 57122 [FIN, ACK] Seq=500488444 Ack=328 Win=15552 Len=0 TSV=8472807 TSER=8418932
================================================================================
IPv4 Conversations
Filter:<No Filter>
                                               |       <-      | |       ->      | |     Total     |
                                               | Frames  Bytes | | Frames  Bytes | | Frames  Bytes |
10.0.1.3             <-> 10.0.1.2              345671 523302737  172307  11372596  517978 534675333
================================================================================
  1   0.000000     10.0.1.3 -> 10.0.1.2     TCP 57125 > http-alt [SYN] Seq=0 Win=5840 Len=0 MSS=1460 TSV=8424199 TSER=0 WS=6
  2   0.000318     10.0.1.2 -> 10.0.1.3     TCP http-alt > 57125 [SYN, ACK] Seq=0 Ack=1 Win=14480 Len=0 MSS=1460 TSV=8478075 TSER=8424199 WS=6
  3   0.000343     10.0.1.3 -> 10.0.1.2     TCP 57125 > http-alt [ACK] Seq=1 Ack=1 Win=5888 Len=0 TSV=8424199 TSER=8478075
518153  42.658106     10.0.1.3 -> 10.0.1.2     TCP 57125 > http-alt [FIN, ACK] Seq=327 Ack=500488444 Win=2577472 Len=0 TSV=8434864 TSER=8488680
518154  42.658487     10.0.1.2 -> 10.0.1.3     TCP http-alt > 57125 [FIN, ACK] Seq=500488444 Ack=328 Win=15552 Len=0 TSV=8488741 TSER=8434864
================================================================================
IPv4 Conversations
Filter:<No Filter>
                                               |       <-      | |       ->      | |     Total     |
                                               | Frames  Bytes | | Frames  Bytes | | Frames  Bytes |
10.0.1.3             <-> 10.0.1.2              345706 523305047  172449  11381968  518155 534687015
================================================================================
