  1   0.000000     10.0.1.3 -> 10.0.1.2     TCP 33213 > 9040 [SYN] Seq=0 Win=5840 Len=0 MSS=1460 TSV=4566624 TSER=0 WS=6
  2   0.000372     10.0.1.2 -> 10.0.1.3     TCP 9040 > 33213 [SYN, ACK] Seq=0 Ack=1 Win=14480 Len=0 MSS=1460 TSV=4551542 TSER=4566624 WS=6
  3   0.000395     10.0.1.3 -> 10.0.1.2     TCP 33213 > 9040 [ACK] Seq=1 Ack=1 Win=5888 Len=0 TSV=4566624 TSER=4551542
  7   0.002350     10.0.1.2 -> 10.0.1.3     TCP 9040 > 33213 [ACK] Seq=1 Ack=13 Win=14528 Len=0 TSV=4551542 TSER=4566624
103905  18.734132     10.0.1.3 -> 10.0.1.2     TCP 33213 > 9040 [FIN, ACK] Seq=13 Ack=100000002 Win=2005824 Len=0 TSV=4571307 TSER=4556204
103906  18.734379     10.0.1.2 -> 10.0.1.3     TCP 9040 > 33213 [ACK] Seq=100000002 Ack=14 Win=14528 Len=0 TSV=4556225 TSER=4571307
  1   0.000000     10.0.1.3 -> 10.0.1.2     TCP 33215 > 9040 [SYN] Seq=0 Win=5840 Len=0 MSS=1460 TSV=4574342 TSER=0 WS=6
  2   0.000294     10.0.1.2 -> 10.0.1.3     TCP 9040 > 33215 [SYN, ACK] Seq=0 Ack=1 Win=14480 Len=0 MSS=1460 TSV=4559260 TSER=4574342 WS=6
  3   0.000318     10.0.1.3 -> 10.0.1.2     TCP 33215 > 9040 [ACK] Seq=1 Ack=1 Win=5888 Len=0 TSV=4574342 TSER=4559260
  7   0.002261     10.0.1.2 -> 10.0.1.3     TCP 9040 > 33215 [ACK] Seq=1 Ack=13 Win=14528 Len=0 TSV=4559261 TSER=4574343
93081  18.655312     10.0.1.3 -> 10.0.1.2     TCP 33215 > 9040 [FIN, ACK] Seq=13 Ack=100000002 Win=2002944 Len=0 TSV=4579006 TSER=4563903
93082  18.655568     10.0.1.2 -> 10.0.1.3     TCP 9040 > 33215 [ACK] Seq=100000002 Ack=14 Win=14528 Len=0 TSV=4563924 TSER=4579006
  1   0.000000     10.0.1.3 -> 10.0.1.2     TCP 45999 > 9040 [SYN] Seq=0 Win=5840 Len=0 MSS=1460 TSV=4581891 TSER=0 WS=6
  2   0.000304     10.0.1.2 -> 10.0.1.3     TCP 9040 > 45999 [SYN, ACK] Seq=0 Ack=1 Win=14480 Len=0 MSS=1460 TSV=4566810 TSER=4581891 WS=6
  3   0.000338     10.0.1.3 -> 10.0.1.2     TCP 45999 > 9040 [ACK] Seq=1 Ack=1 Win=5888 Len=0 TSV=4581891 TSER=4566810
  7   0.002922     10.0.1.2 -> 10.0.1.3     TCP 9040 > 45999 [ACK] Seq=1 Ack=13 Win=14528 Len=0 TSV=4566811 TSER=4581892
99030  18.271876     10.0.1.3 -> 10.0.1.2     TCP 45999 > 9040 [FIN, ACK] Seq=13 Ack=100000002 Win=2002944 Len=0 TSV=4586459 TSER=4571357
99031  18.272128     10.0.1.2 -> 10.0.1.3     TCP 9040 > 45999 [ACK] Seq=100000002 Ack=14 Win=14528 Len=0 TSV=4571378 TSER=4586459
  1   0.000000     10.0.1.3 -> 10.0.1.2     TCP 46001 > 9040 [SYN] Seq=0 Win=5840 Len=0 MSS=1460 TSV=4589408 TSER=0 WS=6
  2   0.000301     10.0.1.2 -> 10.0.1.3     TCP 9040 > 46001 [SYN, ACK] Seq=0 Ack=1 Win=14480 Len=0 MSS=1460 TSV=4574327 TSER=4589408 WS=6
  3   0.000322     10.0.1.3 -> 10.0.1.2     TCP 46001 > 9040 [ACK] Seq=1 Ack=1 Win=5888 Len=0 TSV=4589408 TSER=4574327
  7   0.002462     10.0.1.2 -> 10.0.1.3     TCP 9040 > 46001 [ACK] Seq=1 Ack=13 Win=14528 Len=0 TSV=4574328 TSER=4589409
103930  18.684405     10.0.1.3 -> 10.0.1.2     TCP 46001 > 9040 [FIN, ACK] Seq=13 Ack=100000002 Win=2002944 Len=0 TSV=4594079 TSER=4578978
103931  18.684652     10.0.1.2 -> 10.0.1.3     TCP 9040 > 46001 [ACK] Seq=100000002 Ack=14 Win=14528 Len=0 TSV=4578999 TSER=4594079
  1   0.000000     10.0.1.3 -> 10.0.1.2     TCP 46003 > 9040 [SYN] Seq=0 Win=5840 Len=0 MSS=1460 TSV=4597140 TSER=0 WS=6
  2   0.000318     10.0.1.2 -> 10.0.1.3     TCP 9040 > 46003 [SYN, ACK] Seq=0 Ack=1 Win=14480 Len=0 MSS=1460 TSV=4582060 TSER=4597140 WS=6
  3   0.000343     10.0.1.3 -> 10.0.1.2     TCP 46003 > 9040 [ACK] Seq=1 Ack=1 Win=5888 Len=0 TSV=4597140 TSER=4582060
  7   0.002340     10.0.1.2 -> 10.0.1.3     TCP 9040 > 46003 [ACK] Seq=1 Ack=13 Win=14528 Len=0 TSV=4582061 TSER=4597141
103766  18.832594     10.0.1.3 -> 10.0.1.2     TCP 46003 > 9040 [FIN, ACK] Seq=13 Ack=100000002 Win=2002944 Len=0 TSV=4601848 TSER=4586747
103767  18.832846     10.0.1.2 -> 10.0.1.3     TCP 9040 > 46003 [ACK] Seq=100000002 Ack=14 Win=14528 Len=0 TSV=4586769 TSER=4601848
  1   0.000000     10.0.1.3 -> 10.0.1.2     TCP 46005 > 9040 [SYN] Seq=0 Win=5840 Len=0 MSS=1460 TSV=4604909 TSER=0 WS=6
  2   0.000363     10.0.1.2 -> 10.0.1.3     TCP 9040 > 46005 [SYN, ACK] Seq=0 Ack=1 Win=14480 Len=0 MSS=1460 TSV=4589830 TSER=4604909 WS=6
  3   0.000388     10.0.1.3 -> 10.0.1.2     TCP 46005 > 9040 [ACK] Seq=1 Ack=1 Win=5888 Len=0 TSV=4604909 TSER=4589830
  7   0.002373     10.0.1.2 -> 10.0.1.3     TCP 9040 > 46005 [ACK] Seq=1 Ack=13 Win=14528 Len=0 TSV=4589830 TSER=4604909
103917  18.687971     10.0.1.3 -> 10.0.1.2     TCP 46005 > 9040 [FIN, ACK] Seq=13 Ack=100000002 Win=2002944 Len=0 TSV=4609581 TSER=4594481
103918  18.688224     10.0.1.2 -> 10.0.1.3     TCP 9040 > 46005 [ACK] Seq=100000002 Ack=14 Win=14528 Len=0 TSV=4594502 TSER=4609581
  1   0.000000     10.0.1.3 -> 10.0.1.2     TCP 46007 > 9040 [SYN] Seq=0 Win=5840 Len=0 MSS=1460 TSV=4612669 TSER=0 WS=6
  2   0.000267     10.0.1.2 -> 10.0.1.3     TCP 9040 > 46007 [SYN, ACK] Seq=0 Ack=1 Win=14480 Len=0 MSS=1460 TSV=4597591 TSER=4612669 WS=6
  3   0.000291     10.0.1.3 -> 10.0.1.2     TCP 46007 > 9040 [ACK] Seq=1 Ack=1 Win=5888 Len=0 TSV=4612669 TSER=4597591
  7   0.002191     10.0.1.2 -> 10.0.1.3     TCP 9040 > 46007 [ACK] Seq=1 Ack=13 Win=14528 Len=0 TSV=4597591 TSER=4612670
104052  18.813064     10.0.1.3 -> 10.0.1.2     TCP 46007 > 9040 [FIN, ACK] Seq=13 Ack=100000002 Win=2002944 Len=0 TSV=4617373 TSER=4602273
104053  18.813315     10.0.1.2 -> 10.0.1.3     TCP 9040 > 46007 [ACK] Seq=100000002 Ack=14 Win=14528 Len=0 TSV=4602294 TSER=4617373
  1   0.000000     10.0.1.3 -> 10.0.1.2     TCP 46009 > 9040 [SYN] Seq=0 Win=5840 Len=0 MSS=1460 TSV=4620427 TSER=0 WS=6
  2   0.000283     10.0.1.2 -> 10.0.1.3     TCP 9040 > 46009 [SYN, ACK] Seq=0 Ack=1 Win=14480 Len=0 MSS=1460 TSV=4605348 TSER=4620427 WS=6
  3   0.000306     10.0.1.3 -> 10.0.1.2     TCP 46009 > 9040 [ACK] Seq=1 Ack=1 Win=5888 Len=0 TSV=4620427 TSER=4605348
  7   0.002171     10.0.1.2 -> 10.0.1.3     TCP 9040 > 46009 [ACK] Seq=1 Ack=13 Win=14528 Len=0 TSV=4605349 TSER=4620427
103819  18.628884     10.0.1.3 -> 10.0.1.2     TCP 46009 > 9040 [FIN, ACK] Seq=13 Ack=100000002 Win=2002944 Len=0 TSV=4625084 TSER=4609984
103820  18.629129     10.0.1.2 -> 10.0.1.3     TCP 9040 > 46009 [ACK] Seq=100000002 Ack=14 Win=14528 Len=0 TSV=4610006 TSER=4625084
  1   0.000000     10.0.1.3 -> 10.0.1.2     TCP 46011 > 9040 [SYN] Seq=0 Win=5840 Len=0 MSS=1460 TSV=4628151 TSER=0 WS=6
  2   0.000283     10.0.1.2 -> 10.0.1.3     TCP 9040 > 46011 [SYN, ACK] Seq=0 Ack=1 Win=14480 Len=0 MSS=1460 TSV=4613073 TSER=4628151 WS=6
  3   0.000317     10.0.1.3 -> 10.0.1.2     TCP 46011 > 9040 [ACK] Seq=1 Ack=1 Win=5888 Len=0 TSV=4628151 TSER=4613073
  7   0.003056     10.0.1.2 -> 10.0.1.3     TCP 9040 > 46011 [ACK] Seq=1 Ack=13 Win=14528 Len=0 TSV=4613074 TSER=4628152
103969  18.788780     10.0.1.3 -> 10.0.1.2     TCP 46011 > 9040 [FIN, ACK] Seq=13 Ack=100000002 Win=2005824 Len=0 TSV=4632848 TSER=4617750
103970  18.789027     10.0.1.2 -> 10.0.1.3     TCP 9040 > 46011 [ACK] Seq=100000002 Ack=14 Win=14528 Len=0 TSV=4617771 TSER=4632848
  1   0.000000     10.0.1.3 -> 10.0.1.2     TCP 46013 > 9040 [SYN] Seq=0 Win=5840 Len=0 MSS=1460 TSV=4635925 TSER=0 WS=6
  2   0.000314     10.0.1.2 -> 10.0.1.3     TCP 9040 > 46013 [SYN, ACK] Seq=0 Ack=1 Win=14480 Len=0 MSS=1460 TSV=4620848 TSER=4635925 WS=6
  3   0.000338     10.0.1.3 -> 10.0.1.2     TCP 46013 > 9040 [ACK] Seq=1 Ack=1 Win=5888 Len=0 TSV=4635925 TSER=4620848
  7   0.002271     10.0.1.2 -> 10.0.1.3     TCP 9040 > 46013 [ACK] Seq=1 Ack=13 Win=14528 Len=0 TSV=4620848 TSER=4635926
103665  18.588547     10.0.1.3 -> 10.0.1.2     TCP 46013 > 9040 [FIN, ACK] Seq=13 Ack=100000002 Win=2011584 Len=0 TSV=4640572 TSER=4625474
103666  18.588794     10.0.1.2 -> 10.0.1.3     TCP 9040 > 46013 [ACK] Seq=100000002 Ack=14 Win=14528 Len=0 TSV=4625495 TSER=4640572
  1   0.000000     10.0.1.3 -> 10.0.1.2     TCP 46015 > 9040 [SYN] Seq=0 Win=5840 Len=0 MSS=1460 TSV=4643628 TSER=0 WS=6
  2   0.000286     10.0.1.2 -> 10.0.1.3     TCP 9040 > 46015 [SYN, ACK] Seq=0 Ack=1 Win=14480 Len=0 MSS=1460 TSV=4628552 TSER=4643628 WS=6
  3   0.000308     10.0.1.3 -> 10.0.1.2     TCP 46015 > 9040 [ACK] Seq=1 Ack=1 Win=5888 Len=0 TSV=4643628 TSER=4628552
  7   0.002193     10.0.1.2 -> 10.0.1.3     TCP 9040 > 46015 [ACK] Seq=1 Ack=13 Win=14528 Len=0 TSV=4628553 TSER=4643629
103858  18.567766     10.0.1.3 -> 10.0.1.2     TCP 46015 > 9040 [FIN, ACK] Seq=13 Ack=100000002 Win=2002944 Len=0 TSV=4648270 TSER=4633173
103859  18.568028     10.0.1.2 -> 10.0.1.3     TCP 9040 > 46015 [ACK] Seq=100000002 Ack=14 Win=14528 Len=0 TSV=4633194 TSER=4648270
  1   0.000000     10.0.1.3 -> 10.0.1.2     TCP 39150 > 9040 [SYN] Seq=0 Win=5840 Len=0 MSS=1460 TSV=4651357 TSER=0 WS=6
  2   0.000353     10.0.1.2 -> 10.0.1.3     TCP 9040 > 39150 [SYN, ACK] Seq=0 Ack=1 Win=14480 Len=0 MSS=1460 TSV=4636282 TSER=4651357 WS=6
  3   0.000378     10.0.1.3 -> 10.0.1.2     TCP 39150 > 9040 [ACK] Seq=1 Ack=1 Win=5888 Len=0 TSV=4651357 TSER=4636282
  7   0.002371     10.0.1.2 -> 10.0.1.3     TCP 9040 > 39150 [ACK] Seq=1 Ack=13 Win=14528 Len=0 TSV=4636282 TSER=4651358
103844  18.694236     10.0.1.3 -> 10.0.1.2     TCP 39150 > 9040 [FIN, ACK] Seq=13 Ack=100000002 Win=2002944 Len=0 TSV=4656031 TSER=4640934
103845  18.694488     10.0.1.2 -> 10.0.1.3     TCP 9040 > 39150 [ACK] Seq=100000002 Ack=14 Win=14528 Len=0 TSV=4640956 TSER=4656031
  1   0.000000     10.0.1.3 -> 10.0.1.2     TCP 39152 > 9040 [SYN] Seq=0 Win=5840 Len=0 MSS=1460 TSV=4659062 TSER=0 WS=6
  2   0.000278     10.0.1.2 -> 10.0.1.3     TCP 9040 > 39152 [SYN, ACK] Seq=0 Ack=1 Win=14480 Len=0 MSS=1460 TSV=4643986 TSER=4659062 WS=6
  3   0.000300     10.0.1.3 -> 10.0.1.2     TCP 39152 > 9040 [ACK] Seq=1 Ack=1 Win=5888 Len=0 TSV=4659062 TSER=4643986
  7   0.002239     10.0.1.2 -> 10.0.1.3     TCP 9040 > 39152 [ACK] Seq=1 Ack=13 Win=14528 Len=0 TSV=4643987 TSER=4659062
103775  18.511499     10.0.1.3 -> 10.0.1.2     TCP 39152 > 9040 [FIN, ACK] Seq=13 Ack=100000002 Win=2002944 Len=0 TSV=4663690 TSER=4648593
103776  18.511774     10.0.1.2 -> 10.0.1.3     TCP 9040 > 39152 [ACK] Seq=100000002 Ack=14 Win=14528 Len=0 TSV=4648615 TSER=4663690
  1   0.000000     10.0.1.3 -> 10.0.1.2     TCP 39154 > 9040 [SYN] Seq=0 Win=5840 Len=0 MSS=1460 TSV=4666740 TSER=0 WS=6
  2   0.000302     10.0.1.2 -> 10.0.1.3     TCP 9040 > 39154 [SYN, ACK] Seq=0 Ack=1 Win=14480 Len=0 MSS=1460 TSV=4651666 TSER=4666740 WS=6
  3   0.000325     10.0.1.3 -> 10.0.1.2     TCP 39154 > 9040 [ACK] Seq=1 Ack=1 Win=5888 Len=0 TSV=4666740 TSER=4651666
  7   0.002275     10.0.1.2 -> 10.0.1.3     TCP 9040 > 39154 [ACK] Seq=1 Ack=13 Win=14528 Len=0 TSV=4651666 TSER=4666741
103050  18.946588     10.0.1.3 -> 10.0.1.2     TCP 39154 > 9040 [FIN, ACK] Seq=13 Ack=100000002 Win=2002944 Len=0 TSV=4671477 TSER=4656381
103051  18.946858     10.0.1.2 -> 10.0.1.3     TCP 9040 > 39154 [ACK] Seq=100000002 Ack=14 Win=14528 Len=0 TSV=4656403 TSER=4671477
  1   0.000000     10.0.1.3 -> 10.0.1.2     TCP 39156 > 9040 [SYN] Seq=0 Win=5840 Len=0 MSS=1460 TSV=4674536 TSER=0 WS=6
  2   0.000293     10.0.1.2 -> 10.0.1.3     TCP 9040 > 39156 [SYN, ACK] Seq=0 Ack=1 Win=14480 Len=0 MSS=1460 TSV=4659462 TSER=4674536 WS=6
  3   0.000318     10.0.1.3 -> 10.0.1.2     TCP 39156 > 9040 [ACK] Seq=1 Ack=1 Win=5888 Len=0 TSV=4674536 TSER=4659462
  7   0.002204     10.0.1.2 -> 10.0.1.3     TCP 9040 > 39156 [ACK] Seq=1 Ack=13 Win=14528 Len=0 TSV=4659462 TSER=4674536
103638  18.257230     10.0.1.3 -> 10.0.1.2     TCP 39156 > 9040 [FIN, ACK] Seq=13 Ack=100000002 Win=2002944 Len=0 TSV=4679100 TSER=4664005
103639  18.257478     10.0.1.2 -> 10.0.1.3     TCP 9040 > 39156 [ACK] Seq=100000002 Ack=14 Win=14528 Len=0 TSV=4664026 TSER=4679100
  1   0.000000     10.0.1.3 -> 10.0.1.2     TCP 39158 > 9040 [SYN] Seq=0 Win=5840 Len=0 MSS=1460 TSV=4682167 TSER=0 WS=6
  2   0.000302     10.0.1.2 -> 10.0.1.3     TCP 9040 > 39158 [SYN, ACK] Seq=0 Ack=1 Win=14480 Len=0 MSS=1460 TSV=4667093 TSER=4682167 WS=6
  3   0.000325     10.0.1.3 -> 10.0.1.2     TCP 39158 > 9040 [ACK] Seq=1 Ack=1 Win=5888 Len=0 TSV=4682167 TSER=4667093
  7   0.002255     10.0.1.2 -> 10.0.1.3     TCP 9040 > 39158 [ACK] Seq=1 Ack=13 Win=14528 Len=0 TSV=4667094 TSER=4682167
103881  18.632063     10.0.1.3 -> 10.0.1.2     TCP 39158 > 9040 [FIN, ACK] Seq=13 Ack=100000002 Win=2005824 Len=0 TSV=4686825 TSER=4671730
103882  18.632315     10.0.1.2 -> 10.0.1.3     TCP 9040 > 39158 [ACK] Seq=100000002 Ack=14 Win=14528 Len=0 TSV=4671751 TSER=4686825
  1   0.000000     10.0.1.3 -> 10.0.1.2     TCP 39160 > 9040 [SYN] Seq=0 Win=5840 Len=0 MSS=1460 TSV=4689874 TSER=0 WS=6
  2   0.000316     10.0.1.2 -> 10.0.1.3     TCP 9040 > 39160 [SYN, ACK] Seq=0 Ack=1 Win=14480 Len=0 MSS=1460 TSV=4674802 TSER=4689874 WS=6
  3   0.000341     10.0.1.3 -> 10.0.1.2     TCP 39160 > 9040 [ACK] Seq=1 Ack=1 Win=5888 Len=0 TSV=4689875 TSER=4674802
  7   0.002154     10.0.1.2 -> 10.0.1.3     TCP 9040 > 39160 [ACK] Seq=1 Ack=13 Win=14528 Len=0 TSV=4674802 TSER=4689875
103801  18.315176     10.0.1.3 -> 10.0.1.2     TCP 39160 > 9040 [FIN, ACK] Seq=13 Ack=100000002 Win=2002944 Len=0 TSV=4694453 TSER=4679359
103802  18.315432     10.0.1.2 -> 10.0.1.3     TCP 9040 > 39160 [ACK] Seq=100000002 Ack=14 Win=14528 Len=0 TSV=4679381 TSER=4694453
  1   0.000000     10.0.1.3 -> 10.0.1.2     TCP 39162 > 9040 [SYN] Seq=0 Win=5840 Len=0 MSS=1460 TSV=4697553 TSER=0 WS=6
  2   0.000325     10.0.1.2 -> 10.0.1.3     TCP 9040 > 39162 [SYN, ACK] Seq=0 Ack=1 Win=14480 Len=0 MSS=1460 TSV=4682481 TSER=4697553 WS=6
  3   0.000347     10.0.1.3 -> 10.0.1.2     TCP 39162 > 9040 [ACK] Seq=1 Ack=1 Win=5888 Len=0 TSV=4697554 TSER=4682481
  7   0.002305     10.0.1.2 -> 10.0.1.3     TCP 9040 > 39162 [ACK] Seq=1 Ack=13 Win=14528 Len=0 TSV=4682482 TSER=4697554
103896  18.720780     10.0.1.3 -> 10.0.1.2     TCP 39162 > 9040 [FIN, ACK] Seq=13 Ack=100000002 Win=2011584 Len=0 TSV=4702234 TSER=4687140
103897  18.721026     10.0.1.2 -> 10.0.1.3     TCP 9040 > 39162 [ACK] Seq=100000002 Ack=14 Win=14528 Len=0 TSV=4687162 TSER=4702234
  1   0.000000     10.0.1.3 -> 10.0.1.2     TCP 39164 > 9040 [SYN] Seq=0 Win=5840 Len=0 MSS=1460 TSV=4705275 TSER=0 WS=6
  2   0.000304     10.0.1.2 -> 10.0.1.3     TCP 9040 > 39164 [SYN, ACK] Seq=0 Ack=1 Win=14480 Len=0 MSS=1460 TSV=4690203 TSER=4705275 WS=6
  3   0.000327     10.0.1.3 -> 10.0.1.2     TCP 39164 > 9040 [ACK] Seq=1 Ack=1 Win=5888 Len=0 TSV=4705275 TSER=4690203
  7   0.002247     10.0.1.2 -> 10.0.1.3     TCP 9040 > 39164 [ACK] Seq=1 Ack=13 Win=14528 Len=0 TSV=4690204 TSER=4705276
104019  18.890453     10.0.1.3 -> 10.0.1.2     TCP 39164 > 9040 [FIN, ACK] Seq=13 Ack=100000002 Win=2002944 Len=0 TSV=4709997 TSER=4694905
104020  18.890710     10.0.1.2 -> 10.0.1.3     TCP 9040 > 39164 [ACK] Seq=100000002 Ack=14 Win=14528 Len=0 TSV=4694926 TSER=4709997
  1   0.000000     10.0.1.3 -> 10.0.1.2     TCP 39166 > 9040 [SYN] Seq=0 Win=5840 Len=0 MSS=1460 TSV=4713075 TSER=0 WS=6
  2   0.000303     10.0.1.2 -> 10.0.1.3     TCP 9040 > 39166 [SYN, ACK] Seq=0 Ack=1 Win=14480 Len=0 MSS=1460 TSV=4698004 TSER=4713075 WS=6
  3   0.000328     10.0.1.3 -> 10.0.1.2     TCP 39166 > 9040 [ACK] Seq=1 Ack=1 Win=5888 Len=0 TSV=4713075 TSER=4698004
  7   0.002886     10.0.1.2 -> 10.0.1.3     TCP 9040 > 39166 [ACK] Seq=1 Ack=13 Win=14528 Len=0 TSV=4698004 TSER=4713076
103889  18.628941     10.0.1.3 -> 10.0.1.2     TCP 39166 > 9040 [FIN, ACK] Seq=13 Ack=100000002 Win=2002944 Len=0 TSV=4717732 TSER=4702640
103890  18.629190     10.0.1.2 -> 10.0.1.3     TCP 9040 > 39166 [ACK] Seq=100000002 Ack=14 Win=14528 Len=0 TSV=4702661 TSER=4717732
