  1   0.000000     10.0.1.3 -> 10.0.1.2     TCP 35316 > 9040 [SYN] Seq=0 Win=5840 Len=0 MSS=1460 TSV=2305729 TSER=0 WS=6
  2   0.000336     10.0.1.2 -> 10.0.1.3     TCP 9040 > 35316 [SYN, ACK] Seq=0 Ack=1 Win=14480 Len=0 MSS=1460 TSV=2290672 TSER=2305729 WS=6
  3   0.000359     10.0.1.3 -> 10.0.1.2     TCP 35316 > 9040 [ACK] Seq=1 Ack=1 Win=5888 Len=0 TSV=2305729 TSER=2290672
  7   0.002262     10.0.1.2 -> 10.0.1.3     TCP 9040 > 35316 [ACK] Seq=1 Ack=13 Win=14528 Len=0 TSV=2290673 TSER=2305730
155212  12.792284     10.0.1.3 -> 10.0.1.2     TCP 35316 > 9040 [FIN, ACK] Seq=13 Ack=150000002 Win=2580480 Len=0 TSV=2308927 TSER=2293816
  1   0.000000     10.0.1.3 -> 10.0.1.2     TCP 35318 > 9040 [SYN] Seq=0 Win=5840 Len=0 MSS=1460 TSV=2312604 TSER=0 WS=6
  2   0.000303     10.0.1.2 -> 10.0.1.3     TCP 9040 > 35318 [SYN, ACK] Seq=0 Ack=1 Win=14480 Len=0 MSS=1460 TSV=2297548 TSER=2312604 WS=6
  3   0.000325     10.0.1.3 -> 10.0.1.2     TCP 35318 > 9040 [ACK] Seq=1 Ack=1 Win=5888 Len=0 TSV=2312604 TSER=2297548
  7   0.002300     10.0.1.2 -> 10.0.1.3     TCP 9040 > 35318 [ACK] Seq=1 Ack=13 Win=14528 Len=0 TSV=2297548 TSER=2312605
155034  12.795394     10.0.1.3 -> 10.0.1.2     TCP 35318 > 9040 [FIN, ACK] Seq=13 Ack=150000002 Win=2580480 Len=0 TSV=2315803 TSER=2300692
  1   0.000000     10.0.1.3 -> 10.0.1.2     TCP 35321 > 9040 [SYN] Seq=0 Win=5840 Len=0 MSS=1460 TSV=2319473 TSER=0 WS=6
  2   0.000312     10.0.1.2 -> 10.0.1.3     TCP 9040 > 35321 [SYN, ACK] Seq=0 Ack=1 Win=14480 Len=0 MSS=1460 TSV=2304418 TSER=2319473 WS=6
  3   0.000335     10.0.1.3 -> 10.0.1.2     TCP 35321 > 9040 [ACK] Seq=1 Ack=1 Win=5888 Len=0 TSV=2319473 TSER=2304418
  7   0.002838     10.0.1.2 -> 10.0.1.3     TCP 9040 > 35321 [ACK] Seq=1 Ack=13 Win=14528 Len=0 TSV=2304418 TSER=2319474
155037  12.803928     10.0.1.3 -> 10.0.1.2     TCP 35321 > 9040 [FIN, ACK] Seq=13 Ack=150000002 Win=2580480 Len=0 TSV=2322674 TSER=2307564
  1   0.000000     10.0.1.3 -> 10.0.1.2     TCP 36970 > 9040 [SYN] Seq=0 Win=5840 Len=0 MSS=1460 TSV=2326354 TSER=0 WS=6
  2   0.000308     10.0.1.2 -> 10.0.1.3     TCP 9040 > 36970 [SYN, ACK] Seq=0 Ack=1 Win=14480 Len=0 MSS=1460 TSV=2311299 TSER=2326354 WS=6
  3   0.000331     10.0.1.3 -> 10.0.1.2     TCP 36970 > 9040 [ACK] Seq=1 Ack=1 Win=5888 Len=0 TSV=2326354 TSER=2311299
  7   0.002108     10.0.1.2 -> 10.0.1.3     TCP 9040 > 36970 [ACK] Seq=1 Ack=13 Win=14528 Len=0 TSV=2311299 TSER=2326354
141440  12.812984     10.0.1.3 -> 10.0.1.2     TCP 36970 > 9040 [FIN, ACK] Seq=13 Ack=150000002 Win=2580480 Len=0 TSV=2329557 TSER=2314447
  1   0.000000     10.0.1.3 -> 10.0.1.2     TCP 36972 > 9040 [SYN] Seq=0 Win=5840 Len=0 MSS=1460 TSV=2333086 TSER=0 WS=6
  2   0.000336     10.0.1.2 -> 10.0.1.3     TCP 9040 > 36972 [SYN, ACK] Seq=0 Ack=1 Win=14480 Len=0 MSS=1460 TSV=2318031 TSER=2333086 WS=6
  3   0.000358     10.0.1.3 -> 10.0.1.2     TCP 36972 > 9040 [ACK] Seq=1 Ack=1 Win=5888 Len=0 TSV=2333086 TSER=2318031
  7   0.002295     10.0.1.2 -> 10.0.1.3     TCP 9040 > 36972 [ACK] Seq=1 Ack=13 Win=14528 Len=0 TSV=2318032 TSER=2333087
155029  12.794702     10.0.1.3 -> 10.0.1.2     TCP 36972 > 9040 [FIN, ACK] Seq=13 Ack=150000002 Win=2580480 Len=0 TSV=2336285 TSER=2321175
  1   0.000000     10.0.1.3 -> 10.0.1.2     TCP 36974 > 9040 [SYN] Seq=0 Win=5840 Len=0 MSS=1460 TSV=2339969 TSER=0 WS=6
  2   0.000297     10.0.1.2 -> 10.0.1.3     TCP 9040 > 36974 [SYN, ACK] Seq=0 Ack=1 Win=14480 Len=0 MSS=1460 TSV=2324915 TSER=2339969 WS=6
  3   0.000317     10.0.1.3 -> 10.0.1.2     TCP 36974 > 9040 [ACK] Seq=1 Ack=1 Win=5888 Len=0 TSV=2339969 TSER=2324915
  7   0.002959     10.0.1.2 -> 10.0.1.3     TCP 9040 > 36974 [ACK] Seq=1 Ack=13 Win=14528 Len=0 TSV=2324916 TSER=2339970
155298  12.800305     10.0.1.3 -> 10.0.1.2     TCP 36974 > 9040 [FIN, ACK] Seq=13 Ack=150000002 Win=2580480 Len=0 TSV=2343169 TSER=2328060
  1   0.000000     10.0.1.3 -> 10.0.1.2     TCP 36976 > 9040 [SYN] Seq=0 Win=5840 Len=0 MSS=1460 TSV=2347351 TSER=0 WS=6
  2   0.000312     10.0.1.2 -> 10.0.1.3     TCP 9040 > 36976 [SYN, ACK] Seq=0 Ack=1 Win=14480 Len=0 MSS=1460 TSV=2332297 TSER=2347351 WS=6
  3   0.000335     10.0.1.3 -> 10.0.1.2     TCP 36976 > 9040 [ACK] Seq=1 Ack=1 Win=5888 Len=0 TSV=2347351 TSER=2332297
  7   0.002309     10.0.1.2 -> 10.0.1.3     TCP 9040 > 36976 [ACK] Seq=1 Ack=13 Win=14528 Len=0 TSV=2332298 TSER=2347351
155317  12.821518     10.0.1.3 -> 10.0.1.2     TCP 36976 > 9040 [FIN, ACK] Seq=13 Ack=150000002 Win=2580480 Len=0 TSV=2350556 TSER=2335448
  1   0.000000     10.0.1.3 -> 10.0.1.2     TCP 36978 > 9040 [SYN] Seq=0 Win=5840 Len=0 MSS=1460 TSV=2354187 TSER=0 WS=6
  2   0.000268     10.0.1.2 -> 10.0.1.3     TCP 9040 > 36978 [SYN, ACK] Seq=0 Ack=1 Win=14480 Len=0 MSS=1460 TSV=2339134 TSER=2354187 WS=6
  3   0.000293     10.0.1.3 -> 10.0.1.2     TCP 36978 > 9040 [ACK] Seq=1 Ack=1 Win=5888 Len=0 TSV=2354187 TSER=2339134
  7   0.002350     10.0.1.2 -> 10.0.1.3     TCP 9040 > 36978 [ACK] Seq=1 Ack=13 Win=14528 Len=0 TSV=2339135 TSER=2354188
155220  12.795499     10.0.1.3 -> 10.0.1.2     TCP 36978 > 9040 [FIN, ACK] Seq=13 Ack=150000002 Win=2580480 Len=0 TSV=2357386 TSER=2342278
  1   0.000000     10.0.1.3 -> 10.0.1.2     TCP 36980 > 9040 [SYN] Seq=0 Win=5840 Len=0 MSS=1460 TSV=2361070 TSER=0 WS=6
  2   0.000358     10.0.1.2 -> 10.0.1.3     TCP 9040 > 36980 [SYN, ACK] Seq=0 Ack=1 Win=14480 Len=0 MSS=1460 TSV=2346018 TSER=2361070 WS=6
  3   0.000383     10.0.1.3 -> 10.0.1.2     TCP 36980 > 9040 [ACK] Seq=1 Ack=1 Win=5888 Len=0 TSV=2361070 TSER=2346018
  7   0.002204     10.0.1.2 -> 10.0.1.3     TCP 9040 > 36980 [ACK] Seq=1 Ack=13 Win=14528 Len=0 TSV=2346018 TSER=2361070
155173  12.794206     10.0.1.3 -> 10.0.1.2     TCP 36980 > 9040 [FIN, ACK] Seq=13 Ack=150000002 Win=2580480 Len=0 TSV=2364269 TSER=2349161
  1   0.000000     10.0.1.3 -> 10.0.1.2     TCP 36982 > 9040 [SYN] Seq=0 Win=5840 Len=0 MSS=1460 TSV=2367931 TSER=0 WS=6
  2   0.000364     10.0.1.2 -> 10.0.1.3     TCP 9040 > 36982 [SYN, ACK] Seq=0 Ack=1 Win=14480 Len=0 MSS=1460 TSV=2352879 TSER=2367931 WS=6
  3   0.000390     10.0.1.3 -> 10.0.1.2     TCP 36982 > 9040 [ACK] Seq=1 Ack=1 Win=5888 Len=0 TSV=2367931 TSER=2352879
  7   0.002239     10.0.1.2 -> 10.0.1.3     TCP 9040 > 36982 [ACK] Seq=1 Ack=13 Win=14528 Len=0 TSV=2352879 TSER=2367931
142537  12.794839     10.0.1.3 -> 10.0.1.2     TCP 36982 > 9040 [FIN, ACK] Seq=13 Ack=150000002 Win=2580480 Len=0 TSV=2371130 TSER=2356023
  1   0.000000     10.0.1.3 -> 10.0.1.2     TCP 36984 > 9040 [SYN] Seq=0 Win=5840 Len=0 MSS=1460 TSV=2374634 TSER=0 WS=6
  2   0.000363     10.0.1.2 -> 10.0.1.3     TCP 9040 > 36984 [SYN, ACK] Seq=0 Ack=1 Win=14480 Len=0 MSS=1460 TSV=2359582 TSER=2374634 WS=6
  3   0.000387     10.0.1.3 -> 10.0.1.2     TCP 36984 > 9040 [ACK] Seq=1 Ack=1 Win=5888 Len=0 TSV=2374634 TSER=2359582
  7   0.002319     10.0.1.2 -> 10.0.1.3     TCP 9040 > 36984 [ACK] Seq=1 Ack=13 Win=14528 Len=0 TSV=2359583 TSER=2374634
155391  12.796668     10.0.1.3 -> 10.0.1.2     TCP 36984 > 9040 [FIN, ACK] Seq=13 Ack=150000002 Win=2580480 Len=0 TSV=2377833 TSER=2362726
  1   0.000000     10.0.1.3 -> 10.0.1.2     TCP 36986 > 9040 [SYN] Seq=0 Win=5840 Len=0 MSS=1460 TSV=2381509 TSER=0 WS=6
  2   0.000283     10.0.1.2 -> 10.0.1.3     TCP 9040 > 36986 [SYN, ACK] Seq=0 Ack=1 Win=14480 Len=0 MSS=1460 TSV=2366458 TSER=2381509 WS=6
  3   0.000305     10.0.1.3 -> 10.0.1.2     TCP 36986 > 9040 [ACK] Seq=1 Ack=1 Win=5888 Len=0 TSV=2381509 TSER=2366458
  7   0.002245     10.0.1.2 -> 10.0.1.3     TCP 9040 > 36986 [ACK] Seq=1 Ack=13 Win=14528 Len=0 TSV=2366459 TSER=2381510
155403  12.794715     10.0.1.3 -> 10.0.1.2     TCP 36986 > 9040 [FIN, ACK] Seq=13 Ack=150000002 Win=2580480 Len=0 TSV=2384708 TSER=2369602
  1   0.000000     10.0.1.3 -> 10.0.1.2     TCP 36988 > 9040 [SYN] Seq=0 Win=5840 Len=0 MSS=1460 TSV=2388880 TSER=0 WS=6
  2   0.000274     10.0.1.2 -> 10.0.1.3     TCP 9040 > 36988 [SYN, ACK] Seq=0 Ack=1 Win=14480 Len=0 MSS=1460 TSV=2373830 TSER=2388880 WS=6
  3   0.000296     10.0.1.3 -> 10.0.1.2     TCP 36988 > 9040 [ACK] Seq=1 Ack=1 Win=5888 Len=0 TSV=2388880 TSER=2373830
  7   0.002287     10.0.1.2 -> 10.0.1.3     TCP 9040 > 36988 [ACK] Seq=1 Ack=13 Win=14528 Len=0 TSV=2373830 TSER=2388881
152676  12.793134     10.0.1.3 -> 10.0.1.2     TCP 36988 > 9040 [FIN, ACK] Seq=13 Ack=150000002 Win=2568768 Len=0 TSV=2392079 TSER=2376974
  1   0.000000     10.0.1.3 -> 10.0.1.2     TCP 36991 > 9040 [SYN] Seq=0 Win=5840 Len=0 MSS=1460 TSV=2395704 TSER=0 WS=6
  2   0.000424     10.0.1.2 -> 10.0.1.3     TCP 9040 > 36991 [SYN, ACK] Seq=0 Ack=1 Win=14480 Len=0 MSS=1460 TSV=2380654 TSER=2395704 WS=6
  3   0.000446     10.0.1.3 -> 10.0.1.2     TCP 36991 > 9040 [ACK] Seq=1 Ack=1 Win=5888 Len=0 TSV=2395704 TSER=2380654
  7   0.002389     10.0.1.2 -> 10.0.1.3     TCP 9040 > 36991 [ACK] Seq=1 Ack=13 Win=14528 Len=0 TSV=2380654 TSER=2395704
154969  12.790658     10.0.1.3 -> 10.0.1.2     TCP 36991 > 9040 [FIN, ACK] Seq=13 Ack=150000002 Win=2580480 Len=0 TSV=2398902 TSER=2383797
  1   0.000000     10.0.1.3 -> 10.0.1.2     TCP 43771 > 9040 [SYN] Seq=0 Win=5840 Len=0 MSS=1460 TSV=2402554 TSER=0 WS=6
  2   0.000309     10.0.1.2 -> 10.0.1.3     TCP 9040 > 43771 [SYN, ACK] Seq=0 Ack=1 Win=14480 Len=0 MSS=1460 TSV=2387505 TSER=2402554 WS=6
  3   0.000333     10.0.1.3 -> 10.0.1.2     TCP 43771 > 9040 [ACK] Seq=1 Ack=1 Win=5888 Len=0 TSV=2402554 TSER=2387505
  7   0.002295     10.0.1.2 -> 10.0.1.3     TCP 9040 > 43771 [ACK] Seq=1 Ack=13 Win=14528 Len=0 TSV=2387505 TSER=2402555
155390  12.798136     10.0.1.3 -> 10.0.1.2     TCP 43771 > 9040 [FIN, ACK] Seq=13 Ack=150000002 Win=2580480 Len=0 TSV=2405754 TSER=2390650
  1   0.000000     10.0.1.3 -> 10.0.1.2     TCP 43773 > 9040 [SYN] Seq=0 Win=5840 Len=0 MSS=1460 TSV=2409430 TSER=0 WS=6
  2   0.000317     10.0.1.2 -> 10.0.1.3     TCP 9040 > 43773 [SYN, ACK] Seq=0 Ack=1 Win=14480 Len=0 MSS=1460 TSV=2394381 TSER=2409430 WS=6
  3   0.000340     10.0.1.3 -> 10.0.1.2     TCP 43773 > 9040 [ACK] Seq=1 Ack=1 Win=5888 Len=0 TSV=2409430 TSER=2394381
  7   0.002389     10.0.1.2 -> 10.0.1.3     TCP 9040 > 43773 [ACK] Seq=1 Ack=13 Win=14528 Len=0 TSV=2394381 TSER=2409430
146846  12.797098     10.0.1.3 -> 10.0.1.2     TCP 43773 > 9040 [FIN, ACK] Seq=13 Ack=150000002 Win=2580480 Len=0 TSV=2412629 TSER=2397525
  1   0.000000     10.0.1.3 -> 10.0.1.2     TCP 43775 > 9040 [SYN] Seq=0 Win=5840 Len=0 MSS=1460 TSV=2416204 TSER=0 WS=6
  2   0.000382     10.0.1.2 -> 10.0.1.3     TCP 9040 > 43775 [SYN, ACK] Seq=0 Ack=1 Win=14480 Len=0 MSS=1460 TSV=2401156 TSER=2416204 WS=6
  3   0.000406     10.0.1.3 -> 10.0.1.2     TCP 43775 > 9040 [ACK] Seq=1 Ack=1 Win=5888 Len=0 TSV=2416204 TSER=2401156
  7   0.002270     10.0.1.2 -> 10.0.1.3     TCP 9040 > 43775 [ACK] Seq=1 Ack=13 Win=14528 Len=0 TSV=2401156 TSER=2416205
155315  12.795282     10.0.1.3 -> 10.0.1.2     TCP 43775 > 9040 [FIN, ACK] Seq=13 Ack=150000002 Win=2580480 Len=0 TSV=2419403 TSER=2404299
  1   0.000000     10.0.1.3 -> 10.0.1.2     TCP 43777 > 9040 [SYN] Seq=0 Win=5840 Len=0 MSS=1460 TSV=2423641 TSER=0 WS=6
  2   0.000303     10.0.1.2 -> 10.0.1.3     TCP 9040 > 43777 [SYN, ACK] Seq=0 Ack=1 Win=14480 Len=0 MSS=1460 TSV=2408593 TSER=2423641 WS=6
  3   0.000326     10.0.1.3 -> 10.0.1.2     TCP 43777 > 9040 [ACK] Seq=1 Ack=1 Win=5888 Len=0 TSV=2423641 TSER=2408593
  7   0.002436     10.0.1.2 -> 10.0.1.3     TCP 9040 > 43777 [ACK] Seq=1 Ack=13 Win=14528 Len=0 TSV=2408594 TSER=2423642
155312  13.397803     10.0.1.3 -> 10.0.1.2     TCP 43777 > 9040 [FIN, ACK] Seq=13 Ack=150000002 Win=2580480 Len=0 TSV=2426990 TSER=2411888
  1   0.000000     10.0.1.3 -> 10.0.1.2     TCP 43779 > 9040 [SYN] Seq=0 Win=5840 Len=0 MSS=1460 TSV=2430671 TSER=0 WS=6
  2   0.000277     10.0.1.2 -> 10.0.1.3     TCP 9040 > 43779 [SYN, ACK] Seq=0 Ack=1 Win=14480 Len=0 MSS=1460 TSV=2415624 TSER=2430671 WS=6
  3   0.000300     10.0.1.3 -> 10.0.1.2     TCP 43779 > 9040 [ACK] Seq=1 Ack=1 Win=5888 Len=0 TSV=2430671 TSER=2415624
  7   0.002314     10.0.1.2 -> 10.0.1.3     TCP 9040 > 43779 [ACK] Seq=1 Ack=13 Win=14528 Len=0 TSV=2415624 TSER=2430672
143734  12.797031     10.0.1.3 -> 10.0.1.2     TCP 43779 > 9040 [FIN, ACK] Seq=13 Ack=150000002 Win=2580480 Len=0 TSV=2433871 TSER=2418768
  1   0.000000     10.0.1.3 -> 10.0.1.2     TCP 43781 > 9040 [SYN] Seq=0 Win=5840 Len=0 MSS=1460 TSV=2437399 TSER=0 WS=6
  2   0.000298     10.0.1.2 -> 10.0.1.3     TCP 9040 > 43781 [SYN, ACK] Seq=0 Ack=1 Win=14480 Len=0 MSS=1460 TSV=2422352 TSER=2437399 WS=6
  3   0.000322     10.0.1.3 -> 10.0.1.2     TCP 43781 > 9040 [ACK] Seq=1 Ack=1 Win=5888 Len=0 TSV=2437399 TSER=2422352
  7   0.002170     10.0.1.2 -> 10.0.1.3     TCP 9040 > 43781 [ACK] Seq=1 Ack=13 Win=14528 Len=0 TSV=2422352 TSER=2437399
155318  12.796853     10.0.1.3 -> 10.0.1.2     TCP 43781 > 9040 [FIN, ACK] Seq=13 Ack=150000002 Win=2580480 Len=0 TSV=2440598 TSER=2425496
