  1   0.000000     10.0.1.3 -> 10.0.1.2     TCP 41085 > 9040 [SYN] Seq=0 Win=5840 Len=0 MSS=1460 TSV=10064656 TSER=0 WS=6
  2   0.000293     10.0.1.2 -> 10.0.1.3     TCP 9040 > 41085 [SYN, ACK] Seq=0 Ack=1 Win=14480 Len=0 MSS=1460 TSV=2479302 TSER=10064656 WS=6
  3   0.000320     10.0.1.3 -> 10.0.1.2     TCP 41085 > 9040 [ACK] Seq=1 Ack=1 Win=5888 Len=0 TSV=10064656 TSER=2479302
  7   0.004102     10.0.1.2 -> 10.0.1.3     TCP 9040 > 41085 [ACK] Seq=1 Ack=13 Win=14528 Len=0 TSV=2479303 TSER=10064657
154502  12.796885     10.0.1.3 -> 10.0.1.2     TCP 41085 > 9040 [FIN, ACK] Seq=13 Ack=150000002 Win=2580480 Len=0 TSV=10067855 TSER=2482446
154503  12.797141     10.0.1.2 -> 10.0.1.3     TCP 9040 > 41085 [ACK] Seq=150000002 Ack=14 Win=14528 Len=0 TSV=2482501 TSER=10067855
  1   0.000000     10.0.1.3 -> 10.0.1.2     TCP 41088 > 9040 [SYN] Seq=0 Win=5840 Len=0 MSS=1460 TSV=10071541 TSER=0 WS=6
  2   0.000274     10.0.1.2 -> 10.0.1.3     TCP 9040 > 41088 [SYN, ACK] Seq=0 Ack=1 Win=14480 Len=0 MSS=1460 TSV=2486187 TSER=10071541 WS=6
  3   0.000297     10.0.1.3 -> 10.0.1.2     TCP 41088 > 9040 [ACK] Seq=1 Ack=1 Win=5888 Len=0 TSV=10071541 TSER=2486187
  7   0.002199     10.0.1.2 -> 10.0.1.3     TCP 9040 > 41088 [ACK] Seq=1 Ack=13 Win=14528 Len=0 TSV=2486187 TSER=10071541
140367  12.809805     10.0.1.3 -> 10.0.1.2     TCP 41088 > 9040 [FIN, ACK] Seq=13 Ack=150000002 Win=2580480 Len=0 TSV=10074743 TSER=2489335
140368  12.810057     10.0.1.2 -> 10.0.1.3     TCP 9040 > 41088 [ACK] Seq=150000002 Ack=14 Win=14528 Len=0 TSV=2489390 TSER=10074743
  1   0.000000     10.0.1.3 -> 10.0.1.2     TCP 41090 > 9040 [SYN] Seq=0 Win=5840 Len=0 MSS=1460 TSV=10078254 TSER=0 WS=6
  2   0.000294     10.0.1.2 -> 10.0.1.3     TCP 9040 > 41090 [SYN, ACK] Seq=0 Ack=1 Win=14480 Len=0 MSS=1460 TSV=2492901 TSER=10078254 WS=6
  3   0.000317     10.0.1.3 -> 10.0.1.2     TCP 41090 > 9040 [ACK] Seq=1 Ack=1 Win=5888 Len=0 TSV=10078254 TSER=2492901
  7   0.002324     10.0.1.2 -> 10.0.1.3     TCP 9040 > 41090 [ACK] Seq=1 Ack=13 Win=14528 Len=0 TSV=2492901 TSER=10078255
154796  12.798572     10.0.1.3 -> 10.0.1.2     TCP 41090 > 9040 [FIN, ACK] Seq=13 Ack=150000002 Win=2580480 Len=0 TSV=10081454 TSER=2496046
154797  12.798815     10.0.1.2 -> 10.0.1.3     TCP 9040 > 41090 [ACK] Seq=150000002 Ack=14 Win=14528 Len=0 TSV=2496101 TSER=10081454
  1   0.000000     10.0.1.3 -> 10.0.1.2     TCP 41092 > 9040 [SYN] Seq=0 Win=5840 Len=0 MSS=1460 TSV=10085131 TSER=0 WS=6
  2   0.000276     10.0.1.2 -> 10.0.1.3     TCP 9040 > 41092 [SYN, ACK] Seq=0 Ack=1 Win=14480 Len=0 MSS=1460 TSV=2499779 TSER=10085131 WS=6
  3   0.000302     10.0.1.3 -> 10.0.1.2     TCP 41092 > 9040 [ACK] Seq=1 Ack=1 Win=5888 Len=0 TSV=10085131 TSER=2499779
  7   0.002309     10.0.1.2 -> 10.0.1.3     TCP 9040 > 41092 [ACK] Seq=1 Ack=13 Win=14528 Len=0 TSV=2499779 TSER=10085132
150863  12.801483     10.0.1.3 -> 10.0.1.2     TCP 41092 > 9040 [FIN, ACK] Seq=13 Ack=150000002 Win=2580480 Len=0 TSV=10088332 TSER=2502924
150864  12.801724     10.0.1.2 -> 10.0.1.3     TCP 9040 > 41092 [ACK] Seq=150000002 Ack=14 Win=14528 Len=0 TSV=2502979 TSER=10088332
  1   0.000000     10.0.1.3 -> 10.0.1.2     TCP 41096 > 9040 [SYN] Seq=0 Win=5840 Len=0 MSS=1460 TSV=10091986 TSER=0 WS=6
  2   0.000284     10.0.1.2 -> 10.0.1.3     TCP 9040 > 41096 [SYN, ACK] Seq=0 Ack=1 Win=14480 Len=0 MSS=1460 TSV=2506634 TSER=10091986 WS=6
  3   0.000309     10.0.1.3 -> 10.0.1.2     TCP 41096 > 9040 [ACK] Seq=1 Ack=1 Win=5888 Len=0 TSV=10091986 TSER=2506634
  7   0.002278     10.0.1.2 -> 10.0.1.3     TCP 9040 > 41096 [ACK] Seq=1 Ack=13 Win=14528 Len=0 TSV=2506635 TSER=10091986
154730  12.802378     10.0.1.3 -> 10.0.1.2     TCP 41096 > 9040 [FIN, ACK] Seq=13 Ack=150000002 Win=2580480 Len=0 TSV=10095187 TSER=2509780
154731  12.802632     10.0.1.2 -> 10.0.1.3     TCP 9040 > 41096 [ACK] Seq=150000002 Ack=14 Win=14528 Len=0 TSV=2509835 TSER=10095187
  1   0.000000     10.0.1.3 -> 10.0.1.2     TCP 41098 > 9040 [SYN] Seq=0 Win=5840 Len=0 MSS=1460 TSV=10098872 TSER=0 WS=6
  2   0.000304     10.0.1.2 -> 10.0.1.3     TCP 9040 > 41098 [SYN, ACK] Seq=0 Ack=1 Win=14480 Len=0 MSS=1460 TSV=2513520 TSER=10098872 WS=6
  3   0.000328     10.0.1.3 -> 10.0.1.2     TCP 41098 > 9040 [ACK] Seq=1 Ack=1 Win=5888 Len=0 TSV=10098872 TSER=2513520
  7   0.002179     10.0.1.2 -> 10.0.1.3     TCP 9040 > 41098 [ACK] Seq=1 Ack=13 Win=14528 Len=0 TSV=2513521 TSER=10098872
154970  12.794923     10.0.1.3 -> 10.0.1.2     TCP 41098 > 9040 [FIN, ACK] Seq=13 Ack=150000002 Win=2580480 Len=0 TSV=10102070 TSER=2516664
154971  12.795174     10.0.1.2 -> 10.0.1.3     TCP 9040 > 41098 [ACK] Seq=150000002 Ack=14 Win=14528 Len=0 TSV=2516719 TSER=10102070
  1   0.000000     10.0.1.3 -> 10.0.1.2     TCP 41103 > 9040 [SYN] Seq=0 Win=5840 Len=0 MSS=1460 TSV=10105760 TSER=0 WS=6
  2   0.000267     10.0.1.2 -> 10.0.1.3     TCP 9040 > 41103 [SYN, ACK] Seq=0 Ack=1 Win=14480 Len=0 MSS=1460 TSV=2520409 TSER=10105760 WS=6
  3   0.000285     10.0.1.3 -> 10.0.1.2     TCP 41103 > 9040 [ACK] Seq=1 Ack=1 Win=5888 Len=0 TSV=10105760 TSER=2520409
  7   0.002129     10.0.1.2 -> 10.0.1.3     TCP 9040 > 41103 [ACK] Seq=1 Ack=13 Win=14528 Len=0 TSV=2520409 TSER=10105760
154863  12.808875     10.0.1.3 -> 10.0.1.2     TCP 41103 > 9040 [FIN, ACK] Seq=13 Ack=150000002 Win=2580480 Len=0 TSV=10108962 TSER=2523556
154864  12.809128     10.0.1.2 -> 10.0.1.3     TCP 9040 > 41103 [ACK] Seq=150000002 Ack=14 Win=14528 Len=0 TSV=2523611 TSER=10108962
  1   0.000000     10.0.1.3 -> 10.0.1.2     TCP 41105 > 9040 [SYN] Seq=0 Win=5840 Len=0 MSS=1460 TSV=10112661 TSER=0 WS=6
  2   0.000292     10.0.1.2 -> 10.0.1.3     TCP 9040 > 41105 [SYN, ACK] Seq=0 Ack=1 Win=14480 Len=0 MSS=1460 TSV=2527311 TSER=10112661 WS=6
  3   0.000316     10.0.1.3 -> 10.0.1.2     TCP 41105 > 9040 [ACK] Seq=1 Ack=1 Win=5888 Len=0 TSV=10112661 TSER=2527311
  7   0.002243     10.0.1.2 -> 10.0.1.3     TCP 9040 > 41105 [ACK] Seq=1 Ack=13 Win=14528 Len=0 TSV=2527312 TSER=10112662
154669  12.830764     10.0.1.3 -> 10.0.1.2     TCP 41105 > 9040 [FIN, ACK] Seq=13 Ack=150000002 Win=2580480 Len=0 TSV=10115869 TSER=2530464
154670  12.831010     10.0.1.2 -> 10.0.1.3     TCP 9040 > 41105 [ACK] Seq=150000002 Ack=14 Win=14528 Len=0 TSV=2530519 TSER=10115869
  1   0.000000     10.0.1.3 -> 10.0.1.2     TCP 41107 > 9040 [SYN] Seq=0 Win=5840 Len=0 MSS=1460 TSV=10119552 TSER=0 WS=6
  2   0.000291     10.0.1.2 -> 10.0.1.3     TCP 9040 > 41107 [SYN, ACK] Seq=0 Ack=1 Win=14480 Len=0 MSS=1460 TSV=2534202 TSER=10119552 WS=6
  3   0.000314     10.0.1.3 -> 10.0.1.2     TCP 41107 > 9040 [ACK] Seq=1 Ack=1 Win=5888 Len=0 TSV=10119552 TSER=2534202
  7   0.002012     10.0.1.2 -> 10.0.1.3     TCP 9040 > 41107 [ACK] Seq=1 Ack=13 Win=14528 Len=0 TSV=2534202 TSER=10119552
143860  12.813041     10.0.1.3 -> 10.0.1.2     TCP 41107 > 9040 [FIN, ACK] Seq=13 Ack=150000002 Win=2580480 Len=0 TSV=10122755 TSER=2537350
143861  12.813297     10.0.1.2 -> 10.0.1.3     TCP 9040 > 41107 [ACK] Seq=150000002 Ack=14 Win=14528 Len=0 TSV=2537405 TSER=10122755
  1   0.000000     10.0.1.3 -> 10.0.1.2     TCP 49648 > 9040 [SYN] Seq=0 Win=5840 Len=0 MSS=1460 TSV=10126285 TSER=0 WS=6
  2   0.000285     10.0.1.2 -> 10.0.1.3     TCP 9040 > 49648 [SYN, ACK] Seq=0 Ack=1 Win=14480 Len=0 MSS=1460 TSV=2540935 TSER=10126285 WS=6
  3   0.000318     10.0.1.3 -> 10.0.1.2     TCP 49648 > 9040 [ACK] Seq=1 Ack=1 Win=5888 Len=0 TSV=10126285 TSER=2540935
  7   0.002168     10.0.1.2 -> 10.0.1.3     TCP 9040 > 49648 [ACK] Seq=1 Ack=13 Win=14528 Len=0 TSV=2540936 TSER=10126285
155204  12.797561     10.0.1.3 -> 10.0.1.2     TCP 49648 > 9040 [FIN, ACK] Seq=13 Ack=150000002 Win=2568768 Len=0 TSV=10129484 TSER=2544080
155205  12.797816     10.0.1.2 -> 10.0.1.3     TCP 9040 > 49648 [ACK] Seq=150000002 Ack=14 Win=14528 Len=0 TSV=2544135 TSER=10129484
  1   0.000000     10.0.1.3 -> 10.0.1.2     TCP 49650 > 9040 [SYN] Seq=0 Win=5840 Len=0 MSS=1460 TSV=10133141 TSER=0 WS=6
  2   0.000296     10.0.1.2 -> 10.0.1.3     TCP 9040 > 49650 [SYN, ACK] Seq=0 Ack=1 Win=14480 Len=0 MSS=1460 TSV=2547792 TSER=10133141 WS=6
  3   0.000320     10.0.1.3 -> 10.0.1.2     TCP 49650 > 9040 [ACK] Seq=1 Ack=1 Win=5888 Len=0 TSV=10133141 TSER=2547792
  7   0.002249     10.0.1.2 -> 10.0.1.3     TCP 9040 > 49650 [ACK] Seq=1 Ack=13 Win=14528 Len=0 TSV=2547793 TSER=10133142
155072  12.807752     10.0.1.3 -> 10.0.1.2     TCP 49650 > 9040 [FIN, ACK] Seq=13 Ack=150000002 Win=2580480 Len=0 TSV=10136343 TSER=2550939
155073  12.807983     10.0.1.2 -> 10.0.1.3     TCP 9040 > 49650 [ACK] Seq=150000002 Ack=14 Win=14528 Len=0 TSV=2550994 TSER=10136343
  1   0.000000     10.0.1.3 -> 10.0.1.2     TCP 49653 > 9040 [SYN] Seq=0 Win=5840 Len=0 MSS=1460 TSV=10140013 TSER=0 WS=6
  2   0.000303     10.0.1.2 -> 10.0.1.3     TCP 9040 > 49653 [SYN, ACK] Seq=0 Ack=1 Win=14480 Len=0 MSS=1460 TSV=2554664 TSER=10140013 WS=6
  3   0.000326     10.0.1.3 -> 10.0.1.2     TCP 49653 > 9040 [ACK] Seq=1 Ack=1 Win=5888 Len=0 TSV=10140013 TSER=2554664
  7   0.002219     10.0.1.2 -> 10.0.1.3     TCP 9040 > 49653 [ACK] Seq=1 Ack=13 Win=14528 Len=0 TSV=2554665 TSER=10140013
154816  12.797764     10.0.1.3 -> 10.0.1.2     TCP 49653 > 9040 [FIN, ACK] Seq=13 Ack=150000002 Win=2580480 Len=0 TSV=10143212 TSER=2557809
154817  12.798007     10.0.1.2 -> 10.0.1.3     TCP 9040 > 49653 [ACK] Seq=150000002 Ack=14 Win=14528 Len=0 TSV=2557864 TSER=10143212
  1   0.000000     10.0.1.3 -> 10.0.1.2     TCP 49655 > 9040 [SYN] Seq=0 Win=5840 Len=0 MSS=1460 TSV=10146927 TSER=0 WS=6
  2   0.000350     10.0.1.2 -> 10.0.1.3     TCP 9040 > 49655 [SYN, ACK] Seq=0 Ack=1 Win=14480 Len=0 MSS=1460 TSV=2561579 TSER=10146927 WS=6
  3   0.000373     10.0.1.3 -> 10.0.1.2     TCP 49655 > 9040 [ACK] Seq=1 Ack=1 Win=5888 Len=0 TSV=10146927 TSER=2561579
  7   0.002276     10.0.1.2 -> 10.0.1.3     TCP 9040 > 49655 [ACK] Seq=1 Ack=13 Win=14528 Len=0 TSV=2561580 TSER=10146928
  1   0.000000     10.0.1.3 -> 10.0.1.2     TCP 49657 > 9040 [SYN] Seq=0 Win=5840 Len=0 MSS=1460 TSV=10153804 TSER=0 WS=6
  2   0.000300     10.0.1.2 -> 10.0.1.3     TCP 9040 > 49657 [SYN, ACK] Seq=0 Ack=1 Win=14480 Len=0 MSS=1460 TSV=2568457 TSER=10153804 WS=6
  3   0.000324     10.0.1.3 -> 10.0.1.2     TCP 49657 > 9040 [ACK] Seq=1 Ack=1 Win=5888 Len=0 TSV=10153804 TSER=2568457
  7   0.002219     10.0.1.2 -> 10.0.1.3     TCP 9040 > 49657 [ACK] Seq=1 Ack=13 Win=14528 Len=0 TSV=2568457 TSER=10153805
154824  12.857676     10.0.1.3 -> 10.0.1.2     TCP 49657 > 9040 [FIN, ACK] Seq=13 Ack=150000002 Win=2580480 Len=0 TSV=10157019 TSER=2571617
154825  12.857952     10.0.1.2 -> 10.0.1.3     TCP 9040 > 49657 [ACK] Seq=150000002 Ack=14 Win=14528 Len=0 TSV=2571672 TSER=10157019
  1   0.000000     10.0.1.3 -> 10.0.1.2     TCP 49660 > 9040 [SYN] Seq=0 Win=5840 Len=0 MSS=1460 TSV=10160694 TSER=0 WS=6
  2   0.000303     10.0.1.2 -> 10.0.1.3     TCP 9040 > 49660 [SYN, ACK] Seq=0 Ack=1 Win=14480 Len=0 MSS=1460 TSV=2575348 TSER=10160694 WS=6
  3   0.000326     10.0.1.3 -> 10.0.1.2     TCP 49660 > 9040 [ACK] Seq=1 Ack=1 Win=5888 Len=0 TSV=10160694 TSER=2575348
  7   0.002203     10.0.1.2 -> 10.0.1.3     TCP 9040 > 49660 [ACK] Seq=1 Ack=13 Win=14528 Len=0 TSV=2575348 TSER=10160695
154609  12.793780     10.0.1.3 -> 10.0.1.2     TCP 49660 > 9040 [FIN, ACK] Seq=13 Ack=150000002 Win=2580480 Len=0 TSV=10163893 TSER=2578491
154610  12.794024     10.0.1.2 -> 10.0.1.3     TCP 9040 > 49660 [ACK] Seq=150000002 Ack=14 Win=14528 Len=0 TSV=2578546 TSER=10163893
  1   0.000000     10.0.1.3 -> 10.0.1.2     TCP 49662 > 9040 [SYN] Seq=0 Win=5840 Len=0 MSS=1460 TSV=10167616 TSER=0 WS=6
  2   0.000286     10.0.1.2 -> 10.0.1.3     TCP 9040 > 49662 [SYN, ACK] Seq=0 Ack=1 Win=14480 Len=0 MSS=1460 TSV=2582270 TSER=10167616 WS=6
  3   0.000308     10.0.1.3 -> 10.0.1.2     TCP 49662 > 9040 [ACK] Seq=1 Ack=1 Win=5888 Len=0 TSV=10167616 TSER=2582270
  7   0.002271     10.0.1.2 -> 10.0.1.3     TCP 9040 > 49662 [ACK] Seq=1 Ack=13 Win=14528 Len=0 TSV=2582270 TSER=10167616
141983  12.793293     10.0.1.3 -> 10.0.1.2     TCP 49662 > 9040 [FIN, ACK] Seq=13 Ack=150000002 Win=2580480 Len=0 TSV=10170815 TSER=2585413
141984  12.793538     10.0.1.2 -> 10.0.1.3     TCP 9040 > 49662 [ACK] Seq=150000002 Ack=14 Win=14528 Len=0 TSV=2585468 TSER=10170815
  1   0.000000     10.0.1.3 -> 10.0.1.2     TCP 49665 > 9040 [SYN] Seq=0 Win=5840 Len=0 MSS=1460 TSV=10174249 TSER=0 WS=6
  2   0.000289     10.0.1.2 -> 10.0.1.3     TCP 9040 > 49665 [SYN, ACK] Seq=0 Ack=1 Win=14480 Len=0 MSS=1460 TSV=2588904 TSER=10174249 WS=6
  3   0.000316     10.0.1.3 -> 10.0.1.2     TCP 49665 > 9040 [ACK] Seq=1 Ack=1 Win=5888 Len=0 TSV=10174249 TSER=2588904
  7   0.002258     10.0.1.2 -> 10.0.1.3     TCP 9040 > 49665 [ACK] Seq=1 Ack=13 Win=14528 Len=0 TSV=2588904 TSER=10174250
155077  12.809250     10.0.1.3 -> 10.0.1.2     TCP 49665 > 9040 [FIN, ACK] Seq=13 Ack=150000002 Win=2560064 Len=0 TSV=10177451 TSER=2592052
155078  12.809500     10.0.1.2 -> 10.0.1.3     TCP 9040 > 49665 [ACK] Seq=150000002 Ack=14 Win=14528 Len=0 TSV=2592106 TSER=10177451
  1   0.000000     10.0.1.3 -> 10.0.1.2     TCP 49668 > 9040 [SYN] Seq=0 Win=5840 Len=0 MSS=1460 TSV=10181144 TSER=0 WS=6
  2   0.000282     10.0.1.2 -> 10.0.1.3     TCP 9040 > 49668 [SYN, ACK] Seq=0 Ack=1 Win=14480 Len=0 MSS=1460 TSV=2595799 TSER=10181144 WS=6
  3   0.000304     10.0.1.3 -> 10.0.1.2     TCP 49668 > 9040 [ACK] Seq=1 Ack=1 Win=5888 Len=0 TSV=10181144 TSER=2595799
  7   0.002204     10.0.1.2 -> 10.0.1.3     TCP 9040 > 49668 [ACK] Seq=1 Ack=13 Win=14528 Len=0 TSV=2595800 TSER=10181145
154831  12.811065     10.0.1.3 -> 10.0.1.2     TCP 49668 > 9040 [FIN, ACK] Seq=13 Ack=150000002 Win=2580480 Len=0 TSV=10184347 TSER=2598947
154832  12.811321     10.0.1.2 -> 10.0.1.3     TCP 9040 > 49668 [ACK] Seq=150000002 Ack=14 Win=14528 Len=0 TSV=2599002 TSER=10184347
  1   0.000000     10.0.1.3 -> 10.0.1.2     TCP 49670 > 9040 [SYN] Seq=0 Win=5840 Len=0 MSS=1460 TSV=10188022 TSER=0 WS=6
  2   0.000271     10.0.1.2 -> 10.0.1.3     TCP 9040 > 49670 [SYN, ACK] Seq=0 Ack=1 Win=14480 Len=0 MSS=1460 TSV=2602677 TSER=10188022 WS=6
  3   0.000295     10.0.1.3 -> 10.0.1.2     TCP 49670 > 9040 [ACK] Seq=1 Ack=1 Win=5888 Len=0 TSV=10188022 TSER=2602677
  7   0.002177     10.0.1.2 -> 10.0.1.3     TCP 9040 > 49670 [ACK] Seq=1 Ack=13 Win=14528 Len=0 TSV=2602678 TSER=10188022
154638  12.802825     10.0.1.3 -> 10.0.1.2     TCP 49670 > 9040 [FIN, ACK] Seq=13 Ack=150000002 Win=2580480 Len=0 TSV=10191222 TSER=2605823
154639  12.803071     10.0.1.2 -> 10.0.1.3     TCP 9040 > 49670 [ACK] Seq=150000002 Ack=14 Win=14528 Len=0 TSV=2605878 TSER=10191222
  1   0.000000     10.0.1.3 -> 10.0.1.2     TCP 49673 > 9040 [SYN] Seq=0 Win=5840 Len=0 MSS=1460 TSV=10194889 TSER=0 WS=6
  2   0.000288     10.0.1.2 -> 10.0.1.3     TCP 9040 > 49673 [SYN, ACK] Seq=0 Ack=1 Win=14480 Len=0 MSS=1460 TSV=2609545 TSER=10194889 WS=6
  3   0.000311     10.0.1.3 -> 10.0.1.2     TCP 49673 > 9040 [ACK] Seq=1 Ack=1 Win=5888 Len=0 TSV=10194889 TSER=2609545
  7   0.002173     10.0.1.2 -> 10.0.1.3     TCP 9040 > 49673 [ACK] Seq=1 Ack=13 Win=14528 Len=0 TSV=2609545 TSER=10194890
154588  12.796200     10.0.1.3 -> 10.0.1.2     TCP 49673 > 9040 [FIN, ACK] Seq=13 Ack=150000002 Win=2580480 Len=0 TSV=10198088 TSER=2612689
154589  12.796456     10.0.1.2 -> 10.0.1.3     TCP 9040 > 49673 [ACK] Seq=150000002 Ack=14 Win=14528 Len=0 TSV=2612744 TSER=10198088
