  1   0.000000     10.0.1.3 -> 10.0.1.2     TCP 39168 > 9040 [SYN] Seq=0 Win=5840 Len=0 MSS=1460 TSV=4720800 TSER=0 WS=6
  2   0.000317     10.0.1.2 -> 10.0.1.3     TCP 9040 > 39168 [SYN, ACK] Seq=0 Ack=1 Win=14480 Len=0 MSS=1460 TSV=4705730 TSER=4720800 WS=6
  3   0.000338     10.0.1.3 -> 10.0.1.2     TCP 39168 > 9040 [ACK] Seq=1 Ack=1 Win=5888 Len=0 TSV=4720800 TSER=4705730
  7   0.002231     10.0.1.2 -> 10.0.1.3     TCP 9040 > 39168 [ACK] Seq=1 Ack=13 Win=14528 Len=0 TSV=4705730 TSER=4720801
155743  27.331257     10.0.1.3 -> 10.0.1.2     TCP 39168 > 9040 [FIN, ACK] Seq=13 Ack=150000002 Win=2005824 Len=0 TSV=4727633 TSER=4712542
155744  27.331449     10.0.1.2 -> 10.0.1.3     TCP 9040 > 39168 [ACK] Seq=150000002 Ack=14 Win=14528 Len=0 TSV=4712563 TSER=4727633
  1   0.000000     10.0.1.3 -> 10.0.1.2     TCP 52974 > 9040 [SYN] Seq=0 Win=5840 Len=0 MSS=1460 TSV=4731316 TSER=0 WS=6
  2   0.000296     10.0.1.2 -> 10.0.1.3     TCP 9040 > 52974 [SYN, ACK] Seq=0 Ack=1 Win=14480 Len=0 MSS=1460 TSV=4716247 TSER=4731316 WS=6
  3   0.000320     10.0.1.3 -> 10.0.1.2     TCP 52974 > 9040 [ACK] Seq=1 Ack=1 Win=5888 Len=0 TSV=4731316 TSER=4716247
  7   0.002679     10.0.1.2 -> 10.0.1.3     TCP 9040 > 52974 [ACK] Seq=1 Ack=13 Win=14528 Len=0 TSV=4716247 TSER=4731317
154095  27.855406     10.0.1.3 -> 10.0.1.2     TCP 52974 > 9040 [FIN, ACK] Seq=13 Ack=150000002 Win=2002944 Len=0 TSV=4738280 TSER=4723190
154096  27.855648     10.0.1.2 -> 10.0.1.3     TCP 9040 > 52974 [ACK] Seq=150000002 Ack=14 Win=14528 Len=0 TSV=4723211 TSER=4738280
  1   0.000000     10.0.1.3 -> 10.0.1.2     TCP 52976 > 9040 [SYN] Seq=0 Win=5840 Len=0 MSS=1460 TSV=4741949 TSER=0 WS=6
  2   0.000308     10.0.1.2 -> 10.0.1.3     TCP 9040 > 52976 [SYN, ACK] Seq=0 Ack=1 Win=14480 Len=0 MSS=1460 TSV=4726881 TSER=4741949 WS=6
  3   0.000340     10.0.1.3 -> 10.0.1.2     TCP 52976 > 9040 [ACK] Seq=1 Ack=1 Win=5888 Len=0 TSV=4741950 TSER=4726881
  7   0.003763     10.0.1.2 -> 10.0.1.3     TCP 9040 > 52976 [ACK] Seq=1 Ack=13 Win=14528 Len=0 TSV=4726881 TSER=4741951
154429  27.369820     10.0.1.3 -> 10.0.1.2     TCP 52976 > 9040 [FIN, ACK] Seq=13 Ack=150000002 Win=2002944 Len=0 TSV=4748792 TSER=4733702
154430  27.370068     10.0.1.2 -> 10.0.1.3     TCP 9040 > 52976 [ACK] Seq=150000002 Ack=14 Win=14528 Len=0 TSV=4733724 TSER=4748792
  1   0.000000     10.0.1.3 -> 10.0.1.2     TCP 52978 > 9040 [SYN] Seq=0 Win=5840 Len=0 MSS=1460 TSV=4752400 TSER=0 WS=6
  2   0.000298     10.0.1.2 -> 10.0.1.3     TCP 9040 > 52978 [SYN, ACK] Seq=0 Ack=1 Win=14480 Len=0 MSS=1460 TSV=4737331 TSER=4752400 WS=6
  3   0.000322     10.0.1.3 -> 10.0.1.2     TCP 52978 > 9040 [ACK] Seq=1 Ack=1 Win=5888 Len=0 TSV=4752400 TSER=4737331
  7   0.002230     10.0.1.2 -> 10.0.1.3     TCP 9040 > 52978 [ACK] Seq=1 Ack=13 Win=14528 Len=0 TSV=4737332 TSER=4752400
  1   0.000000     10.0.1.3 -> 10.0.1.2     TCP 52980 > 9040 [SYN] Seq=0 Win=5840 Len=0 MSS=1460 TSV=4762956 TSER=0 WS=6
  2   0.000286     10.0.1.2 -> 10.0.1.3     TCP 9040 > 52980 [SYN, ACK] Seq=0 Ack=1 Win=14480 Len=0 MSS=1460 TSV=4747889 TSER=4762956 WS=6
  3   0.000320     10.0.1.3 -> 10.0.1.2     TCP 52980 > 9040 [ACK] Seq=1 Ack=1 Win=5888 Len=0 TSV=4762957 TSER=4747889
  7   0.002531     10.0.1.2 -> 10.0.1.3     TCP 9040 > 52980 [ACK] Seq=1 Ack=13 Win=14528 Len=0 TSV=4747889 TSER=4762957
  1   0.000000     10.0.1.3 -> 10.0.1.2     TCP 52982 > 9040 [SYN] Seq=0 Win=5840 Len=0 MSS=1460 TSV=4773524 TSER=0 WS=6
  2   0.000315     10.0.1.2 -> 10.0.1.3     TCP 9040 > 52982 [SYN, ACK] Seq=0 Ack=1 Win=14480 Len=0 MSS=1460 TSV=4758457 TSER=4773524 WS=6
  3   0.000336     10.0.1.3 -> 10.0.1.2     TCP 52982 > 9040 [ACK] Seq=1 Ack=1 Win=5888 Len=0 TSV=4773524 TSER=4758457
  7   0.002278     10.0.1.2 -> 10.0.1.3     TCP 9040 > 52982 [ACK] Seq=1 Ack=13 Win=14528 Len=0 TSV=4758458 TSER=4773524
154637  27.669225     10.0.1.3 -> 10.0.1.2     TCP 52982 > 9040 [FIN, ACK] Seq=13 Ack=150000002 Win=2002944 Len=0 TSV=4780441 TSER=4765354
154638  27.669472     10.0.1.2 -> 10.0.1.3     TCP 9040 > 52982 [ACK] Seq=150000002 Ack=14 Win=14528 Len=0 TSV=4765375 TSER=4780441
  1   0.000000     10.0.1.3 -> 10.0.1.2     TCP 52984 > 9040 [SYN] Seq=0 Win=5840 Len=0 MSS=1460 TSV=4784111 TSER=0 WS=6
  2   0.000305     10.0.1.2 -> 10.0.1.3     TCP 9040 > 52984 [SYN, ACK] Seq=0 Ack=1 Win=14480 Len=0 MSS=1460 TSV=4769045 TSER=4784111 WS=6
  3   0.000329     10.0.1.3 -> 10.0.1.2     TCP 52984 > 9040 [ACK] Seq=1 Ack=1 Win=5888 Len=0 TSV=4784111 TSER=4769045
  7   0.002236     10.0.1.2 -> 10.0.1.3     TCP 9040 > 52984 [ACK] Seq=1 Ack=13 Win=14528 Len=0 TSV=4769046 TSER=4784111
153496  27.851752     10.0.1.3 -> 10.0.1.2     TCP 52984 > 9040 [FIN, ACK] Seq=13 Ack=150000002 Win=2005824 Len=0 TSV=4791074 TSER=4775987
153497  27.852002     10.0.1.2 -> 10.0.1.3     TCP 9040 > 52984 [ACK] Seq=150000002 Ack=14 Win=14528 Len=0 TSV=4776008 TSER=4791074
  1   0.000000     10.0.1.3 -> 10.0.1.2     TCP 52986 > 9040 [SYN] Seq=0 Win=5840 Len=0 MSS=1460 TSV=4794629 TSER=0 WS=6
  2   0.000372     10.0.1.2 -> 10.0.1.3     TCP 9040 > 52986 [SYN, ACK] Seq=0 Ack=1 Win=14480 Len=0 MSS=1460 TSV=4779564 TSER=4794629 WS=6
  3   0.000395     10.0.1.3 -> 10.0.1.2     TCP 52986 > 9040 [ACK] Seq=1 Ack=1 Win=5888 Len=0 TSV=4794629 TSER=4779564
  7   0.002334     10.0.1.2 -> 10.0.1.3     TCP 9040 > 52986 [ACK] Seq=1 Ack=13 Win=14528 Len=0 TSV=4779564 TSER=4794630
  1   0.000000     10.0.1.3 -> 10.0.1.2     TCP 48269 > 9040 [SYN] Seq=0 Win=5840 Len=0 MSS=1460 TSV=4805218 TSER=0 WS=6
  2   0.000313     10.0.1.2 -> 10.0.1.3     TCP 9040 > 48269 [SYN, ACK] Seq=0 Ack=1 Win=14480 Len=0 MSS=1460 TSV=4790154 TSER=4805218 WS=6
  3   0.000336     10.0.1.3 -> 10.0.1.2     TCP 48269 > 9040 [ACK] Seq=1 Ack=1 Win=5888 Len=0 TSV=4805218 TSER=4790154
  7   0.002246     10.0.1.2 -> 10.0.1.3     TCP 9040 > 48269 [ACK] Seq=1 Ack=13 Win=14528 Len=0 TSV=4790155 TSER=4805219
  1   0.000000     10.0.1.3 -> 10.0.1.2     TCP 48271 > 9040 [SYN] Seq=0 Win=5840 Len=0 MSS=1460 TSV=4815671 TSER=0 WS=6
  2   0.000368     10.0.1.2 -> 10.0.1.3     TCP 9040 > 48271 [SYN, ACK] Seq=0 Ack=1 Win=14480 Len=0 MSS=1460 TSV=4800607 TSER=4815671 WS=6
  3   0.000394     10.0.1.3 -> 10.0.1.2     TCP 48271 > 9040 [ACK] Seq=1 Ack=1 Win=5888 Len=0 TSV=4815671 TSER=4800607
  7   0.002381     10.0.1.2 -> 10.0.1.3     TCP 9040 > 48271 [ACK] Seq=1 Ack=13 Win=14528 Len=0 TSV=4800608 TSER=4815671
154030  27.592340     10.0.1.3 -> 10.0.1.2     TCP 48271 > 9040 [FIN, ACK] Seq=13 Ack=150000002 Win=2002944 Len=0 TSV=4822569 TSER=4807484
154031  27.592595     10.0.1.2 -> 10.0.1.3     TCP 9040 > 48271 [ACK] Seq=150000002 Ack=14 Win=14528 Len=0 TSV=4807506 TSER=4822569
  1   0.000000     10.0.1.3 -> 10.0.1.2     TCP 48273 > 9040 [SYN] Seq=0 Win=5840 Len=0 MSS=1460 TSV=4826111 TSER=0 WS=6
  2   0.000331     10.0.1.2 -> 10.0.1.3     TCP 9040 > 48273 [SYN, ACK] Seq=0 Ack=1 Win=14480 Len=0 MSS=1460 TSV=4811048 TSER=4826111 WS=6
  3   0.000353     10.0.1.3 -> 10.0.1.2     TCP 48273 > 9040 [ACK] Seq=1 Ack=1 Win=5888 Len=0 TSV=4826111 TSER=4811048
  7   0.002599     10.0.1.2 -> 10.0.1.3     TCP 9040 > 48273 [ACK] Seq=1 Ack=13 Win=14528 Len=0 TSV=4811049 TSER=4826111
154696  27.750862     10.0.1.3 -> 10.0.1.2     TCP 48273 > 9040 [FIN, ACK] Seq=13 Ack=150000002 Win=2002944 Len=0 TSV=4833048 TSER=4817965
154697  27.751125     10.0.1.2 -> 10.0.1.3     TCP 9040 > 48273 [ACK] Seq=150000002 Ack=14 Win=14528 Len=0 TSV=4817986 TSER=4833048
  1   0.000000     10.0.1.3 -> 10.0.1.2     TCP 48276 > 9040 [SYN] Seq=0 Win=5840 Len=0 MSS=1460 TSV=4837119 TSER=0 WS=6
  2   0.000273     10.0.1.2 -> 10.0.1.3     TCP 9040 > 48276 [SYN, ACK] Seq=0 Ack=1 Win=14480 Len=0 MSS=1460 TSV=4822057 TSER=4837119 WS=6
  3   0.000297     10.0.1.3 -> 10.0.1.2     TCP 48276 > 9040 [ACK] Seq=1 Ack=1 Win=5888 Len=0 TSV=4837119 TSER=4822057
  7   0.002291     10.0.1.2 -> 10.0.1.3     TCP 9040 > 48276 [ACK] Seq=1 Ack=13 Win=14528 Len=0 TSV=4822058 TSER=4837120
155373  27.878685     10.0.1.3 -> 10.0.1.2     TCP 48276 > 9040 [FIN, ACK] Seq=13 Ack=150000002 Win=2002944 Len=0 TSV=4844089 TSER=4829006
155374  27.878921     10.0.1.2 -> 10.0.1.3     TCP 9040 > 48276 [ACK] Seq=150000002 Ack=14 Win=14528 Len=0 TSV=4829027 TSER=4844089
  1   0.000000     10.0.1.3 -> 10.0.1.2     TCP 48278 > 9040 [SYN] Seq=0 Win=5840 Len=0 MSS=1460 TSV=4847763 TSER=0 WS=6
  2   0.000277     10.0.1.2 -> 10.0.1.3     TCP 9040 > 48278 [SYN, ACK] Seq=0 Ack=1 Win=14480 Len=0 MSS=1460 TSV=4832702 TSER=4847763 WS=6
  3   0.000299     10.0.1.3 -> 10.0.1.2     TCP 48278 > 9040 [ACK] Seq=1 Ack=1 Win=5888 Len=0 TSV=4847763 TSER=4832702
  7   0.002204     10.0.1.2 -> 10.0.1.3     TCP 9040 > 48278 [ACK] Seq=1 Ack=13 Win=14528 Len=0 TSV=4832703 TSER=4847764
  1   0.000000     10.0.1.3 -> 10.0.1.2     TCP 48280 > 9040 [SYN] Seq=0 Win=5840 Len=0 MSS=1460 TSV=4858330 TSER=0 WS=6
  2   0.000319     10.0.1.2 -> 10.0.1.3     TCP 9040 > 48280 [SYN, ACK] Seq=0 Ack=1 Win=14480 Len=0 MSS=1460 TSV=4843270 TSER=4858330 WS=6
  3   0.000342     10.0.1.3 -> 10.0.1.2     TCP 48280 > 9040 [ACK] Seq=1 Ack=1 Win=5888 Len=0 TSV=4858330 TSER=4843270
  7   0.002229     10.0.1.2 -> 10.0.1.3     TCP 9040 > 48280 [ACK] Seq=1 Ack=13 Win=14528 Len=0 TSV=4843270 TSER=4858331
154486  27.817504     10.0.1.3 -> 10.0.1.2     TCP 48280 > 9040 [FIN, ACK] Seq=13 Ack=150000002 Win=2026112 Len=0 TSV=4865284 TSER=4850203
154487  27.817742     10.0.1.2 -> 10.0.1.3     TCP 9040 > 48280 [ACK] Seq=150000002 Ack=14 Win=14528 Len=0 TSV=4850225 TSER=4865284
  1   0.000000     10.0.1.3 -> 10.0.1.2     TCP 48282 > 9040 [SYN] Seq=0 Win=5840 Len=0 MSS=1460 TSV=4869620 TSER=0 WS=6
  2   0.000292     10.0.1.2 -> 10.0.1.3     TCP 9040 > 48282 [SYN, ACK] Seq=0 Ack=1 Win=14480 Len=0 MSS=1460 TSV=4854560 TSER=4869620 WS=6
  3   0.000317     10.0.1.3 -> 10.0.1.2     TCP 48282 > 9040 [ACK] Seq=1 Ack=1 Win=5888 Len=0 TSV=4869620 TSER=4854560
  7   0.002170     10.0.1.2 -> 10.0.1.3     TCP 9040 > 48282 [ACK] Seq=1 Ack=13 Win=14528 Len=0 TSV=4854561 TSER=4869620
154552  27.618042     10.0.1.3 -> 10.0.1.2     TCP 48282 > 9040 [FIN, ACK] Seq=13 Ack=150000002 Win=2023168 Len=0 TSV=4876524 TSER=4861444
154553  27.618318     10.0.1.2 -> 10.0.1.3     TCP 9040 > 48282 [ACK] Seq=150000002 Ack=14 Win=14528 Len=0 TSV=4861465 TSER=4876524
  1   0.000000     10.0.1.3 -> 10.0.1.2     TCP 59676 > 9040 [SYN] Seq=0 Win=5840 Len=0 MSS=1460 TSV=4880179 TSER=0 WS=6
  2   0.000302     10.0.1.2 -> 10.0.1.3     TCP 9040 > 59676 [SYN, ACK] Seq=0 Ack=1 Win=14480 Len=0 MSS=1460 TSV=4865120 TSER=4880179 WS=6
  3   0.000326     10.0.1.3 -> 10.0.1.2     TCP 59676 > 9040 [ACK] Seq=1 Ack=1 Win=5888 Len=0 TSV=4880179 TSER=4865120
  7   0.002437     10.0.1.2 -> 10.0.1.3     TCP 9040 > 59676 [ACK] Seq=1 Ack=13 Win=14528 Len=0 TSV=4865121 TSER=4880179
154301  27.442622     10.0.1.3 -> 10.0.1.2     TCP 59676 > 9040 [FIN, ACK] Seq=13 Ack=150000002 Win=2023168 Len=0 TSV=4887039 TSER=4871960
154302  27.442857     10.0.1.2 -> 10.0.1.3     TCP 9040 > 59676 [ACK] Seq=150000002 Ack=14 Win=14528 Len=0 TSV=4871981 TSER=4887039
  1   0.000000     10.0.1.3 -> 10.0.1.2     TCP 59678 > 9040 [SYN] Seq=0 Win=5840 Len=0 MSS=1460 TSV=4890634 TSER=0 WS=6
  2   0.000319     10.0.1.2 -> 10.0.1.3     TCP 9040 > 59678 [SYN, ACK] Seq=0 Ack=1 Win=14480 Len=0 MSS=1460 TSV=4875576 TSER=4890634 WS=6
  3   0.000345     10.0.1.3 -> 10.0.1.2     TCP 59678 > 9040 [ACK] Seq=1 Ack=1 Win=5888 Len=0 TSV=4890634 TSER=4875576
  7   0.002242     10.0.1.2 -> 10.0.1.3     TCP 9040 > 59678 [ACK] Seq=1 Ack=13 Win=14528 Len=0 TSV=4875577 TSER=4890635
  1   0.000000     10.0.1.3 -> 10.0.1.2     TCP 59680 > 9040 [SYN] Seq=0 Win=5840 Len=0 MSS=1460 TSV=4901209 TSER=0 WS=6
  2   0.000320     10.0.1.2 -> 10.0.1.3     TCP 9040 > 59680 [SYN, ACK] Seq=0 Ack=1 Win=14480 Len=0 MSS=1460 TSV=4886152 TSER=4901209 WS=6
  3   0.000344     10.0.1.3 -> 10.0.1.2     TCP 59680 > 9040 [ACK] Seq=1 Ack=1 Win=5888 Len=0 TSV=4901209 TSER=4886152
  7   0.002202     10.0.1.2 -> 10.0.1.3     TCP 9040 > 59680 [ACK] Seq=1 Ack=13 Win=14528 Len=0 TSV=4886153 TSER=4901210
155802  28.065391     10.0.1.3 -> 10.0.1.2     TCP 59680 > 9040 [FIN, ACK] Seq=13 Ack=150000002 Win=2005824 Len=0 TSV=4908226 TSER=4893148
155803  28.065642     10.0.1.2 -> 10.0.1.3     TCP 9040 > 59680 [ACK] Seq=150000002 Ack=14 Win=14528 Len=0 TSV=4893169 TSER=4908226
  1   0.000000     10.0.1.3 -> 10.0.1.2     TCP 59682 > 9040 [SYN] Seq=0 Win=5840 Len=0 MSS=1460 TSV=4911885 TSER=0 WS=6
  2   0.000319     10.0.1.2 -> 10.0.1.3     TCP 9040 > 59682 [SYN, ACK] Seq=0 Ack=1 Win=14480 Len=0 MSS=1460 TSV=4896829 TSER=4911885 WS=6
  3   0.000343     10.0.1.3 -> 10.0.1.2     TCP 59682 > 9040 [ACK] Seq=1 Ack=1 Win=5888 Len=0 TSV=4911885 TSER=4896829
  7   0.002345     10.0.1.2 -> 10.0.1.3     TCP 9040 > 59682 [ACK] Seq=1 Ack=13 Win=14528 Len=0 TSV=4896830 TSER=4911886
155029  27.699775     10.0.1.3 -> 10.0.1.2     TCP 59682 > 9040 [FIN, ACK] Seq=13 Ack=150000002 Win=2002944 Len=0 TSV=4918811 TSER=4903733
155030  27.700043     10.0.1.2 -> 10.0.1.3     TCP 9040 > 59682 [ACK] Seq=150000002 Ack=14 Win=14528 Len=0 TSV=4903755 TSER=4918811
  1   0.000000     10.0.1.3 -> 10.0.1.2     TCP 59685 > 9040 [SYN] Seq=0 Win=5840 Len=0 MSS=1460 TSV=4922440 TSER=0 WS=6
  2   0.000360     10.0.1.2 -> 10.0.1.3     TCP 9040 > 59685 [SYN, ACK] Seq=0 Ack=1 Win=14480 Len=0 MSS=1460 TSV=4907384 TSER=4922440 WS=6
  3   0.000382     10.0.1.3 -> 10.0.1.2     TCP 59685 > 9040 [ACK] Seq=1 Ack=1 Win=5888 Len=0 TSV=4922440 TSER=4907384
  7   0.002279     10.0.1.2 -> 10.0.1.3     TCP 9040 > 59685 [ACK] Seq=1 Ack=13 Win=14528 Len=0 TSV=4907385 TSER=4922440
154241  27.385581     10.0.1.3 -> 10.0.1.2     TCP 59685 > 9040 [FIN, ACK] Seq=13 Ack=150000002 Win=2002944 Len=0 TSV=4929286 TSER=4914210
154242  27.385828     10.0.1.2 -> 10.0.1.3     TCP 9040 > 59685 [ACK] Seq=150000002 Ack=14 Win=14528 Len=0 TSV=4914231 TSER=4929286
