  1   0.000000     10.0.1.3 -> 10.0.1.2     TCP 39452 > 9040 [SYN] Seq=0 Win=5840 Len=0 MSS=1460 TSV=9960936 TSER=0 WS=6
  2   0.000360     10.0.1.2 -> 10.0.1.3     TCP 9040 > 39452 [SYN, ACK] Seq=0 Ack=1 Win=14480 Len=0 MSS=1460 TSV=2375575 TSER=9960936 WS=6
  3   0.000383     10.0.1.3 -> 10.0.1.2     TCP 39452 > 9040 [ACK] Seq=1 Ack=1 Win=5888 Len=0 TSV=9960937 TSER=2375575
  7   0.002318     10.0.1.2 -> 10.0.1.3     TCP 9040 > 39452 [ACK] Seq=1 Ack=13 Win=14528 Len=0 TSV=2375575 TSER=9960937
103304   8.536749     10.0.1.3 -> 10.0.1.2     TCP 39452 > 9040 [FIN, ACK] Seq=13 Ack=100000002 Win=2580480 Len=0 TSV=9963071 TSER=2377654
103305   8.536964     10.0.1.2 -> 10.0.1.3     TCP 9040 > 39452 [ACK] Seq=100000002 Ack=14 Win=14528 Len=0 TSV=2377709 TSER=9963071
  1   0.000000     10.0.1.3 -> 10.0.1.2     TCP 39454 > 9040 [SYN] Seq=0 Win=5840 Len=0 MSS=1460 TSV=9966152 TSER=0 WS=6
  2   0.000314     10.0.1.2 -> 10.0.1.3     TCP 9040 > 39454 [SYN, ACK] Seq=0 Ack=1 Win=14480 Len=0 MSS=1460 TSV=2380791 TSER=9966152 WS=6
  3   0.000340     10.0.1.3 -> 10.0.1.2     TCP 39454 > 9040 [ACK] Seq=1 Ack=1 Win=5888 Len=0 TSV=9966152 TSER=2380791
  7   0.003105     10.0.1.2 -> 10.0.1.3     TCP 9040 > 39454 [ACK] Seq=1 Ack=13 Win=14528 Len=0 TSV=2380791 TSER=9966153
103162   8.539494     10.0.1.3 -> 10.0.1.2     TCP 39454 > 9040 [FIN, ACK] Seq=13 Ack=100000002 Win=2580480 Len=0 TSV=9968287 TSER=2382871
103163   8.539747     10.0.1.2 -> 10.0.1.3     TCP 9040 > 39454 [ACK] Seq=100000002 Ack=14 Win=14528 Len=0 TSV=2382926 TSER=9968287
  1   0.000000     10.0.1.3 -> 10.0.1.2     TCP 39457 > 9040 [SYN] Seq=0 Win=5840 Len=0 MSS=1460 TSV=9971367 TSER=0 WS=6
  2   0.000297     10.0.1.2 -> 10.0.1.3     TCP 9040 > 39457 [SYN, ACK] Seq=0 Ack=1 Win=14480 Len=0 MSS=1460 TSV=2386006 TSER=9971367 WS=6
  3   0.000313     10.0.1.3 -> 10.0.1.2     TCP 39457 > 9040 [ACK] Seq=1 Ack=1 Win=5888 Len=0 TSV=9971367 TSER=2386006
  7   0.002196     10.0.1.2 -> 10.0.1.3     TCP 9040 > 39457 [ACK] Seq=1 Ack=13 Win=14528 Len=0 TSV=2386007 TSER=9971368
103106   8.540869     10.0.1.3 -> 10.0.1.2     TCP 39457 > 9040 [FIN, ACK] Seq=13 Ack=100000002 Win=2580480 Len=0 TSV=9973502 TSER=2388087
103107   8.541123     10.0.1.2 -> 10.0.1.3     TCP 9040 > 39457 [ACK] Seq=100000002 Ack=14 Win=14528 Len=0 TSV=2388142 TSER=9973502
  1   0.000000     10.0.1.3 -> 10.0.1.2     TCP 39479 > 9040 [SYN] Seq=0 Win=5840 Len=0 MSS=1460 TSV=9976532 TSER=0 WS=6
  2   0.000281     10.0.1.2 -> 10.0.1.3     TCP 9040 > 39479 [SYN, ACK] Seq=0 Ack=1 Win=14480 Len=0 MSS=1460 TSV=2391172 TSER=9976532 WS=6
  3   0.000304     10.0.1.3 -> 10.0.1.2     TCP 39479 > 9040 [ACK] Seq=1 Ack=1 Win=5888 Len=0 TSV=9976532 TSER=2391172
  7   0.002297     10.0.1.2 -> 10.0.1.3     TCP 9040 > 39479 [ACK] Seq=1 Ack=13 Win=14528 Len=0 TSV=2391172 TSER=9976533
99287   8.539681     10.0.1.3 -> 10.0.1.2     TCP 39479 > 9040 [FIN, ACK] Seq=13 Ack=100000002 Win=2580480 Len=0 TSV=9978667 TSER=2393252
99288   8.539942     10.0.1.2 -> 10.0.1.3     TCP 9040 > 39479 [ACK] Seq=100000002 Ack=14 Win=14528 Len=0 TSV=2393307 TSER=9978667
  1   0.000000     10.0.1.3 -> 10.0.1.2     TCP 39481 > 9040 [SYN] Seq=0 Win=5840 Len=0 MSS=1460 TSV=9981802 TSER=0 WS=6
  2   0.000269     10.0.1.2 -> 10.0.1.3     TCP 9040 > 39481 [SYN, ACK] Seq=0 Ack=1 Win=14480 Len=0 MSS=1460 TSV=2396441 TSER=9981802 WS=6
  3   0.000289     10.0.1.3 -> 10.0.1.2     TCP 39481 > 9040 [ACK] Seq=1 Ack=1 Win=5888 Len=0 TSV=9981802 TSER=2396441
  7   0.002128     10.0.1.2 -> 10.0.1.3     TCP 9040 > 39481 [ACK] Seq=1 Ack=13 Win=14528 Len=0 TSV=2396442 TSER=9981802
103512   8.539186     10.0.1.3 -> 10.0.1.2     TCP 39481 > 9040 [FIN, ACK] Seq=13 Ack=100000002 Win=2580480 Len=0 TSV=9983936 TSER=2398521
103513   8.539427     10.0.1.2 -> 10.0.1.3     TCP 9040 > 39481 [ACK] Seq=100000002 Ack=14 Win=14528 Len=0 TSV=2398576 TSER=9983936
  1   0.000000     10.0.1.3 -> 10.0.1.2     TCP 39483 > 9040 [SYN] Seq=0 Win=5840 Len=0 MSS=1460 TSV=9987006 TSER=0 WS=6
  2   0.000314     10.0.1.2 -> 10.0.1.3     TCP 9040 > 39483 [SYN, ACK] Seq=0 Ack=1 Win=14480 Len=0 MSS=1460 TSV=2401646 TSER=9987006 WS=6
  3   0.000341     10.0.1.3 -> 10.0.1.2     TCP 39483 > 9040 [ACK] Seq=1 Ack=1 Win=5888 Len=0 TSV=9987006 TSER=2401646
  7   0.002245     10.0.1.2 -> 10.0.1.3     TCP 9040 > 39483 [ACK] Seq=1 Ack=13 Win=14528 Len=0 TSV=2401647 TSER=9987006
103106   8.538647     10.0.1.3 -> 10.0.1.2     TCP 39483 > 9040 [FIN, ACK] Seq=13 Ack=100000002 Win=2580480 Len=0 TSV=9989141 TSER=2403726
103107   8.538918     10.0.1.2 -> 10.0.1.3     TCP 9040 > 39483 [ACK] Seq=100000002 Ack=14 Win=14528 Len=0 TSV=2403781 TSER=9989141
  1   0.000000     10.0.1.3 -> 10.0.1.2     TCP 39486 > 9040 [SYN] Seq=0 Win=5840 Len=0 MSS=1460 TSV=9992348 TSER=0 WS=6
  2   0.000285     10.0.1.2 -> 10.0.1.3     TCP 9040 > 39486 [SYN, ACK] Seq=0 Ack=1 Win=14480 Len=0 MSS=1460 TSV=2406988 TSER=9992348 WS=6
  3   0.000308     10.0.1.3 -> 10.0.1.2     TCP 39486 > 9040 [ACK] Seq=1 Ack=1 Win=5888 Len=0 TSV=9992348 TSER=2406988
  7   0.002250     10.0.1.2 -> 10.0.1.3     TCP 9040 > 39486 [ACK] Seq=1 Ack=13 Win=14528 Len=0 TSV=2406989 TSER=9992348
103374   8.543099     10.0.1.3 -> 10.0.1.2     TCP 39486 > 9040 [FIN, ACK] Seq=13 Ack=100000002 Win=2580480 Len=0 TSV=9994483 TSER=2409069
103375   8.543351     10.0.1.2 -> 10.0.1.3     TCP 9040 > 39486 [ACK] Seq=100000002 Ack=14 Win=14528 Len=0 TSV=2409124 TSER=9994483
  1   0.000000     10.0.1.3 -> 10.0.1.2     TCP 39488 > 9040 [SYN] Seq=0 Win=5840 Len=0 MSS=1460 TSV=9997544 TSER=0 WS=6
  2   0.000311     10.0.1.2 -> 10.0.1.3     TCP 9040 > 39488 [SYN, ACK] Seq=0 Ack=1 Win=14480 Len=0 MSS=1460 TSV=2412185 TSER=9997544 WS=6
  3   0.000335     10.0.1.3 -> 10.0.1.2     TCP 39488 > 9040 [ACK] Seq=1 Ack=1 Win=5888 Len=0 TSV=9997544 TSER=2412185
  7   0.003837     10.0.1.2 -> 10.0.1.3     TCP 9040 > 39488 [ACK] Seq=1 Ack=13 Win=14528 Len=0 TSV=2412186 TSER=9997545
103355   8.542767     10.0.1.3 -> 10.0.1.2     TCP 39488 > 9040 [FIN, ACK] Seq=13 Ack=100000002 Win=2580480 Len=0 TSV=9999680 TSER=2414266
103356   8.543010     10.0.1.2 -> 10.0.1.3     TCP 9040 > 39488 [ACK] Seq=100000002 Ack=14 Win=14528 Len=0 TSV=2414321 TSER=9999680
  1   0.000000     10.0.1.3 -> 10.0.1.2     TCP 39490 > 9040 [SYN] Seq=0 Win=5840 Len=0 MSS=1460 TSV=10002730 TSER=0 WS=6
  2   0.000333     10.0.1.2 -> 10.0.1.3     TCP 9040 > 39490 [SYN, ACK] Seq=0 Ack=1 Win=14480 Len=0 MSS=1460 TSV=2417371 TSER=10002730 WS=6
  3   0.000356     10.0.1.3 -> 10.0.1.2     TCP 39490 > 9040 [ACK] Seq=1 Ack=1 Win=5888 Len=0 TSV=10002730 TSER=2417371
  7   0.002310     10.0.1.2 -> 10.0.1.3     TCP 9040 > 39490 [ACK] Seq=1 Ack=13 Win=14528 Len=0 TSV=2417372 TSER=10002731
  1   0.000000     10.0.1.3 -> 10.0.1.2     TCP 39493 > 9040 [SYN] Seq=0 Win=5840 Len=0 MSS=1460 TSV=10007770 TSER=0 WS=6
  2   0.000293     10.0.1.2 -> 10.0.1.3     TCP 9040 > 39493 [SYN, ACK] Seq=0 Ack=1 Win=14480 Len=0 MSS=1460 TSV=2422412 TSER=10007770 WS=6
  3   0.000319     10.0.1.3 -> 10.0.1.2     TCP 39493 > 9040 [ACK] Seq=1 Ack=1 Win=5888 Len=0 TSV=10007770 TSER=2422412
  7   0.002407     10.0.1.2 -> 10.0.1.3     TCP 9040 > 39493 [ACK] Seq=1 Ack=13 Win=14528 Len=0 TSV=2422412 TSER=10007771
103355   8.536643     10.0.1.3 -> 10.0.1.2     TCP 39493 > 9040 [FIN, ACK] Seq=13 Ack=100000002 Win=2580480 Len=0 TSV=10009904 TSER=2424491
103356   8.536883     10.0.1.2 -> 10.0.1.3     TCP 9040 > 39493 [ACK] Seq=100000002 Ack=14 Win=14528 Len=0 TSV=2424546 TSER=10009904
  1   0.000000     10.0.1.3 -> 10.0.1.2     TCP 39496 > 9040 [SYN] Seq=0 Win=5840 Len=0 MSS=1460 TSV=10012987 TSER=0 WS=6
  2   0.000282     10.0.1.2 -> 10.0.1.3     TCP 9040 > 39496 [SYN, ACK] Seq=0 Ack=1 Win=14480 Len=0 MSS=1460 TSV=2427629 TSER=10012987 WS=6
  3   0.000302     10.0.1.3 -> 10.0.1.2     TCP 39496 > 9040 [ACK] Seq=1 Ack=1 Win=5888 Len=0 TSV=10012987 TSER=2427629
  7   0.002056     10.0.1.2 -> 10.0.1.3     TCP 9040 > 39496 [ACK] Seq=1 Ack=13 Win=14528 Len=0 TSV=2427630 TSER=10012988
  1   0.000000     10.0.1.3 -> 10.0.1.2     TCP 39498 > 9040 [SYN] Seq=0 Win=5840 Len=0 MSS=1460 TSV=10018022 TSER=0 WS=6
  2   0.000370     10.0.1.2 -> 10.0.1.3     TCP 9040 > 39498 [SYN, ACK] Seq=0 Ack=1 Win=14480 Len=0 MSS=1460 TSV=2432664 TSER=10018022 WS=6
  3   0.000397     10.0.1.3 -> 10.0.1.2     TCP 39498 > 9040 [ACK] Seq=1 Ack=1 Win=5888 Len=0 TSV=10018022 TSER=2432664
  7   0.002239     10.0.1.2 -> 10.0.1.3     TCP 9040 > 39498 [ACK] Seq=1 Ack=13 Win=14528 Len=0 TSV=2432665 TSER=10018022
103349   8.542871     10.0.1.3 -> 10.0.1.2     TCP 39498 > 9040 [FIN, ACK] Seq=13 Ack=100000002 Win=2580480 Len=0 TSV=10020158 TSER=2434745
103350   8.543112     10.0.1.2 -> 10.0.1.3     TCP 9040 > 39498 [ACK] Seq=100000002 Ack=14 Win=14528 Len=0 TSV=2434800 TSER=10020158
  1   0.000000     10.0.1.3 -> 10.0.1.2     TCP 39501 > 9040 [SYN] Seq=0 Win=5840 Len=0 MSS=1460 TSV=10023225 TSER=0 WS=6
  2   0.000284     10.0.1.2 -> 10.0.1.3     TCP 9040 > 39501 [SYN, ACK] Seq=0 Ack=1 Win=14480 Len=0 MSS=1460 TSV=2437868 TSER=10023225 WS=6
  3   0.000307     10.0.1.3 -> 10.0.1.2     TCP 39501 > 9040 [ACK] Seq=1 Ack=1 Win=5888 Len=0 TSV=10023225 TSER=2437868
  7   0.002327     10.0.1.2 -> 10.0.1.3     TCP 9040 > 39501 [ACK] Seq=1 Ack=13 Win=14528 Len=0 TSV=2437868 TSER=10023225
  1   0.000000     10.0.1.3 -> 10.0.1.2     TCP 39504 > 9040 [SYN] Seq=0 Win=5840 Len=0 MSS=1460 TSV=10028302 TSER=0 WS=6
  2   0.000308     10.0.1.2 -> 10.0.1.3     TCP 9040 > 39504 [SYN, ACK] Seq=0 Ack=1 Win=14480 Len=0 MSS=1460 TSV=2442945 TSER=10028302 WS=6
  3   0.000330     10.0.1.3 -> 10.0.1.2     TCP 39504 > 9040 [ACK] Seq=1 Ack=1 Win=5888 Len=0 TSV=10028302 TSER=2442945
  7   0.002255     10.0.1.2 -> 10.0.1.3     TCP 9040 > 39504 [ACK] Seq=1 Ack=13 Win=14528 Len=0 TSV=2442946 TSER=10028302
103397   8.534963     10.0.1.3 -> 10.0.1.2     TCP 39504 > 9040 [FIN, ACK] Seq=13 Ack=100000002 Win=2565888 Len=0 TSV=10030436 TSER=2445024
103398   8.535216     10.0.1.2 -> 10.0.1.3     TCP 9040 > 39504 [ACK] Seq=100000002 Ack=14 Win=14528 Len=0 TSV=2445079 TSER=10030436
  1   0.000000     10.0.1.3 -> 10.0.1.2     TCP 39506 > 9040 [SYN] Seq=0 Win=5840 Len=0 MSS=1460 TSV=10033499 TSER=0 WS=6
  2   0.000299     10.0.1.2 -> 10.0.1.3     TCP 9040 > 39506 [SYN, ACK] Seq=0 Ack=1 Win=14480 Len=0 MSS=1460 TSV=2448143 TSER=10033499 WS=6
  3   0.000325     10.0.1.3 -> 10.0.1.2     TCP 39506 > 9040 [ACK] Seq=1 Ack=1 Win=5888 Len=0 TSV=10033499 TSER=2448143
  7   0.002972     10.0.1.2 -> 10.0.1.3     TCP 9040 > 39506 [ACK] Seq=1 Ack=13 Win=14528 Len=0 TSV=2448143 TSER=10033500
103440   8.553341     10.0.1.3 -> 10.0.1.2     TCP 39506 > 9040 [FIN, ACK] Seq=13 Ack=100000002 Win=2560064 Len=0 TSV=10035638 TSER=2450227
103441   8.553581     10.0.1.2 -> 10.0.1.3     TCP 9040 > 39506 [ACK] Seq=100000002 Ack=14 Win=14528 Len=0 TSV=2450281 TSER=10035638
  1   0.000000     10.0.1.3 -> 10.0.1.2     TCP 39509 > 9040 [SYN] Seq=0 Win=5840 Len=0 MSS=1460 TSV=10038625 TSER=0 WS=6
  2   0.000314     10.0.1.2 -> 10.0.1.3     TCP 9040 > 39509 [SYN, ACK] Seq=0 Ack=1 Win=14480 Len=0 MSS=1460 TSV=2453269 TSER=10038625 WS=6
  3   0.000338     10.0.1.3 -> 10.0.1.2     TCP 39509 > 9040 [ACK] Seq=1 Ack=1 Win=5888 Len=0 TSV=10038625 TSER=2453269
  7   0.002202     10.0.1.2 -> 10.0.1.3     TCP 9040 > 39509 [ACK] Seq=1 Ack=13 Win=14528 Len=0 TSV=2453269 TSER=10038625
103425   8.544848     10.0.1.3 -> 10.0.1.2     TCP 39509 > 9040 [FIN, ACK] Seq=13 Ack=100000002 Win=2580480 Len=0 TSV=10040761 TSER=2455350
103426   8.545102     10.0.1.2 -> 10.0.1.3     TCP 9040 > 39509 [ACK] Seq=100000002 Ack=14 Win=14528 Len=0 TSV=2455405 TSER=10040761
  1   0.000000     10.0.1.3 -> 10.0.1.2     TCP 39511 > 9040 [SYN] Seq=0 Win=5840 Len=0 MSS=1460 TSV=10043826 TSER=0 WS=6
  2   0.000318     10.0.1.2 -> 10.0.1.3     TCP 9040 > 39511 [SYN, ACK] Seq=0 Ack=1 Win=14480 Len=0 MSS=1460 TSV=2458470 TSER=10043826 WS=6
  3   0.000345     10.0.1.3 -> 10.0.1.2     TCP 39511 > 9040 [ACK] Seq=1 Ack=1 Win=5888 Len=0 TSV=10043826 TSER=2458470
  7   0.002140     10.0.1.2 -> 10.0.1.3     TCP 9040 > 39511 [ACK] Seq=1 Ack=13 Win=14528 Len=0 TSV=2458471 TSER=10043826
103231   8.539284     10.0.1.3 -> 10.0.1.2     TCP 39511 > 9040 [FIN, ACK] Seq=13 Ack=100000002 Win=2580480 Len=0 TSV=10045961 TSER=2460550
103232   8.539533     10.0.1.2 -> 10.0.1.3     TCP 9040 > 39511 [ACK] Seq=100000002 Ack=14 Win=14528 Len=0 TSV=2460605 TSER=10045961
  1   0.000000     10.0.1.3 -> 10.0.1.2     TCP 39514 > 9040 [SYN] Seq=0 Win=5840 Len=0 MSS=1460 TSV=10049034 TSER=0 WS=6
  2   0.000285     10.0.1.2 -> 10.0.1.3     TCP 9040 > 39514 [SYN, ACK] Seq=0 Ack=1 Win=14480 Len=0 MSS=1460 TSV=2463679 TSER=10049034 WS=6
  3   0.000310     10.0.1.3 -> 10.0.1.2     TCP 39514 > 9040 [ACK] Seq=1 Ack=1 Win=5888 Len=0 TSV=10049034 TSER=2463679
  7   0.002346     10.0.1.2 -> 10.0.1.3     TCP 9040 > 39514 [ACK] Seq=1 Ack=13 Win=14528 Len=0 TSV=2463680 TSER=10049035
103031   8.534099     10.0.1.3 -> 10.0.1.2     TCP 39514 > 9040 [FIN, ACK] Seq=13 Ack=100000002 Win=2568768 Len=0 TSV=10051168 TSER=2465758
103032   8.534350     10.0.1.2 -> 10.0.1.3     TCP 9040 > 39514 [ACK] Seq=100000002 Ack=14 Win=14528 Len=0 TSV=2465813 TSER=10051168
  1   0.000000     10.0.1.3 -> 10.0.1.2     TCP 41081 > 9040 [SYN] Seq=0 Win=5840 Len=0 MSS=1460 TSV=10054234 TSER=0 WS=6
  2   0.000320     10.0.1.2 -> 10.0.1.3     TCP 9040 > 41081 [SYN, ACK] Seq=0 Ack=1 Win=14480 Len=0 MSS=1460 TSV=2468879 TSER=10054234 WS=6
  3   0.000344     10.0.1.3 -> 10.0.1.2     TCP 41081 > 9040 [ACK] Seq=1 Ack=1 Win=5888 Len=0 TSV=10054234 TSER=2468879
  7   0.002362     10.0.1.2 -> 10.0.1.3     TCP 9040 > 41081 [ACK] Seq=1 Ack=13 Win=14528 Len=0 TSV=2468880 TSER=10054235
103042   8.547522     10.0.1.3 -> 10.0.1.2     TCP 41081 > 9040 [FIN, ACK] Seq=13 Ack=100000002 Win=2580480 Len=0 TSV=10056371 TSER=2470962
103043   8.547764     10.0.1.2 -> 10.0.1.3     TCP 9040 > 41081 [ACK] Seq=100000002 Ack=14 Win=14528 Len=0 TSV=2471017 TSER=10056371
  1   0.000000     10.0.1.3 -> 10.0.1.2     TCP 41083 > 9040 [SYN] Seq=0 Win=5840 Len=0 MSS=1460 TSV=10059427 TSER=0 WS=6
  2   0.000320     10.0.1.2 -> 10.0.1.3     TCP 9040 > 41083 [SYN, ACK] Seq=0 Ack=1 Win=14480 Len=0 MSS=1460 TSV=2474072 TSER=10059427 WS=6
  3   0.000347     10.0.1.3 -> 10.0.1.2     TCP 41083 > 9040 [ACK] Seq=1 Ack=1 Win=5888 Len=0 TSV=10059427 TSER=2474072
  7   0.002225     10.0.1.2 -> 10.0.1.3     TCP 9040 > 41083 [ACK] Seq=1 Ack=13 Win=14528 Len=0 TSV=2474073 TSER=10059427
103477   8.539410     10.0.1.3 -> 10.0.1.2     TCP 41083 > 9040 [FIN, ACK] Seq=13 Ack=100000002 Win=2580480 Len=0 TSV=10061561 TSER=2476152
103478   8.539655     10.0.1.2 -> 10.0.1.3     TCP 9040 > 41083 [ACK] Seq=100000002 Ack=14 Win=14528 Len=0 TSV=2476207 TSER=10061561
