  1   0.000000     10.0.1.3 -> 10.0.1.2     TCP 37899 > 9040 [SYN] Seq=0 Win=5840 Len=0 MSS=1460 TSV=8757391 TSER=0 WS=6
  2   0.000272     10.0.1.2 -> 10.0.1.3     TCP 9040 > 37899 [SYN, ACK] Seq=0 Ack=1 Win=14480 Len=0 MSS=1460 TSV=8811292 TSER=8757391 WS=6
  3   0.000297     10.0.1.3 -> 10.0.1.2     TCP 37899 > 9040 [ACK] Seq=1 Ack=1 Win=5888 Len=0 TSV=8757391 TSER=8811292
  7   0.002265     10.0.1.2 -> 10.0.1.3     TCP 9040 > 37899 [ACK] Seq=1 Ack=13 Win=14528 Len=0 TSV=8811293 TSER=8757392
155744  12.795431     10.0.1.3 -> 10.0.1.2     TCP 37899 > 9040 [FIN, ACK] Seq=13 Ack=150000002 Win=2580480 Len=0 TSV=8760590 TSER=8814436
155745  12.795675     10.0.1.2 -> 10.0.1.3     TCP 9040 > 37899 [ACK] Seq=150000002 Ack=14 Win=14528 Len=0 TSV=8814491 TSER=8760590
================================================================================
IPv4 Conversations
Filter:<No Filter>
                                               |       <-      | |       ->      | |     Total     |
                                               | Frames  Bytes | | Frames  Bytes | | Frames  Bytes |
10.0.1.3             <-> 10.0.1.2              103597 156837410   52148   3441788  155745 160279198
================================================================================
  1   0.000000     10.0.1.3 -> 10.0.1.2     TCP 37901 > 9040 [SYN] Seq=0 Win=5840 Len=0 MSS=1460 TSV=8763448 TSER=0 WS=6
  2   0.000311     10.0.1.2 -> 10.0.1.3     TCP 9040 > 37901 [SYN, ACK] Seq=0 Ack=1 Win=14480 Len=0 MSS=1460 TSV=8817350 TSER=8763448 WS=6
  3   0.000334     10.0.1.3 -> 10.0.1.2     TCP 37901 > 9040 [ACK] Seq=1 Ack=1 Win=5888 Len=0 TSV=8763448 TSER=8817350
  7   0.002618     10.0.1.2 -> 10.0.1.3     TCP 9040 > 37901 [ACK] Seq=1 Ack=13 Win=14528 Len=0 TSV=8817350 TSER=8763448
155742  12.793308     10.0.1.3 -> 10.0.1.2     TCP 37901 > 9040 [FIN, ACK] Seq=13 Ack=150000002 Win=2580480 Len=0 TSV=8766647 TSER=8820493
155743  12.793553     10.0.1.2 -> 10.0.1.3     TCP 9040 > 37901 [ACK] Seq=150000002 Ack=14 Win=14528 Len=0 TSV=8820548 TSER=8766647
================================================================================
IPv4 Conversations
Filter:<No Filter>
                                               |       <-      | |       ->      | |     Total     |
                                               | Frames  Bytes | | Frames  Bytes | | Frames  Bytes |
10.0.1.3             <-> 10.0.1.2              103599 156837542   52144   3441524  155743 160279066
================================================================================
  1   0.000000     10.0.1.3 -> 10.0.1.2     TCP 37903 > 9040 [SYN] Seq=0 Win=5840 Len=0 MSS=1460 TSV=8769493 TSER=0 WS=6
  2   0.000283     10.0.1.2 -> 10.0.1.3     TCP 9040 > 37903 [SYN, ACK] Seq=0 Ack=1 Win=14480 Len=0 MSS=1460 TSV=8823395 TSER=8769493 WS=6
  3   0.000307     10.0.1.3 -> 10.0.1.2     TCP 37903 > 9040 [ACK] Seq=1 Ack=1 Win=5888 Len=0 TSV=8769493 TSER=8823395
  7   0.002463     10.0.1.2 -> 10.0.1.3     TCP 9040 > 37903 [ACK] Seq=1 Ack=13 Win=14528 Len=0 TSV=8823396 TSER=8769494
155808  12.972343     10.0.1.3 -> 10.0.1.2     TCP 37903 > 9040 [FIN, ACK] Seq=13 Ack=150000002 Win=2580480 Len=0 TSV=8772736 TSER=8826583
155809  12.972611     10.0.1.2 -> 10.0.1.3     TCP 9040 > 37903 [ACK] Seq=150000002 Ack=14 Win=14528 Len=0 TSV=8826638 TSER=8772736
================================================================================
IPv4 Conversations
Filter:<No Filter>
                                               |       <-      | |       ->      | |     Total     |
                                               | Frames  Bytes | | Frames  Bytes | | Frames  Bytes |
10.0.1.3             <-> 10.0.1.2              103603 156837806   52206   3445616  155809 160283422
================================================================================
  1   0.000000     10.0.1.3 -> 10.0.1.2     TCP 52947 > 9040 [SYN] Seq=0 Win=5840 Len=0 MSS=1460 TSV=8775592 TSER=0 WS=6
  2   0.000386     10.0.1.2 -> 10.0.1.3     TCP 9040 > 52947 [SYN, ACK] Seq=0 Ack=1 Win=14480 Len=0 MSS=1460 TSV=8829495 TSER=8775592 WS=6
  3   0.000410     10.0.1.3 -> 10.0.1.2     TCP 52947 > 9040 [ACK] Seq=1 Ack=1 Win=5888 Len=0 TSV=8775592 TSER=8829495
  7   0.002351     10.0.1.2 -> 10.0.1.3     TCP 9040 > 52947 [ACK] Seq=1 Ack=13 Win=14528 Len=0 TSV=8829495 TSER=8775593
155721  12.799607     10.0.1.3 -> 10.0.1.2     TCP 52947 > 9040 [FIN, ACK] Seq=13 Ack=150000002 Win=2580480 Len=0 TSV=8778792 TSER=8832640
155722  12.799853     10.0.1.2 -> 10.0.1.3     TCP 9040 > 52947 [ACK] Seq=150000002 Ack=14 Win=14528 Len=0 TSV=8832695 TSER=8778792
================================================================================
IPv4 Conversations
Filter:<No Filter>
                                               |       <-      | |       ->      | |     Total     |
                                               | Frames  Bytes | | Frames  Bytes | | Frames  Bytes |
10.0.1.3             <-> 10.0.1.2              103596 156837344   52126   3440336  155722 160277680
================================================================================
  1   0.000000     10.0.1.3 -> 10.0.1.2     TCP 52949 > 9040 [SYN] Seq=0 Win=5840 Len=0 MSS=1460 TSV=8781634 TSER=0 WS=6
  2   0.000281     10.0.1.2 -> 10.0.1.3     TCP 9040 > 52949 [SYN, ACK] Seq=0 Ack=1 Win=14480 Len=0 MSS=1460 TSV=8835537 TSER=8781634 WS=6
  3   0.000305     10.0.1.3 -> 10.0.1.2     TCP 52949 > 9040 [ACK] Seq=1 Ack=1 Win=5888 Len=0 TSV=8781635 TSER=8835537
  7   0.002290     10.0.1.2 -> 10.0.1.3     TCP 9040 > 52949 [ACK] Seq=1 Ack=13 Win=14528 Len=0 TSV=8835538 TSER=8781635
155764  12.793557     10.0.1.3 -> 10.0.1.2     TCP 52949 > 9040 [FIN, ACK] Seq=13 Ack=150000002 Win=2580480 Len=0 TSV=8784833 TSER=8838681
155765  12.793809     10.0.1.2 -> 10.0.1.3     TCP 9040 > 52949 [ACK] Seq=150000002 Ack=14 Win=14528 Len=0 TSV=8838736 TSER=8784833
================================================================================
IPv4 Conversations
Filter:<No Filter>
                                               |       <-      | |       ->      | |     Total     |
                                               | Frames  Bytes | | Frames  Bytes | | Frames  Bytes |
10.0.1.3             <-> 10.0.1.2              103597 156837410   52168   3443108  155765 160280518
================================================================================
  1   0.000000     10.0.1.3 -> 10.0.1.2     TCP 52951 > 9040 [SYN] Seq=0 Win=5840 Len=0 MSS=1460 TSV=8787673 TSER=0 WS=6
  2   0.000294     10.0.1.2 -> 10.0.1.3     TCP 9040 > 52951 [SYN, ACK] Seq=0 Ack=1 Win=14480 Len=0 MSS=1460 TSV=8841576 TSER=8787673 WS=6
  3   0.000316     10.0.1.3 -> 10.0.1.2     TCP 52951 > 9040 [ACK] Seq=1 Ack=1 Win=5888 Len=0 TSV=8787673 TSER=8841576
  7   0.002358     10.0.1.2 -> 10.0.1.3     TCP 9040 > 52951 [ACK] Seq=1 Ack=13 Win=14528 Len=0 TSV=8841577 TSER=8787674
155759  12.795015     10.0.1.3 -> 10.0.1.2     TCP 52951 > 9040 [FIN, ACK] Seq=13 Ack=150000002 Win=2580480 Len=0 TSV=8790872 TSER=8844720
155760  12.795265     10.0.1.2 -> 10.0.1.3     TCP 9040 > 52951 [ACK] Seq=150000002 Ack=14 Win=14528 Len=0 TSV=8844775 TSER=8790872
================================================================================
IPv4 Conversations
Filter:<No Filter>
                                               |       <-      | |       ->      | |     Total     |
                                               | Frames  Bytes | | Frames  Bytes | | Frames  Bytes |
10.0.1.3             <-> 10.0.1.2              103599 156837542   52161   3442646  155760 160280188
================================================================================
  1   0.000000     10.0.1.3 -> 10.0.1.2     TCP 52953 > 9040 [SYN] Seq=0 Win=5840 Len=0 MSS=1460 TSV=8793702 TSER=0 WS=6
  2   0.000289     10.0.1.2 -> 10.0.1.3     TCP 9040 > 52953 [SYN, ACK] Seq=0 Ack=1 Win=14480 Len=0 MSS=1460 TSV=8847606 TSER=8793702 WS=6
  3   0.000321     10.0.1.3 -> 10.0.1.2     TCP 52953 > 9040 [ACK] Seq=1 Ack=1 Win=5888 Len=0 TSV=8793702 TSER=8847606
  7   0.002524     10.0.1.2 -> 10.0.1.3     TCP 9040 > 52953 [ACK] Seq=1 Ack=13 Win=14528 Len=0 TSV=8847607 TSER=8793703
155768  12.797822     10.0.1.3 -> 10.0.1.2     TCP 52953 > 9040 [FIN, ACK] Seq=13 Ack=150000002 Win=2580480 Len=0 TSV=8796902 TSER=8850751
155769  12.798094     10.0.1.2 -> 10.0.1.3     TCP 9040 > 52953 [ACK] Seq=150000002 Ack=14 Win=14528 Len=0 TSV=8850806 TSER=8796902
================================================================================
IPv4 Conversations
Filter:<No Filter>
                                               |       <-      | |       ->      | |     Total     |
                                               | Frames  Bytes | | Frames  Bytes | | Frames  Bytes |
10.0.1.3             <-> 10.0.1.2              103598 156837476   52171   3443306  155769 160280782
================================================================================
  1   0.000000     10.0.1.3 -> 10.0.1.2     TCP 52957 > 9040 [SYN] Seq=0 Win=5840 Len=0 MSS=1460 TSV=8799745 TSER=0 WS=6
  2   0.000302     10.0.1.2 -> 10.0.1.3     TCP 9040 > 52957 [SYN, ACK] Seq=0 Ack=1 Win=14480 Len=0 MSS=1460 TSV=8853649 TSER=8799745 WS=6
  3   0.000327     10.0.1.3 -> 10.0.1.2     TCP 52957 > 9040 [ACK] Seq=1 Ack=1 Win=5888 Len=0 TSV=8799745 TSER=8853649
  7   0.002163     10.0.1.2 -> 10.0.1.3     TCP 9040 > 52957 [ACK] Seq=1 Ack=13 Win=14528 Len=0 TSV=8853649 TSER=8799745
155770  12.802820     10.0.1.3 -> 10.0.1.2     TCP 52957 > 9040 [FIN, ACK] Seq=13 Ack=150000002 Win=2580480 Len=0 TSV=8802945 TSER=8856795
155771  12.803069     10.0.1.2 -> 10.0.1.3     TCP 9040 > 52957 [ACK] Seq=150000002 Ack=14 Win=14528 Len=0 TSV=8856850 TSER=8802945
================================================================================
IPv4 Conversations
Filter:<No Filter>
                                               |       <-      | |       ->      | |     Total     |
                                               | Frames  Bytes | | Frames  Bytes | | Frames  Bytes |
10.0.1.3             <-> 10.0.1.2              103599 156837542   52172   3443372  155771 160280914
================================================================================
  1   0.000000     10.0.1.3 -> 10.0.1.2     TCP 52959 > 9040 [SYN] Seq=0 Win=5840 Len=0 MSS=1460 TSV=8805784 TSER=0 WS=6
  2   0.000313     10.0.1.2 -> 10.0.1.3     TCP 9040 > 52959 [SYN, ACK] Seq=0 Ack=1 Win=14480 Len=0 MSS=1460 TSV=8859688 TSER=8805784 WS=6
  3   0.000337     10.0.1.3 -> 10.0.1.2     TCP 52959 > 9040 [ACK] Seq=1 Ack=1 Win=5888 Len=0 TSV=8805784 TSER=8859688
  7   0.002344     10.0.1.2 -> 10.0.1.3     TCP 9040 > 52959 [ACK] Seq=1 Ack=13 Win=14528 Len=0 TSV=8859689 TSER=8805784
155804  13.119283     10.0.1.3 -> 10.0.1.2     TCP 52959 > 9040 [FIN, ACK] Seq=13 Ack=150000002 Win=2574592 Len=0 TSV=8809064 TSER=8862914
155805  13.119528     10.0.1.2 -> 10.0.1.3     TCP 9040 > 52959 [ACK] Seq=150000002 Ack=14 Win=14528 Len=0 TSV=8862968 TSER=8809064
================================================================================
IPv4 Conversations
Filter:<No Filter>
                                               |       <-      | |       ->      | |     Total     |
                                               | Frames  Bytes | | Frames  Bytes | | Frames  Bytes |
10.0.1.3             <-> 10.0.1.2              103608 156838136   52197   3445022  155805 160283158
================================================================================
  1   0.000000     10.0.1.3 -> 10.0.1.2     TCP 52961 > 9040 [SYN] Seq=0 Win=5840 Len=0 MSS=1460 TSV=8811902 TSER=0 WS=6
  2   0.000272     10.0.1.2 -> 10.0.1.3     TCP 9040 > 52961 [SYN, ACK] Seq=0 Ack=1 Win=14480 Len=0 MSS=1460 TSV=8865807 TSER=8811902 WS=6
  3   0.000295     10.0.1.3 -> 10.0.1.2     TCP 52961 > 9040 [ACK] Seq=1 Ack=1 Win=5888 Len=0 TSV=8811902 TSER=8865807
  7   0.002266     10.0.1.2 -> 10.0.1.3     TCP 9040 > 52961 [ACK] Seq=1 Ack=13 Win=14528 Len=0 TSV=8865808 TSER=8811903
155837  13.420042     10.0.1.3 -> 10.0.1.2     TCP 52961 > 9040 [FIN, ACK] Seq=13 Ack=150000002 Win=2560064 Len=0 TSV=8815257 TSER=8869108
155838  13.420285     10.0.1.2 -> 10.0.1.3     TCP 9040 > 52961 [ACK] Seq=150000002 Ack=14 Win=14528 Len=0 TSV=8869162 TSER=8815257
================================================================================
IPv4 Conversations
Filter:<No Filter>
                                               |       <-      | |       ->      | |     Total     |
                                               | Frames  Bytes | | Frames  Bytes | | Frames  Bytes |
10.0.1.3             <-> 10.0.1.2              103626 156839324   52212   3446012  155838 160285336
================================================================================
  1   0.000000     10.0.1.3 -> 10.0.1.2     TCP 52963 > 9040 [SYN] Seq=0 Win=5840 Len=0 MSS=1460 TSV=8818090 TSER=0 WS=6
  2   0.000362     10.0.1.2 -> 10.0.1.3     TCP 9040 > 52963 [SYN, ACK] Seq=0 Ack=1 Win=14480 Len=0 MSS=1460 TSV=8871995 TSER=8818090 WS=6
  3   0.000387     10.0.1.3 -> 10.0.1.2     TCP 52963 > 9040 [ACK] Seq=1 Ack=1 Win=5888 Len=0 TSV=8818090 TSER=8871995
  7   0.002522     10.0.1.2 -> 10.0.1.3     TCP 9040 > 52963 [ACK] Seq=1 Ack=13 Win=14528 Len=0 TSV=8871996 TSER=8818090
155781  13.002825     10.0.1.3 -> 10.0.1.2     TCP 52963 > 9040 [FIN, ACK] Seq=13 Ack=150000002 Win=2580480 Len=0 TSV=8821341 TSER=8875191
155782  13.003073     10.0.1.2 -> 10.0.1.3     TCP 9040 > 52963 [ACK] Seq=150000002 Ack=14 Win=14528 Len=0 TSV=8875246 TSER=8821341
================================================================================
IPv4 Conversations
Filter:<No Filter>
                                               |       <-      | |       ->      | |     Total     |
                                               | Frames  Bytes | | Frames  Bytes | | Frames  Bytes |
10.0.1.3             <-> 10.0.1.2              103602 156837740   52180   3443900  155782 160281640
================================================================================
  1   0.000000     10.0.1.3 -> 10.0.1.2     TCP 52965 > 9040 [SYN] Seq=0 Win=5840 Len=0 MSS=1460 TSV=8824196 TSER=0 WS=6
  2   0.000286     10.0.1.2 -> 10.0.1.3     TCP 9040 > 52965 [SYN, ACK] Seq=0 Ack=1 Win=14480 Len=0 MSS=1460 TSV=8878102 TSER=8824196 WS=6
  3   0.000309     10.0.1.3 -> 10.0.1.2     TCP 52965 > 9040 [ACK] Seq=1 Ack=1 Win=5888 Len=0 TSV=8824196 TSER=8878102
  7   0.002226     10.0.1.2 -> 10.0.1.3     TCP 9040 > 52965 [ACK] Seq=1 Ack=13 Win=14528 Len=0 TSV=8878102 TSER=8824196
155734  12.814919     10.0.1.3 -> 10.0.1.2     TCP 52965 > 9040 [FIN, ACK] Seq=13 Ack=150000002 Win=2580480 Len=0 TSV=8827399 TSER=8881251
155735  12.815171     10.0.1.2 -> 10.0.1.3     TCP 9040 > 52965 [ACK] Seq=150000002 Ack=14 Win=14528 Len=0 TSV=8881306 TSER=8827399
================================================================================
IPv4 Conversations
Filter:<No Filter>
                                               |       <-      | |       ->      | |     Total     |
                                               | Frames  Bytes | | Frames  Bytes | | Frames  Bytes |
10.0.1.3             <-> 10.0.1.2              103599 156837542   52136   3440996  155735 160278538
================================================================================
  1   0.000000     10.0.1.3 -> 10.0.1.2     TCP 52967 > 9040 [SYN] Seq=0 Win=5840 Len=0 MSS=1460 TSV=8830236 TSER=0 WS=6
  2   0.000309     10.0.1.2 -> 10.0.1.3     TCP 9040 > 52967 [SYN, ACK] Seq=0 Ack=1 Win=14480 Len=0 MSS=1460 TSV=8884143 TSER=8830236 WS=6
  3   0.000333     10.0.1.3 -> 10.0.1.2     TCP 52967 > 9040 [ACK] Seq=1 Ack=1 Win=5888 Len=0 TSV=8830236 TSER=8884143
  7   0.002241     10.0.1.2 -> 10.0.1.3     TCP 9040 > 52967 [ACK] Seq=1 Ack=13 Win=14528 Len=0 TSV=8884144 TSER=8830237
155683  12.813127     10.0.1.3 -> 10.0.1.2     TCP 52967 > 9040 [FIN, ACK] Seq=13 Ack=150000002 Win=2580480 Len=0 TSV=8833440 TSER=8887292
155684  12.813377     10.0.1.2 -> 10.0.1.3     TCP 9040 > 52967 [ACK] Seq=150000002 Ack=14 Win=14528 Len=0 TSV=8887347 TSER=8833440
================================================================================
IPv4 Conversations
Filter:<No Filter>
                                               |       <-      | |       ->      | |     Total     |
                                               | Frames  Bytes | | Frames  Bytes | | Frames  Bytes |
10.0.1.3             <-> 10.0.1.2              103601 156837674   52083   3437498  155684 160275172
================================================================================
  1   0.000000     10.0.1.3 -> 10.0.1.2     TCP 52970 > 9040 [SYN] Seq=0 Win=5840 Len=0 MSS=1460 TSV=8836284 TSER=0 WS=6
  2   0.000286     10.0.1.2 -> 10.0.1.3     TCP 9040 > 52970 [SYN, ACK] Seq=0 Ack=1 Win=14480 Len=0 MSS=1460 TSV=8890191 TSER=8836284 WS=6
  3   0.000317     10.0.1.3 -> 10.0.1.2     TCP 52970 > 9040 [ACK] Seq=1 Ack=1 Win=5888 Len=0 TSV=8836284 TSER=8890191
  7   0.002824     10.0.1.2 -> 10.0.1.3     TCP 9040 > 52970 [ACK] Seq=1 Ack=13 Win=14528 Len=0 TSV=8890192 TSER=8836285
155756  12.808053     10.0.1.3 -> 10.0.1.2     TCP 52970 > 9040 [FIN, ACK] Seq=13 Ack=150000002 Win=2580480 Len=0 TSV=8839486 TSER=8893339
155757  12.808307     10.0.1.2 -> 10.0.1.3     TCP 9040 > 52970 [ACK] Seq=150000002 Ack=14 Win=14528 Len=0 TSV=8893394 TSER=8839486
================================================================================
IPv4 Conversations
Filter:<No Filter>
                                               |       <-      | |       ->      | |     Total     |
                                               | Frames  Bytes | | Frames  Bytes | | Frames  Bytes |
10.0.1.3             <-> 10.0.1.2              103598 156837476   52159   3442514  155757 160279990
================================================================================
  1   0.000000     10.0.1.3 -> 10.0.1.2     TCP 52972 > 9040 [SYN] Seq=0 Win=5840 Len=0 MSS=1460 TSV=8842330 TSER=0 WS=6
  2   0.000293     10.0.1.2 -> 10.0.1.3     TCP 9040 > 52972 [SYN, ACK] Seq=0 Ack=1 Win=14480 Len=0 MSS=1460 TSV=8896237 TSER=8842330 WS=6
  3   0.000318     10.0.1.3 -> 10.0.1.2     TCP 52972 > 9040 [ACK] Seq=1 Ack=1 Win=5888 Len=0 TSV=8842330 TSER=8896237
  7   0.002285     10.0.1.2 -> 10.0.1.3     TCP 9040 > 52972 [ACK] Seq=1 Ack=13 Win=14528 Len=0 TSV=8896238 TSER=8842331
155773  12.808519     10.0.1.3 -> 10.0.1.2     TCP 52972 > 9040 [FIN, ACK] Seq=13 Ack=150000002 Win=2580480 Len=0 TSV=8845532 TSER=8899385
155774  12.808771     10.0.1.2 -> 10.0.1.3     TCP 9040 > 52972 [ACK] Seq=150000002 Ack=14 Win=14528 Len=0 TSV=8899440 TSER=8845532
================================================================================
IPv4 Conversations
Filter:<No Filter>
                                               |       <-      | |       ->      | |     Total     |
                                               | Frames  Bytes | | Frames  Bytes | | Frames  Bytes |
10.0.1.3             <-> 10.0.1.2              103597 156837410   52177   3443702  155774 160281112
================================================================================
  1   0.000000     10.0.1.3 -> 10.0.1.2     TCP 52974 > 9040 [SYN] Seq=0 Win=5840 Len=0 MSS=1460 TSV=8848374 TSER=0 WS=6
  2   0.000293     10.0.1.2 -> 10.0.1.3     TCP 9040 > 52974 [SYN, ACK] Seq=0 Ack=1 Win=14480 Len=0 MSS=1460 TSV=8902282 TSER=8848374 WS=6
  3   0.000319     10.0.1.3 -> 10.0.1.2     TCP 52974 > 9040 [ACK] Seq=1 Ack=1 Win=5888 Len=0 TSV=8848374 TSER=8902282
  7   0.002241     10.0.1.2 -> 10.0.1.3     TCP 9040 > 52974 [ACK] Seq=1 Ack=13 Win=14528 Len=0 TSV=8902283 TSER=8848375
155779  12.802444     10.0.1.3 -> 10.0.1.2     TCP 52974 > 9040 [FIN, ACK] Seq=13 Ack=150000002 Win=2580480 Len=0 TSV=8851575 TSER=8905428
155780  12.802692     10.0.1.2 -> 10.0.1.3     TCP 9040 > 52974 [ACK] Seq=150000002 Ack=14 Win=14528 Len=0 TSV=8905483 TSER=8851575
================================================================================
IPv4 Conversations
Filter:<No Filter>
                                               |       <-      | |       ->      | |     Total     |
                                               | Frames  Bytes | | Frames  Bytes | | Frames  Bytes |
10.0.1.3             <-> 10.0.1.2              103598 156837476   52182   3444032  155780 160281508
================================================================================
  1   0.000000     10.0.1.3 -> 10.0.1.2     TCP 33723 > 9040 [SYN] Seq=0 Win=5840 Len=0 MSS=1460 TSV=8854411 TSER=0 WS=6
  2   0.000287     10.0.1.2 -> 10.0.1.3     TCP 9040 > 33723 [SYN, ACK] Seq=0 Ack=1 Win=14480 Len=0 MSS=1460 TSV=8908319 TSER=8854411 WS=6
  3   0.000311     10.0.1.3 -> 10.0.1.2     TCP 33723 > 9040 [ACK] Seq=1 Ack=1 Win=5888 Len=0 TSV=8854411 TSER=8908319
  7   0.002252     10.0.1.2 -> 10.0.1.3     TCP 9040 > 33723 [ACK] Seq=1 Ack=13 Win=14528 Len=0 TSV=8908320 TSER=8854411
155755  12.793059     10.0.1.3 -> 10.0.1.2     TCP 33723 > 9040 [FIN, ACK] Seq=13 Ack=150000002 Win=2580480 Len=0 TSV=8857609 TSER=8911463
155756  12.793312     10.0.1.2 -> 10.0.1.3     TCP 9040 > 33723 [ACK] Seq=150000002 Ack=14 Win=14528 Len=0 TSV=8911518 TSER=8857609
================================================================================
IPv4 Conversations
Filter:<No Filter>
                                               |       <-      | |       ->      | |     Total     |
                                               | Frames  Bytes | | Frames  Bytes | | Frames  Bytes |
10.0.1.3             <-> 10.0.1.2              103598 156837476   52158   3442448  155756 160279924
================================================================================
  1   0.000000     10.0.1.3 -> 10.0.1.2     TCP 33725 > 9040 [SYN] Seq=0 Win=5840 Len=0 MSS=1460 TSV=8860457 TSER=0 WS=6
  2   0.000279     10.0.1.2 -> 10.0.1.3     TCP 9040 > 33725 [SYN, ACK] Seq=0 Ack=1 Win=14480 Len=0 MSS=1460 TSV=8914365 TSER=8860457 WS=6
  3   0.000302     10.0.1.3 -> 10.0.1.2     TCP 33725 > 9040 [ACK] Seq=1 Ack=1 Win=5888 Len=0 TSV=8860457 TSER=8914365
  7   0.002223     10.0.1.2 -> 10.0.1.3     TCP 9040 > 33725 [ACK] Seq=1 Ack=13 Win=14528 Len=0 TSV=8914366 TSER=8860457
155732  12.837138     10.0.1.3 -> 10.0.1.2     TCP 33725 > 9040 [FIN, ACK] Seq=13 Ack=150000002 Win=2580480 Len=0 TSV=8863666 TSER=8917520
155733  12.837385     10.0.1.2 -> 10.0.1.3     TCP 9040 > 33725 [ACK] Seq=150000002 Ack=14 Win=14528 Len=0 TSV=8917575 TSER=8863666
================================================================================
IPv4 Conversations
Filter:<No Filter>
                                               |       <-      | |       ->      | |     Total     |
                                               | Frames  Bytes | | Frames  Bytes | | Frames  Bytes |
10.0.1.3             <-> 10.0.1.2              103599 156837542   52134   3440864  155733 160278406
================================================================================
  1   0.000000     10.0.1.3 -> 10.0.1.2     TCP 33727 > 9040 [SYN] Seq=0 Win=5840 Len=0 MSS=1460 TSV=8866517 TSER=0 WS=6
  2   0.000317     10.0.1.2 -> 10.0.1.3     TCP 9040 > 33727 [SYN, ACK] Seq=0 Ack=1 Win=14480 Len=0 MSS=1460 TSV=8920426 TSER=8866517 WS=6
  3   0.000338     10.0.1.3 -> 10.0.1.2     TCP 33727 > 9040 [ACK] Seq=1 Ack=1 Win=5888 Len=0 TSV=8866517 TSER=8920426
  7   0.002317     10.0.1.2 -> 10.0.1.3     TCP 9040 > 33727 [ACK] Seq=1 Ack=13 Win=14528 Len=0 TSV=8920427 TSER=8866517
155838  13.584231     10.0.1.3 -> 10.0.1.2     TCP 33727 > 9040 [FIN, ACK] Seq=13 Ack=150000002 Win=2580480 Len=0 TSV=8869913 TSER=8923768
155839  13.584476     10.0.1.2 -> 10.0.1.3     TCP 9040 > 33727 [ACK] Seq=150000002 Ack=14 Win=14528 Len=0 TSV=8923823 TSER=8869913
================================================================================
IPv4 Conversations
Filter:<No Filter>
                                               |       <-      | |       ->      | |     Total     |
                                               | Frames  Bytes | | Frames  Bytes | | Frames  Bytes |
10.0.1.3             <-> 10.0.1.2              103633 156839786   52206   3445616  155839 160285402
================================================================================
  1   0.000000     10.0.1.3 -> 10.0.1.2     TCP 33729 > 9040 [SYN] Seq=0 Win=5840 Len=0 MSS=1460 TSV=8872750 TSER=0 WS=6
  2   0.000316     10.0.1.2 -> 10.0.1.3     TCP 9040 > 33729 [SYN, ACK] Seq=0 Ack=1 Win=14480 Len=0 MSS=1460 TSV=8926659 TSER=8872750 WS=6
  3   0.000340     10.0.1.3 -> 10.0.1.2     TCP 33729 > 9040 [ACK] Seq=1 Ack=1 Win=5888 Len=0 TSV=8872750 TSER=8926659
  7   0.002202     10.0.1.2 -> 10.0.1.3     TCP 9040 > 33729 [ACK] Seq=1 Ack=13 Win=14528 Len=0 TSV=8926660 TSER=8872750
155791  12.821456     10.0.1.3 -> 10.0.1.2     TCP 33729 > 9040 [FIN, ACK] Seq=13 Ack=150000002 Win=2580480 Len=0 TSV=8875955 TSER=8929810
155792  12.821732     10.0.1.2 -> 10.0.1.3     TCP 9040 > 33729 [ACK] Seq=150000002 Ack=14 Win=14528 Len=0 TSV=8929865 TSER=8875955
================================================================================
IPv4 Conversations
Filter:<No Filter>
                                               |       <-      | |       ->      | |     Total     |
                                               | Frames  Bytes | | Frames  Bytes | | Frames  Bytes |
10.0.1.3             <-> 10.0.1.2              103599 156837542   52193   3444758  155792 160282300
================================================================================
