  1   0.000000     10.0.1.3 -> 10.0.1.2     TCP 34939 > 9040 [SYN] Seq=0 Win=5840 Len=0 MSS=1460 TSV=2201881 TSER=0 WS=6
  2   0.000497     10.0.1.2 -> 10.0.1.3     TCP 9040 > 34939 [SYN, ACK] Seq=0 Ack=1 Win=14480 Len=0 MSS=1460 TSV=2186817 TSER=2201881 WS=6
  3   0.000520     10.0.1.3 -> 10.0.1.2     TCP 34939 > 9040 [ACK] Seq=1 Ack=1 Win=5888 Len=0 TSV=2201881 TSER=2186817
  7   0.002528     10.0.1.2 -> 10.0.1.3     TCP 9040 > 34939 [ACK] Seq=1 Ack=13 Win=14528 Len=0 TSV=2186817 TSER=2201882
103893   8.538341     10.0.1.3 -> 10.0.1.2     TCP 34939 > 9040 [FIN, ACK] Seq=13 Ack=100000002 Win=2580480 Len=0 TSV=2204016 TSER=2188896
  1   0.000000     10.0.1.3 -> 10.0.1.2     TCP 34941 > 9040 [SYN] Seq=0 Win=5840 Len=0 MSS=1460 TSV=2207068 TSER=0 WS=6
  2   0.000287     10.0.1.2 -> 10.0.1.3     TCP 9040 > 34941 [SYN, ACK] Seq=0 Ack=1 Win=14480 Len=0 MSS=1460 TSV=2192003 TSER=2207068 WS=6
  3   0.000314     10.0.1.3 -> 10.0.1.2     TCP 34941 > 9040 [ACK] Seq=1 Ack=1 Win=5888 Len=0 TSV=2207068 TSER=2192003
  7   0.002347     10.0.1.2 -> 10.0.1.3     TCP 9040 > 34941 [ACK] Seq=1 Ack=13 Win=14528 Len=0 TSV=2192004 TSER=2207068
103781   8.538037     10.0.1.3 -> 10.0.1.2     TCP 34941 > 9040 [FIN, ACK] Seq=13 Ack=100000002 Win=2580480 Len=0 TSV=2209202 TSER=2194083
  1   0.000000     10.0.1.3 -> 10.0.1.2     TCP 34943 > 9040 [SYN] Seq=0 Win=5840 Len=0 MSS=1460 TSV=2212244 TSER=0 WS=6
  2   0.000269     10.0.1.2 -> 10.0.1.3     TCP 9040 > 34943 [SYN, ACK] Seq=0 Ack=1 Win=14480 Len=0 MSS=1460 TSV=2197181 TSER=2212244 WS=6
  3   0.000292     10.0.1.3 -> 10.0.1.2     TCP 34943 > 9040 [ACK] Seq=1 Ack=1 Win=5888 Len=0 TSV=2212245 TSER=2197181
  7   0.002967     10.0.1.2 -> 10.0.1.3     TCP 9040 > 34943 [ACK] Seq=1 Ack=13 Win=14528 Len=0 TSV=2197181 TSER=2212245
103811   8.539058     10.0.1.3 -> 10.0.1.2     TCP 34943 > 9040 [FIN, ACK] Seq=13 Ack=100000002 Win=2580480 Len=0 TSV=2214379 TSER=2199260
  1   0.000000     10.0.1.3 -> 10.0.1.2     TCP 34946 > 9040 [SYN] Seq=0 Win=5840 Len=0 MSS=1460 TSV=2217474 TSER=0 WS=6
  2   0.000301     10.0.1.2 -> 10.0.1.3     TCP 9040 > 34946 [SYN, ACK] Seq=0 Ack=1 Win=14480 Len=0 MSS=1460 TSV=2202411 TSER=2217474 WS=6
  3   0.000328     10.0.1.3 -> 10.0.1.2     TCP 34946 > 9040 [ACK] Seq=1 Ack=1 Win=5888 Len=0 TSV=2217474 TSER=2202411
  7   0.002263     10.0.1.2 -> 10.0.1.3     TCP 9040 > 34946 [ACK] Seq=1 Ack=13 Win=14528 Len=0 TSV=2202411 TSER=2217475
  1   0.000000     10.0.1.3 -> 10.0.1.2     TCP 34948 > 9040 [SYN] Seq=0 Win=5840 Len=0 MSS=1460 TSV=2222584 TSER=0 WS=6
  2   0.000302     10.0.1.2 -> 10.0.1.3     TCP 9040 > 34948 [SYN, ACK] Seq=0 Ack=1 Win=14480 Len=0 MSS=1460 TSV=2207521 TSER=2222584 WS=6
  3   0.000325     10.0.1.3 -> 10.0.1.2     TCP 34948 > 9040 [ACK] Seq=1 Ack=1 Win=5888 Len=0 TSV=2222584 TSER=2207521
  7   0.002283     10.0.1.2 -> 10.0.1.3     TCP 9040 > 34948 [ACK] Seq=1 Ack=13 Win=14528 Len=0 TSV=2207522 TSER=2222585
103451   8.535839     10.0.1.3 -> 10.0.1.2     TCP 34948 > 9040 [FIN, ACK] Seq=13 Ack=100000002 Win=2580480 Len=0 TSV=2224718 TSER=2209601
  1   0.000000     10.0.1.3 -> 10.0.1.2     TCP 34950 > 9040 [SYN] Seq=0 Win=5840 Len=0 MSS=1460 TSV=2227787 TSER=0 WS=6
  2   0.000309     10.0.1.2 -> 10.0.1.3     TCP 9040 > 34950 [SYN, ACK] Seq=0 Ack=1 Win=14480 Len=0 MSS=1460 TSV=2212724 TSER=2227787 WS=6
  3   0.000332     10.0.1.3 -> 10.0.1.2     TCP 34950 > 9040 [ACK] Seq=1 Ack=1 Win=5888 Len=0 TSV=2227787 TSER=2212724
  7   0.002317     10.0.1.2 -> 10.0.1.3     TCP 9040 > 34950 [ACK] Seq=1 Ack=13 Win=14528 Len=0 TSV=2212725 TSER=2227787
103739   8.546409     10.0.1.3 -> 10.0.1.2     TCP 34950 > 9040 [FIN, ACK] Seq=13 Ack=100000002 Win=2580480 Len=0 TSV=2229924 TSER=2214806
  1   0.000000     10.0.1.3 -> 10.0.1.2     TCP 34952 > 9040 [SYN] Seq=0 Win=5840 Len=0 MSS=1460 TSV=2232937 TSER=0 WS=6
  2   0.000371     10.0.1.2 -> 10.0.1.3     TCP 9040 > 34952 [SYN, ACK] Seq=0 Ack=1 Win=14480 Len=0 MSS=1460 TSV=2217874 TSER=2232937 WS=6
  3   0.000393     10.0.1.3 -> 10.0.1.2     TCP 34952 > 9040 [ACK] Seq=1 Ack=1 Win=5888 Len=0 TSV=2232937 TSER=2217874
  7   0.002458     10.0.1.2 -> 10.0.1.3     TCP 9040 > 34952 [ACK] Seq=1 Ack=13 Win=14528 Len=0 TSV=2217875 TSER=2232937
103664   8.541297     10.0.1.3 -> 10.0.1.2     TCP 34952 > 9040 [FIN, ACK] Seq=13 Ack=100000002 Win=2580480 Len=0 TSV=2235072 TSER=2219955
  1   0.000000     10.0.1.3 -> 10.0.1.2     TCP 34954 > 9040 [SYN] Seq=0 Win=5840 Len=0 MSS=1460 TSV=2238142 TSER=0 WS=6
  2   0.000302     10.0.1.2 -> 10.0.1.3     TCP 9040 > 34954 [SYN, ACK] Seq=0 Ack=1 Win=14480 Len=0 MSS=1460 TSV=2223080 TSER=2238142 WS=6
  3   0.000326     10.0.1.3 -> 10.0.1.2     TCP 34954 > 9040 [ACK] Seq=1 Ack=1 Win=5888 Len=0 TSV=2238142 TSER=2223080
  7   0.002164     10.0.1.2 -> 10.0.1.3     TCP 9040 > 34954 [ACK] Seq=1 Ack=13 Win=14528 Len=0 TSV=2223080 TSER=2238142
103631   8.538201     10.0.1.3 -> 10.0.1.2     TCP 34954 > 9040 [FIN, ACK] Seq=13 Ack=100000002 Win=2580480 Len=0 TSV=2240276 TSER=2225160
  1   0.000000     10.0.1.3 -> 10.0.1.2     TCP 34956 > 9040 [SYN] Seq=0 Win=5840 Len=0 MSS=1460 TSV=2243374 TSER=0 WS=6
  2   0.000321     10.0.1.2 -> 10.0.1.3     TCP 9040 > 34956 [SYN, ACK] Seq=0 Ack=1 Win=14480 Len=0 MSS=1460 TSV=2228313 TSER=2243374 WS=6
  3   0.000344     10.0.1.3 -> 10.0.1.2     TCP 34956 > 9040 [ACK] Seq=1 Ack=1 Win=5888 Len=0 TSV=2243374 TSER=2228313
  7   0.002250     10.0.1.2 -> 10.0.1.3     TCP 9040 > 34956 [ACK] Seq=1 Ack=13 Win=14528 Len=0 TSV=2228313 TSER=2243375
  1   0.000000     10.0.1.3 -> 10.0.1.2     TCP 34958 > 9040 [SYN] Seq=0 Win=5840 Len=0 MSS=1460 TSV=2248474 TSER=0 WS=6
  2   0.000315     10.0.1.2 -> 10.0.1.3     TCP 9040 > 34958 [SYN, ACK] Seq=0 Ack=1 Win=14480 Len=0 MSS=1460 TSV=2233413 TSER=2248474 WS=6
  3   0.000337     10.0.1.3 -> 10.0.1.2     TCP 34958 > 9040 [ACK] Seq=1 Ack=1 Win=5888 Len=0 TSV=2248474 TSER=2233413
  7   0.002388     10.0.1.2 -> 10.0.1.3     TCP 9040 > 34958 [ACK] Seq=1 Ack=13 Win=14528 Len=0 TSV=2233413 TSER=2248474
103707   8.542933     10.0.1.3 -> 10.0.1.2     TCP 34958 > 9040 [FIN, ACK] Seq=13 Ack=100000002 Win=2580480 Len=0 TSV=2250609 TSER=2235493
  1   0.000000     10.0.1.3 -> 10.0.1.2     TCP 35296 > 9040 [SYN] Seq=0 Win=5840 Len=0 MSS=1460 TSV=2253655 TSER=0 WS=6
  2   0.000280     10.0.1.2 -> 10.0.1.3     TCP 9040 > 35296 [SYN, ACK] Seq=0 Ack=1 Win=14480 Len=0 MSS=1460 TSV=2238594 TSER=2253655 WS=6
  3   0.000303     10.0.1.3 -> 10.0.1.2     TCP 35296 > 9040 [ACK] Seq=1 Ack=1 Win=5888 Len=0 TSV=2253655 TSER=2238594
  7   0.002277     10.0.1.2 -> 10.0.1.3     TCP 9040 > 35296 [ACK] Seq=1 Ack=13 Win=14528 Len=0 TSV=2238595 TSER=2253655
103576   8.539121     10.0.1.3 -> 10.0.1.2     TCP 35296 > 9040 [FIN, ACK] Seq=13 Ack=100000002 Win=2580480 Len=0 TSV=2255789 TSER=2240674
  1   0.000000     10.0.1.3 -> 10.0.1.2     TCP 35298 > 9040 [SYN] Seq=0 Win=5840 Len=0 MSS=1460 TSV=2258856 TSER=0 WS=6
  2   0.000339     10.0.1.2 -> 10.0.1.3     TCP 9040 > 35298 [SYN, ACK] Seq=0 Ack=1 Win=14480 Len=0 MSS=1460 TSV=2243795 TSER=2258856 WS=6
  3   0.000372     10.0.1.3 -> 10.0.1.2     TCP 35298 > 9040 [ACK] Seq=1 Ack=1 Win=5888 Len=0 TSV=2258856 TSER=2243795
  7   0.002604     10.0.1.2 -> 10.0.1.3     TCP 9040 > 35298 [ACK] Seq=1 Ack=13 Win=14528 Len=0 TSV=2243796 TSER=2258856
103771   8.537507     10.0.1.3 -> 10.0.1.2     TCP 35298 > 9040 [FIN, ACK] Seq=13 Ack=100000002 Win=2580480 Len=0 TSV=2260990 TSER=2245875
  1   0.000000     10.0.1.3 -> 10.0.1.2     TCP 35300 > 9040 [SYN] Seq=0 Win=5840 Len=0 MSS=1460 TSV=2264063 TSER=0 WS=6
  2   0.000324     10.0.1.2 -> 10.0.1.3     TCP 9040 > 35300 [SYN, ACK] Seq=0 Ack=1 Win=14480 Len=0 MSS=1460 TSV=2249003 TSER=2264063 WS=6
  3   0.000349     10.0.1.3 -> 10.0.1.2     TCP 35300 > 9040 [ACK] Seq=1 Ack=1 Win=5888 Len=0 TSV=2264063 TSER=2249003
  7   0.003423     10.0.1.2 -> 10.0.1.3     TCP 9040 > 35300 [ACK] Seq=1 Ack=13 Win=14528 Len=0 TSV=2249004 TSER=2264064
103417   8.540585     10.0.1.3 -> 10.0.1.2     TCP 35300 > 9040 [FIN, ACK] Seq=13 Ack=100000002 Win=2580480 Len=0 TSV=2266199 TSER=2251084
  1   0.000000     10.0.1.3 -> 10.0.1.2     TCP 35302 > 9040 [SYN] Seq=0 Win=5840 Len=0 MSS=1460 TSV=2269265 TSER=0 WS=6
  2   0.000375     10.0.1.2 -> 10.0.1.3     TCP 9040 > 35302 [SYN, ACK] Seq=0 Ack=1 Win=14480 Len=0 MSS=1460 TSV=2254206 TSER=2269265 WS=6
  3   0.000398     10.0.1.3 -> 10.0.1.2     TCP 35302 > 9040 [ACK] Seq=1 Ack=1 Win=5888 Len=0 TSV=2269265 TSER=2254206
  7   0.002368     10.0.1.2 -> 10.0.1.3     TCP 9040 > 35302 [ACK] Seq=1 Ack=13 Win=14528 Len=0 TSV=2254206 TSER=2269266
103663   8.541407     10.0.1.3 -> 10.0.1.2     TCP 35302 > 9040 [FIN, ACK] Seq=13 Ack=100000002 Win=2580480 Len=0 TSV=2271401 TSER=2256286
  1   0.000000     10.0.1.3 -> 10.0.1.2     TCP 35304 > 9040 [SYN] Seq=0 Win=5840 Len=0 MSS=1460 TSV=2274464 TSER=0 WS=6
  2   0.000359     10.0.1.2 -> 10.0.1.3     TCP 9040 > 35304 [SYN, ACK] Seq=0 Ack=1 Win=14480 Len=0 MSS=1460 TSV=2259405 TSER=2274464 WS=6
  3   0.000383     10.0.1.3 -> 10.0.1.2     TCP 35304 > 9040 [ACK] Seq=1 Ack=1 Win=5888 Len=0 TSV=2274464 TSER=2259405
  7   0.002388     10.0.1.2 -> 10.0.1.3     TCP 9040 > 35304 [ACK] Seq=1 Ack=13 Win=14528 Len=0 TSV=2259405 TSER=2274464
103782   8.538815     10.0.1.3 -> 10.0.1.2     TCP 35304 > 9040 [FIN, ACK] Seq=13 Ack=100000002 Win=2580480 Len=0 TSV=2276599 TSER=2261484
  1   0.000000     10.0.1.3 -> 10.0.1.2     TCP 35306 > 9040 [SYN] Seq=0 Win=5840 Len=0 MSS=1460 TSV=2279675 TSER=0 WS=6
  2   0.000371     10.0.1.2 -> 10.0.1.3     TCP 9040 > 35306 [SYN, ACK] Seq=0 Ack=1 Win=14480 Len=0 MSS=1460 TSV=2264616 TSER=2279675 WS=6
  3   0.000394     10.0.1.3 -> 10.0.1.2     TCP 35306 > 9040 [ACK] Seq=1 Ack=1 Win=5888 Len=0 TSV=2279675 TSER=2264616
  7   0.002455     10.0.1.2 -> 10.0.1.3     TCP 9040 > 35306 [ACK] Seq=1 Ack=13 Win=14528 Len=0 TSV=2264617 TSER=2279675
103647   8.544162     10.0.1.3 -> 10.0.1.2     TCP 35306 > 9040 [FIN, ACK] Seq=13 Ack=100000002 Win=2560064 Len=0 TSV=2281811 TSER=2266698
  1   0.000000     10.0.1.3 -> 10.0.1.2     TCP 35308 > 9040 [SYN] Seq=0 Win=5840 Len=0 MSS=1460 TSV=2284882 TSER=0 WS=6
  2   0.000290     10.0.1.2 -> 10.0.1.3     TCP 9040 > 35308 [SYN, ACK] Seq=0 Ack=1 Win=14480 Len=0 MSS=1460 TSV=2269823 TSER=2284882 WS=6
  3   0.000317     10.0.1.3 -> 10.0.1.2     TCP 35308 > 9040 [ACK] Seq=1 Ack=1 Win=5888 Len=0 TSV=2284882 TSER=2269823
  7   0.002267     10.0.1.2 -> 10.0.1.3     TCP 9040 > 35308 [ACK] Seq=1 Ack=13 Win=14528 Len=0 TSV=2269824 TSER=2284882
103826   8.544146     10.0.1.3 -> 10.0.1.2     TCP 35308 > 9040 [FIN, ACK] Seq=13 Ack=100000002 Win=2580480 Len=0 TSV=2287018 TSER=2271905
  1   0.000000     10.0.1.3 -> 10.0.1.2     TCP 35310 > 9040 [SYN] Seq=0 Win=5840 Len=0 MSS=1460 TSV=2290094 TSER=0 WS=6
  2   0.000288     10.0.1.2 -> 10.0.1.3     TCP 9040 > 35310 [SYN, ACK] Seq=0 Ack=1 Win=14480 Len=0 MSS=1460 TSV=2275036 TSER=2290094 WS=6
  3   0.000312     10.0.1.3 -> 10.0.1.2     TCP 35310 > 9040 [ACK] Seq=1 Ack=1 Win=5888 Len=0 TSV=2290094 TSER=2275036
  7   0.002327     10.0.1.2 -> 10.0.1.3     TCP 9040 > 35310 [ACK] Seq=1 Ack=13 Win=14528 Len=0 TSV=2275037 TSER=2290094
103610   8.538860     10.0.1.3 -> 10.0.1.2     TCP 35310 > 9040 [FIN, ACK] Seq=13 Ack=100000002 Win=2580352 Len=0 TSV=2292229 TSER=2277116
  1   0.000000     10.0.1.3 -> 10.0.1.2     TCP 35312 > 9040 [SYN] Seq=0 Win=5840 Len=0 MSS=1460 TSV=2295298 TSER=0 WS=6
  2   0.000287     10.0.1.2 -> 10.0.1.3     TCP 9040 > 35312 [SYN, ACK] Seq=0 Ack=1 Win=14480 Len=0 MSS=1460 TSV=2280241 TSER=2295298 WS=6
  3   0.000309     10.0.1.3 -> 10.0.1.2     TCP 35312 > 9040 [ACK] Seq=1 Ack=1 Win=5888 Len=0 TSV=2295298 TSER=2280241
  7   0.002221     10.0.1.2 -> 10.0.1.3     TCP 9040 > 35312 [ACK] Seq=1 Ack=13 Win=14528 Len=0 TSV=2280241 TSER=2295299
103727   8.540187     10.0.1.3 -> 10.0.1.2     TCP 35312 > 9040 [FIN, ACK] Seq=13 Ack=100000002 Win=2580480 Len=0 TSV=2297433 TSER=2282321
  1   0.000000     10.0.1.3 -> 10.0.1.2     TCP 35314 > 9040 [SYN] Seq=0 Win=5840 Len=0 MSS=1460 TSV=2300511 TSER=0 WS=6
  2   0.000292     10.0.1.2 -> 10.0.1.3     TCP 9040 > 35314 [SYN, ACK] Seq=0 Ack=1 Win=14480 Len=0 MSS=1460 TSV=2285454 TSER=2300511 WS=6
  3   0.000314     10.0.1.3 -> 10.0.1.2     TCP 35314 > 9040 [ACK] Seq=1 Ack=1 Win=5888 Len=0 TSV=2300512 TSER=2285454
  7   0.002366     10.0.1.2 -> 10.0.1.3     TCP 9040 > 35314 [ACK] Seq=1 Ack=13 Win=14528 Len=0 TSV=2285455 TSER=2300512
103615   8.540811     10.0.1.3 -> 10.0.1.2     TCP 35314 > 9040 [FIN, ACK] Seq=13 Ack=100000002 Win=2580480 Len=0 TSV=2302647 TSER=2287535
