  1   0.000000     10.0.1.3 -> 10.0.1.2     TCP 44558 > 9040 [SYN] Seq=0 Win=5840 Len=0 MSS=1460 TSV=8664539 TSER=0 WS=6
  2   0.000328     10.0.1.2 -> 10.0.1.3     TCP 9040 > 44558 [SYN, ACK] Seq=0 Ack=1 Win=14480 Len=0 MSS=1460 TSV=8718433 TSER=8664539 WS=6
  3   0.000350     10.0.1.3 -> 10.0.1.2     TCP 44558 > 9040 [ACK] Seq=1 Ack=1 Win=5888 Len=0 TSV=8664539 TSER=8718433
  7   0.002281     10.0.1.2 -> 10.0.1.3     TCP 9040 > 44558 [ACK] Seq=1 Ack=13 Win=14528 Len=0 TSV=8718433 TSER=8664539
103966   8.538285     10.0.1.3 -> 10.0.1.2     TCP 44558 > 9040 [FIN, ACK] Seq=13 Ack=100000002 Win=2580480 Len=0 TSV=8666674 TSER=8720513
103967   8.538543     10.0.1.2 -> 10.0.1.3     TCP 9040 > 44558 [ACK] Seq=100000002 Ack=14 Win=14528 Len=0 TSV=8720568 TSER=8666674
================================================================================
IPv4 Conversations
Filter:<No Filter>
                                               |       <-      | |       ->      | |     Total     |
                                               | Frames  Bytes | | Frames  Bytes | | Frames  Bytes |
10.0.1.3             <-> 10.0.1.2               69066 104558364   34901   2303486  103967 106861850
================================================================================
  1   0.000000     10.0.1.3 -> 10.0.1.2     TCP 44560 > 9040 [SYN] Seq=0 Win=5840 Len=0 MSS=1460 TSV=8669185 TSER=0 WS=6
  2   0.000300     10.0.1.2 -> 10.0.1.3     TCP 9040 > 44560 [SYN, ACK] Seq=0 Ack=1 Win=14480 Len=0 MSS=1460 TSV=8723079 TSER=8669185 WS=6
  3   0.000322     10.0.1.3 -> 10.0.1.2     TCP 44560 > 9040 [ACK] Seq=1 Ack=1 Win=5888 Len=0 TSV=8669185 TSER=8723079
  7   0.002191     10.0.1.2 -> 10.0.1.3     TCP 9040 > 44560 [ACK] Seq=1 Ack=13 Win=14528 Len=0 TSV=8723080 TSER=8669186
103965   8.536427     10.0.1.3 -> 10.0.1.2     TCP 44560 > 9040 [FIN, ACK] Seq=13 Ack=100000002 Win=2580480 Len=0 TSV=8671319 TSER=8725159
103966   8.536680     10.0.1.2 -> 10.0.1.3     TCP 9040 > 44560 [ACK] Seq=100000002 Ack=14 Win=14528 Len=0 TSV=8725214 TSER=8671319
================================================================================
IPv4 Conversations
Filter:<No Filter>
                                               |       <-      | |       ->      | |     Total     |
                                               | Frames  Bytes | | Frames  Bytes | | Frames  Bytes |
10.0.1.3             <-> 10.0.1.2               69067 104558430   34899   2303354  103966 106861784
================================================================================
  1   0.000000     10.0.1.3 -> 10.0.1.2     TCP 44562 > 9040 [SYN] Seq=0 Win=5840 Len=0 MSS=1460 TSV=8673829 TSER=0 WS=6
  2   0.000275     10.0.1.2 -> 10.0.1.3     TCP 9040 > 44562 [SYN, ACK] Seq=0 Ack=1 Win=14480 Len=0 MSS=1460 TSV=8727724 TSER=8673829 WS=6
  3   0.000297     10.0.1.3 -> 10.0.1.2     TCP 44562 > 9040 [ACK] Seq=1 Ack=1 Win=5888 Len=0 TSV=8673829 TSER=8727724
  7   0.002249     10.0.1.2 -> 10.0.1.3     TCP 9040 > 44562 [ACK] Seq=1 Ack=13 Win=14528 Len=0 TSV=8727725 TSER=8673830
103950   8.537764     10.0.1.3 -> 10.0.1.2     TCP 44562 > 9040 [FIN, ACK] Seq=13 Ack=100000002 Win=2580480 Len=0 TSV=8675964 TSER=8729804
103951   8.538014     10.0.1.2 -> 10.0.1.3     TCP 9040 > 44562 [ACK] Seq=100000002 Ack=14 Win=14528 Len=0 TSV=8729859 TSER=8675964
================================================================================
IPv4 Conversations
Filter:<No Filter>
                                               |       <-      | |       ->      | |     Total     |
                                               | Frames  Bytes | | Frames  Bytes | | Frames  Bytes |
10.0.1.3             <-> 10.0.1.2               69067 104558430   34884   2302364  103951 106860794
================================================================================
  1   0.000000     10.0.1.3 -> 10.0.1.2     TCP 44565 > 9040 [SYN] Seq=0 Win=5840 Len=0 MSS=1460 TSV=8678476 TSER=0 WS=6
  2   0.000276     10.0.1.2 -> 10.0.1.3     TCP 9040 > 44565 [SYN, ACK] Seq=0 Ack=1 Win=14480 Len=0 MSS=1460 TSV=8732371 TSER=8678476 WS=6
  3   0.000294     10.0.1.3 -> 10.0.1.2     TCP 44565 > 9040 [ACK] Seq=1 Ack=1 Win=5888 Len=0 TSV=8678476 TSER=8732371
  7   0.001965     10.0.1.2 -> 10.0.1.3     TCP 9040 > 44565 [ACK] Seq=1 Ack=13 Win=14528 Len=0 TSV=8732372 TSER=8678477
103746   8.537680     10.0.1.3 -> 10.0.1.2     TCP 44565 > 9040 [FIN, ACK] Seq=13 Ack=100000002 Win=2580480 Len=0 TSV=8680611 TSER=8734451
103747   8.537915     10.0.1.2 -> 10.0.1.3     TCP 9040 > 44565 [ACK] Seq=100000002 Ack=14 Win=14528 Len=0 TSV=8734506 TSER=8680611
================================================================================
IPv4 Conversations
Filter:<No Filter>
                                               |       <-      | |       ->      | |     Total     |
                                               | Frames  Bytes | | Frames  Bytes | | Frames  Bytes |
10.0.1.3             <-> 10.0.1.2               69067 104558430   34680   2288900  103747 106847330
================================================================================
  1   0.000000     10.0.1.3 -> 10.0.1.2     TCP 44567 > 9040 [SYN] Seq=0 Win=5840 Len=0 MSS=1460 TSV=8683114 TSER=0 WS=6
  2   0.000300     10.0.1.2 -> 10.0.1.3     TCP 9040 > 44567 [SYN, ACK] Seq=0 Ack=1 Win=14480 Len=0 MSS=1460 TSV=8737009 TSER=8683114 WS=6
  3   0.000324     10.0.1.3 -> 10.0.1.2     TCP 44567 > 9040 [ACK] Seq=1 Ack=1 Win=5888 Len=0 TSV=8683114 TSER=8737009
  7   0.002207     10.0.1.2 -> 10.0.1.3     TCP 9040 > 44567 [ACK] Seq=1 Ack=13 Win=14528 Len=0 TSV=8737010 TSER=8683114
103960   8.537481     10.0.1.3 -> 10.0.1.2     TCP 44567 > 9040 [FIN, ACK] Seq=13 Ack=100000002 Win=2580480 Len=0 TSV=8685248 TSER=8739089
103961   8.537753     10.0.1.2 -> 10.0.1.3     TCP 9040 > 44567 [ACK] Seq=100000002 Ack=14 Win=14528 Len=0 TSV=8739144 TSER=8685248
================================================================================
IPv4 Conversations
Filter:<No Filter>
                                               |       <-      | |       ->      | |     Total     |
                                               | Frames  Bytes | | Frames  Bytes | | Frames  Bytes |
10.0.1.3             <-> 10.0.1.2               69066 104558364   34895   2303090  103961 106861454
================================================================================
  1   0.000000     10.0.1.3 -> 10.0.1.2     TCP 44569 > 9040 [SYN] Seq=0 Win=5840 Len=0 MSS=1460 TSV=8687758 TSER=0 WS=6
  2   0.000285     10.0.1.2 -> 10.0.1.3     TCP 9040 > 44569 [SYN, ACK] Seq=0 Ack=1 Win=14480 Len=0 MSS=1460 TSV=8741654 TSER=8687758 WS=6
  3   0.000311     10.0.1.3 -> 10.0.1.2     TCP 44569 > 9040 [ACK] Seq=1 Ack=1 Win=5888 Len=0 TSV=8687758 TSER=8741654
  7   0.002296     10.0.1.2 -> 10.0.1.3     TCP 9040 > 44569 [ACK] Seq=1 Ack=13 Win=14528 Len=0 TSV=8741655 TSER=8687759
103976   8.542695     10.0.1.3 -> 10.0.1.2     TCP 44569 > 9040 [FIN, ACK] Seq=13 Ack=100000002 Win=2580480 Len=0 TSV=8689894 TSER=8743735
103977   8.542943     10.0.1.2 -> 10.0.1.3     TCP 9040 > 44569 [ACK] Seq=100000002 Ack=14 Win=14528 Len=0 TSV=8743790 TSER=8689894
================================================================================
IPv4 Conversations
Filter:<No Filter>
                                               |       <-      | |       ->      | |     Total     |
                                               | Frames  Bytes | | Frames  Bytes | | Frames  Bytes |
10.0.1.3             <-> 10.0.1.2               69067 104558430   34910   2304080  103977 106862510
================================================================================
  1   0.000000     10.0.1.3 -> 10.0.1.2     TCP 44571 > 9040 [SYN] Seq=0 Win=5840 Len=0 MSS=1460 TSV=8692402 TSER=0 WS=6
  2   0.000297     10.0.1.2 -> 10.0.1.3     TCP 9040 > 44571 [SYN, ACK] Seq=0 Ack=1 Win=14480 Len=0 MSS=1460 TSV=8746298 TSER=8692402 WS=6
  3   0.000320     10.0.1.3 -> 10.0.1.2     TCP 44571 > 9040 [ACK] Seq=1 Ack=1 Win=5888 Len=0 TSV=8692402 TSER=8746298
  7   0.002158     10.0.1.2 -> 10.0.1.3     TCP 9040 > 44571 [ACK] Seq=1 Ack=13 Win=14528 Len=0 TSV=8746298 TSER=8692402
104027   8.538979     10.0.1.3 -> 10.0.1.2     TCP 44571 > 9040 [FIN, ACK] Seq=13 Ack=100000002 Win=2580480 Len=0 TSV=8694537 TSER=8748378
104028   8.539246     10.0.1.2 -> 10.0.1.3     TCP 9040 > 44571 [ACK] Seq=100000002 Ack=14 Win=14528 Len=0 TSV=8748433 TSER=8694537
================================================================================
IPv4 Conversations
Filter:<No Filter>
                                               |       <-      | |       ->      | |     Total     |
                                               | Frames  Bytes | | Frames  Bytes | | Frames  Bytes |
10.0.1.3             <-> 10.0.1.2               69070 104558628   34958   2307248  104028 106865876
================================================================================
  1   0.000000     10.0.1.3 -> 10.0.1.2     TCP 44573 > 9040 [SYN] Seq=0 Win=5840 Len=0 MSS=1460 TSV=8697033 TSER=0 WS=6
  2   0.000289     10.0.1.2 -> 10.0.1.3     TCP 9040 > 44573 [SYN, ACK] Seq=0 Ack=1 Win=14480 Len=0 MSS=1460 TSV=8750930 TSER=8697033 WS=6
  3   0.000321     10.0.1.3 -> 10.0.1.2     TCP 44573 > 9040 [ACK] Seq=1 Ack=1 Win=5888 Len=0 TSV=8697033 TSER=8750930
  7   0.002761     10.0.1.2 -> 10.0.1.3     TCP 9040 > 44573 [ACK] Seq=1 Ack=13 Win=14528 Len=0 TSV=8750930 TSER=8697034
103965   8.544071     10.0.1.3 -> 10.0.1.2     TCP 44573 > 9040 [FIN, ACK] Seq=13 Ack=100000002 Win=2580480 Len=0 TSV=8699169 TSER=8753011
103966   8.544318     10.0.1.2 -> 10.0.1.3     TCP 9040 > 44573 [ACK] Seq=100000002 Ack=14 Win=14528 Len=0 TSV=8753066 TSER=8699169
================================================================================
IPv4 Conversations
Filter:<No Filter>
                                               |       <-      | |       ->      | |     Total     |
                                               | Frames  Bytes | | Frames  Bytes | | Frames  Bytes |
10.0.1.3             <-> 10.0.1.2               69068 104558496   34898   2303288  103966 106861784
================================================================================
  1   0.000000     10.0.1.3 -> 10.0.1.2     TCP 37873 > 9040 [SYN] Seq=0 Win=5840 Len=0 MSS=1460 TSV=8701672 TSER=0 WS=6
  2   0.000317     10.0.1.2 -> 10.0.1.3     TCP 9040 > 37873 [SYN, ACK] Seq=0 Ack=1 Win=14480 Len=0 MSS=1460 TSV=8755569 TSER=8701672 WS=6
  3   0.000339     10.0.1.3 -> 10.0.1.2     TCP 37873 > 9040 [ACK] Seq=1 Ack=1 Win=5888 Len=0 TSV=8701672 TSER=8755569
  7   0.002213     10.0.1.2 -> 10.0.1.3     TCP 9040 > 37873 [ACK] Seq=1 Ack=13 Win=14528 Len=0 TSV=8755569 TSER=8701672
103979   8.537096     10.0.1.3 -> 10.0.1.2     TCP 37873 > 9040 [FIN, ACK] Seq=13 Ack=100000002 Win=2580480 Len=0 TSV=8703806 TSER=8757648
103980   8.537331     10.0.1.2 -> 10.0.1.3     TCP 9040 > 37873 [ACK] Seq=100000002 Ack=14 Win=14528 Len=0 TSV=8757703 TSER=8703806
================================================================================
IPv4 Conversations
Filter:<No Filter>
                                               |       <-      | |       ->      | |     Total     |
                                               | Frames  Bytes | | Frames  Bytes | | Frames  Bytes |
10.0.1.3             <-> 10.0.1.2               69068 104558496   34912   2304212  103980 106862708
================================================================================
  1   0.000000     10.0.1.3 -> 10.0.1.2     TCP 37875 > 9040 [SYN] Seq=0 Win=5840 Len=0 MSS=1460 TSV=8706316 TSER=0 WS=6
  2   0.000277     10.0.1.2 -> 10.0.1.3     TCP 9040 > 37875 [SYN, ACK] Seq=0 Ack=1 Win=14480 Len=0 MSS=1460 TSV=8760213 TSER=8706316 WS=6
  3   0.000301     10.0.1.3 -> 10.0.1.2     TCP 37875 > 9040 [ACK] Seq=1 Ack=1 Win=5888 Len=0 TSV=8706316 TSER=8760213
  7   0.002191     10.0.1.2 -> 10.0.1.3     TCP 9040 > 37875 [ACK] Seq=1 Ack=13 Win=14528 Len=0 TSV=8760214 TSER=8706316
104003   8.534721     10.0.1.3 -> 10.0.1.2     TCP 37875 > 9040 [FIN, ACK] Seq=13 Ack=100000002 Win=2580480 Len=0 TSV=8708450 TSER=8762292
104004   8.534987     10.0.1.2 -> 10.0.1.3     TCP 9040 > 37875 [ACK] Seq=100000002 Ack=14 Win=14528 Len=0 TSV=8762347 TSER=8708450
================================================================================
IPv4 Conversations
Filter:<No Filter>
                                               |       <-      | |       ->      | |     Total     |
                                               | Frames  Bytes | | Frames  Bytes | | Frames  Bytes |
10.0.1.3             <-> 10.0.1.2               69067 104558430   34937   2305862  104004 106864292
================================================================================
  1   0.000000     10.0.1.3 -> 10.0.1.2     TCP 37877 > 9040 [SYN] Seq=0 Win=5840 Len=0 MSS=1460 TSV=8710948 TSER=0 WS=6
  2   0.000291     10.0.1.2 -> 10.0.1.3     TCP 9040 > 37877 [SYN, ACK] Seq=0 Ack=1 Win=14480 Len=0 MSS=1460 TSV=8764845 TSER=8710948 WS=6
  3   0.000316     10.0.1.3 -> 10.0.1.2     TCP 37877 > 9040 [ACK] Seq=1 Ack=1 Win=5888 Len=0 TSV=8710948 TSER=8764845
  7   0.002229     10.0.1.2 -> 10.0.1.3     TCP 9040 > 37877 [ACK] Seq=1 Ack=13 Win=14528 Len=0 TSV=8764846 TSER=8710948
103996   8.536553     10.0.1.3 -> 10.0.1.2     TCP 37877 > 9040 [FIN, ACK] Seq=13 Ack=100000002 Win=2580480 Len=0 TSV=8713082 TSER=8766925
103997   8.536803     10.0.1.2 -> 10.0.1.3     TCP 9040 > 37877 [ACK] Seq=100000002 Ack=14 Win=14528 Len=0 TSV=8766980 TSER=8713082
================================================================================
IPv4 Conversations
Filter:<No Filter>
                                               |       <-      | |       ->      | |     Total     |
                                               | Frames  Bytes | | Frames  Bytes | | Frames  Bytes |
10.0.1.3             <-> 10.0.1.2               69067 104558430   34930   2305400  103997 106863830
================================================================================
  1   0.000000     10.0.1.3 -> 10.0.1.2     TCP 37879 > 9040 [SYN] Seq=0 Win=5840 Len=0 MSS=1460 TSV=8715586 TSER=0 WS=6
  2   0.000298     10.0.1.2 -> 10.0.1.3     TCP 9040 > 37879 [SYN, ACK] Seq=0 Ack=1 Win=14480 Len=0 MSS=1460 TSV=8769484 TSER=8715586 WS=6
  3   0.000320     10.0.1.3 -> 10.0.1.2     TCP 37879 > 9040 [ACK] Seq=1 Ack=1 Win=5888 Len=0 TSV=8715586 TSER=8769484
  7   0.002192     10.0.1.2 -> 10.0.1.3     TCP 9040 > 37879 [ACK] Seq=1 Ack=13 Win=14528 Len=0 TSV=8769484 TSER=8715586
103941   8.552570     10.0.1.3 -> 10.0.1.2     TCP 37879 > 9040 [FIN, ACK] Seq=13 Ack=100000002 Win=2580480 Len=0 TSV=8717724 TSER=8771567
103942   8.552819     10.0.1.2 -> 10.0.1.3     TCP 9040 > 37879 [ACK] Seq=100000002 Ack=14 Win=14528 Len=0 TSV=8771622 TSER=8717724
================================================================================
IPv4 Conversations
Filter:<No Filter>
                                               |       <-      | |       ->      | |     Total     |
                                               | Frames  Bytes | | Frames  Bytes | | Frames  Bytes |
10.0.1.3             <-> 10.0.1.2               69067 104558430   34875   2301770  103942 106860200
================================================================================
  1   0.000000     10.0.1.3 -> 10.0.1.2     TCP 37881 > 9040 [SYN] Seq=0 Win=5840 Len=0 MSS=1460 TSV=8720233 TSER=0 WS=6
  2   0.000283     10.0.1.2 -> 10.0.1.3     TCP 9040 > 37881 [SYN, ACK] Seq=0 Ack=1 Win=14480 Len=0 MSS=1460 TSV=8774131 TSER=8720233 WS=6
  3   0.000306     10.0.1.3 -> 10.0.1.2     TCP 37881 > 9040 [ACK] Seq=1 Ack=1 Win=5888 Len=0 TSV=8720233 TSER=8774131
  7   0.002344     10.0.1.2 -> 10.0.1.3     TCP 9040 > 37881 [ACK] Seq=1 Ack=13 Win=14528 Len=0 TSV=8774132 TSER=8720233
103982   8.537295     10.0.1.3 -> 10.0.1.2     TCP 37881 > 9040 [FIN, ACK] Seq=13 Ack=100000002 Win=2580480 Len=0 TSV=8722367 TSER=8776211
103983   8.537544     10.0.1.2 -> 10.0.1.3     TCP 9040 > 37881 [ACK] Seq=100000002 Ack=14 Win=14528 Len=0 TSV=8776266 TSER=8722367
================================================================================
IPv4 Conversations
Filter:<No Filter>
                                               |       <-      | |       ->      | |     Total     |
                                               | Frames  Bytes | | Frames  Bytes | | Frames  Bytes |
10.0.1.3             <-> 10.0.1.2               69066 104558364   34917   2304542  103983 106862906
================================================================================
  1   0.000000     10.0.1.3 -> 10.0.1.2     TCP 37885 > 9040 [SYN] Seq=0 Win=5840 Len=0 MSS=1460 TSV=8724880 TSER=0 WS=6
  2   0.000302     10.0.1.2 -> 10.0.1.3     TCP 9040 > 37885 [SYN, ACK] Seq=0 Ack=1 Win=14480 Len=0 MSS=1460 TSV=8778779 TSER=8724880 WS=6
  3   0.000325     10.0.1.3 -> 10.0.1.2     TCP 37885 > 9040 [ACK] Seq=1 Ack=1 Win=5888 Len=0 TSV=8724880 TSER=8778779
  7   0.002407     10.0.1.2 -> 10.0.1.3     TCP 9040 > 37885 [ACK] Seq=1 Ack=13 Win=14528 Len=0 TSV=8778779 TSER=8724881
104008   8.543425     10.0.1.3 -> 10.0.1.2     TCP 37885 > 9040 [FIN, ACK] Seq=13 Ack=100000002 Win=2574592 Len=0 TSV=8727016 TSER=8780860
104009   8.543673     10.0.1.2 -> 10.0.1.3     TCP 9040 > 37885 [ACK] Seq=100000002 Ack=14 Win=14528 Len=0 TSV=8780915 TSER=8727016
================================================================================
IPv4 Conversations
Filter:<No Filter>
                                               |       <-      | |       ->      | |     Total     |
                                               | Frames  Bytes | | Frames  Bytes | | Frames  Bytes |
10.0.1.3             <-> 10.0.1.2               69066 104558364   34943   2306258  104009 106864622
================================================================================
  1   0.000000     10.0.1.3 -> 10.0.1.2     TCP 37887 > 9040 [SYN] Seq=0 Win=5840 Len=0 MSS=1460 TSV=8729524 TSER=0 WS=6
  2   0.000310     10.0.1.2 -> 10.0.1.3     TCP 9040 > 37887 [SYN, ACK] Seq=0 Ack=1 Win=14480 Len=0 MSS=1460 TSV=8783423 TSER=8729524 WS=6
  3   0.000331     10.0.1.3 -> 10.0.1.2     TCP 37887 > 9040 [ACK] Seq=1 Ack=1 Win=5888 Len=0 TSV=8729524 TSER=8783423
  7   0.002205     10.0.1.2 -> 10.0.1.3     TCP 9040 > 37887 [ACK] Seq=1 Ack=13 Win=14528 Len=0 TSV=8783423 TSER=8729524
103955   8.542066     10.0.1.3 -> 10.0.1.2     TCP 37887 > 9040 [FIN, ACK] Seq=13 Ack=100000002 Win=2580480 Len=0 TSV=8731659 TSER=8785503
103956   8.542318     10.0.1.2 -> 10.0.1.3     TCP 9040 > 37887 [ACK] Seq=100000002 Ack=14 Win=14528 Len=0 TSV=8785558 TSER=8731659
================================================================================
IPv4 Conversations
Filter:<No Filter>
                                               |       <-      | |       ->      | |     Total     |
                                               | Frames  Bytes | | Frames  Bytes | | Frames  Bytes |
10.0.1.3             <-> 10.0.1.2               69067 104558430   34889   2302694  103956 106861124
================================================================================
  1   0.000000     10.0.1.3 -> 10.0.1.2     TCP 37889 > 9040 [SYN] Seq=0 Win=5840 Len=0 MSS=1460 TSV=8734171 TSER=0 WS=6
  2   0.000296     10.0.1.2 -> 10.0.1.3     TCP 9040 > 37889 [SYN, ACK] Seq=0 Ack=1 Win=14480 Len=0 MSS=1460 TSV=8788071 TSER=8734171 WS=6
  3   0.000325     10.0.1.3 -> 10.0.1.2     TCP 37889 > 9040 [ACK] Seq=1 Ack=1 Win=5888 Len=0 TSV=8734171 TSER=8788071
  7   0.002255     10.0.1.2 -> 10.0.1.3     TCP 9040 > 37889 [ACK] Seq=1 Ack=13 Win=14528 Len=0 TSV=8788071 TSER=8734172
103938   8.541265     10.0.1.3 -> 10.0.1.2     TCP 37889 > 9040 [FIN, ACK] Seq=13 Ack=100000002 Win=2580480 Len=0 TSV=8736307 TSER=8790151
103939   8.541514     10.0.1.2 -> 10.0.1.3     TCP 9040 > 37889 [ACK] Seq=100000002 Ack=14 Win=14528 Len=0 TSV=8790206 TSER=8736307
================================================================================
IPv4 Conversations
Filter:<No Filter>
                                               |       <-      | |       ->      | |     Total     |
                                               | Frames  Bytes | | Frames  Bytes | | Frames  Bytes |
10.0.1.3             <-> 10.0.1.2               69066 104558364   34873   2301638  103939 106860002
================================================================================
  1   0.000000     10.0.1.3 -> 10.0.1.2     TCP 37891 > 9040 [SYN] Seq=0 Win=5840 Len=0 MSS=1460 TSV=8738824 TSER=0 WS=6
  2   0.000304     10.0.1.2 -> 10.0.1.3     TCP 9040 > 37891 [SYN, ACK] Seq=0 Ack=1 Win=14480 Len=0 MSS=1460 TSV=8792723 TSER=8738824 WS=6
  3   0.000328     10.0.1.3 -> 10.0.1.2     TCP 37891 > 9040 [ACK] Seq=1 Ack=1 Win=5888 Len=0 TSV=8738824 TSER=8792723
  7   0.002277     10.0.1.2 -> 10.0.1.3     TCP 9040 > 37891 [ACK] Seq=1 Ack=13 Win=14528 Len=0 TSV=8792724 TSER=8738824
103991   8.537829     10.0.1.3 -> 10.0.1.2     TCP 37891 > 9040 [FIN, ACK] Seq=13 Ack=100000002 Win=2580480 Len=0 TSV=8740958 TSER=8794803
103992   8.538084     10.0.1.2 -> 10.0.1.3     TCP 9040 > 37891 [ACK] Seq=100000002 Ack=14 Win=14528 Len=0 TSV=8794858 TSER=8740958
================================================================================
IPv4 Conversations
Filter:<No Filter>
                                               |       <-      | |       ->      | |     Total     |
                                               | Frames  Bytes | | Frames  Bytes | | Frames  Bytes |
10.0.1.3             <-> 10.0.1.2               69066 104558364   34926   2305136  103992 106863500
================================================================================
  1   0.000000     10.0.1.3 -> 10.0.1.2     TCP 37893 > 9040 [SYN] Seq=0 Win=5840 Len=0 MSS=1460 TSV=8743465 TSER=0 WS=6
  2   0.000271     10.0.1.2 -> 10.0.1.3     TCP 9040 > 37893 [SYN, ACK] Seq=0 Ack=1 Win=14480 Len=0 MSS=1460 TSV=8797365 TSER=8743465 WS=6
  3   0.000294     10.0.1.3 -> 10.0.1.2     TCP 37893 > 9040 [ACK] Seq=1 Ack=1 Win=5888 Len=0 TSV=8743465 TSER=8797365
  7   0.002177     10.0.1.2 -> 10.0.1.3     TCP 9040 > 37893 [ACK] Seq=1 Ack=13 Win=14528 Len=0 TSV=8797366 TSER=8743465
103966   8.535952     10.0.1.3 -> 10.0.1.2     TCP 37893 > 9040 [FIN, ACK] Seq=13 Ack=100000002 Win=2580480 Len=0 TSV=8745599 TSER=8799444
103967   8.536206     10.0.1.2 -> 10.0.1.3     TCP 9040 > 37893 [ACK] Seq=100000002 Ack=14 Win=14528 Len=0 TSV=8799499 TSER=8745599
================================================================================
IPv4 Conversations
Filter:<No Filter>
                                               |       <-      | |       ->      | |     Total     |
                                               | Frames  Bytes | | Frames  Bytes | | Frames  Bytes |
10.0.1.3             <-> 10.0.1.2               69066 104558364   34901   2303486  103967 106861850
================================================================================
  1   0.000000     10.0.1.3 -> 10.0.1.2     TCP 37895 > 9040 [SYN] Seq=0 Win=5840 Len=0 MSS=1460 TSV=8748101 TSER=0 WS=6
  2   0.000273     10.0.1.2 -> 10.0.1.3     TCP 9040 > 37895 [SYN, ACK] Seq=0 Ack=1 Win=14480 Len=0 MSS=1460 TSV=8802001 TSER=8748101 WS=6
  3   0.000298     10.0.1.3 -> 10.0.1.2     TCP 37895 > 9040 [ACK] Seq=1 Ack=1 Win=5888 Len=0 TSV=8748101 TSER=8802001
  7   0.002301     10.0.1.2 -> 10.0.1.3     TCP 9040 > 37895 [ACK] Seq=1 Ack=13 Win=14528 Len=0 TSV=8802002 TSER=8748102
103994   8.539159     10.0.1.3 -> 10.0.1.2     TCP 37895 > 9040 [FIN, ACK] Seq=13 Ack=100000002 Win=2580480 Len=0 TSV=8750236 TSER=8804081
103995   8.539391     10.0.1.2 -> 10.0.1.3     TCP 9040 > 37895 [ACK] Seq=100000002 Ack=14 Win=14528 Len=0 TSV=8804136 TSER=8750236
================================================================================
IPv4 Conversations
Filter:<No Filter>
                                               |       <-      | |       ->      | |     Total     |
                                               | Frames  Bytes | | Frames  Bytes | | Frames  Bytes |
10.0.1.3             <-> 10.0.1.2               69068 104558496   34927   2305202  103995 106863698
================================================================================
  1   0.000000     10.0.1.3 -> 10.0.1.2     TCP 37897 > 9040 [SYN] Seq=0 Win=5840 Len=0 MSS=1460 TSV=8752747 TSER=0 WS=6
  2   0.000317     10.0.1.2 -> 10.0.1.3     TCP 9040 > 37897 [SYN, ACK] Seq=0 Ack=1 Win=14480 Len=0 MSS=1460 TSV=8806648 TSER=8752747 WS=6
  3   0.000341     10.0.1.3 -> 10.0.1.2     TCP 37897 > 9040 [ACK] Seq=1 Ack=1 Win=5888 Len=0 TSV=8752747 TSER=8806648
  7   0.002198     10.0.1.2 -> 10.0.1.3     TCP 9040 > 37897 [ACK] Seq=1 Ack=13 Win=14528 Len=0 TSV=8806649 TSER=8752748
104001   8.538486     10.0.1.3 -> 10.0.1.2     TCP 37897 > 9040 [FIN, ACK] Seq=13 Ack=100000002 Win=2557184 Len=0 TSV=8754882 TSER=8808728
104002   8.538740     10.0.1.2 -> 10.0.1.3     TCP 9040 > 37897 [ACK] Seq=100000002 Ack=14 Win=14528 Len=0 TSV=8808783 TSER=8754882
================================================================================
IPv4 Conversations
Filter:<No Filter>
                                               |       <-      | |       ->      | |     Total     |
                                               | Frames  Bytes | | Frames  Bytes | | Frames  Bytes |
10.0.1.3             <-> 10.0.1.2               69066 104558364   34936   2305796  104002 106864160
================================================================================
