  1   0.000000     10.0.1.3 -> 10.0.1.2     TCP 42347 > 9040 [SYN] Seq=0 Win=5840 Len=0 MSS=1460 TSV=9808194 TSER=0 WS=6
  2   0.000304     10.0.1.2 -> 10.0.1.3     TCP 9040 > 42347 [SYN, ACK] Seq=0 Ack=1 Win=14480 Len=0 MSS=1460 TSV=9862174 TSER=9808194 WS=6
  3   0.000327     10.0.1.3 -> 10.0.1.2     TCP 42347 > 9040 [ACK] Seq=1 Ack=1 Win=5888 Len=0 TSV=9808194 TSER=9862174
  7   0.002203     10.0.1.2 -> 10.0.1.3     TCP 9040 > 42347 [ACK] Seq=1 Ack=13 Win=14528 Len=0 TSV=9862175 TSER=9808194
259272  21.317386     10.0.1.3 -> 10.0.1.2     TCP 42347 > 9040 [FIN, ACK] Seq=13 Ack=250000002 Win=2580480 Len=0 TSV=9813523 TSER=9867449
259273  21.317638     10.0.1.2 -> 10.0.1.3     TCP 9040 > 42347 [ACK] Seq=250000002 Ack=14 Win=14528 Len=0 TSV=9867504 TSER=9813523
================================================================================
IPv4 Conversations
Filter:<No Filter>
                                               |       <-      | |       ->      | |     Total     |
                                               | Frames  Bytes | | Frames  Bytes | | Frames  Bytes |
10.0.1.3             <-> 10.0.1.2              172660 261395568   86613   5716478  259273 267112046
================================================================================
  1   0.000000     10.0.1.3 -> 10.0.1.2     TCP 42349 > 9040 [SYN] Seq=0 Win=5840 Len=0 MSS=1460 TSV=9816272 TSER=0 WS=6
  2   0.000319     10.0.1.2 -> 10.0.1.3     TCP 9040 > 42349 [SYN, ACK] Seq=0 Ack=1 Win=14480 Len=0 MSS=1460 TSV=9870253 TSER=9816272 WS=6
  3   0.000342     10.0.1.3 -> 10.0.1.2     TCP 42349 > 9040 [ACK] Seq=1 Ack=1 Win=5888 Len=0 TSV=9816272 TSER=9870253
  7   0.002243     10.0.1.2 -> 10.0.1.3     TCP 9040 > 42349 [ACK] Seq=1 Ack=13 Win=14528 Len=0 TSV=9870254 TSER=9816272
259234  21.308720     10.0.1.3 -> 10.0.1.2     TCP 42349 > 9040 [FIN, ACK] Seq=13 Ack=250000002 Win=2580480 Len=0 TSV=9821599 TSER=9875526
259235  21.308973     10.0.1.2 -> 10.0.1.3     TCP 9040 > 42349 [ACK] Seq=250000002 Ack=14 Win=14528 Len=0 TSV=9875581 TSER=9821599
================================================================================
IPv4 Conversations
Filter:<No Filter>
                                               |       <-      | |       ->      | |     Total     |
                                               | Frames  Bytes | | Frames  Bytes | | Frames  Bytes |
10.0.1.3             <-> 10.0.1.2              172659 261395502   86576   5714036  259235 267109538
================================================================================
  1   0.000000     10.0.1.3 -> 10.0.1.2     TCP 42351 > 9040 [SYN] Seq=0 Win=5840 Len=0 MSS=1460 TSV=9824365 TSER=0 WS=6
  2   0.000317     10.0.1.2 -> 10.0.1.3     TCP 9040 > 42351 [SYN, ACK] Seq=0 Ack=1 Win=14480 Len=0 MSS=1460 TSV=9878347 TSER=9824365 WS=6
  3   0.000338     10.0.1.3 -> 10.0.1.2     TCP 42351 > 9040 [ACK] Seq=1 Ack=1 Win=5888 Len=0 TSV=9824365 TSER=9878347
  7   0.002263     10.0.1.2 -> 10.0.1.3     TCP 9040 > 42351 [ACK] Seq=1 Ack=13 Win=14528 Len=0 TSV=9878347 TSER=9824366
259332  21.316262     10.0.1.3 -> 10.0.1.2     TCP 42351 > 9040 [FIN, ACK] Seq=13 Ack=250000002 Win=2580480 Len=0 TSV=9829694 TSER=9883621
259333  21.316516     10.0.1.2 -> 10.0.1.3     TCP 9040 > 42351 [ACK] Seq=250000002 Ack=14 Win=14528 Len=0 TSV=9883676 TSER=9829694
================================================================================
IPv4 Conversations
Filter:<No Filter>
                                               |       <-      | |       ->      | |     Total     |
                                               | Frames  Bytes | | Frames  Bytes | | Frames  Bytes |
10.0.1.3             <-> 10.0.1.2              172663 261395766   86670   5720240  259333 267116006
================================================================================
  1   0.000000     10.0.1.3 -> 10.0.1.2     TCP 60768 > 9040 [SYN] Seq=0 Win=5840 Len=0 MSS=1460 TSV=9832434 TSER=0 WS=6
  2   0.000336     10.0.1.2 -> 10.0.1.3     TCP 9040 > 60768 [SYN, ACK] Seq=0 Ack=1 Win=14480 Len=0 MSS=1460 TSV=9886416 TSER=9832434 WS=6
  3   0.000358     10.0.1.3 -> 10.0.1.2     TCP 60768 > 9040 [ACK] Seq=1 Ack=1 Win=5888 Len=0 TSV=9832434 TSER=9886416
  7   0.002218     10.0.1.2 -> 10.0.1.3     TCP 9040 > 60768 [ACK] Seq=1 Ack=13 Win=14528 Len=0 TSV=9886416 TSER=9832434
259266  21.310167     10.0.1.3 -> 10.0.1.2     TCP 60768 > 9040 [FIN, ACK] Seq=13 Ack=250000002 Win=2580480 Len=0 TSV=9837761 TSER=9891689
259267  21.310416     10.0.1.2 -> 10.0.1.3     TCP 9040 > 60768 [ACK] Seq=250000002 Ack=14 Win=14528 Len=0 TSV=9891744 TSER=9837761
================================================================================
IPv4 Conversations
Filter:<No Filter>
                                               |       <-      | |       ->      | |     Total     |
                                               | Frames  Bytes | | Frames  Bytes | | Frames  Bytes |
10.0.1.3             <-> 10.0.1.2              172661 261395634   86606   5716016  259267 267111650
================================================================================
  1   0.000000     10.0.1.3 -> 10.0.1.2     TCP 60770 > 9040 [SYN] Seq=0 Win=5840 Len=0 MSS=1460 TSV=9840517 TSER=0 WS=6
  2   0.000316     10.0.1.2 -> 10.0.1.3     TCP 9040 > 60770 [SYN, ACK] Seq=0 Ack=1 Win=14480 Len=0 MSS=1460 TSV=9894500 TSER=9840517 WS=6
  3   0.000337     10.0.1.3 -> 10.0.1.2     TCP 60770 > 9040 [ACK] Seq=1 Ack=1 Win=5888 Len=0 TSV=9840517 TSER=9894500
  7   0.002279     10.0.1.2 -> 10.0.1.3     TCP 9040 > 60770 [ACK] Seq=1 Ack=13 Win=14528 Len=0 TSV=9894500 TSER=9840517
259260  21.311991     10.0.1.3 -> 10.0.1.2     TCP 60770 > 9040 [FIN, ACK] Seq=13 Ack=250000002 Win=2580480 Len=0 TSV=9845845 TSER=9899773
259261  21.312243     10.0.1.2 -> 10.0.1.3     TCP 9040 > 60770 [ACK] Seq=250000002 Ack=14 Win=14528 Len=0 TSV=9899828 TSER=9845845
================================================================================
IPv4 Conversations
Filter:<No Filter>
                                               |       <-      | |       ->      | |     Total     |
                                               | Frames  Bytes | | Frames  Bytes | | Frames  Bytes |
10.0.1.3             <-> 10.0.1.2              172660 261395568   86601   5715686  259261 267111254
================================================================================
  1   0.000000     10.0.1.3 -> 10.0.1.2     TCP 60772 > 9040 [SYN] Seq=0 Win=5840 Len=0 MSS=1460 TSV=9848608 TSER=0 WS=6
  2   0.000315     10.0.1.2 -> 10.0.1.3     TCP 9040 > 60772 [SYN, ACK] Seq=0 Ack=1 Win=14480 Len=0 MSS=1460 TSV=9902591 TSER=9848608 WS=6
  3   0.000336     10.0.1.3 -> 10.0.1.2     TCP 60772 > 9040 [ACK] Seq=1 Ack=1 Win=5888 Len=0 TSV=9848608 TSER=9902591
  7   0.002270     10.0.1.2 -> 10.0.1.3     TCP 9040 > 60772 [ACK] Seq=1 Ack=13 Win=14528 Len=0 TSV=9902592 TSER=9848608
259233  21.315821     10.0.1.3 -> 10.0.1.2     TCP 60772 > 9040 [FIN, ACK] Seq=13 Ack=250000002 Win=2580480 Len=0 TSV=9853937 TSER=9907866
259234  21.316064     10.0.1.2 -> 10.0.1.3     TCP 9040 > 60772 [ACK] Seq=250000002 Ack=14 Win=14528 Len=0 TSV=9907921 TSER=9853937
================================================================================
IPv4 Conversations
Filter:<No Filter>
                                               |       <-      | |       ->      | |     Total     |
                                               | Frames  Bytes | | Frames  Bytes | | Frames  Bytes |
10.0.1.3             <-> 10.0.1.2              172660 261395568   86574   5713904  259234 267109472
================================================================================
  1   0.000000     10.0.1.3 -> 10.0.1.2     TCP 60776 > 9040 [SYN] Seq=0 Win=5840 Len=0 MSS=1460 TSV=9856695 TSER=0 WS=6
  2   0.000306     10.0.1.2 -> 10.0.1.3     TCP 9040 > 60776 [SYN, ACK] Seq=0 Ack=1 Win=14480 Len=0 MSS=1460 TSV=9910679 TSER=9856695 WS=6
  3   0.000336     10.0.1.3 -> 10.0.1.2     TCP 60776 > 9040 [ACK] Seq=1 Ack=1 Win=5888 Len=0 TSV=9856695 TSER=9910679
  7   0.003180     10.0.1.2 -> 10.0.1.3     TCP 9040 > 60776 [ACK] Seq=1 Ack=13 Win=14528 Len=0 TSV=9910680 TSER=9856696
259296  21.314834     10.0.1.3 -> 10.0.1.2     TCP 60776 > 9040 [FIN, ACK] Seq=13 Ack=250000002 Win=2580480 Len=0 TSV=9862024 TSER=9915953
259297  21.315082     10.0.1.2 -> 10.0.1.3     TCP 9040 > 60776 [ACK] Seq=250000002 Ack=14 Win=14528 Len=0 TSV=9916008 TSER=9862024
================================================================================
IPv4 Conversations
Filter:<No Filter>
                                               |       <-      | |       ->      | |     Total     |
                                               | Frames  Bytes | | Frames  Bytes | | Frames  Bytes |
10.0.1.3             <-> 10.0.1.2              172661 261395634   86636   5717996  259297 267113630
================================================================================
  1   0.000000     10.0.1.3 -> 10.0.1.2     TCP 60778 > 9040 [SYN] Seq=0 Win=5840 Len=0 MSS=1460 TSV=9864779 TSER=0 WS=6
  2   0.000299     10.0.1.2 -> 10.0.1.3     TCP 9040 > 60778 [SYN, ACK] Seq=0 Ack=1 Win=14480 Len=0 MSS=1460 TSV=9918764 TSER=9864779 WS=6
  3   0.000323     10.0.1.3 -> 10.0.1.2     TCP 60778 > 9040 [ACK] Seq=1 Ack=1 Win=5888 Len=0 TSV=9864779 TSER=9918764
  7   0.003215     10.0.1.2 -> 10.0.1.3     TCP 9040 > 60778 [ACK] Seq=1 Ack=13 Win=14528 Len=0 TSV=9918765 TSER=9864780
259310  21.311121     10.0.1.3 -> 10.0.1.2     TCP 60778 > 9040 [FIN, ACK] Seq=13 Ack=250000002 Win=2580480 Len=0 TSV=9870107 TSER=9924037
259311  21.311374     10.0.1.2 -> 10.0.1.3     TCP 9040 > 60778 [ACK] Seq=250000002 Ack=14 Win=14528 Len=0 TSV=9924092 TSER=9870107
================================================================================
IPv4 Conversations
Filter:<No Filter>
                                               |       <-      | |       ->      | |     Total     |
                                               | Frames  Bytes | | Frames  Bytes | | Frames  Bytes |
10.0.1.3             <-> 10.0.1.2              172660 261395568   86651   5718986  259311 267114554
================================================================================
  1   0.000000     10.0.1.3 -> 10.0.1.2     TCP 60780 > 9040 [SYN] Seq=0 Win=5840 Len=0 MSS=1460 TSV=9872881 TSER=0 WS=6
  2   0.000295     10.0.1.2 -> 10.0.1.3     TCP 9040 > 60780 [SYN, ACK] Seq=0 Ack=1 Win=14480 Len=0 MSS=1460 TSV=9926866 TSER=9872881 WS=6
  3   0.000317     10.0.1.3 -> 10.0.1.2     TCP 60780 > 9040 [ACK] Seq=1 Ack=1 Win=5888 Len=0 TSV=9872881 TSER=9926866
  7   0.002265     10.0.1.2 -> 10.0.1.3     TCP 9040 > 60780 [ACK] Seq=1 Ack=13 Win=14528 Len=0 TSV=9926867 TSER=9872882
259413  21.307164     10.0.1.3 -> 10.0.1.2     TCP 60780 > 9040 [FIN, ACK] Seq=13 Ack=250000002 Win=2557184 Len=0 TSV=9878208 TSER=9932139
259414  21.307416     10.0.1.2 -> 10.0.1.3     TCP 9040 > 60780 [ACK] Seq=250000002 Ack=14 Win=14528 Len=0 TSV=9932194 TSER=9878208
================================================================================
IPv4 Conversations
Filter:<No Filter>
                                               |       <-      | |       ->      | |     Total     |
                                               | Frames  Bytes | | Frames  Bytes | | Frames  Bytes |
10.0.1.3             <-> 10.0.1.2              172658 261395436   86756   5725916  259414 267121352
================================================================================
  1   0.000000     10.0.1.3 -> 10.0.1.2     TCP 60782 > 9040 [SYN] Seq=0 Win=5840 Len=0 MSS=1460 TSV=9880959 TSER=0 WS=6
  2   0.000320     10.0.1.2 -> 10.0.1.3     TCP 9040 > 60782 [SYN, ACK] Seq=0 Ack=1 Win=14480 Len=0 MSS=1460 TSV=9934945 TSER=9880959 WS=6
  3   0.000342     10.0.1.3 -> 10.0.1.2     TCP 60782 > 9040 [ACK] Seq=1 Ack=1 Win=5888 Len=0 TSV=9880959 TSER=9934945
  7   0.002245     10.0.1.2 -> 10.0.1.3     TCP 9040 > 60782 [ACK] Seq=1 Ack=13 Win=14528 Len=0 TSV=9934946 TSER=9880960
259251  21.308953     10.0.1.3 -> 10.0.1.2     TCP 60782 > 9040 [FIN, ACK] Seq=13 Ack=250000002 Win=2580480 Len=0 TSV=9886286 TSER=9940218
259252  21.309202     10.0.1.2 -> 10.0.1.3     TCP 9040 > 60782 [ACK] Seq=250000002 Ack=14 Win=14528 Len=0 TSV=9940273 TSER=9886286
================================================================================
IPv4 Conversations
Filter:<No Filter>
                                               |       <-      | |       ->      | |     Total     |
                                               | Frames  Bytes | | Frames  Bytes | | Frames  Bytes |
10.0.1.3             <-> 10.0.1.2              172661 261395634   86591   5715026  259252 267110660
================================================================================
  1   0.000000     10.0.1.3 -> 10.0.1.2     TCP 60784 > 9040 [SYN] Seq=0 Win=5840 Len=0 MSS=1460 TSV=9889042 TSER=0 WS=6
  2   0.000282     10.0.1.2 -> 10.0.1.3     TCP 9040 > 60784 [SYN, ACK] Seq=0 Ack=1 Win=14480 Len=0 MSS=1460 TSV=9943028 TSER=9889042 WS=6
  3   0.000306     10.0.1.3 -> 10.0.1.2     TCP 60784 > 9040 [ACK] Seq=1 Ack=1 Win=5888 Len=0 TSV=9889042 TSER=9943028
  7   0.002143     10.0.1.2 -> 10.0.1.3     TCP 9040 > 60784 [ACK] Seq=1 Ack=13 Win=14528 Len=0 TSV=9943029 TSER=9889042
259309  21.304284     10.0.1.3 -> 10.0.1.2     TCP 60784 > 9040 [FIN, ACK] Seq=13 Ack=250000002 Win=2580480 Len=0 TSV=9894368 TSER=9948300
259310  21.304534     10.0.1.2 -> 10.0.1.3     TCP 9040 > 60784 [ACK] Seq=250000002 Ack=14 Win=14528 Len=0 TSV=9948355 TSER=9894368
================================================================================
IPv4 Conversations
Filter:<No Filter>
                                               |       <-      | |       ->      | |     Total     |
                                               | Frames  Bytes | | Frames  Bytes | | Frames  Bytes |
10.0.1.3             <-> 10.0.1.2              172663 261395766   86647   5718722  259310 267114488
================================================================================
  1   0.000000     10.0.1.3 -> 10.0.1.2     TCP 60786 > 9040 [SYN] Seq=0 Win=5840 Len=0 MSS=1460 TSV=9897127 TSER=0 WS=6
  2   0.000318     10.0.1.2 -> 10.0.1.3     TCP 9040 > 60786 [SYN, ACK] Seq=0 Ack=1 Win=14480 Len=0 MSS=1460 TSV=9951114 TSER=9897127 WS=6
  3   0.000341     10.0.1.3 -> 10.0.1.2     TCP 60786 > 9040 [ACK] Seq=1 Ack=1 Win=5888 Len=0 TSV=9897127 TSER=9951114
  7   0.002289     10.0.1.2 -> 10.0.1.3     TCP 9040 > 60786 [ACK] Seq=1 Ack=13 Win=14528 Len=0 TSV=9951115 TSER=9897127
259291  21.307659     10.0.1.3 -> 10.0.1.2     TCP 60786 > 9040 [FIN, ACK] Seq=13 Ack=250000002 Win=2574592 Len=0 TSV=9902454 TSER=9956387
259292  21.307913     10.0.1.2 -> 10.0.1.3     TCP 9040 > 60786 [ACK] Seq=250000002 Ack=14 Win=14528 Len=0 TSV=9956442 TSER=9902454
================================================================================
IPv4 Conversations
Filter:<No Filter>
                                               |       <-      | |       ->      | |     Total     |
                                               | Frames  Bytes | | Frames  Bytes | | Frames  Bytes |
10.0.1.3             <-> 10.0.1.2              172659 261395502   86633   5717798  259292 267113300
================================================================================
  1   0.000000     10.0.1.3 -> 10.0.1.2     TCP 56781 > 9040 [SYN] Seq=0 Win=5840 Len=0 MSS=1460 TSV=9905229 TSER=0 WS=6
  2   0.000272     10.0.1.2 -> 10.0.1.3     TCP 9040 > 56781 [SYN, ACK] Seq=0 Ack=1 Win=14480 Len=0 MSS=1460 TSV=9959217 TSER=9905229 WS=6
  3   0.000294     10.0.1.3 -> 10.0.1.2     TCP 56781 > 9040 [ACK] Seq=1 Ack=1 Win=5888 Len=0 TSV=9905229 TSER=9959217
  7   0.002184     10.0.1.2 -> 10.0.1.3     TCP 9040 > 56781 [ACK] Seq=1 Ack=13 Win=14528 Len=0 TSV=9959217 TSER=9905229
259242  21.309873     10.0.1.3 -> 10.0.1.2     TCP 56781 > 9040 [FIN, ACK] Seq=13 Ack=250000002 Win=2580480 Len=0 TSV=9910556 TSER=9964490
259243  21.310120     10.0.1.2 -> 10.0.1.3     TCP 9040 > 56781 [ACK] Seq=250000002 Ack=14 Win=14528 Len=0 TSV=9964545 TSER=9910556
================================================================================
IPv4 Conversations
Filter:<No Filter>
                                               |       <-      | |       ->      | |     Total     |
                                               | Frames  Bytes | | Frames  Bytes | | Frames  Bytes |
10.0.1.3             <-> 10.0.1.2              172660 261395568   86583   5714498  259243 267110066
================================================================================
  1   0.000000     10.0.1.3 -> 10.0.1.2     TCP 56783 > 9040 [SYN] Seq=0 Win=5840 Len=0 MSS=1460 TSV=9913297 TSER=0 WS=6
  2   0.000318     10.0.1.2 -> 10.0.1.3     TCP 9040 > 56783 [SYN, ACK] Seq=0 Ack=1 Win=14480 Len=0 MSS=1460 TSV=9967286 TSER=9913297 WS=6
  3   0.000342     10.0.1.3 -> 10.0.1.2     TCP 56783 > 9040 [ACK] Seq=1 Ack=1 Win=5888 Len=0 TSV=9913297 TSER=9967286
  7   0.002265     10.0.1.2 -> 10.0.1.3     TCP 9040 > 56783 [ACK] Seq=1 Ack=13 Win=14528 Len=0 TSV=9967286 TSER=9913298
259260  21.339606     10.0.1.3 -> 10.0.1.2     TCP 56783 > 9040 [FIN, ACK] Seq=13 Ack=250000002 Win=2580480 Len=0 TSV=9918632 TSER=9972566
259261  21.339863     10.0.1.2 -> 10.0.1.3     TCP 9040 > 56783 [ACK] Seq=250000002 Ack=14 Win=14528 Len=0 TSV=9972621 TSER=9918632
================================================================================
IPv4 Conversations
Filter:<No Filter>
                                               |       <-      | |       ->      | |     Total     |
                                               | Frames  Bytes | | Frames  Bytes | | Frames  Bytes |
10.0.1.3             <-> 10.0.1.2              172661 261395634   86600   5715620  259261 267111254
================================================================================
  1   0.000000     10.0.1.3 -> 10.0.1.2     TCP 56785 > 9040 [SYN] Seq=0 Win=5840 Len=0 MSS=1460 TSV=9921388 TSER=0 WS=6
  2   0.000319     10.0.1.2 -> 10.0.1.3     TCP 9040 > 56785 [SYN, ACK] Seq=0 Ack=1 Win=14480 Len=0 MSS=1460 TSV=9975377 TSER=9921388 WS=6
  3   0.000342     10.0.1.3 -> 10.0.1.2     TCP 56785 > 9040 [ACK] Seq=1 Ack=1 Win=5888 Len=0 TSV=9921388 TSER=9975377
  7   0.002254     10.0.1.2 -> 10.0.1.3     TCP 9040 > 56785 [ACK] Seq=1 Ack=13 Win=14528 Len=0 TSV=9975378 TSER=9921388
259302  21.307194     10.0.1.3 -> 10.0.1.2     TCP 56785 > 9040 [FIN, ACK] Seq=13 Ack=250000002 Win=2580480 Len=0 TSV=9926715 TSER=9980650
259303  21.307439     10.0.1.2 -> 10.0.1.3     TCP 9040 > 56785 [ACK] Seq=250000002 Ack=14 Win=14528 Len=0 TSV=9980704 TSER=9926715
================================================================================
IPv4 Conversations
Filter:<No Filter>
                                               |       <-      | |       ->      | |     Total     |
                                               | Frames  Bytes | | Frames  Bytes | | Frames  Bytes |
10.0.1.3             <-> 10.0.1.2              172662 261395700   86641   5718326  259303 267114026
================================================================================
  1   0.000000     10.0.1.3 -> 10.0.1.2     TCP 56789 > 9040 [SYN] Seq=0 Win=5840 Len=0 MSS=1460 TSV=9929488 TSER=0 WS=6
  2   0.000301     10.0.1.2 -> 10.0.1.3     TCP 9040 > 56789 [SYN, ACK] Seq=0 Ack=1 Win=14480 Len=0 MSS=1460 TSV=9983478 TSER=9929488 WS=6
  3   0.000327     10.0.1.3 -> 10.0.1.2     TCP 56789 > 9040 [ACK] Seq=1 Ack=1 Win=5888 Len=0 TSV=9929488 TSER=9983478
  7   0.002225     10.0.1.2 -> 10.0.1.3     TCP 9040 > 56789 [ACK] Seq=1 Ack=13 Win=14528 Len=0 TSV=9983478 TSER=9929488
259291  21.309395     10.0.1.3 -> 10.0.1.2     TCP 56789 > 9040 [FIN, ACK] Seq=13 Ack=250000002 Win=2580480 Len=0 TSV=9934816 TSER=9988750
259292  21.309640     10.0.1.2 -> 10.0.1.3     TCP 9040 > 56789 [ACK] Seq=250000002 Ack=14 Win=14528 Len=0 TSV=9988806 TSER=9934816
================================================================================
IPv4 Conversations
Filter:<No Filter>
                                               |       <-      | |       ->      | |     Total     |
                                               | Frames  Bytes | | Frames  Bytes | | Frames  Bytes |
10.0.1.3             <-> 10.0.1.2              172659 261395502   86633   5717798  259292 267113300
================================================================================
  1   0.000000     10.0.1.3 -> 10.0.1.2     TCP 56791 > 9040 [SYN] Seq=0 Win=5840 Len=0 MSS=1460 TSV=9937567 TSER=0 WS=6
  2   0.000272     10.0.1.2 -> 10.0.1.3     TCP 9040 > 56791 [SYN, ACK] Seq=0 Ack=1 Win=14480 Len=0 MSS=1460 TSV=9991558 TSER=9937567 WS=6
  3   0.000294     10.0.1.3 -> 10.0.1.2     TCP 56791 > 9040 [ACK] Seq=1 Ack=1 Win=5888 Len=0 TSV=9937567 TSER=9991558
  7   0.002174     10.0.1.2 -> 10.0.1.3     TCP 9040 > 56791 [ACK] Seq=1 Ack=13 Win=14528 Len=0 TSV=9991558 TSER=9937568
259241  21.308239     10.0.1.3 -> 10.0.1.2     TCP 56791 > 9040 [FIN, ACK] Seq=13 Ack=250000002 Win=2580480 Len=0 TSV=9942894 TSER=9996830
259242  21.308492     10.0.1.2 -> 10.0.1.3     TCP 9040 > 56791 [ACK] Seq=250000002 Ack=14 Win=14528 Len=0 TSV=9996885 TSER=9942894
================================================================================
IPv4 Conversations
Filter:<No Filter>
                                               |       <-      | |       ->      | |     Total     |
                                               | Frames  Bytes | | Frames  Bytes | | Frames  Bytes |
10.0.1.3             <-> 10.0.1.2              172661 261395634   86581   5714366  259242 267110000
================================================================================
  1   0.000000     10.0.1.3 -> 10.0.1.2     TCP 56793 > 9040 [SYN] Seq=0 Win=5840 Len=0 MSS=1460 TSV=9945658 TSER=0 WS=6
  2   0.000293     10.0.1.2 -> 10.0.1.3     TCP 9040 > 56793 [SYN, ACK] Seq=0 Ack=1 Win=14480 Len=0 MSS=1460 TSV=9999649 TSER=9945658 WS=6
  3   0.000315     10.0.1.3 -> 10.0.1.2     TCP 56793 > 9040 [ACK] Seq=1 Ack=1 Win=5888 Len=0 TSV=9945658 TSER=9999649
  7   0.002231     10.0.1.2 -> 10.0.1.3     TCP 9040 > 56793 [ACK] Seq=1 Ack=13 Win=14528 Len=0 TSV=9999649 TSER=9945659
259348  21.306254     10.0.1.3 -> 10.0.1.2     TCP 56793 > 9040 [FIN, ACK] Seq=13 Ack=250000002 Win=2580480 Len=0 TSV=9950985 TSER=10004921
259349  21.306498     10.0.1.2 -> 10.0.1.3     TCP 9040 > 56793 [ACK] Seq=250000002 Ack=14 Win=14528 Len=0 TSV=10004976 TSER=9950985
================================================================================
IPv4 Conversations
Filter:<No Filter>
                                               |       <-      | |       ->      | |     Total     |
                                               | Frames  Bytes | | Frames  Bytes | | Frames  Bytes |
10.0.1.3             <-> 10.0.1.2              172661 261395634   86688   5721428  259349 267117062
================================================================================
  1   0.000000     10.0.1.3 -> 10.0.1.2     TCP 56795 > 9040 [SYN] Seq=0 Win=5840 Len=0 MSS=1460 TSV=9953745 TSER=0 WS=6
  2   0.000317     10.0.1.2 -> 10.0.1.3     TCP 9040 > 56795 [SYN, ACK] Seq=0 Ack=1 Win=14480 Len=0 MSS=1460 TSV=10007737 TSER=9953745 WS=6
  3   0.000340     10.0.1.3 -> 10.0.1.2     TCP 56795 > 9040 [ACK] Seq=1 Ack=1 Win=5888 Len=0 TSV=9953745 TSER=10007737
  7   0.002291     10.0.1.2 -> 10.0.1.3     TCP 9040 > 56795 [ACK] Seq=1 Ack=13 Win=14528 Len=0 TSV=10007737 TSER=9953746
259287  21.309603     10.0.1.3 -> 10.0.1.2     TCP 56795 > 9040 [FIN, ACK] Seq=13 Ack=250000002 Win=2580480 Len=0 TSV=9959073 TSER=10013010
259288  21.309850     10.0.1.2 -> 10.0.1.3     TCP 9040 > 56795 [ACK] Seq=250000002 Ack=14 Win=14528 Len=0 TSV=10013065 TSER=9959073
================================================================================
IPv4 Conversations
Filter:<No Filter>
                                               |       <-      | |       ->      | |     Total     |
                                               | Frames  Bytes | | Frames  Bytes | | Frames  Bytes |
10.0.1.3             <-> 10.0.1.2              172660 261395568   86628   5717468  259288 267113036
================================================================================
  1   0.000000     10.0.1.3 -> 10.0.1.2     TCP 56797 > 9040 [SYN] Seq=0 Win=5840 Len=0 MSS=1460 TSV=9961829 TSER=0 WS=6
  2   0.000275     10.0.1.2 -> 10.0.1.3     TCP 9040 > 56797 [SYN, ACK] Seq=0 Ack=1 Win=14480 Len=0 MSS=1460 TSV=10015821 TSER=9961829 WS=6
  3   0.000298     10.0.1.3 -> 10.0.1.2     TCP 56797 > 9040 [ACK] Seq=1 Ack=1 Win=5888 Len=0 TSV=9961829 TSER=10015821
  7   0.002265     10.0.1.2 -> 10.0.1.3     TCP 9040 > 56797 [ACK] Seq=1 Ack=13 Win=14528 Len=0 TSV=10015821 TSER=9961829
259327  21.305625     10.0.1.3 -> 10.0.1.2     TCP 56797 > 9040 [FIN, ACK] Seq=13 Ack=250000002 Win=2580480 Len=0 TSV=9967155 TSER=10021093
259328  21.305873     10.0.1.2 -> 10.0.1.3     TCP 9040 > 56797 [ACK] Seq=250000002 Ack=14 Win=14528 Len=0 TSV=10021148 TSER=9967155
================================================================================
IPv4 Conversations
Filter:<No Filter>
                                               |       <-      | |       ->      | |     Total     |
                                               | Frames  Bytes | | Frames  Bytes | | Frames  Bytes |
10.0.1.3             <-> 10.0.1.2              172659 261395502   86669   5720174  259328 267115676
================================================================================
