  1   0.000000     10.0.1.3 -> 10.0.1.2     TCP 38950 > 9040 [SYN] Seq=0 Win=5840 Len=0 MSS=1460 TSV=10201771 TSER=0 WS=6
  2   0.000301     10.0.1.2 -> 10.0.1.3     TCP 9040 > 38950 [SYN, ACK] Seq=0 Ack=1 Win=14480 Len=0 MSS=1460 TSV=2616428 TSER=10201771 WS=6
  3   0.000328     10.0.1.3 -> 10.0.1.2     TCP 38950 > 9040 [ACK] Seq=1 Ack=1 Win=5888 Len=0 TSV=10201771 TSER=2616428
  7   0.002163     10.0.1.2 -> 10.0.1.3     TCP 9040 > 38950 [ACK] Seq=1 Ack=13 Win=14528 Len=0 TSV=2616428 TSER=10201772
204306  17.051579     10.0.1.3 -> 10.0.1.2     TCP 38950 > 9040 [FIN, ACK] Seq=13 Ack=200000002 Win=2580480 Len=0 TSV=10206034 TSER=2620636
204307  17.051828     10.0.1.2 -> 10.0.1.3     TCP 9040 > 38950 [ACK] Seq=200000002 Ack=14 Win=14528 Len=0 TSV=2620691 TSER=10206034
  1   0.000000     10.0.1.3 -> 10.0.1.2     TCP 38953 > 9040 [SYN] Seq=0 Win=5840 Len=0 MSS=1460 TSV=10210303 TSER=0 WS=6
  2   0.000298     10.0.1.2 -> 10.0.1.3     TCP 9040 > 38953 [SYN, ACK] Seq=0 Ack=1 Win=14480 Len=0 MSS=1460 TSV=2624960 TSER=10210303 WS=6
  3   0.000321     10.0.1.3 -> 10.0.1.2     TCP 38953 > 9040 [ACK] Seq=1 Ack=1 Win=5888 Len=0 TSV=10210303 TSER=2624960
  7   0.002168     10.0.1.2 -> 10.0.1.3     TCP 9040 > 38953 [ACK] Seq=1 Ack=13 Win=14528 Len=0 TSV=2624960 TSER=10210304
190541  17.058319     10.0.1.3 -> 10.0.1.2     TCP 38953 > 9040 [FIN, ACK] Seq=13 Ack=200000002 Win=2580480 Len=0 TSV=10214568 TSER=2629170
190542  17.058572     10.0.1.2 -> 10.0.1.3     TCP 9040 > 38953 [ACK] Seq=200000002 Ack=14 Win=14528 Len=0 TSV=2629225 TSER=10214568
  1   0.000000     10.0.1.3 -> 10.0.1.2     TCP 38955 > 9040 [SYN] Seq=0 Win=5840 Len=0 MSS=1460 TSV=10218648 TSER=0 WS=6
  2   0.000291     10.0.1.2 -> 10.0.1.3     TCP 9040 > 38955 [SYN, ACK] Seq=0 Ack=1 Win=14480 Len=0 MSS=1460 TSV=2633306 TSER=10218648 WS=6
  3   0.000315     10.0.1.3 -> 10.0.1.2     TCP 38955 > 9040 [ACK] Seq=1 Ack=1 Win=5888 Len=0 TSV=10218649 TSER=2633306
  7   0.002193     10.0.1.2 -> 10.0.1.3     TCP 9040 > 38955 [ACK] Seq=1 Ack=13 Win=14528 Len=0 TSV=2633307 TSER=10218649
201900  17.137625     10.0.1.3 -> 10.0.1.2     TCP 38955 > 9040 [FIN, ACK] Seq=13 Ack=200000002 Win=2580480 Len=0 TSV=10222933 TSER=2637536
201901  17.137874     10.0.1.2 -> 10.0.1.3     TCP 9040 > 38955 [ACK] Seq=200000002 Ack=14 Win=14528 Len=0 TSV=2637591 TSER=10222933
  1   0.000000     10.0.1.3 -> 10.0.1.2     TCP 38959 > 9040 [SYN] Seq=0 Win=5840 Len=0 MSS=1460 TSV=10227160 TSER=0 WS=6
  2   0.000362     10.0.1.2 -> 10.0.1.3     TCP 9040 > 38959 [SYN, ACK] Seq=0 Ack=1 Win=14480 Len=0 MSS=1460 TSV=2641818 TSER=10227160 WS=6
  3   0.000385     10.0.1.3 -> 10.0.1.2     TCP 38959 > 9040 [ACK] Seq=1 Ack=1 Win=5888 Len=0 TSV=10227160 TSER=2641818
  7   0.002374     10.0.1.2 -> 10.0.1.3     TCP 9040 > 38959 [ACK] Seq=1 Ack=13 Win=14528 Len=0 TSV=2641818 TSER=10227160
206266  17.064892     10.0.1.3 -> 10.0.1.2     TCP 38959 > 9040 [FIN, ACK] Seq=13 Ack=200000002 Win=2580480 Len=0 TSV=10231426 TSER=2646029
206267  17.065139     10.0.1.2 -> 10.0.1.3     TCP 9040 > 38959 [ACK] Seq=200000002 Ack=14 Win=14528 Len=0 TSV=2646084 TSER=10231426
  1   0.000000     10.0.1.3 -> 10.0.1.2     TCP 38961 > 9040 [SYN] Seq=0 Win=5840 Len=0 MSS=1460 TSV=10235744 TSER=0 WS=6
  2   0.000349     10.0.1.2 -> 10.0.1.3     TCP 9040 > 38961 [SYN, ACK] Seq=0 Ack=1 Win=14480 Len=0 MSS=1460 TSV=2650402 TSER=10235744 WS=6
  3   0.000375     10.0.1.3 -> 10.0.1.2     TCP 38961 > 9040 [ACK] Seq=1 Ack=1 Win=5888 Len=0 TSV=10235744 TSER=2650402
  7   0.002207     10.0.1.2 -> 10.0.1.3     TCP 9040 > 38961 [ACK] Seq=1 Ack=13 Win=14528 Len=0 TSV=2650403 TSER=10235744
203977  17.057977     10.0.1.3 -> 10.0.1.2     TCP 38961 > 9040 [FIN, ACK] Seq=13 Ack=200000002 Win=2580480 Len=0 TSV=10240008 TSER=2654612
203978  17.058232     10.0.1.2 -> 10.0.1.3     TCP 9040 > 38961 [ACK] Seq=200000002 Ack=14 Win=14528 Len=0 TSV=2654667 TSER=10240008
  1   0.000000     10.0.1.3 -> 10.0.1.2     TCP 38964 > 9040 [SYN] Seq=0 Win=5840 Len=0 MSS=1460 TSV=10244238 TSER=0 WS=6
  2   0.000376     10.0.1.2 -> 10.0.1.3     TCP 9040 > 38964 [SYN, ACK] Seq=0 Ack=1 Win=14480 Len=0 MSS=1460 TSV=2658898 TSER=10244238 WS=6
  3   0.000410     10.0.1.3 -> 10.0.1.2     TCP 38964 > 9040 [ACK] Seq=1 Ack=1 Win=5888 Len=0 TSV=10244238 TSER=2658898
  7   0.002707     10.0.1.2 -> 10.0.1.3     TCP 9040 > 38964 [ACK] Seq=1 Ack=13 Win=14528 Len=0 TSV=2658898 TSER=10244239
202171  17.062338     10.0.1.3 -> 10.0.1.2     TCP 38964 > 9040 [FIN, ACK] Seq=13 Ack=200000002 Win=2580480 Len=0 TSV=10248504 TSER=2663109
202172  17.062593     10.0.1.2 -> 10.0.1.3     TCP 9040 > 38964 [ACK] Seq=200000002 Ack=14 Win=14528 Len=0 TSV=2663164 TSER=10248504
  1   0.000000     10.0.1.3 -> 10.0.1.2     TCP 38967 > 9040 [SYN] Seq=0 Win=5840 Len=0 MSS=1460 TSV=10252777 TSER=0 WS=6
  2   0.000379     10.0.1.2 -> 10.0.1.3     TCP 9040 > 38967 [SYN, ACK] Seq=0 Ack=1 Win=14480 Len=0 MSS=1460 TSV=2667437 TSER=10252777 WS=6
  3   0.000403     10.0.1.3 -> 10.0.1.2     TCP 38967 > 9040 [ACK] Seq=1 Ack=1 Win=5888 Len=0 TSV=10252777 TSER=2667437
  7   0.002311     10.0.1.2 -> 10.0.1.3     TCP 9040 > 38967 [ACK] Seq=1 Ack=13 Win=14528 Len=0 TSV=2667438 TSER=10252777
191865  17.051022     10.0.1.3 -> 10.0.1.2     TCP 38967 > 9040 [FIN, ACK] Seq=13 Ack=200000002 Win=2580480 Len=0 TSV=10257040 TSER=2671645
191866  17.051307     10.0.1.2 -> 10.0.1.3     TCP 9040 > 38967 [ACK] Seq=200000002 Ack=14 Win=14528 Len=0 TSV=2671700 TSER=10257040
  1   0.000000     10.0.1.3 -> 10.0.1.2     TCP 38970 > 9040 [SYN] Seq=0 Win=5840 Len=0 MSS=1460 TSV=10261187 TSER=0 WS=6
  2   0.000304     10.0.1.2 -> 10.0.1.3     TCP 9040 > 38970 [SYN, ACK] Seq=0 Ack=1 Win=14480 Len=0 MSS=1460 TSV=2675848 TSER=10261187 WS=6
  3   0.000330     10.0.1.3 -> 10.0.1.2     TCP 38970 > 9040 [ACK] Seq=1 Ack=1 Win=5888 Len=0 TSV=10261187 TSER=2675848
  7   0.002303     10.0.1.2 -> 10.0.1.3     TCP 9040 > 38970 [ACK] Seq=1 Ack=13 Win=14528 Len=0 TSV=2675848 TSER=10261187
185604  17.054164     10.0.1.3 -> 10.0.1.2     TCP 38970 > 9040 [FIN, ACK] Seq=13 Ack=200000002 Win=2580480 Len=0 TSV=10265450 TSER=2680056
185605  17.054414     10.0.1.2 -> 10.0.1.3     TCP 9040 > 38970 [ACK] Seq=200000002 Ack=14 Win=14528 Len=0 TSV=2680111 TSER=10265450
  1   0.000000     10.0.1.3 -> 10.0.1.2     TCP 38972 > 9040 [SYN] Seq=0 Win=5840 Len=0 MSS=1460 TSV=10269499 TSER=0 WS=6
  2   0.000352     10.0.1.2 -> 10.0.1.3     TCP 9040 > 38972 [SYN, ACK] Seq=0 Ack=1 Win=14480 Len=0 MSS=1460 TSV=2684160 TSER=10269499 WS=6
  3   0.000376     10.0.1.3 -> 10.0.1.2     TCP 38972 > 9040 [ACK] Seq=1 Ack=1 Win=5888 Len=0 TSV=10269499 TSER=2684160
  7   0.002421     10.0.1.2 -> 10.0.1.3     TCP 9040 > 38972 [ACK] Seq=1 Ack=13 Win=14528 Len=0 TSV=2684161 TSER=10269499
205006  17.052286     10.0.1.3 -> 10.0.1.2     TCP 38972 > 9040 [FIN, ACK] Seq=13 Ack=200000002 Win=2580480 Len=0 TSV=10273762 TSER=2688369
205007  17.052534     10.0.1.2 -> 10.0.1.3     TCP 9040 > 38972 [ACK] Seq=200000002 Ack=14 Win=14528 Len=0 TSV=2688424 TSER=10273762
  1   0.000000     10.0.1.3 -> 10.0.1.2     TCP 50221 > 9040 [SYN] Seq=0 Win=5840 Len=0 MSS=1460 TSV=10277966 TSER=0 WS=6
  2   0.000305     10.0.1.2 -> 10.0.1.3     TCP 9040 > 50221 [SYN, ACK] Seq=0 Ack=1 Win=14480 Len=0 MSS=1460 TSV=2692628 TSER=10277966 WS=6
  3   0.000328     10.0.1.3 -> 10.0.1.2     TCP 50221 > 9040 [ACK] Seq=1 Ack=1 Win=5888 Len=0 TSV=10277966 TSER=2692628
  7   0.002344     10.0.1.2 -> 10.0.1.3     TCP 9040 > 50221 [ACK] Seq=1 Ack=13 Win=14528 Len=0 TSV=2692628 TSER=10277966
201720  17.053487     10.0.1.3 -> 10.0.1.2     TCP 50221 > 9040 [FIN, ACK] Seq=13 Ack=200000002 Win=2580480 Len=0 TSV=10282229 TSER=2696836
201721  17.053734     10.0.1.2 -> 10.0.1.3     TCP 9040 > 50221 [ACK] Seq=200000002 Ack=14 Win=14528 Len=0 TSV=2696891 TSER=10282229
  1   0.000000     10.0.1.3 -> 10.0.1.2     TCP 50223 > 9040 [SYN] Seq=0 Win=5840 Len=0 MSS=1460 TSV=10286491 TSER=0 WS=6
  2   0.000309     10.0.1.2 -> 10.0.1.3     TCP 9040 > 50223 [SYN, ACK] Seq=0 Ack=1 Win=14480 Len=0 MSS=1460 TSV=2701153 TSER=10286491 WS=6
  3   0.000327     10.0.1.3 -> 10.0.1.2     TCP 50223 > 9040 [ACK] Seq=1 Ack=1 Win=5888 Len=0 TSV=10286491 TSER=2701153
  7   0.002233     10.0.1.2 -> 10.0.1.3     TCP 9040 > 50223 [ACK] Seq=1 Ack=13 Win=14528 Len=0 TSV=2701154 TSER=10286491
200717  17.052129     10.0.1.3 -> 10.0.1.2     TCP 50223 > 9040 [FIN, ACK] Seq=13 Ack=200000002 Win=2580480 Len=0 TSV=10290754 TSER=2705362
200718  17.052382     10.0.1.2 -> 10.0.1.3     TCP 9040 > 50223 [ACK] Seq=200000002 Ack=14 Win=14528 Len=0 TSV=2705417 TSER=10290754
  1   0.000000     10.0.1.3 -> 10.0.1.2     TCP 50226 > 9040 [SYN] Seq=0 Win=5840 Len=0 MSS=1460 TSV=10295026 TSER=0 WS=6
  2   0.000319     10.0.1.2 -> 10.0.1.3     TCP 9040 > 50226 [SYN, ACK] Seq=0 Ack=1 Win=14480 Len=0 MSS=1460 TSV=2709689 TSER=10295026 WS=6
  3   0.000341     10.0.1.3 -> 10.0.1.2     TCP 50226 > 9040 [ACK] Seq=1 Ack=1 Win=5888 Len=0 TSV=10295026 TSER=2709689
  7   0.002236     10.0.1.2 -> 10.0.1.3     TCP 9040 > 50226 [ACK] Seq=1 Ack=13 Win=14528 Len=0 TSV=2709690 TSER=10295027
183889  17.053246     10.0.1.3 -> 10.0.1.2     TCP 50226 > 9040 [FIN, ACK] Seq=13 Ack=200000002 Win=2580480 Len=0 TSV=10299289 TSER=2713898
183890  17.053501     10.0.1.2 -> 10.0.1.3     TCP 9040 > 50226 [ACK] Seq=200000002 Ack=14 Win=14528 Len=0 TSV=2713953 TSER=10299289
  1   0.000000     10.0.1.3 -> 10.0.1.2     TCP 50228 > 9040 [SYN] Seq=0 Win=5840 Len=0 MSS=1460 TSV=10303127 TSER=0 WS=6
  2   0.000300     10.0.1.2 -> 10.0.1.3     TCP 9040 > 50228 [SYN, ACK] Seq=0 Ack=1 Win=14480 Len=0 MSS=1460 TSV=2717791 TSER=10303127 WS=6
  3   0.000326     10.0.1.3 -> 10.0.1.2     TCP 50228 > 9040 [ACK] Seq=1 Ack=1 Win=5888 Len=0 TSV=10303127 TSER=2717791
  7   0.002201     10.0.1.2 -> 10.0.1.3     TCP 9040 > 50228 [ACK] Seq=1 Ack=13 Win=14528 Len=0 TSV=2717792 TSER=10303128
202941  17.053369     10.0.1.3 -> 10.0.1.2     TCP 50228 > 9040 [FIN, ACK] Seq=13 Ack=200000002 Win=2580480 Len=0 TSV=10307391 TSER=2722000
202942  17.053614     10.0.1.2 -> 10.0.1.3     TCP 9040 > 50228 [ACK] Seq=200000002 Ack=14 Win=14528 Len=0 TSV=2722055 TSER=10307391
  1   0.000000     10.0.1.3 -> 10.0.1.2     TCP 50232 > 9040 [SYN] Seq=0 Win=5840 Len=0 MSS=1460 TSV=10311640 TSER=0 WS=6
  2   0.000284     10.0.1.2 -> 10.0.1.3     TCP 9040 > 50232 [SYN, ACK] Seq=0 Ack=1 Win=14480 Len=0 MSS=1460 TSV=2726305 TSER=10311640 WS=6
  3   0.000307     10.0.1.3 -> 10.0.1.2     TCP 50232 > 9040 [ACK] Seq=1 Ack=1 Win=5888 Len=0 TSV=10311640 TSER=2726305
  7   0.002303     10.0.1.2 -> 10.0.1.3     TCP 9040 > 50232 [ACK] Seq=1 Ack=13 Win=14528 Len=0 TSV=2726305 TSER=10311641
180059  17.347119     10.0.1.3 -> 10.0.1.2     TCP 50232 > 9040 [FIN, ACK] Seq=13 Ack=200000002 Win=2563008 Len=0 TSV=10315977 TSER=2730587
180060  17.347370     10.0.1.2 -> 10.0.1.3     TCP 9040 > 50232 [ACK] Seq=200000002 Ack=14 Win=14528 Len=0 TSV=2730642 TSER=10315977
  1   0.000000     10.0.1.3 -> 10.0.1.2     TCP 50234 > 9040 [SYN] Seq=0 Win=5840 Len=0 MSS=1460 TSV=10320093 TSER=0 WS=6
  2   0.000368     10.0.1.2 -> 10.0.1.3     TCP 9040 > 50234 [SYN, ACK] Seq=0 Ack=1 Win=14480 Len=0 MSS=1460 TSV=2734758 TSER=10320093 WS=6
  3   0.000395     10.0.1.3 -> 10.0.1.2     TCP 50234 > 9040 [ACK] Seq=1 Ack=1 Win=5888 Len=0 TSV=10320093 TSER=2734758
  7   0.002271     10.0.1.2 -> 10.0.1.3     TCP 9040 > 50234 [ACK] Seq=1 Ack=13 Win=14528 Len=0 TSV=2734759 TSER=10320094
188111  17.055211     10.0.1.3 -> 10.0.1.2     TCP 50234 > 9040 [FIN, ACK] Seq=13 Ack=200000002 Win=2580480 Len=0 TSV=10324357 TSER=2738967
188112  17.055461     10.0.1.2 -> 10.0.1.3     TCP 9040 > 50234 [ACK] Seq=200000002 Ack=14 Win=14528 Len=0 TSV=2739023 TSER=10324357
  1   0.000000     10.0.1.3 -> 10.0.1.2     TCP 50239 > 9040 [SYN] Seq=0 Win=5840 Len=0 MSS=1460 TSV=10328519 TSER=0 WS=6
  2   0.000365     10.0.1.2 -> 10.0.1.3     TCP 9040 > 50239 [SYN, ACK] Seq=0 Ack=1 Win=14480 Len=0 MSS=1460 TSV=2743185 TSER=10328519 WS=6
  3   0.000384     10.0.1.3 -> 10.0.1.2     TCP 50239 > 9040 [ACK] Seq=1 Ack=1 Win=5888 Len=0 TSV=10328519 TSER=2743185
  7   0.002336     10.0.1.2 -> 10.0.1.3     TCP 9040 > 50239 [ACK] Seq=1 Ack=13 Win=14528 Len=0 TSV=2743185 TSER=10328519
202128  17.060077     10.0.1.3 -> 10.0.1.2     TCP 50239 > 9040 [FIN, ACK] Seq=13 Ack=200000002 Win=2580480 Len=0 TSV=10332784 TSER=2747394
202129  17.060320     10.0.1.2 -> 10.0.1.3     TCP 9040 > 50239 [ACK] Seq=200000002 Ack=14 Win=14528 Len=0 TSV=2747450 TSER=10332784
  1   0.000000     10.0.1.3 -> 10.0.1.2     TCP 50241 > 9040 [SYN] Seq=0 Win=5840 Len=0 MSS=1460 TSV=10337001 TSER=0 WS=6
  2   0.000317     10.0.1.2 -> 10.0.1.3     TCP 9040 > 50241 [SYN, ACK] Seq=0 Ack=1 Win=14480 Len=0 MSS=1460 TSV=2751667 TSER=10337001 WS=6
  3   0.000333     10.0.1.3 -> 10.0.1.2     TCP 50241 > 9040 [ACK] Seq=1 Ack=1 Win=5888 Len=0 TSV=10337001 TSER=2751667
  7   0.002110     10.0.1.2 -> 10.0.1.3     TCP 9040 > 50241 [ACK] Seq=1 Ack=13 Win=14528 Len=0 TSV=2751668 TSER=10337001
194777  17.051522     10.0.1.3 -> 10.0.1.2     TCP 50241 > 9040 [FIN, ACK] Seq=13 Ack=200000002 Win=2580480 Len=0 TSV=10341264 TSER=2755876
194778  17.051795     10.0.1.2 -> 10.0.1.3     TCP 9040 > 50241 [ACK] Seq=200000002 Ack=14 Win=14528 Len=0 TSV=2755931 TSER=10341264
  1   0.000000     10.0.1.3 -> 10.0.1.2     TCP 50244 > 9040 [SYN] Seq=0 Win=5840 Len=0 MSS=1460 TSV=10345414 TSER=0 WS=6
  2   0.000317     10.0.1.2 -> 10.0.1.3     TCP 9040 > 50244 [SYN, ACK] Seq=0 Ack=1 Win=14480 Len=0 MSS=1460 TSV=2760081 TSER=10345414 WS=6
  3   0.000341     10.0.1.3 -> 10.0.1.2     TCP 50244 > 9040 [ACK] Seq=1 Ack=1 Win=5888 Len=0 TSV=10345414 TSER=2760081
  7   0.002308     10.0.1.2 -> 10.0.1.3     TCP 9040 > 50244 [ACK] Seq=1 Ack=13 Win=14528 Len=0 TSV=2760082 TSER=10345414
201698  17.051034     10.0.1.3 -> 10.0.1.2     TCP 50244 > 9040 [FIN, ACK] Seq=13 Ack=200000002 Win=2560064 Len=0 TSV=10349677 TSER=2764290
201699  17.051291     10.0.1.2 -> 10.0.1.3     TCP 9040 > 50244 [ACK] Seq=200000002 Ack=14 Win=14528 Len=0 TSV=2764344 TSER=10349677
  1   0.000000     10.0.1.3 -> 10.0.1.2     TCP 53399 > 9040 [SYN] Seq=0 Win=5840 Len=0 MSS=1460 TSV=10353808 TSER=0 WS=6
  2   0.000400     10.0.1.2 -> 10.0.1.3     TCP 9040 > 53399 [SYN, ACK] Seq=0 Ack=1 Win=14480 Len=0 MSS=1460 TSV=2768476 TSER=10353808 WS=6
  3   0.000424     10.0.1.3 -> 10.0.1.2     TCP 53399 > 9040 [ACK] Seq=1 Ack=1 Win=5888 Len=0 TSV=10353808 TSER=2768476
  7   0.002272     10.0.1.2 -> 10.0.1.3     TCP 9040 > 53399 [ACK] Seq=1 Ack=13 Win=14528 Len=0 TSV=2768476 TSER=10353808
200773  17.054145     10.0.1.3 -> 10.0.1.2     TCP 53399 > 9040 [FIN, ACK] Seq=13 Ack=200000002 Win=2580480 Len=0 TSV=10358072 TSER=2772684
200774  17.054387     10.0.1.2 -> 10.0.1.3     TCP 9040 > 53399 [ACK] Seq=200000002 Ack=14 Win=14528 Len=0 TSV=2772739 TSER=10358072
  1   0.000000     10.0.1.3 -> 10.0.1.2     TCP 53402 > 9040 [SYN] Seq=0 Win=5840 Len=0 MSS=1460 TSV=10362308 TSER=0 WS=6
  2   0.000372     10.0.1.2 -> 10.0.1.3     TCP 9040 > 53402 [SYN, ACK] Seq=0 Ack=1 Win=14480 Len=0 MSS=1460 TSV=2776976 TSER=10362308 WS=6
  3   0.000397     10.0.1.3 -> 10.0.1.2     TCP 53402 > 9040 [ACK] Seq=1 Ack=1 Win=5888 Len=0 TSV=10362308 TSER=2776976
  7   0.002334     10.0.1.2 -> 10.0.1.3     TCP 9040 > 53402 [ACK] Seq=1 Ack=13 Win=14528 Len=0 TSV=2776977 TSER=10362308
203488  17.053726     10.0.1.3 -> 10.0.1.2     TCP 53402 > 9040 [FIN, ACK] Seq=13 Ack=200000002 Win=2580480 Len=0 TSV=10366572 TSER=2781185
203489  17.053979     10.0.1.2 -> 10.0.1.3     TCP 9040 > 53402 [ACK] Seq=200000002 Ack=14 Win=14528 Len=0 TSV=2781240 TSER=10366572
