  1   0.000000     10.0.1.3 -> 10.0.1.2     TCP 38839 > 9040 [SYN] Seq=0 Win=5840 Len=0 MSS=1460 TSV=5201081 TSER=0 WS=6
  2   0.000294     10.0.1.2 -> 10.0.1.3     TCP 9040 > 38839 [SYN, ACK] Seq=0 Ack=1 Win=14480 Len=0 MSS=1460 TSV=5186047 TSER=5201081 WS=6
  3   0.000317     10.0.1.3 -> 10.0.1.2     TCP 38839 > 9040 [ACK] Seq=1 Ack=1 Win=5888 Len=0 TSV=5201081 TSER=5186047
  7   0.002378     10.0.1.2 -> 10.0.1.3     TCP 9040 > 38839 [ACK] Seq=1 Ack=13 Win=14528 Len=0 TSV=5186047 TSER=5201082
258150  46.108946     10.0.1.3 -> 10.0.1.2     TCP 38839 > 9040 [FIN, ACK] Seq=13 Ack=250000002 Win=2023168 Len=0 TSV=5212609 TSER=5197553
258151  46.109197     10.0.1.2 -> 10.0.1.3     TCP 9040 > 38839 [ACK] Seq=250000002 Ack=14 Win=14528 Len=0 TSV=5197575 TSER=5212609
  1   0.000000     10.0.1.3 -> 10.0.1.2     TCP 38841 > 9040 [SYN] Seq=0 Win=5840 Len=0 MSS=1460 TSV=5217465 TSER=0 WS=6
  2   0.000324     10.0.1.2 -> 10.0.1.3     TCP 9040 > 38841 [SYN, ACK] Seq=0 Ack=1 Win=14480 Len=0 MSS=1460 TSV=5202432 TSER=5217465 WS=6
  3   0.000347     10.0.1.3 -> 10.0.1.2     TCP 38841 > 9040 [ACK] Seq=1 Ack=1 Win=5888 Len=0 TSV=5217466 TSER=5202432
  7   0.002272     10.0.1.2 -> 10.0.1.3     TCP 9040 > 38841 [ACK] Seq=1 Ack=13 Win=14528 Len=0 TSV=5202433 TSER=5217466
259427  46.200385     10.0.1.3 -> 10.0.1.2     TCP 38841 > 9040 [FIN, ACK] Seq=13 Ack=250000002 Win=2008704 Len=0 TSV=5229016 TSER=5213962
259428  46.200658     10.0.1.2 -> 10.0.1.3     TCP 9040 > 38841 [ACK] Seq=250000002 Ack=14 Win=14528 Len=0 TSV=5213983 TSER=5229016
  1   0.000000     10.0.1.3 -> 10.0.1.2     TCP 38843 > 9040 [SYN] Seq=0 Win=5840 Len=0 MSS=1460 TSV=5233951 TSER=0 WS=6
  2   0.000294     10.0.1.2 -> 10.0.1.3     TCP 9040 > 38843 [SYN, ACK] Seq=0 Ack=1 Win=14480 Len=0 MSS=1460 TSV=5218919 TSER=5233951 WS=6
  3   0.000317     10.0.1.3 -> 10.0.1.2     TCP 38843 > 9040 [ACK] Seq=1 Ack=1 Win=5888 Len=0 TSV=5233951 TSER=5218919
  7   0.002181     10.0.1.2 -> 10.0.1.3     TCP 9040 > 38843 [ACK] Seq=1 Ack=13 Win=14528 Len=0 TSV=5218920 TSER=5233952
256348  45.436847     10.0.1.3 -> 10.0.1.2     TCP 38843 > 9040 [FIN, ACK] Seq=13 Ack=250000002 Win=2020288 Len=0 TSV=5245310 TSER=5230258
256349  45.437099     10.0.1.2 -> 10.0.1.3     TCP 9040 > 38843 [ACK] Seq=250000002 Ack=14 Win=14528 Len=0 TSV=5230279 TSER=5245310
  1   0.000000     10.0.1.3 -> 10.0.1.2     TCP 38845 > 9040 [SYN] Seq=0 Win=5840 Len=0 MSS=1460 TSV=5250226 TSER=0 WS=6
  2   0.000292     10.0.1.2 -> 10.0.1.3     TCP 9040 > 38845 [SYN, ACK] Seq=0 Ack=1 Win=14480 Len=0 MSS=1460 TSV=5235195 TSER=5250226 WS=6
  3   0.000315     10.0.1.3 -> 10.0.1.2     TCP 38845 > 9040 [ACK] Seq=1 Ack=1 Win=5888 Len=0 TSV=5250226 TSER=5235195
  7   0.002256     10.0.1.2 -> 10.0.1.3     TCP 9040 > 38845 [ACK] Seq=1 Ack=13 Win=14528 Len=0 TSV=5235196 TSER=5250226
256619  45.158085     10.0.1.3 -> 10.0.1.2     TCP 38845 > 9040 [FIN, ACK] Seq=13 Ack=250000002 Win=2002944 Len=0 TSV=5261515 TSER=5246464
256620  45.158367     10.0.1.2 -> 10.0.1.3     TCP 9040 > 38845 [ACK] Seq=250000002 Ack=14 Win=14528 Len=0 TSV=5246485 TSER=5261515
  1   0.000000     10.0.1.3 -> 10.0.1.2     TCP 42225 > 9040 [SYN] Seq=0 Win=5840 Len=0 MSS=1460 TSV=5266383 TSER=0 WS=6
  2   0.000273     10.0.1.2 -> 10.0.1.3     TCP 9040 > 42225 [SYN, ACK] Seq=0 Ack=1 Win=14480 Len=0 MSS=1460 TSV=5251354 TSER=5266383 WS=6
  3   0.000296     10.0.1.3 -> 10.0.1.2     TCP 42225 > 9040 [ACK] Seq=1 Ack=1 Win=5888 Len=0 TSV=5266383 TSER=5251354
  7   0.002165     10.0.1.2 -> 10.0.1.3     TCP 9040 > 42225 [ACK] Seq=1 Ack=13 Win=14528 Len=0 TSV=5251354 TSER=5266384
258350  44.965792     10.0.1.3 -> 10.0.1.2     TCP 42225 > 9040 [FIN, ACK] Seq=13 Ack=250000002 Win=2002944 Len=0 TSV=5277625 TSER=5262574
258351  44.966038     10.0.1.2 -> 10.0.1.3     TCP 9040 > 42225 [ACK] Seq=250000002 Ack=14 Win=14528 Len=0 TSV=5262596 TSER=5277625
  1   0.000000     10.0.1.3 -> 10.0.1.2     TCP 42227 > 9040 [SYN] Seq=0 Win=5840 Len=0 MSS=1460 TSV=5282542 TSER=0 WS=6
  2   0.000307     10.0.1.2 -> 10.0.1.3     TCP 9040 > 42227 [SYN, ACK] Seq=0 Ack=1 Win=14480 Len=0 MSS=1460 TSV=5267514 TSER=5282542 WS=6
  3   0.000336     10.0.1.3 -> 10.0.1.2     TCP 42227 > 9040 [ACK] Seq=1 Ack=1 Win=5888 Len=0 TSV=5282542 TSER=5267514
  7   0.002265     10.0.1.2 -> 10.0.1.3     TCP 9040 > 42227 [ACK] Seq=1 Ack=13 Win=14528 Len=0 TSV=5267514 TSER=5282543
257366  45.875921     10.0.1.3 -> 10.0.1.2     TCP 42227 > 9040 [FIN, ACK] Seq=13 Ack=250000002 Win=2023168 Len=0 TSV=5294011 TSER=5278962
257367  45.876177     10.0.1.2 -> 10.0.1.3     TCP 9040 > 42227 [ACK] Seq=250000002 Ack=14 Win=14528 Len=0 TSV=5278983 TSER=5294011
  1   0.000000     10.0.1.3 -> 10.0.1.2     TCP 42229 > 9040 [SYN] Seq=0 Win=5840 Len=0 MSS=1460 TSV=5298628 TSER=0 WS=6
  2   0.000302     10.0.1.2 -> 10.0.1.3     TCP 9040 > 42229 [SYN, ACK] Seq=0 Ack=1 Win=14480 Len=0 MSS=1460 TSV=5283601 TSER=5298628 WS=6
  3   0.000323     10.0.1.3 -> 10.0.1.2     TCP 42229 > 9040 [ACK] Seq=1 Ack=1 Win=5888 Len=0 TSV=5298628 TSER=5283601
  7   0.002285     10.0.1.2 -> 10.0.1.3     TCP 9040 > 42229 [ACK] Seq=1 Ack=13 Win=14528 Len=0 TSV=5283601 TSER=5298628
247230  46.028487     10.0.1.3 -> 10.0.1.2     TCP 42229 > 9040 [FIN, ACK] Seq=13 Ack=250000002 Win=2031872 Len=0 TSV=5310135 TSER=5295087
247231  46.028740     10.0.1.2 -> 10.0.1.3     TCP 9040 > 42229 [ACK] Seq=250000002 Ack=14 Win=14528 Len=0 TSV=5295109 TSER=5310135
  1   0.000000     10.0.1.3 -> 10.0.1.2     TCP 42231 > 9040 [SYN] Seq=0 Win=5840 Len=0 MSS=1460 TSV=5314891 TSER=0 WS=6
  2   0.000373     10.0.1.2 -> 10.0.1.3     TCP 9040 > 42231 [SYN, ACK] Seq=0 Ack=1 Win=14480 Len=0 MSS=1460 TSV=5299865 TSER=5314891 WS=6
  3   0.000399     10.0.1.3 -> 10.0.1.2     TCP 42231 > 9040 [ACK] Seq=1 Ack=1 Win=5888 Len=0 TSV=5314891 TSER=5299865
  7   0.002261     10.0.1.2 -> 10.0.1.3     TCP 9040 > 42231 [ACK] Seq=1 Ack=13 Win=14528 Len=0 TSV=5299865 TSER=5314891
257528  46.298820     10.0.1.3 -> 10.0.1.2     TCP 42231 > 9040 [FIN, ACK] Seq=13 Ack=250000002 Win=2017408 Len=0 TSV=5326465 TSER=5311419
257529  46.299075     10.0.1.2 -> 10.0.1.3     TCP 9040 > 42231 [ACK] Seq=250000002 Ack=14 Win=14528 Len=0 TSV=5311440 TSER=5326465
  1   0.000000     10.0.1.3 -> 10.0.1.2     TCP 37042 > 9040 [SYN] Seq=0 Win=5840 Len=0 MSS=1460 TSV=5331411 TSER=0 WS=6
  2   0.000270     10.0.1.2 -> 10.0.1.3     TCP 9040 > 37042 [SYN, ACK] Seq=0 Ack=1 Win=14480 Len=0 MSS=1460 TSV=5316386 TSER=5331411 WS=6
  3   0.000293     10.0.1.3 -> 10.0.1.2     TCP 37042 > 9040 [ACK] Seq=1 Ack=1 Win=5888 Len=0 TSV=5331411 TSER=5316386
  7   0.002196     10.0.1.2 -> 10.0.1.3     TCP 9040 > 37042 [ACK] Seq=1 Ack=13 Win=14528 Len=0 TSV=5316387 TSER=5331412
258156  46.185113     10.0.1.3 -> 10.0.1.2     TCP 37042 > 9040 [FIN, ACK] Seq=13 Ack=250000002 Win=2002944 Len=0 TSV=5342957 TSER=5327912
258157  46.185383     10.0.1.2 -> 10.0.1.3     TCP 9040 > 37042 [ACK] Seq=250000002 Ack=14 Win=14528 Len=0 TSV=5327934 TSER=5342957
  1   0.000000     10.0.1.3 -> 10.0.1.2     TCP 37044 > 9040 [SYN] Seq=0 Win=5840 Len=0 MSS=1460 TSV=5347860 TSER=0 WS=6
  2   0.000287     10.0.1.2 -> 10.0.1.3     TCP 9040 > 37044 [SYN, ACK] Seq=0 Ack=1 Win=14480 Len=0 MSS=1460 TSV=5332836 TSER=5347860 WS=6
  3   0.000318     10.0.1.3 -> 10.0.1.2     TCP 37044 > 9040 [ACK] Seq=1 Ack=1 Win=5888 Len=0 TSV=5347860 TSER=5332836
  7   0.002436     10.0.1.2 -> 10.0.1.3     TCP 9040 > 37044 [ACK] Seq=1 Ack=13 Win=14528 Len=0 TSV=5332837 TSER=5347860
257436  45.661804     10.0.1.3 -> 10.0.1.2     TCP 37044 > 9040 [FIN, ACK] Seq=13 Ack=250000002 Win=2026112 Len=0 TSV=5359275 TSER=5344231
257437  45.662055     10.0.1.2 -> 10.0.1.3     TCP 9040 > 37044 [ACK] Seq=250000002 Ack=14 Win=14528 Len=0 TSV=5344252 TSER=5359275
  1   0.000000     10.0.1.3 -> 10.0.1.2     TCP 37046 > 9040 [SYN] Seq=0 Win=5840 Len=0 MSS=1460 TSV=5364089 TSER=0 WS=6
  2   0.000367     10.0.1.2 -> 10.0.1.3     TCP 9040 > 37046 [SYN, ACK] Seq=0 Ack=1 Win=14480 Len=0 MSS=1460 TSV=5349067 TSER=5364089 WS=6
  3   0.000390     10.0.1.3 -> 10.0.1.2     TCP 37046 > 9040 [ACK] Seq=1 Ack=1 Win=5888 Len=0 TSV=5364089 TSER=5349067
  7   0.002387     10.0.1.2 -> 10.0.1.3     TCP 9040 > 37046 [ACK] Seq=1 Ack=13 Win=14528 Len=0 TSV=5349067 TSER=5364090
258109  45.059686     10.0.1.3 -> 10.0.1.2     TCP 37046 > 9040 [FIN, ACK] Seq=13 Ack=250000002 Win=2002944 Len=0 TSV=5375354 TSER=5360311
258110  45.059938     10.0.1.2 -> 10.0.1.3     TCP 9040 > 37046 [ACK] Seq=250000002 Ack=14 Win=14528 Len=0 TSV=5360332 TSER=5375354
  1   0.000000     10.0.1.3 -> 10.0.1.2     TCP 37048 > 9040 [SYN] Seq=0 Win=5840 Len=0 MSS=1460 TSV=5380224 TSER=0 WS=6
  2   0.000280     10.0.1.2 -> 10.0.1.3     TCP 9040 > 37048 [SYN, ACK] Seq=0 Ack=1 Win=14480 Len=0 MSS=1460 TSV=5365203 TSER=5380224 WS=6
  3   0.000303     10.0.1.3 -> 10.0.1.2     TCP 37048 > 9040 [ACK] Seq=1 Ack=1 Win=5888 Len=0 TSV=5380224 TSER=5365203
  7   0.002178     10.0.1.2 -> 10.0.1.3     TCP 9040 > 37048 [ACK] Seq=1 Ack=13 Win=14528 Len=0 TSV=5365203 TSER=5380224
258588  45.791463     10.0.1.3 -> 10.0.1.2     TCP 37048 > 9040 [FIN, ACK] Seq=13 Ack=250000002 Win=2023168 Len=0 TSV=5391672 TSER=5376630
258589  45.791710     10.0.1.2 -> 10.0.1.3     TCP 9040 > 37048 [ACK] Seq=250000002 Ack=14 Win=14528 Len=0 TSV=5376652 TSER=5391672
  1   0.000000     10.0.1.3 -> 10.0.1.2     TCP 37050 > 9040 [SYN] Seq=0 Win=5840 Len=0 MSS=1460 TSV=5396578 TSER=0 WS=6
  2   0.000305     10.0.1.2 -> 10.0.1.3     TCP 9040 > 37050 [SYN, ACK] Seq=0 Ack=1 Win=14480 Len=0 MSS=1460 TSV=5381558 TSER=5396578 WS=6
  3   0.000331     10.0.1.3 -> 10.0.1.2     TCP 37050 > 9040 [ACK] Seq=1 Ack=1 Win=5888 Len=0 TSV=5396578 TSER=5381558
  7   0.002200     10.0.1.2 -> 10.0.1.3     TCP 9040 > 37050 [ACK] Seq=1 Ack=13 Win=14528 Len=0 TSV=5381559 TSER=5396578
258509  45.441436     10.0.1.3 -> 10.0.1.2     TCP 37050 > 9040 [FIN, ACK] Seq=13 Ack=250000002 Win=2002944 Len=0 TSV=5407938 TSER=5392898
258510  45.441684     10.0.1.2 -> 10.0.1.3     TCP 9040 > 37050 [ACK] Seq=250000002 Ack=14 Win=14528 Len=0 TSV=5392919 TSER=5407938
  1   0.000000     10.0.1.3 -> 10.0.1.2     TCP 37163 > 9040 [SYN] Seq=0 Win=5840 Len=0 MSS=1460 TSV=5412841 TSER=0 WS=6
  2   0.000298     10.0.1.2 -> 10.0.1.3     TCP 9040 > 37163 [SYN, ACK] Seq=0 Ack=1 Win=14480 Len=0 MSS=1460 TSV=5397822 TSER=5412841 WS=6
  3   0.000322     10.0.1.3 -> 10.0.1.2     TCP 37163 > 9040 [ACK] Seq=1 Ack=1 Win=5888 Len=0 TSV=5412841 TSER=5397822
  7   0.002301     10.0.1.2 -> 10.0.1.3     TCP 9040 > 37163 [ACK] Seq=1 Ack=13 Win=14528 Len=0 TSV=5397823 TSER=5412842
243695  45.739582     10.0.1.3 -> 10.0.1.2     TCP 37163 > 9040 [FIN, ACK] Seq=13 Ack=250000002 Win=2002944 Len=0 TSV=5424276 TSER=5409237
243696  45.739829     10.0.1.2 -> 10.0.1.3     TCP 9040 > 37163 [ACK] Seq=250000002 Ack=14 Win=14528 Len=0 TSV=5409258 TSER=5424276
  1   0.000000     10.0.1.3 -> 10.0.1.2     TCP 37165 > 9040 [SYN] Seq=0 Win=5840 Len=0 MSS=1460 TSV=5429007 TSER=0 WS=6
  2   0.000290     10.0.1.2 -> 10.0.1.3     TCP 9040 > 37165 [SYN, ACK] Seq=0 Ack=1 Win=14480 Len=0 MSS=1460 TSV=5413990 TSER=5429007 WS=6
  3   0.000312     10.0.1.3 -> 10.0.1.2     TCP 37165 > 9040 [ACK] Seq=1 Ack=1 Win=5888 Len=0 TSV=5429007 TSER=5413990
  7   0.002187     10.0.1.2 -> 10.0.1.3     TCP 9040 > 37165 [ACK] Seq=1 Ack=13 Win=14528 Len=0 TSV=5413990 TSER=5429007
253758  45.342012     10.0.1.3 -> 10.0.1.2     TCP 37165 > 9040 [FIN, ACK] Seq=13 Ack=250000002 Win=2020288 Len=0 TSV=5440343 TSER=5425305
253759  45.342262     10.0.1.2 -> 10.0.1.3     TCP 9040 > 37165 [ACK] Seq=250000002 Ack=14 Win=14528 Len=0 TSV=5425326 TSER=5440343
  1   0.000000     10.0.1.3 -> 10.0.1.2     TCP 37167 > 9040 [SYN] Seq=0 Win=5840 Len=0 MSS=1460 TSV=5444871 TSER=0 WS=6
  2   0.000335     10.0.1.2 -> 10.0.1.3     TCP 9040 > 37167 [SYN, ACK] Seq=0 Ack=1 Win=14480 Len=0 MSS=1460 TSV=5429855 TSER=5444871 WS=6
  3   0.000357     10.0.1.3 -> 10.0.1.2     TCP 37167 > 9040 [ACK] Seq=1 Ack=1 Win=5888 Len=0 TSV=5444871 TSER=5429855
  7   0.002306     10.0.1.2 -> 10.0.1.3     TCP 9040 > 37167 [ACK] Seq=1 Ack=13 Win=14528 Len=0 TSV=5429855 TSER=5444872
249637  45.000082     10.0.1.3 -> 10.0.1.2     TCP 37167 > 9040 [FIN, ACK] Seq=13 Ack=250000002 Win=2017408 Len=0 TSV=5456121 TSER=5441084
249638  45.000304     10.0.1.2 -> 10.0.1.3     TCP 9040 > 37167 [ACK] Seq=250000002 Ack=14 Win=14528 Len=0 TSV=5441106 TSER=5456121
  1   0.000000     10.0.1.3 -> 10.0.1.2     TCP 37169 > 9040 [SYN] Seq=0 Win=5840 Len=0 MSS=1460 TSV=5460861 TSER=0 WS=6
  2   0.000330     10.0.1.2 -> 10.0.1.3     TCP 9040 > 37169 [SYN, ACK] Seq=0 Ack=1 Win=14480 Len=0 MSS=1460 TSV=5445846 TSER=5460861 WS=6
  3   0.000363     10.0.1.3 -> 10.0.1.2     TCP 37169 > 9040 [ACK] Seq=1 Ack=1 Win=5888 Len=0 TSV=5460861 TSER=5445846
  7   0.003659     10.0.1.2 -> 10.0.1.3     TCP 9040 > 37169 [ACK] Seq=1 Ack=13 Win=14528 Len=0 TSV=5445847 TSER=5460862
258383  45.535581     10.0.1.3 -> 10.0.1.2     TCP 37169 > 9040 [FIN, ACK] Seq=13 Ack=250000002 Win=2002944 Len=0 TSV=5472245 TSER=5457209
258384  45.535824     10.0.1.2 -> 10.0.1.3     TCP 9040 > 37169 [ACK] Seq=250000002 Ack=14 Win=14528 Len=0 TSV=5457231 TSER=5472245
  1   0.000000     10.0.1.3 -> 10.0.1.2     TCP 40973 > 9040 [SYN] Seq=0 Win=5840 Len=0 MSS=1460 TSV=5477149 TSER=0 WS=6
  2   0.000288     10.0.1.2 -> 10.0.1.3     TCP 9040 > 40973 [SYN, ACK] Seq=0 Ack=1 Win=14480 Len=0 MSS=1460 TSV=5462135 TSER=5477149 WS=6
  3   0.000311     10.0.1.3 -> 10.0.1.2     TCP 40973 > 9040 [ACK] Seq=1 Ack=1 Win=5888 Len=0 TSV=5477149 TSER=5462135
  7   0.002162     10.0.1.2 -> 10.0.1.3     TCP 9040 > 40973 [ACK] Seq=1 Ack=13 Win=14528 Len=0 TSV=5462135 TSER=5477149
257499  45.626243     10.0.1.3 -> 10.0.1.2     TCP 40973 > 9040 [FIN, ACK] Seq=13 Ack=250000002 Win=2002944 Len=0 TSV=5488555 TSER=5473521
257500  45.626521     10.0.1.2 -> 10.0.1.3     TCP 9040 > 40973 [ACK] Seq=250000002 Ack=14 Win=14528 Len=0 TSV=5473542 TSER=5488555
  1   0.000000     10.0.1.3 -> 10.0.1.2     TCP 40975 > 9040 [SYN] Seq=0 Win=5840 Len=0 MSS=1460 TSV=5493421 TSER=0 WS=6
  2   0.000308     10.0.1.2 -> 10.0.1.3     TCP 9040 > 40975 [SYN, ACK] Seq=0 Ack=1 Win=14480 Len=0 MSS=1460 TSV=5478408 TSER=5493421 WS=6
  3   0.000332     10.0.1.3 -> 10.0.1.2     TCP 40975 > 9040 [ACK] Seq=1 Ack=1 Win=5888 Len=0 TSV=5493421 TSER=5478408
  7   0.002193     10.0.1.2 -> 10.0.1.3     TCP 9040 > 40975 [ACK] Seq=1 Ack=13 Win=14528 Len=0 TSV=5478409 TSER=5493421
257944  45.876399     10.0.1.3 -> 10.0.1.2     TCP 40975 > 9040 [FIN, ACK] Seq=13 Ack=250000002 Win=2002944 Len=0 TSV=5504890 TSER=5489857
257945  45.876652     10.0.1.2 -> 10.0.1.3     TCP 9040 > 40975 [ACK] Seq=250000002 Ack=14 Win=14528 Len=0 TSV=5489878 TSER=5504890
  1   0.000000     10.0.1.3 -> 10.0.1.2     TCP 40977 > 9040 [SYN] Seq=0 Win=5840 Len=0 MSS=1460 TSV=5509794 TSER=0 WS=6
  2   0.000312     10.0.1.2 -> 10.0.1.3     TCP 9040 > 40977 [SYN, ACK] Seq=0 Ack=1 Win=14480 Len=0 MSS=1460 TSV=5494783 TSER=5509794 WS=6
  3   0.000335     10.0.1.3 -> 10.0.1.2     TCP 40977 > 9040 [ACK] Seq=1 Ack=1 Win=5888 Len=0 TSV=5509795 TSER=5494783
  7   0.002226     10.0.1.2 -> 10.0.1.3     TCP 9040 > 40977 [ACK] Seq=1 Ack=13 Win=14528 Len=0 TSV=5494784 TSER=5509795
258019  45.613382     10.0.1.3 -> 10.0.1.2     TCP 40977 > 9040 [FIN, ACK] Seq=13 Ack=250000002 Win=2026112 Len=0 TSV=5521198 TSER=5506166
258020  45.613636     10.0.1.2 -> 10.0.1.3     TCP 9040 > 40977 [ACK] Seq=250000002 Ack=14 Win=14528 Len=0 TSV=5506187 TSER=5521198
