  1   0.000000     10.0.1.3 -> 10.0.1.2     TCP 42168 > 9040 [SYN] Seq=0 Win=5840 Len=0 MSS=1460 TSV=325081 TSER=0 WS=6
  2   0.000273     10.0.1.2 -> 10.0.1.3     TCP 9040 > 42168 [SYN, ACK] Seq=0 Ack=1 Win=14480 Len=0 MSS=1460 TSV=732688 TSER=325081 WS=6
  3   0.000329     10.0.1.3 -> 10.0.1.2     TCP 42168 > 9040 [ACK] Seq=1 Ack=1 Win=5888 Len=0 TSV=325082 TSER=732688
  7   0.004195     10.0.1.2 -> 10.0.1.3     TCP 9040 > 42168 [ACK] Seq=1 Ack=13 Win=14528 Len=0 TSV=732689 TSER=325083
227926  21.391409     10.0.1.3 -> 10.0.1.2     TCP 42168 > 9040 [FIN, ACK] Seq=13 Ack=250000002 Win=2580480 Len=0 TSV=330430 TSER=737981
227927  21.391658     10.0.1.2 -> 10.0.1.3     TCP 9040 > 42168 [ACK] Seq=250000002 Ack=14 Win=14528 Len=0 TSV=738036 TSER=330430
  1   0.000000     10.0.1.3 -> 10.0.1.2     TCP 42170 > 9040 [SYN] Seq=0 Win=5840 Len=0 MSS=1460 TSV=334884 TSER=0 WS=6
  2   0.000319     10.0.1.2 -> 10.0.1.3     TCP 9040 > 42170 [SYN, ACK] Seq=0 Ack=1 Win=14480 Len=0 MSS=1460 TSV=742491 TSER=334884 WS=6
  3   0.000346     10.0.1.3 -> 10.0.1.2     TCP 42170 > 9040 [ACK] Seq=1 Ack=1 Win=5888 Len=0 TSV=334885 TSER=742491
  7   0.002286     10.0.1.2 -> 10.0.1.3     TCP 9040 > 42170 [ACK] Seq=1 Ack=13 Win=14528 Len=0 TSV=742492 TSER=334885
239860  21.308631     10.0.1.3 -> 10.0.1.2     TCP 42170 > 9040 [FIN, ACK] Seq=13 Ack=250000002 Win=2580480 Len=0 TSV=340212 TSER=747764
239861  21.308883     10.0.1.2 -> 10.0.1.3     TCP 9040 > 42170 [ACK] Seq=250000002 Ack=14 Win=14528 Len=0 TSV=747819 TSER=340212
  1   0.000000     10.0.1.3 -> 10.0.1.2     TCP 42172 > 9040 [SYN] Seq=0 Win=5840 Len=0 MSS=1460 TSV=344728 TSER=0 WS=6
  2   0.000301     10.0.1.2 -> 10.0.1.3     TCP 9040 > 42172 [SYN, ACK] Seq=0 Ack=1 Win=14480 Len=0 MSS=1460 TSV=752335 TSER=344728 WS=6
  3   0.000324     10.0.1.3 -> 10.0.1.2     TCP 42172 > 9040 [ACK] Seq=1 Ack=1 Win=5888 Len=0 TSV=344728 TSER=752335
  7   0.002242     10.0.1.2 -> 10.0.1.3     TCP 9040 > 42172 [ACK] Seq=1 Ack=13 Win=14528 Len=0 TSV=752336 TSER=344728
239993  21.309162     10.0.1.3 -> 10.0.1.2     TCP 42172 > 9040 [FIN, ACK] Seq=13 Ack=250000002 Win=2580480 Len=0 TSV=350055 TSER=757608
239994  21.309409     10.0.1.2 -> 10.0.1.3     TCP 9040 > 42172 [ACK] Seq=250000002 Ack=14 Win=14528 Len=0 TSV=757663 TSER=350055
  1   0.000000     10.0.1.3 -> 10.0.1.2     TCP 42174 > 9040 [SYN] Seq=0 Win=5840 Len=0 MSS=1460 TSV=354717 TSER=0 WS=6
  2   0.000301     10.0.1.2 -> 10.0.1.3     TCP 9040 > 42174 [SYN, ACK] Seq=0 Ack=1 Win=14480 Len=0 MSS=1460 TSV=762326 TSER=354717 WS=6
  3   0.000323     10.0.1.3 -> 10.0.1.2     TCP 42174 > 9040 [ACK] Seq=1 Ack=1 Win=5888 Len=0 TSV=354718 TSER=762326
  7   0.002174     10.0.1.2 -> 10.0.1.3     TCP 9040 > 42174 [ACK] Seq=1 Ack=13 Win=14528 Len=0 TSV=762326 TSER=354718
243065  21.304483     10.0.1.3 -> 10.0.1.2     TCP 42174 > 9040 [FIN, ACK] Seq=13 Ack=250000002 Win=2580480 Len=0 TSV=360044 TSER=767597
243066  21.304736     10.0.1.2 -> 10.0.1.3     TCP 9040 > 42174 [ACK] Seq=250000002 Ack=14 Win=14528 Len=0 TSV=767652 TSER=360044
  1   0.000000     10.0.1.3 -> 10.0.1.2     TCP 42176 > 9040 [SYN] Seq=0 Win=5840 Len=0 MSS=1460 TSV=364787 TSER=0 WS=6
  2   0.000270     10.0.1.2 -> 10.0.1.3     TCP 9040 > 42176 [SYN, ACK] Seq=0 Ack=1 Win=14480 Len=0 MSS=1460 TSV=772396 TSER=364787 WS=6
  3   0.000295     10.0.1.3 -> 10.0.1.2     TCP 42176 > 9040 [ACK] Seq=1 Ack=1 Win=5888 Len=0 TSV=364787 TSER=772396
  7   0.002269     10.0.1.2 -> 10.0.1.3     TCP 9040 > 42176 [ACK] Seq=1 Ack=13 Win=14528 Len=0 TSV=772397 TSER=364787
234177  21.462614     10.0.1.3 -> 10.0.1.2     TCP 42176 > 9040 [FIN, ACK] Seq=13 Ack=250000002 Win=2580480 Len=0 TSV=370152 TSER=777707
234178  21.462878     10.0.1.2 -> 10.0.1.3     TCP 9040 > 42176 [ACK] Seq=250000002 Ack=14 Win=14528 Len=0 TSV=777762 TSER=370152
  1   0.000000     10.0.1.3 -> 10.0.1.2     TCP 42178 > 9040 [SYN] Seq=0 Win=5840 Len=0 MSS=1460 TSV=374767 TSER=0 WS=6
  2   0.000309     10.0.1.2 -> 10.0.1.3     TCP 9040 > 42178 [SYN, ACK] Seq=0 Ack=1 Win=14480 Len=0 MSS=1460 TSV=782377 TSER=374767 WS=6
  3   0.000330     10.0.1.3 -> 10.0.1.2     TCP 42178 > 9040 [ACK] Seq=1 Ack=1 Win=5888 Len=0 TSV=374767 TSER=782377
  7   0.002275     10.0.1.2 -> 10.0.1.3     TCP 9040 > 42178 [ACK] Seq=1 Ack=13 Win=14528 Len=0 TSV=782377 TSER=374767
250915  21.310871     10.0.1.3 -> 10.0.1.2     TCP 42178 > 9040 [FIN, ACK] Seq=13 Ack=250000002 Win=2580480 Len=0 TSV=380095 TSER=787650
250916  21.311126     10.0.1.2 -> 10.0.1.3     TCP 9040 > 42178 [ACK] Seq=250000002 Ack=14 Win=14528 Len=0 TSV=787705 TSER=380095
  1   0.000000     10.0.1.3 -> 10.0.1.2     TCP 46710 > 9040 [SYN] Seq=0 Win=5840 Len=0 MSS=1460 TSV=384915 TSER=0 WS=6
  2   0.000352     10.0.1.2 -> 10.0.1.3     TCP 9040 > 46710 [SYN, ACK] Seq=0 Ack=1 Win=14480 Len=0 MSS=1460 TSV=792526 TSER=384915 WS=6
  3   0.000391     10.0.1.3 -> 10.0.1.2     TCP 46710 > 9040 [ACK] Seq=1 Ack=1 Win=5888 Len=0 TSV=384916 TSER=792526
  7   0.002571     10.0.1.2 -> 10.0.1.3     TCP 9040 > 46710 [ACK] Seq=1 Ack=13 Win=14528 Len=0 TSV=792527 TSER=384916
245173  21.325594     10.0.1.3 -> 10.0.1.2     TCP 46710 > 9040 [FIN, ACK] Seq=13 Ack=250000002 Win=2580480 Len=0 TSV=390247 TSER=797803
245174  21.325830     10.0.1.2 -> 10.0.1.3     TCP 9040 > 46710 [ACK] Seq=250000002 Ack=14 Win=14528 Len=0 TSV=797858 TSER=390247
  1   0.000000     10.0.1.3 -> 10.0.1.2     TCP 46713 > 9040 [SYN] Seq=0 Win=5840 Len=0 MSS=1460 TSV=394992 TSER=0 WS=6
  2   0.000318     10.0.1.2 -> 10.0.1.3     TCP 9040 > 46713 [SYN, ACK] Seq=0 Ack=1 Win=14480 Len=0 MSS=1460 TSV=802604 TSER=394992 WS=6
  3   0.000339     10.0.1.3 -> 10.0.1.2     TCP 46713 > 9040 [ACK] Seq=1 Ack=1 Win=5888 Len=0 TSV=394992 TSER=802604
  7   0.002414     10.0.1.2 -> 10.0.1.3     TCP 9040 > 46713 [ACK] Seq=1 Ack=13 Win=14528 Len=0 TSV=802604 TSER=394993
252809  21.306240     10.0.1.3 -> 10.0.1.2     TCP 46713 > 9040 [FIN, ACK] Seq=13 Ack=250000002 Win=2580480 Len=0 TSV=400319 TSER=807876
252810  21.306495     10.0.1.2 -> 10.0.1.3     TCP 9040 > 46713 [ACK] Seq=250000002 Ack=14 Win=14528 Len=0 TSV=807931 TSER=400319
  1   0.000000     10.0.1.3 -> 10.0.1.2     TCP 46715 > 9040 [SYN] Seq=0 Win=5840 Len=0 MSS=1460 TSV=405025 TSER=0 WS=6
  2   0.000292     10.0.1.2 -> 10.0.1.3     TCP 9040 > 46715 [SYN, ACK] Seq=0 Ack=1 Win=14480 Len=0 MSS=1460 TSV=812637 TSER=405025 WS=6
  3   0.000314     10.0.1.3 -> 10.0.1.2     TCP 46715 > 9040 [ACK] Seq=1 Ack=1 Win=5888 Len=0 TSV=405025 TSER=812637
  7   0.002226     10.0.1.2 -> 10.0.1.3     TCP 9040 > 46715 [ACK] Seq=1 Ack=13 Win=14528 Len=0 TSV=812637 TSER=405025
252482  21.307912     10.0.1.3 -> 10.0.1.2     TCP 46715 > 9040 [FIN, ACK] Seq=13 Ack=250000002 Win=2580480 Len=0 TSV=410352 TSER=817909
252483  21.308166     10.0.1.2 -> 10.0.1.3     TCP 9040 > 46715 [ACK] Seq=250000002 Ack=14 Win=14528 Len=0 TSV=817964 TSER=410352
  1   0.000000     10.0.1.3 -> 10.0.1.2     TCP 46719 > 9040 [SYN] Seq=0 Win=5840 Len=0 MSS=1460 TSV=415121 TSER=0 WS=6
  2   0.000279     10.0.1.2 -> 10.0.1.3     TCP 9040 > 46719 [SYN, ACK] Seq=0 Ack=1 Win=14480 Len=0 MSS=1460 TSV=822734 TSER=415121 WS=6
  3   0.000301     10.0.1.3 -> 10.0.1.2     TCP 46719 > 9040 [ACK] Seq=1 Ack=1 Win=5888 Len=0 TSV=415121 TSER=822734
  7   0.002616     10.0.1.2 -> 10.0.1.3     TCP 9040 > 46719 [ACK] Seq=1 Ack=13 Win=14528 Len=0 TSV=822735 TSER=415122
253986  21.309606     10.0.1.3 -> 10.0.1.2     TCP 46719 > 9040 [FIN, ACK] Seq=13 Ack=250000002 Win=2580480 Len=0 TSV=420449 TSER=828007
253987  21.309853     10.0.1.2 -> 10.0.1.3     TCP 9040 > 46719 [ACK] Seq=250000002 Ack=14 Win=14528 Len=0 TSV=828062 TSER=420449
  1   0.000000     10.0.1.3 -> 10.0.1.2     TCP 46721 > 9040 [SYN] Seq=0 Win=5840 Len=0 MSS=1460 TSV=425230 TSER=0 WS=6
  2   0.000312     10.0.1.2 -> 10.0.1.3     TCP 9040 > 46721 [SYN, ACK] Seq=0 Ack=1 Win=14480 Len=0 MSS=1460 TSV=832844 TSER=425230 WS=6
  3   0.000337     10.0.1.3 -> 10.0.1.2     TCP 46721 > 9040 [ACK] Seq=1 Ack=1 Win=5888 Len=0 TSV=425230 TSER=832844
  7   0.002197     10.0.1.2 -> 10.0.1.3     TCP 9040 > 46721 [ACK] Seq=1 Ack=13 Win=14528 Len=0 TSV=832844 TSER=425230
252898  21.309562     10.0.1.3 -> 10.0.1.2     TCP 46721 > 9040 [FIN, ACK] Seq=13 Ack=250000002 Win=2580480 Len=0 TSV=430557 TSER=838117
252899  21.309808     10.0.1.2 -> 10.0.1.3     TCP 9040 > 46721 [ACK] Seq=250000002 Ack=14 Win=14528 Len=0 TSV=838172 TSER=430557
  1   0.000000     10.0.1.3 -> 10.0.1.2     TCP 46723 > 9040 [SYN] Seq=0 Win=5840 Len=0 MSS=1460 TSV=435409 TSER=0 WS=6
  2   0.000283     10.0.1.2 -> 10.0.1.3     TCP 9040 > 46723 [SYN, ACK] Seq=0 Ack=1 Win=14480 Len=0 MSS=1460 TSV=843024 TSER=435409 WS=6
  3   0.000306     10.0.1.3 -> 10.0.1.2     TCP 46723 > 9040 [ACK] Seq=1 Ack=1 Win=5888 Len=0 TSV=435409 TSER=843024
  7   0.002219     10.0.1.2 -> 10.0.1.3     TCP 9040 > 46723 [ACK] Seq=1 Ack=13 Win=14528 Len=0 TSV=843024 TSER=435410
250252  21.309464     10.0.1.3 -> 10.0.1.2     TCP 46723 > 9040 [FIN, ACK] Seq=13 Ack=250000002 Win=2580480 Len=0 TSV=440737 TSER=848297
250253  21.309675     10.0.1.2 -> 10.0.1.3     TCP 9040 > 46723 [ACK] Seq=250000002 Ack=14 Win=14528 Len=0 TSV=848352 TSER=440737
  1   0.000000     10.0.1.3 -> 10.0.1.2     TCP 46725 > 9040 [SYN] Seq=0 Win=5840 Len=0 MSS=1460 TSV=445531 TSER=0 WS=6
  2   0.000303     10.0.1.2 -> 10.0.1.3     TCP 9040 > 46725 [SYN, ACK] Seq=0 Ack=1 Win=14480 Len=0 MSS=1460 TSV=853146 TSER=445531 WS=6
  3   0.000325     10.0.1.3 -> 10.0.1.2     TCP 46725 > 9040 [ACK] Seq=1 Ack=1 Win=5888 Len=0 TSV=445531 TSER=853146
  7   0.002255     10.0.1.2 -> 10.0.1.3     TCP 9040 > 46725 [ACK] Seq=1 Ack=13 Win=14528 Len=0 TSV=853147 TSER=445532
250308  21.311322     10.0.1.3 -> 10.0.1.2     TCP 46725 > 9040 [FIN, ACK] Seq=13 Ack=250000002 Win=2580352 Len=0 TSV=450859 TSER=858420
250309  21.311601     10.0.1.2 -> 10.0.1.3     TCP 9040 > 46725 [ACK] Seq=250000002 Ack=14 Win=14528 Len=0 TSV=858475 TSER=450859
  1   0.000000     10.0.1.3 -> 10.0.1.2     TCP 52341 > 9040 [SYN] Seq=0 Win=5840 Len=0 MSS=1460 TSV=455633 TSER=0 WS=6
  2   0.000311     10.0.1.2 -> 10.0.1.3     TCP 9040 > 52341 [SYN, ACK] Seq=0 Ack=1 Win=14480 Len=0 MSS=1460 TSV=863249 TSER=455633 WS=6
  3   0.000334     10.0.1.3 -> 10.0.1.2     TCP 52341 > 9040 [ACK] Seq=1 Ack=1 Win=5888 Len=0 TSV=455633 TSER=863249
  7   0.002221     10.0.1.2 -> 10.0.1.3     TCP 9040 > 52341 [ACK] Seq=1 Ack=13 Win=14528 Len=0 TSV=863250 TSER=455633
  1   0.000000     10.0.1.3 -> 10.0.1.2     TCP 52343 > 9040 [SYN] Seq=0 Win=5840 Len=0 MSS=1460 TSV=465530 TSER=0 WS=6
  2   0.000290     10.0.1.2 -> 10.0.1.3     TCP 9040 > 52343 [SYN, ACK] Seq=0 Ack=1 Win=14480 Len=0 MSS=1460 TSV=873147 TSER=465530 WS=6
  3   0.000316     10.0.1.3 -> 10.0.1.2     TCP 52343 > 9040 [ACK] Seq=1 Ack=1 Win=5888 Len=0 TSV=465530 TSER=873147
  7   0.002893     10.0.1.2 -> 10.0.1.3     TCP 9040 > 52343 [ACK] Seq=1 Ack=13 Win=14528 Len=0 TSV=873148 TSER=465531
253079  21.314361     10.0.1.3 -> 10.0.1.2     TCP 52343 > 9040 [FIN, ACK] Seq=13 Ack=250000002 Win=2580480 Len=0 TSV=470859 TSER=878421
253080  21.314617     10.0.1.2 -> 10.0.1.3     TCP 9040 > 52343 [ACK] Seq=250000002 Ack=14 Win=14528 Len=0 TSV=878476 TSER=470859
  1   0.000000     10.0.1.3 -> 10.0.1.2     TCP 52345 > 9040 [SYN] Seq=0 Win=5840 Len=0 MSS=1460 TSV=475753 TSER=0 WS=6
  2   0.000271     10.0.1.2 -> 10.0.1.3     TCP 9040 > 52345 [SYN, ACK] Seq=0 Ack=1 Win=14480 Len=0 MSS=1460 TSV=883371 TSER=475753 WS=6
  3   0.000295     10.0.1.3 -> 10.0.1.2     TCP 52345 > 9040 [ACK] Seq=1 Ack=1 Win=5888 Len=0 TSV=475753 TSER=883371
  7   0.002180     10.0.1.2 -> 10.0.1.3     TCP 9040 > 52345 [ACK] Seq=1 Ack=13 Win=14528 Len=0 TSV=883371 TSER=475753
233666  21.309643     10.0.1.3 -> 10.0.1.2     TCP 52345 > 9040 [FIN, ACK] Seq=13 Ack=250000002 Win=2580480 Len=0 TSV=481080 TSER=888644
233667  21.309895     10.0.1.2 -> 10.0.1.3     TCP 9040 > 52345 [ACK] Seq=250000002 Ack=14 Win=14528 Len=0 TSV=888699 TSER=481080
  1   0.000000     10.0.1.3 -> 10.0.1.2     TCP 52347 > 9040 [SYN] Seq=0 Win=5840 Len=0 MSS=1460 TSV=485714 TSER=0 WS=6
  2   0.000278     10.0.1.2 -> 10.0.1.3     TCP 9040 > 52347 [SYN, ACK] Seq=0 Ack=1 Win=14480 Len=0 MSS=1460 TSV=893333 TSER=485714 WS=6
  3   0.000304     10.0.1.3 -> 10.0.1.2     TCP 52347 > 9040 [ACK] Seq=1 Ack=1 Win=5888 Len=0 TSV=485714 TSER=893333
  7   0.002520     10.0.1.2 -> 10.0.1.3     TCP 9040 > 52347 [ACK] Seq=1 Ack=13 Win=14528 Len=0 TSV=893333 TSER=485715
245231  21.396933     10.0.1.3 -> 10.0.1.2     TCP 52347 > 9040 [FIN, ACK] Seq=13 Ack=250000002 Win=2580480 Len=0 TSV=491064 TSER=898627
245232  21.397191     10.0.1.2 -> 10.0.1.3     TCP 9040 > 52347 [ACK] Seq=250000002 Ack=14 Win=14528 Len=0 TSV=898682 TSER=491064
  1   0.000000     10.0.1.3 -> 10.0.1.2     TCP 52349 > 9040 [SYN] Seq=0 Win=5840 Len=0 MSS=1460 TSV=495820 TSER=0 WS=6
  2   0.000313     10.0.1.2 -> 10.0.1.3     TCP 9040 > 52349 [SYN, ACK] Seq=0 Ack=1 Win=14480 Len=0 MSS=1460 TSV=903440 TSER=495820 WS=6
  3   0.000336     10.0.1.3 -> 10.0.1.2     TCP 52349 > 9040 [ACK] Seq=1 Ack=1 Win=5888 Len=0 TSV=495820 TSER=903440
  7   0.002359     10.0.1.2 -> 10.0.1.3     TCP 9040 > 52349 [ACK] Seq=1 Ack=13 Win=14528 Len=0 TSV=903440 TSER=495821
229951  21.306375     10.0.1.3 -> 10.0.1.2     TCP 52349 > 9040 [FIN, ACK] Seq=13 Ack=250000002 Win=2580480 Len=0 TSV=501147 TSER=908711
229952  21.306631     10.0.1.2 -> 10.0.1.3     TCP 9040 > 52349 [ACK] Seq=250000002 Ack=14 Win=14528 Len=0 TSV=908766 TSER=501147
  1   0.000000     10.0.1.3 -> 10.0.1.2     TCP 52351 > 9040 [SYN] Seq=0 Win=5840 Len=0 MSS=1460 TSV=505468 TSER=0 WS=6
  2   0.000316     10.0.1.2 -> 10.0.1.3     TCP 9040 > 52351 [SYN, ACK] Seq=0 Ack=1 Win=14480 Len=0 MSS=1460 TSV=913088 TSER=505468 WS=6
  3   0.000340     10.0.1.3 -> 10.0.1.2     TCP 52351 > 9040 [ACK] Seq=1 Ack=1 Win=5888 Len=0 TSV=505468 TSER=913088
  7   0.002228     10.0.1.2 -> 10.0.1.3     TCP 9040 > 52351 [ACK] Seq=1 Ack=13 Win=14528 Len=0 TSV=913088 TSER=505468
228198  21.309485     10.0.1.3 -> 10.0.1.2     TCP 52351 > 9040 [FIN, ACK] Seq=13 Ack=250000002 Win=2580480 Len=0 TSV=510795 TSER=918361
228199  21.309730     10.0.1.2 -> 10.0.1.3     TCP 9040 > 52351 [ACK] Seq=250000002 Ack=14 Win=14528 Len=0 TSV=918416 TSER=510795
  1   0.000000     10.0.1.3 -> 10.0.1.2     TCP 52353 > 9040 [SYN] Seq=0 Win=5840 Len=0 MSS=1460 TSV=515150 TSER=0 WS=6
  2   0.000305     10.0.1.2 -> 10.0.1.3     TCP 9040 > 52353 [SYN, ACK] Seq=0 Ack=1 Win=14480 Len=0 MSS=1460 TSV=922771 TSER=515150 WS=6
  3   0.000327     10.0.1.3 -> 10.0.1.2     TCP 52353 > 9040 [ACK] Seq=1 Ack=1 Win=5888 Len=0 TSV=515150 TSER=922771
  7   0.002277     10.0.1.2 -> 10.0.1.3     TCP 9040 > 52353 [ACK] Seq=1 Ack=13 Win=14528 Len=0 TSV=922771 TSER=515150
234094  21.325653     10.0.1.3 -> 10.0.1.2     TCP 52353 > 9040 [FIN, ACK] Seq=13 Ack=250000002 Win=2580480 Len=0 TSV=520482 TSER=928048
234095  21.325913     10.0.1.2 -> 10.0.1.3     TCP 9040 > 52353 [ACK] Seq=250000002 Ack=14 Win=14528 Len=0 TSV=928103 TSER=520482
