  1   0.000000     10.0.1.3 -> 10.0.1.2     TCP 54626 > 9040 [SYN] Seq=0 Win=5840 Len=0 MSS=1460 TSV=2613705 TSER=0 WS=6
  2   0.000309     10.0.1.2 -> 10.0.1.3     TCP 9040 > 54626 [SYN, ACK] Seq=0 Ack=1 Win=14480 Len=0 MSS=1460 TSV=2598672 TSER=2613705 WS=6
  3   0.000324     10.0.1.3 -> 10.0.1.2     TCP 54626 > 9040 [ACK] Seq=1 Ack=1 Win=5888 Len=0 TSV=2613705 TSER=2598672
  7   0.003804     10.0.1.2 -> 10.0.1.3     TCP 9040 > 54626 [ACK] Seq=1 Ack=13 Win=14528 Len=0 TSV=2598673 TSER=2613706
258750  21.312024     10.0.1.3 -> 10.0.1.2     TCP 54626 > 9040 [FIN, ACK] Seq=13 Ack=250000002 Win=2580480 Len=0 TSV=2619034 TSER=2603945
  1   0.000000     10.0.1.3 -> 10.0.1.2     TCP 54628 > 9040 [SYN] Seq=0 Win=5840 Len=0 MSS=1460 TSV=2623844 TSER=0 WS=6
  2   0.000294     10.0.1.2 -> 10.0.1.3     TCP 9040 > 54628 [SYN, ACK] Seq=0 Ack=1 Win=14480 Len=0 MSS=1460 TSV=2608811 TSER=2623844 WS=6
  3   0.000317     10.0.1.3 -> 10.0.1.2     TCP 54628 > 9040 [ACK] Seq=1 Ack=1 Win=5888 Len=0 TSV=2623844 TSER=2608811
  7   0.002258     10.0.1.2 -> 10.0.1.3     TCP 9040 > 54628 [ACK] Seq=1 Ack=13 Win=14528 Len=0 TSV=2608812 TSER=2623845
258831  21.342431     10.0.1.3 -> 10.0.1.2     TCP 54628 > 9040 [FIN, ACK] Seq=13 Ack=250000002 Win=2580480 Len=0 TSV=2629180 TSER=2614092
  1   0.000000     10.0.1.3 -> 10.0.1.2     TCP 42299 > 9040 [SYN] Seq=0 Win=5840 Len=0 MSS=1460 TSV=2634024 TSER=0 WS=6
  2   0.000366     10.0.1.2 -> 10.0.1.3     TCP 9040 > 42299 [SYN, ACK] Seq=0 Ack=1 Win=14480 Len=0 MSS=1460 TSV=2618992 TSER=2634024 WS=6
  3   0.000391     10.0.1.3 -> 10.0.1.2     TCP 42299 > 9040 [ACK] Seq=1 Ack=1 Win=5888 Len=0 TSV=2634024 TSER=2618992
  7   0.002274     10.0.1.2 -> 10.0.1.3     TCP 9040 > 42299 [ACK] Seq=1 Ack=13 Win=14528 Len=0 TSV=2618993 TSER=2634025
258630  27.209488     10.0.1.3 -> 10.0.1.2     TCP 42299 > 9040 [FIN, ACK] Seq=13 Ack=250000002 Win=2580480 Len=0 TSV=2640827 TSER=2625774
  1   0.000000     10.0.1.3 -> 10.0.1.2     TCP 42302 > 9040 [SYN] Seq=0 Win=5840 Len=0 MSS=1460 TSV=2645701 TSER=0 WS=6
  2   0.000382     10.0.1.2 -> 10.0.1.3     TCP 9040 > 42302 [SYN, ACK] Seq=0 Ack=1 Win=14480 Len=0 MSS=1460 TSV=2630670 TSER=2645701 WS=6
  3   0.000404     10.0.1.3 -> 10.0.1.2     TCP 42302 > 9040 [ACK] Seq=1 Ack=1 Win=5888 Len=0 TSV=2645701 TSER=2630670
  7   0.002408     10.0.1.2 -> 10.0.1.3     TCP 9040 > 42302 [ACK] Seq=1 Ack=13 Win=14528 Len=0 TSV=2630670 TSER=2645701
232756  47.426504     10.0.1.3 -> 10.0.1.2     TCP 42302 > 9040 [FIN, ACK] Seq=13 Ack=250000002 Win=2011584 Len=0 TSV=2657558 TSER=2642506
  1   0.000000     10.0.1.3 -> 10.0.1.2     TCP 42304 > 9040 [SYN] Seq=0 Win=5840 Len=0 MSS=1460 TSV=2662401 TSER=0 WS=6
  2   0.000270     10.0.1.2 -> 10.0.1.3     TCP 9040 > 42304 [SYN, ACK] Seq=0 Ack=1 Win=14480 Len=0 MSS=1460 TSV=2647372 TSER=2662401 WS=6
  3   0.000296     10.0.1.3 -> 10.0.1.2     TCP 42304 > 9040 [ACK] Seq=1 Ack=1 Win=5888 Len=0 TSV=2662401 TSER=2647372
  7   0.002307     10.0.1.2 -> 10.0.1.3     TCP 9040 > 42304 [ACK] Seq=1 Ack=13 Win=14528 Len=0 TSV=2647372 TSER=2662402
  1   0.000000     10.0.1.3 -> 10.0.1.2     TCP 42306 > 9040 [SYN] Seq=0 Win=5840 Len=0 MSS=1460 TSV=2678624 TSER=0 WS=6
  2   0.000405     10.0.1.2 -> 10.0.1.3     TCP 9040 > 42306 [SYN, ACK] Seq=0 Ack=1 Win=14480 Len=0 MSS=1460 TSV=2663596 TSER=2678624 WS=6
  3   0.000458     10.0.1.3 -> 10.0.1.2     TCP 42306 > 9040 [ACK] Seq=1 Ack=1 Win=5888 Len=0 TSV=2678624 TSER=2663596
  7   0.002680     10.0.1.2 -> 10.0.1.3     TCP 9040 > 42306 [ACK] Seq=1 Ack=13 Win=14528 Len=0 TSV=2663596 TSER=2678625
257997  45.510569     10.0.1.3 -> 10.0.1.2     TCP 42306 > 9040 [FIN, ACK] Seq=13 Ack=250000002 Win=2005824 Len=0 TSV=2690002 TSER=2674953
  1   0.000000     10.0.1.3 -> 10.0.1.2     TCP 42308 > 9040 [SYN] Seq=0 Win=5840 Len=0 MSS=1460 TSV=2694869 TSER=0 WS=6
  2   0.000273     10.0.1.2 -> 10.0.1.3     TCP 9040 > 42308 [SYN, ACK] Seq=0 Ack=1 Win=14480 Len=0 MSS=1460 TSV=2679842 TSER=2694869 WS=6
  3   0.000296     10.0.1.3 -> 10.0.1.2     TCP 42308 > 9040 [ACK] Seq=1 Ack=1 Win=5888 Len=0 TSV=2694869 TSER=2679842
  7   0.002553     10.0.1.2 -> 10.0.1.3     TCP 9040 > 42308 [ACK] Seq=1 Ack=13 Win=14528 Len=0 TSV=2679842 TSER=2694870
259197  45.240759     10.0.1.3 -> 10.0.1.2     TCP 42308 > 9040 [FIN, ACK] Seq=13 Ack=250000002 Win=2026112 Len=0 TSV=2706180 TSER=2691132
  1   0.000000     10.0.1.3 -> 10.0.1.2     TCP 37618 > 9040 [SYN] Seq=0 Win=5840 Len=0 MSS=1460 TSV=2711070 TSER=0 WS=6
  2   0.000312     10.0.1.2 -> 10.0.1.3     TCP 9040 > 37618 [SYN, ACK] Seq=0 Ack=1 Win=14480 Len=0 MSS=1460 TSV=2696044 TSER=2711070 WS=6
  3   0.000337     10.0.1.3 -> 10.0.1.2     TCP 37618 > 9040 [ACK] Seq=1 Ack=1 Win=5888 Len=0 TSV=2711070 TSER=2696044
  7   0.002308     10.0.1.2 -> 10.0.1.3     TCP 9040 > 37618 [ACK] Seq=1 Ack=13 Win=14528 Len=0 TSV=2696044 TSER=2711071
258148  46.464457     10.0.1.3 -> 10.0.1.2     TCP 37618 > 9040 [FIN, ACK] Seq=13 Ack=250000002 Win=2008704 Len=0 TSV=2722686 TSER=2707639
  1   0.000000     10.0.1.3 -> 10.0.1.2     TCP 37621 > 9040 [SYN] Seq=0 Win=5840 Len=0 MSS=1460 TSV=2727571 TSER=0 WS=6
  2   0.000368     10.0.1.2 -> 10.0.1.3     TCP 9040 > 37621 [SYN, ACK] Seq=0 Ack=1 Win=14480 Len=0 MSS=1460 TSV=2712546 TSER=2727571 WS=6
  3   0.000394     10.0.1.3 -> 10.0.1.2     TCP 37621 > 9040 [ACK] Seq=1 Ack=1 Win=5888 Len=0 TSV=2727571 TSER=2712546
  7   0.002257     10.0.1.2 -> 10.0.1.3     TCP 9040 > 37621 [ACK] Seq=1 Ack=13 Win=14528 Len=0 TSV=2712546 TSER=2727571
243876  45.387938     10.0.1.3 -> 10.0.1.2     TCP 37621 > 9040 [FIN, ACK] Seq=13 Ack=250000002 Win=2014528 Len=0 TSV=2738918 TSER=2723872
  1   0.000000     10.0.1.3 -> 10.0.1.2     TCP 37624 > 9040 [SYN] Seq=0 Win=5840 Len=0 MSS=1460 TSV=2743804 TSER=0 WS=6
  2   0.000267     10.0.1.2 -> 10.0.1.3     TCP 9040 > 37624 [SYN, ACK] Seq=0 Ack=1 Win=14480 Len=0 MSS=1460 TSV=2728780 TSER=2743804 WS=6
  3   0.000290     10.0.1.3 -> 10.0.1.2     TCP 37624 > 9040 [ACK] Seq=1 Ack=1 Win=5888 Len=0 TSV=2743804 TSER=2728780
  7   0.002268     10.0.1.2 -> 10.0.1.3     TCP 9040 > 37624 [ACK] Seq=1 Ack=13 Win=14528 Len=0 TSV=2728781 TSER=2743804
259476  45.913129     10.0.1.3 -> 10.0.1.2     TCP 37624 > 9040 [FIN, ACK] Seq=13 Ack=250000002 Win=2002944 Len=0 TSV=2755282 TSER=2740238
  1   0.000000     10.0.1.3 -> 10.0.1.2     TCP 37626 > 9040 [SYN] Seq=0 Win=5840 Len=0 MSS=1460 TSV=2760154 TSER=0 WS=6
  2   0.000299     10.0.1.2 -> 10.0.1.3     TCP 9040 > 37626 [SYN, ACK] Seq=0 Ack=1 Win=14480 Len=0 MSS=1460 TSV=2745131 TSER=2760154 WS=6
  3   0.000322     10.0.1.3 -> 10.0.1.2     TCP 37626 > 9040 [ACK] Seq=1 Ack=1 Win=5888 Len=0 TSV=2760154 TSER=2745131
  7   0.002184     10.0.1.2 -> 10.0.1.3     TCP 9040 > 37626 [ACK] Seq=1 Ack=13 Win=14528 Len=0 TSV=2745132 TSER=2760154
259583  45.524924     10.0.1.3 -> 10.0.1.2     TCP 37626 > 9040 [FIN, ACK] Seq=13 Ack=250000002 Win=2011584 Len=0 TSV=2771535 TSER=2756492
  1   0.000000     10.0.1.3 -> 10.0.1.2     TCP 54438 > 9040 [SYN] Seq=0 Win=5840 Len=0 MSS=1460 TSV=2776370 TSER=0 WS=6
  2   0.000301     10.0.1.2 -> 10.0.1.3     TCP 9040 > 54438 [SYN, ACK] Seq=0 Ack=1 Win=14480 Len=0 MSS=1460 TSV=2761349 TSER=2776370 WS=6
  3   0.000322     10.0.1.3 -> 10.0.1.2     TCP 54438 > 9040 [ACK] Seq=1 Ack=1 Win=5888 Len=0 TSV=2776371 TSER=2761349
  7   0.002212     10.0.1.2 -> 10.0.1.3     TCP 9040 > 54438 [ACK] Seq=1 Ack=13 Win=14528 Len=0 TSV=2761350 TSER=2776371
259561  45.321173     10.0.1.3 -> 10.0.1.2     TCP 54438 > 9040 [FIN, ACK] Seq=13 Ack=250000002 Win=2023168 Len=0 TSV=2787701 TSER=2772659
  1   0.000000     10.0.1.3 -> 10.0.1.2     TCP 54440 > 9040 [SYN] Seq=0 Win=5840 Len=0 MSS=1460 TSV=2792535 TSER=0 WS=6
  2   0.000283     10.0.1.2 -> 10.0.1.3     TCP 9040 > 54440 [SYN, ACK] Seq=0 Ack=1 Win=14480 Len=0 MSS=1460 TSV=2777515 TSER=2792535 WS=6
  3   0.000318     10.0.1.3 -> 10.0.1.2     TCP 54440 > 9040 [ACK] Seq=1 Ack=1 Win=5888 Len=0 TSV=2792535 TSER=2777515
  7   0.003603     10.0.1.2 -> 10.0.1.3     TCP 9040 > 54440 [ACK] Seq=1 Ack=13 Win=14528 Len=0 TSV=2777516 TSER=2792536
258801  45.405583     10.0.1.3 -> 10.0.1.2     TCP 54440 > 9040 [FIN, ACK] Seq=13 Ack=250000002 Win=2008704 Len=0 TSV=2803886 TSER=2788846
  1   0.000000     10.0.1.3 -> 10.0.1.2     TCP 54444 > 9040 [SYN] Seq=0 Win=5840 Len=0 MSS=1460 TSV=2808811 TSER=0 WS=6
  2   0.000333     10.0.1.2 -> 10.0.1.3     TCP 9040 > 54444 [SYN, ACK] Seq=0 Ack=1 Win=14480 Len=0 MSS=1460 TSV=2793792 TSER=2808811 WS=6
  3   0.000355     10.0.1.3 -> 10.0.1.2     TCP 54444 > 9040 [ACK] Seq=1 Ack=1 Win=5888 Len=0 TSV=2808811 TSER=2793792
  7   0.002142     10.0.1.2 -> 10.0.1.3     TCP 9040 > 54444 [ACK] Seq=1 Ack=13 Win=14528 Len=0 TSV=2793792 TSER=2808811
257246  46.632357     10.0.1.3 -> 10.0.1.2     TCP 54444 > 9040 [FIN, ACK] Seq=13 Ack=250000002 Win=2014528 Len=0 TSV=2820469 TSER=2805430
  1   0.000000     10.0.1.3 -> 10.0.1.2     TCP 54446 > 9040 [SYN] Seq=0 Win=5840 Len=0 MSS=1460 TSV=2825371 TSER=0 WS=6
  2   0.000290     10.0.1.2 -> 10.0.1.3     TCP 9040 > 54446 [SYN, ACK] Seq=0 Ack=1 Win=14480 Len=0 MSS=1460 TSV=2810353 TSER=2825371 WS=6
  3   0.000313     10.0.1.3 -> 10.0.1.2     TCP 54446 > 9040 [ACK] Seq=1 Ack=1 Win=5888 Len=0 TSV=2825371 TSER=2810353
  7   0.002215     10.0.1.2 -> 10.0.1.3     TCP 9040 > 54446 [ACK] Seq=1 Ack=13 Win=14528 Len=0 TSV=2810354 TSER=2825372
248172  46.708721     10.0.1.3 -> 10.0.1.2     TCP 54446 > 9040 [FIN, ACK] Seq=13 Ack=250000002 Win=2026112 Len=0 TSV=2837048 TSER=2822010
  1   0.000000     10.0.1.3 -> 10.0.1.2     TCP 54448 > 9040 [SYN] Seq=0 Win=5840 Len=0 MSS=1460 TSV=2841828 TSER=0 WS=6
  2   0.000298     10.0.1.2 -> 10.0.1.3     TCP 9040 > 54448 [SYN, ACK] Seq=0 Ack=1 Win=14480 Len=0 MSS=1460 TSV=2826812 TSER=2841828 WS=6
  3   0.000330     10.0.1.3 -> 10.0.1.2     TCP 54448 > 9040 [ACK] Seq=1 Ack=1 Win=5888 Len=0 TSV=2841828 TSER=2826812
  7   0.003115     10.0.1.2 -> 10.0.1.3     TCP 9040 > 54448 [ACK] Seq=1 Ack=13 Win=14528 Len=0 TSV=2826812 TSER=2841829
242439  45.842725     10.0.1.3 -> 10.0.1.2     TCP 54448 > 9040 [FIN, ACK] Seq=13 Ack=250000002 Win=2020288 Len=0 TSV=2853289 TSER=2838252
  1   0.000000     10.0.1.3 -> 10.0.1.2     TCP 56911 > 9040 [SYN] Seq=0 Win=5840 Len=0 MSS=1460 TSV=2857834 TSER=0 WS=6
  2   0.000306     10.0.1.2 -> 10.0.1.3     TCP 9040 > 56911 [SYN, ACK] Seq=0 Ack=1 Win=14480 Len=0 MSS=1460 TSV=2842819 TSER=2857834 WS=6
  3   0.000332     10.0.1.3 -> 10.0.1.2     TCP 56911 > 9040 [ACK] Seq=1 Ack=1 Win=5888 Len=0 TSV=2857834 TSER=2842819
  7   0.002224     10.0.1.2 -> 10.0.1.3     TCP 9040 > 56911 [ACK] Seq=1 Ack=13 Win=14528 Len=0 TSV=2842820 TSER=2857835
259578  45.537070     10.0.1.3 -> 10.0.1.2     TCP 56911 > 9040 [FIN, ACK] Seq=13 Ack=250000002 Win=2005824 Len=0 TSV=2869218 TSER=2854183
  1   0.000000     10.0.1.3 -> 10.0.1.2     TCP 56913 > 9040 [SYN] Seq=0 Win=5840 Len=0 MSS=1460 TSV=2874119 TSER=0 WS=6
  2   0.000304     10.0.1.2 -> 10.0.1.3     TCP 9040 > 56913 [SYN, ACK] Seq=0 Ack=1 Win=14480 Len=0 MSS=1460 TSV=2859106 TSER=2874119 WS=6
  3   0.000324     10.0.1.3 -> 10.0.1.2     TCP 56913 > 9040 [ACK] Seq=1 Ack=1 Win=5888 Len=0 TSV=2874120 TSER=2859106
  7   0.002272     10.0.1.2 -> 10.0.1.3     TCP 9040 > 56913 [ACK] Seq=1 Ack=13 Win=14528 Len=0 TSV=2859106 TSER=2874120
258093  45.100461     10.0.1.3 -> 10.0.1.2     TCP 56913 > 9040 [FIN, ACK] Seq=13 Ack=250000002 Win=2017408 Len=0 TSV=2885395 TSER=2870360
  1   0.000000     10.0.1.3 -> 10.0.1.2     TCP 56916 > 9040 [SYN] Seq=0 Win=5840 Len=0 MSS=1460 TSV=2890233 TSER=0 WS=6
  2   0.000302     10.0.1.2 -> 10.0.1.3     TCP 9040 > 56916 [SYN, ACK] Seq=0 Ack=1 Win=14480 Len=0 MSS=1460 TSV=2875221 TSER=2890233 WS=6
  3   0.000326     10.0.1.3 -> 10.0.1.2     TCP 56916 > 9040 [ACK] Seq=1 Ack=1 Win=5888 Len=0 TSV=2890234 TSER=2875221
  7   0.002281     10.0.1.2 -> 10.0.1.3     TCP 9040 > 56916 [ACK] Seq=1 Ack=13 Win=14528 Len=0 TSV=2875221 TSER=2890234
255030  45.117675     10.0.1.3 -> 10.0.1.2     TCP 56916 > 9040 [FIN, ACK] Seq=13 Ack=250000002 Win=2002944 Len=0 TSV=2901513 TSER=2886480
  1   0.000000     10.0.1.3 -> 10.0.1.2     TCP 56918 > 9040 [SYN] Seq=0 Win=5840 Len=0 MSS=1460 TSV=2906383 TSER=0 WS=6
  2   0.000280     10.0.1.2 -> 10.0.1.3     TCP 9040 > 56918 [SYN, ACK] Seq=0 Ack=1 Win=14480 Len=0 MSS=1460 TSV=2891372 TSER=2906383 WS=6
  3   0.000301     10.0.1.3 -> 10.0.1.2     TCP 56918 > 9040 [ACK] Seq=1 Ack=1 Win=5888 Len=0 TSV=2906383 TSER=2891372
  7   0.002212     10.0.1.2 -> 10.0.1.3     TCP 9040 > 56918 [ACK] Seq=1 Ack=13 Win=14528 Len=0 TSV=2891372 TSER=2906384
259357  45.709953     10.0.1.3 -> 10.0.1.2     TCP 56918 > 9040 [FIN, ACK] Seq=13 Ack=250000002 Win=2005824 Len=0 TSV=2917811 TSER=2902779
