  1   0.000000     10.0.1.3 -> 10.0.1.2     TCP 43783 > 9040 [SYN] Seq=0 Win=5840 Len=0 MSS=1460 TSV=2444284 TSER=0 WS=6
  2   0.000286     10.0.1.2 -> 10.0.1.3     TCP 9040 > 43783 [SYN, ACK] Seq=0 Ack=1 Win=14480 Len=0 MSS=1460 TSV=2429237 TSER=2444284 WS=6
  3   0.000310     10.0.1.3 -> 10.0.1.2     TCP 43783 > 9040 [ACK] Seq=1 Ack=1 Win=5888 Len=0 TSV=2444284 TSER=2429237
  7   0.002287     10.0.1.2 -> 10.0.1.3     TCP 9040 > 43783 [ACK] Seq=1 Ack=13 Win=14528 Len=0 TSV=2429238 TSER=2444284
207118  17.054997     10.0.1.3 -> 10.0.1.2     TCP 43783 > 9040 [FIN, ACK] Seq=13 Ack=200000002 Win=2580480 Len=0 TSV=2448547 TSER=2433446
  1   0.000000     10.0.1.3 -> 10.0.1.2     TCP 43785 > 9040 [SYN] Seq=0 Win=5840 Len=0 MSS=1460 TSV=2452762 TSER=0 WS=6
  2   0.000437     10.0.1.2 -> 10.0.1.3     TCP 9040 > 43785 [SYN, ACK] Seq=0 Ack=1 Win=14480 Len=0 MSS=1460 TSV=2437716 TSER=2452762 WS=6
  3   0.000462     10.0.1.3 -> 10.0.1.2     TCP 43785 > 9040 [ACK] Seq=1 Ack=1 Win=5888 Len=0 TSV=2452762 TSER=2437716
  7   0.002326     10.0.1.2 -> 10.0.1.3     TCP 9040 > 43785 [ACK] Seq=1 Ack=13 Win=14528 Len=0 TSV=2437717 TSER=2452762
206964  17.053845     10.0.1.3 -> 10.0.1.2     TCP 43785 > 9040 [FIN, ACK] Seq=13 Ack=200000002 Win=2580480 Len=0 TSV=2457025 TSER=2441925
  1   0.000000     10.0.1.3 -> 10.0.1.2     TCP 43787 > 9040 [SYN] Seq=0 Win=5840 Len=0 MSS=1460 TSV=2461280 TSER=0 WS=6
  2   0.000274     10.0.1.2 -> 10.0.1.3     TCP 9040 > 43787 [SYN, ACK] Seq=0 Ack=1 Win=14480 Len=0 MSS=1460 TSV=2446235 TSER=2461280 WS=6
  3   0.000298     10.0.1.3 -> 10.0.1.2     TCP 43787 > 9040 [ACK] Seq=1 Ack=1 Win=5888 Len=0 TSV=2461280 TSER=2446235
  7   0.003482     10.0.1.2 -> 10.0.1.3     TCP 9040 > 43787 [ACK] Seq=1 Ack=13 Win=14528 Len=0 TSV=2446236 TSER=2461281
206978  17.062867     10.0.1.3 -> 10.0.1.2     TCP 43787 > 9040 [FIN, ACK] Seq=13 Ack=200000002 Win=2580480 Len=0 TSV=2465546 TSER=2450446
  1   0.000000     10.0.1.3 -> 10.0.1.2     TCP 43789 > 9040 [SYN] Seq=0 Win=5840 Len=0 MSS=1460 TSV=2469777 TSER=0 WS=6
  2   0.000354     10.0.1.2 -> 10.0.1.3     TCP 9040 > 43789 [SYN, ACK] Seq=0 Ack=1 Win=14480 Len=0 MSS=1460 TSV=2454733 TSER=2469777 WS=6
  3   0.000372     10.0.1.3 -> 10.0.1.2     TCP 43789 > 9040 [ACK] Seq=1 Ack=1 Win=5888 Len=0 TSV=2469777 TSER=2454733
  7   0.002426     10.0.1.2 -> 10.0.1.3     TCP 9040 > 43789 [ACK] Seq=1 Ack=13 Win=14528 Len=0 TSV=2454734 TSER=2469778
196165  17.062361     10.0.1.3 -> 10.0.1.2     TCP 43789 > 9040 [FIN, ACK] Seq=13 Ack=200000002 Win=2580480 Len=0 TSV=2474043 TSER=2458944
  1   0.000000     10.0.1.3 -> 10.0.1.2     TCP 46200 > 9040 [SYN] Seq=0 Win=5840 Len=0 MSS=1460 TSV=2478151 TSER=0 WS=6
  2   0.000292     10.0.1.2 -> 10.0.1.3     TCP 9040 > 46200 [SYN, ACK] Seq=0 Ack=1 Win=14480 Len=0 MSS=1460 TSV=2463107 TSER=2478151 WS=6
  3   0.000315     10.0.1.3 -> 10.0.1.2     TCP 46200 > 9040 [ACK] Seq=1 Ack=1 Win=5888 Len=0 TSV=2478151 TSER=2463107
  7   0.002290     10.0.1.2 -> 10.0.1.3     TCP 9040 > 46200 [ACK] Seq=1 Ack=13 Win=14528 Len=0 TSV=2463107 TSER=2478151
207058  17.302464     10.0.1.3 -> 10.0.1.2     TCP 46200 > 9040 [FIN, ACK] Seq=13 Ack=200000002 Win=2580480 Len=0 TSV=2482476 TSER=2467378
  1   0.000000     10.0.1.3 -> 10.0.1.2     TCP 46202 > 9040 [SYN] Seq=0 Win=5840 Len=0 MSS=1460 TSV=2486755 TSER=0 WS=6
  2   0.000352     10.0.1.2 -> 10.0.1.3     TCP 9040 > 46202 [SYN, ACK] Seq=0 Ack=1 Win=14480 Len=0 MSS=1460 TSV=2471712 TSER=2486755 WS=6
  3   0.000374     10.0.1.3 -> 10.0.1.2     TCP 46202 > 9040 [ACK] Seq=1 Ack=1 Win=5888 Len=0 TSV=2486755 TSER=2471712
  7   0.002226     10.0.1.2 -> 10.0.1.3     TCP 9040 > 46202 [ACK] Seq=1 Ack=13 Win=14528 Len=0 TSV=2471712 TSER=2486755
206943  17.052153     10.0.1.3 -> 10.0.1.2     TCP 46202 > 9040 [FIN, ACK] Seq=13 Ack=200000002 Win=2580480 Len=0 TSV=2491018 TSER=2475920
  1   0.000000     10.0.1.3 -> 10.0.1.2     TCP 46204 > 9040 [SYN] Seq=0 Win=5840 Len=0 MSS=1460 TSV=2495221 TSER=0 WS=6
  2   0.000392     10.0.1.2 -> 10.0.1.3     TCP 9040 > 46204 [SYN, ACK] Seq=0 Ack=1 Win=14480 Len=0 MSS=1460 TSV=2480178 TSER=2495221 WS=6
  3   0.000418     10.0.1.3 -> 10.0.1.2     TCP 46204 > 9040 [ACK] Seq=1 Ack=1 Win=5888 Len=0 TSV=2495221 TSER=2480178
  7   0.002383     10.0.1.2 -> 10.0.1.3     TCP 9040 > 46204 [ACK] Seq=1 Ack=13 Win=14528 Len=0 TSV=2480179 TSER=2495221
180359  17.055394     10.0.1.3 -> 10.0.1.2     TCP 46204 > 9040 [FIN, ACK] Seq=13 Ack=200000002 Win=2580480 Len=0 TSV=2499484 TSER=2484387
  1   0.000000     10.0.1.3 -> 10.0.1.2     TCP 46206 > 9040 [SYN] Seq=0 Win=5840 Len=0 MSS=1460 TSV=2503445 TSER=0 WS=6
  2   0.000345     10.0.1.2 -> 10.0.1.3     TCP 9040 > 46206 [SYN, ACK] Seq=0 Ack=1 Win=14480 Len=0 MSS=1460 TSV=2488404 TSER=2503445 WS=6
  3   0.000379     10.0.1.3 -> 10.0.1.2     TCP 46206 > 9040 [ACK] Seq=1 Ack=1 Win=5888 Len=0 TSV=2503446 TSER=2488404
  7   0.003895     10.0.1.2 -> 10.0.1.3     TCP 9040 > 46206 [ACK] Seq=1 Ack=13 Win=14528 Len=0 TSV=2488405 TSER=2503446
194975  17.056262     10.0.1.3 -> 10.0.1.2     TCP 46206 > 9040 [FIN, ACK] Seq=13 Ack=200000002 Win=2580480 Len=0 TSV=2507710 TSER=2492613
  1   0.000000     10.0.1.3 -> 10.0.1.2     TCP 46208 > 9040 [SYN] Seq=0 Win=5840 Len=0 MSS=1460 TSV=2511747 TSER=0 WS=6
  2   0.000371     10.0.1.2 -> 10.0.1.3     TCP 9040 > 46208 [SYN, ACK] Seq=0 Ack=1 Win=14480 Len=0 MSS=1460 TSV=2496706 TSER=2511747 WS=6
  3   0.000395     10.0.1.3 -> 10.0.1.2     TCP 46208 > 9040 [ACK] Seq=1 Ack=1 Win=5888 Len=0 TSV=2511747 TSER=2496706
  7   0.002285     10.0.1.2 -> 10.0.1.3     TCP 9040 > 46208 [ACK] Seq=1 Ack=13 Win=14528 Len=0 TSV=2496707 TSER=2511748
206921  17.054195     10.0.1.3 -> 10.0.1.2     TCP 46208 > 9040 [FIN, ACK] Seq=13 Ack=200000002 Win=2568768 Len=0 TSV=2516011 TSER=2500915
  1   0.000000     10.0.1.3 -> 10.0.1.2     TCP 46210 > 9040 [SYN] Seq=0 Win=5840 Len=0 MSS=1460 TSV=2520328 TSER=0 WS=6
  2   0.000334     10.0.1.2 -> 10.0.1.3     TCP 9040 > 46210 [SYN, ACK] Seq=0 Ack=1 Win=14480 Len=0 MSS=1460 TSV=2505288 TSER=2520328 WS=6
  3   0.000357     10.0.1.3 -> 10.0.1.2     TCP 46210 > 9040 [ACK] Seq=1 Ack=1 Win=5888 Len=0 TSV=2520328 TSER=2505288
  7   0.002262     10.0.1.2 -> 10.0.1.3     TCP 9040 > 46210 [ACK] Seq=1 Ack=13 Win=14528 Len=0 TSV=2505288 TSER=2520329
206917  17.055443     10.0.1.3 -> 10.0.1.2     TCP 46210 > 9040 [FIN, ACK] Seq=13 Ack=200000002 Win=2580480 Len=0 TSV=2524592 TSER=2509497
  1   0.000000     10.0.1.3 -> 10.0.1.2     TCP 46212 > 9040 [SYN] Seq=0 Win=5840 Len=0 MSS=1460 TSV=2528843 TSER=0 WS=6
  2   0.000277     10.0.1.2 -> 10.0.1.3     TCP 9040 > 46212 [SYN, ACK] Seq=0 Ack=1 Win=14480 Len=0 MSS=1460 TSV=2513803 TSER=2528843 WS=6
  3   0.000300     10.0.1.3 -> 10.0.1.2     TCP 46212 > 9040 [ACK] Seq=1 Ack=1 Win=5888 Len=0 TSV=2528843 TSER=2513803
  7   0.002350     10.0.1.2 -> 10.0.1.3     TCP 9040 > 46212 [ACK] Seq=1 Ack=13 Win=14528 Len=0 TSV=2513803 TSER=2528843
206807  17.048137     10.0.1.3 -> 10.0.1.2     TCP 46212 > 9040 [FIN, ACK] Seq=13 Ack=200000002 Win=2580480 Len=0 TSV=2533104 TSER=2518010
  1   0.000000     10.0.1.3 -> 10.0.1.2     TCP 46214 > 9040 [SYN] Seq=0 Win=5840 Len=0 MSS=1460 TSV=2537419 TSER=0 WS=6
  2   0.000307     10.0.1.2 -> 10.0.1.3     TCP 9040 > 46214 [SYN, ACK] Seq=0 Ack=1 Win=14480 Len=0 MSS=1460 TSV=2522379 TSER=2537419 WS=6
  3   0.000332     10.0.1.3 -> 10.0.1.2     TCP 46214 > 9040 [ACK] Seq=1 Ack=1 Win=5888 Len=0 TSV=2537419 TSER=2522379
  7   0.002360     10.0.1.2 -> 10.0.1.3     TCP 9040 > 46214 [ACK] Seq=1 Ack=13 Win=14528 Len=0 TSV=2522380 TSER=2537419
207093  17.051913     10.0.1.3 -> 10.0.1.2     TCP 46214 > 9040 [FIN, ACK] Seq=13 Ack=200000002 Win=2580480 Len=0 TSV=2541682 TSER=2526588
  1   0.000000     10.0.1.3 -> 10.0.1.2     TCP 46216 > 9040 [SYN] Seq=0 Win=5840 Len=0 MSS=1460 TSV=2545960 TSER=0 WS=6
  2   0.000375     10.0.1.2 -> 10.0.1.3     TCP 9040 > 46216 [SYN, ACK] Seq=0 Ack=1 Win=14480 Len=0 MSS=1460 TSV=2530921 TSER=2545960 WS=6
  3   0.000399     10.0.1.3 -> 10.0.1.2     TCP 46216 > 9040 [ACK] Seq=1 Ack=1 Win=5888 Len=0 TSV=2545960 TSER=2530921
  7   0.002164     10.0.1.2 -> 10.0.1.3     TCP 9040 > 46216 [ACK] Seq=1 Ack=13 Win=14528 Len=0 TSV=2530921 TSER=2545960
194923  17.049179     10.0.1.3 -> 10.0.1.2     TCP 46216 > 9040 [FIN, ACK] Seq=13 Ack=200000002 Win=2580480 Len=0 TSV=2550222 TSER=2535129
  1   0.000000     10.0.1.3 -> 10.0.1.2     TCP 54612 > 9040 [SYN] Seq=0 Win=5840 Len=0 MSS=1460 TSV=2554358 TSER=0 WS=6
  2   0.000364     10.0.1.2 -> 10.0.1.3     TCP 9040 > 54612 [SYN, ACK] Seq=0 Ack=1 Win=14480 Len=0 MSS=1460 TSV=2539321 TSER=2554358 WS=6
  3   0.000387     10.0.1.3 -> 10.0.1.2     TCP 54612 > 9040 [ACK] Seq=1 Ack=1 Win=5888 Len=0 TSV=2554358 TSER=2539321
  7   0.003651     10.0.1.2 -> 10.0.1.3     TCP 9040 > 54612 [ACK] Seq=1 Ack=13 Win=14528 Len=0 TSV=2539321 TSER=2554359
207094  17.056521     10.0.1.3 -> 10.0.1.2     TCP 54612 > 9040 [FIN, ACK] Seq=13 Ack=200000002 Win=2580480 Len=0 TSV=2558623 TSER=2543530
  1   0.000000     10.0.1.3 -> 10.0.1.2     TCP 54614 > 9040 [SYN] Seq=0 Win=5840 Len=0 MSS=1460 TSV=2562872 TSER=0 WS=6
  2   0.000296     10.0.1.2 -> 10.0.1.3     TCP 9040 > 54614 [SYN, ACK] Seq=0 Ack=1 Win=14480 Len=0 MSS=1460 TSV=2547835 TSER=2562872 WS=6
  3   0.000323     10.0.1.3 -> 10.0.1.2     TCP 54614 > 9040 [ACK] Seq=1 Ack=1 Win=5888 Len=0 TSV=2562873 TSER=2547835
  7   0.002976     10.0.1.2 -> 10.0.1.3     TCP 9040 > 54614 [ACK] Seq=1 Ack=13 Win=14528 Len=0 TSV=2547836 TSER=2562873
206733  17.053111     10.0.1.3 -> 10.0.1.2     TCP 54614 > 9040 [FIN, ACK] Seq=13 Ack=200000002 Win=2580480 Len=0 TSV=2567136 TSER=2552044
  1   0.000000     10.0.1.3 -> 10.0.1.2     TCP 54616 > 9040 [SYN] Seq=0 Win=5840 Len=0 MSS=1460 TSV=2571390 TSER=0 WS=6
  2   0.000442     10.0.1.2 -> 10.0.1.3     TCP 9040 > 54616 [SYN, ACK] Seq=0 Ack=1 Win=14480 Len=0 MSS=1460 TSV=2556353 TSER=2571390 WS=6
  3   0.000464     10.0.1.3 -> 10.0.1.2     TCP 54616 > 9040 [ACK] Seq=1 Ack=1 Win=5888 Len=0 TSV=2571390 TSER=2556353
  7   0.002348     10.0.1.2 -> 10.0.1.3     TCP 9040 > 54616 [ACK] Seq=1 Ack=13 Win=14528 Len=0 TSV=2556354 TSER=2571391
206972  17.048578     10.0.1.3 -> 10.0.1.2     TCP 54616 > 9040 [FIN, ACK] Seq=13 Ack=200000002 Win=2580480 Len=0 TSV=2575652 TSER=2560561
  1   0.000000     10.0.1.3 -> 10.0.1.2     TCP 54618 > 9040 [SYN] Seq=0 Win=5840 Len=0 MSS=1460 TSV=2579962 TSER=0 WS=6
  2   0.000321     10.0.1.2 -> 10.0.1.3     TCP 9040 > 54618 [SYN, ACK] Seq=0 Ack=1 Win=14480 Len=0 MSS=1460 TSV=2564926 TSER=2579962 WS=6
  3   0.000344     10.0.1.3 -> 10.0.1.2     TCP 54618 > 9040 [ACK] Seq=1 Ack=1 Win=5888 Len=0 TSV=2579962 TSER=2564926
  7   0.002356     10.0.1.2 -> 10.0.1.3     TCP 9040 > 54618 [ACK] Seq=1 Ack=13 Win=14528 Len=0 TSV=2564926 TSER=2579962
189019  17.053551     10.0.1.3 -> 10.0.1.2     TCP 54618 > 9040 [FIN, ACK] Seq=13 Ack=200000002 Win=2580480 Len=0 TSV=2584225 TSER=2569135
  1   0.000000     10.0.1.3 -> 10.0.1.2     TCP 54620 > 9040 [SYN] Seq=0 Win=5840 Len=0 MSS=1460 TSV=2588302 TSER=0 WS=6
  2   0.000322     10.0.1.2 -> 10.0.1.3     TCP 9040 > 54620 [SYN, ACK] Seq=0 Ack=1 Win=14480 Len=0 MSS=1460 TSV=2573266 TSER=2588302 WS=6
  3   0.000346     10.0.1.3 -> 10.0.1.2     TCP 54620 > 9040 [ACK] Seq=1 Ack=1 Win=5888 Len=0 TSV=2588302 TSER=2573266
  7   0.002326     10.0.1.2 -> 10.0.1.3     TCP 9040 > 54620 [ACK] Seq=1 Ack=13 Win=14528 Len=0 TSV=2573267 TSER=2588302
206999  17.050032     10.0.1.3 -> 10.0.1.2     TCP 54620 > 9040 [FIN, ACK] Seq=13 Ack=200000002 Win=2580480 Len=0 TSV=2592564 TSER=2577474
  1   0.000000     10.0.1.3 -> 10.0.1.2     TCP 54622 > 9040 [SYN] Seq=0 Win=5840 Len=0 MSS=1460 TSV=2596870 TSER=0 WS=6
  2   0.000283     10.0.1.2 -> 10.0.1.3     TCP 9040 > 54622 [SYN, ACK] Seq=0 Ack=1 Win=14480 Len=0 MSS=1460 TSV=2581835 TSER=2596870 WS=6
  3   0.000306     10.0.1.3 -> 10.0.1.2     TCP 54622 > 9040 [ACK] Seq=1 Ack=1 Win=5888 Len=0 TSV=2596870 TSER=2581835
  7   0.002312     10.0.1.2 -> 10.0.1.3     TCP 9040 > 54622 [ACK] Seq=1 Ack=13 Win=14528 Len=0 TSV=2581836 TSER=2596870
206956  17.053135     10.0.1.3 -> 10.0.1.2     TCP 54622 > 9040 [FIN, ACK] Seq=13 Ack=200000002 Win=2580480 Len=0 TSV=2601133 TSER=2586044
  1   0.000000     10.0.1.3 -> 10.0.1.2     TCP 54624 > 9040 [SYN] Seq=0 Win=5840 Len=0 MSS=1460 TSV=2605410 TSER=0 WS=6
  2   0.000336     10.0.1.2 -> 10.0.1.3     TCP 9040 > 54624 [SYN, ACK] Seq=0 Ack=1 Win=14480 Len=0 MSS=1460 TSV=2590376 TSER=2605410 WS=6
  3   0.000360     10.0.1.3 -> 10.0.1.2     TCP 54624 > 9040 [ACK] Seq=1 Ack=1 Win=5888 Len=0 TSV=2605410 TSER=2590376
  7   0.002319     10.0.1.2 -> 10.0.1.3     TCP 9040 > 54624 [ACK] Seq=1 Ack=13 Win=14528 Len=0 TSV=2590377 TSER=2605411
190483  17.052942     10.0.1.3 -> 10.0.1.2     TCP 54624 > 9040 [FIN, ACK] Seq=13 Ack=200000002 Win=2580480 Len=0 TSV=2609673 TSER=2594585
