  1   0.000000     10.0.1.3 -> 10.0.1.2     TCP 59687 > 9040 [SYN] Seq=0 Win=5840 Len=0 MSS=1460 TSV=4932953 TSER=0 WS=6
  2   0.000314     10.0.1.2 -> 10.0.1.3     TCP 9040 > 59687 [SYN, ACK] Seq=0 Ack=1 Win=14480 Len=0 MSS=1460 TSV=4917898 TSER=4932953 WS=6
  3   0.000337     10.0.1.3 -> 10.0.1.2     TCP 59687 > 9040 [ACK] Seq=1 Ack=1 Win=5888 Len=0 TSV=4932953 TSER=4917898
  7   0.002387     10.0.1.2 -> 10.0.1.3     TCP 9040 > 59687 [ACK] Seq=1 Ack=13 Win=14528 Len=0 TSV=4917899 TSER=4932953
204625  36.884929     10.0.1.3 -> 10.0.1.2     TCP 59687 > 9040 [FIN, ACK] Seq=13 Ack=200000002 Win=2002944 Len=0 TSV=4942174 TSER=4927099
204626  36.885182     10.0.1.2 -> 10.0.1.3     TCP 9040 > 59687 [ACK] Seq=200000002 Ack=14 Win=14528 Len=0 TSV=4927120 TSER=4942174
  1   0.000000     10.0.1.3 -> 10.0.1.2     TCP 59689 > 9040 [SYN] Seq=0 Win=5840 Len=0 MSS=1460 TSV=4946298 TSER=0 WS=6
  2   0.000283     10.0.1.2 -> 10.0.1.3     TCP 9040 > 59689 [SYN, ACK] Seq=0 Ack=1 Win=14480 Len=0 MSS=1460 TSV=4931244 TSER=4946298 WS=6
  3   0.000305     10.0.1.3 -> 10.0.1.2     TCP 59689 > 9040 [ACK] Seq=1 Ack=1 Win=5888 Len=0 TSV=4946298 TSER=4931244
  7   0.002167     10.0.1.2 -> 10.0.1.3     TCP 9040 > 59689 [ACK] Seq=1 Ack=13 Win=14528 Len=0 TSV=4931245 TSER=4946298
207434  36.555942     10.0.1.3 -> 10.0.1.2     TCP 59689 > 9040 [FIN, ACK] Seq=13 Ack=200000002 Win=2005824 Len=0 TSV=4955437 TSER=4940363
207435  36.556189     10.0.1.2 -> 10.0.1.3     TCP 9040 > 59689 [ACK] Seq=200000002 Ack=14 Win=14528 Len=0 TSV=4940384 TSER=4955437
  1   0.000000     10.0.1.3 -> 10.0.1.2     TCP 39014 > 9040 [SYN] Seq=0 Win=5840 Len=0 MSS=1460 TSV=4959732 TSER=0 WS=6
  2   0.000370     10.0.1.2 -> 10.0.1.3     TCP 9040 > 39014 [SYN, ACK] Seq=0 Ack=1 Win=14480 Len=0 MSS=1460 TSV=4944680 TSER=4959732 WS=6
  3   0.000392     10.0.1.3 -> 10.0.1.2     TCP 39014 > 9040 [ACK] Seq=1 Ack=1 Win=5888 Len=0 TSV=4959733 TSER=4944680
  7   0.002257     10.0.1.2 -> 10.0.1.3     TCP 9040 > 39014 [ACK] Seq=1 Ack=13 Win=14528 Len=0 TSV=4944681 TSER=4959733
206773  36.986340     10.0.1.3 -> 10.0.1.2     TCP 39014 > 9040 [FIN, ACK] Seq=13 Ack=200000002 Win=2020288 Len=0 TSV=4968979 TSER=4953906
206774  36.986586     10.0.1.2 -> 10.0.1.3     TCP 9040 > 39014 [ACK] Seq=200000002 Ack=14 Win=14528 Len=0 TSV=4953927 TSER=4968979
  1   0.000000     10.0.1.3 -> 10.0.1.2     TCP 39016 > 9040 [SYN] Seq=0 Win=5840 Len=0 MSS=1460 TSV=4973217 TSER=0 WS=6
  2   0.000302     10.0.1.2 -> 10.0.1.3     TCP 9040 > 39016 [SYN, ACK] Seq=0 Ack=1 Win=14480 Len=0 MSS=1460 TSV=4958165 TSER=4973217 WS=6
  3   0.000336     10.0.1.3 -> 10.0.1.2     TCP 39016 > 9040 [ACK] Seq=1 Ack=1 Win=5888 Len=0 TSV=4973217 TSER=4958165
  7   0.003588     10.0.1.2 -> 10.0.1.3     TCP 9040 > 39016 [ACK] Seq=1 Ack=13 Win=14528 Len=0 TSV=4958166 TSER=4973218
192037  36.773413     10.0.1.3 -> 10.0.1.2     TCP 39016 > 9040 [FIN, ACK] Seq=13 Ack=200000002 Win=2014528 Len=0 TSV=4982410 TSER=4967338
192038  36.773660     10.0.1.2 -> 10.0.1.3     TCP 9040 > 39016 [ACK] Seq=200000002 Ack=14 Win=14528 Len=0 TSV=4967359 TSER=4982410
  1   0.000000     10.0.1.3 -> 10.0.1.2     TCP 39018 > 9040 [SYN] Seq=0 Win=5840 Len=0 MSS=1460 TSV=4986529 TSER=0 WS=6
  2   0.000372     10.0.1.2 -> 10.0.1.3     TCP 9040 > 39018 [SYN, ACK] Seq=0 Ack=1 Win=14480 Len=0 MSS=1460 TSV=4971478 TSER=4986529 WS=6
  3   0.000401     10.0.1.3 -> 10.0.1.2     TCP 39018 > 9040 [ACK] Seq=1 Ack=1 Win=5888 Len=0 TSV=4986529 TSER=4971478
  7   0.002342     10.0.1.2 -> 10.0.1.3     TCP 9040 > 39018 [ACK] Seq=1 Ack=13 Win=14528 Len=0 TSV=4971479 TSER=4986530
205521  36.281315     10.0.1.3 -> 10.0.1.2     TCP 39018 > 9040 [FIN, ACK] Seq=13 Ack=200000002 Win=2005824 Len=0 TSV=4995599 TSER=4980528
205522  36.281559     10.0.1.2 -> 10.0.1.3     TCP 9040 > 39018 [ACK] Seq=200000002 Ack=14 Win=14528 Len=0 TSV=4980549 TSER=4995599
  1   0.000000     10.0.1.3 -> 10.0.1.2     TCP 39020 > 9040 [SYN] Seq=0 Win=5840 Len=0 MSS=1460 TSV=4999809 TSER=0 WS=6
  2   0.000277     10.0.1.2 -> 10.0.1.3     TCP 9040 > 39020 [SYN, ACK] Seq=0 Ack=1 Win=14480 Len=0 MSS=1460 TSV=4984759 TSER=4999809 WS=6
  3   0.000298     10.0.1.3 -> 10.0.1.2     TCP 39020 > 9040 [ACK] Seq=1 Ack=1 Win=5888 Len=0 TSV=4999809 TSER=4984759
  7   0.002189     10.0.1.2 -> 10.0.1.3     TCP 9040 > 39020 [ACK] Seq=1 Ack=13 Win=14528 Len=0 TSV=4984760 TSER=4999809
206608  36.747091     10.0.1.3 -> 10.0.1.2     TCP 39020 > 9040 [FIN, ACK] Seq=13 Ack=200000002 Win=2002944 Len=0 TSV=5008996 TSER=4993925
206609  36.747337     10.0.1.2 -> 10.0.1.3     TCP 9040 > 39020 [ACK] Seq=200000002 Ack=14 Win=14528 Len=0 TSV=4993947 TSER=5008996
  1   0.000000     10.0.1.3 -> 10.0.1.2     TCP 39022 > 9040 [SYN] Seq=0 Win=5840 Len=0 MSS=1460 TSV=5013202 TSER=0 WS=6
  2   0.000301     10.0.1.2 -> 10.0.1.3     TCP 9040 > 39022 [SYN, ACK] Seq=0 Ack=1 Win=14480 Len=0 MSS=1460 TSV=4998154 TSER=5013202 WS=6
  3   0.000325     10.0.1.3 -> 10.0.1.2     TCP 39022 > 9040 [ACK] Seq=1 Ack=1 Win=5888 Len=0 TSV=5013202 TSER=4998154
  7   0.002203     10.0.1.2 -> 10.0.1.3     TCP 9040 > 39022 [ACK] Seq=1 Ack=13 Win=14528 Len=0 TSV=4998154 TSER=5013203
194868  36.158374     10.0.1.3 -> 10.0.1.2     TCP 39022 > 9040 [FIN, ACK] Seq=13 Ack=200000002 Win=2002944 Len=0 TSV=5022242 TSER=5007172
194869  36.158621     10.0.1.2 -> 10.0.1.3     TCP 9040 > 39022 [ACK] Seq=200000002 Ack=14 Win=14528 Len=0 TSV=5007194 TSER=5022242
  1   0.000000     10.0.1.3 -> 10.0.1.2     TCP 54034 > 9040 [SYN] Seq=0 Win=5840 Len=0 MSS=1460 TSV=5026375 TSER=0 WS=6
  2   0.000297     10.0.1.2 -> 10.0.1.3     TCP 9040 > 54034 [SYN, ACK] Seq=0 Ack=1 Win=14480 Len=0 MSS=1460 TSV=5011328 TSER=5026375 WS=6
  3   0.000321     10.0.1.3 -> 10.0.1.2     TCP 54034 > 9040 [ACK] Seq=1 Ack=1 Win=5888 Len=0 TSV=5026376 TSER=5011328
  7   0.002172     10.0.1.2 -> 10.0.1.3     TCP 9040 > 54034 [ACK] Seq=1 Ack=13 Win=14528 Len=0 TSV=5011328 TSER=5026376
206443  36.744761     10.0.1.3 -> 10.0.1.2     TCP 54034 > 9040 [FIN, ACK] Seq=13 Ack=200000002 Win=2023168 Len=0 TSV=5035562 TSER=5020493
206444  36.745007     10.0.1.2 -> 10.0.1.3     TCP 9040 > 54034 [ACK] Seq=200000002 Ack=14 Win=14528 Len=0 TSV=5020515 TSER=5035562
  1   0.000000     10.0.1.3 -> 10.0.1.2     TCP 54036 > 9040 [SYN] Seq=0 Win=5840 Len=0 MSS=1460 TSV=5039836 TSER=0 WS=6
  2   0.000353     10.0.1.2 -> 10.0.1.3     TCP 9040 > 54036 [SYN, ACK] Seq=0 Ack=1 Win=14480 Len=0 MSS=1460 TSV=5024789 TSER=5039836 WS=6
  3   0.000380     10.0.1.3 -> 10.0.1.2     TCP 54036 > 9040 [ACK] Seq=1 Ack=1 Win=5888 Len=0 TSV=5039836 TSER=5024789
  7   0.002327     10.0.1.2 -> 10.0.1.3     TCP 9040 > 54036 [ACK] Seq=1 Ack=13 Win=14528 Len=0 TSV=5024790 TSER=5039836
206434  36.978618     10.0.1.3 -> 10.0.1.2     TCP 54036 > 9040 [FIN, ACK] Seq=13 Ack=200000002 Win=2002944 Len=0 TSV=5049081 TSER=5034013
206435  36.978869     10.0.1.2 -> 10.0.1.3     TCP 9040 > 54036 [ACK] Seq=200000002 Ack=14 Win=14528 Len=0 TSV=5034035 TSER=5049081
  1   0.000000     10.0.1.3 -> 10.0.1.2     TCP 54038 > 9040 [SYN] Seq=0 Win=5840 Len=0 MSS=1460 TSV=5053373 TSER=0 WS=6
  2   0.000285     10.0.1.2 -> 10.0.1.3     TCP 9040 > 54038 [SYN, ACK] Seq=0 Ack=1 Win=14480 Len=0 MSS=1460 TSV=5038328 TSER=5053373 WS=6
  3   0.000308     10.0.1.3 -> 10.0.1.2     TCP 54038 > 9040 [ACK] Seq=1 Ack=1 Win=5888 Len=0 TSV=5053373 TSER=5038328
  7   0.002262     10.0.1.2 -> 10.0.1.3     TCP 9040 > 54038 [ACK] Seq=1 Ack=13 Win=14528 Len=0 TSV=5038328 TSER=5053374
206083  37.002493     10.0.1.3 -> 10.0.1.2     TCP 54038 > 9040 [FIN, ACK] Seq=13 Ack=200000002 Win=2002944 Len=0 TSV=5062624 TSER=5047558
206084  37.002745     10.0.1.2 -> 10.0.1.3     TCP 9040 > 54038 [ACK] Seq=200000002 Ack=14 Win=14528 Len=0 TSV=5047579 TSER=5062624
  1   0.000000     10.0.1.3 -> 10.0.1.2     TCP 54040 > 9040 [SYN] Seq=0 Win=5840 Len=0 MSS=1460 TSV=5066890 TSER=0 WS=6
  2   0.000318     10.0.1.2 -> 10.0.1.3     TCP 9040 > 54040 [SYN, ACK] Seq=0 Ack=1 Win=14480 Len=0 MSS=1460 TSV=5051845 TSER=5066890 WS=6
  3   0.000341     10.0.1.3 -> 10.0.1.2     TCP 54040 > 9040 [ACK] Seq=1 Ack=1 Win=5888 Len=0 TSV=5066890 TSER=5051845
  7   0.002235     10.0.1.2 -> 10.0.1.3     TCP 9040 > 54040 [ACK] Seq=1 Ack=13 Win=14528 Len=0 TSV=5051846 TSER=5066891
  1   0.000000     10.0.1.3 -> 10.0.1.2     TCP 54042 > 9040 [SYN] Seq=0 Win=5840 Len=0 MSS=1460 TSV=5080371 TSER=0 WS=6
  2   0.000303     10.0.1.2 -> 10.0.1.3     TCP 9040 > 54042 [SYN, ACK] Seq=0 Ack=1 Win=14480 Len=0 MSS=1460 TSV=5065328 TSER=5080371 WS=6
  3   0.000325     10.0.1.3 -> 10.0.1.2     TCP 54042 > 9040 [ACK] Seq=1 Ack=1 Win=5888 Len=0 TSV=5080371 TSER=5065328
  7   0.002185     10.0.1.2 -> 10.0.1.3     TCP 9040 > 54042 [ACK] Seq=1 Ack=13 Win=14528 Len=0 TSV=5065328 TSER=5080372
204056  36.429421     10.0.1.3 -> 10.0.1.2     TCP 54042 > 9040 [FIN, ACK] Seq=13 Ack=200000002 Win=2008704 Len=0 TSV=5089479 TSER=5074414
204057  36.429679     10.0.1.2 -> 10.0.1.3     TCP 9040 > 54042 [ACK] Seq=200000002 Ack=14 Win=14528 Len=0 TSV=5074436 TSER=5089479
  1   0.000000     10.0.1.3 -> 10.0.1.2     TCP 54044 > 9040 [SYN] Seq=0 Win=5840 Len=0 MSS=1460 TSV=5093752 TSER=0 WS=6
  2   0.000286     10.0.1.2 -> 10.0.1.3     TCP 9040 > 54044 [SYN, ACK] Seq=0 Ack=1 Win=14480 Len=0 MSS=1460 TSV=5078710 TSER=5093752 WS=6
  3   0.000308     10.0.1.3 -> 10.0.1.2     TCP 54044 > 9040 [ACK] Seq=1 Ack=1 Win=5888 Len=0 TSV=5093752 TSER=5078710
  7   0.002325     10.0.1.2 -> 10.0.1.3     TCP 9040 > 54044 [ACK] Seq=1 Ack=13 Win=14528 Len=0 TSV=5078710 TSER=5093753
205467  36.714842     10.0.1.3 -> 10.0.1.2     TCP 54044 > 9040 [FIN, ACK] Seq=13 Ack=200000002 Win=2005824 Len=0 TSV=5102931 TSER=5087868
205468  36.715097     10.0.1.2 -> 10.0.1.3     TCP 9040 > 54044 [ACK] Seq=200000002 Ack=14 Win=14528 Len=0 TSV=5087889 TSER=5102931
  1   0.000000     10.0.1.3 -> 10.0.1.2     TCP 57682 > 9040 [SYN] Seq=0 Win=5840 Len=0 MSS=1460 TSV=5107198 TSER=0 WS=6
  2   0.000279     10.0.1.2 -> 10.0.1.3     TCP 9040 > 57682 [SYN, ACK] Seq=0 Ack=1 Win=14480 Len=0 MSS=1460 TSV=5092156 TSER=5107198 WS=6
  3   0.000301     10.0.1.3 -> 10.0.1.2     TCP 57682 > 9040 [ACK] Seq=1 Ack=1 Win=5888 Len=0 TSV=5107198 TSER=5092156
  7   0.002190     10.0.1.2 -> 10.0.1.3     TCP 9040 > 57682 [ACK] Seq=1 Ack=13 Win=14528 Len=0 TSV=5092157 TSER=5107198
204171  37.051249     10.0.1.3 -> 10.0.1.2     TCP 57682 > 9040 [FIN, ACK] Seq=13 Ack=200000002 Win=2005824 Len=0 TSV=5116461 TSER=5101398
204172  37.051494     10.0.1.2 -> 10.0.1.3     TCP 9040 > 57682 [ACK] Seq=200000002 Ack=14 Win=14528 Len=0 TSV=5101420 TSER=5116461
  1   0.000000     10.0.1.3 -> 10.0.1.2     TCP 57684 > 9040 [SYN] Seq=0 Win=5840 Len=0 MSS=1460 TSV=5120695 TSER=0 WS=6
  2   0.000370     10.0.1.2 -> 10.0.1.3     TCP 9040 > 57684 [SYN, ACK] Seq=0 Ack=1 Win=14480 Len=0 MSS=1460 TSV=5105654 TSER=5120695 WS=6
  3   0.000395     10.0.1.3 -> 10.0.1.2     TCP 57684 > 9040 [ACK] Seq=1 Ack=1 Win=5888 Len=0 TSV=5120695 TSER=5105654
  7   0.002156     10.0.1.2 -> 10.0.1.3     TCP 9040 > 57684 [ACK] Seq=1 Ack=13 Win=14528 Len=0 TSV=5105655 TSER=5120695
204380  36.111543     10.0.1.3 -> 10.0.1.2     TCP 57684 > 9040 [FIN, ACK] Seq=13 Ack=200000002 Win=2002944 Len=0 TSV=5129723 TSER=5114661
204381  36.111785     10.0.1.2 -> 10.0.1.3     TCP 9040 > 57684 [ACK] Seq=200000002 Ack=14 Win=14528 Len=0 TSV=5114683 TSER=5129723
  1   0.000000     10.0.1.3 -> 10.0.1.2     TCP 57686 > 9040 [SYN] Seq=0 Win=5840 Len=0 MSS=1460 TSV=5133994 TSER=0 WS=6
  2   0.000335     10.0.1.2 -> 10.0.1.3     TCP 9040 > 57686 [SYN, ACK] Seq=0 Ack=1 Win=14480 Len=0 MSS=1460 TSV=5118954 TSER=5133994 WS=6
  3   0.000362     10.0.1.3 -> 10.0.1.2     TCP 57686 > 9040 [ACK] Seq=1 Ack=1 Win=5888 Len=0 TSV=5133994 TSER=5118954
  7   0.002268     10.0.1.2 -> 10.0.1.3     TCP 9040 > 57686 [ACK] Seq=1 Ack=13 Win=14528 Len=0 TSV=5118955 TSER=5133994
205143  36.232739     10.0.1.3 -> 10.0.1.2     TCP 57686 > 9040 [FIN, ACK] Seq=13 Ack=200000002 Win=2005824 Len=0 TSV=5143052 TSER=5127992
205144  36.232996     10.0.1.2 -> 10.0.1.3     TCP 9040 > 57686 [ACK] Seq=200000002 Ack=14 Win=14528 Len=0 TSV=5128013 TSER=5143052
  1   0.000000     10.0.1.3 -> 10.0.1.2     TCP 57688 > 9040 [SYN] Seq=0 Win=5840 Len=0 MSS=1460 TSV=5147287 TSER=0 WS=6
  2   0.000301     10.0.1.2 -> 10.0.1.3     TCP 9040 > 57688 [SYN, ACK] Seq=0 Ack=1 Win=14480 Len=0 MSS=1460 TSV=5132248 TSER=5147287 WS=6
  3   0.000325     10.0.1.3 -> 10.0.1.2     TCP 57688 > 9040 [ACK] Seq=1 Ack=1 Win=5888 Len=0 TSV=5147287 TSER=5132248
  7   0.002177     10.0.1.2 -> 10.0.1.3     TCP 9040 > 57688 [ACK] Seq=1 Ack=13 Win=14528 Len=0 TSV=5132249 TSER=5147287
206998  37.188268     10.0.1.3 -> 10.0.1.2     TCP 57688 > 9040 [FIN, ACK] Seq=13 Ack=200000002 Win=2023168 Len=0 TSV=5156584 TSER=5141525
206999  37.188521     10.0.1.2 -> 10.0.1.3     TCP 9040 > 57688 [ACK] Seq=200000002 Ack=14 Win=14528 Len=0 TSV=5141546 TSER=5156584
  1   0.000000     10.0.1.3 -> 10.0.1.2     TCP 57690 > 9040 [SYN] Seq=0 Win=5840 Len=0 MSS=1460 TSV=5160862 TSER=0 WS=6
  2   0.000371     10.0.1.2 -> 10.0.1.3     TCP 9040 > 57690 [SYN, ACK] Seq=0 Ack=1 Win=14480 Len=0 MSS=1460 TSV=5145825 TSER=5160862 WS=6
  3   0.000394     10.0.1.3 -> 10.0.1.2     TCP 57690 > 9040 [ACK] Seq=1 Ack=1 Win=5888 Len=0 TSV=5160862 TSER=5145825
  7   0.002268     10.0.1.2 -> 10.0.1.3     TCP 9040 > 57690 [ACK] Seq=1 Ack=13 Win=14528 Len=0 TSV=5145825 TSER=5160863
204285  36.334783     10.0.1.3 -> 10.0.1.2     TCP 57690 > 9040 [FIN, ACK] Seq=13 Ack=200000002 Win=2008704 Len=0 TSV=5169946 TSER=5154887
204286  36.335038     10.0.1.2 -> 10.0.1.3     TCP 9040 > 57690 [ACK] Seq=200000002 Ack=14 Win=14528 Len=0 TSV=5154909 TSER=5169946
  1   0.000000     10.0.1.3 -> 10.0.1.2     TCP 57692 > 9040 [SYN] Seq=0 Win=5840 Len=0 MSS=1460 TSV=5174220 TSER=0 WS=6
  2   0.000276     10.0.1.2 -> 10.0.1.3     TCP 9040 > 57692 [SYN, ACK] Seq=0 Ack=1 Win=14480 Len=0 MSS=1460 TSV=5159184 TSER=5174220 WS=6
  3   0.000299     10.0.1.3 -> 10.0.1.2     TCP 57692 > 9040 [ACK] Seq=1 Ack=1 Win=5888 Len=0 TSV=5174221 TSER=5159184
  7   0.002432     10.0.1.2 -> 10.0.1.3     TCP 9040 > 57692 [ACK] Seq=1 Ack=13 Win=14528 Len=0 TSV=5159184 TSER=5174221
203977  37.091442     10.0.1.3 -> 10.0.1.2     TCP 57692 > 9040 [FIN, ACK] Seq=13 Ack=200000002 Win=2005824 Len=0 TSV=5183493 TSER=5168436
203978  37.091696     10.0.1.2 -> 10.0.1.3     TCP 9040 > 57692 [ACK] Seq=200000002 Ack=14 Win=14528 Len=0 TSV=5168457 TSER=5183493
  1   0.000000     10.0.1.3 -> 10.0.1.2     TCP 38837 > 9040 [SYN] Seq=0 Win=5840 Len=0 MSS=1460 TSV=5187751 TSER=0 WS=6
  2   0.000367     10.0.1.2 -> 10.0.1.3     TCP 9040 > 38837 [SYN, ACK] Seq=0 Ack=1 Win=14480 Len=0 MSS=1460 TSV=5172715 TSER=5187751 WS=6
  3   0.000391     10.0.1.3 -> 10.0.1.2     TCP 38837 > 9040 [ACK] Seq=1 Ack=1 Win=5888 Len=0 TSV=5187751 TSER=5172715
  7   0.002329     10.0.1.2 -> 10.0.1.3     TCP 9040 > 38837 [ACK] Seq=1 Ack=13 Win=14528 Len=0 TSV=5172716 TSER=5187751
191316  37.122255     10.0.1.3 -> 10.0.1.2     TCP 38837 > 9040 [FIN, ACK] Seq=13 Ack=200000002 Win=2002944 Len=0 TSV=5197032 TSER=5181975
191317  37.122514     10.0.1.2 -> 10.0.1.3     TCP 9040 > 38837 [ACK] Seq=200000002 Ack=14 Win=14528 Len=0 TSV=5181997 TSER=5197032
