  1   0.000000     10.0.1.3 -> 10.0.1.2     TCP 33733 > 9040 [SYN] Seq=0 Win=5840 Len=0 MSS=1460 TSV=8878790 TSER=0 WS=6
  2   0.000296     10.0.1.2 -> 10.0.1.3     TCP 9040 > 33733 [SYN, ACK] Seq=0 Ack=1 Win=14480 Len=0 MSS=1460 TSV=8932700 TSER=8878790 WS=6
  3   0.000321     10.0.1.3 -> 10.0.1.2     TCP 33733 > 9040 [ACK] Seq=1 Ack=1 Win=5888 Len=0 TSV=8878790 TSER=8932700
  7   0.003034     10.0.1.2 -> 10.0.1.3     TCP 9040 > 33733 [ACK] Seq=1 Ack=13 Win=14528 Len=0 TSV=8932701 TSER=8878791
207566  17.090708     10.0.1.3 -> 10.0.1.2     TCP 33733 > 9040 [FIN, ACK] Seq=13 Ack=200000002 Win=2580480 Len=0 TSV=8883063 TSER=8936918
207567  17.090962     10.0.1.2 -> 10.0.1.3     TCP 9040 > 33733 [ACK] Seq=200000002 Ack=14 Win=14528 Len=0 TSV=8936973 TSER=8883063
================================================================================
IPv4 Conversations
Filter:<No Filter>
                                               |       <-      | |       ->      | |     Total     |
                                               | Frames  Bytes | | Frames  Bytes | | Frames  Bytes |
10.0.1.3             <-> 10.0.1.2              138130 209116588   69437   4582862  207567 213699450
================================================================================
  1   0.000000     10.0.1.3 -> 10.0.1.2     TCP 33735 > 9040 [SYN] Seq=0 Win=5840 Len=0 MSS=1460 TSV=8886247 TSER=0 WS=6
  2   0.000313     10.0.1.2 -> 10.0.1.3     TCP 9040 > 33735 [SYN, ACK] Seq=0 Ack=1 Win=14480 Len=0 MSS=1460 TSV=8940158 TSER=8886247 WS=6
  3   0.000338     10.0.1.3 -> 10.0.1.2     TCP 33735 > 9040 [ACK] Seq=1 Ack=1 Win=5888 Len=0 TSV=8886247 TSER=8940158
  7   0.002230     10.0.1.2 -> 10.0.1.3     TCP 9040 > 33735 [ACK] Seq=1 Ack=13 Win=14528 Len=0 TSV=8940158 TSER=8886248
207518  17.049622     10.0.1.3 -> 10.0.1.2     TCP 33735 > 9040 [FIN, ACK] Seq=13 Ack=200000002 Win=2580480 Len=0 TSV=8890510 TSER=8944366
207519  17.049899     10.0.1.2 -> 10.0.1.3     TCP 9040 > 33735 [ACK] Seq=200000002 Ack=14 Win=14528 Len=0 TSV=8944421 TSER=8890510
================================================================================
IPv4 Conversations
Filter:<No Filter>
                                               |       <-      | |       ->      | |     Total     |
                                               | Frames  Bytes | | Frames  Bytes | | Frames  Bytes |
10.0.1.3             <-> 10.0.1.2              138134 209116852   69385   4579430  207519 213696282
================================================================================
  1   0.000000     10.0.1.3 -> 10.0.1.2     TCP 33737 > 9040 [SYN] Seq=0 Win=5840 Len=0 MSS=1460 TSV=8893726 TSER=0 WS=6
  2   0.000302     10.0.1.2 -> 10.0.1.3     TCP 9040 > 33737 [SYN, ACK] Seq=0 Ack=1 Win=14480 Len=0 MSS=1460 TSV=8947637 TSER=8893726 WS=6
  3   0.000324     10.0.1.3 -> 10.0.1.2     TCP 33737 > 9040 [ACK] Seq=1 Ack=1 Win=5888 Len=0 TSV=8893726 TSER=8947637
  7   0.002166     10.0.1.2 -> 10.0.1.3     TCP 9040 > 33737 [ACK] Seq=1 Ack=13 Win=14528 Len=0 TSV=8947638 TSER=8893727
207481  17.698380     10.0.1.3 -> 10.0.1.2     TCP 33737 > 9040 [FIN, ACK] Seq=13 Ack=200000002 Win=2580480 Len=0 TSV=8898151 TSER=8952007
207482  17.698597     10.0.1.2 -> 10.0.1.3     TCP 9040 > 33737 [ACK] Seq=200000002 Ack=14 Win=14528 Len=0 TSV=8952062 TSER=8898151
================================================================================
IPv4 Conversations
Filter:<No Filter>
                                               |       <-      | |       ->      | |     Total     |
                                               | Frames  Bytes | | Frames  Bytes | | Frames  Bytes |
10.0.1.3             <-> 10.0.1.2              138145 209117578   69337   4576262  207482 213693840
================================================================================
  1   0.000000     10.0.1.3 -> 10.0.1.2     TCP 33739 > 9040 [SYN] Seq=0 Win=5840 Len=0 MSS=1460 TSV=8901340 TSER=0 WS=6
  2   0.000312     10.0.1.2 -> 10.0.1.3     TCP 9040 > 33739 [SYN, ACK] Seq=0 Ack=1 Win=14480 Len=0 MSS=1460 TSV=8955252 TSER=8901340 WS=6
  3   0.000336     10.0.1.3 -> 10.0.1.2     TCP 33739 > 9040 [ACK] Seq=1 Ack=1 Win=5888 Len=0 TSV=8901340 TSER=8955252
  7   0.002235     10.0.1.2 -> 10.0.1.3     TCP 9040 > 33739 [ACK] Seq=1 Ack=13 Win=14528 Len=0 TSV=8955253 TSER=8901341
207349  17.126613     10.0.1.3 -> 10.0.1.2     TCP 33739 > 9040 [FIN, ACK] Seq=13 Ack=200000002 Win=2580480 Len=0 TSV=8905622 TSER=8959479
207350  17.126870     10.0.1.2 -> 10.0.1.3     TCP 9040 > 33739 [ACK] Seq=200000002 Ack=14 Win=14528 Len=0 TSV=8959534 TSER=8905622
================================================================================
IPv4 Conversations
Filter:<No Filter>
                                               |       <-      | |       ->      | |     Total     |
                                               | Frames  Bytes | | Frames  Bytes | | Frames  Bytes |
10.0.1.3             <-> 10.0.1.2              138133 209116786   69217   4568342  207350 213685128
================================================================================
  1   0.000000     10.0.1.3 -> 10.0.1.2     TCP 33742 > 9040 [SYN] Seq=0 Win=5840 Len=0 MSS=1460 TSV=8908793 TSER=0 WS=6
  2   0.000316     10.0.1.2 -> 10.0.1.3     TCP 9040 > 33742 [SYN, ACK] Seq=0 Ack=1 Win=14480 Len=0 MSS=1460 TSV=8962705 TSER=8908793 WS=6
  3   0.000336     10.0.1.3 -> 10.0.1.2     TCP 33742 > 9040 [ACK] Seq=1 Ack=1 Win=5888 Len=0 TSV=8908793 TSER=8962705
  7   0.002156     10.0.1.2 -> 10.0.1.3     TCP 9040 > 33742 [ACK] Seq=1 Ack=13 Win=14528 Len=0 TSV=8962706 TSER=8908794
207489  17.090896     10.0.1.3 -> 10.0.1.2     TCP 33742 > 9040 [FIN, ACK] Seq=13 Ack=200000002 Win=2580480 Len=0 TSV=8913066 TSER=8966923
207490  17.091146     10.0.1.2 -> 10.0.1.3     TCP 9040 > 33742 [ACK] Seq=200000002 Ack=14 Win=14528 Len=0 TSV=8966978 TSER=8913066
================================================================================
IPv4 Conversations
Filter:<No Filter>
                                               |       <-      | |       ->      | |     Total     |
                                               | Frames  Bytes | | Frames  Bytes | | Frames  Bytes |
10.0.1.3             <-> 10.0.1.2              138137 209117050   69353   4577318  207490 213694368
================================================================================
  1   0.000000     10.0.1.3 -> 10.0.1.2     TCP 33744 > 9040 [SYN] Seq=0 Win=5840 Len=0 MSS=1460 TSV=8916231 TSER=0 WS=6
  2   0.000314     10.0.1.2 -> 10.0.1.3     TCP 9040 > 33744 [SYN, ACK] Seq=0 Ack=1 Win=14480 Len=0 MSS=1460 TSV=8970144 TSER=8916231 WS=6
  3   0.000337     10.0.1.3 -> 10.0.1.2     TCP 33744 > 9040 [ACK] Seq=1 Ack=1 Win=5888 Len=0 TSV=8916232 TSER=8970144
  7   0.002235     10.0.1.2 -> 10.0.1.3     TCP 9040 > 33744 [ACK] Seq=1 Ack=13 Win=14528 Len=0 TSV=8970145 TSER=8916232
207507  17.104801     10.0.1.3 -> 10.0.1.2     TCP 33744 > 9040 [FIN, ACK] Seq=13 Ack=200000002 Win=2580480 Len=0 TSV=8920508 TSER=8974366
207508  17.105057     10.0.1.2 -> 10.0.1.3     TCP 9040 > 33744 [ACK] Seq=200000002 Ack=14 Win=14528 Len=0 TSV=8974421 TSER=8920508
================================================================================
IPv4 Conversations
Filter:<No Filter>
                                               |       <-      | |       ->      | |     Total     |
                                               | Frames  Bytes | | Frames  Bytes | | Frames  Bytes |
10.0.1.3             <-> 10.0.1.2              138136 209116984   69372   4578572  207508 213695556
================================================================================
  1   0.000000     10.0.1.3 -> 10.0.1.2     TCP 33746 > 9040 [SYN] Seq=0 Win=5840 Len=0 MSS=1460 TSV=8923685 TSER=0 WS=6
  2   0.000267     10.0.1.2 -> 10.0.1.3     TCP 9040 > 33746 [SYN, ACK] Seq=0 Ack=1 Win=14480 Len=0 MSS=1460 TSV=8977599 TSER=8923685 WS=6
  3   0.000290     10.0.1.3 -> 10.0.1.2     TCP 33746 > 9040 [ACK] Seq=1 Ack=1 Win=5888 Len=0 TSV=8923685 TSER=8977599
  7   0.002199     10.0.1.2 -> 10.0.1.3     TCP 9040 > 33746 [ACK] Seq=1 Ack=13 Win=14528 Len=0 TSV=8977599 TSER=8923685
207510  17.076928     10.0.1.3 -> 10.0.1.2     TCP 33746 > 9040 [FIN, ACK] Seq=13 Ack=200000002 Win=2580480 Len=0 TSV=8927954 TSER=8981813
207511  17.077173     10.0.1.2 -> 10.0.1.3     TCP 9040 > 33746 [ACK] Seq=200000002 Ack=14 Win=14528 Len=0 TSV=8981868 TSER=8927954
================================================================================
IPv4 Conversations
Filter:<No Filter>
                                               |       <-      | |       ->      | |     Total     |
                                               | Frames  Bytes | | Frames  Bytes | | Frames  Bytes |
10.0.1.3             <-> 10.0.1.2              138142 209117380   69369   4578374  207511 213695754
================================================================================
  1   0.000000     10.0.1.3 -> 10.0.1.2     TCP 49362 > 9040 [SYN] Seq=0 Win=5840 Len=0 MSS=1460 TSV=8931125 TSER=0 WS=6
  2   0.000364     10.0.1.2 -> 10.0.1.3     TCP 9040 > 49362 [SYN, ACK] Seq=0 Ack=1 Win=14480 Len=0 MSS=1460 TSV=8985039 TSER=8931125 WS=6
  3   0.000397     10.0.1.3 -> 10.0.1.2     TCP 49362 > 9040 [ACK] Seq=1 Ack=1 Win=5888 Len=0 TSV=8931125 TSER=8985039
  7   0.002344     10.0.1.2 -> 10.0.1.3     TCP 9040 > 49362 [ACK] Seq=1 Ack=13 Win=14528 Len=0 TSV=8985039 TSER=8931125
207516  17.063086     10.0.1.3 -> 10.0.1.2     TCP 49362 > 9040 [FIN, ACK] Seq=13 Ack=200000002 Win=2580480 Len=0 TSV=8935391 TSER=8989250
207517  17.063332     10.0.1.2 -> 10.0.1.3     TCP 9040 > 49362 [ACK] Seq=200000002 Ack=14 Win=14528 Len=0 TSV=8989305 TSER=8935391
================================================================================
IPv4 Conversations
Filter:<No Filter>
                                               |       <-      | |       ->      | |     Total     |
                                               | Frames  Bytes | | Frames  Bytes | | Frames  Bytes |
10.0.1.3             <-> 10.0.1.2              138128 209116456   69389   4579694  207517 213696150
================================================================================
  1   0.000000     10.0.1.3 -> 10.0.1.2     TCP 49364 > 9040 [SYN] Seq=0 Win=5840 Len=0 MSS=1460 TSV=8938555 TSER=0 WS=6
  2   0.000317     10.0.1.2 -> 10.0.1.3     TCP 9040 > 49364 [SYN, ACK] Seq=0 Ack=1 Win=14480 Len=0 MSS=1460 TSV=8992470 TSER=8938555 WS=6
  3   0.000339     10.0.1.3 -> 10.0.1.2     TCP 49364 > 9040 [ACK] Seq=1 Ack=1 Win=5888 Len=0 TSV=8938555 TSER=8992470
  7   0.002247     10.0.1.2 -> 10.0.1.3     TCP 9040 > 49364 [ACK] Seq=1 Ack=13 Win=14528 Len=0 TSV=8992470 TSER=8938555
207435  17.055107     10.0.1.3 -> 10.0.1.2     TCP 49364 > 9040 [FIN, ACK] Seq=13 Ack=200000002 Win=2580480 Len=0 TSV=8942819 TSER=8996679
207436  17.055371     10.0.1.2 -> 10.0.1.3     TCP 9040 > 49364 [ACK] Seq=200000002 Ack=14 Win=14528 Len=0 TSV=8996734 TSER=8942819
================================================================================
IPv4 Conversations
Filter:<No Filter>
                                               |       <-      | |       ->      | |     Total     |
                                               | Frames  Bytes | | Frames  Bytes | | Frames  Bytes |
10.0.1.3             <-> 10.0.1.2              138130 209116588   69306   4574216  207436 213690804
================================================================================
  1   0.000000     10.0.1.3 -> 10.0.1.2     TCP 49366 > 9040 [SYN] Seq=0 Win=5840 Len=0 MSS=1460 TSV=8946000 TSER=0 WS=6
  2   0.000275     10.0.1.2 -> 10.0.1.3     TCP 9040 > 49366 [SYN, ACK] Seq=0 Ack=1 Win=14480 Len=0 MSS=1460 TSV=8999915 TSER=8946000 WS=6
  3   0.000299     10.0.1.3 -> 10.0.1.2     TCP 49366 > 9040 [ACK] Seq=1 Ack=1 Win=5888 Len=0 TSV=8946000 TSER=8999915
  7   0.002317     10.0.1.2 -> 10.0.1.3     TCP 9040 > 49366 [ACK] Seq=1 Ack=13 Win=14528 Len=0 TSV=8999916 TSER=8946001
207533  17.052677     10.0.1.3 -> 10.0.1.2     TCP 49366 > 9040 [FIN, ACK] Seq=13 Ack=200000002 Win=2580480 Len=0 TSV=8950263 TSER=9004124
207534  17.052930     10.0.1.2 -> 10.0.1.3     TCP 9040 > 49366 [ACK] Seq=200000002 Ack=14 Win=14528 Len=0 TSV=9004179 TSER=8950263
================================================================================
IPv4 Conversations
Filter:<No Filter>
                                               |       <-      | |       ->      | |     Total     |
                                               | Frames  Bytes | | Frames  Bytes | | Frames  Bytes |
10.0.1.3             <-> 10.0.1.2              138129 209116522   69405   4580750  207534 213697272
================================================================================
  1   0.000000     10.0.1.3 -> 10.0.1.2     TCP 49370 > 9040 [SYN] Seq=0 Win=5840 Len=0 MSS=1460 TSV=8953432 TSER=0 WS=6
  2   0.000295     10.0.1.2 -> 10.0.1.3     TCP 9040 > 49370 [SYN, ACK] Seq=0 Ack=1 Win=14480 Len=0 MSS=1460 TSV=9007348 TSER=8953432 WS=6
  3   0.000316     10.0.1.3 -> 10.0.1.2     TCP 49370 > 9040 [ACK] Seq=1 Ack=1 Win=5888 Len=0 TSV=8953433 TSER=9007348
  7   0.002241     10.0.1.2 -> 10.0.1.3     TCP 9040 > 49370 [ACK] Seq=1 Ack=13 Win=14528 Len=0 TSV=9007349 TSER=8953433
207535  17.059319     10.0.1.3 -> 10.0.1.2     TCP 49370 > 9040 [FIN, ACK] Seq=13 Ack=200000002 Win=2580480 Len=0 TSV=8957698 TSER=9011559
207536  17.059567     10.0.1.2 -> 10.0.1.3     TCP 9040 > 49370 [ACK] Seq=200000002 Ack=14 Win=14528 Len=0 TSV=9011614 TSER=8957698
================================================================================
IPv4 Conversations
Filter:<No Filter>
                                               |       <-      | |       ->      | |     Total     |
                                               | Frames  Bytes | | Frames  Bytes | | Frames  Bytes |
10.0.1.3             <-> 10.0.1.2              138129 209116522   69407   4580882  207536 213697404
================================================================================
  1   0.000000     10.0.1.3 -> 10.0.1.2     TCP 49372 > 9040 [SYN] Seq=0 Win=5840 Len=0 MSS=1460 TSV=8960872 TSER=0 WS=6
  2   0.000296     10.0.1.2 -> 10.0.1.3     TCP 9040 > 49372 [SYN, ACK] Seq=0 Ack=1 Win=14480 Len=0 MSS=1460 TSV=9014788 TSER=8960872 WS=6
  3   0.000322     10.0.1.3 -> 10.0.1.2     TCP 49372 > 9040 [ACK] Seq=1 Ack=1 Win=5888 Len=0 TSV=8960872 TSER=9014788
  7   0.002279     10.0.1.2 -> 10.0.1.3     TCP 9040 > 49372 [ACK] Seq=1 Ack=13 Win=14528 Len=0 TSV=9014789 TSER=8960872
207511  17.053963     10.0.1.3 -> 10.0.1.2     TCP 49372 > 9040 [FIN, ACK] Seq=13 Ack=200000002 Win=2580480 Len=0 TSV=8965135 TSER=9018997
207512  17.054216     10.0.1.2 -> 10.0.1.3     TCP 9040 > 49372 [ACK] Seq=200000002 Ack=14 Win=14528 Len=0 TSV=9019052 TSER=8965135
================================================================================
IPv4 Conversations
Filter:<No Filter>
                                               |       <-      | |       ->      | |     Total     |
                                               | Frames  Bytes | | Frames  Bytes | | Frames  Bytes |
10.0.1.3             <-> 10.0.1.2              138128 209116456   69384   4579364  207512 213695820
================================================================================
  1   0.000000     10.0.1.3 -> 10.0.1.2     TCP 49374 > 9040 [SYN] Seq=0 Win=5840 Len=0 MSS=1460 TSV=8968291 TSER=0 WS=6
  2   0.000270     10.0.1.2 -> 10.0.1.3     TCP 9040 > 49374 [SYN, ACK] Seq=0 Ack=1 Win=14480 Len=0 MSS=1460 TSV=9022208 TSER=8968291 WS=6
  3   0.000293     10.0.1.3 -> 10.0.1.2     TCP 49374 > 9040 [ACK] Seq=1 Ack=1 Win=5888 Len=0 TSV=8968291 TSER=9022208
  7   0.002195     10.0.1.2 -> 10.0.1.3     TCP 9040 > 49374 [ACK] Seq=1 Ack=13 Win=14528 Len=0 TSV=9022208 TSER=8968291
207626  18.841603     10.0.1.3 -> 10.0.1.2     TCP 49374 > 9040 [FIN, ACK] Seq=13 Ack=200000002 Win=2580480 Len=0 TSV=8973001 TSER=9026863
207627  18.841852     10.0.1.2 -> 10.0.1.3     TCP 9040 > 49374 [ACK] Seq=200000002 Ack=14 Win=14528 Len=0 TSV=9026918 TSER=8973001
================================================================================
IPv4 Conversations
Filter:<No Filter>
                                               |       <-      | |       ->      | |     Total     |
                                               | Frames  Bytes | | Frames  Bytes | | Frames  Bytes |
10.0.1.3             <-> 10.0.1.2              138182 209120020   69445   4583390  207627 213703410
================================================================================
  1   0.000000     10.0.1.3 -> 10.0.1.2     TCP 49376 > 9040 [SYN] Seq=0 Win=5840 Len=0 MSS=1460 TSV=8976181 TSER=0 WS=6
  2   0.000290     10.0.1.2 -> 10.0.1.3     TCP 9040 > 49376 [SYN, ACK] Seq=0 Ack=1 Win=14480 Len=0 MSS=1460 TSV=9030099 TSER=8976181 WS=6
  3   0.000313     10.0.1.3 -> 10.0.1.2     TCP 49376 > 9040 [ACK] Seq=1 Ack=1 Win=5888 Len=0 TSV=8976181 TSER=9030099
  7   0.002170     10.0.1.2 -> 10.0.1.3     TCP 9040 > 49376 [ACK] Seq=1 Ack=13 Win=14528 Len=0 TSV=9030100 TSER=8976182
207485  17.052327     10.0.1.3 -> 10.0.1.2     TCP 49376 > 9040 [FIN, ACK] Seq=13 Ack=200000002 Win=2580480 Len=0 TSV=8980445 TSER=9034308
207486  17.052579     10.0.1.2 -> 10.0.1.3     TCP 9040 > 49376 [ACK] Seq=200000002 Ack=14 Win=14528 Len=0 TSV=9034363 TSER=8980445
================================================================================
IPv4 Conversations
Filter:<No Filter>
                                               |       <-      | |       ->      | |     Total     |
                                               | Frames  Bytes | | Frames  Bytes | | Frames  Bytes |
10.0.1.3             <-> 10.0.1.2              138129 209116522   69357   4577582  207486 213694104
================================================================================
  1   0.000000     10.0.1.3 -> 10.0.1.2     TCP 49380 > 9040 [SYN] Seq=0 Win=5840 Len=0 MSS=1460 TSV=8983648 TSER=0 WS=6
  2   0.000318     10.0.1.2 -> 10.0.1.3     TCP 9040 > 49380 [SYN, ACK] Seq=0 Ack=1 Win=14480 Len=0 MSS=1460 TSV=9037566 TSER=8983648 WS=6
  3   0.000340     10.0.1.3 -> 10.0.1.2     TCP 49380 > 9040 [ACK] Seq=1 Ack=1 Win=5888 Len=0 TSV=8983648 TSER=9037566
  7   0.002140     10.0.1.2 -> 10.0.1.3     TCP 9040 > 49380 [ACK] Seq=1 Ack=13 Win=14528 Len=0 TSV=9037566 TSER=8983648
207534  17.051132     10.0.1.3 -> 10.0.1.2     TCP 49380 > 9040 [FIN, ACK] Seq=13 Ack=200000002 Win=2580480 Len=0 TSV=8987911 TSER=9041774
207535  17.051386     10.0.1.2 -> 10.0.1.3     TCP 9040 > 49380 [ACK] Seq=200000002 Ack=14 Win=14528 Len=0 TSV=9041829 TSER=8987911
================================================================================
IPv4 Conversations
Filter:<No Filter>
                                               |       <-      | |       ->      | |     Total     |
                                               | Frames  Bytes | | Frames  Bytes | | Frames  Bytes |
10.0.1.3             <-> 10.0.1.2              138130 209116588   69405   4580750  207535 213697338
================================================================================
  1   0.000000     10.0.1.3 -> 10.0.1.2     TCP 49382 > 9040 [SYN] Seq=0 Win=5840 Len=0 MSS=1460 TSV=8991091 TSER=0 WS=6
  2   0.000312     10.0.1.2 -> 10.0.1.3     TCP 9040 > 49382 [SYN, ACK] Seq=0 Ack=1 Win=14480 Len=0 MSS=1460 TSV=9045010 TSER=8991091 WS=6
  3   0.000335     10.0.1.3 -> 10.0.1.2     TCP 49382 > 9040 [ACK] Seq=1 Ack=1 Win=5888 Len=0 TSV=8991091 TSER=9045010
  7   0.002150     10.0.1.2 -> 10.0.1.3     TCP 9040 > 49382 [ACK] Seq=1 Ack=13 Win=14528 Len=0 TSV=9045010 TSER=8991091
207516  17.054736     10.0.1.3 -> 10.0.1.2     TCP 49382 > 9040 [FIN, ACK] Seq=13 Ack=200000002 Win=2580480 Len=0 TSV=8995355 TSER=9049219
207517  17.054985     10.0.1.2 -> 10.0.1.3     TCP 9040 > 49382 [ACK] Seq=200000002 Ack=14 Win=14528 Len=0 TSV=9049274 TSER=8995355
================================================================================
IPv4 Conversations
Filter:<No Filter>
                                               |       <-      | |       ->      | |     Total     |
                                               | Frames  Bytes | | Frames  Bytes | | Frames  Bytes |
10.0.1.3             <-> 10.0.1.2              138129 209116522   69388   4579628  207517 213696150
================================================================================
  1   0.000000     10.0.1.3 -> 10.0.1.2     TCP 49384 > 9040 [SYN] Seq=0 Win=5840 Len=0 MSS=1460 TSV=8998525 TSER=0 WS=6
  2   0.000284     10.0.1.2 -> 10.0.1.3     TCP 9040 > 49384 [SYN, ACK] Seq=0 Ack=1 Win=14480 Len=0 MSS=1460 TSV=9052444 TSER=8998525 WS=6
  3   0.000307     10.0.1.3 -> 10.0.1.2     TCP 49384 > 9040 [ACK] Seq=1 Ack=1 Win=5888 Len=0 TSV=8998525 TSER=9052444
  7   0.002292     10.0.1.2 -> 10.0.1.3     TCP 9040 > 49384 [ACK] Seq=1 Ack=13 Win=14528 Len=0 TSV=9052444 TSER=8998525
207443  17.051861     10.0.1.3 -> 10.0.1.2     TCP 49384 > 9040 [FIN, ACK] Seq=13 Ack=200000002 Win=2580352 Len=0 TSV=9002788 TSER=9056652
207444  17.052110     10.0.1.2 -> 10.0.1.3     TCP 9040 > 49384 [ACK] Seq=200000002 Ack=14 Win=14528 Len=0 TSV=9056707 TSER=9002788
================================================================================
IPv4 Conversations
Filter:<No Filter>
                                               |       <-      | |       ->      | |     Total     |
                                               | Frames  Bytes | | Frames  Bytes | | Frames  Bytes |
10.0.1.3             <-> 10.0.1.2              138131 209116654   69313   4574678  207444 213691332
================================================================================
  1   0.000000     10.0.1.3 -> 10.0.1.2     TCP 52153 > 9040 [SYN] Seq=0 Win=5840 Len=0 MSS=1460 TSV=9005950 TSER=0 WS=6
  2   0.000294     10.0.1.2 -> 10.0.1.3     TCP 9040 > 52153 [SYN, ACK] Seq=0 Ack=1 Win=14480 Len=0 MSS=1460 TSV=9059870 TSER=9005950 WS=6
  3   0.000317     10.0.1.3 -> 10.0.1.2     TCP 52153 > 9040 [ACK] Seq=1 Ack=1 Win=5888 Len=0 TSV=9005950 TSER=9059870
  7   0.002338     10.0.1.2 -> 10.0.1.3     TCP 9040 > 52153 [ACK] Seq=1 Ack=13 Win=14528 Len=0 TSV=9059870 TSER=9005950
207538  17.068364     10.0.1.3 -> 10.0.1.2     TCP 52153 > 9040 [FIN, ACK] Seq=13 Ack=200000002 Win=2580480 Len=0 TSV=9010217 TSER=9064082
207539  17.068612     10.0.1.2 -> 10.0.1.3     TCP 9040 > 52153 [ACK] Seq=200000002 Ack=14 Win=14528 Len=0 TSV=9064137 TSER=9010217
================================================================================
IPv4 Conversations
Filter:<No Filter>
                                               |       <-      | |       ->      | |     Total     |
                                               | Frames  Bytes | | Frames  Bytes | | Frames  Bytes |
10.0.1.3             <-> 10.0.1.2              138136 209116984   69403   4580618  207539 213697602
================================================================================
  1   0.000000     10.0.1.3 -> 10.0.1.2     TCP 52155 > 9040 [SYN] Seq=0 Win=5840 Len=0 MSS=1460 TSV=9013390 TSER=0 WS=6
  2   0.000286     10.0.1.2 -> 10.0.1.3     TCP 9040 > 52155 [SYN, ACK] Seq=0 Ack=1 Win=14480 Len=0 MSS=1460 TSV=9067310 TSER=9013390 WS=6
  3   0.000309     10.0.1.3 -> 10.0.1.2     TCP 52155 > 9040 [ACK] Seq=1 Ack=1 Win=5888 Len=0 TSV=9013390 TSER=9067310
  7   0.002140     10.0.1.2 -> 10.0.1.3     TCP 9040 > 52155 [ACK] Seq=1 Ack=13 Win=14528 Len=0 TSV=9067311 TSER=9013390
207479  17.082396     10.0.1.3 -> 10.0.1.2     TCP 52155 > 9040 [FIN, ACK] Seq=13 Ack=200000002 Win=2580480 Len=0 TSV=9017661 TSER=9071526
207480  17.082654     10.0.1.2 -> 10.0.1.3     TCP 9040 > 52155 [ACK] Seq=200000002 Ack=14 Win=14528 Len=0 TSV=9071581 TSER=9017661
================================================================================
IPv4 Conversations
Filter:<No Filter>
                                               |       <-      | |       ->      | |     Total     |
                                               | Frames  Bytes | | Frames  Bytes | | Frames  Bytes |
10.0.1.3             <-> 10.0.1.2              138132 209116720   69348   4576988  207480 213693708
================================================================================
  1   0.000000     10.0.1.3 -> 10.0.1.2     TCP 52157 > 9040 [SYN] Seq=0 Win=5840 Len=0 MSS=1460 TSV=9020818 TSER=0 WS=6
  2   0.000290     10.0.1.2 -> 10.0.1.3     TCP 9040 > 52157 [SYN, ACK] Seq=0 Ack=1 Win=14480 Len=0 MSS=1460 TSV=9074739 TSER=9020818 WS=6
  3   0.000312     10.0.1.3 -> 10.0.1.2     TCP 52157 > 9040 [ACK] Seq=1 Ack=1 Win=5888 Len=0 TSV=9020818 TSER=9074739
  7   0.002270     10.0.1.2 -> 10.0.1.3     TCP 9040 > 52157 [ACK] Seq=1 Ack=13 Win=14528 Len=0 TSV=9074739 TSER=9020818
207564  17.051600     10.0.1.3 -> 10.0.1.2     TCP 52157 > 9040 [FIN, ACK] Seq=13 Ack=200000002 Win=2580480 Len=0 TSV=9025081 TSER=9078947
207565  17.051868     10.0.1.2 -> 10.0.1.3     TCP 9040 > 52157 [ACK] Seq=200000002 Ack=14 Win=14528 Len=0 TSV=9079002 TSER=9025081
================================================================================
IPv4 Conversations
Filter:<No Filter>
                                               |       <-      | |       ->      | |     Total     |
                                               | Frames  Bytes | | Frames  Bytes | | Frames  Bytes |
10.0.1.3             <-> 10.0.1.2              138129 209116522   69436   4582796  207565 213699318
================================================================================
