  1   0.000000     10.0.1.3 -> 10.0.1.2     TCP 40979 > 9040 [SYN] Seq=0 Win=5840 Len=0 MSS=1460 TSV=5526033 TSER=0 WS=6
  2   0.000304     10.0.1.2 -> 10.0.1.3     TCP 9040 > 40979 [SYN, ACK] Seq=0 Ack=1 Win=14480 Len=0 MSS=1460 TSV=5511023 TSER=5526033 WS=6
  3   0.000326     10.0.1.3 -> 10.0.1.2     TCP 40979 > 9040 [ACK] Seq=1 Ack=1 Win=5888 Len=0 TSV=5526033 TSER=5511023
  7   0.002285     10.0.1.2 -> 10.0.1.3     TCP 9040 > 40979 [ACK] Seq=1 Ack=13 Win=14528 Len=0 TSV=5511023 TSER=5526033
308236  55.097955     10.0.1.3 -> 10.0.1.2     TCP 40979 > 9040 [FIN, ACK] Seq=13 Ack=300000002 Win=2020288 Len=0 TSV=5539807 TSER=5524777
308237  55.098202     10.0.1.2 -> 10.0.1.3     TCP 9040 > 40979 [ACK] Seq=300000002 Ack=14 Win=14528 Len=0 TSV=5524798 TSER=5539807
  1   0.000000     10.0.1.3 -> 10.0.1.2     TCP 40981 > 9040 [SYN] Seq=0 Win=5840 Len=0 MSS=1460 TSV=5545492 TSER=0 WS=6
  2   0.000303     10.0.1.2 -> 10.0.1.3     TCP 9040 > 40981 [SYN, ACK] Seq=0 Ack=1 Win=14480 Len=0 MSS=1460 TSV=5530483 TSER=5545492 WS=6
  3   0.000327     10.0.1.3 -> 10.0.1.2     TCP 40981 > 9040 [ACK] Seq=1 Ack=1 Win=5888 Len=0 TSV=5545492 TSER=5530483
  7   0.002214     10.0.1.2 -> 10.0.1.3     TCP 9040 > 40981 [ACK] Seq=1 Ack=13 Win=14528 Len=0 TSV=5530484 TSER=5545493
308718  54.523957     10.0.1.3 -> 10.0.1.2     TCP 40981 > 9040 [FIN, ACK] Seq=13 Ack=300000002 Win=2026112 Len=0 TSV=5559123 TSER=5544094
308719  54.524164     10.0.1.2 -> 10.0.1.3     TCP 9040 > 40981 [ACK] Seq=300000002 Ack=14 Win=14528 Len=0 TSV=5544115 TSER=5559123
  1   0.000000     10.0.1.3 -> 10.0.1.2     TCP 54399 > 9040 [SYN] Seq=0 Win=5840 Len=0 MSS=1460 TSV=5564579 TSER=0 WS=6
  2   0.000284     10.0.1.2 -> 10.0.1.3     TCP 9040 > 54399 [SYN, ACK] Seq=0 Ack=1 Win=14480 Len=0 MSS=1460 TSV=5549572 TSER=5564579 WS=6
  3   0.000310     10.0.1.3 -> 10.0.1.2     TCP 54399 > 9040 [ACK] Seq=1 Ack=1 Win=5888 Len=0 TSV=5564579 TSER=5549572
  7   0.002993     10.0.1.2 -> 10.0.1.3     TCP 9040 > 54399 [ACK] Seq=1 Ack=13 Win=14528 Len=0 TSV=5549573 TSER=5564580
310915  54.643485     10.0.1.3 -> 10.0.1.2     TCP 54399 > 9040 [FIN, ACK] Seq=13 Ack=300000002 Win=2002944 Len=0 TSV=5578240 TSER=5563213
310916  54.643732     10.0.1.2 -> 10.0.1.3     TCP 9040 > 54399 [ACK] Seq=300000002 Ack=14 Win=14528 Len=0 TSV=5563234 TSER=5578240
  1   0.000000     10.0.1.3 -> 10.0.1.2     TCP 54401 > 9040 [SYN] Seq=0 Win=5840 Len=0 MSS=1460 TSV=5583783 TSER=0 WS=6
  2   0.000307     10.0.1.2 -> 10.0.1.3     TCP 9040 > 54401 [SYN, ACK] Seq=0 Ack=1 Win=14480 Len=0 MSS=1460 TSV=5568777 TSER=5583783 WS=6
  3   0.000351     10.0.1.3 -> 10.0.1.2     TCP 54401 > 9040 [ACK] Seq=1 Ack=1 Win=5888 Len=0 TSV=5583783 TSER=5568777
  7   0.003044     10.0.1.2 -> 10.0.1.3     TCP 9040 > 54401 [ACK] Seq=1 Ack=13 Win=14528 Len=0 TSV=5568778 TSER=5583783
311144  54.970957     10.0.1.3 -> 10.0.1.2     TCP 54401 > 9040 [FIN, ACK] Seq=13 Ack=300000002 Win=2026112 Len=0 TSV=5597525 TSER=5582499
311145  54.971210     10.0.1.2 -> 10.0.1.3     TCP 9040 > 54401 [ACK] Seq=300000002 Ack=14 Win=14528 Len=0 TSV=5582521 TSER=5597525
  1   0.000000     10.0.1.3 -> 10.0.1.2     TCP 54403 > 9040 [SYN] Seq=0 Win=5840 Len=0 MSS=1460 TSV=5602992 TSER=0 WS=6
  2   0.000286     10.0.1.2 -> 10.0.1.3     TCP 9040 > 54403 [SYN, ACK] Seq=0 Ack=1 Win=14480 Len=0 MSS=1460 TSV=5587988 TSER=5602992 WS=6
  3   0.000319     10.0.1.3 -> 10.0.1.2     TCP 54403 > 9040 [ACK] Seq=1 Ack=1 Win=5888 Len=0 TSV=5602992 TSER=5587988
  7   0.002521     10.0.1.2 -> 10.0.1.3     TCP 9040 > 54403 [ACK] Seq=1 Ack=13 Win=14528 Len=0 TSV=5587989 TSER=5602993
311209  54.187348     10.0.1.3 -> 10.0.1.2     TCP 54403 > 9040 [FIN, ACK] Seq=13 Ack=300000002 Win=2008704 Len=0 TSV=5616539 TSER=5601515
311210  54.187596     10.0.1.2 -> 10.0.1.3     TCP 9040 > 54403 [ACK] Seq=300000002 Ack=14 Win=14528 Len=0 TSV=5601536 TSER=5616539
  1   0.000000     10.0.1.3 -> 10.0.1.2     TCP 54405 > 9040 [SYN] Seq=0 Win=5840 Len=0 MSS=1460 TSV=5622100 TSER=0 WS=6
  2   0.000321     10.0.1.2 -> 10.0.1.3     TCP 9040 > 54405 [SYN, ACK] Seq=0 Ack=1 Win=14480 Len=0 MSS=1460 TSV=5607097 TSER=5622100 WS=6
  3   0.000343     10.0.1.3 -> 10.0.1.2     TCP 54405 > 9040 [ACK] Seq=1 Ack=1 Win=5888 Len=0 TSV=5622100 TSER=5607097
  7   0.002257     10.0.1.2 -> 10.0.1.3     TCP 9040 > 54405 [ACK] Seq=1 Ack=13 Win=14528 Len=0 TSV=5607098 TSER=5622101
311195  54.722347     10.0.1.3 -> 10.0.1.2     TCP 54405 > 9040 [FIN, ACK] Seq=13 Ack=300000002 Win=2002944 Len=0 TSV=5635781 TSER=5620757
311196  54.722600     10.0.1.2 -> 10.0.1.3     TCP 9040 > 54405 [ACK] Seq=300000002 Ack=14 Win=14528 Len=0 TSV=5620779 TSER=5635781
  1   0.000000     10.0.1.3 -> 10.0.1.2     TCP 55312 > 9040 [SYN] Seq=0 Win=5840 Len=0 MSS=1460 TSV=5641318 TSER=0 WS=6
  2   0.000323     10.0.1.2 -> 10.0.1.3     TCP 9040 > 55312 [SYN, ACK] Seq=0 Ack=1 Win=14480 Len=0 MSS=1460 TSV=5626317 TSER=5641318 WS=6
  3   0.000347     10.0.1.3 -> 10.0.1.2     TCP 55312 > 9040 [ACK] Seq=1 Ack=1 Win=5888 Len=0 TSV=5641318 TSER=5626317
  7   0.002353     10.0.1.2 -> 10.0.1.3     TCP 9040 > 55312 [ACK] Seq=1 Ack=13 Win=14528 Len=0 TSV=5626317 TSER=5641318
311317  54.701743     10.0.1.3 -> 10.0.1.2     TCP 55312 > 9040 [FIN, ACK] Seq=13 Ack=300000002 Win=2023168 Len=0 TSV=5654994 TSER=5639972
311318  54.702001     10.0.1.2 -> 10.0.1.3     TCP 9040 > 55312 [ACK] Seq=300000002 Ack=14 Win=14528 Len=0 TSV=5639993 TSER=5654994
  1   0.000000     10.0.1.3 -> 10.0.1.2     TCP 55314 > 9040 [SYN] Seq=0 Win=5840 Len=0 MSS=1460 TSV=5660448 TSER=0 WS=6
  2   0.000327     10.0.1.2 -> 10.0.1.3     TCP 9040 > 55314 [SYN, ACK] Seq=0 Ack=1 Win=14480 Len=0 MSS=1460 TSV=5645449 TSER=5660448 WS=6
  3   0.000352     10.0.1.3 -> 10.0.1.2     TCP 55314 > 9040 [ACK] Seq=1 Ack=1 Win=5888 Len=0 TSV=5660448 TSER=5645449
  7   0.002225     10.0.1.2 -> 10.0.1.3     TCP 9040 > 55314 [ACK] Seq=1 Ack=13 Win=14528 Len=0 TSV=5645449 TSER=5660449
300472  54.651578     10.0.1.3 -> 10.0.1.2     TCP 55314 > 9040 [FIN, ACK] Seq=13 Ack=300000002 Win=2002944 Len=0 TSV=5674111 TSER=5659091
300473  54.651825     10.0.1.2 -> 10.0.1.3     TCP 9040 > 55314 [ACK] Seq=300000002 Ack=14 Win=14528 Len=0 TSV=5659113 TSER=5674111
  1   0.000000     10.0.1.3 -> 10.0.1.2     TCP 55316 > 9040 [SYN] Seq=0 Win=5840 Len=0 MSS=1460 TSV=5679396 TSER=0 WS=6
  2   0.000283     10.0.1.2 -> 10.0.1.3     TCP 9040 > 55316 [SYN, ACK] Seq=0 Ack=1 Win=14480 Len=0 MSS=1460 TSV=5664398 TSER=5679396 WS=6
  3   0.000306     10.0.1.3 -> 10.0.1.2     TCP 55316 > 9040 [ACK] Seq=1 Ack=1 Win=5888 Len=0 TSV=5679397 TSER=5664398
  7   0.002193     10.0.1.2 -> 10.0.1.3     TCP 9040 > 55316 [ACK] Seq=1 Ack=13 Win=14528 Len=0 TSV=5664398 TSER=5679397
311074  54.798420     10.0.1.3 -> 10.0.1.2     TCP 55316 > 9040 [FIN, ACK] Seq=13 Ack=300000002 Win=2002944 Len=0 TSV=5693096 TSER=5678077
311075  54.798666     10.0.1.2 -> 10.0.1.3     TCP 9040 > 55316 [ACK] Seq=300000002 Ack=14 Win=14528 Len=0 TSV=5678099 TSER=5693096
  1   0.000000     10.0.1.3 -> 10.0.1.2     TCP 55318 > 9040 [SYN] Seq=0 Win=5840 Len=0 MSS=1460 TSV=5698549 TSER=0 WS=6
  2   0.000320     10.0.1.2 -> 10.0.1.3     TCP 9040 > 55318 [SYN, ACK] Seq=0 Ack=1 Win=14480 Len=0 MSS=1460 TSV=5683552 TSER=5698549 WS=6
  3   0.000342     10.0.1.3 -> 10.0.1.2     TCP 55318 > 9040 [ACK] Seq=1 Ack=1 Win=5888 Len=0 TSV=5698549 TSER=5683552
  7   0.002200     10.0.1.2 -> 10.0.1.3     TCP 9040 > 55318 [ACK] Seq=1 Ack=13 Win=14528 Len=0 TSV=5683553 TSER=5698550
300295  54.783712     10.0.1.3 -> 10.0.1.2     TCP 55318 > 9040 [FIN, ACK] Seq=13 Ack=300000002 Win=2026112 Len=0 TSV=5712245 TSER=5697228
300296  54.783986     10.0.1.2 -> 10.0.1.3     TCP 9040 > 55318 [ACK] Seq=300000002 Ack=14 Win=14528 Len=0 TSV=5697249 TSER=5712245
  1   0.000000     10.0.1.3 -> 10.0.1.2     TCP 43653 > 9040 [SYN] Seq=0 Win=5840 Len=0 MSS=1460 TSV=5717971 TSER=0 WS=6
  2   0.000318     10.0.1.2 -> 10.0.1.3     TCP 9040 > 43653 [SYN, ACK] Seq=0 Ack=1 Win=14480 Len=0 MSS=1460 TSV=5702975 TSER=5717971 WS=6
  3   0.000340     10.0.1.3 -> 10.0.1.2     TCP 43653 > 9040 [ACK] Seq=1 Ack=1 Win=5888 Len=0 TSV=5717971 TSER=5702975
  7   0.002225     10.0.1.2 -> 10.0.1.3     TCP 9040 > 43653 [ACK] Seq=1 Ack=13 Win=14528 Len=0 TSV=5702975 TSER=5717971
311190  54.447917     10.0.1.3 -> 10.0.1.2     TCP 43653 > 9040 [FIN, ACK] Seq=13 Ack=300000002 Win=2002944 Len=0 TSV=5731583 TSER=5716567
311191  54.448146     10.0.1.2 -> 10.0.1.3     TCP 9040 > 43653 [ACK] Seq=300000002 Ack=14 Win=14528 Len=0 TSV=5716588 TSER=5731583
  1   0.000000     10.0.1.3 -> 10.0.1.2     TCP 43655 > 9040 [SYN] Seq=0 Win=5840 Len=0 MSS=1460 TSV=5737041 TSER=0 WS=6
  2   0.000276     10.0.1.2 -> 10.0.1.3     TCP 9040 > 43655 [SYN, ACK] Seq=0 Ack=1 Win=14480 Len=0 MSS=1460 TSV=5722047 TSER=5737041 WS=6
  3   0.000304     10.0.1.3 -> 10.0.1.2     TCP 43655 > 9040 [ACK] Seq=1 Ack=1 Win=5888 Len=0 TSV=5737041 TSER=5722047
  7   0.002273     10.0.1.2 -> 10.0.1.3     TCP 9040 > 43655 [ACK] Seq=1 Ack=13 Win=14528 Len=0 TSV=5722048 TSER=5737042
310985  55.089344     10.0.1.3 -> 10.0.1.2     TCP 43655 > 9040 [FIN, ACK] Seq=13 Ack=300000002 Win=2014528 Len=0 TSV=5750814 TSER=5735799
310986  55.089594     10.0.1.2 -> 10.0.1.3     TCP 9040 > 43655 [ACK] Seq=300000002 Ack=14 Win=14528 Len=0 TSV=5735821 TSER=5750814
  1   0.000000     10.0.1.3 -> 10.0.1.2     TCP 43657 > 9040 [SYN] Seq=0 Win=5840 Len=0 MSS=1460 TSV=5756449 TSER=0 WS=6
  2   0.000365     10.0.1.2 -> 10.0.1.3     TCP 9040 > 43657 [SYN, ACK] Seq=0 Ack=1 Win=14480 Len=0 MSS=1460 TSV=5741456 TSER=5756449 WS=6
  3   0.000388     10.0.1.3 -> 10.0.1.2     TCP 43657 > 9040 [ACK] Seq=1 Ack=1 Win=5888 Len=0 TSV=5756449 TSER=5741456
  7   0.002282     10.0.1.2 -> 10.0.1.3     TCP 9040 > 43657 [ACK] Seq=1 Ack=13 Win=14528 Len=0 TSV=5741457 TSER=5756450
311311  55.425683     10.0.1.3 -> 10.0.1.2     TCP 43657 > 9040 [FIN, ACK] Seq=13 Ack=300000002 Win=2002944 Len=0 TSV=5770306 TSER=5755292
311312  55.425937     10.0.1.2 -> 10.0.1.3     TCP 9040 > 43657 [ACK] Seq=300000002 Ack=14 Win=14528 Len=0 TSV=5755314 TSER=5770306
  1   0.000000     10.0.1.3 -> 10.0.1.2     TCP 59992 > 9040 [SYN] Seq=0 Win=5840 Len=0 MSS=1460 TSV=5775838 TSER=0 WS=6
  2   0.000320     10.0.1.2 -> 10.0.1.3     TCP 9040 > 59992 [SYN, ACK] Seq=0 Ack=1 Win=14480 Len=0 MSS=1460 TSV=5760846 TSER=5775838 WS=6
  3   0.000343     10.0.1.3 -> 10.0.1.2     TCP 59992 > 9040 [ACK] Seq=1 Ack=1 Win=5888 Len=0 TSV=5775838 TSER=5760846
  7   0.002449     10.0.1.2 -> 10.0.1.3     TCP 9040 > 59992 [ACK] Seq=1 Ack=13 Win=14528 Len=0 TSV=5760847 TSER=5775838
307638  55.479093     10.0.1.3 -> 10.0.1.2     TCP 59992 > 9040 [FIN, ACK] Seq=13 Ack=300000002 Win=2005824 Len=0 TSV=5789707 TSER=5774696
307639  55.479346     10.0.1.2 -> 10.0.1.3     TCP 9040 > 59992 [ACK] Seq=300000002 Ack=14 Win=14528 Len=0 TSV=5774717 TSER=5789707
  1   0.000000     10.0.1.3 -> 10.0.1.2     TCP 59994 > 9040 [SYN] Seq=0 Win=5840 Len=0 MSS=1460 TSV=5795242 TSER=0 WS=6
  2   0.000333     10.0.1.2 -> 10.0.1.3     TCP 9040 > 59994 [SYN, ACK] Seq=0 Ack=1 Win=14480 Len=0 MSS=1460 TSV=5780252 TSER=5795242 WS=6
  3   0.000354     10.0.1.3 -> 10.0.1.2     TCP 59994 > 9040 [ACK] Seq=1 Ack=1 Win=5888 Len=0 TSV=5795242 TSER=5780252
  7   0.002297     10.0.1.2 -> 10.0.1.3     TCP 9040 > 59994 [ACK] Seq=1 Ack=13 Win=14528 Len=0 TSV=5780253 TSER=5795242
311376  54.928295     10.0.1.3 -> 10.0.1.2     TCP 59994 > 9040 [FIN, ACK] Seq=13 Ack=300000002 Win=2002944 Len=0 TSV=5808974 TSER=5793964
311377  54.928551     10.0.1.2 -> 10.0.1.3     TCP 9040 > 59994 [ACK] Seq=300000002 Ack=14 Win=14528 Len=0 TSV=5793985 TSER=5808974
  1   0.000000     10.0.1.3 -> 10.0.1.2     TCP 59996 > 9040 [SYN] Seq=0 Win=5840 Len=0 MSS=1460 TSV=5814484 TSER=0 WS=6
  2   0.000368     10.0.1.2 -> 10.0.1.3     TCP 9040 > 59996 [SYN, ACK] Seq=0 Ack=1 Win=14480 Len=0 MSS=1460 TSV=5799496 TSER=5814484 WS=6
  3   0.000393     10.0.1.3 -> 10.0.1.2     TCP 59996 > 9040 [ACK] Seq=1 Ack=1 Win=5888 Len=0 TSV=5814484 TSER=5799496
  7   0.002301     10.0.1.2 -> 10.0.1.3     TCP 9040 > 59996 [ACK] Seq=1 Ack=13 Win=14528 Len=0 TSV=5799496 TSER=5814484
311410  55.334043     10.0.1.3 -> 10.0.1.2     TCP 59996 > 9040 [FIN, ACK] Seq=13 Ack=300000002 Win=2005824 Len=0 TSV=5828317 TSER=5813309
311411  55.334293     10.0.1.2 -> 10.0.1.3     TCP 9040 > 59996 [ACK] Seq=300000002 Ack=14 Win=14528 Len=0 TSV=5813330 TSER=5828317
  1   0.000000     10.0.1.3 -> 10.0.1.2     TCP 59998 > 9040 [SYN] Seq=0 Win=5840 Len=0 MSS=1460 TSV=5833801 TSER=0 WS=6
  2   0.000268     10.0.1.2 -> 10.0.1.3     TCP 9040 > 59998 [SYN, ACK] Seq=0 Ack=1 Win=14480 Len=0 MSS=1460 TSV=5818814 TSER=5833801 WS=6
  3   0.000292     10.0.1.3 -> 10.0.1.2     TCP 59998 > 9040 [ACK] Seq=1 Ack=1 Win=5888 Len=0 TSV=5833801 TSER=5818814
  7   0.002308     10.0.1.2 -> 10.0.1.3     TCP 9040 > 59998 [ACK] Seq=1 Ack=13 Win=14528 Len=0 TSV=5818814 TSER=5833801
309156  54.716290     10.0.1.3 -> 10.0.1.2     TCP 59998 > 9040 [FIN, ACK] Seq=13 Ack=300000002 Win=2008704 Len=0 TSV=5847480 TSER=5832473
309157  54.716535     10.0.1.2 -> 10.0.1.3     TCP 9040 > 59998 [ACK] Seq=300000002 Ack=14 Win=14528 Len=0 TSV=5832494 TSER=5847480
  1   0.000000     10.0.1.3 -> 10.0.1.2     TCP 41963 > 9040 [SYN] Seq=0 Win=5840 Len=0 MSS=1460 TSV=5852923 TSER=0 WS=6
  2   0.000300     10.0.1.2 -> 10.0.1.3     TCP 9040 > 41963 [SYN, ACK] Seq=0 Ack=1 Win=14480 Len=0 MSS=1460 TSV=5837937 TSER=5852923 WS=6
  3   0.000321     10.0.1.3 -> 10.0.1.2     TCP 41963 > 9040 [ACK] Seq=1 Ack=1 Win=5888 Len=0 TSV=5852923 TSER=5837937
  7   0.002262     10.0.1.2 -> 10.0.1.3     TCP 9040 > 41963 [ACK] Seq=1 Ack=13 Win=14528 Len=0 TSV=5837938 TSER=5852923
311221  55.253640     10.0.1.3 -> 10.0.1.2     TCP 41963 > 9040 [FIN, ACK] Seq=13 Ack=300000002 Win=2002944 Len=0 TSV=5866736 TSER=5851730
311222  55.253889     10.0.1.2 -> 10.0.1.3     TCP 9040 > 41963 [ACK] Seq=300000002 Ack=14 Win=14528 Len=0 TSV=5851752 TSER=5866736
  1   0.000000     10.0.1.3 -> 10.0.1.2     TCP 41965 > 9040 [SYN] Seq=0 Win=5840 Len=0 MSS=1460 TSV=5872312 TSER=0 WS=6
  2   0.000295     10.0.1.2 -> 10.0.1.3     TCP 9040 > 41965 [SYN, ACK] Seq=0 Ack=1 Win=14480 Len=0 MSS=1460 TSV=5857328 TSER=5872312 WS=6
  3   0.000322     10.0.1.3 -> 10.0.1.2     TCP 41965 > 9040 [ACK] Seq=1 Ack=1 Win=5888 Len=0 TSV=5872312 TSER=5857328
  7   0.002257     10.0.1.2 -> 10.0.1.3     TCP 9040 > 41965 [ACK] Seq=1 Ack=13 Win=14528 Len=0 TSV=5857329 TSER=5872313
311330  54.724247     10.0.1.3 -> 10.0.1.2     TCP 41965 > 9040 [FIN, ACK] Seq=13 Ack=300000002 Win=2005824 Len=0 TSV=5885993 TSER=5870989
311331  54.724494     10.0.1.2 -> 10.0.1.3     TCP 9040 > 41965 [ACK] Seq=300000002 Ack=14 Win=14528 Len=0 TSV=5871010 TSER=5885993
  1   0.000000     10.0.1.3 -> 10.0.1.2     TCP 41967 > 9040 [SYN] Seq=0 Win=5840 Len=0 MSS=1460 TSV=5891581 TSER=0 WS=6
  2   0.000350     10.0.1.2 -> 10.0.1.3     TCP 9040 > 41967 [SYN, ACK] Seq=0 Ack=1 Win=14480 Len=0 MSS=1460 TSV=5876598 TSER=5891581 WS=6
  3   0.000373     10.0.1.3 -> 10.0.1.2     TCP 41967 > 9040 [ACK] Seq=1 Ack=1 Win=5888 Len=0 TSV=5891581 TSER=5876598
  7   0.002353     10.0.1.2 -> 10.0.1.3     TCP 9040 > 41967 [ACK] Seq=1 Ack=13 Win=14528 Len=0 TSV=5876599 TSER=5891581
310942  54.540955     10.0.1.2 -> 10.0.1.3     TCP [TCP ACKed lost segment] [TCP Previous segment lost] 9040 > 41967 [ACK] Seq=300000002 Ack=14 Win=14528 Len=0 TSV=5890235 TSER=5905216
