  1   0.000000     10.0.1.3 -> 10.0.1.2     TCP 41969 > 9040 [SYN] Seq=0 Win=5840 Len=0 MSS=1460 TSV=5910636 TSER=0 WS=6
  2   0.000320     10.0.1.2 -> 10.0.1.3     TCP 9040 > 41969 [SYN, ACK] Seq=0 Ack=1 Win=14480 Len=0 MSS=1460 TSV=5895655 TSER=5910636 WS=6
  3   0.000346     10.0.1.3 -> 10.0.1.2     TCP 41969 > 9040 [ACK] Seq=1 Ack=1 Win=5888 Len=0 TSV=5910636 TSER=5895655
  7   0.002426     10.0.1.2 -> 10.0.1.3     TCP 9040 > 41969 [ACK] Seq=1 Ack=13 Win=14528 Len=0 TSV=5895656 TSER=5910637
362956  64.099261     10.0.1.3 -> 10.0.1.2     TCP 41969 > 9040 [FIN, ACK] Seq=13 Ack=350000002 Win=2026112 Len=0 TSV=5926661 TSER=5911660
362957  64.099516     10.0.1.2 -> 10.0.1.3     TCP 9040 > 41969 [ACK] Seq=350000002 Ack=14 Win=14528 Len=0 TSV=5911681 TSER=5926661
  1   0.000000     10.0.1.3 -> 10.0.1.2     TCP 34844 > 9040 [SYN] Seq=0 Win=5840 Len=0 MSS=1460 TSV=5932510 TSER=0 WS=6
  2   0.000335     10.0.1.2 -> 10.0.1.3     TCP 9040 > 34844 [SYN, ACK] Seq=0 Ack=1 Win=14480 Len=0 MSS=1460 TSV=5917531 TSER=5932510 WS=6
  3   0.000357     10.0.1.3 -> 10.0.1.2     TCP 34844 > 9040 [ACK] Seq=1 Ack=1 Win=5888 Len=0 TSV=5932510 TSER=5917531
  7   0.002249     10.0.1.2 -> 10.0.1.3     TCP 9040 > 34844 [ACK] Seq=1 Ack=13 Win=14528 Len=0 TSV=5917531 TSER=5932511
349737  64.457128     10.0.1.3 -> 10.0.1.2     TCP 34844 > 9040 [FIN, ACK] Seq=13 Ack=350000002 Win=2020288 Len=0 TSV=5948625 TSER=5933625
349738  64.457378     10.0.1.2 -> 10.0.1.3     TCP 9040 > 34844 [ACK] Seq=350000002 Ack=14 Win=14528 Len=0 TSV=5933646 TSER=5948625
  1   0.000000     10.0.1.3 -> 10.0.1.2     TCP 34846 > 9040 [SYN] Seq=0 Win=5840 Len=0 MSS=1460 TSV=5954584 TSER=0 WS=6
  2   0.000296     10.0.1.2 -> 10.0.1.3     TCP 9040 > 34846 [SYN, ACK] Seq=0 Ack=1 Win=14480 Len=0 MSS=1460 TSV=5939606 TSER=5954584 WS=6
  3   0.000319     10.0.1.3 -> 10.0.1.2     TCP 34846 > 9040 [ACK] Seq=1 Ack=1 Win=5888 Len=0 TSV=5954584 TSER=5939606
  7   0.002264     10.0.1.2 -> 10.0.1.3     TCP 9040 > 34846 [ACK] Seq=1 Ack=13 Win=14528 Len=0 TSV=5939607 TSER=5954584
362922  62.631964     10.0.1.3 -> 10.0.1.2     TCP 34846 > 9040 [FIN, ACK] Seq=13 Ack=350000002 Win=2002944 Len=0 TSV=5970242 TSER=5955244
362923  62.632213     10.0.1.2 -> 10.0.1.3     TCP 9040 > 34846 [ACK] Seq=350000002 Ack=14 Win=14528 Len=0 TSV=5955265 TSER=5970242
  1   0.000000     10.0.1.3 -> 10.0.1.2     TCP 34848 > 9040 [SYN] Seq=0 Win=5840 Len=0 MSS=1460 TSV=5976290 TSER=0 WS=6
  2   0.000290     10.0.1.2 -> 10.0.1.3     TCP 9040 > 34848 [SYN, ACK] Seq=0 Ack=1 Win=14480 Len=0 MSS=1460 TSV=5961314 TSER=5976290 WS=6
  3   0.000316     10.0.1.3 -> 10.0.1.2     TCP 34848 > 9040 [ACK] Seq=1 Ack=1 Win=5888 Len=0 TSV=5976290 TSER=5961314
  7   0.002924     10.0.1.2 -> 10.0.1.3     TCP 9040 > 34848 [ACK] Seq=1 Ack=13 Win=14528 Len=0 TSV=5961315 TSER=5976291
359060  63.137270     10.0.1.3 -> 10.0.1.2     TCP 34848 > 9040 [FIN, ACK] Seq=13 Ack=350000002 Win=2026112 Len=0 TSV=5992075 TSER=5977078
359061  63.137515     10.0.1.2 -> 10.0.1.3     TCP 9040 > 34848 [ACK] Seq=350000002 Ack=14 Win=14528 Len=0 TSV=5977100 TSER=5992075
  1   0.000000     10.0.1.3 -> 10.0.1.2     TCP 34850 > 9040 [SYN] Seq=0 Win=5840 Len=0 MSS=1460 TSV=5998243 TSER=0 WS=6
  2   0.000272     10.0.1.2 -> 10.0.1.3     TCP 9040 > 34850 [SYN, ACK] Seq=0 Ack=1 Win=14480 Len=0 MSS=1460 TSV=5983268 TSER=5998243 WS=6
  3   0.000295     10.0.1.3 -> 10.0.1.2     TCP 34850 > 9040 [ACK] Seq=1 Ack=1 Win=5888 Len=0 TSV=5998243 TSER=5983268
  7   0.002249     10.0.1.2 -> 10.0.1.3     TCP 9040 > 34850 [ACK] Seq=1 Ack=13 Win=14528 Len=0 TSV=5983269 TSER=5998243
344112  63.530836     10.0.1.3 -> 10.0.1.2     TCP 34850 > 9040 [FIN, ACK] Seq=13 Ack=350000002 Win=2017408 Len=0 TSV=6014126 TSER=5999131
344113  63.531084     10.0.1.2 -> 10.0.1.3     TCP 9040 > 34850 [ACK] Seq=350000002 Ack=14 Win=14528 Len=0 TSV=5999152 TSER=6014126
  1   0.000000     10.0.1.3 -> 10.0.1.2     TCP 51772 > 9040 [SYN] Seq=0 Win=5840 Len=0 MSS=1460 TSV=6019894 TSER=0 WS=6
  2   0.000294     10.0.1.2 -> 10.0.1.3     TCP 9040 > 51772 [SYN, ACK] Seq=0 Ack=1 Win=14480 Len=0 MSS=1460 TSV=6004921 TSER=6019894 WS=6
  3   0.000317     10.0.1.3 -> 10.0.1.2     TCP 51772 > 9040 [ACK] Seq=1 Ack=1 Win=5888 Len=0 TSV=6019894 TSER=6004921
  7   0.002209     10.0.1.2 -> 10.0.1.3     TCP 9040 > 51772 [ACK] Seq=1 Ack=13 Win=14528 Len=0 TSV=6004921 TSER=6019894
348720  63.617399     10.0.1.3 -> 10.0.1.2     TCP 51772 > 9040 [FIN, ACK] Seq=13 Ack=350000002 Win=2034752 Len=0 TSV=6035798 TSER=6020805
348721  63.617650     10.0.1.2 -> 10.0.1.3     TCP 9040 > 51772 [ACK] Seq=350000002 Ack=14 Win=14528 Len=0 TSV=6020826 TSER=6035798
  1   0.000000     10.0.1.3 -> 10.0.1.2     TCP 51774 > 9040 [SYN] Seq=0 Win=5840 Len=0 MSS=1460 TSV=6041800 TSER=0 WS=6
  2   0.000285     10.0.1.2 -> 10.0.1.3     TCP 9040 > 51774 [SYN, ACK] Seq=0 Ack=1 Win=14480 Len=0 MSS=1460 TSV=6026829 TSER=6041800 WS=6
  3   0.000307     10.0.1.3 -> 10.0.1.2     TCP 51774 > 9040 [ACK] Seq=1 Ack=1 Win=5888 Len=0 TSV=6041800 TSER=6026829
  7   0.002636     10.0.1.2 -> 10.0.1.3     TCP 9040 > 51774 [ACK] Seq=1 Ack=13 Win=14528 Len=0 TSV=6026830 TSER=6041801
363147  63.459794     10.0.1.3 -> 10.0.1.2     TCP 51774 > 9040 [FIN, ACK] Seq=13 Ack=350000002 Win=2017408 Len=0 TSV=6057665 TSER=6042674
363148  63.460041     10.0.1.2 -> 10.0.1.3     TCP 9040 > 51774 [ACK] Seq=350000002 Ack=14 Win=14528 Len=0 TSV=6042695 TSER=6057665
  1   0.000000     10.0.1.3 -> 10.0.1.2     TCP 51776 > 9040 [SYN] Seq=0 Win=5840 Len=0 MSS=1460 TSV=6063685 TSER=0 WS=6
  2   0.000316     10.0.1.2 -> 10.0.1.3     TCP 9040 > 51776 [SYN, ACK] Seq=0 Ack=1 Win=14480 Len=0 MSS=1460 TSV=6048716 TSER=6063685 WS=6
  3   0.000340     10.0.1.3 -> 10.0.1.2     TCP 51776 > 9040 [ACK] Seq=1 Ack=1 Win=5888 Len=0 TSV=6063685 TSER=6048716
  7   0.002134     10.0.1.2 -> 10.0.1.3     TCP 9040 > 51776 [ACK] Seq=1 Ack=13 Win=14528 Len=0 TSV=6048716 TSER=6063686
360900  64.067714     10.0.1.3 -> 10.0.1.2     TCP 51776 > 9040 [FIN, ACK] Seq=13 Ack=350000002 Win=2026112 Len=0 TSV=6079702 TSER=6064713
360901  64.067962     10.0.1.2 -> 10.0.1.3     TCP 9040 > 51776 [ACK] Seq=350000002 Ack=14 Win=14528 Len=0 TSV=6064734 TSER=6079702
  1   0.000000     10.0.1.3 -> 10.0.1.2     TCP 59842 > 9040 [SYN] Seq=0 Win=5840 Len=0 MSS=1460 TSV=6085613 TSER=0 WS=6
  2   0.000316     10.0.1.2 -> 10.0.1.3     TCP 9040 > 59842 [SYN, ACK] Seq=0 Ack=1 Win=14480 Len=0 MSS=1460 TSV=6070645 TSER=6085613 WS=6
  3   0.000342     10.0.1.3 -> 10.0.1.2     TCP 59842 > 9040 [ACK] Seq=1 Ack=1 Win=5888 Len=0 TSV=6085613 TSER=6070645
  7   0.002321     10.0.1.2 -> 10.0.1.3     TCP 9040 > 59842 [ACK] Seq=1 Ack=13 Win=14528 Len=0 TSV=6070645 TSER=6085613
363058  64.228690     10.0.1.3 -> 10.0.1.2     TCP 59842 > 9040 [FIN, ACK] Seq=13 Ack=350000002 Win=2023168 Len=0 TSV=6101670 TSER=6086682
363059  64.228944     10.0.1.2 -> 10.0.1.3     TCP 9040 > 59842 [ACK] Seq=350000002 Ack=14 Win=14528 Len=0 TSV=6086703 TSER=6101670
  1   0.000000     10.0.1.3 -> 10.0.1.2     TCP 59844 > 9040 [SYN] Seq=0 Win=5840 Len=0 MSS=1460 TSV=6107926 TSER=0 WS=6
  2   0.000304     10.0.1.2 -> 10.0.1.3     TCP 9040 > 59844 [SYN, ACK] Seq=0 Ack=1 Win=14480 Len=0 MSS=1460 TSV=6092960 TSER=6107926 WS=6
  3   0.000329     10.0.1.3 -> 10.0.1.2     TCP 59844 > 9040 [ACK] Seq=1 Ack=1 Win=5888 Len=0 TSV=6107926 TSER=6092960
  7   0.002175     10.0.1.2 -> 10.0.1.3     TCP 9040 > 59844 [ACK] Seq=1 Ack=13 Win=14528 Len=0 TSV=6092960 TSER=6107926
352549  65.533627     10.0.1.3 -> 10.0.1.2     TCP 59844 > 9040 [FIN, ACK] Seq=13 Ack=350000002 Win=2002944 Len=0 TSV=6124309 TSER=6109323
352550  65.533875     10.0.1.2 -> 10.0.1.3     TCP 9040 > 59844 [ACK] Seq=350000002 Ack=14 Win=14528 Len=0 TSV=6109344 TSER=6124309
  1   0.000000     10.0.1.3 -> 10.0.1.2     TCP 59846 > 9040 [SYN] Seq=0 Win=5840 Len=0 MSS=1460 TSV=6130262 TSER=0 WS=6
  2   0.000305     10.0.1.2 -> 10.0.1.3     TCP 9040 > 59846 [SYN, ACK] Seq=0 Ack=1 Win=14480 Len=0 MSS=1460 TSV=6115298 TSER=6130262 WS=6
  3   0.000330     10.0.1.3 -> 10.0.1.2     TCP 59846 > 9040 [ACK] Seq=1 Ack=1 Win=5888 Len=0 TSV=6130262 TSER=6115298
  7   0.002312     10.0.1.2 -> 10.0.1.3     TCP 9040 > 59846 [ACK] Seq=1 Ack=13 Win=14528 Len=0 TSV=6115298 TSER=6130262
345595  64.386398     10.0.1.3 -> 10.0.1.2     TCP 59846 > 9040 [FIN, ACK] Seq=13 Ack=350000002 Win=2014528 Len=0 TSV=6146359 TSER=6131374
345596  64.386650     10.0.1.2 -> 10.0.1.3     TCP 9040 > 59846 [ACK] Seq=350000002 Ack=14 Win=14528 Len=0 TSV=6131395 TSER=6146359
  1   0.000000     10.0.1.3 -> 10.0.1.2     TCP 47409 > 9040 [SYN] Seq=0 Win=5840 Len=0 MSS=1460 TSV=6152302 TSER=0 WS=6
  2   0.000304     10.0.1.2 -> 10.0.1.3     TCP 9040 > 47409 [SYN, ACK] Seq=0 Ack=1 Win=14480 Len=0 MSS=1460 TSV=6137339 TSER=6152302 WS=6
  3   0.000326     10.0.1.3 -> 10.0.1.2     TCP 47409 > 9040 [ACK] Seq=1 Ack=1 Win=5888 Len=0 TSV=6152302 TSER=6137339
  7   0.002253     10.0.1.2 -> 10.0.1.3     TCP 9040 > 47409 [ACK] Seq=1 Ack=13 Win=14528 Len=0 TSV=6137339 TSER=6152302
363158  63.805024     10.0.1.3 -> 10.0.1.2     TCP 47409 > 9040 [FIN, ACK] Seq=13 Ack=350000002 Win=2026112 Len=0 TSV=6168253 TSER=6153270
363159  63.805278     10.0.1.2 -> 10.0.1.3     TCP 9040 > 47409 [ACK] Seq=350000002 Ack=14 Win=14528 Len=0 TSV=6153291 TSER=6168253
  1   0.000000     10.0.1.3 -> 10.0.1.2     TCP 47411 > 9040 [SYN] Seq=0 Win=5840 Len=0 MSS=1460 TSV=6174715 TSER=0 WS=6
  2   0.000293     10.0.1.2 -> 10.0.1.3     TCP 9040 > 47411 [SYN, ACK] Seq=0 Ack=1 Win=14480 Len=0 MSS=1460 TSV=6159754 TSER=6174715 WS=6
  3   0.000318     10.0.1.3 -> 10.0.1.2     TCP 47411 > 9040 [ACK] Seq=1 Ack=1 Win=5888 Len=0 TSV=6174715 TSER=6159754
  7   0.002186     10.0.1.2 -> 10.0.1.3     TCP 9040 > 47411 [ACK] Seq=1 Ack=13 Win=14528 Len=0 TSV=6159754 TSER=6174715
360471  63.818034     10.0.1.3 -> 10.0.1.2     TCP 47411 > 9040 [FIN, ACK] Seq=13 Ack=350000002 Win=2014528 Len=0 TSV=6190669 TSER=6175688
360472  63.818277     10.0.1.2 -> 10.0.1.3     TCP 9040 > 47411 [ACK] Seq=350000002 Ack=14 Win=14528 Len=0 TSV=6175709 TSER=6190669
  1   0.000000     10.0.1.3 -> 10.0.1.2     TCP 47413 > 9040 [SYN] Seq=0 Win=5840 Len=0 MSS=1460 TSV=6196824 TSER=0 WS=6
  2   0.000295     10.0.1.2 -> 10.0.1.3     TCP 9040 > 47413 [SYN, ACK] Seq=0 Ack=1 Win=14480 Len=0 MSS=1460 TSV=6181864 TSER=6196824 WS=6
  3   0.000320     10.0.1.3 -> 10.0.1.2     TCP 47413 > 9040 [ACK] Seq=1 Ack=1 Win=5888 Len=0 TSV=6196824 TSER=6181864
  7   0.002264     10.0.1.2 -> 10.0.1.3     TCP 9040 > 47413 [ACK] Seq=1 Ack=13 Win=14528 Len=0 TSV=6181865 TSER=6196824
363220  64.061009     10.0.1.3 -> 10.0.1.2     TCP 47413 > 9040 [FIN, ACK] Seq=13 Ack=350000002 Win=2026112 Len=0 TSV=6212839 TSER=6197860
363221  64.061256     10.0.1.2 -> 10.0.1.3     TCP 9040 > 47413 [ACK] Seq=350000002 Ack=14 Win=14528 Len=0 TSV=6197881 TSER=6212839
  1   0.000000     10.0.1.3 -> 10.0.1.2     TCP 47415 > 9040 [SYN] Seq=0 Win=5840 Len=0 MSS=1460 TSV=6218898 TSER=0 WS=6
  2   0.000301     10.0.1.2 -> 10.0.1.3     TCP 9040 > 47415 [SYN, ACK] Seq=0 Ack=1 Win=14480 Len=0 MSS=1460 TSV=6203941 TSER=6218898 WS=6
  3   0.000324     10.0.1.3 -> 10.0.1.2     TCP 47415 > 9040 [ACK] Seq=1 Ack=1 Win=5888 Len=0 TSV=6218899 TSER=6203941
  7   0.002175     10.0.1.2 -> 10.0.1.3     TCP 9040 > 47415 [ACK] Seq=1 Ack=13 Win=14528 Len=0 TSV=6203941 TSER=6218899
362748  63.034370     10.0.1.3 -> 10.0.1.2     TCP 47415 > 9040 [FIN, ACK] Seq=13 Ack=350000002 Win=2020288 Len=0 TSV=6234657 TSER=6219679
362749  63.034617     10.0.1.2 -> 10.0.1.3     TCP 9040 > 47415 [ACK] Seq=350000002 Ack=14 Win=14528 Len=0 TSV=6219700 TSER=6234657
  1   0.000000     10.0.1.3 -> 10.0.1.2     TCP 49277 > 9040 [SYN] Seq=0 Win=5840 Len=0 MSS=1460 TSV=6240856 TSER=0 WS=6
  2   0.000336     10.0.1.2 -> 10.0.1.3     TCP 9040 > 49277 [SYN, ACK] Seq=0 Ack=1 Win=14480 Len=0 MSS=1460 TSV=6225900 TSER=6240856 WS=6
  3   0.000360     10.0.1.3 -> 10.0.1.2     TCP 49277 > 9040 [ACK] Seq=1 Ack=1 Win=5888 Len=0 TSV=6240856 TSER=6225900
  7   0.002366     10.0.1.2 -> 10.0.1.3     TCP 9040 > 49277 [ACK] Seq=1 Ack=13 Win=14528 Len=0 TSV=6225900 TSER=6240856
363151  64.060701     10.0.1.3 -> 10.0.1.2     TCP 49277 > 9040 [FIN, ACK] Seq=13 Ack=350000002 Win=2026112 Len=0 TSV=6256871 TSER=6241895
363152  64.060948     10.0.1.2 -> 10.0.1.3     TCP 9040 > 49277 [ACK] Seq=350000002 Ack=14 Win=14528 Len=0 TSV=6241916 TSER=6256871
  1   0.000000     10.0.1.3 -> 10.0.1.2     TCP 49279 > 9040 [SYN] Seq=0 Win=5840 Len=0 MSS=1460 TSV=6263015 TSER=0 WS=6
  2   0.000288     10.0.1.2 -> 10.0.1.3     TCP 9040 > 49279 [SYN, ACK] Seq=0 Ack=1 Win=14480 Len=0 MSS=1460 TSV=6248060 TSER=6263015 WS=6
  3   0.000310     10.0.1.3 -> 10.0.1.2     TCP 49279 > 9040 [ACK] Seq=1 Ack=1 Win=5888 Len=0 TSV=6263015 TSER=6248060
  7   0.002270     10.0.1.2 -> 10.0.1.3     TCP 9040 > 49279 [ACK] Seq=1 Ack=13 Win=14528 Len=0 TSV=6248060 TSER=6263015
362997  63.451778     10.0.1.3 -> 10.0.1.2     TCP 49279 > 9040 [FIN, ACK] Seq=13 Ack=350000002 Win=2017408 Len=0 TSV=6278878 TSER=6263903
362998  63.452013     10.0.1.2 -> 10.0.1.3     TCP 9040 > 49279 [ACK] Seq=350000002 Ack=14 Win=14528 Len=0 TSV=6263924 TSER=6278878
  1   0.000000     10.0.1.3 -> 10.0.1.2     TCP 49282 > 9040 [SYN] Seq=0 Win=5840 Len=0 MSS=1460 TSV=6284935 TSER=0 WS=6
  2   0.000302     10.0.1.2 -> 10.0.1.3     TCP 9040 > 49282 [SYN, ACK] Seq=0 Ack=1 Win=14480 Len=0 MSS=1460 TSV=6269982 TSER=6284935 WS=6
  3   0.000324     10.0.1.3 -> 10.0.1.2     TCP 49282 > 9040 [ACK] Seq=1 Ack=1 Win=5888 Len=0 TSV=6284935 TSER=6269982
  7   0.002169     10.0.1.2 -> 10.0.1.3     TCP 9040 > 49282 [ACK] Seq=1 Ack=13 Win=14528 Len=0 TSV=6269982 TSER=6284935
363043  63.693724     10.0.1.3 -> 10.0.1.2     TCP 49282 > 9040 [FIN, ACK] Seq=13 Ack=350000002 Win=2023168 Len=0 TSV=6300858 TSER=6285885
363044  63.693982     10.0.1.2 -> 10.0.1.3     TCP 9040 > 49282 [ACK] Seq=350000002 Ack=14 Win=14528 Len=0 TSV=6285907 TSER=6300858
  1   0.000000     10.0.1.3 -> 10.0.1.2     TCP 53746 > 9040 [SYN] Seq=0 Win=5840 Len=0 MSS=1460 TSV=6307006 TSER=0 WS=6
  2   0.000318     10.0.1.2 -> 10.0.1.3     TCP 9040 > 53746 [SYN, ACK] Seq=0 Ack=1 Win=14480 Len=0 MSS=1460 TSV=6292055 TSER=6307006 WS=6
  3   0.000345     10.0.1.3 -> 10.0.1.2     TCP 53746 > 9040 [ACK] Seq=1 Ack=1 Win=5888 Len=0 TSV=6307006 TSER=6292055
  7   0.002305     10.0.1.2 -> 10.0.1.3     TCP 9040 > 53746 [ACK] Seq=1 Ack=13 Win=14528 Len=0 TSV=6292056 TSER=6307007
351969  63.502681     10.0.1.3 -> 10.0.1.2     TCP 53746 > 9040 [FIN, ACK] Seq=13 Ack=350000002 Win=2017408 Len=0 TSV=6322882 TSER=6307910
351970  63.502930     10.0.1.2 -> 10.0.1.3     TCP 9040 > 53746 [ACK] Seq=350000002 Ack=14 Win=14528 Len=0 TSV=6307932 TSER=6322882
  1   0.000000     10.0.1.3 -> 10.0.1.2     TCP 53748 > 9040 [SYN] Seq=0 Win=5840 Len=0 MSS=1460 TSV=6328864 TSER=0 WS=6
  2   0.000316     10.0.1.2 -> 10.0.1.3     TCP 9040 > 53748 [SYN, ACK] Seq=0 Ack=1 Win=14480 Len=0 MSS=1460 TSV=6313914 TSER=6328864 WS=6
  3   0.000341     10.0.1.3 -> 10.0.1.2     TCP 53748 > 9040 [ACK] Seq=1 Ack=1 Win=5888 Len=0 TSV=6328864 TSER=6313914
  7   0.002219     10.0.1.2 -> 10.0.1.3     TCP 9040 > 53748 [ACK] Seq=1 Ack=13 Win=14528 Len=0 TSV=6313915 TSER=6328864
339890  63.624834     10.0.1.3 -> 10.0.1.2     TCP 53748 > 9040 [FIN, ACK] Seq=13 Ack=350000002 Win=2023168 Len=0 TSV=6344770 TSER=6329800
339891  63.625046     10.0.1.2 -> 10.0.1.3     TCP 9040 > 53748 [ACK] Seq=350000002 Ack=14 Win=14528 Len=0 TSV=6329822 TSER=6344770
