  1   0.000000     10.0.1.3 -> 10.0.1.2     TCP 52356 > 9040 [SYN] Seq=0 Win=5840 Len=0 MSS=1460 TSV=525120 TSER=0 WS=6
  2   0.000305     10.0.1.2 -> 10.0.1.3     TCP 9040 > 52356 [SYN, ACK] Seq=0 Ack=1 Win=14480 Len=0 MSS=1460 TSV=932742 TSER=525120 WS=6
  3   0.000327     10.0.1.3 -> 10.0.1.2     TCP 52356 > 9040 [ACK] Seq=1 Ack=1 Win=5888 Len=0 TSV=525121 TSER=932742
  7   0.002201     10.0.1.2 -> 10.0.1.3     TCP 9040 > 52356 [ACK] Seq=1 Ack=13 Win=14528 Len=0 TSV=932743 TSER=525121
286920  25.570097     10.0.1.3 -> 10.0.1.2     TCP 52356 > 9040 [FIN, ACK] Seq=13 Ack=300000002 Win=2580480 Len=0 TSV=531513 TSER=939080
286921  25.570349     10.0.1.2 -> 10.0.1.3     TCP 9040 > 52356 [ACK] Seq=300000002 Ack=14 Win=14528 Len=0 TSV=939135 TSER=531513
  1   0.000000     10.0.1.3 -> 10.0.1.2     TCP 54845 > 9040 [SYN] Seq=0 Win=5840 Len=0 MSS=1460 TSV=536734 TSER=0 WS=6
  2   0.000283     10.0.1.2 -> 10.0.1.3     TCP 9040 > 54845 [SYN, ACK] Seq=0 Ack=1 Win=14480 Len=0 MSS=1460 TSV=944356 TSER=536734 WS=6
  3   0.000305     10.0.1.3 -> 10.0.1.2     TCP 54845 > 9040 [ACK] Seq=1 Ack=1 Win=5888 Len=0 TSV=536734 TSER=944356
  7   0.002313     10.0.1.2 -> 10.0.1.3     TCP 9040 > 54845 [ACK] Seq=1 Ack=13 Win=14528 Len=0 TSV=944357 TSER=536734
287558  25.567572     10.0.1.3 -> 10.0.1.2     TCP 54845 > 9040 [FIN, ACK] Seq=13 Ack=300000002 Win=2580480 Len=0 TSV=543126 TSER=950694
287559  25.567824     10.0.1.2 -> 10.0.1.3     TCP 9040 > 54845 [ACK] Seq=300000002 Ack=14 Win=14528 Len=0 TSV=950749 TSER=543126
  1   0.000000     10.0.1.3 -> 10.0.1.2     TCP 54847 > 9040 [SYN] Seq=0 Win=5840 Len=0 MSS=1460 TSV=548348 TSER=0 WS=6
  2   0.000318     10.0.1.2 -> 10.0.1.3     TCP 9040 > 54847 [SYN, ACK] Seq=0 Ack=1 Win=14480 Len=0 MSS=1460 TSV=955971 TSER=548348 WS=6
  3   0.000341     10.0.1.3 -> 10.0.1.2     TCP 54847 > 9040 [ACK] Seq=1 Ack=1 Win=5888 Len=0 TSV=548348 TSER=955971
  7   0.002335     10.0.1.2 -> 10.0.1.3     TCP 9040 > 54847 [ACK] Seq=1 Ack=13 Win=14528 Len=0 TSV=955972 TSER=548349
257632  25.567024     10.0.1.3 -> 10.0.1.2     TCP 54847 > 9040 [FIN, ACK] Seq=13 Ack=300000002 Win=2580480 Len=0 TSV=554740 TSER=962308
257633  25.567273     10.0.1.2 -> 10.0.1.3     TCP 9040 > 54847 [ACK] Seq=300000002 Ack=14 Win=14528 Len=0 TSV=962363 TSER=554740
  1   0.000000     10.0.1.3 -> 10.0.1.2     TCP 54849 > 9040 [SYN] Seq=0 Win=5840 Len=0 MSS=1460 TSV=559618 TSER=0 WS=6
  2   0.000443     10.0.1.2 -> 10.0.1.3     TCP 9040 > 54849 [SYN, ACK] Seq=0 Ack=1 Win=14480 Len=0 MSS=1460 TSV=967242 TSER=559618 WS=6
  3   0.000466     10.0.1.3 -> 10.0.1.2     TCP 54849 > 9040 [ACK] Seq=1 Ack=1 Win=5888 Len=0 TSV=559618 TSER=967242
  7   0.002227     10.0.1.2 -> 10.0.1.3     TCP 9040 > 54849 [ACK] Seq=1 Ack=13 Win=14528 Len=0 TSV=967242 TSER=559618
305588  25.565697     10.0.1.3 -> 10.0.1.2     TCP 54849 > 9040 [FIN, ACK] Seq=13 Ack=300000002 Win=2580480 Len=0 TSV=566009 TSER=973579
305589  25.565942     10.0.1.2 -> 10.0.1.3     TCP 9040 > 54849 [ACK] Seq=300000002 Ack=14 Win=14528 Len=0 TSV=973634 TSER=566009
  1   0.000000     10.0.1.3 -> 10.0.1.2     TCP 54852 > 9040 [SYN] Seq=0 Win=5840 Len=0 MSS=1460 TSV=570999 TSER=0 WS=6
  2   0.000297     10.0.1.2 -> 10.0.1.3     TCP 9040 > 54852 [SYN, ACK] Seq=0 Ack=1 Win=14480 Len=0 MSS=1460 TSV=978624 TSER=570999 WS=6
  3   0.000317     10.0.1.3 -> 10.0.1.2     TCP 54852 > 9040 [ACK] Seq=1 Ack=1 Win=5888 Len=0 TSV=570999 TSER=978624
  7   0.003056     10.0.1.2 -> 10.0.1.3     TCP 9040 > 54852 [ACK] Seq=1 Ack=13 Win=14528 Len=0 TSV=978624 TSER=571000
269959  25.566194     10.0.1.3 -> 10.0.1.2     TCP 54852 > 9040 [FIN, ACK] Seq=13 Ack=300000002 Win=2580480 Len=0 TSV=577391 TSER=984961
269960  25.566430     10.0.1.2 -> 10.0.1.3     TCP 9040 > 54852 [ACK] Seq=300000002 Ack=14 Win=14528 Len=0 TSV=985016 TSER=577391
  1   0.000000     10.0.1.3 -> 10.0.1.2     TCP 54861 > 9040 [SYN] Seq=0 Win=5840 Len=0 MSS=1460 TSV=582649 TSER=0 WS=6
  2   0.000355     10.0.1.2 -> 10.0.1.3     TCP 9040 > 54861 [SYN, ACK] Seq=0 Ack=1 Win=14480 Len=0 MSS=1460 TSV=990275 TSER=582649 WS=6
  3   0.000377     10.0.1.3 -> 10.0.1.2     TCP 54861 > 9040 [ACK] Seq=1 Ack=1 Win=5888 Len=0 TSV=582649 TSER=990275
  7   0.002202     10.0.1.2 -> 10.0.1.3     TCP 9040 > 54861 [ACK] Seq=1 Ack=13 Win=14528 Len=0 TSV=990275 TSER=582649
262276  25.564516     10.0.1.3 -> 10.0.1.2     TCP 54861 > 9040 [FIN, ACK] Seq=13 Ack=300000002 Win=2580480 Len=0 TSV=589040 TSER=996611
262277  25.564762     10.0.1.2 -> 10.0.1.3     TCP 9040 > 54861 [ACK] Seq=300000002 Ack=14 Win=14528 Len=0 TSV=996666 TSER=589040
  1   0.000000     10.0.1.3 -> 10.0.1.2     TCP 54863 > 9040 [SYN] Seq=0 Win=5840 Len=0 MSS=1460 TSV=593926 TSER=0 WS=6
  2   0.000278     10.0.1.2 -> 10.0.1.3     TCP 9040 > 54863 [SYN, ACK] Seq=0 Ack=1 Win=14480 Len=0 MSS=1460 TSV=1001553 TSER=593926 WS=6
  3   0.000300     10.0.1.3 -> 10.0.1.2     TCP 54863 > 9040 [ACK] Seq=1 Ack=1 Win=5888 Len=0 TSV=593927 TSER=1001553
  7   0.002230     10.0.1.2 -> 10.0.1.3     TCP 9040 > 54863 [ACK] Seq=1 Ack=13 Win=14528 Len=0 TSV=1001554 TSER=593927
275171  26.824878     10.0.1.3 -> 10.0.1.2     TCP 54863 > 9040 [FIN, ACK] Seq=13 Ack=300000002 Win=2580480 Len=0 TSV=600633 TSER=1008205
275172  26.825244     10.0.1.2 -> 10.0.1.3     TCP 9040 > 54863 [ACK] Seq=300000002 Ack=14 Win=14528 Len=0 TSV=1008260 TSER=600633
  1   0.000000     10.0.1.3 -> 10.0.1.2     TCP 60666 > 9040 [SYN] Seq=0 Win=5840 Len=0 MSS=1460 TSV=605816 TSER=0 WS=6
  2   0.000269     10.0.1.2 -> 10.0.1.3     TCP 9040 > 60666 [SYN, ACK] Seq=0 Ack=1 Win=14480 Len=0 MSS=1460 TSV=1013443 TSER=605816 WS=6
  3   0.000288     10.0.1.3 -> 10.0.1.2     TCP 60666 > 9040 [ACK] Seq=1 Ack=1 Win=5888 Len=0 TSV=605816 TSER=1013443
  7   0.002362     10.0.1.2 -> 10.0.1.3     TCP 9040 > 60666 [ACK] Seq=1 Ack=13 Win=14528 Len=0 TSV=1013444 TSER=605816
268594  25.633059     10.0.1.3 -> 10.0.1.2     TCP 60666 > 9040 [FIN, ACK] Seq=13 Ack=300000002 Win=2580480 Len=0 TSV=612224 TSER=1019797
268595  25.633313     10.0.1.2 -> 10.0.1.3     TCP 9040 > 60666 [ACK] Seq=300000002 Ack=14 Win=14528 Len=0 TSV=1019852 TSER=612224
  1   0.000000     10.0.1.3 -> 10.0.1.2     TCP 60668 > 9040 [SYN] Seq=0 Win=5840 Len=0 MSS=1460 TSV=617251 TSER=0 WS=6
  2   0.000281     10.0.1.2 -> 10.0.1.3     TCP 9040 > 60668 [SYN, ACK] Seq=0 Ack=1 Win=14480 Len=0 MSS=1460 TSV=1024879 TSER=617251 WS=6
  3   0.000303     10.0.1.3 -> 10.0.1.2     TCP 60668 > 9040 [ACK] Seq=1 Ack=1 Win=5888 Len=0 TSV=617251 TSER=1024879
  7   0.002250     10.0.1.2 -> 10.0.1.3     TCP 9040 > 60668 [ACK] Seq=1 Ack=13 Win=14528 Len=0 TSV=1024880 TSER=617251
278447  25.566904     10.0.1.3 -> 10.0.1.2     TCP 60668 > 9040 [FIN, ACK] Seq=13 Ack=300000002 Win=2580480 Len=0 TSV=623643 TSER=1031216
278448  25.567151     10.0.1.2 -> 10.0.1.3     TCP 9040 > 60668 [ACK] Seq=300000002 Ack=14 Win=14528 Len=0 TSV=1031271 TSER=623643
  1   0.000000     10.0.1.3 -> 10.0.1.2     TCP 60670 > 9040 [SYN] Seq=0 Win=5840 Len=0 MSS=1460 TSV=628641 TSER=0 WS=6
  2   0.000366     10.0.1.2 -> 10.0.1.3     TCP 9040 > 60670 [SYN, ACK] Seq=0 Ack=1 Win=14480 Len=0 MSS=1460 TSV=1036271 TSER=628641 WS=6
  3   0.000390     10.0.1.3 -> 10.0.1.2     TCP 60670 > 9040 [ACK] Seq=1 Ack=1 Win=5888 Len=0 TSV=628642 TSER=1036271
  7   0.002269     10.0.1.2 -> 10.0.1.3     TCP 9040 > 60670 [ACK] Seq=1 Ack=13 Win=14528 Len=0 TSV=1036271 TSER=628642
302181  25.563992     10.0.1.3 -> 10.0.1.2     TCP 60670 > 9040 [FIN, ACK] Seq=13 Ack=300000002 Win=2580480 Len=0 TSV=635032 TSER=1042607
302182  25.564226     10.0.1.2 -> 10.0.1.3     TCP 9040 > 60670 [ACK] Seq=300000002 Ack=14 Win=14528 Len=0 TSV=1042662 TSER=635032
  1   0.000000     10.0.1.3 -> 10.0.1.2     TCP 60672 > 9040 [SYN] Seq=0 Win=5840 Len=0 MSS=1460 TSV=640449 TSER=0 WS=6
  2   0.000292     10.0.1.2 -> 10.0.1.3     TCP 9040 > 60672 [SYN, ACK] Seq=0 Ack=1 Win=14480 Len=0 MSS=1460 TSV=1048079 TSER=640449 WS=6
  3   0.000315     10.0.1.3 -> 10.0.1.2     TCP 60672 > 9040 [ACK] Seq=1 Ack=1 Win=5888 Len=0 TSV=640449 TSER=1048079
  7   0.002352     10.0.1.2 -> 10.0.1.3     TCP 9040 > 60672 [ACK] Seq=1 Ack=13 Win=14528 Len=0 TSV=1048080 TSER=640450
300762  25.584942     10.0.1.3 -> 10.0.1.2     TCP 60672 > 9040 [FIN, ACK] Seq=13 Ack=300000002 Win=2580480 Len=0 TSV=646845 TSER=1054421
300763  25.585198     10.0.1.2 -> 10.0.1.3     TCP 9040 > 60672 [ACK] Seq=300000002 Ack=14 Win=14528 Len=0 TSV=1054476 TSER=646845
  1   0.000000     10.0.1.3 -> 10.0.1.2     TCP 60674 > 9040 [SYN] Seq=0 Win=5840 Len=0 MSS=1460 TSV=651976 TSER=0 WS=6
  2   0.000371     10.0.1.2 -> 10.0.1.3     TCP 9040 > 60674 [SYN, ACK] Seq=0 Ack=1 Win=14480 Len=0 MSS=1460 TSV=1059607 TSER=651976 WS=6
  3   0.000394     10.0.1.3 -> 10.0.1.2     TCP 60674 > 9040 [ACK] Seq=1 Ack=1 Win=5888 Len=0 TSV=651976 TSER=1059607
  7   0.002421     10.0.1.2 -> 10.0.1.3     TCP 9040 > 60674 [ACK] Seq=1 Ack=13 Win=14528 Len=0 TSV=1059607 TSER=651976
301748  25.566625     10.0.1.3 -> 10.0.1.2     TCP 60674 > 9040 [FIN, ACK] Seq=13 Ack=300000002 Win=2580480 Len=0 TSV=658367 TSER=1065944
301749  25.566875     10.0.1.2 -> 10.0.1.3     TCP 9040 > 60674 [ACK] Seq=300000002 Ack=14 Win=14528 Len=0 TSV=1065999 TSER=658367
  1   0.000000     10.0.1.3 -> 10.0.1.2     TCP 60677 > 9040 [SYN] Seq=0 Win=5840 Len=0 MSS=1460 TSV=663808 TSER=0 WS=6
  2   0.000424     10.0.1.2 -> 10.0.1.3     TCP 9040 > 60677 [SYN, ACK] Seq=0 Ack=1 Win=14480 Len=0 MSS=1460 TSV=1071440 TSER=663808 WS=6
  3   0.000448     10.0.1.3 -> 10.0.1.2     TCP 60677 > 9040 [ACK] Seq=1 Ack=1 Win=5888 Len=0 TSV=663808 TSER=1071440
  7   0.002397     10.0.1.2 -> 10.0.1.3     TCP 9040 > 60677 [ACK] Seq=1 Ack=13 Win=14528 Len=0 TSV=1071440 TSER=663808
266428  25.565678     10.0.1.3 -> 10.0.1.2     TCP 60677 > 9040 [FIN, ACK] Seq=13 Ack=300000002 Win=2580480 Len=0 TSV=670199 TSER=1077776
266429  25.565927     10.0.1.2 -> 10.0.1.3     TCP 9040 > 60677 [ACK] Seq=300000002 Ack=14 Win=14528 Len=0 TSV=1077831 TSER=670199
  1   0.000000     10.0.1.3 -> 10.0.1.2     TCP 60679 > 9040 [SYN] Seq=0 Win=5840 Len=0 MSS=1460 TSV=675202 TSER=0 WS=6
  2   0.000306     10.0.1.2 -> 10.0.1.3     TCP 9040 > 60679 [SYN, ACK] Seq=0 Ack=1 Win=14480 Len=0 MSS=1460 TSV=1082835 TSER=675202 WS=6
  3   0.000331     10.0.1.3 -> 10.0.1.2     TCP 60679 > 9040 [ACK] Seq=1 Ack=1 Win=5888 Len=0 TSV=675202 TSER=1082835
  7   0.002162     10.0.1.2 -> 10.0.1.3     TCP 9040 > 60679 [ACK] Seq=1 Ack=13 Win=14528 Len=0 TSV=1082835 TSER=675202
287735  26.766720     10.0.1.3 -> 10.0.1.2     TCP 60679 > 9040 [FIN, ACK] Seq=13 Ack=300000002 Win=2557184 Len=0 TSV=681894 TSER=1089472
287736  26.766968     10.0.1.2 -> 10.0.1.3     TCP 9040 > 60679 [ACK] Seq=300000002 Ack=14 Win=14528 Len=0 TSV=1089527 TSER=681894
  1   0.000000     10.0.1.3 -> 10.0.1.2     TCP 60964 > 9040 [SYN] Seq=0 Win=5840 Len=0 MSS=1460 TSV=687157 TSER=0 WS=6
  2   0.000364     10.0.1.2 -> 10.0.1.3     TCP 9040 > 60964 [SYN, ACK] Seq=0 Ack=1 Win=14480 Len=0 MSS=1460 TSV=1094791 TSER=687157 WS=6
  3   0.000387     10.0.1.3 -> 10.0.1.2     TCP 60964 > 9040 [ACK] Seq=1 Ack=1 Win=5888 Len=0 TSV=687157 TSER=1094791
  7   0.002270     10.0.1.2 -> 10.0.1.3     TCP 9040 > 60964 [ACK] Seq=1 Ack=13 Win=14528 Len=0 TSV=1094791 TSER=687158
299525  25.564346     10.0.1.3 -> 10.0.1.2     TCP 60964 > 9040 [FIN, ACK] Seq=13 Ack=300000002 Win=2580480 Len=0 TSV=693548 TSER=1101127
299526  25.564613     10.0.1.2 -> 10.0.1.3     TCP 9040 > 60964 [ACK] Seq=300000002 Ack=14 Win=14528 Len=0 TSV=1101182 TSER=693548
  1   0.000000     10.0.1.3 -> 10.0.1.2     TCP 60966 > 9040 [SYN] Seq=0 Win=5840 Len=0 MSS=1460 TSV=698938 TSER=0 WS=6
  2   0.000293     10.0.1.2 -> 10.0.1.3     TCP 9040 > 60966 [SYN, ACK] Seq=0 Ack=1 Win=14480 Len=0 MSS=1460 TSV=1106572 TSER=698938 WS=6
  3   0.000317     10.0.1.3 -> 10.0.1.2     TCP 60966 > 9040 [ACK] Seq=1 Ack=1 Win=5888 Len=0 TSV=698938 TSER=1106572
  7   0.002320     10.0.1.2 -> 10.0.1.3     TCP 9040 > 60966 [ACK] Seq=1 Ack=13 Win=14528 Len=0 TSV=1106573 TSER=698939
279135  26.327035     10.0.1.3 -> 10.0.1.2     TCP 60966 > 9040 [FIN, ACK] Seq=13 Ack=300000002 Win=2580480 Len=0 TSV=705520 TSER=1113100
279136  26.327285     10.0.1.2 -> 10.0.1.3     TCP 9040 > 60966 [ACK] Seq=300000002 Ack=14 Win=14528 Len=0 TSV=1113155 TSER=705520
  1   0.000000     10.0.1.3 -> 10.0.1.2     TCP 60969 > 9040 [SYN] Seq=0 Win=5840 Len=0 MSS=1460 TSV=710674 TSER=0 WS=6
  2   0.000269     10.0.1.2 -> 10.0.1.3     TCP 9040 > 60969 [SYN, ACK] Seq=0 Ack=1 Win=14480 Len=0 MSS=1460 TSV=1118310 TSER=710674 WS=6
  3   0.000293     10.0.1.3 -> 10.0.1.2     TCP 60969 > 9040 [ACK] Seq=1 Ack=1 Win=5888 Len=0 TSV=710674 TSER=1118310
  7   0.002250     10.0.1.2 -> 10.0.1.3     TCP 9040 > 60969 [ACK] Seq=1 Ack=13 Win=14528 Len=0 TSV=1118310 TSER=710675
292221  25.568414     10.0.1.3 -> 10.0.1.2     TCP 60969 > 9040 [FIN, ACK] Seq=13 Ack=300000002 Win=2580480 Len=0 TSV=717066 TSER=1124647
292222  25.568662     10.0.1.2 -> 10.0.1.3     TCP 9040 > 60969 [ACK] Seq=300000002 Ack=14 Win=14528 Len=0 TSV=1124702 TSER=717066
  1   0.000000     10.0.1.3 -> 10.0.1.2     TCP 60971 > 9040 [SYN] Seq=0 Win=5840 Len=0 MSS=1460 TSV=722396 TSER=0 WS=6
  2   0.000307     10.0.1.2 -> 10.0.1.3     TCP 9040 > 60971 [SYN, ACK] Seq=0 Ack=1 Win=14480 Len=0 MSS=1460 TSV=1130033 TSER=722396 WS=6
  3   0.000330     10.0.1.3 -> 10.0.1.2     TCP 60971 > 9040 [ACK] Seq=1 Ack=1 Win=5888 Len=0 TSV=722396 TSER=1130033
  7   0.002933     10.0.1.2 -> 10.0.1.3     TCP 9040 > 60971 [ACK] Seq=1 Ack=13 Win=14528 Len=0 TSV=1130033 TSER=722397
304352  25.577842     10.0.1.3 -> 10.0.1.2     TCP 60971 > 9040 [FIN, ACK] Seq=13 Ack=300000002 Win=2580480 Len=0 TSV=728791 TSER=1136373
304353  25.578097     10.0.1.2 -> 10.0.1.3     TCP 9040 > 60971 [ACK] Seq=300000002 Ack=14 Win=14528 Len=0 TSV=1136428 TSER=728791
  1   0.000000     10.0.1.3 -> 10.0.1.2     TCP 60973 > 9040 [SYN] Seq=0 Win=5840 Len=0 MSS=1460 TSV=734095 TSER=0 WS=6
  2   0.000282     10.0.1.2 -> 10.0.1.3     TCP 9040 > 60973 [SYN, ACK] Seq=0 Ack=1 Win=14480 Len=0 MSS=1460 TSV=1141732 TSER=734095 WS=6
  3   0.000306     10.0.1.3 -> 10.0.1.2     TCP 60973 > 9040 [ACK] Seq=1 Ack=1 Win=5888 Len=0 TSV=734095 TSER=1141732
  7   0.002290     10.0.1.2 -> 10.0.1.3     TCP 9040 > 60973 [ACK] Seq=1 Ack=13 Win=14528 Len=0 TSV=1141733 TSER=734095
290652  25.565511     10.0.1.3 -> 10.0.1.2     TCP 60973 > 9040 [FIN, ACK] Seq=13 Ack=300000002 Win=2580480 Len=0 TSV=740486 TSER=1148069
290653  25.565762     10.0.1.2 -> 10.0.1.3     TCP 9040 > 60973 [ACK] Seq=300000002 Ack=14 Win=14528 Len=0 TSV=1148124 TSER=740486
  1   0.000000     10.0.1.3 -> 10.0.1.2     TCP 60975 > 9040 [SYN] Seq=0 Win=5840 Len=0 MSS=1460 TSV=745708 TSER=0 WS=6
  2   0.000300     10.0.1.2 -> 10.0.1.3     TCP 9040 > 60975 [SYN, ACK] Seq=0 Ack=1 Win=14480 Len=0 MSS=1460 TSV=1153346 TSER=745708 WS=6
  3   0.000323     10.0.1.3 -> 10.0.1.2     TCP 60975 > 9040 [ACK] Seq=1 Ack=1 Win=5888 Len=0 TSV=745708 TSER=1153346
  7   0.002260     10.0.1.2 -> 10.0.1.3     TCP 9040 > 60975 [ACK] Seq=1 Ack=13 Win=14528 Len=0 TSV=1153346 TSER=745708
271455  25.570743     10.0.1.3 -> 10.0.1.2     TCP 60975 > 9040 [FIN, ACK] Seq=13 Ack=300000002 Win=2580480 Len=0 TSV=752100 TSER=1159684
271456  25.570996     10.0.1.2 -> 10.0.1.3     TCP 9040 > 60975 [ACK] Seq=300000002 Ack=14 Win=14528 Len=0 TSV=1159739 TSER=752100
