  1   0.000000     10.0.1.3 -> 10.0.1.2     TCP 56920 > 9040 [SYN] Seq=0 Win=5840 Len=0 MSS=1460 TSV=2922710 TSER=0 WS=6
  2   0.000369     10.0.1.2 -> 10.0.1.3     TCP 9040 > 56920 [SYN, ACK] Seq=0 Ack=1 Win=14480 Len=0 MSS=1460 TSV=2907699 TSER=2922710 WS=6
  3   0.000393     10.0.1.3 -> 10.0.1.2     TCP 56920 > 9040 [ACK] Seq=1 Ack=1 Win=5888 Len=0 TSV=2922710 TSER=2907699
  7   0.002400     10.0.1.2 -> 10.0.1.3     TCP 9040 > 56920 [ACK] Seq=1 Ack=13 Win=14528 Len=0 TSV=2907700 TSER=2922710
311105  54.195886     10.0.1.3 -> 10.0.1.2     TCP 56920 > 9040 [FIN, ACK] Seq=13 Ack=300000002 Win=2020288 Len=0 TSV=2936258 TSER=2921228
  1   0.000000     10.0.1.3 -> 10.0.1.2     TCP 55547 > 9040 [SYN] Seq=0 Win=5840 Len=0 MSS=1460 TSV=2941831 TSER=0 WS=6
  2   0.000291     10.0.1.2 -> 10.0.1.3     TCP 9040 > 55547 [SYN, ACK] Seq=0 Ack=1 Win=14480 Len=0 MSS=1460 TSV=2926822 TSER=2941831 WS=6
  3   0.000315     10.0.1.3 -> 10.0.1.2     TCP 55547 > 9040 [ACK] Seq=1 Ack=1 Win=5888 Len=0 TSV=2941831 TSER=2926822
  7   0.002358     10.0.1.2 -> 10.0.1.3     TCP 9040 > 55547 [ACK] Seq=1 Ack=13 Win=14528 Len=0 TSV=2926823 TSER=2941831
311033  54.641410     10.0.1.3 -> 10.0.1.2     TCP 55547 > 9040 [FIN, ACK] Seq=13 Ack=300000002 Win=2017408 Len=0 TSV=2955491 TSER=2940462
  1   0.000000     10.0.1.3 -> 10.0.1.2     TCP 55549 > 9040 [SYN] Seq=0 Win=5840 Len=0 MSS=1460 TSV=2961103 TSER=0 WS=6
  2   0.000293     10.0.1.2 -> 10.0.1.3     TCP 9040 > 55549 [SYN, ACK] Seq=0 Ack=1 Win=14480 Len=0 MSS=1460 TSV=2946095 TSER=2961103 WS=6
  3   0.000316     10.0.1.3 -> 10.0.1.2     TCP 55549 > 9040 [ACK] Seq=1 Ack=1 Win=5888 Len=0 TSV=2961103 TSER=2946095
  7   0.002276     10.0.1.2 -> 10.0.1.3     TCP 9040 > 55549 [ACK] Seq=1 Ack=13 Win=14528 Len=0 TSV=2946096 TSER=2961103
311337  54.888615     10.0.1.3 -> 10.0.1.2     TCP 55549 > 9040 [FIN, ACK] Seq=13 Ack=300000002 Win=2014528 Len=0 TSV=2974825 TSER=2959797
  1   0.000000     10.0.1.3 -> 10.0.1.2     TCP 55551 > 9040 [SYN] Seq=0 Win=5840 Len=0 MSS=1460 TSV=2980282 TSER=0 WS=6
  2   0.000309     10.0.1.2 -> 10.0.1.3     TCP 9040 > 55551 [SYN, ACK] Seq=0 Ack=1 Win=14480 Len=0 MSS=1460 TSV=2965276 TSER=2980282 WS=6
  3   0.000332     10.0.1.3 -> 10.0.1.2     TCP 55551 > 9040 [ACK] Seq=1 Ack=1 Win=5888 Len=0 TSV=2980282 TSER=2965276
  7   0.002432     10.0.1.2 -> 10.0.1.3     TCP 9040 > 55551 [ACK] Seq=1 Ack=13 Win=14528 Len=0 TSV=2965277 TSER=2980283
310884  54.269766     10.0.1.3 -> 10.0.1.2     TCP 55551 > 9040 [FIN, ACK] Seq=13 Ack=300000002 Win=2020288 Len=0 TSV=2993850 TSER=2978823
  1   0.000000     10.0.1.3 -> 10.0.1.2     TCP 55553 > 9040 [SYN] Seq=0 Win=5840 Len=0 MSS=1460 TSV=2999386 TSER=0 WS=6
  2   0.000299     10.0.1.2 -> 10.0.1.3     TCP 9040 > 55553 [SYN, ACK] Seq=0 Ack=1 Win=14480 Len=0 MSS=1460 TSV=2984381 TSER=2999386 WS=6
  3   0.000324     10.0.1.3 -> 10.0.1.2     TCP 55553 > 9040 [ACK] Seq=1 Ack=1 Win=5888 Len=0 TSV=2999386 TSER=2984381
  7   0.002176     10.0.1.2 -> 10.0.1.3     TCP 9040 > 55553 [ACK] Seq=1 Ack=13 Win=14528 Len=0 TSV=2984382 TSER=2999386
301629  54.742519     10.0.1.3 -> 10.0.1.2     TCP 55553 > 9040 [FIN, ACK] Seq=13 Ack=300000002 Win=2026112 Len=0 TSV=3013071 TSER=2998046
  1   0.000000     10.0.1.3 -> 10.0.1.2     TCP 42030 > 9040 [SYN] Seq=0 Win=5840 Len=0 MSS=1460 TSV=3018445 TSER=0 WS=6
  2   0.000337     10.0.1.2 -> 10.0.1.3     TCP 9040 > 42030 [SYN, ACK] Seq=0 Ack=1 Win=14480 Len=0 MSS=1460 TSV=3003442 TSER=3018445 WS=6
  3   0.000361     10.0.1.3 -> 10.0.1.2     TCP 42030 > 9040 [ACK] Seq=1 Ack=1 Win=5888 Len=0 TSV=3018445 TSER=3003442
  7   0.002311     10.0.1.2 -> 10.0.1.3     TCP 9040 > 42030 [ACK] Seq=1 Ack=13 Win=14528 Len=0 TSV=3003443 TSER=3018446
311301  54.980474     10.0.1.3 -> 10.0.1.2     TCP 42030 > 9040 [FIN, ACK] Seq=13 Ack=300000002 Win=2023168 Len=0 TSV=3032191 TSER=3017167
  1   0.000000     10.0.1.3 -> 10.0.1.2     TCP 42032 > 9040 [SYN] Seq=0 Win=5840 Len=0 MSS=1460 TSV=3037711 TSER=0 WS=6
  2   0.000319     10.0.1.2 -> 10.0.1.3     TCP 9040 > 42032 [SYN, ACK] Seq=0 Ack=1 Win=14480 Len=0 MSS=1460 TSV=3022709 TSER=3037711 WS=6
  3   0.000342     10.0.1.3 -> 10.0.1.2     TCP 42032 > 9040 [ACK] Seq=1 Ack=1 Win=5888 Len=0 TSV=3037711 TSER=3022709
  7   0.002210     10.0.1.2 -> 10.0.1.3     TCP 9040 > 42032 [ACK] Seq=1 Ack=13 Win=14528 Len=0 TSV=3022710 TSER=3037712
296396  54.426152     10.0.1.3 -> 10.0.1.2     TCP 42032 > 9040 [FIN, ACK] Seq=13 Ack=300000002 Win=2005824 Len=0 TSV=3051318 TSER=3036296
  1   0.000000     10.0.1.3 -> 10.0.1.2     TCP 42034 > 9040 [SYN] Seq=0 Win=5840 Len=0 MSS=1460 TSV=3056656 TSER=0 WS=6
  2   0.000311     10.0.1.2 -> 10.0.1.3     TCP 9040 > 42034 [SYN, ACK] Seq=0 Ack=1 Win=14480 Len=0 MSS=1460 TSV=3041656 TSER=3056656 WS=6
  3   0.000336     10.0.1.3 -> 10.0.1.2     TCP 42034 > 9040 [ACK] Seq=1 Ack=1 Win=5888 Len=0 TSV=3056656 TSER=3041656
  7   0.002155     10.0.1.2 -> 10.0.1.3     TCP 9040 > 42034 [ACK] Seq=1 Ack=13 Win=14528 Len=0 TSV=3041656 TSER=3056656
311002  55.065670     10.0.1.3 -> 10.0.1.2     TCP 42034 > 9040 [FIN, ACK] Seq=13 Ack=300000002 Win=2005824 Len=0 TSV=3070422 TSER=3055402
  1   0.000000     10.0.1.3 -> 10.0.1.2     TCP 48835 > 9040 [SYN] Seq=0 Win=5840 Len=0 MSS=1460 TSV=3075922 TSER=0 WS=6
  2   0.000291     10.0.1.2 -> 10.0.1.3     TCP 9040 > 48835 [SYN, ACK] Seq=0 Ack=1 Win=14480 Len=0 MSS=1460 TSV=3060923 TSER=3075922 WS=6
  3   0.000313     10.0.1.3 -> 10.0.1.2     TCP 48835 > 9040 [ACK] Seq=1 Ack=1 Win=5888 Len=0 TSV=3075922 TSER=3060923
  7   0.002275     10.0.1.2 -> 10.0.1.3     TCP 9040 > 48835 [ACK] Seq=1 Ack=13 Win=14528 Len=0 TSV=3060924 TSER=3075922
311524  54.485078     10.0.1.3 -> 10.0.1.2     TCP 48835 > 9040 [FIN, ACK] Seq=13 Ack=300000002 Win=2017408 Len=0 TSV=3089543 TSER=3074524
  1   0.000000     10.0.1.3 -> 10.0.1.2     TCP 48837 > 9040 [SYN] Seq=0 Win=5840 Len=0 MSS=1460 TSV=3095218 TSER=0 WS=6
  2   0.000285     10.0.1.2 -> 10.0.1.3     TCP 9040 > 48837 [SYN, ACK] Seq=0 Ack=1 Win=14480 Len=0 MSS=1460 TSV=3080220 TSER=3095218 WS=6
  3   0.000308     10.0.1.3 -> 10.0.1.2     TCP 48837 > 9040 [ACK] Seq=1 Ack=1 Win=5888 Len=0 TSV=3095218 TSER=3080220
  7   0.002213     10.0.1.2 -> 10.0.1.3     TCP 9040 > 48837 [ACK] Seq=1 Ack=13 Win=14528 Len=0 TSV=3080221 TSER=3095218
311318  54.884661     10.0.1.3 -> 10.0.1.2     TCP 48837 > 9040 [FIN, ACK] Seq=13 Ack=300000002 Win=2020288 Len=0 TSV=3108939 TSER=3093921
  1   0.000000     10.0.1.3 -> 10.0.1.2     TCP 48839 > 9040 [SYN] Seq=0 Win=5840 Len=0 MSS=1460 TSV=3114412 TSER=0 WS=6
  2   0.000355     10.0.1.2 -> 10.0.1.3     TCP 9040 > 48839 [SYN, ACK] Seq=0 Ack=1 Win=14480 Len=0 MSS=1460 TSV=3099416 TSER=3114412 WS=6
  3   0.000378     10.0.1.3 -> 10.0.1.2     TCP 48839 > 9040 [ACK] Seq=1 Ack=1 Win=5888 Len=0 TSV=3114412 TSER=3099416
  7   0.002321     10.0.1.2 -> 10.0.1.3     TCP 9040 > 48839 [ACK] Seq=1 Ack=13 Win=14528 Len=0 TSV=3099417 TSER=3114413
306024  55.078491     10.0.1.3 -> 10.0.1.2     TCP 48839 > 9040 [FIN, ACK] Seq=13 Ack=300000002 Win=2026112 Len=0 TSV=3128182 TSER=3113165
  1   0.000000     10.0.1.3 -> 10.0.1.2     TCP 48841 > 9040 [SYN] Seq=0 Win=5840 Len=0 MSS=1460 TSV=3133795 TSER=0 WS=6
  2   0.000358     10.0.1.2 -> 10.0.1.3     TCP 9040 > 48841 [SYN, ACK] Seq=0 Ack=1 Win=14480 Len=0 MSS=1460 TSV=3118800 TSER=3133795 WS=6
  3   0.000383     10.0.1.3 -> 10.0.1.2     TCP 48841 > 9040 [ACK] Seq=1 Ack=1 Win=5888 Len=0 TSV=3133795 TSER=3118800
  7   0.002364     10.0.1.2 -> 10.0.1.3     TCP 9040 > 48841 [ACK] Seq=1 Ack=13 Win=14528 Len=0 TSV=3118801 TSER=3133795
311066  53.865229     10.0.1.3 -> 10.0.1.2     TCP 48841 > 9040 [FIN, ACK] Seq=13 Ack=300000002 Win=2005824 Len=0 TSV=3147261 TSER=3132246
  1   0.000000     10.0.1.3 -> 10.0.1.2     TCP 56914 > 9040 [SYN] Seq=0 Win=5840 Len=0 MSS=1460 TSV=3153600 TSER=0 WS=6
  2   0.000295     10.0.1.2 -> 10.0.1.3     TCP 9040 > 56914 [SYN, ACK] Seq=0 Ack=1 Win=14480 Len=0 MSS=1460 TSV=3138607 TSER=3153600 WS=6
  3   0.000327     10.0.1.3 -> 10.0.1.2     TCP 56914 > 9040 [ACK] Seq=1 Ack=1 Win=5888 Len=0 TSV=3153600 TSER=3138607
  7   0.002520     10.0.1.2 -> 10.0.1.3     TCP 9040 > 56914 [ACK] Seq=1 Ack=13 Win=14528 Len=0 TSV=3138608 TSER=3153601
310915  55.108312     10.0.1.3 -> 10.0.1.2     TCP 56914 > 9040 [FIN, ACK] Seq=13 Ack=300000002 Win=2002944 Len=0 TSV=3167377 TSER=3152364
  1   0.000000     10.0.1.3 -> 10.0.1.2     TCP 56916 > 9040 [SYN] Seq=0 Win=5840 Len=0 MSS=1460 TSV=3172881 TSER=0 WS=6
  2   0.000298     10.0.1.2 -> 10.0.1.3     TCP 9040 > 56916 [SYN, ACK] Seq=0 Ack=1 Win=14480 Len=0 MSS=1460 TSV=3157890 TSER=3172881 WS=6
  3   0.000330     10.0.1.3 -> 10.0.1.2     TCP 56916 > 9040 [ACK] Seq=1 Ack=1 Win=5888 Len=0 TSV=3172881 TSER=3157890
  7   0.002556     10.0.1.2 -> 10.0.1.3     TCP 9040 > 56916 [ACK] Seq=1 Ack=13 Win=14528 Len=0 TSV=3157890 TSER=3172882
311273  54.594884     10.0.1.3 -> 10.0.1.2     TCP 56916 > 9040 [FIN, ACK] Seq=13 Ack=300000002 Win=2005824 Len=0 TSV=3186530 TSER=3171518
  1   0.000000     10.0.1.3 -> 10.0.1.2     TCP 56918 > 9040 [SYN] Seq=0 Win=5840 Len=0 MSS=1460 TSV=3192052 TSER=0 WS=6
  2   0.000319     10.0.1.2 -> 10.0.1.3     TCP 9040 > 56918 [SYN, ACK] Seq=0 Ack=1 Win=14480 Len=0 MSS=1460 TSV=3177062 TSER=3192052 WS=6
  3   0.000344     10.0.1.3 -> 10.0.1.2     TCP 56918 > 9040 [ACK] Seq=1 Ack=1 Win=5888 Len=0 TSV=3192052 TSER=3177062
  7   0.002190     10.0.1.2 -> 10.0.1.3     TCP 9040 > 56918 [ACK] Seq=1 Ack=13 Win=14528 Len=0 TSV=3177063 TSER=3192053
308078  55.048927     10.0.1.3 -> 10.0.1.2     TCP 56918 > 9040 [FIN, ACK] Seq=13 Ack=300000002 Win=2023168 Len=0 TSV=3205815 TSER=3190804
  1   0.000000     10.0.1.3 -> 10.0.1.2     TCP 56920 > 9040 [SYN] Seq=0 Win=5840 Len=0 MSS=1460 TSV=3211369 TSER=0 WS=6
  2   0.000370     10.0.1.2 -> 10.0.1.3     TCP 9040 > 56920 [SYN, ACK] Seq=0 Ack=1 Win=14480 Len=0 MSS=1460 TSV=3196380 TSER=3211369 WS=6
  3   0.000395     10.0.1.3 -> 10.0.1.2     TCP 56920 > 9040 [ACK] Seq=1 Ack=1 Win=5888 Len=0 TSV=3211369 TSER=3196380
  7   0.002255     10.0.1.2 -> 10.0.1.3     TCP 9040 > 56920 [ACK] Seq=1 Ack=13 Win=14528 Len=0 TSV=3196381 TSER=3211369
311081  55.104972     10.0.1.3 -> 10.0.1.2     TCP 56920 > 9040 [FIN, ACK] Seq=13 Ack=300000002 Win=2014528 Len=0 TSV=3225145 TSER=3210136
  1   0.000000     10.0.1.3 -> 10.0.1.2     TCP 50777 > 9040 [SYN] Seq=0 Win=5840 Len=0 MSS=1460 TSV=3230839 TSER=0 WS=6
  2   0.000297     10.0.1.2 -> 10.0.1.3     TCP 9040 > 50777 [SYN, ACK] Seq=0 Ack=1 Win=14480 Len=0 MSS=1460 TSV=3215852 TSER=3230839 WS=6
  3   0.000322     10.0.1.3 -> 10.0.1.2     TCP 50777 > 9040 [ACK] Seq=1 Ack=1 Win=5888 Len=0 TSV=3230839 TSER=3215852
  7   0.002439     10.0.1.2 -> 10.0.1.3     TCP 9040 > 50777 [ACK] Seq=1 Ack=13 Win=14528 Len=0 TSV=3215853 TSER=3230840
307294  53.976878     10.0.1.3 -> 10.0.1.2     TCP 50777 > 9040 [FIN, ACK] Seq=13 Ack=300000002 Win=2002944 Len=0 TSV=3244333 TSER=3229326
  1   0.000000     10.0.1.3 -> 10.0.1.2     TCP 50779 > 9040 [SYN] Seq=0 Win=5840 Len=0 MSS=1460 TSV=3249982 TSER=0 WS=6
  2   0.000276     10.0.1.2 -> 10.0.1.3     TCP 9040 > 50779 [SYN, ACK] Seq=0 Ack=1 Win=14480 Len=0 MSS=1460 TSV=3234996 TSER=3249982 WS=6
  3   0.000299     10.0.1.3 -> 10.0.1.2     TCP 50779 > 9040 [ACK] Seq=1 Ack=1 Win=5888 Len=0 TSV=3249982 TSER=3234996
  7   0.002139     10.0.1.2 -> 10.0.1.3     TCP 9040 > 50779 [ACK] Seq=1 Ack=13 Win=14528 Len=0 TSV=3234997 TSER=3249982
297322  54.184743     10.0.1.3 -> 10.0.1.2     TCP 50779 > 9040 [FIN, ACK] Seq=13 Ack=300000002 Win=2005824 Len=0 TSV=3263528 TSER=3248522
  1   0.000000     10.0.1.3 -> 10.0.1.2     TCP 50781 > 9040 [SYN] Seq=0 Win=5840 Len=0 MSS=1460 TSV=3269037 TSER=0 WS=6
  2   0.000306     10.0.1.2 -> 10.0.1.3     TCP 9040 > 50781 [SYN, ACK] Seq=0 Ack=1 Win=14480 Len=0 MSS=1460 TSV=3254052 TSER=3269037 WS=6
  3   0.000341     10.0.1.3 -> 10.0.1.2     TCP 50781 > 9040 [ACK] Seq=1 Ack=1 Win=5888 Len=0 TSV=3269037 TSER=3254052
  7   0.002476     10.0.1.2 -> 10.0.1.3     TCP 9040 > 50781 [ACK] Seq=1 Ack=13 Win=14528 Len=0 TSV=3254053 TSER=3269037
301945  54.799938     10.0.1.3 -> 10.0.1.2     TCP 50781 > 9040 [FIN, ACK] Seq=13 Ack=300000002 Win=2005824 Len=0 TSV=3282737 TSER=3267732
  1   0.000000     10.0.1.3 -> 10.0.1.2     TCP 50783 > 9040 [SYN] Seq=0 Win=5840 Len=0 MSS=1460 TSV=3288270 TSER=0 WS=6
  2   0.000322     10.0.1.2 -> 10.0.1.3     TCP 9040 > 50783 [SYN, ACK] Seq=0 Ack=1 Win=14480 Len=0 MSS=1460 TSV=3273287 TSER=3288270 WS=6
  3   0.000357     10.0.1.3 -> 10.0.1.2     TCP 50783 > 9040 [ACK] Seq=1 Ack=1 Win=5888 Len=0 TSV=3288270 TSER=3273287
  7   0.002694     10.0.1.2 -> 10.0.1.3     TCP 9040 > 50783 [ACK] Seq=1 Ack=13 Win=14528 Len=0 TSV=3273287 TSER=3288270
311223  53.944653     10.0.1.3 -> 10.0.1.2     TCP 50783 > 9040 [FIN, ACK] Seq=13 Ack=300000002 Win=2005824 Len=0 TSV=3301756 TSER=3286752
