  1   0.000000     10.0.1.3 -> 10.0.1.2     TCP 57521 > 9040 [SYN] Seq=0 Win=5840 Len=0 MSS=1460 TSV=10612901 TSER=0 WS=6
  2   0.000321     10.0.1.2 -> 10.0.1.3     TCP 9040 > 57521 [SYN, ACK] Seq=0 Ack=1 Win=14480 Len=0 MSS=1460 TSV=10666943 TSER=10612901 WS=6
  3   0.000344     10.0.1.3 -> 10.0.1.2     TCP 57521 > 9040 [ACK] Seq=1 Ack=1 Win=5888 Len=0 TSV=10612901 TSER=10666943
  7   0.003602     10.0.1.2 -> 10.0.1.3     TCP 9040 > 57521 [ACK] Seq=1 Ack=13 Win=14528 Len=0 TSV=10666944 TSER=10612902
362815  30.089727     10.0.1.3 -> 10.0.1.2     TCP 57521 > 9040 [FIN, ACK] Seq=13 Ack=350000002 Win=2580480 Len=0 TSV=10620424 TSER=10674411
362816  30.089976     10.0.1.2 -> 10.0.1.3     TCP 9040 > 57521 [ACK] Seq=350000002 Ack=14 Win=14528 Len=0 TSV=10674466 TSER=10620424
================================================================================
IPv4 Conversations
Filter:<No Filter>
                                               |       <-      | |       ->      | |     Total     |
                                               | Frames  Bytes | | Frames  Bytes | | Frames  Bytes |
10.0.1.3             <-> 10.0.1.2              241739 365954782  121077   7991102  362816 373945884
================================================================================
  1   0.000000     10.0.1.3 -> 10.0.1.2     TCP 57523 > 9040 [SYN] Seq=0 Win=5840 Len=0 MSS=1460 TSV=10623869 TSER=0 WS=6
  2   0.000311     10.0.1.2 -> 10.0.1.3     TCP 9040 > 57523 [SYN, ACK] Seq=0 Ack=1 Win=14480 Len=0 MSS=1460 TSV=10677911 TSER=10623869 WS=6
  3   0.000334     10.0.1.3 -> 10.0.1.2     TCP 57523 > 9040 [ACK] Seq=1 Ack=1 Win=5888 Len=0 TSV=10623869 TSER=10677911
  7   0.002222     10.0.1.2 -> 10.0.1.3     TCP 9040 > 57523 [ACK] Seq=1 Ack=13 Win=14528 Len=0 TSV=10677911 TSER=10623869
362823  29.983253     10.0.1.3 -> 10.0.1.2     TCP 57523 > 9040 [FIN, ACK] Seq=13 Ack=350000002 Win=2580480 Len=0 TSV=10631365 TSER=10685352
362824  29.983500     10.0.1.2 -> 10.0.1.3     TCP 9040 > 57523 [ACK] Seq=350000002 Ack=14 Win=14528 Len=0 TSV=10685407 TSER=10631365
================================================================================
IPv4 Conversations
Filter:<No Filter>
                                               |       <-      | |       ->      | |     Total     |
                                               | Frames  Bytes | | Frames  Bytes | | Frames  Bytes |
10.0.1.3             <-> 10.0.1.2              241731 365954254  121093   7992158  362824 373946412
================================================================================
  1   0.000000     10.0.1.3 -> 10.0.1.2     TCP 57526 > 9040 [SYN] Seq=0 Win=5840 Len=0 MSS=1460 TSV=10634791 TSER=0 WS=6
  2   0.000292     10.0.1.2 -> 10.0.1.3     TCP 9040 > 57526 [SYN, ACK] Seq=0 Ack=1 Win=14480 Len=0 MSS=1460 TSV=10688834 TSER=10634791 WS=6
  3   0.000315     10.0.1.3 -> 10.0.1.2     TCP 57526 > 9040 [ACK] Seq=1 Ack=1 Win=5888 Len=0 TSV=10634791 TSER=10688834
  7   0.002219     10.0.1.2 -> 10.0.1.3     TCP 9040 > 57526 [ACK] Seq=1 Ack=13 Win=14528 Len=0 TSV=10688834 TSER=10634791
362738  29.839277     10.0.1.3 -> 10.0.1.2     TCP 57526 > 9040 [FIN, ACK] Seq=13 Ack=350000002 Win=2580480 Len=0 TSV=10642251 TSER=10696239
362739  29.839525     10.0.1.2 -> 10.0.1.3     TCP 9040 > 57526 [ACK] Seq=350000002 Ack=14 Win=14528 Len=0 TSV=10696294 TSER=10642251
================================================================================
IPv4 Conversations
Filter:<No Filter>
                                               |       <-      | |       ->      | |     Total     |
                                               | Frames  Bytes | | Frames  Bytes | | Frames  Bytes |
10.0.1.3             <-> 10.0.1.2              241726 365953924  121013   7986878  362739 373940802
================================================================================
  1   0.000000     10.0.1.3 -> 10.0.1.2     TCP 57528 > 9040 [SYN] Seq=0 Win=5840 Len=0 MSS=1460 TSV=10645697 TSER=0 WS=6
  2   0.000271     10.0.1.2 -> 10.0.1.3     TCP 9040 > 57528 [SYN, ACK] Seq=0 Ack=1 Win=14480 Len=0 MSS=1460 TSV=10699741 TSER=10645697 WS=6
  3   0.000294     10.0.1.3 -> 10.0.1.2     TCP 57528 > 9040 [ACK] Seq=1 Ack=1 Win=5888 Len=0 TSV=10645697 TSER=10699741
  7   0.002208     10.0.1.2 -> 10.0.1.3     TCP 9040 > 57528 [ACK] Seq=1 Ack=13 Win=14528 Len=0 TSV=10699741 TSER=10645697
363030  30.238816     10.0.1.3 -> 10.0.1.2     TCP 57528 > 9040 [FIN, ACK] Seq=13 Ack=350000002 Win=2554304 Len=0 TSV=10653257 TSER=10707247
363031  30.239068     10.0.1.2 -> 10.0.1.3     TCP 9040 > 57528 [ACK] Seq=350000002 Ack=14 Win=14528 Len=0 TSV=10707301 TSER=10653257
================================================================================
IPv4 Conversations
Filter:<No Filter>
                                               |       <-      | |       ->      | |     Total     |
                                               | Frames  Bytes | | Frames  Bytes | | Frames  Bytes |
10.0.1.3             <-> 10.0.1.2              241744 365955112  121287   8004962  363031 373960074
================================================================================
  1   0.000000     10.0.1.3 -> 10.0.1.2     TCP 33188 > 9040 [SYN] Seq=0 Win=5840 Len=0 MSS=1460 TSV=10656700 TSER=0 WS=6
  2   0.000272     10.0.1.2 -> 10.0.1.3     TCP 9040 > 33188 [SYN, ACK] Seq=0 Ack=1 Win=14480 Len=0 MSS=1460 TSV=10710744 TSER=10656700 WS=6
  3   0.000294     10.0.1.3 -> 10.0.1.2     TCP 33188 > 9040 [ACK] Seq=1 Ack=1 Win=5888 Len=0 TSV=10656700 TSER=10710744
  7   0.002260     10.0.1.2 -> 10.0.1.3     TCP 9040 > 33188 [ACK] Seq=1 Ack=13 Win=14528 Len=0 TSV=10710745 TSER=10656700
362848  29.851963     10.0.1.3 -> 10.0.1.2     TCP 33188 > 9040 [FIN, ACK] Seq=13 Ack=350000002 Win=2580480 Len=0 TSV=10664163 TSER=10718153
362849  29.852240     10.0.1.2 -> 10.0.1.3     TCP 9040 > 33188 [ACK] Seq=350000002 Ack=14 Win=14528 Len=0 TSV=10718208 TSER=10664163
================================================================================
IPv4 Conversations
Filter:<No Filter>
                                               |       <-      | |       ->      | |     Total     |
                                               | Frames  Bytes | | Frames  Bytes | | Frames  Bytes |
10.0.1.3             <-> 10.0.1.2              241727 365953990  121122   7994072  362849 373948062
================================================================================
  1   0.000000     10.0.1.3 -> 10.0.1.2     TCP 33190 > 9040 [SYN] Seq=0 Win=5840 Len=0 MSS=1460 TSV=10667601 TSER=0 WS=6
  2   0.000306     10.0.1.2 -> 10.0.1.3     TCP 9040 > 33190 [SYN, ACK] Seq=0 Ack=1 Win=14480 Len=0 MSS=1460 TSV=10721647 TSER=10667601 WS=6
  3   0.000341     10.0.1.3 -> 10.0.1.2     TCP 33190 > 9040 [ACK] Seq=1 Ack=1 Win=5888 Len=0 TSV=10667601 TSER=10721647
  7   0.003012     10.0.1.2 -> 10.0.1.3     TCP 9040 > 33190 [ACK] Seq=1 Ack=13 Win=14528 Len=0 TSV=10721647 TSER=10667602
362748  29.826201     10.0.1.3 -> 10.0.1.2     TCP 33190 > 9040 [FIN, ACK] Seq=13 Ack=350000002 Win=2580480 Len=0 TSV=10675058 TSER=10729049
362749  29.826446     10.0.1.2 -> 10.0.1.3     TCP 9040 > 33190 [ACK] Seq=350000002 Ack=14 Win=14528 Len=0 TSV=10729104 TSER=10675058
================================================================================
IPv4 Conversations
Filter:<No Filter>
                                               |       <-      | |       ->      | |     Total     |
                                               | Frames  Bytes | | Frames  Bytes | | Frames  Bytes |
10.0.1.3             <-> 10.0.1.2              241725 365953858  121024   7987604  362749 373941462
================================================================================
  1   0.000000     10.0.1.3 -> 10.0.1.2     TCP 33194 > 9040 [SYN] Seq=0 Win=5840 Len=0 MSS=1460 TSV=10678494 TSER=0 WS=6
  2   0.000286     10.0.1.2 -> 10.0.1.3     TCP 9040 > 33194 [SYN, ACK] Seq=0 Ack=1 Win=14480 Len=0 MSS=1460 TSV=10732541 TSER=10678494 WS=6
  3   0.000308     10.0.1.3 -> 10.0.1.2     TCP 33194 > 9040 [ACK] Seq=1 Ack=1 Win=5888 Len=0 TSV=10678495 TSER=10732541
  7   0.002385     10.0.1.2 -> 10.0.1.3     TCP 9040 > 33194 [ACK] Seq=1 Ack=13 Win=14528 Len=0 TSV=10732541 TSER=10678495
362819  29.933225     10.0.1.3 -> 10.0.1.2     TCP 33194 > 9040 [FIN, ACK] Seq=13 Ack=350000002 Win=2580480 Len=0 TSV=10685978 TSER=10739969
362820  29.933475     10.0.1.2 -> 10.0.1.3     TCP 9040 > 33194 [ACK] Seq=350000002 Ack=14 Win=14528 Len=0 TSV=10740025 TSER=10685978
================================================================================
IPv4 Conversations
Filter:<No Filter>
                                               |       <-      | |       ->      | |     Total     |
                                               | Frames  Bytes | | Frames  Bytes | | Frames  Bytes |
10.0.1.3             <-> 10.0.1.2              241732 365954320  121088   7991828  362820 373946148
================================================================================
  1   0.000000     10.0.1.3 -> 10.0.1.2     TCP 33196 > 9040 [SYN] Seq=0 Win=5840 Len=0 MSS=1460 TSV=10689545 TSER=0 WS=6
  2   0.000260     10.0.1.2 -> 10.0.1.3     TCP 9040 > 33196 [SYN, ACK] Seq=0 Ack=1 Win=14480 Len=0 MSS=1460 TSV=10743592 TSER=10689545 WS=6
  3   0.000282     10.0.1.3 -> 10.0.1.2     TCP 33196 > 9040 [ACK] Seq=1 Ack=1 Win=5888 Len=0 TSV=10689545 TSER=10743592
  7   0.002360     10.0.1.2 -> 10.0.1.3     TCP 9040 > 33196 [ACK] Seq=1 Ack=13 Win=14528 Len=0 TSV=10743593 TSER=10689546
362807  29.821578     10.0.1.3 -> 10.0.1.2     TCP 33196 > 9040 [FIN, ACK] Seq=13 Ack=350000002 Win=2580480 Len=0 TSV=10697000 TSER=10750993
362808  29.821824     10.0.1.2 -> 10.0.1.3     TCP 9040 > 33196 [ACK] Seq=350000002 Ack=14 Win=14528 Len=0 TSV=10751048 TSER=10697000
================================================================================
IPv4 Conversations
Filter:<No Filter>
                                               |       <-      | |       ->      | |     Total     |
                                               | Frames  Bytes | | Frames  Bytes | | Frames  Bytes |
10.0.1.3             <-> 10.0.1.2              241722 365953660  121086   7991696  362808 373945356
================================================================================
  1   0.000000     10.0.1.3 -> 10.0.1.2     TCP 33198 > 9040 [SYN] Seq=0 Win=5840 Len=0 MSS=1460 TSV=10700419 TSER=0 WS=6
  2   0.000292     10.0.1.2 -> 10.0.1.3     TCP 9040 > 33198 [SYN, ACK] Seq=0 Ack=1 Win=14480 Len=0 MSS=1460 TSV=10754467 TSER=10700419 WS=6
  3   0.000316     10.0.1.3 -> 10.0.1.2     TCP 33198 > 9040 [ACK] Seq=1 Ack=1 Win=5888 Len=0 TSV=10700419 TSER=10754467
  7   0.002120     10.0.1.2 -> 10.0.1.3     TCP 9040 > 33198 [ACK] Seq=1 Ack=13 Win=14528 Len=0 TSV=10754467 TSER=10700419
362793  29.822618     10.0.1.3 -> 10.0.1.2     TCP 33198 > 9040 [FIN, ACK] Seq=13 Ack=350000002 Win=2580480 Len=0 TSV=10707874 TSER=10761868
362794  29.822868     10.0.1.2 -> 10.0.1.3     TCP 9040 > 33198 [ACK] Seq=350000002 Ack=14 Win=14528 Len=0 TSV=10761923 TSER=10707874
================================================================================
IPv4 Conversations
Filter:<No Filter>
                                               |       <-      | |       ->      | |     Total     |
                                               | Frames  Bytes | | Frames  Bytes | | Frames  Bytes |
10.0.1.3             <-> 10.0.1.2              241724 365953792  121070   7990640  362794 373944432
================================================================================
  1   0.000000     10.0.1.3 -> 10.0.1.2     TCP 33200 > 9040 [SYN] Seq=0 Win=5840 Len=0 MSS=1460 TSV=10711318 TSER=0 WS=6
  2   0.000318     10.0.1.2 -> 10.0.1.3     TCP 9040 > 33200 [SYN, ACK] Seq=0 Ack=1 Win=14480 Len=0 MSS=1460 TSV=10765367 TSER=10711318 WS=6
  3   0.000340     10.0.1.3 -> 10.0.1.2     TCP 33200 > 9040 [ACK] Seq=1 Ack=1 Win=5888 Len=0 TSV=10711318 TSER=10765367
  7   0.002231     10.0.1.2 -> 10.0.1.3     TCP 9040 > 33200 [ACK] Seq=1 Ack=13 Win=14528 Len=0 TSV=10765367 TSER=10711318
362752  29.825303     10.0.1.3 -> 10.0.1.2     TCP 33200 > 9040 [FIN, ACK] Seq=13 Ack=350000002 Win=2580480 Len=0 TSV=10718774 TSER=10772769
362753  29.825576     10.0.1.2 -> 10.0.1.3     TCP 9040 > 33200 [ACK] Seq=350000002 Ack=14 Win=14528 Len=0 TSV=10772824 TSER=10718774
================================================================================
IPv4 Conversations
Filter:<No Filter>
                                               |       <-      | |       ->      | |     Total     |
                                               | Frames  Bytes | | Frames  Bytes | | Frames  Bytes |
10.0.1.3             <-> 10.0.1.2              241725 365953858  121028   7987868  362753 373941726
================================================================================
  1   0.000000     10.0.1.3 -> 10.0.1.2     TCP 33202 > 9040 [SYN] Seq=0 Win=5840 Len=0 MSS=1460 TSV=10722196 TSER=0 WS=6
  2   0.000290     10.0.1.2 -> 10.0.1.3     TCP 9040 > 33202 [SYN, ACK] Seq=0 Ack=1 Win=14480 Len=0 MSS=1460 TSV=10776245 TSER=10722196 WS=6
  3   0.000316     10.0.1.3 -> 10.0.1.2     TCP 33202 > 9040 [ACK] Seq=1 Ack=1 Win=5888 Len=0 TSV=10722196 TSER=10776245
  7   0.002227     10.0.1.2 -> 10.0.1.3     TCP 9040 > 33202 [ACK] Seq=1 Ack=13 Win=14528 Len=0 TSV=10776246 TSER=10722196
362847  29.855033     10.0.1.3 -> 10.0.1.2     TCP 33202 > 9040 [FIN, ACK] Seq=13 Ack=350000002 Win=2580480 Len=0 TSV=10729660 TSER=10783655
362848  29.855271     10.0.1.2 -> 10.0.1.3     TCP 9040 > 33202 [ACK] Seq=350000002 Ack=14 Win=14528 Len=0 TSV=10783710 TSER=10729660
================================================================================
IPv4 Conversations
Filter:<No Filter>
                                               |       <-      | |       ->      | |     Total     |
                                               | Frames  Bytes | | Frames  Bytes | | Frames  Bytes |
10.0.1.3             <-> 10.0.1.2              241726 365953924  121122   7994072  362848 373947996
================================================================================
  1   0.000000     10.0.1.3 -> 10.0.1.2     TCP 44263 > 9040 [SYN] Seq=0 Win=5840 Len=0 MSS=1460 TSV=10733060 TSER=0 WS=6
  2   0.000322     10.0.1.2 -> 10.0.1.3     TCP 9040 > 44263 [SYN, ACK] Seq=0 Ack=1 Win=14480 Len=0 MSS=1460 TSV=10787110 TSER=10733060 WS=6
  3   0.000343     10.0.1.3 -> 10.0.1.2     TCP 44263 > 9040 [ACK] Seq=1 Ack=1 Win=5888 Len=0 TSV=10733060 TSER=10787110
  7   0.002262     10.0.1.2 -> 10.0.1.3     TCP 9040 > 44263 [ACK] Seq=1 Ack=13 Win=14528 Len=0 TSV=10787111 TSER=10733060
362832  29.826887     10.0.1.3 -> 10.0.1.2     TCP 44263 > 9040 [FIN, ACK] Seq=13 Ack=350000002 Win=2580480 Len=0 TSV=10740517 TSER=10794512
362833  29.827159     10.0.1.2 -> 10.0.1.3     TCP 9040 > 44263 [ACK] Seq=350000002 Ack=14 Win=14528 Len=0 TSV=10794567 TSER=10740517
================================================================================
IPv4 Conversations
Filter:<No Filter>
                                               |       <-      | |       ->      | |     Total     |
                                               | Frames  Bytes | | Frames  Bytes | | Frames  Bytes |
10.0.1.3             <-> 10.0.1.2              241725 365953858  121108   7993148  362833 373947006
================================================================================
  1   0.000000     10.0.1.3 -> 10.0.1.2     TCP 44265 > 9040 [SYN] Seq=0 Win=5840 Len=0 MSS=1460 TSV=10743928 TSER=0 WS=6
  2   0.000282     10.0.1.2 -> 10.0.1.3     TCP 9040 > 44265 [SYN, ACK] Seq=0 Ack=1 Win=14480 Len=0 MSS=1460 TSV=10797979 TSER=10743928 WS=6
  3   0.000305     10.0.1.3 -> 10.0.1.2     TCP 44265 > 9040 [ACK] Seq=1 Ack=1 Win=5888 Len=0 TSV=10743928 TSER=10797979
  7   0.002272     10.0.1.2 -> 10.0.1.3     TCP 9040 > 44265 [ACK] Seq=1 Ack=13 Win=14528 Len=0 TSV=10797980 TSER=10743928
362722  29.823771     10.0.1.3 -> 10.0.1.2     TCP 44265 > 9040 [FIN, ACK] Seq=13 Ack=350000002 Win=2580480 Len=0 TSV=10751384 TSER=10805381
362723  29.824029     10.0.1.2 -> 10.0.1.3     TCP 9040 > 44265 [ACK] Seq=350000002 Ack=14 Win=14528 Len=0 TSV=10805436 TSER=10751384
================================================================================
IPv4 Conversations
Filter:<No Filter>
                                               |       <-      | |       ->      | |     Total     |
                                               | Frames  Bytes | | Frames  Bytes | | Frames  Bytes |
10.0.1.3             <-> 10.0.1.2              241724 365953792  120999   7985954  362723 373939746
================================================================================
  1   0.000000     10.0.1.3 -> 10.0.1.2     TCP 44269 > 9040 [SYN] Seq=0 Win=5840 Len=0 MSS=1460 TSV=10754792 TSER=0 WS=6
  2   0.000300     10.0.1.2 -> 10.0.1.3     TCP 9040 > 44269 [SYN, ACK] Seq=0 Ack=1 Win=14480 Len=0 MSS=1460 TSV=10808844 TSER=10754792 WS=6
  3   0.000323     10.0.1.3 -> 10.0.1.2     TCP 44269 > 9040 [ACK] Seq=1 Ack=1 Win=5888 Len=0 TSV=10754792 TSER=10808844
  7   0.002214     10.0.1.2 -> 10.0.1.3     TCP 9040 > 44269 [ACK] Seq=1 Ack=13 Win=14528 Len=0 TSV=10808845 TSER=10754793
362579  29.960648     10.0.1.3 -> 10.0.1.2     TCP 44269 > 9040 [FIN, ACK] Seq=13 Ack=350000002 Win=2580480 Len=0 TSV=10762282 TSER=10816280
362580  29.960900     10.0.1.2 -> 10.0.1.3     TCP 9040 > 44269 [ACK] Seq=350000002 Ack=14 Win=14528 Len=0 TSV=10816335 TSER=10762282
================================================================================
IPv4 Conversations
Filter:<No Filter>
                                               |       <-      | |       ->      | |     Total     |
                                               | Frames  Bytes | | Frames  Bytes | | Frames  Bytes |
10.0.1.3             <-> 10.0.1.2              241732 365954320  120848   7975988  362580 373930308
================================================================================
  1   0.000000     10.0.1.3 -> 10.0.1.2     TCP 44272 > 9040 [SYN] Seq=0 Win=5840 Len=0 MSS=1460 TSV=10765691 TSER=0 WS=6
  2   0.000303     10.0.1.2 -> 10.0.1.3     TCP 9040 > 44272 [SYN, ACK] Seq=0 Ack=1 Win=14480 Len=0 MSS=1460 TSV=10819744 TSER=10765691 WS=6
  3   0.000326     10.0.1.3 -> 10.0.1.2     TCP 44272 > 9040 [ACK] Seq=1 Ack=1 Win=5888 Len=0 TSV=10765691 TSER=10819744
  7   0.002300     10.0.1.2 -> 10.0.1.3     TCP 9040 > 44272 [ACK] Seq=1 Ack=13 Win=14528 Len=0 TSV=10819744 TSER=10765691
362873  29.987513     10.0.1.3 -> 10.0.1.2     TCP 44272 > 9040 [FIN, ACK] Seq=13 Ack=350000002 Win=2580480 Len=0 TSV=10773188 TSER=10827186
362874  29.987768     10.0.1.2 -> 10.0.1.3     TCP 9040 > 44272 [ACK] Seq=350000002 Ack=14 Win=14528 Len=0 TSV=10827241 TSER=10773188
================================================================================
IPv4 Conversations
Filter:<No Filter>
                                               |       <-      | |       ->      | |     Total     |
                                               | Frames  Bytes | | Frames  Bytes | | Frames  Bytes |
10.0.1.3             <-> 10.0.1.2              241726 365953924  121148   7995788  362874 373949712
================================================================================
  1   0.000000     10.0.1.3 -> 10.0.1.2     TCP 44274 > 9040 [SYN] Seq=0 Win=5840 Len=0 MSS=1460 TSV=10776619 TSER=0 WS=6
  2   0.000296     10.0.1.2 -> 10.0.1.3     TCP 9040 > 44274 [SYN, ACK] Seq=0 Ack=1 Win=14480 Len=0 MSS=1460 TSV=10830673 TSER=10776619 WS=6
  3   0.000312     10.0.1.3 -> 10.0.1.2     TCP 44274 > 9040 [ACK] Seq=1 Ack=1 Win=5888 Len=0 TSV=10776619 TSER=10830673
  7   0.002137     10.0.1.2 -> 10.0.1.3     TCP 9040 > 44274 [ACK] Seq=1 Ack=13 Win=14528 Len=0 TSV=10830673 TSER=10776620
362888  29.822055     10.0.1.3 -> 10.0.1.2     TCP 44274 > 9040 [FIN, ACK] Seq=13 Ack=350000002 Win=2580480 Len=0 TSV=10784075 TSER=10838074
362889  29.822304     10.0.1.2 -> 10.0.1.3     TCP 9040 > 44274 [ACK] Seq=350000002 Ack=14 Win=14528 Len=0 TSV=10838129 TSER=10784075
================================================================================
IPv4 Conversations
Filter:<No Filter>
                                               |       <-      | |       ->      | |     Total     |
                                               | Frames  Bytes | | Frames  Bytes | | Frames  Bytes |
10.0.1.3             <-> 10.0.1.2              241725 365953858  121164   7996844  362889 373950702
================================================================================
  1   0.000000     10.0.1.3 -> 10.0.1.2     TCP 44276 > 9040 [SYN] Seq=0 Win=5840 Len=0 MSS=1460 TSV=10787461 TSER=0 WS=6
  2   0.000275     10.0.1.2 -> 10.0.1.3     TCP 9040 > 44276 [SYN, ACK] Seq=0 Ack=1 Win=14480 Len=0 MSS=1460 TSV=10841516 TSER=10787461 WS=6
  3   0.000298     10.0.1.3 -> 10.0.1.2     TCP 44276 > 9040 [ACK] Seq=1 Ack=1 Win=5888 Len=0 TSV=10787461 TSER=10841516
  7   0.002173     10.0.1.2 -> 10.0.1.3     TCP 9040 > 44276 [ACK] Seq=1 Ack=13 Win=14528 Len=0 TSV=10841516 TSER=10787461
362950  29.821416     10.0.1.3 -> 10.0.1.2     TCP 44276 > 9040 [FIN, ACK] Seq=13 Ack=350000002 Win=2580480 Len=0 TSV=10794917 TSER=10848917
362951  29.821673     10.0.1.2 -> 10.0.1.3     TCP 9040 > 44276 [ACK] Seq=350000002 Ack=14 Win=14528 Len=0 TSV=10848972 TSER=10794917
================================================================================
IPv4 Conversations
Filter:<No Filter>
                                               |       <-      | |       ->      | |     Total     |
                                               | Frames  Bytes | | Frames  Bytes | | Frames  Bytes |
10.0.1.3             <-> 10.0.1.2              241725 365953858  121226   8000936  362951 373954794
================================================================================
  1   0.000000     10.0.1.3 -> 10.0.1.2     TCP 44278 > 9040 [SYN] Seq=0 Win=5840 Len=0 MSS=1460 TSV=10798318 TSER=0 WS=6
  2   0.000273     10.0.1.2 -> 10.0.1.3     TCP 9040 > 44278 [SYN, ACK] Seq=0 Ack=1 Win=14480 Len=0 MSS=1460 TSV=10852373 TSER=10798318 WS=6
  3   0.000296     10.0.1.3 -> 10.0.1.2     TCP 44278 > 9040 [ACK] Seq=1 Ack=1 Win=5888 Len=0 TSV=10798318 TSER=10852373
  7   0.002157     10.0.1.2 -> 10.0.1.3     TCP 9040 > 44278 [ACK] Seq=1 Ack=13 Win=14528 Len=0 TSV=10852373 TSER=10798318
362814  29.822306     10.0.1.3 -> 10.0.1.2     TCP 44278 > 9040 [FIN, ACK] Seq=13 Ack=350000002 Win=2580480 Len=0 TSV=10805773 TSER=10859774
362815  29.822558     10.0.1.2 -> 10.0.1.3     TCP 9040 > 44278 [ACK] Seq=350000002 Ack=14 Win=14528 Len=0 TSV=10859829 TSER=10805773
================================================================================
IPv4 Conversations
Filter:<No Filter>
                                               |       <-      | |       ->      | |     Total     |
                                               | Frames  Bytes | | Frames  Bytes | | Frames  Bytes |
10.0.1.3             <-> 10.0.1.2              241721 365953594  121094   7992224  362815 373945818
================================================================================
  1   0.000000     10.0.1.3 -> 10.0.1.2     TCP 45084 > 9040 [SYN] Seq=0 Win=5840 Len=0 MSS=1460 TSV=10809181 TSER=0 WS=6
  2   0.000287     10.0.1.2 -> 10.0.1.3     TCP 9040 > 45084 [SYN, ACK] Seq=0 Ack=1 Win=14480 Len=0 MSS=1460 TSV=10863237 TSER=10809181 WS=6
  3   0.000308     10.0.1.3 -> 10.0.1.2     TCP 45084 > 9040 [ACK] Seq=1 Ack=1 Win=5888 Len=0 TSV=10809181 TSER=10863237
  7   0.002285     10.0.1.2 -> 10.0.1.3     TCP 9040 > 45084 [ACK] Seq=1 Ack=13 Win=14528 Len=0 TSV=10863237 TSER=10809181
362791  29.819214     10.0.1.3 -> 10.0.1.2     TCP 45084 > 9040 [FIN, ACK] Seq=13 Ack=350000002 Win=2580480 Len=0 TSV=10816636 TSER=10870637
362792  29.819457     10.0.1.2 -> 10.0.1.3     TCP 9040 > 45084 [ACK] Seq=350000002 Ack=14 Win=14528 Len=0 TSV=10870692 TSER=10816636
================================================================================
IPv4 Conversations
Filter:<No Filter>
                                               |       <-      | |       ->      | |     Total     |
                                               | Frames  Bytes | | Frames  Bytes | | Frames  Bytes |
10.0.1.3             <-> 10.0.1.2              241724 365953792  121068   7990508  362792 373944300
================================================================================
  1   0.000000     10.0.1.3 -> 10.0.1.2     TCP 45086 > 9040 [SYN] Seq=0 Win=5840 Len=0 MSS=1460 TSV=10820023 TSER=0 WS=6
  2   0.000320     10.0.1.2 -> 10.0.1.3     TCP 9040 > 45086 [SYN, ACK] Seq=0 Ack=1 Win=14480 Len=0 MSS=1460 TSV=10874080 TSER=10820023 WS=6
  3   0.000343     10.0.1.3 -> 10.0.1.2     TCP 45086 > 9040 [ACK] Seq=1 Ack=1 Win=5888 Len=0 TSV=10820023 TSER=10874080
  7   0.002267     10.0.1.2 -> 10.0.1.3     TCP 9040 > 45086 [ACK] Seq=1 Ack=13 Win=14528 Len=0 TSV=10874081 TSER=10820024
362830  29.824156     10.0.1.3 -> 10.0.1.2     TCP 45086 > 9040 [FIN, ACK] Seq=13 Ack=350000002 Win=2580480 Len=0 TSV=10827479 TSER=10881482
362831  29.824411     10.0.1.2 -> 10.0.1.3     TCP 9040 > 45086 [ACK] Seq=350000002 Ack=14 Win=14528 Len=0 TSV=10881537 TSER=10827479
================================================================================
