  1   0.000000     10.0.1.3 -> 10.0.1.2     TCP 58591 > 9040 [SYN] Seq=0 Win=5840 Len=0 MSS=1460 TSV=10385730 TSER=0 WS=6
  2   0.000272     10.0.1.2 -> 10.0.1.3     TCP 9040 > 58591 [SYN, ACK] Seq=0 Ack=1 Win=14480 Len=0 MSS=1460 TSV=10439754 TSER=10385730 WS=6
  3   0.000301     10.0.1.3 -> 10.0.1.2     TCP 58591 > 9040 [ACK] Seq=1 Ack=1 Win=5888 Len=0 TSV=10385730 TSER=10439754
  7   0.002270     10.0.1.2 -> 10.0.1.3     TCP 9040 > 58591 [ACK] Seq=1 Ack=13 Win=14528 Len=0 TSV=10439755 TSER=10385731
311037  25.653988     10.0.1.3 -> 10.0.1.2     TCP 58591 > 9040 [FIN, ACK] Seq=13 Ack=300000002 Win=2580480 Len=0 TSV=10392144 TSER=10446113
311038  25.654231     10.0.1.2 -> 10.0.1.3     TCP 9040 > 58591 [ACK] Seq=300000002 Ack=14 Win=14528 Len=0 TSV=10446168 TSER=10392144
================================================================================
IPv4 Conversations
Filter:<No Filter>
                                               |       <-      | |       ->      | |     Total     |
                                               | Frames  Bytes | | Frames  Bytes | | Frames  Bytes |
10.0.1.3             <-> 10.0.1.2              207192 313674680  103846   6853856  311038 320528536
================================================================================
  1   0.000000     10.0.1.3 -> 10.0.1.2     TCP 58593 > 9040 [SYN] Seq=0 Win=5840 Len=0 MSS=1460 TSV=10395232 TSER=0 WS=6
  2   0.000314     10.0.1.2 -> 10.0.1.3     TCP 9040 > 58593 [SYN, ACK] Seq=0 Ack=1 Win=14480 Len=0 MSS=1460 TSV=10449257 TSER=10395232 WS=6
  3   0.000339     10.0.1.3 -> 10.0.1.2     TCP 58593 > 9040 [ACK] Seq=1 Ack=1 Win=5888 Len=0 TSV=10395232 TSER=10449257
  7   0.002211     10.0.1.2 -> 10.0.1.3     TCP 9040 > 58593 [ACK] Seq=1 Ack=13 Win=14528 Len=0 TSV=10449257 TSER=10395232
311098  25.563625     10.0.1.3 -> 10.0.1.2     TCP 58593 > 9040 [FIN, ACK] Seq=13 Ack=300000002 Win=2580480 Len=0 TSV=10401623 TSER=10455593
311099  25.563870     10.0.1.2 -> 10.0.1.3     TCP 9040 > 58593 [ACK] Seq=300000002 Ack=14 Win=14528 Len=0 TSV=10455648 TSER=10401623
================================================================================
IPv4 Conversations
Filter:<No Filter>
                                               |       <-      | |       ->      | |     Total     |
                                               | Frames  Bytes | | Frames  Bytes | | Frames  Bytes |
10.0.1.3             <-> 10.0.1.2              207192 313674680  103907   6857882  311099 320532562
================================================================================
  1   0.000000     10.0.1.3 -> 10.0.1.2     TCP 58595 > 9040 [SYN] Seq=0 Win=5840 Len=0 MSS=1460 TSV=10404695 TSER=0 WS=6
  2   0.000272     10.0.1.2 -> 10.0.1.3     TCP 9040 > 58595 [SYN, ACK] Seq=0 Ack=1 Win=14480 Len=0 MSS=1460 TSV=10458720 TSER=10404695 WS=6
  3   0.000295     10.0.1.3 -> 10.0.1.2     TCP 58595 > 9040 [ACK] Seq=1 Ack=1 Win=5888 Len=0 TSV=10404695 TSER=10458720
  7   0.002228     10.0.1.2 -> 10.0.1.3     TCP 9040 > 58595 [ACK] Seq=1 Ack=13 Win=14528 Len=0 TSV=10458721 TSER=10404695
311086  25.562996     10.0.1.3 -> 10.0.1.2     TCP 58595 > 9040 [FIN, ACK] Seq=13 Ack=300000002 Win=2580480 Len=0 TSV=10411086 TSER=10465057
311087  25.563250     10.0.1.2 -> 10.0.1.3     TCP 9040 > 58595 [ACK] Seq=300000002 Ack=14 Win=14528 Len=0 TSV=10465112 TSER=10411086
================================================================================
IPv4 Conversations
Filter:<No Filter>
                                               |       <-      | |       ->      | |     Total     |
                                               | Frames  Bytes | | Frames  Bytes | | Frames  Bytes |
10.0.1.3             <-> 10.0.1.2              207190 313674548  103897   6857222  311087 320531770
================================================================================
  1   0.000000     10.0.1.3 -> 10.0.1.2     TCP 58597 > 9040 [SYN] Seq=0 Win=5840 Len=0 MSS=1460 TSV=10414171 TSER=0 WS=6
  2   0.000273     10.0.1.2 -> 10.0.1.3     TCP 9040 > 58597 [SYN, ACK] Seq=0 Ack=1 Win=14480 Len=0 MSS=1460 TSV=10468197 TSER=10414171 WS=6
  3   0.000298     10.0.1.3 -> 10.0.1.2     TCP 58597 > 9040 [ACK] Seq=1 Ack=1 Win=5888 Len=0 TSV=10414171 TSER=10468197
  7   0.002273     10.0.1.2 -> 10.0.1.3     TCP 9040 > 58597 [ACK] Seq=1 Ack=13 Win=14528 Len=0 TSV=10468198 TSER=10414172
311177  25.568374     10.0.1.3 -> 10.0.1.2     TCP 58597 > 9040 [FIN, ACK] Seq=13 Ack=300000002 Win=2560064 Len=0 TSV=10420563 TSER=10474535
311178  25.568622     10.0.1.2 -> 10.0.1.3     TCP 9040 > 58597 [ACK] Seq=300000002 Ack=14 Win=14528 Len=0 TSV=10474590 TSER=10420563
================================================================================
IPv4 Conversations
Filter:<No Filter>
                                               |       <-      | |       ->      | |     Total     |
                                               | Frames  Bytes | | Frames  Bytes | | Frames  Bytes |
10.0.1.3             <-> 10.0.1.2              207190 313674548  103988   6863228  311178 320537776
================================================================================
  1   0.000000     10.0.1.3 -> 10.0.1.2     TCP 58599 > 9040 [SYN] Seq=0 Win=5840 Len=0 MSS=1460 TSV=10423639 TSER=0 WS=6
  2   0.000292     10.0.1.2 -> 10.0.1.3     TCP 9040 > 58599 [SYN, ACK] Seq=0 Ack=1 Win=14480 Len=0 MSS=1460 TSV=10477666 TSER=10423639 WS=6
  3   0.000316     10.0.1.3 -> 10.0.1.2     TCP 58599 > 9040 [ACK] Seq=1 Ack=1 Win=5888 Len=0 TSV=10423639 TSER=10477666
  7   0.002233     10.0.1.2 -> 10.0.1.3     TCP 9040 > 58599 [ACK] Seq=1 Ack=13 Win=14528 Len=0 TSV=10477666 TSER=10423639
311063  25.602668     10.0.1.3 -> 10.0.1.2     TCP 58599 > 9040 [FIN, ACK] Seq=13 Ack=300000002 Win=2580480 Len=0 TSV=10430039 TSER=10484012
311064  25.602918     10.0.1.2 -> 10.0.1.3     TCP 9040 > 58599 [ACK] Seq=300000002 Ack=14 Win=14528 Len=0 TSV=10484067 TSER=10430039
================================================================================
IPv4 Conversations
Filter:<No Filter>
                                               |       <-      | |       ->      | |     Total     |
                                               | Frames  Bytes | | Frames  Bytes | | Frames  Bytes |
10.0.1.3             <-> 10.0.1.2              207199 313675142  103865   6855110  311064 320530252
================================================================================
  1   0.000000     10.0.1.3 -> 10.0.1.2     TCP 38438 > 9040 [SYN] Seq=0 Win=5840 Len=0 MSS=1460 TSV=10433105 TSER=0 WS=6
  2   0.000314     10.0.1.2 -> 10.0.1.3     TCP 9040 > 38438 [SYN, ACK] Seq=0 Ack=1 Win=14480 Len=0 MSS=1460 TSV=10487133 TSER=10433105 WS=6
  3   0.000337     10.0.1.3 -> 10.0.1.2     TCP 38438 > 9040 [ACK] Seq=1 Ack=1 Win=5888 Len=0 TSV=10433105 TSER=10487133
  7   0.002400     10.0.1.2 -> 10.0.1.3     TCP 9040 > 38438 [ACK] Seq=1 Ack=13 Win=14528 Len=0 TSV=10487133 TSER=10433106
311178  25.597910     10.0.1.3 -> 10.0.1.2     TCP 38438 > 9040 [FIN, ACK] Seq=13 Ack=300000002 Win=2557184 Len=0 TSV=10439504 TSER=10493478
311179  25.598156     10.0.1.2 -> 10.0.1.3     TCP 9040 > 38438 [ACK] Seq=300000002 Ack=14 Win=14528 Len=0 TSV=10493533 TSER=10439504
================================================================================
IPv4 Conversations
Filter:<No Filter>
                                               |       <-      | |       ->      | |     Total     |
                                               | Frames  Bytes | | Frames  Bytes | | Frames  Bytes |
10.0.1.3             <-> 10.0.1.2              207189 313674482  103990   6863360  311179 320537842
================================================================================
  1   0.000000     10.0.1.3 -> 10.0.1.2     TCP 38440 > 9040 [SYN] Seq=0 Win=5840 Len=0 MSS=1460 TSV=10442593 TSER=0 WS=6
  2   0.000319     10.0.1.2 -> 10.0.1.3     TCP 9040 > 38440 [SYN, ACK] Seq=0 Ack=1 Win=14480 Len=0 MSS=1460 TSV=10496622 TSER=10442593 WS=6
  3   0.000341     10.0.1.3 -> 10.0.1.2     TCP 38440 > 9040 [ACK] Seq=1 Ack=1 Win=5888 Len=0 TSV=10442593 TSER=10496622
  7   0.002246     10.0.1.2 -> 10.0.1.3     TCP 9040 > 38440 [ACK] Seq=1 Ack=13 Win=14528 Len=0 TSV=10496622 TSER=10442593
311100  25.577335     10.0.1.3 -> 10.0.1.2     TCP 38440 > 9040 [FIN, ACK] Seq=13 Ack=300000002 Win=2580480 Len=0 TSV=10448988 TSER=10502961
311101  25.577594     10.0.1.2 -> 10.0.1.3     TCP 9040 > 38440 [ACK] Seq=300000002 Ack=14 Win=14528 Len=0 TSV=10503016 TSER=10448988
================================================================================
IPv4 Conversations
Filter:<No Filter>
                                               |       <-      | |       ->      | |     Total     |
                                               | Frames  Bytes | | Frames  Bytes | | Frames  Bytes |
10.0.1.3             <-> 10.0.1.2              207191 313674614  103910   6858080  311101 320532694
================================================================================
  1   0.000000     10.0.1.3 -> 10.0.1.2     TCP 38444 > 9040 [SYN] Seq=0 Win=5840 Len=0 MSS=1460 TSV=10452081 TSER=0 WS=6
  2   0.000296     10.0.1.2 -> 10.0.1.3     TCP 9040 > 38444 [SYN, ACK] Seq=0 Ack=1 Win=14480 Len=0 MSS=1460 TSV=10506110 TSER=10452081 WS=6
  3   0.000317     10.0.1.3 -> 10.0.1.2     TCP 38444 > 9040 [ACK] Seq=1 Ack=1 Win=5888 Len=0 TSV=10452081 TSER=10506110
  7   0.002261     10.0.1.2 -> 10.0.1.3     TCP 9040 > 38444 [ACK] Seq=1 Ack=13 Win=14528 Len=0 TSV=10506111 TSER=10452082
310932  25.564653     10.0.1.3 -> 10.0.1.2     TCP 38444 > 9040 [FIN, ACK] Seq=13 Ack=300000002 Win=2580480 Len=0 TSV=10458472 TSER=10512447
310933  25.564899     10.0.1.2 -> 10.0.1.3     TCP 9040 > 38444 [ACK] Seq=300000002 Ack=14 Win=14528 Len=0 TSV=10512502 TSER=10458472
================================================================================
IPv4 Conversations
Filter:<No Filter>
                                               |       <-      | |       ->      | |     Total     |
                                               | Frames  Bytes | | Frames  Bytes | | Frames  Bytes |
10.0.1.3             <-> 10.0.1.2              207194 313674812  103739   6846794  310933 320521606
================================================================================
  1   0.000000     10.0.1.3 -> 10.0.1.2     TCP 38446 > 9040 [SYN] Seq=0 Win=5840 Len=0 MSS=1460 TSV=10461566 TSER=0 WS=6
  2   0.000300     10.0.1.2 -> 10.0.1.3     TCP 9040 > 38446 [SYN, ACK] Seq=0 Ack=1 Win=14480 Len=0 MSS=1460 TSV=10515596 TSER=10461566 WS=6
  3   0.000333     10.0.1.3 -> 10.0.1.2     TCP 38446 > 9040 [ACK] Seq=1 Ack=1 Win=5888 Len=0 TSV=10461567 TSER=10515596
  7   0.003705     10.0.1.2 -> 10.0.1.3     TCP 9040 > 38446 [ACK] Seq=1 Ack=13 Win=14528 Len=0 TSV=10515597 TSER=10461567
311070  25.564752     10.0.1.3 -> 10.0.1.2     TCP 38446 > 9040 [FIN, ACK] Seq=13 Ack=300000002 Win=2580480 Len=0 TSV=10467958 TSER=10521933
311071  25.565003     10.0.1.2 -> 10.0.1.3     TCP 9040 > 38446 [ACK] Seq=300000002 Ack=14 Win=14528 Len=0 TSV=10521988 TSER=10467958
================================================================================
IPv4 Conversations
Filter:<No Filter>
                                               |       <-      | |       ->      | |     Total     |
                                               | Frames  Bytes | | Frames  Bytes | | Frames  Bytes |
10.0.1.3             <-> 10.0.1.2              207193 313674746  103878   6855968  311071 320530714
================================================================================
  1   0.000000     10.0.1.3 -> 10.0.1.2     TCP 38448 > 9040 [SYN] Seq=0 Win=5840 Len=0 MSS=1460 TSV=10471058 TSER=0 WS=6
  2   0.000293     10.0.1.2 -> 10.0.1.3     TCP 9040 > 38448 [SYN, ACK] Seq=0 Ack=1 Win=14480 Len=0 MSS=1460 TSV=10525088 TSER=10471058 WS=6
  3   0.000316     10.0.1.3 -> 10.0.1.2     TCP 38448 > 9040 [ACK] Seq=1 Ack=1 Win=5888 Len=0 TSV=10471058 TSER=10525088
  7   0.002300     10.0.1.2 -> 10.0.1.3     TCP 9040 > 38448 [ACK] Seq=1 Ack=13 Win=14528 Len=0 TSV=10525089 TSER=10471058
310990  25.851403     10.0.1.3 -> 10.0.1.2     TCP 38448 > 9040 [FIN, ACK] Seq=13 Ack=300000002 Win=2580480 Len=0 TSV=10477521 TSER=10531497
310991  25.851655     10.0.1.2 -> 10.0.1.3     TCP 9040 > 38448 [ACK] Seq=300000002 Ack=14 Win=14528 Len=0 TSV=10531552 TSER=10477521
================================================================================
IPv4 Conversations
Filter:<No Filter>
                                               |       <-      | |       ->      | |     Total     |
                                               | Frames  Bytes | | Frames  Bytes | | Frames  Bytes |
10.0.1.3             <-> 10.0.1.2              207206 313675604  103785   6849830  310991 320525434
================================================================================
  1   0.000000     10.0.1.3 -> 10.0.1.2     TCP 38450 > 9040 [SYN] Seq=0 Win=5840 Len=0 MSS=1460 TSV=10480606 TSER=0 WS=6
  2   0.000268     10.0.1.2 -> 10.0.1.3     TCP 9040 > 38450 [SYN, ACK] Seq=0 Ack=1 Win=14480 Len=0 MSS=1460 TSV=10534637 TSER=10480606 WS=6
  3   0.000293     10.0.1.3 -> 10.0.1.2     TCP 38450 > 9040 [ACK] Seq=1 Ack=1 Win=5888 Len=0 TSV=10480606 TSER=10534637
  7   0.002290     10.0.1.2 -> 10.0.1.3     TCP 9040 > 38450 [ACK] Seq=1 Ack=13 Win=14528 Len=0 TSV=10534638 TSER=10480606
311106  25.579282     10.0.1.3 -> 10.0.1.2     TCP 38450 > 9040 [FIN, ACK] Seq=13 Ack=300000002 Win=2580480 Len=0 TSV=10487001 TSER=10540977
311107  25.579559     10.0.1.2 -> 10.0.1.3     TCP 9040 > 38450 [ACK] Seq=300000002 Ack=14 Win=14528 Len=0 TSV=10541032 TSER=10487001
================================================================================
IPv4 Conversations
Filter:<No Filter>
                                               |       <-      | |       ->      | |     Total     |
                                               | Frames  Bytes | | Frames  Bytes | | Frames  Bytes |
10.0.1.3             <-> 10.0.1.2              207194 313674812  103913   6858278  311107 320533090
================================================================================
  1   0.000000     10.0.1.3 -> 10.0.1.2     TCP 38452 > 9040 [SYN] Seq=0 Win=5840 Len=0 MSS=1460 TSV=10490098 TSER=0 WS=6
  2   0.000338     10.0.1.2 -> 10.0.1.3     TCP 9040 > 38452 [SYN, ACK] Seq=0 Ack=1 Win=14480 Len=0 MSS=1460 TSV=10544130 TSER=10490098 WS=6
  3   0.000361     10.0.1.3 -> 10.0.1.2     TCP 38452 > 9040 [ACK] Seq=1 Ack=1 Win=5888 Len=0 TSV=10490099 TSER=10544130
  7   0.002250     10.0.1.2 -> 10.0.1.3     TCP 9040 > 38452 [ACK] Seq=1 Ack=13 Win=14528 Len=0 TSV=10544131 TSER=10490099
311292  28.169161     10.0.1.3 -> 10.0.1.2     TCP 38452 > 9040 [FIN, ACK] Seq=13 Ack=300000002 Win=2580480 Len=0 TSV=10497141 TSER=10551118
311293  28.169409     10.0.1.2 -> 10.0.1.3     TCP 9040 > 38452 [ACK] Seq=300000002 Ack=14 Win=14528 Len=0 TSV=10551173 TSER=10497141
================================================================================
IPv4 Conversations
Filter:<No Filter>
                                               |       <-      | |       ->      | |     Total     |
                                               | Frames  Bytes | | Frames  Bytes | | Frames  Bytes |
10.0.1.3             <-> 10.0.1.2              207291 313681214  104002   6864152  311293 320545366
================================================================================
  1   0.000000     10.0.1.3 -> 10.0.1.2     TCP 38454 > 9040 [SYN] Seq=0 Win=5840 Len=0 MSS=1460 TSV=10500245 TSER=0 WS=6
  2   0.000363     10.0.1.2 -> 10.0.1.3     TCP 9040 > 38454 [SYN, ACK] Seq=0 Ack=1 Win=14480 Len=0 MSS=1460 TSV=10554277 TSER=10500245 WS=6
  3   0.000388     10.0.1.3 -> 10.0.1.2     TCP 38454 > 9040 [ACK] Seq=1 Ack=1 Win=5888 Len=0 TSV=10500245 TSER=10554277
  7   0.002355     10.0.1.2 -> 10.0.1.3     TCP 9040 > 38454 [ACK] Seq=1 Ack=13 Win=14528 Len=0 TSV=10554278 TSER=10500245
311173  26.964074     10.0.1.3 -> 10.0.1.2     TCP 38454 > 9040 [FIN, ACK] Seq=13 Ack=300000002 Win=2580480 Len=0 TSV=10506986 TSER=10560964
311174  26.964325     10.0.1.2 -> 10.0.1.3     TCP 9040 > 38454 [ACK] Seq=300000002 Ack=14 Win=14528 Len=0 TSV=10561019 TSER=10506986
================================================================================
IPv4 Conversations
Filter:<No Filter>
                                               |       <-      | |       ->      | |     Total     |
                                               | Frames  Bytes | | Frames  Bytes | | Frames  Bytes |
10.0.1.3             <-> 10.0.1.2              207236 313677584  103938   6859928  311174 320537512
================================================================================
  1   0.000000     10.0.1.3 -> 10.0.1.2     TCP 54073 > 9040 [SYN] Seq=0 Win=5840 Len=0 MSS=1460 TSV=10510099 TSER=0 WS=6
  2   0.000292     10.0.1.2 -> 10.0.1.3     TCP 9040 > 54073 [SYN, ACK] Seq=0 Ack=1 Win=14480 Len=0 MSS=1460 TSV=10564133 TSER=10510099 WS=6
  3   0.000315     10.0.1.3 -> 10.0.1.2     TCP 54073 > 9040 [ACK] Seq=1 Ack=1 Win=5888 Len=0 TSV=10510099 TSER=10564133
  7   0.002202     10.0.1.2 -> 10.0.1.3     TCP 9040 > 54073 [ACK] Seq=1 Ack=13 Win=14528 Len=0 TSV=10564133 TSER=10510100
311121  26.125621     10.0.1.3 -> 10.0.1.2     TCP 54073 > 9040 [FIN, ACK] Seq=13 Ack=300000002 Win=2580480 Len=0 TSV=10516631 TSER=10570610
311122  26.125860     10.0.1.2 -> 10.0.1.3     TCP 9040 > 54073 [ACK] Seq=300000002 Ack=14 Win=14528 Len=0 TSV=10570665 TSER=10516631
================================================================================
IPv4 Conversations
Filter:<No Filter>
                                               |       <-      | |       ->      | |     Total     |
                                               | Frames  Bytes | | Frames  Bytes | | Frames  Bytes |
10.0.1.3             <-> 10.0.1.2              207210 313675868  103912   6858212  311122 320534080
================================================================================
  1   0.000000     10.0.1.3 -> 10.0.1.2     TCP 54075 > 9040 [SYN] Seq=0 Win=5840 Len=0 MSS=1460 TSV=10519727 TSER=0 WS=6
  2   0.000298     10.0.1.2 -> 10.0.1.3     TCP 9040 > 54075 [SYN, ACK] Seq=0 Ack=1 Win=14480 Len=0 MSS=1460 TSV=10573761 TSER=10519727 WS=6
  3   0.000321     10.0.1.3 -> 10.0.1.2     TCP 54075 > 9040 [ACK] Seq=1 Ack=1 Win=5888 Len=0 TSV=10519727 TSER=10573761
  7   0.002239     10.0.1.2 -> 10.0.1.3     TCP 9040 > 54075 [ACK] Seq=1 Ack=13 Win=14528 Len=0 TSV=10573762 TSER=10519728
311025  25.576083     10.0.1.3 -> 10.0.1.2     TCP 54075 > 9040 [FIN, ACK] Seq=13 Ack=300000002 Win=2580480 Len=0 TSV=10526121 TSER=10580101
311026  25.576337     10.0.1.2 -> 10.0.1.3     TCP 9040 > 54075 [ACK] Seq=300000002 Ack=14 Win=14528 Len=0 TSV=10580156 TSER=10526121
================================================================================
IPv4 Conversations
Filter:<No Filter>
                                               |       <-      | |       ->      | |     Total     |
                                               | Frames  Bytes | | Frames  Bytes | | Frames  Bytes |
10.0.1.3             <-> 10.0.1.2              207193 313674746  103833   6852998  311026 320527744
================================================================================
  1   0.000000     10.0.1.3 -> 10.0.1.2     TCP 54079 > 9040 [SYN] Seq=0 Win=5840 Len=0 MSS=1460 TSV=10529229 TSER=0 WS=6
  2   0.000275     10.0.1.2 -> 10.0.1.3     TCP 9040 > 54079 [SYN, ACK] Seq=0 Ack=1 Win=14480 Len=0 MSS=1460 TSV=10583264 TSER=10529229 WS=6
  3   0.000306     10.0.1.3 -> 10.0.1.2     TCP 54079 > 9040 [ACK] Seq=1 Ack=1 Win=5888 Len=0 TSV=10529229 TSER=10583264
  7   0.003396     10.0.1.2 -> 10.0.1.3     TCP 9040 > 54079 [ACK] Seq=1 Ack=13 Win=14528 Len=0 TSV=10583265 TSER=10529230
311034  26.495066     10.0.1.3 -> 10.0.1.2     TCP 54079 > 9040 [FIN, ACK] Seq=13 Ack=300000002 Win=2580480 Len=0 TSV=10535853 TSER=10589833
311035  26.495342     10.0.1.2 -> 10.0.1.3     TCP 9040 > 54079 [ACK] Seq=300000002 Ack=14 Win=14528 Len=0 TSV=10589888 TSER=10535853
================================================================================
IPv4 Conversations
Filter:<No Filter>
                                               |       <-      | |       ->      | |     Total     |
                                               | Frames  Bytes | | Frames  Bytes | | Frames  Bytes |
10.0.1.3             <-> 10.0.1.2              207227 313676990  103808   6851348  311035 320528338
================================================================================
  1   0.000000     10.0.1.3 -> 10.0.1.2     TCP 54081 > 9040 [SYN] Seq=0 Win=5840 Len=0 MSS=1460 TSV=10538947 TSER=0 WS=6
  2   0.000582     10.0.1.2 -> 10.0.1.3     TCP 9040 > 54081 [SYN, ACK] Seq=0 Ack=1 Win=14480 Len=0 MSS=1460 TSV=10592983 TSER=10538947 WS=6
  3   0.000607     10.0.1.3 -> 10.0.1.2     TCP 54081 > 9040 [ACK] Seq=1 Ack=1 Win=5888 Len=0 TSV=10538947 TSER=10592983
  7   0.002570     10.0.1.2 -> 10.0.1.3     TCP 9040 > 54081 [ACK] Seq=1 Ack=13 Win=14528 Len=0 TSV=10592983 TSER=10538948
310980  25.580540     10.0.1.3 -> 10.0.1.2     TCP 54081 > 9040 [FIN, ACK] Seq=13 Ack=300000002 Win=2580480 Len=0 TSV=10545342 TSER=10599323
310981  25.580790     10.0.1.2 -> 10.0.1.3     TCP 9040 > 54081 [ACK] Seq=300000002 Ack=14 Win=14528 Len=0 TSV=10599378 TSER=10545342
================================================================================
IPv4 Conversations
Filter:<No Filter>
                                               |       <-      | |       ->      | |     Total     |
                                               | Frames  Bytes | | Frames  Bytes | | Frames  Bytes |
10.0.1.3             <-> 10.0.1.2              207193 313674746  103788   6850028  310981 320524774
================================================================================
  1   0.000000     10.0.1.3 -> 10.0.1.2     TCP 54083 > 9040 [SYN] Seq=0 Win=5840 Len=0 MSS=1460 TSV=10548424 TSER=0 WS=6
  2   0.000284     10.0.1.2 -> 10.0.1.3     TCP 9040 > 54083 [SYN, ACK] Seq=0 Ack=1 Win=14480 Len=0 MSS=1460 TSV=10602461 TSER=10548424 WS=6
  3   0.000309     10.0.1.3 -> 10.0.1.2     TCP 54083 > 9040 [ACK] Seq=1 Ack=1 Win=5888 Len=0 TSV=10548424 TSER=10602461
  7   0.002235     10.0.1.2 -> 10.0.1.3     TCP 9040 > 54083 [ACK] Seq=1 Ack=13 Win=14528 Len=0 TSV=10602461 TSER=10548425
311007  25.715339     10.0.1.3 -> 10.0.1.2     TCP 54083 > 9040 [FIN, ACK] Seq=13 Ack=300000002 Win=2580480 Len=0 TSV=10554853 TSER=10608835
311008  25.715589     10.0.1.2 -> 10.0.1.3     TCP 9040 > 54083 [ACK] Seq=300000002 Ack=14 Win=14528 Len=0 TSV=10608890 TSER=10554853
================================================================================
IPv4 Conversations
Filter:<No Filter>
                                               |       <-      | |       ->      | |     Total     |
                                               | Frames  Bytes | | Frames  Bytes | | Frames  Bytes |
10.0.1.3             <-> 10.0.1.2              207196 313674944  103812   6851612  311008 320526556
================================================================================
  1   0.000000     10.0.1.3 -> 10.0.1.2     TCP 54085 > 9040 [SYN] Seq=0 Win=5840 Len=0 MSS=1460 TSV=10557944 TSER=0 WS=6
  2   0.000368     10.0.1.2 -> 10.0.1.3     TCP 9040 > 54085 [SYN, ACK] Seq=0 Ack=1 Win=14480 Len=0 MSS=1460 TSV=10611981 TSER=10557944 WS=6
  3   0.000390     10.0.1.3 -> 10.0.1.2     TCP 54085 > 9040 [ACK] Seq=1 Ack=1 Win=5888 Len=0 TSV=10557944 TSER=10611981
  7   0.002281     10.0.1.2 -> 10.0.1.3     TCP 9040 > 54085 [ACK] Seq=1 Ack=13 Win=14528 Len=0 TSV=10611982 TSER=10557945
311042  25.567077     10.0.1.3 -> 10.0.1.2     TCP 54085 > 9040 [FIN, ACK] Seq=13 Ack=300000002 Win=2580480 Len=0 TSV=10564336 TSER=10618319
311043  25.567330     10.0.1.2 -> 10.0.1.3     TCP 9040 > 54085 [ACK] Seq=300000002 Ack=14 Win=14528 Len=0 TSV=10618374 TSER=10564336
================================================================================
IPv4 Conversations
Filter:<No Filter>
                                               |       <-      | |       ->      | |     Total     |
                                               | Frames  Bytes | | Frames  Bytes | | Frames  Bytes |
10.0.1.3             <-> 10.0.1.2              207193 313674746  103850   6854120  311043 320528866
================================================================================
  1   0.000000     10.0.1.3 -> 10.0.1.2     TCP 54087 > 9040 [SYN] Seq=0 Win=5840 Len=0 MSS=1460 TSV=10567405 TSER=0 WS=6
  2   0.000271     10.0.1.2 -> 10.0.1.3     TCP 9040 > 54087 [SYN, ACK] Seq=0 Ack=1 Win=14480 Len=0 MSS=1460 TSV=10621443 TSER=10567405 WS=6
  3   0.000294     10.0.1.3 -> 10.0.1.2     TCP 54087 > 9040 [ACK] Seq=1 Ack=1 Win=5888 Len=0 TSV=10567405 TSER=10621443
  7   0.002224     10.0.1.2 -> 10.0.1.3     TCP 9040 > 54087 [ACK] Seq=1 Ack=13 Win=14528 Len=0 TSV=10621443 TSER=10567406
310920  25.567804     10.0.1.3 -> 10.0.1.2     TCP 54087 > 9040 [FIN, ACK] Seq=13 Ack=300000002 Win=2580480 Len=0 TSV=10573797 TSER=10627780
310921  25.568018     10.0.1.2 -> 10.0.1.3     TCP 9040 > 54087 [ACK] Seq=300000002 Ack=14 Win=14528 Len=0 TSV=10627835 TSER=10573797
================================================================================
IPv4 Conversations
Filter:<No Filter>
                                               |       <-      | |       ->      | |     Total     |
                                               | Frames  Bytes | | Frames  Bytes | | Frames  Bytes |
10.0.1.3             <-> 10.0.1.2              207194 313674812  103727   6846002  310921 320520814
================================================================================
