  1   0.000000     10.0.1.3 -> 10.0.1.2     TCP 51384 > 9040 [SYN] Seq=0 Win=5840 Len=0 MSS=1460 TSV=1382930 TSER=0 WS=6
  2   0.000307     10.0.1.2 -> 10.0.1.3     TCP 9040 > 51384 [SYN, ACK] Seq=0 Ack=1 Win=14480 Len=0 MSS=1460 TSV=1790618 TSER=1382930 WS=6
  3   0.000334     10.0.1.3 -> 10.0.1.2     TCP 51384 > 9040 [ACK] Seq=1 Ack=1 Win=5888 Len=0 TSV=1382932 TSER=1790618
  7   0.002565     10.0.1.2 -> 10.0.1.3     TCP 9040 > 51384 [ACK] Seq=1 Ack=13 Win=14528 Len=0 TSV=1790618 TSER=1382932
342462  29.922716     10.0.1.3 -> 10.0.1.2     TCP 51384 > 9040 [FIN, ACK] Seq=13 Ack=350000002 Win=2580480 Len=0 TSV=1390412 TSER=1798044
342463  29.922964     10.0.1.2 -> 10.0.1.3     TCP 9040 > 51384 [ACK] Seq=350000002 Ack=14 Win=14528 Len=0 TSV=1798099 TSER=1390412
  1   0.000000     10.0.1.3 -> 10.0.1.2     TCP 51386 > 9040 [SYN] Seq=0 Win=5840 Len=0 MSS=1460 TSV=1396299 TSER=0 WS=6
  2   0.000307     10.0.1.2 -> 10.0.1.3     TCP 9040 > 51386 [SYN, ACK] Seq=0 Ack=1 Win=14480 Len=0 MSS=1460 TSV=1803986 TSER=1396299 WS=6
  3   0.000330     10.0.1.3 -> 10.0.1.2     TCP 51386 > 9040 [ACK] Seq=1 Ack=1 Win=5888 Len=0 TSV=1396299 TSER=1803986
  7   0.002302     10.0.1.2 -> 10.0.1.3     TCP 9040 > 51386 [ACK] Seq=1 Ack=13 Win=14528 Len=0 TSV=1803986 TSER=1396299
362123  29.827334     10.0.1.3 -> 10.0.1.2     TCP 51386 > 9040 [FIN, ACK] Seq=13 Ack=350000002 Win=2565888 Len=0 TSV=1403756 TSER=1811388
362124  29.827582     10.0.1.2 -> 10.0.1.3     TCP 9040 > 51386 [ACK] Seq=350000002 Ack=14 Win=14528 Len=0 TSV=1811443 TSER=1403756
  1   0.000000     10.0.1.3 -> 10.0.1.2     TCP 51388 > 9040 [SYN] Seq=0 Win=5840 Len=0 MSS=1460 TSV=1409722 TSER=0 WS=6
  2   0.000318     10.0.1.2 -> 10.0.1.3     TCP 9040 > 51388 [SYN, ACK] Seq=0 Ack=1 Win=14480 Len=0 MSS=1460 TSV=1817410 TSER=1409722 WS=6
  3   0.000344     10.0.1.3 -> 10.0.1.2     TCP 51388 > 9040 [ACK] Seq=1 Ack=1 Win=5888 Len=0 TSV=1409722 TSER=1817410
  7   0.002157     10.0.1.2 -> 10.0.1.3     TCP 9040 > 51388 [ACK] Seq=1 Ack=13 Win=14528 Len=0 TSV=1817411 TSER=1409723
332346  29.826040     10.0.1.3 -> 10.0.1.2     TCP 51388 > 9040 [FIN, ACK] Seq=13 Ack=350000002 Win=2580480 Len=0 TSV=1417179 TSER=1824812
332347  29.826284     10.0.1.2 -> 10.0.1.3     TCP 9040 > 51388 [ACK] Seq=350000002 Ack=14 Win=14528 Len=0 TSV=1824867 TSER=1417179
  1   0.000000     10.0.1.3 -> 10.0.1.2     TCP 46021 > 9040 [SYN] Seq=0 Win=5840 Len=0 MSS=1460 TSV=1448523 TSER=0 WS=6
  2   0.000328     10.0.1.2 -> 10.0.1.3     TCP 9040 > 46021 [SYN, ACK] Seq=0 Ack=1 Win=14480 Len=0 MSS=1460 TSV=1856214 TSER=1448523 WS=6
  3   0.000360     10.0.1.3 -> 10.0.1.2     TCP 46021 > 9040 [ACK] Seq=1 Ack=1 Win=5888 Len=0 TSV=1448523 TSER=1856214
  7   0.003010     10.0.1.2 -> 10.0.1.3     TCP 9040 > 46021 [ACK] Seq=1 Ack=13 Win=14528 Len=0 TSV=1856215 TSER=1448524
347020  29.819537     10.0.1.3 -> 10.0.1.2     TCP 46021 > 9040 [FIN, ACK] Seq=13 Ack=350000002 Win=2580480 Len=0 TSV=1455978 TSER=1863614
347021  29.819789     10.0.1.2 -> 10.0.1.3     TCP 9040 > 46021 [ACK] Seq=350000002 Ack=14 Win=14528 Len=0 TSV=1863669 TSER=1455978
  1   0.000000     10.0.1.3 -> 10.0.1.2     TCP 46023 > 9040 [SYN] Seq=0 Win=5840 Len=0 MSS=1460 TSV=1461665 TSER=0 WS=6
  2   0.000299     10.0.1.2 -> 10.0.1.3     TCP 9040 > 46023 [SYN, ACK] Seq=0 Ack=1 Win=14480 Len=0 MSS=1460 TSV=1869357 TSER=1461665 WS=6
  3   0.000333     10.0.1.3 -> 10.0.1.2     TCP 46023 > 9040 [ACK] Seq=1 Ack=1 Win=5888 Len=0 TSV=1461666 TSER=1869357
  7   0.002702     10.0.1.2 -> 10.0.1.3     TCP 9040 > 46023 [ACK] Seq=1 Ack=13 Win=14528 Len=0 TSV=1869358 TSER=1461666
349077  29.821284     10.0.1.3 -> 10.0.1.2     TCP 46023 > 9040 [FIN, ACK] Seq=13 Ack=350000002 Win=2580480 Len=0 TSV=1469121 TSER=1876758
349078  29.821540     10.0.1.2 -> 10.0.1.3     TCP 9040 > 46023 [ACK] Seq=350000002 Ack=14 Win=14528 Len=0 TSV=1876813 TSER=1469121
  1   0.000000     10.0.1.3 -> 10.0.1.2     TCP 46025 > 9040 [SYN] Seq=0 Win=5840 Len=0 MSS=1460 TSV=1475056 TSER=0 WS=6
  2   0.000272     10.0.1.2 -> 10.0.1.3     TCP 9040 > 46025 [SYN, ACK] Seq=0 Ack=1 Win=14480 Len=0 MSS=1460 TSV=1882749 TSER=1475056 WS=6
  3   0.000294     10.0.1.3 -> 10.0.1.2     TCP 46025 > 9040 [ACK] Seq=1 Ack=1 Win=5888 Len=0 TSV=1475056 TSER=1882749
  7   0.002225     10.0.1.2 -> 10.0.1.3     TCP 9040 > 46025 [ACK] Seq=1 Ack=13 Win=14528 Len=0 TSV=1882750 TSER=1475056
361765  29.826660     10.0.1.3 -> 10.0.1.2     TCP 46025 > 9040 [FIN, ACK] Seq=13 Ack=350000002 Win=2580480 Len=0 TSV=1482513 TSER=1890151
361766  29.826914     10.0.1.2 -> 10.0.1.3     TCP 9040 > 46025 [ACK] Seq=350000002 Ack=14 Win=14528 Len=0 TSV=1890206 TSER=1482513
  1   0.000000     10.0.1.3 -> 10.0.1.2     TCP 46027 > 9040 [SYN] Seq=0 Win=5840 Len=0 MSS=1460 TSV=1488679 TSER=0 WS=6
  2   0.000304     10.0.1.2 -> 10.0.1.3     TCP 9040 > 46027 [SYN, ACK] Seq=0 Ack=1 Win=14480 Len=0 MSS=1460 TSV=1896373 TSER=1488679 WS=6
  3   0.000327     10.0.1.3 -> 10.0.1.2     TCP 46027 > 9040 [ACK] Seq=1 Ack=1 Win=5888 Len=0 TSV=1488679 TSER=1896373
  7   0.002299     10.0.1.2 -> 10.0.1.3     TCP 9040 > 46027 [ACK] Seq=1 Ack=13 Win=14528 Len=0 TSV=1896373 TSER=1488679
330548  29.822009     10.0.1.3 -> 10.0.1.2     TCP 46027 > 9040 [FIN, ACK] Seq=13 Ack=350000002 Win=2580480 Len=0 TSV=1496134 TSER=1903774
330549  29.822265     10.0.1.2 -> 10.0.1.3     TCP 9040 > 46027 [ACK] Seq=350000002 Ack=14 Win=14528 Len=0 TSV=1903829 TSER=1496134
  1   0.000000     10.0.1.3 -> 10.0.1.2     TCP 33964 > 9040 [SYN] Seq=0 Win=5840 Len=0 MSS=1460 TSV=1501878 TSER=0 WS=6
  2   0.000297     10.0.1.2 -> 10.0.1.3     TCP 9040 > 33964 [SYN, ACK] Seq=0 Ack=1 Win=14480 Len=0 MSS=1460 TSV=1909574 TSER=1501878 WS=6
  3   0.000322     10.0.1.3 -> 10.0.1.2     TCP 33964 > 9040 [ACK] Seq=1 Ack=1 Win=5888 Len=0 TSV=1501879 TSER=1909574
  7   0.002185     10.0.1.2 -> 10.0.1.3     TCP 9040 > 33964 [ACK] Seq=1 Ack=13 Win=14528 Len=0 TSV=1909574 TSER=1501879
345906  29.824026     10.0.1.3 -> 10.0.1.2     TCP 33964 > 9040 [FIN, ACK] Seq=13 Ack=350000002 Win=2580480 Len=0 TSV=1509335 TSER=1916975
345907  29.824272     10.0.1.2 -> 10.0.1.3     TCP 9040 > 33964 [ACK] Seq=350000002 Ack=14 Win=14528 Len=0 TSV=1917030 TSER=1509335
  1   0.000000     10.0.1.3 -> 10.0.1.2     TCP 33966 > 9040 [SYN] Seq=0 Win=5840 Len=0 MSS=1460 TSV=1515266 TSER=0 WS=6
  2   0.000305     10.0.1.2 -> 10.0.1.3     TCP 9040 > 33966 [SYN, ACK] Seq=0 Ack=1 Win=14480 Len=0 MSS=1460 TSV=1922962 TSER=1515266 WS=6
  3   0.000328     10.0.1.3 -> 10.0.1.2     TCP 33966 > 9040 [ACK] Seq=1 Ack=1 Win=5888 Len=0 TSV=1515266 TSER=1922962
  7   0.002296     10.0.1.2 -> 10.0.1.3     TCP 9040 > 33966 [ACK] Seq=1 Ack=13 Win=14528 Len=0 TSV=1922962 TSER=1515266
362096  29.822764     10.0.1.3 -> 10.0.1.2     TCP 33966 > 9040 [FIN, ACK] Seq=13 Ack=350000002 Win=2580480 Len=0 TSV=1522721 TSER=1930363
362097  29.823015     10.0.1.2 -> 10.0.1.3     TCP 9040 > 33966 [ACK] Seq=350000002 Ack=14 Win=14528 Len=0 TSV=1930418 TSER=1522721
  1   0.000000     10.0.1.3 -> 10.0.1.2     TCP 33968 > 9040 [SYN] Seq=0 Win=5840 Len=0 MSS=1460 TSV=1528786 TSER=0 WS=6
  2   0.000286     10.0.1.2 -> 10.0.1.3     TCP 9040 > 33968 [SYN, ACK] Seq=0 Ack=1 Win=14480 Len=0 MSS=1460 TSV=1936483 TSER=1528786 WS=6
  3   0.000309     10.0.1.3 -> 10.0.1.2     TCP 33968 > 9040 [ACK] Seq=1 Ack=1 Win=5888 Len=0 TSV=1528786 TSER=1936483
  7   0.002156     10.0.1.2 -> 10.0.1.3     TCP 9040 > 33968 [ACK] Seq=1 Ack=13 Win=14528 Len=0 TSV=1936483 TSER=1528786
349043  29.824080     10.0.1.3 -> 10.0.1.2     TCP 33968 > 9040 [FIN, ACK] Seq=13 Ack=350000002 Win=2580480 Len=0 TSV=1536242 TSER=1943884
349044  29.824317     10.0.1.2 -> 10.0.1.3     TCP 9040 > 33968 [ACK] Seq=350000002 Ack=14 Win=14528 Len=0 TSV=1943939 TSER=1536242
  1   0.000000     10.0.1.3 -> 10.0.1.2     TCP 33970 > 9040 [SYN] Seq=0 Win=5840 Len=0 MSS=1460 TSV=1542267 TSER=0 WS=6
  2   0.000327     10.0.1.2 -> 10.0.1.3     TCP 9040 > 33970 [SYN, ACK] Seq=0 Ack=1 Win=14480 Len=0 MSS=1460 TSV=1949965 TSER=1542267 WS=6
  3   0.000360     10.0.1.3 -> 10.0.1.2     TCP 33970 > 9040 [ACK] Seq=1 Ack=1 Win=5888 Len=0 TSV=1542267 TSER=1949965
  7   0.002259     10.0.1.2 -> 10.0.1.3     TCP 9040 > 33970 [ACK] Seq=1 Ack=13 Win=14528 Len=0 TSV=1949965 TSER=1542267
331110  29.823524     10.0.1.3 -> 10.0.1.2     TCP 33970 > 9040 [FIN, ACK] Seq=13 Ack=350000002 Win=2580480 Len=0 TSV=1549723 TSER=1957366
331111  29.823774     10.0.1.2 -> 10.0.1.3     TCP 9040 > 33970 [ACK] Seq=350000002 Ack=14 Win=14528 Len=0 TSV=1957421 TSER=1549723
  1   0.000000     10.0.1.3 -> 10.0.1.2     TCP 33973 > 9040 [SYN] Seq=0 Win=5840 Len=0 MSS=1460 TSV=1555509 TSER=0 WS=6
  2   0.000371     10.0.1.2 -> 10.0.1.3     TCP 9040 > 33973 [SYN, ACK] Seq=0 Ack=1 Win=14480 Len=0 MSS=1460 TSV=1963208 TSER=1555509 WS=6
  3   0.000394     10.0.1.3 -> 10.0.1.2     TCP 33973 > 9040 [ACK] Seq=1 Ack=1 Win=5888 Len=0 TSV=1555509 TSER=1963208
  7   0.002352     10.0.1.2 -> 10.0.1.3     TCP 9040 > 33973 [ACK] Seq=1 Ack=13 Win=14528 Len=0 TSV=1963209 TSER=1555510
361082  29.823980     10.0.1.3 -> 10.0.1.2     TCP 33973 > 9040 [FIN, ACK] Seq=13 Ack=350000002 Win=2580480 Len=0 TSV=1562965 TSER=1970610
361083  29.824223     10.0.1.2 -> 10.0.1.3     TCP 9040 > 33973 [ACK] Seq=350000002 Ack=14 Win=14528 Len=0 TSV=1970665 TSER=1562965
  1   0.000000     10.0.1.3 -> 10.0.1.2     TCP 33976 > 9040 [SYN] Seq=0 Win=5840 Len=0 MSS=1460 TSV=1568928 TSER=0 WS=6
  2   0.000320     10.0.1.2 -> 10.0.1.3     TCP 9040 > 33976 [SYN, ACK] Seq=0 Ack=1 Win=14480 Len=0 MSS=1460 TSV=1976628 TSER=1568928 WS=6
  3   0.000344     10.0.1.3 -> 10.0.1.2     TCP 33976 > 9040 [ACK] Seq=1 Ack=1 Win=5888 Len=0 TSV=1568929 TSER=1976628
  7   0.002305     10.0.1.2 -> 10.0.1.3     TCP 9040 > 33976 [ACK] Seq=1 Ack=13 Win=14528 Len=0 TSV=1976629 TSER=1568929
362029  29.820830     10.0.1.3 -> 10.0.1.2     TCP 33976 > 9040 [FIN, ACK] Seq=13 Ack=350000002 Win=2580480 Len=0 TSV=1576384 TSER=1984029
362030  29.821077     10.0.1.2 -> 10.0.1.3     TCP 9040 > 33976 [ACK] Seq=350000002 Ack=14 Win=14528 Len=0 TSV=1984084 TSER=1576384
  1   0.000000     10.0.1.3 -> 10.0.1.2     TCP 48762 > 9040 [SYN] Seq=0 Win=5840 Len=0 MSS=1460 TSV=1582528 TSER=0 WS=6
  2   0.000302     10.0.1.2 -> 10.0.1.3     TCP 9040 > 48762 [SYN, ACK] Seq=0 Ack=1 Win=14480 Len=0 MSS=1460 TSV=1990229 TSER=1582528 WS=6
  3   0.000326     10.0.1.3 -> 10.0.1.2     TCP 48762 > 9040 [ACK] Seq=1 Ack=1 Win=5888 Len=0 TSV=1582528 TSER=1990229
  7   0.002273     10.0.1.2 -> 10.0.1.3     TCP 9040 > 48762 [ACK] Seq=1 Ack=13 Win=14528 Len=0 TSV=1990230 TSER=1582528
361986  31.249558     10.0.1.3 -> 10.0.1.2     TCP 48762 > 9040 [FIN, ACK] Seq=13 Ack=350000002 Win=2580480 Len=0 TSV=1590341 TSER=1997987
361987  31.249813     10.0.1.2 -> 10.0.1.3     TCP 9040 > 48762 [ACK] Seq=350000002 Ack=14 Win=14528 Len=0 TSV=1998042 TSER=1590341
  1   0.000000     10.0.1.3 -> 10.0.1.2     TCP 48764 > 9040 [SYN] Seq=0 Win=5840 Len=0 MSS=1460 TSV=1596535 TSER=0 WS=6
  2   0.000310     10.0.1.2 -> 10.0.1.3     TCP 9040 > 48764 [SYN, ACK] Seq=0 Ack=1 Win=14480 Len=0 MSS=1460 TSV=2004237 TSER=1596535 WS=6
  3   0.000333     10.0.1.3 -> 10.0.1.2     TCP 48764 > 9040 [ACK] Seq=1 Ack=1 Win=5888 Len=0 TSV=1596535 TSER=2004237
  7   0.002195     10.0.1.2 -> 10.0.1.3     TCP 9040 > 48764 [ACK] Seq=1 Ack=13 Win=14528 Len=0 TSV=2004238 TSER=1596536
344340  29.819979     10.0.1.3 -> 10.0.1.2     TCP 48764 > 9040 [FIN, ACK] Seq=13 Ack=350000002 Win=2580480 Len=0 TSV=1603990 TSER=2011638
344341  29.820224     10.0.1.2 -> 10.0.1.3     TCP 9040 > 48764 [ACK] Seq=350000002 Ack=14 Win=14528 Len=0 TSV=2011693 TSER=1603990
  1   0.000000     10.0.1.3 -> 10.0.1.2     TCP 48766 > 9040 [SYN] Seq=0 Win=5840 Len=0 MSS=1460 TSV=1609815 TSER=0 WS=6
  2   0.000284     10.0.1.2 -> 10.0.1.3     TCP 9040 > 48766 [SYN, ACK] Seq=0 Ack=1 Win=14480 Len=0 MSS=1460 TSV=2017518 TSER=1609815 WS=6
  3   0.000308     10.0.1.3 -> 10.0.1.2     TCP 48766 > 9040 [ACK] Seq=1 Ack=1 Win=5888 Len=0 TSV=1609815 TSER=2017518
  7   0.002288     10.0.1.2 -> 10.0.1.3     TCP 9040 > 48766 [ACK] Seq=1 Ack=13 Win=14528 Len=0 TSV=2017519 TSER=1609815
361470  29.824937     10.0.1.3 -> 10.0.1.2     TCP 48766 > 9040 [FIN, ACK] Seq=13 Ack=350000002 Win=2580480 Len=0 TSV=1617271 TSER=2024920
361471  29.825192     10.0.1.2 -> 10.0.1.3     TCP 9040 > 48766 [ACK] Seq=350000002 Ack=14 Win=14528 Len=0 TSV=2024975 TSER=1617271
  1   0.000000     10.0.1.3 -> 10.0.1.2     TCP 48768 > 9040 [SYN] Seq=0 Win=5840 Len=0 MSS=1460 TSV=1623376 TSER=0 WS=6
  2   0.000303     10.0.1.2 -> 10.0.1.3     TCP 9040 > 48768 [SYN, ACK] Seq=0 Ack=1 Win=14480 Len=0 MSS=1460 TSV=2031080 TSER=1623376 WS=6
  3   0.000323     10.0.1.3 -> 10.0.1.2     TCP 48768 > 9040 [ACK] Seq=1 Ack=1 Win=5888 Len=0 TSV=1623376 TSER=2031080
  7   0.002265     10.0.1.2 -> 10.0.1.3     TCP 9040 > 48768 [ACK] Seq=1 Ack=13 Win=14528 Len=0 TSV=2031080 TSER=1623376
361678  29.819592     10.0.1.3 -> 10.0.1.2     TCP 48768 > 9040 [FIN, ACK] Seq=13 Ack=350000002 Win=2580480 Len=0 TSV=1630831 TSER=2038480
361679  29.819836     10.0.1.2 -> 10.0.1.3     TCP 9040 > 48768 [ACK] Seq=350000002 Ack=14 Win=14528 Len=0 TSV=2038535 TSER=1630831
  1   0.000000     10.0.1.3 -> 10.0.1.2     TCP 48771 > 9040 [SYN] Seq=0 Win=5840 Len=0 MSS=1460 TSV=1637074 TSER=0 WS=6
  2   0.000280     10.0.1.2 -> 10.0.1.3     TCP 9040 > 48771 [SYN, ACK] Seq=0 Ack=1 Win=14480 Len=0 MSS=1460 TSV=2044779 TSER=1637074 WS=6
  3   0.000304     10.0.1.3 -> 10.0.1.2     TCP 48771 > 9040 [ACK] Seq=1 Ack=1 Win=5888 Len=0 TSV=1637074 TSER=2044779
  7   0.002280     10.0.1.2 -> 10.0.1.3     TCP 9040 > 48771 [ACK] Seq=1 Ack=13 Win=14528 Len=0 TSV=2044780 TSER=1637074
362121  29.820623     10.0.1.3 -> 10.0.1.2     TCP 48771 > 9040 [FIN, ACK] Seq=13 Ack=350000002 Win=2580480 Len=0 TSV=1644529 TSER=2052180
362122  29.820880     10.0.1.2 -> 10.0.1.3     TCP 9040 > 48771 [ACK] Seq=350000002 Ack=14 Win=14528 Len=0 TSV=2052235 TSER=1644529
  1   0.000000     10.0.1.3 -> 10.0.1.2     TCP 45262 > 9040 [SYN] Seq=0 Win=5840 Len=0 MSS=1460 TSV=1650615 TSER=0 WS=6
  2   0.000310     10.0.1.2 -> 10.0.1.3     TCP 9040 > 45262 [SYN, ACK] Seq=0 Ack=1 Win=14480 Len=0 MSS=1460 TSV=2058322 TSER=1650615 WS=6
  3   0.000342     10.0.1.3 -> 10.0.1.2     TCP 45262 > 9040 [ACK] Seq=1 Ack=1 Win=5888 Len=0 TSV=1650615 TSER=2058322
  7   0.002096     10.0.1.2 -> 10.0.1.3     TCP 9040 > 45262 [ACK] Seq=1 Ack=13 Win=14528 Len=0 TSV=2058322 TSER=1650616
331050  29.826460     10.0.1.3 -> 10.0.1.2     TCP 45262 > 9040 [FIN, ACK] Seq=13 Ack=350000002 Win=2580480 Len=0 TSV=1658072 TSER=2065724
331051  29.826714     10.0.1.2 -> 10.0.1.3     TCP 9040 > 45262 [ACK] Seq=350000002 Ack=14 Win=14528 Len=0 TSV=2065779 TSER=1658072
  1   0.000000     10.0.1.3 -> 10.0.1.2     TCP 45264 > 9040 [SYN] Seq=0 Win=5840 Len=0 MSS=1460 TSV=1663856 TSER=0 WS=6
  2   0.000336     10.0.1.2 -> 10.0.1.3     TCP 9040 > 45264 [SYN, ACK] Seq=0 Ack=1 Win=14480 Len=0 MSS=1460 TSV=2071563 TSER=1663856 WS=6
  3   0.000358     10.0.1.3 -> 10.0.1.2     TCP 45264 > 9040 [ACK] Seq=1 Ack=1 Win=5888 Len=0 TSV=1663856 TSER=2071563
  7   0.002996     10.0.1.2 -> 10.0.1.3     TCP 9040 > 45264 [ACK] Seq=1 Ack=13 Win=14528 Len=0 TSV=2071564 TSER=1663857
336840  29.828935     10.0.1.3 -> 10.0.1.2     TCP 45264 > 9040 [FIN, ACK] Seq=13 Ack=350000002 Win=2580480 Len=0 TSV=1671314 TSER=2078966
336841  29.829181     10.0.1.2 -> 10.0.1.3     TCP 9040 > 45264 [ACK] Seq=350000002 Ack=14 Win=14528 Len=0 TSV=2079021 TSER=1671314
  1   0.000000     10.0.1.3 -> 10.0.1.2     TCP 45266 > 9040 [SYN] Seq=0 Win=5840 Len=0 MSS=1460 TSV=1677142 TSER=0 WS=6
  2   0.000313     10.0.1.2 -> 10.0.1.3     TCP 9040 > 45266 [SYN, ACK] Seq=0 Ack=1 Win=14480 Len=0 MSS=1460 TSV=2084850 TSER=1677142 WS=6
  3   0.000338     10.0.1.3 -> 10.0.1.2     TCP 45266 > 9040 [ACK] Seq=1 Ack=1 Win=5888 Len=0 TSV=1677142 TSER=2084850
  7   0.002228     10.0.1.2 -> 10.0.1.3     TCP 9040 > 45266 [ACK] Seq=1 Ack=13 Win=14528 Len=0 TSV=2084850 TSER=1677142
340121  29.828834     10.0.1.3 -> 10.0.1.2     TCP 45266 > 9040 [FIN, ACK] Seq=13 Ack=350000002 Win=2580480 Len=0 TSV=1684599 TSER=2092253
340122  29.829083     10.0.1.2 -> 10.0.1.3     TCP 9040 > 45266 [ACK] Seq=350000002 Ack=14 Win=14528 Len=0 TSV=2092308 TSER=1684599
  1   0.000000     10.0.1.3 -> 10.0.1.2     TCP 45268 > 9040 [SYN] Seq=0 Win=5840 Len=0 MSS=1460 TSV=1690456 TSER=0 WS=6
  2   0.000303     10.0.1.2 -> 10.0.1.3     TCP 9040 > 45268 [SYN, ACK] Seq=0 Ack=1 Win=14480 Len=0 MSS=1460 TSV=2098165 TSER=1690456 WS=6
  3   0.000325     10.0.1.3 -> 10.0.1.2     TCP 45268 > 9040 [ACK] Seq=1 Ack=1 Win=5888 Len=0 TSV=1690456 TSER=2098165
  7   0.002264     10.0.1.2 -> 10.0.1.3     TCP 9040 > 45268 [ACK] Seq=1 Ack=13 Win=14528 Len=0 TSV=2098166 TSER=1690456
340061  29.829153     10.0.1.3 -> 10.0.1.2     TCP 45268 > 9040 [FIN, ACK] Seq=13 Ack=350000002 Win=2580480 Len=0 TSV=1697913 TSER=2105568
340062  29.829399     10.0.1.2 -> 10.0.1.3     TCP 9040 > 45268 [ACK] Seq=350000002 Ack=14 Win=14528 Len=0 TSV=2105623 TSER=1697913
  1   0.000000     10.0.1.3 -> 10.0.1.2     TCP 45271 > 9040 [SYN] Seq=0 Win=5840 Len=0 MSS=1460 TSV=1703797 TSER=0 WS=6
  2   0.000278     10.0.1.2 -> 10.0.1.3     TCP 9040 > 45271 [SYN, ACK] Seq=0 Ack=1 Win=14480 Len=0 MSS=1460 TSV=2111507 TSER=1703797 WS=6
  3   0.000302     10.0.1.3 -> 10.0.1.2     TCP 45271 > 9040 [ACK] Seq=1 Ack=1 Win=5888 Len=0 TSV=1703797 TSER=2111507
  7   0.002201     10.0.1.2 -> 10.0.1.3     TCP 9040 > 45271 [ACK] Seq=1 Ack=13 Win=14528 Len=0 TSV=2111507 TSER=1703797
361832  29.825102     10.0.1.3 -> 10.0.1.2     TCP 45271 > 9040 [FIN, ACK] Seq=13 Ack=350000002 Win=2580480 Len=0 TSV=1711253 TSER=2118909
361833  29.825353     10.0.1.2 -> 10.0.1.3     TCP 9040 > 45271 [ACK] Seq=350000002 Ack=14 Win=14528 Len=0 TSV=2118964 TSER=1711253
