  1   0.000000     10.0.1.3 -> 10.0.1.2     TCP 44558 > 9040 [SYN] Seq=0 Win=5840 Len=0 MSS=1460 TSV=3307252 TSER=0 WS=6
  2   0.000374     10.0.1.2 -> 10.0.1.3     TCP 9040 > 44558 [SYN, ACK] Seq=0 Ack=1 Win=14480 Len=0 MSS=1460 TSV=3292271 TSER=3307252 WS=6
  3   0.000397     10.0.1.3 -> 10.0.1.2     TCP 44558 > 9040 [ACK] Seq=1 Ack=1 Win=5888 Len=0 TSV=3307252 TSER=3292271
  7   0.002372     10.0.1.2 -> 10.0.1.3     TCP 9040 > 44558 [ACK] Seq=1 Ack=13 Win=14528 Len=0 TSV=3292271 TSER=3307252
363243  63.227138     10.0.1.3 -> 10.0.1.2     TCP 44558 > 9040 [FIN, ACK] Seq=13 Ack=350000002 Win=2026112 Len=0 TSV=3323058 TSER=3308057
  1   0.000000     10.0.1.3 -> 10.0.1.2     TCP 44560 > 9040 [SYN] Seq=0 Win=5840 Len=0 MSS=1460 TSV=3329189 TSER=0 WS=6
  2   0.000268     10.0.1.2 -> 10.0.1.3     TCP 9040 > 44560 [SYN, ACK] Seq=0 Ack=1 Win=14480 Len=0 MSS=1460 TSV=3314209 TSER=3329189 WS=6
  3   0.000293     10.0.1.3 -> 10.0.1.2     TCP 44560 > 9040 [ACK] Seq=1 Ack=1 Win=5888 Len=0 TSV=3329189 TSER=3314209
  7   0.002232     10.0.1.2 -> 10.0.1.3     TCP 9040 > 44560 [ACK] Seq=1 Ack=13 Win=14528 Len=0 TSV=3314210 TSER=3329189
350680  63.896397     10.0.1.3 -> 10.0.1.2     TCP 44560 > 9040 [FIN, ACK] Seq=13 Ack=350000002 Win=2014528 Len=0 TSV=3345163 TSER=3330163
  1   0.000000     10.0.1.3 -> 10.0.1.2     TCP 44562 > 9040 [SYN] Seq=0 Win=5840 Len=0 MSS=1460 TSV=3351174 TSER=0 WS=6
  2   0.000304     10.0.1.2 -> 10.0.1.3     TCP 9040 > 44562 [SYN, ACK] Seq=0 Ack=1 Win=14480 Len=0 MSS=1460 TSV=3336196 TSER=3351174 WS=6
  3   0.000335     10.0.1.3 -> 10.0.1.2     TCP 44562 > 9040 [ACK] Seq=1 Ack=1 Win=5888 Len=0 TSV=3351174 TSER=3336196
  7   0.003625     10.0.1.2 -> 10.0.1.3     TCP 9040 > 44562 [ACK] Seq=1 Ack=13 Win=14528 Len=0 TSV=3336197 TSER=3351175
361687  62.738092     10.0.1.3 -> 10.0.1.2     TCP 44562 > 9040 [FIN, ACK] Seq=13 Ack=350000002 Win=2017408 Len=0 TSV=3366858 TSER=3351860
  1   0.000000     10.0.1.3 -> 10.0.1.2     TCP 44564 > 9040 [SYN] Seq=0 Win=5840 Len=0 MSS=1460 TSV=3372879 TSER=0 WS=6
  2   0.000372     10.0.1.2 -> 10.0.1.3     TCP 9040 > 44564 [SYN, ACK] Seq=0 Ack=1 Win=14480 Len=0 MSS=1460 TSV=3357903 TSER=3372879 WS=6
  3   0.000395     10.0.1.3 -> 10.0.1.2     TCP 44564 > 9040 [ACK] Seq=1 Ack=1 Win=5888 Len=0 TSV=3372879 TSER=3357903
  7   0.002355     10.0.1.2 -> 10.0.1.3     TCP 9040 > 44564 [ACK] Seq=1 Ack=13 Win=14528 Len=0 TSV=3357903 TSER=3372879
363377  64.196128     10.0.1.3 -> 10.0.1.2     TCP 44564 > 9040 [FIN, ACK] Seq=13 Ack=350000002 Win=2026112 Len=0 TSV=3388928 TSER=3373931
  1   0.000000     10.0.1.3 -> 10.0.1.2     TCP 38873 > 9040 [SYN] Seq=0 Win=5840 Len=0 MSS=1460 TSV=3395034 TSER=0 WS=6
  2   0.000298     10.0.1.2 -> 10.0.1.3     TCP 9040 > 38873 [SYN, ACK] Seq=0 Ack=1 Win=14480 Len=0 MSS=1460 TSV=3380059 TSER=3395034 WS=6
  3   0.000321     10.0.1.3 -> 10.0.1.2     TCP 38873 > 9040 [ACK] Seq=1 Ack=1 Win=5888 Len=0 TSV=3395034 TSER=3380059
  7   0.002063     10.0.1.2 -> 10.0.1.3     TCP 9040 > 38873 [ACK] Seq=1 Ack=13 Win=14528 Len=0 TSV=3380060 TSER=3395034
362274  64.134714     10.0.1.3 -> 10.0.1.2     TCP 38873 > 9040 [FIN, ACK] Seq=13 Ack=350000002 Win=2005824 Len=0 TSV=3411067 TSER=3396073
  1   0.000000     10.0.1.3 -> 10.0.1.2     TCP 38875 > 9040 [SYN] Seq=0 Win=5840 Len=0 MSS=1460 TSV=3417011 TSER=0 WS=6
  2   0.000302     10.0.1.2 -> 10.0.1.3     TCP 9040 > 38875 [SYN, ACK] Seq=0 Ack=1 Win=14480 Len=0 MSS=1460 TSV=3402039 TSER=3417011 WS=6
  3   0.000339     10.0.1.3 -> 10.0.1.2     TCP 38875 > 9040 [ACK] Seq=1 Ack=1 Win=5888 Len=0 TSV=3417012 TSER=3402039
  7   0.003859     10.0.1.2 -> 10.0.1.3     TCP 9040 > 38875 [ACK] Seq=1 Ack=13 Win=14528 Len=0 TSV=3402040 TSER=3417013
363395  63.966926     10.0.1.3 -> 10.0.1.2     TCP 38875 > 9040 [FIN, ACK] Seq=13 Ack=350000002 Win=2026112 Len=0 TSV=3433003 TSER=3418010
  1   0.000000     10.0.1.3 -> 10.0.1.2     TCP 38877 > 9040 [SYN] Seq=0 Win=5840 Len=0 MSS=1460 TSV=3439210 TSER=0 WS=6
  2   0.000275     10.0.1.2 -> 10.0.1.3     TCP 9040 > 38877 [SYN, ACK] Seq=0 Ack=1 Win=14480 Len=0 MSS=1460 TSV=3424239 TSER=3439210 WS=6
  3   0.000298     10.0.1.3 -> 10.0.1.2     TCP 38877 > 9040 [ACK] Seq=1 Ack=1 Win=5888 Len=0 TSV=3439210 TSER=3424239
  7   0.002146     10.0.1.2 -> 10.0.1.3     TCP 9040 > 38877 [ACK] Seq=1 Ack=13 Win=14528 Len=0 TSV=3424239 TSER=3439210
363232  62.823397     10.0.1.3 -> 10.0.1.2     TCP 38877 > 9040 [FIN, ACK] Seq=13 Ack=350000002 Win=2014528 Len=0 TSV=3454916 TSER=3439924
  1   0.000000     10.0.1.3 -> 10.0.1.2     TCP 56339 > 9040 [SYN] Seq=0 Win=5840 Len=0 MSS=1460 TSV=3461226 TSER=0 WS=6
  2   0.000322     10.0.1.2 -> 10.0.1.3     TCP 9040 > 56339 [SYN, ACK] Seq=0 Ack=1 Win=14480 Len=0 MSS=1460 TSV=3446256 TSER=3461226 WS=6
  3   0.000344     10.0.1.3 -> 10.0.1.2     TCP 56339 > 9040 [ACK] Seq=1 Ack=1 Win=5888 Len=0 TSV=3461226 TSER=3446256
  7   0.002342     10.0.1.2 -> 10.0.1.3     TCP 9040 > 56339 [ACK] Seq=1 Ack=13 Win=14528 Len=0 TSV=3446257 TSER=3461227
363386  62.556715     10.0.1.3 -> 10.0.1.2     TCP 56339 > 9040 [FIN, ACK] Seq=13 Ack=350000002 Win=2017408 Len=0 TSV=3476865 TSER=3461875
  1   0.000000     10.0.1.3 -> 10.0.1.2     TCP 56341 > 9040 [SYN] Seq=0 Win=5840 Len=0 MSS=1460 TSV=3482896 TSER=0 WS=6
  2   0.000308     10.0.1.2 -> 10.0.1.3     TCP 9040 > 56341 [SYN, ACK] Seq=0 Ack=1 Win=14480 Len=0 MSS=1460 TSV=3467927 TSER=3482896 WS=6
  3   0.000336     10.0.1.3 -> 10.0.1.2     TCP 56341 > 9040 [ACK] Seq=1 Ack=1 Win=5888 Len=0 TSV=3482896 TSER=3467927
  7   0.002349     10.0.1.2 -> 10.0.1.3     TCP 9040 > 56341 [ACK] Seq=1 Ack=13 Win=14528 Len=0 TSV=3467928 TSER=3482896
347241  63.484870     10.0.1.3 -> 10.0.1.2     TCP 56341 > 9040 [FIN, ACK] Seq=13 Ack=350000002 Win=2023168 Len=0 TSV=3498767 TSER=3483778
  1   0.000000     10.0.1.3 -> 10.0.1.2     TCP 56343 > 9040 [SYN] Seq=0 Win=5840 Len=0 MSS=1460 TSV=3504744 TSER=0 WS=6
  2   0.000293     10.0.1.2 -> 10.0.1.3     TCP 9040 > 56343 [SYN, ACK] Seq=0 Ack=1 Win=14480 Len=0 MSS=1460 TSV=3489778 TSER=3504744 WS=6
  3   0.000315     10.0.1.3 -> 10.0.1.2     TCP 56343 > 9040 [ACK] Seq=1 Ack=1 Win=5888 Len=0 TSV=3504744 TSER=3489778
  7   0.002209     10.0.1.2 -> 10.0.1.3     TCP 9040 > 56343 [ACK] Seq=1 Ack=13 Win=14528 Len=0 TSV=3489778 TSER=3504745
363075  64.025393     10.0.1.3 -> 10.0.1.2     TCP 56343 > 9040 [FIN, ACK] Seq=13 Ack=350000002 Win=2026112 Len=0 TSV=3520751 TSER=3505764
  1   0.000000     10.0.1.3 -> 10.0.1.2     TCP 53207 > 9040 [SYN] Seq=0 Win=5840 Len=0 MSS=1460 TSV=3526759 TSER=0 WS=6
  2   0.000293     10.0.1.2 -> 10.0.1.3     TCP 9040 > 53207 [SYN, ACK] Seq=0 Ack=1 Win=14480 Len=0 MSS=1460 TSV=3511794 TSER=3526759 WS=6
  3   0.000314     10.0.1.3 -> 10.0.1.2     TCP 53207 > 9040 [ACK] Seq=1 Ack=1 Win=5888 Len=0 TSV=3526759 TSER=3511794
  7   0.002278     10.0.1.2 -> 10.0.1.3     TCP 9040 > 53207 [ACK] Seq=1 Ack=13 Win=14528 Len=0 TSV=3511795 TSER=3526760
362916  63.159949     10.0.1.3 -> 10.0.1.2     TCP 53207 > 9040 [FIN, ACK] Seq=13 Ack=350000002 Win=2023168 Len=0 TSV=3542549 TSER=3527564
  1   0.000000     10.0.1.3 -> 10.0.1.2     TCP 53209 > 9040 [SYN] Seq=0 Win=5840 Len=0 MSS=1460 TSV=3548809 TSER=0 WS=6
  2   0.000301     10.0.1.2 -> 10.0.1.3     TCP 9040 > 53209 [SYN, ACK] Seq=0 Ack=1 Win=14480 Len=0 MSS=1460 TSV=3533847 TSER=3548809 WS=6
  3   0.000324     10.0.1.3 -> 10.0.1.2     TCP 53209 > 9040 [ACK] Seq=1 Ack=1 Win=5888 Len=0 TSV=3548809 TSER=3533847
  7   0.002524     10.0.1.2 -> 10.0.1.3     TCP 9040 > 53209 [ACK] Seq=1 Ack=13 Win=14528 Len=0 TSV=3533847 TSER=3548810
348186  64.017465     10.0.1.3 -> 10.0.1.2     TCP 53209 > 9040 [FIN, ACK] Seq=13 Ack=350000002 Win=2005824 Len=0 TSV=3564814 TSER=3549831
  1   0.000000     10.0.1.3 -> 10.0.1.2     TCP 53211 > 9040 [SYN] Seq=0 Win=5840 Len=0 MSS=1460 TSV=3570616 TSER=0 WS=6
  2   0.000370     10.0.1.2 -> 10.0.1.3     TCP 9040 > 53211 [SYN, ACK] Seq=0 Ack=1 Win=14480 Len=0 MSS=1460 TSV=3555654 TSER=3570616 WS=6
  3   0.000394     10.0.1.3 -> 10.0.1.2     TCP 53211 > 9040 [ACK] Seq=1 Ack=1 Win=5888 Len=0 TSV=3570616 TSER=3555654
  7   0.002319     10.0.1.2 -> 10.0.1.3     TCP 9040 > 53211 [ACK] Seq=1 Ack=13 Win=14528 Len=0 TSV=3555655 TSER=3570616
362954  63.443193     10.0.1.3 -> 10.0.1.2     TCP 53211 > 9040 [FIN, ACK] Seq=13 Ack=350000002 Win=2026112 Len=0 TSV=3586477 TSER=3571495
  1   0.000000     10.0.1.3 -> 10.0.1.2     TCP 53213 > 9040 [SYN] Seq=0 Win=5840 Len=0 MSS=1460 TSV=3592528 TSER=0 WS=6
  2   0.000302     10.0.1.2 -> 10.0.1.3     TCP 9040 > 53213 [SYN, ACK] Seq=0 Ack=1 Win=14480 Len=0 MSS=1460 TSV=3577568 TSER=3592528 WS=6
  3   0.000325     10.0.1.3 -> 10.0.1.2     TCP 53213 > 9040 [ACK] Seq=1 Ack=1 Win=5888 Len=0 TSV=3592528 TSER=3577568
  7   0.002173     10.0.1.2 -> 10.0.1.3     TCP 9040 > 53213 [ACK] Seq=1 Ack=13 Win=14528 Len=0 TSV=3577569 TSER=3592528
363005  63.624357     10.0.1.3 -> 10.0.1.2     TCP 53213 > 9040 [FIN, ACK] Seq=13 Ack=350000002 Win=2020288 Len=0 TSV=3608434 TSER=3593454
  1   0.000000     10.0.1.3 -> 10.0.1.2     TCP 38117 > 9040 [SYN] Seq=0 Win=5840 Len=0 MSS=1460 TSV=3614430 TSER=0 WS=6
  2   0.000329     10.0.1.2 -> 10.0.1.3     TCP 9040 > 38117 [SYN, ACK] Seq=0 Ack=1 Win=14480 Len=0 MSS=1460 TSV=3599471 TSER=3614430 WS=6
  3   0.000489     10.0.1.3 -> 10.0.1.2     TCP 38117 > 9040 [ACK] Seq=1 Ack=1 Win=5888 Len=0 TSV=3614430 TSER=3599471
  7   0.002525     10.0.1.2 -> 10.0.1.3     TCP 9040 > 38117 [ACK] Seq=1 Ack=13 Win=14528 Len=0 TSV=3599472 TSER=3614430
347683  63.580907     10.0.1.3 -> 10.0.1.2     TCP 38117 > 9040 [FIN, ACK] Seq=13 Ack=350000002 Win=2005824 Len=0 TSV=3630325 TSER=3615346
  1   0.000000     10.0.1.3 -> 10.0.1.2     TCP 38119 > 9040 [SYN] Seq=0 Win=5840 Len=0 MSS=1460 TSV=3636324 TSER=0 WS=6
  2   0.000300     10.0.1.2 -> 10.0.1.3     TCP 9040 > 38119 [SYN, ACK] Seq=0 Ack=1 Win=14480 Len=0 MSS=1460 TSV=3621367 TSER=3636324 WS=6
  3   0.000327     10.0.1.3 -> 10.0.1.2     TCP 38119 > 9040 [ACK] Seq=1 Ack=1 Win=5888 Len=0 TSV=3636324 TSER=3621367
  7   0.002307     10.0.1.2 -> 10.0.1.3     TCP 9040 > 38119 [ACK] Seq=1 Ack=13 Win=14528 Len=0 TSV=3621368 TSER=3636324
362999  62.987978     10.0.1.3 -> 10.0.1.2     TCP 38119 > 9040 [FIN, ACK] Seq=13 Ack=350000002 Win=2005824 Len=0 TSV=3652071 TSER=3637094
  1   0.000000     10.0.1.3 -> 10.0.1.2     TCP 38121 > 9040 [SYN] Seq=0 Win=5840 Len=0 MSS=1460 TSV=3658219 TSER=0 WS=6
  2   0.000322     10.0.1.2 -> 10.0.1.3     TCP 9040 > 38121 [SYN, ACK] Seq=0 Ack=1 Win=14480 Len=0 MSS=1460 TSV=3643264 TSER=3658219 WS=6
  3   0.000345     10.0.1.3 -> 10.0.1.2     TCP 38121 > 9040 [ACK] Seq=1 Ack=1 Win=5888 Len=0 TSV=3658219 TSER=3643264
  7   0.002258     10.0.1.2 -> 10.0.1.3     TCP 9040 > 38121 [ACK] Seq=1 Ack=13 Win=14528 Len=0 TSV=3643265 TSER=3658219
355285  63.564835     10.0.1.3 -> 10.0.1.2     TCP 38121 > 9040 [FIN, ACK] Seq=13 Ack=350000002 Win=2023168 Len=0 TSV=3674110 TSER=3659135
  1   0.000000     10.0.1.3 -> 10.0.1.2     TCP 33803 > 9040 [SYN] Seq=0 Win=5840 Len=0 MSS=1460 TSV=3680080 TSER=0 WS=6
  2   0.000286     10.0.1.2 -> 10.0.1.3     TCP 9040 > 33803 [SYN, ACK] Seq=0 Ack=1 Win=14480 Len=0 MSS=1460 TSV=3665126 TSER=3680080 WS=6
  3   0.000303     10.0.1.3 -> 10.0.1.2     TCP 33803 > 9040 [ACK] Seq=1 Ack=1 Win=5888 Len=0 TSV=3680080 TSER=3665126
  7   0.002218     10.0.1.2 -> 10.0.1.3     TCP 9040 > 33803 [ACK] Seq=1 Ack=13 Win=14528 Len=0 TSV=3665127 TSER=3680080
344825  63.764251     10.0.1.3 -> 10.0.1.2     TCP 33803 > 9040 [FIN, ACK] Seq=13 Ack=350000002 Win=2026112 Len=0 TSV=3696021 TSER=3681047
  1   0.000000     10.0.1.3 -> 10.0.1.2     TCP 33806 > 9040 [SYN] Seq=0 Win=5840 Len=0 MSS=1460 TSV=3702096 TSER=0 WS=6
  2   0.000374     10.0.1.2 -> 10.0.1.3     TCP 9040 > 33806 [SYN, ACK] Seq=0 Ack=1 Win=14480 Len=0 MSS=1460 TSV=3687145 TSER=3702096 WS=6
  3   0.000399     10.0.1.3 -> 10.0.1.2     TCP 33806 > 9040 [ACK] Seq=1 Ack=1 Win=5888 Len=0 TSV=3702096 TSER=3687145
  7   0.002407     10.0.1.2 -> 10.0.1.3     TCP 9040 > 33806 [ACK] Seq=1 Ack=13 Win=14528 Len=0 TSV=3687145 TSER=3702097
360641  62.639733     10.0.1.3 -> 10.0.1.2     TCP 33806 > 9040 [FIN, ACK] Seq=13 Ack=350000002 Win=2023168 Len=0 TSV=3717756 TSER=3702784
  1   0.000000     10.0.1.3 -> 10.0.1.2     TCP 33808 > 9040 [SYN] Seq=0 Win=5840 Len=0 MSS=1460 TSV=3723818 TSER=0 WS=6
  2   0.000296     10.0.1.2 -> 10.0.1.3     TCP 9040 > 33808 [SYN, ACK] Seq=0 Ack=1 Win=14480 Len=0 MSS=1460 TSV=3708868 TSER=3723818 WS=6
  3   0.000320     10.0.1.3 -> 10.0.1.2     TCP 33808 > 9040 [ACK] Seq=1 Ack=1 Win=5888 Len=0 TSV=3723818 TSER=3708868
  7   0.002325     10.0.1.2 -> 10.0.1.3     TCP 9040 > 33808 [ACK] Seq=1 Ack=13 Win=14528 Len=0 TSV=3708868 TSER=3723818
362946  63.927066     10.0.1.3 -> 10.0.1.2     TCP 33808 > 9040 [FIN, ACK] Seq=13 Ack=350000002 Win=2005824 Len=0 TSV=3739799 TSER=3724829
