  1   0.000000     10.0.1.3 -> 10.0.1.2     TCP 33810 > 9040 [SYN] Seq=0 Win=5840 Len=0 MSS=1460 TSV=3745873 TSER=0 WS=6
  2   0.000277     10.0.1.2 -> 10.0.1.3     TCP 9040 > 33810 [SYN, ACK] Seq=0 Ack=1 Win=14480 Len=0 MSS=1460 TSV=3730925 TSER=3745873 WS=6
  3   0.000299     10.0.1.3 -> 10.0.1.2     TCP 33810 > 9040 [ACK] Seq=1 Ack=1 Win=5888 Len=0 TSV=3745873 TSER=3730925
  7   0.002292     10.0.1.2 -> 10.0.1.3     TCP 9040 > 33810 [ACK] Seq=1 Ack=13 Win=14528 Len=0 TSV=3730926 TSER=3745874
397929  72.429897     10.0.1.3 -> 10.0.1.2     TCP 33810 > 9040 [FIN, ACK] Seq=13 Ack=400000002 Win=2002944 Len=0 TSV=3763981 TSER=3749012
  1   0.000000     10.0.1.3 -> 10.0.1.2     TCP 39677 > 9040 [SYN] Seq=0 Win=5840 Len=0 MSS=1460 TSV=3770571 TSER=0 WS=6
  2   0.000284     10.0.1.2 -> 10.0.1.3     TCP 9040 > 39677 [SYN, ACK] Seq=0 Ack=1 Win=14480 Len=0 MSS=1460 TSV=3755625 TSER=3770571 WS=6
  3   0.000308     10.0.1.3 -> 10.0.1.2     TCP 39677 > 9040 [ACK] Seq=1 Ack=1 Win=5888 Len=0 TSV=3770572 TSER=3755625
  7   0.002298     10.0.1.2 -> 10.0.1.3     TCP 9040 > 39677 [ACK] Seq=1 Ack=13 Win=14528 Len=0 TSV=3755626 TSER=3770572
404307  72.136046     10.0.1.3 -> 10.0.1.2     TCP 39677 > 9040 [FIN, ACK] Seq=13 Ack=400000002 Win=2020288 Len=0 TSV=3788605 TSER=3773639
  1   0.000000     10.0.1.3 -> 10.0.1.2     TCP 39679 > 9040 [SYN] Seq=0 Win=5840 Len=0 MSS=1460 TSV=3795234 TSER=0 WS=6
  2   0.000304     10.0.1.2 -> 10.0.1.3     TCP 9040 > 39679 [SYN, ACK] Seq=0 Ack=1 Win=14480 Len=0 MSS=1460 TSV=3780289 TSER=3795234 WS=6
  3   0.000327     10.0.1.3 -> 10.0.1.2     TCP 39679 > 9040 [ACK] Seq=1 Ack=1 Win=5888 Len=0 TSV=3795234 TSER=3780289
  7   0.002244     10.0.1.2 -> 10.0.1.3     TCP 9040 > 39679 [ACK] Seq=1 Ack=13 Win=14528 Len=0 TSV=3780290 TSER=3795234
414685  72.429076     10.0.1.3 -> 10.0.1.2     TCP 39679 > 9040 [FIN, ACK] Seq=13 Ack=400000002 Win=2026112 Len=0 TSV=3813341 TSER=3798377
  1   0.000000     10.0.1.3 -> 10.0.1.2     TCP turbonote-1 > 9040 [SYN] Seq=0 Win=5840 Len=0 MSS=1460 TSV=3820098 TSER=0 WS=6
  2   0.000288     10.0.1.2 -> 10.0.1.3     TCP 9040 > turbonote-1 [SYN, ACK] Seq=0 Ack=1 Win=14480 Len=0 MSS=1460 TSV=3805156 TSER=3820098 WS=6
  3   0.000311     10.0.1.3 -> 10.0.1.2     TCP turbonote-1 > 9040 [ACK] Seq=1 Ack=1 Win=5888 Len=0 TSV=3820098 TSER=3805156
  7   0.002235     10.0.1.2 -> 10.0.1.3     TCP 9040 > turbonote-1 [ACK] Seq=1 Ack=13 Win=14528 Len=0 TSV=3805156 TSER=3820099
414763  73.538170     10.0.1.3 -> 10.0.1.2     TCP turbonote-1 > 9040 [FIN, ACK] Seq=13 Ack=400000002 Win=2020288 Len=0 TSV=3838483 TSER=3823520
  1   0.000000     10.0.1.3 -> 10.0.1.2     TCP 36684 > 9040 [SYN] Seq=0 Win=5840 Len=0 MSS=1460 TSV=3845136 TSER=0 WS=6
  2   0.000299     10.0.1.2 -> 10.0.1.3     TCP 9040 > 36684 [SYN, ACK] Seq=0 Ack=1 Win=14480 Len=0 MSS=1460 TSV=3830196 TSER=3845136 WS=6
  3   0.000322     10.0.1.3 -> 10.0.1.2     TCP 36684 > 9040 [ACK] Seq=1 Ack=1 Win=5888 Len=0 TSV=3845136 TSER=3830196
  7   0.002188     10.0.1.2 -> 10.0.1.3     TCP 9040 > 36684 [ACK] Seq=1 Ack=13 Win=14528 Len=0 TSV=3830196 TSER=3845137
407747  73.244741     10.0.1.3 -> 10.0.1.2     TCP 36684 > 9040 [FIN, ACK] Seq=13 Ack=400000002 Win=2023168 Len=0 TSV=3863448 TSER=3848487
  1   0.000000     10.0.1.3 -> 10.0.1.2     TCP 36686 > 9040 [SYN] Seq=0 Win=5840 Len=0 MSS=1460 TSV=3869857 TSER=0 WS=6
  2   0.000297     10.0.1.2 -> 10.0.1.3     TCP 9040 > 36686 [SYN, ACK] Seq=0 Ack=1 Win=14480 Len=0 MSS=1460 TSV=3854919 TSER=3869857 WS=6
  3   0.000320     10.0.1.3 -> 10.0.1.2     TCP 36686 > 9040 [ACK] Seq=1 Ack=1 Win=5888 Len=0 TSV=3869858 TSER=3854919
  7   0.002331     10.0.1.2 -> 10.0.1.3     TCP 9040 > 36686 [ACK] Seq=1 Ack=13 Win=14528 Len=0 TSV=3854919 TSER=3869858
413268  72.154260     10.0.1.3 -> 10.0.1.2     TCP 36686 > 9040 [FIN, ACK] Seq=13 Ack=400000002 Win=2014528 Len=0 TSV=3887896 TSER=3872937
  1   0.000000     10.0.1.3 -> 10.0.1.2     TCP 36688 > 9040 [SYN] Seq=0 Win=5840 Len=0 MSS=1460 TSV=3894649 TSER=0 WS=6
  2   0.000316     10.0.1.2 -> 10.0.1.3     TCP 9040 > 36688 [SYN, ACK] Seq=0 Ack=1 Win=14480 Len=0 MSS=1460 TSV=3879712 TSER=3894649 WS=6
  3   0.000340     10.0.1.3 -> 10.0.1.2     TCP 36688 > 9040 [ACK] Seq=1 Ack=1 Win=5888 Len=0 TSV=3894649 TSER=3879712
  7   0.002223     10.0.1.2 -> 10.0.1.3     TCP 9040 > 36688 [ACK] Seq=1 Ack=13 Win=14528 Len=0 TSV=3879712 TSER=3894649
403521  71.829369     10.0.1.3 -> 10.0.1.2     TCP 36688 > 9040 [FIN, ACK] Seq=13 Ack=400000002 Win=2026112 Len=0 TSV=3912606 TSER=3897649
  1   0.000000     10.0.1.3 -> 10.0.1.2     TCP 50150 > 9040 [SYN] Seq=0 Win=5840 Len=0 MSS=1460 TSV=3919171 TSER=0 WS=6
  2   0.000368     10.0.1.2 -> 10.0.1.3     TCP 9040 > 50150 [SYN, ACK] Seq=0 Ack=1 Win=14480 Len=0 MSS=1460 TSV=3904236 TSER=3919171 WS=6
  3   0.000393     10.0.1.3 -> 10.0.1.2     TCP 50150 > 9040 [ACK] Seq=1 Ack=1 Win=5888 Len=0 TSV=3919171 TSER=3904236
  7   0.002229     10.0.1.2 -> 10.0.1.3     TCP 9040 > 50150 [ACK] Seq=1 Ack=13 Win=14528 Len=0 TSV=3904236 TSER=3919171
415100  72.599453     10.0.1.3 -> 10.0.1.2     TCP 50150 > 9040 [FIN, ACK] Seq=13 Ack=400000002 Win=2023168 Len=0 TSV=3937321 TSER=3922365
  1   0.000000     10.0.1.3 -> 10.0.1.2     TCP 50152 > 9040 [SYN] Seq=0 Win=5840 Len=0 MSS=1460 TSV=3944239 TSER=0 WS=6
  2   0.000317     10.0.1.2 -> 10.0.1.3     TCP 9040 > 50152 [SYN, ACK] Seq=0 Ack=1 Win=14480 Len=0 MSS=1460 TSV=3929306 TSER=3944239 WS=6
  3   0.000343     10.0.1.3 -> 10.0.1.2     TCP 50152 > 9040 [ACK] Seq=1 Ack=1 Win=5888 Len=0 TSV=3944239 TSER=3929306
  7   0.002225     10.0.1.2 -> 10.0.1.3     TCP 9040 > 50152 [ACK] Seq=1 Ack=13 Win=14528 Len=0 TSV=3929306 TSER=3944240
408583  72.479588     10.0.1.3 -> 10.0.1.2     TCP 50152 > 9040 [FIN, ACK] Seq=13 Ack=400000002 Win=2017408 Len=0 TSV=3962359 TSER=3947406
  1   0.000000     10.0.1.3 -> 10.0.1.2     TCP 50154 > 9040 [SYN] Seq=0 Win=5840 Len=0 MSS=1460 TSV=3969043 TSER=0 WS=6
  2   0.000319     10.0.1.2 -> 10.0.1.3     TCP 9040 > 50154 [SYN, ACK] Seq=0 Ack=1 Win=14480 Len=0 MSS=1460 TSV=3954112 TSER=3969043 WS=6
  3   0.000345     10.0.1.3 -> 10.0.1.2     TCP 50154 > 9040 [ACK] Seq=1 Ack=1 Win=5888 Len=0 TSV=3969043 TSER=3954112
  7   0.002209     10.0.1.2 -> 10.0.1.3     TCP 9040 > 50154 [ACK] Seq=1 Ack=13 Win=14528 Len=0 TSV=3954112 TSER=3969044
415070  72.734498     10.0.1.3 -> 10.0.1.2     TCP 50154 > 9040 [FIN, ACK] Seq=13 Ack=400000002 Win=2026112 Len=0 TSV=3987227 TSER=3972275
  1   0.000000     10.0.1.3 -> 10.0.1.2     TCP 38921 > 9040 [SYN] Seq=0 Win=5840 Len=0 MSS=1460 TSV=3993988 TSER=0 WS=6
  2   0.000301     10.0.1.2 -> 10.0.1.3     TCP 9040 > 38921 [SYN, ACK] Seq=0 Ack=1 Win=14480 Len=0 MSS=1460 TSV=3979058 TSER=3993988 WS=6
  3   0.000325     10.0.1.3 -> 10.0.1.2     TCP 38921 > 9040 [ACK] Seq=1 Ack=1 Win=5888 Len=0 TSV=3993988 TSER=3979058
  7   0.002299     10.0.1.2 -> 10.0.1.3     TCP 9040 > 38921 [ACK] Seq=1 Ack=13 Win=14528 Len=0 TSV=3979059 TSER=3993988
414725  73.279777     10.0.1.3 -> 10.0.1.2     TCP 38921 > 9040 [FIN, ACK] Seq=13 Ack=400000002 Win=2023168 Len=0 TSV=4012308 TSER=3997358
  1   0.000000     10.0.1.3 -> 10.0.1.2     TCP 38923 > 9040 [SYN] Seq=0 Win=5840 Len=0 MSS=1460 TSV=4018992 TSER=0 WS=6
  2   0.000311     10.0.1.2 -> 10.0.1.3     TCP 9040 > 38923 [SYN, ACK] Seq=0 Ack=1 Win=14480 Len=0 MSS=1460 TSV=4004064 TSER=4018992 WS=6
  3   0.000345     10.0.1.3 -> 10.0.1.2     TCP 38923 > 9040 [ACK] Seq=1 Ack=1 Win=5888 Len=0 TSV=4018992 TSER=4004064
  7   0.003841     10.0.1.2 -> 10.0.1.3     TCP 9040 > 38923 [ACK] Seq=1 Ack=13 Win=14528 Len=0 TSV=4004065 TSER=4018993
405506  72.590480     10.0.1.3 -> 10.0.1.2     TCP 38923 > 9040 [FIN, ACK] Seq=13 Ack=400000002 Win=2034752 Len=0 TSV=4037139 TSER=4022192
  1   0.000000     10.0.1.3 -> 10.0.1.2     TCP 38925 > 9040 [SYN] Seq=0 Win=5840 Len=0 MSS=1460 TSV=4043742 TSER=0 WS=6
  2   0.000293     10.0.1.2 -> 10.0.1.3     TCP 9040 > 38925 [SYN, ACK] Seq=0 Ack=1 Win=14480 Len=0 MSS=1460 TSV=4028817 TSER=4043742 WS=6
  3   0.000319     10.0.1.3 -> 10.0.1.2     TCP 38925 > 9040 [ACK] Seq=1 Ack=1 Win=5888 Len=0 TSV=4043743 TSER=4028817
  7   0.002190     10.0.1.2 -> 10.0.1.3     TCP 9040 > 38925 [ACK] Seq=1 Ack=13 Win=14528 Len=0 TSV=4028817 TSER=4043743
403175  72.042791     10.0.1.3 -> 10.0.1.2     TCP 38925 > 9040 [FIN, ACK] Seq=13 Ack=400000002 Win=2002944 Len=0 TSV=4061753 TSER=4046807
  1   0.000000     10.0.1.3 -> 10.0.1.2     TCP 34970 > 9040 [SYN] Seq=0 Win=5840 Len=0 MSS=1460 TSV=4068331 TSER=0 WS=6
  2   0.000294     10.0.1.2 -> 10.0.1.3     TCP 9040 > 34970 [SYN, ACK] Seq=0 Ack=1 Win=14480 Len=0 MSS=1460 TSV=4053407 TSER=4068331 WS=6
  3   0.000318     10.0.1.3 -> 10.0.1.2     TCP 34970 > 9040 [ACK] Seq=1 Ack=1 Win=5888 Len=0 TSV=4068331 TSER=4053407
  7   0.002194     10.0.1.2 -> 10.0.1.3     TCP 9040 > 34970 [ACK] Seq=1 Ack=13 Win=14528 Len=0 TSV=4053408 TSER=4068332
409974  72.450265     10.0.1.3 -> 10.0.1.2     TCP 34970 > 9040 [FIN, ACK] Seq=13 Ack=400000002 Win=2014528 Len=0 TSV=4086444 TSER=4071500
  1   0.000000     10.0.1.3 -> 10.0.1.2     TCP 34972 > 9040 [SYN] Seq=0 Win=5840 Len=0 MSS=1460 TSV=4093075 TSER=0 WS=6
  2   0.000322     10.0.1.2 -> 10.0.1.3     TCP 9040 > 34972 [SYN, ACK] Seq=0 Ack=1 Win=14480 Len=0 MSS=1460 TSV=4078153 TSER=4093075 WS=6
  3   0.000345     10.0.1.3 -> 10.0.1.2     TCP 34972 > 9040 [ACK] Seq=1 Ack=1 Win=5888 Len=0 TSV=4093075 TSER=4078153
  7   0.002257     10.0.1.2 -> 10.0.1.3     TCP 9040 > 34972 [ACK] Seq=1 Ack=13 Win=14528 Len=0 TSV=4078154 TSER=4093076
414923  71.610293     10.0.1.3 -> 10.0.1.2     TCP 34972 > 9040 [FIN, ACK] Seq=13 Ack=400000002 Win=2017408 Len=0 TSV=4110978 TSER=4096036
  1   0.000000     10.0.1.3 -> 10.0.1.2     TCP 34974 > 9040 [SYN] Seq=0 Win=5840 Len=0 MSS=1460 TSV=4117663 TSER=0 WS=6
  2   0.000370     10.0.1.2 -> 10.0.1.3     TCP 9040 > 34974 [SYN, ACK] Seq=0 Ack=1 Win=14480 Len=0 MSS=1460 TSV=4102743 TSER=4117663 WS=6
  3   0.000394     10.0.1.3 -> 10.0.1.2     TCP 34974 > 9040 [ACK] Seq=1 Ack=1 Win=5888 Len=0 TSV=4117663 TSER=4102743
  7   0.002349     10.0.1.2 -> 10.0.1.3     TCP 9040 > 34974 [ACK] Seq=1 Ack=13 Win=14528 Len=0 TSV=4102743 TSER=4117663
412359  72.006197     10.0.1.3 -> 10.0.1.2     TCP 34974 > 9040 [FIN, ACK] Seq=13 Ack=400000002 Win=2026112 Len=0 TSV=4135664 TSER=4120724
  1   0.000000     10.0.1.3 -> 10.0.1.2     TCP 57944 > 9040 [SYN] Seq=0 Win=5840 Len=0 MSS=1460 TSV=4142353 TSER=0 WS=6
  2   0.000303     10.0.1.2 -> 10.0.1.3     TCP 9040 > 57944 [SYN, ACK] Seq=0 Ack=1 Win=14480 Len=0 MSS=1460 TSV=4127435 TSER=4142353 WS=6
  3   0.000329     10.0.1.3 -> 10.0.1.2     TCP 57944 > 9040 [ACK] Seq=1 Ack=1 Win=5888 Len=0 TSV=4142353 TSER=4127435
  7   0.002337     10.0.1.2 -> 10.0.1.3     TCP 9040 > 57944 [ACK] Seq=1 Ack=13 Win=14528 Len=0 TSV=4127435 TSER=4142354
412562  74.144911     10.0.1.3 -> 10.0.1.2     TCP 57944 > 9040 [FIN, ACK] Seq=13 Ack=400000002 Win=2017408 Len=0 TSV=4160889 TSER=4145951
  1   0.000000     10.0.1.3 -> 10.0.1.2     TCP 57946 > 9040 [SYN] Seq=0 Win=5840 Len=0 MSS=1460 TSV=4167509 TSER=0 WS=6
  2   0.000377     10.0.1.2 -> 10.0.1.3     TCP 9040 > 57946 [SYN, ACK] Seq=0 Ack=1 Win=14480 Len=0 MSS=1460 TSV=4152593 TSER=4167509 WS=6
  3   0.000402     10.0.1.3 -> 10.0.1.2     TCP 57946 > 9040 [ACK] Seq=1 Ack=1 Win=5888 Len=0 TSV=4167509 TSER=4152593
  7   0.003790     10.0.1.2 -> 10.0.1.3     TCP 9040 > 57946 [ACK] Seq=1 Ack=13 Win=14528 Len=0 TSV=4152594 TSER=4167510
402467  75.547768     10.0.1.3 -> 10.0.1.2     TCP 57946 > 9040 [FIN, ACK] Seq=13 Ack=400000002 Win=2023168 Len=0 TSV=4186397 TSER=4171460
  1   0.000000     10.0.1.3 -> 10.0.1.2     TCP 57948 > 9040 [SYN] Seq=0 Win=5840 Len=0 MSS=1460 TSV=4193084 TSER=0 WS=6
  2   0.000291     10.0.1.2 -> 10.0.1.3     TCP 9040 > 57948 [SYN, ACK] Seq=0 Ack=1 Win=14480 Len=0 MSS=1460 TSV=4178170 TSER=4193084 WS=6
  3   0.000319     10.0.1.3 -> 10.0.1.2     TCP 57948 > 9040 [ACK] Seq=1 Ack=1 Win=5888 Len=0 TSV=4193084 TSER=4178170
  7   0.003595     10.0.1.2 -> 10.0.1.3     TCP 9040 > 57948 [ACK] Seq=1 Ack=13 Win=14528 Len=0 TSV=4178171 TSER=4193085
403500  74.096078     10.0.1.3 -> 10.0.1.2     TCP 57948 > 9040 [FIN, ACK] Seq=13 Ack=400000002 Win=2023168 Len=0 TSV=4211609 TSER=4196673
  1   0.000000     10.0.1.3 -> 10.0.1.2     TCP 57655 > 9040 [SYN] Seq=0 Win=5840 Len=0 MSS=1460 TSV=4218082 TSER=0 WS=6
  2   0.000331     10.0.1.2 -> 10.0.1.3     TCP 9040 > 57655 [SYN, ACK] Seq=0 Ack=1 Win=14480 Len=0 MSS=1460 TSV=4203169 TSER=4218082 WS=6
  3   0.000355     10.0.1.3 -> 10.0.1.2     TCP 57655 > 9040 [ACK] Seq=1 Ack=1 Win=5888 Len=0 TSV=4218082 TSER=4203169
  7   0.002442     10.0.1.2 -> 10.0.1.3     TCP 9040 > 57655 [ACK] Seq=1 Ack=13 Win=14528 Len=0 TSV=4203170 TSER=4218082
411265  74.795515     10.0.1.3 -> 10.0.1.2     TCP 57655 > 9040 [FIN, ACK] Seq=13 Ack=400000002 Win=2026112 Len=0 TSV=4236781 TSER=4221848
