  1   0.000000     10.0.1.3 -> 10.0.1.2     TCP 49617 > 9040 [SYN] Seq=0 Win=5840 Len=0 MSS=1460 TSV=2383261 TSER=0 WS=6
  2   0.000319     10.0.1.2 -> 10.0.1.3     TCP 9040 > 49617 [SYN, ACK] Seq=0 Ack=1 Win=14480 Len=0 MSS=1460 TSV=2791022 TSER=2383261 WS=6
  3   0.000343     10.0.1.3 -> 10.0.1.2     TCP 49617 > 9040 [ACK] Seq=1 Ack=1 Win=5888 Len=0 TSV=2383261 TSER=2791022
  7   0.002314     10.0.1.2 -> 10.0.1.3     TCP 9040 > 49617 [ACK] Seq=1 Ack=13 Win=14528 Len=0 TSV=2791023 TSER=2383261
463104  38.341625     10.0.1.3 -> 10.0.1.2     TCP 49617 > 9040 [FIN, ACK] Seq=13 Ack=450000002 Win=2580480 Len=0 TSV=2392846 TSER=2800553
463105  38.341891     10.0.1.2 -> 10.0.1.3     TCP 9040 > 49617 [ACK] Seq=450000002 Ack=14 Win=14528 Len=0 TSV=2800608 TSER=2392846
  1   0.000000     10.0.1.3 -> 10.0.1.2     TCP 49619 > 9040 [SYN] Seq=0 Win=5840 Len=0 MSS=1460 TSV=2400110 TSER=0 WS=6
  2   0.000302     10.0.1.2 -> 10.0.1.3     TCP 9040 > 49619 [SYN, ACK] Seq=0 Ack=1 Win=14480 Len=0 MSS=1460 TSV=2807873 TSER=2400110 WS=6
  3   0.000327     10.0.1.3 -> 10.0.1.2     TCP 49619 > 9040 [ACK] Seq=1 Ack=1 Win=5888 Len=0 TSV=2400110 TSER=2807873
  7   0.002246     10.0.1.2 -> 10.0.1.3     TCP 9040 > 49619 [ACK] Seq=1 Ack=13 Win=14528 Len=0 TSV=2807873 TSER=2400110
428767  38.332403     10.0.1.3 -> 10.0.1.2     TCP 49619 > 9040 [FIN, ACK] Seq=13 Ack=450000002 Win=2580480 Len=0 TSV=2409693 TSER=2817401
428768  38.332651     10.0.1.2 -> 10.0.1.3     TCP 9040 > 49619 [ACK] Seq=450000002 Ack=14 Win=14528 Len=0 TSV=2817456 TSER=2409693
  1   0.000000     10.0.1.3 -> 10.0.1.2     TCP 41839 > 9040 [SYN] Seq=0 Win=5840 Len=0 MSS=1460 TSV=2416468 TSER=0 WS=6
  2   0.000365     10.0.1.2 -> 10.0.1.3     TCP 9040 > 41839 [SYN, ACK] Seq=0 Ack=1 Win=14480 Len=0 MSS=1460 TSV=2824232 TSER=2416468 WS=6
  3   0.000389     10.0.1.3 -> 10.0.1.2     TCP 41839 > 9040 [ACK] Seq=1 Ack=1 Win=5888 Len=0 TSV=2416468 TSER=2824232
  7   0.002222     10.0.1.2 -> 10.0.1.3     TCP 9040 > 41839 [ACK] Seq=1 Ack=13 Win=14528 Len=0 TSV=2824232 TSER=2416468
428862  38.352880     10.0.1.3 -> 10.0.1.2     TCP 41839 > 9040 [FIN, ACK] Seq=13 Ack=450000002 Win=2580480 Len=0 TSV=2426056 TSER=2833766
428863  38.353127     10.0.1.2 -> 10.0.1.3     TCP 9040 > 41839 [ACK] Seq=450000002 Ack=14 Win=14528 Len=0 TSV=2833821 TSER=2426056
  1   0.000000     10.0.1.3 -> 10.0.1.2     TCP 41842 > 9040 [SYN] Seq=0 Win=5840 Len=0 MSS=1460 TSV=2433487 TSER=0 WS=6
  2   0.000321     10.0.1.2 -> 10.0.1.3     TCP 9040 > 41842 [SYN, ACK] Seq=0 Ack=1 Win=14480 Len=0 MSS=1460 TSV=2841252 TSER=2433487 WS=6
  3   0.000347     10.0.1.3 -> 10.0.1.2     TCP 41842 > 9040 [ACK] Seq=1 Ack=1 Win=5888 Len=0 TSV=2433487 TSER=2841252
  7   0.002284     10.0.1.2 -> 10.0.1.3     TCP 9040 > 41842 [ACK] Seq=1 Ack=13 Win=14528 Len=0 TSV=2841253 TSER=2433487
462919  38.335564     10.0.1.3 -> 10.0.1.2     TCP 41842 > 9040 [FIN, ACK] Seq=13 Ack=450000002 Win=2580480 Len=0 TSV=2443071 TSER=2850782
462920  38.335831     10.0.1.2 -> 10.0.1.3     TCP 9040 > 41842 [ACK] Seq=450000002 Ack=14 Win=14528 Len=0 TSV=2850837 TSER=2443071
  1   0.000000     10.0.1.3 -> 10.0.1.2     TCP 41846 > 9040 [SYN] Seq=0 Win=5840 Len=0 MSS=1460 TSV=2450315 TSER=0 WS=6
  2   0.000314     10.0.1.2 -> 10.0.1.3     TCP 9040 > 41846 [SYN, ACK] Seq=0 Ack=1 Win=14480 Len=0 MSS=1460 TSV=2858082 TSER=2450315 WS=6
  3   0.000338     10.0.1.3 -> 10.0.1.2     TCP 41846 > 9040 [ACK] Seq=1 Ack=1 Win=5888 Len=0 TSV=2450315 TSER=2858082
  7   0.002390     10.0.1.2 -> 10.0.1.3     TCP 9040 > 41846 [ACK] Seq=1 Ack=13 Win=14528 Len=0 TSV=2858082 TSER=2450316
22802   1.919948     10.0.1.3 -> 10.0.1.2     TCP 36949 > 9040 [SYN] Seq=0 Win=5840 Len=0 MSS=1460 TSV=2726221 TSER=0 WS=6
25431   2.136578     10.0.1.2 -> 10.0.1.3     TCP 9040 > 36949 [SYN, ACK] Seq=0 Ack=1 Win=14480 Len=0 MSS=1460 TSV=3134008 TSER=2726221 WS=6
25432   2.136603     10.0.1.3 -> 10.0.1.2     TCP 36949 > 9040 [ACK] Seq=1 Ack=1 Win=5888 Len=0 TSV=2726275 TSER=3134008
30671   2.569344     10.0.1.2 -> 10.0.1.3     TCP 9040 > 36949 [ACK] Seq=1 Ack=13 Win=14528 Len=0 TSV=3134116 TSER=2726329
213798  17.880681     10.0.1.3 -> 10.0.1.2     TCP 36947 > 9040 [FIN, ACK] Seq=1 Ack=159197354 Win=40320 Len=0 TSV=2730211 TSER=3137889
624191  51.895407     10.0.1.3 -> 10.0.1.2     TCP 36949 > 9040 [FIN, ACK] Seq=13 Ack=450000002 Win=2580480 Len=0 TSV=2738714 TSER=3146447
624192  51.895616     10.0.1.2 -> 10.0.1.3     TCP 9040 > 36949 [ACK] Seq=450000002 Ack=14 Win=14528 Len=0 TSV=3146502 TSER=2738714
  1   0.000000     10.0.1.3 -> 10.0.1.2     TCP 36953 > 9040 [SYN] Seq=0 Win=5840 Len=0 MSS=1460 TSV=2747836 TSER=0 WS=6
  2   0.000360     10.0.1.2 -> 10.0.1.3     TCP 9040 > 36953 [SYN, ACK] Seq=0 Ack=1 Win=14480 Len=0 MSS=1460 TSV=3155625 TSER=2747836 WS=6
  3   0.000385     10.0.1.3 -> 10.0.1.2     TCP 36953 > 9040 [ACK] Seq=1 Ack=1 Win=5888 Len=0 TSV=2747836 TSER=3155625
  7   0.002307     10.0.1.2 -> 10.0.1.3     TCP 9040 > 36953 [ACK] Seq=1 Ack=13 Win=14528 Len=0 TSV=3155625 TSER=2747836
439973  38.350753     10.0.1.3 -> 10.0.1.2     TCP 36953 > 9040 [FIN, ACK] Seq=13 Ack=450000002 Win=2580480 Len=0 TSV=2757424 TSER=3165158
439974  38.351012     10.0.1.2 -> 10.0.1.3     TCP 9040 > 36953 [ACK] Seq=450000002 Ack=14 Win=14528 Len=0 TSV=3165213 TSER=2757424
  1   0.000000     10.0.1.3 -> 10.0.1.2     TCP 36955 > 9040 [SYN] Seq=0 Win=5840 Len=0 MSS=1460 TSV=2764233 TSER=0 WS=6
  2   0.000278     10.0.1.2 -> 10.0.1.3     TCP 9040 > 36955 [SYN, ACK] Seq=0 Ack=1 Win=14480 Len=0 MSS=1460 TSV=3172023 TSER=2764233 WS=6
  3   0.000301     10.0.1.3 -> 10.0.1.2     TCP 36955 > 9040 [ACK] Seq=1 Ack=1 Win=5888 Len=0 TSV=2764234 TSER=3172023
  7   0.002154     10.0.1.2 -> 10.0.1.3     TCP 9040 > 36955 [ACK] Seq=1 Ack=13 Win=14528 Len=0 TSV=3172024 TSER=2764234
412714  38.573998     10.0.1.3 -> 10.0.1.2     TCP 36955 > 9040 [FIN, ACK] Seq=13 Ack=450000002 Win=2580480 Len=0 TSV=2773877 TSER=3181613
412715  38.574241     10.0.1.2 -> 10.0.1.3     TCP 9040 > 36955 [ACK] Seq=450000002 Ack=14 Win=14528 Len=0 TSV=3181668 TSER=2773877
  1   0.000000     10.0.1.3 -> 10.0.1.2     TCP 35416 > 9040 [SYN] Seq=0 Win=5840 Len=0 MSS=1460 TSV=2780506 TSER=0 WS=6
  2   0.000369     10.0.1.2 -> 10.0.1.3     TCP 9040 > 35416 [SYN, ACK] Seq=0 Ack=1 Win=14480 Len=0 MSS=1460 TSV=3188297 TSER=2780506 WS=6
  3   0.000394     10.0.1.3 -> 10.0.1.2     TCP 35416 > 9040 [ACK] Seq=1 Ack=1 Win=5888 Len=0 TSV=2780506 TSER=3188297
  7   0.002355     10.0.1.2 -> 10.0.1.3     TCP 9040 > 35416 [ACK] Seq=1 Ack=13 Win=14528 Len=0 TSV=3188298 TSER=2780507
463106  38.342697     10.0.1.3 -> 10.0.1.2     TCP 35416 > 9040 [FIN, ACK] Seq=13 Ack=450000002 Win=2580480 Len=0 TSV=2790092 TSER=3197829
463107  38.342932     10.0.1.2 -> 10.0.1.3     TCP 9040 > 35416 [ACK] Seq=450000002 Ack=14 Win=14528 Len=0 TSV=3197884 TSER=2790092
  1   0.000000     10.0.1.3 -> 10.0.1.2     TCP 35418 > 9040 [SYN] Seq=0 Win=5840 Len=0 MSS=1460 TSV=2797279 TSER=0 WS=6
  2   0.000302     10.0.1.2 -> 10.0.1.3     TCP 9040 > 35418 [SYN, ACK] Seq=0 Ack=1 Win=14480 Len=0 MSS=1460 TSV=3205072 TSER=2797279 WS=6
  3   0.000330     10.0.1.3 -> 10.0.1.2     TCP 35418 > 9040 [ACK] Seq=1 Ack=1 Win=5888 Len=0 TSV=2797279 TSER=3205072
  7   0.002261     10.0.1.2 -> 10.0.1.3     TCP 9040 > 35418 [ACK] Seq=1 Ack=13 Win=14528 Len=0 TSV=3205072 TSER=2797280
445740  38.337893     10.0.1.3 -> 10.0.1.2     TCP 35418 > 9040 [FIN, ACK] Seq=13 Ack=450000002 Win=2580480 Len=0 TSV=2806864 TSER=3214602
445741  38.338133     10.0.1.2 -> 10.0.1.3     TCP 9040 > 35418 [ACK] Seq=450000002 Ack=14 Win=14528 Len=0 TSV=3214657 TSER=2806864
  1   0.000000     10.0.1.3 -> 10.0.1.2     TCP 35421 > 9040 [SYN] Seq=0 Win=5840 Len=0 MSS=1460 TSV=2814041 TSER=0 WS=6
  2   0.000272     10.0.1.2 -> 10.0.1.3     TCP 9040 > 35421 [SYN, ACK] Seq=0 Ack=1 Win=14480 Len=0 MSS=1460 TSV=3221835 TSER=2814041 WS=6
  3   0.000297     10.0.1.3 -> 10.0.1.2     TCP 35421 > 9040 [ACK] Seq=1 Ack=1 Win=5888 Len=0 TSV=2814041 TSER=3221835
  7   0.002330     10.0.1.2 -> 10.0.1.3     TCP 9040 > 35421 [ACK] Seq=1 Ack=13 Win=14528 Len=0 TSV=3221835 TSER=2814041
432535  38.342366     10.0.1.3 -> 10.0.1.2     TCP 35421 > 9040 [FIN, ACK] Seq=13 Ack=450000002 Win=2580480 Len=0 TSV=2823627 TSER=3231366
432536  38.342616     10.0.1.2 -> 10.0.1.3     TCP 9040 > 35421 [ACK] Seq=450000002 Ack=14 Win=14528 Len=0 TSV=3231421 TSER=2823627
  1   0.000000     10.0.1.3 -> 10.0.1.2     TCP 35425 > 9040 [SYN] Seq=0 Win=5840 Len=0 MSS=1460 TSV=2830570 TSER=0 WS=6
  2   0.000372     10.0.1.2 -> 10.0.1.3     TCP 9040 > 35425 [SYN, ACK] Seq=0 Ack=1 Win=14480 Len=0 MSS=1460 TSV=3238365 TSER=2830570 WS=6
  3   0.000398     10.0.1.3 -> 10.0.1.2     TCP 35425 > 9040 [ACK] Seq=1 Ack=1 Win=5888 Len=0 TSV=2830570 TSER=3238365
  7   0.002318     10.0.1.2 -> 10.0.1.3     TCP 9040 > 35425 [ACK] Seq=1 Ack=13 Win=14528 Len=0 TSV=3238365 TSER=2830570
429366  38.351603     10.0.1.3 -> 10.0.1.2     TCP 35425 > 9040 [FIN, ACK] Seq=13 Ack=450000002 Win=2580480 Len=0 TSV=2840158 TSER=3247899
429367  38.351856     10.0.1.2 -> 10.0.1.3     TCP 9040 > 35425 [ACK] Seq=450000002 Ack=14 Win=14528 Len=0 TSV=3247954 TSER=2840158
  1   0.000000     10.0.1.3 -> 10.0.1.2     TCP 35427 > 9040 [SYN] Seq=0 Win=5840 Len=0 MSS=1460 TSV=2847115 TSER=0 WS=6
  2   0.000301     10.0.1.2 -> 10.0.1.3     TCP 9040 > 35427 [SYN, ACK] Seq=0 Ack=1 Win=14480 Len=0 MSS=1460 TSV=3254911 TSER=2847115 WS=6
  3   0.000327     10.0.1.3 -> 10.0.1.2     TCP 35427 > 9040 [ACK] Seq=1 Ack=1 Win=5888 Len=0 TSV=2847115 TSER=3254911
  7   0.002257     10.0.1.2 -> 10.0.1.3     TCP 9040 > 35427 [ACK] Seq=1 Ack=13 Win=14528 Len=0 TSV=3254911 TSER=2847115
462947  38.340755     10.0.1.3 -> 10.0.1.2     TCP 35427 > 9040 [FIN, ACK] Seq=13 Ack=450000002 Win=2580480 Len=0 TSV=2856700 TSER=3264442
462948  38.341004     10.0.1.2 -> 10.0.1.3     TCP 9040 > 35427 [ACK] Seq=450000002 Ack=14 Win=14528 Len=0 TSV=3264497 TSER=2856700
  1   0.000000     10.0.1.3 -> 10.0.1.2     TCP 46108 > 9040 [SYN] Seq=0 Win=5840 Len=0 MSS=1460 TSV=2863989 TSER=0 WS=6
  2   0.000304     10.0.1.2 -> 10.0.1.3     TCP 9040 > 46108 [SYN, ACK] Seq=0 Ack=1 Win=14480 Len=0 MSS=1460 TSV=3271786 TSER=2863989 WS=6
  3   0.000337     10.0.1.3 -> 10.0.1.2     TCP 46108 > 9040 [ACK] Seq=1 Ack=1 Win=5888 Len=0 TSV=2863989 TSER=3271786
  7   0.002568     10.0.1.2 -> 10.0.1.3     TCP 9040 > 46108 [ACK] Seq=1 Ack=13 Win=14528 Len=0 TSV=3271787 TSER=2863989
431510  38.340430     10.0.1.3 -> 10.0.1.2     TCP 46108 > 9040 [FIN, ACK] Seq=13 Ack=450000002 Win=2580480 Len=0 TSV=2873574 TSER=3281317
431511  38.340678     10.0.1.2 -> 10.0.1.3     TCP 9040 > 46108 [ACK] Seq=450000002 Ack=14 Win=14528 Len=0 TSV=3281372 TSER=2873574
  1   0.000000     10.0.1.3 -> 10.0.1.2     TCP 46110 > 9040 [SYN] Seq=0 Win=5840 Len=0 MSS=1460 TSV=2880440 TSER=0 WS=6
  2   0.000271     10.0.1.2 -> 10.0.1.3     TCP 9040 > 46110 [SYN, ACK] Seq=0 Ack=1 Win=14480 Len=0 MSS=1460 TSV=3288239 TSER=2880440 WS=6
  3   0.000294     10.0.1.3 -> 10.0.1.2     TCP 46110 > 9040 [ACK] Seq=1 Ack=1 Win=5888 Len=0 TSV=2880440 TSER=3288239
  7   0.002249     10.0.1.2 -> 10.0.1.3     TCP 9040 > 46110 [ACK] Seq=1 Ack=13 Win=14528 Len=0 TSV=3288239 TSER=2880440
428198  38.336652     10.0.1.3 -> 10.0.1.2     TCP 46110 > 9040 [FIN, ACK] Seq=13 Ack=450000002 Win=2580480 Len=0 TSV=2890024 TSER=3297768
428199  38.336906     10.0.1.2 -> 10.0.1.3     TCP 9040 > 46110 [ACK] Seq=450000002 Ack=14 Win=14528 Len=0 TSV=3297824 TSER=2890024
  1   0.000000     10.0.1.3 -> 10.0.1.2     TCP 46115 > 9040 [SYN] Seq=0 Win=5840 Len=0 MSS=1460 TSV=2896942 TSER=0 WS=6
  2   0.000298     10.0.1.2 -> 10.0.1.3     TCP 9040 > 46115 [SYN, ACK] Seq=0 Ack=1 Win=14480 Len=0 MSS=1460 TSV=3304742 TSER=2896942 WS=6
  3   0.000321     10.0.1.3 -> 10.0.1.2     TCP 46115 > 9040 [ACK] Seq=1 Ack=1 Win=5888 Len=0 TSV=2896942 TSER=3304742
  7   0.002198     10.0.1.2 -> 10.0.1.3     TCP 9040 > 46115 [ACK] Seq=1 Ack=13 Win=14528 Len=0 TSV=3304742 TSER=2896942
450426  38.338485     10.0.1.3 -> 10.0.1.2     TCP 46115 > 9040 [FIN, ACK] Seq=13 Ack=450000002 Win=2580480 Len=0 TSV=2906526 TSER=3314272
450427  38.338726     10.0.1.2 -> 10.0.1.3     TCP 9040 > 46115 [ACK] Seq=450000002 Ack=14 Win=14528 Len=0 TSV=3314327 TSER=2906526
  1   0.000000     10.0.1.3 -> 10.0.1.2     TCP 46117 > 9040 [SYN] Seq=0 Win=5840 Len=0 MSS=1460 TSV=2913220 TSER=0 WS=6
  2   0.000266     10.0.1.2 -> 10.0.1.3     TCP 9040 > 46117 [SYN, ACK] Seq=0 Ack=1 Win=14480 Len=0 MSS=1460 TSV=3321021 TSER=2913220 WS=6
  3   0.000283     10.0.1.3 -> 10.0.1.2     TCP 46117 > 9040 [ACK] Seq=1 Ack=1 Win=5888 Len=0 TSV=2913220 TSER=3321021
  7   0.002018     10.0.1.2 -> 10.0.1.3     TCP 9040 > 46117 [ACK] Seq=1 Ack=13 Win=14528 Len=0 TSV=3321021 TSER=2913220
462541  38.341432     10.0.1.3 -> 10.0.1.2     TCP 46117 > 9040 [FIN, ACK] Seq=13 Ack=450000002 Win=2580480 Len=0 TSV=2922805 TSER=3330552
462542  38.341679     10.0.1.2 -> 10.0.1.3     TCP 9040 > 46117 [ACK] Seq=450000002 Ack=14 Win=14528 Len=0 TSV=3330607 TSER=2922805
  1   0.000000     10.0.1.3 -> 10.0.1.2     TCP 46698 > 9040 [SYN] Seq=0 Win=5840 Len=0 MSS=1460 TSV=2930050 TSER=0 WS=6
  2   0.000292     10.0.1.2 -> 10.0.1.3     TCP 9040 > 46698 [SYN, ACK] Seq=0 Ack=1 Win=14480 Len=0 MSS=1460 TSV=3337853 TSER=2930050 WS=6
  3   0.000318     10.0.1.3 -> 10.0.1.2     TCP 46698 > 9040 [ACK] Seq=1 Ack=1 Win=5888 Len=0 TSV=2930051 TSER=3337853
  7   0.002226     10.0.1.2 -> 10.0.1.3     TCP 9040 > 46698 [ACK] Seq=1 Ack=13 Win=14528 Len=0 TSV=3337853 TSER=2930051
459937  38.339953     10.0.1.3 -> 10.0.1.2     TCP 46698 > 9040 [FIN, ACK] Seq=13 Ack=450000002 Win=2580480 Len=0 TSV=2939635 TSER=3347384
459938  38.340200     10.0.1.2 -> 10.0.1.3     TCP 9040 > 46698 [ACK] Seq=450000002 Ack=14 Win=14528 Len=0 TSV=3347439 TSER=2939635
  1   0.000000     10.0.1.3 -> 10.0.1.2     TCP 46701 > 9040 [SYN] Seq=0 Win=5840 Len=0 MSS=1460 TSV=2946576 TSER=0 WS=6
  2   0.000321     10.0.1.2 -> 10.0.1.3     TCP 9040 > 46701 [SYN, ACK] Seq=0 Ack=1 Win=14480 Len=0 MSS=1460 TSV=3354380 TSER=2946576 WS=6
  3   0.000347     10.0.1.3 -> 10.0.1.2     TCP 46701 > 9040 [ACK] Seq=1 Ack=1 Win=5888 Len=0 TSV=2946576 TSER=3354380
  7   0.002412     10.0.1.2 -> 10.0.1.3     TCP 9040 > 46701 [ACK] Seq=1 Ack=13 Win=14528 Len=0 TSV=3354380 TSER=2946576
404497  38.340840     10.0.1.3 -> 10.0.1.2     TCP 46701 > 9040 [FIN, ACK] Seq=13 Ack=450000002 Win=2580480 Len=0 TSV=2956161 TSER=3363910
404498  38.341089     10.0.1.2 -> 10.0.1.3     TCP 9040 > 46701 [ACK] Seq=450000002 Ack=14 Win=14528 Len=0 TSV=3363965 TSER=2956161
  1   0.000000     10.0.1.3 -> 10.0.1.2     TCP 46704 > 9040 [SYN] Seq=0 Win=5840 Len=0 MSS=1460 TSV=2962647 TSER=0 WS=6
  2   0.000317     10.0.1.2 -> 10.0.1.3     TCP 9040 > 46704 [SYN, ACK] Seq=0 Ack=1 Win=14480 Len=0 MSS=1460 TSV=3370452 TSER=2962647 WS=6
  3   0.000345     10.0.1.3 -> 10.0.1.2     TCP 46704 > 9040 [ACK] Seq=1 Ack=1 Win=5888 Len=0 TSV=2962648 TSER=3370452
  7   0.002384     10.0.1.2 -> 10.0.1.3     TCP 9040 > 46704 [ACK] Seq=1 Ack=13 Win=14528 Len=0 TSV=3370453 TSER=2962648
416114  38.339327     10.0.1.3 -> 10.0.1.2     TCP 46704 > 9040 [FIN, ACK] Seq=13 Ack=450000002 Win=2580480 Len=0 TSV=2972232 TSER=3379983
416115  38.339575     10.0.1.2 -> 10.0.1.3     TCP 9040 > 46704 [ACK] Seq=450000002 Ack=14 Win=14528 Len=0 TSV=3380038 TSER=2972232
  1   0.000000     10.0.1.3 -> 10.0.1.2     TCP 46708 > 9040 [SYN] Seq=0 Win=5840 Len=0 MSS=1460 TSV=2978987 TSER=0 WS=6
  2   0.000298     10.0.1.2 -> 10.0.1.3     TCP 9040 > 46708 [SYN, ACK] Seq=0 Ack=1 Win=14480 Len=0 MSS=1460 TSV=3386793 TSER=2978987 WS=6
  3   0.000322     10.0.1.3 -> 10.0.1.2     TCP 46708 > 9040 [ACK] Seq=1 Ack=1 Win=5888 Len=0 TSV=2978987 TSER=3386793
  7   0.002239     10.0.1.2 -> 10.0.1.3     TCP 9040 > 46708 [ACK] Seq=1 Ack=13 Win=14528 Len=0 TSV=3386793 TSER=2978987
443276  38.339786     10.0.1.3 -> 10.0.1.2     TCP 46708 > 9040 [FIN, ACK] Seq=13 Ack=450000002 Win=2580480 Len=0 TSV=2988572 TSER=3396323
443277  38.340038     10.0.1.2 -> 10.0.1.3     TCP 9040 > 46708 [ACK] Seq=450000002 Ack=14 Win=14528 Len=0 TSV=3396379 TSER=2988572
  1   0.000000     10.0.1.3 -> 10.0.1.2     TCP 46710 > 9040 [SYN] Seq=0 Win=5840 Len=0 MSS=1460 TSV=2995949 TSER=0 WS=6
  2   0.000284     10.0.1.2 -> 10.0.1.3     TCP 9040 > 46710 [SYN, ACK] Seq=0 Ack=1 Win=14480 Len=0 MSS=1460 TSV=3403756 TSER=2995949 WS=6
  3   0.000308     10.0.1.3 -> 10.0.1.2     TCP 46710 > 9040 [ACK] Seq=1 Ack=1 Win=5888 Len=0 TSV=2995949 TSER=3403756
  7   0.002203     10.0.1.2 -> 10.0.1.3     TCP 9040 > 46710 [ACK] Seq=1 Ack=13 Win=14528 Len=0 TSV=3403757 TSER=2995949
425224  38.338618     10.0.1.3 -> 10.0.1.2     TCP 46710 > 9040 [FIN, ACK] Seq=13 Ack=450000002 Win=2580480 Len=0 TSV=3005534 TSER=3413287
425225  38.338839     10.0.1.2 -> 10.0.1.3     TCP 9040 > 46710 [ACK] Seq=450000002 Ack=14 Win=14528 Len=0 TSV=3413342 TSER=3005534
  1   0.000000     10.0.1.3 -> 10.0.1.2     TCP 49994 > 9040 [SYN] Seq=0 Win=5840 Len=0 MSS=1460 TSV=3012355 TSER=0 WS=6
  2   0.000296     10.0.1.2 -> 10.0.1.3     TCP 9040 > 49994 [SYN, ACK] Seq=0 Ack=1 Win=14480 Len=0 MSS=1460 TSV=3420164 TSER=3012355 WS=6
  3   0.000318     10.0.1.3 -> 10.0.1.2     TCP 49994 > 9040 [ACK] Seq=1 Ack=1 Win=5888 Len=0 TSV=3012355 TSER=3420164
  7   0.002236     10.0.1.2 -> 10.0.1.3     TCP 9040 > 49994 [ACK] Seq=1 Ack=13 Win=14528 Len=0 TSV=3420164 TSER=3012355
426391  38.340015     10.0.1.3 -> 10.0.1.2     TCP 49994 > 9040 [FIN, ACK] Seq=13 Ack=450000002 Win=2580480 Len=0 TSV=3021940 TSER=3429695
426392  38.340262     10.0.1.2 -> 10.0.1.3     TCP 9040 > 49994 [ACK] Seq=450000002 Ack=14 Win=14528 Len=0 TSV=3429750 TSER=3021940
  1   0.000000     10.0.1.3 -> 10.0.1.2     TCP 49996 > 9040 [SYN] Seq=0 Win=5840 Len=0 MSS=1460 TSV=3028690 TSER=0 WS=6
  2   0.000286     10.0.1.2 -> 10.0.1.3     TCP 9040 > 49996 [SYN, ACK] Seq=0 Ack=1 Win=14480 Len=0 MSS=1460 TSV=3436500 TSER=3028690 WS=6
  3   0.000310     10.0.1.3 -> 10.0.1.2     TCP 49996 > 9040 [ACK] Seq=1 Ack=1 Win=5888 Len=0 TSV=3028690 TSER=3436500
  7   0.002318     10.0.1.2 -> 10.0.1.3     TCP 9040 > 49996 [ACK] Seq=1 Ack=13 Win=14528 Len=0 TSV=3436501 TSER=3028691
459821  38.336975     10.0.1.3 -> 10.0.1.2     TCP 49996 > 9040 [FIN, ACK] Seq=13 Ack=450000002 Win=2580480 Len=0 TSV=3038275 TSER=3446030
459822  38.337220     10.0.1.2 -> 10.0.1.3     TCP 9040 > 49996 [ACK] Seq=450000002 Ack=14 Win=14528 Len=0 TSV=3446085 TSER=3038275
  1   0.000000     10.0.1.3 -> 10.0.1.2     TCP 50001 > 9040 [SYN] Seq=0 Win=5840 Len=0 MSS=1460 TSV=3045586 TSER=0 WS=6
  2   0.000320     10.0.1.2 -> 10.0.1.3     TCP 9040 > 50001 [SYN, ACK] Seq=0 Ack=1 Win=14480 Len=0 MSS=1460 TSV=3453397 TSER=3045586 WS=6
  3   0.000343     10.0.1.3 -> 10.0.1.2     TCP 50001 > 9040 [ACK] Seq=1 Ack=1 Win=5888 Len=0 TSV=3045586 TSER=3453397
  7   0.002374     10.0.1.2 -> 10.0.1.3     TCP 9040 > 50001 [ACK] Seq=1 Ack=13 Win=14528 Len=0 TSV=3453397 TSER=3045586
428753  38.337528     10.0.1.3 -> 10.0.1.2     TCP 50001 > 9040 [FIN, ACK] Seq=13 Ack=450000002 Win=2580480 Len=0 TSV=3055170 TSER=3462927
428754  38.337769     10.0.1.2 -> 10.0.1.3     TCP 9040 > 50001 [ACK] Seq=450000002 Ack=14 Win=14528 Len=0 TSV=3462982 TSER=3055170
