  1   0.000000     10.0.1.3 -> 10.0.1.2     TCP 56457 > 9040 [SYN] Seq=0 Win=5840 Len=0 MSS=1460 TSV=2082250 TSER=0 WS=6
  2   0.000287     10.0.1.2 -> 10.0.1.3     TCP 9040 > 56457 [SYN, ACK] Seq=0 Ack=1 Win=14480 Len=0 MSS=1460 TSV=2489989 TSER=2082250 WS=6
  3   0.000310     10.0.1.3 -> 10.0.1.2     TCP 56457 > 9040 [ACK] Seq=1 Ack=1 Win=5888 Len=0 TSV=2082250 TSER=2489989
  7   0.002182     10.0.1.2 -> 10.0.1.3     TCP 9040 > 56457 [ACK] Seq=1 Ack=13 Win=14528 Len=0 TSV=2489989 TSER=2082250
410049  34.089408     10.0.1.3 -> 10.0.1.2     TCP 56457 > 9040 [FIN, ACK] Seq=13 Ack=400000002 Win=2580480 Len=0 TSV=2090772 TSER=2498457
410050  34.089666     10.0.1.2 -> 10.0.1.3     TCP 9040 > 56457 [ACK] Seq=400000002 Ack=14 Win=14528 Len=0 TSV=2498512 TSER=2090772
  1   0.000000     10.0.1.3 -> 10.0.1.2     TCP 56459 > 9040 [SYN] Seq=0 Win=5840 Len=0 MSS=1460 TSV=2097545 TSER=0 WS=6
  2   0.000276     10.0.1.2 -> 10.0.1.3     TCP 9040 > 56459 [SYN, ACK] Seq=0 Ack=1 Win=14480 Len=0 MSS=1460 TSV=2505285 TSER=2097545 WS=6
  3   0.000299     10.0.1.3 -> 10.0.1.2     TCP 56459 > 9040 [ACK] Seq=1 Ack=1 Win=5888 Len=0 TSV=2097545 TSER=2505285
  7   0.002199     10.0.1.2 -> 10.0.1.3     TCP 9040 > 56459 [ACK] Seq=1 Ack=13 Win=14528 Len=0 TSV=2505286 TSER=2097546
387913  34.091005     10.0.1.3 -> 10.0.1.2     TCP 56459 > 9040 [FIN, ACK] Seq=13 Ack=400000002 Win=2580480 Len=0 TSV=2106068 TSER=2513754
387914  34.091248     10.0.1.2 -> 10.0.1.3     TCP 9040 > 56459 [ACK] Seq=400000002 Ack=14 Win=14528 Len=0 TSV=2513809 TSER=2106068
  1   0.000000     10.0.1.3 -> 10.0.1.2     TCP 55713 > 9040 [SYN] Seq=0 Win=5840 Len=0 MSS=1460 TSV=2112337 TSER=0 WS=6
  2   0.000278     10.0.1.2 -> 10.0.1.3     TCP 9040 > 55713 [SYN, ACK] Seq=0 Ack=1 Win=14480 Len=0 MSS=1460 TSV=2520078 TSER=2112337 WS=6
  3   0.000303     10.0.1.3 -> 10.0.1.2     TCP 55713 > 9040 [ACK] Seq=1 Ack=1 Win=5888 Len=0 TSV=2112337 TSER=2520078
  7   0.002398     10.0.1.2 -> 10.0.1.3     TCP 9040 > 55713 [ACK] Seq=1 Ack=13 Win=14528 Len=0 TSV=2520079 TSER=2112338
410429  34.077830     10.0.1.3 -> 10.0.1.2     TCP 55713 > 9040 [FIN, ACK] Seq=13 Ack=400000002 Win=2580480 Len=0 TSV=2120857 TSER=2528543
410430  34.078078     10.0.1.2 -> 10.0.1.3     TCP 9040 > 55713 [ACK] Seq=400000002 Ack=14 Win=14528 Len=0 TSV=2528598 TSER=2120857
  1   0.000000     10.0.1.3 -> 10.0.1.2     TCP 55715 > 9040 [SYN] Seq=0 Win=5840 Len=0 MSS=1460 TSV=2127526 TSER=0 WS=6
  2   0.000370     10.0.1.2 -> 10.0.1.3     TCP 9040 > 55715 [SYN, ACK] Seq=0 Ack=1 Win=14480 Len=0 MSS=1460 TSV=2535269 TSER=2127526 WS=6
  3   0.000395     10.0.1.3 -> 10.0.1.2     TCP 55715 > 9040 [ACK] Seq=1 Ack=1 Win=5888 Len=0 TSV=2127526 TSER=2535269
  7   0.002346     10.0.1.2 -> 10.0.1.3     TCP 9040 > 55715 [ACK] Seq=1 Ack=13 Win=14528 Len=0 TSV=2535269 TSER=2127527
382727  34.082708     10.0.1.3 -> 10.0.1.2     TCP 55715 > 9040 [FIN, ACK] Seq=13 Ack=400000002 Win=2580480 Len=0 TSV=2136047 TSER=2543735
382728  34.082925     10.0.1.2 -> 10.0.1.3     TCP 9040 > 55715 [ACK] Seq=400000002 Ack=14 Win=14528 Len=0 TSV=2543790 TSER=2136047
  1   0.000000     10.0.1.3 -> 10.0.1.2     TCP 55717 > 9040 [SYN] Seq=0 Win=5840 Len=0 MSS=1460 TSV=2142398 TSER=0 WS=6
  2   0.000287     10.0.1.2 -> 10.0.1.3     TCP 9040 > 55717 [SYN, ACK] Seq=0 Ack=1 Win=14480 Len=0 MSS=1460 TSV=2550141 TSER=2142398 WS=6
  3   0.000311     10.0.1.3 -> 10.0.1.2     TCP 55717 > 9040 [ACK] Seq=1 Ack=1 Win=5888 Len=0 TSV=2142398 TSER=2550141
  7   0.002223     10.0.1.2 -> 10.0.1.3     TCP 9040 > 55717 [ACK] Seq=1 Ack=13 Win=14528 Len=0 TSV=2550142 TSER=2142398
395394  34.076912     10.0.1.3 -> 10.0.1.2     TCP 55717 > 9040 [FIN, ACK] Seq=13 Ack=400000002 Win=2580480 Len=0 TSV=2150917 TSER=2558606
395395  34.077166     10.0.1.2 -> 10.0.1.3     TCP 9040 > 55717 [ACK] Seq=400000002 Ack=14 Win=14528 Len=0 TSV=2558661 TSER=2150917
  1   0.000000     10.0.1.3 -> 10.0.1.2     TCP 55721 > 9040 [SYN] Seq=0 Win=5840 Len=0 MSS=1460 TSV=2157350 TSER=0 WS=6
  2   0.000290     10.0.1.2 -> 10.0.1.3     TCP 9040 > 55721 [SYN, ACK] Seq=0 Ack=1 Win=14480 Len=0 MSS=1460 TSV=2565094 TSER=2157350 WS=6
  3   0.000317     10.0.1.3 -> 10.0.1.2     TCP 55721 > 9040 [ACK] Seq=1 Ack=1 Win=5888 Len=0 TSV=2157350 TSER=2565094
  7   0.002423     10.0.1.2 -> 10.0.1.3     TCP 9040 > 55721 [ACK] Seq=1 Ack=13 Win=14528 Len=0 TSV=2565095 TSER=2157351
  1   0.000000     10.0.1.3 -> 10.0.1.2     TCP 55723 > 9040 [SYN] Seq=0 Win=5840 Len=0 MSS=1460 TSV=2172118 TSER=0 WS=6
  2   0.000308     10.0.1.2 -> 10.0.1.3     TCP 9040 > 55723 [SYN, ACK] Seq=0 Ack=1 Win=14480 Len=0 MSS=1460 TSV=2579863 TSER=2172118 WS=6
  3   0.000333     10.0.1.3 -> 10.0.1.2     TCP 55723 > 9040 [ACK] Seq=1 Ack=1 Win=5888 Len=0 TSV=2172118 TSER=2579863
  7   0.002254     10.0.1.2 -> 10.0.1.3     TCP 9040 > 55723 [ACK] Seq=1 Ack=13 Win=14528 Len=0 TSV=2579864 TSER=2172118
399383  34.079333     10.0.1.3 -> 10.0.1.2     TCP 55723 > 9040 [FIN, ACK] Seq=13 Ack=400000002 Win=2580480 Len=0 TSV=2180637 TSER=2588329
399384  34.079582     10.0.1.2 -> 10.0.1.3     TCP 9040 > 55723 [ACK] Seq=400000002 Ack=14 Win=14528 Len=0 TSV=2588384 TSER=2180637
  1   0.000000     10.0.1.3 -> 10.0.1.2     TCP 51500 > 9040 [SYN] Seq=0 Win=5840 Len=0 MSS=1460 TSV=2187154 TSER=0 WS=6
  2   0.000284     10.0.1.2 -> 10.0.1.3     TCP 9040 > 51500 [SYN, ACK] Seq=0 Ack=1 Win=14480 Len=0 MSS=1460 TSV=2594901 TSER=2187154 WS=6
  3   0.000308     10.0.1.3 -> 10.0.1.2     TCP 51500 > 9040 [ACK] Seq=1 Ack=1 Win=5888 Len=0 TSV=2187154 TSER=2594901
  7   0.002103     10.0.1.2 -> 10.0.1.3     TCP 9040 > 51500 [ACK] Seq=1 Ack=13 Win=14528 Len=0 TSV=2594901 TSER=2187154
396743  35.318039     10.0.1.3 -> 10.0.1.2     TCP 51500 > 9040 [FIN, ACK] Seq=13 Ack=400000002 Win=2580480 Len=0 TSV=2195983 TSER=2603676
396744  35.318284     10.0.1.2 -> 10.0.1.3     TCP 9040 > 51500 [ACK] Seq=400000002 Ack=14 Win=14528 Len=0 TSV=2603731 TSER=2195983
  1   0.000000     10.0.1.3 -> 10.0.1.2     TCP 51503 > 9040 [SYN] Seq=0 Win=5840 Len=0 MSS=1460 TSV=2202521 TSER=0 WS=6
  2   0.000294     10.0.1.2 -> 10.0.1.3     TCP 9040 > 51503 [SYN, ACK] Seq=0 Ack=1 Win=14480 Len=0 MSS=1460 TSV=2610268 TSER=2202521 WS=6
  3   0.000317     10.0.1.3 -> 10.0.1.2     TCP 51503 > 9040 [ACK] Seq=1 Ack=1 Win=5888 Len=0 TSV=2202521 TSER=2610268
  7   0.002260     10.0.1.2 -> 10.0.1.3     TCP 9040 > 51503 [ACK] Seq=1 Ack=13 Win=14528 Len=0 TSV=2610269 TSER=2202521
383065  34.084362     10.0.1.3 -> 10.0.1.2     TCP 51503 > 9040 [FIN, ACK] Seq=13 Ack=400000002 Win=2574592 Len=0 TSV=2211042 TSER=2618735
383066  34.084620     10.0.1.2 -> 10.0.1.3     TCP 9040 > 51503 [ACK] Seq=400000002 Ack=14 Win=14528 Len=0 TSV=2618790 TSER=2211042
  1   0.000000     10.0.1.3 -> 10.0.1.2     TCP 51505 > 9040 [SYN] Seq=0 Win=5840 Len=0 MSS=1460 TSV=2217330 TSER=0 WS=6
  2   0.000319     10.0.1.2 -> 10.0.1.3     TCP 9040 > 51505 [SYN, ACK] Seq=0 Ack=1 Win=14480 Len=0 MSS=1460 TSV=2625079 TSER=2217330 WS=6
  3   0.000342     10.0.1.3 -> 10.0.1.2     TCP 51505 > 9040 [ACK] Seq=1 Ack=1 Win=5888 Len=0 TSV=2217330 TSER=2625079
  7   0.002338     10.0.1.2 -> 10.0.1.3     TCP 9040 > 51505 [ACK] Seq=1 Ack=13 Win=14528 Len=0 TSV=2625080 TSER=2217331
  1   0.000000     10.0.1.3 -> 10.0.1.2     TCP 51509 > 9040 [SYN] Seq=0 Win=5840 Len=0 MSS=1460 TSV=2231937 TSER=0 WS=6
  2   0.000339     10.0.1.2 -> 10.0.1.3     TCP 9040 > 51509 [SYN, ACK] Seq=0 Ack=1 Win=14480 Len=0 MSS=1460 TSV=2639687 TSER=2231937 WS=6
  3   0.000365     10.0.1.3 -> 10.0.1.2     TCP 51509 > 9040 [ACK] Seq=1 Ack=1 Win=5888 Len=0 TSV=2231937 TSER=2639687
  7   0.002306     10.0.1.2 -> 10.0.1.3     TCP 9040 > 51509 [ACK] Seq=1 Ack=13 Win=14528 Len=0 TSV=2639687 TSER=2231937
411270  34.081853     10.0.1.3 -> 10.0.1.2     TCP 51509 > 9040 [FIN, ACK] Seq=13 Ack=400000002 Win=2580480 Len=0 TSV=2240457 TSER=2648153
411271  34.082082     10.0.1.2 -> 10.0.1.3     TCP 9040 > 51509 [ACK] Seq=400000002 Ack=14 Win=14528 Len=0 TSV=2648208 TSER=2240457
  1   0.000000     10.0.1.3 -> 10.0.1.2     TCP 51511 > 9040 [SYN] Seq=0 Win=5840 Len=0 MSS=1460 TSV=2246965 TSER=0 WS=6
  2   0.000317     10.0.1.2 -> 10.0.1.3     TCP 9040 > 51511 [SYN, ACK] Seq=0 Ack=1 Win=14480 Len=0 MSS=1460 TSV=2654716 TSER=2246965 WS=6
  3   0.000343     10.0.1.3 -> 10.0.1.2     TCP 51511 > 9040 [ACK] Seq=1 Ack=1 Win=5888 Len=0 TSV=2246965 TSER=2654716
  7   0.002217     10.0.1.2 -> 10.0.1.3     TCP 9040 > 51511 [ACK] Seq=1 Ack=13 Win=14528 Len=0 TSV=2654716 TSER=2246965
410900  34.079518     10.0.1.3 -> 10.0.1.2     TCP 51511 > 9040 [FIN, ACK] Seq=13 Ack=400000002 Win=2580480 Len=0 TSV=2255485 TSER=2663181
410901  34.079757     10.0.1.2 -> 10.0.1.3     TCP 9040 > 51511 [ACK] Seq=400000002 Ack=14 Win=14528 Len=0 TSV=2663237 TSER=2255485
  1   0.000000     10.0.1.3 -> 10.0.1.2     TCP 48722 > 9040 [SYN] Seq=0 Win=5840 Len=0 MSS=1460 TSV=2262110 TSER=0 WS=6
  2   0.000298     10.0.1.2 -> 10.0.1.3     TCP 9040 > 48722 [SYN, ACK] Seq=0 Ack=1 Win=14480 Len=0 MSS=1460 TSV=2669863 TSER=2262110 WS=6
  3   0.000323     10.0.1.3 -> 10.0.1.2     TCP 48722 > 9040 [ACK] Seq=1 Ack=1 Win=5888 Len=0 TSV=2262111 TSER=2669863
  7   0.003715     10.0.1.2 -> 10.0.1.3     TCP 9040 > 48722 [ACK] Seq=1 Ack=13 Win=14528 Len=0 TSV=2669864 TSER=2262112
411584  34.083820     10.0.1.3 -> 10.0.1.2     TCP 48722 > 9040 [FIN, ACK] Seq=13 Ack=400000002 Win=2580480 Len=0 TSV=2270632 TSER=2678329
411585  34.084073     10.0.1.2 -> 10.0.1.3     TCP 9040 > 48722 [ACK] Seq=400000002 Ack=14 Win=14528 Len=0 TSV=2678384 TSER=2270632
  1   0.000000     10.0.1.3 -> 10.0.1.2     TCP 48724 > 9040 [SYN] Seq=0 Win=5840 Len=0 MSS=1460 TSV=2277369 TSER=0 WS=6
  2   0.000373     10.0.1.2 -> 10.0.1.3     TCP 9040 > 48724 [SYN, ACK] Seq=0 Ack=1 Win=14480 Len=0 MSS=1460 TSV=2685123 TSER=2277369 WS=6
  3   0.000396     10.0.1.3 -> 10.0.1.2     TCP 48724 > 9040 [ACK] Seq=1 Ack=1 Win=5888 Len=0 TSV=2277369 TSER=2685123
  7   0.002310     10.0.1.2 -> 10.0.1.3     TCP 9040 > 48724 [ACK] Seq=1 Ack=13 Win=14528 Len=0 TSV=2685123 TSER=2277370
397992  34.079449     10.0.1.3 -> 10.0.1.2     TCP 48724 > 9040 [FIN, ACK] Seq=13 Ack=400000002 Win=2580480 Len=0 TSV=2285889 TSER=2693588
397993  34.079698     10.0.1.2 -> 10.0.1.3     TCP 9040 > 48724 [ACK] Seq=400000002 Ack=14 Win=14528 Len=0 TSV=2693643 TSER=2285889
  1   0.000000     10.0.1.3 -> 10.0.1.2     TCP 48726 > 9040 [SYN] Seq=0 Win=5840 Len=0 MSS=1460 TSV=2292454 TSER=0 WS=6
  2   0.000365     10.0.1.2 -> 10.0.1.3     TCP 9040 > 48726 [SYN, ACK] Seq=0 Ack=1 Win=14480 Len=0 MSS=1460 TSV=2700208 TSER=2292454 WS=6
  3   0.000388     10.0.1.3 -> 10.0.1.2     TCP 48726 > 9040 [ACK] Seq=1 Ack=1 Win=5888 Len=0 TSV=2292454 TSER=2700208
  7   0.002326     10.0.1.2 -> 10.0.1.3     TCP 9040 > 48726 [ACK] Seq=1 Ack=13 Win=14528 Len=0 TSV=2700209 TSER=2292454
383232  34.075195     10.0.1.3 -> 10.0.1.2     TCP 48726 > 9040 [FIN, ACK] Seq=13 Ack=400000002 Win=2560064 Len=0 TSV=2300972 TSER=2708673
383233  34.075440     10.0.1.2 -> 10.0.1.3     TCP 9040 > 48726 [ACK] Seq=400000002 Ack=14 Win=14528 Len=0 TSV=2708728 TSER=2300972
  1   0.000000     10.0.1.3 -> 10.0.1.2     TCP 48730 > 9040 [SYN] Seq=0 Win=5840 Len=0 MSS=1460 TSV=2307317 TSER=0 WS=6
  2   0.000305     10.0.1.2 -> 10.0.1.3     TCP 9040 > 48730 [SYN, ACK] Seq=0 Ack=1 Win=14480 Len=0 MSS=1460 TSV=2715072 TSER=2307317 WS=6
  3   0.000329     10.0.1.3 -> 10.0.1.2     TCP 48730 > 9040 [ACK] Seq=1 Ack=1 Win=5888 Len=0 TSV=2307317 TSER=2715072
  7   0.002319     10.0.1.2 -> 10.0.1.3     TCP 9040 > 48730 [ACK] Seq=1 Ack=13 Win=14528 Len=0 TSV=2715073 TSER=2307317
411562  34.078499     10.0.1.3 -> 10.0.1.2     TCP 48730 > 9040 [FIN, ACK] Seq=13 Ack=400000002 Win=2580480 Len=0 TSV=2315836 TSER=2723538
411563  34.078747     10.0.1.2 -> 10.0.1.3     TCP 9040 > 48730 [ACK] Seq=400000002 Ack=14 Win=14528 Len=0 TSV=2723593 TSER=2315836
  1   0.000000     10.0.1.3 -> 10.0.1.2     TCP 48732 > 9040 [SYN] Seq=0 Win=5840 Len=0 MSS=1460 TSV=2322513 TSER=0 WS=6
  2   0.000280     10.0.1.2 -> 10.0.1.3     TCP 9040 > 48732 [SYN, ACK] Seq=0 Ack=1 Win=14480 Len=0 MSS=1460 TSV=2730270 TSER=2322513 WS=6
  3   0.000302     10.0.1.3 -> 10.0.1.2     TCP 48732 > 9040 [ACK] Seq=1 Ack=1 Win=5888 Len=0 TSV=2322513 TSER=2730270
  7   0.002255     10.0.1.2 -> 10.0.1.3     TCP 9040 > 48732 [ACK] Seq=1 Ack=13 Win=14528 Len=0 TSV=2730271 TSER=2322514
412005  34.079868     10.0.1.3 -> 10.0.1.2     TCP 48732 > 9040 [FIN, ACK] Seq=13 Ack=400000002 Win=2557184 Len=0 TSV=2331033 TSER=2738736
412006  34.080122     10.0.1.2 -> 10.0.1.3     TCP 9040 > 48732 [ACK] Seq=400000002 Ack=14 Win=14528 Len=0 TSV=2738791 TSER=2331033
  1   0.000000     10.0.1.3 -> 10.0.1.2     TCP 49609 > 9040 [SYN] Seq=0 Win=5840 Len=0 MSS=1460 TSV=2337798 TSER=0 WS=6
  2   0.000336     10.0.1.2 -> 10.0.1.3     TCP 9040 > 49609 [SYN, ACK] Seq=0 Ack=1 Win=14480 Len=0 MSS=1460 TSV=2745556 TSER=2337798 WS=6
  3   0.000360     10.0.1.3 -> 10.0.1.2     TCP 49609 > 9040 [ACK] Seq=1 Ack=1 Win=5888 Len=0 TSV=2337798 TSER=2745556
  7   0.002241     10.0.1.2 -> 10.0.1.3     TCP 9040 > 49609 [ACK] Seq=1 Ack=13 Win=14528 Len=0 TSV=2745556 TSER=2337799
396230  36.122765     10.0.1.3 -> 10.0.1.2     TCP 49609 > 9040 [FIN, ACK] Seq=13 Ack=400000002 Win=2557184 Len=0 TSV=2346829 TSER=2754533
396231  36.123023     10.0.1.2 -> 10.0.1.3     TCP 9040 > 49609 [ACK] Seq=400000002 Ack=14 Win=14528 Len=0 TSV=2754587 TSER=2346829
  1   0.000000     10.0.1.3 -> 10.0.1.2     TCP 49611 > 9040 [SYN] Seq=0 Win=5840 Len=0 MSS=1460 TSV=2353345 TSER=0 WS=6
  2   0.000313     10.0.1.2 -> 10.0.1.3     TCP 9040 > 49611 [SYN, ACK] Seq=0 Ack=1 Win=14480 Len=0 MSS=1460 TSV=2761105 TSER=2353345 WS=6
  3   0.000336     10.0.1.3 -> 10.0.1.2     TCP 49611 > 9040 [ACK] Seq=1 Ack=1 Win=5888 Len=0 TSV=2353345 TSER=2761105
  7   0.002288     10.0.1.2 -> 10.0.1.3     TCP 9040 > 49611 [ACK] Seq=1 Ack=13 Win=14528 Len=0 TSV=2761105 TSER=2353346
  1   0.000000     10.0.1.3 -> 10.0.1.2     TCP 49613 > 9040 [SYN] Seq=0 Win=5840 Len=0 MSS=1460 TSV=2367981 TSER=0 WS=6
  2   0.000288     10.0.1.2 -> 10.0.1.3     TCP 9040 > 49613 [SYN, ACK] Seq=0 Ack=1 Win=14480 Len=0 MSS=1460 TSV=2775741 TSER=2367981 WS=6
  3   0.000311     10.0.1.3 -> 10.0.1.2     TCP 49613 > 9040 [ACK] Seq=1 Ack=1 Win=5888 Len=0 TSV=2367981 TSER=2775741
  7   0.002142     10.0.1.2 -> 10.0.1.3     TCP 9040 > 49613 [ACK] Seq=1 Ack=13 Win=14528 Len=0 TSV=2775742 TSER=2367981
412178  34.080251     10.0.1.3 -> 10.0.1.2     TCP 49613 > 9040 [FIN, ACK] Seq=13 Ack=400000002 Win=2580480 Len=0 TSV=2376501 TSER=2784207
412179  34.080491     10.0.1.2 -> 10.0.1.3     TCP 9040 > 49613 [ACK] Seq=400000002 Ack=14 Win=14528 Len=0 TSV=2784262 TSER=2376501
