  1   0.000000     10.0.1.3 -> 10.0.1.2     TCP 57306 > 9040 [SYN] Seq=0 Win=5840 Len=0 MSS=1460 TSV=11360470 TSER=0 WS=6
  2   0.000313     10.0.1.2 -> 10.0.1.3     TCP 9040 > 57306 [SYN, ACK] Seq=0 Ack=1 Win=14480 Len=0 MSS=1460 TSV=11414568 TSER=11360470 WS=6
  3   0.000336     10.0.1.3 -> 10.0.1.2     TCP 57306 > 9040 [ACK] Seq=1 Ack=1 Win=5888 Len=0 TSV=11360470 TSER=11414568
  7   0.002331     10.0.1.2 -> 10.0.1.3     TCP 9040 > 57306 [ACK] Seq=1 Ack=13 Win=14528 Len=0 TSV=11414568 TSER=11360471
466401  39.089579     10.0.1.3 -> 10.0.1.2     TCP 57306 > 9040 [FIN, ACK] Seq=13 Ack=450000002 Win=2580480 Len=0 TSV=11370243 TSER=11424286
466402  39.089821     10.0.1.2 -> 10.0.1.3     TCP 9040 > 57306 [ACK] Seq=450000002 Ack=14 Win=14528 Len=0 TSV=11424341 TSER=11370243
================================================================================
IPv4 Conversations
Filter:<No Filter>
                                               |       <-      | |       ->      | |     Total     |
                                               | Frames  Bytes | | Frames  Bytes | | Frames  Bytes |
10.0.1.3             <-> 10.0.1.2              310791 470512214  155611  10270346  466402 480782560
================================================================================
  1   0.000000     10.0.1.3 -> 10.0.1.2     TCP 57308 > 9040 [SYN] Seq=0 Win=5840 Len=0 MSS=1460 TSV=11374369 TSER=0 WS=6
  2   0.000292     10.0.1.2 -> 10.0.1.3     TCP 9040 > 57308 [SYN, ACK] Seq=0 Ack=1 Win=14480 Len=0 MSS=1460 TSV=11428468 TSER=11374369 WS=6
  3   0.000316     10.0.1.3 -> 10.0.1.2     TCP 57308 > 9040 [ACK] Seq=1 Ack=1 Win=5888 Len=0 TSV=11374369 TSER=11428468
  7   0.002233     10.0.1.2 -> 10.0.1.3     TCP 9040 > 57308 [ACK] Seq=1 Ack=13 Win=14528 Len=0 TSV=11428468 TSER=11374369
466382  38.336268     10.0.1.3 -> 10.0.1.2     TCP 57308 > 9040 [FIN, ACK] Seq=13 Ack=450000002 Win=2580480 Len=0 TSV=11383953 TSER=11437997
466383  38.336511     10.0.1.2 -> 10.0.1.3     TCP 9040 > 57308 [ACK] Seq=450000002 Ack=14 Win=14528 Len=0 TSV=11438052 TSER=11383953
================================================================================
IPv4 Conversations
Filter:<No Filter>
                                               |       <-      | |       ->      | |     Total     |
                                               | Frames  Bytes | | Frames  Bytes | | Frames  Bytes |
10.0.1.3             <-> 10.0.1.2              310784 470511752  155599  10269554  466383 480781306
================================================================================
  1   0.000000     10.0.1.3 -> 10.0.1.2     TCP 57310 > 9040 [SYN] Seq=0 Win=5840 Len=0 MSS=1460 TSV=11388049 TSER=0 WS=6
  2   0.000312     10.0.1.2 -> 10.0.1.3     TCP 9040 > 57310 [SYN, ACK] Seq=0 Ack=1 Win=14480 Len=0 MSS=1460 TSV=11442149 TSER=11388049 WS=6
  3   0.000336     10.0.1.3 -> 10.0.1.2     TCP 57310 > 9040 [ACK] Seq=1 Ack=1 Win=5888 Len=0 TSV=11388049 TSER=11442149
  7   0.002239     10.0.1.2 -> 10.0.1.3     TCP 9040 > 57310 [ACK] Seq=1 Ack=13 Win=14528 Len=0 TSV=11442149 TSER=11388050
466247  38.337102     10.0.1.3 -> 10.0.1.2     TCP 57310 > 9040 [FIN, ACK] Seq=13 Ack=450000002 Win=2580480 Len=0 TSV=11397633 TSER=11451679
466248  38.337358     10.0.1.2 -> 10.0.1.3     TCP 9040 > 57310 [ACK] Seq=450000002 Ack=14 Win=14528 Len=0 TSV=11451734 TSER=11397633
================================================================================
IPv4 Conversations
Filter:<No Filter>
                                               |       <-      | |       ->      | |     Total     |
                                               | Frames  Bytes | | Frames  Bytes | | Frames  Bytes |
10.0.1.3             <-> 10.0.1.2              310786 470511884  155462  10260512  466248 480772396
================================================================================
  1   0.000000     10.0.1.3 -> 10.0.1.2     TCP 42195 > 9040 [SYN] Seq=0 Win=5840 Len=0 MSS=1460 TSV=11401720 TSER=0 WS=6
  2   0.000270     10.0.1.2 -> 10.0.1.3     TCP 9040 > 42195 [SYN, ACK] Seq=0 Ack=1 Win=14480 Len=0 MSS=1460 TSV=11455821 TSER=11401720 WS=6
  3   0.000292     10.0.1.3 -> 10.0.1.2     TCP 42195 > 9040 [ACK] Seq=1 Ack=1 Win=5888 Len=0 TSV=11401720 TSER=11455821
  7   0.002143     10.0.1.2 -> 10.0.1.3     TCP 9040 > 42195 [ACK] Seq=1 Ack=13 Win=14528 Len=0 TSV=11455821 TSER=11401720
466383  38.335195     10.0.1.3 -> 10.0.1.2     TCP 42195 > 9040 [FIN, ACK] Seq=13 Ack=450000002 Win=2580480 Len=0 TSV=11411304 TSER=11465351
466384  38.335408     10.0.1.2 -> 10.0.1.3     TCP 9040 > 42195 [ACK] Seq=450000002 Ack=14 Win=14528 Len=0 TSV=11465406 TSER=11411304
================================================================================
IPv4 Conversations
Filter:<No Filter>
                                               |       <-      | |       ->      | |     Total     |
                                               | Frames  Bytes | | Frames  Bytes | | Frames  Bytes |
10.0.1.3             <-> 10.0.1.2              310788 470512016  155596  10269356  466384 480781372
================================================================================
  1   0.000000     10.0.1.3 -> 10.0.1.2     TCP 42197 > 9040 [SYN] Seq=0 Win=5840 Len=0 MSS=1460 TSV=11415390 TSER=0 WS=6
  2   0.000270     10.0.1.2 -> 10.0.1.3     TCP 9040 > 42197 [SYN, ACK] Seq=0 Ack=1 Win=14480 Len=0 MSS=1460 TSV=11469492 TSER=11415390 WS=6
  3   0.000293     10.0.1.3 -> 10.0.1.2     TCP 42197 > 9040 [ACK] Seq=1 Ack=1 Win=5888 Len=0 TSV=11415390 TSER=11469492
  7   0.002185     10.0.1.2 -> 10.0.1.3     TCP 9040 > 42197 [ACK] Seq=1 Ack=13 Win=14528 Len=0 TSV=11469493 TSER=11415391
466433  38.337989     10.0.1.3 -> 10.0.1.2     TCP 42197 > 9040 [FIN, ACK] Seq=13 Ack=450000002 Win=2580480 Len=0 TSV=11424975 TSER=11479022
466434  38.338263     10.0.1.2 -> 10.0.1.3     TCP 9040 > 42197 [ACK] Seq=450000002 Ack=14 Win=14528 Len=0 TSV=11479077 TSER=11424975
================================================================================
IPv4 Conversations
Filter:<No Filter>
                                               |       <-      | |       ->      | |     Total     |
                                               | Frames  Bytes | | Frames  Bytes | | Frames  Bytes |
10.0.1.3             <-> 10.0.1.2              310789 470512082  155645  10272590  466434 480784672
================================================================================
  1   0.000000     10.0.1.3 -> 10.0.1.2     TCP 42201 > 9040 [SYN] Seq=0 Win=5840 Len=0 MSS=1460 TSV=11429051 TSER=0 WS=6
  2   0.000297     10.0.1.2 -> 10.0.1.3     TCP 9040 > 42201 [SYN, ACK] Seq=0 Ack=1 Win=14480 Len=0 MSS=1460 TSV=11483154 TSER=11429051 WS=6
  3   0.000320     10.0.1.3 -> 10.0.1.2     TCP 42201 > 9040 [ACK] Seq=1 Ack=1 Win=5888 Len=0 TSV=11429051 TSER=11483154
  7   0.002298     10.0.1.2 -> 10.0.1.3     TCP 9040 > 42201 [ACK] Seq=1 Ack=13 Win=14528 Len=0 TSV=11483154 TSER=11429051
466414  38.334964     10.0.1.3 -> 10.0.1.2     TCP 42201 > 9040 [FIN, ACK] Seq=13 Ack=450000002 Win=2580480 Len=0 TSV=11438635 TSER=11492683
466415  38.335204     10.0.1.2 -> 10.0.1.3     TCP 9040 > 42201 [ACK] Seq=450000002 Ack=14 Win=14528 Len=0 TSV=11492738 TSER=11438635
================================================================================
IPv4 Conversations
Filter:<No Filter>
                                               |       <-      | |       ->      | |     Total     |
                                               | Frames  Bytes | | Frames  Bytes | | Frames  Bytes |
10.0.1.3             <-> 10.0.1.2              310787 470511950  155628  10271468  466415 480783418
================================================================================
  1   0.000000     10.0.1.3 -> 10.0.1.2     TCP 42203 > 9040 [SYN] Seq=0 Win=5840 Len=0 MSS=1460 TSV=11442716 TSER=0 WS=6
  2   0.000312     10.0.1.2 -> 10.0.1.3     TCP 9040 > 42203 [SYN, ACK] Seq=0 Ack=1 Win=14480 Len=0 MSS=1460 TSV=11496820 TSER=11442716 WS=6
  3   0.000334     10.0.1.3 -> 10.0.1.2     TCP 42203 > 9040 [ACK] Seq=1 Ack=1 Win=5888 Len=0 TSV=11442716 TSER=11496820
  7   0.002611     10.0.1.2 -> 10.0.1.3     TCP 9040 > 42203 [ACK] Seq=1 Ack=13 Win=14528 Len=0 TSV=11496821 TSER=11442717
466514  38.333192     10.0.1.3 -> 10.0.1.2     TCP 42203 > 9040 [FIN, ACK] Seq=13 Ack=450000002 Win=2574592 Len=0 TSV=11452300 TSER=11506350
466515  38.333449     10.0.1.2 -> 10.0.1.3     TCP 9040 > 42203 [ACK] Seq=450000002 Ack=14 Win=14528 Len=0 TSV=11506404 TSER=11452300
================================================================================
IPv4 Conversations
Filter:<No Filter>
                                               |       <-      | |       ->      | |     Total     |
                                               | Frames  Bytes | | Frames  Bytes | | Frames  Bytes |
10.0.1.3             <-> 10.0.1.2              310785 470511818  155730  10278200  466515 480790018
================================================================================
  1   0.000000     10.0.1.3 -> 10.0.1.2     TCP 42205 > 9040 [SYN] Seq=0 Win=5840 Len=0 MSS=1460 TSV=11456388 TSER=0 WS=6
  2   0.000307     10.0.1.2 -> 10.0.1.3     TCP 9040 > 42205 [SYN, ACK] Seq=0 Ack=1 Win=14480 Len=0 MSS=1460 TSV=11510493 TSER=11456388 WS=6
  3   0.000331     10.0.1.3 -> 10.0.1.2     TCP 42205 > 9040 [ACK] Seq=1 Ack=1 Win=5888 Len=0 TSV=11456388 TSER=11510493
  7   0.002174     10.0.1.2 -> 10.0.1.3     TCP 9040 > 42205 [ACK] Seq=1 Ack=13 Win=14528 Len=0 TSV=11510494 TSER=11456389
466332  38.339292     10.0.1.3 -> 10.0.1.2     TCP 42205 > 9040 [FIN, ACK] Seq=13 Ack=450000002 Win=2580480 Len=0 TSV=11465973 TSER=11520024
466333  38.339536     10.0.1.2 -> 10.0.1.3     TCP 9040 > 42205 [ACK] Seq=450000002 Ack=14 Win=14528 Len=0 TSV=11520079 TSER=11465973
================================================================================
IPv4 Conversations
Filter:<No Filter>
                                               |       <-      | |       ->      | |     Total     |
                                               | Frames  Bytes | | Frames  Bytes | | Frames  Bytes |
10.0.1.3             <-> 10.0.1.2              310785 470511818  155548  10266188  466333 480778006
================================================================================
  1   0.000000     10.0.1.3 -> 10.0.1.2     TCP 42209 > 9040 [SYN] Seq=0 Win=5840 Len=0 MSS=1460 TSV=11470069 TSER=0 WS=6
  2   0.000333     10.0.1.2 -> 10.0.1.3     TCP 9040 > 42209 [SYN, ACK] Seq=0 Ack=1 Win=14480 Len=0 MSS=1460 TSV=11524175 TSER=11470069 WS=6
  3   0.000356     10.0.1.3 -> 10.0.1.2     TCP 42209 > 9040 [ACK] Seq=1 Ack=1 Win=5888 Len=0 TSV=11470069 TSER=11524175
  7   0.002187     10.0.1.2 -> 10.0.1.3     TCP 9040 > 42209 [ACK] Seq=1 Ack=13 Win=14528 Len=0 TSV=11524175 TSER=11470069
466340  38.337337     10.0.1.3 -> 10.0.1.2     TCP 42209 > 9040 [FIN, ACK] Seq=13 Ack=450000002 Win=2580480 Len=0 TSV=11479653 TSER=11533705
466341  38.337584     10.0.1.2 -> 10.0.1.3     TCP 9040 > 42209 [ACK] Seq=450000002 Ack=14 Win=14528 Len=0 TSV=11533760 TSER=11479653
================================================================================
IPv4 Conversations
Filter:<No Filter>
                                               |       <-      | |       ->      | |     Total     |
                                               | Frames  Bytes | | Frames  Bytes | | Frames  Bytes |
10.0.1.3             <-> 10.0.1.2              310786 470511884  155555  10266650  466341 480778534
================================================================================
  1   0.000000     10.0.1.3 -> 10.0.1.2     TCP 37103 > 9040 [SYN] Seq=0 Win=5840 Len=0 MSS=1460 TSV=11483755 TSER=0 WS=6
  2   0.000302     10.0.1.2 -> 10.0.1.3     TCP 9040 > 37103 [SYN, ACK] Seq=0 Ack=1 Win=14480 Len=0 MSS=1460 TSV=11537862 TSER=11483755 WS=6
  3   0.000326     10.0.1.3 -> 10.0.1.2     TCP 37103 > 9040 [ACK] Seq=1 Ack=1 Win=5888 Len=0 TSV=11483756 TSER=11537862
  7   0.002204     10.0.1.2 -> 10.0.1.3     TCP 9040 > 37103 [ACK] Seq=1 Ack=13 Win=14528 Len=0 TSV=11537863 TSER=11483756
466388  38.338847     10.0.1.3 -> 10.0.1.2     TCP 37103 > 9040 [FIN, ACK] Seq=13 Ack=450000002 Win=2580480 Len=0 TSV=11493340 TSER=11547393
466389  38.339101     10.0.1.2 -> 10.0.1.3     TCP 9040 > 37103 [ACK] Seq=450000002 Ack=14 Win=14528 Len=0 TSV=11547448 TSER=11493340
================================================================================
IPv4 Conversations
Filter:<No Filter>
                                               |       <-      | |       ->      | |     Total     |
                                               | Frames  Bytes | | Frames  Bytes | | Frames  Bytes |
10.0.1.3             <-> 10.0.1.2              310793 470512346  155596  10269356  466389 480781702
================================================================================
  1   0.000000     10.0.1.3 -> 10.0.1.2     TCP 37105 > 9040 [SYN] Seq=0 Win=5840 Len=0 MSS=1460 TSV=11497399 TSER=0 WS=6
  2   0.000314     10.0.1.2 -> 10.0.1.3     TCP 9040 > 37105 [SYN, ACK] Seq=0 Ack=1 Win=14480 Len=0 MSS=1460 TSV=11551507 TSER=11497399 WS=6
  3   0.000337     10.0.1.3 -> 10.0.1.2     TCP 37105 > 9040 [ACK] Seq=1 Ack=1 Win=5888 Len=0 TSV=11497399 TSER=11551507
  7   0.002266     10.0.1.2 -> 10.0.1.3     TCP 9040 > 37105 [ACK] Seq=1 Ack=13 Win=14528 Len=0 TSV=11551508 TSER=11497399
466566  38.338254     10.0.1.3 -> 10.0.1.2     TCP 37105 > 9040 [FIN, ACK] Seq=13 Ack=450000002 Win=2557184 Len=0 TSV=11506984 TSER=11561038
466567  38.338501     10.0.1.2 -> 10.0.1.3     TCP 9040 > 37105 [ACK] Seq=450000002 Ack=14 Win=14528 Len=0 TSV=11561092 TSER=11506984
================================================================================
IPv4 Conversations
Filter:<No Filter>
                                               |       <-      | |       ->      | |     Total     |
                                               | Frames  Bytes | | Frames  Bytes | | Frames  Bytes |
10.0.1.3             <-> 10.0.1.2              310781 470511554  155786  10281896  466567 480793450
================================================================================
  1   0.000000     10.0.1.3 -> 10.0.1.2     TCP 37109 > 9040 [SYN] Seq=0 Win=5840 Len=0 MSS=1460 TSV=11511165 TSER=0 WS=6
  2   0.000312     10.0.1.2 -> 10.0.1.3     TCP 9040 > 37109 [SYN, ACK] Seq=0 Ack=1 Win=14480 Len=0 MSS=1460 TSV=11565274 TSER=11511165 WS=6
  3   0.000335     10.0.1.3 -> 10.0.1.2     TCP 37109 > 9040 [ACK] Seq=1 Ack=1 Win=5888 Len=0 TSV=11511165 TSER=11565274
  7   0.002351     10.0.1.2 -> 10.0.1.3     TCP 9040 > 37109 [ACK] Seq=1 Ack=13 Win=14528 Len=0 TSV=11565275 TSER=11511166
466340  38.342470     10.0.1.3 -> 10.0.1.2     TCP 37109 > 9040 [FIN, ACK] Seq=13 Ack=450000002 Win=2580480 Len=0 TSV=11520751 TSER=11574806
466341  38.342723     10.0.1.2 -> 10.0.1.3     TCP 9040 > 37109 [ACK] Seq=450000002 Ack=14 Win=14528 Len=0 TSV=11574861 TSER=11520751
================================================================================
IPv4 Conversations
Filter:<No Filter>
                                               |       <-      | |       ->      | |     Total     |
                                               | Frames  Bytes | | Frames  Bytes | | Frames  Bytes |
10.0.1.3             <-> 10.0.1.2              310787 470511950  155554  10266584  466341 480778534
================================================================================
  1   0.000000     10.0.1.3 -> 10.0.1.2     TCP 37111 > 9040 [SYN] Seq=0 Win=5840 Len=0 MSS=1460 TSV=11524825 TSER=0 WS=6
  2   0.000319     10.0.1.2 -> 10.0.1.3     TCP 9040 > 37111 [SYN, ACK] Seq=0 Ack=1 Win=14480 Len=0 MSS=1460 TSV=11578935 TSER=11524825 WS=6
  3   0.000343     10.0.1.3 -> 10.0.1.2     TCP 37111 > 9040 [ACK] Seq=1 Ack=1 Win=5888 Len=0 TSV=11524825 TSER=11578935
  7   0.002320     10.0.1.2 -> 10.0.1.3     TCP 9040 > 37111 [ACK] Seq=1 Ack=13 Win=14528 Len=0 TSV=11578935 TSER=11524825
466409  38.338110     10.0.1.3 -> 10.0.1.2     TCP 37111 > 9040 [FIN, ACK] Seq=13 Ack=450000002 Win=2580480 Len=0 TSV=11534409 TSER=11588465
466410  38.338354     10.0.1.2 -> 10.0.1.3     TCP 9040 > 37111 [ACK] Seq=450000002 Ack=14 Win=14528 Len=0 TSV=11588520 TSER=11534409
================================================================================
IPv4 Conversations
Filter:<No Filter>
                                               |       <-      | |       ->      | |     Total     |
                                               | Frames  Bytes | | Frames  Bytes | | Frames  Bytes |
10.0.1.3             <-> 10.0.1.2              310786 470511884  155624  10271204  466410 480783088
================================================================================
  1   0.000000     10.0.1.3 -> 10.0.1.2     TCP 37114 > 9040 [SYN] Seq=0 Win=5840 Len=0 MSS=1460 TSV=11538488 TSER=0 WS=6
  2   0.000360     10.0.1.2 -> 10.0.1.3     TCP 9040 > 37114 [SYN, ACK] Seq=0 Ack=1 Win=14480 Len=0 MSS=1460 TSV=11592599 TSER=11538488 WS=6
  3   0.000383     10.0.1.3 -> 10.0.1.2     TCP 37114 > 9040 [ACK] Seq=1 Ack=1 Win=5888 Len=0 TSV=11538488 TSER=11592599
  7   0.002294     10.0.1.2 -> 10.0.1.3     TCP 9040 > 37114 [ACK] Seq=1 Ack=13 Win=14528 Len=0 TSV=11592600 TSER=11538488
466362  38.348602     10.0.1.3 -> 10.0.1.2     TCP 37114 > 9040 [FIN, ACK] Seq=13 Ack=450000002 Win=2580480 Len=0 TSV=11548075 TSER=11602132
466363  38.348845     10.0.1.2 -> 10.0.1.3     TCP 9040 > 37114 [ACK] Seq=450000002 Ack=14 Win=14528 Len=0 TSV=11602187 TSER=11548075
================================================================================
IPv4 Conversations
Filter:<No Filter>
                                               |       <-      | |       ->      | |     Total     |
                                               | Frames  Bytes | | Frames  Bytes | | Frames  Bytes |
10.0.1.3             <-> 10.0.1.2              310785 470511818  155578  10268168  466363 480779986
================================================================================
  1   0.000000     10.0.1.3 -> 10.0.1.2     TCP 36172 > 9040 [SYN] Seq=0 Win=5840 Len=0 MSS=1460 TSV=11552427 TSER=0 WS=6
  2   0.000330     10.0.1.2 -> 10.0.1.3     TCP 9040 > 36172 [SYN, ACK] Seq=0 Ack=1 Win=14480 Len=0 MSS=1460 TSV=11606539 TSER=11552427 WS=6
  3   0.000363     10.0.1.3 -> 10.0.1.2     TCP 36172 > 9040 [ACK] Seq=1 Ack=1 Win=5888 Len=0 TSV=11552427 TSER=11606539
  7   0.003745     10.0.1.2 -> 10.0.1.3     TCP 9040 > 36172 [ACK] Seq=1 Ack=13 Win=14528 Len=0 TSV=11606540 TSER=11552428
466434  38.338834     10.0.1.3 -> 10.0.1.2     TCP 36172 > 9040 [FIN, ACK] Seq=13 Ack=450000002 Win=2580480 Len=0 TSV=11562011 TSER=11616069
466435  38.339080     10.0.1.2 -> 10.0.1.3     TCP 9040 > 36172 [ACK] Seq=450000002 Ack=14 Win=14528 Len=0 TSV=11616124 TSER=11562011
================================================================================
IPv4 Conversations
Filter:<No Filter>
                                               |       <-      | |       ->      | |     Total     |
                                               | Frames  Bytes | | Frames  Bytes | | Frames  Bytes |
10.0.1.3             <-> 10.0.1.2              310783 470511686  155652  10273052  466435 480784738
================================================================================
  1   0.000000     10.0.1.3 -> 10.0.1.2     TCP 36174 > 9040 [SYN] Seq=0 Win=5840 Len=0 MSS=1460 TSV=11566076 TSER=0 WS=6
  2   0.000298     10.0.1.2 -> 10.0.1.3     TCP 9040 > 36174 [SYN, ACK] Seq=0 Ack=1 Win=14480 Len=0 MSS=1460 TSV=11620189 TSER=11566076 WS=6
  3   0.000321     10.0.1.3 -> 10.0.1.2     TCP 36174 > 9040 [ACK] Seq=1 Ack=1 Win=5888 Len=0 TSV=11566076 TSER=11620189
  7   0.002197     10.0.1.2 -> 10.0.1.3     TCP 9040 > 36174 [ACK] Seq=1 Ack=13 Win=14528 Len=0 TSV=11620190 TSER=11566077
466285  38.338003     10.0.1.3 -> 10.0.1.2     TCP 36174 > 9040 [FIN, ACK] Seq=13 Ack=450000002 Win=2580480 Len=0 TSV=11575661 TSER=11629719
466286  38.338250     10.0.1.2 -> 10.0.1.3     TCP 9040 > 36174 [ACK] Seq=450000002 Ack=14 Win=14528 Len=0 TSV=11629775 TSER=11575661
================================================================================
IPv4 Conversations
Filter:<No Filter>
                                               |       <-      | |       ->      | |     Total     |
                                               | Frames  Bytes | | Frames  Bytes | | Frames  Bytes |
10.0.1.3             <-> 10.0.1.2              310703 470386222  155583  10268498  466286 480654720
================================================================================
  1   0.000000     10.0.1.3 -> 10.0.1.2     TCP 36178 > 9040 [SYN] Seq=0 Win=5840 Len=0 MSS=1460 TSV=11579739 TSER=0 WS=6
  2   0.000289     10.0.1.2 -> 10.0.1.3     TCP 9040 > 36178 [SYN, ACK] Seq=0 Ack=1 Win=14480 Len=0 MSS=1460 TSV=11633853 TSER=11579739 WS=6
  3   0.000320     10.0.1.3 -> 10.0.1.2     TCP 36178 > 9040 [ACK] Seq=1 Ack=1 Win=5888 Len=0 TSV=11579739 TSER=11633853
  7   0.003362     10.0.1.2 -> 10.0.1.3     TCP 9040 > 36178 [ACK] Seq=1 Ack=13 Win=14528 Len=0 TSV=11633854 TSER=11579740
466369  38.431623     10.0.1.3 -> 10.0.1.2     TCP 36178 > 9040 [FIN, ACK] Seq=13 Ack=450000002 Win=2580480 Len=0 TSV=11589347 TSER=11643407
466370  38.431858     10.0.1.2 -> 10.0.1.3     TCP 9040 > 36178 [ACK] Seq=450000002 Ack=14 Win=14528 Len=0 TSV=11643462 TSER=11589347
================================================================================
IPv4 Conversations
Filter:<No Filter>
                                               |       <-      | |       ->      | |     Total     |
                                               | Frames  Bytes | | Frames  Bytes | | Frames  Bytes |
10.0.1.3             <-> 10.0.1.2              310789 470512082  155581  10268366  466370 480780448
================================================================================
  1   0.000000     10.0.1.3 -> 10.0.1.2     TCP 36181 > 9040 [SYN] Seq=0 Win=5840 Len=0 MSS=1460 TSV=11593814 TSER=0 WS=6
  2   0.000273     10.0.1.2 -> 10.0.1.3     TCP 9040 > 36181 [SYN, ACK] Seq=0 Ack=1 Win=14480 Len=0 MSS=1460 TSV=11647930 TSER=11593814 WS=6
  3   0.000294     10.0.1.3 -> 10.0.1.2     TCP 36181 > 9040 [ACK] Seq=1 Ack=1 Win=5888 Len=0 TSV=11593814 TSER=11647930
  7   0.002265     10.0.1.2 -> 10.0.1.3     TCP 9040 > 36181 [ACK] Seq=1 Ack=13 Win=14528 Len=0 TSV=11647930 TSER=11593815
466160  38.341440     10.0.1.3 -> 10.0.1.2     TCP 36181 > 9040 [FIN, ACK] Seq=13 Ack=450000002 Win=2574592 Len=0 TSV=11603400 TSER=11657461
466161  38.341685     10.0.1.2 -> 10.0.1.3     TCP 9040 > 36181 [ACK] Seq=450000002 Ack=14 Win=14528 Len=0 TSV=11657516 TSER=11603400
================================================================================
IPv4 Conversations
Filter:<No Filter>
                                               |       <-      | |       ->      | |     Total     |
                                               | Frames  Bytes | | Frames  Bytes | | Frames  Bytes |
10.0.1.3             <-> 10.0.1.2              310784 470511752  155377  10254902  466161 480766654
================================================================================
  1   0.000000     10.0.1.3 -> 10.0.1.2     TCP 36183 > 9040 [SYN] Seq=0 Win=5840 Len=0 MSS=1460 TSV=11607481 TSER=0 WS=6
  2   0.000278     10.0.1.2 -> 10.0.1.3     TCP 9040 > 36183 [SYN, ACK] Seq=0 Ack=1 Win=14480 Len=0 MSS=1460 TSV=11661597 TSER=11607481 WS=6
  3   0.000301     10.0.1.3 -> 10.0.1.2     TCP 36183 > 9040 [ACK] Seq=1 Ack=1 Win=5888 Len=0 TSV=11607481 TSER=11661597
  7   0.002162     10.0.1.2 -> 10.0.1.3     TCP 9040 > 36183 [ACK] Seq=1 Ack=13 Win=14528 Len=0 TSV=11661597 TSER=11607481
466407  38.337084     10.0.1.3 -> 10.0.1.2     TCP 36183 > 9040 [FIN, ACK] Seq=13 Ack=450000002 Win=2580480 Len=0 TSV=11617065 TSER=11671127
466408  38.337333     10.0.1.2 -> 10.0.1.3     TCP 9040 > 36183 [ACK] Seq=450000002 Ack=14 Win=14528 Len=0 TSV=11671182 TSER=11617065
================================================================================
IPv4 Conversations
Filter:<No Filter>
                                               |       <-      | |       ->      | |     Total     |
                                               | Frames  Bytes | | Frames  Bytes | | Frames  Bytes |
10.0.1.3             <-> 10.0.1.2              310786 470511884  155622  10271072  466408 480782956
================================================================================
  1   0.000000     10.0.1.3 -> 10.0.1.2     TCP 36185 > 9040 [SYN] Seq=0 Win=5840 Len=0 MSS=1460 TSV=11621122 TSER=0 WS=6
  2   0.000296     10.0.1.2 -> 10.0.1.3     TCP 9040 > 36185 [SYN, ACK] Seq=0 Ack=1 Win=14480 Len=0 MSS=1460 TSV=11675239 TSER=11621122 WS=6
  3   0.000320     10.0.1.3 -> 10.0.1.2     TCP 36185 > 9040 [ACK] Seq=1 Ack=1 Win=5888 Len=0 TSV=11621122 TSER=11675239
  7   0.002284     10.0.1.2 -> 10.0.1.3     TCP 9040 > 36185 [ACK] Seq=1 Ack=13 Win=14528 Len=0 TSV=11675240 TSER=11621123
466441  38.547106     10.0.1.3 -> 10.0.1.2     TCP 36185 > 9040 [FIN, ACK] Seq=13 Ack=450000002 Win=2580480 Len=0 TSV=11630759 TSER=11684822
466442  38.547359     10.0.1.2 -> 10.0.1.3     TCP 9040 > 36185 [ACK] Seq=450000002 Ack=14 Win=14528 Len=0 TSV=11684877 TSER=11630759
================================================================================
IPv4 Conversations
Filter:<No Filter>
                                               |       <-      | |       ->      | |     Total     |
                                               | Frames  Bytes | | Frames  Bytes | | Frames  Bytes |
10.0.1.3             <-> 10.0.1.2              310796 470512544  155646  10272656  466442 480785200
================================================================================
