  1   0.000000     10.0.1.3 -> 10.0.1.2     TCP 57968 > 9040 [SYN] Seq=0 Win=5840 Len=0 MSS=1460 TSV=6846577 TSER=0 WS=6
  2   0.000322     10.0.1.2 -> 10.0.1.3     TCP 9040 > 57968 [SYN, ACK] Seq=0 Ack=1 Win=14480 Len=0 MSS=1460 TSV=6831666 TSER=6846577 WS=6
  3   0.000347     10.0.1.3 -> 10.0.1.2     TCP 57968 > 9040 [ACK] Seq=1 Ack=1 Win=5888 Len=0 TSV=6846577 TSER=6831666
  7   0.002251     10.0.1.2 -> 10.0.1.3     TCP 9040 > 57968 [ACK] Seq=1 Ack=13 Win=14528 Len=0 TSV=6831667 TSER=6846577
466786  82.211520     10.0.1.3 -> 10.0.1.2     TCP 57968 > 9040 [FIN, ACK] Seq=13 Ack=450000002 Win=2026112 Len=0 TSV=6867130 TSER=6852199
466787  82.211764     10.0.1.2 -> 10.0.1.3     TCP 9040 > 57968 [ACK] Seq=450000002 Ack=14 Win=14528 Len=0 TSV=6852221 TSER=6867130
  1   0.000000     10.0.1.3 -> 10.0.1.2     TCP 57970 > 9040 [SYN] Seq=0 Win=5840 Len=0 MSS=1460 TSV=6874198 TSER=0 WS=6
  2   0.000286     10.0.1.2 -> 10.0.1.3     TCP 9040 > 57970 [SYN, ACK] Seq=0 Ack=1 Win=14480 Len=0 MSS=1460 TSV=6859290 TSER=6874198 WS=6
  3   0.000310     10.0.1.3 -> 10.0.1.2     TCP 57970 > 9040 [ACK] Seq=1 Ack=1 Win=5888 Len=0 TSV=6874198 TSER=6859290
  7   0.002309     10.0.1.2 -> 10.0.1.3     TCP 9040 > 57970 [ACK] Seq=1 Ack=13 Win=14528 Len=0 TSV=6859290 TSER=6874199
439076  80.909519     10.0.1.3 -> 10.0.1.2     TCP 57970 > 9040 [FIN, ACK] Seq=13 Ack=450000002 Win=2014528 Len=0 TSV=6894426 TSER=6879497
439077  80.909766     10.0.1.2 -> 10.0.1.3     TCP 9040 > 57970 [ACK] Seq=450000002 Ack=14 Win=14528 Len=0 TSV=6879519 TSER=6894426
  1   0.000000     10.0.1.3 -> 10.0.1.2     TCP 59612 > 9040 [SYN] Seq=0 Win=5840 Len=0 MSS=1460 TSV=6901547 TSER=0 WS=6
  2   0.000300     10.0.1.2 -> 10.0.1.3     TCP 9040 > 59612 [SYN, ACK] Seq=0 Ack=1 Win=14480 Len=0 MSS=1460 TSV=6886641 TSER=6901547 WS=6
  3   0.000323     10.0.1.3 -> 10.0.1.2     TCP 59612 > 9040 [ACK] Seq=1 Ack=1 Win=5888 Len=0 TSV=6901547 TSER=6886641
  7   0.003697     10.0.1.2 -> 10.0.1.3     TCP 9040 > 59612 [ACK] Seq=1 Ack=13 Win=14528 Len=0 TSV=6886642 TSER=6901548
459226  80.929570     10.0.1.3 -> 10.0.1.2     TCP 59612 > 9040 [FIN, ACK] Seq=13 Ack=450000002 Win=2020288 Len=0 TSV=6921780 TSER=6906854
459227  80.929817     10.0.1.2 -> 10.0.1.3     TCP 9040 > 59612 [ACK] Seq=450000002 Ack=14 Win=14528 Len=0 TSV=6906875 TSER=6921780
  1   0.000000     10.0.1.3 -> 10.0.1.2     TCP 59614 > 9040 [SYN] Seq=0 Win=5840 Len=0 MSS=1460 TSV=6928656 TSER=0 WS=6
  2   0.000305     10.0.1.2 -> 10.0.1.3     TCP 9040 > 59614 [SYN, ACK] Seq=0 Ack=1 Win=14480 Len=0 MSS=1460 TSV=6913752 TSER=6928656 WS=6
  3   0.000329     10.0.1.3 -> 10.0.1.2     TCP 59614 > 9040 [ACK] Seq=1 Ack=1 Win=5888 Len=0 TSV=6928657 TSER=6913752
  7   0.002294     10.0.1.2 -> 10.0.1.3     TCP 9040 > 59614 [ACK] Seq=1 Ack=13 Win=14528 Len=0 TSV=6913753 TSER=6928657
461433  82.025845     10.0.1.3 -> 10.0.1.2     TCP 59614 > 9040 [FIN, ACK] Seq=13 Ack=450000002 Win=2020288 Len=0 TSV=6949163 TSER=6934239
461434  82.026099     10.0.1.2 -> 10.0.1.3     TCP 9040 > 59614 [ACK] Seq=450000002 Ack=14 Win=14528 Len=0 TSV=6934260 TSER=6949163
  1   0.000000     10.0.1.3 -> 10.0.1.2     TCP 59616 > 9040 [SYN] Seq=0 Win=5840 Len=0 MSS=1460 TSV=6956425 TSER=0 WS=6
  2   0.000369     10.0.1.2 -> 10.0.1.3     TCP 9040 > 59616 [SYN, ACK] Seq=0 Ack=1 Win=14480 Len=0 MSS=1460 TSV=6941522 TSER=6956425 WS=6
  3   0.000394     10.0.1.3 -> 10.0.1.2     TCP 59616 > 9040 [ACK] Seq=1 Ack=1 Win=5888 Len=0 TSV=6956425 TSER=6941522
  7   0.002326     10.0.1.2 -> 10.0.1.3     TCP 9040 > 59616 [ACK] Seq=1 Ack=13 Win=14528 Len=0 TSV=6941523 TSER=6956425
448903  82.631355     10.0.1.3 -> 10.0.1.2     TCP 59616 > 9040 [FIN, ACK] Seq=13 Ack=450000002 Win=2023168 Len=0 TSV=6977082 TSER=6962160
448904  82.631608     10.0.1.2 -> 10.0.1.3     TCP 9040 > 59616 [ACK] Seq=450000002 Ack=14 Win=14528 Len=0 TSV=6962182 TSER=6977082
  1   0.000000     10.0.1.3 -> 10.0.1.2     TCP 42820 > 9040 [SYN] Seq=0 Win=5840 Len=0 MSS=1460 TSV=6984115 TSER=0 WS=6
  2   0.000302     10.0.1.2 -> 10.0.1.3     TCP 9040 > 42820 [SYN, ACK] Seq=0 Ack=1 Win=14480 Len=0 MSS=1460 TSV=6969214 TSER=6984115 WS=6
  3   0.000326     10.0.1.3 -> 10.0.1.2     TCP 42820 > 9040 [ACK] Seq=1 Ack=1 Win=5888 Len=0 TSV=6984115 TSER=6969214
  7   0.002251     10.0.1.2 -> 10.0.1.3     TCP 9040 > 42820 [ACK] Seq=1 Ack=13 Win=14528 Len=0 TSV=6969215 TSER=6984115
466754  81.415725     10.0.1.3 -> 10.0.1.2     TCP 42820 > 9040 [FIN, ACK] Seq=13 Ack=450000002 Win=2020288 Len=0 TSV=7004469 TSER=6989548
466755  81.415972     10.0.1.2 -> 10.0.1.3     TCP 9040 > 42820 [ACK] Seq=450000002 Ack=14 Win=14528 Len=0 TSV=6989570 TSER=7004469
  1   0.000000     10.0.1.3 -> 10.0.1.2     TCP 42822 > 9040 [SYN] Seq=0 Win=5840 Len=0 MSS=1460 TSV=7011738 TSER=0 WS=6
  2   0.000302     10.0.1.2 -> 10.0.1.3     TCP 9040 > 42822 [SYN, ACK] Seq=0 Ack=1 Win=14480 Len=0 MSS=1460 TSV=6996840 TSER=7011738 WS=6
  3   0.000325     10.0.1.3 -> 10.0.1.2     TCP 42822 > 9040 [ACK] Seq=1 Ack=1 Win=5888 Len=0 TSV=7011739 TSER=6996840
  7   0.002202     10.0.1.2 -> 10.0.1.3     TCP 9040 > 42822 [ACK] Seq=1 Ack=13 Win=14528 Len=0 TSV=6996841 TSER=7011739
466700  81.578408     10.0.1.3 -> 10.0.1.2     TCP 42822 > 9040 [FIN, ACK] Seq=13 Ack=450000002 Win=2026112 Len=0 TSV=7032133 TSER=7017215
466701  81.578659     10.0.1.2 -> 10.0.1.3     TCP 9040 > 42822 [ACK] Seq=450000002 Ack=14 Win=14528 Len=0 TSV=7017236 TSER=7032133
  1   0.000000     10.0.1.3 -> 10.0.1.2     TCP 42824 > 9040 [SYN] Seq=0 Win=5840 Len=0 MSS=1460 TSV=7039324 TSER=0 WS=6
  2   0.000294     10.0.1.2 -> 10.0.1.3     TCP 9040 > 42824 [SYN, ACK] Seq=0 Ack=1 Win=14480 Len=0 MSS=1460 TSV=7024428 TSER=7039324 WS=6
  3   0.000318     10.0.1.3 -> 10.0.1.2     TCP 42824 > 9040 [ACK] Seq=1 Ack=1 Win=5888 Len=0 TSV=7039324 TSER=7024428
  7   0.002265     10.0.1.2 -> 10.0.1.3     TCP 9040 > 42824 [ACK] Seq=1 Ack=13 Win=14528 Len=0 TSV=7024428 TSER=7039324
456423  82.304192     10.0.1.3 -> 10.0.1.2     TCP 42824 > 9040 [FIN, ACK] Seq=13 Ack=450000002 Win=2023168 Len=0 TSV=7059900 TSER=7044984
456424  82.304449     10.0.1.2 -> 10.0.1.3     TCP 9040 > 42824 [ACK] Seq=450000002 Ack=14 Win=14528 Len=0 TSV=7045005 TSER=7059900
  1   0.000000     10.0.1.3 -> 10.0.1.2     TCP 52692 > 9040 [SYN] Seq=0 Win=5840 Len=0 MSS=1460 TSV=7067025 TSER=0 WS=6
  2   0.000328     10.0.1.2 -> 10.0.1.3     TCP 9040 > 52692 [SYN, ACK] Seq=0 Ack=1 Win=14480 Len=0 MSS=1460 TSV=7052131 TSER=7067025 WS=6
  3   0.000363     10.0.1.3 -> 10.0.1.2     TCP 52692 > 9040 [ACK] Seq=1 Ack=1 Win=5888 Len=0 TSV=7067025 TSER=7052131
  7   0.003924     10.0.1.2 -> 10.0.1.3     TCP 9040 > 52692 [ACK] Seq=1 Ack=13 Win=14528 Len=0 TSV=7052132 TSER=7067026
466858  83.171085     10.0.1.3 -> 10.0.1.2     TCP 52692 > 9040 [FIN, ACK] Seq=13 Ack=450000002 Win=2014528 Len=0 TSV=7087818 TSER=7072904
466859  83.171338     10.0.1.2 -> 10.0.1.3     TCP 9040 > 52692 [ACK] Seq=450000002 Ack=14 Win=14528 Len=0 TSV=7072925 TSER=7087818
  1   0.000000     10.0.1.3 -> 10.0.1.2     TCP 52694 > 9040 [SYN] Seq=0 Win=5840 Len=0 MSS=1460 TSV=7095196 TSER=0 WS=6
  2   0.000300     10.0.1.2 -> 10.0.1.3     TCP 9040 > 52694 [SYN, ACK] Seq=0 Ack=1 Win=14480 Len=0 MSS=1460 TSV=7080304 TSER=7095196 WS=6
  3   0.000323     10.0.1.3 -> 10.0.1.2     TCP 52694 > 9040 [ACK] Seq=1 Ack=1 Win=5888 Len=0 TSV=7095196 TSER=7080304
  7   0.002299     10.0.1.2 -> 10.0.1.3     TCP 9040 > 52694 [ACK] Seq=1 Ack=13 Win=14528 Len=0 TSV=7080304 TSER=7095196
466840  82.522513     10.0.1.3 -> 10.0.1.2     TCP 52694 > 9040 [FIN, ACK] Seq=13 Ack=450000002 Win=2023168 Len=0 TSV=7115826 TSER=7100915
466841  82.522764     10.0.1.2 -> 10.0.1.3     TCP 9040 > 52694 [ACK] Seq=450000002 Ack=14 Win=14528 Len=0 TSV=7100936 TSER=7115826
  1   0.000000     10.0.1.3 -> 10.0.1.2     TCP 52696 > 9040 [SYN] Seq=0 Win=5840 Len=0 MSS=1460 TSV=7122967 TSER=0 WS=6
  2   0.000315     10.0.1.2 -> 10.0.1.3     TCP 9040 > 52696 [SYN, ACK] Seq=0 Ack=1 Win=14480 Len=0 MSS=1460 TSV=7108078 TSER=7122967 WS=6
  3   0.000336     10.0.1.3 -> 10.0.1.2     TCP 52696 > 9040 [ACK] Seq=1 Ack=1 Win=5888 Len=0 TSV=7122967 TSER=7108078
  7   0.002268     10.0.1.2 -> 10.0.1.3     TCP 9040 > 52696 [ACK] Seq=1 Ack=13 Win=14528 Len=0 TSV=7108078 TSER=7122968
466855  81.473484     10.0.1.3 -> 10.0.1.2     TCP 52696 > 9040 [FIN, ACK] Seq=13 Ack=450000002 Win=2026112 Len=0 TSV=7143336 TSER=7128426
466856  81.473735     10.0.1.2 -> 10.0.1.3     TCP 9040 > 52696 [ACK] Seq=450000002 Ack=14 Win=14528 Len=0 TSV=7128448 TSER=7143336
  1   0.000000     10.0.1.3 -> 10.0.1.2     TCP 47684 > 9040 [SYN] Seq=0 Win=5840 Len=0 MSS=1460 TSV=7150632 TSER=0 WS=6
  2   0.000292     10.0.1.2 -> 10.0.1.3     TCP 9040 > 47684 [SYN, ACK] Seq=0 Ack=1 Win=14480 Len=0 MSS=1460 TSV=7135744 TSER=7150632 WS=6
  3   0.000324     10.0.1.3 -> 10.0.1.2     TCP 47684 > 9040 [ACK] Seq=1 Ack=1 Win=5888 Len=0 TSV=7150632 TSER=7135744
  7   0.002745     10.0.1.2 -> 10.0.1.3     TCP 9040 > 47684 [ACK] Seq=1 Ack=13 Win=14528 Len=0 TSV=7135745 TSER=7150633
458750  81.220320     10.0.1.3 -> 10.0.1.2     TCP 47684 > 9040 [FIN, ACK] Seq=13 Ack=450000002 Win=2023168 Len=0 TSV=7170937 TSER=7156030
458751  81.220567     10.0.1.2 -> 10.0.1.3     TCP 9040 > 47684 [ACK] Seq=450000002 Ack=14 Win=14528 Len=0 TSV=7156051 TSER=7170937
  1   0.000000     10.0.1.3 -> 10.0.1.2     TCP 47687 > 9040 [SYN] Seq=0 Win=5840 Len=0 MSS=1460 TSV=7178233 TSER=0 WS=6
  2   0.000290     10.0.1.2 -> 10.0.1.3     TCP 9040 > 47687 [SYN, ACK] Seq=0 Ack=1 Win=14480 Len=0 MSS=1460 TSV=7163347 TSER=7178233 WS=6
  3   0.000313     10.0.1.3 -> 10.0.1.2     TCP 47687 > 9040 [ACK] Seq=1 Ack=1 Win=5888 Len=0 TSV=7178233 TSER=7163347
  7   0.002188     10.0.1.2 -> 10.0.1.3     TCP 9040 > 47687 [ACK] Seq=1 Ack=13 Win=14528 Len=0 TSV=7163347 TSER=7178233
456159  81.102000     10.0.1.3 -> 10.0.1.2     TCP 47687 > 9040 [FIN, ACK] Seq=13 Ack=450000002 Win=2034752 Len=0 TSV=7198508 TSER=7183603
456160  81.102256     10.0.1.2 -> 10.0.1.3     TCP 9040 > 47687 [ACK] Seq=450000002 Ack=14 Win=14528 Len=0 TSV=7183624 TSER=7198508
  1   0.000000     10.0.1.3 -> 10.0.1.2     TCP 41756 > 9040 [SYN] Seq=0 Win=5840 Len=0 MSS=1460 TSV=7205666 TSER=0 WS=6
  2   0.000282     10.0.1.2 -> 10.0.1.3     TCP 9040 > 41756 [SYN, ACK] Seq=0 Ack=1 Win=14480 Len=0 MSS=1460 TSV=7190782 TSER=7205666 WS=6
  3   0.000307     10.0.1.3 -> 10.0.1.2     TCP 41756 > 9040 [ACK] Seq=1 Ack=1 Win=5888 Len=0 TSV=7205666 TSER=7190782
  7   0.002311     10.0.1.2 -> 10.0.1.3     TCP 9040 > 41756 [ACK] Seq=1 Ack=13 Win=14528 Len=0 TSV=7190783 TSER=7205666
455327  80.538722     10.0.1.3 -> 10.0.1.2     TCP 41756 > 9040 [FIN, ACK] Seq=13 Ack=450000002 Win=2023168 Len=0 TSV=7225800 TSER=7210897
455328  80.538966     10.0.1.2 -> 10.0.1.3     TCP 9040 > 41756 [ACK] Seq=450000002 Ack=14 Win=14528 Len=0 TSV=7210918 TSER=7225800
  1   0.000000     10.0.1.3 -> 10.0.1.2     TCP 41758 > 9040 [SYN] Seq=0 Win=5840 Len=0 MSS=1460 TSV=7233052 TSER=0 WS=6
  2   0.000273     10.0.1.2 -> 10.0.1.3     TCP 9040 > 41758 [SYN, ACK] Seq=0 Ack=1 Win=14480 Len=0 MSS=1460 TSV=7218170 TSER=7233052 WS=6
  3   0.000300     10.0.1.3 -> 10.0.1.2     TCP 41758 > 9040 [ACK] Seq=1 Ack=1 Win=5888 Len=0 TSV=7233052 TSER=7218170
  7   0.002272     10.0.1.2 -> 10.0.1.3     TCP 9040 > 41758 [ACK] Seq=1 Ack=13 Win=14528 Len=0 TSV=7218171 TSER=7233052
453854  81.373417     10.0.1.3 -> 10.0.1.2     TCP 41758 > 9040 [FIN, ACK] Seq=13 Ack=450000002 Win=2023168 Len=0 TSV=7253395 TSER=7238494
453855  81.373663     10.0.1.2 -> 10.0.1.3     TCP 9040 > 41758 [ACK] Seq=450000002 Ack=14 Win=14528 Len=0 TSV=7238515 TSER=7253395
  1   0.000000     10.0.1.3 -> 10.0.1.2     TCP 41760 > 9040 [SYN] Seq=0 Win=5840 Len=0 MSS=1460 TSV=7260607 TSER=0 WS=6
  2   0.000292     10.0.1.2 -> 10.0.1.3     TCP 9040 > 41760 [SYN, ACK] Seq=0 Ack=1 Win=14480 Len=0 MSS=1460 TSV=7245728 TSER=7260607 WS=6
  3   0.000315     10.0.1.3 -> 10.0.1.2     TCP 41760 > 9040 [ACK] Seq=1 Ack=1 Win=5888 Len=0 TSV=7260607 TSER=7245728
  7   0.002171     10.0.1.2 -> 10.0.1.3     TCP 9040 > 41760 [ACK] Seq=1 Ack=13 Win=14528 Len=0 TSV=7245728 TSER=7260608
451600  81.462618     10.0.1.3 -> 10.0.1.2     TCP 41760 > 9040 [FIN, ACK] Seq=13 Ack=450000002 Win=2023168 Len=0 TSV=7280973 TSER=7266074
451601  81.462864     10.0.1.2 -> 10.0.1.3     TCP 9040 > 41760 [ACK] Seq=450000002 Ack=14 Win=14528 Len=0 TSV=7266095 TSER=7280973
  1   0.000000     10.0.1.3 -> 10.0.1.2     TCP 46113 > 9040 [SYN] Seq=0 Win=5840 Len=0 MSS=1460 TSV=7288162 TSER=0 WS=6
  2   0.000368     10.0.1.2 -> 10.0.1.3     TCP 9040 > 46113 [SYN, ACK] Seq=0 Ack=1 Win=14480 Len=0 MSS=1460 TSV=7273284 TSER=7288162 WS=6
  3   0.000390     10.0.1.3 -> 10.0.1.2     TCP 46113 > 9040 [ACK] Seq=1 Ack=1 Win=5888 Len=0 TSV=7288162 TSER=7273284
  7   0.002535     10.0.1.2 -> 10.0.1.3     TCP 9040 > 46113 [ACK] Seq=1 Ack=13 Win=14528 Len=0 TSV=7273285 TSER=7288162
452595  81.253865     10.0.1.3 -> 10.0.1.2     TCP 46113 > 9040 [FIN, ACK] Seq=13 Ack=450000002 Win=2023168 Len=0 TSV=7308475 TSER=7293578
452596  81.254112     10.0.1.2 -> 10.0.1.3     TCP 9040 > 46113 [ACK] Seq=450000002 Ack=14 Win=14528 Len=0 TSV=7293599 TSER=7308475
  1   0.000000     10.0.1.3 -> 10.0.1.2     TCP 46115 > 9040 [SYN] Seq=0 Win=5840 Len=0 MSS=1460 TSV=7315646 TSER=0 WS=6
  2   0.000297     10.0.1.2 -> 10.0.1.3     TCP 9040 > 46115 [SYN, ACK] Seq=0 Ack=1 Win=14480 Len=0 MSS=1460 TSV=7300771 TSER=7315646 WS=6
  3   0.000323     10.0.1.3 -> 10.0.1.2     TCP 46115 > 9040 [ACK] Seq=1 Ack=1 Win=5888 Len=0 TSV=7315646 TSER=7300771
  7   0.002191     10.0.1.2 -> 10.0.1.3     TCP 9040 > 46115 [ACK] Seq=1 Ack=13 Win=14528 Len=0 TSV=7300771 TSER=7315646
457577  80.799053     10.0.1.3 -> 10.0.1.2     TCP 46115 > 9040 [FIN, ACK] Seq=13 Ack=450000002 Win=2023168 Len=0 TSV=7335846 TSER=7320951
457578  80.799314     10.0.1.2 -> 10.0.1.3     TCP 9040 > 46115 [ACK] Seq=450000002 Ack=14 Win=14528 Len=0 TSV=7320972 TSER=7335846
  1   0.000000     10.0.1.3 -> 10.0.1.2     TCP 46117 > 9040 [SYN] Seq=0 Win=5840 Len=0 MSS=1460 TSV=7343112 TSER=0 WS=6
  2   0.000315     10.0.1.2 -> 10.0.1.3     TCP 9040 > 46117 [SYN, ACK] Seq=0 Ack=1 Win=14480 Len=0 MSS=1460 TSV=7328239 TSER=7343112 WS=6
  3   0.000349     10.0.1.3 -> 10.0.1.2     TCP 46117 > 9040 [ACK] Seq=1 Ack=1 Win=5888 Len=0 TSV=7343112 TSER=7328239
  7   0.002435     10.0.1.2 -> 10.0.1.3     TCP 9040 > 46117 [ACK] Seq=1 Ack=13 Win=14528 Len=0 TSV=7328240 TSER=7343113
466741  80.788937     10.0.1.3 -> 10.0.1.2     TCP 46117 > 9040 [FIN, ACK] Seq=13 Ack=450000002 Win=2026112 Len=0 TSV=7363310 TSER=7348416
466742  80.789189     10.0.1.2 -> 10.0.1.3     TCP 9040 > 46117 [ACK] Seq=450000002 Ack=14 Win=14528 Len=0 TSV=7348438 TSER=7363310
  1   0.000000     10.0.1.3 -> 10.0.1.2     TCP 36330 > 9040 [SYN] Seq=0 Win=5840 Len=0 MSS=1460 TSV=7370695 TSER=0 WS=6
  2   0.000325     10.0.1.2 -> 10.0.1.3     TCP 9040 > 36330 [SYN, ACK] Seq=0 Ack=1 Win=14480 Len=0 MSS=1460 TSV=7355824 TSER=7370695 WS=6
  3   0.000350     10.0.1.3 -> 10.0.1.2     TCP 36330 > 9040 [ACK] Seq=1 Ack=1 Win=5888 Len=0 TSV=7370695 TSER=7355824
  7   0.002311     10.0.1.2 -> 10.0.1.3     TCP 9040 > 36330 [ACK] Seq=1 Ack=13 Win=14528 Len=0 TSV=7355824 TSER=7370696
466892  81.732174     10.0.1.3 -> 10.0.1.2     TCP 36330 > 9040 [FIN, ACK] Seq=13 Ack=450000002 Win=2023168 Len=0 TSV=7391128 TSER=7376237
466893  81.732429     10.0.1.2 -> 10.0.1.3     TCP 9040 > 36330 [ACK] Seq=450000002 Ack=14 Win=14528 Len=0 TSV=7376258 TSER=7391128
