  1   0.000000     10.0.1.3 -> 10.0.1.2     TCP 57657 > 9040 [SYN] Seq=0 Win=5840 Len=0 MSS=1460 TSV=4243426 TSER=0 WS=6
  2   0.000377     10.0.1.2 -> 10.0.1.3     TCP 9040 > 57657 [SYN, ACK] Seq=0 Ack=1 Win=14480 Len=0 MSS=1460 TSV=4228515 TSER=4243426 WS=6
  3   0.000403     10.0.1.3 -> 10.0.1.2     TCP 57657 > 9040 [ACK] Seq=1 Ack=1 Win=5888 Len=0 TSV=4243426 TSER=4228515
  7   0.002352     10.0.1.2 -> 10.0.1.3     TCP 9040 > 57657 [ACK] Seq=1 Ack=13 Win=14528 Len=0 TSV=4228516 TSER=4243427
467099  83.162983     10.0.1.3 -> 10.0.1.2     TCP 57657 > 9040 [FIN, ACK] Seq=13 Ack=450000002 Win=2023168 Len=0 TSV=4264217 TSER=4249286
  1   0.000000     10.0.1.3 -> 10.0.1.2     TCP 57659 > 9040 [SYN] Seq=0 Win=5840 Len=0 MSS=1460 TSV=4271557 TSER=0 WS=6
  2   0.000304     10.0.1.2 -> 10.0.1.3     TCP 9040 > 57659 [SYN, ACK] Seq=0 Ack=1 Win=14480 Len=0 MSS=1460 TSV=4256648 TSER=4271557 WS=6
  3   0.000329     10.0.1.3 -> 10.0.1.2     TCP 57659 > 9040 [ACK] Seq=1 Ack=1 Win=5888 Len=0 TSV=4271557 TSER=4256648
  7   0.002166     10.0.1.2 -> 10.0.1.3     TCP 9040 > 57659 [ACK] Seq=1 Ack=13 Win=14528 Len=0 TSV=4256648 TSER=4271557
461220  83.319202     10.0.1.3 -> 10.0.1.2     TCP 57659 > 9040 [FIN, ACK] Seq=13 Ack=450000002 Win=2034752 Len=0 TSV=4292387 TSER=4277458
  1   0.000000     10.0.1.3 -> 10.0.1.2     TCP 35256 > 9040 [SYN] Seq=0 Win=5840 Len=0 MSS=1460 TSV=4299641 TSER=0 WS=6
  2   0.000323     10.0.1.2 -> 10.0.1.3     TCP 9040 > 35256 [SYN, ACK] Seq=0 Ack=1 Win=14480 Len=0 MSS=1460 TSV=4284735 TSER=4299641 WS=6
  3   0.000345     10.0.1.3 -> 10.0.1.2     TCP 35256 > 9040 [ACK] Seq=1 Ack=1 Win=5888 Len=0 TSV=4299641 TSER=4284735
  7   0.003570     10.0.1.2 -> 10.0.1.3     TCP 9040 > 35256 [ACK] Seq=1 Ack=13 Win=14528 Len=0 TSV=4284736 TSER=4299642
457753  82.925789     10.0.1.3 -> 10.0.1.2     TCP 35256 > 9040 [FIN, ACK] Seq=13 Ack=450000002 Win=2026112 Len=0 TSV=4320373 TSER=4305447
  1   0.000000     10.0.1.3 -> 10.0.1.2     TCP 35258 > 9040 [SYN] Seq=0 Win=5840 Len=0 MSS=1460 TSV=4327528 TSER=0 WS=6
  2   0.000267     10.0.1.2 -> 10.0.1.3     TCP 9040 > 35258 [SYN, ACK] Seq=0 Ack=1 Win=14480 Len=0 MSS=1460 TSV=4312623 TSER=4327528 WS=6
  3   0.000290     10.0.1.3 -> 10.0.1.2     TCP 35258 > 9040 [ACK] Seq=1 Ack=1 Win=5888 Len=0 TSV=4327528 TSER=4312623
  7   0.002519     10.0.1.2 -> 10.0.1.3     TCP 9040 > 35258 [ACK] Seq=1 Ack=13 Win=14528 Len=0 TSV=4312624 TSER=4327528
456581  83.490052     10.0.1.3 -> 10.0.1.2     TCP 35258 > 9040 [FIN, ACK] Seq=13 Ack=450000002 Win=2017408 Len=0 TSV=4348400 TSER=4333476
  1   0.000000     10.0.1.3 -> 10.0.1.2     TCP 40709 > 9040 [SYN] Seq=0 Win=5840 Len=0 MSS=1460 TSV=4355437 TSER=0 WS=6
  2   0.000320     10.0.1.2 -> 10.0.1.3     TCP 9040 > 40709 [SYN, ACK] Seq=0 Ack=1 Win=14480 Len=0 MSS=1460 TSV=4340534 TSER=4355437 WS=6
  3   0.000344     10.0.1.3 -> 10.0.1.2     TCP 40709 > 9040 [ACK] Seq=1 Ack=1 Win=5888 Len=0 TSV=4355437 TSER=4340534
  7   0.002179     10.0.1.2 -> 10.0.1.3     TCP 9040 > 40709 [ACK] Seq=1 Ack=13 Win=14528 Len=0 TSV=4340535 TSER=4355437
466771  83.654963     10.0.1.3 -> 10.0.1.2     TCP 40709 > 9040 [FIN, ACK] Seq=13 Ack=450000002 Win=2026112 Len=0 TSV=4376351 TSER=4361428
  1   0.000000     10.0.1.3 -> 10.0.1.2     TCP 40711 > 9040 [SYN] Seq=0 Win=5840 Len=0 MSS=1460 TSV=4383541 TSER=0 WS=6
  2   0.000286     10.0.1.2 -> 10.0.1.3     TCP 9040 > 40711 [SYN, ACK] Seq=0 Ack=1 Win=14480 Len=0 MSS=1460 TSV=4368641 TSER=4383541 WS=6
  3   0.000312     10.0.1.3 -> 10.0.1.2     TCP 40711 > 9040 [ACK] Seq=1 Ack=1 Win=5888 Len=0 TSV=4383541 TSER=4368641
  7   0.002218     10.0.1.2 -> 10.0.1.3     TCP 9040 > 40711 [ACK] Seq=1 Ack=13 Win=14528 Len=0 TSV=4368641 TSER=4383541
465600  84.847991     10.0.1.3 -> 10.0.1.2     TCP 40711 > 9040 [FIN, ACK] Seq=13 Ack=450000002 Win=2023168 Len=0 TSV=4404753 TSER=4389833
  1   0.000000     10.0.1.3 -> 10.0.1.2     TCP 40713 > 9040 [SYN] Seq=0 Win=5840 Len=0 MSS=1460 TSV=4411984 TSER=0 WS=6
  2   0.000302     10.0.1.2 -> 10.0.1.3     TCP 9040 > 40713 [SYN, ACK] Seq=0 Ack=1 Win=14480 Len=0 MSS=1460 TSV=4397086 TSER=4411984 WS=6
  3   0.000325     10.0.1.3 -> 10.0.1.2     TCP 40713 > 9040 [ACK] Seq=1 Ack=1 Win=5888 Len=0 TSV=4411984 TSER=4397086
  7   0.002160     10.0.1.2 -> 10.0.1.3     TCP 9040 > 40713 [ACK] Seq=1 Ack=13 Win=14528 Len=0 TSV=4397086 TSER=4411984
466843  84.513319     10.0.1.3 -> 10.0.1.2     TCP 40713 > 9040 [FIN, ACK] Seq=13 Ack=450000002 Win=2026112 Len=0 TSV=4433112 TSER=4418194
  1   0.000000     10.0.1.3 -> 10.0.1.2     TCP 45544 > 9040 [SYN] Seq=0 Win=5840 Len=0 MSS=1460 TSV=4440376 TSER=0 WS=6
  2   0.000319     10.0.1.2 -> 10.0.1.3     TCP 9040 > 45544 [SYN, ACK] Seq=0 Ack=1 Win=14480 Len=0 MSS=1460 TSV=4425480 TSER=4440376 WS=6
  3   0.000343     10.0.1.3 -> 10.0.1.2     TCP 45544 > 9040 [ACK] Seq=1 Ack=1 Win=5888 Len=0 TSV=4440376 TSER=4425480
  7   0.002288     10.0.1.2 -> 10.0.1.3     TCP 9040 > 45544 [ACK] Seq=1 Ack=13 Win=14528 Len=0 TSV=4425480 TSER=4440376
451028  84.675772     10.0.1.3 -> 10.0.1.2     TCP 45544 > 9040 [FIN, ACK] Seq=13 Ack=450000002 Win=2020288 Len=0 TSV=4461544 TSER=4446629
  1   0.000000     10.0.1.3 -> 10.0.1.2     TCP 45546 > 9040 [SYN] Seq=0 Win=5840 Len=0 MSS=1460 TSV=4468351 TSER=0 WS=6
  2   0.000309     10.0.1.2 -> 10.0.1.3     TCP 9040 > 45546 [SYN, ACK] Seq=0 Ack=1 Win=14480 Len=0 MSS=1460 TSV=4453457 TSER=4468351 WS=6
  3   0.000331     10.0.1.3 -> 10.0.1.2     TCP 45546 > 9040 [ACK] Seq=1 Ack=1 Win=5888 Len=0 TSV=4468351 TSER=4453457
  7   0.002342     10.0.1.2 -> 10.0.1.3     TCP 9040 > 45546 [ACK] Seq=1 Ack=13 Win=14528 Len=0 TSV=4453457 TSER=4468351
467054  83.788517     10.0.1.3 -> 10.0.1.2     TCP 45546 > 9040 [FIN, ACK] Seq=13 Ack=450000002 Win=2023168 Len=0 TSV=4489298 TSER=4474384
  1   0.000000     10.0.1.3 -> 10.0.1.2     TCP 45548 > 9040 [SYN] Seq=0 Win=5840 Len=0 MSS=1460 TSV=4496629 TSER=0 WS=6
  2   0.000287     10.0.1.2 -> 10.0.1.3     TCP 9040 > 45548 [SYN, ACK] Seq=0 Ack=1 Win=14480 Len=0 MSS=1460 TSV=4481737 TSER=4496629 WS=6
  3   0.000311     10.0.1.3 -> 10.0.1.2     TCP 45548 > 9040 [ACK] Seq=1 Ack=1 Win=5888 Len=0 TSV=4496629 TSER=4481737
  7   0.002204     10.0.1.2 -> 10.0.1.3     TCP 9040 > 45548 [ACK] Seq=1 Ack=13 Win=14528 Len=0 TSV=4481737 TSER=4496629
445001  84.964931     10.0.1.3 -> 10.0.1.2     TCP 45548 > 9040 [FIN, ACK] Seq=13 Ack=450000002 Win=2037696 Len=0 TSV=4517870 TSER=4502958
  1   0.000000     10.0.1.3 -> 10.0.1.2     TCP 52229 > 9040 [SYN] Seq=0 Win=5840 Len=0 MSS=1460 TSV=4525018 TSER=0 WS=6
  2   0.000327     10.0.1.2 -> 10.0.1.3     TCP 9040 > 52229 [SYN, ACK] Seq=0 Ack=1 Win=14480 Len=0 MSS=1460 TSV=4510129 TSER=4525018 WS=6
  3   0.000353     10.0.1.3 -> 10.0.1.2     TCP 52229 > 9040 [ACK] Seq=1 Ack=1 Win=5888 Len=0 TSV=4525018 TSER=4510129
  7   0.002186     10.0.1.2 -> 10.0.1.3     TCP 9040 > 52229 [ACK] Seq=1 Ack=13 Win=14528 Len=0 TSV=4510129 TSER=4525018
461498  84.590219     10.0.1.3 -> 10.0.1.2     TCP 52229 > 9040 [FIN, ACK] Seq=13 Ack=450000002 Win=2026112 Len=0 TSV=4546166 TSER=4531256
  1   0.000000     10.0.1.3 -> 10.0.1.2     TCP 52231 > 9040 [SYN] Seq=0 Win=5840 Len=0 MSS=1460 TSV=4553493 TSER=0 WS=6
  2   0.000360     10.0.1.2 -> 10.0.1.3     TCP 9040 > 52231 [SYN, ACK] Seq=0 Ack=1 Win=14480 Len=0 MSS=1460 TSV=4538606 TSER=4553493 WS=6
  3   0.000383     10.0.1.3 -> 10.0.1.2     TCP 52231 > 9040 [ACK] Seq=1 Ack=1 Win=5888 Len=0 TSV=4553494 TSER=4538606
  7   0.002290     10.0.1.2 -> 10.0.1.3     TCP 9040 > 52231 [ACK] Seq=1 Ack=13 Win=14528 Len=0 TSV=4538606 TSER=4553494
457199  81.131306     10.0.1.3 -> 10.0.1.2     TCP 52231 > 9040 [FIN, ACK] Seq=13 Ack=450000002 Win=2023168 Len=0 TSV=4573776 TSER=4558869
  1   0.000000     10.0.1.3 -> 10.0.1.2     TCP 58013 > 9040 [SYN] Seq=0 Win=5840 Len=0 MSS=1460 TSV=4581006 TSER=0 WS=6
  2   0.000321     10.0.1.2 -> 10.0.1.3     TCP 9040 > 58013 [SYN, ACK] Seq=0 Ack=1 Win=14480 Len=0 MSS=1460 TSV=4566121 TSER=4581006 WS=6
  3   0.000346     10.0.1.3 -> 10.0.1.2     TCP 58013 > 9040 [ACK] Seq=1 Ack=1 Win=5888 Len=0 TSV=4581006 TSER=4566121
  7   0.002224     10.0.1.2 -> 10.0.1.3     TCP 9040 > 58013 [ACK] Seq=1 Ack=13 Win=14528 Len=0 TSV=4566122 TSER=4581007
464235  81.728683     10.0.1.3 -> 10.0.1.2     TCP 58013 > 9040 [FIN, ACK] Seq=13 Ack=450000002 Win=2017408 Len=0 TSV=4601439 TSER=4586534
  1   0.000000     10.0.1.3 -> 10.0.1.2     TCP 58015 > 9040 [SYN] Seq=0 Win=5840 Len=0 MSS=1460 TSV=4608796 TSER=0 WS=6
  2   0.000286     10.0.1.2 -> 10.0.1.3     TCP 9040 > 58015 [SYN, ACK] Seq=0 Ack=1 Win=14480 Len=0 MSS=1460 TSV=4593913 TSER=4608796 WS=6
  3   0.000308     10.0.1.3 -> 10.0.1.2     TCP 58015 > 9040 [ACK] Seq=1 Ack=1 Win=5888 Len=0 TSV=4608796 TSER=4593913
  7   0.002359     10.0.1.2 -> 10.0.1.3     TCP 9040 > 58015 [ACK] Seq=1 Ack=13 Win=14528 Len=0 TSV=4593913 TSER=4608796
465736  82.507402     10.0.1.3 -> 10.0.1.2     TCP 58015 > 9040 [FIN, ACK] Seq=13 Ack=450000002 Win=2023168 Len=0 TSV=4629423 TSER=4614520
  1   0.000000     10.0.1.3 -> 10.0.1.2     TCP 58017 > 9040 [SYN] Seq=0 Win=5840 Len=0 MSS=1460 TSV=4636246 TSER=0 WS=6
  2   0.000308     10.0.1.2 -> 10.0.1.3     TCP 9040 > 58017 [SYN, ACK] Seq=0 Ack=1 Win=14480 Len=0 MSS=1460 TSV=4621365 TSER=4636246 WS=6
  3   0.000332     10.0.1.3 -> 10.0.1.2     TCP 58017 > 9040 [ACK] Seq=1 Ack=1 Win=5888 Len=0 TSV=4636246 TSER=4621365
  7   0.002263     10.0.1.2 -> 10.0.1.3     TCP 9040 > 58017 [ACK] Seq=1 Ack=13 Win=14528 Len=0 TSV=4621365 TSER=4636247
467073  81.689343     10.0.1.3 -> 10.0.1.2     TCP 58017 > 9040 [FIN, ACK] Seq=13 Ack=450000002 Win=2017408 Len=0 TSV=4656669 TSER=4641767
  1   0.000000     10.0.1.3 -> 10.0.1.2     TCP 35555 > 9040 [SYN] Seq=0 Win=5840 Len=0 MSS=1460 TSV=4663974 TSER=0 WS=6
  2   0.000296     10.0.1.2 -> 10.0.1.3     TCP 9040 > 35555 [SYN, ACK] Seq=0 Ack=1 Win=14480 Len=0 MSS=1460 TSV=4649095 TSER=4663974 WS=6
  3   0.000319     10.0.1.3 -> 10.0.1.2     TCP 35555 > 9040 [ACK] Seq=1 Ack=1 Win=5888 Len=0 TSV=4663974 TSER=4649095
  7   0.002260     10.0.1.2 -> 10.0.1.3     TCP 9040 > 35555 [ACK] Seq=1 Ack=13 Win=14528 Len=0 TSV=4649096 TSER=4663975
466328  82.284769     10.0.1.3 -> 10.0.1.2     TCP 35555 > 9040 [FIN, ACK] Seq=13 Ack=450000002 Win=2017408 Len=0 TSV=4684546 TSER=4669647
  1   0.000000     10.0.1.3 -> 10.0.1.2     TCP 35557 > 9040 [SYN] Seq=0 Win=5840 Len=0 MSS=1460 TSV=4691877 TSER=0 WS=6
  2   0.000298     10.0.1.2 -> 10.0.1.3     TCP 9040 > 35557 [SYN, ACK] Seq=0 Ack=1 Win=14480 Len=0 MSS=1460 TSV=4677000 TSER=4691877 WS=6
  3   0.000330     10.0.1.3 -> 10.0.1.2     TCP 35557 > 9040 [ACK] Seq=1 Ack=1 Win=5888 Len=0 TSV=4691877 TSER=4677000
  7   0.002138     10.0.1.2 -> 10.0.1.3     TCP 9040 > 35557 [ACK] Seq=1 Ack=13 Win=14528 Len=0 TSV=4677001 TSER=4691878
467061  82.916774     10.0.1.3 -> 10.0.1.2     TCP 35557 > 9040 [FIN, ACK] Seq=13 Ack=450000002 Win=2023168 Len=0 TSV=4712607 TSER=4697710
  1   0.000000     10.0.1.3 -> 10.0.1.2     TCP 35559 > 9040 [SYN] Seq=0 Win=5840 Len=0 MSS=1460 TSV=4719846 TSER=0 WS=6
  2   0.000281     10.0.1.2 -> 10.0.1.3     TCP 9040 > 35559 [SYN, ACK] Seq=0 Ack=1 Win=14480 Len=0 MSS=1460 TSV=4704971 TSER=4719846 WS=6
  3   0.000298     10.0.1.3 -> 10.0.1.2     TCP 35559 > 9040 [ACK] Seq=1 Ack=1 Win=5888 Len=0 TSV=4719846 TSER=4704971
  7   0.002113     10.0.1.2 -> 10.0.1.3     TCP 9040 > 35559 [ACK] Seq=1 Ack=13 Win=14528 Len=0 TSV=4704971 TSER=4719846
466903  82.802889     10.0.1.3 -> 10.0.1.2     TCP 35559 > 9040 [FIN, ACK] Seq=13 Ack=450000002 Win=2023168 Len=0 TSV=4740547 TSER=4725652
  1   0.000000     10.0.1.3 -> 10.0.1.2     TCP 55344 > 9040 [SYN] Seq=0 Win=5840 Len=0 MSS=1460 TSV=4747590 TSER=0 WS=6
  2   0.000311     10.0.1.2 -> 10.0.1.3     TCP 9040 > 55344 [SYN, ACK] Seq=0 Ack=1 Win=14480 Len=0 MSS=1460 TSV=4732718 TSER=4747590 WS=6
  3   0.000344     10.0.1.3 -> 10.0.1.2     TCP 55344 > 9040 [ACK] Seq=1 Ack=1 Win=5888 Len=0 TSV=4747590 TSER=4732718
  7   0.002428     10.0.1.2 -> 10.0.1.3     TCP 9040 > 55344 [ACK] Seq=1 Ack=13 Win=14528 Len=0 TSV=4732718 TSER=4747591
463157  81.301230     10.0.1.3 -> 10.0.1.2     TCP 55344 > 9040 [FIN, ACK] Seq=13 Ack=450000002 Win=2023168 Len=0 TSV=4767916 TSER=4753023
  1   0.000000     10.0.1.3 -> 10.0.1.2     TCP 55346 > 9040 [SYN] Seq=0 Win=5840 Len=0 MSS=1460 TSV=4775187 TSER=0 WS=6
  2   0.000314     10.0.1.2 -> 10.0.1.3     TCP 9040 > 55346 [SYN, ACK] Seq=0 Ack=1 Win=14480 Len=0 MSS=1460 TSV=4760316 TSER=4775187 WS=6
  3   0.000349     10.0.1.3 -> 10.0.1.2     TCP 55346 > 9040 [ACK] Seq=1 Ack=1 Win=5888 Len=0 TSV=4775187 TSER=4760316
  7   0.002209     10.0.1.2 -> 10.0.1.3     TCP 9040 > 55346 [ACK] Seq=1 Ack=13 Win=14528 Len=0 TSV=4760316 TSER=4775187
467068  81.642658     10.0.1.3 -> 10.0.1.2     TCP 55346 > 9040 [FIN, ACK] Seq=13 Ack=450000002 Win=2026112 Len=0 TSV=4795597 TSER=4780707
