  1   0.000000     10.0.1.3 -> 10.0.1.2     TCP 58675 > 9040 [SYN] Seq=0 Win=5840 Len=0 MSS=1460 TSV=10956544 TSER=0 WS=6
  2   0.000307     10.0.1.2 -> 10.0.1.3     TCP 9040 > 58675 [SYN, ACK] Seq=0 Ack=1 Win=14480 Len=0 MSS=1460 TSV=11010611 TSER=10956544 WS=6
  3   0.000329     10.0.1.3 -> 10.0.1.2     TCP 58675 > 9040 [ACK] Seq=1 Ack=1 Win=5888 Len=0 TSV=10956544 TSER=11010611
  7   0.002269     10.0.1.2 -> 10.0.1.3     TCP 9040 > 58675 [ACK] Seq=1 Ack=13 Win=14528 Len=0 TSV=11010612 TSER=10956545
414617  34.189816     10.0.1.3 -> 10.0.1.2     TCP 58675 > 9040 [FIN, ACK] Seq=13 Ack=400000002 Win=2580480 Len=0 TSV=10965092 TSER=11019104
414618  34.190059     10.0.1.2 -> 10.0.1.3     TCP 9040 > 58675 [ACK] Seq=400000002 Ack=14 Win=14528 Len=0 TSV=11019159 TSER=10965092
================================================================================
IPv4 Conversations
Filter:<No Filter>
                                               |       <-      | |       ->      | |     Total     |
                                               | Frames  Bytes | | Frames  Bytes | | Frames  Bytes |
10.0.1.3             <-> 10.0.1.2              276257 418232970  138361   9131846  414618 427364816
================================================================================
  1   0.000000     10.0.1.3 -> 10.0.1.2     TCP 58677 > 9040 [SYN] Seq=0 Win=5840 Len=0 MSS=1460 TSV=10968847 TSER=0 WS=6
  2   0.000275     10.0.1.2 -> 10.0.1.3     TCP 9040 > 58677 [SYN, ACK] Seq=0 Ack=1 Win=14480 Len=0 MSS=1460 TSV=11022915 TSER=10968847 WS=6
  3   0.000298     10.0.1.3 -> 10.0.1.2     TCP 58677 > 9040 [ACK] Seq=1 Ack=1 Win=5888 Len=0 TSV=10968847 TSER=11022915
  7   0.002208     10.0.1.2 -> 10.0.1.3     TCP 9040 > 58677 [ACK] Seq=1 Ack=13 Win=14528 Len=0 TSV=11022915 TSER=10968847
414620  34.078868     10.0.1.3 -> 10.0.1.2     TCP 58677 > 9040 [FIN, ACK] Seq=13 Ack=400000002 Win=2580480 Len=0 TSV=10977366 TSER=11031380
414621  34.079121     10.0.1.2 -> 10.0.1.3     TCP 9040 > 58677 [ACK] Seq=400000002 Ack=14 Win=14528 Len=0 TSV=11031435 TSER=10977366
================================================================================
IPv4 Conversations
Filter:<No Filter>
                                               |       <-      | |       ->      | |     Total     |
                                               | Frames  Bytes | | Frames  Bytes | | Frames  Bytes |
10.0.1.3             <-> 10.0.1.2              276255 418232838  138366   9132176  414621 427365014
================================================================================
  1   0.000000     10.0.1.3 -> 10.0.1.2     TCP 58681 > 9040 [SYN] Seq=0 Win=5840 Len=0 MSS=1460 TSV=10981151 TSER=0 WS=6
  2   0.000274     10.0.1.2 -> 10.0.1.3     TCP 9040 > 58681 [SYN, ACK] Seq=0 Ack=1 Win=14480 Len=0 MSS=1460 TSV=11035220 TSER=10981151 WS=6
  3   0.000297     10.0.1.3 -> 10.0.1.2     TCP 58681 > 9040 [ACK] Seq=1 Ack=1 Win=5888 Len=0 TSV=10981151 TSER=11035220
  7   0.002311     10.0.1.2 -> 10.0.1.3     TCP 9040 > 58681 [ACK] Seq=1 Ack=13 Win=14528 Len=0 TSV=11035221 TSER=10981152
414709  34.078332     10.0.1.3 -> 10.0.1.2     TCP 58681 > 9040 [FIN, ACK] Seq=13 Ack=400000002 Win=2565888 Len=0 TSV=10989671 TSER=11043686
414710  34.078575     10.0.1.2 -> 10.0.1.3     TCP 9040 > 58681 [ACK] Seq=400000002 Ack=14 Win=14528 Len=0 TSV=11043740 TSER=10989671
================================================================================
IPv4 Conversations
Filter:<No Filter>
                                               |       <-      | |       ->      | |     Total     |
                                               | Frames  Bytes | | Frames  Bytes | | Frames  Bytes |
10.0.1.3             <-> 10.0.1.2              276251 418232574  138459   9138314  414710 427370888
================================================================================
  1   0.000000     10.0.1.3 -> 10.0.1.2     TCP 58683 > 9040 [SYN] Seq=0 Win=5840 Len=0 MSS=1460 TSV=10993441 TSER=0 WS=6
  2   0.000277     10.0.1.2 -> 10.0.1.3     TCP 9040 > 58683 [SYN, ACK] Seq=0 Ack=1 Win=14480 Len=0 MSS=1460 TSV=11047511 TSER=10993441 WS=6
  3   0.000299     10.0.1.3 -> 10.0.1.2     TCP 58683 > 9040 [ACK] Seq=1 Ack=1 Win=5888 Len=0 TSV=10993441 TSER=11047511
  7   0.002204     10.0.1.2 -> 10.0.1.3     TCP 9040 > 58683 [ACK] Seq=1 Ack=13 Win=14528 Len=0 TSV=11047511 TSER=10993441
414762  34.078009     10.0.1.3 -> 10.0.1.2     TCP 58683 > 9040 [FIN, ACK] Seq=13 Ack=400000002 Win=2565888 Len=0 TSV=11001960 TSER=11055976
414763  34.078252     10.0.1.2 -> 10.0.1.3     TCP 9040 > 58683 [ACK] Seq=400000002 Ack=14 Win=14528 Len=0 TSV=11056031 TSER=11001960
================================================================================
IPv4 Conversations
Filter:<No Filter>
                                               |       <-      | |       ->      | |     Total     |
                                               | Frames  Bytes | | Frames  Bytes | | Frames  Bytes |
10.0.1.3             <-> 10.0.1.2              276252 418232640  138511   9141746  414763 427374386
================================================================================
  1   0.000000     10.0.1.3 -> 10.0.1.2     TCP 58685 > 9040 [SYN] Seq=0 Win=5840 Len=0 MSS=1460 TSV=11005687 TSER=0 WS=6
  2   0.000320     10.0.1.2 -> 10.0.1.3     TCP 9040 > 58685 [SYN, ACK] Seq=0 Ack=1 Win=14480 Len=0 MSS=1460 TSV=11059757 TSER=11005687 WS=6
  3   0.000343     10.0.1.3 -> 10.0.1.2     TCP 58685 > 9040 [ACK] Seq=1 Ack=1 Win=5888 Len=0 TSV=11005687 TSER=11059757
  7   0.002214     10.0.1.2 -> 10.0.1.3     TCP 9040 > 58685 [ACK] Seq=1 Ack=13 Win=14528 Len=0 TSV=11059758 TSER=11005687
414511  34.079719     10.0.1.3 -> 10.0.1.2     TCP 58685 > 9040 [FIN, ACK] Seq=13 Ack=400000002 Win=2580480 Len=0 TSV=11014206 TSER=11068223
414512  34.079958     10.0.1.2 -> 10.0.1.3     TCP 9040 > 58685 [ACK] Seq=400000002 Ack=14 Win=14528 Len=0 TSV=11068278 TSER=11014206
================================================================================
IPv4 Conversations
Filter:<No Filter>
                                               |       <-      | |       ->      | |     Total     |
                                               | Frames  Bytes | | Frames  Bytes | | Frames  Bytes |
10.0.1.3             <-> 10.0.1.2              276253 418232706  138259   9125114  414512 427357820
================================================================================
  1   0.000000     10.0.1.3 -> 10.0.1.2     TCP 58687 > 9040 [SYN] Seq=0 Win=5840 Len=0 MSS=1460 TSV=11017943 TSER=0 WS=6
  2   0.000294     10.0.1.2 -> 10.0.1.3     TCP 9040 > 58687 [SYN, ACK] Seq=0 Ack=1 Win=14480 Len=0 MSS=1460 TSV=11072016 TSER=11017943 WS=6
  3   0.000319     10.0.1.3 -> 10.0.1.2     TCP 58687 > 9040 [ACK] Seq=1 Ack=1 Win=5888 Len=0 TSV=11017944 TSER=11072016
  7   0.003781     10.0.1.2 -> 10.0.1.3     TCP 9040 > 58687 [ACK] Seq=1 Ack=13 Win=14528 Len=0 TSV=11072016 TSER=11017945
414622  34.082032     10.0.1.3 -> 10.0.1.2     TCP 58687 > 9040 [FIN, ACK] Seq=13 Ack=400000002 Win=2580480 Len=0 TSV=11026464 TSER=11080482
414623  34.082244     10.0.1.2 -> 10.0.1.3     TCP 9040 > 58687 [ACK] Seq=400000002 Ack=14 Win=14528 Len=0 TSV=11080537 TSER=11026464
================================================================================
IPv4 Conversations
Filter:<No Filter>
                                               |       <-      | |       ->      | |     Total     |
                                               | Frames  Bytes | | Frames  Bytes | | Frames  Bytes |
10.0.1.3             <-> 10.0.1.2              276255 418232838  138368   9132308  414623 427365146
================================================================================
  1   0.000000     10.0.1.3 -> 10.0.1.2     TCP 59457 > 9040 [SYN] Seq=0 Win=5840 Len=0 MSS=1460 TSV=11030197 TSER=0 WS=6
  2   0.000303     10.0.1.2 -> 10.0.1.3     TCP 9040 > 59457 [SYN, ACK] Seq=0 Ack=1 Win=14480 Len=0 MSS=1460 TSV=11084270 TSER=11030197 WS=6
  3   0.000327     10.0.1.3 -> 10.0.1.2     TCP 59457 > 9040 [ACK] Seq=1 Ack=1 Win=5888 Len=0 TSV=11030197 TSER=11084270
  7   0.002290     10.0.1.2 -> 10.0.1.3     TCP 9040 > 59457 [ACK] Seq=1 Ack=13 Win=14528 Len=0 TSV=11084270 TSER=11030197
414248  34.080470     10.0.1.3 -> 10.0.1.2     TCP 59457 > 9040 [FIN, ACK] Seq=13 Ack=400000002 Win=2580480 Len=0 TSV=11038717 TSER=11092736
414249  34.080717     10.0.1.2 -> 10.0.1.3     TCP 9040 > 59457 [ACK] Seq=400000002 Ack=14 Win=14528 Len=0 TSV=11092791 TSER=11038717
================================================================================
IPv4 Conversations
Filter:<No Filter>
                                               |       <-      | |       ->      | |     Total     |
                                               | Frames  Bytes | | Frames  Bytes | | Frames  Bytes |
10.0.1.3             <-> 10.0.1.2              276256 418232904  137993   9107558  414249 427340462
================================================================================
  1   0.000000     10.0.1.3 -> 10.0.1.2     TCP 59460 > 9040 [SYN] Seq=0 Win=5840 Len=0 MSS=1460 TSV=11042458 TSER=0 WS=6
  2   0.000293     10.0.1.2 -> 10.0.1.3     TCP 9040 > 59460 [SYN, ACK] Seq=0 Ack=1 Win=14480 Len=0 MSS=1460 TSV=11096532 TSER=11042458 WS=6
  3   0.000316     10.0.1.3 -> 10.0.1.2     TCP 59460 > 9040 [ACK] Seq=1 Ack=1 Win=5888 Len=0 TSV=11042458 TSER=11096532
  7   0.002199     10.0.1.2 -> 10.0.1.3     TCP 9040 > 59460 [ACK] Seq=1 Ack=13 Win=14528 Len=0 TSV=11096532 TSER=11042459
414615  34.084118     10.0.1.3 -> 10.0.1.2     TCP 59460 > 9040 [FIN, ACK] Seq=13 Ack=400000002 Win=2580480 Len=0 TSV=11050979 TSER=11104999
414616  34.084333     10.0.1.2 -> 10.0.1.3     TCP 9040 > 59460 [ACK] Seq=400000002 Ack=14 Win=14528 Len=0 TSV=11105054 TSER=11050979
================================================================================
IPv4 Conversations
Filter:<No Filter>
                                               |       <-      | |       ->      | |     Total     |
                                               | Frames  Bytes | | Frames  Bytes | | Frames  Bytes |
10.0.1.3             <-> 10.0.1.2              276254 418232772  138362   9131912  414616 427364684
================================================================================
  1   0.000000     10.0.1.3 -> 10.0.1.2     TCP 59464 > 9040 [SYN] Seq=0 Win=5840 Len=0 MSS=1460 TSV=11054748 TSER=0 WS=6
  2   0.000278     10.0.1.2 -> 10.0.1.3     TCP 9040 > 59464 [SYN, ACK] Seq=0 Ack=1 Win=14480 Len=0 MSS=1460 TSV=11108823 TSER=11054748 WS=6
  3   0.000302     10.0.1.3 -> 10.0.1.2     TCP 59464 > 9040 [ACK] Seq=1 Ack=1 Win=5888 Len=0 TSV=11054748 TSER=11108823
  7   0.002797     10.0.1.2 -> 10.0.1.3     TCP 9040 > 59464 [ACK] Seq=1 Ack=13 Win=14528 Len=0 TSV=11108823 TSER=11054749
414658  34.079198     10.0.1.3 -> 10.0.1.2     TCP 59464 > 9040 [FIN, ACK] Seq=13 Ack=400000002 Win=2580480 Len=0 TSV=11063268 TSER=11117288
414659  34.079453     10.0.1.2 -> 10.0.1.3     TCP 9040 > 59464 [ACK] Seq=400000002 Ack=14 Win=14528 Len=0 TSV=11117343 TSER=11063268
================================================================================
IPv4 Conversations
Filter:<No Filter>
                                               |       <-      | |       ->      | |     Total     |
                                               | Frames  Bytes | | Frames  Bytes | | Frames  Bytes |
10.0.1.3             <-> 10.0.1.2              276255 418232838  138404   9134684  414659 427367522
================================================================================
  1   0.000000     10.0.1.3 -> 10.0.1.2     TCP 59466 > 9040 [SYN] Seq=0 Win=5840 Len=0 MSS=1460 TSV=11067001 TSER=0 WS=6
  2   0.000273     10.0.1.2 -> 10.0.1.3     TCP 9040 > 59466 [SYN, ACK] Seq=0 Ack=1 Win=14480 Len=0 MSS=1460 TSV=11121077 TSER=11067001 WS=6
  3   0.000296     10.0.1.3 -> 10.0.1.2     TCP 59466 > 9040 [ACK] Seq=1 Ack=1 Win=5888 Len=0 TSV=11067001 TSER=11121077
  7   0.002125     10.0.1.2 -> 10.0.1.3     TCP 9040 > 59466 [ACK] Seq=1 Ack=13 Win=14528 Len=0 TSV=11121077 TSER=11067002
414659  34.080425     10.0.1.3 -> 10.0.1.2     TCP 59466 > 9040 [FIN, ACK] Seq=13 Ack=400000002 Win=2580480 Len=0 TSV=11075521 TSER=11129542
414660  34.080674     10.0.1.2 -> 10.0.1.3     TCP 9040 > 59466 [ACK] Seq=400000002 Ack=14 Win=14528 Len=0 TSV=11129597 TSER=11075521
================================================================================
IPv4 Conversations
Filter:<No Filter>
                                               |       <-      | |       ->      | |     Total     |
                                               | Frames  Bytes | | Frames  Bytes | | Frames  Bytes |
10.0.1.3             <-> 10.0.1.2              276255 418232838  138405   9134750  414660 427367588
================================================================================
  1   0.000000     10.0.1.3 -> 10.0.1.2     TCP 59468 > 9040 [SYN] Seq=0 Win=5840 Len=0 MSS=1460 TSV=11079236 TSER=0 WS=6
  2   0.000280     10.0.1.2 -> 10.0.1.3     TCP 9040 > 59468 [SYN, ACK] Seq=0 Ack=1 Win=14480 Len=0 MSS=1460 TSV=11133312 TSER=11079236 WS=6
  3   0.000304     10.0.1.3 -> 10.0.1.2     TCP 59468 > 9040 [ACK] Seq=1 Ack=1 Win=5888 Len=0 TSV=11079236 TSER=11133312
  7   0.002205     10.0.1.2 -> 10.0.1.3     TCP 9040 > 59468 [ACK] Seq=1 Ack=13 Win=14528 Len=0 TSV=11133313 TSER=11079236
414570  34.088889     10.0.1.3 -> 10.0.1.2     TCP 59468 > 9040 [FIN, ACK] Seq=13 Ack=400000002 Win=2580480 Len=0 TSV=11087758 TSER=11141780
414571  34.089138     10.0.1.2 -> 10.0.1.3     TCP 9040 > 59468 [ACK] Seq=400000002 Ack=14 Win=14528 Len=0 TSV=11141835 TSER=11087758
================================================================================
IPv4 Conversations
Filter:<No Filter>
                                               |       <-      | |       ->      | |     Total     |
                                               | Frames  Bytes | | Frames  Bytes | | Frames  Bytes |
10.0.1.3             <-> 10.0.1.2              276254 418232772  138317   9128942  414571 427361714
================================================================================
  1   0.000000     10.0.1.3 -> 10.0.1.2     TCP 59471 > 9040 [SYN] Seq=0 Win=5840 Len=0 MSS=1460 TSV=11091508 TSER=0 WS=6
  2   0.000301     10.0.1.2 -> 10.0.1.3     TCP 9040 > 59471 [SYN, ACK] Seq=0 Ack=1 Win=14480 Len=0 MSS=1460 TSV=11145586 TSER=11091508 WS=6
  3   0.000325     10.0.1.3 -> 10.0.1.2     TCP 59471 > 9040 [ACK] Seq=1 Ack=1 Win=5888 Len=0 TSV=11091508 TSER=11145586
  7   0.002228     10.0.1.2 -> 10.0.1.3     TCP 9040 > 59471 [ACK] Seq=1 Ack=13 Win=14528 Len=0 TSV=11145586 TSER=11091509
414601  34.079577     10.0.1.3 -> 10.0.1.2     TCP 59471 > 9040 [FIN, ACK] Seq=13 Ack=400000002 Win=2580480 Len=0 TSV=11100028 TSER=11154051
414602  34.079822     10.0.1.2 -> 10.0.1.3     TCP 9040 > 59471 [ACK] Seq=400000002 Ack=14 Win=14528 Len=0 TSV=11154106 TSER=11100028
================================================================================
IPv4 Conversations
Filter:<No Filter>
                                               |       <-      | |       ->      | |     Total     |
                                               | Frames  Bytes | | Frames  Bytes | | Frames  Bytes |
10.0.1.3             <-> 10.0.1.2              276254 418232772  138348   9130988  414602 427363760
================================================================================
  1   0.000000     10.0.1.3 -> 10.0.1.2     TCP 35890 > 9040 [SYN] Seq=0 Win=5840 Len=0 MSS=1460 TSV=11103787 TSER=0 WS=6
  2   0.000299     10.0.1.2 -> 10.0.1.3     TCP 9040 > 35890 [SYN, ACK] Seq=0 Ack=1 Win=14480 Len=0 MSS=1460 TSV=11157866 TSER=11103787 WS=6
  3   0.000323     10.0.1.3 -> 10.0.1.2     TCP 35890 > 9040 [ACK] Seq=1 Ack=1 Win=5888 Len=0 TSV=11103788 TSER=11157866
  7   0.002320     10.0.1.2 -> 10.0.1.3     TCP 9040 > 35890 [ACK] Seq=1 Ack=13 Win=14528 Len=0 TSV=11157867 TSER=11103788
414591  34.081429     10.0.1.3 -> 10.0.1.2     TCP 35890 > 9040 [FIN, ACK] Seq=13 Ack=400000002 Win=2580480 Len=0 TSV=11112308 TSER=11166332
414592  34.081677     10.0.1.2 -> 10.0.1.3     TCP 9040 > 35890 [ACK] Seq=400000002 Ack=14 Win=14528 Len=0 TSV=11166387 TSER=11112308
================================================================================
IPv4 Conversations
Filter:<No Filter>
                                               |       <-      | |       ->      | |     Total     |
                                               | Frames  Bytes | | Frames  Bytes | | Frames  Bytes |
10.0.1.3             <-> 10.0.1.2              276254 418232772  138338   9130328  414592 427363100
================================================================================
  1   0.000000     10.0.1.3 -> 10.0.1.2     TCP 35892 > 9040 [SYN] Seq=0 Win=5840 Len=0 MSS=1460 TSV=11116048 TSER=0 WS=6
  2   0.000305     10.0.1.2 -> 10.0.1.3     TCP 9040 > 35892 [SYN, ACK] Seq=0 Ack=1 Win=14480 Len=0 MSS=1460 TSV=11170127 TSER=11116048 WS=6
  3   0.000329     10.0.1.3 -> 10.0.1.2     TCP 35892 > 9040 [ACK] Seq=1 Ack=1 Win=5888 Len=0 TSV=11116048 TSER=11170127
  7   0.002231     10.0.1.2 -> 10.0.1.3     TCP 9040 > 35892 [ACK] Seq=1 Ack=13 Win=14528 Len=0 TSV=11170128 TSER=11116049
414515  34.093111     10.0.1.3 -> 10.0.1.2     TCP 35892 > 9040 [FIN, ACK] Seq=13 Ack=400000002 Win=2580480 Len=0 TSV=11124571 TSER=11178596
414516  34.093359     10.0.1.2 -> 10.0.1.3     TCP 9040 > 35892 [ACK] Seq=400000002 Ack=14 Win=14528 Len=0 TSV=11178651 TSER=11124571
================================================================================
IPv4 Conversations
Filter:<No Filter>
                                               |       <-      | |       ->      | |     Total     |
                                               | Frames  Bytes | | Frames  Bytes | | Frames  Bytes |
10.0.1.3             <-> 10.0.1.2              276255 418232838  138261   9125246  414516 427358084
================================================================================
  1   0.000000     10.0.1.3 -> 10.0.1.2     TCP 35896 > 9040 [SYN] Seq=0 Win=5840 Len=0 MSS=1460 TSV=11128329 TSER=0 WS=6
  2   0.000284     10.0.1.2 -> 10.0.1.3     TCP 9040 > 35896 [SYN, ACK] Seq=0 Ack=1 Win=14480 Len=0 MSS=1460 TSV=11182410 TSER=11128329 WS=6
  3   0.000306     10.0.1.3 -> 10.0.1.2     TCP 35896 > 9040 [ACK] Seq=1 Ack=1 Win=5888 Len=0 TSV=11128329 TSER=11182410
  7   0.002265     10.0.1.2 -> 10.0.1.3     TCP 9040 > 35896 [ACK] Seq=1 Ack=13 Win=14528 Len=0 TSV=11182410 TSER=11128330
414583  34.142041     10.0.1.3 -> 10.0.1.2     TCP 35896 > 9040 [FIN, ACK] Seq=13 Ack=400000002 Win=2580480 Len=0 TSV=11136865 TSER=11190891
414584  34.142287     10.0.1.2 -> 10.0.1.3     TCP 9040 > 35896 [ACK] Seq=400000002 Ack=14 Win=14528 Len=0 TSV=11190946 TSER=11136865
================================================================================
IPv4 Conversations
Filter:<No Filter>
                                               |       <-      | |       ->      | |     Total     |
                                               | Frames  Bytes | | Frames  Bytes | | Frames  Bytes |
10.0.1.3             <-> 10.0.1.2              276260 418233168  138324   9129404  414584 427362572
================================================================================
  1   0.000000     10.0.1.3 -> 10.0.1.2     TCP 35898 > 9040 [SYN] Seq=0 Win=5840 Len=0 MSS=1460 TSV=11140642 TSER=0 WS=6
  2   0.000271     10.0.1.2 -> 10.0.1.3     TCP 9040 > 35898 [SYN, ACK] Seq=0 Ack=1 Win=14480 Len=0 MSS=1460 TSV=11194723 TSER=11140642 WS=6
  3   0.000294     10.0.1.3 -> 10.0.1.2     TCP 35898 > 9040 [ACK] Seq=1 Ack=1 Win=5888 Len=0 TSV=11140642 TSER=11194723
  7   0.002273     10.0.1.2 -> 10.0.1.3     TCP 9040 > 35898 [ACK] Seq=1 Ack=13 Win=14528 Len=0 TSV=11194724 TSER=11140642
414566  34.081832     10.0.1.3 -> 10.0.1.2     TCP 35898 > 9040 [FIN, ACK] Seq=13 Ack=400000002 Win=2580480 Len=0 TSV=11149162 TSER=11203189
414567  34.082078     10.0.1.2 -> 10.0.1.3     TCP 9040 > 35898 [ACK] Seq=400000002 Ack=14 Win=14528 Len=0 TSV=11203244 TSER=11149162
================================================================================
IPv4 Conversations
Filter:<No Filter>
                                               |       <-      | |       ->      | |     Total     |
                                               | Frames  Bytes | | Frames  Bytes | | Frames  Bytes |
10.0.1.3             <-> 10.0.1.2              276257 418232970  138310   9128480  414567 427361450
================================================================================
  1   0.000000     10.0.1.3 -> 10.0.1.2     TCP 35900 > 9040 [SYN] Seq=0 Win=5840 Len=0 MSS=1460 TSV=11152912 TSER=0 WS=6
  2   0.000320     10.0.1.2 -> 10.0.1.3     TCP 9040 > 35900 [SYN, ACK] Seq=0 Ack=1 Win=14480 Len=0 MSS=1460 TSV=11206994 TSER=11152912 WS=6
  3   0.000349     10.0.1.3 -> 10.0.1.2     TCP 35900 > 9040 [ACK] Seq=1 Ack=1 Win=5888 Len=0 TSV=11152912 TSER=11206994
  7   0.002214     10.0.1.2 -> 10.0.1.3     TCP 9040 > 35900 [ACK] Seq=1 Ack=13 Win=14528 Len=0 TSV=11206995 TSER=11152912
414559  34.079088     10.0.1.3 -> 10.0.1.2     TCP 35900 > 9040 [FIN, ACK] Seq=13 Ack=400000002 Win=2580480 Len=0 TSV=11161432 TSER=11215460
414560  34.079335     10.0.1.2 -> 10.0.1.3     TCP 9040 > 35900 [ACK] Seq=400000002 Ack=14 Win=14528 Len=0 TSV=11215515 TSER=11161432
================================================================================
IPv4 Conversations
Filter:<No Filter>
                                               |       <-      | |       ->      | |     Total     |
                                               | Frames  Bytes | | Frames  Bytes | | Frames  Bytes |
10.0.1.3             <-> 10.0.1.2              276255 418232838  138305   9128150  414560 427360988
================================================================================
  1   0.000000     10.0.1.3 -> 10.0.1.2     TCP 35902 > 9040 [SYN] Seq=0 Win=5840 Len=0 MSS=1460 TSV=11165232 TSER=0 WS=6
  2   0.000312     10.0.1.2 -> 10.0.1.3     TCP 9040 > 35902 [SYN, ACK] Seq=0 Ack=1 Win=14480 Len=0 MSS=1460 TSV=11219315 TSER=11165232 WS=6
  3   0.000334     10.0.1.3 -> 10.0.1.2     TCP 35902 > 9040 [ACK] Seq=1 Ack=1 Win=5888 Len=0 TSV=11165233 TSER=11219315
  7   0.002364     10.0.1.2 -> 10.0.1.3     TCP 9040 > 35902 [ACK] Seq=1 Ack=13 Win=14528 Len=0 TSV=11219316 TSER=11165233
414629  34.080217     10.0.1.3 -> 10.0.1.2     TCP 35902 > 9040 [FIN, ACK] Seq=13 Ack=400000002 Win=2580480 Len=0 TSV=11173753 TSER=11227781
414630  34.080480     10.0.1.2 -> 10.0.1.3     TCP 9040 > 35902 [ACK] Seq=400000002 Ack=14 Win=14528 Len=0 TSV=11227836 TSER=11173753
================================================================================
IPv4 Conversations
Filter:<No Filter>
                                               |       <-      | |       ->      | |     Total     |
                                               | Frames  Bytes | | Frames  Bytes | | Frames  Bytes |
10.0.1.3             <-> 10.0.1.2              276253 418232706  138377   9132902  414630 427365608
================================================================================
  1   0.000000     10.0.1.3 -> 10.0.1.2     TCP 39938 > 9040 [SYN] Seq=0 Win=5840 Len=0 MSS=1460 TSV=11177493 TSER=0 WS=6
  2   0.000318     10.0.1.2 -> 10.0.1.3     TCP 9040 > 39938 [SYN, ACK] Seq=0 Ack=1 Win=14480 Len=0 MSS=1460 TSV=11231577 TSER=11177493 WS=6
  3   0.000341     10.0.1.3 -> 10.0.1.2     TCP 39938 > 9040 [ACK] Seq=1 Ack=1 Win=5888 Len=0 TSV=11177493 TSER=11231577
  7   0.002304     10.0.1.2 -> 10.0.1.3     TCP 9040 > 39938 [ACK] Seq=1 Ack=13 Win=14528 Len=0 TSV=11231578 TSER=11177494
414665  34.083804     10.0.1.3 -> 10.0.1.2     TCP 39938 > 9040 [FIN, ACK] Seq=13 Ack=400000002 Win=2580480 Len=0 TSV=11186014 TSER=11240044
414666  34.084056     10.0.1.2 -> 10.0.1.3     TCP 9040 > 39938 [ACK] Seq=400000002 Ack=14 Win=14528 Len=0 TSV=11240099 TSER=11186014
================================================================================
IPv4 Conversations
Filter:<No Filter>
                                               |       <-      | |       ->      | |     Total     |
                                               | Frames  Bytes | | Frames  Bytes | | Frames  Bytes |
10.0.1.3             <-> 10.0.1.2              276256 418232904  138410   9135080  414666 427367984
================================================================================
  1   0.000000     10.0.1.3 -> 10.0.1.2     TCP 39940 > 9040 [SYN] Seq=0 Win=5840 Len=0 MSS=1460 TSV=11189763 TSER=0 WS=6
  2   0.000319     10.0.1.2 -> 10.0.1.3     TCP 9040 > 39940 [SYN, ACK] Seq=0 Ack=1 Win=14480 Len=0 MSS=1460 TSV=11243848 TSER=11189763 WS=6
  3   0.000343     10.0.1.3 -> 10.0.1.2     TCP 39940 > 9040 [ACK] Seq=1 Ack=1 Win=5888 Len=0 TSV=11189763 TSER=11243848
  7   0.002222     10.0.1.2 -> 10.0.1.3     TCP 9040 > 39940 [ACK] Seq=1 Ack=13 Win=14528 Len=0 TSV=11243848 TSER=11189764
414604  34.080159     10.0.1.3 -> 10.0.1.2     TCP 39940 > 9040 [FIN, ACK] Seq=13 Ack=400000002 Win=2580480 Len=0 TSV=11198283 TSER=11252314
414605  34.080403     10.0.1.2 -> 10.0.1.3     TCP 9040 > 39940 [ACK] Seq=400000002 Ack=14 Win=14528 Len=0 TSV=11252369 TSER=11198283
================================================================================
IPv4 Conversations
Filter:<No Filter>
                                               |       <-      | |       ->      | |     Total     |
                                               | Frames  Bytes | | Frames  Bytes | | Frames  Bytes |
10.0.1.3             <-> 10.0.1.2              276254 418232772  138351   9131186  414605 427363958
================================================================================
