  1   0.000000     10.0.1.3 -> 10.0.1.2     TCP 53750 > 9040 [SYN] Seq=0 Win=5840 Len=0 MSS=1460 TSV=6350599 TSER=0 WS=6
  2   0.000290     10.0.1.2 -> 10.0.1.3     TCP 9040 > 53750 [SYN, ACK] Seq=0 Ack=1 Win=14480 Len=0 MSS=1460 TSV=6335651 TSER=6350599 WS=6
  3   0.000313     10.0.1.3 -> 10.0.1.2     TCP 53750 > 9040 [ACK] Seq=1 Ack=1 Win=5888 Len=0 TSV=6350599 TSER=6335651
  7   0.002185     10.0.1.2 -> 10.0.1.3     TCP 9040 > 53750 [ACK] Seq=1 Ack=13 Win=14528 Len=0 TSV=6335652 TSER=6350600
415064  72.330796     10.0.1.3 -> 10.0.1.2     TCP 53750 > 9040 [FIN, ACK] Seq=13 Ack=400000002 Win=2002944 Len=0 TSV=6368682 TSER=6353714
415065  72.331040     10.0.1.2 -> 10.0.1.3     TCP 9040 > 53750 [ACK] Seq=400000002 Ack=14 Win=14528 Len=0 TSV=6353735 TSER=6368682
  1   0.000000     10.0.1.3 -> 10.0.1.2     TCP 47070 > 9040 [SYN] Seq=0 Win=5840 Len=0 MSS=1460 TSV=6375424 TSER=0 WS=6
  2   0.000374     10.0.1.2 -> 10.0.1.3     TCP 9040 > 47070 [SYN, ACK] Seq=0 Ack=1 Win=14480 Len=0 MSS=1460 TSV=6360478 TSER=6375424 WS=6
  3   0.000398     10.0.1.3 -> 10.0.1.2     TCP 47070 > 9040 [ACK] Seq=1 Ack=1 Win=5888 Len=0 TSV=6375424 TSER=6360478
  7   0.002279     10.0.1.2 -> 10.0.1.3     TCP 9040 > 47070 [ACK] Seq=1 Ack=13 Win=14528 Len=0 TSV=6360479 TSER=6375425
415045  71.587823     10.0.1.3 -> 10.0.1.2     TCP 47070 > 9040 [FIN, ACK] Seq=13 Ack=400000002 Win=2026112 Len=0 TSV=6393321 TSER=6378355
415046  71.588073     10.0.1.2 -> 10.0.1.3     TCP 9040 > 47070 [ACK] Seq=400000002 Ack=14 Win=14528 Len=0 TSV=6378376 TSER=6393321
  1   0.000000     10.0.1.3 -> 10.0.1.2     TCP 47072 > 9040 [SYN] Seq=0 Win=5840 Len=0 MSS=1460 TSV=6400034 TSER=0 WS=6
  2   0.000270     10.0.1.2 -> 10.0.1.3     TCP 9040 > 47072 [SYN, ACK] Seq=0 Ack=1 Win=14480 Len=0 MSS=1460 TSV=6385090 TSER=6400034 WS=6
  3   0.000296     10.0.1.3 -> 10.0.1.2     TCP 47072 > 9040 [ACK] Seq=1 Ack=1 Win=5888 Len=0 TSV=6400034 TSER=6385090
  7   0.002281     10.0.1.2 -> 10.0.1.3     TCP 9040 > 47072 [ACK] Seq=1 Ack=13 Win=14528 Len=0 TSV=6385090 TSER=6400035
406571  72.105047     10.0.1.3 -> 10.0.1.2     TCP 47072 > 9040 [FIN, ACK] Seq=13 Ack=400000002 Win=2026112 Len=0 TSV=6418060 TSER=6403096
406572  72.105299     10.0.1.2 -> 10.0.1.3     TCP 9040 > 47072 [ACK] Seq=400000002 Ack=14 Win=14528 Len=0 TSV=6403117 TSER=6418060
  1   0.000000     10.0.1.3 -> 10.0.1.2     TCP 47074 > 9040 [SYN] Seq=0 Win=5840 Len=0 MSS=1460 TSV=6424705 TSER=0 WS=6
  2   0.000319     10.0.1.2 -> 10.0.1.3     TCP 9040 > 47074 [SYN, ACK] Seq=0 Ack=1 Win=14480 Len=0 MSS=1460 TSV=6409763 TSER=6424705 WS=6
  3   0.000342     10.0.1.3 -> 10.0.1.2     TCP 47074 > 9040 [ACK] Seq=1 Ack=1 Win=5888 Len=0 TSV=6424705 TSER=6409763
  7   0.002318     10.0.1.2 -> 10.0.1.3     TCP 9040 > 47074 [ACK] Seq=1 Ack=13 Win=14528 Len=0 TSV=6409763 TSER=6424706
415264  73.168026     10.0.1.3 -> 10.0.1.2     TCP 47074 > 9040 [FIN, ACK] Seq=13 Ack=400000002 Win=2017408 Len=0 TSV=6442997 TSER=6428035
415265  73.168274     10.0.1.2 -> 10.0.1.3     TCP 9040 > 47074 [ACK] Seq=400000002 Ack=14 Win=14528 Len=0 TSV=6428056 TSER=6442997
  1   0.000000     10.0.1.3 -> 10.0.1.2     TCP 47076 > 9040 [SYN] Seq=0 Win=5840 Len=0 MSS=1460 TSV=6449833 TSER=0 WS=6
  2   0.000303     10.0.1.2 -> 10.0.1.3     TCP 9040 > 47076 [SYN, ACK] Seq=0 Ack=1 Win=14480 Len=0 MSS=1460 TSV=6434892 TSER=6449833 WS=6
  3   0.000327     10.0.1.3 -> 10.0.1.2     TCP 47076 > 9040 [ACK] Seq=1 Ack=1 Win=5888 Len=0 TSV=6449833 TSER=6434892
  7   0.002247     10.0.1.2 -> 10.0.1.3     TCP 9040 > 47076 [ACK] Seq=1 Ack=13 Win=14528 Len=0 TSV=6434893 TSER=6449833
415234  72.413215     10.0.1.3 -> 10.0.1.2     TCP 47076 > 9040 [FIN, ACK] Seq=13 Ack=400000002 Win=2023168 Len=0 TSV=6467936 TSER=6452976
415235  72.413462     10.0.1.2 -> 10.0.1.3     TCP 9040 > 47076 [ACK] Seq=400000002 Ack=14 Win=14528 Len=0 TSV=6452997 TSER=6467936
  1   0.000000     10.0.1.3 -> 10.0.1.2     TCP 43311 > 9040 [SYN] Seq=0 Win=5840 Len=0 MSS=1460 TSV=6474688 TSER=0 WS=6
  2   0.000273     10.0.1.2 -> 10.0.1.3     TCP 9040 > 43311 [SYN, ACK] Seq=0 Ack=1 Win=14480 Len=0 MSS=1460 TSV=6459750 TSER=6474688 WS=6
  3   0.000297     10.0.1.3 -> 10.0.1.2     TCP 43311 > 9040 [ACK] Seq=1 Ack=1 Win=5888 Len=0 TSV=6474688 TSER=6459750
  7   0.002276     10.0.1.2 -> 10.0.1.3     TCP 9040 > 43311 [ACK] Seq=1 Ack=13 Win=14528 Len=0 TSV=6459750 TSER=6474688
414877  73.592642     10.0.1.3 -> 10.0.1.2     TCP 43311 > 9040 [FIN, ACK] Seq=13 Ack=400000002 Win=2014528 Len=0 TSV=6493086 TSER=6478128
414878  73.592896     10.0.1.2 -> 10.0.1.3     TCP 9040 > 43311 [ACK] Seq=400000002 Ack=14 Win=14528 Len=0 TSV=6478149 TSER=6493086
  1   0.000000     10.0.1.3 -> 10.0.1.2     TCP 43313 > 9040 [SYN] Seq=0 Win=5840 Len=0 MSS=1460 TSV=6499768 TSER=0 WS=6
  2   0.000323     10.0.1.2 -> 10.0.1.3     TCP 9040 > 43313 [SYN, ACK] Seq=0 Ack=1 Win=14480 Len=0 MSS=1460 TSV=6484832 TSER=6499768 WS=6
  3   0.000349     10.0.1.3 -> 10.0.1.2     TCP 43313 > 9040 [ACK] Seq=1 Ack=1 Win=5888 Len=0 TSV=6499768 TSER=6484832
  7   0.002240     10.0.1.2 -> 10.0.1.3     TCP 9040 > 43313 [ACK] Seq=1 Ack=13 Win=14528 Len=0 TSV=6484832 TSER=6499769
402741  72.706425     10.0.1.3 -> 10.0.1.2     TCP 43313 > 9040 [FIN, ACK] Seq=13 Ack=400000002 Win=2023168 Len=0 TSV=6517945 TSER=6502988
402742  72.706684     10.0.1.2 -> 10.0.1.3     TCP 9040 > 43313 [ACK] Seq=400000002 Ack=14 Win=14528 Len=0 TSV=6503010 TSER=6517945
  1   0.000000     10.0.1.3 -> 10.0.1.2     TCP 43315 > 9040 [SYN] Seq=0 Win=5840 Len=0 MSS=1460 TSV=6524497 TSER=0 WS=6
  2   0.000301     10.0.1.2 -> 10.0.1.3     TCP 9040 > 43315 [SYN, ACK] Seq=0 Ack=1 Win=14480 Len=0 MSS=1460 TSV=6509562 TSER=6524497 WS=6
  3   0.000325     10.0.1.3 -> 10.0.1.2     TCP 43315 > 9040 [ACK] Seq=1 Ack=1 Win=5888 Len=0 TSV=6524497 TSER=6509562
  7   0.002236     10.0.1.2 -> 10.0.1.3     TCP 9040 > 43315 [ACK] Seq=1 Ack=13 Win=14528 Len=0 TSV=6509563 TSER=6524497
412184  72.137606     10.0.1.3 -> 10.0.1.2     TCP 43315 > 9040 [FIN, ACK] Seq=13 Ack=400000002 Win=2002944 Len=0 TSV=6542531 TSER=6527576
412185  72.137855     10.0.1.2 -> 10.0.1.3     TCP 9040 > 43315 [ACK] Seq=400000002 Ack=14 Win=14528 Len=0 TSV=6527598 TSER=6542531
  1   0.000000     10.0.1.3 -> 10.0.1.2     TCP 51429 > 9040 [SYN] Seq=0 Win=5840 Len=0 MSS=1460 TSV=6549136 TSER=0 WS=6
  2   0.000284     10.0.1.2 -> 10.0.1.3     TCP 9040 > 51429 [SYN, ACK] Seq=0 Ack=1 Win=14480 Len=0 MSS=1460 TSV=6534204 TSER=6549136 WS=6
  3   0.000307     10.0.1.3 -> 10.0.1.2     TCP 51429 > 9040 [ACK] Seq=1 Ack=1 Win=5888 Len=0 TSV=6549137 TSER=6534204
  7   0.002241     10.0.1.2 -> 10.0.1.3     TCP 9040 > 51429 [ACK] Seq=1 Ack=13 Win=14528 Len=0 TSV=6534204 TSER=6549137
415108  72.249038     10.0.1.3 -> 10.0.1.2     TCP 51429 > 9040 [FIN, ACK] Seq=13 Ack=400000002 Win=2020288 Len=0 TSV=6567199 TSER=6552246
415109  72.249287     10.0.1.2 -> 10.0.1.3     TCP 9040 > 51429 [ACK] Seq=400000002 Ack=14 Win=14528 Len=0 TSV=6552267 TSER=6567199
  1   0.000000     10.0.1.3 -> 10.0.1.2     TCP 51431 > 9040 [SYN] Seq=0 Win=5840 Len=0 MSS=1460 TSV=6573901 TSER=0 WS=6
  2   0.000297     10.0.1.2 -> 10.0.1.3     TCP 9040 > 51431 [SYN, ACK] Seq=0 Ack=1 Win=14480 Len=0 MSS=1460 TSV=6558970 TSER=6573901 WS=6
  3   0.000322     10.0.1.3 -> 10.0.1.2     TCP 51431 > 9040 [ACK] Seq=1 Ack=1 Win=5888 Len=0 TSV=6573901 TSER=6558970
  7   0.002289     10.0.1.2 -> 10.0.1.3     TCP 9040 > 51431 [ACK] Seq=1 Ack=13 Win=14528 Len=0 TSV=6558971 TSER=6573902
404416  72.095035     10.0.1.3 -> 10.0.1.2     TCP 51431 > 9040 [FIN, ACK] Seq=13 Ack=400000002 Win=2020288 Len=0 TSV=6591925 TSER=6576974
404417  72.095294     10.0.1.2 -> 10.0.1.3     TCP 9040 > 51431 [ACK] Seq=400000002 Ack=14 Win=14528 Len=0 TSV=6576995 TSER=6591925
  1   0.000000     10.0.1.3 -> 10.0.1.2     TCP 51433 > 9040 [SYN] Seq=0 Win=5840 Len=0 MSS=1460 TSV=6598585 TSER=0 WS=6
  2   0.000332     10.0.1.2 -> 10.0.1.3     TCP 9040 > 51433 [SYN, ACK] Seq=0 Ack=1 Win=14480 Len=0 MSS=1460 TSV=6583656 TSER=6598585 WS=6
  3   0.000356     10.0.1.3 -> 10.0.1.2     TCP 51433 > 9040 [ACK] Seq=1 Ack=1 Win=5888 Len=0 TSV=6598585 TSER=6583656
  7   0.002298     10.0.1.2 -> 10.0.1.3     TCP 9040 > 51433 [ACK] Seq=1 Ack=13 Win=14528 Len=0 TSV=6583656 TSER=6598586
414986  73.032344     10.0.1.3 -> 10.0.1.2     TCP 51433 > 9040 [FIN, ACK] Seq=13 Ack=400000002 Win=2017408 Len=0 TSV=6616843 TSER=6601894
414987  73.032557     10.0.1.2 -> 10.0.1.3     TCP 9040 > 51433 [ACK] Seq=400000002 Ack=14 Win=14528 Len=0 TSV=6601915 TSER=6616843
  1   0.000000     10.0.1.3 -> 10.0.1.2     TCP 59964 > 9040 [SYN] Seq=0 Win=5840 Len=0 MSS=1460 TSV=6623384 TSER=0 WS=6
  2   0.000293     10.0.1.2 -> 10.0.1.3     TCP 9040 > 59964 [SYN, ACK] Seq=0 Ack=1 Win=14480 Len=0 MSS=1460 TSV=6608457 TSER=6623384 WS=6
  3   0.000319     10.0.1.3 -> 10.0.1.2     TCP 59964 > 9040 [ACK] Seq=1 Ack=1 Win=5888 Len=0 TSV=6623384 TSER=6608457
  7   0.002429     10.0.1.2 -> 10.0.1.3     TCP 9040 > 59964 [ACK] Seq=1 Ack=13 Win=14528 Len=0 TSV=6608457 TSER=6623385
414751  72.538507     10.0.1.3 -> 10.0.1.2     TCP 59964 > 9040 [FIN, ACK] Seq=13 Ack=400000002 Win=2026112 Len=0 TSV=6641519 TSER=6626571
414752  72.538754     10.0.1.2 -> 10.0.1.3     TCP 9040 > 59964 [ACK] Seq=400000002 Ack=14 Win=14528 Len=0 TSV=6626593 TSER=6641519
  1   0.000000     10.0.1.3 -> 10.0.1.2     TCP 59966 > 9040 [SYN] Seq=0 Win=5840 Len=0 MSS=1460 TSV=6647877 TSER=0 WS=6
  2   0.000290     10.0.1.2 -> 10.0.1.3     TCP 9040 > 59966 [SYN, ACK] Seq=0 Ack=1 Win=14480 Len=0 MSS=1460 TSV=6632952 TSER=6647877 WS=6
  3   0.000323     10.0.1.3 -> 10.0.1.2     TCP 59966 > 9040 [ACK] Seq=1 Ack=1 Win=5888 Len=0 TSV=6647877 TSER=6632952
  7   0.002511     10.0.1.2 -> 10.0.1.3     TCP 9040 > 59966 [ACK] Seq=1 Ack=13 Win=14528 Len=0 TSV=6632952 TSER=6647878
414858  72.401501     10.0.1.3 -> 10.0.1.2     TCP 59966 > 9040 [FIN, ACK] Seq=13 Ack=400000002 Win=2014528 Len=0 TSV=6665978 TSER=6651032
414859  72.401756     10.0.1.2 -> 10.0.1.3     TCP 9040 > 59966 [ACK] Seq=400000002 Ack=14 Win=14528 Len=0 TSV=6651053 TSER=6665978
  1   0.000000     10.0.1.3 -> 10.0.1.2     TCP 59968 > 9040 [SYN] Seq=0 Win=5840 Len=0 MSS=1460 TSV=6672451 TSER=0 WS=6
  2   0.000303     10.0.1.2 -> 10.0.1.3     TCP 9040 > 59968 [SYN, ACK] Seq=0 Ack=1 Win=14480 Len=0 MSS=1460 TSV=6657527 TSER=6672451 WS=6
  3   0.000328     10.0.1.3 -> 10.0.1.2     TCP 59968 > 9040 [ACK] Seq=1 Ack=1 Win=5888 Len=0 TSV=6672451 TSER=6657527
  7   0.002187     10.0.1.2 -> 10.0.1.3     TCP 9040 > 59968 [ACK] Seq=1 Ack=13 Win=14528 Len=0 TSV=6657528 TSER=6672451
415054  73.291719     10.0.1.3 -> 10.0.1.2     TCP 59968 > 9040 [FIN, ACK] Seq=13 Ack=400000002 Win=2020288 Len=0 TSV=6690774 TSER=6675830
415055  73.291966     10.0.1.2 -> 10.0.1.3     TCP 9040 > 59968 [ACK] Seq=400000002 Ack=14 Win=14528 Len=0 TSV=6675851 TSER=6690774
  1   0.000000     10.0.1.3 -> 10.0.1.2     TCP 37590 > 9040 [SYN] Seq=0 Win=5840 Len=0 MSS=1460 TSV=6697557 TSER=0 WS=6
  2   0.000315     10.0.1.2 -> 10.0.1.3     TCP 9040 > 37590 [SYN, ACK] Seq=0 Ack=1 Win=14480 Len=0 MSS=1460 TSV=6682635 TSER=6697557 WS=6
  3   0.000350     10.0.1.3 -> 10.0.1.2     TCP 37590 > 9040 [ACK] Seq=1 Ack=1 Win=5888 Len=0 TSV=6697557 TSER=6682635
  7   0.003211     10.0.1.2 -> 10.0.1.3     TCP 9040 > 37590 [ACK] Seq=1 Ack=13 Win=14528 Len=0 TSV=6682636 TSER=6697558
414848  72.523304     10.0.1.3 -> 10.0.1.2     TCP 37590 > 9040 [FIN, ACK] Seq=13 Ack=400000002 Win=2023168 Len=0 TSV=6715688 TSER=6700746
414849  72.523550     10.0.1.2 -> 10.0.1.3     TCP 9040 > 37590 [ACK] Seq=400000002 Ack=14 Win=14528 Len=0 TSV=6700767 TSER=6715688
  1   0.000000     10.0.1.3 -> 10.0.1.2     TCP 37592 > 9040 [SYN] Seq=0 Win=5840 Len=0 MSS=1460 TSV=6722408 TSER=0 WS=6
  2   0.000365     10.0.1.2 -> 10.0.1.3     TCP 9040 > 37592 [SYN, ACK] Seq=0 Ack=1 Win=14480 Len=0 MSS=1460 TSV=6707489 TSER=6722408 WS=6
  3   0.000389     10.0.1.3 -> 10.0.1.2     TCP 37592 > 9040 [ACK] Seq=1 Ack=1 Win=5888 Len=0 TSV=6722408 TSER=6707489
  7   0.003684     10.0.1.2 -> 10.0.1.3     TCP 9040 > 37592 [ACK] Seq=1 Ack=13 Win=14528 Len=0 TSV=6707489 TSER=6722409
414845  73.368821     10.0.1.3 -> 10.0.1.2     TCP 37592 > 9040 [FIN, ACK] Seq=13 Ack=400000002 Win=2023168 Len=0 TSV=6740751 TSER=6725811
414846  73.369073     10.0.1.2 -> 10.0.1.3     TCP 9040 > 37592 [ACK] Seq=400000002 Ack=14 Win=14528 Len=0 TSV=6725832 TSER=6740751
  1   0.000000     10.0.1.3 -> 10.0.1.2     TCP 37594 > 9040 [SYN] Seq=0 Win=5840 Len=0 MSS=1460 TSV=6747319 TSER=0 WS=6
  2   0.000305     10.0.1.2 -> 10.0.1.3     TCP 9040 > 37594 [SYN, ACK] Seq=0 Ack=1 Win=14480 Len=0 MSS=1460 TSV=6732401 TSER=6747319 WS=6
  3   0.000330     10.0.1.3 -> 10.0.1.2     TCP 37594 > 9040 [ACK] Seq=1 Ack=1 Win=5888 Len=0 TSV=6747319 TSER=6732401
  7   0.002338     10.0.1.2 -> 10.0.1.3     TCP 9040 > 37594 [ACK] Seq=1 Ack=13 Win=14528 Len=0 TSV=6732402 TSER=6747320
399416  72.549166     10.0.1.3 -> 10.0.1.2     TCP 37594 > 9040 [FIN, ACK] Seq=13 Ack=400000002 Win=2020288 Len=0 TSV=6765457 TSER=6750518
399417  72.549411     10.0.1.2 -> 10.0.1.3     TCP 9040 > 37594 [ACK] Seq=400000002 Ack=14 Win=14528 Len=0 TSV=6750540 TSER=6765457
  1   0.000000     10.0.1.3 -> 10.0.1.2     TCP 34006 > 9040 [SYN] Seq=0 Win=5840 Len=0 MSS=1460 TSV=6771926 TSER=0 WS=6
  2   0.000317     10.0.1.2 -> 10.0.1.3     TCP 9040 > 34006 [SYN, ACK] Seq=0 Ack=1 Win=14480 Len=0 MSS=1460 TSV=6757010 TSER=6771926 WS=6
  3   0.000339     10.0.1.3 -> 10.0.1.2     TCP 34006 > 9040 [ACK] Seq=1 Ack=1 Win=5888 Len=0 TSV=6771926 TSER=6757010
  7   0.002880     10.0.1.2 -> 10.0.1.3     TCP 9040 > 34006 [ACK] Seq=1 Ack=13 Win=14528 Len=0 TSV=6757011 TSER=6771927
414920  73.459015     10.0.1.3 -> 10.0.1.2     TCP 34006 > 9040 [FIN, ACK] Seq=13 Ack=400000002 Win=2023168 Len=0 TSV=6790291 TSER=6775355
414921  73.459264     10.0.1.2 -> 10.0.1.3     TCP 9040 > 34006 [ACK] Seq=400000002 Ack=14 Win=14528 Len=0 TSV=6775376 TSER=6790291
  1   0.000000     10.0.1.3 -> 10.0.1.2     TCP 34008 > 9040 [SYN] Seq=0 Win=5840 Len=0 MSS=1460 TSV=6796908 TSER=0 WS=6
  2   0.000283     10.0.1.2 -> 10.0.1.3     TCP 9040 > 34008 [SYN, ACK] Seq=0 Ack=1 Win=14480 Len=0 MSS=1460 TSV=6781994 TSER=6796908 WS=6
  3   0.000307     10.0.1.3 -> 10.0.1.2     TCP 34008 > 9040 [ACK] Seq=1 Ack=1 Win=5888 Len=0 TSV=6796909 TSER=6781994
  7   0.002179     10.0.1.2 -> 10.0.1.3     TCP 9040 > 34008 [ACK] Seq=1 Ack=13 Win=14528 Len=0 TSV=6781995 TSER=6796909
414947  72.888659     10.0.1.3 -> 10.0.1.2     TCP 34008 > 9040 [FIN, ACK] Seq=13 Ack=400000002 Win=2011584 Len=0 TSV=6815131 TSER=6800196
414948  72.888911     10.0.1.2 -> 10.0.1.3     TCP 9040 > 34008 [ACK] Seq=400000002 Ack=14 Win=14528 Len=0 TSV=6800218 TSER=6815131
  1   0.000000     10.0.1.3 -> 10.0.1.2     TCP 34010 > 9040 [SYN] Seq=0 Win=5840 Len=0 MSS=1460 TSV=6821845 TSER=0 WS=6
  2   0.000323     10.0.1.2 -> 10.0.1.3     TCP 9040 > 34010 [SYN, ACK] Seq=0 Ack=1 Win=14480 Len=0 MSS=1460 TSV=6806933 TSER=6821845 WS=6
  3   0.000349     10.0.1.3 -> 10.0.1.2     TCP 34010 > 9040 [ACK] Seq=1 Ack=1 Win=5888 Len=0 TSV=6821845 TSER=6806933
  7   0.002290     10.0.1.2 -> 10.0.1.3     TCP 9040 > 34010 [ACK] Seq=1 Ack=13 Win=14528 Len=0 TSV=6806933 TSER=6821845
407123  72.059012     10.0.1.3 -> 10.0.1.2     TCP 34010 > 9040 [FIN, ACK] Seq=13 Ack=400000002 Win=2023168 Len=0 TSV=6839860 TSER=6824927
407124  72.059256     10.0.1.2 -> 10.0.1.3     TCP 9040 > 34010 [ACK] Seq=400000002 Ack=14 Win=14528 Len=0 TSV=6824949 TSER=6839860
