  1   0.000000     10.0.1.3 -> 10.0.1.2     TCP 40978 > 9040 [SYN] Seq=0 Win=5840 Len=0 MSS=1460 TSV=11809260 TSER=0 WS=6
  2   0.000276     10.0.1.2 -> 10.0.1.3     TCP 9040 > 40978 [SYN, ACK] Seq=0 Ack=1 Win=14480 Len=0 MSS=1460 TSV=11863391 TSER=11809260 WS=6
  3   0.000300     10.0.1.3 -> 10.0.1.2     TCP 40978 > 9040 [ACK] Seq=1 Ack=1 Win=5888 Len=0 TSV=11809260 TSER=11863391
  7   0.002159     10.0.1.2 -> 10.0.1.3     TCP 9040 > 40978 [ACK] Seq=1 Ack=13 Win=14528 Len=0 TSV=11863392 TSER=11809260
518347  42.592213     10.0.1.3 -> 10.0.1.2     TCP 40978 > 9040 [FIN, ACK] Seq=13 Ack=500000002 Win=2568768 Len=0 TSV=11819908 TSER=11873985
518348  42.592458     10.0.1.2 -> 10.0.1.3     TCP 9040 > 40978 [ACK] Seq=500000002 Ack=14 Win=14528 Len=0 TSV=11874040 TSER=11819908
================================================================================
IPv4 Conversations
Filter:<No Filter>
                                               |       <-      | |       ->      | |     Total     |
                                               | Frames  Bytes | | Frames  Bytes | | Frames  Bytes |
10.0.1.3             <-> 10.0.1.2              345315 522790798  173033  11420198  518348 534210996
================================================================================
  1   0.000000     10.0.1.3 -> 10.0.1.2     TCP 40980 > 9040 [SYN] Seq=0 Win=5840 Len=0 MSS=1460 TSV=11824348 TSER=0 WS=6
  2   0.000286     10.0.1.2 -> 10.0.1.3     TCP 9040 > 40980 [SYN, ACK] Seq=0 Ack=1 Win=14480 Len=0 MSS=1460 TSV=11878481 TSER=11824348 WS=6
  3   0.000308     10.0.1.3 -> 10.0.1.2     TCP 40980 > 9040 [ACK] Seq=1 Ack=1 Win=5888 Len=0 TSV=11824348 TSER=11878481
  7   0.002348     10.0.1.2 -> 10.0.1.3     TCP 9040 > 40980 [ACK] Seq=1 Ack=13 Win=14528 Len=0 TSV=11878482 TSER=11824349
518014  42.636914     10.0.1.3 -> 10.0.1.2     TCP 40980 > 9040 [FIN, ACK] Seq=13 Ack=500000002 Win=2580480 Len=0 TSV=11835008 TSER=11889086
518015  42.637160     10.0.1.2 -> 10.0.1.3     TCP 9040 > 40980 [ACK] Seq=500000002 Ack=14 Win=14528 Len=0 TSV=11889141 TSER=11835008
================================================================================
IPv4 Conversations
Filter:<No Filter>
                                               |       <-      | |       ->      | |     Total     |
                                               | Frames  Bytes | | Frames  Bytes | | Frames  Bytes |
10.0.1.3             <-> 10.0.1.2              345321 522791194  172694  11397824  518015 534189018
================================================================================
  1   0.000000     10.0.1.3 -> 10.0.1.2     TCP 40982 > 9040 [SYN] Seq=0 Win=5840 Len=0 MSS=1460 TSV=11839413 TSER=0 WS=6
  2   0.000279     10.0.1.2 -> 10.0.1.3     TCP 9040 > 40982 [SYN, ACK] Seq=0 Ack=1 Win=14480 Len=0 MSS=1460 TSV=11893546 TSER=11839413 WS=6
  3   0.000302     10.0.1.3 -> 10.0.1.2     TCP 40982 > 9040 [ACK] Seq=1 Ack=1 Win=5888 Len=0 TSV=11839413 TSER=11893546
  7   0.002496     10.0.1.2 -> 10.0.1.3     TCP 9040 > 40982 [ACK] Seq=1 Ack=13 Win=14528 Len=0 TSV=11893547 TSER=11839413
518089  42.596503     10.0.1.3 -> 10.0.1.2     TCP 40982 > 9040 [FIN, ACK] Seq=13 Ack=500000002 Win=2580480 Len=0 TSV=11850062 TSER=11904141
518090  42.596747     10.0.1.2 -> 10.0.1.3     TCP 9040 > 40982 [ACK] Seq=500000002 Ack=14 Win=14528 Len=0 TSV=11904196 TSER=11850062
================================================================================
IPv4 Conversations
Filter:<No Filter>
                                               |       <-      | |       ->      | |     Total     |
                                               | Frames  Bytes | | Frames  Bytes | | Frames  Bytes |
10.0.1.3             <-> 10.0.1.2              345320 522791128  172770  11402840  518090 534193968
================================================================================
  1   0.000000     10.0.1.3 -> 10.0.1.2     TCP 42880 > 9040 [SYN] Seq=0 Win=5840 Len=0 MSS=1460 TSV=11854483 TSER=0 WS=6
  2   0.000315     10.0.1.2 -> 10.0.1.3     TCP 9040 > 42880 [SYN, ACK] Seq=0 Ack=1 Win=14480 Len=0 MSS=1460 TSV=11908618 TSER=11854483 WS=6
  3   0.000338     10.0.1.3 -> 10.0.1.2     TCP 42880 > 9040 [ACK] Seq=1 Ack=1 Win=5888 Len=0 TSV=11854483 TSER=11908618
  7   0.002228     10.0.1.2 -> 10.0.1.3     TCP 9040 > 42880 [ACK] Seq=1 Ack=13 Win=14528 Len=0 TSV=11908618 TSER=11854483
518112  42.617560     10.0.1.3 -> 10.0.1.2     TCP 42880 > 9040 [FIN, ACK] Seq=13 Ack=500000002 Win=2580480 Len=0 TSV=11865137 TSER=11919218
518113  42.617804     10.0.1.2 -> 10.0.1.3     TCP 9040 > 42880 [ACK] Seq=500000002 Ack=14 Win=14528 Len=0 TSV=11919273 TSER=11865137
================================================================================
IPv4 Conversations
Filter:<No Filter>
                                               |       <-      | |       ->      | |     Total     |
                                               | Frames  Bytes | | Frames  Bytes | | Frames  Bytes |
10.0.1.3             <-> 10.0.1.2              345318 522790996  172795  11404490  518113 534195486
================================================================================
  1   0.000000     10.0.1.3 -> 10.0.1.2     TCP 42882 > 9040 [SYN] Seq=0 Win=5840 Len=0 MSS=1460 TSV=11869550 TSER=0 WS=6
  2   0.000284     10.0.1.2 -> 10.0.1.3     TCP 9040 > 42882 [SYN, ACK] Seq=0 Ack=1 Win=14480 Len=0 MSS=1460 TSV=11923686 TSER=11869550 WS=6
  3   0.000307     10.0.1.3 -> 10.0.1.2     TCP 42882 > 9040 [ACK] Seq=1 Ack=1 Win=5888 Len=0 TSV=11869550 TSER=11923686
  7   0.003090     10.0.1.2 -> 10.0.1.3     TCP 9040 > 42882 [ACK] Seq=1 Ack=13 Win=14528 Len=0 TSV=11923687 TSER=11869551
518155  42.595879     10.0.1.3 -> 10.0.1.2     TCP 42882 > 9040 [FIN, ACK] Seq=13 Ack=500000002 Win=2580480 Len=0 TSV=11880199 TSER=11934281
518156  42.596132     10.0.1.2 -> 10.0.1.3     TCP 9040 > 42882 [ACK] Seq=500000002 Ack=14 Win=14528 Len=0 TSV=11934336 TSER=11880199
================================================================================
IPv4 Conversations
Filter:<No Filter>
                                               |       <-      | |       ->      | |     Total     |
                                               | Frames  Bytes | | Frames  Bytes | | Frames  Bytes |
10.0.1.3             <-> 10.0.1.2              345320 522791128  172836  11407196  518156 534198324
================================================================================
  1   0.000000     10.0.1.3 -> 10.0.1.2     TCP 42887 > 9040 [SYN] Seq=0 Win=5840 Len=0 MSS=1460 TSV=11884608 TSER=0 WS=6
  2   0.000300     10.0.1.2 -> 10.0.1.3     TCP 9040 > 42887 [SYN, ACK] Seq=0 Ack=1 Win=14480 Len=0 MSS=1460 TSV=11938745 TSER=11884608 WS=6
  3   0.000330     10.0.1.3 -> 10.0.1.2     TCP 42887 > 9040 [ACK] Seq=1 Ack=1 Win=5888 Len=0 TSV=11884608 TSER=11938745
  7   0.002290     10.0.1.2 -> 10.0.1.3     TCP 9040 > 42887 [ACK] Seq=1 Ack=13 Win=14528 Len=0 TSV=11938746 TSER=11884608
517950  42.609079     10.0.1.3 -> 10.0.1.2     TCP 42887 > 9040 [FIN, ACK] Seq=13 Ack=500000002 Win=2580480 Len=0 TSV=11895260 TSER=11949343
517951  42.609334     10.0.1.2 -> 10.0.1.3     TCP 9040 > 42887 [ACK] Seq=500000002 Ack=14 Win=14528 Len=0 TSV=11949398 TSER=11895260
================================================================================
IPv4 Conversations
Filter:<No Filter>
                                               |       <-      | |       ->      | |     Total     |
                                               | Frames  Bytes | | Frames  Bytes | | Frames  Bytes |
10.0.1.3             <-> 10.0.1.2              345318 522790996  172633  11393798  517951 534184794
================================================================================
  1   0.000000     10.0.1.3 -> 10.0.1.2     TCP 42889 > 9040 [SYN] Seq=0 Win=5840 Len=0 MSS=1460 TSV=11899750 TSER=0 WS=6
  2   0.000379     10.0.1.2 -> 10.0.1.3     TCP 9040 > 42889 [SYN, ACK] Seq=0 Ack=1 Win=14480 Len=0 MSS=1460 TSV=11953889 TSER=11899750 WS=6
  3   0.000403     10.0.1.3 -> 10.0.1.2     TCP 42889 > 9040 [ACK] Seq=1 Ack=1 Win=5888 Len=0 TSV=11899750 TSER=11953889
  7   0.002267     10.0.1.2 -> 10.0.1.3     TCP 9040 > 42889 [ACK] Seq=1 Ack=13 Win=14528 Len=0 TSV=11953889 TSER=11899751
518045  42.927710     10.0.1.3 -> 10.0.1.2     TCP 42889 > 9040 [FIN, ACK] Seq=13 Ack=500000002 Win=2580352 Len=0 TSV=11910482 TSER=11964566
518046  42.927963     10.0.1.2 -> 10.0.1.3     TCP 9040 > 42889 [ACK] Seq=500000002 Ack=14 Win=14528 Len=0 TSV=11964621 TSER=11910482
================================================================================
IPv4 Conversations
Filter:<No Filter>
                                               |       <-      | |       ->      | |     Total     |
                                               | Frames  Bytes | | Frames  Bytes | | Frames  Bytes |
10.0.1.3             <-> 10.0.1.2              345322 522791260  172724  11399804  518046 534191064
================================================================================
  1   0.000000     10.0.1.3 -> 10.0.1.2     TCP 42891 > 9040 [SYN] Seq=0 Win=5840 Len=0 MSS=1460 TSV=11914880 TSER=0 WS=6
  2   0.000356     10.0.1.2 -> 10.0.1.3     TCP 9040 > 42891 [SYN, ACK] Seq=0 Ack=1 Win=14480 Len=0 MSS=1460 TSV=11969019 TSER=11914880 WS=6
  3   0.000379     10.0.1.3 -> 10.0.1.2     TCP 42891 > 9040 [ACK] Seq=1 Ack=1 Win=5888 Len=0 TSV=11914880 TSER=11969019
  7   0.002342     10.0.1.2 -> 10.0.1.3     TCP 9040 > 42891 [ACK] Seq=1 Ack=13 Win=14528 Len=0 TSV=11969020 TSER=11914880
518334  42.604357     10.0.1.3 -> 10.0.1.2     TCP 42891 > 9040 [FIN, ACK] Seq=13 Ack=500000002 Win=2557184 Len=0 TSV=11925531 TSER=11979617
518335  42.604603     10.0.1.2 -> 10.0.1.3     TCP 9040 > 42891 [ACK] Seq=500000002 Ack=14 Win=14528 Len=0 TSV=11979671 TSER=11925531
================================================================================
IPv4 Conversations
Filter:<No Filter>
                                               |       <-      | |       ->      | |     Total     |
                                               | Frames  Bytes | | Frames  Bytes | | Frames  Bytes |
10.0.1.3             <-> 10.0.1.2              345313 522790666  173022  11419472  518335 534210138
================================================================================
  1   0.000000     10.0.1.3 -> 10.0.1.2     TCP 57478 > 9040 [SYN] Seq=0 Win=5840 Len=0 MSS=1460 TSV=11929988 TSER=0 WS=6
  2   0.000375     10.0.1.2 -> 10.0.1.3     TCP 9040 > 57478 [SYN, ACK] Seq=0 Ack=1 Win=14480 Len=0 MSS=1460 TSV=11984129 TSER=11929988 WS=6
  3   0.000399     10.0.1.3 -> 10.0.1.2     TCP 57478 > 9040 [ACK] Seq=1 Ack=1 Win=5888 Len=0 TSV=11929988 TSER=11984129
  7   0.003219     10.0.1.2 -> 10.0.1.3     TCP 9040 > 57478 [ACK] Seq=1 Ack=13 Win=14528 Len=0 TSV=11984130 TSER=11929989
518164  42.597835     10.0.1.3 -> 10.0.1.2     TCP 57478 > 9040 [FIN, ACK] Seq=13 Ack=500000002 Win=2580480 Len=0 TSV=11940638 TSER=11994724
518165  42.598081     10.0.1.2 -> 10.0.1.3     TCP 9040 > 57478 [ACK] Seq=500000002 Ack=14 Win=14528 Len=0 TSV=11994779 TSER=11940638
================================================================================
IPv4 Conversations
Filter:<No Filter>
                                               |       <-      | |       ->      | |     Total     |
                                               | Frames  Bytes | | Frames  Bytes | | Frames  Bytes |
10.0.1.3             <-> 10.0.1.2              345318 522790996  172847  11407922  518165 534198918
================================================================================
  1   0.000000     10.0.1.3 -> 10.0.1.2     TCP 57480 > 9040 [SYN] Seq=0 Win=5840 Len=0 MSS=1460 TSV=11945033 TSER=0 WS=6
  2   0.000302     10.0.1.2 -> 10.0.1.3     TCP 9040 > 57480 [SYN, ACK] Seq=0 Ack=1 Win=14480 Len=0 MSS=1460 TSV=11999175 TSER=11945033 WS=6
  3   0.000326     10.0.1.3 -> 10.0.1.2     TCP 57480 > 9040 [ACK] Seq=1 Ack=1 Win=5888 Len=0 TSV=11945033 TSER=11999175
  7   0.002833     10.0.1.2 -> 10.0.1.3     TCP 9040 > 57480 [ACK] Seq=1 Ack=13 Win=14528 Len=0 TSV=11999176 TSER=11945034
518228  43.874486     10.0.1.3 -> 10.0.1.2     TCP 57480 > 9040 [FIN, ACK] Seq=13 Ack=500000002 Win=2580480 Len=0 TSV=11956002 TSER=12010090
518229  43.874736     10.0.1.2 -> 10.0.1.3     TCP 9040 > 57480 [ACK] Seq=500000002 Ack=14 Win=14528 Len=0 TSV=12010145 TSER=11956002
================================================================================
IPv4 Conversations
Filter:<No Filter>
                                               |       <-      | |       ->      | |     Total     |
                                               | Frames  Bytes | | Frames  Bytes | | Frames  Bytes |
10.0.1.3             <-> 10.0.1.2              345371 522794494  172858  11408648  518229 534203142
================================================================================
  1   0.000000     10.0.1.3 -> 10.0.1.2     TCP 57485 > 9040 [SYN] Seq=0 Win=5840 Len=0 MSS=1460 TSV=11960476 TSER=0 WS=6
  2   0.000299     10.0.1.2 -> 10.0.1.3     TCP 9040 > 57485 [SYN, ACK] Seq=0 Ack=1 Win=14480 Len=0 MSS=1460 TSV=12014619 TSER=11960476 WS=6
  3   0.000322     10.0.1.3 -> 10.0.1.2     TCP 57485 > 9040 [ACK] Seq=1 Ack=1 Win=5888 Len=0 TSV=11960476 TSER=12014619
  7   0.002275     10.0.1.2 -> 10.0.1.3     TCP 9040 > 57485 [ACK] Seq=1 Ack=13 Win=14528 Len=0 TSV=12014620 TSER=11960477
518072  42.654952     10.0.1.3 -> 10.0.1.2     TCP 57485 > 9040 [FIN, ACK] Seq=13 Ack=500000002 Win=2580480 Len=0 TSV=11971140 TSER=12025229
518073  42.655209     10.0.1.2 -> 10.0.1.3     TCP 9040 > 57485 [ACK] Seq=500000002 Ack=14 Win=14528 Len=0 TSV=12025284 TSER=11971140
================================================================================
IPv4 Conversations
Filter:<No Filter>
                                               |       <-      | |       ->      | |     Total     |
                                               | Frames  Bytes | | Frames  Bytes | | Frames  Bytes |
10.0.1.3             <-> 10.0.1.2              345321 522791194  172752  11401652  518073 534192846
================================================================================
  1   0.000000     10.0.1.3 -> 10.0.1.2     TCP 57487 > 9040 [SYN] Seq=0 Win=5840 Len=0 MSS=1460 TSV=11975513 TSER=0 WS=6
  2   0.000269     10.0.1.2 -> 10.0.1.3     TCP 9040 > 57487 [SYN, ACK] Seq=0 Ack=1 Win=14480 Len=0 MSS=1460 TSV=12029658 TSER=11975513 WS=6
  3   0.000293     10.0.1.3 -> 10.0.1.2     TCP 57487 > 9040 [ACK] Seq=1 Ack=1 Win=5888 Len=0 TSV=11975513 TSER=12029658
  7   0.003530     10.0.1.2 -> 10.0.1.3     TCP 9040 > 57487 [ACK] Seq=1 Ack=13 Win=14528 Len=0 TSV=12029659 TSER=11975514
518107  42.595556     10.0.1.3 -> 10.0.1.2     TCP 57487 > 9040 [FIN, ACK] Seq=13 Ack=500000002 Win=2580480 Len=0 TSV=11986162 TSER=12040252
518108  42.595829     10.0.1.2 -> 10.0.1.3     TCP 9040 > 57487 [ACK] Seq=500000002 Ack=14 Win=14528 Len=0 TSV=12040307 TSER=11986162
================================================================================
IPv4 Conversations
Filter:<No Filter>
                                               |       <-      | |       ->      | |     Total     |
                                               | Frames  Bytes | | Frames  Bytes | | Frames  Bytes |
10.0.1.3             <-> 10.0.1.2              345321 522791194  172787  11403962  518108 534195156
================================================================================
  1   0.000000     10.0.1.3 -> 10.0.1.2     TCP 57490 > 9040 [SYN] Seq=0 Win=5840 Len=0 MSS=1460 TSV=11990569 TSER=0 WS=6
  2   0.000292     10.0.1.2 -> 10.0.1.3     TCP 9040 > 57490 [SYN, ACK] Seq=0 Ack=1 Win=14480 Len=0 MSS=1460 TSV=12044715 TSER=11990569 WS=6
  3   0.000316     10.0.1.3 -> 10.0.1.2     TCP 57490 > 9040 [ACK] Seq=1 Ack=1 Win=5888 Len=0 TSV=11990569 TSER=12044715
  7   0.002225     10.0.1.2 -> 10.0.1.3     TCP 9040 > 57490 [ACK] Seq=1 Ack=13 Win=14528 Len=0 TSV=12044715 TSER=11990570
518164  42.595161     10.0.1.3 -> 10.0.1.2     TCP 57490 > 9040 [FIN, ACK] Seq=13 Ack=500000002 Win=2580480 Len=0 TSV=12001218 TSER=12055309
518165  42.595409     10.0.1.2 -> 10.0.1.3     TCP 9040 > 57490 [ACK] Seq=500000002 Ack=14 Win=14528 Len=0 TSV=12055364 TSER=12001218
================================================================================
IPv4 Conversations
Filter:<No Filter>
                                               |       <-      | |       ->      | |     Total     |
                                               | Frames  Bytes | | Frames  Bytes | | Frames  Bytes |
10.0.1.3             <-> 10.0.1.2              345321 522791194  172844  11407724  518165 534198918
================================================================================
  1   0.000000     10.0.1.3 -> 10.0.1.2     TCP 55674 > 9040 [SYN] Seq=0 Win=5840 Len=0 MSS=1460 TSV=12005616 TSER=0 WS=6
  2   0.000305     10.0.1.2 -> 10.0.1.3     TCP 9040 > 55674 [SYN, ACK] Seq=0 Ack=1 Win=14480 Len=0 MSS=1460 TSV=12059762 TSER=12005616 WS=6
  3   0.000340     10.0.1.3 -> 10.0.1.2     TCP 55674 > 9040 [ACK] Seq=1 Ack=1 Win=5888 Len=0 TSV=12005616 TSER=12059762
  7   0.002331     10.0.1.2 -> 10.0.1.3     TCP 9040 > 55674 [ACK] Seq=1 Ack=13 Win=14528 Len=0 TSV=12059763 TSER=12005616
518116  42.596335     10.0.1.3 -> 10.0.1.2     TCP 55674 > 9040 [FIN, ACK] Seq=13 Ack=500000002 Win=2580480 Len=0 TSV=12016265 TSER=12070357
518117  42.596580     10.0.1.2 -> 10.0.1.3     TCP 9040 > 55674 [ACK] Seq=500000002 Ack=14 Win=14528 Len=0 TSV=12070412 TSER=12016265
================================================================================
IPv4 Conversations
Filter:<No Filter>
                                               |       <-      | |       ->      | |     Total     |
                                               | Frames  Bytes | | Frames  Bytes | | Frames  Bytes |
10.0.1.3             <-> 10.0.1.2              345316 522790864  172801  11404886  518117 534195750
================================================================================
  1   0.000000     10.0.1.3 -> 10.0.1.2     TCP 55676 > 9040 [SYN] Seq=0 Win=5840 Len=0 MSS=1460 TSV=12020637 TSER=0 WS=6
  2   0.000282     10.0.1.2 -> 10.0.1.3     TCP 9040 > 55676 [SYN, ACK] Seq=0 Ack=1 Win=14480 Len=0 MSS=1460 TSV=12074784 TSER=12020637 WS=6
  3   0.000316     10.0.1.3 -> 10.0.1.2     TCP 55676 > 9040 [ACK] Seq=1 Ack=1 Win=5888 Len=0 TSV=12020637 TSER=12074784
  7   0.003725     10.0.1.2 -> 10.0.1.3     TCP 9040 > 55676 [ACK] Seq=1 Ack=13 Win=14528 Len=0 TSV=12074785 TSER=12020637
517938  42.621337     10.0.1.3 -> 10.0.1.2     TCP 55676 > 9040 [FIN, ACK] Seq=13 Ack=500000002 Win=2580480 Len=0 TSV=12031292 TSER=12085386
517939  42.621590     10.0.1.2 -> 10.0.1.3     TCP 9040 > 55676 [ACK] Seq=500000002 Ack=14 Win=14528 Len=0 TSV=12085441 TSER=12031292
================================================================================
IPv4 Conversations
Filter:<No Filter>
                                               |       <-      | |       ->      | |     Total     |
                                               | Frames  Bytes | | Frames  Bytes | | Frames  Bytes |
10.0.1.3             <-> 10.0.1.2              345324 522791392  172615  11392610  517939 534184002
================================================================================
  1   0.000000     10.0.1.3 -> 10.0.1.2     TCP 55681 > 9040 [SYN] Seq=0 Win=5840 Len=0 MSS=1460 TSV=12035702 TSER=0 WS=6
  2   0.000368     10.0.1.2 -> 10.0.1.3     TCP 9040 > 55681 [SYN, ACK] Seq=0 Ack=1 Win=14480 Len=0 MSS=1460 TSV=12089851 TSER=12035702 WS=6
  3   0.000397     10.0.1.3 -> 10.0.1.2     TCP 55681 > 9040 [ACK] Seq=1 Ack=1 Win=5888 Len=0 TSV=12035702 TSER=12089851
  7   0.002362     10.0.1.2 -> 10.0.1.3     TCP 9040 > 55681 [ACK] Seq=1 Ack=13 Win=14528 Len=0 TSV=12089851 TSER=12035702
518172  42.590845     10.0.1.3 -> 10.0.1.2     TCP 55681 > 9040 [FIN, ACK] Seq=13 Ack=500000002 Win=2580480 Len=0 TSV=12046350 TSER=12100444
518173  42.591090     10.0.1.2 -> 10.0.1.3     TCP 9040 > 55681 [ACK] Seq=500000002 Ack=14 Win=14528 Len=0 TSV=12100499 TSER=12046350
================================================================================
IPv4 Conversations
Filter:<No Filter>
                                               |       <-      | |       ->      | |     Total     |
                                               | Frames  Bytes | | Frames  Bytes | | Frames  Bytes |
10.0.1.3             <-> 10.0.1.2              345316 522790864  172857  11408582  518173 534199446
================================================================================
  1   0.000000     10.0.1.3 -> 10.0.1.2     TCP 55683 > 9040 [SYN] Seq=0 Win=5840 Len=0 MSS=1460 TSV=12050771 TSER=0 WS=6
  2   0.000387     10.0.1.2 -> 10.0.1.3     TCP 9040 > 55683 [SYN, ACK] Seq=0 Ack=1 Win=14480 Len=0 MSS=1460 TSV=12104921 TSER=12050771 WS=6
  3   0.000420     10.0.1.3 -> 10.0.1.2     TCP 55683 > 9040 [ACK] Seq=1 Ack=1 Win=5888 Len=0 TSV=12050772 TSER=12104921
  7   0.002719     10.0.1.2 -> 10.0.1.3     TCP 9040 > 55683 [ACK] Seq=1 Ack=13 Win=14528 Len=0 TSV=12104922 TSER=12050772
518152  42.594550     10.0.1.3 -> 10.0.1.2     TCP 55683 > 9040 [FIN, ACK] Seq=13 Ack=500000002 Win=2580480 Len=0 TSV=12061420 TSER=12115516
518153  42.594814     10.0.1.2 -> 10.0.1.3     TCP 9040 > 55683 [ACK] Seq=500000002 Ack=14 Win=14528 Len=0 TSV=12115571 TSER=12061420
================================================================================
IPv4 Conversations
Filter:<No Filter>
                                               |       <-      | |       ->      | |     Total     |
                                               | Frames  Bytes | | Frames  Bytes | | Frames  Bytes |
10.0.1.3             <-> 10.0.1.2              345313 522790666  172840  11407460  518153 534198126
================================================================================
  1   0.000000     10.0.1.3 -> 10.0.1.2     TCP 55685 > 9040 [SYN] Seq=0 Win=5840 Len=0 MSS=1460 TSV=12065813 TSER=0 WS=6
  2   0.000303     10.0.1.2 -> 10.0.1.3     TCP 9040 > 55685 [SYN, ACK] Seq=0 Ack=1 Win=14480 Len=0 MSS=1460 TSV=12119964 TSER=12065813 WS=6
  3   0.000326     10.0.1.3 -> 10.0.1.2     TCP 55685 > 9040 [ACK] Seq=1 Ack=1 Win=5888 Len=0 TSV=12065813 TSER=12119964
  7   0.002267     10.0.1.2 -> 10.0.1.3     TCP 9040 > 55685 [ACK] Seq=1 Ack=13 Win=14528 Len=0 TSV=12119965 TSER=12065814
518161  42.599853     10.0.1.3 -> 10.0.1.2     TCP 55685 > 9040 [FIN, ACK] Seq=13 Ack=500000002 Win=2580480 Len=0 TSV=12076463 TSER=12130560
518162  42.600113     10.0.1.2 -> 10.0.1.3     TCP 9040 > 55685 [ACK] Seq=500000002 Ack=14 Win=14528 Len=0 TSV=12130615 TSER=12076463
================================================================================
IPv4 Conversations
Filter:<No Filter>
                                               |       <-      | |       ->      | |     Total     |
                                               | Frames  Bytes | | Frames  Bytes | | Frames  Bytes |
10.0.1.3             <-> 10.0.1.2              345319 522791062  172843  11407658  518162 534198720
================================================================================
  1   0.000000     10.0.1.3 -> 10.0.1.2     TCP 60888 > 9040 [SYN] Seq=0 Win=5840 Len=0 MSS=1460 TSV=12080877 TSER=0 WS=6
  2   0.000355     10.0.1.2 -> 10.0.1.3     TCP 9040 > 60888 [SYN, ACK] Seq=0 Ack=1 Win=14480 Len=0 MSS=1460 TSV=12135030 TSER=12080877 WS=6
  3   0.000378     10.0.1.3 -> 10.0.1.2     TCP 60888 > 9040 [ACK] Seq=1 Ack=1 Win=5888 Len=0 TSV=12080878 TSER=12135030
  7   0.002402     10.0.1.2 -> 10.0.1.3     TCP 9040 > 60888 [ACK] Seq=1 Ack=13 Win=14528 Len=0 TSV=12135030 TSER=12080878
518902  67.442383     10.0.1.3 -> 10.0.1.2     TCP 60888 > 9040 [FIN, ACK] Seq=13 Ack=500000002 Win=2580480 Len=0 TSV=12097738 TSER=12151870
518903  67.442634     10.0.1.2 -> 10.0.1.3     TCP 9040 > 60888 [ACK] Seq=500000002 Ack=14 Win=14528 Len=0 TSV=12151891 TSER=12097738
================================================================================
IPv4 Conversations
Filter:<No Filter>
                                               |       <-      | |       ->      | |     Total     |
                                               | Frames  Bytes | | Frames  Bytes | | Frames  Bytes |
10.0.1.3             <-> 10.0.1.2              345673 522814426  173230  11433200  518903 534247626
================================================================================
  1   0.000000     10.0.1.3 -> 10.0.1.2     TCP 60892 > 9040 [SYN] Seq=0 Win=5840 Len=0 MSS=1460 TSV=12102148 TSER=0 WS=6
  2   0.000370     10.0.1.2 -> 10.0.1.3     TCP 9040 > 60892 [SYN, ACK] Seq=0 Ack=1 Win=14480 Len=0 MSS=1460 TSV=12156303 TSER=12102148 WS=6
  3   0.000393     10.0.1.3 -> 10.0.1.2     TCP 60892 > 9040 [ACK] Seq=1 Ack=1 Win=5888 Len=0 TSV=12102149 TSER=12156303
  7   0.002298     10.0.1.2 -> 10.0.1.3     TCP 9040 > 60892 [ACK] Seq=1 Ack=13 Win=14528 Len=0 TSV=12156303 TSER=12102149
519803  90.804753     10.0.1.3 -> 10.0.1.2     TCP 60892 > 9040 [FIN, ACK] Seq=13 Ack=500000002 Win=2023168 Len=0 TSV=12124850 TSER=12178984
519804  90.805011     10.0.1.2 -> 10.0.1.3     TCP 9040 > 60892 [ACK] Seq=500000002 Ack=14 Win=14528 Len=0 TSV=12179005 TSER=12124850
================================================================================
IPv4 Conversations
Filter:<No Filter>
                                               |       <-      | |       ->      | |     Total     |
                                               | Frames  Bytes | | Frames  Bytes | | Frames  Bytes |
10.0.1.3             <-> 10.0.1.2              346001 522836074  173803  11471018  519804 534307092
================================================================================
