  1   0.000000     10.0.1.3 -> 10.0.1.2     TCP 37007 > 9040 [SYN] Seq=0 Win=5840 Len=0 MSS=1460 TSV=4469739 TSER=0 WS=6
  2   0.000319     10.0.1.2 -> 10.0.1.3     TCP 9040 > 37007 [SYN, ACK] Seq=0 Ack=1 Win=14480 Len=0 MSS=1460 TSV=4454650 TSER=4469739 WS=6
  3   0.000345     10.0.1.3 -> 10.0.1.2     TCP 37007 > 9040 [ACK] Seq=1 Ack=1 Win=5888 Len=0 TSV=4469740 TSER=4454650
51949   9.525572     10.0.1.3 -> 10.0.1.2     TCP 37007 > 9040 [FIN, ACK] Seq=12 Ack=50000002 Win=1976576 Len=0 TSV=4472121 TSER=4457011
51950   9.525824     10.0.1.2 -> 10.0.1.3     TCP 9040 > 37007 [ACK] Seq=50000002 Ack=13 Win=14528 Len=0 TSV=4457031 TSER=4472121
  1   0.000000     10.0.1.3 -> 10.0.1.2     TCP 37009 > 9040 [SYN] Seq=0 Win=5840 Len=0 MSS=1460 TSV=4474563 TSER=0 WS=6
  2   0.000288     10.0.1.2 -> 10.0.1.3     TCP 9040 > 37009 [SYN, ACK] Seq=0 Ack=1 Win=14480 Len=0 MSS=1460 TSV=4459474 TSER=4474563 WS=6
  3   0.000310     10.0.1.3 -> 10.0.1.2     TCP 37009 > 9040 [ACK] Seq=1 Ack=1 Win=5888 Len=0 TSV=4474563 TSER=4459474
51979   9.542913     10.0.1.3 -> 10.0.1.2     TCP 37009 > 9040 [FIN, ACK] Seq=12 Ack=50000002 Win=1976576 Len=0 TSV=4476949 TSER=4461839
51980   9.543160     10.0.1.2 -> 10.0.1.3     TCP 9040 > 37009 [ACK] Seq=50000002 Ack=13 Win=14528 Len=0 TSV=4461860 TSER=4476949
  1   0.000000     10.0.1.3 -> 10.0.1.2     TCP 37011 > 9040 [SYN] Seq=0 Win=5840 Len=0 MSS=1460 TSV=4479415 TSER=0 WS=6
  2   0.000299     10.0.1.2 -> 10.0.1.3     TCP 9040 > 37011 [SYN, ACK] Seq=0 Ack=1 Win=14480 Len=0 MSS=1460 TSV=4464327 TSER=4479415 WS=6
  3   0.000322     10.0.1.3 -> 10.0.1.2     TCP 37011 > 9040 [ACK] Seq=1 Ack=1 Win=5888 Len=0 TSV=4479415 TSER=4464327
51894   9.466300     10.0.1.3 -> 10.0.1.2     TCP 37011 > 9040 [FIN, ACK] Seq=12 Ack=50000002 Win=1973696 Len=0 TSV=4481782 TSER=4466673
51895   9.466547     10.0.1.2 -> 10.0.1.3     TCP 9040 > 37011 [ACK] Seq=50000002 Ack=13 Win=14528 Len=0 TSV=4466693 TSER=4481782
  1   0.000000     10.0.1.3 -> 10.0.1.2     TCP 37013 > 9040 [SYN] Seq=0 Win=5840 Len=0 MSS=1460 TSV=4484245 TSER=0 WS=6
  2   0.000302     10.0.1.2 -> 10.0.1.3     TCP 9040 > 37013 [SYN, ACK] Seq=0 Ack=1 Win=14480 Len=0 MSS=1460 TSV=4469156 TSER=4484245 WS=6
  3   0.000323     10.0.1.3 -> 10.0.1.2     TCP 37013 > 9040 [ACK] Seq=1 Ack=1 Win=5888 Len=0 TSV=4484245 TSER=4469156
52005   9.562707     10.0.1.3 -> 10.0.1.2     TCP 37013 > 9040 [FIN, ACK] Seq=12 Ack=50000002 Win=1973696 Len=0 TSV=4486636 TSER=4471527
52006   9.562958     10.0.1.2 -> 10.0.1.3     TCP 9040 > 37013 [ACK] Seq=50000002 Ack=13 Win=14528 Len=0 TSV=4471547 TSER=4486636
  1   0.000000     10.0.1.3 -> 10.0.1.2     TCP 37015 > 9040 [SYN] Seq=0 Win=5840 Len=0 MSS=1460 TSV=4489095 TSER=0 WS=6
  2   0.000303     10.0.1.2 -> 10.0.1.3     TCP 9040 > 37015 [SYN, ACK] Seq=0 Ack=1 Win=14480 Len=0 MSS=1460 TSV=4474007 TSER=4489095 WS=6
  3   0.000326     10.0.1.3 -> 10.0.1.2     TCP 37015 > 9040 [ACK] Seq=1 Ack=1 Win=5888 Len=0 TSV=4489095 TSER=4474007
52054   9.529962     10.0.1.3 -> 10.0.1.2     TCP 37015 > 9040 [FIN, ACK] Seq=12 Ack=50000002 Win=1970816 Len=0 TSV=4491478 TSER=4476369
52055   9.530214     10.0.1.2 -> 10.0.1.3     TCP 9040 > 37015 [ACK] Seq=50000002 Ack=13 Win=14528 Len=0 TSV=4476390 TSER=4491478
  1   0.000000     10.0.1.3 -> 10.0.1.2     TCP 37017 > 9040 [SYN] Seq=0 Win=5840 Len=0 MSS=1460 TSV=4493936 TSER=0 WS=6
  2   0.000362     10.0.1.2 -> 10.0.1.3     TCP 9040 > 37017 [SYN, ACK] Seq=0 Ack=1 Win=14480 Len=0 MSS=1460 TSV=4478848 TSER=4493936 WS=6
  3   0.000385     10.0.1.3 -> 10.0.1.2     TCP 37017 > 9040 [ACK] Seq=1 Ack=1 Win=5888 Len=0 TSV=4493936 TSER=4478848
52006   9.595549     10.0.1.3 -> 10.0.1.2     TCP 37017 > 9040 [FIN, ACK] Seq=12 Ack=50000002 Win=1979520 Len=0 TSV=4496335 TSER=4481227
52007   9.595802     10.0.1.2 -> 10.0.1.3     TCP 9040 > 37017 [ACK] Seq=50000002 Ack=13 Win=14528 Len=0 TSV=4481247 TSER=4496335
  1   0.000000     10.0.1.3 -> 10.0.1.2     TCP 37019 > 9040 [SYN] Seq=0 Win=5840 Len=0 MSS=1460 TSV=4498795 TSER=0 WS=6
  2   0.000368     10.0.1.2 -> 10.0.1.3     TCP 9040 > 37019 [SYN, ACK] Seq=0 Ack=1 Win=14480 Len=0 MSS=1460 TSV=4483708 TSER=4498795 WS=6
  3   0.000393     10.0.1.3 -> 10.0.1.2     TCP 37019 > 9040 [ACK] Seq=1 Ack=1 Win=5888 Len=0 TSV=4498795 TSER=4483708
52175   9.616725     10.0.1.3 -> 10.0.1.2     TCP 37019 > 9040 [FIN, ACK] Seq=12 Ack=50000002 Win=1967936 Len=0 TSV=4501200 TSER=4486092
52176   9.616972     10.0.1.2 -> 10.0.1.3     TCP 9040 > 37019 [ACK] Seq=50000002 Ack=13 Win=14528 Len=0 TSV=4486113 TSER=4501200
  1   0.000000     10.0.1.3 -> 10.0.1.2     TCP 33186 > 9040 [SYN] Seq=0 Win=5840 Len=0 MSS=1460 TSV=4503644 TSER=0 WS=6
  2   0.000268     10.0.1.2 -> 10.0.1.3     TCP 9040 > 33186 [SYN, ACK] Seq=0 Ack=1 Win=14480 Len=0 MSS=1460 TSV=4488557 TSER=4503644 WS=6
  3   0.000294     10.0.1.3 -> 10.0.1.2     TCP 33186 > 9040 [ACK] Seq=1 Ack=1 Win=5888 Len=0 TSV=4503644 TSER=4488557
52044   9.497235     10.0.1.3 -> 10.0.1.2     TCP 33186 > 9040 [FIN, ACK] Seq=12 Ack=50000002 Win=1973696 Len=0 TSV=4506019 TSER=4490911
52045   9.497488     10.0.1.2 -> 10.0.1.3     TCP 9040 > 33186 [ACK] Seq=50000002 Ack=13 Win=14528 Len=0 TSV=4490932 TSER=4506019
  1   0.000000     10.0.1.3 -> 10.0.1.2     TCP 33188 > 9040 [SYN] Seq=0 Win=5840 Len=0 MSS=1460 TSV=4508480 TSER=0 WS=6
  2   0.000297     10.0.1.2 -> 10.0.1.3     TCP 9040 > 33188 [SYN, ACK] Seq=0 Ack=1 Win=14480 Len=0 MSS=1460 TSV=4493393 TSER=4508480 WS=6
  3   0.000322     10.0.1.3 -> 10.0.1.2     TCP 33188 > 9040 [ACK] Seq=1 Ack=1 Win=5888 Len=0 TSV=4508480 TSER=4493393
52123   9.996058     10.0.1.3 -> 10.0.1.2     TCP 33188 > 9040 [FIN, ACK] Seq=12 Ack=50000002 Win=1973696 Len=0 TSV=4510979 TSER=4495872
52124   9.996305     10.0.1.2 -> 10.0.1.3     TCP 9040 > 33188 [ACK] Seq=50000002 Ack=13 Win=14528 Len=0 TSV=4495892 TSER=4510979
  1   0.000000     10.0.1.3 -> 10.0.1.2     TCP 33190 > 9040 [SYN] Seq=0 Win=5840 Len=0 MSS=1460 TSV=4513451 TSER=0 WS=6
  2   0.000318     10.0.1.2 -> 10.0.1.3     TCP 9040 > 33190 [SYN, ACK] Seq=0 Ack=1 Win=14480 Len=0 MSS=1460 TSV=4498365 TSER=4513451 WS=6
  3   0.000340     10.0.1.3 -> 10.0.1.2     TCP 33190 > 9040 [ACK] Seq=1 Ack=1 Win=5888 Len=0 TSV=4513452 TSER=4498365
52065   9.478385     10.0.1.3 -> 10.0.1.2     TCP 33190 > 9040 [FIN, ACK] Seq=12 Ack=50000002 Win=1962112 Len=0 TSV=4515821 TSER=4500714
52066   9.478629     10.0.1.2 -> 10.0.1.3     TCP 9040 > 33190 [ACK] Seq=50000002 Ack=13 Win=14528 Len=0 TSV=4500735 TSER=4515821
  1   0.000000     10.0.1.3 -> 10.0.1.2     TCP 33192 > 9040 [SYN] Seq=0 Win=5840 Len=0 MSS=1460 TSV=4518276 TSER=0 WS=6
  2   0.000329     10.0.1.2 -> 10.0.1.3     TCP 9040 > 33192 [SYN, ACK] Seq=0 Ack=1 Win=14480 Len=0 MSS=1460 TSV=4503190 TSER=4518276 WS=6
  3   0.000364     10.0.1.3 -> 10.0.1.2     TCP 33192 > 9040 [ACK] Seq=1 Ack=1 Win=5888 Len=0 TSV=4518276 TSER=4503190
51824   9.589880     10.0.1.3 -> 10.0.1.2     TCP 33192 > 9040 [FIN, ACK] Seq=12 Ack=50000002 Win=1959232 Len=0 TSV=4520673 TSER=4505567
51825   9.590127     10.0.1.2 -> 10.0.1.3     TCP 9040 > 33192 [ACK] Seq=50000002 Ack=13 Win=14528 Len=0 TSV=4505588 TSER=4520673
  1   0.000000     10.0.1.3 -> 10.0.1.2     TCP 33194 > 9040 [SYN] Seq=0 Win=5840 Len=0 MSS=1460 TSV=4523132 TSER=0 WS=6
  2   0.000305     10.0.1.2 -> 10.0.1.3     TCP 9040 > 33194 [SYN, ACK] Seq=0 Ack=1 Win=14480 Len=0 MSS=1460 TSV=4508046 TSER=4523132 WS=6
  3   0.000329     10.0.1.3 -> 10.0.1.2     TCP 33194 > 9040 [ACK] Seq=1 Ack=1 Win=5888 Len=0 TSV=4523132 TSER=4508046
52140   9.601065     10.0.1.3 -> 10.0.1.2     TCP 33194 > 9040 [FIN, ACK] Seq=12 Ack=50000002 Win=1976576 Len=0 TSV=4525532 TSER=4510426
52141   9.601312     10.0.1.2 -> 10.0.1.3     TCP 9040 > 33194 [ACK] Seq=50000002 Ack=13 Win=14528 Len=0 TSV=4510447 TSER=4525532
  1   0.000000     10.0.1.3 -> 10.0.1.2     TCP 33196 > 9040 [SYN] Seq=0 Win=5840 Len=0 MSS=1460 TSV=4527987 TSER=0 WS=6
  2   0.000281     10.0.1.2 -> 10.0.1.3     TCP 9040 > 33196 [SYN, ACK] Seq=0 Ack=1 Win=14480 Len=0 MSS=1460 TSV=4512902 TSER=4527987 WS=6
  3   0.000305     10.0.1.3 -> 10.0.1.2     TCP 33196 > 9040 [ACK] Seq=1 Ack=1 Win=5888 Len=0 TSV=4527988 TSER=4512902
51926   9.336975     10.0.1.3 -> 10.0.1.2     TCP 33196 > 9040 [FIN, ACK] Seq=12 Ack=50000002 Win=1970816 Len=0 TSV=4530322 TSER=4515216
51927   9.337222     10.0.1.2 -> 10.0.1.3     TCP 9040 > 33196 [ACK] Seq=50000002 Ack=13 Win=14528 Len=0 TSV=4515237 TSER=4530322
  1   0.000000     10.0.1.3 -> 10.0.1.2     TCP 33198 > 9040 [SYN] Seq=0 Win=5840 Len=0 MSS=1460 TSV=4532783 TSER=0 WS=6
  2   0.000292     10.0.1.2 -> 10.0.1.3     TCP 9040 > 33198 [SYN, ACK] Seq=0 Ack=1 Win=14480 Len=0 MSS=1460 TSV=4517698 TSER=4532783 WS=6
  3   0.000318     10.0.1.3 -> 10.0.1.2     TCP 33198 > 9040 [ACK] Seq=1 Ack=1 Win=5888 Len=0 TSV=4532783 TSER=4517698
52022   9.660907     10.0.1.3 -> 10.0.1.2     TCP 33198 > 9040 [FIN, ACK] Seq=12 Ack=50000002 Win=2000000 Len=0 TSV=4535198 TSER=4520093
52023   9.661160     10.0.1.2 -> 10.0.1.3     TCP 9040 > 33198 [ACK] Seq=50000002 Ack=13 Win=14528 Len=0 TSV=4520114 TSER=4535198
  1   0.000000     10.0.1.3 -> 10.0.1.2     TCP 33200 > 9040 [SYN] Seq=0 Win=5840 Len=0 MSS=1460 TSV=4537645 TSER=0 WS=6
  2   0.000305     10.0.1.2 -> 10.0.1.3     TCP 9040 > 33200 [SYN, ACK] Seq=0 Ack=1 Win=14480 Len=0 MSS=1460 TSV=4522561 TSER=4537645 WS=6
  3   0.000330     10.0.1.3 -> 10.0.1.2     TCP 33200 > 9040 [ACK] Seq=1 Ack=1 Win=5888 Len=0 TSV=4537646 TSER=4522561
52127   9.438312     10.0.1.3 -> 10.0.1.2     TCP 33200 > 9040 [FIN, ACK] Seq=12 Ack=50000002 Win=1962112 Len=0 TSV=4540005 TSER=4524900
52128   9.438562     10.0.1.2 -> 10.0.1.3     TCP 9040 > 33200 [ACK] Seq=50000002 Ack=13 Win=14528 Len=0 TSV=4524921 TSER=4540005
  1   0.000000     10.0.1.3 -> 10.0.1.2     TCP 33202 > 9040 [SYN] Seq=0 Win=5840 Len=0 MSS=1460 TSV=4542475 TSER=0 WS=6
  2   0.000302     10.0.1.2 -> 10.0.1.3     TCP 9040 > 33202 [SYN, ACK] Seq=0 Ack=1 Win=14480 Len=0 MSS=1460 TSV=4527391 TSER=4542475 WS=6
  3   0.000325     10.0.1.3 -> 10.0.1.2     TCP 33202 > 9040 [ACK] Seq=1 Ack=1 Win=5888 Len=0 TSV=4542475 TSER=4527391
52015   9.346719     10.0.1.3 -> 10.0.1.2     TCP 33202 > 9040 [FIN, ACK] Seq=12 Ack=50000002 Win=1982400 Len=0 TSV=4544811 TSER=4529707
52016   9.346994     10.0.1.2 -> 10.0.1.3     TCP 9040 > 33202 [ACK] Seq=50000002 Ack=13 Win=14528 Len=0 TSV=4529727 TSER=4544811
  1   0.000000     10.0.1.3 -> 10.0.1.2     TCP 33205 > 9040 [SYN] Seq=0 Win=5840 Len=0 MSS=1460 TSV=4547288 TSER=0 WS=6
  2   0.000302     10.0.1.2 -> 10.0.1.3     TCP 9040 > 33205 [SYN, ACK] Seq=0 Ack=1 Win=14480 Len=0 MSS=1460 TSV=4532205 TSER=4547288 WS=6
  3   0.000327     10.0.1.3 -> 10.0.1.2     TCP 33205 > 9040 [ACK] Seq=1 Ack=1 Win=5888 Len=0 TSV=4547288 TSER=4532205
51481   9.435795     10.0.1.3 -> 10.0.1.2     TCP 33205 > 9040 [FIN, ACK] Seq=12 Ack=50000002 Win=1967936 Len=0 TSV=4549647 TSER=4534543
51482   9.436039     10.0.1.2 -> 10.0.1.3     TCP 9040 > 33205 [ACK] Seq=50000002 Ack=13 Win=14528 Len=0 TSV=4534564 TSER=4549647
  1   0.000000     10.0.1.3 -> 10.0.1.2     TCP 33207 > 9040 [SYN] Seq=0 Win=5840 Len=0 MSS=1460 TSV=4552100 TSER=0 WS=6
  2   0.000320     10.0.1.2 -> 10.0.1.3     TCP 9040 > 33207 [SYN, ACK] Seq=0 Ack=1 Win=14480 Len=0 MSS=1460 TSV=4537017 TSER=4552100 WS=6
  3   0.000345     10.0.1.3 -> 10.0.1.2     TCP 33207 > 9040 [ACK] Seq=1 Ack=1 Win=5888 Len=0 TSV=4552100 TSER=4537017
52092   9.601561     10.0.1.3 -> 10.0.1.2     TCP 33207 > 9040 [FIN, ACK] Seq=12 Ack=50000002 Win=1970816 Len=0 TSV=4554501 TSER=4539397
52093   9.601808     10.0.1.2 -> 10.0.1.3     TCP 9040 > 33207 [ACK] Seq=50000002 Ack=13 Win=14528 Len=0 TSV=4539417 TSER=4554501
  1   0.000000     10.0.1.3 -> 10.0.1.2     TCP 33209 > 9040 [SYN] Seq=0 Win=5840 Len=0 MSS=1460 TSV=4556950 TSER=0 WS=6
  2   0.000299     10.0.1.2 -> 10.0.1.3     TCP 9040 > 33209 [SYN, ACK] Seq=0 Ack=1 Win=14480 Len=0 MSS=1460 TSV=4541867 TSER=4556950 WS=6
  3   0.000321     10.0.1.3 -> 10.0.1.2     TCP 33209 > 9040 [ACK] Seq=1 Ack=1 Win=5888 Len=0 TSV=4556950 TSER=4541867
51913   9.486694     10.0.1.3 -> 10.0.1.2     TCP 33209 > 9040 [FIN, ACK] Seq=12 Ack=50000002 Win=1973696 Len=0 TSV=4559322 TSER=4544218
51914   9.486946     10.0.1.2 -> 10.0.1.3     TCP 9040 > 33209 [ACK] Seq=50000002 Ack=13 Win=14528 Len=0 TSV=4544239 TSER=4559322
  1   0.000000     10.0.1.3 -> 10.0.1.2     TCP 33211 > 9040 [SYN] Seq=0 Win=5840 Len=0 MSS=1460 TSV=4561784 TSER=0 WS=6
  2   0.000313     10.0.1.2 -> 10.0.1.3     TCP 9040 > 33211 [SYN, ACK] Seq=0 Ack=1 Win=14480 Len=0 MSS=1460 TSV=4546701 TSER=4561784 WS=6
  3   0.000337     10.0.1.3 -> 10.0.1.2     TCP 33211 > 9040 [ACK] Seq=1 Ack=1 Win=5888 Len=0 TSV=4561784 TSER=4546701
51972   9.594908     10.0.1.3 -> 10.0.1.2     TCP 33211 > 9040 [FIN, ACK] Seq=12 Ack=50000002 Win=1979520 Len=0 TSV=4564183 TSER=4549079
51973   9.595161     10.0.1.2 -> 10.0.1.3     TCP 9040 > 33211 [ACK] Seq=50000002 Ack=13 Win=14528 Len=0 TSV=4549100 TSER=4564183
