  1   0.000000     10.0.1.3 -> 10.0.1.2     TCP 41551 > 9040 [SYN] Seq=0 Win=5840 Len=0 MSS=1460 TSV=4802808 TSER=0 WS=6
  2   0.000375     10.0.1.2 -> 10.0.1.3     TCP 9040 > 41551 [SYN, ACK] Seq=0 Ack=1 Win=14480 Len=0 MSS=1460 TSV=4787939 TSER=4802808 WS=6
  3   0.000397     10.0.1.3 -> 10.0.1.2     TCP 41551 > 9040 [ACK] Seq=1 Ack=1 Win=5888 Len=0 TSV=4802808 TSER=4787939
  7   0.002597     10.0.1.2 -> 10.0.1.3     TCP 9040 > 41551 [ACK] Seq=1 Ack=13 Win=14528 Len=0 TSV=4787940 TSER=4802809
514836  92.263409     10.0.1.3 -> 10.0.1.2     TCP 41551 > 9040 [FIN, ACK] Seq=13 Ack=500000002 Win=2034752 Len=0 TSV=4825874 TSER=4810986
  1   0.000000     10.0.1.3 -> 10.0.1.2     TCP 41553 > 9040 [SYN] Seq=0 Win=5840 Len=0 MSS=1460 TSV=4833889 TSER=0 WS=6
  2   0.000309     10.0.1.2 -> 10.0.1.3     TCP 9040 > 41553 [SYN, ACK] Seq=0 Ack=1 Win=14480 Len=0 MSS=1460 TSV=4819022 TSER=4833889 WS=6
  3   0.000329     10.0.1.3 -> 10.0.1.2     TCP 41553 > 9040 [ACK] Seq=1 Ack=1 Win=5888 Len=0 TSV=4833889 TSER=4819022
  7   0.002170     10.0.1.2 -> 10.0.1.3     TCP 9040 > 41553 [ACK] Seq=1 Ack=13 Win=14528 Len=0 TSV=4819023 TSER=4833889
515497  91.211439     10.0.1.3 -> 10.0.1.2     TCP 41553 > 9040 [FIN, ACK] Seq=13 Ack=500000002 Win=2023168 Len=0 TSV=4856691 TSER=4841805
  1   0.000000     10.0.1.3 -> 10.0.1.2     TCP 41555 > 9040 [SYN] Seq=0 Win=5840 Len=0 MSS=1460 TSV=4864632 TSER=0 WS=6
  2   0.000377     10.0.1.2 -> 10.0.1.3     TCP 9040 > 41555 [SYN, ACK] Seq=0 Ack=1 Win=14480 Len=0 MSS=1460 TSV=4849768 TSER=4864632 WS=6
  3   0.000400     10.0.1.3 -> 10.0.1.2     TCP 41555 > 9040 [ACK] Seq=1 Ack=1 Win=5888 Len=0 TSV=4864632 TSER=4849768
  7   0.002601     10.0.1.2 -> 10.0.1.3     TCP 9040 > 41555 [ACK] Seq=1 Ack=13 Win=14528 Len=0 TSV=4849768 TSER=4864632
518755  91.805890     10.0.1.3 -> 10.0.1.2     TCP 41555 > 9040 [FIN, ACK] Seq=13 Ack=500000002 Win=2026112 Len=0 TSV=4887583 TSER=4872700
  1   0.000000     10.0.1.3 -> 10.0.1.2     TCP 52393 > 9040 [SYN] Seq=0 Win=5840 Len=0 MSS=1460 TSV=4895605 TSER=0 WS=6
  2   0.000352     10.0.1.2 -> 10.0.1.3     TCP 9040 > 52393 [SYN, ACK] Seq=0 Ack=1 Win=14480 Len=0 MSS=1460 TSV=4880743 TSER=4895605 WS=6
  3   0.000375     10.0.1.3 -> 10.0.1.2     TCP 52393 > 9040 [ACK] Seq=1 Ack=1 Win=5888 Len=0 TSV=4895605 TSER=4880743
  7   0.002205     10.0.1.2 -> 10.0.1.3     TCP 9040 > 52393 [ACK] Seq=1 Ack=13 Win=14528 Len=0 TSV=4880743 TSER=4895605
518442  90.959309     10.0.1.3 -> 10.0.1.2     TCP 52393 > 9040 [FIN, ACK] Seq=13 Ack=500000002 Win=2023168 Len=0 TSV=4918344 TSER=4903463
  1   0.000000     10.0.1.3 -> 10.0.1.2     TCP 52395 > 9040 [SYN] Seq=0 Win=5840 Len=0 MSS=1460 TSV=4926280 TSER=0 WS=6
  2   0.000333     10.0.1.2 -> 10.0.1.3     TCP 9040 > 52395 [SYN, ACK] Seq=0 Ack=1 Win=14480 Len=0 MSS=1460 TSV=4911421 TSER=4926280 WS=6
  3   0.000354     10.0.1.3 -> 10.0.1.2     TCP 52395 > 9040 [ACK] Seq=1 Ack=1 Win=5888 Len=0 TSV=4926280 TSER=4911421
  7   0.002377     10.0.1.2 -> 10.0.1.3     TCP 9040 > 52395 [ACK] Seq=1 Ack=13 Win=14528 Len=0 TSV=4911421 TSER=4926281
518090  90.971679     10.0.1.3 -> 10.0.1.2     TCP 52395 > 9040 [FIN, ACK] Seq=13 Ack=500000002 Win=2026112 Len=0 TSV=4949023 TSER=4934144
  1   0.000000     10.0.1.3 -> 10.0.1.2     TCP 53593 > 9040 [SYN] Seq=0 Win=5840 Len=0 MSS=1460 TSV=4956787 TSER=0 WS=6
  2   0.000298     10.0.1.2 -> 10.0.1.3     TCP 9040 > 53593 [SYN, ACK] Seq=0 Ack=1 Win=14480 Len=0 MSS=1460 TSV=4941931 TSER=4956787 WS=6
  3   0.000322     10.0.1.3 -> 10.0.1.2     TCP 53593 > 9040 [ACK] Seq=1 Ack=1 Win=5888 Len=0 TSV=4956788 TSER=4941931
  7   0.002243     10.0.1.2 -> 10.0.1.3     TCP 9040 > 53593 [ACK] Seq=1 Ack=13 Win=14528 Len=0 TSV=4941931 TSER=4956788
506212  91.997477     10.0.1.3 -> 10.0.1.2     TCP 53593 > 9040 [FIN, ACK] Seq=13 Ack=500000002 Win=2011584 Len=0 TSV=4979787 TSER=4964910
  1   0.000000     10.0.1.3 -> 10.0.1.2     TCP 53595 > 9040 [SYN] Seq=0 Win=5840 Len=0 MSS=1460 TSV=4987613 TSER=0 WS=6
  2   0.000373     10.0.1.2 -> 10.0.1.3     TCP 9040 > 53595 [SYN, ACK] Seq=0 Ack=1 Win=14480 Len=0 MSS=1460 TSV=4972758 TSER=4987613 WS=6
  3   0.000403     10.0.1.3 -> 10.0.1.2     TCP 53595 > 9040 [ACK] Seq=1 Ack=1 Win=5888 Len=0 TSV=4987613 TSER=4972758
  7   0.002472     10.0.1.2 -> 10.0.1.3     TCP 9040 > 53595 [ACK] Seq=1 Ack=13 Win=14528 Len=0 TSV=4972759 TSER=4987613
517896  88.820997     10.0.1.3 -> 10.0.1.2     TCP 53595 > 9040 [FIN, ACK] Seq=13 Ack=500000002 Win=2023168 Len=0 TSV=5009818 TSER=4994944
  1   0.000000     10.0.1.3 -> 10.0.1.2     TCP 53597 > 9040 [SYN] Seq=0 Win=5840 Len=0 MSS=1460 TSV=5017754 TSER=0 WS=6
  2   0.000441     10.0.1.2 -> 10.0.1.3     TCP 9040 > 53597 [SYN, ACK] Seq=0 Ack=1 Win=14480 Len=0 MSS=1460 TSV=5002902 TSER=5017754 WS=6
  3   0.000465     10.0.1.3 -> 10.0.1.2     TCP 53597 > 9040 [ACK] Seq=1 Ack=1 Win=5888 Len=0 TSV=5017754 TSER=5002902
  7   0.002330     10.0.1.2 -> 10.0.1.3     TCP 9040 > 53597 [ACK] Seq=1 Ack=13 Win=14528 Len=0 TSV=5002902 TSER=5017754
518527  91.050372     10.0.1.3 -> 10.0.1.2     TCP 53597 > 9040 [FIN, ACK] Seq=13 Ack=500000002 Win=2026112 Len=0 TSV=5040517 TSER=5025644
  1   0.000000     10.0.1.3 -> 10.0.1.2     TCP 53774 > 9040 [SYN] Seq=0 Win=5840 Len=0 MSS=1460 TSV=5048496 TSER=0 WS=6
  2   0.000363     10.0.1.2 -> 10.0.1.3     TCP 9040 > 53774 [SYN, ACK] Seq=0 Ack=1 Win=14480 Len=0 MSS=1460 TSV=5033646 TSER=5048496 WS=6
  3   0.000394     10.0.1.3 -> 10.0.1.2     TCP 53774 > 9040 [ACK] Seq=1 Ack=1 Win=5888 Len=0 TSV=5048496 TSER=5033646
  7   0.003026     10.0.1.2 -> 10.0.1.3     TCP 9040 > 53774 [ACK] Seq=1 Ack=13 Win=14528 Len=0 TSV=5033647 TSER=5048497
505102  90.192930     10.0.1.3 -> 10.0.1.2     TCP 53774 > 9040 [FIN, ACK] Seq=13 Ack=500000002 Win=2023168 Len=0 TSV=5071044 TSER=5056174
  1   0.000000     10.0.1.3 -> 10.0.1.2     TCP 53776 > 9040 [SYN] Seq=0 Win=5840 Len=0 MSS=1460 TSV=5078833 TSER=0 WS=6
  2   0.000398     10.0.1.2 -> 10.0.1.3     TCP 9040 > 53776 [SYN, ACK] Seq=0 Ack=1 Win=14480 Len=0 MSS=1460 TSV=5063985 TSER=5078833 WS=6
  3   0.000422     10.0.1.3 -> 10.0.1.2     TCP 53776 > 9040 [ACK] Seq=1 Ack=1 Win=5888 Len=0 TSV=5078833 TSER=5063985
  7   0.002286     10.0.1.2 -> 10.0.1.3     TCP 9040 > 53776 [ACK] Seq=1 Ack=13 Win=14528 Len=0 TSV=5063985 TSER=5078833
504788  91.820896     10.0.1.3 -> 10.0.1.2     TCP 53776 > 9040 [FIN, ACK] Seq=13 Ack=500000002 Win=2014528 Len=0 TSV=5101788 TSER=5086920
  1   0.000000     10.0.1.3 -> 10.0.1.2     TCP 60356 > 9040 [SYN] Seq=0 Win=5840 Len=0 MSS=1460 TSV=5109399 TSER=0 WS=6
  2   0.000347     10.0.1.2 -> 10.0.1.3     TCP 9040 > 60356 [SYN, ACK] Seq=0 Ack=1 Win=14480 Len=0 MSS=1460 TSV=5094554 TSER=5109399 WS=6
  3   0.000379     10.0.1.3 -> 10.0.1.2     TCP 60356 > 9040 [ACK] Seq=1 Ack=1 Win=5888 Len=0 TSV=5109399 TSER=5094554
  7   0.002575     10.0.1.2 -> 10.0.1.3     TCP 9040 > 60356 [ACK] Seq=1 Ack=13 Win=14528 Len=0 TSV=5094554 TSER=5109400
515903  92.170850     10.0.1.3 -> 10.0.1.2     TCP 60356 > 9040 [FIN, ACK] Seq=13 Ack=500000002 Win=2031872 Len=0 TSV=5132442 TSER=5117577
  1   0.000000     10.0.1.3 -> 10.0.1.2     TCP 60358 > 9040 [SYN] Seq=0 Win=5840 Len=0 MSS=1460 TSV=5140050 TSER=0 WS=6
  2   0.000306     10.0.1.2 -> 10.0.1.3     TCP 9040 > 60358 [SYN, ACK] Seq=0 Ack=1 Win=14480 Len=0 MSS=1460 TSV=5125207 TSER=5140050 WS=6
  3   0.000328     10.0.1.3 -> 10.0.1.2     TCP 60358 > 9040 [ACK] Seq=1 Ack=1 Win=5888 Len=0 TSV=5140050 TSER=5125207
  7   0.002225     10.0.1.2 -> 10.0.1.3     TCP 9040 > 60358 [ACK] Seq=1 Ack=13 Win=14528 Len=0 TSV=5125207 TSER=5140051
519032  89.432364     10.0.1.3 -> 10.0.1.2     TCP 60358 > 9040 [FIN, ACK] Seq=13 Ack=500000002 Win=2002944 Len=0 TSV=5162408 TSER=5147545
  1   0.000000     10.0.1.3 -> 10.0.1.2     TCP 60360 > 9040 [SYN] Seq=0 Win=5840 Len=0 MSS=1460 TSV=5170375 TSER=0 WS=6
  2   0.000302     10.0.1.2 -> 10.0.1.3     TCP 9040 > 60360 [SYN, ACK] Seq=0 Ack=1 Win=14480 Len=0 MSS=1460 TSV=5155534 TSER=5170375 WS=6
  3   0.000329     10.0.1.3 -> 10.0.1.2     TCP 60360 > 9040 [ACK] Seq=1 Ack=1 Win=5888 Len=0 TSV=5170375 TSER=5155534
  7   0.002227     10.0.1.2 -> 10.0.1.3     TCP 9040 > 60360 [ACK] Seq=1 Ack=13 Win=14528 Len=0 TSV=5155534 TSER=5170375
517649  91.955214     10.0.1.3 -> 10.0.1.2     TCP 60360 > 9040 [FIN, ACK] Seq=13 Ack=500000002 Win=2026112 Len=0 TSV=5193363 TSER=5178503
  1   0.000000     10.0.1.3 -> 10.0.1.2     TCP 48217 > 9040 [SYN] Seq=0 Win=5840 Len=0 MSS=1460 TSV=5201258 TSER=0 WS=6
  2   0.000303     10.0.1.2 -> 10.0.1.3     TCP 9040 > 48217 [SYN, ACK] Seq=0 Ack=1 Win=14480 Len=0 MSS=1460 TSV=5186420 TSER=5201258 WS=6
  3   0.000326     10.0.1.3 -> 10.0.1.2     TCP 48217 > 9040 [ACK] Seq=1 Ack=1 Win=5888 Len=0 TSV=5201258 TSER=5186420
  7   0.003614     10.0.1.2 -> 10.0.1.3     TCP 9040 > 48217 [ACK] Seq=1 Ack=13 Win=14528 Len=0 TSV=5186421 TSER=5201259
518709  91.344539     10.0.1.3 -> 10.0.1.2     TCP 48217 > 9040 [FIN, ACK] Seq=13 Ack=500000002 Win=2026112 Len=0 TSV=5224095 TSER=5209236
  1   0.000000     10.0.1.3 -> 10.0.1.2     TCP 48219 > 9040 [SYN] Seq=0 Win=5840 Len=0 MSS=1460 TSV=5232060 TSER=0 WS=6
  2   0.000402     10.0.1.2 -> 10.0.1.3     TCP 9040 > 48219 [SYN, ACK] Seq=0 Ack=1 Win=14480 Len=0 MSS=1460 TSV=5217224 TSER=5232060 WS=6
  3   0.000435     10.0.1.3 -> 10.0.1.2     TCP 48219 > 9040 [ACK] Seq=1 Ack=1 Win=5888 Len=0 TSV=5232060 TSER=5217224
  7   0.003470     10.0.1.2 -> 10.0.1.3     TCP 9040 > 48219 [ACK] Seq=1 Ack=13 Win=14528 Len=0 TSV=5217224 TSER=5232061
518571  91.560973     10.0.1.3 -> 10.0.1.2     TCP 48219 > 9040 [FIN, ACK] Seq=13 Ack=500000002 Win=2026112 Len=0 TSV=5254950 TSER=5240094
  1   0.000000     10.0.1.3 -> 10.0.1.2     TCP 53932 > 9040 [SYN] Seq=0 Win=5840 Len=0 MSS=1460 TSV=5263087 TSER=0 WS=6
  2   0.000290     10.0.1.2 -> 10.0.1.3     TCP 9040 > 53932 [SYN, ACK] Seq=0 Ack=1 Win=14480 Len=0 MSS=1460 TSV=5248253 TSER=5263087 WS=6
  3   0.000313     10.0.1.3 -> 10.0.1.2     TCP 53932 > 9040 [ACK] Seq=1 Ack=1 Win=5888 Len=0 TSV=5263087 TSER=5248253
  7   0.002509     10.0.1.2 -> 10.0.1.3     TCP 9040 > 53932 [ACK] Seq=1 Ack=13 Win=14528 Len=0 TSV=5248254 TSER=5263088
502116  90.425427     10.0.1.3 -> 10.0.1.2     TCP 53932 > 9040 [FIN, ACK] Seq=13 Ack=500000002 Win=2023168 Len=0 TSV=5285694 TSER=5270840
  1   0.000000     10.0.1.3 -> 10.0.1.2     TCP 53934 > 9040 [SYN] Seq=0 Win=5840 Len=0 MSS=1460 TSV=5293492 TSER=0 WS=6
  2   0.000303     10.0.1.2 -> 10.0.1.3     TCP 9040 > 53934 [SYN, ACK] Seq=0 Ack=1 Win=14480 Len=0 MSS=1460 TSV=5278660 TSER=5293492 WS=6
  3   0.000325     10.0.1.3 -> 10.0.1.2     TCP 53934 > 9040 [ACK] Seq=1 Ack=1 Win=5888 Len=0 TSV=5293492 TSER=5278660
  7   0.002258     10.0.1.2 -> 10.0.1.3     TCP 9040 > 53934 [ACK] Seq=1 Ack=13 Win=14528 Len=0 TSV=5278661 TSER=5293492
505868  90.664304     10.0.1.3 -> 10.0.1.2     TCP 53934 > 9040 [FIN, ACK] Seq=13 Ack=500000002 Win=2017408 Len=0 TSV=5316158 TSER=5301306
  1   0.000000     10.0.1.3 -> 10.0.1.2     TCP 53937 > 9040 [SYN] Seq=0 Win=5840 Len=0 MSS=1460 TSV=5323932 TSER=0 WS=6
  2   0.000279     10.0.1.2 -> 10.0.1.3     TCP 9040 > 53937 [SYN, ACK] Seq=0 Ack=1 Win=14480 Len=0 MSS=1460 TSV=5309103 TSER=5323932 WS=6
  3   0.000304     10.0.1.3 -> 10.0.1.2     TCP 53937 > 9040 [ACK] Seq=1 Ack=1 Win=5888 Len=0 TSV=5323933 TSER=5309103
  7   0.002173     10.0.1.2 -> 10.0.1.3     TCP 9040 > 53937 [ACK] Seq=1 Ack=13 Win=14528 Len=0 TSV=5309103 TSER=5323933
517966  93.433895     10.0.1.3 -> 10.0.1.2     TCP 53937 > 9040 [FIN, ACK] Seq=13 Ack=500000002 Win=2023168 Len=0 TSV=5347291 TSER=5332442
  1   0.000000     10.0.1.3 -> 10.0.1.2     TCP 45974 > 9040 [SYN] Seq=0 Win=5840 Len=0 MSS=1460 TSV=5355212 TSER=0 WS=6
  2   0.000362     10.0.1.2 -> 10.0.1.3     TCP 9040 > 45974 [SYN, ACK] Seq=0 Ack=1 Win=14480 Len=0 MSS=1460 TSV=5340385 TSER=5355212 WS=6
  3   0.000386     10.0.1.3 -> 10.0.1.2     TCP 45974 > 9040 [ACK] Seq=1 Ack=1 Win=5888 Len=0 TSV=5355212 TSER=5340385
  7   0.002284     10.0.1.2 -> 10.0.1.3     TCP 9040 > 45974 [ACK] Seq=1 Ack=13 Win=14528 Len=0 TSV=5340385 TSER=5355212
518562  91.407081     10.0.1.3 -> 10.0.1.2     TCP 45974 > 9040 [FIN, ACK] Seq=13 Ack=500000002 Win=2020288 Len=0 TSV=5378064 TSER=5363217
  1   0.000000     10.0.1.3 -> 10.0.1.2     TCP 45976 > 9040 [SYN] Seq=0 Win=5840 Len=0 MSS=1460 TSV=5386029 TSER=0 WS=6
  2   0.000299     10.0.1.2 -> 10.0.1.3     TCP 9040 > 45976 [SYN, ACK] Seq=0 Ack=1 Win=14480 Len=0 MSS=1460 TSV=5371205 TSER=5386029 WS=6
  3   0.000321     10.0.1.3 -> 10.0.1.2     TCP 45976 > 9040 [ACK] Seq=1 Ack=1 Win=5888 Len=0 TSV=5386030 TSER=5371205
  7   0.002254     10.0.1.2 -> 10.0.1.3     TCP 9040 > 45976 [ACK] Seq=1 Ack=13 Win=14528 Len=0 TSV=5371205 TSER=5386030
512189  91.480819     10.0.1.3 -> 10.0.1.2     TCP 45976 > 9040 [FIN, ACK] Seq=13 Ack=500000002 Win=2017408 Len=0 TSV=5408900 TSER=5394055
