  1   0.000000     10.0.1.3 -> 10.0.1.2     TCP 45382 > 9040 [SYN] Seq=0 Win=5840 Len=0 MSS=1460 TSV=2131352 TSER=0 WS=6
  2   0.000375     10.0.1.2 -> 10.0.1.3     TCP 9040 > 45382 [SYN, ACK] Seq=0 Ack=1 Win=14480 Len=0 MSS=1460 TSV=2116282 TSER=2131352 WS=6
  3   0.000398     10.0.1.3 -> 10.0.1.2     TCP 45382 > 9040 [ACK] Seq=1 Ack=1 Win=5888 Len=0 TSV=2131352 TSER=2116282
51743   4.293727     10.0.1.3 -> 10.0.1.2     TCP 45382 > 9040 [FIN, ACK] Seq=12 Ack=50000002 Win=2580480 Len=0 TSV=2132426 TSER=2117301
51744   4.294010     10.0.1.2 -> 10.0.1.3     TCP 9040 > 45382 [ACK] Seq=50000002 Ack=13 Win=14528 Len=0 TSV=2117356 TSER=2132426
  1   0.000000     10.0.1.3 -> 10.0.1.2     TCP 45384 > 9040 [SYN] Seq=0 Win=5840 Len=0 MSS=1460 TSV=2134886 TSER=0 WS=6
  2   0.000316     10.0.1.2 -> 10.0.1.3     TCP 9040 > 45384 [SYN, ACK] Seq=0 Ack=1 Win=14480 Len=0 MSS=1460 TSV=2119817 TSER=2134886 WS=6
  3   0.000339     10.0.1.3 -> 10.0.1.2     TCP 45384 > 9040 [ACK] Seq=1 Ack=1 Win=5888 Len=0 TSV=2134886 TSER=2119817
51959   4.290973     10.0.1.3 -> 10.0.1.2     TCP 45384 > 9040 [FIN, ACK] Seq=12 Ack=50000002 Win=2580480 Len=0 TSV=2135959 TSER=2120839
51960   4.291228     10.0.1.2 -> 10.0.1.3     TCP 9040 > 45384 [ACK] Seq=50000002 Ack=13 Win=14528 Len=0 TSV=2120889 TSER=2135959
  1   0.000000     10.0.1.3 -> 10.0.1.2     TCP 45386 > 9040 [SYN] Seq=0 Win=5840 Len=0 MSS=1460 TSV=2138416 TSER=0 WS=6
  2   0.000306     10.0.1.2 -> 10.0.1.3     TCP 9040 > 45386 [SYN, ACK] Seq=0 Ack=1 Win=14480 Len=0 MSS=1460 TSV=2123346 TSER=2138416 WS=6
  3   0.000329     10.0.1.3 -> 10.0.1.2     TCP 45386 > 9040 [ACK] Seq=1 Ack=1 Win=5888 Len=0 TSV=2138416 TSER=2123346
51939   4.277617     10.0.1.3 -> 10.0.1.2     TCP 45386 > 9040 [FIN, ACK] Seq=12 Ack=50000002 Win=2580480 Len=0 TSV=2139485 TSER=2124366
51940   4.277872     10.0.1.2 -> 10.0.1.3     TCP 9040 > 45386 [ACK] Seq=50000002 Ack=13 Win=14528 Len=0 TSV=2124416 TSER=2139485
  1   0.000000     10.0.1.3 -> 10.0.1.2     TCP 45388 > 9040 [SYN] Seq=0 Win=5840 Len=0 MSS=1460 TSV=2141946 TSER=0 WS=6
  2   0.000307     10.0.1.2 -> 10.0.1.3     TCP 9040 > 45388 [SYN, ACK] Seq=0 Ack=1 Win=14480 Len=0 MSS=1460 TSV=2126877 TSER=2141946 WS=6
  3   0.000342     10.0.1.3 -> 10.0.1.2     TCP 45388 > 9040 [ACK] Seq=1 Ack=1 Win=5888 Len=0 TSV=2141946 TSER=2126877
52017   4.324354     10.0.1.3 -> 10.0.1.2     TCP 45388 > 9040 [FIN, ACK] Seq=12 Ack=50000002 Win=2580480 Len=0 TSV=2143027 TSER=2127910
52018   4.324632     10.0.1.2 -> 10.0.1.3     TCP 9040 > 45388 [ACK] Seq=50000002 Ack=13 Win=14528 Len=0 TSV=2127958 TSER=2143027
  1   0.000000     10.0.1.3 -> 10.0.1.2     TCP 45390 > 9040 [SYN] Seq=0 Win=5840 Len=0 MSS=1460 TSV=2145484 TSER=0 WS=6
  2   0.000437     10.0.1.2 -> 10.0.1.3     TCP 9040 > 45390 [SYN, ACK] Seq=0 Ack=1 Win=14480 Len=0 MSS=1460 TSV=2130415 TSER=2145484 WS=6
  3   0.000462     10.0.1.3 -> 10.0.1.2     TCP 45390 > 9040 [ACK] Seq=1 Ack=1 Win=5888 Len=0 TSV=2145484 TSER=2130415
51761   4.341832     10.0.1.3 -> 10.0.1.2     TCP 45390 > 9040 [FIN, ACK] Seq=12 Ack=50000002 Win=2580480 Len=0 TSV=2146570 TSER=2131450
51762   4.342135     10.0.1.2 -> 10.0.1.3     TCP 9040 > 45390 [ACK] Seq=50000002 Ack=13 Win=14528 Len=0 TSV=2131501 TSER=2146570
  1   0.000000     10.0.1.3 -> 10.0.1.2     TCP 45392 > 9040 [SYN] Seq=0 Win=5840 Len=0 MSS=1460 TSV=2149023 TSER=0 WS=6
  2   0.000369     10.0.1.2 -> 10.0.1.3     TCP 9040 > 45392 [SYN, ACK] Seq=0 Ack=1 Win=14480 Len=0 MSS=1460 TSV=2133955 TSER=2149023 WS=6
  3   0.000395     10.0.1.3 -> 10.0.1.2     TCP 45392 > 9040 [ACK] Seq=1 Ack=1 Win=5888 Len=0 TSV=2149024 TSER=2133955
51942   4.290759     10.0.1.3 -> 10.0.1.2     TCP 45392 > 9040 [FIN, ACK] Seq=12 Ack=50000002 Win=2580480 Len=0 TSV=2150096 TSER=2134980
51943   4.291011     10.0.1.2 -> 10.0.1.3     TCP 9040 > 45392 [ACK] Seq=50000002 Ack=13 Win=14528 Len=0 TSV=2135028 TSER=2150096
  1   0.000000     10.0.1.3 -> 10.0.1.2     TCP 45394 > 9040 [SYN] Seq=0 Win=5840 Len=0 MSS=1460 TSV=2152551 TSER=0 WS=6
  2   0.000274     10.0.1.2 -> 10.0.1.3     TCP 9040 > 45394 [SYN, ACK] Seq=0 Ack=1 Win=14480 Len=0 MSS=1460 TSV=2137483 TSER=2152551 WS=6
  3   0.000298     10.0.1.3 -> 10.0.1.2     TCP 45394 > 9040 [ACK] Seq=1 Ack=1 Win=5888 Len=0 TSV=2152551 TSER=2137483
51999   4.306920     10.0.1.3 -> 10.0.1.2     TCP 45394 > 9040 [FIN, ACK] Seq=12 Ack=50000002 Win=2580480 Len=0 TSV=2153628 TSER=2138508
52000   4.307182     10.0.1.2 -> 10.0.1.3     TCP 9040 > 45394 [ACK] Seq=50000002 Ack=13 Win=14528 Len=0 TSV=2138560 TSER=2153628
  1   0.000000     10.0.1.3 -> 10.0.1.2     TCP 45396 > 9040 [SYN] Seq=0 Win=5840 Len=0 MSS=1460 TSV=2156092 TSER=0 WS=6
  2   0.000299     10.0.1.2 -> 10.0.1.3     TCP 9040 > 45396 [SYN, ACK] Seq=0 Ack=1 Win=14480 Len=0 MSS=1460 TSV=2141024 TSER=2156092 WS=6
  3   0.000324     10.0.1.3 -> 10.0.1.2     TCP 45396 > 9040 [ACK] Seq=1 Ack=1 Win=5888 Len=0 TSV=2156092 TSER=2141024
51982   4.284205     10.0.1.3 -> 10.0.1.2     TCP 45396 > 9040 [FIN, ACK] Seq=12 Ack=50000002 Win=2580480 Len=0 TSV=2157163 TSER=2142047
51983   4.284460     10.0.1.2 -> 10.0.1.3     TCP 9040 > 45396 [ACK] Seq=50000002 Ack=13 Win=14528 Len=0 TSV=2142095 TSER=2157163
  1   0.000000     10.0.1.3 -> 10.0.1.2     TCP 45398 > 9040 [SYN] Seq=0 Win=5840 Len=0 MSS=1460 TSV=2159617 TSER=0 WS=6
  2   0.000301     10.0.1.2 -> 10.0.1.3     TCP 9040 > 45398 [SYN, ACK] Seq=0 Ack=1 Win=14480 Len=0 MSS=1460 TSV=2144549 TSER=2159617 WS=6
  3   0.000325     10.0.1.3 -> 10.0.1.2     TCP 45398 > 9040 [ACK] Seq=1 Ack=1 Win=5888 Len=0 TSV=2159617 TSER=2144549
52045   4.281374     10.0.1.3 -> 10.0.1.2     TCP 45398 > 9040 [FIN, ACK] Seq=12 Ack=50000002 Win=2580480 Len=0 TSV=2160688 TSER=2145571
52046   4.281628     10.0.1.2 -> 10.0.1.3     TCP 9040 > 45398 [ACK] Seq=50000002 Ack=13 Win=14528 Len=0 TSV=2145620 TSER=2160688
  1   0.000000     10.0.1.3 -> 10.0.1.2     TCP 45400 > 9040 [SYN] Seq=0 Win=5840 Len=0 MSS=1460 TSV=2163148 TSER=0 WS=6
  2   0.000317     10.0.1.2 -> 10.0.1.3     TCP 9040 > 45400 [SYN, ACK] Seq=0 Ack=1 Win=14480 Len=0 MSS=1460 TSV=2148080 TSER=2163148 WS=6
  3   0.000340     10.0.1.3 -> 10.0.1.2     TCP 45400 > 9040 [ACK] Seq=1 Ack=1 Win=5888 Len=0 TSV=2163148 TSER=2148080
52044   4.281142     10.0.1.3 -> 10.0.1.2     TCP 45400 > 9040 [FIN, ACK] Seq=12 Ack=50000002 Win=2580480 Len=0 TSV=2164218 TSER=2149102
52045   4.281387     10.0.1.2 -> 10.0.1.3     TCP 9040 > 45400 [ACK] Seq=50000002 Ack=13 Win=14528 Len=0 TSV=2149151 TSER=2164218
  1   0.000000     10.0.1.3 -> 10.0.1.2     TCP 45402 > 9040 [SYN] Seq=0 Win=5840 Len=0 MSS=1460 TSV=2166679 TSER=0 WS=6
  2   0.000366     10.0.1.2 -> 10.0.1.3     TCP 9040 > 45402 [SYN, ACK] Seq=0 Ack=1 Win=14480 Len=0 MSS=1460 TSV=2151611 TSER=2166679 WS=6
  3   0.000388     10.0.1.3 -> 10.0.1.2     TCP 45402 > 9040 [ACK] Seq=1 Ack=1 Win=5888 Len=0 TSV=2166679 TSER=2151611
51994   4.283302     10.0.1.3 -> 10.0.1.2     TCP 45402 > 9040 [FIN, ACK] Seq=12 Ack=50000002 Win=2560064 Len=0 TSV=2167750 TSER=2152634
51995   4.283553     10.0.1.2 -> 10.0.1.3     TCP 9040 > 45402 [ACK] Seq=50000002 Ack=13 Win=14528 Len=0 TSV=2152682 TSER=2167750
  1   0.000000     10.0.1.3 -> 10.0.1.2     TCP 45404 > 9040 [SYN] Seq=0 Win=5840 Len=0 MSS=1460 TSV=2170215 TSER=0 WS=6
  2   0.000288     10.0.1.2 -> 10.0.1.3     TCP 9040 > 45404 [SYN, ACK] Seq=0 Ack=1 Win=14480 Len=0 MSS=1460 TSV=2155148 TSER=2170215 WS=6
  3   0.000312     10.0.1.3 -> 10.0.1.2     TCP 45404 > 9040 [ACK] Seq=1 Ack=1 Win=5888 Len=0 TSV=2170216 TSER=2155148
51831   4.280380     10.0.1.3 -> 10.0.1.2     TCP 45404 > 9040 [FIN, ACK] Seq=12 Ack=50000002 Win=2571648 Len=0 TSV=2171286 TSER=2156170
51832   4.280625     10.0.1.2 -> 10.0.1.3     TCP 9040 > 45404 [ACK] Seq=50000002 Ack=13 Win=14528 Len=0 TSV=2156219 TSER=2171286
  1   0.000000     10.0.1.3 -> 10.0.1.2     TCP 45406 > 9040 [SYN] Seq=0 Win=5840 Len=0 MSS=1460 TSV=2173741 TSER=0 WS=6
  2   0.000301     10.0.1.2 -> 10.0.1.3     TCP 9040 > 45406 [SYN, ACK] Seq=0 Ack=1 Win=14480 Len=0 MSS=1460 TSV=2158674 TSER=2173741 WS=6
  3   0.000324     10.0.1.3 -> 10.0.1.2     TCP 45406 > 9040 [ACK] Seq=1 Ack=1 Win=5888 Len=0 TSV=2173741 TSER=2158674
51941   4.291467     10.0.1.3 -> 10.0.1.2     TCP 45406 > 9040 [FIN, ACK] Seq=12 Ack=50000002 Win=2560064 Len=0 TSV=2174814 TSER=2159699
51942   4.291717     10.0.1.2 -> 10.0.1.3     TCP 9040 > 45406 [ACK] Seq=50000002 Ack=13 Win=14528 Len=0 TSV=2159747 TSER=2174814
  1   0.000000     10.0.1.3 -> 10.0.1.2     TCP 34925 > 9040 [SYN] Seq=0 Win=5840 Len=0 MSS=1460 TSV=2177249 TSER=0 WS=6
  2   0.000309     10.0.1.2 -> 10.0.1.3     TCP 9040 > 34925 [SYN, ACK] Seq=0 Ack=1 Win=14480 Len=0 MSS=1460 TSV=2162183 TSER=2177249 WS=6
  3   0.000332     10.0.1.3 -> 10.0.1.2     TCP 34925 > 9040 [ACK] Seq=1 Ack=1 Win=5888 Len=0 TSV=2177249 TSER=2162183
52003   4.290727     10.0.1.3 -> 10.0.1.2     TCP 34925 > 9040 [FIN, ACK] Seq=12 Ack=50000002 Win=2580480 Len=0 TSV=2178322 TSER=2163208
52004   4.290980     10.0.1.2 -> 10.0.1.3     TCP 9040 > 34925 [ACK] Seq=50000002 Ack=13 Win=14528 Len=0 TSV=2163256 TSER=2178322
  1   0.000000     10.0.1.3 -> 10.0.1.2     TCP 34927 > 9040 [SYN] Seq=0 Win=5840 Len=0 MSS=1460 TSV=2180780 TSER=0 WS=6
  2   0.000542     10.0.1.2 -> 10.0.1.3     TCP 9040 > 34927 [SYN, ACK] Seq=0 Ack=1 Win=14480 Len=0 MSS=1460 TSV=2165714 TSER=2180780 WS=6
  3   0.000565     10.0.1.3 -> 10.0.1.2     TCP 34927 > 9040 [ACK] Seq=1 Ack=1 Win=5888 Len=0 TSV=2180780 TSER=2165714
51837   4.282258     10.0.1.3 -> 10.0.1.2     TCP 34927 > 9040 [FIN, ACK] Seq=12 Ack=50000002 Win=2580480 Len=0 TSV=2181851 TSER=2166735
51838   4.282505     10.0.1.2 -> 10.0.1.3     TCP 9040 > 34927 [ACK] Seq=50000002 Ack=13 Win=14528 Len=0 TSV=2166785 TSER=2181851
  1   0.000000     10.0.1.3 -> 10.0.1.2     TCP 34929 > 9040 [SYN] Seq=0 Win=5840 Len=0 MSS=1460 TSV=2184307 TSER=0 WS=6
  2   0.000297     10.0.1.2 -> 10.0.1.3     TCP 9040 > 34929 [SYN, ACK] Seq=0 Ack=1 Win=14480 Len=0 MSS=1460 TSV=2169241 TSER=2184307 WS=6
  3   0.000321     10.0.1.3 -> 10.0.1.2     TCP 34929 > 9040 [ACK] Seq=1 Ack=1 Win=5888 Len=0 TSV=2184307 TSER=2169241
51923   4.281016     10.0.1.3 -> 10.0.1.2     TCP 34929 > 9040 [FIN, ACK] Seq=12 Ack=50000002 Win=2580480 Len=0 TSV=2185377 TSER=2170262
51924   4.281263     10.0.1.2 -> 10.0.1.3     TCP 9040 > 34929 [ACK] Seq=50000002 Ack=13 Win=14528 Len=0 TSV=2170311 TSER=2185377
  1   0.000000     10.0.1.3 -> 10.0.1.2     TCP 34931 > 9040 [SYN] Seq=0 Win=5840 Len=0 MSS=1460 TSV=2187797 TSER=0 WS=6
  2   0.000286     10.0.1.2 -> 10.0.1.3     TCP 9040 > 34931 [SYN, ACK] Seq=0 Ack=1 Win=14480 Len=0 MSS=1460 TSV=2172731 TSER=2187797 WS=6
  3   0.000309     10.0.1.3 -> 10.0.1.2     TCP 34931 > 9040 [ACK] Seq=1 Ack=1 Win=5888 Len=0 TSV=2187797 TSER=2172731
51876   4.279297     10.0.1.3 -> 10.0.1.2     TCP 34931 > 9040 [FIN, ACK] Seq=12 Ack=50000002 Win=2580480 Len=0 TSV=2188867 TSER=2173750
51877   4.279539     10.0.1.2 -> 10.0.1.3     TCP 9040 > 34931 [ACK] Seq=50000002 Ack=13 Win=14528 Len=0 TSV=2173801 TSER=2188867
  1   0.000000     10.0.1.3 -> 10.0.1.2     TCP 34933 > 9040 [SYN] Seq=0 Win=5840 Len=0 MSS=1460 TSV=2191324 TSER=0 WS=6
  2   0.000283     10.0.1.2 -> 10.0.1.3     TCP 9040 > 34933 [SYN, ACK] Seq=0 Ack=1 Win=14480 Len=0 MSS=1460 TSV=2176258 TSER=2191324 WS=6
  3   0.000305     10.0.1.3 -> 10.0.1.2     TCP 34933 > 9040 [ACK] Seq=1 Ack=1 Win=5888 Len=0 TSV=2191324 TSER=2176258
51888   4.285454     10.0.1.3 -> 10.0.1.2     TCP 34933 > 9040 [FIN, ACK] Seq=12 Ack=50000002 Win=2580480 Len=0 TSV=2192395 TSER=2177280
51889   4.285707     10.0.1.2 -> 10.0.1.3     TCP 9040 > 34933 [ACK] Seq=50000002 Ack=13 Win=14528 Len=0 TSV=2177330 TSER=2192395
  1   0.000000     10.0.1.3 -> 10.0.1.2     TCP 34935 > 9040 [SYN] Seq=0 Win=5840 Len=0 MSS=1460 TSV=2194834 TSER=0 WS=6
  2   0.000300     10.0.1.2 -> 10.0.1.3     TCP 9040 > 34935 [SYN, ACK] Seq=0 Ack=1 Win=14480 Len=0 MSS=1460 TSV=2179769 TSER=2194834 WS=6
  3   0.000323     10.0.1.3 -> 10.0.1.2     TCP 34935 > 9040 [ACK] Seq=1 Ack=1 Win=5888 Len=0 TSV=2194834 TSER=2179769
51962   4.282399     10.0.1.3 -> 10.0.1.2     TCP 34935 > 9040 [FIN, ACK] Seq=12 Ack=50000002 Win=2580480 Len=0 TSV=2195905 TSER=2180790
51963   4.282677     10.0.1.2 -> 10.0.1.3     TCP 9040 > 34935 [ACK] Seq=50000002 Ack=13 Win=14528 Len=0 TSV=2180840 TSER=2195905
  1   0.000000     10.0.1.3 -> 10.0.1.2     TCP 34937 > 9040 [SYN] Seq=0 Win=5840 Len=0 MSS=1460 TSV=2198353 TSER=0 WS=6
  2   0.000316     10.0.1.2 -> 10.0.1.3     TCP 9040 > 34937 [SYN, ACK] Seq=0 Ack=1 Win=14480 Len=0 MSS=1460 TSV=2183288 TSER=2198353 WS=6
  3   0.000339     10.0.1.3 -> 10.0.1.2     TCP 34937 > 9040 [ACK] Seq=1 Ack=1 Win=5888 Len=0 TSV=2198353 TSER=2183288
51849   4.292201     10.0.1.3 -> 10.0.1.2     TCP 34937 > 9040 [FIN, ACK] Seq=12 Ack=50000002 Win=2580480 Len=0 TSV=2199426 TSER=2184311
51850   4.292448     10.0.1.2 -> 10.0.1.3     TCP 9040 > 34937 [ACK] Seq=50000002 Ack=13 Win=14528 Len=0 TSV=2184361 TSER=2199426
