  1   0.000000     10.0.1.3 -> 10.0.1.2     TCP 50003 > 9040 [SYN] Seq=0 Win=5840 Len=0 MSS=1460 TSV=3062081 TSER=0 WS=6
  2   0.000280     10.0.1.2 -> 10.0.1.3     TCP 9040 > 50003 [SYN, ACK] Seq=0 Ack=1 Win=14480 Len=0 MSS=1460 TSV=3469894 TSER=3062081 WS=6
  3   0.000304     10.0.1.3 -> 10.0.1.2     TCP 50003 > 9040 [ACK] Seq=1 Ack=1 Win=5888 Len=0 TSV=3062081 TSER=3469894
  7   0.002769     10.0.1.2 -> 10.0.1.3     TCP 9040 > 50003 [ACK] Seq=1 Ack=13 Win=14528 Len=0 TSV=3469894 TSER=3062082
504246  42.632977     10.0.1.3 -> 10.0.1.2     TCP 50003 > 9040 [FIN, ACK] Seq=13 Ack=500000002 Win=2580480 Len=0 TSV=3072740 TSER=3480498
504247  42.633218     10.0.1.2 -> 10.0.1.3     TCP 9040 > 50003 [ACK] Seq=500000002 Ack=14 Win=14528 Len=0 TSV=3480553 TSER=3072740
  1   0.000000     10.0.1.3 -> 10.0.1.2     TCP 44803 > 9040 [SYN] Seq=0 Win=5840 Len=0 MSS=1460 TSV=3080524 TSER=0 WS=6
  2   0.000288     10.0.1.2 -> 10.0.1.3     TCP 9040 > 44803 [SYN, ACK] Seq=0 Ack=1 Win=14480 Len=0 MSS=1460 TSV=3488338 TSER=3080524 WS=6
  3   0.000311     10.0.1.3 -> 10.0.1.2     TCP 44803 > 9040 [ACK] Seq=1 Ack=1 Win=5888 Len=0 TSV=3080524 TSER=3488338
  7   0.002226     10.0.1.2 -> 10.0.1.3     TCP 9040 > 44803 [ACK] Seq=1 Ack=13 Win=14528 Len=0 TSV=3488338 TSER=3080524
514897  42.603334     10.0.1.3 -> 10.0.1.2     TCP 44803 > 9040 [FIN, ACK] Seq=13 Ack=500000002 Win=2580480 Len=0 TSV=3091175 TSER=3498935
514898  42.603588     10.0.1.2 -> 10.0.1.3     TCP 9040 > 44803 [ACK] Seq=500000002 Ack=14 Win=14528 Len=0 TSV=3498990 TSER=3091175
  1   0.000000     10.0.1.3 -> 10.0.1.2     TCP 45869 > 9040 [SYN] Seq=0 Win=5840 Len=0 MSS=1460 TSV=3165917 TSER=0 WS=6
  2   0.000281     10.0.1.2 -> 10.0.1.3     TCP 9040 > 45869 [SYN, ACK] Seq=0 Ack=1 Win=14480 Len=0 MSS=1460 TSV=3573737 TSER=3165917 WS=6
  3   0.000304     10.0.1.3 -> 10.0.1.2     TCP 45869 > 9040 [ACK] Seq=1 Ack=1 Win=5888 Len=0 TSV=3165917 TSER=3573737
  7   0.002179     10.0.1.2 -> 10.0.1.3     TCP 9040 > 45869 [ACK] Seq=1 Ack=13 Win=14528 Len=0 TSV=3573738 TSER=3165917
489020  42.696214     10.0.1.3 -> 10.0.1.2     TCP 45869 > 9040 [FIN, ACK] Seq=13 Ack=500000002 Win=2580480 Len=0 TSV=3176591 TSER=3584357
489021  42.696470     10.0.1.2 -> 10.0.1.3     TCP 9040 > 45869 [ACK] Seq=500000002 Ack=14 Win=14528 Len=0 TSV=3584412 TSER=3176591
  1   0.000000     10.0.1.3 -> 10.0.1.2     TCP 45871 > 9040 [SYN] Seq=0 Win=5840 Len=0 MSS=1460 TSV=3183890 TSER=0 WS=6
  2   0.000317     10.0.1.2 -> 10.0.1.3     TCP 9040 > 45871 [SYN, ACK] Seq=0 Ack=1 Win=14480 Len=0 MSS=1460 TSV=3591711 TSER=3183890 WS=6
  3   0.000341     10.0.1.3 -> 10.0.1.2     TCP 45871 > 9040 [ACK] Seq=1 Ack=1 Win=5888 Len=0 TSV=3183890 TSER=3591711
  7   0.002267     10.0.1.2 -> 10.0.1.3     TCP 9040 > 45871 [ACK] Seq=1 Ack=13 Win=14528 Len=0 TSV=3591712 TSER=3183890
502003  42.596431     10.0.1.3 -> 10.0.1.2     TCP 45871 > 9040 [FIN, ACK] Seq=13 Ack=500000002 Win=2580480 Len=0 TSV=3194539 TSER=3602306
502004  42.596675     10.0.1.2 -> 10.0.1.3     TCP 9040 > 45871 [ACK] Seq=500000002 Ack=14 Win=14528 Len=0 TSV=3602361 TSER=3194539
  1   0.000000     10.0.1.3 -> 10.0.1.2     TCP 45875 > 9040 [SYN] Seq=0 Win=5840 Len=0 MSS=1460 TSV=3202393 TSER=0 WS=6
  2   0.000296     10.0.1.2 -> 10.0.1.3     TCP 9040 > 45875 [SYN, ACK] Seq=0 Ack=1 Win=14480 Len=0 MSS=1460 TSV=3610216 TSER=3202393 WS=6
  3   0.000320     10.0.1.3 -> 10.0.1.2     TCP 45875 > 9040 [ACK] Seq=1 Ack=1 Win=5888 Len=0 TSV=3202393 TSER=3610216
  7   0.002171     10.0.1.2 -> 10.0.1.3     TCP 9040 > 45875 [ACK] Seq=1 Ack=13 Win=14528 Len=0 TSV=3610217 TSER=3202394
500798  42.594083     10.0.1.3 -> 10.0.1.2     TCP 45875 > 9040 [FIN, ACK] Seq=13 Ack=500000002 Win=2571648 Len=0 TSV=3213042 TSER=3620811
500799  42.594340     10.0.1.2 -> 10.0.1.3     TCP 9040 > 45875 [ACK] Seq=500000002 Ack=14 Win=14528 Len=0 TSV=3620866 TSER=3213042
  1   0.000000     10.0.1.3 -> 10.0.1.2     TCP 45877 > 9040 [SYN] Seq=0 Win=5840 Len=0 MSS=1460 TSV=3220453 TSER=0 WS=6
  2   0.000298     10.0.1.2 -> 10.0.1.3     TCP 9040 > 45877 [SYN, ACK] Seq=0 Ack=1 Win=14480 Len=0 MSS=1460 TSV=3628277 TSER=3220453 WS=6
  3   0.000320     10.0.1.3 -> 10.0.1.2     TCP 45877 > 9040 [ACK] Seq=1 Ack=1 Win=5888 Len=0 TSV=3220453 TSER=3628277
  7   0.002209     10.0.1.2 -> 10.0.1.3     TCP 9040 > 45877 [ACK] Seq=1 Ack=13 Win=14528 Len=0 TSV=3628278 TSER=3220453
481306  42.596123     10.0.1.3 -> 10.0.1.2     TCP 45877 > 9040 [FIN, ACK] Seq=13 Ack=500000002 Win=2580480 Len=0 TSV=3231102 TSER=3638872
481307  42.596370     10.0.1.2 -> 10.0.1.3     TCP 9040 > 45877 [ACK] Seq=500000002 Ack=14 Win=14528 Len=0 TSV=3638927 TSER=3231102
  1   0.000000     10.0.1.3 -> 10.0.1.2     TCP 54781 > 9040 [SYN] Seq=0 Win=5840 Len=0 MSS=1460 TSV=3238786 TSER=0 WS=6
  2   0.000268     10.0.1.2 -> 10.0.1.3     TCP 9040 > 54781 [SYN, ACK] Seq=0 Ack=1 Win=14480 Len=0 MSS=1460 TSV=3646612 TSER=3238786 WS=6
  3   0.000293     10.0.1.3 -> 10.0.1.2     TCP 54781 > 9040 [ACK] Seq=1 Ack=1 Win=5888 Len=0 TSV=3238786 TSER=3646612
  7   0.002268     10.0.1.2 -> 10.0.1.3     TCP 9040 > 54781 [ACK] Seq=1 Ack=13 Win=14528 Len=0 TSV=3646612 TSER=3238786
429686  43.794288     10.0.1.3 -> 10.0.1.2     TCP 54781 > 9040 [FIN, ACK] Seq=13 Ack=500000002 Win=2580480 Len=0 TSV=3249734 TSER=3657506
429687  43.794567     10.0.1.2 -> 10.0.1.3     TCP 9040 > 54781 [ACK] Seq=500000002 Ack=14 Win=14528 Len=0 TSV=3657561 TSER=3249734
  1   0.000000     10.0.1.3 -> 10.0.1.2     TCP 54784 > 9040 [SYN] Seq=0 Win=5840 Len=0 MSS=1460 TSV=3256636 TSER=0 WS=6
  2   0.000298     10.0.1.2 -> 10.0.1.3     TCP 9040 > 54784 [SYN, ACK] Seq=0 Ack=1 Win=14480 Len=0 MSS=1460 TSV=3664463 TSER=3256636 WS=6
  3   0.000323     10.0.1.3 -> 10.0.1.2     TCP 54784 > 9040 [ACK] Seq=1 Ack=1 Win=5888 Len=0 TSV=3256636 TSER=3664463
  7   0.002207     10.0.1.2 -> 10.0.1.3     TCP 9040 > 54784 [ACK] Seq=1 Ack=13 Win=14528 Len=0 TSV=3664464 TSER=3256637
483475  42.593074     10.0.1.3 -> 10.0.1.2     TCP 54784 > 9040 [FIN, ACK] Seq=13 Ack=500000002 Win=2580480 Len=0 TSV=3267284 TSER=3675057
483476  42.593321     10.0.1.2 -> 10.0.1.3     TCP 9040 > 54784 [ACK] Seq=500000002 Ack=14 Win=14528 Len=0 TSV=3675112 TSER=3267284
  1   0.000000     10.0.1.3 -> 10.0.1.2     TCP 54788 > 9040 [SYN] Seq=0 Win=5840 Len=0 MSS=1460 TSV=3274949 TSER=0 WS=6
  2   0.000286     10.0.1.2 -> 10.0.1.3     TCP 9040 > 54788 [SYN, ACK] Seq=0 Ack=1 Win=14480 Len=0 MSS=1460 TSV=3682778 TSER=3274949 WS=6
  3   0.000309     10.0.1.3 -> 10.0.1.2     TCP 54788 > 9040 [ACK] Seq=1 Ack=1 Win=5888 Len=0 TSV=3274949 TSER=3682778
  7   0.002446     10.0.1.2 -> 10.0.1.3     TCP 9040 > 54788 [ACK] Seq=1 Ack=13 Win=14528 Len=0 TSV=3682778 TSER=3274950
514877  42.594904     10.0.1.3 -> 10.0.1.2     TCP 54788 > 9040 [FIN, ACK] Seq=13 Ack=500000002 Win=2580480 Len=0 TSV=3285598 TSER=3693372
514878  42.595146     10.0.1.2 -> 10.0.1.3     TCP 9040 > 54788 [ACK] Seq=500000002 Ack=14 Win=14528 Len=0 TSV=3693427 TSER=3285598
  1   0.000000     10.0.1.3 -> 10.0.1.2     TCP 54790 > 9040 [SYN] Seq=0 Win=5840 Len=0 MSS=1460 TSV=3293541 TSER=0 WS=6
  2   0.000290     10.0.1.2 -> 10.0.1.3     TCP 9040 > 54790 [SYN, ACK] Seq=0 Ack=1 Win=14480 Len=0 MSS=1460 TSV=3701371 TSER=3293541 WS=6
  3   0.000313     10.0.1.3 -> 10.0.1.2     TCP 54790 > 9040 [ACK] Seq=1 Ack=1 Win=5888 Len=0 TSV=3293542 TSER=3701371
  7   0.002206     10.0.1.2 -> 10.0.1.3     TCP 9040 > 54790 [ACK] Seq=1 Ack=13 Win=14528 Len=0 TSV=3701372 TSER=3293542
494780  42.588479     10.0.1.3 -> 10.0.1.2     TCP 54790 > 9040 [FIN, ACK] Seq=13 Ack=500000002 Win=2580480 Len=0 TSV=3304189 TSER=3711964
494781  42.588726     10.0.1.2 -> 10.0.1.3     TCP 9040 > 54790 [ACK] Seq=500000002 Ack=14 Win=14528 Len=0 TSV=3712019 TSER=3304189
  1   0.000000     10.0.1.3 -> 10.0.1.2     TCP 36556 > 9040 [SYN] Seq=0 Win=5840 Len=0 MSS=1460 TSV=3311931 TSER=0 WS=6
  2   0.000292     10.0.1.2 -> 10.0.1.3     TCP 9040 > 36556 [SYN, ACK] Seq=0 Ack=1 Win=14480 Len=0 MSS=1460 TSV=3719762 TSER=3311931 WS=6
  3   0.000324     10.0.1.3 -> 10.0.1.2     TCP 36556 > 9040 [ACK] Seq=1 Ack=1 Win=5888 Len=0 TSV=3311931 TSER=3719762
  7   0.002825     10.0.1.2 -> 10.0.1.3     TCP 9040 > 36556 [ACK] Seq=1 Ack=13 Win=14528 Len=0 TSV=3719763 TSER=3311932
460144  42.597366     10.0.1.3 -> 10.0.1.2     TCP 36556 > 9040 [FIN, ACK] Seq=13 Ack=500000002 Win=2580480 Len=0 TSV=3322581 TSER=3730358
460145  42.597616     10.0.1.2 -> 10.0.1.3     TCP 9040 > 36556 [ACK] Seq=500000002 Ack=14 Win=14528 Len=0 TSV=3730413 TSER=3322581
  1   0.000000     10.0.1.3 -> 10.0.1.2     TCP 36558 > 9040 [SYN] Seq=0 Win=5840 Len=0 MSS=1460 TSV=3329915 TSER=0 WS=6
  2   0.000295     10.0.1.2 -> 10.0.1.3     TCP 9040 > 36558 [SYN, ACK] Seq=0 Ack=1 Win=14480 Len=0 MSS=1460 TSV=3737748 TSER=3329915 WS=6
  3   0.000319     10.0.1.3 -> 10.0.1.2     TCP 36558 > 9040 [ACK] Seq=1 Ack=1 Win=5888 Len=0 TSV=3329915 TSER=3737748
  7   0.002963     10.0.1.2 -> 10.0.1.3     TCP 9040 > 36558 [ACK] Seq=1 Ack=13 Win=14528 Len=0 TSV=3737749 TSER=3329916
514403  42.607869     10.0.1.3 -> 10.0.1.2     TCP 36558 > 9040 [FIN, ACK] Seq=13 Ack=500000002 Win=2580480 Len=0 TSV=3340567 TSER=3748346
514404  42.608124     10.0.1.2 -> 10.0.1.3     TCP 9040 > 36558 [ACK] Seq=500000002 Ack=14 Win=14528 Len=0 TSV=3748401 TSER=3340567
  1   0.000000     10.0.1.3 -> 10.0.1.2     TCP 36563 > 9040 [SYN] Seq=0 Win=5840 Len=0 MSS=1460 TSV=3348598 TSER=0 WS=6
  2   0.000304     10.0.1.2 -> 10.0.1.3     TCP 9040 > 36563 [SYN, ACK] Seq=0 Ack=1 Win=14480 Len=0 MSS=1460 TSV=3756432 TSER=3348598 WS=6
  3   0.000327     10.0.1.3 -> 10.0.1.2     TCP 36563 > 9040 [ACK] Seq=1 Ack=1 Win=5888 Len=0 TSV=3348598 TSER=3756432
  7   0.002129     10.0.1.2 -> 10.0.1.3     TCP 9040 > 36563 [ACK] Seq=1 Ack=13 Win=14528 Len=0 TSV=3756433 TSER=3348598
496958  42.619890     10.0.1.3 -> 10.0.1.2     TCP 36563 > 9040 [FIN, ACK] Seq=13 Ack=500000002 Win=2580480 Len=0 TSV=3359253 TSER=3767033
496959  42.620135     10.0.1.2 -> 10.0.1.3     TCP 9040 > 36563 [ACK] Seq=500000002 Ack=14 Win=14528 Len=0 TSV=3767088 TSER=3359253
  1   0.000000     10.0.1.3 -> 10.0.1.2     TCP 36565 > 9040 [SYN] Seq=0 Win=5840 Len=0 MSS=1460 TSV=3366931 TSER=0 WS=6
  2   0.000288     10.0.1.2 -> 10.0.1.3     TCP 9040 > 36565 [SYN, ACK] Seq=0 Ack=1 Win=14480 Len=0 MSS=1460 TSV=3774766 TSER=3366931 WS=6
  3   0.000311     10.0.1.3 -> 10.0.1.2     TCP 36565 > 9040 [ACK] Seq=1 Ack=1 Win=5888 Len=0 TSV=3366931 TSER=3774766
  7   0.002228     10.0.1.2 -> 10.0.1.3     TCP 9040 > 36565 [ACK] Seq=1 Ack=13 Win=14528 Len=0 TSV=3774766 TSER=3366931
514908  42.595533     10.0.1.3 -> 10.0.1.2     TCP 36565 > 9040 [FIN, ACK] Seq=13 Ack=500000002 Win=2580480 Len=0 TSV=3377579 TSER=3785361
514909  42.595790     10.0.1.2 -> 10.0.1.3     TCP 9040 > 36565 [ACK] Seq=500000002 Ack=14 Win=14528 Len=0 TSV=3785416 TSER=3377579
  1   0.000000     10.0.1.3 -> 10.0.1.2     TCP 54194 > 9040 [SYN] Seq=0 Win=5840 Len=0 MSS=1460 TSV=3385381 TSER=0 WS=6
  2   0.000304     10.0.1.2 -> 10.0.1.3     TCP 9040 > 54194 [SYN, ACK] Seq=0 Ack=1 Win=14480 Len=0 MSS=1460 TSV=3793218 TSER=3385381 WS=6
  3   0.000330     10.0.1.3 -> 10.0.1.2     TCP 54194 > 9040 [ACK] Seq=1 Ack=1 Win=5888 Len=0 TSV=3385381 TSER=3793218
  7   0.002307     10.0.1.2 -> 10.0.1.3     TCP 9040 > 54194 [ACK] Seq=1 Ack=13 Win=14528 Len=0 TSV=3793218 TSER=3385382
490348  42.603975     10.0.1.3 -> 10.0.1.2     TCP 54194 > 9040 [FIN, ACK] Seq=13 Ack=500000002 Win=2580480 Len=0 TSV=3396032 TSER=3803815
490349  42.604221     10.0.1.2 -> 10.0.1.3     TCP 9040 > 54194 [ACK] Seq=500000002 Ack=14 Win=14528 Len=0 TSV=3803870 TSER=3396032
  1   0.000000     10.0.1.3 -> 10.0.1.2     TCP 54196 > 9040 [SYN] Seq=0 Win=5840 Len=0 MSS=1460 TSV=3403680 TSER=0 WS=6
  2   0.000277     10.0.1.2 -> 10.0.1.3     TCP 9040 > 54196 [SYN, ACK] Seq=0 Ack=1 Win=14480 Len=0 MSS=1460 TSV=3811519 TSER=3403680 WS=6
  3   0.000300     10.0.1.3 -> 10.0.1.2     TCP 54196 > 9040 [ACK] Seq=1 Ack=1 Win=5888 Len=0 TSV=3403681 TSER=3811519
  7   0.002346     10.0.1.2 -> 10.0.1.3     TCP 9040 > 54196 [ACK] Seq=1 Ack=13 Win=14528 Len=0 TSV=3811519 TSER=3403681
478684  42.593282     10.0.1.3 -> 10.0.1.2     TCP 54196 > 9040 [FIN, ACK] Seq=13 Ack=500000002 Win=2580480 Len=0 TSV=3414329 TSER=3822113
478685  42.593530     10.0.1.2 -> 10.0.1.3     TCP 9040 > 54196 [ACK] Seq=500000002 Ack=14 Win=14528 Len=0 TSV=3822168 TSER=3414329
  1   0.000000     10.0.1.3 -> 10.0.1.2     TCP 54201 > 9040 [SYN] Seq=0 Win=5840 Len=0 MSS=1460 TSV=3422025 TSER=0 WS=6
  2   0.000272     10.0.1.2 -> 10.0.1.3     TCP 9040 > 54201 [SYN, ACK] Seq=0 Ack=1 Win=14480 Len=0 MSS=1460 TSV=3829864 TSER=3422025 WS=6
  3   0.000291     10.0.1.3 -> 10.0.1.2     TCP 54201 > 9040 [ACK] Seq=1 Ack=1 Win=5888 Len=0 TSV=3422025 TSER=3829864
  7   0.002085     10.0.1.2 -> 10.0.1.3     TCP 9040 > 54201 [ACK] Seq=1 Ack=13 Win=14528 Len=0 TSV=3829865 TSER=3422025
483036  42.595920     10.0.1.3 -> 10.0.1.2     TCP 54201 > 9040 [FIN, ACK] Seq=13 Ack=500000002 Win=2580480 Len=0 TSV=3432674 TSER=3840459
483037  42.596172     10.0.1.2 -> 10.0.1.3     TCP 9040 > 54201 [ACK] Seq=500000002 Ack=14 Win=14528 Len=0 TSV=3840514 TSER=3432674
  1   0.000000     10.0.1.3 -> 10.0.1.2     TCP 54203 > 9040 [SYN] Seq=0 Win=5840 Len=0 MSS=1460 TSV=3439930 TSER=0 WS=6
  2   0.000288     10.0.1.2 -> 10.0.1.3     TCP 9040 > 54203 [SYN, ACK] Seq=0 Ack=1 Win=14480 Len=0 MSS=1460 TSV=3847771 TSER=3439930 WS=6
  3   0.000312     10.0.1.3 -> 10.0.1.2     TCP 54203 > 9040 [ACK] Seq=1 Ack=1 Win=5888 Len=0 TSV=3439930 TSER=3847771
  7   0.002194     10.0.1.2 -> 10.0.1.3     TCP 9040 > 54203 [ACK] Seq=1 Ack=13 Win=14528 Len=0 TSV=3847771 TSER=3439930
494262  42.595620     10.0.1.3 -> 10.0.1.2     TCP 54203 > 9040 [FIN, ACK] Seq=13 Ack=500000002 Win=2563008 Len=0 TSV=3450579 TSER=3858366
494263  42.595873     10.0.1.2 -> 10.0.1.3     TCP 9040 > 54203 [ACK] Seq=500000002 Ack=14 Win=14528 Len=0 TSV=3858421 TSER=3450579
  1   0.000000     10.0.1.3 -> 10.0.1.2     TCP 48314 > 9040 [SYN] Seq=0 Win=5840 Len=0 MSS=1460 TSV=3457951 TSER=0 WS=6
  2   0.000315     10.0.1.2 -> 10.0.1.3     TCP 9040 > 48314 [SYN, ACK] Seq=0 Ack=1 Win=14480 Len=0 MSS=1460 TSV=3865793 TSER=3457951 WS=6
  3   0.000338     10.0.1.3 -> 10.0.1.2     TCP 48314 > 9040 [ACK] Seq=1 Ack=1 Win=5888 Len=0 TSV=3457951 TSER=3865793
  7   0.002358     10.0.1.2 -> 10.0.1.3     TCP 9040 > 48314 [ACK] Seq=1 Ack=13 Win=14528 Len=0 TSV=3865794 TSER=3457952
478126  42.605837     10.0.1.3 -> 10.0.1.2     TCP 48314 > 9040 [FIN, ACK] Seq=13 Ack=500000002 Win=2580480 Len=0 TSV=3468603 TSER=3876391
478127  42.606093     10.0.1.2 -> 10.0.1.3     TCP 9040 > 48314 [ACK] Seq=500000002 Ack=14 Win=14528 Len=0 TSV=3876446 TSER=3468603
  1   0.000000     10.0.1.3 -> 10.0.1.2     TCP 48316 > 9040 [SYN] Seq=0 Win=5840 Len=0 MSS=1460 TSV=3476359 TSER=0 WS=6
  2   0.000294     10.0.1.2 -> 10.0.1.3     TCP 9040 > 48316 [SYN, ACK] Seq=0 Ack=1 Win=14480 Len=0 MSS=1460 TSV=3884203 TSER=3476359 WS=6
  3   0.000318     10.0.1.3 -> 10.0.1.2     TCP 48316 > 9040 [ACK] Seq=1 Ack=1 Win=5888 Len=0 TSV=3476359 TSER=3884203
  7   0.002367     10.0.1.2 -> 10.0.1.3     TCP 9040 > 48316 [ACK] Seq=1 Ack=13 Win=14528 Len=0 TSV=3884203 TSER=3476359
481992  42.605562     10.0.1.3 -> 10.0.1.2     TCP 48316 > 9040 [FIN, ACK] Seq=13 Ack=500000002 Win=2580480 Len=0 TSV=3487011 TSER=3894800
481993  42.605813     10.0.1.2 -> 10.0.1.3     TCP 9040 > 48316 [ACK] Seq=500000002 Ack=14 Win=14528 Len=0 TSV=3894855 TSER=3487011
  1   0.000000     10.0.1.3 -> 10.0.1.2     TCP 48322 > 9040 [SYN] Seq=0 Win=5840 Len=0 MSS=1460 TSV=3494707 TSER=0 WS=6
  2   0.000362     10.0.1.2 -> 10.0.1.3     TCP 9040 > 48322 [SYN, ACK] Seq=0 Ack=1 Win=14480 Len=0 MSS=1460 TSV=3902552 TSER=3494707 WS=6
  3   0.000388     10.0.1.3 -> 10.0.1.2     TCP 48322 > 9040 [ACK] Seq=1 Ack=1 Win=5888 Len=0 TSV=3494707 TSER=3902552
  7   0.002348     10.0.1.2 -> 10.0.1.3     TCP 9040 > 48322 [ACK] Seq=1 Ack=13 Win=14528 Len=0 TSV=3902552 TSER=3494707
  1   0.000000     10.0.1.3 -> 10.0.1.2     TCP 48324 > 9040 [SYN] Seq=0 Win=5840 Len=0 MSS=1460 TSV=3512574 TSER=0 WS=6
  2   0.000281     10.0.1.2 -> 10.0.1.3     TCP 9040 > 48324 [SYN, ACK] Seq=0 Ack=1 Win=14480 Len=0 MSS=1460 TSV=3920420 TSER=3512574 WS=6
  3   0.000318     10.0.1.3 -> 10.0.1.2     TCP 48324 > 9040 [ACK] Seq=1 Ack=1 Win=5888 Len=0 TSV=3512574 TSER=3920420
  7   0.003384     10.0.1.2 -> 10.0.1.3     TCP 9040 > 48324 [ACK] Seq=1 Ack=13 Win=14528 Len=0 TSV=3920421 TSER=3512575
494472  42.699433     10.0.1.3 -> 10.0.1.2     TCP 48324 > 9040 [FIN, ACK] Seq=13 Ack=500000002 Win=2580480 Len=0 TSV=3523249 TSER=3931041
494473  42.699706     10.0.1.2 -> 10.0.1.3     TCP 9040 > 48324 [ACK] Seq=500000002 Ack=14 Win=14528 Len=0 TSV=3931096 TSER=3523249
