  1   0.000000     10.0.1.3 -> 10.0.1.2     TCP 42042 > 9040 [SYN] Seq=0 Win=5840 Len=0 MSS=1460 TSV=8599546 TSER=0 WS=6
  2   0.000317     10.0.1.2 -> 10.0.1.3     TCP 9040 > 42042 [SYN, ACK] Seq=0 Ack=1 Win=14480 Len=0 MSS=1460 TSV=8653436 TSER=8599546 WS=6
  3   0.000342     10.0.1.3 -> 10.0.1.2     TCP 42042 > 9040 [ACK] Seq=1 Ack=1 Win=5888 Len=0 TSV=8599547 TSER=8653436
52171   4.335593     10.0.1.3 -> 10.0.1.2     TCP 42042 > 9040 [FIN, ACK] Seq=12 Ack=50000002 Win=2580480 Len=0 TSV=8600631 TSER=8654465
52172   4.335839     10.0.1.2 -> 10.0.1.3     TCP 9040 > 42042 [ACK] Seq=50000002 Ack=13 Win=14528 Len=0 TSV=8654520 TSER=8600631
================================================================================
IPv4 Conversations
Filter:<No Filter>
                                               |       <-      | |       ->      | |     Total     |
                                               | Frames  Bytes | | Frames  Bytes | | Frames  Bytes |
10.0.1.3             <-> 10.0.1.2               34536  52279384   17636   1163995   52172  53443379
================================================================================
  1   0.000000     10.0.1.3 -> 10.0.1.2     TCP 42044 > 9040 [SYN] Seq=0 Win=5840 Len=0 MSS=1460 TSV=8602821 TSER=0 WS=6
  2   0.000287     10.0.1.2 -> 10.0.1.3     TCP 9040 > 42044 [SYN, ACK] Seq=0 Ack=1 Win=14480 Len=0 MSS=1460 TSV=8656711 TSER=8602821 WS=6
  3   0.000312     10.0.1.3 -> 10.0.1.2     TCP 42044 > 9040 [ACK] Seq=1 Ack=1 Win=5888 Len=0 TSV=8602822 TSER=8656711
52208   4.283159     10.0.1.3 -> 10.0.1.2     TCP 42044 > 9040 [FIN, ACK] Seq=12 Ack=50000002 Win=2565888 Len=0 TSV=8603892 TSER=8657733
52209   4.283409     10.0.1.2 -> 10.0.1.3     TCP 9040 > 42044 [ACK] Seq=50000002 Ack=13 Win=14528 Len=0 TSV=8657782 TSER=8603892
================================================================================
IPv4 Conversations
Filter:<No Filter>
                                               |       <-      | |       ->      | |     Total     |
                                               | Frames  Bytes | | Frames  Bytes | | Frames  Bytes |
10.0.1.3             <-> 10.0.1.2               34536  52279384   17673   1166437   52209  53445821
================================================================================
  1   0.000000     10.0.1.3 -> 10.0.1.2     TCP 42046 > 9040 [SYN] Seq=0 Win=5840 Len=0 MSS=1460 TSV=8606074 TSER=0 WS=6
  2   0.000291     10.0.1.2 -> 10.0.1.3     TCP 9040 > 42046 [SYN, ACK] Seq=0 Ack=1 Win=14480 Len=0 MSS=1460 TSV=8659964 TSER=8606074 WS=6
  3   0.000315     10.0.1.3 -> 10.0.1.2     TCP 42046 > 9040 [ACK] Seq=1 Ack=1 Win=5888 Len=0 TSV=8606075 TSER=8659964
52224   4.281031     10.0.1.3 -> 10.0.1.2     TCP 42046 > 9040 [FIN, ACK] Seq=12 Ack=50000002 Win=2563008 Len=0 TSV=8607145 TSER=8660983
52225   4.281290     10.0.1.2 -> 10.0.1.3     TCP 9040 > 42046 [ACK] Seq=50000002 Ack=13 Win=14528 Len=0 TSV=8661035 TSER=8607145
================================================================================
IPv4 Conversations
Filter:<No Filter>
                                               |       <-      | |       ->      | |     Total     |
                                               | Frames  Bytes | | Frames  Bytes | | Frames  Bytes |
10.0.1.3             <-> 10.0.1.2               34536  52279384   17689   1167493   52225  53446877
================================================================================
  1   0.000000     10.0.1.3 -> 10.0.1.2     TCP 42048 > 9040 [SYN] Seq=0 Win=5840 Len=0 MSS=1460 TSV=8609323 TSER=0 WS=6
  2   0.000285     10.0.1.2 -> 10.0.1.3     TCP 9040 > 42048 [SYN, ACK] Seq=0 Ack=1 Win=14480 Len=0 MSS=1460 TSV=8663213 TSER=8609323 WS=6
  3   0.000307     10.0.1.3 -> 10.0.1.2     TCP 42048 > 9040 [ACK] Seq=1 Ack=1 Win=5888 Len=0 TSV=8609323 TSER=8663213
52214   4.283318     10.0.1.3 -> 10.0.1.2     TCP 42048 > 9040 [FIN, ACK] Seq=12 Ack=50000002 Win=2580480 Len=0 TSV=8610394 TSER=8664232
52215   4.283562     10.0.1.2 -> 10.0.1.3     TCP 9040 > 42048 [ACK] Seq=50000002 Ack=13 Win=14528 Len=0 TSV=8664284 TSER=8610394
================================================================================
IPv4 Conversations
Filter:<No Filter>
                                               |       <-      | |       ->      | |     Total     |
                                               | Frames  Bytes | | Frames  Bytes | | Frames  Bytes |
10.0.1.3             <-> 10.0.1.2               34536  52279384   17679   1166833   52215  53446217
================================================================================
  1   0.000000     10.0.1.3 -> 10.0.1.2     TCP 42050 > 9040 [SYN] Seq=0 Win=5840 Len=0 MSS=1460 TSV=8612573 TSER=0 WS=6
  2   0.000283     10.0.1.2 -> 10.0.1.3     TCP 9040 > 42050 [SYN, ACK] Seq=0 Ack=1 Win=14480 Len=0 MSS=1460 TSV=8666463 TSER=8612573 WS=6
  3   0.000305     10.0.1.3 -> 10.0.1.2     TCP 42050 > 9040 [ACK] Seq=1 Ack=1 Win=5888 Len=0 TSV=8612573 TSER=8666463
52197   4.282580     10.0.1.3 -> 10.0.1.2     TCP 42050 > 9040 [FIN, ACK] Seq=12 Ack=50000002 Win=2580480 Len=0 TSV=8613644 TSER=8667479
52198   4.282826     10.0.1.2 -> 10.0.1.3     TCP 9040 > 42050 [ACK] Seq=50000002 Ack=13 Win=14528 Len=0 TSV=8667534 TSER=8613644
================================================================================
IPv4 Conversations
Filter:<No Filter>
                                               |       <-      | |       ->      | |     Total     |
                                               | Frames  Bytes | | Frames  Bytes | | Frames  Bytes |
10.0.1.3             <-> 10.0.1.2               34536  52279384   17662   1165711   52198  53445095
================================================================================
  1   0.000000     10.0.1.3 -> 10.0.1.2     TCP 42052 > 9040 [SYN] Seq=0 Win=5840 Len=0 MSS=1460 TSV=8615829 TSER=0 WS=6
  2   0.000321     10.0.1.2 -> 10.0.1.3     TCP 9040 > 42052 [SYN, ACK] Seq=0 Ack=1 Win=14480 Len=0 MSS=1460 TSV=8669719 TSER=8615829 WS=6
  3   0.000354     10.0.1.3 -> 10.0.1.2     TCP 42052 > 9040 [ACK] Seq=1 Ack=1 Win=5888 Len=0 TSV=8615829 TSER=8669719
52195   4.279764     10.0.1.3 -> 10.0.1.2     TCP 42052 > 9040 [FIN, ACK] Seq=12 Ack=50000002 Win=2580480 Len=0 TSV=8616899 TSER=8670735
52196   4.280017     10.0.1.2 -> 10.0.1.3     TCP 9040 > 42052 [ACK] Seq=50000002 Ack=13 Win=14528 Len=0 TSV=8670789 TSER=8616899
================================================================================
IPv4 Conversations
Filter:<No Filter>
                                               |       <-      | |       ->      | |     Total     |
                                               | Frames  Bytes | | Frames  Bytes | | Frames  Bytes |
10.0.1.3             <-> 10.0.1.2               34535  52279318   17661   1165645   52196  53444963
================================================================================
  1   0.000000     10.0.1.3 -> 10.0.1.2     TCP 42054 > 9040 [SYN] Seq=0 Win=5840 Len=0 MSS=1460 TSV=8619075 TSER=0 WS=6
  2   0.000307     10.0.1.2 -> 10.0.1.3     TCP 9040 > 42054 [SYN, ACK] Seq=0 Ack=1 Win=14480 Len=0 MSS=1460 TSV=8672966 TSER=8619075 WS=6
  3   0.000330     10.0.1.3 -> 10.0.1.2     TCP 42054 > 9040 [ACK] Seq=1 Ack=1 Win=5888 Len=0 TSV=8619075 TSER=8672966
52206   4.280199     10.0.1.3 -> 10.0.1.2     TCP 42054 > 9040 [FIN, ACK] Seq=12 Ack=50000002 Win=2580480 Len=0 TSV=8620145 TSER=8673981
52207   4.280450     10.0.1.2 -> 10.0.1.3     TCP 9040 > 42054 [ACK] Seq=50000002 Ack=13 Win=14528 Len=0 TSV=8674036 TSER=8620145
================================================================================
IPv4 Conversations
Filter:<No Filter>
                                               |       <-      | |       ->      | |     Total     |
                                               | Frames  Bytes | | Frames  Bytes | | Frames  Bytes |
10.0.1.3             <-> 10.0.1.2               34536  52279384   17671   1166305   52207  53445689
================================================================================
  1   0.000000     10.0.1.3 -> 10.0.1.2     TCP 42056 > 9040 [SYN] Seq=0 Win=5840 Len=0 MSS=1460 TSV=8622319 TSER=0 WS=6
  2   0.000302     10.0.1.2 -> 10.0.1.3     TCP 9040 > 42056 [SYN, ACK] Seq=0 Ack=1 Win=14480 Len=0 MSS=1460 TSV=8676210 TSER=8622319 WS=6
  3   0.000318     10.0.1.3 -> 10.0.1.2     TCP 42056 > 9040 [ACK] Seq=1 Ack=1 Win=5888 Len=0 TSV=8622319 TSER=8676210
52214   4.275844     10.0.1.3 -> 10.0.1.2     TCP 42056 > 9040 [FIN, ACK] Seq=12 Ack=50000002 Win=2580480 Len=0 TSV=8623388 TSER=8677224
52215   4.276094     10.0.1.2 -> 10.0.1.3     TCP 9040 > 42056 [ACK] Seq=50000002 Ack=13 Win=14528 Len=0 TSV=8677279 TSER=8623388
================================================================================
IPv4 Conversations
Filter:<No Filter>
                                               |       <-      | |       ->      | |     Total     |
                                               | Frames  Bytes | | Frames  Bytes | | Frames  Bytes |
10.0.1.3             <-> 10.0.1.2               34536  52279384   17679   1166833   52215  53446217
================================================================================
  1   0.000000     10.0.1.3 -> 10.0.1.2     TCP 44532 > 9040 [SYN] Seq=0 Win=5840 Len=0 MSS=1460 TSV=8625560 TSER=0 WS=6
  2   0.000293     10.0.1.2 -> 10.0.1.3     TCP 9040 > 44532 [SYN, ACK] Seq=0 Ack=1 Win=14480 Len=0 MSS=1460 TSV=8679451 TSER=8625560 WS=6
  3   0.000317     10.0.1.3 -> 10.0.1.2     TCP 44532 > 9040 [ACK] Seq=1 Ack=1 Win=5888 Len=0 TSV=8625560 TSER=8679451
52187   4.281067     10.0.1.3 -> 10.0.1.2     TCP 44532 > 9040 [FIN, ACK] Seq=12 Ack=50000002 Win=2580480 Len=0 TSV=8626630 TSER=8680469
52188   4.281318     10.0.1.2 -> 10.0.1.3     TCP 9040 > 44532 [ACK] Seq=50000002 Ack=13 Win=14528 Len=0 TSV=8680521 TSER=8626630
================================================================================
IPv4 Conversations
Filter:<No Filter>
                                               |       <-      | |       ->      | |     Total     |
                                               | Frames  Bytes | | Frames  Bytes | | Frames  Bytes |
10.0.1.3             <-> 10.0.1.2               34536  52279384   17652   1165051   52188  53444435
================================================================================
  1   0.000000     10.0.1.3 -> 10.0.1.2     TCP 44534 > 9040 [SYN] Seq=0 Win=5840 Len=0 MSS=1460 TSV=8628808 TSER=0 WS=6
  2   0.000299     10.0.1.2 -> 10.0.1.3     TCP 9040 > 44534 [SYN, ACK] Seq=0 Ack=1 Win=14480 Len=0 MSS=1460 TSV=8682699 TSER=8628808 WS=6
  3   0.000323     10.0.1.3 -> 10.0.1.2     TCP 44534 > 9040 [ACK] Seq=1 Ack=1 Win=5888 Len=0 TSV=8628808 TSER=8682699
52231   4.275939     10.0.1.3 -> 10.0.1.2     TCP 44534 > 9040 [FIN, ACK] Seq=12 Ack=50000002 Win=2580352 Len=0 TSV=8629877 TSER=8683715
52232   4.276189     10.0.1.2 -> 10.0.1.3     TCP 9040 > 44534 [ACK] Seq=50000002 Ack=13 Win=14528 Len=0 TSV=8683768 TSER=8629877
================================================================================
IPv4 Conversations
Filter:<No Filter>
                                               |       <-      | |       ->      | |     Total     |
                                               | Frames  Bytes | | Frames  Bytes | | Frames  Bytes |
10.0.1.3             <-> 10.0.1.2               34536  52279384   17696   1167955   52232  53447339
================================================================================
  1   0.000000     10.0.1.3 -> 10.0.1.2     TCP 44536 > 9040 [SYN] Seq=0 Win=5840 Len=0 MSS=1460 TSV=8632054 TSER=0 WS=6
  2   0.000282     10.0.1.2 -> 10.0.1.3     TCP 9040 > 44536 [SYN, ACK] Seq=0 Ack=1 Win=14480 Len=0 MSS=1460 TSV=8685946 TSER=8632054 WS=6
  3   0.000304     10.0.1.3 -> 10.0.1.2     TCP 44536 > 9040 [ACK] Seq=1 Ack=1 Win=5888 Len=0 TSV=8632054 TSER=8685946
52227   4.283267     10.0.1.3 -> 10.0.1.2     TCP 44536 > 9040 [FIN, ACK] Seq=12 Ack=50000002 Win=2580480 Len=0 TSV=8633125 TSER=8686962
52228   4.283515     10.0.1.2 -> 10.0.1.3     TCP 9040 > 44536 [ACK] Seq=50000002 Ack=13 Win=14528 Len=0 TSV=8687017 TSER=8633125
================================================================================
IPv4 Conversations
Filter:<No Filter>
                                               |       <-      | |       ->      | |     Total     |
                                               | Frames  Bytes | | Frames  Bytes | | Frames  Bytes |
10.0.1.3             <-> 10.0.1.2               34536  52279384   17692   1167691   52228  53447075
================================================================================
  1   0.000000     10.0.1.3 -> 10.0.1.2     TCP 44538 > 9040 [SYN] Seq=0 Win=5840 Len=0 MSS=1460 TSV=8635306 TSER=0 WS=6
  2   0.000289     10.0.1.2 -> 10.0.1.3     TCP 9040 > 44538 [SYN, ACK] Seq=0 Ack=1 Win=14480 Len=0 MSS=1460 TSV=8689198 TSER=8635306 WS=6
  3   0.000313     10.0.1.3 -> 10.0.1.2     TCP 44538 > 9040 [ACK] Seq=1 Ack=1 Win=5888 Len=0 TSV=8635306 TSER=8689198
52209   4.282114     10.0.1.3 -> 10.0.1.2     TCP 44538 > 9040 [FIN, ACK] Seq=12 Ack=50000002 Win=2580480 Len=0 TSV=8636376 TSER=8690216
52210   4.282358     10.0.1.2 -> 10.0.1.3     TCP 9040 > 44538 [ACK] Seq=50000002 Ack=13 Win=14528 Len=0 TSV=8690268 TSER=8636376
================================================================================
IPv4 Conversations
Filter:<No Filter>
                                               |       <-      | |       ->      | |     Total     |
                                               | Frames  Bytes | | Frames  Bytes | | Frames  Bytes |
10.0.1.3             <-> 10.0.1.2               34536  52279384   17674   1166503   52210  53445887
================================================================================
  1   0.000000     10.0.1.3 -> 10.0.1.2     TCP 44540 > 9040 [SYN] Seq=0 Win=5840 Len=0 MSS=1460 TSV=8638550 TSER=0 WS=6
  2   0.000302     10.0.1.2 -> 10.0.1.3     TCP 9040 > 44540 [SYN, ACK] Seq=0 Ack=1 Win=14480 Len=0 MSS=1460 TSV=8692443 TSER=8638550 WS=6
  3   0.000334     10.0.1.3 -> 10.0.1.2     TCP 44540 > 9040 [ACK] Seq=1 Ack=1 Win=5888 Len=0 TSV=8638551 TSER=8692443
52210   4.287479     10.0.1.3 -> 10.0.1.2     TCP 44540 > 9040 [FIN, ACK] Seq=12 Ack=50000002 Win=2580480 Len=0 TSV=8639623 TSER=8693460
52211   4.287730     10.0.1.2 -> 10.0.1.3     TCP 9040 > 44540 [ACK] Seq=50000002 Ack=13 Win=14528 Len=0 TSV=8693515 TSER=8639623
================================================================================
IPv4 Conversations
Filter:<No Filter>
                                               |       <-      | |       ->      | |     Total     |
                                               | Frames  Bytes | | Frames  Bytes | | Frames  Bytes |
10.0.1.3             <-> 10.0.1.2               34537  52279450   17674   1166503   52211  53445953
================================================================================
  1   0.000000     10.0.1.3 -> 10.0.1.2     TCP 44542 > 9040 [SYN] Seq=0 Win=5840 Len=0 MSS=1460 TSV=8641799 TSER=0 WS=6
  2   0.000309     10.0.1.2 -> 10.0.1.3     TCP 9040 > 44542 [SYN, ACK] Seq=0 Ack=1 Win=14480 Len=0 MSS=1460 TSV=8695691 TSER=8641799 WS=6
  3   0.000334     10.0.1.3 -> 10.0.1.2     TCP 44542 > 9040 [ACK] Seq=1 Ack=1 Win=5888 Len=0 TSV=8641799 TSER=8695691
52215   4.280970     10.0.1.3 -> 10.0.1.2     TCP 44542 > 9040 [FIN, ACK] Seq=12 Ack=50000002 Win=2580480 Len=0 TSV=8642869 TSER=8696711
52216   4.281224     10.0.1.2 -> 10.0.1.3     TCP 9040 > 44542 [ACK] Seq=50000002 Ack=13 Win=14528 Len=0 TSV=8696762 TSER=8642869
================================================================================
IPv4 Conversations
Filter:<No Filter>
                                               |       <-      | |       ->      | |     Total     |
                                               | Frames  Bytes | | Frames  Bytes | | Frames  Bytes |
10.0.1.3             <-> 10.0.1.2               34536  52279384   17680   1166899   52216  53446283
================================================================================
  1   0.000000     10.0.1.3 -> 10.0.1.2     TCP 44544 > 9040 [SYN] Seq=0 Win=5840 Len=0 MSS=1460 TSV=8645047 TSER=0 WS=6
  2   0.000309     10.0.1.2 -> 10.0.1.3     TCP 9040 > 44544 [SYN, ACK] Seq=0 Ack=1 Win=14480 Len=0 MSS=1460 TSV=8698939 TSER=8645047 WS=6
  3   0.000329     10.0.1.3 -> 10.0.1.2     TCP 44544 > 9040 [ACK] Seq=1 Ack=1 Win=5888 Len=0 TSV=8645047 TSER=8698939
52204   4.284076     10.0.1.3 -> 10.0.1.2     TCP 44544 > 9040 [FIN, ACK] Seq=12 Ack=50000002 Win=2580480 Len=0 TSV=8646118 TSER=8699957
52205   4.284326     10.0.1.2 -> 10.0.1.3     TCP 9040 > 44544 [ACK] Seq=50000002 Ack=13 Win=14528 Len=0 TSV=8700010 TSER=8646118
================================================================================
IPv4 Conversations
Filter:<No Filter>
                                               |       <-      | |       ->      | |     Total     |
                                               | Frames  Bytes | | Frames  Bytes | | Frames  Bytes |
10.0.1.3             <-> 10.0.1.2               34536  52279384   17669   1166173   52205  53445557
================================================================================
  1   0.000000     10.0.1.3 -> 10.0.1.2     TCP 44546 > 9040 [SYN] Seq=0 Win=5840 Len=0 MSS=1460 TSV=8648298 TSER=0 WS=6
  2   0.000286     10.0.1.2 -> 10.0.1.3     TCP 9040 > 44546 [SYN, ACK] Seq=0 Ack=1 Win=14480 Len=0 MSS=1460 TSV=8702191 TSER=8648298 WS=6
  3   0.000317     10.0.1.3 -> 10.0.1.2     TCP 44546 > 9040 [ACK] Seq=1 Ack=1 Win=5888 Len=0 TSV=8648298 TSER=8702191
52192   4.281477     10.0.1.3 -> 10.0.1.2     TCP 44546 > 9040 [FIN, ACK] Seq=12 Ack=50000002 Win=2580480 Len=0 TSV=8649369 TSER=8703212
52193   4.281727     10.0.1.2 -> 10.0.1.3     TCP 9040 > 44546 [ACK] Seq=50000002 Ack=13 Win=14528 Len=0 TSV=8703261 TSER=8649369
================================================================================
IPv4 Conversations
Filter:<No Filter>
                                               |       <-      | |       ->      | |     Total     |
                                               | Frames  Bytes | | Frames  Bytes | | Frames  Bytes |
10.0.1.3             <-> 10.0.1.2               34535  52279318   17658   1165447   52193  53444765
================================================================================
  1   0.000000     10.0.1.3 -> 10.0.1.2     TCP 44550 > 9040 [SYN] Seq=0 Win=5840 Len=0 MSS=1460 TSV=8651543 TSER=0 WS=6
  2   0.000306     10.0.1.2 -> 10.0.1.3     TCP 9040 > 44550 [SYN, ACK] Seq=0 Ack=1 Win=14480 Len=0 MSS=1460 TSV=8705436 TSER=8651543 WS=6
  3   0.000329     10.0.1.3 -> 10.0.1.2     TCP 44550 > 9040 [ACK] Seq=1 Ack=1 Win=5888 Len=0 TSV=8651543 TSER=8705436
52157   4.278058     10.0.1.3 -> 10.0.1.2     TCP 44550 > 9040 [FIN, ACK] Seq=12 Ack=50000002 Win=2580480 Len=0 TSV=8652612 TSER=8706450
52158   4.278310     10.0.1.2 -> 10.0.1.3     TCP 9040 > 44550 [ACK] Seq=50000002 Ack=13 Win=14528 Len=0 TSV=8706505 TSER=8652612
================================================================================
IPv4 Conversations
Filter:<No Filter>
                                               |       <-      | |       ->      | |     Total     |
                                               | Frames  Bytes | | Frames  Bytes | | Frames  Bytes |
10.0.1.3             <-> 10.0.1.2               34536  52279384   17622   1163071   52158  53442455
================================================================================
  1   0.000000     10.0.1.3 -> 10.0.1.2     TCP 44552 > 9040 [SYN] Seq=0 Win=5840 Len=0 MSS=1460 TSV=8654797 TSER=0 WS=6
  2   0.000282     10.0.1.2 -> 10.0.1.3     TCP 9040 > 44552 [SYN, ACK] Seq=0 Ack=1 Win=14480 Len=0 MSS=1460 TSV=8708691 TSER=8654797 WS=6
  3   0.000306     10.0.1.3 -> 10.0.1.2     TCP 44552 > 9040 [ACK] Seq=1 Ack=1 Win=5888 Len=0 TSV=8654797 TSER=8708691
52222   4.281818     10.0.1.3 -> 10.0.1.2     TCP 44552 > 9040 [FIN, ACK] Seq=12 Ack=50000002 Win=2580480 Len=0 TSV=8655868 TSER=8709706
52223   4.282076     10.0.1.2 -> 10.0.1.3     TCP 9040 > 44552 [ACK] Seq=50000002 Ack=13 Win=14528 Len=0 TSV=8709761 TSER=8655868
================================================================================
IPv4 Conversations
Filter:<No Filter>
                                               |       <-      | |       ->      | |     Total     |
                                               | Frames  Bytes | | Frames  Bytes | | Frames  Bytes |
10.0.1.3             <-> 10.0.1.2               34536  52279384   17687   1167361   52223  53446745
================================================================================
  1   0.000000     10.0.1.3 -> 10.0.1.2     TCP 44554 > 9040 [SYN] Seq=0 Win=5840 Len=0 MSS=1460 TSV=8658039 TSER=0 WS=6
  2   0.000281     10.0.1.2 -> 10.0.1.3     TCP 9040 > 44554 [SYN, ACK] Seq=0 Ack=1 Win=14480 Len=0 MSS=1460 TSV=8711933 TSER=8658039 WS=6
  3   0.000304     10.0.1.3 -> 10.0.1.2     TCP 44554 > 9040 [ACK] Seq=1 Ack=1 Win=5888 Len=0 TSV=8658039 TSER=8711933
52204   4.281466     10.0.1.3 -> 10.0.1.2     TCP 44554 > 9040 [FIN, ACK] Seq=12 Ack=50000002 Win=2580480 Len=0 TSV=8659110 TSER=8712948
52205   4.281723     10.0.1.2 -> 10.0.1.3     TCP 9040 > 44554 [ACK] Seq=50000002 Ack=13 Win=14528 Len=0 TSV=8713003 TSER=8659110
================================================================================
IPv4 Conversations
Filter:<No Filter>
                                               |       <-      | |       ->      | |     Total     |
                                               | Frames  Bytes | | Frames  Bytes | | Frames  Bytes |
10.0.1.3             <-> 10.0.1.2               34536  52279384   17669   1166173   52205  53445557
================================================================================
  1   0.000000     10.0.1.3 -> 10.0.1.2     TCP 44556 > 9040 [SYN] Seq=0 Win=5840 Len=0 MSS=1460 TSV=8661292 TSER=0 WS=6
  2   0.000279     10.0.1.2 -> 10.0.1.3     TCP 9040 > 44556 [SYN, ACK] Seq=0 Ack=1 Win=14480 Len=0 MSS=1460 TSV=8715186 TSER=8661292 WS=6
  3   0.000302     10.0.1.3 -> 10.0.1.2     TCP 44556 > 9040 [ACK] Seq=1 Ack=1 Win=5888 Len=0 TSV=8661292 TSER=8715186
52212   4.277128     10.0.1.3 -> 10.0.1.2     TCP 44556 > 9040 [FIN, ACK] Seq=12 Ack=50000002 Win=2580480 Len=0 TSV=8662362 TSER=8716206
52213   4.277373     10.0.1.2 -> 10.0.1.3     TCP 9040 > 44556 [ACK] Seq=50000002 Ack=13 Win=14528 Len=0 TSV=8716255 TSER=8662362
================================================================================
IPv4 Conversations
Filter:<No Filter>
                                               |       <-      | |       ->      | |     Total     |
                                               | Frames  Bytes | | Frames  Bytes | | Frames  Bytes |
10.0.1.3             <-> 10.0.1.2               34536  52279384   17677   1166701   52213  53446085
================================================================================
