49577   4.080092     10.0.1.3 -> 10.0.1.2     TCP 52138 > 9040 [FIN, ACK] Seq=1 Ack=47918914 Win=40320 Len=0 TSV=9891637 TSER=2306215
  1   0.000000     10.0.1.3 -> 10.0.1.2     TCP 52141 > 9040 [SYN] Seq=0 Win=5840 Len=0 MSS=1460 TSV=9894054 TSER=0 WS=6
  2   0.000294     10.0.1.2 -> 10.0.1.3     TCP 9040 > 52141 [SYN, ACK] Seq=0 Ack=1 Win=14480 Len=0 MSS=1460 TSV=2308688 TSER=9894054 WS=6
  3   0.000317     10.0.1.3 -> 10.0.1.2     TCP 52141 > 9040 [ACK] Seq=1 Ack=1 Win=5888 Len=0 TSV=9894055 TSER=2308688
51254   4.278088     10.0.1.3 -> 10.0.1.2     TCP 52141 > 9040 [FIN, ACK] Seq=12 Ack=50000002 Win=2580480 Len=0 TSV=9895124 TSER=2309702
51255   4.278331     10.0.1.2 -> 10.0.1.3     TCP 9040 > 52141 [ACK] Seq=50000002 Ack=13 Win=14528 Len=0 TSV=2309757 TSER=9895124
  1   0.000000     10.0.1.3 -> 10.0.1.2     TCP 52143 > 9040 [SYN] Seq=0 Win=5840 Len=0 MSS=1460 TSV=9897558 TSER=0 WS=6
  2   0.000270     10.0.1.2 -> 10.0.1.3     TCP 9040 > 52143 [SYN, ACK] Seq=0 Ack=1 Win=14480 Len=0 MSS=1460 TSV=2312191 TSER=9897558 WS=6
  3   0.000294     10.0.1.3 -> 10.0.1.2     TCP 52143 > 9040 [ACK] Seq=1 Ack=1 Win=5888 Len=0 TSV=9897558 TSER=2312191
51708   4.281788     10.0.1.3 -> 10.0.1.2     TCP 52143 > 9040 [FIN, ACK] Seq=12 Ack=50000002 Win=2580480 Len=0 TSV=9898628 TSER=2313207
51709   4.282041     10.0.1.2 -> 10.0.1.3     TCP 9040 > 52143 [ACK] Seq=50000002 Ack=13 Win=14528 Len=0 TSV=2313262 TSER=9898628
  1   0.000000     10.0.1.3 -> 10.0.1.2     TCP 39413 > 9040 [SYN] Seq=0 Win=5840 Len=0 MSS=1460 TSV=9901067 TSER=0 WS=6
  2   0.000310     10.0.1.2 -> 10.0.1.3     TCP 9040 > 39413 [SYN, ACK] Seq=0 Ack=1 Win=14480 Len=0 MSS=1460 TSV=2315701 TSER=9901067 WS=6
  3   0.000325     10.0.1.3 -> 10.0.1.2     TCP 39413 > 9040 [ACK] Seq=1 Ack=1 Win=5888 Len=0 TSV=9901067 TSER=2315701
51797   4.283270     10.0.1.3 -> 10.0.1.2     TCP 39413 > 9040 [FIN, ACK] Seq=12 Ack=50000002 Win=2580480 Len=0 TSV=9902138 TSER=2316717
51798   4.283515     10.0.1.2 -> 10.0.1.3     TCP 9040 > 39413 [ACK] Seq=50000002 Ack=13 Win=14528 Len=0 TSV=2316772 TSER=9902138
  1   0.000000     10.0.1.3 -> 10.0.1.2     TCP 39415 > 9040 [SYN] Seq=0 Win=5840 Len=0 MSS=1460 TSV=9904594 TSER=0 WS=6
  2   0.000293     10.0.1.2 -> 10.0.1.3     TCP 9040 > 39415 [SYN, ACK] Seq=0 Ack=1 Win=14480 Len=0 MSS=1460 TSV=2319228 TSER=9904594 WS=6
  3   0.000320     10.0.1.3 -> 10.0.1.2     TCP 39415 > 9040 [ACK] Seq=1 Ack=1 Win=5888 Len=0 TSV=9904594 TSER=2319228
51813   4.277511     10.0.1.3 -> 10.0.1.2     TCP 39415 > 9040 [FIN, ACK] Seq=12 Ack=50000002 Win=2580480 Len=0 TSV=9905664 TSER=2320243
51814   4.277758     10.0.1.2 -> 10.0.1.3     TCP 9040 > 39415 [ACK] Seq=50000002 Ack=13 Win=14528 Len=0 TSV=2320298 TSER=9905664
  1   0.000000     10.0.1.3 -> 10.0.1.2     TCP 39418 > 9040 [SYN] Seq=0 Win=5840 Len=0 MSS=1460 TSV=9908134 TSER=0 WS=6
  2   0.000286     10.0.1.2 -> 10.0.1.3     TCP 9040 > 39418 [SYN, ACK] Seq=0 Ack=1 Win=14480 Len=0 MSS=1460 TSV=2322768 TSER=9908134 WS=6
  3   0.000309     10.0.1.3 -> 10.0.1.2     TCP 39418 > 9040 [ACK] Seq=1 Ack=1 Win=5888 Len=0 TSV=9908134 TSER=2322768
51774   4.296608     10.0.1.3 -> 10.0.1.2     TCP 39418 > 9040 [FIN, ACK] Seq=12 Ack=50000002 Win=2580480 Len=0 TSV=9909208 TSER=2323791
51775   4.296824     10.0.1.2 -> 10.0.1.3     TCP 9040 > 39418 [ACK] Seq=50000002 Ack=13 Win=14528 Len=0 TSV=2323842 TSER=9909208
  1   0.000000     10.0.1.3 -> 10.0.1.2     TCP 39420 > 9040 [SYN] Seq=0 Win=5840 Len=0 MSS=1460 TSV=9911656 TSER=0 WS=6
  2   0.000298     10.0.1.2 -> 10.0.1.3     TCP 9040 > 39420 [SYN, ACK] Seq=0 Ack=1 Win=14480 Len=0 MSS=1460 TSV=2326290 TSER=9911656 WS=6
  3   0.000323     10.0.1.3 -> 10.0.1.2     TCP 39420 > 9040 [ACK] Seq=1 Ack=1 Win=5888 Len=0 TSV=9911656 TSER=2326290
51834   4.300610     10.0.1.3 -> 10.0.1.2     TCP 39420 > 9040 [FIN, ACK] Seq=12 Ack=50000002 Win=2580480 Len=0 TSV=9912731 TSER=2327310
51835   4.300867     10.0.1.2 -> 10.0.1.3     TCP 9040 > 39420 [ACK] Seq=50000002 Ack=13 Win=14528 Len=0 TSV=2327365 TSER=9912731
  1   0.000000     10.0.1.3 -> 10.0.1.2     TCP 39422 > 9040 [SYN] Seq=0 Win=5840 Len=0 MSS=1460 TSV=9915196 TSER=0 WS=6
  2   0.000368     10.0.1.2 -> 10.0.1.3     TCP 9040 > 39422 [SYN, ACK] Seq=0 Ack=1 Win=14480 Len=0 MSS=1460 TSV=2329831 TSER=9915196 WS=6
  3   0.000394     10.0.1.3 -> 10.0.1.2     TCP 39422 > 9040 [ACK] Seq=1 Ack=1 Win=5888 Len=0 TSV=9915196 TSER=2329831
51961   4.280071     10.0.1.3 -> 10.0.1.2     TCP 39422 > 9040 [FIN, ACK] Seq=12 Ack=50000002 Win=2580480 Len=0 TSV=9916266 TSER=2330847
51962   4.280313     10.0.1.2 -> 10.0.1.3     TCP 9040 > 39422 [ACK] Seq=50000002 Ack=13 Win=14528 Len=0 TSV=2330901 TSER=9916266
  1   0.000000     10.0.1.3 -> 10.0.1.2     TCP 39424 > 9040 [SYN] Seq=0 Win=5840 Len=0 MSS=1460 TSV=9918704 TSER=0 WS=6
  2   0.000321     10.0.1.2 -> 10.0.1.3     TCP 9040 > 39424 [SYN, ACK] Seq=0 Ack=1 Win=14480 Len=0 MSS=1460 TSV=2333339 TSER=9918704 WS=6
  3   0.000347     10.0.1.3 -> 10.0.1.2     TCP 39424 > 9040 [ACK] Seq=1 Ack=1 Win=5888 Len=0 TSV=9918704 TSER=2333339
51686   4.282471     10.0.1.3 -> 10.0.1.2     TCP 39424 > 9040 [FIN, ACK] Seq=12 Ack=50000002 Win=2580480 Len=0 TSV=9919775 TSER=2334355
51687   4.282741     10.0.1.2 -> 10.0.1.3     TCP 9040 > 39424 [ACK] Seq=50000002 Ack=13 Win=14528 Len=0 TSV=2334410 TSER=9919775
  1   0.000000     10.0.1.3 -> 10.0.1.2     TCP 39427 > 9040 [SYN] Seq=0 Win=5840 Len=0 MSS=1460 TSV=9922223 TSER=0 WS=6
  2   0.000284     10.0.1.2 -> 10.0.1.3     TCP 9040 > 39427 [SYN, ACK] Seq=0 Ack=1 Win=14480 Len=0 MSS=1460 TSV=2336858 TSER=9922223 WS=6
  3   0.000307     10.0.1.3 -> 10.0.1.2     TCP 39427 > 9040 [ACK] Seq=1 Ack=1 Win=5888 Len=0 TSV=9922223 TSER=2336858
51537   4.283375     10.0.1.3 -> 10.0.1.2     TCP 39427 > 9040 [FIN, ACK] Seq=12 Ack=50000002 Win=2580480 Len=0 TSV=9923294 TSER=2337876
51538   4.283623     10.0.1.2 -> 10.0.1.3     TCP 9040 > 39427 [ACK] Seq=50000002 Ack=13 Win=14528 Len=0 TSV=2337929 TSER=9923294
  1   0.000000     10.0.1.3 -> 10.0.1.2     TCP 39429 > 9040 [SYN] Seq=0 Win=5840 Len=0 MSS=1460 TSV=9925754 TSER=0 WS=6
  2   0.000276     10.0.1.2 -> 10.0.1.3     TCP 9040 > 39429 [SYN, ACK] Seq=0 Ack=1 Win=14480 Len=0 MSS=1460 TSV=2340389 TSER=9925754 WS=6
  3   0.000298     10.0.1.3 -> 10.0.1.2     TCP 39429 > 9040 [ACK] Seq=1 Ack=1 Win=5888 Len=0 TSV=9925754 TSER=2340389
51745   4.282041     10.0.1.3 -> 10.0.1.2     TCP 39429 > 9040 [FIN, ACK] Seq=12 Ack=50000002 Win=2580480 Len=0 TSV=9926824 TSER=2341405
51746   4.282288     10.0.1.2 -> 10.0.1.3     TCP 9040 > 39429 [ACK] Seq=50000002 Ack=13 Win=14528 Len=0 TSV=2341460 TSER=9926824
  1   0.000000     10.0.1.3 -> 10.0.1.2     TCP 39431 > 9040 [SYN] Seq=0 Win=5840 Len=0 MSS=1460 TSV=9929261 TSER=0 WS=6
  2   0.000304     10.0.1.2 -> 10.0.1.3     TCP 9040 > 39431 [SYN, ACK] Seq=0 Ack=1 Win=14480 Len=0 MSS=1460 TSV=2343897 TSER=9929261 WS=6
  3   0.000326     10.0.1.3 -> 10.0.1.2     TCP 39431 > 9040 [ACK] Seq=1 Ack=1 Win=5888 Len=0 TSV=9929261 TSER=2343897
51750   4.284687     10.0.1.3 -> 10.0.1.2     TCP 39431 > 9040 [FIN, ACK] Seq=12 Ack=50000002 Win=2580480 Len=0 TSV=9930332 TSER=2344913
51751   4.284928     10.0.1.2 -> 10.0.1.3     TCP 9040 > 39431 [ACK] Seq=50000002 Ack=13 Win=14528 Len=0 TSV=2344968 TSER=9930332
  1   0.000000     10.0.1.3 -> 10.0.1.2     TCP 39433 > 9040 [SYN] Seq=0 Win=5840 Len=0 MSS=1460 TSV=9932787 TSER=0 WS=6
  2   0.000309     10.0.1.2 -> 10.0.1.3     TCP 9040 > 39433 [SYN, ACK] Seq=0 Ack=1 Win=14480 Len=0 MSS=1460 TSV=2347423 TSER=9932787 WS=6
  3   0.000349     10.0.1.3 -> 10.0.1.2     TCP 39433 > 9040 [ACK] Seq=1 Ack=1 Win=5888 Len=0 TSV=9932787 TSER=2347423
51713   4.280962     10.0.1.3 -> 10.0.1.2     TCP 39433 > 9040 [FIN, ACK] Seq=12 Ack=50000002 Win=2580480 Len=0 TSV=9933857 TSER=2348438
51714   4.281214     10.0.1.2 -> 10.0.1.3     TCP 9040 > 39433 [ACK] Seq=50000002 Ack=13 Win=14528 Len=0 TSV=2348493 TSER=9933857
  1   0.000000     10.0.1.3 -> 10.0.1.2     TCP 39435 > 9040 [SYN] Seq=0 Win=5840 Len=0 MSS=1460 TSV=9936262 TSER=0 WS=6
  2   0.000256     10.0.1.2 -> 10.0.1.3     TCP 9040 > 39435 [SYN, ACK] Seq=0 Ack=1 Win=14480 Len=0 MSS=1460 TSV=2350898 TSER=9936262 WS=6
  3   0.000274     10.0.1.3 -> 10.0.1.2     TCP 39435 > 9040 [ACK] Seq=1 Ack=1 Win=5888 Len=0 TSV=9936262 TSER=2350898
51778   4.286188     10.0.1.3 -> 10.0.1.2     TCP 39435 > 9040 [FIN, ACK] Seq=12 Ack=50000002 Win=2580480 Len=0 TSV=9937333 TSER=2351915
51779   4.286438     10.0.1.2 -> 10.0.1.3     TCP 9040 > 39435 [ACK] Seq=50000002 Ack=13 Win=14528 Len=0 TSV=2351970 TSER=9937333
  1   0.000000     10.0.1.3 -> 10.0.1.2     TCP 39438 > 9040 [SYN] Seq=0 Win=5840 Len=0 MSS=1460 TSV=9939796 TSER=0 WS=6
  2   0.000266     10.0.1.2 -> 10.0.1.3     TCP 9040 > 39438 [SYN, ACK] Seq=0 Ack=1 Win=14480 Len=0 MSS=1460 TSV=2354432 TSER=9939796 WS=6
  3   0.000285     10.0.1.3 -> 10.0.1.2     TCP 39438 > 9040 [ACK] Seq=1 Ack=1 Win=5888 Len=0 TSV=9939796 TSER=2354432
51789   4.281475     10.0.1.3 -> 10.0.1.2     TCP 39438 > 9040 [FIN, ACK] Seq=12 Ack=50000002 Win=2580352 Len=0 TSV=9940866 TSER=2355448
51790   4.281722     10.0.1.2 -> 10.0.1.3     TCP 9040 > 39438 [ACK] Seq=50000002 Ack=13 Win=14528 Len=0 TSV=2355503 TSER=9940866
  1   0.000000     10.0.1.3 -> 10.0.1.2     TCP 39440 > 9040 [SYN] Seq=0 Win=5840 Len=0 MSS=1460 TSV=9943296 TSER=0 WS=6
  2   0.000311     10.0.1.2 -> 10.0.1.3     TCP 9040 > 39440 [SYN, ACK] Seq=0 Ack=1 Win=14480 Len=0 MSS=1460 TSV=2357933 TSER=9943296 WS=6
  3   0.000327     10.0.1.3 -> 10.0.1.2     TCP 39440 > 9040 [ACK] Seq=1 Ack=1 Win=5888 Len=0 TSV=9943296 TSER=2357933
51913   4.283188     10.0.1.3 -> 10.0.1.2     TCP 39440 > 9040 [FIN, ACK] Seq=12 Ack=50000002 Win=2580480 Len=0 TSV=9944367 TSER=2358949
51914   4.283446     10.0.1.2 -> 10.0.1.3     TCP 9040 > 39440 [ACK] Seq=50000002 Ack=13 Win=14528 Len=0 TSV=2359004 TSER=9944367
  1   0.000000     10.0.1.3 -> 10.0.1.2     TCP 39442 > 9040 [SYN] Seq=0 Win=5840 Len=0 MSS=1460 TSV=9946837 TSER=0 WS=6
  2   0.000269     10.0.1.2 -> 10.0.1.3     TCP 9040 > 39442 [SYN, ACK] Seq=0 Ack=1 Win=14480 Len=0 MSS=1460 TSV=2361474 TSER=9946837 WS=6
  3   0.000294     10.0.1.3 -> 10.0.1.2     TCP 39442 > 9040 [ACK] Seq=1 Ack=1 Win=5888 Len=0 TSV=9946837 TSER=2361474
51891   4.281913     10.0.1.3 -> 10.0.1.2     TCP 39442 > 9040 [FIN, ACK] Seq=12 Ack=50000002 Win=2580480 Len=0 TSV=9947907 TSER=2362492
51892   4.282162     10.0.1.2 -> 10.0.1.3     TCP 9040 > 39442 [ACK] Seq=50000002 Ack=13 Win=14528 Len=0 TSV=2362545 TSER=9947907
  1   0.000000     10.0.1.3 -> 10.0.1.2     TCP 39445 > 9040 [SYN] Seq=0 Win=5840 Len=0 MSS=1460 TSV=9950339 TSER=0 WS=6
  2   0.000300     10.0.1.2 -> 10.0.1.3     TCP 9040 > 39445 [SYN, ACK] Seq=0 Ack=1 Win=14480 Len=0 MSS=1460 TSV=2364977 TSER=9950339 WS=6
  3   0.000323     10.0.1.3 -> 10.0.1.2     TCP 39445 > 9040 [ACK] Seq=1 Ack=1 Win=5888 Len=0 TSV=9950339 TSER=2364977
51682   4.281503     10.0.1.3 -> 10.0.1.2     TCP 39445 > 9040 [FIN, ACK] Seq=12 Ack=50000002 Win=2580480 Len=0 TSV=9951410 TSER=2365992
51683   4.281759     10.0.1.2 -> 10.0.1.3     TCP 9040 > 39445 [ACK] Seq=50000002 Ack=13 Win=14528 Len=0 TSV=2366047 TSER=9951410
  1   0.000000     10.0.1.3 -> 10.0.1.2     TCP 39447 > 9040 [SYN] Seq=0 Win=5840 Len=0 MSS=1460 TSV=9953878 TSER=0 WS=6
  2   0.000319     10.0.1.2 -> 10.0.1.3     TCP 9040 > 39447 [SYN, ACK] Seq=0 Ack=1 Win=14480 Len=0 MSS=1460 TSV=2368516 TSER=9953878 WS=6
  3   0.000344     10.0.1.3 -> 10.0.1.2     TCP 39447 > 9040 [ACK] Seq=1 Ack=1 Win=5888 Len=0 TSV=9953878 TSER=2368516
51976   4.287530     10.0.1.3 -> 10.0.1.2     TCP 39447 > 9040 [FIN, ACK] Seq=12 Ack=50000002 Win=2580480 Len=0 TSV=9954950 TSER=2369533
51977   4.287781     10.0.1.2 -> 10.0.1.3     TCP 9040 > 39447 [ACK] Seq=50000002 Ack=13 Win=14528 Len=0 TSV=2369588 TSER=9954950
  1   0.000000     10.0.1.3 -> 10.0.1.2     TCP 39450 > 9040 [SYN] Seq=0 Win=5840 Len=0 MSS=1460 TSV=9957414 TSER=0 WS=6
  2   0.000299     10.0.1.2 -> 10.0.1.3     TCP 9040 > 39450 [SYN, ACK] Seq=0 Ack=1 Win=14480 Len=0 MSS=1460 TSV=2372052 TSER=9957414 WS=6
  3   0.000325     10.0.1.3 -> 10.0.1.2     TCP 39450 > 9040 [ACK] Seq=1 Ack=1 Win=5888 Len=0 TSV=9957414 TSER=2372052
51813   4.281321     10.0.1.3 -> 10.0.1.2     TCP 39450 > 9040 [FIN, ACK] Seq=12 Ack=50000002 Win=2580480 Len=0 TSV=9958485 TSER=2373068
51814   4.281575     10.0.1.2 -> 10.0.1.3     TCP 9040 > 39450 [ACK] Seq=50000002 Ack=13 Win=14528 Len=0 TSV=2373123 TSER=9958485
