  1   0.000000     10.0.1.3 -> 10.0.1.2     TCP 36332 > 9040 [SYN] Seq=0 Win=5840 Len=0 MSS=1460 TSV=7398477 TSER=0 WS=6
  2   0.000337     10.0.1.2 -> 10.0.1.3     TCP 9040 > 36332 [SYN, ACK] Seq=0 Ack=1 Win=14480 Len=0 MSS=1460 TSV=7383608 TSER=7398477 WS=6
  3   0.000360     10.0.1.3 -> 10.0.1.2     TCP 36332 > 9040 [ACK] Seq=1 Ack=1 Win=5888 Len=0 TSV=7398477 TSER=7383608
  7   0.002286     10.0.1.2 -> 10.0.1.3     TCP 9040 > 36332 [ACK] Seq=1 Ack=13 Win=14528 Len=0 TSV=7383608 TSER=7398477
518641  90.399829     10.0.1.3 -> 10.0.1.2     TCP 36332 > 9040 [FIN, ACK] Seq=13 Ack=500000002 Win=2026112 Len=0 TSV=7421077 TSER=7406188
518642  90.400085     10.0.1.2 -> 10.0.1.3     TCP 9040 > 36332 [ACK] Seq=500000002 Ack=14 Win=14528 Len=0 TSV=7406209 TSER=7421077
  1   0.000000     10.0.1.3 -> 10.0.1.2     TCP 37976 > 9040 [SYN] Seq=0 Win=5840 Len=0 MSS=1460 TSV=7428832 TSER=0 WS=6
  2   0.000324     10.0.1.2 -> 10.0.1.3     TCP 9040 > 37976 [SYN, ACK] Seq=0 Ack=1 Win=14480 Len=0 MSS=1460 TSV=7413965 TSER=7428832 WS=6
  3   0.000350     10.0.1.3 -> 10.0.1.2     TCP 37976 > 9040 [ACK] Seq=1 Ack=1 Win=5888 Len=0 TSV=7428832 TSER=7413965
  7   0.002331     10.0.1.2 -> 10.0.1.3     TCP 9040 > 37976 [ACK] Seq=1 Ack=13 Win=14528 Len=0 TSV=7413966 TSER=7428833
517559  91.355693     10.0.1.3 -> 10.0.1.2     TCP 37976 > 9040 [FIN, ACK] Seq=13 Ack=500000002 Win=2014528 Len=0 TSV=7451671 TSER=7436785
517560  91.355935     10.0.1.2 -> 10.0.1.3     TCP 9040 > 37976 [ACK] Seq=500000002 Ack=14 Win=14528 Len=0 TSV=7436806 TSER=7451671
  1   0.000000     10.0.1.3 -> 10.0.1.2     TCP 37978 > 9040 [SYN] Seq=0 Win=5840 Len=0 MSS=1460 TSV=7459711 TSER=0 WS=6
  2   0.000268     10.0.1.2 -> 10.0.1.3     TCP 9040 > 37978 [SYN, ACK] Seq=0 Ack=1 Win=14480 Len=0 MSS=1460 TSV=7444846 TSER=7459711 WS=6
  3   0.000293     10.0.1.3 -> 10.0.1.2     TCP 37978 > 9040 [ACK] Seq=1 Ack=1 Win=5888 Len=0 TSV=7459711 TSER=7444846
  7   0.002150     10.0.1.2 -> 10.0.1.3     TCP 9040 > 37978 [ACK] Seq=1 Ack=13 Win=14528 Len=0 TSV=7444847 TSER=7459711
518734  89.931677     10.0.1.3 -> 10.0.1.2     TCP 37978 > 9040 [FIN, ACK] Seq=13 Ack=500000002 Win=2014528 Len=0 TSV=7482194 TSER=7467310
518735  89.931931     10.0.1.2 -> 10.0.1.3     TCP 9040 > 37978 [ACK] Seq=500000002 Ack=14 Win=14528 Len=0 TSV=7467331 TSER=7482194
  1   0.000000     10.0.1.3 -> 10.0.1.2     TCP 37980 > 9040 [SYN] Seq=0 Win=5840 Len=0 MSS=1460 TSV=7490172 TSER=0 WS=6
  2   0.000325     10.0.1.2 -> 10.0.1.3     TCP 9040 > 37980 [SYN, ACK] Seq=0 Ack=1 Win=14480 Len=0 MSS=1460 TSV=7475310 TSER=7490172 WS=6
  3   0.000350     10.0.1.3 -> 10.0.1.2     TCP 37980 > 9040 [ACK] Seq=1 Ack=1 Win=5888 Len=0 TSV=7490173 TSER=7475310
  7   0.002253     10.0.1.2 -> 10.0.1.3     TCP 9040 > 37980 [ACK] Seq=1 Ack=13 Win=14528 Len=0 TSV=7475311 TSER=7490173
518875  92.099547     10.0.1.3 -> 10.0.1.2     TCP 37980 > 9040 [FIN, ACK] Seq=13 Ack=500000002 Win=2026112 Len=0 TSV=7513197 TSER=7498316
518876  92.099798     10.0.1.2 -> 10.0.1.3     TCP 9040 > 37980 [ACK] Seq=500000002 Ack=14 Win=14528 Len=0 TSV=7498337 TSER=7513197
  1   0.000000     10.0.1.3 -> 10.0.1.2     TCP 35361 > 9040 [SYN] Seq=0 Win=5840 Len=0 MSS=1460 TSV=7521129 TSER=0 WS=6
  2   0.000301     10.0.1.2 -> 10.0.1.3     TCP 9040 > 35361 [SYN, ACK] Seq=0 Ack=1 Win=14480 Len=0 MSS=1460 TSV=7506270 TSER=7521129 WS=6
  3   0.000323     10.0.1.3 -> 10.0.1.2     TCP 35361 > 9040 [ACK] Seq=1 Ack=1 Win=5888 Len=0 TSV=7521130 TSER=7506270
  7   0.002213     10.0.1.2 -> 10.0.1.3     TCP 9040 > 35361 [ACK] Seq=1 Ack=13 Win=14528 Len=0 TSV=7506270 TSER=7521130
506412  89.851445     10.0.1.3 -> 10.0.1.2     TCP 35361 > 9040 [FIN, ACK] Seq=13 Ack=500000002 Win=2020288 Len=0 TSV=7543592 TSER=7528713
506413  89.851691     10.0.1.2 -> 10.0.1.3     TCP 9040 > 35361 [ACK] Seq=500000002 Ack=14 Win=14528 Len=0 TSV=7528734 TSER=7543592
  1   0.000000     10.0.1.3 -> 10.0.1.2     TCP 35363 > 9040 [SYN] Seq=0 Win=5840 Len=0 MSS=1460 TSV=7551353 TSER=0 WS=6
  2   0.000337     10.0.1.2 -> 10.0.1.3     TCP 9040 > 35363 [SYN, ACK] Seq=0 Ack=1 Win=14480 Len=0 MSS=1460 TSV=7536496 TSER=7551353 WS=6
  3   0.000362     10.0.1.3 -> 10.0.1.2     TCP 35363 > 9040 [ACK] Seq=1 Ack=1 Win=5888 Len=0 TSV=7551353 TSER=7536496
  7   0.002355     10.0.1.2 -> 10.0.1.3     TCP 9040 > 35363 [ACK] Seq=1 Ack=13 Win=14528 Len=0 TSV=7536496 TSER=7551353
501985  90.767678     10.0.1.3 -> 10.0.1.2     TCP 35363 > 9040 [FIN, ACK] Seq=13 Ack=500000002 Win=2020288 Len=0 TSV=7574045 TSER=7559168
501986  90.767930     10.0.1.2 -> 10.0.1.3     TCP 9040 > 35363 [ACK] Seq=500000002 Ack=14 Win=14528 Len=0 TSV=7559189 TSER=7574045
  1   0.000000     10.0.1.3 -> 10.0.1.2     TCP 60882 > 9040 [SYN] Seq=0 Win=5840 Len=0 MSS=1460 TSV=7581813 TSER=0 WS=6
  2   0.000288     10.0.1.2 -> 10.0.1.3     TCP 9040 > 60882 [SYN, ACK] Seq=0 Ack=1 Win=14480 Len=0 MSS=1460 TSV=7566958 TSER=7581813 WS=6
  3   0.000310     10.0.1.3 -> 10.0.1.2     TCP 60882 > 9040 [ACK] Seq=1 Ack=1 Win=5888 Len=0 TSV=7581813 TSER=7566958
  7   0.002249     10.0.1.2 -> 10.0.1.3     TCP 9040 > 60882 [ACK] Seq=1 Ack=13 Win=14528 Len=0 TSV=7566959 TSER=7581814
518859  90.390351     10.0.1.3 -> 10.0.1.2     TCP 60882 > 9040 [FIN, ACK] Seq=13 Ack=500000002 Win=2017408 Len=0 TSV=7604411 TSER=7589536
518860  90.390604     10.0.1.2 -> 10.0.1.3     TCP 9040 > 60882 [ACK] Seq=500000002 Ack=14 Win=14528 Len=0 TSV=7589557 TSER=7604411
  1   0.000000     10.0.1.3 -> 10.0.1.2     TCP 60884 > 9040 [SYN] Seq=0 Win=5840 Len=0 MSS=1460 TSV=7612111 TSER=0 WS=6
  2   0.000351     10.0.1.2 -> 10.0.1.3     TCP 9040 > 60884 [SYN, ACK] Seq=0 Ack=1 Win=14480 Len=0 MSS=1460 TSV=7597258 TSER=7612111 WS=6
  3   0.000375     10.0.1.3 -> 10.0.1.2     TCP 60884 > 9040 [ACK] Seq=1 Ack=1 Win=5888 Len=0 TSV=7612111 TSER=7597258
  7   0.002407     10.0.1.2 -> 10.0.1.3     TCP 9040 > 60884 [ACK] Seq=1 Ack=13 Win=14528 Len=0 TSV=7597259 TSER=7612112
518580  89.467220     10.0.1.3 -> 10.0.1.2     TCP 60884 > 9040 [FIN, ACK] Seq=13 Ack=500000002 Win=2020288 Len=0 TSV=7634478 TSER=7619605
518581  89.467438     10.0.1.2 -> 10.0.1.3     TCP 9040 > 60884 [ACK] Seq=500000002 Ack=14 Win=14528 Len=0 TSV=7619627 TSER=7634478
  1   0.000000     10.0.1.3 -> 10.0.1.2     TCP 60886 > 9040 [SYN] Seq=0 Win=5840 Len=0 MSS=1460 TSV=7642428 TSER=0 WS=6
  2   0.000305     10.0.1.2 -> 10.0.1.3     TCP 9040 > 60886 [SYN, ACK] Seq=0 Ack=1 Win=14480 Len=0 MSS=1460 TSV=7627578 TSER=7642428 WS=6
  3   0.000330     10.0.1.3 -> 10.0.1.2     TCP 60886 > 9040 [ACK] Seq=1 Ack=1 Win=5888 Len=0 TSV=7642428 TSER=7627578
  7   0.002259     10.0.1.2 -> 10.0.1.3     TCP 9040 > 60886 [ACK] Seq=1 Ack=13 Win=14528 Len=0 TSV=7627578 TSER=7642429
513600  90.372547     10.0.1.3 -> 10.0.1.2     TCP 60886 > 9040 [FIN, ACK] Seq=13 Ack=500000002 Win=2026112 Len=0 TSV=7665021 TSER=7650151
513601  90.372793     10.0.1.2 -> 10.0.1.3     TCP 9040 > 60886 [ACK] Seq=500000002 Ack=14 Win=14528 Len=0 TSV=7650172 TSER=7665021
  1   0.000000     10.0.1.3 -> 10.0.1.2     TCP 53094 > 9040 [SYN] Seq=0 Win=5840 Len=0 MSS=1460 TSV=7672867 TSER=0 WS=6
  2   0.000324     10.0.1.2 -> 10.0.1.3     TCP 9040 > 53094 [SYN, ACK] Seq=0 Ack=1 Win=14480 Len=0 MSS=1460 TSV=7658019 TSER=7672867 WS=6
  3   0.000347     10.0.1.3 -> 10.0.1.2     TCP 53094 > 9040 [ACK] Seq=1 Ack=1 Win=5888 Len=0 TSV=7672867 TSER=7658019
  7   0.002243     10.0.1.2 -> 10.0.1.3     TCP 9040 > 53094 [ACK] Seq=1 Ack=13 Win=14528 Len=0 TSV=7658020 TSER=7672868
496769  90.980219     10.0.1.3 -> 10.0.1.2     TCP 53094 > 9040 [FIN, ACK] Seq=13 Ack=500000002 Win=2026112 Len=0 TSV=7695612 TSER=7680744
496770  90.980466     10.0.1.2 -> 10.0.1.3     TCP 9040 > 53094 [ACK] Seq=500000002 Ack=14 Win=14528 Len=0 TSV=7680766 TSER=7695612
  1   0.000000     10.0.1.3 -> 10.0.1.2     TCP 53096 > 9040 [SYN] Seq=0 Win=5840 Len=0 MSS=1460 TSV=7703307 TSER=0 WS=6
  2   0.000279     10.0.1.2 -> 10.0.1.3     TCP 9040 > 53096 [SYN, ACK] Seq=0 Ack=1 Win=14480 Len=0 MSS=1460 TSV=7688461 TSER=7703307 WS=6
  3   0.000302     10.0.1.3 -> 10.0.1.2     TCP 53096 > 9040 [ACK] Seq=1 Ack=1 Win=5888 Len=0 TSV=7703308 TSER=7688461
  7   0.002171     10.0.1.2 -> 10.0.1.3     TCP 9040 > 53096 [ACK] Seq=1 Ack=13 Win=14528 Len=0 TSV=7688462 TSER=7703308
517153  89.723703     10.0.1.3 -> 10.0.1.2     TCP 53096 > 9040 [FIN, ACK] Seq=13 Ack=500000002 Win=2020288 Len=0 TSV=7725738 TSER=7710873
517154  89.723955     10.0.1.2 -> 10.0.1.3     TCP 9040 > 53096 [ACK] Seq=500000002 Ack=14 Win=14528 Len=0 TSV=7710894 TSER=7725738
  1   0.000000     10.0.1.3 -> 10.0.1.2     TCP 37299 > 9040 [SYN] Seq=0 Win=5840 Len=0 MSS=1460 TSV=7733756 TSER=0 WS=6
  2   0.000303     10.0.1.2 -> 10.0.1.3     TCP 9040 > 37299 [SYN, ACK] Seq=0 Ack=1 Win=14480 Len=0 MSS=1460 TSV=7718913 TSER=7733756 WS=6
  3   0.000330     10.0.1.3 -> 10.0.1.2     TCP 37299 > 9040 [ACK] Seq=1 Ack=1 Win=5888 Len=0 TSV=7733757 TSER=7718913
  7   0.003873     10.0.1.2 -> 10.0.1.3     TCP 9040 > 37299 [ACK] Seq=1 Ack=13 Win=14528 Len=0 TSV=7718914 TSER=7733758
505208  90.797065     10.0.1.3 -> 10.0.1.2     TCP 37299 > 9040 [FIN, ACK] Seq=13 Ack=500000002 Win=2034752 Len=0 TSV=7756456 TSER=7741593
505209  90.797316     10.0.1.2 -> 10.0.1.3     TCP 9040 > 37299 [ACK] Seq=500000002 Ack=14 Win=14528 Len=0 TSV=7741614 TSER=7756456
  1   0.000000     10.0.1.3 -> 10.0.1.2     TCP 37301 > 9040 [SYN] Seq=0 Win=5840 Len=0 MSS=1460 TSV=7764242 TSER=0 WS=6
  2   0.000324     10.0.1.2 -> 10.0.1.3     TCP 9040 > 37301 [SYN, ACK] Seq=0 Ack=1 Win=14480 Len=0 MSS=1460 TSV=7749400 TSER=7764242 WS=6
  3   0.000348     10.0.1.3 -> 10.0.1.2     TCP 37301 > 9040 [ACK] Seq=1 Ack=1 Win=5888 Len=0 TSV=7764242 TSER=7749400
  7   0.002283     10.0.1.2 -> 10.0.1.3     TCP 9040 > 37301 [ACK] Seq=1 Ack=13 Win=14528 Len=0 TSV=7749401 TSER=7764242
518946  90.613431     10.0.1.3 -> 10.0.1.2     TCP 37301 > 9040 [FIN, ACK] Seq=13 Ack=500000002 Win=2020288 Len=0 TSV=7786895 TSER=7772034
518947  90.613648     10.0.1.2 -> 10.0.1.3     TCP 9040 > 37301 [ACK] Seq=500000002 Ack=14 Win=14528 Len=0 TSV=7772055 TSER=7786895
  1   0.000000     10.0.1.3 -> 10.0.1.2     TCP 37303 > 9040 [SYN] Seq=0 Win=5840 Len=0 MSS=1460 TSV=7794574 TSER=0 WS=6
  2   0.000312     10.0.1.2 -> 10.0.1.3     TCP 9040 > 37303 [SYN, ACK] Seq=0 Ack=1 Win=14480 Len=0 MSS=1460 TSV=7779735 TSER=7794574 WS=6
  3   0.000335     10.0.1.3 -> 10.0.1.2     TCP 37303 > 9040 [ACK] Seq=1 Ack=1 Win=5888 Len=0 TSV=7794574 TSER=7779735
  7   0.002251     10.0.1.2 -> 10.0.1.3     TCP 9040 > 37303 [ACK] Seq=1 Ack=13 Win=14528 Len=0 TSV=7779736 TSER=7794575
518654  89.406588     10.0.1.3 -> 10.0.1.2     TCP 37303 > 9040 [FIN, ACK] Seq=13 Ack=500000002 Win=2017408 Len=0 TSV=7816926 TSER=7802067
518655  89.406840     10.0.1.2 -> 10.0.1.3     TCP 9040 > 37303 [ACK] Seq=500000002 Ack=14 Win=14528 Len=0 TSV=7802089 TSER=7816926
  1   0.000000     10.0.1.3 -> 10.0.1.2     TCP 42135 > 9040 [SYN] Seq=0 Win=5840 Len=0 MSS=1460 TSV=7824780 TSER=0 WS=6
  2   0.000300     10.0.1.2 -> 10.0.1.3     TCP 9040 > 42135 [SYN, ACK] Seq=0 Ack=1 Win=14480 Len=0 MSS=1460 TSV=7809944 TSER=7824780 WS=6
  3   0.000323     10.0.1.3 -> 10.0.1.2     TCP 42135 > 9040 [ACK] Seq=1 Ack=1 Win=5888 Len=0 TSV=7824780 TSER=7809944
  7   0.002177     10.0.1.2 -> 10.0.1.3     TCP 9040 > 42135 [ACK] Seq=1 Ack=13 Win=14528 Len=0 TSV=7809944 TSER=7824781
487563  91.161085     10.0.1.3 -> 10.0.1.2     TCP 42135 > 9040 [FIN, ACK] Seq=13 Ack=500000002 Win=2026112 Len=0 TSV=7847571 TSER=7832714
487564  91.161325     10.0.1.2 -> 10.0.1.3     TCP 9040 > 42135 [ACK] Seq=500000002 Ack=14 Win=14528 Len=0 TSV=7832736 TSER=7847571
  1   0.000000     10.0.1.3 -> 10.0.1.2     TCP 42137 > 9040 [SYN] Seq=0 Win=5840 Len=0 MSS=1460 TSV=7855048 TSER=0 WS=6
  2   0.000270     10.0.1.2 -> 10.0.1.3     TCP 9040 > 42137 [SYN, ACK] Seq=0 Ack=1 Win=14480 Len=0 MSS=1460 TSV=7840213 TSER=7855048 WS=6
  3   0.000296     10.0.1.3 -> 10.0.1.2     TCP 42137 > 9040 [ACK] Seq=1 Ack=1 Win=5888 Len=0 TSV=7855048 TSER=7840213
  7   0.002152     10.0.1.2 -> 10.0.1.3     TCP 9040 > 42137 [ACK] Seq=1 Ack=13 Win=14528 Len=0 TSV=7840214 TSER=7855048
508783  91.123837     10.0.1.3 -> 10.0.1.2     TCP 42137 > 9040 [FIN, ACK] Seq=13 Ack=500000002 Win=2026112 Len=0 TSV=7877829 TSER=7862974
508784  91.124081     10.0.1.2 -> 10.0.1.3     TCP 9040 > 42137 [ACK] Seq=500000002 Ack=14 Win=14528 Len=0 TSV=7862996 TSER=7877829
  1   0.000000     10.0.1.3 -> 10.0.1.2     TCP 47138 > 9040 [SYN] Seq=0 Win=5840 Len=0 MSS=1460 TSV=7885711 TSER=0 WS=6
  2   0.000418     10.0.1.2 -> 10.0.1.3     TCP 9040 > 47138 [SYN, ACK] Seq=0 Ack=1 Win=14480 Len=0 MSS=1460 TSV=7870879 TSER=7885711 WS=6
  3   0.000441     10.0.1.3 -> 10.0.1.2     TCP 47138 > 9040 [ACK] Seq=1 Ack=1 Win=5888 Len=0 TSV=7885711 TSER=7870879
  7   0.002384     10.0.1.2 -> 10.0.1.3     TCP 9040 > 47138 [ACK] Seq=1 Ack=13 Win=14528 Len=0 TSV=7870879 TSER=7885712
518159  90.253920     10.0.1.3 -> 10.0.1.2     TCP 47138 > 9040 [FIN, ACK] Seq=13 Ack=500000002 Win=2023168 Len=0 TSV=7908275 TSER=7893423
518160  90.254165     10.0.1.2 -> 10.0.1.3     TCP 9040 > 47138 [ACK] Seq=500000002 Ack=14 Win=14528 Len=0 TSV=7893444 TSER=7908275
  1   0.000000     10.0.1.3 -> 10.0.1.2     TCP 47140 > 9040 [SYN] Seq=0 Win=5840 Len=0 MSS=1460 TSV=7916095 TSER=0 WS=6
  2   0.000329     10.0.1.2 -> 10.0.1.3     TCP 9040 > 47140 [SYN, ACK] Seq=0 Ack=1 Win=14480 Len=0 MSS=1460 TSV=7901265 TSER=7916095 WS=6
  3   0.000352     10.0.1.3 -> 10.0.1.2     TCP 47140 > 9040 [ACK] Seq=1 Ack=1 Win=5888 Len=0 TSV=7916095 TSER=7901265
  7   0.002321     10.0.1.2 -> 10.0.1.3     TCP 9040 > 47140 [ACK] Seq=1 Ack=13 Win=14528 Len=0 TSV=7901265 TSER=7916095
502689  90.780867     10.0.1.3 -> 10.0.1.2     TCP 47140 > 9040 [FIN, ACK] Seq=13 Ack=500000002 Win=2026112 Len=0 TSV=7938790 TSER=7923940
502690  90.781119     10.0.1.2 -> 10.0.1.3     TCP 9040 > 47140 [ACK] Seq=500000002 Ack=14 Win=14528 Len=0 TSV=7923962 TSER=7938790
  1   0.000000     10.0.1.3 -> 10.0.1.2     TCP 47142 > 9040 [SYN] Seq=0 Win=5840 Len=0 MSS=1460 TSV=7946439 TSER=0 WS=6
  2   0.000306     10.0.1.2 -> 10.0.1.3     TCP 9040 > 47142 [SYN, ACK] Seq=0 Ack=1 Win=14480 Len=0 MSS=1460 TSV=7931611 TSER=7946439 WS=6
  3   0.000332     10.0.1.3 -> 10.0.1.2     TCP 47142 > 9040 [ACK] Seq=1 Ack=1 Win=5888 Len=0 TSV=7946439 TSER=7931611
  7   0.002260     10.0.1.2 -> 10.0.1.3     TCP 9040 > 47142 [ACK] Seq=1 Ack=13 Win=14528 Len=0 TSV=7931612 TSER=7946440
518580  90.125779     10.0.1.3 -> 10.0.1.2     TCP 47142 > 9040 [FIN, ACK] Seq=13 Ack=500000002 Win=2026112 Len=0 TSV=7968971 TSER=7954123
518581  90.126038     10.0.1.2 -> 10.0.1.3     TCP 9040 > 47142 [ACK] Seq=500000002 Ack=14 Win=14528 Len=0 TSV=7954145 TSER=7968971
  1   0.000000     10.0.1.3 -> 10.0.1.2     TCP 47743 > 9040 [SYN] Seq=0 Win=5840 Len=0 MSS=1460 TSV=7976920 TSER=0 WS=6
  2   0.000292     10.0.1.2 -> 10.0.1.3     TCP 9040 > 47743 [SYN, ACK] Seq=0 Ack=1 Win=14480 Len=0 MSS=1460 TSV=7962095 TSER=7976920 WS=6
  3   0.000318     10.0.1.3 -> 10.0.1.2     TCP 47743 > 9040 [ACK] Seq=1 Ack=1 Win=5888 Len=0 TSV=7976920 TSER=7962095
  7   0.002230     10.0.1.2 -> 10.0.1.3     TCP 9040 > 47743 [ACK] Seq=1 Ack=13 Win=14528 Len=0 TSV=7962095 TSER=7976920
516785  91.354171     10.0.1.3 -> 10.0.1.2     TCP 47743 > 9040 [FIN, ACK] Seq=13 Ack=500000002 Win=2023168 Len=0 TSV=7999759 TSER=7984913
516786  91.354425     10.0.1.2 -> 10.0.1.3     TCP 9040 > 47743 [ACK] Seq=500000002 Ack=14 Win=14528 Len=0 TSV=7984935 TSER=7999759
