  1   0.000000     10.0.1.3 -> 10.0.1.2     TCP 57421 > 9040 [SYN] Seq=0 Win=5840 Len=0 MSS=1460 TSV=1855996 TSER=0 WS=6
  2   0.000305     10.0.1.2 -> 10.0.1.3     TCP 9040 > 57421 [SYN, ACK] Seq=0 Ack=1 Win=14480 Len=0 MSS=1460 TSV=1909375 TSER=1855996 WS=6
  3   0.000338     10.0.1.3 -> 10.0.1.2     TCP 57421 > 9040 [ACK] Seq=1 Ack=1 Win=5888 Len=0 TSV=1855996 TSER=1909375
155817  12.772506     10.0.1.3 -> 10.0.1.2     TCP 57421 > 9040 [FIN, ACK] Seq=9 Ack=150000001 Win=2580480 Len=0 TSV=1859189 TSER=1912514
155818  12.811926     10.0.1.2 -> 10.0.1.3     TCP 9040 > 57421 [ACK] Seq=150000001 Ack=10 Win=14528 Len=0 TSV=1912579 TSER=1859189
================================================================================
IPv4 Conversations
Filter:<No Filter>
                                               |       <-      | |       ->      | |     Total     |
                                               | Frames  Bytes | | Frames  Bytes | | Frames  Bytes |
10.0.1.3             <-> 10.0.1.2              103596 156837344   52222   3446668  155818 160284012
================================================================================
  1   0.000000     10.0.1.3 -> 10.0.1.2     TCP 57422 > 9040 [SYN] Seq=0 Win=5840 Len=0 MSS=1460 TSV=1861234 TSER=0 WS=6
  2   0.000310     10.0.1.2 -> 10.0.1.3     TCP 9040 > 57422 [SYN, ACK] Seq=0 Ack=1 Win=14480 Len=0 MSS=1460 TSV=1914614 TSER=1861234 WS=6
  3   0.000346     10.0.1.3 -> 10.0.1.2     TCP 57422 > 9040 [ACK] Seq=1 Ack=1 Win=5888 Len=0 TSV=1861235 TSER=1914614
155824  12.772492     10.0.1.3 -> 10.0.1.2     TCP 57422 > 9040 [FIN, ACK] Seq=9 Ack=150000001 Win=2580480 Len=0 TSV=1864428 TSER=1917753
155825  12.808737     10.0.1.2 -> 10.0.1.3     TCP 9040 > 57422 [ACK] Seq=150000001 Ack=10 Win=14528 Len=0 TSV=1917817 TSER=1864428
================================================================================
IPv4 Conversations
Filter:<No Filter>
                                               |       <-      | |       ->      | |     Total     |
                                               | Frames  Bytes | | Frames  Bytes | | Frames  Bytes |
10.0.1.3             <-> 10.0.1.2              103596 156837344   52229   3447130  155825 160284474
================================================================================
  1   0.000000     10.0.1.3 -> 10.0.1.2     TCP 57423 > 9040 [SYN] Seq=0 Win=5840 Len=0 MSS=1460 TSV=1866475 TSER=0 WS=6
  2   0.000280     10.0.1.2 -> 10.0.1.3     TCP 9040 > 57423 [SYN, ACK] Seq=0 Ack=1 Win=14480 Len=0 MSS=1460 TSV=1919855 TSER=1866475 WS=6
  3   0.000317     10.0.1.3 -> 10.0.1.2     TCP 57423 > 9040 [ACK] Seq=1 Ack=1 Win=5888 Len=0 TSV=1866475 TSER=1919855
155827  12.772398     10.0.1.3 -> 10.0.1.2     TCP 57423 > 9040 [FIN, ACK] Seq=9 Ack=150000001 Win=2580480 Len=0 TSV=1869668 TSER=1922993
155828  12.810888     10.0.1.2 -> 10.0.1.3     TCP 9040 > 57423 [ACK] Seq=150000001 Ack=10 Win=14528 Len=0 TSV=1923058 TSER=1869668
================================================================================
IPv4 Conversations
Filter:<No Filter>
                                               |       <-      | |       ->      | |     Total     |
                                               | Frames  Bytes | | Frames  Bytes | | Frames  Bytes |
10.0.1.3             <-> 10.0.1.2              103596 156837344   52232   3447328  155828 160284672
================================================================================
  1   0.000000     10.0.1.3 -> 10.0.1.2     TCP 57424 > 9040 [SYN] Seq=0 Win=5840 Len=0 MSS=1460 TSV=1871700 TSER=0 WS=6
  2   0.000307     10.0.1.2 -> 10.0.1.3     TCP 9040 > 57424 [SYN, ACK] Seq=0 Ack=1 Win=14480 Len=0 MSS=1460 TSV=1925081 TSER=1871700 WS=6
  3   0.000343     10.0.1.3 -> 10.0.1.2     TCP 57424 > 9040 [ACK] Seq=1 Ack=1 Win=5888 Len=0 TSV=1871700 TSER=1925081
155806  12.772484     10.0.1.3 -> 10.0.1.2     TCP 57424 > 9040 [FIN, ACK] Seq=9 Ack=150000001 Win=2580480 Len=0 TSV=1874894 TSER=1928221
155807  12.809255     10.0.1.2 -> 10.0.1.3     TCP 9040 > 57424 [ACK] Seq=150000001 Ack=10 Win=14528 Len=0 TSV=1928284 TSER=1874894
================================================================================
IPv4 Conversations
Filter:<No Filter>
                                               |       <-      | |       ->      | |     Total     |
                                               | Frames  Bytes | | Frames  Bytes | | Frames  Bytes |
10.0.1.3             <-> 10.0.1.2              103596 156837344   52211   3445942  155807 160283286
================================================================================
  1   0.000000     10.0.1.3 -> 10.0.1.2     TCP 35661 > 9040 [SYN] Seq=0 Win=5840 Len=0 MSS=1460 TSV=1876937 TSER=0 WS=6
  2   0.000327     10.0.1.2 -> 10.0.1.3     TCP 9040 > 35661 [SYN, ACK] Seq=0 Ack=1 Win=14480 Len=0 MSS=1460 TSV=1930318 TSER=1876937 WS=6
  3   0.000365     10.0.1.3 -> 10.0.1.2     TCP 35661 > 9040 [ACK] Seq=1 Ack=1 Win=5888 Len=0 TSV=1876937 TSER=1930318
155808  12.773269     10.0.1.3 -> 10.0.1.2     TCP 35661 > 9040 [FIN, ACK] Seq=9 Ack=150000001 Win=2580480 Len=0 TSV=1880130 TSER=1933457
155809  12.809825     10.0.1.2 -> 10.0.1.3     TCP 9040 > 35661 [ACK] Seq=150000001 Ack=10 Win=14528 Len=0 TSV=1933521 TSER=1880130
================================================================================
IPv4 Conversations
Filter:<No Filter>
                                               |       <-      | |       ->      | |     Total     |
                                               | Frames  Bytes | | Frames  Bytes | | Frames  Bytes |
10.0.1.3             <-> 10.0.1.2              103596 156837344   52213   3446074  155809 160283418
================================================================================
  1   0.000000     10.0.1.3 -> 10.0.1.2     TCP 35662 > 9040 [SYN] Seq=0 Win=5840 Len=0 MSS=1460 TSV=1882175 TSER=0 WS=6
  2   0.000281     10.0.1.2 -> 10.0.1.3     TCP 9040 > 35662 [SYN, ACK] Seq=0 Ack=1 Win=14480 Len=0 MSS=1460 TSV=1935556 TSER=1882175 WS=6
  3   0.000316     10.0.1.3 -> 10.0.1.2     TCP 35662 > 9040 [ACK] Seq=1 Ack=1 Win=5888 Len=0 TSV=1882175 TSER=1935556
155795  12.772437     10.0.1.3 -> 10.0.1.2     TCP 35662 > 9040 [FIN, ACK] Seq=9 Ack=150000001 Win=2580480 Len=0 TSV=1885368 TSER=1938696
155796  12.812650     10.0.1.2 -> 10.0.1.3     TCP 9040 > 35662 [ACK] Seq=150000001 Ack=10 Win=14528 Len=0 TSV=1938760 TSER=1885368
================================================================================
IPv4 Conversations
Filter:<No Filter>
                                               |       <-      | |       ->      | |     Total     |
                                               | Frames  Bytes | | Frames  Bytes | | Frames  Bytes |
10.0.1.3             <-> 10.0.1.2              103596 156837344   52200   3445216  155796 160282560
================================================================================
  1   0.000000     10.0.1.3 -> 10.0.1.2     TCP 35663 > 9040 [SYN] Seq=0 Win=5840 Len=0 MSS=1460 TSV=1887414 TSER=0 WS=6
  2   0.000321     10.0.1.2 -> 10.0.1.3     TCP 9040 > 35663 [SYN, ACK] Seq=0 Ack=1 Win=14480 Len=0 MSS=1460 TSV=1940796 TSER=1887414 WS=6
  3   0.000354     10.0.1.3 -> 10.0.1.2     TCP 35663 > 9040 [ACK] Seq=1 Ack=1 Win=5888 Len=0 TSV=1887414 TSER=1940796
155815  12.772619     10.0.1.3 -> 10.0.1.2     TCP 35663 > 9040 [FIN, ACK] Seq=9 Ack=150000001 Win=2580480 Len=0 TSV=1890607 TSER=1943935
155816  12.809899     10.0.1.2 -> 10.0.1.3     TCP 9040 > 35663 [ACK] Seq=150000001 Ack=10 Win=14528 Len=0 TSV=1943999 TSER=1890607
================================================================================
IPv4 Conversations
Filter:<No Filter>
                                               |       <-      | |       ->      | |     Total     |
                                               | Frames  Bytes | | Frames  Bytes | | Frames  Bytes |
10.0.1.3             <-> 10.0.1.2              103596 156837344   52220   3446536  155816 160283880
================================================================================
  1   0.000000     10.0.1.3 -> 10.0.1.2     TCP 35664 > 9040 [SYN] Seq=0 Win=5840 Len=0 MSS=1460 TSV=1892650 TSER=0 WS=6
  2   0.000326     10.0.1.2 -> 10.0.1.3     TCP 9040 > 35664 [SYN, ACK] Seq=0 Ack=1 Win=14480 Len=0 MSS=1460 TSV=1946032 TSER=1892650 WS=6
  3   0.000362     10.0.1.3 -> 10.0.1.2     TCP 35664 > 9040 [ACK] Seq=1 Ack=1 Win=5888 Len=0 TSV=1892650 TSER=1946032
155823  12.772520     10.0.1.3 -> 10.0.1.2     TCP 35664 > 9040 [FIN, ACK] Seq=9 Ack=150000001 Win=2580480 Len=0 TSV=1895843 TSER=1949170
155824  12.810703     10.0.1.2 -> 10.0.1.3     TCP 9040 > 35664 [ACK] Seq=150000001 Ack=10 Win=14528 Len=0 TSV=1949235 TSER=1895843
================================================================================
IPv4 Conversations
Filter:<No Filter>
                                               |       <-      | |       ->      | |     Total     |
                                               | Frames  Bytes | | Frames  Bytes | | Frames  Bytes |
10.0.1.3             <-> 10.0.1.2              103596 156837344   52228   3447064  155824 160284408
================================================================================
  1   0.000000     10.0.1.3 -> 10.0.1.2     TCP 35665 > 9040 [SYN] Seq=0 Win=5840 Len=0 MSS=1460 TSV=1897875 TSER=0 WS=6
  2   0.000304     10.0.1.2 -> 10.0.1.3     TCP 9040 > 35665 [SYN, ACK] Seq=0 Ack=1 Win=14480 Len=0 MSS=1460 TSV=1951258 TSER=1897875 WS=6
  3   0.000340     10.0.1.3 -> 10.0.1.2     TCP 35665 > 9040 [ACK] Seq=1 Ack=1 Win=5888 Len=0 TSV=1897876 TSER=1951258
155830  12.772478     10.0.1.3 -> 10.0.1.2     TCP 35665 > 9040 [FIN, ACK] Seq=9 Ack=150000001 Win=2580480 Len=0 TSV=1901069 TSER=1954398
155831  12.809692     10.0.1.2 -> 10.0.1.3     TCP 9040 > 35665 [ACK] Seq=150000001 Ack=10 Win=14528 Len=0 TSV=1954461 TSER=1901069
================================================================================
IPv4 Conversations
Filter:<No Filter>
                                               |       <-      | |       ->      | |     Total     |
                                               | Frames  Bytes | | Frames  Bytes | | Frames  Bytes |
10.0.1.3             <-> 10.0.1.2              103596 156837344   52235   3447526  155831 160284870
================================================================================
  1   0.000000     10.0.1.3 -> 10.0.1.2     TCP 35666 > 9040 [SYN] Seq=0 Win=5840 Len=0 MSS=1460 TSV=1903124 TSER=0 WS=6
  2   0.000325     10.0.1.2 -> 10.0.1.3     TCP 9040 > 35666 [SYN, ACK] Seq=0 Ack=1 Win=14480 Len=0 MSS=1460 TSV=1956506 TSER=1903124 WS=6
  3   0.000361     10.0.1.3 -> 10.0.1.2     TCP 35666 > 9040 [ACK] Seq=1 Ack=1 Win=5888 Len=0 TSV=1903124 TSER=1956506
155820  12.772550     10.0.1.3 -> 10.0.1.2     TCP 35666 > 9040 [FIN, ACK] Seq=9 Ack=150000001 Win=2580480 Len=0 TSV=1906317 TSER=1959645
155821  12.811634     10.0.1.2 -> 10.0.1.3     TCP 9040 > 35666 [ACK] Seq=150000001 Ack=10 Win=14528 Len=0 TSV=1959710 TSER=1906317
================================================================================
IPv4 Conversations
Filter:<No Filter>
                                               |       <-      | |       ->      | |     Total     |
                                               | Frames  Bytes | | Frames  Bytes | | Frames  Bytes |
10.0.1.3             <-> 10.0.1.2              103596 156837344   52225   3446866  155821 160284210
================================================================================
  1   0.000000     10.0.1.3 -> 10.0.1.2     TCP 35667 > 9040 [SYN] Seq=0 Win=5840 Len=0 MSS=1460 TSV=1908356 TSER=0 WS=6
  2   0.000279     10.0.1.2 -> 10.0.1.3     TCP 9040 > 35667 [SYN, ACK] Seq=0 Ack=1 Win=14480 Len=0 MSS=1460 TSV=1961739 TSER=1908356 WS=6
  3   0.000312     10.0.1.3 -> 10.0.1.2     TCP 35667 > 9040 [ACK] Seq=1 Ack=1 Win=5888 Len=0 TSV=1908356 TSER=1961739
155798  12.772463     10.0.1.3 -> 10.0.1.2     TCP 35667 > 9040 [FIN, ACK] Seq=9 Ack=150000001 Win=2580480 Len=0 TSV=1911549 TSER=1964878
155799  12.810172     10.0.1.2 -> 10.0.1.3     TCP 9040 > 35667 [ACK] Seq=150000001 Ack=10 Win=14528 Len=0 TSV=1964942 TSER=1911549
================================================================================
IPv4 Conversations
Filter:<No Filter>
                                               |       <-      | |       ->      | |     Total     |
                                               | Frames  Bytes | | Frames  Bytes | | Frames  Bytes |
10.0.1.3             <-> 10.0.1.2              103596 156837344   52203   3445414  155799 160282758
================================================================================
  1   0.000000     10.0.1.3 -> 10.0.1.2     TCP 35668 > 9040 [SYN] Seq=0 Win=5840 Len=0 MSS=1460 TSV=1913597 TSER=0 WS=6
  2   0.000323     10.0.1.2 -> 10.0.1.3     TCP 9040 > 35668 [SYN, ACK] Seq=0 Ack=1 Win=14480 Len=0 MSS=1460 TSV=1966981 TSER=1913597 WS=6
  3   0.000354     10.0.1.3 -> 10.0.1.2     TCP 35668 > 9040 [ACK] Seq=1 Ack=1 Win=5888 Len=0 TSV=1913598 TSER=1966981
155804  12.773197     10.0.1.3 -> 10.0.1.2     TCP 35668 > 9040 [FIN, ACK] Seq=9 Ack=150000001 Win=2580480 Len=0 TSV=1916791 TSER=1970121
155805  12.812807     10.0.1.2 -> 10.0.1.3     TCP 9040 > 35668 [ACK] Seq=150000001 Ack=10 Win=14528 Len=0 TSV=1970185 TSER=1916791
================================================================================
IPv4 Conversations
Filter:<No Filter>
                                               |       <-      | |       ->      | |     Total     |
                                               | Frames  Bytes | | Frames  Bytes | | Frames  Bytes |
10.0.1.3             <-> 10.0.1.2              103596 156837344   52209   3445810  155805 160283154
================================================================================
  1   0.000000     10.0.1.3 -> 10.0.1.2     TCP 35670 > 9040 [SYN] Seq=0 Win=5840 Len=0 MSS=1460 TSV=1918848 TSER=0 WS=6
  2   0.000323     10.0.1.2 -> 10.0.1.3     TCP 9040 > 35670 [SYN, ACK] Seq=0 Ack=1 Win=14480 Len=0 MSS=1460 TSV=1972232 TSER=1918848 WS=6
  3   0.000356     10.0.1.3 -> 10.0.1.2     TCP 35670 > 9040 [ACK] Seq=1 Ack=1 Win=5888 Len=0 TSV=1918848 TSER=1972232
155792  12.772517     10.0.1.3 -> 10.0.1.2     TCP 35670 > 9040 [FIN, ACK] Seq=9 Ack=150000001 Win=2580480 Len=0 TSV=1922041 TSER=1975372
155793  12.812001     10.0.1.2 -> 10.0.1.3     TCP 9040 > 35670 [ACK] Seq=150000001 Ack=10 Win=14528 Len=0 TSV=1975436 TSER=1922041
================================================================================
IPv4 Conversations
Filter:<No Filter>
                                               |       <-      | |       ->      | |     Total     |
                                               | Frames  Bytes | | Frames  Bytes | | Frames  Bytes |
10.0.1.3             <-> 10.0.1.2              103596 156837344   52197   3445018  155793 160282362
================================================================================
  1   0.000000     10.0.1.3 -> 10.0.1.2     TCP 35671 > 9040 [SYN] Seq=0 Win=5840 Len=0 MSS=1460 TSV=1924076 TSER=0 WS=6
  2   0.000310     10.0.1.2 -> 10.0.1.3     TCP 9040 > 35671 [SYN, ACK] Seq=0 Ack=1 Win=14480 Len=0 MSS=1460 TSV=1977461 TSER=1924076 WS=6
  3   0.000345     10.0.1.3 -> 10.0.1.2     TCP 35671 > 9040 [ACK] Seq=1 Ack=1 Win=5888 Len=0 TSV=1924077 TSER=1977461
155808  12.772478     10.0.1.3 -> 10.0.1.2     TCP 35671 > 9040 [FIN, ACK] Seq=9 Ack=150000001 Win=2580480 Len=0 TSV=1927270 TSER=1980601
155809  12.809739     10.0.1.2 -> 10.0.1.3     TCP 9040 > 35671 [ACK] Seq=150000001 Ack=10 Win=14528 Len=0 TSV=1980664 TSER=1927270
================================================================================
IPv4 Conversations
Filter:<No Filter>
                                               |       <-      | |       ->      | |     Total     |
                                               | Frames  Bytes | | Frames  Bytes | | Frames  Bytes |
10.0.1.3             <-> 10.0.1.2              103596 156837344   52213   3446074  155809 160283418
================================================================================
  1   0.000000     10.0.1.3 -> 10.0.1.2     TCP 35672 > 9040 [SYN] Seq=0 Win=5840 Len=0 MSS=1460 TSV=1929318 TSER=0 WS=6
  2   0.000324     10.0.1.2 -> 10.0.1.3     TCP 9040 > 35672 [SYN, ACK] Seq=0 Ack=1 Win=14480 Len=0 MSS=1460 TSV=1982703 TSER=1929318 WS=6
  3   0.000355     10.0.1.3 -> 10.0.1.2     TCP 35672 > 9040 [ACK] Seq=1 Ack=1 Win=5888 Len=0 TSV=1929318 TSER=1982703
155783  12.772468     10.0.1.3 -> 10.0.1.2     TCP 35672 > 9040 [FIN, ACK] Seq=9 Ack=150000001 Win=2580480 Len=0 TSV=1932511 TSER=1985842
155784  12.809232     10.0.1.2 -> 10.0.1.3     TCP 9040 > 35672 [ACK] Seq=150000001 Ack=10 Win=14528 Len=0 TSV=1985906 TSER=1932511
================================================================================
IPv4 Conversations
Filter:<No Filter>
                                               |       <-      | |       ->      | |     Total     |
                                               | Frames  Bytes | | Frames  Bytes | | Frames  Bytes |
10.0.1.3             <-> 10.0.1.2              103596 156837344   52188   3444424  155784 160281768
================================================================================
  1   0.000000     10.0.1.3 -> 10.0.1.2     TCP 35673 > 9040 [SYN] Seq=0 Win=5840 Len=0 MSS=1460 TSV=1934556 TSER=0 WS=6
  2   0.000326     10.0.1.2 -> 10.0.1.3     TCP 9040 > 35673 [SYN, ACK] Seq=0 Ack=1 Win=14480 Len=0 MSS=1460 TSV=1987942 TSER=1934556 WS=6
  3   0.000362     10.0.1.3 -> 10.0.1.2     TCP 35673 > 9040 [ACK] Seq=1 Ack=1 Win=5888 Len=0 TSV=1934556 TSER=1987942
155816  12.772465     10.0.1.3 -> 10.0.1.2     TCP 35673 > 9040 [FIN, ACK] Seq=9 Ack=150000001 Win=2580480 Len=0 TSV=1937750 TSER=1991081
155817  12.810240     10.0.1.2 -> 10.0.1.3     TCP 9040 > 35673 [ACK] Seq=150000001 Ack=10 Win=14528 Len=0 TSV=1991145 TSER=1937750
================================================================================
IPv4 Conversations
Filter:<No Filter>
                                               |       <-      | |       ->      | |     Total     |
                                               | Frames  Bytes | | Frames  Bytes | | Frames  Bytes |
10.0.1.3             <-> 10.0.1.2              103596 156837344   52221   3446602  155817 160283946
================================================================================
  1   0.000000     10.0.1.3 -> 10.0.1.2     TCP 35674 > 9040 [SYN] Seq=0 Win=5840 Len=0 MSS=1460 TSV=1939804 TSER=0 WS=6
  2   0.000285     10.0.1.2 -> 10.0.1.3     TCP 9040 > 35674 [SYN, ACK] Seq=0 Ack=1 Win=14480 Len=0 MSS=1460 TSV=1993190 TSER=1939804 WS=6
  3   0.000320     10.0.1.3 -> 10.0.1.2     TCP 35674 > 9040 [ACK] Seq=1 Ack=1 Win=5888 Len=0 TSV=1939804 TSER=1993190
155828  12.772400     10.0.1.3 -> 10.0.1.2     TCP 35674 > 9040 [FIN, ACK] Seq=9 Ack=150000001 Win=2580480 Len=0 TSV=1942997 TSER=1996329
155829  12.810044     10.0.1.2 -> 10.0.1.3     TCP 9040 > 35674 [ACK] Seq=150000001 Ack=10 Win=14528 Len=0 TSV=1996393 TSER=1942997
================================================================================
IPv4 Conversations
Filter:<No Filter>
                                               |       <-      | |       ->      | |     Total     |
                                               | Frames  Bytes | | Frames  Bytes | | Frames  Bytes |
10.0.1.3             <-> 10.0.1.2              103596 156837344   52233   3447394  155829 160284738
================================================================================
  1   0.000000     10.0.1.3 -> 10.0.1.2     TCP 35675 > 9040 [SYN] Seq=0 Win=5840 Len=0 MSS=1460 TSV=1945033 TSER=0 WS=6
  2   0.000280     10.0.1.2 -> 10.0.1.3     TCP 9040 > 35675 [SYN, ACK] Seq=0 Ack=1 Win=14480 Len=0 MSS=1460 TSV=1998419 TSER=1945033 WS=6
  3   0.000313     10.0.1.3 -> 10.0.1.2     TCP 35675 > 9040 [ACK] Seq=1 Ack=1 Win=5888 Len=0 TSV=1945033 TSER=1998419
155833  12.772465     10.0.1.3 -> 10.0.1.2     TCP 35675 > 9040 [FIN, ACK] Seq=9 Ack=150000001 Win=2574592 Len=0 TSV=1948226 TSER=2001559
155834  12.812430     10.0.1.2 -> 10.0.1.3     TCP 9040 > 35675 [ACK] Seq=150000001 Ack=10 Win=14528 Len=0 TSV=2001623 TSER=1948226
================================================================================
IPv4 Conversations
Filter:<No Filter>
                                               |       <-      | |       ->      | |     Total     |
                                               | Frames  Bytes | | Frames  Bytes | | Frames  Bytes |
10.0.1.3             <-> 10.0.1.2              103596 156837344   52238   3447724  155834 160285068
================================================================================
  1   0.000000     10.0.1.3 -> 10.0.1.2     TCP 44459 > 9040 [SYN] Seq=0 Win=5840 Len=0 MSS=1460 TSV=1950270 TSER=0 WS=6
  2   0.000298     10.0.1.2 -> 10.0.1.3     TCP 9040 > 44459 [SYN, ACK] Seq=0 Ack=1 Win=14480 Len=0 MSS=1460 TSV=2003656 TSER=1950270 WS=6
  3   0.000332     10.0.1.3 -> 10.0.1.2     TCP 44459 > 9040 [ACK] Seq=1 Ack=1 Win=5888 Len=0 TSV=1950270 TSER=2003656
155833  12.773107     10.0.1.3 -> 10.0.1.2     TCP 44459 > 9040 [FIN, ACK] Seq=9 Ack=150000001 Win=2580480 Len=0 TSV=1953463 TSER=2006796
155834  12.811993     10.0.1.2 -> 10.0.1.3     TCP 9040 > 44459 [ACK] Seq=150000001 Ack=10 Win=14528 Len=0 TSV=2006860 TSER=1953463
================================================================================
IPv4 Conversations
Filter:<No Filter>
                                               |       <-      | |       ->      | |     Total     |
                                               | Frames  Bytes | | Frames  Bytes | | Frames  Bytes |
10.0.1.3             <-> 10.0.1.2              103596 156837344   52238   3447724  155834 160285068
================================================================================
  1   0.000000     10.0.1.3 -> 10.0.1.2     TCP 44460 > 9040 [SYN] Seq=0 Win=5840 Len=0 MSS=1460 TSV=1955509 TSER=0 WS=6
  2   0.000324     10.0.1.2 -> 10.0.1.3     TCP 9040 > 44460 [SYN, ACK] Seq=0 Ack=1 Win=14480 Len=0 MSS=1460 TSV=2008896 TSER=1955509 WS=6
  3   0.000357     10.0.1.3 -> 10.0.1.2     TCP 44460 > 9040 [ACK] Seq=1 Ack=1 Win=5888 Len=0 TSV=1955509 TSER=2008896
155828  12.772534     10.0.1.3 -> 10.0.1.2     TCP 44460 > 9040 [FIN, ACK] Seq=9 Ack=150000001 Win=2580480 Len=0 TSV=1958702 TSER=2012034
155829  12.810032     10.0.1.2 -> 10.0.1.3     TCP 9040 > 44460 [ACK] Seq=150000001 Ack=10 Win=14528 Len=0 TSV=2012099 TSER=1958702
================================================================================
IPv4 Conversations
Filter:<No Filter>
                                               |       <-      | |       ->      | |     Total     |
                                               | Frames  Bytes | | Frames  Bytes | | Frames  Bytes |
10.0.1.3             <-> 10.0.1.2              103596 156837344   52233   3447394  155829 160284738
================================================================================
