  1   0.000000     10.0.1.3 -> 10.0.1.2     TCP 58610 > 9040 [SYN] Seq=0 Win=5840 Len=0 MSS=1460 TSV=1779104 TSER=0 WS=6
  2   0.000308     10.0.1.2 -> 10.0.1.3     TCP 9040 > 58610 [SYN, ACK] Seq=0 Ack=1 Win=14480 Len=0 MSS=1460 TSV=1832477 TSER=1779104 WS=6
  3   0.000342     10.0.1.3 -> 10.0.1.2     TCP 58610 > 9040 [ACK] Seq=1 Ack=1 Win=5888 Len=0 TSV=1779104 TSER=1832477
104033   8.515561     10.0.1.3 -> 10.0.1.2     TCP 58610 > 9040 [FIN, ACK] Seq=9 Ack=100000001 Win=2580480 Len=0 TSV=1781232 TSER=1834552
104034   8.553681     10.0.1.2 -> 10.0.1.3     TCP 9040 > 58610 [ACK] Seq=100000001 Ack=10 Win=14528 Len=0 TSV=1834616 TSER=1781232
================================================================================
IPv4 Conversations
Filter:<No Filter>
                                               |       <-      | |       ->      | |     Total     |
                                               | Frames  Bytes | | Frames  Bytes | | Frames  Bytes |
10.0.1.3             <-> 10.0.1.2               69065 104558298   34969   2307970  104034 106866268
================================================================================
  1   0.000000     10.0.1.3 -> 10.0.1.2     TCP 58611 > 9040 [SYN] Seq=0 Win=5840 Len=0 MSS=1460 TSV=1782944 TSER=0 WS=6
  2   0.000325     10.0.1.2 -> 10.0.1.3     TCP 9040 > 58611 [SYN, ACK] Seq=0 Ack=1 Win=14480 Len=0 MSS=1460 TSV=1836317 TSER=1782944 WS=6
  3   0.000361     10.0.1.3 -> 10.0.1.2     TCP 58611 > 9040 [ACK] Seq=1 Ack=1 Win=5888 Len=0 TSV=1782944 TSER=1836317
104029   8.515660     10.0.1.3 -> 10.0.1.2     TCP 58611 > 9040 [FIN, ACK] Seq=9 Ack=100000001 Win=2580480 Len=0 TSV=1785072 TSER=1838393
104030   8.552363     10.0.1.2 -> 10.0.1.3     TCP 9040 > 58611 [ACK] Seq=100000001 Ack=10 Win=14528 Len=0 TSV=1838456 TSER=1785072
================================================================================
IPv4 Conversations
Filter:<No Filter>
                                               |       <-      | |       ->      | |     Total     |
                                               | Frames  Bytes | | Frames  Bytes | | Frames  Bytes |
10.0.1.3             <-> 10.0.1.2               69065 104558298   34965   2307706  104030 106866004
================================================================================
  1   0.000000     10.0.1.3 -> 10.0.1.2     TCP 58612 > 9040 [SYN] Seq=0 Win=5840 Len=0 MSS=1460 TSV=1786791 TSER=0 WS=6
  2   0.000281     10.0.1.2 -> 10.0.1.3     TCP 9040 > 58612 [SYN, ACK] Seq=0 Ack=1 Win=14480 Len=0 MSS=1460 TSV=1840165 TSER=1786791 WS=6
  3   0.000314     10.0.1.3 -> 10.0.1.2     TCP 58612 > 9040 [ACK] Seq=1 Ack=1 Win=5888 Len=0 TSV=1786791 TSER=1840165
104033   8.515578     10.0.1.3 -> 10.0.1.2     TCP 58612 > 9040 [FIN, ACK] Seq=9 Ack=100000001 Win=2580480 Len=0 TSV=1788920 TSER=1842240
104034   8.552368     10.0.1.2 -> 10.0.1.3     TCP 9040 > 58612 [ACK] Seq=100000001 Ack=10 Win=14528 Len=0 TSV=1842304 TSER=1788920
================================================================================
IPv4 Conversations
Filter:<No Filter>
                                               |       <-      | |       ->      | |     Total     |
                                               | Frames  Bytes | | Frames  Bytes | | Frames  Bytes |
10.0.1.3             <-> 10.0.1.2               69065 104558298   34969   2307970  104034 106866268
================================================================================
  1   0.000000     10.0.1.3 -> 10.0.1.2     TCP 58613 > 9040 [SYN] Seq=0 Win=5840 Len=0 MSS=1460 TSV=1790627 TSER=0 WS=6
  2   0.000326     10.0.1.2 -> 10.0.1.3     TCP 9040 > 58613 [SYN, ACK] Seq=0 Ack=1 Win=14480 Len=0 MSS=1460 TSV=1844001 TSER=1790627 WS=6
  3   0.000363     10.0.1.3 -> 10.0.1.2     TCP 58613 > 9040 [ACK] Seq=1 Ack=1 Win=5888 Len=0 TSV=1790627 TSER=1844001
103967   8.515584     10.0.1.3 -> 10.0.1.2     TCP 58613 > 9040 [FIN, ACK] Seq=9 Ack=100000001 Win=2580480 Len=0 TSV=1792756 TSER=1846075
103968   8.553519     10.0.1.2 -> 10.0.1.3     TCP 9040 > 58613 [ACK] Seq=100000001 Ack=10 Win=14528 Len=0 TSV=1846140 TSER=1792756
================================================================================
IPv4 Conversations
Filter:<No Filter>
                                               |       <-      | |       ->      | |     Total     |
                                               | Frames  Bytes | | Frames  Bytes | | Frames  Bytes |
10.0.1.3             <-> 10.0.1.2               69065 104558298   34903   2303614  103968 106861912
================================================================================
  1   0.000000     10.0.1.3 -> 10.0.1.2     TCP 58614 > 9040 [SYN] Seq=0 Win=5840 Len=0 MSS=1460 TSV=1794470 TSER=0 WS=6
  2   0.000324     10.0.1.2 -> 10.0.1.3     TCP 9040 > 58614 [SYN, ACK] Seq=0 Ack=1 Win=14480 Len=0 MSS=1460 TSV=1847845 TSER=1794470 WS=6
  3   0.000358     10.0.1.3 -> 10.0.1.2     TCP 58614 > 9040 [ACK] Seq=1 Ack=1 Win=5888 Len=0 TSV=1794470 TSER=1847845
104019   8.515595     10.0.1.3 -> 10.0.1.2     TCP 58614 > 9040 [FIN, ACK] Seq=9 Ack=100000001 Win=2580480 Len=0 TSV=1796599 TSER=1849919
104020   8.555234     10.0.1.2 -> 10.0.1.3     TCP 9040 > 58614 [ACK] Seq=100000001 Ack=10 Win=14528 Len=0 TSV=1849984 TSER=1796599
================================================================================
IPv4 Conversations
Filter:<No Filter>
                                               |       <-      | |       ->      | |     Total     |
                                               | Frames  Bytes | | Frames  Bytes | | Frames  Bytes |
10.0.1.3             <-> 10.0.1.2               69065 104558298   34955   2307046  104020 106865344
================================================================================
  1   0.000000     10.0.1.3 -> 10.0.1.2     TCP 58615 > 9040 [SYN] Seq=0 Win=5840 Len=0 MSS=1460 TSV=1798321 TSER=0 WS=6
  2   0.000302     10.0.1.2 -> 10.0.1.3     TCP 9040 > 58615 [SYN, ACK] Seq=0 Ack=1 Win=14480 Len=0 MSS=1460 TSV=1851695 TSER=1798321 WS=6
  3   0.000336     10.0.1.3 -> 10.0.1.2     TCP 58615 > 9040 [ACK] Seq=1 Ack=1 Win=5888 Len=0 TSV=1798321 TSER=1851695
104026   8.515547     10.0.1.3 -> 10.0.1.2     TCP 58615 > 9040 [FIN, ACK] Seq=9 Ack=100000001 Win=2580480 Len=0 TSV=1800449 TSER=1853770
104027   8.555710     10.0.1.2 -> 10.0.1.3     TCP 9040 > 58615 [ACK] Seq=100000001 Ack=10 Win=14528 Len=0 TSV=1853835 TSER=1800449
================================================================================
IPv4 Conversations
Filter:<No Filter>
                                               |       <-      | |       ->      | |     Total     |
                                               | Frames  Bytes | | Frames  Bytes | | Frames  Bytes |
10.0.1.3             <-> 10.0.1.2               69065 104558298   34962   2307508  104027 106865806
================================================================================
  1   0.000000     10.0.1.3 -> 10.0.1.2     TCP 57405 > 9040 [SYN] Seq=0 Win=5840 Len=0 MSS=1460 TSV=1802158 TSER=0 WS=6
  2   0.000332     10.0.1.2 -> 10.0.1.3     TCP 9040 > 57405 [SYN, ACK] Seq=0 Ack=1 Win=14480 Len=0 MSS=1460 TSV=1855534 TSER=1802158 WS=6
  3   0.000368     10.0.1.3 -> 10.0.1.2     TCP 57405 > 9040 [ACK] Seq=1 Ack=1 Win=5888 Len=0 TSV=1802158 TSER=1855534
104030   8.515755     10.0.1.3 -> 10.0.1.2     TCP 57405 > 9040 [FIN, ACK] Seq=9 Ack=100000001 Win=2580480 Len=0 TSV=1804287 TSER=1857609
104031   8.555684     10.0.1.2 -> 10.0.1.3     TCP 9040 > 57405 [ACK] Seq=100000001 Ack=10 Win=14528 Len=0 TSV=1857673 TSER=1804287
================================================================================
IPv4 Conversations
Filter:<No Filter>
                                               |       <-      | |       ->      | |     Total     |
                                               | Frames  Bytes | | Frames  Bytes | | Frames  Bytes |
10.0.1.3             <-> 10.0.1.2               69065 104558298   34966   2307772  104031 106866070
================================================================================
  1   0.000000     10.0.1.3 -> 10.0.1.2     TCP 57406 > 9040 [SYN] Seq=0 Win=5840 Len=0 MSS=1460 TSV=1806000 TSER=0 WS=6
  2   0.000283     10.0.1.2 -> 10.0.1.3     TCP 9040 > 57406 [SYN, ACK] Seq=0 Ack=1 Win=14480 Len=0 MSS=1460 TSV=1859375 TSER=1806000 WS=6
  3   0.000316     10.0.1.3 -> 10.0.1.2     TCP 57406 > 9040 [ACK] Seq=1 Ack=1 Win=5888 Len=0 TSV=1806000 TSER=1859375
104016   8.515652     10.0.1.3 -> 10.0.1.2     TCP 57406 > 9040 [FIN, ACK] Seq=9 Ack=100000001 Win=2580480 Len=0 TSV=1808129 TSER=1861450
104017   8.553345     10.0.1.2 -> 10.0.1.3     TCP 9040 > 57406 [ACK] Seq=100000001 Ack=10 Win=14528 Len=0 TSV=1861514 TSER=1808129
================================================================================
IPv4 Conversations
Filter:<No Filter>
                                               |       <-      | |       ->      | |     Total     |
                                               | Frames  Bytes | | Frames  Bytes | | Frames  Bytes |
10.0.1.3             <-> 10.0.1.2               69065 104558298   34952   2306848  104017 106865146
================================================================================
  1   0.000000     10.0.1.3 -> 10.0.1.2     TCP 57408 > 9040 [SYN] Seq=0 Win=5840 Len=0 MSS=1460 TSV=1809864 TSER=0 WS=6
  2   0.000314     10.0.1.2 -> 10.0.1.3     TCP 9040 > 57408 [SYN, ACK] Seq=0 Ack=1 Win=14480 Len=0 MSS=1460 TSV=1863240 TSER=1809864 WS=6
  3   0.000338     10.0.1.3 -> 10.0.1.2     TCP 57408 > 9040 [ACK] Seq=1 Ack=1 Win=5888 Len=0 TSV=1809865 TSER=1863240
103962   8.520004     10.0.1.3 -> 10.0.1.2     TCP 57408 > 9040 [FIN, ACK] Seq=9 Ack=100000001 Win=2580480 Len=0 TSV=1811994 TSER=1865316
103963   8.556780     10.0.1.2 -> 10.0.1.3     TCP 9040 > 57408 [ACK] Seq=100000001 Ack=10 Win=14528 Len=0 TSV=1865380 TSER=1811994
================================================================================
IPv4 Conversations
Filter:<No Filter>
                                               |       <-      | |       ->      | |     Total     |
                                               | Frames  Bytes | | Frames  Bytes | | Frames  Bytes |
10.0.1.3             <-> 10.0.1.2               69065 104558298   34898   2303284  103963 106861582
================================================================================
  1   0.000000     10.0.1.3 -> 10.0.1.2     TCP 57409 > 9040 [SYN] Seq=0 Win=5840 Len=0 MSS=1460 TSV=1813710 TSER=0 WS=6
  2   0.000323     10.0.1.2 -> 10.0.1.3     TCP 9040 > 57409 [SYN, ACK] Seq=0 Ack=1 Win=14480 Len=0 MSS=1460 TSV=1867086 TSER=1813710 WS=6
  3   0.000354     10.0.1.3 -> 10.0.1.2     TCP 57409 > 9040 [ACK] Seq=1 Ack=1 Win=5888 Len=0 TSV=1813710 TSER=1867086
104033   8.515588     10.0.1.3 -> 10.0.1.2     TCP 57409 > 9040 [FIN, ACK] Seq=9 Ack=100000001 Win=2580480 Len=0 TSV=1815839 TSER=1869161
104034   8.552457     10.0.1.2 -> 10.0.1.3     TCP 9040 > 57409 [ACK] Seq=100000001 Ack=10 Win=14528 Len=0 TSV=1869225 TSER=1815839
================================================================================
IPv4 Conversations
Filter:<No Filter>
                                               |       <-      | |       ->      | |     Total     |
                                               | Frames  Bytes | | Frames  Bytes | | Frames  Bytes |
10.0.1.3             <-> 10.0.1.2               69065 104558298   34969   2307970  104034 106866268
================================================================================
  1   0.000000     10.0.1.3 -> 10.0.1.2     TCP 57410 > 9040 [SYN] Seq=0 Win=5840 Len=0 MSS=1460 TSV=1817551 TSER=0 WS=6
  2   0.000306     10.0.1.2 -> 10.0.1.3     TCP 9040 > 57410 [SYN, ACK] Seq=0 Ack=1 Win=14480 Len=0 MSS=1460 TSV=1870928 TSER=1817551 WS=6
  3   0.000339     10.0.1.3 -> 10.0.1.2     TCP 57410 > 9040 [ACK] Seq=1 Ack=1 Win=5888 Len=0 TSV=1817552 TSER=1870928
104022   8.515605     10.0.1.3 -> 10.0.1.2     TCP 57410 > 9040 [FIN, ACK] Seq=9 Ack=100000001 Win=2580480 Len=0 TSV=1819681 TSER=1873003
104023   8.553420     10.0.1.2 -> 10.0.1.3     TCP 9040 > 57410 [ACK] Seq=100000001 Ack=10 Win=14528 Len=0 TSV=1873067 TSER=1819681
================================================================================
IPv4 Conversations
Filter:<No Filter>
                                               |       <-      | |       ->      | |     Total     |
                                               | Frames  Bytes | | Frames  Bytes | | Frames  Bytes |
10.0.1.3             <-> 10.0.1.2               69065 104558298   34958   2307244  104023 106865542
================================================================================
  1   0.000000     10.0.1.3 -> 10.0.1.2     TCP 57411 > 9040 [SYN] Seq=0 Win=5840 Len=0 MSS=1460 TSV=1821401 TSER=0 WS=6
  2   0.000284     10.0.1.2 -> 10.0.1.3     TCP 9040 > 57411 [SYN, ACK] Seq=0 Ack=1 Win=14480 Len=0 MSS=1460 TSV=1874778 TSER=1821401 WS=6
  3   0.000318     10.0.1.3 -> 10.0.1.2     TCP 57411 > 9040 [ACK] Seq=1 Ack=1 Win=5888 Len=0 TSV=1821401 TSER=1874778
104030   8.515526     10.0.1.3 -> 10.0.1.2     TCP 57411 > 9040 [FIN, ACK] Seq=9 Ack=100000001 Win=2580480 Len=0 TSV=1823530 TSER=1876853
104031   8.555018     10.0.1.2 -> 10.0.1.3     TCP 9040 > 57411 [ACK] Seq=100000001 Ack=10 Win=14528 Len=0 TSV=1876917 TSER=1823530
================================================================================
IPv4 Conversations
Filter:<No Filter>
                                               |       <-      | |       ->      | |     Total     |
                                               | Frames  Bytes | | Frames  Bytes | | Frames  Bytes |
10.0.1.3             <-> 10.0.1.2               69065 104558298   34966   2307772  104031 106866070
================================================================================
  1   0.000000     10.0.1.3 -> 10.0.1.2     TCP 57412 > 9040 [SYN] Seq=0 Win=5840 Len=0 MSS=1460 TSV=1825240 TSER=0 WS=6
  2   0.000307     10.0.1.2 -> 10.0.1.3     TCP 9040 > 57412 [SYN, ACK] Seq=0 Ack=1 Win=14480 Len=0 MSS=1460 TSV=1878617 TSER=1825240 WS=6
  3   0.000341     10.0.1.3 -> 10.0.1.2     TCP 57412 > 9040 [ACK] Seq=1 Ack=1 Win=5888 Len=0 TSV=1825240 TSER=1878617
104000   8.515575     10.0.1.3 -> 10.0.1.2     TCP 57412 > 9040 [FIN, ACK] Seq=9 Ack=100000001 Win=2580480 Len=0 TSV=1827369 TSER=1880692
104001   8.553532     10.0.1.2 -> 10.0.1.3     TCP 9040 > 57412 [ACK] Seq=100000001 Ack=10 Win=14528 Len=0 TSV=1880756 TSER=1827369
================================================================================
IPv4 Conversations
Filter:<No Filter>
                                               |       <-      | |       ->      | |     Total     |
                                               | Frames  Bytes | | Frames  Bytes | | Frames  Bytes |
10.0.1.3             <-> 10.0.1.2               69065 104558298   34936   2305792  104001 106864090
================================================================================
  1   0.000000     10.0.1.3 -> 10.0.1.2     TCP 57413 > 9040 [SYN] Seq=0 Win=5840 Len=0 MSS=1460 TSV=1829079 TSER=0 WS=6
  2   0.000319     10.0.1.2 -> 10.0.1.3     TCP 9040 > 57413 [SYN, ACK] Seq=0 Ack=1 Win=14480 Len=0 MSS=1460 TSV=1882456 TSER=1829079 WS=6
  3   0.000351     10.0.1.3 -> 10.0.1.2     TCP 57413 > 9040 [ACK] Seq=1 Ack=1 Win=5888 Len=0 TSV=1829079 TSER=1882456
104029   8.515673     10.0.1.3 -> 10.0.1.2     TCP 57413 > 9040 [FIN, ACK] Seq=9 Ack=100000001 Win=2580480 Len=0 TSV=1831208 TSER=1884531
104030   8.554028     10.0.1.2 -> 10.0.1.3     TCP 9040 > 57413 [ACK] Seq=100000001 Ack=10 Win=14528 Len=0 TSV=1884595 TSER=1831208
================================================================================
IPv4 Conversations
Filter:<No Filter>
                                               |       <-      | |       ->      | |     Total     |
                                               | Frames  Bytes | | Frames  Bytes | | Frames  Bytes |
10.0.1.3             <-> 10.0.1.2               69065 104558298   34965   2307706  104030 106866004
================================================================================
  1   0.000000     10.0.1.3 -> 10.0.1.2     TCP 57414 > 9040 [SYN] Seq=0 Win=5840 Len=0 MSS=1460 TSV=1832925 TSER=0 WS=6
  2   0.000281     10.0.1.2 -> 10.0.1.3     TCP 9040 > 57414 [SYN, ACK] Seq=0 Ack=1 Win=14480 Len=0 MSS=1460 TSV=1886302 TSER=1832925 WS=6
  3   0.000323     10.0.1.3 -> 10.0.1.2     TCP 57414 > 9040 [ACK] Seq=1 Ack=1 Win=5888 Len=0 TSV=1832925 TSER=1886302
103948   8.515491     10.0.1.3 -> 10.0.1.2     TCP 57414 > 9040 [FIN, ACK] Seq=9 Ack=100000001 Win=2580480 Len=0 TSV=1835054 TSER=1888377
103949   8.552971     10.0.1.2 -> 10.0.1.3     TCP 9040 > 57414 [ACK] Seq=100000001 Ack=10 Win=14528 Len=0 TSV=1888441 TSER=1835054
================================================================================
IPv4 Conversations
Filter:<No Filter>
                                               |       <-      | |       ->      | |     Total     |
                                               | Frames  Bytes | | Frames  Bytes | | Frames  Bytes |
10.0.1.3             <-> 10.0.1.2               69065 104558298   34884   2302360  103949 106860658
================================================================================
  1   0.000000     10.0.1.3 -> 10.0.1.2     TCP 57416 > 9040 [SYN] Seq=0 Win=5840 Len=0 MSS=1460 TSV=1836787 TSER=0 WS=6
  2   0.000314     10.0.1.2 -> 10.0.1.3     TCP 9040 > 57416 [SYN, ACK] Seq=0 Ack=1 Win=14480 Len=0 MSS=1460 TSV=1890165 TSER=1836787 WS=6
  3   0.000339     10.0.1.3 -> 10.0.1.2     TCP 57416 > 9040 [ACK] Seq=1 Ack=1 Win=5888 Len=0 TSV=1836787 TSER=1890165
103904   8.516032     10.0.1.3 -> 10.0.1.2     TCP 57416 > 9040 [FIN, ACK] Seq=9 Ack=100000001 Win=2580480 Len=0 TSV=1838916 TSER=1892240
103905   8.553921     10.0.1.2 -> 10.0.1.3     TCP 9040 > 57416 [ACK] Seq=100000001 Ack=10 Win=14528 Len=0 TSV=1892304 TSER=1838916
================================================================================
IPv4 Conversations
Filter:<No Filter>
                                               |       <-      | |       ->      | |     Total     |
                                               | Frames  Bytes | | Frames  Bytes | | Frames  Bytes |
10.0.1.3             <-> 10.0.1.2               69065 104558298   34840   2299456  103905 106857754
================================================================================
  1   0.000000     10.0.1.3 -> 10.0.1.2     TCP 57417 > 9040 [SYN] Seq=0 Win=5840 Len=0 MSS=1460 TSV=1840625 TSER=0 WS=6
  2   0.000284     10.0.1.2 -> 10.0.1.3     TCP 9040 > 57417 [SYN, ACK] Seq=0 Ack=1 Win=14480 Len=0 MSS=1460 TSV=1894003 TSER=1840625 WS=6
  3   0.000317     10.0.1.3 -> 10.0.1.2     TCP 57417 > 9040 [ACK] Seq=1 Ack=1 Win=5888 Len=0 TSV=1840625 TSER=1894003
104025   8.515535     10.0.1.3 -> 10.0.1.2     TCP 57417 > 9040 [FIN, ACK] Seq=9 Ack=100000001 Win=2580480 Len=0 TSV=1842753 TSER=1896078
104026   8.555000     10.0.1.2 -> 10.0.1.3     TCP 9040 > 57417 [ACK] Seq=100000001 Ack=10 Win=14528 Len=0 TSV=1896142 TSER=1842753
================================================================================
IPv4 Conversations
Filter:<No Filter>
                                               |       <-      | |       ->      | |     Total     |
                                               | Frames  Bytes | | Frames  Bytes | | Frames  Bytes |
10.0.1.3             <-> 10.0.1.2               69065 104558298   34961   2307442  104026 106865740
================================================================================
  1   0.000000     10.0.1.3 -> 10.0.1.2     TCP 57418 > 9040 [SYN] Seq=0 Win=5840 Len=0 MSS=1460 TSV=1844465 TSER=0 WS=6
  2   0.000306     10.0.1.2 -> 10.0.1.3     TCP 9040 > 57418 [SYN, ACK] Seq=0 Ack=1 Win=14480 Len=0 MSS=1460 TSV=1897843 TSER=1844465 WS=6
  3   0.000340     10.0.1.3 -> 10.0.1.2     TCP 57418 > 9040 [ACK] Seq=1 Ack=1 Win=5888 Len=0 TSV=1844465 TSER=1897843
104030   8.515647     10.0.1.3 -> 10.0.1.2     TCP 57418 > 9040 [FIN, ACK] Seq=9 Ack=100000001 Win=2580480 Len=0 TSV=1846594 TSER=1899918
104031   8.552645     10.0.1.2 -> 10.0.1.3     TCP 9040 > 57418 [ACK] Seq=100000001 Ack=10 Win=14528 Len=0 TSV=1899982 TSER=1846594
================================================================================
IPv4 Conversations
Filter:<No Filter>
                                               |       <-      | |       ->      | |     Total     |
                                               | Frames  Bytes | | Frames  Bytes | | Frames  Bytes |
10.0.1.3             <-> 10.0.1.2               69065 104558298   34966   2307772  104031 106866070
================================================================================
  1   0.000000     10.0.1.3 -> 10.0.1.2     TCP 57419 > 9040 [SYN] Seq=0 Win=5840 Len=0 MSS=1460 TSV=1848303 TSER=0 WS=6
  2   0.000280     10.0.1.2 -> 10.0.1.3     TCP 9040 > 57419 [SYN, ACK] Seq=0 Ack=1 Win=14480 Len=0 MSS=1460 TSV=1901682 TSER=1848303 WS=6
  3   0.000313     10.0.1.3 -> 10.0.1.2     TCP 57419 > 9040 [ACK] Seq=1 Ack=1 Win=5888 Len=0 TSV=1848303 TSER=1901682
104032   8.515566     10.0.1.3 -> 10.0.1.2     TCP 57419 > 9040 [FIN, ACK] Seq=9 Ack=100000001 Win=2580480 Len=0 TSV=1850432 TSER=1903756
104033   8.554398     10.0.1.2 -> 10.0.1.3     TCP 9040 > 57419 [ACK] Seq=100000001 Ack=10 Win=14528 Len=0 TSV=1903821 TSER=1850432
================================================================================
IPv4 Conversations
Filter:<No Filter>
                                               |       <-      | |       ->      | |     Total     |
                                               | Frames  Bytes | | Frames  Bytes | | Frames  Bytes |
10.0.1.3             <-> 10.0.1.2               69065 104558298   34968   2307904  104033 106866202
================================================================================
  1   0.000000     10.0.1.3 -> 10.0.1.2     TCP 57420 > 9040 [SYN] Seq=0 Win=5840 Len=0 MSS=1460 TSV=1852149 TSER=0 WS=6
  2   0.000280     10.0.1.2 -> 10.0.1.3     TCP 9040 > 57420 [SYN, ACK] Seq=0 Ack=1 Win=14480 Len=0 MSS=1460 TSV=1905528 TSER=1852149 WS=6
  3   0.000315     10.0.1.3 -> 10.0.1.2     TCP 57420 > 9040 [ACK] Seq=1 Ack=1 Win=5888 Len=0 TSV=1852149 TSER=1905528
104035   8.515571     10.0.1.3 -> 10.0.1.2     TCP 57420 > 9040 [FIN, ACK] Seq=9 Ack=100000001 Win=2580480 Len=0 TSV=1854277 TSER=1907602
104036   8.555326     10.0.1.2 -> 10.0.1.3     TCP 9040 > 57420 [ACK] Seq=100000001 Ack=10 Win=14528 Len=0 TSV=1907667 TSER=1854277
================================================================================
IPv4 Conversations
Filter:<No Filter>
                                               |       <-      | |       ->      | |     Total     |
                                               | Frames  Bytes | | Frames  Bytes | | Frames  Bytes |
10.0.1.3             <-> 10.0.1.2               69065 104558298   34971   2308102  104036 106866400
================================================================================
