  1   0.000000     10.0.1.3 -> 10.0.1.2     TCP 44461 > 9040 [SYN] Seq=0 Win=5840 Len=0 MSS=1460 TSV=1960751 TSER=0 WS=6
  2   0.000292     10.0.1.2 -> 10.0.1.3     TCP 9040 > 44461 [SYN, ACK] Seq=0 Ack=1 Win=14480 Len=0 MSS=1460 TSV=2014138 TSER=1960751 WS=6
  3   0.000329     10.0.1.3 -> 10.0.1.2     TCP 44461 > 9040 [ACK] Seq=1 Ack=1 Win=5888 Len=0 TSV=1960751 TSER=2014138
207574  17.029399     10.0.1.3 -> 10.0.1.2     TCP 44461 > 9040 [FIN, ACK] Seq=9 Ack=200000001 Win=2580480 Len=0 TSV=1965008 TSER=2018342
207575  17.068745     10.0.1.2 -> 10.0.1.3     TCP 9040 > 44461 [ACK] Seq=200000001 Ack=10 Win=14528 Len=0 TSV=2018406 TSER=1965008
================================================================================
IPv4 Conversations
Filter:<No Filter>
                                               |       <-      | |       ->      | |     Total     |
                                               | Frames  Bytes | | Frames  Bytes | | Frames  Bytes |
10.0.1.3             <-> 10.0.1.2              138126 209116324   69449   4583650  207575 213699974
================================================================================
  1   0.000000     10.0.1.3 -> 10.0.1.2     TCP 44462 > 9040 [SYN] Seq=0 Win=5840 Len=0 MSS=1460 TSV=1967378 TSER=0 WS=6
  2   0.000308     10.0.1.2 -> 10.0.1.3     TCP 9040 > 44462 [SYN, ACK] Seq=0 Ack=1 Win=14480 Len=0 MSS=1460 TSV=2020766 TSER=1967378 WS=6
  3   0.000342     10.0.1.3 -> 10.0.1.2     TCP 44462 > 9040 [ACK] Seq=1 Ack=1 Win=5888 Len=0 TSV=1967378 TSER=2020766
207609  17.029394     10.0.1.3 -> 10.0.1.2     TCP 44462 > 9040 [FIN, ACK] Seq=9 Ack=200000001 Win=2580480 Len=0 TSV=1971635 TSER=2024970
207610  17.066564     10.0.1.2 -> 10.0.1.3     TCP 9040 > 44462 [ACK] Seq=200000001 Ack=10 Win=14528 Len=0 TSV=2025033 TSER=1971635
================================================================================
IPv4 Conversations
Filter:<No Filter>
                                               |       <-      | |       ->      | |     Total     |
                                               | Frames  Bytes | | Frames  Bytes | | Frames  Bytes |
10.0.1.3             <-> 10.0.1.2              138126 209116324   69484   4585960  207610 213702284
================================================================================
  1   0.000000     10.0.1.3 -> 10.0.1.2     TCP 44463 > 9040 [SYN] Seq=0 Win=5840 Len=0 MSS=1460 TSV=1973986 TSER=0 WS=6
  2   0.000323     10.0.1.2 -> 10.0.1.3     TCP 9040 > 44463 [SYN, ACK] Seq=0 Ack=1 Win=14480 Len=0 MSS=1460 TSV=2027374 TSER=1973986 WS=6
  3   0.000358     10.0.1.3 -> 10.0.1.2     TCP 44463 > 9040 [ACK] Seq=1 Ack=1 Win=5888 Len=0 TSV=1973986 TSER=2027374
207585  17.029492     10.0.1.3 -> 10.0.1.2     TCP 44463 > 9040 [FIN, ACK] Seq=9 Ack=200000001 Win=2580480 Len=0 TSV=1978243 TSER=2031577
207586  17.067764     10.0.1.2 -> 10.0.1.3     TCP 9040 > 44463 [ACK] Seq=200000001 Ack=10 Win=14528 Len=0 TSV=2031642 TSER=1978243
================================================================================
IPv4 Conversations
Filter:<No Filter>
                                               |       <-      | |       ->      | |     Total     |
                                               | Frames  Bytes | | Frames  Bytes | | Frames  Bytes |
10.0.1.3             <-> 10.0.1.2              138126 209116324   69460   4584376  207586 213700700
================================================================================
  1   0.000000     10.0.1.3 -> 10.0.1.2     TCP 44464 > 9040 [SYN] Seq=0 Win=5840 Len=0 MSS=1460 TSV=1980632 TSER=0 WS=6
  2   0.000305     10.0.1.2 -> 10.0.1.3     TCP 9040 > 44464 [SYN, ACK] Seq=0 Ack=1 Win=14480 Len=0 MSS=1460 TSV=2034021 TSER=1980632 WS=6
  3   0.000340     10.0.1.3 -> 10.0.1.2     TCP 44464 > 9040 [ACK] Seq=1 Ack=1 Win=5888 Len=0 TSV=1980632 TSER=2034021
207599  17.029323     10.0.1.3 -> 10.0.1.2     TCP 44464 > 9040 [FIN, ACK] Seq=9 Ack=200000001 Win=2580480 Len=0 TSV=1984889 TSER=2038224
207600  17.066928     10.0.1.2 -> 10.0.1.3     TCP 9040 > 44464 [ACK] Seq=200000001 Ack=10 Win=14528 Len=0 TSV=2038288 TSER=1984889
================================================================================
IPv4 Conversations
Filter:<No Filter>
                                               |       <-      | |       ->      | |     Total     |
                                               | Frames  Bytes | | Frames  Bytes | | Frames  Bytes |
10.0.1.3             <-> 10.0.1.2              138126 209116324   69474   4585300  207600 213701624
================================================================================
  1   0.000000     10.0.1.3 -> 10.0.1.2     TCP 44465 > 9040 [SYN] Seq=0 Win=5840 Len=0 MSS=1460 TSV=1987284 TSER=0 WS=6
  2   0.000284     10.0.1.2 -> 10.0.1.3     TCP 9040 > 44465 [SYN, ACK] Seq=0 Ack=1 Win=14480 Len=0 MSS=1460 TSV=2040674 TSER=1987284 WS=6
  3   0.000319     10.0.1.3 -> 10.0.1.2     TCP 44465 > 9040 [ACK] Seq=1 Ack=1 Win=5888 Len=0 TSV=1987285 TSER=2040674
207625  17.029367     10.0.1.3 -> 10.0.1.2     TCP 44465 > 9040 [FIN, ACK] Seq=9 Ack=200000001 Win=2563008 Len=0 TSV=1991542 TSER=2044878
207626  17.066449     10.0.1.2 -> 10.0.1.3     TCP 9040 > 44465 [ACK] Seq=200000001 Ack=10 Win=14528 Len=0 TSV=2044941 TSER=1991542
================================================================================
IPv4 Conversations
Filter:<No Filter>
                                               |       <-      | |       ->      | |     Total     |
                                               | Frames  Bytes | | Frames  Bytes | | Frames  Bytes |
10.0.1.3             <-> 10.0.1.2              138126 209116324   69500   4587016  207626 213703340
================================================================================
  1   0.000000     10.0.1.3 -> 10.0.1.2     TCP 44466 > 9040 [SYN] Seq=0 Win=5840 Len=0 MSS=1460 TSV=1993908 TSER=0 WS=6
  2   0.000306     10.0.1.2 -> 10.0.1.3     TCP 9040 > 44466 [SYN, ACK] Seq=0 Ack=1 Win=14480 Len=0 MSS=1460 TSV=2047297 TSER=1993908 WS=6
  3   0.000339     10.0.1.3 -> 10.0.1.2     TCP 44466 > 9040 [ACK] Seq=1 Ack=1 Win=5888 Len=0 TSV=1993908 TSER=2047297
207611  17.029393     10.0.1.3 -> 10.0.1.2     TCP 44466 > 9040 [FIN, ACK] Seq=9 Ack=200000001 Win=2580480 Len=0 TSV=1998165 TSER=2051501
207612  17.067565     10.0.1.2 -> 10.0.1.3     TCP 9040 > 44466 [ACK] Seq=200000001 Ack=10 Win=14528 Len=0 TSV=2051565 TSER=1998165
================================================================================
IPv4 Conversations
Filter:<No Filter>
                                               |       <-      | |       ->      | |     Total     |
                                               | Frames  Bytes | | Frames  Bytes | | Frames  Bytes |
10.0.1.3             <-> 10.0.1.2              138126 209116324   69486   4586092  207612 213702416
================================================================================
  1   0.000000     10.0.1.3 -> 10.0.1.2     TCP 44467 > 9040 [SYN] Seq=0 Win=5840 Len=0 MSS=1460 TSV=2000540 TSER=0 WS=6
  2   0.000316     10.0.1.2 -> 10.0.1.3     TCP 9040 > 44467 [SYN, ACK] Seq=0 Ack=1 Win=14480 Len=0 MSS=1460 TSV=2053930 TSER=2000540 WS=6
  3   0.000353     10.0.1.3 -> 10.0.1.2     TCP 44467 > 9040 [ACK] Seq=1 Ack=1 Win=5888 Len=0 TSV=2000540 TSER=2053930
207598  17.029316     10.0.1.3 -> 10.0.1.2     TCP 44467 > 9040 [FIN, ACK] Seq=9 Ack=200000001 Win=2580480 Len=0 TSV=2004797 TSER=2058134
207599  17.066085     10.0.1.2 -> 10.0.1.3     TCP 9040 > 44467 [ACK] Seq=200000001 Ack=10 Win=14528 Len=0 TSV=2058197 TSER=2004797
================================================================================
IPv4 Conversations
Filter:<No Filter>
                                               |       <-      | |       ->      | |     Total     |
                                               | Frames  Bytes | | Frames  Bytes | | Frames  Bytes |
10.0.1.3             <-> 10.0.1.2              138126 209116324   69473   4585234  207599 213701558
================================================================================
  1   0.000000     10.0.1.3 -> 10.0.1.2     TCP 44468 > 9040 [SYN] Seq=0 Win=5840 Len=0 MSS=1460 TSV=2007168 TSER=0 WS=6
  2   0.000282     10.0.1.2 -> 10.0.1.3     TCP 9040 > 44468 [SYN, ACK] Seq=0 Ack=1 Win=14480 Len=0 MSS=1460 TSV=2060558 TSER=2007168 WS=6
  3   0.000318     10.0.1.3 -> 10.0.1.2     TCP 44468 > 9040 [ACK] Seq=1 Ack=1 Win=5888 Len=0 TSV=2007168 TSER=2060558
207623  17.029434     10.0.1.3 -> 10.0.1.2     TCP 44468 > 9040 [FIN, ACK] Seq=9 Ack=200000001 Win=2557184 Len=0 TSV=2011425 TSER=2064762
207624  17.067218     10.0.1.2 -> 10.0.1.3     TCP 9040 > 44468 [ACK] Seq=200000001 Ack=10 Win=14528 Len=0 TSV=2064826 TSER=2011425
================================================================================
IPv4 Conversations
Filter:<No Filter>
                                               |       <-      | |       ->      | |     Total     |
                                               | Frames  Bytes | | Frames  Bytes | | Frames  Bytes |
10.0.1.3             <-> 10.0.1.2              138126 209116324   69498   4586884  207624 213703208
================================================================================
  1   0.000000     10.0.1.3 -> 10.0.1.2     TCP 44469 > 9040 [SYN] Seq=0 Win=5840 Len=0 MSS=1460 TSV=2013822 TSER=0 WS=6
  2   0.000292     10.0.1.2 -> 10.0.1.3     TCP 9040 > 44469 [SYN, ACK] Seq=0 Ack=1 Win=14480 Len=0 MSS=1460 TSV=2067213 TSER=2013822 WS=6
  3   0.000328     10.0.1.3 -> 10.0.1.2     TCP 44469 > 9040 [ACK] Seq=1 Ack=1 Win=5888 Len=0 TSV=2013822 TSER=2067213
207618  17.029380     10.0.1.3 -> 10.0.1.2     TCP 44469 > 9040 [FIN, ACK] Seq=9 Ack=200000001 Win=2580480 Len=0 TSV=2018079 TSER=2071416
207619  17.069108     10.0.1.2 -> 10.0.1.3     TCP 9040 > 44469 [ACK] Seq=200000001 Ack=10 Win=14528 Len=0 TSV=2071481 TSER=2018079
================================================================================
IPv4 Conversations
Filter:<No Filter>
                                               |       <-      | |       ->      | |     Total     |
                                               | Frames  Bytes | | Frames  Bytes | | Frames  Bytes |
10.0.1.3             <-> 10.0.1.2              138126 209116324   69493   4586554  207619 213702878
================================================================================
  1   0.000000     10.0.1.3 -> 10.0.1.2     TCP 44470 > 9040 [SYN] Seq=0 Win=5840 Len=0 MSS=1460 TSV=2020456 TSER=0 WS=6
  2   0.000323     10.0.1.2 -> 10.0.1.3     TCP 9040 > 44470 [SYN, ACK] Seq=0 Ack=1 Win=14480 Len=0 MSS=1460 TSV=2073847 TSER=2020456 WS=6
  3   0.000359     10.0.1.3 -> 10.0.1.2     TCP 44470 > 9040 [ACK] Seq=1 Ack=1 Win=5888 Len=0 TSV=2020456 TSER=2073847
207618  17.029481     10.0.1.3 -> 10.0.1.2     TCP 44470 > 9040 [FIN, ACK] Seq=9 Ack=200000001 Win=2580480 Len=0 TSV=2024713 TSER=2078050
207619  17.068130     10.0.1.2 -> 10.0.1.3     TCP 9040 > 44470 [ACK] Seq=200000001 Ack=10 Win=14528 Len=0 TSV=2078115 TSER=2024713
================================================================================
IPv4 Conversations
Filter:<No Filter>
                                               |       <-      | |       ->      | |     Total     |
                                               | Frames  Bytes | | Frames  Bytes | | Frames  Bytes |
10.0.1.3             <-> 10.0.1.2              138126 209116324   69493   4586554  207619 213702878
================================================================================
  1   0.000000     10.0.1.3 -> 10.0.1.2     TCP 54078 > 9040 [SYN] Seq=0 Win=5840 Len=0 MSS=1460 TSV=2027088 TSER=0 WS=6
  2   0.000324     10.0.1.2 -> 10.0.1.3     TCP 9040 > 54078 [SYN, ACK] Seq=0 Ack=1 Win=14480 Len=0 MSS=1460 TSV=2080480 TSER=2027088 WS=6
  3   0.000357     10.0.1.3 -> 10.0.1.2     TCP 54078 > 9040 [ACK] Seq=1 Ack=1 Win=5888 Len=0 TSV=2027088 TSER=2080480
207602  17.029496     10.0.1.3 -> 10.0.1.2     TCP 54078 > 9040 [FIN, ACK] Seq=9 Ack=200000001 Win=2580480 Len=0 TSV=2031345 TSER=2084683
207603  17.065885     10.0.1.2 -> 10.0.1.3     TCP 9040 > 54078 [ACK] Seq=200000001 Ack=10 Win=14528 Len=0 TSV=2084747 TSER=2031345
================================================================================
IPv4 Conversations
Filter:<No Filter>
                                               |       <-      | |       ->      | |     Total     |
                                               | Frames  Bytes | | Frames  Bytes | | Frames  Bytes |
10.0.1.3             <-> 10.0.1.2              138126 209116324   69477   4585498  207603 213701822
================================================================================
  1   0.000000     10.0.1.3 -> 10.0.1.2     TCP 54079 > 9040 [SYN] Seq=0 Win=5840 Len=0 MSS=1460 TSV=2033723 TSER=0 WS=6
  2   0.000349     10.0.1.2 -> 10.0.1.3     TCP 9040 > 54079 [SYN, ACK] Seq=0 Ack=1 Win=14480 Len=0 MSS=1460 TSV=2087115 TSER=2033723 WS=6
  3   0.000384     10.0.1.3 -> 10.0.1.2     TCP 54079 > 9040 [ACK] Seq=1 Ack=1 Win=5888 Len=0 TSV=2033723 TSER=2087115
207611  17.030800     10.0.1.3 -> 10.0.1.2     TCP 54079 > 9040 [FIN, ACK] Seq=9 Ack=200000001 Win=2580480 Len=0 TSV=2037980 TSER=2091320
207612  17.067175     10.0.1.2 -> 10.0.1.3     TCP 9040 > 54079 [ACK] Seq=200000001 Ack=10 Win=14528 Len=0 TSV=2091383 TSER=2037980
================================================================================
IPv4 Conversations
Filter:<No Filter>
                                               |       <-      | |       ->      | |     Total     |
                                               | Frames  Bytes | | Frames  Bytes | | Frames  Bytes |
10.0.1.3             <-> 10.0.1.2              138126 209116324   69486   4586092  207612 213702416
================================================================================
  1   0.000000     10.0.1.3 -> 10.0.1.2     TCP 54080 > 9040 [SYN] Seq=0 Win=5840 Len=0 MSS=1460 TSV=2040349 TSER=0 WS=6
  2   0.000323     10.0.1.2 -> 10.0.1.3     TCP 9040 > 54080 [SYN, ACK] Seq=0 Ack=1 Win=14480 Len=0 MSS=1460 TSV=2093742 TSER=2040349 WS=6
  3   0.000356     10.0.1.3 -> 10.0.1.2     TCP 54080 > 9040 [ACK] Seq=1 Ack=1 Win=5888 Len=0 TSV=2040349 TSER=2093742
207620  17.029381     10.0.1.3 -> 10.0.1.2     TCP 54080 > 9040 [FIN, ACK] Seq=9 Ack=200000001 Win=2580480 Len=0 TSV=2044606 TSER=2097946
207621  17.069041     10.0.1.2 -> 10.0.1.3     TCP 9040 > 54080 [ACK] Seq=200000001 Ack=10 Win=14528 Len=0 TSV=2098010 TSER=2044606
================================================================================
IPv4 Conversations
Filter:<No Filter>
                                               |       <-      | |       ->      | |     Total     |
                                               | Frames  Bytes | | Frames  Bytes | | Frames  Bytes |
10.0.1.3             <-> 10.0.1.2              138126 209116324   69495   4586686  207621 213703010
================================================================================
  1   0.000000     10.0.1.3 -> 10.0.1.2     TCP 54081 > 9040 [SYN] Seq=0 Win=5840 Len=0 MSS=1460 TSV=2046979 TSER=0 WS=6
  2   0.000322     10.0.1.2 -> 10.0.1.3     TCP 9040 > 54081 [SYN, ACK] Seq=0 Ack=1 Win=14480 Len=0 MSS=1460 TSV=2100373 TSER=2046979 WS=6
  3   0.000358     10.0.1.3 -> 10.0.1.2     TCP 54081 > 9040 [ACK] Seq=1 Ack=1 Win=5888 Len=0 TSV=2046979 TSER=2100373
207623  17.029345     10.0.1.3 -> 10.0.1.2     TCP 54081 > 9040 [FIN, ACK] Seq=9 Ack=200000001 Win=2557184 Len=0 TSV=2051237 TSER=2104577
207624  17.068664     10.0.1.2 -> 10.0.1.3     TCP 9040 > 54081 [ACK] Seq=200000001 Ack=10 Win=14528 Len=0 TSV=2104641 TSER=2051237
================================================================================
IPv4 Conversations
Filter:<No Filter>
                                               |       <-      | |       ->      | |     Total     |
                                               | Frames  Bytes | | Frames  Bytes | | Frames  Bytes |
10.0.1.3             <-> 10.0.1.2              138126 209116324   69498   4586884  207624 213703208
================================================================================
  1   0.000000     10.0.1.3 -> 10.0.1.2     TCP 54082 > 9040 [SYN] Seq=0 Win=5840 Len=0 MSS=1460 TSV=2053602 TSER=0 WS=6
  2   0.000315     10.0.1.2 -> 10.0.1.3     TCP 9040 > 54082 [SYN, ACK] Seq=0 Ack=1 Win=14480 Len=0 MSS=1460 TSV=2106996 TSER=2053602 WS=6
  3   0.000351     10.0.1.3 -> 10.0.1.2     TCP 54082 > 9040 [ACK] Seq=1 Ack=1 Win=5888 Len=0 TSV=2053602 TSER=2106996
207606  17.029594     10.0.1.3 -> 10.0.1.2     TCP 54082 > 9040 [FIN, ACK] Seq=9 Ack=200000001 Win=2574592 Len=0 TSV=2057859 TSER=2111200
207607  17.066028     10.0.1.2 -> 10.0.1.3     TCP 9040 > 54082 [ACK] Seq=200000001 Ack=10 Win=14528 Len=0 TSV=2111263 TSER=2057859
================================================================================
IPv4 Conversations
Filter:<No Filter>
                                               |       <-      | |       ->      | |     Total     |
                                               | Frames  Bytes | | Frames  Bytes | | Frames  Bytes |
10.0.1.3             <-> 10.0.1.2              138126 209116324   69481   4585762  207607 213702086
================================================================================
  1   0.000000     10.0.1.3 -> 10.0.1.2     TCP 54083 > 9040 [SYN] Seq=0 Win=5840 Len=0 MSS=1460 TSV=2060233 TSER=0 WS=6
  2   0.000275     10.0.1.2 -> 10.0.1.3     TCP 9040 > 54083 [SYN, ACK] Seq=0 Ack=1 Win=14480 Len=0 MSS=1460 TSV=2113628 TSER=2060233 WS=6
  3   0.000306     10.0.1.3 -> 10.0.1.2     TCP 54083 > 9040 [ACK] Seq=1 Ack=1 Win=5888 Len=0 TSV=2060234 TSER=2113628
207599  17.029242     10.0.1.3 -> 10.0.1.2     TCP 54083 > 9040 [FIN, ACK] Seq=9 Ack=200000001 Win=2580480 Len=0 TSV=2064491 TSER=2117831
207600  17.068347     10.0.1.2 -> 10.0.1.3     TCP 9040 > 54083 [ACK] Seq=200000001 Ack=10 Win=14528 Len=0 TSV=2117896 TSER=2064491
================================================================================
IPv4 Conversations
Filter:<No Filter>
                                               |       <-      | |       ->      | |     Total     |
                                               | Frames  Bytes | | Frames  Bytes | | Frames  Bytes |
10.0.1.3             <-> 10.0.1.2              138126 209116324   69474   4585300  207600 213701624
================================================================================
  1   0.000000     10.0.1.3 -> 10.0.1.2     TCP 54084 > 9040 [SYN] Seq=0 Win=5840 Len=0 MSS=1460 TSV=2066875 TSER=0 WS=6
  2   0.000283     10.0.1.2 -> 10.0.1.3     TCP 9040 > 54084 [SYN, ACK] Seq=0 Ack=1 Win=14480 Len=0 MSS=1460 TSV=2120270 TSER=2066875 WS=6
  3   0.000315     10.0.1.3 -> 10.0.1.2     TCP 54084 > 9040 [ACK] Seq=1 Ack=1 Win=5888 Len=0 TSV=2066875 TSER=2120270
207593  17.029414     10.0.1.3 -> 10.0.1.2     TCP 54084 > 9040 [FIN, ACK] Seq=9 Ack=200000001 Win=2580480 Len=0 TSV=2071133 TSER=2124474
207594  17.067453     10.0.1.2 -> 10.0.1.3     TCP 9040 > 54084 [ACK] Seq=200000001 Ack=10 Win=14528 Len=0 TSV=2124538 TSER=2071133
================================================================================
IPv4 Conversations
Filter:<No Filter>
                                               |       <-      | |       ->      | |     Total     |
                                               | Frames  Bytes | | Frames  Bytes | | Frames  Bytes |
10.0.1.3             <-> 10.0.1.2              138126 209116324   69468   4584904  207594 213701228
================================================================================
  1   0.000000     10.0.1.3 -> 10.0.1.2     TCP 54085 > 9040 [SYN] Seq=0 Win=5840 Len=0 MSS=1460 TSV=2073487 TSER=0 WS=6
  2   0.000329     10.0.1.2 -> 10.0.1.3     TCP 9040 > 54085 [SYN, ACK] Seq=0 Ack=1 Win=14480 Len=0 MSS=1460 TSV=2126883 TSER=2073487 WS=6
  3   0.000366     10.0.1.3 -> 10.0.1.2     TCP 54085 > 9040 [ACK] Seq=1 Ack=1 Win=5888 Len=0 TSV=2073488 TSER=2126883
207585  17.029442     10.0.1.3 -> 10.0.1.2     TCP 54085 > 9040 [FIN, ACK] Seq=9 Ack=200000001 Win=2580480 Len=0 TSV=2077745 TSER=2131087
207586  17.068125     10.0.1.2 -> 10.0.1.3     TCP 9040 > 54085 [ACK] Seq=200000001 Ack=10 Win=14528 Len=0 TSV=2131151 TSER=2077745
================================================================================
IPv4 Conversations
Filter:<No Filter>
                                               |       <-      | |       ->      | |     Total     |
                                               | Frames  Bytes | | Frames  Bytes | | Frames  Bytes |
10.0.1.3             <-> 10.0.1.2              138126 209116324   69460   4584376  207586 213700700
================================================================================
  1   0.000000     10.0.1.3 -> 10.0.1.2     TCP 54086 > 9040 [SYN] Seq=0 Win=5840 Len=0 MSS=1460 TSV=2080120 TSER=0 WS=6
  2   0.000294     10.0.1.2 -> 10.0.1.3     TCP 9040 > 54086 [SYN, ACK] Seq=0 Ack=1 Win=14480 Len=0 MSS=1460 TSV=2133516 TSER=2080120 WS=6
  3   0.000327     10.0.1.3 -> 10.0.1.2     TCP 54086 > 9040 [ACK] Seq=1 Ack=1 Win=5888 Len=0 TSV=2080120 TSER=2133516
207616  17.029348     10.0.1.3 -> 10.0.1.2     TCP 54086 > 9040 [FIN, ACK] Seq=9 Ack=200000001 Win=2580480 Len=0 TSV=2084377 TSER=2137720
207617  17.068679     10.0.1.2 -> 10.0.1.3     TCP 9040 > 54086 [ACK] Seq=200000001 Ack=10 Win=14528 Len=0 TSV=2137784 TSER=2084377
================================================================================
IPv4 Conversations
Filter:<No Filter>
                                               |       <-      | |       ->      | |     Total     |
                                               | Frames  Bytes | | Frames  Bytes | | Frames  Bytes |
10.0.1.3             <-> 10.0.1.2              138126 209116324   69491   4586422  207617 213702746
================================================================================
  1   0.000000     10.0.1.3 -> 10.0.1.2     TCP 54087 > 9040 [SYN] Seq=0 Win=5840 Len=0 MSS=1460 TSV=2086754 TSER=0 WS=6
  2   0.000284     10.0.1.2 -> 10.0.1.3     TCP 9040 > 54087 [SYN, ACK] Seq=0 Ack=1 Win=14480 Len=0 MSS=1460 TSV=2140151 TSER=2086754 WS=6
  3   0.000316     10.0.1.3 -> 10.0.1.2     TCP 54087 > 9040 [ACK] Seq=1 Ack=1 Win=5888 Len=0 TSV=2086754 TSER=2140151
207612  17.029336     10.0.1.3 -> 10.0.1.2     TCP 54087 > 9040 [FIN, ACK] Seq=9 Ack=200000001 Win=2580480 Len=0 TSV=2091011 TSER=2144355
207613  17.065762     10.0.1.2 -> 10.0.1.3     TCP 9040 > 54087 [ACK] Seq=200000001 Ack=10 Win=14528 Len=0 TSV=2144418 TSER=2091011
================================================================================
IPv4 Conversations
Filter:<No Filter>
                                               |       <-      | |       ->      | |     Total     |
                                               | Frames  Bytes | | Frames  Bytes | | Frames  Bytes |
10.0.1.3             <-> 10.0.1.2              138126 209116324   69487   4586158  207613 213702482
================================================================================
