  1   0.000000     10.0.1.3 -> 10.0.1.2     TCP 54088 > 9040 [SYN] Seq=0 Win=5840 Len=0 MSS=1460 TSV=2093386 TSER=0 WS=6
  2   0.000283     10.0.1.2 -> 10.0.1.3     TCP 9040 > 54088 [SYN, ACK] Seq=0 Ack=1 Win=14480 Len=0 MSS=1460 TSV=2146784 TSER=2093386 WS=6
  3   0.000316     10.0.1.3 -> 10.0.1.2     TCP 54088 > 9040 [ACK] Seq=1 Ack=1 Win=5888 Len=0 TSV=2093386 TSER=2146784
259416  21.286217     10.0.1.3 -> 10.0.1.2     TCP 54088 > 9040 [FIN, ACK] Seq=9 Ack=250000001 Win=2580480 Len=0 TSV=2098708 TSER=2152052
259417  21.326370     10.0.1.2 -> 10.0.1.3     TCP 9040 > 54088 [ACK] Seq=250000001 Ack=10 Win=14528 Len=0 TSV=2152116 TSER=2098708
================================================================================
IPv4 Conversations
Filter:<No Filter>
                                               |       <-      | |       ->      | |     Total     |
                                               | Frames  Bytes | | Frames  Bytes | | Frames  Bytes |
10.0.1.3             <-> 10.0.1.2              172656 261395304   86761   5726242  259417 267121546
================================================================================
  1   0.000000     10.0.1.3 -> 10.0.1.2     TCP 41616 > 9040 [SYN] Seq=0 Win=5840 Len=0 MSS=1460 TSV=2101395 TSER=0 WS=6
  2   0.000325     10.0.1.2 -> 10.0.1.3     TCP 9040 > 41616 [SYN, ACK] Seq=0 Ack=1 Win=14480 Len=0 MSS=1460 TSV=2154793 TSER=2101395 WS=6
  3   0.000359     10.0.1.3 -> 10.0.1.2     TCP 41616 > 9040 [ACK] Seq=1 Ack=1 Win=5888 Len=0 TSV=2101395 TSER=2154793
259385  21.286295     10.0.1.3 -> 10.0.1.2     TCP 41616 > 9040 [FIN, ACK] Seq=9 Ack=250000001 Win=2580480 Len=0 TSV=2106717 TSER=2160060
259386  21.325482     10.0.1.2 -> 10.0.1.3     TCP 9040 > 41616 [ACK] Seq=250000001 Ack=10 Win=14528 Len=0 TSV=2160125 TSER=2106717
================================================================================
IPv4 Conversations
Filter:<No Filter>
                                               |       <-      | |       ->      | |     Total     |
                                               | Frames  Bytes | | Frames  Bytes | | Frames  Bytes |
10.0.1.3             <-> 10.0.1.2              172656 261395304   86730   5724196  259386 267119500
================================================================================
  1   0.000000     10.0.1.3 -> 10.0.1.2     TCP 41617 > 9040 [SYN] Seq=0 Win=5840 Len=0 MSS=1460 TSV=2109440 TSER=0 WS=6
  2   0.000276     10.0.1.2 -> 10.0.1.3     TCP 9040 > 41617 [SYN, ACK] Seq=0 Ack=1 Win=14480 Len=0 MSS=1460 TSV=2162839 TSER=2109440 WS=6
  3   0.000310     10.0.1.3 -> 10.0.1.2     TCP 41617 > 9040 [ACK] Seq=1 Ack=1 Win=5888 Len=0 TSV=2109440 TSER=2162839
259380  21.286171     10.0.1.3 -> 10.0.1.2     TCP 41617 > 9040 [FIN, ACK] Seq=9 Ack=250000001 Win=2580480 Len=0 TSV=2114762 TSER=2168106
259381  21.325944     10.0.1.2 -> 10.0.1.3     TCP 9040 > 41617 [ACK] Seq=250000001 Ack=10 Win=14528 Len=0 TSV=2168171 TSER=2114762
================================================================================
IPv4 Conversations
Filter:<No Filter>
                                               |       <-      | |       ->      | |     Total     |
                                               | Frames  Bytes | | Frames  Bytes | | Frames  Bytes |
10.0.1.3             <-> 10.0.1.2              172656 261395304   86725   5723866  259381 267119170
================================================================================
  1   0.000000     10.0.1.3 -> 10.0.1.2     TCP 41618 > 9040 [SYN] Seq=0 Win=5840 Len=0 MSS=1460 TSV=2117449 TSER=0 WS=6
  2   0.000293     10.0.1.2 -> 10.0.1.3     TCP 9040 > 41618 [SYN, ACK] Seq=0 Ack=1 Win=14480 Len=0 MSS=1460 TSV=2170848 TSER=2117449 WS=6
  3   0.000325     10.0.1.3 -> 10.0.1.2     TCP 41618 > 9040 [ACK] Seq=1 Ack=1 Win=5888 Len=0 TSV=2117449 TSER=2170848
259402  21.286187     10.0.1.3 -> 10.0.1.2     TCP 41618 > 9040 [FIN, ACK] Seq=9 Ack=250000001 Win=2580480 Len=0 TSV=2122771 TSER=2176116
259403  21.324052     10.0.1.2 -> 10.0.1.3     TCP 9040 > 41618 [ACK] Seq=250000001 Ack=10 Win=14528 Len=0 TSV=2176180 TSER=2122771
================================================================================
IPv4 Conversations
Filter:<No Filter>
                                               |       <-      | |       ->      | |     Total     |
                                               | Frames  Bytes | | Frames  Bytes | | Frames  Bytes |
10.0.1.3             <-> 10.0.1.2              172656 261395304   86747   5725318  259403 267120622
================================================================================
  1   0.000000     10.0.1.3 -> 10.0.1.2     TCP 41619 > 9040 [SYN] Seq=0 Win=5840 Len=0 MSS=1460 TSV=2125453 TSER=0 WS=6
  2   0.000283     10.0.1.2 -> 10.0.1.3     TCP 9040 > 41619 [SYN, ACK] Seq=0 Ack=1 Win=14480 Len=0 MSS=1460 TSV=2178853 TSER=2125453 WS=6
  3   0.000316     10.0.1.3 -> 10.0.1.2     TCP 41619 > 9040 [ACK] Seq=1 Ack=1 Win=5888 Len=0 TSV=2125453 TSER=2178853
259418  21.286279     10.0.1.3 -> 10.0.1.2     TCP 41619 > 9040 [FIN, ACK] Seq=9 Ack=250000001 Win=2560064 Len=0 TSV=2130774 TSER=2184121
259419  21.322731     10.0.1.2 -> 10.0.1.3     TCP 9040 > 41619 [ACK] Seq=250000001 Ack=10 Win=14528 Len=0 TSV=2184184 TSER=2130774
================================================================================
IPv4 Conversations
Filter:<No Filter>
                                               |       <-      | |       ->      | |     Total     |
                                               | Frames  Bytes | | Frames  Bytes | | Frames  Bytes |
10.0.1.3             <-> 10.0.1.2              172656 261395304   86763   5726374  259419 267121678
================================================================================
  1   0.000000     10.0.1.3 -> 10.0.1.2     TCP 41620 > 9040 [SYN] Seq=0 Win=5840 Len=0 MSS=1460 TSV=2133461 TSER=0 WS=6
  2   0.000307     10.0.1.2 -> 10.0.1.3     TCP 9040 > 41620 [SYN, ACK] Seq=0 Ack=1 Win=14480 Len=0 MSS=1460 TSV=2186861 TSER=2133461 WS=6
  3   0.000350     10.0.1.3 -> 10.0.1.2     TCP 41620 > 9040 [ACK] Seq=1 Ack=1 Win=5888 Len=0 TSV=2133461 TSER=2186861
259393  21.286197     10.0.1.3 -> 10.0.1.2     TCP 41620 > 9040 [FIN, ACK] Seq=9 Ack=250000001 Win=2580480 Len=0 TSV=2138783 TSER=2192129
259394  21.323516     10.0.1.2 -> 10.0.1.3     TCP 9040 > 41620 [ACK] Seq=250000001 Ack=10 Win=14528 Len=0 TSV=2192193 TSER=2138783
================================================================================
IPv4 Conversations
Filter:<No Filter>
                                               |       <-      | |       ->      | |     Total     |
                                               | Frames  Bytes | | Frames  Bytes | | Frames  Bytes |
10.0.1.3             <-> 10.0.1.2              172656 261395304   86738   5724724  259394 267120028
================================================================================
  1   0.000000     10.0.1.3 -> 10.0.1.2     TCP 41621 > 9040 [SYN] Seq=0 Win=5840 Len=0 MSS=1460 TSV=2141476 TSER=0 WS=6
  2   0.000292     10.0.1.2 -> 10.0.1.3     TCP 9040 > 41621 [SYN, ACK] Seq=0 Ack=1 Win=14480 Len=0 MSS=1460 TSV=2194877 TSER=2141476 WS=6
  3   0.000327     10.0.1.3 -> 10.0.1.2     TCP 41621 > 9040 [ACK] Seq=1 Ack=1 Win=5888 Len=0 TSV=2141476 TSER=2194877
259410  21.286196     10.0.1.3 -> 10.0.1.2     TCP 41621 > 9040 [FIN, ACK] Seq=9 Ack=250000001 Win=2580480 Len=0 TSV=2146798 TSER=2200145
259411  21.325351     10.0.1.2 -> 10.0.1.3     TCP 9040 > 41621 [ACK] Seq=250000001 Ack=10 Win=14528 Len=0 TSV=2200209 TSER=2146798
================================================================================
IPv4 Conversations
Filter:<No Filter>
                                               |       <-      | |       ->      | |     Total     |
                                               | Frames  Bytes | | Frames  Bytes | | Frames  Bytes |
10.0.1.3             <-> 10.0.1.2              172656 261395304   86755   5725846  259411 267121150
================================================================================
  1   0.000000     10.0.1.3 -> 10.0.1.2     TCP 41622 > 9040 [SYN] Seq=0 Win=5840 Len=0 MSS=1460 TSV=2149508 TSER=0 WS=6
  2   0.000320     10.0.1.2 -> 10.0.1.3     TCP 9040 > 41622 [SYN, ACK] Seq=0 Ack=1 Win=14480 Len=0 MSS=1460 TSV=2202910 TSER=2149508 WS=6
  3   0.000355     10.0.1.3 -> 10.0.1.2     TCP 41622 > 9040 [ACK] Seq=1 Ack=1 Win=5888 Len=0 TSV=2149508 TSER=2202910
259412  21.286260     10.0.1.3 -> 10.0.1.2     TCP 41622 > 9040 [FIN, ACK] Seq=9 Ack=250000001 Win=2580480 Len=0 TSV=2154830 TSER=2208178
259413  21.326357     10.0.1.2 -> 10.0.1.3     TCP 9040 > 41622 [ACK] Seq=250000001 Ack=10 Win=14528 Len=0 TSV=2208242 TSER=2154830
================================================================================
IPv4 Conversations
Filter:<No Filter>
                                               |       <-      | |       ->      | |     Total     |
                                               | Frames  Bytes | | Frames  Bytes | | Frames  Bytes |
10.0.1.3             <-> 10.0.1.2              172656 261395304   86757   5725978  259413 267121282
================================================================================
  1   0.000000     10.0.1.3 -> 10.0.1.2     TCP 41623 > 9040 [SYN] Seq=0 Win=5840 Len=0 MSS=1460 TSV=2157527 TSER=0 WS=6
  2   0.000312     10.0.1.2 -> 10.0.1.3     TCP 9040 > 41623 [SYN, ACK] Seq=0 Ack=1 Win=14480 Len=0 MSS=1460 TSV=2210930 TSER=2157527 WS=6
  3   0.000346     10.0.1.3 -> 10.0.1.2     TCP 41623 > 9040 [ACK] Seq=1 Ack=1 Win=5888 Len=0 TSV=2157528 TSER=2210930
259422  21.286253     10.0.1.3 -> 10.0.1.2     TCP 41623 > 9040 [FIN, ACK] Seq=9 Ack=250000001 Win=2580480 Len=0 TSV=2162849 TSER=2216197
259423  21.322713     10.0.1.2 -> 10.0.1.3     TCP 9040 > 41623 [ACK] Seq=250000001 Ack=10 Win=14528 Len=0 TSV=2216261 TSER=2162849
================================================================================
IPv4 Conversations
Filter:<No Filter>
                                               |       <-      | |       ->      | |     Total     |
                                               | Frames  Bytes | | Frames  Bytes | | Frames  Bytes |
10.0.1.3             <-> 10.0.1.2              172656 261395304   86767   5726638  259423 267121942
================================================================================
  1   0.000000     10.0.1.3 -> 10.0.1.2     TCP 41624 > 9040 [SYN] Seq=0 Win=5840 Len=0 MSS=1460 TSV=2165556 TSER=0 WS=6
  2   0.000302     10.0.1.2 -> 10.0.1.3     TCP 9040 > 41624 [SYN, ACK] Seq=0 Ack=1 Win=14480 Len=0 MSS=1460 TSV=2218959 TSER=2165556 WS=6
  3   0.000336     10.0.1.3 -> 10.0.1.2     TCP 41624 > 9040 [ACK] Seq=1 Ack=1 Win=5888 Len=0 TSV=2165556 TSER=2218959
259403  21.286195     10.0.1.3 -> 10.0.1.2     TCP 41624 > 9040 [FIN, ACK] Seq=9 Ack=250000001 Win=2580480 Len=0 TSV=2170878 TSER=2224226
259404  21.325716     10.0.1.2 -> 10.0.1.3     TCP 9040 > 41624 [ACK] Seq=250000001 Ack=10 Win=14528 Len=0 TSV=2224291 TSER=2170878
================================================================================
IPv4 Conversations
Filter:<No Filter>
                                               |       <-      | |       ->      | |     Total     |
                                               | Frames  Bytes | | Frames  Bytes | | Frames  Bytes |
10.0.1.3             <-> 10.0.1.2              172656 261395304   86748   5725384  259404 267120688
================================================================================
  1   0.000000     10.0.1.3 -> 10.0.1.2     TCP 41625 > 9040 [SYN] Seq=0 Win=5840 Len=0 MSS=1460 TSV=2173568 TSER=0 WS=6
  2   0.000279     10.0.1.2 -> 10.0.1.3     TCP 9040 > 41625 [SYN, ACK] Seq=0 Ack=1 Win=14480 Len=0 MSS=1460 TSV=2226971 TSER=2173568 WS=6
  3   0.000312     10.0.1.3 -> 10.0.1.2     TCP 41625 > 9040 [ACK] Seq=1 Ack=1 Win=5888 Len=0 TSV=2173568 TSER=2226971
259397  21.286245     10.0.1.3 -> 10.0.1.2     TCP 41625 > 9040 [FIN, ACK] Seq=9 Ack=250000001 Win=2580480 Len=0 TSV=2178889 TSER=2232239
259398  21.324211     10.0.1.2 -> 10.0.1.3     TCP 9040 > 41625 [ACK] Seq=250000001 Ack=10 Win=14528 Len=0 TSV=2232303 TSER=2178889
================================================================================
IPv4 Conversations
Filter:<No Filter>
                                               |       <-      | |       ->      | |     Total     |
                                               | Frames  Bytes | | Frames  Bytes | | Frames  Bytes |
10.0.1.3             <-> 10.0.1.2              172656 261395304   86742   5724988  259398 267120292
================================================================================
  1   0.000000     10.0.1.3 -> 10.0.1.2     TCP 42518 > 9040 [SYN] Seq=0 Win=5840 Len=0 MSS=1460 TSV=2181595 TSER=0 WS=6
  2   0.000302     10.0.1.2 -> 10.0.1.3     TCP 9040 > 42518 [SYN, ACK] Seq=0 Ack=1 Win=14480 Len=0 MSS=1460 TSV=2234999 TSER=2181595 WS=6
  3   0.000333     10.0.1.3 -> 10.0.1.2     TCP 42518 > 9040 [ACK] Seq=1 Ack=1 Win=5888 Len=0 TSV=2181595 TSER=2234999
259393  21.286244     10.0.1.3 -> 10.0.1.2     TCP 42518 > 9040 [FIN, ACK] Seq=9 Ack=250000001 Win=2580480 Len=0 TSV=2186917 TSER=2240267
259394  21.324974     10.0.1.2 -> 10.0.1.3     TCP 9040 > 42518 [ACK] Seq=250000001 Ack=10 Win=14528 Len=0 TSV=2240331 TSER=2186917
================================================================================
IPv4 Conversations
Filter:<No Filter>
                                               |       <-      | |       ->      | |     Total     |
                                               | Frames  Bytes | | Frames  Bytes | | Frames  Bytes |
10.0.1.3             <-> 10.0.1.2              172656 261395304   86738   5724724  259394 267120028
================================================================================
  1   0.000000     10.0.1.3 -> 10.0.1.2     TCP 42520 > 9040 [SYN] Seq=0 Win=5840 Len=0 MSS=1460 TSV=2189617 TSER=0 WS=6
  2   0.000284     10.0.1.2 -> 10.0.1.3     TCP 9040 > 42520 [SYN, ACK] Seq=0 Ack=1 Win=14480 Len=0 MSS=1460 TSV=2243021 TSER=2189617 WS=6
  3   0.000319     10.0.1.3 -> 10.0.1.2     TCP 42520 > 9040 [ACK] Seq=1 Ack=1 Win=5888 Len=0 TSV=2189617 TSER=2243021
259403  21.286239     10.0.1.3 -> 10.0.1.2     TCP 42520 > 9040 [FIN, ACK] Seq=9 Ack=250000001 Win=2580480 Len=0 TSV=2194939 TSER=2248289
259404  21.322713     10.0.1.2 -> 10.0.1.3     TCP 9040 > 42520 [ACK] Seq=250000001 Ack=10 Win=14528 Len=0 TSV=2248353 TSER=2194939
================================================================================
IPv4 Conversations
Filter:<No Filter>
                                               |       <-      | |       ->      | |     Total     |
                                               | Frames  Bytes | | Frames  Bytes | | Frames  Bytes |
10.0.1.3             <-> 10.0.1.2              172656 261395304   86748   5725384  259404 267120688
================================================================================
  1   0.000000     10.0.1.3 -> 10.0.1.2     TCP 42521 > 9040 [SYN] Seq=0 Win=5840 Len=0 MSS=1460 TSV=2197639 TSER=0 WS=6
  2   0.000315     10.0.1.2 -> 10.0.1.3     TCP 9040 > 42521 [SYN, ACK] Seq=0 Ack=1 Win=14480 Len=0 MSS=1460 TSV=2251044 TSER=2197639 WS=6
  3   0.000351     10.0.1.3 -> 10.0.1.2     TCP 42521 > 9040 [ACK] Seq=1 Ack=1 Win=5888 Len=0 TSV=2197639 TSER=2251044
259373  21.286248     10.0.1.3 -> 10.0.1.2     TCP 42521 > 9040 [FIN, ACK] Seq=9 Ack=250000001 Win=2580480 Len=0 TSV=2202961 TSER=2256313
259374  21.323281     10.0.1.2 -> 10.0.1.3     TCP 9040 > 42521 [ACK] Seq=250000001 Ack=10 Win=14528 Len=0 TSV=2256376 TSER=2202961
================================================================================
IPv4 Conversations
Filter:<No Filter>
                                               |       <-      | |       ->      | |     Total     |
                                               | Frames  Bytes | | Frames  Bytes | | Frames  Bytes |
10.0.1.3             <-> 10.0.1.2              172656 261395304   86718   5723404  259374 267118708
================================================================================
  1   0.000000     10.0.1.3 -> 10.0.1.2     TCP 42522 > 9040 [SYN] Seq=0 Win=5840 Len=0 MSS=1460 TSV=2205662 TSER=0 WS=6
  2   0.000292     10.0.1.2 -> 10.0.1.3     TCP 9040 > 42522 [SYN, ACK] Seq=0 Ack=1 Win=14480 Len=0 MSS=1460 TSV=2259067 TSER=2205662 WS=6
  3   0.000324     10.0.1.3 -> 10.0.1.2     TCP 42522 > 9040 [ACK] Seq=1 Ack=1 Win=5888 Len=0 TSV=2205662 TSER=2259067
259394  21.286319     10.0.1.3 -> 10.0.1.2     TCP 42522 > 9040 [FIN, ACK] Seq=9 Ack=250000001 Win=2580480 Len=0 TSV=2210983 TSER=2264335
259395  21.322931     10.0.1.2 -> 10.0.1.3     TCP 9040 > 42522 [ACK] Seq=250000001 Ack=10 Win=14528 Len=0 TSV=2264399 TSER=2210983
================================================================================
IPv4 Conversations
Filter:<No Filter>
                                               |       <-      | |       ->      | |     Total     |
                                               | Frames  Bytes | | Frames  Bytes | | Frames  Bytes |
10.0.1.3             <-> 10.0.1.2              172656 261395304   86739   5724790  259395 267120094
================================================================================
  1   0.000000     10.0.1.3 -> 10.0.1.2     TCP 42523 > 9040 [SYN] Seq=0 Win=5840 Len=0 MSS=1460 TSV=2213679 TSER=0 WS=6
  2   0.000279     10.0.1.2 -> 10.0.1.3     TCP 9040 > 42523 [SYN, ACK] Seq=0 Ack=1 Win=14480 Len=0 MSS=1460 TSV=2267085 TSER=2213679 WS=6
  3   0.000315     10.0.1.3 -> 10.0.1.2     TCP 42523 > 9040 [ACK] Seq=1 Ack=1 Win=5888 Len=0 TSV=2213679 TSER=2267085
259418  21.286264     10.0.1.3 -> 10.0.1.2     TCP 42523 > 9040 [FIN, ACK] Seq=9 Ack=250000001 Win=2580480 Len=0 TSV=2219000 TSER=2272352
259419  21.324364     10.0.1.2 -> 10.0.1.3     TCP 9040 > 42523 [ACK] Seq=250000001 Ack=10 Win=14528 Len=0 TSV=2272417 TSER=2219000
================================================================================
IPv4 Conversations
Filter:<No Filter>
                                               |       <-      | |       ->      | |     Total     |
                                               | Frames  Bytes | | Frames  Bytes | | Frames  Bytes |
10.0.1.3             <-> 10.0.1.2              172656 261395304   86763   5726374  259419 267121678
================================================================================
  1   0.000000     10.0.1.3 -> 10.0.1.2     TCP 42524 > 9040 [SYN] Seq=0 Win=5840 Len=0 MSS=1460 TSV=2221709 TSER=0 WS=6
  2   0.000322     10.0.1.2 -> 10.0.1.3     TCP 9040 > 42524 [SYN, ACK] Seq=0 Ack=1 Win=14480 Len=0 MSS=1460 TSV=2275116 TSER=2221709 WS=6
  3   0.000357     10.0.1.3 -> 10.0.1.2     TCP 42524 > 9040 [ACK] Seq=1 Ack=1 Win=5888 Len=0 TSV=2221709 TSER=2275116
259417  21.286229     10.0.1.3 -> 10.0.1.2     TCP 42524 > 9040 [FIN, ACK] Seq=9 Ack=250000001 Win=2560064 Len=0 TSV=2227031 TSER=2280385
259418  21.324751     10.0.1.2 -> 10.0.1.3     TCP 9040 > 42524 [ACK] Seq=250000001 Ack=10 Win=14528 Len=0 TSV=2280448 TSER=2227031
================================================================================
IPv4 Conversations
Filter:<No Filter>
                                               |       <-      | |       ->      | |     Total     |
                                               | Frames  Bytes | | Frames  Bytes | | Frames  Bytes |
10.0.1.3             <-> 10.0.1.2              172656 261395304   86762   5726308  259418 267121612
================================================================================
  1   0.000000     10.0.1.3 -> 10.0.1.2     TCP 42525 > 9040 [SYN] Seq=0 Win=5840 Len=0 MSS=1460 TSV=2229730 TSER=0 WS=6
  2   0.000310     10.0.1.2 -> 10.0.1.3     TCP 9040 > 42525 [SYN, ACK] Seq=0 Ack=1 Win=14480 Len=0 MSS=1460 TSV=2283137 TSER=2229730 WS=6
  3   0.000347     10.0.1.3 -> 10.0.1.2     TCP 42525 > 9040 [ACK] Seq=1 Ack=1 Win=5888 Len=0 TSV=2229730 TSER=2283137
259380  21.286243     10.0.1.3 -> 10.0.1.2     TCP 42525 > 9040 [FIN, ACK] Seq=9 Ack=250000001 Win=2580480 Len=0 TSV=2235051 TSER=2288405
259381  21.324452     10.0.1.2 -> 10.0.1.3     TCP 9040 > 42525 [ACK] Seq=250000001 Ack=10 Win=14528 Len=0 TSV=2288469 TSER=2235051
================================================================================
IPv4 Conversations
Filter:<No Filter>
                                               |       <-      | |       ->      | |     Total     |
                                               | Frames  Bytes | | Frames  Bytes | | Frames  Bytes |
10.0.1.3             <-> 10.0.1.2              172656 261395304   86725   5723866  259381 267119170
================================================================================
  1   0.000000     10.0.1.3 -> 10.0.1.2     TCP 42526 > 9040 [SYN] Seq=0 Win=5840 Len=0 MSS=1460 TSV=2237736 TSER=0 WS=6
  2   0.000288     10.0.1.2 -> 10.0.1.3     TCP 9040 > 42526 [SYN, ACK] Seq=0 Ack=1 Win=14480 Len=0 MSS=1460 TSV=2291144 TSER=2237736 WS=6
  3   0.000323     10.0.1.3 -> 10.0.1.2     TCP 42526 > 9040 [ACK] Seq=1 Ack=1 Win=5888 Len=0 TSV=2237736 TSER=2291144
259407  21.286245     10.0.1.3 -> 10.0.1.2     TCP 42526 > 9040 [FIN, ACK] Seq=9 Ack=250000001 Win=2580480 Len=0 TSV=2243057 TSER=2296412
259408  21.324869     10.0.1.2 -> 10.0.1.3     TCP 9040 > 42526 [ACK] Seq=250000001 Ack=10 Win=14528 Len=0 TSV=2296476 TSER=2243057
================================================================================
IPv4 Conversations
Filter:<No Filter>
                                               |       <-      | |       ->      | |     Total     |
                                               | Frames  Bytes | | Frames  Bytes | | Frames  Bytes |
10.0.1.3             <-> 10.0.1.2              172656 261395304   86752   5725648  259408 267120952
================================================================================
  1   0.000000     10.0.1.3 -> 10.0.1.2     TCP 42527 > 9040 [SYN] Seq=0 Win=5840 Len=0 MSS=1460 TSV=2245762 TSER=0 WS=6
  2   0.000364     10.0.1.2 -> 10.0.1.3     TCP 9040 > 42527 [SYN, ACK] Seq=0 Ack=1 Win=14480 Len=0 MSS=1460 TSV=2299171 TSER=2245762 WS=6
  3   0.000402     10.0.1.3 -> 10.0.1.2     TCP 42527 > 9040 [ACK] Seq=1 Ack=1 Win=5888 Len=0 TSV=2245762 TSER=2299171
259389  21.286227     10.0.1.3 -> 10.0.1.2     TCP 42527 > 9040 [FIN, ACK] Seq=9 Ack=250000001 Win=2580480 Len=0 TSV=2251084 TSER=2304438
259390  21.325293     10.0.1.2 -> 10.0.1.3     TCP 9040 > 42527 [ACK] Seq=250000001 Ack=10 Win=14528 Len=0 TSV=2304503 TSER=2251084
================================================================================
IPv4 Conversations
Filter:<No Filter>
                                               |       <-      | |       ->      | |     Total     |
                                               | Frames  Bytes | | Frames  Bytes | | Frames  Bytes |
10.0.1.3             <-> 10.0.1.2              172656 261395304   86734   5724460  259390 267119764
================================================================================
