  1   0.000000     10.0.1.3 -> 10.0.1.2     TCP 42361 > 9040 [SYN] Seq=0 Win=5840 Len=0 MSS=1460 TSV=2442424 TSER=0 WS=6
  2   0.000320     10.0.1.2 -> 10.0.1.3     TCP 9040 > 42361 [SYN, ACK] Seq=0 Ack=1 Win=14480 Len=0 MSS=1460 TSV=2495847 TSER=2442424 WS=6
  3   0.000352     10.0.1.3 -> 10.0.1.2     TCP 42361 > 9040 [ACK] Seq=1 Ack=1 Win=5888 Len=0 TSV=2442424 TSER=2495847
362961  29.800136     10.0.1.3 -> 10.0.1.2     TCP 42361 > 9040 [FIN, ACK] Seq=9 Ack=350000001 Win=2580480 Len=0 TSV=2449874 TSER=2503243
362962  29.839467     10.0.1.2 -> 10.0.1.3     TCP 9040 > 42361 [ACK] Seq=350000001 Ack=10 Win=14528 Len=0 TSV=2503308 TSER=2449874
================================================================================
IPv4 Conversations
Filter:<No Filter>
                                               |       <-      | |       ->      | |     Total     |
                                               | Frames  Bytes | | Frames  Bytes | | Frames  Bytes |
10.0.1.3             <-> 10.0.1.2              241717 365953330  121245   8002186  362962 373955516
================================================================================
  1   0.000000     10.0.1.3 -> 10.0.1.2     TCP 42362 > 9040 [SYN] Seq=0 Win=5840 Len=0 MSS=1460 TSV=2453259 TSER=0 WS=6
  2   0.000329     10.0.1.2 -> 10.0.1.3     TCP 9040 > 42362 [SYN, ACK] Seq=0 Ack=1 Win=14480 Len=0 MSS=1460 TSV=2506683 TSER=2453259 WS=6
  3   0.000363     10.0.1.3 -> 10.0.1.2     TCP 42362 > 9040 [ACK] Seq=1 Ack=1 Win=5888 Len=0 TSV=2453259 TSER=2506683
362974  29.800042     10.0.1.3 -> 10.0.1.2     TCP 42362 > 9040 [FIN, ACK] Seq=9 Ack=350000001 Win=2580480 Len=0 TSV=2460709 TSER=2514080
362975  29.838399     10.0.1.2 -> 10.0.1.3     TCP 9040 > 42362 [ACK] Seq=350000001 Ack=10 Win=14528 Len=0 TSV=2514144 TSER=2460709
================================================================================
IPv4 Conversations
Filter:<No Filter>
                                               |       <-      | |       ->      | |     Total     |
                                               | Frames  Bytes | | Frames  Bytes | | Frames  Bytes |
10.0.1.3             <-> 10.0.1.2              241717 365953330  121258   8003044  362975 373956374
================================================================================
  1   0.000000     10.0.1.3 -> 10.0.1.2     TCP 42363 > 9040 [SYN] Seq=0 Win=5840 Len=0 MSS=1460 TSV=2464065 TSER=0 WS=6
  2   0.000319     10.0.1.2 -> 10.0.1.3     TCP 9040 > 42363 [SYN, ACK] Seq=0 Ack=1 Win=14480 Len=0 MSS=1460 TSV=2517490 TSER=2464065 WS=6
  3   0.000350     10.0.1.3 -> 10.0.1.2     TCP 42363 > 9040 [ACK] Seq=1 Ack=1 Win=5888 Len=0 TSV=2464065 TSER=2517490
362998  29.802384     10.0.1.3 -> 10.0.1.2     TCP 42363 > 9040 [FIN, ACK] Seq=9 Ack=350000001 Win=2580480 Len=0 TSV=2471515 TSER=2524887
362999  29.840888     10.0.1.2 -> 10.0.1.3     TCP 9040 > 42363 [ACK] Seq=350000001 Ack=10 Win=14528 Len=0 TSV=2524951 TSER=2471515
================================================================================
IPv4 Conversations
Filter:<No Filter>
                                               |       <-      | |       ->      | |     Total     |
                                               | Frames  Bytes | | Frames  Bytes | | Frames  Bytes |
10.0.1.3             <-> 10.0.1.2              241717 365953330  121282   8004628  362999 373957958
================================================================================
  1   0.000000     10.0.1.3 -> 10.0.1.2     TCP 42364 > 9040 [SYN] Seq=0 Win=5840 Len=0 MSS=1460 TSV=2474867 TSER=0 WS=6
  2   0.000325     10.0.1.2 -> 10.0.1.3     TCP 9040 > 42364 [SYN, ACK] Seq=0 Ack=1 Win=14480 Len=0 MSS=1460 TSV=2528293 TSER=2474867 WS=6
  3   0.000355     10.0.1.3 -> 10.0.1.2     TCP 42364 > 9040 [ACK] Seq=1 Ack=1 Win=5888 Len=0 TSV=2474867 TSER=2528293
362989  29.800159     10.0.1.3 -> 10.0.1.2     TCP 42364 > 9040 [FIN, ACK] Seq=9 Ack=350000001 Win=2560064 Len=0 TSV=2482317 TSER=2535689
362990  29.839666     10.0.1.2 -> 10.0.1.3     TCP 9040 > 42364 [ACK] Seq=350000001 Ack=10 Win=14528 Len=0 TSV=2535754 TSER=2482317
================================================================================
IPv4 Conversations
Filter:<No Filter>
                                               |       <-      | |       ->      | |     Total     |
                                               | Frames  Bytes | | Frames  Bytes | | Frames  Bytes |
10.0.1.3             <-> 10.0.1.2              241717 365953330  121273   8004034  362990 373957364
================================================================================
  1   0.000000     10.0.1.3 -> 10.0.1.2     TCP 33099 > 9040 [SYN] Seq=0 Win=5840 Len=0 MSS=1460 TSV=2485710 TSER=0 WS=6
  2   0.000323     10.0.1.2 -> 10.0.1.3     TCP 9040 > 33099 [SYN, ACK] Seq=0 Ack=1 Win=14480 Len=0 MSS=1460 TSV=2539136 TSER=2485710 WS=6
  3   0.000357     10.0.1.3 -> 10.0.1.2     TCP 33099 > 9040 [ACK] Seq=1 Ack=1 Win=5888 Len=0 TSV=2485710 TSER=2539136
363009  29.800049     10.0.1.3 -> 10.0.1.2     TCP 33099 > 9040 [FIN, ACK] Seq=9 Ack=350000001 Win=2580480 Len=0 TSV=2493160 TSER=2546532
363010  29.838489     10.0.1.2 -> 10.0.1.3     TCP 9040 > 33099 [ACK] Seq=350000001 Ack=10 Win=14528 Len=0 TSV=2546597 TSER=2493160
================================================================================
IPv4 Conversations
Filter:<No Filter>
                                               |       <-      | |       ->      | |     Total     |
                                               | Frames  Bytes | | Frames  Bytes | | Frames  Bytes |
10.0.1.3             <-> 10.0.1.2              241717 365953330  121293   8005354  363010 373958684
================================================================================
  1   0.000000     10.0.1.3 -> 10.0.1.2     TCP 33100 > 9040 [SYN] Seq=0 Win=5840 Len=0 MSS=1460 TSV=2496643 TSER=0 WS=6
  2   0.000328     10.0.1.2 -> 10.0.1.3     TCP 9040 > 33100 [SYN, ACK] Seq=0 Ack=1 Win=14480 Len=0 MSS=1460 TSV=2550071 TSER=2496643 WS=6
  3   0.000361     10.0.1.3 -> 10.0.1.2     TCP 33100 > 9040 [ACK] Seq=1 Ack=1 Win=5888 Len=0 TSV=2496643 TSER=2550071
362991  29.800097     10.0.1.3 -> 10.0.1.2     TCP 33100 > 9040 [FIN, ACK] Seq=9 Ack=350000001 Win=2580480 Len=0 TSV=2504093 TSER=2557467
362992  29.836823     10.0.1.2 -> 10.0.1.3     TCP 9040 > 33100 [ACK] Seq=350000001 Ack=10 Win=14528 Len=0 TSV=2557531 TSER=2504093
================================================================================
IPv4 Conversations
Filter:<No Filter>
                                               |       <-      | |       ->      | |     Total     |
                                               | Frames  Bytes | | Frames  Bytes | | Frames  Bytes |
10.0.1.3             <-> 10.0.1.2              241717 365953330  121275   8004166  362992 373957496
================================================================================
  1   0.000000     10.0.1.3 -> 10.0.1.2     TCP 33101 > 9040 [SYN] Seq=0 Win=5840 Len=0 MSS=1460 TSV=2507416 TSER=0 WS=6
  2   0.000383     10.0.1.2 -> 10.0.1.3     TCP 9040 > 33101 [SYN, ACK] Seq=0 Ack=1 Win=14480 Len=0 MSS=1460 TSV=2560844 TSER=2507416 WS=6
  3   0.000423     10.0.1.3 -> 10.0.1.2     TCP 33101 > 9040 [ACK] Seq=1 Ack=1 Win=5888 Len=0 TSV=2507416 TSER=2560844
362997  29.800112     10.0.1.3 -> 10.0.1.2     TCP 33101 > 9040 [FIN, ACK] Seq=9 Ack=350000001 Win=2580480 Len=0 TSV=2514866 TSER=2568240
362998  29.839844     10.0.1.2 -> 10.0.1.3     TCP 9040 > 33101 [ACK] Seq=350000001 Ack=10 Win=14528 Len=0 TSV=2568305 TSER=2514866
================================================================================
IPv4 Conversations
Filter:<No Filter>
                                               |       <-      | |       ->      | |     Total     |
                                               | Frames  Bytes | | Frames  Bytes | | Frames  Bytes |
10.0.1.3             <-> 10.0.1.2              241717 365953330  121281   8004562  362998 373957892
================================================================================
  1   0.000000     10.0.1.3 -> 10.0.1.2     TCP 33102 > 9040 [SYN] Seq=0 Win=5840 Len=0 MSS=1460 TSV=2518257 TSER=0 WS=6
  2   0.000325     10.0.1.2 -> 10.0.1.3     TCP 9040 > 33102 [SYN, ACK] Seq=0 Ack=1 Win=14480 Len=0 MSS=1460 TSV=2571686 TSER=2518257 WS=6
  3   0.000356     10.0.1.3 -> 10.0.1.2     TCP 33102 > 9040 [ACK] Seq=1 Ack=1 Win=5888 Len=0 TSV=2518257 TSER=2571686
363006  29.800021     10.0.1.3 -> 10.0.1.2     TCP 33102 > 9040 [FIN, ACK] Seq=9 Ack=350000001 Win=2560064 Len=0 TSV=2525707 TSER=2579084
363007  29.838970     10.0.1.2 -> 10.0.1.3     TCP 9040 > 33102 [ACK] Seq=350000001 Ack=10 Win=14528 Len=0 TSV=2579147 TSER=2525707
================================================================================
IPv4 Conversations
Filter:<No Filter>
                                               |       <-      | |       ->      | |     Total     |
                                               | Frames  Bytes | | Frames  Bytes | | Frames  Bytes |
10.0.1.3             <-> 10.0.1.2              241717 365953330  121290   8005156  363007 373958486
================================================================================
  1   0.000000     10.0.1.3 -> 10.0.1.2     TCP 33103 > 9040 [SYN] Seq=0 Win=5840 Len=0 MSS=1460 TSV=2529066 TSER=0 WS=6
  2   0.000282     10.0.1.2 -> 10.0.1.3     TCP 9040 > 33103 [SYN, ACK] Seq=0 Ack=1 Win=14480 Len=0 MSS=1460 TSV=2582496 TSER=2529066 WS=6
  3   0.000317     10.0.1.3 -> 10.0.1.2     TCP 33103 > 9040 [ACK] Seq=1 Ack=1 Win=5888 Len=0 TSV=2529066 TSER=2582496
362971  29.799957     10.0.1.3 -> 10.0.1.2     TCP 33103 > 9040 [FIN, ACK] Seq=9 Ack=350000001 Win=2580480 Len=0 TSV=2536516 TSER=2589892
362972  29.839181     10.0.1.2 -> 10.0.1.3     TCP 9040 > 33103 [ACK] Seq=350000001 Ack=10 Win=14528 Len=0 TSV=2589957 TSER=2536516
================================================================================
IPv4 Conversations
Filter:<No Filter>
                                               |       <-      | |       ->      | |     Total     |
                                               | Frames  Bytes | | Frames  Bytes | | Frames  Bytes |
10.0.1.3             <-> 10.0.1.2              241717 365953330  121255   8002846  362972 373956176
================================================================================
  1   0.000000     10.0.1.3 -> 10.0.1.2     TCP 33104 > 9040 [SYN] Seq=0 Win=5840 Len=0 MSS=1460 TSV=2539851 TSER=0 WS=6
  2   0.000279     10.0.1.2 -> 10.0.1.3     TCP 9040 > 33104 [SYN, ACK] Seq=0 Ack=1 Win=14480 Len=0 MSS=1460 TSV=2593282 TSER=2539851 WS=6
  3   0.000311     10.0.1.3 -> 10.0.1.2     TCP 33104 > 9040 [ACK] Seq=1 Ack=1 Win=5888 Len=0 TSV=2539851 TSER=2593282
362974  29.799981     10.0.1.3 -> 10.0.1.2     TCP 33104 > 9040 [FIN, ACK] Seq=9 Ack=350000001 Win=2580480 Len=0 TSV=2547301 TSER=2600678
362975  29.837807     10.0.1.2 -> 10.0.1.3     TCP 9040 > 33104 [ACK] Seq=350000001 Ack=10 Win=14528 Len=0 TSV=2600742 TSER=2547301
================================================================================
IPv4 Conversations
Filter:<No Filter>
                                               |       <-      | |       ->      | |     Total     |
                                               | Frames  Bytes | | Frames  Bytes | | Frames  Bytes |
10.0.1.3             <-> 10.0.1.2              241717 365953330  121258   8003044  362975 373956374
================================================================================
  1   0.000000     10.0.1.3 -> 10.0.1.2     TCP 55975 > 9040 [SYN] Seq=0 Win=5840 Len=0 MSS=1460 TSV=2550684 TSER=0 WS=6
  2   0.000370     10.0.1.2 -> 10.0.1.3     TCP 9040 > 55975 [SYN, ACK] Seq=0 Ack=1 Win=14480 Len=0 MSS=1460 TSV=2604116 TSER=2550684 WS=6
  3   0.000409     10.0.1.3 -> 10.0.1.2     TCP 55975 > 9040 [ACK] Seq=1 Ack=1 Win=5888 Len=0 TSV=2550684 TSER=2604116
362978  29.800030     10.0.1.3 -> 10.0.1.2     TCP 55975 > 9040 [FIN, ACK] Seq=9 Ack=350000001 Win=2580480 Len=0 TSV=2558134 TSER=2611512
362979  29.837171     10.0.1.2 -> 10.0.1.3     TCP 9040 > 55975 [ACK] Seq=350000001 Ack=10 Win=14528 Len=0 TSV=2611576 TSER=2558134
================================================================================
IPv4 Conversations
Filter:<No Filter>
                                               |       <-      | |       ->      | |     Total     |
                                               | Frames  Bytes | | Frames  Bytes | | Frames  Bytes |
10.0.1.3             <-> 10.0.1.2              241717 365953330  121262   8003308  362979 373956638
================================================================================
  1   0.000000     10.0.1.3 -> 10.0.1.2     TCP 55976 > 9040 [SYN] Seq=0 Win=5840 Len=0 MSS=1460 TSV=2561506 TSER=0 WS=6
  2   0.000302     10.0.1.2 -> 10.0.1.3     TCP 9040 > 55976 [SYN, ACK] Seq=0 Ack=1 Win=14480 Len=0 MSS=1460 TSV=2614939 TSER=2561506 WS=6
  3   0.000337     10.0.1.3 -> 10.0.1.2     TCP 55976 > 9040 [ACK] Seq=1 Ack=1 Win=5888 Len=0 TSV=2561506 TSER=2614939
362985  29.799920     10.0.1.3 -> 10.0.1.2     TCP 55976 > 9040 [FIN, ACK] Seq=9 Ack=350000001 Win=2580480 Len=0 TSV=2568956 TSER=2622335
362986  29.836717     10.0.1.2 -> 10.0.1.3     TCP 9040 > 55976 [ACK] Seq=350000001 Ack=10 Win=14528 Len=0 TSV=2622399 TSER=2568956
================================================================================
IPv4 Conversations
Filter:<No Filter>
                                               |       <-      | |       ->      | |     Total     |
                                               | Frames  Bytes | | Frames  Bytes | | Frames  Bytes |
10.0.1.3             <-> 10.0.1.2              241717 365953330  121269   8003770  362986 373957100
================================================================================
  1   0.000000     10.0.1.3 -> 10.0.1.2     TCP 55977 > 9040 [SYN] Seq=0 Win=5840 Len=0 MSS=1460 TSV=2572333 TSER=0 WS=6
  2   0.000395     10.0.1.2 -> 10.0.1.3     TCP 9040 > 55977 [SYN, ACK] Seq=0 Ack=1 Win=14480 Len=0 MSS=1460 TSV=2625766 TSER=2572333 WS=6
  3   0.000433     10.0.1.3 -> 10.0.1.2     TCP 55977 > 9040 [ACK] Seq=1 Ack=1 Win=5888 Len=0 TSV=2572333 TSER=2625766
362990  29.800155     10.0.1.3 -> 10.0.1.2     TCP 55977 > 9040 [FIN, ACK] Seq=9 Ack=350000001 Win=2580480 Len=0 TSV=2579783 TSER=2633162
362991  29.838903     10.0.1.2 -> 10.0.1.3     TCP 9040 > 55977 [ACK] Seq=350000001 Ack=10 Win=14528 Len=0 TSV=2633227 TSER=2579783
================================================================================
IPv4 Conversations
Filter:<No Filter>
                                               |       <-      | |       ->      | |     Total     |
                                               | Frames  Bytes | | Frames  Bytes | | Frames  Bytes |
10.0.1.3             <-> 10.0.1.2              241717 365953330  121274   8004100  362991 373957430
================================================================================
  1   0.000000     10.0.1.3 -> 10.0.1.2     TCP 55978 > 9040 [SYN] Seq=0 Win=5840 Len=0 MSS=1460 TSV=2583118 TSER=0 WS=6
  2   0.000327     10.0.1.2 -> 10.0.1.3     TCP 9040 > 55978 [SYN, ACK] Seq=0 Ack=1 Win=14480 Len=0 MSS=1460 TSV=2636552 TSER=2583118 WS=6
  3   0.000365     10.0.1.3 -> 10.0.1.2     TCP 55978 > 9040 [ACK] Seq=1 Ack=1 Win=5888 Len=0 TSV=2583118 TSER=2636552
363000  29.800111     10.0.1.3 -> 10.0.1.2     TCP 55978 > 9040 [FIN, ACK] Seq=9 Ack=350000001 Win=2560064 Len=0 TSV=2590568 TSER=2643949
363001  29.839625     10.0.1.2 -> 10.0.1.3     TCP 9040 > 55978 [ACK] Seq=350000001 Ack=10 Win=14528 Len=0 TSV=2644013 TSER=2590568
================================================================================
IPv4 Conversations
Filter:<No Filter>
                                               |       <-      | |       ->      | |     Total     |
                                               | Frames  Bytes | | Frames  Bytes | | Frames  Bytes |
10.0.1.3             <-> 10.0.1.2              241717 365953330  121284   8004760  363001 373958090
================================================================================
  1   0.000000     10.0.1.3 -> 10.0.1.2     TCP 55979 > 9040 [SYN] Seq=0 Win=5840 Len=0 MSS=1460 TSV=2593945 TSER=0 WS=6
  2   0.000282     10.0.1.2 -> 10.0.1.3     TCP 9040 > 55979 [SYN, ACK] Seq=0 Ack=1 Win=14480 Len=0 MSS=1460 TSV=2647380 TSER=2593945 WS=6
  3   0.000323     10.0.1.3 -> 10.0.1.2     TCP 55979 > 9040 [ACK] Seq=1 Ack=1 Win=5888 Len=0 TSV=2593945 TSER=2647380
362974  29.800016     10.0.1.3 -> 10.0.1.2     TCP 55979 > 9040 [FIN, ACK] Seq=9 Ack=350000001 Win=2580480 Len=0 TSV=2601395 TSER=2654777
362975  29.838812     10.0.1.2 -> 10.0.1.3     TCP 9040 > 55979 [ACK] Seq=350000001 Ack=10 Win=14528 Len=0 TSV=2654841 TSER=2601395
================================================================================
IPv4 Conversations
Filter:<No Filter>
                                               |       <-      | |       ->      | |     Total     |
                                               | Frames  Bytes | | Frames  Bytes | | Frames  Bytes |
10.0.1.3             <-> 10.0.1.2              241717 365953330  121258   8003044  362975 373956374
================================================================================
  1   0.000000     10.0.1.3 -> 10.0.1.2     TCP 55980 > 9040 [SYN] Seq=0 Win=5840 Len=0 MSS=1460 TSV=2604770 TSER=0 WS=6
  2   0.000312     10.0.1.2 -> 10.0.1.3     TCP 9040 > 55980 [SYN, ACK] Seq=0 Ack=1 Win=14480 Len=0 MSS=1460 TSV=2658206 TSER=2604770 WS=6
  3   0.000349     10.0.1.3 -> 10.0.1.2     TCP 55980 > 9040 [ACK] Seq=1 Ack=1 Win=5888 Len=0 TSV=2604770 TSER=2658206
362999  29.799947     10.0.1.3 -> 10.0.1.2     TCP 55980 > 9040 [FIN, ACK] Seq=9 Ack=350000001 Win=2580480 Len=0 TSV=2612220 TSER=2665602
363000  29.837529     10.0.1.2 -> 10.0.1.3     TCP 9040 > 55980 [ACK] Seq=350000001 Ack=10 Win=14528 Len=0 TSV=2665666 TSER=2612220
================================================================================
IPv4 Conversations
Filter:<No Filter>
                                               |       <-      | |       ->      | |     Total     |
                                               | Frames  Bytes | | Frames  Bytes | | Frames  Bytes |
10.0.1.3             <-> 10.0.1.2              241717 365953330  121283   8004694  363000 373958024
================================================================================
  1   0.000000     10.0.1.3 -> 10.0.1.2     TCP 55981 > 9040 [SYN] Seq=0 Win=5840 Len=0 MSS=1460 TSV=2615560 TSER=0 WS=6
  2   0.000348     10.0.1.2 -> 10.0.1.3     TCP 9040 > 55981 [SYN, ACK] Seq=0 Ack=1 Win=14480 Len=0 MSS=1460 TSV=2668997 TSER=2615560 WS=6
  3   0.000384     10.0.1.3 -> 10.0.1.2     TCP 55981 > 9040 [ACK] Seq=1 Ack=1 Win=5888 Len=0 TSV=2615560 TSER=2668997
362951  29.800031     10.0.1.3 -> 10.0.1.2     TCP 55981 > 9040 [FIN, ACK] Seq=9 Ack=350000001 Win=2580480 Len=0 TSV=2623010 TSER=2676393
362952  29.840102     10.0.1.2 -> 10.0.1.3     TCP 9040 > 55981 [ACK] Seq=350000001 Ack=10 Win=14528 Len=0 TSV=2676458 TSER=2623010
================================================================================
IPv4 Conversations
Filter:<No Filter>
                                               |       <-      | |       ->      | |     Total     |
                                               | Frames  Bytes | | Frames  Bytes | | Frames  Bytes |
10.0.1.3             <-> 10.0.1.2              241717 365953330  121235   8001526  362952 373954856
================================================================================
  1   0.000000     10.0.1.3 -> 10.0.1.2     TCP 47801 > 9040 [SYN] Seq=0 Win=5840 Len=0 MSS=1460 TSV=2626380 TSER=0 WS=6
  2   0.000333     10.0.1.2 -> 10.0.1.3     TCP 9040 > 47801 [SYN, ACK] Seq=0 Ack=1 Win=14480 Len=0 MSS=1460 TSV=2679817 TSER=2626380 WS=6
  3   0.000367     10.0.1.3 -> 10.0.1.2     TCP 47801 > 9040 [ACK] Seq=1 Ack=1 Win=5888 Len=0 TSV=2626380 TSER=2679817
362970  29.800086     10.0.1.3 -> 10.0.1.2     TCP 47801 > 9040 [FIN, ACK] Seq=9 Ack=350000001 Win=2580480 Len=0 TSV=2633830 TSER=2687213
362971  29.839070     10.0.1.2 -> 10.0.1.3     TCP 9040 > 47801 [ACK] Seq=350000001 Ack=10 Win=14528 Len=0 TSV=2687278 TSER=2633830
================================================================================
IPv4 Conversations
Filter:<No Filter>
                                               |       <-      | |       ->      | |     Total     |
                                               | Frames  Bytes | | Frames  Bytes | | Frames  Bytes |
10.0.1.3             <-> 10.0.1.2              241717 365953330  121254   8002780  362971 373956110
================================================================================
  1   0.000000     10.0.1.3 -> 10.0.1.2     TCP 47803 > 9040 [SYN] Seq=0 Win=5840 Len=0 MSS=1460 TSV=2637201 TSER=0 WS=6
  2   0.000306     10.0.1.2 -> 10.0.1.3     TCP 9040 > 47803 [SYN, ACK] Seq=0 Ack=1 Win=14480 Len=0 MSS=1460 TSV=2690639 TSER=2637201 WS=6
  3   0.000343     10.0.1.3 -> 10.0.1.2     TCP 47803 > 9040 [ACK] Seq=1 Ack=1 Win=5888 Len=0 TSV=2637201 TSER=2690639
362988  29.799931     10.0.1.3 -> 10.0.1.2     TCP 47803 > 9040 [FIN, ACK] Seq=9 Ack=350000001 Win=2580480 Len=0 TSV=2644651 TSER=2698035
362989  29.839527     10.0.1.2 -> 10.0.1.3     TCP 9040 > 47803 [ACK] Seq=350000001 Ack=10 Win=14528 Len=0 TSV=2698100 TSER=2644651
================================================================================
IPv4 Conversations
Filter:<No Filter>
                                               |       <-      | |       ->      | |     Total     |
                                               | Frames  Bytes | | Frames  Bytes | | Frames  Bytes |
10.0.1.3             <-> 10.0.1.2              241717 365953330  121272   8003968  362989 373957298
================================================================================
  1   0.000000     10.0.1.3 -> 10.0.1.2     TCP 47804 > 9040 [SYN] Seq=0 Win=5840 Len=0 MSS=1460 TSV=2648014 TSER=0 WS=6
  2   0.000311     10.0.1.2 -> 10.0.1.3     TCP 9040 > 47804 [SYN, ACK] Seq=0 Ack=1 Win=14480 Len=0 MSS=1460 TSV=2701453 TSER=2648014 WS=6
  3   0.000345     10.0.1.3 -> 10.0.1.2     TCP 47804 > 9040 [ACK] Seq=1 Ack=1 Win=5888 Len=0 TSV=2648014 TSER=2701453
362971  29.800040     10.0.1.3 -> 10.0.1.2     TCP 47804 > 9040 [FIN, ACK] Seq=9 Ack=350000001 Win=2580480 Len=0 TSV=2655464 TSER=2708849
362972  29.836428     10.0.1.2 -> 10.0.1.3     TCP 9040 > 47804 [ACK] Seq=350000001 Ack=10 Win=14528 Len=0 TSV=2708913 TSER=2655464
================================================================================
IPv4 Conversations
Filter:<No Filter>
                                               |       <-      | |       ->      | |     Total     |
                                               | Frames  Bytes | | Frames  Bytes | | Frames  Bytes |
10.0.1.3             <-> 10.0.1.2              241717 365953330  121255   8002846  362972 373956176
================================================================================
