  1   0.000000     10.0.1.3 -> 10.0.1.2     TCP 44956 > 9040 [SYN] Seq=0 Win=5840 Len=0 MSS=1460 TSV=2253776 TSER=0 WS=6
  2   0.000325     10.0.1.2 -> 10.0.1.3     TCP 9040 > 44956 [SYN, ACK] Seq=0 Ack=1 Win=14480 Len=0 MSS=1460 TSV=2307185 TSER=2253776 WS=6
  3   0.000360     10.0.1.3 -> 10.0.1.2     TCP 44956 > 9040 [ACK] Seq=1 Ack=1 Win=5888 Len=0 TSV=2253776 TSER=2307185
311149  25.543160     10.0.1.3 -> 10.0.1.2     TCP 44956 > 9040 [FIN, ACK] Seq=9 Ack=300000001 Win=2580480 Len=0 TSV=2260162 TSER=2313517
311150  25.582860     10.0.1.2 -> 10.0.1.3     TCP 9040 > 44956 [ACK] Seq=300000001 Ack=10 Win=14528 Len=0 TSV=2313582 TSER=2260162
================================================================================
IPv4 Conversations
Filter:<No Filter>
                                               |       <-      | |       ->      | |     Total     |
                                               | Frames  Bytes | | Frames  Bytes | | Frames  Bytes |
10.0.1.3             <-> 10.0.1.2              207187 313674350  103963   6861574  311150 320535924
================================================================================
  1   0.000000     10.0.1.3 -> 10.0.1.2     TCP 44957 > 9040 [SYN] Seq=0 Win=5840 Len=0 MSS=1460 TSV=2263183 TSER=0 WS=6
  2   0.000303     10.0.1.2 -> 10.0.1.3     TCP 9040 > 44957 [SYN, ACK] Seq=0 Ack=1 Win=14480 Len=0 MSS=1460 TSV=2316593 TSER=2263183 WS=6
  3   0.000336     10.0.1.3 -> 10.0.1.2     TCP 44957 > 9040 [ACK] Seq=1 Ack=1 Win=5888 Len=0 TSV=2263183 TSER=2316593
311196  25.543214     10.0.1.3 -> 10.0.1.2     TCP 44957 > 9040 [FIN, ACK] Seq=9 Ack=300000001 Win=2580480 Len=0 TSV=2269569 TSER=2322925
311197  25.579935     10.0.1.2 -> 10.0.1.3     TCP 9040 > 44957 [ACK] Seq=300000001 Ack=10 Win=14528 Len=0 TSV=2322989 TSER=2269569
================================================================================
IPv4 Conversations
Filter:<No Filter>
                                               |       <-      | |       ->      | |     Total     |
                                               | Frames  Bytes | | Frames  Bytes | | Frames  Bytes |
10.0.1.3             <-> 10.0.1.2              207187 313674350  104010   6864676  311197 320539026
================================================================================
  1   0.000000     10.0.1.3 -> 10.0.1.2     TCP 44958 > 9040 [SYN] Seq=0 Win=5840 Len=0 MSS=1460 TSV=2272591 TSER=0 WS=6
  2   0.000278     10.0.1.2 -> 10.0.1.3     TCP 9040 > 44958 [SYN, ACK] Seq=0 Ack=1 Win=14480 Len=0 MSS=1460 TSV=2326002 TSER=2272591 WS=6
  3   0.000312     10.0.1.3 -> 10.0.1.2     TCP 44958 > 9040 [ACK] Seq=1 Ack=1 Win=5888 Len=0 TSV=2272591 TSER=2326002
311200  25.543107     10.0.1.3 -> 10.0.1.2     TCP 44958 > 9040 [FIN, ACK] Seq=9 Ack=300000001 Win=2580480 Len=0 TSV=2278977 TSER=2332333
311201  25.581719     10.0.1.2 -> 10.0.1.3     TCP 9040 > 44958 [ACK] Seq=300000001 Ack=10 Win=14528 Len=0 TSV=2332398 TSER=2278977
================================================================================
IPv4 Conversations
Filter:<No Filter>
                                               |       <-      | |       ->      | |     Total     |
                                               | Frames  Bytes | | Frames  Bytes | | Frames  Bytes |
10.0.1.3             <-> 10.0.1.2              207187 313674350  104014   6864940  311201 320539290
================================================================================
  1   0.000000     10.0.1.3 -> 10.0.1.2     TCP 44959 > 9040 [SYN] Seq=0 Win=5840 Len=0 MSS=1460 TSV=2282048 TSER=0 WS=6
  2   0.000278     10.0.1.2 -> 10.0.1.3     TCP 9040 > 44959 [SYN, ACK] Seq=0 Ack=1 Win=14480 Len=0 MSS=1460 TSV=2335460 TSER=2282048 WS=6
  3   0.000312     10.0.1.3 -> 10.0.1.2     TCP 44959 > 9040 [ACK] Seq=1 Ack=1 Win=5888 Len=0 TSV=2282048 TSER=2335460
311184  25.543090     10.0.1.3 -> 10.0.1.2     TCP 44959 > 9040 [FIN, ACK] Seq=9 Ack=300000001 Win=2580480 Len=0 TSV=2288434 TSER=2341791
311185  25.581622     10.0.1.2 -> 10.0.1.3     TCP 9040 > 44959 [ACK] Seq=300000001 Ack=10 Win=14528 Len=0 TSV=2341856 TSER=2288434
================================================================================
IPv4 Conversations
Filter:<No Filter>
                                               |       <-      | |       ->      | |     Total     |
                                               | Frames  Bytes | | Frames  Bytes | | Frames  Bytes |
10.0.1.3             <-> 10.0.1.2              207187 313674350  103998   6863884  311185 320538234
================================================================================
  1   0.000000     10.0.1.3 -> 10.0.1.2     TCP 44960 > 9040 [SYN] Seq=0 Win=5840 Len=0 MSS=1460 TSV=2291463 TSER=0 WS=6
  2   0.000322     10.0.1.2 -> 10.0.1.3     TCP 9040 > 44960 [SYN, ACK] Seq=0 Ack=1 Win=14480 Len=0 MSS=1460 TSV=2344875 TSER=2291463 WS=6
  3   0.000357     10.0.1.3 -> 10.0.1.2     TCP 44960 > 9040 [ACK] Seq=1 Ack=1 Win=5888 Len=0 TSV=2291463 TSER=2344875
311178  25.543096     10.0.1.3 -> 10.0.1.2     TCP 44960 > 9040 [FIN, ACK] Seq=9 Ack=300000001 Win=2580480 Len=0 TSV=2297849 TSER=2351207
311179  25.580719     10.0.1.2 -> 10.0.1.3     TCP 9040 > 44960 [ACK] Seq=300000001 Ack=10 Win=14528 Len=0 TSV=2351271 TSER=2297849
================================================================================
IPv4 Conversations
Filter:<No Filter>
                                               |       <-      | |       ->      | |     Total     |
                                               | Frames  Bytes | | Frames  Bytes | | Frames  Bytes |
10.0.1.3             <-> 10.0.1.2              207187 313674350  103992   6863488  311179 320537838
================================================================================
  1   0.000000     10.0.1.3 -> 10.0.1.2     TCP 44961 > 9040 [SYN] Seq=0 Win=5840 Len=0 MSS=1460 TSV=2300909 TSER=0 WS=6
  2   0.000322     10.0.1.2 -> 10.0.1.3     TCP 9040 > 44961 [SYN, ACK] Seq=0 Ack=1 Win=14480 Len=0 MSS=1460 TSV=2354322 TSER=2300909 WS=6
  3   0.000358     10.0.1.3 -> 10.0.1.2     TCP 44961 > 9040 [ACK] Seq=1 Ack=1 Win=5888 Len=0 TSV=2300909 TSER=2354322
311195  25.543215     10.0.1.3 -> 10.0.1.2     TCP 44961 > 9040 [FIN, ACK] Seq=9 Ack=300000001 Win=2580480 Len=0 TSV=2307294 TSER=2360654
311196  25.581770     10.0.1.2 -> 10.0.1.3     TCP 9040 > 44961 [ACK] Seq=300000001 Ack=10 Win=14528 Len=0 TSV=2360718 TSER=2307294
================================================================================
IPv4 Conversations
Filter:<No Filter>
                                               |       <-      | |       ->      | |     Total     |
                                               | Frames  Bytes | | Frames  Bytes | | Frames  Bytes |
10.0.1.3             <-> 10.0.1.2              207187 313674350  104009   6864610  311196 320538960
================================================================================
  1   0.000000     10.0.1.3 -> 10.0.1.2     TCP 44962 > 9040 [SYN] Seq=0 Win=5840 Len=0 MSS=1460 TSV=2310298 TSER=0 WS=6
  2   0.000328     10.0.1.2 -> 10.0.1.3     TCP 9040 > 44962 [SYN, ACK] Seq=0 Ack=1 Win=14480 Len=0 MSS=1460 TSV=2363712 TSER=2310298 WS=6
  3   0.000365     10.0.1.3 -> 10.0.1.2     TCP 44962 > 9040 [ACK] Seq=1 Ack=1 Win=5888 Len=0 TSV=2310298 TSER=2363712
311198  25.543159     10.0.1.3 -> 10.0.1.2     TCP 44962 > 9040 [FIN, ACK] Seq=9 Ack=300000001 Win=2580480 Len=0 TSV=2316684 TSER=2370044
311199  25.580615     10.0.1.2 -> 10.0.1.3     TCP 9040 > 44962 [ACK] Seq=300000001 Ack=10 Win=14528 Len=0 TSV=2370108 TSER=2316684
================================================================================
IPv4 Conversations
Filter:<No Filter>
                                               |       <-      | |       ->      | |     Total     |
                                               | Frames  Bytes | | Frames  Bytes | | Frames  Bytes |
10.0.1.3             <-> 10.0.1.2              207187 313674350  104012   6864808  311199 320539158
================================================================================
  1   0.000000     10.0.1.3 -> 10.0.1.2     TCP 44963 > 9040 [SYN] Seq=0 Win=5840 Len=0 MSS=1460 TSV=2319696 TSER=0 WS=6
  2   0.000325     10.0.1.2 -> 10.0.1.3     TCP 9040 > 44963 [SYN, ACK] Seq=0 Ack=1 Win=14480 Len=0 MSS=1460 TSV=2373111 TSER=2319696 WS=6
  3   0.000356     10.0.1.3 -> 10.0.1.2     TCP 44963 > 9040 [ACK] Seq=1 Ack=1 Win=5888 Len=0 TSV=2319696 TSER=2373111
311218  25.543191     10.0.1.3 -> 10.0.1.2     TCP 44963 > 9040 [FIN, ACK] Seq=9 Ack=300000001 Win=2580480 Len=0 TSV=2326082 TSER=2379443
311219  25.582066     10.0.1.2 -> 10.0.1.3     TCP 9040 > 44963 [ACK] Seq=300000001 Ack=10 Win=14528 Len=0 TSV=2379507 TSER=2326082
================================================================================
IPv4 Conversations
Filter:<No Filter>
                                               |       <-      | |       ->      | |     Total     |
                                               | Frames  Bytes | | Frames  Bytes | | Frames  Bytes |
10.0.1.3             <-> 10.0.1.2              207187 313674350  104032   6866128  311219 320540478
================================================================================
  1   0.000000     10.0.1.3 -> 10.0.1.2     TCP 49924 > 9040 [SYN] Seq=0 Win=5840 Len=0 MSS=1460 TSV=2329106 TSER=0 WS=6
  2   0.000325     10.0.1.2 -> 10.0.1.3     TCP 9040 > 49924 [SYN, ACK] Seq=0 Ack=1 Win=14480 Len=0 MSS=1460 TSV=2382521 TSER=2329106 WS=6
  3   0.000362     10.0.1.3 -> 10.0.1.2     TCP 49924 > 9040 [ACK] Seq=1 Ack=1 Win=5888 Len=0 TSV=2329106 TSER=2382521
311194  25.543091     10.0.1.3 -> 10.0.1.2     TCP 49924 > 9040 [FIN, ACK] Seq=9 Ack=300000001 Win=2580480 Len=0 TSV=2335492 TSER=2388853
311195  25.582959     10.0.1.2 -> 10.0.1.3     TCP 9040 > 49924 [ACK] Seq=300000001 Ack=10 Win=14528 Len=0 TSV=2388918 TSER=2335492
================================================================================
IPv4 Conversations
Filter:<No Filter>
                                               |       <-      | |       ->      | |     Total     |
                                               | Frames  Bytes | | Frames  Bytes | | Frames  Bytes |
10.0.1.3             <-> 10.0.1.2              207187 313674350  104008   6864544  311195 320538894
================================================================================
  1   0.000000     10.0.1.3 -> 10.0.1.2     TCP 49925 > 9040 [SYN] Seq=0 Win=5840 Len=0 MSS=1460 TSV=2338562 TSER=0 WS=6
  2   0.000333     10.0.1.2 -> 10.0.1.3     TCP 9040 > 49925 [SYN, ACK] Seq=0 Ack=1 Win=14480 Len=0 MSS=1460 TSV=2391978 TSER=2338562 WS=6
  3   0.000370     10.0.1.3 -> 10.0.1.2     TCP 49925 > 9040 [ACK] Seq=1 Ack=1 Win=5888 Len=0 TSV=2338562 TSER=2391978
311218  25.543191     10.0.1.3 -> 10.0.1.2     TCP 49925 > 9040 [FIN, ACK] Seq=9 Ack=300000001 Win=2580480 Len=0 TSV=2344948 TSER=2398310
311219  25.580070     10.0.1.2 -> 10.0.1.3     TCP 9040 > 49925 [ACK] Seq=300000001 Ack=10 Win=14528 Len=0 TSV=2398374 TSER=2344948
================================================================================
IPv4 Conversations
Filter:<No Filter>
                                               |       <-      | |       ->      | |     Total     |
                                               | Frames  Bytes | | Frames  Bytes | | Frames  Bytes |
10.0.1.3             <-> 10.0.1.2              207187 313674350  104032   6866128  311219 320540478
================================================================================
  1   0.000000     10.0.1.3 -> 10.0.1.2     TCP 49926 > 9040 [SYN] Seq=0 Win=5840 Len=0 MSS=1460 TSV=2348008 TSER=0 WS=6
  2   0.000308     10.0.1.2 -> 10.0.1.3     TCP 9040 > 49926 [SYN, ACK] Seq=0 Ack=1 Win=14480 Len=0 MSS=1460 TSV=2401424 TSER=2348008 WS=6
  3   0.000346     10.0.1.3 -> 10.0.1.2     TCP 49926 > 9040 [ACK] Seq=1 Ack=1 Win=5888 Len=0 TSV=2348008 TSER=2401424
311199  25.543168     10.0.1.3 -> 10.0.1.2     TCP 49926 > 9040 [FIN, ACK] Seq=9 Ack=300000001 Win=2580480 Len=0 TSV=2354394 TSER=2407756
311200  25.579723     10.0.1.2 -> 10.0.1.3     TCP 9040 > 49926 [ACK] Seq=300000001 Ack=10 Win=14528 Len=0 TSV=2407820 TSER=2354394
================================================================================
IPv4 Conversations
Filter:<No Filter>
                                               |       <-      | |       ->      | |     Total     |
                                               | Frames  Bytes | | Frames  Bytes | | Frames  Bytes |
10.0.1.3             <-> 10.0.1.2              207187 313674350  104013   6864874  311200 320539224
================================================================================
  1   0.000000     10.0.1.3 -> 10.0.1.2     TCP 49927 > 9040 [SYN] Seq=0 Win=5840 Len=0 MSS=1460 TSV=2357425 TSER=0 WS=6
  2   0.000313     10.0.1.2 -> 10.0.1.3     TCP 9040 > 49927 [SYN, ACK] Seq=0 Ack=1 Win=14480 Len=0 MSS=1460 TSV=2410842 TSER=2357425 WS=6
  3   0.000348     10.0.1.3 -> 10.0.1.2     TCP 49927 > 9040 [ACK] Seq=1 Ack=1 Win=5888 Len=0 TSV=2357425 TSER=2410842
311195  25.543093     10.0.1.3 -> 10.0.1.2     TCP 49927 > 9040 [FIN, ACK] Seq=9 Ack=300000001 Win=2580480 Len=0 TSV=2363811 TSER=2417175
311196  25.579444     10.0.1.2 -> 10.0.1.3     TCP 9040 > 49927 [ACK] Seq=300000001 Ack=10 Win=14528 Len=0 TSV=2417238 TSER=2363811
================================================================================
IPv4 Conversations
Filter:<No Filter>
                                               |       <-      | |       ->      | |     Total     |
                                               | Frames  Bytes | | Frames  Bytes | | Frames  Bytes |
10.0.1.3             <-> 10.0.1.2              207187 313674350  104009   6864610  311196 320538960
================================================================================
  1   0.000000     10.0.1.3 -> 10.0.1.2     TCP 49928 > 9040 [SYN] Seq=0 Win=5840 Len=0 MSS=1460 TSV=2366882 TSER=0 WS=6
  2   0.000308     10.0.1.2 -> 10.0.1.3     TCP 9040 > 49928 [SYN, ACK] Seq=0 Ack=1 Win=14480 Len=0 MSS=1460 TSV=2420299 TSER=2366882 WS=6
  3   0.000341     10.0.1.3 -> 10.0.1.2     TCP 49928 > 9040 [ACK] Seq=1 Ack=1 Win=5888 Len=0 TSV=2366882 TSER=2420299
311198  25.543157     10.0.1.3 -> 10.0.1.2     TCP 49928 > 9040 [FIN, ACK] Seq=9 Ack=300000001 Win=2580480 Len=0 TSV=2373267 TSER=2426632
311199  25.582503     10.0.1.2 -> 10.0.1.3     TCP 9040 > 49928 [ACK] Seq=300000001 Ack=10 Win=14528 Len=0 TSV=2426696 TSER=2373267
================================================================================
IPv4 Conversations
Filter:<No Filter>
                                               |       <-      | |       ->      | |     Total     |
                                               | Frames  Bytes | | Frames  Bytes | | Frames  Bytes |
10.0.1.3             <-> 10.0.1.2              207187 313674350  104012   6864808  311199 320539158
================================================================================
  1   0.000000     10.0.1.3 -> 10.0.1.2     TCP 49929 > 9040 [SYN] Seq=0 Win=5840 Len=0 MSS=1460 TSV=2376308 TSER=0 WS=6
  2   0.000379     10.0.1.2 -> 10.0.1.3     TCP 9040 > 49929 [SYN, ACK] Seq=0 Ack=1 Win=14480 Len=0 MSS=1460 TSV=2429726 TSER=2376308 WS=6
  3   0.000419     10.0.1.3 -> 10.0.1.2     TCP 49929 > 9040 [ACK] Seq=1 Ack=1 Win=5888 Len=0 TSV=2376308 TSER=2429726
311205  25.543207     10.0.1.3 -> 10.0.1.2     TCP 49929 > 9040 [FIN, ACK] Seq=9 Ack=300000001 Win=2580480 Len=0 TSV=2382693 TSER=2436059
311206  25.579793     10.0.1.2 -> 10.0.1.3     TCP 9040 > 49929 [ACK] Seq=300000001 Ack=10 Win=14528 Len=0 TSV=2436122 TSER=2382693
================================================================================
IPv4 Conversations
Filter:<No Filter>
                                               |       <-      | |       ->      | |     Total     |
                                               | Frames  Bytes | | Frames  Bytes | | Frames  Bytes |
10.0.1.3             <-> 10.0.1.2              207187 313674350  104019   6865270  311206 320539620
================================================================================
  1   0.000000     10.0.1.3 -> 10.0.1.2     TCP 49930 > 9040 [SYN] Seq=0 Win=5840 Len=0 MSS=1460 TSV=2385684 TSER=0 WS=6
  2   0.000322     10.0.1.2 -> 10.0.1.3     TCP 9040 > 49930 [SYN, ACK] Seq=0 Ack=1 Win=14480 Len=0 MSS=1460 TSV=2439103 TSER=2385684 WS=6
  3   0.000358     10.0.1.3 -> 10.0.1.2     TCP 49930 > 9040 [ACK] Seq=1 Ack=1 Win=5888 Len=0 TSV=2385684 TSER=2439103
311199  25.543167     10.0.1.3 -> 10.0.1.2     TCP 49930 > 9040 [FIN, ACK] Seq=9 Ack=300000001 Win=2580480 Len=0 TSV=2392070 TSER=2445435
311200  25.580112     10.0.1.2 -> 10.0.1.3     TCP 9040 > 49930 [ACK] Seq=300000001 Ack=10 Win=14528 Len=0 TSV=2445499 TSER=2392070
================================================================================
IPv4 Conversations
Filter:<No Filter>
                                               |       <-      | |       ->      | |     Total     |
                                               | Frames  Bytes | | Frames  Bytes | | Frames  Bytes |
10.0.1.3             <-> 10.0.1.2              207187 313674350  104013   6864874  311200 320539224
================================================================================
  1   0.000000     10.0.1.3 -> 10.0.1.2     TCP 49931 > 9040 [SYN] Seq=0 Win=5840 Len=0 MSS=1460 TSV=2395094 TSER=0 WS=6
  2   0.000328     10.0.1.2 -> 10.0.1.3     TCP 9040 > 49931 [SYN, ACK] Seq=0 Ack=1 Win=14480 Len=0 MSS=1460 TSV=2448514 TSER=2395094 WS=6
  3   0.000362     10.0.1.3 -> 10.0.1.2     TCP 49931 > 9040 [ACK] Seq=1 Ack=1 Win=5888 Len=0 TSV=2395094 TSER=2448514
311185  25.543136     10.0.1.3 -> 10.0.1.2     TCP 49931 > 9040 [FIN, ACK] Seq=9 Ack=300000001 Win=2580480 Len=0 TSV=2401480 TSER=2454846
311186  25.581433     10.0.1.2 -> 10.0.1.3     TCP 9040 > 49931 [ACK] Seq=300000001 Ack=10 Win=14528 Len=0 TSV=2454910 TSER=2401480
================================================================================
IPv4 Conversations
Filter:<No Filter>
                                               |       <-      | |       ->      | |     Total     |
                                               | Frames  Bytes | | Frames  Bytes | | Frames  Bytes |
10.0.1.3             <-> 10.0.1.2              207187 313674350  103999   6863950  311186 320538300
================================================================================
  1   0.000000     10.0.1.3 -> 10.0.1.2     TCP 42357 > 9040 [SYN] Seq=0 Win=5840 Len=0 MSS=1460 TSV=2404514 TSER=0 WS=6
  2   0.000400     10.0.1.2 -> 10.0.1.3     TCP 9040 > 42357 [SYN, ACK] Seq=0 Ack=1 Win=14480 Len=0 MSS=1460 TSV=2457934 TSER=2404514 WS=6
  3   0.000433     10.0.1.3 -> 10.0.1.2     TCP 42357 > 9040 [ACK] Seq=1 Ack=1 Win=5888 Len=0 TSV=2404514 TSER=2457934
311184  25.543206     10.0.1.3 -> 10.0.1.2     TCP 42357 > 9040 [FIN, ACK] Seq=9 Ack=300000001 Win=2580480 Len=0 TSV=2410899 TSER=2464267
311185  25.582604     10.0.1.2 -> 10.0.1.3     TCP 9040 > 42357 [ACK] Seq=300000001 Ack=10 Win=14528 Len=0 TSV=2464331 TSER=2410899
================================================================================
IPv4 Conversations
Filter:<No Filter>
                                               |       <-      | |       ->      | |     Total     |
                                               | Frames  Bytes | | Frames  Bytes | | Frames  Bytes |
10.0.1.3             <-> 10.0.1.2              207187 313674350  103998   6863884  311185 320538234
================================================================================
  1   0.000000     10.0.1.3 -> 10.0.1.2     TCP 42358 > 9040 [SYN] Seq=0 Win=5840 Len=0 MSS=1460 TSV=2414114 TSER=0 WS=6
  2   0.000331     10.0.1.2 -> 10.0.1.3     TCP 9040 > 42358 [SYN, ACK] Seq=0 Ack=1 Win=14480 Len=0 MSS=1460 TSV=2467536 TSER=2414114 WS=6
  3   0.000366     10.0.1.3 -> 10.0.1.2     TCP 42358 > 9040 [ACK] Seq=1 Ack=1 Win=5888 Len=0 TSV=2414114 TSER=2467536
311184  25.543181     10.0.1.3 -> 10.0.1.2     TCP 42358 > 9040 [FIN, ACK] Seq=9 Ack=300000001 Win=2580480 Len=0 TSV=2420500 TSER=2473867
311185  25.581395     10.0.1.2 -> 10.0.1.3     TCP 9040 > 42358 [ACK] Seq=300000001 Ack=10 Win=14528 Len=0 TSV=2473932 TSER=2420500
================================================================================
IPv4 Conversations
Filter:<No Filter>
                                               |       <-      | |       ->      | |     Total     |
                                               | Frames  Bytes | | Frames  Bytes | | Frames  Bytes |
10.0.1.3             <-> 10.0.1.2              207187 313674350  103998   6863884  311185 320538234
================================================================================
  1   0.000000     10.0.1.3 -> 10.0.1.2     TCP 42359 > 9040 [SYN] Seq=0 Win=5840 Len=0 MSS=1460 TSV=2423547 TSER=0 WS=6
  2   0.000318     10.0.1.2 -> 10.0.1.3     TCP 9040 > 42359 [SYN, ACK] Seq=0 Ack=1 Win=14480 Len=0 MSS=1460 TSV=2476969 TSER=2423547 WS=6
  3   0.000352     10.0.1.3 -> 10.0.1.2     TCP 42359 > 9040 [ACK] Seq=1 Ack=1 Win=5888 Len=0 TSV=2423547 TSER=2476969
311193  25.543118     10.0.1.3 -> 10.0.1.2     TCP 42359 > 9040 [FIN, ACK] Seq=9 Ack=300000001 Win=2580480 Len=0 TSV=2429932 TSER=2483301
311194  25.580924     10.0.1.2 -> 10.0.1.3     TCP 9040 > 42359 [ACK] Seq=300000001 Ack=10 Win=14528 Len=0 TSV=2483365 TSER=2429932
================================================================================
IPv4 Conversations
Filter:<No Filter>
                                               |       <-      | |       ->      | |     Total     |
                                               | Frames  Bytes | | Frames  Bytes | | Frames  Bytes |
10.0.1.3             <-> 10.0.1.2              207187 313674350  104007   6864478  311194 320538828
================================================================================
  1   0.000000     10.0.1.3 -> 10.0.1.2     TCP 42360 > 9040 [SYN] Seq=0 Win=5840 Len=0 MSS=1460 TSV=2432986 TSER=0 WS=6
  2   0.000305     10.0.1.2 -> 10.0.1.3     TCP 9040 > 42360 [SYN, ACK] Seq=0 Ack=1 Win=14480 Len=0 MSS=1460 TSV=2486409 TSER=2432986 WS=6
  3   0.000345     10.0.1.3 -> 10.0.1.2     TCP 42360 > 9040 [ACK] Seq=1 Ack=1 Win=5888 Len=0 TSV=2432986 TSER=2486409
311170  25.543146     10.0.1.3 -> 10.0.1.2     TCP 42360 > 9040 [FIN, ACK] Seq=9 Ack=300000001 Win=2580480 Len=0 TSV=2439372 TSER=2492741
311171  25.581683     10.0.1.2 -> 10.0.1.3     TCP 9040 > 42360 [ACK] Seq=300000001 Ack=10 Win=14528 Len=0 TSV=2492805 TSER=2439372
================================================================================
IPv4 Conversations
Filter:<No Filter>
                                               |       <-      | |       ->      | |     Total     |
                                               | Frames  Bytes | | Frames  Bytes | | Frames  Bytes |
10.0.1.3             <-> 10.0.1.2              207187 313674350  103984   6862960  311171 320537310
================================================================================
