  1   0.000000     10.0.1.3 -> 10.0.1.2     TCP 57820 > 9040 [SYN] Seq=0 Win=5840 Len=0 MSS=1460 TSV=2902933 TSER=0 WS=6
  2   0.000328     10.0.1.2 -> 10.0.1.3     TCP 9040 > 57820 [SYN, ACK] Seq=0 Ack=1 Win=14480 Len=0 MSS=1460 TSV=2956392 TSER=2902933 WS=6
  3   0.000364     10.0.1.3 -> 10.0.1.2     TCP 57820 > 9040 [ACK] Seq=1 Ack=1 Win=5888 Len=0 TSV=2902933 TSER=2956392
466562  38.313804     10.0.1.3 -> 10.0.1.2     TCP 57820 > 9040 [FIN, ACK] Seq=9 Ack=450000001 Win=2580480 Len=0 TSV=2912512 TSER=2965916
466563  38.353433     10.0.1.2 -> 10.0.1.3     TCP 9040 > 57820 [ACK] Seq=450000001 Ack=10 Win=14528 Len=0 TSV=2965981 TSER=2912512
================================================================================
IPv4 Conversations
Filter:<No Filter>
                                               |       <-      | |       ->      | |     Total     |
                                               | Frames  Bytes | | Frames  Bytes | | Frames  Bytes |
10.0.1.3             <-> 10.0.1.2              310778 470511356  155785  10281826  466563 480793182
================================================================================
  1   0.000000     10.0.1.3 -> 10.0.1.2     TCP 57821 > 9040 [SYN] Seq=0 Win=5840 Len=0 MSS=1460 TSV=2916526 TSER=0 WS=6
  2   0.000279     10.0.1.2 -> 10.0.1.3     TCP 9040 > 57821 [SYN, ACK] Seq=0 Ack=1 Win=14480 Len=0 MSS=1460 TSV=2969985 TSER=2916526 WS=6
  3   0.000315     10.0.1.3 -> 10.0.1.2     TCP 57821 > 9040 [ACK] Seq=1 Ack=1 Win=5888 Len=0 TSV=2916526 TSER=2969985
466535  38.313751     10.0.1.3 -> 10.0.1.2     TCP 57821 > 9040 [FIN, ACK] Seq=9 Ack=450000001 Win=2580480 Len=0 TSV=2926104 TSER=2979510
466536  38.350642     10.0.1.2 -> 10.0.1.3     TCP 9040 > 57821 [ACK] Seq=450000001 Ack=10 Win=14528 Len=0 TSV=2979574 TSER=2926104
================================================================================
IPv4 Conversations
Filter:<No Filter>
                                               |       <-      | |       ->      | |     Total     |
                                               | Frames  Bytes | | Frames  Bytes | | Frames  Bytes |
10.0.1.3             <-> 10.0.1.2              310778 470511356  155758  10280044  466536 480791400
================================================================================
  1   0.000000     10.0.1.3 -> 10.0.1.2     TCP 43829 > 9040 [SYN] Seq=0 Win=5840 Len=0 MSS=1460 TSV=2930143 TSER=0 WS=6
  2   0.000328     10.0.1.2 -> 10.0.1.3     TCP 9040 > 43829 [SYN, ACK] Seq=0 Ack=1 Win=14480 Len=0 MSS=1460 TSV=2983603 TSER=2930143 WS=6
  3   0.000363     10.0.1.3 -> 10.0.1.2     TCP 43829 > 9040 [ACK] Seq=1 Ack=1 Win=5888 Len=0 TSV=2930143 TSER=2983603
466600  38.313786     10.0.1.3 -> 10.0.1.2     TCP 43829 > 9040 [FIN, ACK] Seq=9 Ack=450000001 Win=2571648 Len=0 TSV=2939721 TSER=2993128
466601  38.350150     10.0.1.2 -> 10.0.1.3     TCP 9040 > 43829 [ACK] Seq=450000001 Ack=10 Win=14528 Len=0 TSV=2993192 TSER=2939721
================================================================================
IPv4 Conversations
Filter:<No Filter>
                                               |       <-      | |       ->      | |     Total     |
                                               | Frames  Bytes | | Frames  Bytes | | Frames  Bytes |
10.0.1.3             <-> 10.0.1.2              310778 470511356  155823  10284334  466601 480795690
================================================================================
  1   0.000000     10.0.1.3 -> 10.0.1.2     TCP 43830 > 9040 [SYN] Seq=0 Win=5840 Len=0 MSS=1460 TSV=2943736 TSER=0 WS=6
  2   0.000284     10.0.1.2 -> 10.0.1.3     TCP 9040 > 43830 [SYN, ACK] Seq=0 Ack=1 Win=14480 Len=0 MSS=1460 TSV=2997198 TSER=2943736 WS=6
  3   0.000320     10.0.1.3 -> 10.0.1.2     TCP 43830 > 9040 [ACK] Seq=1 Ack=1 Win=5888 Len=0 TSV=2943736 TSER=2997198
466533  38.313823     10.0.1.3 -> 10.0.1.2     TCP 43830 > 9040 [FIN, ACK] Seq=9 Ack=450000001 Win=2580480 Len=0 TSV=2953315 TSER=3006723
466534  38.353114     10.0.1.2 -> 10.0.1.3     TCP 9040 > 43830 [ACK] Seq=450000001 Ack=10 Win=14528 Len=0 TSV=3006787 TSER=2953315
================================================================================
IPv4 Conversations
Filter:<No Filter>
                                               |       <-      | |       ->      | |     Total     |
                                               | Frames  Bytes | | Frames  Bytes | | Frames  Bytes |
10.0.1.3             <-> 10.0.1.2              310778 470511356  155756  10279912  466534 480791268
================================================================================
  1   0.000000     10.0.1.3 -> 10.0.1.2     TCP 43831 > 9040 [SYN] Seq=0 Win=5840 Len=0 MSS=1460 TSV=2957348 TSER=0 WS=6
  2   0.000306     10.0.1.2 -> 10.0.1.3     TCP 9040 > 43831 [SYN, ACK] Seq=0 Ack=1 Win=14480 Len=0 MSS=1460 TSV=3010811 TSER=2957348 WS=6
  3   0.000339     10.0.1.3 -> 10.0.1.2     TCP 43831 > 9040 [ACK] Seq=1 Ack=1 Win=5888 Len=0 TSV=2957348 TSER=3010811
466568  38.313935     10.0.1.3 -> 10.0.1.2     TCP 43831 > 9040 [FIN, ACK] Seq=9 Ack=450000001 Win=2580480 Len=0 TSV=2966927 TSER=3020335
466569  38.352552     10.0.1.2 -> 10.0.1.3     TCP 9040 > 43831 [ACK] Seq=450000001 Ack=10 Win=14528 Len=0 TSV=3020400 TSER=2966927
================================================================================
IPv4 Conversations
Filter:<No Filter>
                                               |       <-      | |       ->      | |     Total     |
                                               | Frames  Bytes | | Frames  Bytes | | Frames  Bytes |
10.0.1.3             <-> 10.0.1.2              310778 470511356  155791  10282222  466569 480793578
================================================================================
  1   0.000000     10.0.1.3 -> 10.0.1.2     TCP 43832 > 9040 [SYN] Seq=0 Win=5840 Len=0 MSS=1460 TSV=2970953 TSER=0 WS=6
  2   0.000285     10.0.1.2 -> 10.0.1.3     TCP 9040 > 43832 [SYN, ACK] Seq=0 Ack=1 Win=14480 Len=0 MSS=1460 TSV=3024417 TSER=2970953 WS=6
  3   0.000320     10.0.1.3 -> 10.0.1.2     TCP 43832 > 9040 [ACK] Seq=1 Ack=1 Win=5888 Len=0 TSV=2970953 TSER=3024417
466571  38.313697     10.0.1.3 -> 10.0.1.2     TCP 43832 > 9040 [FIN, ACK] Seq=9 Ack=450000001 Win=2580480 Len=0 TSV=2980532 TSER=3033942
466572  38.351579     10.0.1.2 -> 10.0.1.3     TCP 9040 > 43832 [ACK] Seq=450000001 Ack=10 Win=14528 Len=0 TSV=3034006 TSER=2980532
================================================================================
IPv4 Conversations
Filter:<No Filter>
                                               |       <-      | |       ->      | |     Total     |
                                               | Frames  Bytes | | Frames  Bytes | | Frames  Bytes |
10.0.1.3             <-> 10.0.1.2              310778 470511356  155794  10282420  466572 480793776
================================================================================
  1   0.000000     10.0.1.3 -> 10.0.1.2     TCP 43833 > 9040 [SYN] Seq=0 Win=5840 Len=0 MSS=1460 TSV=2984555 TSER=0 WS=6
  2   0.000320     10.0.1.2 -> 10.0.1.3     TCP 9040 > 43833 [SYN, ACK] Seq=0 Ack=1 Win=14480 Len=0 MSS=1460 TSV=3038020 TSER=2984555 WS=6
  3   0.000361     10.0.1.3 -> 10.0.1.2     TCP 43833 > 9040 [ACK] Seq=1 Ack=1 Win=5888 Len=0 TSV=2984556 TSER=3038020
466581  38.316228     10.0.1.3 -> 10.0.1.2     TCP 43833 > 9040 [FIN, ACK] Seq=9 Ack=450000001 Win=2580480 Len=0 TSV=2994135 TSER=3047545
466582  38.355198     10.0.1.2 -> 10.0.1.3     TCP 9040 > 43833 [ACK] Seq=450000001 Ack=10 Win=14528 Len=0 TSV=3047610 TSER=2994135
================================================================================
IPv4 Conversations
Filter:<No Filter>
                                               |       <-      | |       ->      | |     Total     |
                                               | Frames  Bytes | | Frames  Bytes | | Frames  Bytes |
10.0.1.3             <-> 10.0.1.2              310778 470511356  155804  10283080  466582 480794436
================================================================================
  1   0.000000     10.0.1.3 -> 10.0.1.2     TCP 43834 > 9040 [SYN] Seq=0 Win=5840 Len=0 MSS=1460 TSV=2998158 TSER=0 WS=6
  2   0.000281     10.0.1.2 -> 10.0.1.3     TCP 9040 > 43834 [SYN, ACK] Seq=0 Ack=1 Win=14480 Len=0 MSS=1460 TSV=3051623 TSER=2998158 WS=6
  3   0.000313     10.0.1.3 -> 10.0.1.2     TCP 43834 > 9040 [ACK] Seq=1 Ack=1 Win=5888 Len=0 TSV=2998158 TSER=3051623
466512  38.313679     10.0.1.3 -> 10.0.1.2     TCP 43834 > 9040 [FIN, ACK] Seq=9 Ack=450000001 Win=2580480 Len=0 TSV=3007736 TSER=3061148
466513  38.350801     10.0.1.2 -> 10.0.1.3     TCP 9040 > 43834 [ACK] Seq=450000001 Ack=10 Win=14528 Len=0 TSV=3061212 TSER=3007736
================================================================================
IPv4 Conversations
Filter:<No Filter>
                                               |       <-      | |       ->      | |     Total     |
                                               | Frames  Bytes | | Frames  Bytes | | Frames  Bytes |
10.0.1.3             <-> 10.0.1.2              310778 470511356  155735  10278526  466513 480789882
================================================================================
  1   0.000000     10.0.1.3 -> 10.0.1.2     TCP 56553 > 9040 [SYN] Seq=0 Win=5840 Len=0 MSS=1460 TSV=3011757 TSER=0 WS=6
  2   0.000279     10.0.1.2 -> 10.0.1.3     TCP 9040 > 56553 [SYN, ACK] Seq=0 Ack=1 Win=14480 Len=0 MSS=1460 TSV=3065224 TSER=3011757 WS=6
  3   0.000311     10.0.1.3 -> 10.0.1.2     TCP 56553 > 9040 [ACK] Seq=1 Ack=1 Win=5888 Len=0 TSV=3011758 TSER=3065224
466583  38.313690     10.0.1.3 -> 10.0.1.2     TCP 56553 > 9040 [FIN, ACK] Seq=9 Ack=450000001 Win=2580480 Len=0 TSV=3021336 TSER=3074749
466584  38.350785     10.0.1.2 -> 10.0.1.3     TCP 9040 > 56553 [ACK] Seq=450000001 Ack=10 Win=14528 Len=0 TSV=3074813 TSER=3021336
================================================================================
IPv4 Conversations
Filter:<No Filter>
                                               |       <-      | |       ->      | |     Total     |
                                               | Frames  Bytes | | Frames  Bytes | | Frames  Bytes |
10.0.1.3             <-> 10.0.1.2              310778 470511356  155806  10283212  466584 480794568
================================================================================
  1   0.000000     10.0.1.3 -> 10.0.1.2     TCP 56554 > 9040 [SYN] Seq=0 Win=5840 Len=0 MSS=1460 TSV=3025442 TSER=0 WS=6
  2   0.000311     10.0.1.2 -> 10.0.1.3     TCP 9040 > 56554 [SYN, ACK] Seq=0 Ack=1 Win=14480 Len=0 MSS=1460 TSV=3078909 TSER=3025442 WS=6
  3   0.000346     10.0.1.3 -> 10.0.1.2     TCP 56554 > 9040 [ACK] Seq=1 Ack=1 Win=5888 Len=0 TSV=3025442 TSER=3078909
466531  38.313776     10.0.1.3 -> 10.0.1.2     TCP 56554 > 9040 [FIN, ACK] Seq=9 Ack=450000001 Win=2580480 Len=0 TSV=3035020 TSER=3088435
466532  38.350583     10.0.1.2 -> 10.0.1.3     TCP 9040 > 56554 [ACK] Seq=450000001 Ack=10 Win=14528 Len=0 TSV=3088498 TSER=3035020
================================================================================
IPv4 Conversations
Filter:<No Filter>
                                               |       <-      | |       ->      | |     Total     |
                                               | Frames  Bytes | | Frames  Bytes | | Frames  Bytes |
10.0.1.3             <-> 10.0.1.2              310778 470511356  155754  10279780  466532 480791136
================================================================================
  1   0.000000     10.0.1.3 -> 10.0.1.2     TCP 56555 > 9040 [SYN] Seq=0 Win=5840 Len=0 MSS=1460 TSV=3039045 TSER=0 WS=6
  2   0.000306     10.0.1.2 -> 10.0.1.3     TCP 9040 > 56555 [SYN, ACK] Seq=0 Ack=1 Win=14480 Len=0 MSS=1460 TSV=3092514 TSER=3039045 WS=6
  3   0.000341     10.0.1.3 -> 10.0.1.2     TCP 56555 > 9040 [ACK] Seq=1 Ack=1 Win=5888 Len=0 TSV=3039046 TSER=3092514
466566  38.314009     10.0.1.3 -> 10.0.1.2     TCP 56555 > 9040 [FIN, ACK] Seq=9 Ack=450000001 Win=2580480 Len=0 TSV=3048624 TSER=3102039
466567  38.350644     10.0.1.2 -> 10.0.1.3     TCP 9040 > 56555 [ACK] Seq=450000001 Ack=10 Win=14528 Len=0 TSV=3102103 TSER=3048624
================================================================================
IPv4 Conversations
Filter:<No Filter>
                                               |       <-      | |       ->      | |     Total     |
                                               | Frames  Bytes | | Frames  Bytes | | Frames  Bytes |
10.0.1.3             <-> 10.0.1.2              310778 470511356  155789  10282090  466567 480793446
================================================================================
  1   0.000000     10.0.1.3 -> 10.0.1.2     TCP 56556 > 9040 [SYN] Seq=0 Win=5840 Len=0 MSS=1460 TSV=3052628 TSER=0 WS=6
  2   0.000283     10.0.1.2 -> 10.0.1.3     TCP 9040 > 56556 [SYN, ACK] Seq=0 Ack=1 Win=14480 Len=0 MSS=1460 TSV=3106098 TSER=3052628 WS=6
  3   0.000315     10.0.1.3 -> 10.0.1.2     TCP 56556 > 9040 [ACK] Seq=1 Ack=1 Win=5888 Len=0 TSV=3052628 TSER=3106098
466543  38.313799     10.0.1.3 -> 10.0.1.2     TCP 56556 > 9040 [FIN, ACK] Seq=9 Ack=450000001 Win=2580480 Len=0 TSV=3062207 TSER=3115623
466544  38.350359     10.0.1.2 -> 10.0.1.3     TCP 9040 > 56556 [ACK] Seq=450000001 Ack=10 Win=14528 Len=0 TSV=3115687 TSER=3062207
================================================================================
IPv4 Conversations
Filter:<No Filter>
                                               |       <-      | |       ->      | |     Total     |
                                               | Frames  Bytes | | Frames  Bytes | | Frames  Bytes |
10.0.1.3             <-> 10.0.1.2              310778 470511356  155766  10280572  466544 480791928
================================================================================
  1   0.000000     10.0.1.3 -> 10.0.1.2     TCP 56557 > 9040 [SYN] Seq=0 Win=5840 Len=0 MSS=1460 TSV=3066282 TSER=0 WS=6
  2   0.000305     10.0.1.2 -> 10.0.1.3     TCP 9040 > 56557 [SYN, ACK] Seq=0 Ack=1 Win=14480 Len=0 MSS=1460 TSV=3119753 TSER=3066282 WS=6
  3   0.000336     10.0.1.3 -> 10.0.1.2     TCP 56557 > 9040 [ACK] Seq=1 Ack=1 Win=5888 Len=0 TSV=3066282 TSER=3119753
466558  38.313725     10.0.1.3 -> 10.0.1.2     TCP 56557 > 9040 [FIN, ACK] Seq=9 Ack=450000001 Win=2580480 Len=0 TSV=3075861 TSER=3129277
466559  38.351761     10.0.1.2 -> 10.0.1.3     TCP 9040 > 56557 [ACK] Seq=450000001 Ack=10 Win=14528 Len=0 TSV=3129342 TSER=3075861
================================================================================
IPv4 Conversations
Filter:<No Filter>
                                               |       <-      | |       ->      | |     Total     |
                                               | Frames  Bytes | | Frames  Bytes | | Frames  Bytes |
10.0.1.3             <-> 10.0.1.2              310778 470511356  155781  10281562  466559 480792918
================================================================================
  1   0.000000     10.0.1.3 -> 10.0.1.2     TCP 56146 > 9040 [SYN] Seq=0 Win=5840 Len=0 MSS=1460 TSV=3079878 TSER=0 WS=6
  2   0.000290     10.0.1.2 -> 10.0.1.3     TCP 9040 > 56146 [SYN, ACK] Seq=0 Ack=1 Win=14480 Len=0 MSS=1460 TSV=3133350 TSER=3079878 WS=6
  3   0.000323     10.0.1.3 -> 10.0.1.2     TCP 56146 > 9040 [ACK] Seq=1 Ack=1 Win=5888 Len=0 TSV=3079878 TSER=3133350
466533  38.313654     10.0.1.3 -> 10.0.1.2     TCP 56146 > 9040 [FIN, ACK] Seq=9 Ack=450000001 Win=2580480 Len=0 TSV=3089457 TSER=3142874
466534  38.351498     10.0.1.2 -> 10.0.1.3     TCP 9040 > 56146 [ACK] Seq=450000001 Ack=10 Win=14528 Len=0 TSV=3142939 TSER=3089457
================================================================================
IPv4 Conversations
Filter:<No Filter>
                                               |       <-      | |       ->      | |     Total     |
                                               | Frames  Bytes | | Frames  Bytes | | Frames  Bytes |
10.0.1.3             <-> 10.0.1.2              310778 470511356  155756  10279912  466534 480791268
================================================================================
  1   0.000000     10.0.1.3 -> 10.0.1.2     TCP 56148 > 9040 [SYN] Seq=0 Win=5840 Len=0 MSS=1460 TSV=3093458 TSER=0 WS=6
  2   0.000312     10.0.1.2 -> 10.0.1.3     TCP 9040 > 56148 [SYN, ACK] Seq=0 Ack=1 Win=14480 Len=0 MSS=1460 TSV=3146931 TSER=3093458 WS=6
  3   0.000345     10.0.1.3 -> 10.0.1.2     TCP 56148 > 9040 [ACK] Seq=1 Ack=1 Win=5888 Len=0 TSV=3093459 TSER=3146931
466562  38.313818     10.0.1.3 -> 10.0.1.2     TCP 56148 > 9040 [FIN, ACK] Seq=9 Ack=450000001 Win=2580480 Len=0 TSV=3103037 TSER=3156457
466563  38.350205     10.0.1.2 -> 10.0.1.3     TCP 9040 > 56148 [ACK] Seq=450000001 Ack=10 Win=14528 Len=0 TSV=3156520 TSER=3103037
================================================================================
IPv4 Conversations
Filter:<No Filter>
                                               |       <-      | |       ->      | |     Total     |
                                               | Frames  Bytes | | Frames  Bytes | | Frames  Bytes |
10.0.1.3             <-> 10.0.1.2              310778 470511356  155785  10281826  466563 480793182
================================================================================
  1   0.000000     10.0.1.3 -> 10.0.1.2     TCP 56149 > 9040 [SYN] Seq=0 Win=5840 Len=0 MSS=1460 TSV=3107031 TSER=0 WS=6
  2   0.000293     10.0.1.2 -> 10.0.1.3     TCP 9040 > 56149 [SYN, ACK] Seq=0 Ack=1 Win=14480 Len=0 MSS=1460 TSV=3160505 TSER=3107031 WS=6
  3   0.000326     10.0.1.3 -> 10.0.1.2     TCP 56149 > 9040 [ACK] Seq=1 Ack=1 Win=5888 Len=0 TSV=3107032 TSER=3160505
466546  38.313774     10.0.1.3 -> 10.0.1.2     TCP 56149 > 9040 [FIN, ACK] Seq=9 Ack=450000001 Win=2580480 Len=0 TSV=3116610 TSER=3170030
466547  38.350217     10.0.1.2 -> 10.0.1.3     TCP 9040 > 56149 [ACK] Seq=450000001 Ack=10 Win=14528 Len=0 TSV=3170094 TSER=3116610
================================================================================
IPv4 Conversations
Filter:<No Filter>
                                               |       <-      | |       ->      | |     Total     |
                                               | Frames  Bytes | | Frames  Bytes | | Frames  Bytes |
10.0.1.3             <-> 10.0.1.2              310778 470511356  155769  10280770  466547 480792126
================================================================================
  1   0.000000     10.0.1.3 -> 10.0.1.2     TCP 56150 > 9040 [SYN] Seq=0 Win=5840 Len=0 MSS=1460 TSV=3120644 TSER=0 WS=6
  2   0.000279     10.0.1.2 -> 10.0.1.3     TCP 9040 > 56150 [SYN, ACK] Seq=0 Ack=1 Win=14480 Len=0 MSS=1460 TSV=3174119 TSER=3120644 WS=6
  3   0.000312     10.0.1.3 -> 10.0.1.2     TCP 56150 > 9040 [ACK] Seq=1 Ack=1 Win=5888 Len=0 TSV=3120644 TSER=3174119
466548  38.313762     10.0.1.3 -> 10.0.1.2     TCP 56150 > 9040 [FIN, ACK] Seq=9 Ack=450000001 Win=2580480 Len=0 TSV=3130222 TSER=3183643
466549  38.353215     10.0.1.2 -> 10.0.1.3     TCP 9040 > 56150 [ACK] Seq=450000001 Ack=10 Win=14528 Len=0 TSV=3183708 TSER=3130222
================================================================================
IPv4 Conversations
Filter:<No Filter>
                                               |       <-      | |       ->      | |     Total     |
                                               | Frames  Bytes | | Frames  Bytes | | Frames  Bytes |
10.0.1.3             <-> 10.0.1.2              310778 470511356  155771  10280902  466549 480792258
================================================================================
  1   0.000000     10.0.1.3 -> 10.0.1.2     TCP 56151 > 9040 [SYN] Seq=0 Win=5840 Len=0 MSS=1460 TSV=3134236 TSER=0 WS=6
  2   0.000283     10.0.1.2 -> 10.0.1.3     TCP 9040 > 56151 [SYN, ACK] Seq=0 Ack=1 Win=14480 Len=0 MSS=1460 TSV=3187712 TSER=3134236 WS=6
  3   0.000316     10.0.1.3 -> 10.0.1.2     TCP 56151 > 9040 [ACK] Seq=1 Ack=1 Win=5888 Len=0 TSV=3134236 TSER=3187712
466505  38.313764     10.0.1.3 -> 10.0.1.2     TCP 56151 > 9040 [FIN, ACK] Seq=9 Ack=450000001 Win=2580480 Len=0 TSV=3143814 TSER=3197236
466506  38.351762     10.0.1.2 -> 10.0.1.3     TCP 9040 > 56151 [ACK] Seq=450000001 Ack=10 Win=14528 Len=0 TSV=3197301 TSER=3143814
================================================================================
IPv4 Conversations
Filter:<No Filter>
                                               |       <-      | |       ->      | |     Total     |
                                               | Frames  Bytes | | Frames  Bytes | | Frames  Bytes |
10.0.1.3             <-> 10.0.1.2              310778 470511356  155728  10278064  466506 480789420
================================================================================
  1   0.000000     10.0.1.3 -> 10.0.1.2     TCP 56152 > 9040 [SYN] Seq=0 Win=5840 Len=0 MSS=1460 TSV=3147859 TSER=0 WS=6
  2   0.000281     10.0.1.2 -> 10.0.1.3     TCP 9040 > 56152 [SYN, ACK] Seq=0 Ack=1 Win=14480 Len=0 MSS=1460 TSV=3201336 TSER=3147859 WS=6
  3   0.000313     10.0.1.3 -> 10.0.1.2     TCP 56152 > 9040 [ACK] Seq=1 Ack=1 Win=5888 Len=0 TSV=3147859 TSER=3201336
466603  38.313672     10.0.1.3 -> 10.0.1.2     TCP 56152 > 9040 [FIN, ACK] Seq=9 Ack=450000001 Win=2557184 Len=0 TSV=3157438 TSER=3210862
466604  38.350953     10.0.1.2 -> 10.0.1.3     TCP 9040 > 56152 [ACK] Seq=450000001 Ack=10 Win=14528 Len=0 TSV=3210925 TSER=3157438
================================================================================
IPv4 Conversations
Filter:<No Filter>
                                               |       <-      | |       ->      | |     Total     |
                                               | Frames  Bytes | | Frames  Bytes | | Frames  Bytes |
10.0.1.3             <-> 10.0.1.2              310778 470511356  155826  10284532  466604 480795888
================================================================================
  1   0.000000     10.0.1.3 -> 10.0.1.2     TCP 33369 > 9040 [SYN] Seq=0 Win=5840 Len=0 MSS=1460 TSV=3161451 TSER=0 WS=6
  2   0.000282     10.0.1.2 -> 10.0.1.3     TCP 9040 > 33369 [SYN, ACK] Seq=0 Ack=1 Win=14480 Len=0 MSS=1460 TSV=3214929 TSER=3161451 WS=6
  3   0.000317     10.0.1.3 -> 10.0.1.2     TCP 33369 > 9040 [ACK] Seq=1 Ack=1 Win=5888 Len=0 TSV=3161451 TSER=3214929
466551  38.313733     10.0.1.3 -> 10.0.1.2     TCP 33369 > 9040 [FIN, ACK] Seq=9 Ack=450000001 Win=2580480 Len=0 TSV=3171029 TSER=3224454
466552  38.353123     10.0.1.2 -> 10.0.1.3     TCP 9040 > 33369 [ACK] Seq=450000001 Ack=10 Win=14528 Len=0 TSV=3224518 TSER=3171029
================================================================================
IPv4 Conversations
Filter:<No Filter>
                                               |       <-      | |       ->      | |     Total     |
                                               | Frames  Bytes | | Frames  Bytes | | Frames  Bytes |
10.0.1.3             <-> 10.0.1.2              310778 470511356  155774  10281100  466552 480792456
================================================================================
