  1   0.000000     10.0.1.3 -> 10.0.1.2     TCP 47805 > 9040 [SYN] Seq=0 Win=5840 Len=0 MSS=1460 TSV=2658835 TSER=0 WS=6
  2   0.000288     10.0.1.2 -> 10.0.1.3     TCP 9040 > 47805 [SYN, ACK] Seq=0 Ack=1 Win=14480 Len=0 MSS=1460 TSV=2712275 TSER=2658835 WS=6
  3   0.000322     10.0.1.3 -> 10.0.1.2     TCP 47805 > 9040 [ACK] Seq=1 Ack=1 Win=5888 Len=0 TSV=2658835 TSER=2712275
414786  34.056874     10.0.1.3 -> 10.0.1.2     TCP 47805 > 9040 [FIN, ACK] Seq=9 Ack=400000001 Win=2563008 Len=0 TSV=2667349 TSER=2720736
414787  34.095930     10.0.1.2 -> 10.0.1.3     TCP 9040 > 47805 [ACK] Seq=400000001 Ack=10 Win=14528 Len=0 TSV=2720800 TSER=2667349
================================================================================
IPv4 Conversations
Filter:<No Filter>
                                               |       <-      | |       ->      | |     Total     |
                                               | Frames  Bytes | | Frames  Bytes | | Frames  Bytes |
10.0.1.3             <-> 10.0.1.2              276248 418232376  138539   9143590  414787 427375966
================================================================================
  1   0.000000     10.0.1.3 -> 10.0.1.2     TCP ap > 9040 [SYN] Seq=0 Win=5840 Len=0 MSS=1460 TSV=2671032 TSER=0 WS=6
  2   0.000309     10.0.1.2 -> 10.0.1.3     TCP 9040 > ap [SYN, ACK] Seq=0 Ack=1 Win=14480 Len=0 MSS=1460 TSV=2724473 TSER=2671032 WS=6
  3   0.000346     10.0.1.3 -> 10.0.1.2     TCP ap > 9040 [ACK] Seq=1 Ack=1 Win=5888 Len=0 TSV=2671033 TSER=2724473
414805  34.056953     10.0.1.3 -> 10.0.1.2     TCP ap > 9040 [FIN, ACK] Seq=9 Ack=400000001 Win=2580480 Len=0 TSV=2679547 TSER=2732935
414806  34.094603     10.0.1.2 -> 10.0.1.3     TCP 9040 > ap [ACK] Seq=400000001 Ack=10 Win=14528 Len=0 TSV=2732998 TSER=2679547
================================================================================
IPv4 Conversations
Filter:<No Filter>
                                               |       <-      | |       ->      | |     Total     |
                                               | Frames  Bytes | | Frames  Bytes | | Frames  Bytes |
10.0.1.3             <-> 10.0.1.2              276248 418232376  138558   9144844  414806 427377220
================================================================================
  1   0.000000     10.0.1.3 -> 10.0.1.2     TCP 47807 > 9040 [SYN] Seq=0 Win=5840 Len=0 MSS=1460 TSV=2683244 TSER=0 WS=6
  2   0.000328     10.0.1.2 -> 10.0.1.3     TCP 9040 > 47807 [SYN, ACK] Seq=0 Ack=1 Win=14480 Len=0 MSS=1460 TSV=2736686 TSER=2683244 WS=6
  3   0.000364     10.0.1.3 -> 10.0.1.2     TCP 47807 > 9040 [ACK] Seq=1 Ack=1 Win=5888 Len=0 TSV=2683244 TSER=2736686
414794  34.056991     10.0.1.3 -> 10.0.1.2     TCP 47807 > 9040 [FIN, ACK] Seq=9 Ack=400000001 Win=2580480 Len=0 TSV=2691758 TSER=2745146
414795  34.096347     10.0.1.2 -> 10.0.1.3     TCP 9040 > 47807 [ACK] Seq=400000001 Ack=10 Win=14528 Len=0 TSV=2745211 TSER=2691758
================================================================================
IPv4 Conversations
Filter:<No Filter>
                                               |       <-      | |       ->      | |     Total     |
                                               | Frames  Bytes | | Frames  Bytes | | Frames  Bytes |
10.0.1.3             <-> 10.0.1.2              276248 418232376  138547   9144118  414795 427376494
================================================================================
  1   0.000000     10.0.1.3 -> 10.0.1.2     TCP bacnet > 9040 [SYN] Seq=0 Win=5840 Len=0 MSS=1460 TSV=2695468 TSER=0 WS=6
  2   0.000280     10.0.1.2 -> 10.0.1.3     TCP 9040 > bacnet [SYN, ACK] Seq=0 Ack=1 Win=14480 Len=0 MSS=1460 TSV=2748911 TSER=2695468 WS=6
  3   0.000313     10.0.1.3 -> 10.0.1.2     TCP bacnet > 9040 [ACK] Seq=1 Ack=1 Win=5888 Len=0 TSV=2695468 TSER=2748911
414776  34.056871     10.0.1.3 -> 10.0.1.2     TCP bacnet > 9040 [FIN, ACK] Seq=9 Ack=400000001 Win=2580480 Len=0 TSV=2703982 TSER=2757371
414777  34.096348     10.0.1.2 -> 10.0.1.3     TCP 9040 > bacnet [ACK] Seq=400000001 Ack=10 Win=14528 Len=0 TSV=2757436 TSER=2703982
================================================================================
IPv4 Conversations
Filter:<No Filter>
                                               |       <-      | |       ->      | |     Total     |
                                               | Frames  Bytes | | Frames  Bytes | | Frames  Bytes |
10.0.1.3             <-> 10.0.1.2              276248 418232376  138529   9142930  414777 427375306
================================================================================
  1   0.000000     10.0.1.3 -> 10.0.1.2     TCP 37438 > 9040 [SYN] Seq=0 Win=5840 Len=0 MSS=1460 TSV=2707702 TSER=0 WS=6
  2   0.000281     10.0.1.2 -> 10.0.1.3     TCP 9040 > 37438 [SYN, ACK] Seq=0 Ack=1 Win=14480 Len=0 MSS=1460 TSV=2761146 TSER=2707702 WS=6
  3   0.000314     10.0.1.3 -> 10.0.1.2     TCP 37438 > 9040 [ACK] Seq=1 Ack=1 Win=5888 Len=0 TSV=2707702 TSER=2761146
414766  34.056892     10.0.1.3 -> 10.0.1.2     TCP 37438 > 9040 [FIN, ACK] Seq=9 Ack=400000001 Win=2580480 Len=0 TSV=2716216 TSER=2769606
414767  34.093761     10.0.1.2 -> 10.0.1.3     TCP 9040 > 37438 [ACK] Seq=400000001 Ack=10 Win=14528 Len=0 TSV=2769670 TSER=2716216
================================================================================
IPv4 Conversations
Filter:<No Filter>
                                               |       <-      | |       ->      | |     Total     |
                                               | Frames  Bytes | | Frames  Bytes | | Frames  Bytes |
10.0.1.3             <-> 10.0.1.2              276248 418232376  138519   9142270  414767 427374646
================================================================================
  1   0.000000     10.0.1.3 -> 10.0.1.2     TCP 37439 > 9040 [SYN] Seq=0 Win=5840 Len=0 MSS=1460 TSV=2719910 TSER=0 WS=6
  2   0.000310     10.0.1.2 -> 10.0.1.3     TCP 9040 > 37439 [SYN, ACK] Seq=0 Ack=1 Win=14480 Len=0 MSS=1460 TSV=2773355 TSER=2719910 WS=6
  3   0.000346     10.0.1.3 -> 10.0.1.2     TCP 37439 > 9040 [ACK] Seq=1 Ack=1 Win=5888 Len=0 TSV=2719910 TSER=2773355
414786  34.056994     10.0.1.3 -> 10.0.1.2     TCP 37439 > 9040 [FIN, ACK] Seq=9 Ack=400000001 Win=2580480 Len=0 TSV=2728424 TSER=2781815
414787  34.093481     10.0.1.2 -> 10.0.1.3     TCP 9040 > 37439 [ACK] Seq=400000001 Ack=10 Win=14528 Len=0 TSV=2781879 TSER=2728424
================================================================================
IPv4 Conversations
Filter:<No Filter>
                                               |       <-      | |       ->      | |     Total     |
                                               | Frames  Bytes | | Frames  Bytes | | Frames  Bytes |
10.0.1.3             <-> 10.0.1.2              276248 418232376  138539   9143590  414787 427375966
================================================================================
  1   0.000000     10.0.1.3 -> 10.0.1.2     TCP 37440 > 9040 [SYN] Seq=0 Win=5840 Len=0 MSS=1460 TSV=2732118 TSER=0 WS=6
  2   0.000283     10.0.1.2 -> 10.0.1.3     TCP 9040 > 37440 [SYN, ACK] Seq=0 Ack=1 Win=14480 Len=0 MSS=1460 TSV=2785564 TSER=2732118 WS=6
  3   0.000323     10.0.1.3 -> 10.0.1.2     TCP 37440 > 9040 [ACK] Seq=1 Ack=1 Win=5888 Len=0 TSV=2732118 TSER=2785564
414753  34.056901     10.0.1.3 -> 10.0.1.2     TCP 37440 > 9040 [FIN, ACK] Seq=9 Ack=400000001 Win=2580480 Len=0 TSV=2740632 TSER=2794024
414754  34.093325     10.0.1.2 -> 10.0.1.3     TCP 9040 > 37440 [ACK] Seq=400000001 Ack=10 Win=14528 Len=0 TSV=2794088 TSER=2740632
================================================================================
IPv4 Conversations
Filter:<No Filter>
                                               |       <-      | |       ->      | |     Total     |
                                               | Frames  Bytes | | Frames  Bytes | | Frames  Bytes |
10.0.1.3             <-> 10.0.1.2              276248 418232376  138506   9141412  414754 427373788
================================================================================
  1   0.000000     10.0.1.3 -> 10.0.1.2     TCP 37441 > 9040 [SYN] Seq=0 Win=5840 Len=0 MSS=1460 TSV=2744335 TSER=0 WS=6
  2   0.000308     10.0.1.2 -> 10.0.1.3     TCP 9040 > 37441 [SYN, ACK] Seq=0 Ack=1 Win=14480 Len=0 MSS=1460 TSV=2797782 TSER=2744335 WS=6
  3   0.000341     10.0.1.3 -> 10.0.1.2     TCP 37441 > 9040 [ACK] Seq=1 Ack=1 Win=5888 Len=0 TSV=2744335 TSER=2797782
414773  34.056853     10.0.1.3 -> 10.0.1.2     TCP 37441 > 9040 [FIN, ACK] Seq=9 Ack=400000001 Win=2580480 Len=0 TSV=2752849 TSER=2806242
414774  34.097022     10.0.1.2 -> 10.0.1.3     TCP 9040 > 37441 [ACK] Seq=400000001 Ack=10 Win=14528 Len=0 TSV=2806307 TSER=2752849
================================================================================
IPv4 Conversations
Filter:<No Filter>
                                               |       <-      | |       ->      | |     Total     |
                                               | Frames  Bytes | | Frames  Bytes | | Frames  Bytes |
10.0.1.3             <-> 10.0.1.2              276248 418232376  138526   9142732  414774 427375108
================================================================================
  1   0.000000     10.0.1.3 -> 10.0.1.2     TCP 37442 > 9040 [SYN] Seq=0 Win=5840 Len=0 MSS=1460 TSV=2756521 TSER=0 WS=6
  2   0.000301     10.0.1.2 -> 10.0.1.3     TCP 9040 > 37442 [SYN, ACK] Seq=0 Ack=1 Win=14480 Len=0 MSS=1460 TSV=2809968 TSER=2756521 WS=6
  3   0.000360     10.0.1.3 -> 10.0.1.2     TCP 37442 > 9040 [ACK] Seq=1 Ack=1 Win=5888 Len=0 TSV=2756521 TSER=2809968
414779  34.056957     10.0.1.3 -> 10.0.1.2     TCP 37442 > 9040 [FIN, ACK] Seq=9 Ack=400000001 Win=2580480 Len=0 TSV=2765035 TSER=2818429
414780  34.095734     10.0.1.2 -> 10.0.1.3     TCP 9040 > 37442 [ACK] Seq=400000001 Ack=10 Win=14528 Len=0 TSV=2818493 TSER=2765035
================================================================================
IPv4 Conversations
Filter:<No Filter>
                                               |       <-      | |       ->      | |     Total     |
                                               | Frames  Bytes | | Frames  Bytes | | Frames  Bytes |
10.0.1.3             <-> 10.0.1.2              276248 418232376  138532   9143128  414780 427375504
================================================================================
  1   0.000000     10.0.1.3 -> 10.0.1.2     TCP 37443 > 9040 [SYN] Seq=0 Win=5840 Len=0 MSS=1460 TSV=2768721 TSER=0 WS=6
  2   0.000323     10.0.1.2 -> 10.0.1.3     TCP 9040 > 37443 [SYN, ACK] Seq=0 Ack=1 Win=14480 Len=0 MSS=1460 TSV=2822169 TSER=2768721 WS=6
  3   0.000359     10.0.1.3 -> 10.0.1.2     TCP 37443 > 9040 [ACK] Seq=1 Ack=1 Win=5888 Len=0 TSV=2768721 TSER=2822169
414785  34.058393     10.0.1.3 -> 10.0.1.2     TCP 37443 > 9040 [FIN, ACK] Seq=9 Ack=400000001 Win=2580480 Len=0 TSV=2777236 TSER=2830630
414786  34.095067     10.0.1.2 -> 10.0.1.3     TCP 9040 > 37443 [ACK] Seq=400000001 Ack=10 Win=14528 Len=0 TSV=2830694 TSER=2777236
================================================================================
IPv4 Conversations
Filter:<No Filter>
                                               |       <-      | |       ->      | |     Total     |
                                               | Frames  Bytes | | Frames  Bytes | | Frames  Bytes |
10.0.1.3             <-> 10.0.1.2              276248 418232376  138538   9143524  414786 427375900
================================================================================
  1   0.000000     10.0.1.3 -> 10.0.1.2     TCP 47085 > 9040 [SYN] Seq=0 Win=5840 Len=0 MSS=1460 TSV=2780921 TSER=0 WS=6
  2   0.000283     10.0.1.2 -> 10.0.1.3     TCP 9040 > 47085 [SYN, ACK] Seq=0 Ack=1 Win=14480 Len=0 MSS=1460 TSV=2834370 TSER=2780921 WS=6
  3   0.000315     10.0.1.3 -> 10.0.1.2     TCP 47085 > 9040 [ACK] Seq=1 Ack=1 Win=5888 Len=0 TSV=2780921 TSER=2834370
414795  34.056837     10.0.1.3 -> 10.0.1.2     TCP 47085 > 9040 [FIN, ACK] Seq=9 Ack=400000001 Win=2580480 Len=0 TSV=2789435 TSER=2842831
414796  34.094859     10.0.1.2 -> 10.0.1.3     TCP 9040 > 47085 [ACK] Seq=400000001 Ack=10 Win=14528 Len=0 TSV=2842895 TSER=2789435
================================================================================
IPv4 Conversations
Filter:<No Filter>
                                               |       <-      | |       ->      | |     Total     |
                                               | Frames  Bytes | | Frames  Bytes | | Frames  Bytes |
10.0.1.3             <-> 10.0.1.2              276248 418232376  138548   9144184  414796 427376560
================================================================================
  1   0.000000     10.0.1.3 -> 10.0.1.2     TCP 47086 > 9040 [SYN] Seq=0 Win=5840 Len=0 MSS=1460 TSV=2793115 TSER=0 WS=6
  2   0.000282     10.0.1.2 -> 10.0.1.3     TCP 9040 > 47086 [SYN, ACK] Seq=0 Ack=1 Win=14480 Len=0 MSS=1460 TSV=2846565 TSER=2793115 WS=6
  3   0.000316     10.0.1.3 -> 10.0.1.2     TCP 47086 > 9040 [ACK] Seq=1 Ack=1 Win=5888 Len=0 TSV=2793115 TSER=2846565
414747  34.056960     10.0.1.3 -> 10.0.1.2     TCP 47086 > 9040 [FIN, ACK] Seq=9 Ack=400000001 Win=2580480 Len=0 TSV=2801629 TSER=2855025
414748  34.095452     10.0.1.2 -> 10.0.1.3     TCP 9040 > 47086 [ACK] Seq=400000001 Ack=10 Win=14528 Len=0 TSV=2855090 TSER=2801629
================================================================================
IPv4 Conversations
Filter:<No Filter>
                                               |       <-      | |       ->      | |     Total     |
                                               | Frames  Bytes | | Frames  Bytes | | Frames  Bytes |
10.0.1.3             <-> 10.0.1.2              276248 418232376  138500   9141016  414748 427373392
================================================================================
  1   0.000000     10.0.1.3 -> 10.0.1.2     TCP 47087 > 9040 [SYN] Seq=0 Win=5840 Len=0 MSS=1460 TSV=2805316 TSER=0 WS=6
  2   0.000313     10.0.1.2 -> 10.0.1.3     TCP 9040 > 47087 [SYN, ACK] Seq=0 Ack=1 Win=14480 Len=0 MSS=1460 TSV=2858767 TSER=2805316 WS=6
  3   0.000349     10.0.1.3 -> 10.0.1.2     TCP 47087 > 9040 [ACK] Seq=1 Ack=1 Win=5888 Len=0 TSV=2805316 TSER=2858767
414802  34.056994     10.0.1.3 -> 10.0.1.2     TCP 47087 > 9040 [FIN, ACK] Seq=9 Ack=400000001 Win=2580480 Len=0 TSV=2813830 TSER=2867227
414803  34.093403     10.0.1.2 -> 10.0.1.3     TCP 9040 > 47087 [ACK] Seq=400000001 Ack=10 Win=14528 Len=0 TSV=2867291 TSER=2813830
================================================================================
IPv4 Conversations
Filter:<No Filter>
                                               |       <-      | |       ->      | |     Total     |
                                               | Frames  Bytes | | Frames  Bytes | | Frames  Bytes |
10.0.1.3             <-> 10.0.1.2              276248 418232376  138555   9144646  414803 427377022
================================================================================
  1   0.000000     10.0.1.3 -> 10.0.1.2     TCP 47088 > 9040 [SYN] Seq=0 Win=5840 Len=0 MSS=1460 TSV=2817544 TSER=0 WS=6
  2   0.000280     10.0.1.2 -> 10.0.1.3     TCP 9040 > 47088 [SYN, ACK] Seq=0 Ack=1 Win=14480 Len=0 MSS=1460 TSV=2870996 TSER=2817544 WS=6
  3   0.000313     10.0.1.3 -> 10.0.1.2     TCP 47088 > 9040 [ACK] Seq=1 Ack=1 Win=5888 Len=0 TSV=2817544 TSER=2870996
414772  34.056898     10.0.1.3 -> 10.0.1.2     TCP 47088 > 9040 [FIN, ACK] Seq=9 Ack=400000001 Win=2560064 Len=0 TSV=2826058 TSER=2879456
414773  34.096484     10.0.1.2 -> 10.0.1.3     TCP 9040 > 47088 [ACK] Seq=400000001 Ack=10 Win=14528 Len=0 TSV=2879521 TSER=2826058
================================================================================
IPv4 Conversations
Filter:<No Filter>
                                               |       <-      | |       ->      | |     Total     |
                                               | Frames  Bytes | | Frames  Bytes | | Frames  Bytes |
10.0.1.3             <-> 10.0.1.2              276248 418232376  138525   9142666  414773 427375042
================================================================================
  1   0.000000     10.0.1.3 -> 10.0.1.2     TCP 47089 > 9040 [SYN] Seq=0 Win=5840 Len=0 MSS=1460 TSV=2829780 TSER=0 WS=6
  2   0.000301     10.0.1.2 -> 10.0.1.3     TCP 9040 > 47089 [SYN, ACK] Seq=0 Ack=1 Win=14480 Len=0 MSS=1460 TSV=2883233 TSER=2829780 WS=6
  3   0.000334     10.0.1.3 -> 10.0.1.2     TCP 47089 > 9040 [ACK] Seq=1 Ack=1 Win=5888 Len=0 TSV=2829780 TSER=2883233
414773  34.056884     10.0.1.3 -> 10.0.1.2     TCP 47089 > 9040 [FIN, ACK] Seq=9 Ack=400000001 Win=2580480 Len=0 TSV=2838294 TSER=2891693
414774  34.095960     10.0.1.2 -> 10.0.1.3     TCP 9040 > 47089 [ACK] Seq=400000001 Ack=10 Win=14528 Len=0 TSV=2891758 TSER=2838294
================================================================================
IPv4 Conversations
Filter:<No Filter>
                                               |       <-      | |       ->      | |     Total     |
                                               | Frames  Bytes | | Frames  Bytes | | Frames  Bytes |
10.0.1.3             <-> 10.0.1.2              276248 418232376  138526   9142732  414774 427375108
================================================================================
  1   0.000000     10.0.1.3 -> 10.0.1.2     TCP 47090 > 9040 [SYN] Seq=0 Win=5840 Len=0 MSS=1460 TSV=2841950 TSER=0 WS=6
  2   0.000308     10.0.1.2 -> 10.0.1.3     TCP 9040 > 47090 [SYN, ACK] Seq=0 Ack=1 Win=14480 Len=0 MSS=1460 TSV=2895404 TSER=2841950 WS=6
  3   0.000342     10.0.1.3 -> 10.0.1.2     TCP 47090 > 9040 [ACK] Seq=1 Ack=1 Win=5888 Len=0 TSV=2841950 TSER=2895404
414791  34.056916     10.0.1.3 -> 10.0.1.2     TCP 47090 > 9040 [FIN, ACK] Seq=9 Ack=400000001 Win=2580480 Len=0 TSV=2850464 TSER=2903865
414792  34.096148     10.0.1.2 -> 10.0.1.3     TCP 9040 > 47090 [ACK] Seq=400000001 Ack=10 Win=14528 Len=0 TSV=2903929 TSER=2850464
================================================================================
IPv4 Conversations
Filter:<No Filter>
                                               |       <-      | |       ->      | |     Total     |
                                               | Frames  Bytes | | Frames  Bytes | | Frames  Bytes |
10.0.1.3             <-> 10.0.1.2              276248 418232376  138544   9143920  414792 427376296
================================================================================
  1   0.000000     10.0.1.3 -> 10.0.1.2     TCP 57816 > 9040 [SYN] Seq=0 Win=5840 Len=0 MSS=1460 TSV=2854139 TSER=0 WS=6
  2   0.000278     10.0.1.2 -> 10.0.1.3     TCP 9040 > 57816 [SYN, ACK] Seq=0 Ack=1 Win=14480 Len=0 MSS=1460 TSV=2907594 TSER=2854139 WS=6
  3   0.000312     10.0.1.3 -> 10.0.1.2     TCP 57816 > 9040 [ACK] Seq=1 Ack=1 Win=5888 Len=0 TSV=2854139 TSER=2907594
414799  34.056883     10.0.1.3 -> 10.0.1.2     TCP 57816 > 9040 [FIN, ACK] Seq=9 Ack=400000001 Win=2580480 Len=0 TSV=2862653 TSER=2916054
414800  34.096640     10.0.1.2 -> 10.0.1.3     TCP 9040 > 57816 [ACK] Seq=400000001 Ack=10 Win=14528 Len=0 TSV=2916119 TSER=2862653
================================================================================
IPv4 Conversations
Filter:<No Filter>
                                               |       <-      | |       ->      | |     Total     |
                                               | Frames  Bytes | | Frames  Bytes | | Frames  Bytes |
10.0.1.3             <-> 10.0.1.2              276248 418232376  138552   9144448  414800 427376824
================================================================================
  1   0.000000     10.0.1.3 -> 10.0.1.2     TCP 57817 > 9040 [SYN] Seq=0 Win=5840 Len=0 MSS=1460 TSV=2866348 TSER=0 WS=6
  2   0.000313     10.0.1.2 -> 10.0.1.3     TCP 9040 > 57817 [SYN, ACK] Seq=0 Ack=1 Win=14480 Len=0 MSS=1460 TSV=2919804 TSER=2866348 WS=6
  3   0.000349     10.0.1.3 -> 10.0.1.2     TCP 57817 > 9040 [ACK] Seq=1 Ack=1 Win=5888 Len=0 TSV=2866348 TSER=2919804
414802  34.056907     10.0.1.3 -> 10.0.1.2     TCP 57817 > 9040 [FIN, ACK] Seq=9 Ack=400000001 Win=2557184 Len=0 TSV=2874863 TSER=2928266
414803  34.095575     10.0.1.2 -> 10.0.1.3     TCP 9040 > 57817 [ACK] Seq=400000001 Ack=10 Win=14528 Len=0 TSV=2928329 TSER=2874863
================================================================================
IPv4 Conversations
Filter:<No Filter>
                                               |       <-      | |       ->      | |     Total     |
                                               | Frames  Bytes | | Frames  Bytes | | Frames  Bytes |
10.0.1.3             <-> 10.0.1.2              276248 418232376  138555   9144646  414803 427377022
================================================================================
  1   0.000000     10.0.1.3 -> 10.0.1.2     TCP 57818 > 9040 [SYN] Seq=0 Win=5840 Len=0 MSS=1460 TSV=2878548 TSER=0 WS=6
  2   0.000291     10.0.1.2 -> 10.0.1.3     TCP 9040 > 57818 [SYN, ACK] Seq=0 Ack=1 Win=14480 Len=0 MSS=1460 TSV=2932005 TSER=2878548 WS=6
  3   0.000327     10.0.1.3 -> 10.0.1.2     TCP 57818 > 9040 [ACK] Seq=1 Ack=1 Win=5888 Len=0 TSV=2878548 TSER=2932005
414777  34.056838     10.0.1.3 -> 10.0.1.2     TCP 57818 > 9040 [FIN, ACK] Seq=9 Ack=400000001 Win=2580480 Len=0 TSV=2887062 TSER=2940466
414778  34.097033     10.0.1.2 -> 10.0.1.3     TCP 9040 > 57818 [ACK] Seq=400000001 Ack=10 Win=14528 Len=0 TSV=2940530 TSER=2887062
================================================================================
IPv4 Conversations
Filter:<No Filter>
                                               |       <-      | |       ->      | |     Total     |
                                               | Frames  Bytes | | Frames  Bytes | | Frames  Bytes |
10.0.1.3             <-> 10.0.1.2              276248 418232376  138530   9142996  414778 427375372
================================================================================
  1   0.000000     10.0.1.3 -> 10.0.1.2     TCP 57819 > 9040 [SYN] Seq=0 Win=5840 Len=0 MSS=1460 TSV=2890728 TSER=0 WS=6
  2   0.000279     10.0.1.2 -> 10.0.1.3     TCP 9040 > 57819 [SYN, ACK] Seq=0 Ack=1 Win=14480 Len=0 MSS=1460 TSV=2944185 TSER=2890728 WS=6
  3   0.000311     10.0.1.3 -> 10.0.1.2     TCP 57819 > 9040 [ACK] Seq=1 Ack=1 Win=5888 Len=0 TSV=2890728 TSER=2944185
414802  34.056869     10.0.1.3 -> 10.0.1.2     TCP 57819 > 9040 [FIN, ACK] Seq=9 Ack=400000001 Win=2580480 Len=0 TSV=2899242 TSER=2952646
414803  34.094044     10.0.1.2 -> 10.0.1.3     TCP 9040 > 57819 [ACK] Seq=400000001 Ack=10 Win=14528 Len=0 TSV=2952710 TSER=2899242
================================================================================
IPv4 Conversations
Filter:<No Filter>
                                               |       <-      | |       ->      | |     Total     |
                                               | Frames  Bytes | | Frames  Bytes | | Frames  Bytes |
10.0.1.3             <-> 10.0.1.2              276248 418232376  138555   9144646  414803 427377022
================================================================================
