  1   0.000000     10.0.1.3 -> 10.0.1.2     TCP 58589 > 9040 [SYN] Seq=0 Win=5840 Len=0 MSS=1460 TSV=1730022 TSER=0 WS=6
  2   0.000311     10.0.1.2 -> 10.0.1.3     TCP 9040 > 58589 [SYN, ACK] Seq=0 Ack=1 Win=14480 Len=0 MSS=1460 TSV=1783392 TSER=1730022 WS=6
  3   0.000347     10.0.1.3 -> 10.0.1.2     TCP 58589 > 9040 [ACK] Seq=1 Ack=1 Win=5888 Len=0 TSV=1730022 TSER=1783392
52182   4.262888     10.0.1.3 -> 10.0.1.2     TCP 58589 > 9040 [FIN, ACK] Seq=9 Ack=50000001 Win=2580480 Len=0 TSV=1731088 TSER=1784405
52183   4.302396     10.0.1.2 -> 10.0.1.3     TCP 9040 > 58589 [ACK] Seq=50000001 Ack=10 Win=14528 Len=0 TSV=1784468 TSER=1731088
================================================================================
IPv4 Conversations
Filter:<No Filter>
                                               |       <-      | |       ->      | |     Total     |
                                               | Frames  Bytes | | Frames  Bytes | | Frames  Bytes |
10.0.1.3             <-> 10.0.1.2               34535  52279318   17648   1164784   52183  53444102
================================================================================
  1   0.000000     10.0.1.3 -> 10.0.1.2     TCP 58590 > 9040 [SYN] Seq=0 Win=5840 Len=0 MSS=1460 TSV=1732479 TSER=0 WS=6
  2   0.000322     10.0.1.2 -> 10.0.1.3     TCP 9040 > 58590 [SYN, ACK] Seq=0 Ack=1 Win=14480 Len=0 MSS=1460 TSV=1785849 TSER=1732479 WS=6
  3   0.000359     10.0.1.3 -> 10.0.1.2     TCP 58590 > 9040 [ACK] Seq=1 Ack=1 Win=5888 Len=0 TSV=1732479 TSER=1785849
52201   4.258714     10.0.1.3 -> 10.0.1.2     TCP 58590 > 9040 [FIN, ACK] Seq=9 Ack=50000001 Win=2580480 Len=0 TSV=1733543 TSER=1786861
52202   4.295705     10.0.1.2 -> 10.0.1.3     TCP 9040 > 58590 [ACK] Seq=50000001 Ack=10 Win=14528 Len=0 TSV=1786923 TSER=1733543
================================================================================
IPv4 Conversations
Filter:<No Filter>
                                               |       <-      | |       ->      | |     Total     |
                                               | Frames  Bytes | | Frames  Bytes | | Frames  Bytes |
10.0.1.3             <-> 10.0.1.2               34535  52279318   17667   1166038   52202  53445356
================================================================================
  1   0.000000     10.0.1.3 -> 10.0.1.2     TCP 58591 > 9040 [SYN] Seq=0 Win=5840 Len=0 MSS=1460 TSV=1734936 TSER=0 WS=6
  2   0.000293     10.0.1.2 -> 10.0.1.3     TCP 9040 > 58591 [SYN, ACK] Seq=0 Ack=1 Win=14480 Len=0 MSS=1460 TSV=1788306 TSER=1734936 WS=6
  3   0.000328     10.0.1.3 -> 10.0.1.2     TCP 58591 > 9040 [ACK] Seq=1 Ack=1 Win=5888 Len=0 TSV=1734936 TSER=1788306
52238   4.258710     10.0.1.3 -> 10.0.1.2     TCP 58591 > 9040 [FIN, ACK] Seq=9 Ack=50000001 Win=2560064 Len=0 TSV=1736001 TSER=1789324
52239   4.297731     10.0.1.2 -> 10.0.1.3     TCP 9040 > 58591 [ACK] Seq=50000001 Ack=10 Win=14528 Len=0 TSV=1789381 TSER=1736001
================================================================================
IPv4 Conversations
Filter:<No Filter>
                                               |       <-      | |       ->      | |     Total     |
                                               | Frames  Bytes | | Frames  Bytes | | Frames  Bytes |
10.0.1.3             <-> 10.0.1.2               34535  52279318   17704   1168480   52239  53447798
================================================================================
  1   0.000000     10.0.1.3 -> 10.0.1.2     TCP 58593 > 9040 [SYN] Seq=0 Win=5840 Len=0 MSS=1460 TSV=1737394 TSER=0 WS=6
  2   0.000283     10.0.1.2 -> 10.0.1.3     TCP 9040 > 58593 [SYN, ACK] Seq=0 Ack=1 Win=14480 Len=0 MSS=1460 TSV=1790764 TSER=1737394 WS=6
  3   0.000319     10.0.1.3 -> 10.0.1.2     TCP 58593 > 9040 [ACK] Seq=1 Ack=1 Win=5888 Len=0 TSV=1737394 TSER=1790764
52236   4.258704     10.0.1.3 -> 10.0.1.2     TCP 58593 > 9040 [FIN, ACK] Seq=9 Ack=50000001 Win=2580480 Len=0 TSV=1738459 TSER=1791780
52237   4.296306     10.0.1.2 -> 10.0.1.3     TCP 9040 > 58593 [ACK] Seq=50000001 Ack=10 Win=14528 Len=0 TSV=1791839 TSER=1738459
================================================================================
IPv4 Conversations
Filter:<No Filter>
                                               |       <-      | |       ->      | |     Total     |
                                               | Frames  Bytes | | Frames  Bytes | | Frames  Bytes |
10.0.1.3             <-> 10.0.1.2               34535  52279318   17702   1168348   52237  53447666
================================================================================
  1   0.000000     10.0.1.3 -> 10.0.1.2     TCP 58594 > 9040 [SYN] Seq=0 Win=5840 Len=0 MSS=1460 TSV=1739847 TSER=0 WS=6
  2   0.000267     10.0.1.2 -> 10.0.1.3     TCP 9040 > 58594 [SYN, ACK] Seq=0 Ack=1 Win=14480 Len=0 MSS=1460 TSV=1793217 TSER=1739847 WS=6
  3   0.000302     10.0.1.3 -> 10.0.1.2     TCP 58594 > 9040 [ACK] Seq=1 Ack=1 Win=5888 Len=0 TSV=1739847 TSER=1793217
52205   4.258641     10.0.1.3 -> 10.0.1.2     TCP 58594 > 9040 [FIN, ACK] Seq=9 Ack=50000001 Win=2580480 Len=0 TSV=1740911 TSER=1794230
52206   4.297082     10.0.1.2 -> 10.0.1.3     TCP 9040 > 58594 [ACK] Seq=50000001 Ack=10 Win=14528 Len=0 TSV=1794292 TSER=1740911
================================================================================
IPv4 Conversations
Filter:<No Filter>
                                               |       <-      | |       ->      | |     Total     |
                                               | Frames  Bytes | | Frames  Bytes | | Frames  Bytes |
10.0.1.3             <-> 10.0.1.2               34535  52279318   17671   1166302   52206  53445620
================================================================================
  1   0.000000     10.0.1.3 -> 10.0.1.2     TCP 58595 > 9040 [SYN] Seq=0 Win=5840 Len=0 MSS=1460 TSV=1742297 TSER=0 WS=6
  2   0.000299     10.0.1.2 -> 10.0.1.3     TCP 9040 > 58595 [SYN, ACK] Seq=0 Ack=1 Win=14480 Len=0 MSS=1460 TSV=1795668 TSER=1742297 WS=6
  3   0.000333     10.0.1.3 -> 10.0.1.2     TCP 58595 > 9040 [ACK] Seq=1 Ack=1 Win=5888 Len=0 TSV=1742297 TSER=1795668
52240   4.258677     10.0.1.3 -> 10.0.1.2     TCP 58595 > 9040 [FIN, ACK] Seq=9 Ack=50000001 Win=2580480 Len=0 TSV=1743362 TSER=1796684
52241   4.295010     10.0.1.2 -> 10.0.1.3     TCP 9040 > 58595 [ACK] Seq=50000001 Ack=10 Win=14528 Len=0 TSV=1796742 TSER=1743362
================================================================================
IPv4 Conversations
Filter:<No Filter>
                                               |       <-      | |       ->      | |     Total     |
                                               | Frames  Bytes | | Frames  Bytes | | Frames  Bytes |
10.0.1.3             <-> 10.0.1.2               34535  52279318   17706   1168612   52241  53447930
================================================================================
  1   0.000000     10.0.1.3 -> 10.0.1.2     TCP 58596 > 9040 [SYN] Seq=0 Win=5840 Len=0 MSS=1460 TSV=1744752 TSER=0 WS=6
  2   0.000323     10.0.1.2 -> 10.0.1.3     TCP 9040 > 58596 [SYN, ACK] Seq=0 Ack=1 Win=14480 Len=0 MSS=1460 TSV=1798123 TSER=1744752 WS=6
  3   0.000355     10.0.1.3 -> 10.0.1.2     TCP 58596 > 9040 [ACK] Seq=1 Ack=1 Win=5888 Len=0 TSV=1744753 TSER=1798123
52237   4.258671     10.0.1.3 -> 10.0.1.2     TCP 58596 > 9040 [FIN, ACK] Seq=9 Ack=50000001 Win=2580480 Len=0 TSV=1745817 TSER=1799141
52238   4.296562     10.0.1.2 -> 10.0.1.3     TCP 9040 > 58596 [ACK] Seq=50000001 Ack=10 Win=14528 Len=0 TSV=1799198 TSER=1745817
================================================================================
IPv4 Conversations
Filter:<No Filter>
                                               |       <-      | |       ->      | |     Total     |
                                               | Frames  Bytes | | Frames  Bytes | | Frames  Bytes |
10.0.1.3             <-> 10.0.1.2               34535  52279318   17703   1168414   52238  53447732
================================================================================
  1   0.000000     10.0.1.3 -> 10.0.1.2     TCP 58597 > 9040 [SYN] Seq=0 Win=5840 Len=0 MSS=1460 TSV=1747207 TSER=0 WS=6
  2   0.000322     10.0.1.2 -> 10.0.1.3     TCP 9040 > 58597 [SYN, ACK] Seq=0 Ack=1 Win=14480 Len=0 MSS=1460 TSV=1800578 TSER=1747207 WS=6
  3   0.000357     10.0.1.3 -> 10.0.1.2     TCP 58597 > 9040 [ACK] Seq=1 Ack=1 Win=5888 Len=0 TSV=1747207 TSER=1800578
52243   4.258743     10.0.1.3 -> 10.0.1.2     TCP 58597 > 9040 [FIN, ACK] Seq=9 Ack=50000001 Win=2580480 Len=0 TSV=1748272 TSER=1801596
52244   4.298082     10.0.1.2 -> 10.0.1.3     TCP 9040 > 58597 [ACK] Seq=50000001 Ack=10 Win=14528 Len=0 TSV=1801653 TSER=1748272
================================================================================
IPv4 Conversations
Filter:<No Filter>
                                               |       <-      | |       ->      | |     Total     |
                                               | Frames  Bytes | | Frames  Bytes | | Frames  Bytes |
10.0.1.3             <-> 10.0.1.2               34535  52279318   17709   1168810   52244  53448128
================================================================================
  1   0.000000     10.0.1.3 -> 10.0.1.2     TCP 58598 > 9040 [SYN] Seq=0 Win=5840 Len=0 MSS=1460 TSV=1749662 TSER=0 WS=6
  2   0.000309     10.0.1.2 -> 10.0.1.3     TCP 9040 > 58598 [SYN, ACK] Seq=0 Ack=1 Win=14480 Len=0 MSS=1460 TSV=1803033 TSER=1749662 WS=6
  3   0.000344     10.0.1.3 -> 10.0.1.2     TCP 58598 > 9040 [ACK] Seq=1 Ack=1 Win=5888 Len=0 TSV=1749662 TSER=1803033
52239   4.259632     10.0.1.3 -> 10.0.1.2     TCP 58598 > 9040 [FIN, ACK] Seq=9 Ack=50000001 Win=2580480 Len=0 TSV=1750727 TSER=1804049
52240   4.296561     10.0.1.2 -> 10.0.1.3     TCP 9040 > 58598 [ACK] Seq=50000001 Ack=10 Win=14528 Len=0 TSV=1804108 TSER=1750727
================================================================================
IPv4 Conversations
Filter:<No Filter>
                                               |       <-      | |       ->      | |     Total     |
                                               | Frames  Bytes | | Frames  Bytes | | Frames  Bytes |
10.0.1.3             <-> 10.0.1.2               34535  52279318   17705   1168546   52240  53447864
================================================================================
  1   0.000000     10.0.1.3 -> 10.0.1.2     TCP 58599 > 9040 [SYN] Seq=0 Win=5840 Len=0 MSS=1460 TSV=1752115 TSER=0 WS=6
  2   0.000307     10.0.1.2 -> 10.0.1.3     TCP 9040 > 58599 [SYN, ACK] Seq=0 Ack=1 Win=14480 Len=0 MSS=1460 TSV=1805486 TSER=1752115 WS=6
  3   0.000341     10.0.1.3 -> 10.0.1.2     TCP 58599 > 9040 [ACK] Seq=1 Ack=1 Win=5888 Len=0 TSV=1752115 TSER=1805486
52241   4.258724     10.0.1.3 -> 10.0.1.2     TCP 58599 > 9040 [FIN, ACK] Seq=9 Ack=50000001 Win=2580480 Len=0 TSV=1753179 TSER=1806504
52242   4.297156     10.0.1.2 -> 10.0.1.3     TCP 9040 > 58599 [ACK] Seq=50000001 Ack=10 Win=14528 Len=0 TSV=1806561 TSER=1753179
================================================================================
IPv4 Conversations
Filter:<No Filter>
                                               |       <-      | |       ->      | |     Total     |
                                               | Frames  Bytes | | Frames  Bytes | | Frames  Bytes |
10.0.1.3             <-> 10.0.1.2               34535  52279318   17707   1168678   52242  53447996
================================================================================
  1   0.000000     10.0.1.3 -> 10.0.1.2     TCP 58600 > 9040 [SYN] Seq=0 Win=5840 Len=0 MSS=1460 TSV=1754568 TSER=0 WS=6
  2   0.000298     10.0.1.2 -> 10.0.1.3     TCP 9040 > 58600 [SYN, ACK] Seq=0 Ack=1 Win=14480 Len=0 MSS=1460 TSV=1807940 TSER=1754568 WS=6
  3   0.000332     10.0.1.3 -> 10.0.1.2     TCP 58600 > 9040 [ACK] Seq=1 Ack=1 Win=5888 Len=0 TSV=1754568 TSER=1807940
52237   4.258690     10.0.1.3 -> 10.0.1.2     TCP 58600 > 9040 [FIN, ACK] Seq=9 Ack=50000001 Win=2580480 Len=0 TSV=1755633 TSER=1808958
52238   4.298540     10.0.1.2 -> 10.0.1.3     TCP 9040 > 58600 [ACK] Seq=50000001 Ack=10 Win=14528 Len=0 TSV=1809015 TSER=1755633
================================================================================
IPv4 Conversations
Filter:<No Filter>
                                               |       <-      | |       ->      | |     Total     |
                                               | Frames  Bytes | | Frames  Bytes | | Frames  Bytes |
10.0.1.3             <-> 10.0.1.2               34535  52279318   17703   1168414   52238  53447732
================================================================================
  1   0.000000     10.0.1.3 -> 10.0.1.2     TCP 58601 > 9040 [SYN] Seq=0 Win=5840 Len=0 MSS=1460 TSV=1757023 TSER=0 WS=6
  2   0.000320     10.0.1.2 -> 10.0.1.3     TCP 9040 > 58601 [SYN, ACK] Seq=0 Ack=1 Win=14480 Len=0 MSS=1460 TSV=1810395 TSER=1757023 WS=6
  3   0.000353     10.0.1.3 -> 10.0.1.2     TCP 58601 > 9040 [ACK] Seq=1 Ack=1 Win=5888 Len=0 TSV=1757023 TSER=1810395
52238   4.258736     10.0.1.3 -> 10.0.1.2     TCP 58601 > 9040 [FIN, ACK] Seq=9 Ack=50000001 Win=2580480 Len=0 TSV=1758088 TSER=1811412
52239   4.295256     10.0.1.2 -> 10.0.1.3     TCP 9040 > 58601 [ACK] Seq=50000001 Ack=10 Win=14528 Len=0 TSV=1811469 TSER=1758088
================================================================================
IPv4 Conversations
Filter:<No Filter>
                                               |       <-      | |       ->      | |     Total     |
                                               | Frames  Bytes | | Frames  Bytes | | Frames  Bytes |
10.0.1.3             <-> 10.0.1.2               34535  52279318   17704   1168480   52239  53447798
================================================================================
  1   0.000000     10.0.1.3 -> 10.0.1.2     TCP 58602 > 9040 [SYN] Seq=0 Win=5840 Len=0 MSS=1460 TSV=1759475 TSER=0 WS=6
  2   0.000285     10.0.1.2 -> 10.0.1.3     TCP 9040 > 58602 [SYN, ACK] Seq=0 Ack=1 Win=14480 Len=0 MSS=1460 TSV=1812847 TSER=1759475 WS=6
  3   0.000340     10.0.1.3 -> 10.0.1.2     TCP 58602 > 9040 [ACK] Seq=1 Ack=1 Win=5888 Len=0 TSV=1759476 TSER=1812847
52241   4.258762     10.0.1.3 -> 10.0.1.2     TCP 58602 > 9040 [FIN, ACK] Seq=9 Ack=50000001 Win=2580480 Len=0 TSV=1760540 TSER=1813864
52242   4.296325     10.0.1.2 -> 10.0.1.3     TCP 9040 > 58602 [ACK] Seq=50000001 Ack=10 Win=14528 Len=0 TSV=1813922 TSER=1760540
================================================================================
IPv4 Conversations
Filter:<No Filter>
                                               |       <-      | |       ->      | |     Total     |
                                               | Frames  Bytes | | Frames  Bytes | | Frames  Bytes |
10.0.1.3             <-> 10.0.1.2               34535  52279318   17707   1168678   52242  53447996
================================================================================
  1   0.000000     10.0.1.3 -> 10.0.1.2     TCP 58603 > 9040 [SYN] Seq=0 Win=5840 Len=0 MSS=1460 TSV=1761936 TSER=0 WS=6
  2   0.000281     10.0.1.2 -> 10.0.1.3     TCP 9040 > 58603 [SYN, ACK] Seq=0 Ack=1 Win=14480 Len=0 MSS=1460 TSV=1815308 TSER=1761936 WS=6
  3   0.000316     10.0.1.3 -> 10.0.1.2     TCP 58603 > 9040 [ACK] Seq=1 Ack=1 Win=5888 Len=0 TSV=1761936 TSER=1815308
52242   4.258836     10.0.1.3 -> 10.0.1.2     TCP 58603 > 9040 [FIN, ACK] Seq=9 Ack=50000001 Win=2580480 Len=0 TSV=1763001 TSER=1816326
52243   4.296894     10.0.1.2 -> 10.0.1.3     TCP 9040 > 58603 [ACK] Seq=50000001 Ack=10 Win=14528 Len=0 TSV=1816383 TSER=1763001
================================================================================
IPv4 Conversations
Filter:<No Filter>
                                               |       <-      | |       ->      | |     Total     |
                                               | Frames  Bytes | | Frames  Bytes | | Frames  Bytes |
10.0.1.3             <-> 10.0.1.2               34535  52279318   17708   1168744   52243  53448062
================================================================================
  1   0.000000     10.0.1.3 -> 10.0.1.2     TCP 58604 > 9040 [SYN] Seq=0 Win=5840 Len=0 MSS=1460 TSV=1764387 TSER=0 WS=6
  2   0.000318     10.0.1.2 -> 10.0.1.3     TCP 9040 > 58604 [SYN, ACK] Seq=0 Ack=1 Win=14480 Len=0 MSS=1460 TSV=1817760 TSER=1764387 WS=6
  3   0.000351     10.0.1.3 -> 10.0.1.2     TCP 58604 > 9040 [ACK] Seq=1 Ack=1 Win=5888 Len=0 TSV=1764387 TSER=1817760
52243   4.258700     10.0.1.3 -> 10.0.1.2     TCP 58604 > 9040 [FIN, ACK] Seq=9 Ack=50000001 Win=2580480 Len=0 TSV=1765452 TSER=1818777
52244   4.295225     10.0.1.2 -> 10.0.1.3     TCP 9040 > 58604 [ACK] Seq=50000001 Ack=10 Win=14528 Len=0 TSV=1818834 TSER=1765452
================================================================================
IPv4 Conversations
Filter:<No Filter>
                                               |       <-      | |       ->      | |     Total     |
                                               | Frames  Bytes | | Frames  Bytes | | Frames  Bytes |
10.0.1.3             <-> 10.0.1.2               34535  52279318   17709   1168810   52244  53448128
================================================================================
  1   0.000000     10.0.1.3 -> 10.0.1.2     TCP 58605 > 9040 [SYN] Seq=0 Win=5840 Len=0 MSS=1460 TSV=1766843 TSER=0 WS=6
  2   0.000288     10.0.1.2 -> 10.0.1.3     TCP 9040 > 58605 [SYN, ACK] Seq=0 Ack=1 Win=14480 Len=0 MSS=1460 TSV=1820216 TSER=1766843 WS=6
  3   0.000319     10.0.1.3 -> 10.0.1.2     TCP 58605 > 9040 [ACK] Seq=1 Ack=1 Win=5888 Len=0 TSV=1766843 TSER=1820216
52239   4.258792     10.0.1.3 -> 10.0.1.2     TCP 58605 > 9040 [FIN, ACK] Seq=9 Ack=50000001 Win=2580480 Len=0 TSV=1767908 TSER=1821234
52240   4.298192     10.0.1.2 -> 10.0.1.3     TCP 9040 > 58605 [ACK] Seq=50000001 Ack=10 Win=14528 Len=0 TSV=1821291 TSER=1767908
================================================================================
IPv4 Conversations
Filter:<No Filter>
                                               |       <-      | |       ->      | |     Total     |
                                               | Frames  Bytes | | Frames  Bytes | | Frames  Bytes |
10.0.1.3             <-> 10.0.1.2               34535  52279318   17705   1168546   52240  53447864
================================================================================
  1   0.000000     10.0.1.3 -> 10.0.1.2     TCP 58606 > 9040 [SYN] Seq=0 Win=5840 Len=0 MSS=1460 TSV=1769296 TSER=0 WS=6
  2   0.000320     10.0.1.2 -> 10.0.1.3     TCP 9040 > 58606 [SYN, ACK] Seq=0 Ack=1 Win=14480 Len=0 MSS=1460 TSV=1822668 TSER=1769296 WS=6
  3   0.000357     10.0.1.3 -> 10.0.1.2     TCP 58606 > 9040 [ACK] Seq=1 Ack=1 Win=5888 Len=0 TSV=1769296 TSER=1822668
52240   4.258726     10.0.1.3 -> 10.0.1.2     TCP 58606 > 9040 [FIN, ACK] Seq=9 Ack=50000001 Win=2580480 Len=0 TSV=1770360 TSER=1823686
52241   4.296285     10.0.1.2 -> 10.0.1.3     TCP 9040 > 58606 [ACK] Seq=50000001 Ack=10 Win=14528 Len=0 TSV=1823743 TSER=1770360
================================================================================
IPv4 Conversations
Filter:<No Filter>
                                               |       <-      | |       ->      | |     Total     |
                                               | Frames  Bytes | | Frames  Bytes | | Frames  Bytes |
10.0.1.3             <-> 10.0.1.2               34535  52279318   17706   1168612   52241  53447930
================================================================================
  1   0.000000     10.0.1.3 -> 10.0.1.2     TCP 58607 > 9040 [SYN] Seq=0 Win=5840 Len=0 MSS=1460 TSV=1771750 TSER=0 WS=6
  2   0.000295     10.0.1.2 -> 10.0.1.3     TCP 9040 > 58607 [SYN, ACK] Seq=0 Ack=1 Win=14480 Len=0 MSS=1460 TSV=1825123 TSER=1771750 WS=6
  3   0.000329     10.0.1.3 -> 10.0.1.2     TCP 58607 > 9040 [ACK] Seq=1 Ack=1 Win=5888 Len=0 TSV=1771750 TSER=1825123
52238   4.258710     10.0.1.3 -> 10.0.1.2     TCP 58607 > 9040 [FIN, ACK] Seq=9 Ack=50000001 Win=2580480 Len=0 TSV=1772815 TSER=1826139
52239   4.297418     10.0.1.2 -> 10.0.1.3     TCP 9040 > 58607 [ACK] Seq=50000001 Ack=10 Win=14528 Len=0 TSV=1826198 TSER=1772815
================================================================================
IPv4 Conversations
Filter:<No Filter>
                                               |       <-      | |       ->      | |     Total     |
                                               | Frames  Bytes | | Frames  Bytes | | Frames  Bytes |
10.0.1.3             <-> 10.0.1.2               34535  52279318   17704   1168480   52239  53447798
================================================================================
  1   0.000000     10.0.1.3 -> 10.0.1.2     TCP 58608 > 9040 [SYN] Seq=0 Win=5840 Len=0 MSS=1460 TSV=1774199 TSER=0 WS=6
  2   0.000312     10.0.1.2 -> 10.0.1.3     TCP 9040 > 58608 [SYN, ACK] Seq=0 Ack=1 Win=14480 Len=0 MSS=1460 TSV=1827572 TSER=1774199 WS=6
  3   0.000349     10.0.1.3 -> 10.0.1.2     TCP 58608 > 9040 [ACK] Seq=1 Ack=1 Win=5888 Len=0 TSV=1774199 TSER=1827572
52231   4.258718     10.0.1.3 -> 10.0.1.2     TCP 58608 > 9040 [FIN, ACK] Seq=9 Ack=50000001 Win=2580480 Len=0 TSV=1775264 TSER=1828586
52232   4.297545     10.0.1.2 -> 10.0.1.3     TCP 9040 > 58608 [ACK] Seq=50000001 Ack=10 Win=14528 Len=0 TSV=1828647 TSER=1775264
================================================================================
IPv4 Conversations
Filter:<No Filter>
                                               |       <-      | |       ->      | |     Total     |
                                               | Frames  Bytes | | Frames  Bytes | | Frames  Bytes |
10.0.1.3             <-> 10.0.1.2               34535  52279318   17697   1168018   52232  53447336
================================================================================
  1   0.000000     10.0.1.3 -> 10.0.1.2     TCP 58609 > 9040 [SYN] Seq=0 Win=5840 Len=0 MSS=1460 TSV=1776649 TSER=0 WS=6
  2   0.000306     10.0.1.2 -> 10.0.1.3     TCP 9040 > 58609 [SYN, ACK] Seq=0 Ack=1 Win=14480 Len=0 MSS=1460 TSV=1830023 TSER=1776649 WS=6
  3   0.000343     10.0.1.3 -> 10.0.1.2     TCP 58609 > 9040 [ACK] Seq=1 Ack=1 Win=5888 Len=0 TSV=1776650 TSER=1830023
52236   4.258788     10.0.1.3 -> 10.0.1.2     TCP 58609 > 9040 [FIN, ACK] Seq=9 Ack=50000001 Win=2563008 Len=0 TSV=1777714 TSER=1831040
52237   4.299164     10.0.1.2 -> 10.0.1.3     TCP 9040 > 58609 [ACK] Seq=50000001 Ack=10 Win=14528 Len=0 TSV=1831098 TSER=1777714
================================================================================
IPv4 Conversations
Filter:<No Filter>
                                               |       <-      | |       ->      | |     Total     |
                                               | Frames  Bytes | | Frames  Bytes | | Frames  Bytes |
10.0.1.3             <-> 10.0.1.2               34535  52279318   17702   1168348   52237  53447666
================================================================================
