  1   0.000000     10.0.1.3 -> 10.0.1.2     TCP 33370 > 9040 [SYN] Seq=0 Win=5840 Len=0 MSS=1460 TSV=3175050 TSER=0 WS=6
  2   0.000278     10.0.1.2 -> 10.0.1.3     TCP 9040 > 33370 [SYN, ACK] Seq=0 Ack=1 Win=14480 Len=0 MSS=1460 TSV=3228529 TSER=3175050 WS=6
  3   0.000311     10.0.1.3 -> 10.0.1.2     TCP 33370 > 9040 [ACK] Seq=1 Ack=1 Win=5888 Len=0 TSV=3175050 TSER=3228529
518309  42.570705     10.0.1.3 -> 10.0.1.2     TCP 33370 > 9040 [FIN, ACK] Seq=9 Ack=500000001 Win=2580480 Len=0 TSV=3185692 TSER=3239118
518310  42.608728     10.0.1.2 -> 10.0.1.3     TCP 9040 > 33370 [ACK] Seq=500000001 Ack=10 Win=14528 Len=0 TSV=3239182 TSER=3185692
================================================================================
IPv4 Conversations
Filter:<No Filter>
                                               |       <-      | |       ->      | |     Total     |
                                               | Frames  Bytes | | Frames  Bytes | | Frames  Bytes |
10.0.1.3             <-> 10.0.1.2              345308 522790336  173002  11418148  518310 534208484
================================================================================
  1   0.000000     10.0.1.3 -> 10.0.1.2     TCP 33371 > 9040 [SYN] Seq=0 Win=5840 Len=0 MSS=1460 TSV=3190041 TSER=0 WS=6
  2   0.000289     10.0.1.2 -> 10.0.1.3     TCP 9040 > 33371 [SYN, ACK] Seq=0 Ack=1 Win=14480 Len=0 MSS=1460 TSV=3243521 TSER=3190041 WS=6
  3   0.000326     10.0.1.3 -> 10.0.1.2     TCP 33371 > 9040 [ACK] Seq=1 Ack=1 Win=5888 Len=0 TSV=3190041 TSER=3243521
518322  42.570625     10.0.1.3 -> 10.0.1.2     TCP 33371 > 9040 [FIN, ACK] Seq=9 Ack=500000001 Win=2580480 Len=0 TSV=3200684 TSER=3254111
518323  42.610472     10.0.1.2 -> 10.0.1.3     TCP 9040 > 33371 [ACK] Seq=500000001 Ack=10 Win=14528 Len=0 TSV=3254175 TSER=3200684
================================================================================
IPv4 Conversations
Filter:<No Filter>
                                               |       <-      | |       ->      | |     Total     |
                                               | Frames  Bytes | | Frames  Bytes | | Frames  Bytes |
10.0.1.3             <-> 10.0.1.2              345308 522790336  173015  11419006  518323 534209342
================================================================================
  1   0.000000     10.0.1.3 -> 10.0.1.2     TCP 33372 > 9040 [SYN] Seq=0 Win=5840 Len=0 MSS=1460 TSV=3205042 TSER=0 WS=6
  2   0.000327     10.0.1.2 -> 10.0.1.3     TCP 9040 > 33372 [SYN, ACK] Seq=0 Ack=1 Win=14480 Len=0 MSS=1460 TSV=3258524 TSER=3205042 WS=6
  3   0.000360     10.0.1.3 -> 10.0.1.2     TCP 33372 > 9040 [ACK] Seq=1 Ack=1 Win=5888 Len=0 TSV=3205042 TSER=3258524
518366  42.570709     10.0.1.3 -> 10.0.1.2     TCP 33372 > 9040 [FIN, ACK] Seq=9 Ack=500000001 Win=2580480 Len=0 TSV=3215685 TSER=3269113
518367  42.608788     10.0.1.2 -> 10.0.1.3     TCP 9040 > 33372 [ACK] Seq=500000001 Ack=10 Win=14528 Len=0 TSV=3269177 TSER=3215685
================================================================================
IPv4 Conversations
Filter:<No Filter>
                                               |       <-      | |       ->      | |     Total     |
                                               | Frames  Bytes | | Frames  Bytes | | Frames  Bytes |
10.0.1.3             <-> 10.0.1.2              345308 522790336  173059  11421910  518367 534212246
================================================================================
  1   0.000000     10.0.1.3 -> 10.0.1.2     TCP 33373 > 9040 [SYN] Seq=0 Win=5840 Len=0 MSS=1460 TSV=3220045 TSER=0 WS=6
  2   0.000313     10.0.1.2 -> 10.0.1.3     TCP 9040 > 33373 [SYN, ACK] Seq=0 Ack=1 Win=14480 Len=0 MSS=1460 TSV=3273528 TSER=3220045 WS=6
  3   0.000339     10.0.1.3 -> 10.0.1.2     TCP 33373 > 9040 [ACK] Seq=1 Ack=1 Win=5888 Len=0 TSV=3220045 TSER=3273528
518318  42.570802     10.0.1.3 -> 10.0.1.2     TCP 33373 > 9040 [FIN, ACK] Seq=9 Ack=500000001 Win=2580480 Len=0 TSV=3230688 TSER=3284117
518319  42.608119     10.0.1.2 -> 10.0.1.3     TCP 9040 > 33373 [ACK] Seq=500000001 Ack=10 Win=14528 Len=0 TSV=3284181 TSER=3230688
================================================================================
IPv4 Conversations
Filter:<No Filter>
                                               |       <-      | |       ->      | |     Total     |
                                               | Frames  Bytes | | Frames  Bytes | | Frames  Bytes |
10.0.1.3             <-> 10.0.1.2              345308 522790336  173011  11418742  518319 534209078
================================================================================
  1   0.000000     10.0.1.3 -> 10.0.1.2     TCP 46985 > 9040 [SYN] Seq=0 Win=5840 Len=0 MSS=1460 TSV=3235106 TSER=0 WS=6
  2   0.000329     10.0.1.2 -> 10.0.1.3     TCP 9040 > 46985 [SYN, ACK] Seq=0 Ack=1 Win=14480 Len=0 MSS=1460 TSV=3288590 TSER=3235106 WS=6
  3   0.000366     10.0.1.3 -> 10.0.1.2     TCP 46985 > 9040 [ACK] Seq=1 Ack=1 Win=5888 Len=0 TSV=3235106 TSER=3288590
518313  42.570696     10.0.1.3 -> 10.0.1.2     TCP 46985 > 9040 [FIN, ACK] Seq=9 Ack=500000001 Win=2580480 Len=0 TSV=3245749 TSER=3299179
518314  42.608239     10.0.1.2 -> 10.0.1.3     TCP 9040 > 46985 [ACK] Seq=500000001 Ack=10 Win=14528 Len=0 TSV=3299243 TSER=3245749
================================================================================
IPv4 Conversations
Filter:<No Filter>
                                               |       <-      | |       ->      | |     Total     |
                                               | Frames  Bytes | | Frames  Bytes | | Frames  Bytes |
10.0.1.3             <-> 10.0.1.2              345308 522790336  173006  11418412  518314 534208748
================================================================================
  1   0.000000     10.0.1.3 -> 10.0.1.2     TCP 46986 > 9040 [SYN] Seq=0 Win=5840 Len=0 MSS=1460 TSV=3250091 TSER=0 WS=6
  2   0.000327     10.0.1.2 -> 10.0.1.3     TCP 9040 > 46986 [SYN, ACK] Seq=0 Ack=1 Win=14480 Len=0 MSS=1460 TSV=3303576 TSER=3250091 WS=6
  3   0.000365     10.0.1.3 -> 10.0.1.2     TCP 46986 > 9040 [ACK] Seq=1 Ack=1 Win=5888 Len=0 TSV=3250091 TSER=3303576
518313  42.570739     10.0.1.3 -> 10.0.1.2     TCP 46986 > 9040 [FIN, ACK] Seq=9 Ack=500000001 Win=2580480 Len=0 TSV=3260734 TSER=3314165
518314  42.607874     10.0.1.2 -> 10.0.1.3     TCP 9040 > 46986 [ACK] Seq=500000001 Ack=10 Win=14528 Len=0 TSV=3314229 TSER=3260734
================================================================================
IPv4 Conversations
Filter:<No Filter>
                                               |       <-      | |       ->      | |     Total     |
                                               | Frames  Bytes | | Frames  Bytes | | Frames  Bytes |
10.0.1.3             <-> 10.0.1.2              345308 522790336  173006  11418412  518314 534208748
================================================================================
  1   0.000000     10.0.1.3 -> 10.0.1.2     TCP 46987 > 9040 [SYN] Seq=0 Win=5840 Len=0 MSS=1460 TSV=3265111 TSER=0 WS=6
  2   0.000310     10.0.1.2 -> 10.0.1.3     TCP 9040 > 46987 [SYN, ACK] Seq=0 Ack=1 Win=14480 Len=0 MSS=1460 TSV=3318597 TSER=3265111 WS=6
  3   0.000343     10.0.1.3 -> 10.0.1.2     TCP 46987 > 9040 [ACK] Seq=1 Ack=1 Win=5888 Len=0 TSV=3265111 TSER=3318597
518355  42.570667     10.0.1.3 -> 10.0.1.2     TCP 46987 > 9040 [FIN, ACK] Seq=9 Ack=500000001 Win=2580480 Len=0 TSV=3275754 TSER=3329186
518356  42.608444     10.0.1.2 -> 10.0.1.3     TCP 9040 > 46987 [ACK] Seq=500000001 Ack=10 Win=14528 Len=0 TSV=3329250 TSER=3275754
================================================================================
IPv4 Conversations
Filter:<No Filter>
                                               |       <-      | |       ->      | |     Total     |
                                               | Frames  Bytes | | Frames  Bytes | | Frames  Bytes |
10.0.1.3             <-> 10.0.1.2              345308 522790336  173048  11421184  518356 534211520
================================================================================
  1   0.000000     10.0.1.3 -> 10.0.1.2     TCP 46988 > 9040 [SYN] Seq=0 Win=5840 Len=0 MSS=1460 TSV=3280115 TSER=0 WS=6
  2   0.000325     10.0.1.2 -> 10.0.1.3     TCP 9040 > 46988 [SYN, ACK] Seq=0 Ack=1 Win=14480 Len=0 MSS=1460 TSV=3333602 TSER=3280115 WS=6
  3   0.000360     10.0.1.3 -> 10.0.1.2     TCP 46988 > 9040 [ACK] Seq=1 Ack=1 Win=5888 Len=0 TSV=3280115 TSER=3333602
518363  42.570669     10.0.1.3 -> 10.0.1.2     TCP 46988 > 9040 [FIN, ACK] Seq=9 Ack=500000001 Win=2580480 Len=0 TSV=3290758 TSER=3344191
518364  42.607748     10.0.1.2 -> 10.0.1.3     TCP 9040 > 46988 [ACK] Seq=500000001 Ack=10 Win=14528 Len=0 TSV=3344255 TSER=3290758
================================================================================
IPv4 Conversations
Filter:<No Filter>
                                               |       <-      | |       ->      | |     Total     |
                                               | Frames  Bytes | | Frames  Bytes | | Frames  Bytes |
10.0.1.3             <-> 10.0.1.2              345308 522790336  173056  11421712  518364 534212048
================================================================================
  1   0.000000     10.0.1.3 -> 10.0.1.2     TCP 46989 > 9040 [SYN] Seq=0 Win=5840 Len=0 MSS=1460 TSV=3295103 TSER=0 WS=6
  2   0.000299     10.0.1.2 -> 10.0.1.3     TCP 9040 > 46989 [SYN, ACK] Seq=0 Ack=1 Win=14480 Len=0 MSS=1460 TSV=3348591 TSER=3295103 WS=6
  3   0.000335     10.0.1.3 -> 10.0.1.2     TCP 46989 > 9040 [ACK] Seq=1 Ack=1 Win=5888 Len=0 TSV=3295103 TSER=3348591
518337  42.570675     10.0.1.3 -> 10.0.1.2     TCP 46989 > 9040 [FIN, ACK] Seq=9 Ack=500000001 Win=2580480 Len=0 TSV=3305745 TSER=3359180
518338  42.607979     10.0.1.2 -> 10.0.1.3     TCP 9040 > 46989 [ACK] Seq=500000001 Ack=10 Win=14528 Len=0 TSV=3359244 TSER=3305745
================================================================================
IPv4 Conversations
Filter:<No Filter>
                                               |       <-      | |       ->      | |     Total     |
                                               | Frames  Bytes | | Frames  Bytes | | Frames  Bytes |
10.0.1.3             <-> 10.0.1.2              345308 522790336  173030  11419996  518338 534210332
================================================================================
  1   0.000000     10.0.1.3 -> 10.0.1.2     TCP 46384 > 9040 [SYN] Seq=0 Win=5840 Len=0 MSS=1460 TSV=3310107 TSER=0 WS=6
  2   0.000278     10.0.1.2 -> 10.0.1.3     TCP 9040 > 46384 [SYN, ACK] Seq=0 Ack=1 Win=14480 Len=0 MSS=1460 TSV=3363596 TSER=3310107 WS=6
  3   0.000314     10.0.1.3 -> 10.0.1.2     TCP 46384 > 9040 [ACK] Seq=1 Ack=1 Win=5888 Len=0 TSV=3310107 TSER=3363596
518368  42.576217     10.0.1.3 -> 10.0.1.2     TCP 46384 > 9040 [FIN, ACK] Seq=9 Ack=500000001 Win=2580480 Len=0 TSV=3320751 TSER=3374187
518369  42.613522     10.0.1.2 -> 10.0.1.3     TCP 9040 > 46384 [ACK] Seq=500000001 Ack=10 Win=14528 Len=0 TSV=3374251 TSER=3320751
================================================================================
IPv4 Conversations
Filter:<No Filter>
                                               |       <-      | |       ->      | |     Total     |
                                               | Frames  Bytes | | Frames  Bytes | | Frames  Bytes |
10.0.1.3             <-> 10.0.1.2              345308 522790336  173061  11422042  518369 534212378
================================================================================
  1   0.000000     10.0.1.3 -> 10.0.1.2     TCP 46385 > 9040 [SYN] Seq=0 Win=5840 Len=0 MSS=1460 TSV=3325086 TSER=0 WS=6
  2   0.000380     10.0.1.2 -> 10.0.1.3     TCP 9040 > 46385 [SYN, ACK] Seq=0 Ack=1 Win=14480 Len=0 MSS=1460 TSV=3378576 TSER=3325086 WS=6
  3   0.000412     10.0.1.3 -> 10.0.1.2     TCP 46385 > 9040 [ACK] Seq=1 Ack=1 Win=5888 Len=0 TSV=3325086 TSER=3378576
518368  42.570746     10.0.1.3 -> 10.0.1.2     TCP 46385 > 9040 [FIN, ACK] Seq=9 Ack=500000001 Win=2580480 Len=0 TSV=3335728 TSER=3389166
518369  42.610540     10.0.1.2 -> 10.0.1.3     TCP 9040 > 46385 [ACK] Seq=500000001 Ack=10 Win=14528 Len=0 TSV=3389230 TSER=3335728
================================================================================
IPv4 Conversations
Filter:<No Filter>
                                               |       <-      | |       ->      | |     Total     |
                                               | Frames  Bytes | | Frames  Bytes | | Frames  Bytes |
10.0.1.3             <-> 10.0.1.2              345308 522790336  173061  11422042  518369 534212378
================================================================================
  1   0.000000     10.0.1.3 -> 10.0.1.2     TCP 46386 > 9040 [SYN] Seq=0 Win=5840 Len=0 MSS=1460 TSV=3340034 TSER=0 WS=6
  2   0.000276     10.0.1.2 -> 10.0.1.3     TCP 9040 > 46386 [SYN, ACK] Seq=0 Ack=1 Win=14480 Len=0 MSS=1460 TSV=3393526 TSER=3340034 WS=6
  3   0.000309     10.0.1.3 -> 10.0.1.2     TCP 46386 > 9040 [ACK] Seq=1 Ack=1 Win=5888 Len=0 TSV=3340034 TSER=3393526
518359  42.570604     10.0.1.3 -> 10.0.1.2     TCP 46386 > 9040 [FIN, ACK] Seq=9 Ack=500000001 Win=2580480 Len=0 TSV=3350677 TSER=3404114
518360  42.608921     10.0.1.2 -> 10.0.1.3     TCP 9040 > 46386 [ACK] Seq=500000001 Ack=10 Win=14528 Len=0 TSV=3404179 TSER=3350677
================================================================================
IPv4 Conversations
Filter:<No Filter>
                                               |       <-      | |       ->      | |     Total     |
                                               | Frames  Bytes | | Frames  Bytes | | Frames  Bytes |
10.0.1.3             <-> 10.0.1.2              345308 522790336  173052  11421448  518360 534211784
================================================================================
  1   0.000000     10.0.1.3 -> 10.0.1.2     TCP 46387 > 9040 [SYN] Seq=0 Win=5840 Len=0 MSS=1460 TSV=3355046 TSER=0 WS=6
  2   0.000285     10.0.1.2 -> 10.0.1.3     TCP 9040 > 46387 [SYN, ACK] Seq=0 Ack=1 Win=14480 Len=0 MSS=1460 TSV=3408539 TSER=3355046 WS=6
  3   0.000318     10.0.1.3 -> 10.0.1.2     TCP 46387 > 9040 [ACK] Seq=1 Ack=1 Win=5888 Len=0 TSV=3355046 TSER=3408539
518357  42.570673     10.0.1.3 -> 10.0.1.2     TCP 46387 > 9040 [FIN, ACK] Seq=9 Ack=500000001 Win=2580480 Len=0 TSV=3365689 TSER=3419128
518358  42.607265     10.0.1.2 -> 10.0.1.3     TCP 9040 > 46387 [ACK] Seq=500000001 Ack=10 Win=14528 Len=0 TSV=3419192 TSER=3365689
================================================================================
IPv4 Conversations
Filter:<No Filter>
                                               |       <-      | |       ->      | |     Total     |
                                               | Frames  Bytes | | Frames  Bytes | | Frames  Bytes |
10.0.1.3             <-> 10.0.1.2              345308 522790336  173050  11421316  518358 534211652
================================================================================
  1   0.000000     10.0.1.3 -> 10.0.1.2     TCP 46388 > 9040 [SYN] Seq=0 Win=5840 Len=0 MSS=1460 TSV=3370065 TSER=0 WS=6
  2   0.000322     10.0.1.2 -> 10.0.1.3     TCP 9040 > 46388 [SYN, ACK] Seq=0 Ack=1 Win=14480 Len=0 MSS=1460 TSV=3423559 TSER=3370065 WS=6
  3   0.000355     10.0.1.3 -> 10.0.1.2     TCP 46388 > 9040 [ACK] Seq=1 Ack=1 Win=5888 Len=0 TSV=3370065 TSER=3423559
518359  42.570684     10.0.1.3 -> 10.0.1.2     TCP 46388 > 9040 [FIN, ACK] Seq=9 Ack=500000001 Win=2580480 Len=0 TSV=3380708 TSER=3434148
518360  42.608752     10.0.1.2 -> 10.0.1.3     TCP 9040 > 46388 [ACK] Seq=500000001 Ack=10 Win=14528 Len=0 TSV=3434212 TSER=3380708
================================================================================
IPv4 Conversations
Filter:<No Filter>
                                               |       <-      | |       ->      | |     Total     |
                                               | Frames  Bytes | | Frames  Bytes | | Frames  Bytes |
10.0.1.3             <-> 10.0.1.2              345308 522790336  173052  11421448  518360 534211784
================================================================================
  1   0.000000     10.0.1.3 -> 10.0.1.2     TCP 42604 > 9040 [SYN] Seq=0 Win=5840 Len=0 MSS=1460 TSV=3385071 TSER=0 WS=6
  2   0.000303     10.0.1.2 -> 10.0.1.3     TCP 9040 > 42604 [SYN, ACK] Seq=0 Ack=1 Win=14480 Len=0 MSS=1460 TSV=3438566 TSER=3385071 WS=6
  3   0.000337     10.0.1.3 -> 10.0.1.2     TCP 42604 > 9040 [ACK] Seq=1 Ack=1 Win=5888 Len=0 TSV=3385072 TSER=3438566
518340  42.570664     10.0.1.3 -> 10.0.1.2     TCP 42604 > 9040 [FIN, ACK] Seq=9 Ack=500000001 Win=2580480 Len=0 TSV=3395714 TSER=3449156
518341  42.609643     10.0.1.2 -> 10.0.1.3     TCP 9040 > 42604 [ACK] Seq=500000001 Ack=10 Win=14528 Len=0 TSV=3449220 TSER=3395714
================================================================================
IPv4 Conversations
Filter:<No Filter>
                                               |       <-      | |       ->      | |     Total     |
                                               | Frames  Bytes | | Frames  Bytes | | Frames  Bytes |
10.0.1.3             <-> 10.0.1.2              345308 522790336  173033  11420194  518341 534210530
================================================================================
  1   0.000000     10.0.1.3 -> 10.0.1.2     TCP 42605 > 9040 [SYN] Seq=0 Win=5840 Len=0 MSS=1460 TSV=3400051 TSER=0 WS=6
  2   0.000297     10.0.1.2 -> 10.0.1.3     TCP 9040 > 42605 [SYN, ACK] Seq=0 Ack=1 Win=14480 Len=0 MSS=1460 TSV=3453547 TSER=3400051 WS=6
  3   0.000327     10.0.1.3 -> 10.0.1.2     TCP 42605 > 9040 [ACK] Seq=1 Ack=1 Win=5888 Len=0 TSV=3400051 TSER=3453547
518353  42.570767     10.0.1.3 -> 10.0.1.2     TCP 42605 > 9040 [FIN, ACK] Seq=9 Ack=500000001 Win=2580480 Len=0 TSV=3410694 TSER=3464136
518354  42.609272     10.0.1.2 -> 10.0.1.3     TCP 9040 > 42605 [ACK] Seq=500000001 Ack=10 Win=14528 Len=0 TSV=3464201 TSER=3410694
================================================================================
IPv4 Conversations
Filter:<No Filter>
                                               |       <-      | |       ->      | |     Total     |
                                               | Frames  Bytes | | Frames  Bytes | | Frames  Bytes |
10.0.1.3             <-> 10.0.1.2              345308 522790336  173046  11421052  518354 534211388
================================================================================
  1   0.000000     10.0.1.3 -> 10.0.1.2     TCP 42606 > 9040 [SYN] Seq=0 Win=5840 Len=0 MSS=1460 TSV=3415024 TSER=0 WS=6
  2   0.000328     10.0.1.2 -> 10.0.1.3     TCP 9040 > 42606 [SYN, ACK] Seq=0 Ack=1 Win=14480 Len=0 MSS=1460 TSV=3468521 TSER=3415024 WS=6
  3   0.000365     10.0.1.3 -> 10.0.1.2     TCP 42606 > 9040 [ACK] Seq=1 Ack=1 Win=5888 Len=0 TSV=3415024 TSER=3468521
518341  42.570705     10.0.1.3 -> 10.0.1.2     TCP 42606 > 9040 [FIN, ACK] Seq=9 Ack=500000001 Win=2580480 Len=0 TSV=3425666 TSER=3479109
518342  42.608239     10.0.1.2 -> 10.0.1.3     TCP 9040 > 42606 [ACK] Seq=500000001 Ack=10 Win=14528 Len=0 TSV=3479174 TSER=3425666
================================================================================
IPv4 Conversations
Filter:<No Filter>
                                               |       <-      | |       ->      | |     Total     |
                                               | Frames  Bytes | | Frames  Bytes | | Frames  Bytes |
10.0.1.3             <-> 10.0.1.2              345308 522790336  173034  11420260  518342 534210596
================================================================================
  1   0.000000     10.0.1.3 -> 10.0.1.2     TCP 42607 > 9040 [SYN] Seq=0 Win=5840 Len=0 MSS=1460 TSV=3430028 TSER=0 WS=6
  2   0.000305     10.0.1.2 -> 10.0.1.3     TCP 9040 > 42607 [SYN, ACK] Seq=0 Ack=1 Win=14480 Len=0 MSS=1460 TSV=3483526 TSER=3430028 WS=6
  3   0.000338     10.0.1.3 -> 10.0.1.2     TCP 42607 > 9040 [ACK] Seq=1 Ack=1 Win=5888 Len=0 TSV=3430028 TSER=3483526
518300  42.570755     10.0.1.3 -> 10.0.1.2     TCP 42607 > 9040 [FIN, ACK] Seq=9 Ack=500000001 Win=2580480 Len=0 TSV=3440671 TSER=3494115
518301  42.609230     10.0.1.2 -> 10.0.1.3     TCP 9040 > 42607 [ACK] Seq=500000001 Ack=10 Win=14528 Len=0 TSV=3494180 TSER=3440671
================================================================================
IPv4 Conversations
Filter:<No Filter>
                                               |       <-      | |       ->      | |     Total     |
                                               | Frames  Bytes | | Frames  Bytes | | Frames  Bytes |
10.0.1.3             <-> 10.0.1.2              345308 522790336  172993  11417554  518301 534207890
================================================================================
  1   0.000000     10.0.1.3 -> 10.0.1.2     TCP 42608 > 9040 [SYN] Seq=0 Win=5840 Len=0 MSS=1460 TSV=3445003 TSER=0 WS=6
  2   0.000283     10.0.1.2 -> 10.0.1.3     TCP 9040 > 42608 [SYN, ACK] Seq=0 Ack=1 Win=14480 Len=0 MSS=1460 TSV=3498503 TSER=3445003 WS=6
  3   0.000318     10.0.1.3 -> 10.0.1.2     TCP 42608 > 9040 [ACK] Seq=1 Ack=1 Win=5888 Len=0 TSV=3445003 TSER=3498503
518350  42.570685     10.0.1.3 -> 10.0.1.2     TCP 42608 > 9040 [FIN, ACK] Seq=9 Ack=500000001 Win=2580480 Len=0 TSV=3455646 TSER=3509093
518351  42.608339     10.0.1.2 -> 10.0.1.3     TCP 9040 > 42608 [ACK] Seq=500000001 Ack=10 Win=14528 Len=0 TSV=3509156 TSER=3455646
================================================================================
IPv4 Conversations
Filter:<No Filter>
                                               |       <-      | |       ->      | |     Total     |
                                               | Frames  Bytes | | Frames  Bytes | | Frames  Bytes |
10.0.1.3             <-> 10.0.1.2              345308 522790336  173043  11420854  518351 534211190
================================================================================
  1   0.000000     10.0.1.3 -> 10.0.1.2     TCP 59290 > 9040 [SYN] Seq=0 Win=5840 Len=0 MSS=1460 TSV=3459984 TSER=0 WS=6
  2   0.000327     10.0.1.2 -> 10.0.1.3     TCP 9040 > 59290 [SYN, ACK] Seq=0 Ack=1 Win=14480 Len=0 MSS=1460 TSV=3513484 TSER=3459984 WS=6
  3   0.000376     10.0.1.3 -> 10.0.1.2     TCP 59290 > 9040 [ACK] Seq=1 Ack=1 Win=5888 Len=0 TSV=3459984 TSER=3513484
518354  42.570766     10.0.1.3 -> 10.0.1.2     TCP 59290 > 9040 [FIN, ACK] Seq=9 Ack=500000001 Win=2580480 Len=0 TSV=3470626 TSER=3524074
518355  42.610128     10.0.1.2 -> 10.0.1.3     TCP 9040 > 59290 [ACK] Seq=500000001 Ack=10 Win=14528 Len=0 TSV=3524138 TSER=3470626
================================================================================
IPv4 Conversations
Filter:<No Filter>
                                               |       <-      | |       ->      | |     Total     |
                                               | Frames  Bytes | | Frames  Bytes | | Frames  Bytes |
10.0.1.3             <-> 10.0.1.2              345308 522790336  173047  11421118  518355 534211454
================================================================================
