  1   0.000000     10.0.1.2 -> 10.0.1.3     TCP 74 50845 > glrpc [SYN] Seq=0 Win=14600 Len=0 MSS=1460 SACK_PERM=1 TSval=8413573 TSecr=0 WS=64
  2   0.000324     10.0.1.3 -> 10.0.1.2     TCP 74 glrpc > 50845 [SYN, ACK] Seq=0 Ack=1 Win=5792 Len=0 MSS=1460 SACK_PERM=1 TSval=33905637 TSecr=8413573 WS=64
  3   0.000339     10.0.1.2 -> 10.0.1.3     TCP 66 50845 > glrpc [ACK] Seq=1 Ack=1 Win=14656 Len=0 TSval=8413573 TSecr=33905637
470320  42.550905     10.0.1.2 -> 10.0.1.3     TCP 66 50845 > glrpc [FIN, ACK] Seq=9 Ack=500000001 Win=3011840 Len=0 TSval=8424211 TSecr=33916253
470321  42.589681     10.0.1.3 -> 10.0.1.2     TCP 66 glrpc > 50845 [ACK] Seq=500000001 Ack=10 Win=5824 Len=0 TSval=33916284 TSecr=8424211
  1   0.000000     10.0.1.2 -> 10.0.1.3     TCP 74 50854 > glrpc [SYN] Seq=0 Win=14600 Len=0 MSS=1460 SACK_PERM=1 TSval=8482901 TSecr=0 WS=64
  2   0.000345     10.0.1.3 -> 10.0.1.2     TCP 74 glrpc > 50854 [SYN, ACK] Seq=0 Ack=1 Win=5792 Len=0 MSS=1460 SACK_PERM=1 TSval=33974960 TSecr=8482901 WS=64
  3   0.000360     10.0.1.2 -> 10.0.1.3     TCP 66 50854 > glrpc [ACK] Seq=1 Ack=1 Win=14656 Len=0 TSval=8482901 TSecr=33974960
518003  42.540929     10.0.1.2 -> 10.0.1.3     TCP 66 50854 > glrpc [FIN, ACK] Seq=9 Ack=500000001 Win=3011840 Len=0 TSval=8493536 TSecr=33985531
518004  42.579515     10.0.1.3 -> 10.0.1.2     TCP 66 glrpc > 50854 [ACK] Seq=500000001 Ack=10 Win=5824 Len=0 TSval=33985604 TSecr=8493536
  1   0.000000     10.0.1.2 -> 10.0.1.3     TCP 74 50864 > glrpc [SYN] Seq=0 Win=14600 Len=0 MSS=1460 SACK_PERM=1 TSval=8569854 TSecr=0 WS=64
  2   0.000331     10.0.1.3 -> 10.0.1.2     TCP 74 glrpc > 50864 [SYN, ACK] Seq=0 Ack=1 Win=5792 Len=0 MSS=1460 SACK_PERM=1 TSval=34061907 TSecr=8569854 WS=64
  3   0.000344     10.0.1.2 -> 10.0.1.3     TCP 66 50864 > glrpc [ACK] Seq=1 Ack=1 Win=14656 Len=0 TSval=8569854 TSecr=34061907
491758  42.532615     10.0.1.2 -> 10.0.1.3     TCP 66 50864 > glrpc [FIN, ACK] Seq=9 Ack=500000001 Win=3011840 Len=0 TSval=8580488 TSecr=34072476
491759  42.571483     10.0.1.3 -> 10.0.1.2     TCP 66 glrpc > 50864 [ACK] Seq=500000001 Ack=10 Win=5824 Len=0 TSval=34072549 TSecr=8580488
  1   0.000000     10.0.1.2 -> 10.0.1.3     TCP 74 50874 > glrpc [SYN] Seq=0 Win=14600 Len=0 MSS=1460 SACK_PERM=1 TSval=8646906 TSecr=0 WS=64
  2   0.000427     10.0.1.3 -> 10.0.1.2     TCP 74 glrpc > 50874 [SYN, ACK] Seq=0 Ack=1 Win=5792 Len=0 MSS=1460 SACK_PERM=1 TSval=34138953 TSecr=8646906 WS=64
  3   0.000447     10.0.1.2 -> 10.0.1.3     TCP 66 50874 > glrpc [ACK] Seq=1 Ack=1 Win=14656 Len=0 TSval=8646907 TSecr=34138953
488952  42.578647     10.0.1.2 -> 10.0.1.3     TCP 66 50874 > glrpc [FIN, ACK] Seq=9 Ack=500000001 Win=2997376 Len=0 TSval=8657551 TSecr=34149576
488953  42.617540     10.0.1.3 -> 10.0.1.2     TCP 66 glrpc > 50874 [ACK] Seq=500000001 Ack=10 Win=5824 Len=0 TSval=34149607 TSecr=8657551
  1   0.000000     10.0.1.2 -> 10.0.1.3     TCP 74 50882 > glrpc [SYN] Seq=0 Win=14600 Len=0 MSS=1460 SACK_PERM=1 TSval=8723151 TSecr=0 WS=64
  2   0.000305     10.0.1.3 -> 10.0.1.2     TCP 74 glrpc > 50882 [SYN, ACK] Seq=0 Ack=1 Win=5792 Len=0 MSS=1460 SACK_PERM=1 TSval=34215192 TSecr=8723151 WS=64
  3   0.000326     10.0.1.2 -> 10.0.1.3     TCP 66 50882 > glrpc [ACK] Seq=1 Ack=1 Win=14656 Len=0 TSval=8723151 TSecr=34215192
490766  42.581759     10.0.1.2 -> 10.0.1.3     TCP 66 50882 > glrpc [FIN, ACK] Seq=9 Ack=500000001 Win=3008960 Len=0 TSval=8733796 TSecr=34225773
490767  42.618309     10.0.1.3 -> 10.0.1.2     TCP 66 glrpc > 50882 [ACK] Seq=500000001 Ack=10 Win=5824 Len=0 TSval=34225846 TSecr=8733796
  1   0.000000     10.0.1.2 -> 10.0.1.3     TCP 74 50892 > glrpc [SYN] Seq=0 Win=14600 Len=0 MSS=1460 SACK_PERM=1 TSval=8800085 TSecr=0 WS=64
  2   0.000349     10.0.1.3 -> 10.0.1.2     TCP 74 glrpc > 50892 [SYN, ACK] Seq=0 Ack=1 Win=5792 Len=0 MSS=1460 SACK_PERM=1 TSval=34292120 TSecr=8800085 WS=64
  3   0.000368     10.0.1.2 -> 10.0.1.3     TCP 66 50892 > glrpc [ACK] Seq=1 Ack=1 Win=14656 Len=0 TSval=8800085 TSecr=34292120
518282  42.539964     10.0.1.2 -> 10.0.1.3     TCP 66 50892 > glrpc [FIN, ACK] Seq=9 Ack=500000001 Win=2985792 Len=0 TSval=8810720 TSecr=34302733
518283  42.577384     10.0.1.3 -> 10.0.1.2     TCP 66 glrpc > 50892 [ACK] Seq=500000001 Ack=10 Win=5824 Len=0 TSval=34302764 TSecr=8810720
  1   0.000000     10.0.1.2 -> 10.0.1.3     TCP 74 50901 > glrpc [SYN] Seq=0 Win=14600 Len=0 MSS=1460 SACK_PERM=1 TSval=8887308 TSecr=0 WS=64
  2   0.000298     10.0.1.3 -> 10.0.1.2     TCP 74 glrpc > 50901 [SYN, ACK] Seq=0 Ack=1 Win=5792 Len=0 MSS=1460 SACK_PERM=1 TSval=34379337 TSecr=8887308 WS=64
  3   0.000318     10.0.1.2 -> 10.0.1.3     TCP 66 50901 > glrpc [ACK] Seq=1 Ack=1 Win=14656 Len=0 TSval=8887308 TSecr=34379337
471619  42.524602     10.0.1.2 -> 10.0.1.3     TCP 66 50901 > glrpc [FIN, ACK] Seq=9 Ack=500000001 Win=3011840 Len=0 TSval=8897939 TSecr=34389914
471620  42.564446     10.0.1.3 -> 10.0.1.2     TCP 66 glrpc > 50901 [ACK] Seq=500000001 Ack=10 Win=5824 Len=0 TSval=34389977 TSecr=8897939
  1   0.000000     10.0.1.2 -> 10.0.1.3     TCP 74 50910 > glrpc [SYN] Seq=0 Win=14600 Len=0 MSS=1460 SACK_PERM=1 TSval=8956779 TSecr=0 WS=64
  2   0.000347     10.0.1.3 -> 10.0.1.2     TCP 74 glrpc > 50910 [SYN, ACK] Seq=0 Ack=1 Win=5792 Len=0 MSS=1460 SACK_PERM=1 TSval=34448803 TSecr=8956779 WS=64
  3   0.000361     10.0.1.2 -> 10.0.1.3     TCP 66 50910 > glrpc [ACK] Seq=1 Ack=1 Win=14656 Len=0 TSval=8956779 TSecr=34448803
498653  42.530868     10.0.1.2 -> 10.0.1.3     TCP 66 50910 > glrpc [FIN, ACK] Seq=9 Ack=500000001 Win=3011840 Len=0 TSval=8967412 TSecr=34459392
498654  42.571714     10.0.1.3 -> 10.0.1.2     TCP 66 glrpc > 50910 [ACK] Seq=500000001 Ack=10 Win=5824 Len=0 TSval=34459445 TSecr=8967412
  1   0.000000     10.0.1.2 -> 10.0.1.3     TCP 74 50919 > glrpc [SYN] Seq=0 Win=14600 Len=0 MSS=1460 SACK_PERM=1 TSval=9036440 TSecr=0 WS=64
  2   0.000332     10.0.1.3 -> 10.0.1.2     TCP 74 glrpc > 50919 [SYN, ACK] Seq=0 Ack=1 Win=5792 Len=0 MSS=1460 SACK_PERM=1 TSval=34528457 TSecr=9036440 WS=64
  3   0.000344     10.0.1.2 -> 10.0.1.3     TCP 66 50919 > glrpc [ACK] Seq=1 Ack=1 Win=14656 Len=0 TSval=9036440 TSecr=34528457
474806  42.524206     10.0.1.2 -> 10.0.1.3     TCP 66 50919 > glrpc [FIN, ACK] Seq=9 Ack=500000001 Win=3014784 Len=0 TSval=9047071 TSecr=34539026
474807  42.561836     10.0.1.3 -> 10.0.1.2     TCP 66 glrpc > 50919 [ACK] Seq=500000001 Ack=10 Win=5824 Len=0 TSval=34539097 TSecr=9047071
  1   0.000000     10.0.1.2 -> 10.0.1.3     TCP 74 50928 > glrpc [SYN] Seq=0 Win=14600 Len=0 MSS=1460 SACK_PERM=1 TSval=9107236 TSecr=0 WS=64
  2   0.000351     10.0.1.3 -> 10.0.1.2     TCP 74 glrpc > 50928 [SYN, ACK] Seq=0 Ack=1 Win=5792 Len=0 MSS=1460 SACK_PERM=1 TSval=34599248 TSecr=9107236 WS=64
  3   0.000373     10.0.1.2 -> 10.0.1.3     TCP 66 50928 > glrpc [ACK] Seq=1 Ack=1 Win=14656 Len=0 TSval=9107236 TSecr=34599248
502137  42.594298     10.0.1.2 -> 10.0.1.3     TCP 66 50928 > glrpc [FIN, ACK] Seq=9 Ack=500000001 Win=3011840 Len=0 TSval=9117884 TSecr=34609874
502138  42.634914     10.0.1.3 -> 10.0.1.2     TCP 66 glrpc > 50928 [ACK] Seq=500000001 Ack=10 Win=5824 Len=0 TSval=34609906 TSecr=9117884
  1   0.000000     10.0.1.2 -> 10.0.1.3     TCP 74 50940 > glrpc [SYN] Seq=0 Win=14600 Len=0 MSS=1460 SACK_PERM=1 TSval=9187810 TSecr=0 WS=64
  2   0.000371     10.0.1.3 -> 10.0.1.2     TCP 74 glrpc > 50940 [SYN, ACK] Seq=0 Ack=1 Win=5792 Len=0 MSS=1460 SACK_PERM=1 TSval=34679816 TSecr=9187810 WS=64
  3   0.000392     10.0.1.2 -> 10.0.1.3     TCP 66 50940 > glrpc [ACK] Seq=1 Ack=1 Win=14656 Len=0 TSval=9187810 TSecr=34679816
499244  42.549138     10.0.1.2 -> 10.0.1.3     TCP 66 50940 > glrpc [FIN, ACK] Seq=9 Ack=500000001 Win=3011840 Len=0 TSval=9198447 TSecr=34690389
499245  42.588963     10.0.1.3 -> 10.0.1.2     TCP 66 glrpc > 50940 [ACK] Seq=500000001 Ack=10 Win=5824 Len=0 TSval=34690463 TSecr=9198447
  1   0.000000     10.0.1.2 -> 10.0.1.3     TCP 74 50950 > glrpc [SYN] Seq=0 Win=14600 Len=0 MSS=1460 SACK_PERM=1 TSval=9267609 TSecr=0 WS=64
  2   0.000281     10.0.1.3 -> 10.0.1.2     TCP 74 glrpc > 50950 [SYN, ACK] Seq=0 Ack=1 Win=5792 Len=0 MSS=1460 SACK_PERM=1 TSval=34759609 TSecr=9267609 WS=64
  3   0.000297     10.0.1.2 -> 10.0.1.3     TCP 66 50950 > glrpc [ACK] Seq=1 Ack=1 Win=14656 Len=0 TSval=9267609 TSecr=34759609
  1   0.000000     10.0.1.2 -> 10.0.1.3     TCP 74 50958 > glrpc [SYN] Seq=0 Win=14600 Len=0 MSS=1460 SACK_PERM=1 TSval=9336006 TSecr=0 WS=64
  2   0.000281     10.0.1.3 -> 10.0.1.2     TCP 74 glrpc > 50958 [SYN, ACK] Seq=0 Ack=1 Win=5792 Len=0 MSS=1460 SACK_PERM=1 TSval=34828001 TSecr=9336006 WS=64
  3   0.000296     10.0.1.2 -> 10.0.1.3     TCP 66 50958 > glrpc [ACK] Seq=1 Ack=1 Win=14656 Len=0 TSval=9336006 TSecr=34828001
485109  42.552054     10.0.1.2 -> 10.0.1.3     TCP 66 50958 > glrpc [FIN, ACK] Seq=9 Ack=500000001 Win=3011840 Len=0 TSval=9346644 TSecr=34838617
485110  42.589439     10.0.1.3 -> 10.0.1.2     TCP 66 glrpc > 50958 [ACK] Seq=500000001 Ack=10 Win=5824 Len=0 TSval=34838648 TSecr=9346644
  1   0.000000     10.0.1.2 -> 10.0.1.3     TCP 74 50968 > glrpc [SYN] Seq=0 Win=14600 Len=0 MSS=1460 SACK_PERM=1 TSval=9410688 TSecr=0 WS=64
  2   0.000297     10.0.1.3 -> 10.0.1.2     TCP 74 glrpc > 50968 [SYN, ACK] Seq=0 Ack=1 Win=5792 Len=0 MSS=1460 SACK_PERM=1 TSval=34902677 TSecr=9410688 WS=64
  3   0.000318     10.0.1.2 -> 10.0.1.3     TCP 66 50968 > glrpc [ACK] Seq=1 Ack=1 Win=14656 Len=0 TSval=9410688 TSecr=34902677
479044  42.530715     10.0.1.2 -> 10.0.1.3     TCP 66 50968 > glrpc [FIN, ACK] Seq=9 Ack=500000001 Win=3011840 Len=0 TSval=9421321 TSecr=34913245
479045  42.569979     10.0.1.3 -> 10.0.1.2     TCP 66 glrpc > 50968 [ACK] Seq=500000001 Ack=10 Win=5824 Len=0 TSval=34913319 TSecr=9421321
  1   0.000000     10.0.1.2 -> 10.0.1.3     TCP 74 50977 > glrpc [SYN] Seq=0 Win=14600 Len=0 MSS=1460 SACK_PERM=1 TSval=9483395 TSecr=0 WS=64
  2   0.000277     10.0.1.3 -> 10.0.1.2     TCP 74 glrpc > 50977 [SYN, ACK] Seq=0 Ack=1 Win=5792 Len=0 MSS=1460 SACK_PERM=1 TSval=34975379 TSecr=9483395 WS=64
  3   0.000292     10.0.1.2 -> 10.0.1.3     TCP 66 50977 > glrpc [ACK] Seq=1 Ack=1 Win=14656 Len=0 TSval=9483395 TSecr=34975379
515280  42.600421     10.0.1.2 -> 10.0.1.3     TCP 66 50977 > glrpc [FIN, ACK] Seq=9 Ack=500000001 Win=3014784 Len=0 TSval=9494045 TSecr=34986007
515281  42.640277     10.0.1.3 -> 10.0.1.2     TCP 66 glrpc > 50977 [ACK] Seq=500000001 Ack=10 Win=5824 Len=0 TSval=34986038 TSecr=9494045
  1   0.000000     10.0.1.2 -> 10.0.1.3     TCP 74 50989 > glrpc [SYN] Seq=0 Win=14600 Len=0 MSS=1460 SACK_PERM=1 TSval=9569438 TSecr=0 WS=64
  2   0.000351     10.0.1.3 -> 10.0.1.2     TCP 74 glrpc > 50989 [SYN, ACK] Seq=0 Ack=1 Win=5792 Len=0 MSS=1460 SACK_PERM=1 TSval=35061415 TSecr=9569438 WS=64
  3   0.000372     10.0.1.2 -> 10.0.1.3     TCP 66 50989 > glrpc [ACK] Seq=1 Ack=1 Win=14656 Len=0 TSval=9569438 TSecr=35061415
503412  42.537356     10.0.1.2 -> 10.0.1.3     TCP 66 50989 > glrpc [FIN, ACK] Seq=9 Ack=500000001 Win=3011840 Len=0 TSval=9580072 TSecr=35072028
503413  42.576060     10.0.1.3 -> 10.0.1.2     TCP 66 glrpc > 50989 [ACK] Seq=500000001 Ack=10 Win=5824 Len=0 TSval=35072059 TSecr=9580072
  1   0.000000     10.0.1.2 -> 10.0.1.3     TCP 74 50997 > glrpc [SYN] Seq=0 Win=14600 Len=0 MSS=1460 SACK_PERM=1 TSval=9650270 TSecr=0 WS=64
  2   0.000306     10.0.1.3 -> 10.0.1.2     TCP 74 glrpc > 50997 [SYN, ACK] Seq=0 Ack=1 Win=5792 Len=0 MSS=1460 SACK_PERM=1 TSval=35142242 TSecr=9650270 WS=64
  3   0.000321     10.0.1.2 -> 10.0.1.3     TCP 66 50997 > glrpc [ACK] Seq=1 Ack=1 Win=14656 Len=0 TSval=9650270 TSecr=35142242
510373  42.549597     10.0.1.2 -> 10.0.1.3     TCP 66 50997 > glrpc [FIN, ACK] Seq=9 Ack=500000001 Win=3008960 Len=0 TSval=9660908 TSecr=35152818
510374  42.587451     10.0.1.3 -> 10.0.1.2     TCP 66 glrpc > 50997 [ACK] Seq=500000001 Ack=10 Win=5824 Len=0 TSval=35152888 TSecr=9660908
  1   0.000000     10.0.1.2 -> 10.0.1.3     TCP 74 51007 > glrpc [SYN] Seq=0 Win=14600 Len=0 MSS=1460 SACK_PERM=1 TSval=9734114 TSecr=0 WS=64
  2   0.000427     10.0.1.3 -> 10.0.1.2     TCP 74 glrpc > 51007 [SYN, ACK] Seq=0 Ack=1 Win=5792 Len=0 MSS=1460 SACK_PERM=1 TSval=35226079 TSecr=9734114 WS=64
  3   0.000447     10.0.1.2 -> 10.0.1.3     TCP 66 51007 > glrpc [ACK] Seq=1 Ack=1 Win=14656 Len=0 TSval=9734114 TSecr=35226079
501716  42.532721     10.0.1.2 -> 10.0.1.3     TCP 66 51007 > glrpc [FIN, ACK] Seq=9 Ack=500000001 Win=3011840 Len=0 TSval=9744747 TSecr=35236690
501717  42.569908     10.0.1.3 -> 10.0.1.2     TCP 66 glrpc > 51007 [ACK] Seq=500000001 Ack=10 Win=5824 Len=0 TSval=35236721 TSecr=9744747
  1   0.000000     10.0.1.2 -> 10.0.1.3     TCP 74 51017 > glrpc [SYN] Seq=0 Win=14600 Len=0 MSS=1460 SACK_PERM=1 TSval=9815849 TSecr=0 WS=64
  2   0.000287     10.0.1.3 -> 10.0.1.2     TCP 74 glrpc > 51017 [SYN, ACK] Seq=0 Ack=1 Win=5792 Len=0 MSS=1460 SACK_PERM=1 TSval=35307807 TSecr=9815849 WS=64
  3   0.000306     10.0.1.2 -> 10.0.1.3     TCP 66 51017 > glrpc [ACK] Seq=1 Ack=1 Win=14656 Len=0 TSval=9815849 TSecr=35307807
513296  42.535803     10.0.1.2 -> 10.0.1.3     TCP 66 51017 > glrpc [FIN, ACK] Seq=9 Ack=500000001 Win=3008960 Len=0 TSval=9826482 TSecr=35318377
513297  42.576926     10.0.1.3 -> 10.0.1.2     TCP 66 glrpc > 51017 [ACK] Seq=500000001 Ack=10 Win=5824 Len=0 TSval=35318451 TSecr=9826482
  1   0.000000     10.0.1.2 -> 10.0.1.3     TCP 74 51027 > glrpc [SYN] Seq=0 Win=14600 Len=0 MSS=1460 SACK_PERM=1 TSval=9901291 TSecr=0 WS=64
  2   0.000331     10.0.1.3 -> 10.0.1.2     TCP 74 glrpc > 51027 [SYN, ACK] Seq=0 Ack=1 Win=5792 Len=0 MSS=1460 SACK_PERM=1 TSval=35393243 TSecr=9901291 WS=64
  3   0.000346     10.0.1.2 -> 10.0.1.3     TCP 66 51027 > glrpc [ACK] Seq=1 Ack=1 Win=14656 Len=0 TSval=9901291 TSecr=35393243
503996  42.532926     10.0.1.2 -> 10.0.1.3     TCP 66 51027 > glrpc [FIN, ACK] Seq=9 Ack=500000001 Win=3085184 Len=0 TSval=9911924 TSecr=35403854
503997  42.570424     10.0.1.3 -> 10.0.1.2     TCP 66 glrpc > 51027 [ACK] Seq=500000001 Ack=10 Win=5824 Len=0 TSval=35403885 TSecr=9911924
