  1   0.000000     10.0.1.2 -> 10.0.1.3     TCP 74 50040 > glrpc [SYN] Seq=0 Win=14600 Len=0 MSS=1460 SACK_PERM=1 TSval=4485497 TSecr=0 WS=64
  2   0.000328     10.0.1.3 -> 10.0.1.2     TCP 74 glrpc > 50040 [SYN, ACK] Seq=0 Ack=1 Win=5792 Len=0 MSS=1460 SACK_PERM=1 TSval=29977856 TSecr=4485497 WS=64
  3   0.000353     10.0.1.2 -> 10.0.1.3     TCP 66 50040 > glrpc [ACK] Seq=1 Ack=1 Win=14656 Len=0 TSval=4485497 TSecr=29977856
103623   8.589614     10.0.1.2 -> 10.0.1.3     TCP 66 50040 > glrpc [FIN, ACK] Seq=9 Ack=100000001 Win=668992 Len=0 TSval=4487644 TSecr=29979995
103624   8.628515     10.0.1.3 -> 10.0.1.2     TCP 66 glrpc > 50040 [ACK] Seq=100000001 Ack=10 Win=5824 Len=0 TSval=29980013 TSecr=4487644
  1   0.000000     10.0.1.2 -> 10.0.1.3     TCP 74 50041 > glrpc [SYN] Seq=0 Win=14600 Len=0 MSS=1460 SACK_PERM=1 TSval=4489460 TSecr=0 WS=64
  2   0.000283     10.0.1.3 -> 10.0.1.2     TCP 74 glrpc > 50041 [SYN, ACK] Seq=0 Ack=1 Win=5792 Len=0 MSS=1460 SACK_PERM=1 TSval=29981818 TSecr=4489460 WS=64
  3   0.000298     10.0.1.2 -> 10.0.1.3     TCP 66 50041 > glrpc [ACK] Seq=1 Ack=1 Win=14656 Len=0 TSval=4489460 TSecr=29981818
102604   8.600785     10.0.1.2 -> 10.0.1.3     TCP 66 50041 > glrpc [FIN, ACK] Seq=9 Ack=100000001 Win=715328 Len=0 TSval=4491610 TSecr=29983960
102605   8.638667     10.0.1.3 -> 10.0.1.2     TCP 66 glrpc > 50041 [ACK] Seq=100000001 Ack=10 Win=5824 Len=0 TSval=29983978 TSecr=4491610
  1   0.000000     10.0.1.2 -> 10.0.1.3     TCP 74 50042 > glrpc [SYN] Seq=0 Win=14600 Len=0 MSS=1460 SACK_PERM=1 TSval=4493376 TSecr=0 WS=64
  2   0.000297     10.0.1.3 -> 10.0.1.2     TCP 74 glrpc > 50042 [SYN, ACK] Seq=0 Ack=1 Win=5792 Len=0 MSS=1460 SACK_PERM=1 TSval=29985735 TSecr=4493376 WS=64
  3   0.000317     10.0.1.2 -> 10.0.1.3     TCP 66 50042 > glrpc [ACK] Seq=1 Ack=1 Win=14656 Len=0 TSval=4493376 TSecr=29985735
103684   8.752279     10.0.1.2 -> 10.0.1.3     TCP 66 50042 > glrpc [FIN, ACK] Seq=9 Ack=100000001 Win=729792 Len=0 TSval=4495564 TSecr=29987915
103685   8.787987     10.0.1.3 -> 10.0.1.2     TCP 66 glrpc > 50042 [ACK] Seq=100000001 Ack=10 Win=5824 Len=0 TSval=29987932 TSecr=4495564
  1   0.000000     10.0.1.2 -> 10.0.1.3     TCP 74 50044 > glrpc [SYN] Seq=0 Win=14600 Len=0 MSS=1460 SACK_PERM=1 TSval=4497718 TSecr=0 WS=64
  2   0.000298     10.0.1.3 -> 10.0.1.2     TCP 74 glrpc > 50044 [SYN, ACK] Seq=0 Ack=1 Win=5792 Len=0 MSS=1460 SACK_PERM=1 TSval=29990076 TSecr=4497718 WS=64
  3   0.000317     10.0.1.2 -> 10.0.1.3     TCP 66 50044 > glrpc [ACK] Seq=1 Ack=1 Win=14656 Len=0 TSval=4497718 TSecr=29990076
103567   8.751424     10.0.1.2 -> 10.0.1.3     TCP 66 50044 > glrpc [FIN, ACK] Seq=9 Ack=100000001 Win=741376 Len=0 TSval=4499906 TSecr=29992256
103568   8.788135     10.0.1.3 -> 10.0.1.2     TCP 66 glrpc > 50044 [ACK] Seq=100000001 Ack=10 Win=5824 Len=0 TSval=29992273 TSecr=4499906
  1   0.000000     10.0.1.2 -> 10.0.1.3     TCP 74 50045 > glrpc [SYN] Seq=0 Win=14600 Len=0 MSS=1460 SACK_PERM=1 TSval=4502052 TSecr=0 WS=64
  2   0.000369     10.0.1.3 -> 10.0.1.2     TCP 74 glrpc > 50045 [SYN, ACK] Seq=0 Ack=1 Win=5792 Len=0 MSS=1460 SACK_PERM=1 TSval=29994410 TSecr=4502052 WS=64
  3   0.000391     10.0.1.2 -> 10.0.1.3     TCP 66 50045 > glrpc [ACK] Seq=1 Ack=1 Win=14656 Len=0 TSval=4502052 TSecr=29994410
103565   8.808896     10.0.1.2 -> 10.0.1.3     TCP 66 50045 > glrpc [FIN, ACK] Seq=9 Ack=100000001 Win=738496 Len=0 TSval=4504254 TSecr=29996603
103566   8.848247     10.0.1.3 -> 10.0.1.2     TCP 66 glrpc > 50045 [ACK] Seq=100000001 Ack=10 Win=5824 Len=0 TSval=29996622 TSecr=4504254
  1   0.000000     10.0.1.2 -> 10.0.1.3     TCP 74 50046 > glrpc [SYN] Seq=0 Win=14600 Len=0 MSS=1460 SACK_PERM=1 TSval=4506906 TSecr=0 WS=64
  2   0.000295     10.0.1.3 -> 10.0.1.2     TCP 74 glrpc > 50046 [SYN, ACK] Seq=0 Ack=1 Win=5792 Len=0 MSS=1460 SACK_PERM=1 TSval=29999263 TSecr=4506906 WS=64
  3   0.000316     10.0.1.2 -> 10.0.1.3     TCP 66 50046 > glrpc [ACK] Seq=1 Ack=1 Win=14656 Len=0 TSval=4506906 TSecr=29999263
103674   8.819705     10.0.1.2 -> 10.0.1.3     TCP 66 50046 > glrpc [FIN, ACK] Seq=9 Ack=100000001 Win=721152 Len=0 TSval=4509111 TSecr=30001460
103675   8.857725     10.0.1.3 -> 10.0.1.2     TCP 66 glrpc > 50046 [ACK] Seq=100000001 Ack=10 Win=5824 Len=0 TSval=30001478 TSecr=4509111
  1   0.000000     10.0.1.2 -> 10.0.1.3     TCP 74 50047 > glrpc [SYN] Seq=0 Win=14600 Len=0 MSS=1460 SACK_PERM=1 TSval=4511359 TSecr=0 WS=64
  2   0.000303     10.0.1.3 -> 10.0.1.2     TCP 74 glrpc > 50047 [SYN, ACK] Seq=0 Ack=1 Win=5792 Len=0 MSS=1460 SACK_PERM=1 TSval=30003716 TSecr=4511359 WS=64
  3   0.000325     10.0.1.2 -> 10.0.1.3     TCP 66 50047 > glrpc [ACK] Seq=1 Ack=1 Win=14656 Len=0 TSval=4511359 TSecr=30003716
103409   8.747366     10.0.1.2 -> 10.0.1.3     TCP 66 50047 > glrpc [FIN, ACK] Seq=9 Ack=100000001 Win=755904 Len=0 TSval=4513546 TSecr=30005894
103410   8.787313     10.0.1.3 -> 10.0.1.2     TCP 66 glrpc > 50047 [ACK] Seq=100000001 Ack=10 Win=5824 Len=0 TSval=30005913 TSecr=4513546
  1   0.000000     10.0.1.2 -> 10.0.1.3     TCP 74 50049 > glrpc [SYN] Seq=0 Win=14600 Len=0 MSS=1460 SACK_PERM=1 TSval=4516002 TSecr=0 WS=64
  2   0.000334     10.0.1.3 -> 10.0.1.2     TCP 74 glrpc > 50049 [SYN, ACK] Seq=0 Ack=1 Win=5792 Len=0 MSS=1460 SACK_PERM=1 TSval=30008358 TSecr=4516002 WS=64
  3   0.000359     10.0.1.2 -> 10.0.1.3     TCP 66 50049 > glrpc [ACK] Seq=1 Ack=1 Win=14656 Len=0 TSval=4516002 TSecr=30008358
103563   8.881644     10.0.1.2 -> 10.0.1.3     TCP 66 50049 > glrpc [FIN, ACK] Seq=9 Ack=100000001 Win=787712 Len=0 TSval=4518222 TSecr=30010571
103564   8.921651     10.0.1.3 -> 10.0.1.2     TCP 66 glrpc > 50049 [ACK] Seq=100000001 Ack=10 Win=5824 Len=0 TSval=30010589 TSecr=4518222
  1   0.000000     10.0.1.2 -> 10.0.1.3     TCP 74 50050 > glrpc [SYN] Seq=0 Win=14600 Len=0 MSS=1460 SACK_PERM=1 TSval=4520870 TSecr=0 WS=64
  2   0.000336     10.0.1.3 -> 10.0.1.2     TCP 74 glrpc > 50050 [SYN, ACK] Seq=0 Ack=1 Win=5792 Len=0 MSS=1460 SACK_PERM=1 TSval=30013226 TSecr=4520870 WS=64
  3   0.000356     10.0.1.2 -> 10.0.1.3     TCP 66 50050 > glrpc [ACK] Seq=1 Ack=1 Win=14656 Len=0 TSval=4520870 TSecr=30013226
103596   8.760165     10.0.1.2 -> 10.0.1.3     TCP 66 50050 > glrpc [FIN, ACK] Seq=9 Ack=100000001 Win=732736 Len=0 TSval=4523060 TSecr=30015408
103597   8.798147     10.0.1.3 -> 10.0.1.2     TCP 66 glrpc > 50050 [ACK] Seq=100000001 Ack=10 Win=5824 Len=0 TSval=30015426 TSecr=4523060
  1   0.000000     10.0.1.2 -> 10.0.1.3     TCP 74 50052 > glrpc [SYN] Seq=0 Win=14600 Len=0 MSS=1460 SACK_PERM=1 TSval=4525397 TSecr=0 WS=64
  2   0.000298     10.0.1.3 -> 10.0.1.2     TCP 74 glrpc > 50052 [SYN, ACK] Seq=0 Ack=1 Win=5792 Len=0 MSS=1460 SACK_PERM=1 TSval=30017753 TSecr=4525397 WS=64
  3   0.000318     10.0.1.2 -> 10.0.1.3     TCP 66 50052 > glrpc [ACK] Seq=1 Ack=1 Win=14656 Len=0 TSval=4525398 TSecr=30017753
103649   8.653605     10.0.1.2 -> 10.0.1.3     TCP 66 50052 > glrpc [FIN, ACK] Seq=9 Ack=100000001 Win=724032 Len=0 TSval=4527561 TSecr=30019909
103650   8.693363     10.0.1.3 -> 10.0.1.2     TCP 66 glrpc > 50052 [ACK] Seq=100000001 Ack=10 Win=5824 Len=0 TSval=30019927 TSecr=4527561
  1   0.000000     10.0.1.2 -> 10.0.1.3     TCP 74 50054 > glrpc [SYN] Seq=0 Win=14600 Len=0 MSS=1460 SACK_PERM=1 TSval=4529911 TSecr=0 WS=64
  2   0.000321     10.0.1.3 -> 10.0.1.2     TCP 74 glrpc > 50054 [SYN, ACK] Seq=0 Ack=1 Win=5792 Len=0 MSS=1460 SACK_PERM=1 TSval=30022267 TSecr=4529911 WS=64
  3   0.000346     10.0.1.2 -> 10.0.1.3     TCP 66 50054 > glrpc [ACK] Seq=1 Ack=1 Win=14656 Len=0 TSval=4529911 TSecr=30022267
103587   8.836979     10.0.1.2 -> 10.0.1.3     TCP 66 50054 > glrpc [FIN, ACK] Seq=9 Ack=100000001 Win=805120 Len=0 TSval=4532120 TSecr=30024467
103588   8.875825     10.0.1.3 -> 10.0.1.2     TCP 66 glrpc > 50054 [ACK] Seq=100000001 Ack=10 Win=5824 Len=0 TSval=30024486 TSecr=4532120
  1   0.000000     10.0.1.2 -> 10.0.1.3     TCP 74 50056 > glrpc [SYN] Seq=0 Win=14600 Len=0 MSS=1460 SACK_PERM=1 TSval=4533869 TSecr=0 WS=64
  2   0.000329     10.0.1.3 -> 10.0.1.2     TCP 74 glrpc > 50056 [SYN, ACK] Seq=0 Ack=1 Win=5792 Len=0 MSS=1460 SACK_PERM=1 TSval=30026224 TSecr=4533869 WS=64
  3   0.000344     10.0.1.2 -> 10.0.1.3     TCP 66 50056 > glrpc [ACK] Seq=1 Ack=1 Win=14656 Len=0 TSval=4533869 TSecr=30026224
103301   8.734234     10.0.1.2 -> 10.0.1.3     TCP 66 50056 > glrpc [FIN, ACK] Seq=9 Ack=100000001 Win=721152 Len=0 TSval=4536052 TSecr=30028399
103302   8.771885     10.0.1.3 -> 10.0.1.2     TCP 66 glrpc > 50056 [ACK] Seq=100000001 Ack=10 Win=5824 Len=0 TSval=30028417 TSecr=4536052
  1   0.000000     10.0.1.2 -> 10.0.1.3     TCP 74 50057 > glrpc [SYN] Seq=0 Win=14600 Len=0 MSS=1460 SACK_PERM=1 TSval=4537842 TSecr=0 WS=64
  2   0.000416     10.0.1.3 -> 10.0.1.2     TCP 74 glrpc > 50057 [SYN, ACK] Seq=0 Ack=1 Win=5792 Len=0 MSS=1460 SACK_PERM=1 TSval=30030197 TSecr=4537842 WS=64
  3   0.000436     10.0.1.2 -> 10.0.1.3     TCP 66 50057 > glrpc [ACK] Seq=1 Ack=1 Win=14656 Len=0 TSval=4537842 TSecr=30030197
103646   8.734135     10.0.1.2 -> 10.0.1.3     TCP 66 50057 > glrpc [FIN, ACK] Seq=9 Ack=100000001 Win=683456 Len=0 TSval=4540026 TSecr=30032371
103647   8.770160     10.0.1.3 -> 10.0.1.2     TCP 66 glrpc > 50057 [ACK] Seq=100000001 Ack=10 Win=5824 Len=0 TSval=30032390 TSecr=4540026
  1   0.000000     10.0.1.2 -> 10.0.1.3     TCP 74 50058 > glrpc [SYN] Seq=0 Win=14600 Len=0 MSS=1460 SACK_PERM=1 TSval=4541769 TSecr=0 WS=64
  2   0.000282     10.0.1.3 -> 10.0.1.2     TCP 74 glrpc > 50058 [SYN, ACK] Seq=0 Ack=1 Win=5792 Len=0 MSS=1460 SACK_PERM=1 TSval=30034123 TSecr=4541769 WS=64
  3   0.000300     10.0.1.2 -> 10.0.1.3     TCP 66 50058 > glrpc [ACK] Seq=1 Ack=1 Win=14656 Len=0 TSval=4541769 TSecr=30034123
101133   8.738854     10.0.1.2 -> 10.0.1.3     TCP 66 50058 > glrpc [FIN, ACK] Seq=9 Ack=100000001 Win=729792 Len=0 TSval=4543953 TSecr=30036299
101134   8.777593     10.0.1.3 -> 10.0.1.2     TCP 66 glrpc > 50058 [ACK] Seq=100000001 Ack=10 Win=5824 Len=0 TSval=30036318 TSecr=4543953
  1   0.000000     10.0.1.2 -> 10.0.1.3     TCP 74 50060 > glrpc [SYN] Seq=0 Win=14600 Len=0 MSS=1460 SACK_PERM=1 TSval=4545788 TSecr=0 WS=64
  2   0.000279     10.0.1.3 -> 10.0.1.2     TCP 74 glrpc > 50060 [SYN, ACK] Seq=0 Ack=1 Win=5792 Len=0 MSS=1460 SACK_PERM=1 TSval=30038142 TSecr=4545788 WS=64
  3   0.000295     10.0.1.2 -> 10.0.1.3     TCP 66 50060 > glrpc [ACK] Seq=1 Ack=1 Win=14656 Len=0 TSval=4545788 TSecr=30038142
103573   8.750080     10.0.1.2 -> 10.0.1.3     TCP 66 50060 > glrpc [FIN, ACK] Seq=9 Ack=100000001 Win=755904 Len=0 TSval=4547975 TSecr=30040321
103574   8.790402     10.0.1.3 -> 10.0.1.2     TCP 66 glrpc > 50060 [ACK] Seq=100000001 Ack=10 Win=5824 Len=0 TSval=30040340 TSecr=4547975
  1   0.000000     10.0.1.2 -> 10.0.1.3     TCP 74 50061 > glrpc [SYN] Seq=0 Win=14600 Len=0 MSS=1460 SACK_PERM=1 TSval=4549844 TSecr=0 WS=64
  2   0.000285     10.0.1.3 -> 10.0.1.2     TCP 74 glrpc > 50061 [SYN, ACK] Seq=0 Ack=1 Win=5792 Len=0 MSS=1460 SACK_PERM=1 TSval=30042197 TSecr=4549844 WS=64
  3   0.000304     10.0.1.2 -> 10.0.1.3     TCP 66 50061 > glrpc [ACK] Seq=1 Ack=1 Win=14656 Len=0 TSval=4549844 TSecr=30042197
103639   8.703666     10.0.1.2 -> 10.0.1.3     TCP 66 50061 > glrpc [FIN, ACK] Seq=9 Ack=100000001 Win=660288 Len=0 TSval=4552019 TSecr=30044366
103640   8.741318     10.0.1.3 -> 10.0.1.2     TCP 66 glrpc > 50061 [ACK] Seq=100000001 Ack=10 Win=5824 Len=0 TSval=30044383 TSecr=4552019
  1   0.000000     10.0.1.2 -> 10.0.1.3     TCP 74 50063 > glrpc [SYN] Seq=0 Win=14600 Len=0 MSS=1460 SACK_PERM=1 TSval=4553778 TSecr=0 WS=64
  2   0.000326     10.0.1.3 -> 10.0.1.2     TCP 74 glrpc > 50063 [SYN, ACK] Seq=0 Ack=1 Win=5792 Len=0 MSS=1460 SACK_PERM=1 TSval=30046132 TSecr=4553778 WS=64
  3   0.000340     10.0.1.2 -> 10.0.1.3     TCP 66 50063 > glrpc [ACK] Seq=1 Ack=1 Win=14656 Len=0 TSval=4553778 TSecr=30046132
103662   8.702248     10.0.1.2 -> 10.0.1.3     TCP 66 50063 > glrpc [FIN, ACK] Seq=9 Ack=100000001 Win=724032 Len=0 TSval=4555953 TSecr=30048299
103663   8.740810     10.0.1.3 -> 10.0.1.2     TCP 66 glrpc > 50063 [ACK] Seq=100000001 Ack=10 Win=5824 Len=0 TSval=30048317 TSecr=4555953
  1   0.000000     10.0.1.2 -> 10.0.1.3     TCP 74 50065 > glrpc [SYN] Seq=0 Win=14600 Len=0 MSS=1460 SACK_PERM=1 TSval=4558025 TSecr=0 WS=64
  2   0.000291     10.0.1.3 -> 10.0.1.2     TCP 74 glrpc > 50065 [SYN, ACK] Seq=0 Ack=1 Win=5792 Len=0 MSS=1460 SACK_PERM=1 TSval=30050379 TSecr=4558025 WS=64
  3   0.000306     10.0.1.2 -> 10.0.1.3     TCP 66 50065 > glrpc [ACK] Seq=1 Ack=1 Win=14656 Len=0 TSval=4558025 TSecr=30050379
96072   8.683553     10.0.1.2 -> 10.0.1.3     TCP 66 50065 > glrpc [FIN, ACK] Seq=9 Ack=100000001 Win=709568 Len=0 TSval=4560196 TSecr=30052541
96073   8.720927     10.0.1.3 -> 10.0.1.2     TCP 66 glrpc > 50065 [ACK] Seq=100000001 Ack=10 Win=5824 Len=0 TSval=30052559 TSecr=4560196
  1   0.000000     10.0.1.2 -> 10.0.1.3     TCP 74 50067 > glrpc [SYN] Seq=0 Win=14600 Len=0 MSS=1460 SACK_PERM=1 TSval=4561779 TSecr=0 WS=64
  2   0.000292     10.0.1.3 -> 10.0.1.2     TCP 74 glrpc > 50067 [SYN, ACK] Seq=0 Ack=1 Win=5792 Len=0 MSS=1460 SACK_PERM=1 TSval=30054132 TSecr=4561779 WS=64
  3   0.000306     10.0.1.2 -> 10.0.1.3     TCP 66 50067 > glrpc [ACK] Seq=1 Ack=1 Win=14656 Len=0 TSval=4561779 TSecr=30054132
103639   8.552702     10.0.1.2 -> 10.0.1.3     TCP 66 50067 > glrpc [FIN, ACK] Seq=9 Ack=100000001 Win=715328 Len=0 TSval=4563917 TSecr=30056262
103640   8.590664     10.0.1.3 -> 10.0.1.2     TCP 66 glrpc > 50067 [ACK] Seq=100000001 Ack=10 Win=5824 Len=0 TSval=30056280 TSecr=4563917
  1   0.000000     10.0.1.2 -> 10.0.1.3     TCP 74 50074 > glrpc [SYN] Seq=0 Win=14600 Len=0 MSS=1460 SACK_PERM=1 TSval=4565623 TSecr=0 WS=64
  2   0.000298     10.0.1.3 -> 10.0.1.2     TCP 74 glrpc > 50074 [SYN, ACK] Seq=0 Ack=1 Win=5792 Len=0 MSS=1460 SACK_PERM=1 TSval=30057976 TSecr=4565623 WS=64
  3   0.000318     10.0.1.2 -> 10.0.1.3     TCP 66 50074 > glrpc [ACK] Seq=1 Ack=1 Win=14656 Len=0 TSval=4565623 TSecr=30057976
103622   8.532057     10.0.1.2 -> 10.0.1.3     TCP 66 50074 > glrpc [FIN, ACK] Seq=9 Ack=100000001 Win=660288 Len=0 TSval=4567756 TSecr=30060101
103623   8.573031     10.0.1.3 -> 10.0.1.2     TCP 66 glrpc > 50074 [ACK] Seq=100000001 Ack=10 Win=5824 Len=0 TSval=30060119 TSecr=4567756
