  0.000000     10.0.1.2 -> 10.0.1.3     TCP 74 48631 > glrpc [SYN] Seq=0 Win=14600 Len=0 MSS=1460 SACK_PERM=1 TSval=1462632 TSecr=0 WS=64
  0.000312     10.0.1.3 -> 10.0.1.2     TCP 74 glrpc > 48631 [SYN, ACK] Seq=0 Ack=1 Win=5792 Len=0 MSS=1460 SACK_PERM=1 TSval=26955218 TSecr=1462632 WS=64
  0.000326     10.0.1.2 -> 10.0.1.3     TCP 66 48631 > glrpc [ACK] Seq=1 Ack=1 Win=14656 Len=0 TSval=1462632 TSecr=26955218
  8.515442     10.0.1.2 -> 10.0.1.3     TCP 66 48631 > glrpc [FIN, ACK] Seq=9 Ack=100000001 Win=695040 Len=0 TSval=1464761 TSecr=26957340
  8.555352     10.0.1.3 -> 10.0.1.2     TCP 66 glrpc > 48631 [ACK] Seq=100000001 Ack=10 Win=5824 Len=0 TSval=26957357 TSecr=1464761
 13.516852     10.0.1.2 -> 10.0.1.3     TCP 74 48632 > glrpc [SYN] Seq=0 Win=14600 Len=0 MSS=1460 SACK_PERM=1 TSval=1466011 TSecr=0 WS=64
 13.517189     10.0.1.3 -> 10.0.1.2     TCP 74 glrpc > 48632 [SYN, ACK] Seq=0 Ack=1 Win=5792 Len=0 MSS=1460 SACK_PERM=1 TSval=26958597 TSecr=1466011 WS=64
 13.517220     10.0.1.2 -> 10.0.1.3     TCP 66 48632 > glrpc [ACK] Seq=1 Ack=1 Win=14656 Len=0 TSval=1466011 TSecr=26958597
 22.157150     10.0.1.2 -> 10.0.1.3     TCP 66 48632 > glrpc [FIN, ACK] Seq=9 Ack=100000001 Win=715328 Len=0 TSval=1468171 TSecr=26960749
 22.195438     10.0.1.3 -> 10.0.1.2     TCP 66 glrpc > 48632 [ACK] Seq=100000001 Ack=10 Win=5824 Len=0 TSval=26960767 TSecr=1468171
 27.158609     10.0.1.2 -> 10.0.1.3     TCP 74 48633 > glrpc [SYN] Seq=0 Win=14600 Len=0 MSS=1460 SACK_PERM=1 TSval=1469422 TSecr=0 WS=64
 27.158937     10.0.1.3 -> 10.0.1.2     TCP 74 glrpc > 48633 [SYN, ACK] Seq=0 Ack=1 Win=5792 Len=0 MSS=1460 SACK_PERM=1 TSval=26962007 TSecr=1469422 WS=64
 27.158954     10.0.1.2 -> 10.0.1.3     TCP 66 48633 > glrpc [ACK] Seq=1 Ack=1 Win=14656 Len=0 TSval=1469422 TSecr=26962007
 35.781471     10.0.1.2 -> 10.0.1.3     TCP 66 48633 > glrpc [FIN, ACK] Seq=9 Ack=100000001 Win=732736 Len=0 TSval=1471578 TSecr=26964155
 35.820365     10.0.1.3 -> 10.0.1.2     TCP 66 glrpc > 48633 [ACK] Seq=100000001 Ack=10 Win=5824 Len=0 TSval=26964173 TSecr=1471578
 40.782893     10.0.1.2 -> 10.0.1.3     TCP 74 48636 > glrpc [SYN] Seq=0 Win=14600 Len=0 MSS=1460 SACK_PERM=1 TSval=1472828 TSecr=0 WS=64
 40.783188     10.0.1.3 -> 10.0.1.2     TCP 74 glrpc > 48636 [SYN, ACK] Seq=0 Ack=1 Win=5792 Len=0 MSS=1460 SACK_PERM=1 TSval=26965413 TSecr=1472828 WS=64
 40.783202     10.0.1.2 -> 10.0.1.3     TCP 66 48636 > glrpc [ACK] Seq=1 Ack=1 Win=14656 Len=0 TSval=1472828 TSecr=26965413
 49.369374     10.0.1.2 -> 10.0.1.3     TCP 66 48636 > glrpc [FIN, ACK] Seq=9 Ack=100000001 Win=718208 Len=0 TSval=1474975 TSecr=26967551
 49.409438     10.0.1.3 -> 10.0.1.2     TCP 66 glrpc > 48636 [ACK] Seq=100000001 Ack=10 Win=5824 Len=0 TSval=26967570 TSecr=1474975
 54.370945     10.0.1.2 -> 10.0.1.3     TCP 74 48637 > glrpc [SYN] Seq=0 Win=14600 Len=0 MSS=1460 SACK_PERM=1 TSval=1476225 TSecr=0 WS=64
 54.371348     10.0.1.3 -> 10.0.1.2     TCP 74 glrpc > 48637 [SYN, ACK] Seq=0 Ack=1 Win=5792 Len=0 MSS=1460 SACK_PERM=1 TSval=26968810 TSecr=1476225 WS=64
 54.371367     10.0.1.2 -> 10.0.1.3     TCP 66 48637 > glrpc [ACK] Seq=1 Ack=1 Win=14656 Len=0 TSval=1476225 TSecr=26968810
 62.955172     10.0.1.2 -> 10.0.1.3     TCP 66 48637 > glrpc [FIN, ACK] Seq=9 Ack=100000001 Win=660288 Len=0 TSval=1478371 TSecr=26970948
 62.994497     10.0.1.3 -> 10.0.1.2     TCP 66 glrpc > 48637 [ACK] Seq=100000001 Ack=10 Win=5824 Len=0 TSval=26970966 TSecr=1478371
 67.956614     10.0.1.2 -> 10.0.1.3     TCP 74 48639 > glrpc [SYN] Seq=0 Win=14600 Len=0 MSS=1460 SACK_PERM=1 TSval=1479621 TSecr=0 WS=64
 67.956910     10.0.1.3 -> 10.0.1.2     TCP 74 glrpc > 48639 [SYN, ACK] Seq=0 Ack=1 Win=5792 Len=0 MSS=1460 SACK_PERM=1 TSval=26972206 TSecr=1479621 WS=64
 67.956928     10.0.1.2 -> 10.0.1.3     TCP 66 48639 > glrpc [ACK] Seq=1 Ack=1 Win=14656 Len=0 TSval=1479621 TSecr=26972206
 76.551257     10.0.1.2 -> 10.0.1.3     TCP 66 48639 > glrpc [FIN, ACK] Seq=9 Ack=100000001 Win=726912 Len=0 TSval=1481770 TSecr=26974346
 76.591460     10.0.1.3 -> 10.0.1.2     TCP 66 glrpc > 48639 [ACK] Seq=100000001 Ack=10 Win=5824 Len=0 TSval=26974365 TSecr=1481770
 81.552636     10.0.1.2 -> 10.0.1.3     TCP 74 48640 > glrpc [SYN] Seq=0 Win=14600 Len=0 MSS=1460 SACK_PERM=1 TSval=1483020 TSecr=0 WS=64
 81.552960     10.0.1.3 -> 10.0.1.2     TCP 74 glrpc > 48640 [SYN, ACK] Seq=0 Ack=1 Win=5792 Len=0 MSS=1460 SACK_PERM=1 TSval=26975605 TSecr=1483020 WS=64
 81.552973     10.0.1.2 -> 10.0.1.3     TCP 66 48640 > glrpc [ACK] Seq=1 Ack=1 Win=14656 Len=0 TSval=1483020 TSecr=26975605
 90.136370     10.0.1.2 -> 10.0.1.3     TCP 66 48640 > glrpc [FIN, ACK] Seq=9 Ack=100000001 Win=657408 Len=0 TSval=1485166 TSecr=26977743
 90.176417     10.0.1.3 -> 10.0.1.2     TCP 66 glrpc > 48640 [ACK] Seq=100000001 Ack=10 Win=5824 Len=0 TSval=26977761 TSecr=1485166
 95.137768     10.0.1.2 -> 10.0.1.3     TCP 74 48641 > glrpc [SYN] Seq=0 Win=14600 Len=0 MSS=1460 SACK_PERM=1 TSval=1486417 TSecr=0 WS=64
 95.138051     10.0.1.3 -> 10.0.1.2     TCP 74 glrpc > 48641 [SYN, ACK] Seq=0 Ack=1 Win=5792 Len=0 MSS=1460 SACK_PERM=1 TSval=26979001 TSecr=1486417 WS=64
 95.138070     10.0.1.2 -> 10.0.1.3     TCP 66 48641 > glrpc [ACK] Seq=1 Ack=1 Win=14656 Len=0 TSval=1486417 TSecr=26979001
103.739171     10.0.1.2 -> 10.0.1.3     TCP 66 48641 > glrpc [FIN, ACK] Seq=9 Ack=100000001 Win=715328 Len=0 TSval=1488567 TSecr=26981143
103.777570     10.0.1.3 -> 10.0.1.2     TCP 66 glrpc > 48641 [ACK] Seq=100000001 Ack=10 Win=5824 Len=0 TSval=26981161 TSecr=1488567
108.740512     10.0.1.2 -> 10.0.1.3     TCP 74 48643 > glrpc [SYN] Seq=0 Win=14600 Len=0 MSS=1460 SACK_PERM=1 TSval=1489817 TSecr=0 WS=64
108.740837     10.0.1.3 -> 10.0.1.2     TCP 74 glrpc > 48643 [SYN, ACK] Seq=0 Ack=1 Win=5792 Len=0 MSS=1460 SACK_PERM=1 TSval=26982401 TSecr=1489817 WS=64
108.740852     10.0.1.2 -> 10.0.1.3     TCP 66 48643 > glrpc [ACK] Seq=1 Ack=1 Win=14656 Len=0 TSval=1489817 TSecr=26982401
117.339359     10.0.1.2 -> 10.0.1.3     TCP 66 48643 > glrpc [FIN, ACK] Seq=9 Ack=100000001 Win=712448 Len=0 TSval=1491967 TSecr=26984544
117.378497     10.0.1.3 -> 10.0.1.2     TCP 66 glrpc > 48643 [ACK] Seq=100000001 Ack=10 Win=5824 Len=0 TSval=26984561 TSecr=1491967
122.340822     10.0.1.2 -> 10.0.1.3     TCP 74 48644 > glrpc [SYN] Seq=0 Win=14600 Len=0 MSS=1460 SACK_PERM=1 TSval=1493217 TSecr=0 WS=64
122.341152     10.0.1.3 -> 10.0.1.2     TCP 74 glrpc > 48644 [SYN, ACK] Seq=0 Ack=1 Win=5792 Len=0 MSS=1460 SACK_PERM=1 TSval=26985801 TSecr=1493217 WS=64
122.341166     10.0.1.2 -> 10.0.1.3     TCP 66 48644 > glrpc [ACK] Seq=1 Ack=1 Win=14656 Len=0 TSval=1493217 TSecr=26985801
130.905735     10.0.1.2 -> 10.0.1.3     TCP 66 48644 > glrpc [FIN, ACK] Seq=9 Ack=100000001 Win=721152 Len=0 TSval=1495359 TSecr=26987935
130.944529     10.0.1.3 -> 10.0.1.2     TCP 66 glrpc > 48644 [ACK] Seq=100000001 Ack=10 Win=5824 Len=0 TSval=26987952 TSecr=1495359
135.907115     10.0.1.2 -> 10.0.1.3     TCP 74 48646 > glrpc [SYN] Seq=0 Win=14600 Len=0 MSS=1460 SACK_PERM=1 TSval=1496609 TSecr=0 WS=64
135.907515     10.0.1.3 -> 10.0.1.2     TCP 74 glrpc > 48646 [SYN, ACK] Seq=0 Ack=1 Win=5792 Len=0 MSS=1460 SACK_PERM=1 TSval=26989192 TSecr=1496609 WS=64
135.907525     10.0.1.2 -> 10.0.1.3     TCP 66 48646 > glrpc [ACK] Seq=1 Ack=1 Win=14656 Len=0 TSval=1496609 TSecr=26989192
144.483674     10.0.1.2 -> 10.0.1.3     TCP 66 48646 > glrpc [FIN, ACK] Seq=9 Ack=100000001 Win=692160 Len=0 TSval=1498753 TSecr=26991329
144.520508     10.0.1.3 -> 10.0.1.2     TCP 66 glrpc > 48646 [ACK] Seq=100000001 Ack=10 Win=5824 Len=0 TSval=26991346 TSecr=1498753
149.485041     10.0.1.2 -> 10.0.1.3     TCP 74 48647 > glrpc [SYN] Seq=0 Win=14600 Len=0 MSS=1460 SACK_PERM=1 TSval=1500003 TSecr=0 WS=64
149.485321     10.0.1.3 -> 10.0.1.2     TCP 74 glrpc > 48647 [SYN, ACK] Seq=0 Ack=1 Win=5792 Len=0 MSS=1460 SACK_PERM=1 TSval=26992587 TSecr=1500003 WS=64
149.485335     10.0.1.2 -> 10.0.1.3     TCP 66 48647 > glrpc [ACK] Seq=1 Ack=1 Win=14656 Len=0 TSval=1500004 TSecr=26992587
158.083910     10.0.1.2 -> 10.0.1.3     TCP 66 48647 > glrpc [FIN, ACK] Seq=9 Ack=100000001 Win=660288 Len=0 TSval=1502153 TSecr=26994729
158.122600     10.0.1.3 -> 10.0.1.2     TCP 66 glrpc > 48647 [ACK] Seq=100000001 Ack=10 Win=5824 Len=0 TSval=26994746 TSecr=1502153
163.085383     10.0.1.2 -> 10.0.1.3     TCP 74 48650 > glrpc [SYN] Seq=0 Win=14600 Len=0 MSS=1460 SACK_PERM=1 TSval=1503404 TSecr=0 WS=64
163.085664     10.0.1.3 -> 10.0.1.2     TCP 74 glrpc > 48650 [SYN, ACK] Seq=0 Ack=1 Win=5792 Len=0 MSS=1460 SACK_PERM=1 TSval=26995986 TSecr=1503404 WS=64
163.085680     10.0.1.2 -> 10.0.1.3     TCP 66 48650 > glrpc [ACK] Seq=1 Ack=1 Win=14656 Len=0 TSval=1503404 TSecr=26995986
171.632050     10.0.1.2 -> 10.0.1.3     TCP 66 48650 > glrpc [FIN, ACK] Seq=9 Ack=100000001 Win=715328 Len=0 TSval=1505540 TSecr=26998115
171.671563     10.0.1.3 -> 10.0.1.2     TCP 66 glrpc > 48650 [ACK] Seq=100000001 Ack=10 Win=5824 Len=0 TSval=26998133 TSecr=1505540
176.634795     10.0.1.2 -> 10.0.1.3     TCP 74 48652 > glrpc [SYN] Seq=0 Win=14600 Len=0 MSS=1460 SACK_PERM=1 TSval=1506791 TSecr=0 WS=64
176.635126     10.0.1.3 -> 10.0.1.2     TCP 74 glrpc > 48652 [SYN, ACK] Seq=0 Ack=1 Win=5792 Len=0 MSS=1460 SACK_PERM=1 TSval=26999374 TSecr=1506791 WS=64
176.635139     10.0.1.2 -> 10.0.1.3     TCP 66 48652 > glrpc [ACK] Seq=1 Ack=1 Win=14656 Len=0 TSval=1506791 TSecr=26999374
185.250200     10.0.1.2 -> 10.0.1.3     TCP 66 48652 > glrpc [FIN, ACK] Seq=9 Ack=100000001 Win=686400 Len=0 TSval=1508945 TSecr=27001520
185.288098     10.0.1.3 -> 10.0.1.2     TCP 66 glrpc > 48652 [ACK] Seq=100000001 Ack=10 Win=5824 Len=0 TSval=27001537 TSecr=1508945
190.253197     10.0.1.2 -> 10.0.1.3     TCP 74 48653 > glrpc [SYN] Seq=0 Win=14600 Len=0 MSS=1460 SACK_PERM=1 TSval=1510195 TSecr=0 WS=64
190.253524     10.0.1.3 -> 10.0.1.2     TCP 74 glrpc > 48653 [SYN, ACK] Seq=0 Ack=1 Win=5792 Len=0 MSS=1460 SACK_PERM=1 TSval=27002778 TSecr=1510195 WS=64
190.253539     10.0.1.2 -> 10.0.1.3     TCP 66 48653 > glrpc [ACK] Seq=1 Ack=1 Win=14656 Len=0 TSval=1510196 TSecr=27002778
198.854813     10.0.1.2 -> 10.0.1.3     TCP 66 48653 > glrpc [FIN, ACK] Seq=9 Ack=100000001 Win=697984 Len=0 TSval=1512346 TSecr=27004920
198.893635     10.0.1.3 -> 10.0.1.2     TCP 66 glrpc > 48653 [ACK] Seq=100000001 Ack=10 Win=5824 Len=0 TSval=27004938 TSecr=1512346
203.856372     10.0.1.2 -> 10.0.1.3     TCP 74 48655 > glrpc [SYN] Seq=0 Win=14600 Len=0 MSS=1460 SACK_PERM=1 TSval=1513596 TSecr=0 WS=64
203.856674     10.0.1.3 -> 10.0.1.2     TCP 74 glrpc > 48655 [SYN, ACK] Seq=0 Ack=1 Win=5792 Len=0 MSS=1460 SACK_PERM=1 TSval=27006178 TSecr=1513596 WS=64
203.856690     10.0.1.2 -> 10.0.1.3     TCP 66 48655 > glrpc [ACK] Seq=1 Ack=1 Win=14656 Len=0 TSval=1513596 TSecr=27006178
212.446793     10.0.1.2 -> 10.0.1.3     TCP 66 48655 > glrpc [FIN, ACK] Seq=9 Ack=100000001 Win=718208 Len=0 TSval=1515744 TSecr=27008318
212.486684     10.0.1.3 -> 10.0.1.2     TCP 66 glrpc > 48655 [ACK] Seq=100000001 Ack=10 Win=5824 Len=0 TSval=27008336 TSecr=1515744
217.466724     10.0.1.2 -> 10.0.1.3     TCP 74 48657 > glrpc [SYN] Seq=0 Win=14600 Len=0 MSS=1460 SACK_PERM=1 TSval=1516999 TSecr=0 WS=64
217.467052     10.0.1.3 -> 10.0.1.2     TCP 74 glrpc > 48657 [SYN, ACK] Seq=0 Ack=1 Win=5792 Len=0 MSS=1460 SACK_PERM=1 TSval=27009581 TSecr=1516999 WS=64
217.467069     10.0.1.2 -> 10.0.1.3     TCP 66 48657 > glrpc [ACK] Seq=1 Ack=1 Win=14656 Len=0 TSval=1516999 TSecr=27009581
226.072947     10.0.1.2 -> 10.0.1.3     TCP 66 48657 > glrpc [FIN, ACK] Seq=9 Ack=100000001 Win=660288 Len=0 TSval=1519150 TSecr=27011724
226.110712     10.0.1.3 -> 10.0.1.2     TCP 66 glrpc > 48657 [ACK] Seq=100000001 Ack=10 Win=5824 Len=0 TSval=27011742 TSecr=1519150
231.074404     10.0.1.2 -> 10.0.1.3     TCP 74 48658 > glrpc [SYN] Seq=0 Win=14600 Len=0 MSS=1460 SACK_PERM=1 TSval=1520401 TSecr=0 WS=64
231.074691     10.0.1.3 -> 10.0.1.2     TCP 74 glrpc > 48658 [SYN, ACK] Seq=0 Ack=1 Win=5792 Len=0 MSS=1460 SACK_PERM=1 TSval=27012982 TSecr=1520401 WS=64
231.074706     10.0.1.2 -> 10.0.1.3     TCP 66 48658 > glrpc [ACK] Seq=1 Ack=1 Win=14656 Len=0 TSval=1520401 TSecr=27012982
239.696420     10.0.1.2 -> 10.0.1.3     TCP 66 48658 > glrpc [FIN, ACK] Seq=9 Ack=100000001 Win=752960 Len=0 TSval=1522556 TSecr=27015130
239.736682     10.0.1.3 -> 10.0.1.2     TCP 66 glrpc > 48658 [ACK] Seq=100000001 Ack=10 Win=5824 Len=0 TSval=27015148 TSecr=1522556
244.830488     10.0.1.2 -> 10.0.1.3     TCP 74 48661 > glrpc [SYN] Seq=0 Win=14600 Len=0 MSS=1460 SACK_PERM=1 TSval=1523840 TSecr=0 WS=64
244.830774     10.0.1.3 -> 10.0.1.2     TCP 74 glrpc > 48661 [SYN, ACK] Seq=0 Ack=1 Win=5792 Len=0 MSS=1460 SACK_PERM=1 TSval=27016421 TSecr=1523840 WS=64
244.830787     10.0.1.2 -> 10.0.1.3     TCP 66 48661 > glrpc [ACK] Seq=1 Ack=1 Win=14656 Len=0 TSval=1523840 TSecr=27016421
253.456673     10.0.1.2 -> 10.0.1.3     TCP 66 48661 > glrpc [FIN, ACK] Seq=9 Ack=100000001 Win=726912 Len=0 TSval=1525996 TSecr=27018570
253.497776     10.0.1.3 -> 10.0.1.2     TCP 66 glrpc > 48661 [ACK] Seq=100000001 Ack=10 Win=5824 Len=0 TSval=27018588 TSecr=1525996
258.480130     10.0.1.2 -> 10.0.1.3     TCP 74 48663 > glrpc [SYN] Seq=0 Win=14600 Len=0 MSS=1460 SACK_PERM=1 TSval=1527252 TSecr=0 WS=64
258.480419     10.0.1.3 -> 10.0.1.2     TCP 74 glrpc > 48663 [SYN, ACK] Seq=0 Ack=1 Win=5792 Len=0 MSS=1460 SACK_PERM=1 TSval=27019833 TSecr=1527252 WS=64
258.480433     10.0.1.2 -> 10.0.1.3     TCP 66 48663 > glrpc [ACK] Seq=1 Ack=1 Win=14656 Len=0 TSval=1527252 TSecr=27019833
267.055564     10.0.1.2 -> 10.0.1.3     TCP 66 48663 > glrpc [FIN, ACK] Seq=9 Ack=100000001 Win=660288 Len=0 TSval=1529396 TSecr=27021970
267.094753     10.0.1.3 -> 10.0.1.2     TCP 66 glrpc > 48663 [ACK] Seq=100000001 Ack=10 Win=5824 Len=0 TSval=27021987 TSecr=1529396
