  1   0.000000     10.0.1.2 -> 10.0.1.3     TCP 74 50011 > glrpc [SYN] Seq=0 Win=14600 Len=0 MSS=1460 SACK_PERM=1 TSval=4437042 TSecr=0 WS=64
  2   0.000285     10.0.1.3 -> 10.0.1.2     TCP 74 glrpc > 50011 [SYN, ACK] Seq=0 Ack=1 Win=5792 Len=0 MSS=1460 SACK_PERM=1 TSval=29929404 TSecr=4437042 WS=64
  3   0.000296     10.0.1.2 -> 10.0.1.3     TCP 66 50011 > glrpc [ACK] Seq=1 Ack=1 Win=14656 Len=0 TSval=4437042 TSecr=29929404
51833   4.310984     10.0.1.2 -> 10.0.1.3     TCP 66 50011 > glrpc [FIN, ACK] Seq=9 Ack=50000001 Win=376512 Len=0 TSval=4438120 TSecr=29930479
51834   4.349295     10.0.1.3 -> 10.0.1.2     TCP 66 glrpc > 50011 [ACK] Seq=50000001 Ack=10 Win=5824 Len=0 TSval=29930492 TSecr=4438120
  1   0.000000     10.0.1.2 -> 10.0.1.3     TCP 74 50012 > glrpc [SYN] Seq=0 Win=14600 Len=0 MSS=1460 SACK_PERM=1 TSval=4439470 TSecr=0 WS=64
  2   0.000292     10.0.1.3 -> 10.0.1.2     TCP 74 glrpc > 50012 [SYN, ACK] Seq=0 Ack=1 Win=5792 Len=0 MSS=1460 SACK_PERM=1 TSval=29931832 TSecr=4439470 WS=64
  3   0.000306     10.0.1.2 -> 10.0.1.3     TCP 66 50012 > glrpc [ACK] Seq=1 Ack=1 Win=14656 Len=0 TSval=4439470 TSecr=29931832
51822   4.270130     10.0.1.2 -> 10.0.1.3     TCP 66 50012 > glrpc [FIN, ACK] Seq=9 Ack=50000001 Win=350464 Len=0 TSval=4440537 TSecr=29932896
51823   4.311470     10.0.1.3 -> 10.0.1.2     TCP 66 glrpc > 50012 [ACK] Seq=50000001 Ack=10 Win=5824 Len=0 TSval=29932910 TSecr=4440537
  1   0.000000     10.0.1.2 -> 10.0.1.3     TCP 74 50013 > glrpc [SYN] Seq=0 Win=14600 Len=0 MSS=1460 SACK_PERM=1 TSval=4441885 TSecr=0 WS=64
  2   0.000352     10.0.1.3 -> 10.0.1.2     TCP 74 glrpc > 50013 [SYN, ACK] Seq=0 Ack=1 Win=5792 Len=0 MSS=1460 SACK_PERM=1 TSval=29934247 TSecr=4441885 WS=64
  3   0.000368     10.0.1.2 -> 10.0.1.3     TCP 66 50013 > glrpc [ACK] Seq=1 Ack=1 Win=14656 Len=0 TSval=4441885 TSecr=29934247
49371   4.289426     10.0.1.2 -> 10.0.1.3     TCP 66 50013 > glrpc [FIN, ACK] Seq=9 Ack=50000001 Win=367808 Len=0 TSval=4442957 TSecr=29935316
49372   4.327608     10.0.1.3 -> 10.0.1.2     TCP 66 glrpc > 50013 [ACK] Seq=50000001 Ack=10 Win=5824 Len=0 TSval=29935329 TSecr=4442957
  1   0.000000     10.0.1.2 -> 10.0.1.3     TCP 74 50015 > glrpc [SYN] Seq=0 Win=14600 Len=0 MSS=1460 SACK_PERM=1 TSval=4444353 TSecr=0 WS=64
  2   0.000266     10.0.1.3 -> 10.0.1.2     TCP 74 glrpc > 50015 [SYN, ACK] Seq=0 Ack=1 Win=5792 Len=0 MSS=1460 SACK_PERM=1 TSval=29936715 TSecr=4444353 WS=64
  3   0.000281     10.0.1.2 -> 10.0.1.3     TCP 66 50015 > glrpc [ACK] Seq=1 Ack=1 Win=14656 Len=0 TSval=4444353 TSecr=29936715
51847   4.292152     10.0.1.2 -> 10.0.1.3     TCP 66 50015 > glrpc [FIN, ACK] Seq=9 Ack=50000001 Win=362048 Len=0 TSval=4445426 TSecr=29937784
51848   4.330053     10.0.1.3 -> 10.0.1.2     TCP 66 glrpc > 50015 [ACK] Seq=50000001 Ack=10 Win=5824 Len=0 TSval=29937798 TSecr=4445426
  1   0.000000     10.0.1.2 -> 10.0.1.3     TCP 74 50017 > glrpc [SYN] Seq=0 Win=14600 Len=0 MSS=1460 SACK_PERM=1 TSval=4446723 TSecr=0 WS=64
  2   0.000297     10.0.1.3 -> 10.0.1.2     TCP 74 glrpc > 50017 [SYN, ACK] Seq=0 Ack=1 Win=5792 Len=0 MSS=1460 SACK_PERM=1 TSval=29939085 TSecr=4446723 WS=64
  3   0.000309     10.0.1.2 -> 10.0.1.3     TCP 66 50017 > glrpc [ACK] Seq=1 Ack=1 Win=14656 Len=0 TSval=4446723 TSecr=29939085
51528   4.347472     10.0.1.2 -> 10.0.1.3     TCP 66 50017 > glrpc [FIN, ACK] Seq=9 Ack=50000001 Win=367808 Len=0 TSval=4447810 TSecr=29940168
51529   4.385668     10.0.1.3 -> 10.0.1.2     TCP 66 glrpc > 50017 [ACK] Seq=50000001 Ack=10 Win=5824 Len=0 TSval=29940182 TSecr=4447810
  1   0.000000     10.0.1.2 -> 10.0.1.3     TCP 74 50018 > glrpc [SYN] Seq=0 Win=14600 Len=0 MSS=1460 SACK_PERM=1 TSval=4449123 TSecr=0 WS=64
  2   0.000290     10.0.1.3 -> 10.0.1.2     TCP 74 glrpc > 50018 [SYN, ACK] Seq=0 Ack=1 Win=5792 Len=0 MSS=1460 SACK_PERM=1 TSval=29941485 TSecr=4449123 WS=64
  3   0.000305     10.0.1.2 -> 10.0.1.3     TCP 66 50018 > glrpc [ACK] Seq=1 Ack=1 Win=14656 Len=0 TSval=4449124 TSecr=29941485
51799   4.368735     10.0.1.2 -> 10.0.1.3     TCP 66 50018 > glrpc [FIN, ACK] Seq=9 Ack=50000001 Win=376512 Len=0 TSval=4450216 TSecr=29942573
51800   4.406114     10.0.1.3 -> 10.0.1.2     TCP 66 glrpc > 50018 [ACK] Seq=50000001 Ack=10 Win=5824 Len=0 TSval=29942587 TSecr=4450216
  1   0.000000     10.0.1.2 -> 10.0.1.3     TCP 74 50019 > glrpc [SYN] Seq=0 Win=14600 Len=0 MSS=1460 SACK_PERM=1 TSval=4451572 TSecr=0 WS=64
  2   0.000311     10.0.1.3 -> 10.0.1.2     TCP 74 glrpc > 50019 [SYN, ACK] Seq=0 Ack=1 Win=5792 Len=0 MSS=1460 SACK_PERM=1 TSval=29943933 TSecr=4451572 WS=64
  3   0.000331     10.0.1.2 -> 10.0.1.3     TCP 66 50019 > glrpc [ACK] Seq=1 Ack=1 Win=14656 Len=0 TSval=4451572 TSecr=29943933
51841   4.387146     10.0.1.2 -> 10.0.1.3     TCP 66 50019 > glrpc [FIN, ACK] Seq=9 Ack=50000001 Win=382272 Len=0 TSval=4452669 TSecr=29945027
51842   4.425414     10.0.1.3 -> 10.0.1.2     TCP 66 glrpc > 50019 [ACK] Seq=50000001 Ack=10 Win=5824 Len=0 TSval=29945040 TSecr=4452669
  1   0.000000     10.0.1.2 -> 10.0.1.3     TCP 74 50020 > glrpc [SYN] Seq=0 Win=14600 Len=0 MSS=1460 SACK_PERM=1 TSval=4453996 TSecr=0 WS=64
  2   0.000300     10.0.1.3 -> 10.0.1.2     TCP 74 glrpc > 50020 [SYN, ACK] Seq=0 Ack=1 Win=5792 Len=0 MSS=1460 SACK_PERM=1 TSval=29946357 TSecr=4453996 WS=64
  3   0.000316     10.0.1.2 -> 10.0.1.3     TCP 66 50020 > glrpc [ACK] Seq=1 Ack=1 Win=14656 Len=0 TSval=4453996 TSecr=29946357
51838   4.376297     10.0.1.2 -> 10.0.1.3     TCP 66 50020 > glrpc [FIN, ACK] Seq=9 Ack=50000001 Win=367808 Len=0 TSval=4455090 TSecr=29947447
51839   4.414628     10.0.1.3 -> 10.0.1.2     TCP 66 glrpc > 50020 [ACK] Seq=50000001 Ack=10 Win=5824 Len=0 TSval=29947461 TSecr=4455090
  1   0.000000     10.0.1.2 -> 10.0.1.3     TCP 74 50022 > glrpc [SYN] Seq=0 Win=14600 Len=0 MSS=1460 SACK_PERM=1 TSval=4456405 TSecr=0 WS=64
  2   0.000329     10.0.1.3 -> 10.0.1.2     TCP 74 glrpc > 50022 [SYN, ACK] Seq=0 Ack=1 Win=5792 Len=0 MSS=1460 SACK_PERM=1 TSval=29948766 TSecr=4456405 WS=64
  3   0.000344     10.0.1.2 -> 10.0.1.3     TCP 66 50022 > glrpc [ACK] Seq=1 Ack=1 Win=14656 Len=0 TSval=4456405 TSecr=29948766
48313   4.374806     10.0.1.2 -> 10.0.1.3     TCP 66 50022 > glrpc [FIN, ACK] Seq=9 Ack=50000001 Win=364928 Len=0 TSval=4457498 TSecr=29949855
48314   4.411611     10.0.1.3 -> 10.0.1.2     TCP 66 glrpc > 50022 [ACK] Seq=50000001 Ack=10 Win=5824 Len=0 TSval=29949869 TSecr=4457498
  1   0.000000     10.0.1.2 -> 10.0.1.3     TCP 74 50023 > glrpc [SYN] Seq=0 Win=14600 Len=0 MSS=1460 SACK_PERM=1 TSval=4458876 TSecr=0 WS=64
  2   0.000298     10.0.1.3 -> 10.0.1.2     TCP 74 glrpc > 50023 [SYN, ACK] Seq=0 Ack=1 Win=5792 Len=0 MSS=1460 SACK_PERM=1 TSval=29951237 TSecr=4458876 WS=64
  3   0.000315     10.0.1.2 -> 10.0.1.3     TCP 66 50023 > glrpc [ACK] Seq=1 Ack=1 Win=14656 Len=0 TSval=4458876 TSecr=29951237
51834   4.360990     10.0.1.2 -> 10.0.1.3     TCP 66 50023 > glrpc [FIN, ACK] Seq=9 Ack=50000001 Win=376512 Len=0 TSval=4459967 TSecr=29952324
51835   4.397515     10.0.1.3 -> 10.0.1.2     TCP 66 glrpc > 50023 [ACK] Seq=50000001 Ack=10 Win=5824 Len=0 TSval=29952337 TSecr=4459967
  1   0.000000     10.0.1.2 -> 10.0.1.3     TCP 74 50024 > glrpc [SYN] Seq=0 Win=14600 Len=0 MSS=1460 SACK_PERM=1 TSval=4461444 TSecr=0 WS=64
  2   0.000324     10.0.1.3 -> 10.0.1.2     TCP 74 glrpc > 50024 [SYN, ACK] Seq=0 Ack=1 Win=5792 Len=0 MSS=1460 SACK_PERM=1 TSval=29953804 TSecr=4461444 WS=64
  3   0.000340     10.0.1.2 -> 10.0.1.3     TCP 66 50024 > glrpc [ACK] Seq=1 Ack=1 Win=14656 Len=0 TSval=4461444 TSecr=29953804
51858   4.377189     10.0.1.2 -> 10.0.1.3     TCP 66 50024 > glrpc [FIN, ACK] Seq=9 Ack=50000001 Win=376512 Len=0 TSval=4462538 TSecr=29954895
51859   4.417113     10.0.1.3 -> 10.0.1.2     TCP 66 glrpc > 50024 [ACK] Seq=50000001 Ack=10 Win=5824 Len=0 TSval=29954909 TSecr=4462538
  1   0.000000     10.0.1.2 -> 10.0.1.3     TCP 74 50026 > glrpc [SYN] Seq=0 Win=14600 Len=0 MSS=1460 SACK_PERM=1 TSval=4463845 TSecr=0 WS=64
  2   0.000405     10.0.1.3 -> 10.0.1.2     TCP 74 glrpc > 50026 [SYN, ACK] Seq=0 Ack=1 Win=5792 Len=0 MSS=1460 SACK_PERM=1 TSval=29956206 TSecr=4463845 WS=64
  3   0.000423     10.0.1.2 -> 10.0.1.3     TCP 66 50026 > glrpc [ACK] Seq=1 Ack=1 Win=14656 Len=0 TSval=4463846 TSecr=29956206
51859   4.341045     10.0.1.2 -> 10.0.1.3     TCP 66 50026 > glrpc [FIN, ACK] Seq=9 Ack=50000001 Win=373632 Len=0 TSval=4464931 TSecr=29957288
51860   4.378629     10.0.1.3 -> 10.0.1.2     TCP 66 glrpc > 50026 [ACK] Seq=50000001 Ack=10 Win=5824 Len=0 TSval=29957301 TSecr=4464931
  1   0.000000     10.0.1.2 -> 10.0.1.3     TCP 74 50029 > glrpc [SYN] Seq=0 Win=14600 Len=0 MSS=1460 SACK_PERM=1 TSval=4466243 TSecr=0 WS=64
  2   0.000284     10.0.1.3 -> 10.0.1.2     TCP 74 glrpc > 50029 [SYN, ACK] Seq=0 Ack=1 Win=5792 Len=0 MSS=1460 SACK_PERM=1 TSval=29958603 TSecr=4466243 WS=64
  3   0.000304     10.0.1.2 -> 10.0.1.3     TCP 66 50029 > glrpc [ACK] Seq=1 Ack=1 Win=14656 Len=0 TSval=4466243 TSecr=29958603
  1   0.000000     10.0.1.2 -> 10.0.1.3     TCP 74 50030 > glrpc [SYN] Seq=0 Win=14600 Len=0 MSS=1460 SACK_PERM=1 TSval=4468616 TSecr=0 WS=64
  2   0.000333     10.0.1.3 -> 10.0.1.2     TCP 74 glrpc > 50030 [SYN, ACK] Seq=0 Ack=1 Win=5792 Len=0 MSS=1460 SACK_PERM=1 TSval=29960977 TSecr=4468616 WS=64
  3   0.000352     10.0.1.2 -> 10.0.1.3     TCP 66 50030 > glrpc [ACK] Seq=1 Ack=1 Win=14656 Len=0 TSval=4468616 TSecr=29960977
51805   4.348960     10.0.1.2 -> 10.0.1.3     TCP 66 50030 > glrpc [FIN, ACK] Seq=9 Ack=50000001 Win=376512 Len=0 TSval=4469704 TSecr=29962060
51806   4.389580     10.0.1.3 -> 10.0.1.2     TCP 66 glrpc > 50030 [ACK] Seq=50000001 Ack=10 Win=5824 Len=0 TSval=29962074 TSecr=4469704
  1   0.000000     10.0.1.2 -> 10.0.1.3     TCP 74 50031 > glrpc [SYN] Seq=0 Win=14600 Len=0 MSS=1460 SACK_PERM=1 TSval=4471025 TSecr=0 WS=64
  2   0.000287     10.0.1.3 -> 10.0.1.2     TCP 74 glrpc > 50031 [SYN, ACK] Seq=0 Ack=1 Win=5792 Len=0 MSS=1460 SACK_PERM=1 TSval=29963385 TSecr=4471025 WS=64
  3   0.000301     10.0.1.2 -> 10.0.1.3     TCP 66 50031 > glrpc [ACK] Seq=1 Ack=1 Win=14656 Len=0 TSval=4471025 TSecr=29963385
51822   4.370674     10.0.1.2 -> 10.0.1.3     TCP 66 50031 > glrpc [FIN, ACK] Seq=9 Ack=50000001 Win=376512 Len=0 TSval=4472117 TSecr=29964474
51823   4.407600     10.0.1.3 -> 10.0.1.2     TCP 66 glrpc > 50031 [ACK] Seq=50000001 Ack=10 Win=5824 Len=0 TSval=29964487 TSecr=4472117
  1   0.000000     10.0.1.2 -> 10.0.1.3     TCP 74 50033 > glrpc [SYN] Seq=0 Win=14600 Len=0 MSS=1460 SACK_PERM=1 TSval=4473494 TSecr=0 WS=64
  2   0.000329     10.0.1.3 -> 10.0.1.2     TCP 74 glrpc > 50033 [SYN, ACK] Seq=0 Ack=1 Win=5792 Len=0 MSS=1460 SACK_PERM=1 TSval=29965854 TSecr=4473494 WS=64
  3   0.000347     10.0.1.2 -> 10.0.1.3     TCP 66 50033 > glrpc [ACK] Seq=1 Ack=1 Win=14656 Len=0 TSval=4473494 TSecr=29965854
51802   4.395066     10.0.1.2 -> 10.0.1.3     TCP 66 50033 > glrpc [FIN, ACK] Seq=9 Ack=50000001 Win=393856 Len=0 TSval=4474593 TSecr=29966948
51803   4.435055     10.0.1.3 -> 10.0.1.2     TCP 66 glrpc > 50033 [ACK] Seq=50000001 Ack=10 Win=5824 Len=0 TSval=29966963 TSecr=4474593
  1   0.000000     10.0.1.2 -> 10.0.1.3     TCP 74 50034 > glrpc [SYN] Seq=0 Win=14600 Len=0 MSS=1460 SACK_PERM=1 TSval=4475897 TSecr=0 WS=64
  2   0.000288     10.0.1.3 -> 10.0.1.2     TCP 74 glrpc > 50034 [SYN, ACK] Seq=0 Ack=1 Win=5792 Len=0 MSS=1460 SACK_PERM=1 TSval=29968257 TSecr=4475897 WS=64
  3   0.000308     10.0.1.2 -> 10.0.1.3     TCP 66 50034 > glrpc [ACK] Seq=1 Ack=1 Win=14656 Len=0 TSval=4475897 TSecr=29968257
51837   4.329592     10.0.1.2 -> 10.0.1.3     TCP 66 50034 > glrpc [FIN, ACK] Seq=9 Ack=50000001 Win=350464 Len=0 TSval=4476980 TSecr=29969335
51838   4.367411     10.0.1.3 -> 10.0.1.2     TCP 66 glrpc > 50034 [ACK] Seq=50000001 Ack=10 Win=5824 Len=0 TSval=29969349 TSecr=4476980
  1   0.000000     10.0.1.2 -> 10.0.1.3     TCP 74 50035 > glrpc [SYN] Seq=0 Win=14600 Len=0 MSS=1460 SACK_PERM=1 TSval=4478288 TSecr=0 WS=64
  2   0.000291     10.0.1.3 -> 10.0.1.2     TCP 74 glrpc > 50035 [SYN, ACK] Seq=0 Ack=1 Win=5792 Len=0 MSS=1460 SACK_PERM=1 TSval=29970648 TSecr=4478288 WS=64
  3   0.000307     10.0.1.2 -> 10.0.1.3     TCP 66 50035 > glrpc [ACK] Seq=1 Ack=1 Win=14656 Len=0 TSval=4478288 TSecr=29970648
51841   4.387417     10.0.1.2 -> 10.0.1.3     TCP 66 50035 > glrpc [FIN, ACK] Seq=9 Ack=50000001 Win=373632 Len=0 TSval=4479385 TSecr=29971740
51842   4.424533     10.0.1.3 -> 10.0.1.2     TCP 66 glrpc > 50035 [ACK] Seq=50000001 Ack=10 Win=5824 Len=0 TSval=29971754 TSecr=4479385
  1   0.000000     10.0.1.2 -> 10.0.1.3     TCP 74 50038 > glrpc [SYN] Seq=0 Win=14600 Len=0 MSS=1460 SACK_PERM=1 TSval=4480694 TSecr=0 WS=64
  2   0.000292     10.0.1.3 -> 10.0.1.2     TCP 74 glrpc > 50038 [SYN, ACK] Seq=0 Ack=1 Win=5792 Len=0 MSS=1460 SACK_PERM=1 TSval=29973053 TSecr=4480694 WS=64
  3   0.000310     10.0.1.2 -> 10.0.1.3     TCP 66 50038 > glrpc [ACK] Seq=1 Ack=1 Win=14656 Len=0 TSval=4480694 TSecr=29973053
51852   4.385236     10.0.1.2 -> 10.0.1.3     TCP 66 50038 > glrpc [FIN, ACK] Seq=9 Ack=50000001 Win=364928 Len=0 TSval=4481790 TSecr=29974145
51853   4.422710     10.0.1.3 -> 10.0.1.2     TCP 66 glrpc > 50038 [ACK] Seq=50000001 Ack=10 Win=5824 Len=0 TSval=29974159 TSecr=4481790
  1   0.000000     10.0.1.2 -> 10.0.1.3     TCP 74 50039 > glrpc [SYN] Seq=0 Win=14600 Len=0 MSS=1460 SACK_PERM=1 TSval=4483092 TSecr=0 WS=64
  2   0.000326     10.0.1.3 -> 10.0.1.2     TCP 74 glrpc > 50039 [SYN, ACK] Seq=0 Ack=1 Win=5792 Len=0 MSS=1460 SACK_PERM=1 TSval=29975451 TSecr=4483092 WS=64
  3   0.000343     10.0.1.2 -> 10.0.1.3     TCP 66 50039 > glrpc [ACK] Seq=1 Ack=1 Win=14656 Len=0 TSval=4483092 TSecr=29975451
51848   4.372726     10.0.1.2 -> 10.0.1.3     TCP 66 50039 > glrpc [FIN, ACK] Seq=9 Ack=50000001 Win=376512 Len=0 TSval=4484185 TSecr=29976541
51849   4.410797     10.0.1.3 -> 10.0.1.2     TCP 66 glrpc > 50039 [ACK] Seq=50000001 Ack=10 Win=5824 Len=0 TSval=29976554 TSecr=4484185
