  1   0.000000     10.0.1.2 -> 10.0.1.3     TCP 74 50081 > glrpc [SYN] Seq=0 Win=14600 Len=0 MSS=1460 SACK_PERM=1 TSval=4569479 TSecr=0 WS=64
  2   0.000315     10.0.1.3 -> 10.0.1.2     TCP 74 glrpc > 50081 [SYN, ACK] Seq=0 Ack=1 Win=5792 Len=0 MSS=1460 SACK_PERM=1 TSval=30061832 TSecr=4569479 WS=64
  3   0.000358     10.0.1.2 -> 10.0.1.3     TCP 66 50081 > glrpc [ACK] Seq=1 Ack=1 Win=14656 Len=0 TSval=4569479 TSecr=30061832
155585  12.841422     10.0.1.2 -> 10.0.1.3     TCP 66 50081 > glrpc [FIN, ACK] Seq=9 Ack=150000001 Win=2293632 Len=0 TSval=4572690 TSecr=30065017
155586  12.879420     10.0.1.3 -> 10.0.1.2     TCP 66 glrpc > 50081 [ACK] Seq=150000001 Ack=10 Win=5824 Len=0 TSval=30065052 TSecr=4572690
  1   0.000000     10.0.1.2 -> 10.0.1.3     TCP 74 50085 > glrpc [SYN] Seq=0 Win=14600 Len=0 MSS=1460 SACK_PERM=1 TSval=4576054 TSecr=0 WS=64
  2   0.000332     10.0.1.3 -> 10.0.1.2     TCP 74 glrpc > 50085 [SYN, ACK] Seq=0 Ack=1 Win=5792 Len=0 MSS=1460 SACK_PERM=1 TSval=30068406 TSecr=4576054 WS=64
  3   0.000345     10.0.1.2 -> 10.0.1.3     TCP 66 50085 > glrpc [ACK] Seq=1 Ack=1 Win=14656 Len=0 TSval=4576054 TSecr=30068406
149418  12.794103     10.0.1.2 -> 10.0.1.3     TCP 66 50085 > glrpc [FIN, ACK] Seq=9 Ack=150000001 Win=2270464 Len=0 TSval=4579252 TSecr=30071580
149419  12.832163     10.0.1.3 -> 10.0.1.2     TCP 66 glrpc > 50085 [ACK] Seq=150000001 Ack=10 Win=5824 Len=0 TSval=30071614 TSecr=4579252
  1   0.000000     10.0.1.2 -> 10.0.1.3     TCP 74 50086 > glrpc [SYN] Seq=0 Win=14600 Len=0 MSS=1460 SACK_PERM=1 TSval=4582491 TSecr=0 WS=64
  2   0.000306     10.0.1.3 -> 10.0.1.2     TCP 74 glrpc > 50086 [SYN, ACK] Seq=0 Ack=1 Win=5792 Len=0 MSS=1460 SACK_PERM=1 TSval=30074842 TSecr=4582491 WS=64
  3   0.000321     10.0.1.2 -> 10.0.1.3     TCP 66 50086 > glrpc [ACK] Seq=1 Ack=1 Win=14656 Len=0 TSval=4582491 TSecr=30074842
146370  12.853061     10.0.1.2 -> 10.0.1.3     TCP 66 50086 > glrpc [FIN, ACK] Seq=9 Ack=150000001 Win=2203904 Len=0 TSval=4585704 TSecr=30078031
146371  12.892565     10.0.1.3 -> 10.0.1.2     TCP 66 glrpc > 50086 [ACK] Seq=150000001 Ack=10 Win=5824 Len=0 TSval=30078066 TSecr=4585704
  1   0.000000     10.0.1.2 -> 10.0.1.3     TCP 74 50087 > glrpc [SYN] Seq=0 Win=14600 Len=0 MSS=1460 SACK_PERM=1 TSval=4588578 TSecr=0 WS=64
  2   0.000335     10.0.1.3 -> 10.0.1.2     TCP 74 glrpc > 50087 [SYN, ACK] Seq=0 Ack=1 Win=5792 Len=0 MSS=1460 SACK_PERM=1 TSval=30080929 TSecr=4588578 WS=64
  3   0.000352     10.0.1.2 -> 10.0.1.3     TCP 66 50087 > glrpc [ACK] Seq=1 Ack=1 Win=14656 Len=0 TSval=4588578 TSecr=30080929
150181  12.924216     10.0.1.2 -> 10.0.1.3     TCP 66 50087 > glrpc [FIN, ACK] Seq=9 Ack=150000001 Win=2351552 Len=0 TSval=4591809 TSecr=30084135
150182  12.962730     10.0.1.3 -> 10.0.1.2     TCP 66 glrpc > 50087 [ACK] Seq=150000001 Ack=10 Win=5824 Len=0 TSval=30084170 TSecr=4591809
  1   0.000000     10.0.1.2 -> 10.0.1.3     TCP 74 50089 > glrpc [SYN] Seq=0 Win=14600 Len=0 MSS=1460 SACK_PERM=1 TSval=4595226 TSecr=0 WS=64
  2   0.000325     10.0.1.3 -> 10.0.1.2     TCP 74 glrpc > 50089 [SYN, ACK] Seq=0 Ack=1 Win=5792 Len=0 MSS=1460 SACK_PERM=1 TSval=30087577 TSecr=4595226 WS=64
  3   0.000337     10.0.1.2 -> 10.0.1.3     TCP 66 50089 > glrpc [ACK] Seq=1 Ack=1 Win=14656 Len=0 TSval=4595227 TSecr=30087577
148198  12.950478     10.0.1.2 -> 10.0.1.3     TCP 66 50089 > glrpc [FIN, ACK] Seq=9 Ack=150000001 Win=2258880 Len=0 TSval=4598464 TSecr=30090788
148199  12.991658     10.0.1.3 -> 10.0.1.2     TCP 66 glrpc > 50089 [ACK] Seq=150000001 Ack=10 Win=5824 Len=0 TSval=30090825 TSecr=4598464
  1   0.000000     10.0.1.2 -> 10.0.1.3     TCP 74 50091 > glrpc [SYN] Seq=0 Win=14600 Len=0 MSS=1460 SACK_PERM=1 TSval=4601453 TSecr=0 WS=64
  2   0.000283     10.0.1.3 -> 10.0.1.2     TCP 74 glrpc > 50091 [SYN, ACK] Seq=0 Ack=1 Win=5792 Len=0 MSS=1460 SACK_PERM=1 TSval=30093803 TSecr=4601453 WS=64
  3   0.000302     10.0.1.2 -> 10.0.1.3     TCP 66 50091 > glrpc [ACK] Seq=1 Ack=1 Win=14656 Len=0 TSval=4601453 TSecr=30093803
155635  12.966022     10.0.1.2 -> 10.0.1.3     TCP 66 50091 > glrpc [FIN, ACK] Seq=9 Ack=150000001 Win=2400832 Len=0 TSval=4604694 TSecr=30097018
155636  13.003236     10.0.1.3 -> 10.0.1.2     TCP 66 glrpc > 50091 [ACK] Seq=150000001 Ack=10 Win=5824 Len=0 TSval=30097054 TSecr=4604694
  1   0.000000     10.0.1.2 -> 10.0.1.3     TCP 74 50093 > glrpc [SYN] Seq=0 Win=14600 Len=0 MSS=1460 SACK_PERM=1 TSval=4607905 TSecr=0 WS=64
  2   0.000305     10.0.1.3 -> 10.0.1.2     TCP 74 glrpc > 50093 [SYN, ACK] Seq=0 Ack=1 Win=5792 Len=0 MSS=1460 SACK_PERM=1 TSval=30100255 TSecr=4607905 WS=64
  3   0.000320     10.0.1.2 -> 10.0.1.3     TCP 66 50093 > glrpc [ACK] Seq=1 Ack=1 Win=14656 Len=0 TSval=4607905 TSecr=30100255
154205  12.927537     10.0.1.2 -> 10.0.1.3     TCP 66 50093 > glrpc [FIN, ACK] Seq=9 Ack=150000001 Win=2319744 Len=0 TSval=4611137 TSecr=30103461
154206  12.968682     10.0.1.3 -> 10.0.1.2     TCP 66 glrpc > 50093 [ACK] Seq=150000001 Ack=10 Win=5824 Len=0 TSval=30103497 TSecr=4611137
  1   0.000000     10.0.1.2 -> 10.0.1.3     TCP 74 50096 > glrpc [SYN] Seq=0 Win=14600 Len=0 MSS=1460 SACK_PERM=1 TSval=4614498 TSecr=0 WS=64
  2   0.000325     10.0.1.3 -> 10.0.1.2     TCP 74 glrpc > 50096 [SYN, ACK] Seq=0 Ack=1 Win=5792 Len=0 MSS=1460 SACK_PERM=1 TSval=30106847 TSecr=4614498 WS=64
  3   0.000340     10.0.1.2 -> 10.0.1.3     TCP 66 50096 > glrpc [ACK] Seq=1 Ack=1 Win=14656 Len=0 TSval=4614498 TSecr=30106847
154139  12.934513     10.0.1.2 -> 10.0.1.3     TCP 66 50096 > glrpc [FIN, ACK] Seq=9 Ack=150000001 Win=2354496 Len=0 TSval=4617732 TSecr=30110055
154140  12.974264     10.0.1.3 -> 10.0.1.2     TCP 66 glrpc > 50096 [ACK] Seq=150000001 Ack=10 Win=5824 Len=0 TSval=30110091 TSecr=4617732
  1   0.000000     10.0.1.2 -> 10.0.1.3     TCP 74 50097 > glrpc [SYN] Seq=0 Win=14600 Len=0 MSS=1460 SACK_PERM=1 TSval=4622065 TSecr=0 WS=64
  2   0.000287     10.0.1.3 -> 10.0.1.2     TCP 74 glrpc > 50097 [SYN, ACK] Seq=0 Ack=1 Win=5792 Len=0 MSS=1460 SACK_PERM=1 TSval=30114413 TSecr=4622065 WS=64
  3   0.000308     10.0.1.2 -> 10.0.1.3     TCP 66 50097 > glrpc [ACK] Seq=1 Ack=1 Win=14656 Len=0 TSval=4622065 TSecr=30114413
149772  12.988833     10.0.1.2 -> 10.0.1.3     TCP 66 50097 > glrpc [FIN, ACK] Seq=9 Ack=150000001 Win=2305216 Len=0 TSval=4625312 TSecr=30117635
149773  13.026846     10.0.1.3 -> 10.0.1.2     TCP 66 glrpc > 50097 [ACK] Seq=150000001 Ack=10 Win=5824 Len=0 TSval=30117670 TSecr=4625312
  1   0.000000     10.0.1.2 -> 10.0.1.3     TCP 74 50099 > glrpc [SYN] Seq=0 Win=14600 Len=0 MSS=1460 SACK_PERM=1 TSval=4629708 TSecr=0 WS=64
  2   0.000294     10.0.1.3 -> 10.0.1.2     TCP 74 glrpc > 50099 [SYN, ACK] Seq=0 Ack=1 Win=5792 Len=0 MSS=1460 SACK_PERM=1 TSval=30122056 TSecr=4629708 WS=64
  3   0.000311     10.0.1.2 -> 10.0.1.3     TCP 66 50099 > glrpc [ACK] Seq=1 Ack=1 Win=14656 Len=0 TSval=4629708 TSecr=30122056
155642  13.043216     10.0.1.2 -> 10.0.1.3     TCP 66 50099 > glrpc [FIN, ACK] Seq=9 Ack=150000001 Win=2354496 Len=0 TSval=4632969 TSecr=30125291
155643  13.082926     10.0.1.3 -> 10.0.1.2     TCP 66 glrpc > 50099 [ACK] Seq=150000001 Ack=10 Win=5824 Len=0 TSval=30125327 TSecr=4632969
  1   0.000000     10.0.1.2 -> 10.0.1.3     TCP 74 50101 > glrpc [SYN] Seq=0 Win=14600 Len=0 MSS=1460 SACK_PERM=1 TSval=4638155 TSecr=0 WS=64
  2   0.000303     10.0.1.3 -> 10.0.1.2     TCP 74 glrpc > 50101 [SYN, ACK] Seq=0 Ack=1 Win=5792 Len=0 MSS=1460 SACK_PERM=1 TSval=30130503 TSecr=4638155 WS=64
  3   0.000321     10.0.1.2 -> 10.0.1.3     TCP 66 50101 > glrpc [ACK] Seq=1 Ack=1 Win=14656 Len=0 TSval=4638155 TSecr=30130503
145234  12.954576     10.0.1.2 -> 10.0.1.3     TCP 66 50101 > glrpc [FIN, ACK] Seq=9 Ack=150000001 Win=2305216 Len=0 TSval=4641394 TSecr=30133716
145235  12.992867     10.0.1.3 -> 10.0.1.2     TCP 66 glrpc > 50101 [ACK] Seq=150000001 Ack=10 Win=5824 Len=0 TSval=30133751 TSecr=4641394
  1   0.000000     10.0.1.2 -> 10.0.1.3     TCP 74 50103 > glrpc [SYN] Seq=0 Win=14600 Len=0 MSS=1460 SACK_PERM=1 TSval=4645568 TSecr=0 WS=64
  2   0.000300     10.0.1.3 -> 10.0.1.2     TCP 74 glrpc > 50103 [SYN, ACK] Seq=0 Ack=1 Win=5792 Len=0 MSS=1460 SACK_PERM=1 TSval=30137915 TSecr=4645568 WS=64
  3   0.000321     10.0.1.2 -> 10.0.1.3     TCP 66 50103 > glrpc [ACK] Seq=1 Ack=1 Win=14656 Len=0 TSval=4645568 TSecr=30137915
142469  12.982644     10.0.1.2 -> 10.0.1.3     TCP 66 50103 > glrpc [FIN, ACK] Seq=9 Ack=150000001 Win=2299456 Len=0 TSval=4648813 TSecr=30141133
142470  13.021405     10.0.1.3 -> 10.0.1.2     TCP 66 glrpc > 50103 [ACK] Seq=150000001 Ack=10 Win=5824 Len=0 TSval=30141170 TSecr=4648813
  1   0.000000     10.0.1.2 -> 10.0.1.3     TCP 74 50104 > glrpc [SYN] Seq=0 Win=14600 Len=0 MSS=1460 SACK_PERM=1 TSval=4651542 TSecr=0 WS=64
  2   0.000303     10.0.1.3 -> 10.0.1.2     TCP 74 glrpc > 50104 [SYN, ACK] Seq=0 Ack=1 Win=5792 Len=0 MSS=1460 SACK_PERM=1 TSval=30143889 TSecr=4651542 WS=64
  3   0.000319     10.0.1.2 -> 10.0.1.3     TCP 66 50104 > glrpc [ACK] Seq=1 Ack=1 Win=14656 Len=0 TSval=4651543 TSecr=30143889
155619  12.929082     10.0.1.2 -> 10.0.1.3     TCP 66 50104 > glrpc [FIN, ACK] Seq=9 Ack=150000001 Win=2313920 Len=0 TSval=4654775 TSecr=30147096
155620  12.968622     10.0.1.3 -> 10.0.1.2     TCP 66 glrpc > 50104 [ACK] Seq=150000001 Ack=10 Win=5824 Len=0 TSval=30147131 TSecr=4654775
  1   0.000000     10.0.1.2 -> 10.0.1.3     TCP 74 50106 > glrpc [SYN] Seq=0 Win=14600 Len=0 MSS=1460 SACK_PERM=1 TSval=4658006 TSecr=0 WS=64
  2   0.000292     10.0.1.3 -> 10.0.1.2     TCP 74 glrpc > 50106 [SYN, ACK] Seq=0 Ack=1 Win=5792 Len=0 MSS=1460 SACK_PERM=1 TSval=30150352 TSecr=4658006 WS=64
  3   0.000312     10.0.1.2 -> 10.0.1.3     TCP 66 50106 > glrpc [ACK] Seq=1 Ack=1 Win=14656 Len=0 TSval=4658007 TSecr=30150352
155580  12.948830     10.0.1.2 -> 10.0.1.3     TCP 66 50106 > glrpc [FIN, ACK] Seq=9 Ack=150000001 Win=2322624 Len=0 TSval=4661244 TSecr=30153564
155581  12.985514     10.0.1.3 -> 10.0.1.2     TCP 66 glrpc > 50106 [ACK] Seq=150000001 Ack=10 Win=5824 Len=0 TSval=30153599 TSecr=4661244
  1   0.000000     10.0.1.2 -> 10.0.1.3     TCP 74 50109 > glrpc [SYN] Seq=0 Win=14600 Len=0 MSS=1460 SACK_PERM=1 TSval=4664693 TSecr=0 WS=64
  2   0.000289     10.0.1.3 -> 10.0.1.2     TCP 74 glrpc > 50109 [SYN, ACK] Seq=0 Ack=1 Win=5792 Len=0 MSS=1460 SACK_PERM=1 TSval=30157038 TSecr=4664693 WS=64
  3   0.000304     10.0.1.2 -> 10.0.1.3     TCP 66 50109 > glrpc [ACK] Seq=1 Ack=1 Win=14656 Len=0 TSval=4664693 TSecr=30157038
155595  12.942539     10.0.1.2 -> 10.0.1.3     TCP 66 50109 > glrpc [FIN, ACK] Seq=9 Ack=150000001 Win=2357376 Len=0 TSval=4667928 TSecr=30160247
155596  12.978990     10.0.1.3 -> 10.0.1.2     TCP 66 glrpc > 50109 [ACK] Seq=150000001 Ack=10 Win=5824 Len=0 TSval=30160283 TSecr=4667928
  1   0.000000     10.0.1.2 -> 10.0.1.3     TCP 74 50111 > glrpc [SYN] Seq=0 Win=14600 Len=0 MSS=1460 SACK_PERM=1 TSval=4671299 TSecr=0 WS=64
  2   0.000308     10.0.1.3 -> 10.0.1.2     TCP 74 glrpc > 50111 [SYN, ACK] Seq=0 Ack=1 Win=5792 Len=0 MSS=1460 SACK_PERM=1 TSval=30163644 TSecr=4671299 WS=64
  3   0.000321     10.0.1.2 -> 10.0.1.3     TCP 66 50111 > glrpc [ACK] Seq=1 Ack=1 Win=14656 Len=0 TSval=4671299 TSecr=30163644
143782  12.955140     10.0.1.2 -> 10.0.1.3     TCP 66 50111 > glrpc [FIN, ACK] Seq=9 Ack=150000001 Win=2267584 Len=0 TSval=4674538 TSecr=30166856
143783  12.994546     10.0.1.3 -> 10.0.1.2     TCP 66 glrpc > 50111 [ACK] Seq=150000001 Ack=10 Win=5824 Len=0 TSval=30166893 TSecr=4674538
  1   0.000000     10.0.1.2 -> 10.0.1.3     TCP 74 50113 > glrpc [SYN] Seq=0 Win=14600 Len=0 MSS=1460 SACK_PERM=1 TSval=4677334 TSecr=0 WS=64
  2   0.000284     10.0.1.3 -> 10.0.1.2     TCP 74 glrpc > 50113 [SYN, ACK] Seq=0 Ack=1 Win=5792 Len=0 MSS=1460 SACK_PERM=1 TSval=30169678 TSecr=4677334 WS=64
  3   0.000302     10.0.1.2 -> 10.0.1.3     TCP 66 50113 > glrpc [ACK] Seq=1 Ack=1 Win=14656 Len=0 TSval=4677334 TSecr=30169678
149375  12.943674     10.0.1.2 -> 10.0.1.3     TCP 66 50113 > glrpc [FIN, ACK] Seq=9 Ack=150000001 Win=2354496 Len=0 TSval=4680570 TSecr=30172889
149376  12.982444     10.0.1.3 -> 10.0.1.2     TCP 66 glrpc > 50113 [ACK] Seq=150000001 Ack=10 Win=5824 Len=0 TSval=30172924 TSecr=4680570
  1   0.000000     10.0.1.2 -> 10.0.1.3     TCP 74 50115 > glrpc [SYN] Seq=0 Win=14600 Len=0 MSS=1460 SACK_PERM=1 TSval=4683608 TSecr=0 WS=64
  2   0.000331     10.0.1.3 -> 10.0.1.2     TCP 74 glrpc > 50115 [SYN, ACK] Seq=0 Ack=1 Win=5792 Len=0 MSS=1460 SACK_PERM=1 TSval=30175952 TSecr=4683608 WS=64
  3   0.000351     10.0.1.2 -> 10.0.1.3     TCP 66 50115 > glrpc [ACK] Seq=1 Ack=1 Win=14656 Len=0 TSval=4683608 TSecr=30175952
145303  12.956530     10.0.1.2 -> 10.0.1.3     TCP 66 50115 > glrpc [FIN, ACK] Seq=9 Ack=150000001 Win=2325504 Len=0 TSval=4686847 TSecr=30179164
145304  12.995325     10.0.1.3 -> 10.0.1.2     TCP 66 glrpc > 50115 [ACK] Seq=150000001 Ack=10 Win=5824 Len=0 TSval=30179201 TSecr=4686847
  1   0.000000     10.0.1.2 -> 10.0.1.3     TCP 74 50119 > glrpc [SYN] Seq=0 Win=14600 Len=0 MSS=1460 SACK_PERM=1 TSval=4690001 TSecr=0 WS=64
  2   0.000309     10.0.1.3 -> 10.0.1.2     TCP 74 glrpc > 50119 [SYN, ACK] Seq=0 Ack=1 Win=5792 Len=0 MSS=1460 SACK_PERM=1 TSval=30182345 TSecr=4690001 WS=64
  3   0.000328     10.0.1.2 -> 10.0.1.3     TCP 66 50119 > glrpc [ACK] Seq=1 Ack=1 Win=14656 Len=0 TSval=4690002 TSecr=30182345
155635  12.957647     10.0.1.2 -> 10.0.1.3     TCP 66 50119 > glrpc [FIN, ACK] Seq=9 Ack=150000001 Win=2328384 Len=0 TSval=4693241 TSecr=30185559
155636  12.999189     10.0.1.3 -> 10.0.1.2     TCP 66 glrpc > 50119 [ACK] Seq=150000001 Ack=10 Win=5824 Len=0 TSval=30185594 TSecr=4693241
  1   0.000000     10.0.1.2 -> 10.0.1.3     TCP 74 50120 > glrpc [SYN] Seq=0 Win=14600 Len=0 MSS=1460 SACK_PERM=1 TSval=4696781 TSecr=0 WS=64
  2   0.000344     10.0.1.3 -> 10.0.1.2     TCP 74 glrpc > 50120 [SYN, ACK] Seq=0 Ack=1 Win=5792 Len=0 MSS=1460 SACK_PERM=1 TSval=30189124 TSecr=4696781 WS=64
  3   0.000358     10.0.1.2 -> 10.0.1.3     TCP 66 50120 > glrpc [ACK] Seq=1 Ack=1 Win=14656 Len=0 TSval=4696781 TSecr=30189124
155392  12.794263     10.0.1.2 -> 10.0.1.3     TCP 66 50120 > glrpc [FIN, ACK] Seq=9 Ack=150000001 Win=2235712 Len=0 TSval=4699980 TSecr=30192298
155393  12.834529     10.0.1.3 -> 10.0.1.2     TCP 66 glrpc > 50120 [ACK] Seq=150000001 Ack=10 Win=5824 Len=0 TSval=30192333 TSecr=4699980
