  0.000000     10.0.1.2 -> 10.0.1.3     TCP 74 48830 > glrpc [SYN] Seq=0 Win=14600 Len=0 MSS=1460 SACK_PERM=1 TSval=2049536 TSecr=0 WS=64
  0.000346     10.0.1.3 -> 10.0.1.2     TCP 74 glrpc > 48830 [SYN, ACK] Seq=0 Ack=1 Win=5792 Len=0 MSS=1460 SACK_PERM=1 TSval=27542078 TSecr=2049536 WS=64
  0.000359     10.0.1.2 -> 10.0.1.3     TCP 66 48830 > glrpc [ACK] Seq=1 Ack=1 Win=14656 Len=0 TSval=2049536 TSecr=27542078
 21.435765     10.0.1.2 -> 10.0.1.3     TCP 66 48830 > glrpc [FIN, ACK] Seq=9 Ack=250000001 Win=2994496 Len=0 TSval=2054895 TSecr=27547372
 21.473213     10.0.1.3 -> 10.0.1.2     TCP 66 glrpc > 48830 [ACK] Seq=250000001 Ack=10 Win=5824 Len=0 TSval=27547446 TSecr=2054895
 26.437152     10.0.1.2 -> 10.0.1.3     TCP 74 48831 > glrpc [SYN] Seq=0 Win=14600 Len=0 MSS=1460 SACK_PERM=1 TSval=2056145 TSecr=0 WS=64
 26.437485     10.0.1.3 -> 10.0.1.2     TCP 74 glrpc > 48831 [SYN, ACK] Seq=0 Ack=1 Win=5792 Len=0 MSS=1460 SACK_PERM=1 TSval=27548687 TSecr=2056145 WS=64
 26.437501     10.0.1.2 -> 10.0.1.3     TCP 66 48831 > glrpc [ACK] Seq=1 Ack=1 Win=14656 Len=0 TSval=2056145 TSecr=27548687
 47.902519     10.0.1.2 -> 10.0.1.3     TCP 66 48831 > glrpc [FIN, ACK] Seq=9 Ack=250000001 Win=3040832 Len=0 TSval=2061512 TSecr=27553999
 47.942191     10.0.1.3 -> 10.0.1.2     TCP 66 glrpc > 48831 [ACK] Seq=250000001 Ack=10 Win=5824 Len=0 TSval=27554063 TSecr=2061512
 52.904015     10.0.1.2 -> 10.0.1.3     TCP 74 48833 > glrpc [SYN] Seq=0 Win=14600 Len=0 MSS=1460 SACK_PERM=1 TSval=2062762 TSecr=0 WS=64
 52.904341     10.0.1.3 -> 10.0.1.2     TCP 74 glrpc > 48833 [SYN, ACK] Seq=0 Ack=1 Win=5792 Len=0 MSS=1460 SACK_PERM=1 TSval=27555303 TSecr=2062762 WS=64
 52.904361     10.0.1.2 -> 10.0.1.3     TCP 66 48833 > glrpc [ACK] Seq=1 Ack=1 Win=14656 Len=0 TSval=2062762 TSecr=27555303
 74.333889     10.0.1.2 -> 10.0.1.3     TCP 66 48833 > glrpc [FIN, ACK] Seq=9 Ack=250000001 Win=3011840 Len=0 TSval=2068120 TSecr=27560597
 74.373261     10.0.1.3 -> 10.0.1.2     TCP 66 glrpc > 48833 [ACK] Seq=250000001 Ack=10 Win=5824 Len=0 TSval=27560670 TSecr=2068120
 79.335368     10.0.1.2 -> 10.0.1.3     TCP 74 48835 > glrpc [SYN] Seq=0 Win=14600 Len=0 MSS=1460 SACK_PERM=1 TSval=2069370 TSecr=0 WS=64
 79.335692     10.0.1.3 -> 10.0.1.2     TCP 74 glrpc > 48835 [SYN, ACK] Seq=0 Ack=1 Win=5792 Len=0 MSS=1460 SACK_PERM=1 TSval=27561910 TSecr=2069370 WS=64
 79.335708     10.0.1.2 -> 10.0.1.3     TCP 66 48835 > glrpc [ACK] Seq=1 Ack=1 Win=14656 Len=0 TSval=2069370 TSecr=27561910
100.908701     10.0.1.2 -> 10.0.1.3     TCP 66 48835 > glrpc [FIN, ACK] Seq=9 Ack=250000001 Win=3032128 Len=0 TSval=2074763 TSecr=27567252
100.946203     10.0.1.3 -> 10.0.1.2     TCP 66 glrpc > 48835 [ACK] Seq=250000001 Ack=10 Win=5824 Len=0 TSval=27567313 TSecr=2074763
105.910952     10.0.1.2 -> 10.0.1.3     TCP 74 48836 > glrpc [SYN] Seq=0 Win=14600 Len=0 MSS=1460 SACK_PERM=1 TSval=2076014 TSecr=0 WS=64
105.911251     10.0.1.3 -> 10.0.1.2     TCP 74 glrpc > 48836 [SYN, ACK] Seq=0 Ack=1 Win=5792 Len=0 MSS=1460 SACK_PERM=1 TSval=27568554 TSecr=2076014 WS=64
105.911267     10.0.1.2 -> 10.0.1.3     TCP 66 48836 > glrpc [ACK] Seq=1 Ack=1 Win=14656 Len=0 TSval=2076014 TSecr=27568554
127.416291     10.0.1.2 -> 10.0.1.3     TCP 66 48836 > glrpc [FIN, ACK] Seq=9 Ack=250000001 Win=3085184 Len=0 TSval=2081390 TSecr=27573863
127.456473     10.0.1.3 -> 10.0.1.2     TCP 66 glrpc > 48836 [ACK] Seq=250000001 Ack=10 Win=5824 Len=0 TSval=27573940 TSecr=2081390
132.418512     10.0.1.2 -> 10.0.1.3     TCP 74 48839 > glrpc [SYN] Seq=0 Win=14600 Len=0 MSS=1460 SACK_PERM=1 TSval=2082641 TSecr=0 WS=64
132.418821     10.0.1.3 -> 10.0.1.2     TCP 74 glrpc > 48839 [SYN, ACK] Seq=0 Ack=1 Win=5792 Len=0 MSS=1460 SACK_PERM=1 TSval=27575180 TSecr=2082641 WS=64
132.418837     10.0.1.2 -> 10.0.1.3     TCP 66 48839 > glrpc [ACK] Seq=1 Ack=1 Win=14656 Len=0 TSval=2082641 TSecr=27575180
153.946842     10.0.1.2 -> 10.0.1.3     TCP 66 48839 > glrpc [FIN, ACK] Seq=9 Ack=250000001 Win=3078464 Len=0 TSval=2088023 TSecr=27580508
153.987160     10.0.1.3 -> 10.0.1.2     TCP 66 glrpc > 48839 [ACK] Seq=250000001 Ack=10 Win=5824 Len=0 TSval=27580572 TSecr=2088023
158.948256     10.0.1.2 -> 10.0.1.3     TCP 74 48840 > glrpc [SYN] Seq=0 Win=14600 Len=0 MSS=1460 SACK_PERM=1 TSval=2089273 TSecr=0 WS=64
158.948661     10.0.1.3 -> 10.0.1.2     TCP 74 glrpc > 48840 [SYN, ACK] Seq=0 Ack=1 Win=5792 Len=0 MSS=1460 SACK_PERM=1 TSval=27581812 TSecr=2089273 WS=64
158.948676     10.0.1.2 -> 10.0.1.3     TCP 66 48840 > glrpc [ACK] Seq=1 Ack=1 Win=14656 Len=0 TSval=2089273 TSecr=27581812
180.429087     10.0.1.2 -> 10.0.1.3     TCP 66 48840 > glrpc [FIN, ACK] Seq=9 Ack=250000001 Win=3011840 Len=0 TSval=2094643 TSecr=27587119
180.469161     10.0.1.3 -> 10.0.1.2     TCP 66 glrpc > 48840 [ACK] Seq=250000001 Ack=10 Win=5824 Len=0 TSval=27587192 TSecr=2094643
185.430582     10.0.1.2 -> 10.0.1.3     TCP 74 48842 > glrpc [SYN] Seq=0 Win=14600 Len=0 MSS=1460 SACK_PERM=1 TSval=2095894 TSecr=0 WS=64
185.430879     10.0.1.3 -> 10.0.1.2     TCP 74 glrpc > 48842 [SYN, ACK] Seq=0 Ack=1 Win=5792 Len=0 MSS=1460 SACK_PERM=1 TSval=27588432 TSecr=2095894 WS=64
185.430894     10.0.1.2 -> 10.0.1.3     TCP 66 48842 > glrpc [ACK] Seq=1 Ack=1 Win=14656 Len=0 TSval=2095894 TSecr=27588432
206.923918     10.0.1.2 -> 10.0.1.3     TCP 66 48842 > glrpc [FIN, ACK] Seq=9 Ack=250000001 Win=3085184 Len=0 TSval=2101267 TSecr=27593752
206.962174     10.0.1.3 -> 10.0.1.2     TCP 66 glrpc > 48842 [ACK] Seq=250000001 Ack=10 Win=5824 Len=0 TSval=27593815 TSecr=2101267
212.051768     10.0.1.2 -> 10.0.1.3     TCP 74 48845 > glrpc [SYN] Seq=0 Win=14600 Len=0 MSS=1460 SACK_PERM=1 TSval=2102549 TSecr=0 WS=64
212.052165     10.0.1.3 -> 10.0.1.2     TCP 74 glrpc > 48845 [SYN, ACK] Seq=0 Ack=1 Win=5792 Len=0 MSS=1460 SACK_PERM=1 TSval=27595087 TSecr=2102549 WS=64
212.052177     10.0.1.2 -> 10.0.1.3     TCP 66 48845 > glrpc [ACK] Seq=1 Ack=1 Win=14656 Len=0 TSval=2102549 TSecr=27595087
233.586804     10.0.1.2 -> 10.0.1.3     TCP 66 48845 > glrpc [FIN, ACK] Seq=9 Ack=250000001 Win=2974208 Len=0 TSval=2107933 TSecr=27600449
233.624153     10.0.1.3 -> 10.0.1.2     TCP 66 glrpc > 48845 [ACK] Seq=250000001 Ack=10 Win=5824 Len=0 TSval=27600480 TSecr=2107933
238.588208     10.0.1.2 -> 10.0.1.3     TCP 74 48846 > glrpc [SYN] Seq=0 Win=14600 Len=0 MSS=1460 SACK_PERM=1 TSval=2109183 TSecr=0 WS=64
238.588533     10.0.1.3 -> 10.0.1.2     TCP 74 glrpc > 48846 [SYN, ACK] Seq=0 Ack=1 Win=5792 Len=0 MSS=1460 SACK_PERM=1 TSval=27601721 TSecr=2109183 WS=64
238.588547     10.0.1.2 -> 10.0.1.3     TCP 66 48846 > glrpc [ACK] Seq=1 Ack=1 Win=14656 Len=0 TSval=2109183 TSecr=27601721
260.136534     10.0.1.2 -> 10.0.1.3     TCP 66 48846 > glrpc [FIN, ACK] Seq=9 Ack=250000001 Win=2985792 Len=0 TSval=2114570 TSecr=27607041
260.175142     10.0.1.3 -> 10.0.1.2     TCP 66 glrpc > 48846 [ACK] Seq=250000001 Ack=10 Win=5824 Len=0 TSval=27607117 TSecr=2114570
265.254220     10.0.1.2 -> 10.0.1.3     TCP 74 48848 > glrpc [SYN] Seq=0 Win=14600 Len=0 MSS=1460 SACK_PERM=1 TSval=2115850 TSecr=0 WS=64
265.254502     10.0.1.3 -> 10.0.1.2     TCP 74 glrpc > 48848 [SYN, ACK] Seq=0 Ack=1 Win=5792 Len=0 MSS=1460 SACK_PERM=1 TSval=27608387 TSecr=2115850 WS=64
265.254520     10.0.1.2 -> 10.0.1.3     TCP 66 48848 > glrpc [ACK] Seq=1 Ack=1 Win=14656 Len=0 TSval=2115850 TSecr=27608387
286.795688     10.0.1.2 -> 10.0.1.3     TCP 66 48848 > glrpc [FIN, ACK] Seq=9 Ack=250000001 Win=2988672 Len=0 TSval=2121235 TSecr=27613721
286.833192     10.0.1.3 -> 10.0.1.2     TCP 66 glrpc > 48848 [ACK] Seq=250000001 Ack=10 Win=5824 Len=0 TSval=27613781 TSecr=2121235
291.797209     10.0.1.2 -> 10.0.1.3     TCP 74 48851 > glrpc [SYN] Seq=0 Win=14600 Len=0 MSS=1460 SACK_PERM=1 TSval=2122485 TSecr=0 WS=64
291.797518     10.0.1.3 -> 10.0.1.2     TCP 74 glrpc > 48851 [SYN, ACK] Seq=0 Ack=1 Win=5792 Len=0 MSS=1460 SACK_PERM=1 TSval=27615022 TSecr=2122485 WS=64
291.797534     10.0.1.2 -> 10.0.1.3     TCP 66 48851 > glrpc [ACK] Seq=1 Ack=1 Win=14656 Len=0 TSval=2122485 TSecr=27615022
313.299519     10.0.1.2 -> 10.0.1.3     TCP 66 48851 > glrpc [FIN, ACK] Seq=9 Ack=250000001 Win=2988672 Len=0 TSval=2127861 TSecr=27620333
313.338144     10.0.1.3 -> 10.0.1.2     TCP 66 glrpc > 48851 [ACK] Seq=250000001 Ack=10 Win=5824 Len=0 TSval=27620407 TSecr=2127861
318.401467     10.0.1.2 -> 10.0.1.3     TCP 74 48854 > glrpc [SYN] Seq=0 Win=14600 Len=0 MSS=1460 SACK_PERM=1 TSval=2129136 TSecr=0 WS=64
318.401787     10.0.1.3 -> 10.0.1.2     TCP 74 glrpc > 48854 [SYN, ACK] Seq=0 Ack=1 Win=5792 Len=0 MSS=1460 SACK_PERM=1 TSval=27621672 TSecr=2129136 WS=64
318.401800     10.0.1.2 -> 10.0.1.3     TCP 66 48854 > glrpc [ACK] Seq=1 Ack=1 Win=14656 Len=0 TSval=2129137 TSecr=27621672
339.924344     10.0.1.2 -> 10.0.1.3     TCP 66 48854 > glrpc [FIN, ACK] Seq=9 Ack=250000001 Win=3058176 Len=0 TSval=2134517 TSecr=27626998
339.965250     10.0.1.3 -> 10.0.1.2     TCP 66 glrpc > 48854 [ACK] Seq=250000001 Ack=10 Win=5824 Len=0 TSval=27627063 TSecr=2134517
344.925898     10.0.1.2 -> 10.0.1.3     TCP 74 48856 > glrpc [SYN] Seq=0 Win=14600 Len=0 MSS=1460 SACK_PERM=1 TSval=2135768 TSecr=0 WS=64
344.926300     10.0.1.3 -> 10.0.1.2     TCP 74 glrpc > 48856 [SYN, ACK] Seq=0 Ack=1 Win=5792 Len=0 MSS=1460 SACK_PERM=1 TSval=27628303 TSecr=2135768 WS=64
344.926313     10.0.1.2 -> 10.0.1.3     TCP 66 48856 > glrpc [ACK] Seq=1 Ack=1 Win=14656 Len=0 TSval=2135768 TSecr=27628303
366.410738     10.0.1.2 -> 10.0.1.3     TCP 66 48856 > glrpc [FIN, ACK] Seq=9 Ack=250000001 Win=2988672 Len=0 TSval=2141139 TSecr=27633610
366.450252     10.0.1.3 -> 10.0.1.2     TCP 66 glrpc > 48856 [ACK] Seq=250000001 Ack=10 Win=5824 Len=0 TSval=27633684 TSecr=2141139
371.437462     10.0.1.2 -> 10.0.1.3     TCP 74 48857 > glrpc [SYN] Seq=0 Win=14600 Len=0 MSS=1460 SACK_PERM=1 TSval=2142395 TSecr=0 WS=64
371.437805     10.0.1.3 -> 10.0.1.2     TCP 74 glrpc > 48857 [SYN, ACK] Seq=0 Ack=1 Win=5792 Len=0 MSS=1460 SACK_PERM=1 TSval=27634930 TSecr=2142395 WS=64
371.437822     10.0.1.2 -> 10.0.1.3     TCP 66 48857 > glrpc [ACK] Seq=1 Ack=1 Win=14656 Len=0 TSval=2142396 TSecr=27634930
392.927993     10.0.1.2 -> 10.0.1.3     TCP 66 48857 > glrpc [FIN, ACK] Seq=9 Ack=250000001 Win=2994496 Len=0 TSval=2147768 TSecr=27640239
392.968104     10.0.1.3 -> 10.0.1.2     TCP 66 glrpc > 48857 [ACK] Seq=250000001 Ack=10 Win=5824 Len=0 TSval=27640313 TSecr=2147768
397.929419     10.0.1.2 -> 10.0.1.3     TCP 74 48859 > glrpc [SYN] Seq=0 Win=14600 Len=0 MSS=1460 SACK_PERM=1 TSval=2149018 TSecr=0 WS=64
397.929744     10.0.1.3 -> 10.0.1.2     TCP 74 glrpc > 48859 [SYN, ACK] Seq=0 Ack=1 Win=5792 Len=0 MSS=1460 SACK_PERM=1 TSval=27641553 TSecr=2149018 WS=64
397.929763     10.0.1.2 -> 10.0.1.3     TCP 66 48859 > glrpc [ACK] Seq=1 Ack=1 Win=14656 Len=0 TSval=2149019 TSecr=27641553
419.402779     10.0.1.2 -> 10.0.1.3     TCP 66 48859 > glrpc [FIN, ACK] Seq=9 Ack=250000001 Win=3020544 Len=0 TSval=2154387 TSecr=27646899
419.442088     10.0.1.3 -> 10.0.1.2     TCP 66 glrpc > 48859 [ACK] Seq=250000001 Ack=10 Win=5824 Len=0 TSval=27646931 TSecr=2154387
424.404206     10.0.1.2 -> 10.0.1.3     TCP 74 48861 > glrpc [SYN] Seq=0 Win=14600 Len=0 MSS=1460 SACK_PERM=1 TSval=2155637 TSecr=0 WS=64
424.404485     10.0.1.3 -> 10.0.1.2     TCP 74 glrpc > 48861 [SYN, ACK] Seq=0 Ack=1 Win=5792 Len=0 MSS=1460 SACK_PERM=1 TSval=27648171 TSecr=2155637 WS=64
424.404498     10.0.1.2 -> 10.0.1.3     TCP 66 48861 > glrpc [ACK] Seq=1 Ack=1 Win=14656 Len=0 TSval=2155637 TSecr=27648171
445.878368     10.0.1.2 -> 10.0.1.3     TCP 66 48861 > glrpc [FIN, ACK] Seq=9 Ack=250000001 Win=2985792 Len=0 TSval=2161006 TSecr=27653476
445.916101     10.0.1.3 -> 10.0.1.2     TCP 66 glrpc > 48861 [ACK] Seq=250000001 Ack=10 Win=5824 Len=0 TSval=27653549 TSecr=2161006
450.898224     10.0.1.2 -> 10.0.1.3     TCP 74 48862 > glrpc [SYN] Seq=0 Win=14600 Len=0 MSS=1460 SACK_PERM=1 TSval=2162261 TSecr=0 WS=64
450.898502     10.0.1.3 -> 10.0.1.2     TCP 74 glrpc > 48862 [SYN, ACK] Seq=0 Ack=1 Win=5792 Len=0 MSS=1460 SACK_PERM=1 TSval=27654794 TSecr=2162261 WS=64
450.898514     10.0.1.2 -> 10.0.1.3     TCP 66 48862 > glrpc [ACK] Seq=1 Ack=1 Win=14656 Len=0 TSval=2162261 TSecr=27654794
472.375450     10.0.1.2 -> 10.0.1.3     TCP 66 48862 > glrpc [FIN, ACK] Seq=9 Ack=250000001 Win=3006080 Len=0 TSval=2167630 TSecr=27660099
472.414099     10.0.1.3 -> 10.0.1.2     TCP 66 glrpc > 48862 [ACK] Seq=250000001 Ack=10 Win=5824 Len=0 TSval=27660173 TSecr=2167630
477.388876     10.0.1.2 -> 10.0.1.3     TCP 74 48864 > glrpc [SYN] Seq=0 Win=14600 Len=0 MSS=1460 SACK_PERM=1 TSval=2168883 TSecr=0 WS=64
477.389159     10.0.1.3 -> 10.0.1.2     TCP 74 glrpc > 48864 [SYN, ACK] Seq=0 Ack=1 Win=5792 Len=0 MSS=1460 SACK_PERM=1 TSval=27661416 TSecr=2168883 WS=64
477.389168     10.0.1.2 -> 10.0.1.3     TCP 66 48864 > glrpc [ACK] Seq=1 Ack=1 Win=14656 Len=0 TSval=2168883 TSecr=27661416
498.899505     10.0.1.2 -> 10.0.1.3     TCP 66 48864 > glrpc [FIN, ACK] Seq=9 Ack=250000001 Win=2988672 Len=0 TSval=2174261 TSecr=27666730
498.937116     10.0.1.3 -> 10.0.1.2     TCP 66 glrpc > 48864 [ACK] Seq=250000001 Ack=10 Win=5824 Len=0 TSval=27666803 TSecr=2174261
503.913032     10.0.1.2 -> 10.0.1.3     TCP 74 48865 > glrpc [SYN] Seq=0 Win=14600 Len=0 MSS=1460 SACK_PERM=1 TSval=2175514 TSecr=0 WS=64
503.913357     10.0.1.3 -> 10.0.1.2     TCP 74 glrpc > 48865 [SYN, ACK] Seq=0 Ack=1 Win=5792 Len=0 MSS=1460 SACK_PERM=1 TSval=27668046 TSecr=2175514 WS=64
503.913371     10.0.1.2 -> 10.0.1.3     TCP 66 48865 > glrpc [ACK] Seq=1 Ack=1 Win=14656 Len=0 TSval=2175514 TSecr=27668046
525.437769     10.0.1.2 -> 10.0.1.3     TCP 66 48865 > glrpc [FIN, ACK] Seq=9 Ack=250000001 Win=3014784 Len=0 TSval=2180896 TSecr=27673406
525.475057     10.0.1.3 -> 10.0.1.2     TCP 66 glrpc > 48865 [ACK] Seq=250000001 Ack=10 Win=5824 Len=0 TSval=27673437 TSecr=2180896
