  1   0.000000     10.0.1.2 -> 10.0.1.3     TCP 74 50173 > glrpc [SYN] Seq=0 Win=14600 Len=0 MSS=1460 SACK_PERM=1 TSval=4912176 TSecr=0 WS=64
  2   0.000305     10.0.1.3 -> 10.0.1.2     TCP 74 glrpc > 50173 [SYN, ACK] Seq=0 Ack=1 Win=5792 Len=0 MSS=1460 SACK_PERM=1 TSval=30404503 TSecr=4912176 WS=64
  3   0.000323     10.0.1.2 -> 10.0.1.3     TCP 66 50173 > glrpc [ACK] Seq=1 Ack=1 Win=14656 Len=0 TSval=4912176 TSecr=30404503
259233  21.558077     10.0.1.2 -> 10.0.1.3     TCP 66 50173 > glrpc [FIN, ACK] Seq=9 Ack=250000001 Win=3085184 Len=0 TSval=4917566 TSecr=30409871
259234  21.597286     10.0.1.3 -> 10.0.1.2     TCP 66 glrpc > 50173 [ACK] Seq=250000001 Ack=10 Win=5824 Len=0 TSval=30409902 TSecr=4917566
  1   0.000000     10.0.1.2 -> 10.0.1.3     TCP 74 50175 > glrpc [SYN] Seq=0 Win=14600 Len=0 MSS=1460 SACK_PERM=1 TSval=4928351 TSecr=0 WS=64
  2   0.000297     10.0.1.3 -> 10.0.1.2     TCP 74 glrpc > 50175 [SYN, ACK] Seq=0 Ack=1 Win=5792 Len=0 MSS=1460 SACK_PERM=1 TSval=30420677 TSecr=4928351 WS=64
  3   0.000316     10.0.1.2 -> 10.0.1.3     TCP 66 50175 > glrpc [ACK] Seq=1 Ack=1 Win=14656 Len=0 TSval=4928351 TSecr=30420677
253238  21.573286     10.0.1.2 -> 10.0.1.3     TCP 66 50175 > glrpc [FIN, ACK] Seq=9 Ack=250000001 Win=3085184 Len=0 TSval=4933744 TSecr=30426027
253239  21.612733     10.0.1.3 -> 10.0.1.2     TCP 66 glrpc > 50175 [ACK] Seq=250000001 Ack=10 Win=5824 Len=0 TSval=30426080 TSecr=4933744
  1   0.000000     10.0.1.2 -> 10.0.1.3     TCP 74 50177 > glrpc [SYN] Seq=0 Win=14600 Len=0 MSS=1460 SACK_PERM=1 TSval=4943599 TSecr=0 WS=64
  2   0.000291     10.0.1.3 -> 10.0.1.2     TCP 74 glrpc > 50177 [SYN, ACK] Seq=0 Ack=1 Win=5792 Len=0 MSS=1460 SACK_PERM=1 TSval=30435924 TSecr=4943599 WS=64
  3   0.000306     10.0.1.2 -> 10.0.1.3     TCP 66 50177 > glrpc [ACK] Seq=1 Ack=1 Win=14656 Len=0 TSval=4943599 TSecr=30435924
247812  21.566172     10.0.1.2 -> 10.0.1.3     TCP 66 50177 > glrpc [FIN, ACK] Seq=9 Ack=250000001 Win=2985792 Len=0 TSval=4948991 TSecr=30441293
247813  21.604797     10.0.1.3 -> 10.0.1.2     TCP 66 glrpc > 50177 [ACK] Seq=250000001 Ack=10 Win=5824 Len=0 TSval=30441325 TSecr=4948991
  1   0.000000     10.0.1.2 -> 10.0.1.3     TCP 74 50179 > glrpc [SYN] Seq=0 Win=14600 Len=0 MSS=1460 SACK_PERM=1 TSval=4958616 TSecr=0 WS=64
  2   0.000292     10.0.1.3 -> 10.0.1.2     TCP 74 glrpc > 50179 [SYN, ACK] Seq=0 Ack=1 Win=5792 Len=0 MSS=1460 SACK_PERM=1 TSval=30450939 TSecr=4958616 WS=64
  3   0.000303     10.0.1.2 -> 10.0.1.3     TCP 66 50179 > glrpc [ACK] Seq=1 Ack=1 Win=14656 Len=0 TSval=4958616 TSecr=30450939
  1   0.000000     10.0.1.2 -> 10.0.1.3     TCP 74 50181 > glrpc [SYN] Seq=0 Win=14600 Len=0 MSS=1460 SACK_PERM=1 TSval=4972763 TSecr=0 WS=64
  2   0.000302     10.0.1.3 -> 10.0.1.2     TCP 74 glrpc > 50181 [SYN, ACK] Seq=0 Ack=1 Win=5792 Len=0 MSS=1460 SACK_PERM=1 TSval=30465085 TSecr=4972763 WS=64
  3   0.000317     10.0.1.2 -> 10.0.1.3     TCP 66 50181 > glrpc [ACK] Seq=1 Ack=1 Win=14656 Len=0 TSval=4972763 TSecr=30465085
259058  21.566164     10.0.1.2 -> 10.0.1.3     TCP 66 50181 > glrpc [FIN, ACK] Seq=9 Ack=250000001 Win=2977088 Len=0 TSval=4978155 TSecr=30470414
259059  21.606102     10.0.1.3 -> 10.0.1.2     TCP 66 glrpc > 50181 [ACK] Seq=250000001 Ack=10 Win=5824 Len=0 TSval=30470487 TSecr=4978155
  1   0.000000     10.0.1.2 -> 10.0.1.3     TCP 74 50184 > glrpc [SYN] Seq=0 Win=14600 Len=0 MSS=1460 SACK_PERM=1 TSval=4989014 TSecr=0 WS=64
  2   0.000286     10.0.1.3 -> 10.0.1.2     TCP 74 glrpc > 50184 [SYN, ACK] Seq=0 Ack=1 Win=5792 Len=0 MSS=1460 SACK_PERM=1 TSval=30481336 TSecr=4989014 WS=64
  3   0.000307     10.0.1.2 -> 10.0.1.3     TCP 66 50184 > glrpc [ACK] Seq=1 Ack=1 Win=14656 Len=0 TSval=4989014 TSecr=30481336
  1   0.000000     10.0.1.2 -> 10.0.1.3     TCP 74 50186 > glrpc [SYN] Seq=0 Win=14600 Len=0 MSS=1460 SACK_PERM=1 TSval=5003166 TSecr=0 WS=64
  2   0.000292     10.0.1.3 -> 10.0.1.2     TCP 74 glrpc > 50186 [SYN, ACK] Seq=0 Ack=1 Win=5792 Len=0 MSS=1460 SACK_PERM=1 TSval=30495486 TSecr=5003166 WS=64
  3   0.000312     10.0.1.2 -> 10.0.1.3     TCP 66 50186 > glrpc [ACK] Seq=1 Ack=1 Win=14656 Len=0 TSval=5003166 TSecr=30495486
259386  21.488386     10.0.1.2 -> 10.0.1.3     TCP 66 50186 > glrpc [FIN, ACK] Seq=9 Ack=250000001 Win=3011840 Len=0 TSval=5008538 TSecr=30500794
259387  21.527962     10.0.1.3 -> 10.0.1.2     TCP 66 glrpc > 50186 [ACK] Seq=250000001 Ack=10 Win=5824 Len=0 TSval=30500868 TSecr=5008538
  1   0.000000     10.0.1.2 -> 10.0.1.3     TCP 74 50190 > glrpc [SYN] Seq=0 Win=14600 Len=0 MSS=1460 SACK_PERM=1 TSval=5024365 TSecr=0 WS=64
  2   0.000301     10.0.1.3 -> 10.0.1.2     TCP 74 glrpc > 50190 [SYN, ACK] Seq=0 Ack=1 Win=5792 Len=0 MSS=1460 SACK_PERM=1 TSval=30516683 TSecr=5024365 WS=64
  3   0.000326     10.0.1.2 -> 10.0.1.3     TCP 66 50190 > glrpc [ACK] Seq=1 Ack=1 Win=14656 Len=0 TSval=5024365 TSecr=30516683
  1   0.000000     10.0.1.2 -> 10.0.1.3     TCP 74 50193 > glrpc [SYN] Seq=0 Win=14600 Len=0 MSS=1460 SACK_PERM=1 TSval=5043323 TSecr=0 WS=64
  2   0.000329     10.0.1.3 -> 10.0.1.2     TCP 74 glrpc > 50193 [SYN, ACK] Seq=0 Ack=1 Win=5792 Len=0 MSS=1460 SACK_PERM=1 TSval=30535640 TSecr=5043323 WS=64
  3   0.000350     10.0.1.2 -> 10.0.1.3     TCP 66 50193 > glrpc [ACK] Seq=1 Ack=1 Win=14656 Len=0 TSval=5043323 TSecr=30535640
239403  21.560919     10.0.1.2 -> 10.0.1.3     TCP 66 50193 > glrpc [FIN, ACK] Seq=9 Ack=250000001 Win=2985792 Len=0 TSval=5048713 TSecr=30540967
239404  21.599095     10.0.1.3 -> 10.0.1.2     TCP 66 glrpc > 50193 [ACK] Seq=250000001 Ack=10 Win=5824 Len=0 TSval=30541040 TSecr=5048713
  1   0.000000     10.0.1.2 -> 10.0.1.3     TCP 74 50198 > glrpc [SYN] Seq=0 Win=14600 Len=0 MSS=1460 SACK_PERM=1 TSval=5057394 TSecr=0 WS=64
  2   0.000284     10.0.1.3 -> 10.0.1.2     TCP 74 glrpc > 50198 [SYN, ACK] Seq=0 Ack=1 Win=5792 Len=0 MSS=1460 SACK_PERM=1 TSval=30549710 TSecr=5057394 WS=64
  3   0.000299     10.0.1.2 -> 10.0.1.3     TCP 66 50198 > glrpc [ACK] Seq=1 Ack=1 Win=14656 Len=0 TSval=5057394 TSecr=30549710
238903  21.594520     10.0.1.2 -> 10.0.1.3     TCP 66 50198 > glrpc [FIN, ACK] Seq=9 Ack=250000001 Win=2977088 Len=0 TSval=5062793 TSecr=30555046
238904  21.635376     10.0.1.3 -> 10.0.1.2     TCP 66 glrpc > 50198 [ACK] Seq=250000001 Ack=10 Win=5824 Len=0 TSval=30555119 TSecr=5062793
  1   0.000000     10.0.1.2 -> 10.0.1.3     TCP 74 50200 > glrpc [SYN] Seq=0 Win=14600 Len=0 MSS=1460 SACK_PERM=1 TSval=5071413 TSecr=0 WS=64
  2   0.000327     10.0.1.3 -> 10.0.1.2     TCP 74 glrpc > 50200 [SYN, ACK] Seq=0 Ack=1 Win=5792 Len=0 MSS=1460 SACK_PERM=1 TSval=30563727 TSecr=5071413 WS=64
  3   0.000344     10.0.1.2 -> 10.0.1.3     TCP 66 50200 > glrpc [ACK] Seq=1 Ack=1 Win=14656 Len=0 TSval=5071413 TSecr=30563727
234639  21.608103     10.0.1.2 -> 10.0.1.3     TCP 66 50200 > glrpc [FIN, ACK] Seq=9 Ack=250000001 Win=3006080 Len=0 TSval=5076815 TSecr=30569064
234640  21.647113     10.0.1.3 -> 10.0.1.2     TCP 66 glrpc > 50200 [ACK] Seq=250000001 Ack=10 Win=5824 Len=0 TSval=30569139 TSecr=5076815
  1   0.000000     10.0.1.2 -> 10.0.1.3     TCP 74 50202 > glrpc [SYN] Seq=0 Win=14600 Len=0 MSS=1460 SACK_PERM=1 TSval=5085037 TSecr=0 WS=64
  2   0.000295     10.0.1.3 -> 10.0.1.2     TCP 74 glrpc > 50202 [SYN, ACK] Seq=0 Ack=1 Win=5792 Len=0 MSS=1460 SACK_PERM=1 TSval=30577351 TSecr=5085037 WS=64
  3   0.000313     10.0.1.2 -> 10.0.1.3     TCP 66 50202 > glrpc [ACK] Seq=1 Ack=1 Win=14656 Len=0 TSval=5085037 TSecr=30577351
244111  21.635755     10.0.1.2 -> 10.0.1.3     TCP 66 50202 > glrpc [FIN, ACK] Seq=9 Ack=250000001 Win=2974208 Len=0 TSval=5090446 TSecr=30582696
244112  21.675539     10.0.1.3 -> 10.0.1.2     TCP 66 glrpc > 50202 [ACK] Seq=250000001 Ack=10 Win=5824 Len=0 TSval=30582770 TSecr=5090446
  1   0.000000     10.0.1.2 -> 10.0.1.3     TCP 74 50204 > glrpc [SYN] Seq=0 Win=14600 Len=0 MSS=1460 SACK_PERM=1 TSval=5099377 TSecr=0 WS=64
  2   0.000287     10.0.1.3 -> 10.0.1.2     TCP 74 glrpc > 50204 [SYN, ACK] Seq=0 Ack=1 Win=5792 Len=0 MSS=1460 SACK_PERM=1 TSval=30591690 TSecr=5099377 WS=64
  3   0.000303     10.0.1.2 -> 10.0.1.3     TCP 66 50204 > glrpc [ACK] Seq=1 Ack=1 Win=14656 Len=0 TSval=5099377 TSecr=30591690
247233  21.520351     10.0.1.2 -> 10.0.1.3     TCP 66 50204 > glrpc [FIN, ACK] Seq=9 Ack=250000001 Win=3014784 Len=0 TSval=5104757 TSecr=30597049
247234  21.559735     10.0.1.3 -> 10.0.1.2     TCP 66 glrpc > 50204 [ACK] Seq=250000001 Ack=10 Win=5824 Len=0 TSval=30597080 TSecr=5104757
  1   0.000000     10.0.1.2 -> 10.0.1.3     TCP 74 50205 > glrpc [SYN] Seq=0 Win=14600 Len=0 MSS=1460 SACK_PERM=1 TSval=5114198 TSecr=0 WS=64
  2   0.000292     10.0.1.3 -> 10.0.1.2     TCP 74 glrpc > 50205 [SYN, ACK] Seq=0 Ack=1 Win=5792 Len=0 MSS=1460 SACK_PERM=1 TSval=30606510 TSecr=5114198 WS=64
  3   0.000311     10.0.1.2 -> 10.0.1.3     TCP 66 50205 > glrpc [ACK] Seq=1 Ack=1 Win=14656 Len=0 TSval=5114198 TSecr=30606510
259255  21.616133     10.0.1.2 -> 10.0.1.3     TCP 66 50205 > glrpc [FIN, ACK] Seq=9 Ack=250000001 Win=3006080 Len=0 TSval=5119602 TSecr=30611870
259256  21.654727     10.0.1.3 -> 10.0.1.2     TCP 66 glrpc > 50205 [ACK] Seq=250000001 Ack=10 Win=5824 Len=0 TSval=30611923 TSecr=5119602
  1   0.000000     10.0.1.2 -> 10.0.1.3     TCP 74 50209 > glrpc [SYN] Seq=0 Win=14600 Len=0 MSS=1460 SACK_PERM=1 TSval=5130575 TSecr=0 WS=64
  2   0.000290     10.0.1.3 -> 10.0.1.2     TCP 74 glrpc > 50209 [SYN, ACK] Seq=0 Ack=1 Win=5792 Len=0 MSS=1460 SACK_PERM=1 TSval=30622886 TSecr=5130575 WS=64
  3   0.000305     10.0.1.2 -> 10.0.1.3     TCP 66 50209 > glrpc [ACK] Seq=1 Ack=1 Win=14656 Len=0 TSval=5130575 TSecr=30622886
239260  21.559684     10.0.1.2 -> 10.0.1.3     TCP 66 50209 > glrpc [FIN, ACK] Seq=9 Ack=250000001 Win=2994496 Len=0 TSval=5135965 TSecr=30628253
239261  21.596769     10.0.1.3 -> 10.0.1.2     TCP 66 glrpc > 50209 [ACK] Seq=250000001 Ack=10 Win=5824 Len=0 TSval=30628285 TSecr=5135965
  1   0.000000     10.0.1.2 -> 10.0.1.3     TCP 74 50211 > glrpc [SYN] Seq=0 Win=14600 Len=0 MSS=1460 SACK_PERM=1 TSval=5144867 TSecr=0 WS=64
  2   0.000352     10.0.1.3 -> 10.0.1.2     TCP 74 glrpc > 50211 [SYN, ACK] Seq=0 Ack=1 Win=5792 Len=0 MSS=1460 SACK_PERM=1 TSval=30637177 TSecr=5144867 WS=64
  3   0.000370     10.0.1.2 -> 10.0.1.3     TCP 66 50211 > glrpc [ACK] Seq=1 Ack=1 Win=14656 Len=0 TSval=5144867 TSecr=30637177
259250  21.533830     10.0.1.2 -> 10.0.1.3     TCP 66 50211 > glrpc [FIN, ACK] Seq=9 Ack=250000001 Win=2985792 Len=0 TSval=5150251 TSecr=30642509
259251  21.573373     10.0.1.3 -> 10.0.1.2     TCP 66 glrpc > 50211 [ACK] Seq=250000001 Ack=10 Win=5824 Len=0 TSval=30642570 TSecr=5150251
  1   0.000000     10.0.1.2 -> 10.0.1.3     TCP 74 50214 > glrpc [SYN] Seq=0 Win=14600 Len=0 MSS=1460 SACK_PERM=1 TSval=5161201 TSecr=0 WS=64
  2   0.000330     10.0.1.3 -> 10.0.1.2     TCP 74 glrpc > 50214 [SYN, ACK] Seq=0 Ack=1 Win=5792 Len=0 MSS=1460 SACK_PERM=1 TSval=30653510 TSecr=5161201 WS=64
  3   0.000345     10.0.1.2 -> 10.0.1.3     TCP 66 50214 > glrpc [ACK] Seq=1 Ack=1 Win=14656 Len=0 TSval=5161201 TSecr=30653510
234662  21.597714     10.0.1.2 -> 10.0.1.3     TCP 66 50214 > glrpc [FIN, ACK] Seq=9 Ack=250000001 Win=3049536 Len=0 TSval=5166601 TSecr=30658887
234663  21.637589     10.0.1.3 -> 10.0.1.2     TCP 66 glrpc > 50214 [ACK] Seq=250000001 Ack=10 Win=5824 Len=0 TSval=30658919 TSecr=5166601
  1   0.000000     10.0.1.2 -> 10.0.1.3     TCP 74 50216 > glrpc [SYN] Seq=0 Win=14600 Len=0 MSS=1460 SACK_PERM=1 TSval=5174816 TSecr=0 WS=64
  2   0.000332     10.0.1.3 -> 10.0.1.2     TCP 74 glrpc > 50216 [SYN, ACK] Seq=0 Ack=1 Win=5792 Len=0 MSS=1460 SACK_PERM=1 TSval=30667123 TSecr=5174816 WS=64
  3   0.000347     10.0.1.2 -> 10.0.1.3     TCP 66 50216 > glrpc [ACK] Seq=1 Ack=1 Win=14656 Len=0 TSval=5174816 TSecr=30667123
242568  21.543039     10.0.1.2 -> 10.0.1.3     TCP 66 50216 > glrpc [FIN, ACK] Seq=9 Ack=250000001 Win=3011840 Len=0 TSval=5180201 TSecr=30672486
242569  21.582052     10.0.1.3 -> 10.0.1.2     TCP 66 glrpc > 50216 [ACK] Seq=250000001 Ack=10 Win=5824 Len=0 TSval=30672518 TSecr=5180201
  1   0.000000     10.0.1.2 -> 10.0.1.3     TCP 74 50218 > glrpc [SYN] Seq=0 Win=14600 Len=0 MSS=1460 SACK_PERM=1 TSval=5193932 TSecr=0 WS=64
  2   0.000338     10.0.1.3 -> 10.0.1.2     TCP 74 glrpc > 50218 [SYN, ACK] Seq=0 Ack=1 Win=5792 Len=0 MSS=1460 SACK_PERM=1 TSval=30686238 TSecr=5193932 WS=64
  3   0.000361     10.0.1.2 -> 10.0.1.3     TCP 66 50218 > glrpc [ACK] Seq=1 Ack=1 Win=14656 Len=0 TSval=5193932 TSecr=30686238
258888  21.597515     10.0.1.2 -> 10.0.1.3     TCP 66 50218 > glrpc [FIN, ACK] Seq=9 Ack=250000001 Win=3037952 Len=0 TSval=5199331 TSecr=30691584
258889  21.637738     10.0.1.3 -> 10.0.1.2     TCP 66 glrpc > 50218 [ACK] Seq=250000001 Ack=10 Win=5824 Len=0 TSval=30691647 TSecr=5199331
  1   0.000000     10.0.1.2 -> 10.0.1.3     TCP 74 50223 > glrpc [SYN] Seq=0 Win=14600 Len=0 MSS=1460 SACK_PERM=1 TSval=5213589 TSecr=0 WS=64
  2   0.000283     10.0.1.3 -> 10.0.1.2     TCP 74 glrpc > 50223 [SYN, ACK] Seq=0 Ack=1 Win=5792 Len=0 MSS=1460 SACK_PERM=1 TSval=30705893 TSecr=5213589 WS=64
  3   0.000302     10.0.1.2 -> 10.0.1.3     TCP 66 50223 > glrpc [ACK] Seq=1 Ack=1 Win=14656 Len=0 TSval=5213589 TSecr=30705893
