 24.277878     10.0.1.2 -> 10.0.1.3     TCP 66 48895 > glrpc [FIN, ACK] Seq=1 Ack=285088497 Win=47060 Len=0 TSval=2352527 TSecr=27844982
 29.279280     10.0.1.2 -> 10.0.1.3     TCP 74 48908 > glrpc [SYN] Seq=0 Win=14600 Len=0 MSS=1460 SACK_PERM=1 TSval=2353777 TSecr=0 WS=64
 29.279565     10.0.1.3 -> 10.0.1.2     TCP 74 glrpc > 48908 [SYN, ACK] Seq=0 Ack=1 Win=5792 Len=0 MSS=1460 SACK_PERM=1 TSval=27846296 TSecr=2353777 WS=64
 29.279579     10.0.1.2 -> 10.0.1.3     TCP 66 48908 > glrpc [ACK] Seq=1 Ack=1 Win=14656 Len=0 TSval=2353777 TSecr=27846296
 54.783436     10.0.1.2 -> 10.0.1.3     TCP 66 48908 > glrpc [FIN, ACK] Seq=9 Ack=300000001 Win=3011840 Len=0 TSval=2360153 TSecr=27852608
 54.823238     10.0.1.3 -> 10.0.1.2     TCP 66 glrpc > 48908 [ACK] Seq=300000001 Ack=10 Win=5824 Len=0 TSval=27852682 TSecr=2360153
 59.784891     10.0.1.2 -> 10.0.1.3     TCP 74 48911 > glrpc [SYN] Seq=0 Win=14600 Len=0 MSS=1460 SACK_PERM=1 TSval=2361404 TSecr=0 WS=64
 59.785214     10.0.1.3 -> 10.0.1.2     TCP 74 glrpc > 48911 [SYN, ACK] Seq=0 Ack=1 Win=5792 Len=0 MSS=1460 SACK_PERM=1 TSval=27853922 TSecr=2361404 WS=64
 59.785230     10.0.1.2 -> 10.0.1.3     TCP 66 48911 > glrpc [ACK] Seq=1 Ack=1 Win=14656 Len=0 TSval=2361404 TSecr=27853922
 85.288493     10.0.1.2 -> 10.0.1.3     TCP 66 48911 > glrpc [FIN, ACK] Seq=9 Ack=300000001 Win=3011840 Len=0 TSval=2367780 TSecr=27860237
 85.328417     10.0.1.3 -> 10.0.1.2     TCP 66 glrpc > 48911 [ACK] Seq=300000001 Ack=10 Win=5824 Len=0 TSval=27860308 TSecr=2367780
 90.289871     10.0.1.2 -> 10.0.1.3     TCP 74 48912 > glrpc [SYN] Seq=0 Win=14600 Len=0 MSS=1460 SACK_PERM=1 TSval=2369030 TSecr=0 WS=64
 90.290168     10.0.1.3 -> 10.0.1.2     TCP 74 glrpc > 48912 [SYN, ACK] Seq=0 Ack=1 Win=5792 Len=0 MSS=1460 SACK_PERM=1 TSval=27861548 TSecr=2369030 WS=64
 90.290182     10.0.1.2 -> 10.0.1.3     TCP 66 48912 > glrpc [ACK] Seq=1 Ack=1 Win=14656 Len=0 TSval=2369030 TSecr=27861548
115.793240     10.0.1.2 -> 10.0.1.3     TCP 66 48912 > glrpc [FIN, ACK] Seq=9 Ack=300000001 Win=3011840 Len=0 TSval=2375406 TSecr=27867902
115.830690     10.0.1.3 -> 10.0.1.2     TCP 66 glrpc > 48912 [ACK] Seq=300000001 Ack=10 Win=5824 Len=0 TSval=27867933 TSecr=2375406
120.794647     10.0.1.2 -> 10.0.1.3     TCP 74 48915 > glrpc [SYN] Seq=0 Win=14600 Len=0 MSS=1460 SACK_PERM=1 TSval=2376656 TSecr=0 WS=64
120.794941     10.0.1.3 -> 10.0.1.2     TCP 74 glrpc > 48915 [SYN, ACK] Seq=0 Ack=1 Win=5792 Len=0 MSS=1460 SACK_PERM=1 TSval=27869173 TSecr=2376656 WS=64
120.794955     10.0.1.2 -> 10.0.1.3     TCP 66 48915 > glrpc [ACK] Seq=1 Ack=1 Win=14656 Len=0 TSval=2376656 TSecr=27869173
146.298664     10.0.1.2 -> 10.0.1.3     TCP 66 48915 > glrpc [FIN, ACK] Seq=9 Ack=300000001 Win=3011840 Len=0 TSval=2383032 TSecr=27875485
146.338008     10.0.1.3 -> 10.0.1.2     TCP 66 glrpc > 48915 [ACK] Seq=300000001 Ack=10 Win=5824 Len=0 TSval=27875559 TSecr=2383032
151.300050     10.0.1.2 -> 10.0.1.3     TCP 74 48916 > glrpc [SYN] Seq=0 Win=14600 Len=0 MSS=1460 SACK_PERM=1 TSval=2384283 TSecr=0 WS=64
151.300350     10.0.1.3 -> 10.0.1.2     TCP 74 glrpc > 48916 [SYN, ACK] Seq=0 Ack=1 Win=5792 Len=0 MSS=1460 SACK_PERM=1 TSval=27876799 TSecr=2384283 WS=64
151.300365     10.0.1.2 -> 10.0.1.3     TCP 66 48916 > glrpc [ACK] Seq=1 Ack=1 Win=14656 Len=0 TSval=2384283 TSecr=27876799
176.805097     10.0.1.2 -> 10.0.1.3     TCP 66 48916 > glrpc [FIN, ACK] Seq=9 Ack=300000001 Win=3011840 Len=0 TSval=2390659 TSecr=27883124
176.844267     10.0.1.3 -> 10.0.1.2     TCP 66 glrpc > 48916 [ACK] Seq=300000001 Ack=10 Win=5824 Len=0 TSval=27883185 TSecr=2390659
181.806423     10.0.1.2 -> 10.0.1.3     TCP 74 48919 > glrpc [SYN] Seq=0 Win=14600 Len=0 MSS=1460 SACK_PERM=1 TSval=2391909 TSecr=0 WS=64
181.806704     10.0.1.3 -> 10.0.1.2     TCP 74 glrpc > 48919 [SYN, ACK] Seq=0 Ack=1 Win=5792 Len=0 MSS=1460 SACK_PERM=1 TSval=27884425 TSecr=2391909 WS=64
181.806717     10.0.1.2 -> 10.0.1.3     TCP 66 48919 > glrpc [ACK] Seq=1 Ack=1 Win=14656 Len=0 TSval=2391909 TSecr=27884425
207.310192     10.0.1.2 -> 10.0.1.3     TCP 66 48919 > glrpc [FIN, ACK] Seq=9 Ack=300000001 Win=3011840 Len=0 TSval=2398285 TSecr=27890738
207.349601     10.0.1.3 -> 10.0.1.2     TCP 66 glrpc > 48919 [ACK] Seq=300000001 Ack=10 Win=5824 Len=0 TSval=27890811 TSecr=2398285
212.336377     10.0.1.2 -> 10.0.1.3     TCP 74 48920 > glrpc [SYN] Seq=0 Win=14600 Len=0 MSS=1460 SACK_PERM=1 TSval=2399542 TSecr=0 WS=64
212.336707     10.0.1.3 -> 10.0.1.2     TCP 74 glrpc > 48920 [SYN, ACK] Seq=0 Ack=1 Win=5792 Len=0 MSS=1460 SACK_PERM=1 TSval=27892057 TSecr=2399542 WS=64
212.336722     10.0.1.2 -> 10.0.1.3     TCP 66 48920 > glrpc [ACK] Seq=1 Ack=1 Win=14656 Len=0 TSval=2399542 TSecr=27892057
237.840509     10.0.1.2 -> 10.0.1.3     TCP 66 48920 > glrpc [FIN, ACK] Seq=9 Ack=300000001 Win=3011840 Len=0 TSval=2405918 TSecr=27898370
237.879876     10.0.1.3 -> 10.0.1.2     TCP 66 glrpc > 48920 [ACK] Seq=300000001 Ack=10 Win=5824 Len=0 TSval=27898443 TSecr=2405918
243.007868     10.0.1.2 -> 10.0.1.3     TCP 74 48923 > glrpc [SYN] Seq=0 Win=14600 Len=0 MSS=1460 SACK_PERM=1 TSval=2407209 TSecr=0 WS=64
243.008174     10.0.1.3 -> 10.0.1.2     TCP 74 glrpc > 48923 [SYN, ACK] Seq=0 Ack=1 Win=5792 Len=0 MSS=1460 SACK_PERM=1 TSval=27899724 TSecr=2407209 WS=64
243.008186     10.0.1.2 -> 10.0.1.3     TCP 66 48923 > glrpc [ACK] Seq=1 Ack=1 Win=14656 Len=0 TSval=2407210 TSecr=27899724
268.518669     10.0.1.2 -> 10.0.1.3     TCP 66 48923 > glrpc [FIN, ACK] Seq=9 Ack=300000001 Win=2985792 Len=0 TSval=2413587 TSecr=27906039
268.559227     10.0.1.3 -> 10.0.1.2     TCP 66 glrpc > 48923 [ACK] Seq=300000001 Ack=10 Win=5824 Len=0 TSval=27906112 TSecr=2413587
273.520189     10.0.1.2 -> 10.0.1.3     TCP 74 48924 > glrpc [SYN] Seq=0 Win=14600 Len=0 MSS=1460 SACK_PERM=1 TSval=2414838 TSecr=0 WS=64
273.520470     10.0.1.3 -> 10.0.1.2     TCP 74 glrpc > 48924 [SYN, ACK] Seq=0 Ack=1 Win=5792 Len=0 MSS=1460 SACK_PERM=1 TSval=27907352 TSecr=2414838 WS=64
273.520485     10.0.1.2 -> 10.0.1.3     TCP 66 48924 > glrpc [ACK] Seq=1 Ack=1 Win=14656 Len=0 TSval=2414838 TSecr=27907352
299.022921     10.0.1.2 -> 10.0.1.3     TCP 66 48924 > glrpc [FIN, ACK] Seq=9 Ack=300000001 Win=3011840 Len=0 TSval=2421213 TSecr=27913667
299.061466     10.0.1.3 -> 10.0.1.2     TCP 66 glrpc > 48924 [ACK] Seq=300000001 Ack=10 Win=5824 Len=0 TSval=27913737 TSecr=2421213
304.033884     10.0.1.2 -> 10.0.1.3     TCP 74 48928 > glrpc [SYN] Seq=0 Win=14600 Len=0 MSS=1460 SACK_PERM=1 TSval=2422466 TSecr=0 WS=64
304.034177     10.0.1.3 -> 10.0.1.2     TCP 74 glrpc > 48928 [SYN, ACK] Seq=0 Ack=1 Win=5792 Len=0 MSS=1460 SACK_PERM=1 TSval=27914980 TSecr=2422466 WS=64
304.034191     10.0.1.2 -> 10.0.1.3     TCP 66 48928 > glrpc [ACK] Seq=1 Ack=1 Win=14656 Len=0 TSval=2422466 TSecr=27914980
329.537457     10.0.1.2 -> 10.0.1.3     TCP 66 48928 > glrpc [FIN, ACK] Seq=9 Ack=300000001 Win=3006080 Len=0 TSval=2428842 TSecr=27921297
329.576865     10.0.1.3 -> 10.0.1.2     TCP 66 glrpc > 48928 [ACK] Seq=300000001 Ack=10 Win=5824 Len=0 TSval=27921365 TSecr=2428842
334.538896     10.0.1.2 -> 10.0.1.3     TCP 74 48929 > glrpc [SYN] Seq=0 Win=14600 Len=0 MSS=1460 SACK_PERM=1 TSval=2430092 TSecr=0 WS=64
334.539184     10.0.1.3 -> 10.0.1.2     TCP 74 glrpc > 48929 [SYN, ACK] Seq=0 Ack=1 Win=5792 Len=0 MSS=1460 SACK_PERM=1 TSval=27922606 TSecr=2430092 WS=64
334.539200     10.0.1.2 -> 10.0.1.3     TCP 66 48929 > glrpc [ACK] Seq=1 Ack=1 Win=14656 Len=0 TSval=2430092 TSecr=27922606
360.043712     10.0.1.2 -> 10.0.1.3     TCP 66 48929 > glrpc [FIN, ACK] Seq=9 Ack=300000001 Win=3011840 Len=0 TSval=2436468 TSecr=27928960
360.081042     10.0.1.3 -> 10.0.1.2     TCP 66 glrpc > 48929 [ACK] Seq=300000001 Ack=10 Win=5824 Len=0 TSval=27928991 TSecr=2436468
365.045088     10.0.1.2 -> 10.0.1.3     TCP 74 48932 > glrpc [SYN] Seq=0 Win=14600 Len=0 MSS=1460 SACK_PERM=1 TSval=2437719 TSecr=0 WS=64
365.045384     10.0.1.3 -> 10.0.1.2     TCP 74 glrpc > 48932 [SYN, ACK] Seq=0 Ack=1 Win=5792 Len=0 MSS=1460 SACK_PERM=1 TSval=27930232 TSecr=2437719 WS=64
365.045399     10.0.1.2 -> 10.0.1.3     TCP 66 48932 > glrpc [ACK] Seq=1 Ack=1 Win=14656 Len=0 TSval=2437719 TSecr=27930232
390.552768     10.0.1.2 -> 10.0.1.3     TCP 66 48932 > glrpc [FIN, ACK] Seq=9 Ack=300000001 Win=3011840 Len=0 TSval=2444096 TSecr=27936544
390.591360     10.0.1.3 -> 10.0.1.2     TCP 66 glrpc > 48932 [ACK] Seq=300000001 Ack=10 Win=5824 Len=0 TSval=27936618 TSecr=2444096
395.554297     10.0.1.2 -> 10.0.1.3     TCP 74 48935 > glrpc [SYN] Seq=0 Win=14600 Len=0 MSS=1460 SACK_PERM=1 TSval=2445346 TSecr=0 WS=64
395.554642     10.0.1.3 -> 10.0.1.2     TCP 74 glrpc > 48935 [SYN, ACK] Seq=0 Ack=1 Win=5792 Len=0 MSS=1460 SACK_PERM=1 TSval=27937858 TSecr=2445346 WS=64
395.554659     10.0.1.2 -> 10.0.1.3     TCP 66 48935 > glrpc [ACK] Seq=1 Ack=1 Win=14656 Len=0 TSval=2445346 TSecr=27937858
426.059103     10.0.1.2 -> 10.0.1.3     TCP 74 48937 > glrpc [SYN] Seq=0 Win=14600 Len=0 MSS=1460 SACK_PERM=1 TSval=2452972 TSecr=0 WS=64
426.059407     10.0.1.3 -> 10.0.1.2     TCP 74 glrpc > 48937 [SYN, ACK] Seq=0 Ack=1 Win=5792 Len=0 MSS=1460 SACK_PERM=1 TSval=27945484 TSecr=2452972 WS=64
426.059424     10.0.1.2 -> 10.0.1.3     TCP 66 48937 > glrpc [ACK] Seq=1 Ack=1 Win=14656 Len=0 TSval=2452972 TSecr=27945484
451.561246     10.0.1.2 -> 10.0.1.3     TCP 66 48937 > glrpc [FIN, ACK] Seq=9 Ack=300000001 Win=3011840 Len=0 TSval=2459348 TSecr=27951795
451.599943     10.0.1.3 -> 10.0.1.2     TCP 66 glrpc > 48937 [ACK] Seq=300000001 Ack=10 Win=5824 Len=0 TSval=27951869 TSecr=2459348
456.562752     10.0.1.2 -> 10.0.1.3     TCP 74 48939 > glrpc [SYN] Seq=0 Win=14600 Len=0 MSS=1460 SACK_PERM=1 TSval=2460598 TSecr=0 WS=64
456.563048     10.0.1.3 -> 10.0.1.2     TCP 74 glrpc > 48939 [SYN, ACK] Seq=0 Ack=1 Win=5792 Len=0 MSS=1460 SACK_PERM=1 TSval=27953109 TSecr=2460598 WS=64
456.563064     10.0.1.2 -> 10.0.1.3     TCP 66 48939 > glrpc [ACK] Seq=1 Ack=1 Win=14656 Len=0 TSval=2460598 TSecr=27953109
482.065476     10.0.1.2 -> 10.0.1.3     TCP 66 48939 > glrpc [FIN, ACK] Seq=9 Ack=300000001 Win=2991616 Len=0 TSval=2466974 TSecr=27959463
482.103225     10.0.1.3 -> 10.0.1.2     TCP 66 glrpc > 48939 [ACK] Seq=300000001 Ack=10 Win=5824 Len=0 TSval=27959494 TSecr=2466974
487.066880     10.0.1.2 -> 10.0.1.3     TCP 74 48941 > glrpc [SYN] Seq=0 Win=14600 Len=0 MSS=1460 SACK_PERM=1 TSval=2468224 TSecr=0 WS=64
487.067166     10.0.1.3 -> 10.0.1.2     TCP 74 glrpc > 48941 [SYN, ACK] Seq=0 Ack=1 Win=5792 Len=0 MSS=1460 SACK_PERM=1 TSval=27960735 TSecr=2468224 WS=64
487.067178     10.0.1.2 -> 10.0.1.3     TCP 66 48941 > glrpc [ACK] Seq=1 Ack=1 Win=14656 Len=0 TSval=2468224 TSecr=27960735
512.569140     10.0.1.2 -> 10.0.1.3     TCP 66 48941 > glrpc [FIN, ACK] Seq=9 Ack=300000001 Win=3014784 Len=0 TSval=2474600 TSecr=27967046
512.608553     10.0.1.3 -> 10.0.1.2     TCP 66 glrpc > 48941 [ACK] Seq=300000001 Ack=10 Win=5824 Len=0 TSval=27967120 TSecr=2474600
517.595839     10.0.1.2 -> 10.0.1.3     TCP 74 48943 > glrpc [SYN] Seq=0 Win=14600 Len=0 MSS=1460 SACK_PERM=1 TSval=2475856 TSecr=0 WS=64
517.596109     10.0.1.3 -> 10.0.1.2     TCP 74 glrpc > 48943 [SYN, ACK] Seq=0 Ack=1 Win=5792 Len=0 MSS=1460 SACK_PERM=1 TSval=27968366 TSecr=2475856 WS=64
517.596123     10.0.1.2 -> 10.0.1.3     TCP 66 48943 > glrpc [ACK] Seq=1 Ack=1 Win=14656 Len=0 TSval=2475857 TSecr=27968366
543.099366     10.0.1.2 -> 10.0.1.3     TCP 66 48943 > glrpc [FIN, ACK] Seq=9 Ack=300000001 Win=3014784 Len=0 TSval=2482232 TSecr=27974680
543.138874     10.0.1.3 -> 10.0.1.2     TCP 66 glrpc > 48943 [ACK] Seq=300000001 Ack=10 Win=5824 Len=0 TSval=27974752 TSecr=2482232
548.133763     10.0.1.2 -> 10.0.1.3     TCP 74 48945 > glrpc [SYN] Seq=0 Win=14600 Len=0 MSS=1460 SACK_PERM=1 TSval=2483491 TSecr=0 WS=64
548.134051     10.0.1.3 -> 10.0.1.2     TCP 74 glrpc > 48945 [SYN, ACK] Seq=0 Ack=1 Win=5792 Len=0 MSS=1460 SACK_PERM=1 TSval=27976000 TSecr=2483491 WS=64
548.134065     10.0.1.2 -> 10.0.1.3     TCP 66 48945 > glrpc [ACK] Seq=1 Ack=1 Win=14656 Len=0 TSval=2483491 TSecr=27976000
573.636757     10.0.1.2 -> 10.0.1.3     TCP 66 48945 > glrpc [FIN, ACK] Seq=9 Ack=300000001 Win=3011840 Len=0 TSval=2489867 TSecr=27982315
573.673138     10.0.1.3 -> 10.0.1.2     TCP 66 glrpc > 48945 [ACK] Seq=300000001 Ack=10 Win=5824 Len=0 TSval=27982385 TSecr=2489867
578.705836     10.0.1.2 -> 10.0.1.3     TCP 74 48946 > glrpc [SYN] Seq=0 Win=14600 Len=0 MSS=1460 SACK_PERM=1 TSval=2491134 TSecr=0 WS=64
578.706162     10.0.1.3 -> 10.0.1.2     TCP 74 glrpc > 48946 [SYN, ACK] Seq=0 Ack=1 Win=5792 Len=0 MSS=1460 SACK_PERM=1 TSval=27983643 TSecr=2491134 WS=64
578.706177     10.0.1.2 -> 10.0.1.3     TCP 66 48946 > glrpc [ACK] Seq=1 Ack=1 Win=14656 Len=0 TSval=2491134 TSecr=27983643
