  1   0.000000     10.0.1.2 -> 10.0.1.3     TCP 74 50693 > glrpc [SYN] Seq=0 Win=14600 Len=0 MSS=1460 SACK_PERM=1 TSval=7195514 TSecr=0 WS=64
  2   0.000337     10.0.1.3 -> 10.0.1.2     TCP 74 glrpc > 50693 [SYN, ACK] Seq=0 Ack=1 Win=5792 Len=0 MSS=1460 SACK_PERM=1 TSval=32687670 TSecr=7195514 WS=64
  3   0.000354     10.0.1.2 -> 10.0.1.3     TCP 66 50693 > glrpc [ACK] Seq=1 Ack=1 Win=14656 Len=0 TSval=7195514 TSecr=32687670
466333  38.329533     10.0.1.2 -> 10.0.1.3     TCP 66 50693 > glrpc [FIN, ACK] Seq=9 Ack=450000001 Win=3011840 Len=0 TSval=7205097 TSecr=32697199
466334  38.366726     10.0.1.3 -> 10.0.1.2     TCP 66 glrpc > 50693 [ACK] Seq=450000001 Ack=10 Win=5824 Len=0 TSval=32697261 TSecr=7205097
  1   0.000000     10.0.1.2 -> 10.0.1.3     TCP 74 50702 > glrpc [SYN] Seq=0 Win=14600 Len=0 MSS=1460 SACK_PERM=1 TSval=7262098 TSecr=0 WS=64
  2   0.000350     10.0.1.3 -> 10.0.1.2     TCP 74 glrpc > 50702 [SYN, ACK] Seq=0 Ack=1 Win=5792 Len=0 MSS=1460 SACK_PERM=1 TSval=32754249 TSecr=7262098 WS=64
  3   0.000363     10.0.1.2 -> 10.0.1.3     TCP 66 50702 > glrpc [ACK] Seq=1 Ack=1 Win=14656 Len=0 TSval=7262098 TSecr=32754249
440666  38.283827     10.0.1.2 -> 10.0.1.3     TCP 66 50702 > glrpc [FIN, ACK] Seq=9 Ack=450000001 Win=3011840 Len=0 TSval=7271669 TSecr=32763757
440667  38.322990     10.0.1.3 -> 10.0.1.2     TCP 66 glrpc > 50702 [ACK] Seq=450000001 Ack=10 Win=5824 Len=0 TSval=32763829 TSecr=7271669
  1   0.000000     10.0.1.2 -> 10.0.1.3     TCP 74 50710 > glrpc [SYN] Seq=0 Win=14600 Len=0 MSS=1460 SACK_PERM=1 TSval=7320298 TSecr=0 WS=64
  2   0.000294     10.0.1.3 -> 10.0.1.2     TCP 74 glrpc > 50710 [SYN, ACK] Seq=0 Ack=1 Win=5792 Len=0 MSS=1460 SACK_PERM=1 TSval=32812444 TSecr=7320298 WS=64
  3   0.000306     10.0.1.2 -> 10.0.1.3     TCP 66 50710 > glrpc [ACK] Seq=1 Ack=1 Win=14656 Len=0 TSval=7320298 TSecr=32812444
453626  38.275260     10.0.1.2 -> 10.0.1.3     TCP 66 50710 > glrpc [FIN, ACK] Seq=9 Ack=450000001 Win=3011840 Len=0 TSval=7329867 TSecr=32821952
453627  38.312559     10.0.1.3 -> 10.0.1.2     TCP 66 glrpc > 50710 [ACK] Seq=450000001 Ack=10 Win=5824 Len=0 TSval=32822022 TSecr=7329867
  1   0.000000     10.0.1.2 -> 10.0.1.3     TCP 74 50717 > glrpc [SYN] Seq=0 Win=14600 Len=0 MSS=1460 SACK_PERM=1 TSval=7382938 TSecr=0 WS=64
  2   0.000285     10.0.1.3 -> 10.0.1.2     TCP 74 glrpc > 50717 [SYN, ACK] Seq=0 Ack=1 Win=5792 Len=0 MSS=1460 SACK_PERM=1 TSval=32875080 TSecr=7382938 WS=64
  3   0.000300     10.0.1.2 -> 10.0.1.3     TCP 66 50717 > glrpc [ACK] Seq=1 Ack=1 Win=14656 Len=0 TSval=7382938 TSecr=32875080
466582  38.298033     10.0.1.2 -> 10.0.1.3     TCP 66 50717 > glrpc [FIN, ACK] Seq=9 Ack=450000001 Win=3011840 Len=0 TSval=7392513 TSecr=32884601
466583  38.339215     10.0.1.3 -> 10.0.1.2     TCP 66 glrpc > 50717 [ACK] Seq=450000001 Ack=10 Win=5824 Len=0 TSval=32884664 TSecr=7392513
  1   0.000000     10.0.1.2 -> 10.0.1.3     TCP 74 50725 > glrpc [SYN] Seq=0 Win=14600 Len=0 MSS=1460 SACK_PERM=1 TSval=7449922 TSecr=0 WS=64
  2   0.000345     10.0.1.3 -> 10.0.1.2     TCP 74 glrpc > 50725 [SYN, ACK] Seq=0 Ack=1 Win=5792 Len=0 MSS=1460 SACK_PERM=1 TSval=32942059 TSecr=7449922 WS=64
  3   0.000365     10.0.1.2 -> 10.0.1.3     TCP 66 50725 > glrpc [ACK] Seq=1 Ack=1 Win=14656 Len=0 TSval=7449922 TSecr=32942059
436047  38.291748     10.0.1.2 -> 10.0.1.3     TCP 66 50725 > glrpc [FIN, ACK] Seq=9 Ack=450000001 Win=3011840 Len=0 TSval=7459495 TSecr=32951567
436048  38.331413     10.0.1.3 -> 10.0.1.2     TCP 66 glrpc > 50725 [ACK] Seq=450000001 Ack=10 Win=5824 Len=0 TSval=32951641 TSecr=7459495
  1   0.000000     10.0.1.2 -> 10.0.1.3     TCP 74 50731 > glrpc [SYN] Seq=0 Win=14600 Len=0 MSS=1460 SACK_PERM=1 TSval=7506708 TSecr=0 WS=64
  2   0.000327     10.0.1.3 -> 10.0.1.2     TCP 74 glrpc > 50731 [SYN, ACK] Seq=0 Ack=1 Win=5792 Len=0 MSS=1460 SACK_PERM=1 TSval=32998840 TSecr=7506708 WS=64
  3   0.000341     10.0.1.2 -> 10.0.1.3     TCP 66 50731 > glrpc [ACK] Seq=1 Ack=1 Win=14656 Len=0 TSval=7506708 TSecr=32998840
430057  38.275487     10.0.1.2 -> 10.0.1.3     TCP 66 50731 > glrpc [FIN, ACK] Seq=9 Ack=450000001 Win=3011840 Len=0 TSval=7516277 TSecr=33008347
430058  38.313789     10.0.1.3 -> 10.0.1.2     TCP 66 glrpc > 50731 [ACK] Seq=450000001 Ack=10 Win=5824 Len=0 TSval=33008418 TSecr=7516277
  1   0.000000     10.0.1.2 -> 10.0.1.3     TCP 74 50737 > glrpc [SYN] Seq=0 Win=14600 Len=0 MSS=1460 SACK_PERM=1 TSval=7561795 TSecr=0 WS=64
  2   0.000344     10.0.1.3 -> 10.0.1.2     TCP 74 glrpc > 50737 [SYN, ACK] Seq=0 Ack=1 Win=5792 Len=0 MSS=1460 SACK_PERM=1 TSval=33053923 TSecr=7561795 WS=64
  3   0.000360     10.0.1.2 -> 10.0.1.3     TCP 66 50737 > glrpc [ACK] Seq=1 Ack=1 Win=14656 Len=0 TSval=7561795 TSecr=33053923
455876  38.288650     10.0.1.2 -> 10.0.1.3     TCP 66 50737 > glrpc [FIN, ACK] Seq=9 Ack=450000001 Win=3011840 Len=0 TSval=7571367 TSecr=33063430
455877  38.325612     10.0.1.3 -> 10.0.1.2     TCP 66 glrpc > 50737 [ACK] Seq=450000001 Ack=10 Win=5824 Len=0 TSval=33063504 TSecr=7571367
  1   0.000000     10.0.1.2 -> 10.0.1.3     TCP 74 50747 > glrpc [SYN] Seq=0 Win=14600 Len=0 MSS=1460 SACK_PERM=1 TSval=7625729 TSecr=0 WS=64
  2   0.000373     10.0.1.3 -> 10.0.1.2     TCP 74 glrpc > 50747 [SYN, ACK] Seq=0 Ack=1 Win=5792 Len=0 MSS=1460 SACK_PERM=1 TSval=33117853 TSecr=7625729 WS=64
  3   0.000388     10.0.1.2 -> 10.0.1.3     TCP 66 50747 > glrpc [ACK] Seq=1 Ack=1 Win=14656 Len=0 TSval=7625729 TSecr=33117853
432266  38.276125     10.0.1.2 -> 10.0.1.3     TCP 66 50747 > glrpc [FIN, ACK] Seq=9 Ack=450000001 Win=3011840 Len=0 TSval=7635298 TSecr=33127358
432267  38.315728     10.0.1.3 -> 10.0.1.2     TCP 66 glrpc > 50747 [ACK] Seq=450000001 Ack=10 Win=5824 Len=0 TSval=33127431 TSecr=7635298
  1   0.000000     10.0.1.2 -> 10.0.1.3     TCP 74 50754 > glrpc [SYN] Seq=0 Win=14600 Len=0 MSS=1460 SACK_PERM=1 TSval=7681282 TSecr=0 WS=64
  2   0.000291     10.0.1.3 -> 10.0.1.2     TCP 74 glrpc > 50754 [SYN, ACK] Seq=0 Ack=1 Win=5792 Len=0 MSS=1460 SACK_PERM=1 TSval=33173401 TSecr=7681282 WS=64
  3   0.000309     10.0.1.2 -> 10.0.1.3     TCP 66 50754 > glrpc [ACK] Seq=1 Ack=1 Win=14656 Len=0 TSval=7681282 TSecr=33173401
434746  38.302712     10.0.1.2 -> 10.0.1.3     TCP 66 50754 > glrpc [FIN, ACK] Seq=9 Ack=450000001 Win=3014784 Len=0 TSval=7690858 TSecr=33182914
434747  38.341178     10.0.1.3 -> 10.0.1.2     TCP 66 glrpc > 50754 [ACK] Seq=450000001 Ack=10 Win=5824 Len=0 TSval=33182986 TSecr=7690858
  1   0.000000     10.0.1.2 -> 10.0.1.3     TCP 74 50761 > glrpc [SYN] Seq=0 Win=14600 Len=0 MSS=1460 SACK_PERM=1 TSval=7737701 TSecr=0 WS=64
  2   0.000349     10.0.1.3 -> 10.0.1.2     TCP 74 glrpc > 50761 [SYN, ACK] Seq=0 Ack=1 Win=5792 Len=0 MSS=1460 SACK_PERM=1 TSval=33229816 TSecr=7737701 WS=64
  3   0.000370     10.0.1.2 -> 10.0.1.3     TCP 66 50761 > glrpc [ACK] Seq=1 Ack=1 Win=14656 Len=0 TSval=7737701 TSecr=33229816
464912  38.274687     10.0.1.2 -> 10.0.1.3     TCP 66 50761 > glrpc [FIN, ACK] Seq=9 Ack=450000001 Win=3011840 Len=0 TSval=7747270 TSecr=33239324
464913  38.315150     10.0.1.3 -> 10.0.1.2     TCP 66 glrpc > 50761 [ACK] Seq=450000001 Ack=10 Win=5824 Len=0 TSval=33239394 TSecr=7747270
  1   0.000000     10.0.1.2 -> 10.0.1.3     TCP 74 50769 > glrpc [SYN] Seq=0 Win=14600 Len=0 MSS=1460 SACK_PERM=1 TSval=7803846 TSecr=0 WS=64
  2   0.000283     10.0.1.3 -> 10.0.1.2     TCP 74 glrpc > 50769 [SYN, ACK] Seq=0 Ack=1 Win=5792 Len=0 MSS=1460 SACK_PERM=1 TSval=33295956 TSecr=7803846 WS=64
  3   0.000303     10.0.1.2 -> 10.0.1.3     TCP 66 50769 > glrpc [ACK] Seq=1 Ack=1 Win=14656 Len=0 TSval=7803847 TSecr=33295956
436475  38.331856     10.0.1.2 -> 10.0.1.3     TCP 66 50769 > glrpc [FIN, ACK] Seq=9 Ack=450000001 Win=2977088 Len=0 TSval=7813429 TSecr=33305485
436476  38.372866     10.0.1.3 -> 10.0.1.2     TCP 66 glrpc > 50769 [ACK] Seq=450000001 Ack=10 Win=5824 Len=0 TSval=33305549 TSecr=7813429
  1   0.000000     10.0.1.2 -> 10.0.1.3     TCP 74 50777 > glrpc [SYN] Seq=0 Win=14600 Len=0 MSS=1460 SACK_PERM=1 TSval=7861015 TSecr=0 WS=64
  2   0.000350     10.0.1.3 -> 10.0.1.2     TCP 74 glrpc > 50777 [SYN, ACK] Seq=0 Ack=1 Win=5792 Len=0 MSS=1460 SACK_PERM=1 TSval=33353121 TSecr=7861015 WS=64
  3   0.000365     10.0.1.2 -> 10.0.1.3     TCP 66 50777 > glrpc [ACK] Seq=1 Ack=1 Win=14656 Len=0 TSval=7861015 TSecr=33353121
460033  38.280918     10.0.1.2 -> 10.0.1.3     TCP 66 50777 > glrpc [FIN, ACK] Seq=9 Ack=450000001 Win=3011840 Len=0 TSval=7870586 TSecr=33362640
460034  38.317481     10.0.1.3 -> 10.0.1.2     TCP 66 glrpc > 50777 [ACK] Seq=450000001 Ack=10 Win=5824 Len=0 TSval=33362700 TSecr=7870586
  1   0.000000     10.0.1.2 -> 10.0.1.3     TCP 74 50783 > glrpc [SYN] Seq=0 Win=14600 Len=0 MSS=1460 SACK_PERM=1 TSval=7925509 TSecr=0 WS=64
  2   0.000295     10.0.1.3 -> 10.0.1.2     TCP 74 glrpc > 50783 [SYN, ACK] Seq=0 Ack=1 Win=5792 Len=0 MSS=1460 SACK_PERM=1 TSval=33417609 TSecr=7925509 WS=64
  3   0.000316     10.0.1.2 -> 10.0.1.3     TCP 66 50783 > glrpc [ACK] Seq=1 Ack=1 Win=14656 Len=0 TSval=7925509 TSecr=33417609
453770  38.275530     10.0.1.2 -> 10.0.1.3     TCP 66 50783 > glrpc [FIN, ACK] Seq=9 Ack=450000001 Win=3011840 Len=0 TSval=7935078 TSecr=33427125
453771  38.315795     10.0.1.3 -> 10.0.1.2     TCP 66 glrpc > 50783 [ACK] Seq=450000001 Ack=10 Win=5824 Len=0 TSval=33427188 TSecr=7935078
  1   0.000000     10.0.1.2 -> 10.0.1.3     TCP 74 50794 > glrpc [SYN] Seq=0 Win=14600 Len=0 MSS=1460 SACK_PERM=1 TSval=7987811 TSecr=0 WS=64
  2   0.000279     10.0.1.3 -> 10.0.1.2     TCP 74 glrpc > 50794 [SYN, ACK] Seq=0 Ack=1 Win=5792 Len=0 MSS=1460 SACK_PERM=1 TSval=33479907 TSecr=7987811 WS=64
  3   0.000294     10.0.1.2 -> 10.0.1.3     TCP 66 50794 > glrpc [ACK] Seq=1 Ack=1 Win=14656 Len=0 TSval=7987811 TSecr=33479907
432838  38.274331     10.0.1.2 -> 10.0.1.3     TCP 66 50794 > glrpc [FIN, ACK] Seq=9 Ack=450000001 Win=3011840 Len=0 TSval=7997379 TSecr=33489412
432839  38.314002     10.0.1.3 -> 10.0.1.2     TCP 66 glrpc > 50794 [ACK] Seq=450000001 Ack=10 Win=5824 Len=0 TSval=33489485 TSecr=7997379
  1   0.000000     10.0.1.2 -> 10.0.1.3     TCP 74 50799 > glrpc [SYN] Seq=0 Win=14600 Len=0 MSS=1460 SACK_PERM=1 TSval=8043566 TSecr=0 WS=64
  2   0.000347     10.0.1.3 -> 10.0.1.2     TCP 74 glrpc > 50799 [SYN, ACK] Seq=0 Ack=1 Win=5792 Len=0 MSS=1460 SACK_PERM=1 TSval=33535658 TSecr=8043566 WS=64
  3   0.000365     10.0.1.2 -> 10.0.1.3     TCP 66 50799 > glrpc [ACK] Seq=1 Ack=1 Win=14656 Len=0 TSval=8043566 TSecr=33535658
444910  38.293333     10.0.1.2 -> 10.0.1.3     TCP 66 50799 > glrpc [FIN, ACK] Seq=9 Ack=450000001 Win=3085184 Len=0 TSval=8053139 TSecr=33545164
444911  38.330123     10.0.1.3 -> 10.0.1.2     TCP 66 glrpc > 50799 [ACK] Seq=450000001 Ack=10 Win=5824 Len=0 TSval=33545240 TSecr=8053139
  1   0.000000     10.0.1.2 -> 10.0.1.3     TCP 74 50807 > glrpc [SYN] Seq=0 Win=14600 Len=0 MSS=1460 SACK_PERM=1 TSval=8103266 TSecr=0 WS=64
  2   0.000403     10.0.1.3 -> 10.0.1.2     TCP 74 glrpc > 50807 [SYN, ACK] Seq=0 Ack=1 Win=5792 Len=0 MSS=1460 SACK_PERM=1 TSval=33595353 TSecr=8103266 WS=64
  3   0.000418     10.0.1.2 -> 10.0.1.3     TCP 66 50807 > glrpc [ACK] Seq=1 Ack=1 Win=14656 Len=0 TSval=8103266 TSecr=33595353
439844  38.276730     10.0.1.2 -> 10.0.1.3     TCP 66 50807 > glrpc [FIN, ACK] Seq=9 Ack=450000001 Win=3011840 Len=0 TSval=8112835 TSecr=33604900
439845  38.316231     10.0.1.3 -> 10.0.1.2     TCP 66 glrpc > 50807 [ACK] Seq=450000001 Ack=10 Win=5824 Len=0 TSval=33604932 TSecr=8112835
  1   0.000000     10.0.1.2 -> 10.0.1.3     TCP 74 50814 > glrpc [SYN] Seq=0 Win=14600 Len=0 MSS=1460 SACK_PERM=1 TSval=8160971 TSecr=0 WS=64
  2   0.000309     10.0.1.3 -> 10.0.1.2     TCP 74 glrpc > 50814 [SYN, ACK] Seq=0 Ack=1 Win=5792 Len=0 MSS=1460 SACK_PERM=1 TSval=33653054 TSecr=8160971 WS=64
  3   0.000330     10.0.1.2 -> 10.0.1.3     TCP 66 50814 > glrpc [ACK] Seq=1 Ack=1 Win=14656 Len=0 TSval=8160971 TSecr=33653054
437794  38.305989     10.0.1.2 -> 10.0.1.3     TCP 66 50814 > glrpc [FIN, ACK] Seq=9 Ack=450000001 Win=3011840 Len=0 TSval=8170547 TSecr=33662569
437795  38.342566     10.0.1.3 -> 10.0.1.2     TCP 66 glrpc > 50814 [ACK] Seq=450000001 Ack=10 Win=5824 Len=0 TSval=33662639 TSecr=8170547
  1   0.000000     10.0.1.2 -> 10.0.1.3     TCP 74 50822 > glrpc [SYN] Seq=0 Win=14600 Len=0 MSS=1460 SACK_PERM=1 TSval=8218283 TSecr=0 WS=64
  2   0.000326     10.0.1.3 -> 10.0.1.2     TCP 74 glrpc > 50822 [SYN, ACK] Seq=0 Ack=1 Win=5792 Len=0 MSS=1460 SACK_PERM=1 TSval=33710361 TSecr=8218283 WS=64
  3   0.000345     10.0.1.2 -> 10.0.1.3     TCP 66 50822 > glrpc [ACK] Seq=1 Ack=1 Win=14656 Len=0 TSval=8218283 TSecr=33710361
453365  38.289614     10.0.1.2 -> 10.0.1.3     TCP 66 50822 > glrpc [FIN, ACK] Seq=9 Ack=450000001 Win=3000256 Len=0 TSval=8227855 TSecr=33719870
453366  38.328552     10.0.1.3 -> 10.0.1.2     TCP 66 glrpc > 50822 [ACK] Seq=450000001 Ack=10 Win=5824 Len=0 TSval=33719943 TSecr=8227855
  1   0.000000     10.0.1.2 -> 10.0.1.3     TCP 74 50828 > glrpc [SYN] Seq=0 Win=14600 Len=0 MSS=1460 SACK_PERM=1 TSval=8280791 TSecr=0 WS=64
  2   0.000325     10.0.1.3 -> 10.0.1.2     TCP 74 glrpc > 50828 [SYN, ACK] Seq=0 Ack=1 Win=5792 Len=0 MSS=1460 SACK_PERM=1 TSval=33772865 TSecr=8280791 WS=64
  3   0.000340     10.0.1.2 -> 10.0.1.3     TCP 66 50828 > glrpc [ACK] Seq=1 Ack=1 Win=14656 Len=0 TSval=8280791 TSecr=33772865
466111  38.281947     10.0.1.2 -> 10.0.1.3     TCP 66 50828 > glrpc [FIN, ACK] Seq=9 Ack=450000001 Win=3011840 Len=0 TSval=8290361 TSecr=33782373
466112  38.321341     10.0.1.3 -> 10.0.1.2     TCP 66 glrpc > 50828 [ACK] Seq=450000001 Ack=10 Win=5824 Len=0 TSval=33782445 TSecr=8290361
  1   0.000000     10.0.1.2 -> 10.0.1.3     TCP 74 50836 > glrpc [SYN] Seq=0 Win=14600 Len=0 MSS=1460 SACK_PERM=1 TSval=8347143 TSecr=0 WS=64
  2   0.000428     10.0.1.3 -> 10.0.1.2     TCP 74 glrpc > 50836 [SYN, ACK] Seq=0 Ack=1 Win=5792 Len=0 MSS=1460 SACK_PERM=1 TSval=33839212 TSecr=8347143 WS=64
  3   0.000450     10.0.1.2 -> 10.0.1.3     TCP 66 50836 > glrpc [ACK] Seq=1 Ack=1 Win=14656 Len=0 TSval=8347143 TSecr=33839212
463885  38.282171     10.0.1.2 -> 10.0.1.3     TCP 66 50836 > glrpc [FIN, ACK] Seq=9 Ack=450000001 Win=2982912 Len=0 TSval=8356713 TSecr=33848720
463886  38.322005     10.0.1.3 -> 10.0.1.2     TCP 66 glrpc > 50836 [ACK] Seq=450000001 Ack=10 Win=5824 Len=0 TSval=33848792 TSecr=8356713
