  1   0.000000     10.0.1.2 -> 10.0.1.3     TCP 74 50226 > glrpc [SYN] Seq=0 Win=14600 Len=0 MSS=1460 SACK_PERM=1 TSval=5227945 TSecr=0 WS=64
  2   0.000291     10.0.1.3 -> 10.0.1.2     TCP 74 glrpc > 50226 [SYN, ACK] Seq=0 Ack=1 Win=5792 Len=0 MSS=1460 SACK_PERM=1 TSval=30720248 TSecr=5227945 WS=64
  3   0.000307     10.0.1.2 -> 10.0.1.3     TCP 66 50226 > glrpc [ACK] Seq=1 Ack=1 Win=14656 Len=0 TSval=5227945 TSecr=30720248
309809  25.755281     10.0.1.2 -> 10.0.1.3     TCP 66 50226 > glrpc [FIN, ACK] Seq=9 Ack=300000001 Win=2971328 Len=0 TSval=5234384 TSecr=30726666
309810  25.794458     10.0.1.3 -> 10.0.1.2     TCP 66 glrpc > 50226 [ACK] Seq=300000001 Ack=10 Win=5824 Len=0 TSval=30726697 TSecr=5234384
  1   0.000000     10.0.1.2 -> 10.0.1.3     TCP 74 50243 > glrpc [SYN] Seq=0 Win=14600 Len=0 MSS=1460 SACK_PERM=1 TSval=5253007 TSecr=0 WS=64
  2   0.000299     10.0.1.3 -> 10.0.1.2     TCP 74 glrpc > 50243 [SYN, ACK] Seq=0 Ack=1 Win=5792 Len=0 MSS=1460 SACK_PERM=1 TSval=30745308 TSecr=5253007 WS=64
  3   0.000315     10.0.1.2 -> 10.0.1.3     TCP 66 50243 > glrpc [ACK] Seq=1 Ack=1 Win=14656 Len=0 TSval=5253007 TSecr=30745308
293102  25.820135     10.0.1.2 -> 10.0.1.3     TCP 66 50243 > glrpc [FIN, ACK] Seq=9 Ack=300000001 Win=3049536 Len=0 TSval=5259462 TSecr=30751697
293103  25.858761     10.0.1.3 -> 10.0.1.2     TCP 66 glrpc > 50243 [ACK] Seq=300000001 Ack=10 Win=5824 Len=0 TSval=30751773 TSecr=5259462
  1   0.000000     10.0.1.2 -> 10.0.1.3     TCP 74 50245 > glrpc [SYN] Seq=0 Win=14600 Len=0 MSS=1460 SACK_PERM=1 TSval=5274604 TSecr=0 WS=64
  2   0.000293     10.0.1.3 -> 10.0.1.2     TCP 74 glrpc > 50245 [SYN, ACK] Seq=0 Ack=1 Win=5792 Len=0 MSS=1460 SACK_PERM=1 TSval=30766903 TSecr=5274604 WS=64
  3   0.000309     10.0.1.2 -> 10.0.1.3     TCP 66 50245 > glrpc [ACK] Seq=1 Ack=1 Win=14656 Len=0 TSval=5274604 TSecr=30766903
302545  25.970297     10.0.1.2 -> 10.0.1.3     TCP 66 50245 > glrpc [FIN, ACK] Seq=9 Ack=300000001 Win=2985792 Len=0 TSval=5281096 TSecr=30773352
302546  26.010305     10.0.1.3 -> 10.0.1.2     TCP 66 glrpc > 50245 [ACK] Seq=300000001 Ack=10 Win=5824 Len=0 TSval=30773406 TSecr=5281096
  1   0.000000     10.0.1.2 -> 10.0.1.3     TCP 74 50248 > glrpc [SYN] Seq=0 Win=14600 Len=0 MSS=1460 SACK_PERM=1 TSval=5298100 TSecr=0 WS=64
  2   0.000431     10.0.1.3 -> 10.0.1.2     TCP 74 glrpc > 50248 [SYN, ACK] Seq=0 Ack=1 Win=5792 Len=0 MSS=1460 SACK_PERM=1 TSval=30790398 TSecr=5298100 WS=64
  3   0.000446     10.0.1.2 -> 10.0.1.3     TCP 66 50248 > glrpc [ACK] Seq=1 Ack=1 Win=14656 Len=0 TSval=5298100 TSecr=30790398
286969  25.947098     10.0.1.2 -> 10.0.1.3     TCP 66 50248 > glrpc [FIN, ACK] Seq=9 Ack=300000001 Win=2977088 Len=0 TSval=5304586 TSecr=30796821
286970  25.986133     10.0.1.3 -> 10.0.1.2     TCP 66 glrpc > 50248 [ACK] Seq=300000001 Ack=10 Win=5824 Len=0 TSval=30796894 TSecr=5304586
  1   0.000000     10.0.1.2 -> 10.0.1.3     TCP 74 50252 > glrpc [SYN] Seq=0 Win=14600 Len=0 MSS=1460 SACK_PERM=1 TSval=5318921 TSecr=0 WS=64
  2   0.000336     10.0.1.3 -> 10.0.1.2     TCP 74 glrpc > 50252 [SYN, ACK] Seq=0 Ack=1 Win=5792 Len=0 MSS=1460 SACK_PERM=1 TSval=30811217 TSecr=5318921 WS=64
  3   0.000358     10.0.1.2 -> 10.0.1.3     TCP 66 50252 > glrpc [ACK] Seq=1 Ack=1 Win=14656 Len=0 TSval=5318921 TSecr=30811217
300973  25.858237     10.0.1.2 -> 10.0.1.3     TCP 66 50252 > glrpc [FIN, ACK] Seq=9 Ack=300000001 Win=3008960 Len=0 TSval=5325386 TSecr=30817617
300974  25.894908     10.0.1.3 -> 10.0.1.2     TCP 66 glrpc > 50252 [ACK] Seq=300000001 Ack=10 Win=5824 Len=0 TSval=30817691 TSecr=5325386
  1   0.000000     10.0.1.2 -> 10.0.1.3     TCP 74 50255 > glrpc [SYN] Seq=0 Win=14600 Len=0 MSS=1460 SACK_PERM=1 TSval=5341911 TSecr=0 WS=64
  2   0.000330     10.0.1.3 -> 10.0.1.2     TCP 74 glrpc > 50255 [SYN, ACK] Seq=0 Ack=1 Win=5792 Len=0 MSS=1460 SACK_PERM=1 TSval=30834205 TSecr=5341911 WS=64
  3   0.000347     10.0.1.2 -> 10.0.1.3     TCP 66 50255 > glrpc [ACK] Seq=1 Ack=1 Win=14656 Len=0 TSval=5341911 TSecr=30834205
310929  25.858836     10.0.1.2 -> 10.0.1.3     TCP 66 50255 > glrpc [FIN, ACK] Seq=9 Ack=300000001 Win=2974208 Len=0 TSval=5348375 TSecr=30840617
310930  25.898724     10.0.1.3 -> 10.0.1.2     TCP 66 glrpc > 50255 [ACK] Seq=300000001 Ack=10 Win=5824 Len=0 TSval=30840680 TSecr=5348375
  1   0.000000     10.0.1.2 -> 10.0.1.3     TCP 74 50261 > glrpc [SYN] Seq=0 Win=14600 Len=0 MSS=1460 SACK_PERM=1 TSval=5366833 TSecr=0 WS=64
  2   0.000290     10.0.1.3 -> 10.0.1.2     TCP 74 glrpc > 50261 [SYN, ACK] Seq=0 Ack=1 Win=5792 Len=0 MSS=1460 SACK_PERM=1 TSval=30859126 TSecr=5366833 WS=64
  3   0.000305     10.0.1.2 -> 10.0.1.3     TCP 66 50261 > glrpc [ACK] Seq=1 Ack=1 Win=14656 Len=0 TSval=5366833 TSecr=30859126
311236  25.904438     10.0.1.2 -> 10.0.1.3     TCP 66 50261 > glrpc [FIN, ACK] Seq=9 Ack=300000001 Win=3085184 Len=0 TSval=5373309 TSecr=30865536
311237  25.944078     10.0.1.3 -> 10.0.1.2     TCP 66 glrpc > 50261 [ACK] Seq=300000001 Ack=10 Win=5824 Len=0 TSval=30865612 TSecr=5373309
  1   0.000000     10.0.1.2 -> 10.0.1.3     TCP 74 50263 > glrpc [SYN] Seq=0 Win=14600 Len=0 MSS=1460 SACK_PERM=1 TSval=5391986 TSecr=0 WS=64
  2   0.000299     10.0.1.3 -> 10.0.1.2     TCP 74 glrpc > 50263 [SYN, ACK] Seq=0 Ack=1 Win=5792 Len=0 MSS=1460 SACK_PERM=1 TSval=30884276 TSecr=5391986 WS=64
  3   0.000317     10.0.1.2 -> 10.0.1.3     TCP 66 50263 > glrpc [ACK] Seq=1 Ack=1 Win=14656 Len=0 TSval=5391986 TSecr=30884276
310877  25.877102     10.0.1.2 -> 10.0.1.3     TCP 66 50263 > glrpc [FIN, ACK] Seq=9 Ack=300000001 Win=2977088 Len=0 TSval=5398455 TSecr=30890681
310878  25.914585     10.0.1.3 -> 10.0.1.2     TCP 66 glrpc > 50263 [ACK] Seq=300000001 Ack=10 Win=5824 Len=0 TSval=30890755 TSecr=5398455
  1   0.000000     10.0.1.2 -> 10.0.1.3     TCP 74 50267 > glrpc [SYN] Seq=0 Win=14600 Len=0 MSS=1460 SACK_PERM=1 TSval=5416866 TSecr=0 WS=64
  2   0.000334     10.0.1.3 -> 10.0.1.2     TCP 74 glrpc > 50267 [SYN, ACK] Seq=0 Ack=1 Win=5792 Len=0 MSS=1460 SACK_PERM=1 TSval=30909155 TSecr=5416866 WS=64
  3   0.000355     10.0.1.2 -> 10.0.1.3     TCP 66 50267 > glrpc [ACK] Seq=1 Ack=1 Win=14656 Len=0 TSval=5416866 TSecr=30909155
291031  25.856702     10.0.1.2 -> 10.0.1.3     TCP 66 50267 > glrpc [FIN, ACK] Seq=9 Ack=300000001 Win=2974208 Len=0 TSval=5423330 TSecr=30915567
291032  25.898062     10.0.1.3 -> 10.0.1.2     TCP 66 glrpc > 50267 [ACK] Seq=300000001 Ack=10 Win=5824 Len=0 TSval=30915629 TSecr=5423330
  1   0.000000     10.0.1.2 -> 10.0.1.3     TCP 74 50271 > glrpc [SYN] Seq=0 Win=14600 Len=0 MSS=1460 SACK_PERM=1 TSval=5438619 TSecr=0 WS=64
  2   0.000333     10.0.1.3 -> 10.0.1.2     TCP 74 glrpc > 50271 [SYN, ACK] Seq=0 Ack=1 Win=5792 Len=0 MSS=1460 SACK_PERM=1 TSval=30930907 TSecr=5438619 WS=64
  3   0.000350     10.0.1.2 -> 10.0.1.3     TCP 66 50271 > glrpc [ACK] Seq=1 Ack=1 Win=14656 Len=0 TSval=5438619 TSecr=30930907
299121  25.883663     10.0.1.2 -> 10.0.1.3     TCP 66 50271 > glrpc [FIN, ACK] Seq=9 Ack=300000001 Win=2991616 Len=0 TSval=5445090 TSecr=30937312
299122  25.922688     10.0.1.3 -> 10.0.1.2     TCP 66 glrpc > 50271 [ACK] Seq=300000001 Ack=10 Win=5824 Len=0 TSval=30937387 TSecr=5445090
  1   0.000000     10.0.1.2 -> 10.0.1.3     TCP 74 50279 > glrpc [SYN] Seq=0 Win=14600 Len=0 MSS=1460 SACK_PERM=1 TSval=5468556 TSecr=0 WS=64
  2   0.000429     10.0.1.3 -> 10.0.1.2     TCP 74 glrpc > 50279 [SYN, ACK] Seq=0 Ack=1 Win=5792 Len=0 MSS=1460 SACK_PERM=1 TSval=30960840 TSecr=5468556 WS=64
  3   0.000450     10.0.1.2 -> 10.0.1.3     TCP 66 50279 > glrpc [ACK] Seq=1 Ack=1 Win=14656 Len=0 TSval=5468556 TSecr=30960840
310622  25.949510     10.0.1.2 -> 10.0.1.3     TCP 66 50279 > glrpc [FIN, ACK] Seq=9 Ack=300000001 Win=3014784 Len=0 TSval=5475043 TSecr=30967273
310623  25.990172     10.0.1.3 -> 10.0.1.2     TCP 66 glrpc > 50279 [ACK] Seq=300000001 Ack=10 Win=5824 Len=0 TSval=30967338 TSecr=5475043
  1   0.000000     10.0.1.2 -> 10.0.1.3     TCP 74 50282 > glrpc [SYN] Seq=0 Win=14600 Len=0 MSS=1460 SACK_PERM=1 TSval=5493194 TSecr=0 WS=64
  2   0.000339     10.0.1.3 -> 10.0.1.2     TCP 74 glrpc > 50282 [SYN, ACK] Seq=0 Ack=1 Win=5792 Len=0 MSS=1460 SACK_PERM=1 TSval=30985477 TSecr=5493194 WS=64
  3   0.000358     10.0.1.2 -> 10.0.1.3     TCP 66 50282 > glrpc [ACK] Seq=1 Ack=1 Win=14656 Len=0 TSval=5493194 TSecr=30985477
291810  25.863602     10.0.1.2 -> 10.0.1.3     TCP 66 50282 > glrpc [FIN, ACK] Seq=9 Ack=300000001 Win=2991616 Len=0 TSval=5499659 TSecr=30991891
291811  25.900745     10.0.1.3 -> 10.0.1.2     TCP 66 glrpc > 50282 [ACK] Seq=300000001 Ack=10 Win=5824 Len=0 TSval=30991952 TSecr=5499659
  1   0.000000     10.0.1.2 -> 10.0.1.3     TCP 74 50285 > glrpc [SYN] Seq=0 Win=14600 Len=0 MSS=1460 SACK_PERM=1 TSval=5513808 TSecr=0 WS=64
  2   0.000338     10.0.1.3 -> 10.0.1.2     TCP 74 glrpc > 50285 [SYN, ACK] Seq=0 Ack=1 Win=5792 Len=0 MSS=1460 SACK_PERM=1 TSval=31006090 TSecr=5513808 WS=64
  3   0.000354     10.0.1.2 -> 10.0.1.3     TCP 66 50285 > glrpc [ACK] Seq=1 Ack=1 Win=14656 Len=0 TSval=5513809 TSecr=31006090
308019  25.524585     10.0.1.2 -> 10.0.1.3     TCP 66 50285 > glrpc [FIN, ACK] Seq=9 Ack=300000001 Win=3011840 Len=0 TSval=5520190 TSecr=31012407
308020  25.563608     10.0.1.3 -> 10.0.1.2     TCP 66 glrpc > 50285 [ACK] Seq=300000001 Ack=10 Win=5824 Len=0 TSval=31012481 TSecr=5520190
  1   0.000000     10.0.1.2 -> 10.0.1.3     TCP 74 50287 > glrpc [SYN] Seq=0 Win=14600 Len=0 MSS=1460 SACK_PERM=1 TSval=5536672 TSecr=0 WS=64
  2   0.000298     10.0.1.3 -> 10.0.1.2     TCP 74 glrpc > 50287 [SYN, ACK] Seq=0 Ack=1 Win=5792 Len=0 MSS=1460 SACK_PERM=1 TSval=31028952 TSecr=5536672 WS=64
  3   0.000317     10.0.1.2 -> 10.0.1.3     TCP 66 50287 > glrpc [ACK] Seq=1 Ack=1 Win=14656 Len=0 TSval=5536672 TSecr=31028952
298732  25.518031     10.0.1.2 -> 10.0.1.3     TCP 66 50287 > glrpc [FIN, ACK] Seq=9 Ack=300000001 Win=3011840 Len=0 TSval=5543051 TSecr=31035272
298733  25.557411     10.0.1.3 -> 10.0.1.2     TCP 66 glrpc > 50287 [ACK] Seq=300000001 Ack=10 Win=5824 Len=0 TSval=31035341 TSecr=5543051
  1   0.000000     10.0.1.2 -> 10.0.1.3     TCP 74 50289 > glrpc [SYN] Seq=0 Win=14600 Len=0 MSS=1460 SACK_PERM=1 TSval=5558003 TSecr=0 WS=64
  2   0.000290     10.0.1.3 -> 10.0.1.2     TCP 74 glrpc > 50289 [SYN, ACK] Seq=0 Ack=1 Win=5792 Len=0 MSS=1460 SACK_PERM=1 TSval=31050282 TSecr=5558003 WS=64
  3   0.000311     10.0.1.2 -> 10.0.1.3     TCP 66 50289 > glrpc [ACK] Seq=1 Ack=1 Win=14656 Len=0 TSval=5558004 TSecr=31050282
297762  25.524384     10.0.1.2 -> 10.0.1.3     TCP 66 50289 > glrpc [FIN, ACK] Seq=9 Ack=300000001 Win=3011840 Len=0 TSval=5564385 TSecr=31056599
297763  25.560798     10.0.1.3 -> 10.0.1.2     TCP 66 glrpc > 50289 [ACK] Seq=300000001 Ack=10 Win=5824 Len=0 TSval=31056672 TSecr=5564385
  1   0.000000     10.0.1.2 -> 10.0.1.3     TCP 74 50291 > glrpc [SYN] Seq=0 Win=14600 Len=0 MSS=1460 SACK_PERM=1 TSval=5579185 TSecr=0 WS=64
  2   0.000297     10.0.1.3 -> 10.0.1.2     TCP 74 glrpc > 50291 [SYN, ACK] Seq=0 Ack=1 Win=5792 Len=0 MSS=1460 SACK_PERM=1 TSval=31071461 TSecr=5579185 WS=64
  3   0.000315     10.0.1.2 -> 10.0.1.3     TCP 66 50291 > glrpc [ACK] Seq=1 Ack=1 Win=14656 Len=0 TSval=5579185 TSecr=31071461
285171  25.522401     10.0.1.2 -> 10.0.1.3     TCP 66 50291 > glrpc [FIN, ACK] Seq=9 Ack=300000001 Win=3011840 Len=0 TSval=5585565 TSecr=31077820
285172  25.559814     10.0.1.3 -> 10.0.1.2     TCP 66 glrpc > 50291 [ACK] Seq=300000001 Ack=10 Win=5824 Len=0 TSval=31077851 TSecr=5585565
  1   0.000000     10.0.1.2 -> 10.0.1.3     TCP 74 50295 > glrpc [SYN] Seq=0 Win=14600 Len=0 MSS=1460 SACK_PERM=1 TSval=5598766 TSecr=0 WS=64
  2   0.000352     10.0.1.3 -> 10.0.1.2     TCP 74 glrpc > 50295 [SYN, ACK] Seq=0 Ack=1 Win=5792 Len=0 MSS=1460 SACK_PERM=1 TSval=31091041 TSecr=5598766 WS=64
  3   0.000370     10.0.1.2 -> 10.0.1.3     TCP 66 50295 > glrpc [ACK] Seq=1 Ack=1 Win=14656 Len=0 TSval=5598766 TSecr=31091041
292044  25.547554     10.0.1.2 -> 10.0.1.3     TCP 66 50295 > glrpc [FIN, ACK] Seq=9 Ack=300000001 Win=3008960 Len=0 TSval=5605153 TSecr=31097385
292045  25.584980     10.0.1.3 -> 10.0.1.2     TCP 66 glrpc > 50295 [ACK] Seq=300000001 Ack=10 Win=5824 Len=0 TSval=31097437 TSecr=5605153
  1   0.000000     10.0.1.2 -> 10.0.1.3     TCP 74 50298 > glrpc [SYN] Seq=0 Win=14600 Len=0 MSS=1460 SACK_PERM=1 TSval=5619285 TSecr=0 WS=64
  2   0.000407     10.0.1.3 -> 10.0.1.2     TCP 74 glrpc > 50298 [SYN, ACK] Seq=0 Ack=1 Win=5792 Len=0 MSS=1460 SACK_PERM=1 TSval=31111558 TSecr=5619285 WS=64
  3   0.000425     10.0.1.2 -> 10.0.1.3     TCP 66 50298 > glrpc [ACK] Seq=1 Ack=1 Win=14656 Len=0 TSval=5619285 TSecr=31111558
311130  25.530137     10.0.1.2 -> 10.0.1.3     TCP 66 50298 > glrpc [FIN, ACK] Seq=9 Ack=300000001 Win=3011840 Len=0 TSval=5625667 TSecr=31117876
311131  25.566930     10.0.1.3 -> 10.0.1.2     TCP 66 glrpc > 50298 [ACK] Seq=300000001 Ack=10 Win=5824 Len=0 TSval=31117950 TSecr=5625667
  1   0.000000     10.0.1.2 -> 10.0.1.3     TCP 74 50303 > glrpc [SYN] Seq=0 Win=14600 Len=0 MSS=1460 SACK_PERM=1 TSval=5642673 TSecr=0 WS=64
  2   0.000296     10.0.1.3 -> 10.0.1.2     TCP 74 glrpc > 50303 [SYN, ACK] Seq=0 Ack=1 Win=5792 Len=0 MSS=1460 SACK_PERM=1 TSval=31134945 TSecr=5642673 WS=64
  3   0.000316     10.0.1.2 -> 10.0.1.3     TCP 66 50303 > glrpc [ACK] Seq=1 Ack=1 Win=14656 Len=0 TSval=5642673 TSecr=31134945
310348  25.519774     10.0.1.2 -> 10.0.1.3     TCP 66 50303 > glrpc [FIN, ACK] Seq=9 Ack=300000001 Win=3011840 Len=0 TSval=5649053 TSecr=31141262
310349  25.559392     10.0.1.3 -> 10.0.1.2     TCP 66 glrpc > 50303 [ACK] Seq=300000001 Ack=10 Win=5824 Len=0 TSval=31141335 TSecr=5649053
  1   0.000000     10.0.1.2 -> 10.0.1.3     TCP 74 50356 > glrpc [SYN] Seq=0 Win=14600 Len=0 MSS=1460 SACK_PERM=1 TSval=5666106 TSecr=0 WS=64
  2   0.000326     10.0.1.3 -> 10.0.1.2     TCP 74 glrpc > 50356 [SYN, ACK] Seq=0 Ack=1 Win=5792 Len=0 MSS=1460 SACK_PERM=1 TSval=31158376 TSecr=5666106 WS=64
  3   0.000341     10.0.1.2 -> 10.0.1.3     TCP 66 50356 > glrpc [ACK] Seq=1 Ack=1 Win=14656 Len=0 TSval=5666106 TSecr=31158376
292830  25.552528     10.0.1.2 -> 10.0.1.3     TCP 66 50356 > glrpc [FIN, ACK] Seq=9 Ack=300000001 Win=3011840 Len=0 TSval=5672494 TSecr=31164705
292831  25.592340     10.0.1.3 -> 10.0.1.2     TCP 66 glrpc > 50356 [ACK] Seq=300000001 Ack=10 Win=5824 Len=0 TSval=31164774 TSecr=5672494
