  0.000000     10.0.1.2 -> 10.0.1.3     TCP 74 44872 > websm [SYN] Seq=0 Win=14600 Len=0 MSS=1460 SACK_PERM=1 TSval=3530271 TSecr=0 WS=64
  0.000000     10.0.1.2 -> 10.0.1.3     TCP 74 49627 > glrpc [SYN] Seq=0 Win=14600 Len=0 MSS=1460 SACK_PERM=1 TSval=3534756 TSecr=0 WS=64
  0.000283     10.0.1.3 -> 10.0.1.2     TCP 74 glrpc > 49627 [SYN, ACK] Seq=0 Ack=1 Win=5792 Len=0 MSS=1460 SACK_PERM=1 TSval=29027186 TSecr=3534756 WS=64
  0.000293     10.0.1.2 -> 10.0.1.3     TCP 66 49627 > glrpc [ACK] Seq=1 Ack=1 Win=14656 Len=0 TSval=3534756 TSecr=29027186
 30.004382     10.0.1.2 -> 10.0.1.3     TCP 66 49627 > glrpc [FIN, ACK] Seq=9 Ack=350000001 Win=3011840 Len=0 TSval=3542257 TSecr=29034623
 30.044635     10.0.1.3 -> 10.0.1.2     TCP 66 glrpc > 49627 [ACK] Seq=350000001 Ack=10 Win=5824 Len=0 TSval=29034697 TSecr=3542257
 50.005841     10.0.1.2 -> 10.0.1.3     TCP 74 49630 > glrpc [SYN] Seq=0 Win=14600 Len=0 MSS=1460 SACK_PERM=1 TSval=3547257 TSecr=0 WS=64
 50.006140     10.0.1.3 -> 10.0.1.2     TCP 74 glrpc > 49630 [SYN, ACK] Seq=0 Ack=1 Win=5792 Len=0 MSS=1460 SACK_PERM=1 TSval=29039687 TSecr=3547257 WS=64
 50.006157     10.0.1.2 -> 10.0.1.3     TCP 66 49630 > glrpc [ACK] Seq=1 Ack=1 Win=14656 Len=0 TSval=3547257 TSecr=29039687
 80.064467     10.0.1.2 -> 10.0.1.3     TCP 66 49630 > glrpc [FIN, ACK] Seq=9 Ack=350000001 Win=3061120 Len=0 TSval=3554772 TSecr=29047151
 80.104388     10.0.1.3 -> 10.0.1.2     TCP 66 glrpc > 49630 [ACK] Seq=350000001 Ack=10 Win=5824 Len=0 TSval=29047211 TSecr=3554772
100.065930     10.0.1.2 -> 10.0.1.3     TCP 74 49633 > glrpc [SYN] Seq=0 Win=14600 Len=0 MSS=1460 SACK_PERM=1 TSval=3559772 TSecr=0 WS=64
100.066254     10.0.1.3 -> 10.0.1.2     TCP 74 glrpc > 49633 [SYN, ACK] Seq=0 Ack=1 Win=5792 Len=0 MSS=1460 SACK_PERM=1 TSval=29052201 TSecr=3559772 WS=64
100.066274     10.0.1.2 -> 10.0.1.3     TCP 66 49633 > glrpc [ACK] Seq=1 Ack=1 Win=14656 Len=0 TSval=3559772 TSecr=29052201
130.125914     10.0.1.2 -> 10.0.1.3     TCP 66 49633 > glrpc [FIN, ACK] Seq=9 Ack=350000001 Win=2982912 Len=0 TSval=3567287 TSecr=29059694
130.164124     10.0.1.3 -> 10.0.1.2     TCP 66 glrpc > 49633 [ACK] Seq=350000001 Ack=10 Win=5824 Len=0 TSval=29059725 TSecr=3567287
150.127406     10.0.1.2 -> 10.0.1.3     TCP 74 49636 > glrpc [SYN] Seq=0 Win=14600 Len=0 MSS=1460 SACK_PERM=1 TSval=3572288 TSecr=0 WS=64
150.127738     10.0.1.3 -> 10.0.1.2     TCP 74 glrpc > 49636 [SYN, ACK] Seq=0 Ack=1 Win=5792 Len=0 MSS=1460 SACK_PERM=1 TSval=29064715 TSecr=3572288 WS=64
150.127757     10.0.1.2 -> 10.0.1.3     TCP 66 49636 > glrpc [ACK] Seq=1 Ack=1 Win=14656 Len=0 TSval=3572288 TSecr=29064715
180.197992     10.0.1.2 -> 10.0.1.3     TCP 66 49636 > glrpc [FIN, ACK] Seq=9 Ack=350000001 Win=3085184 Len=0 TSval=3579805 TSecr=29072172
180.235996     10.0.1.3 -> 10.0.1.2     TCP 66 glrpc > 49636 [ACK] Seq=350000001 Ack=10 Win=5824 Len=0 TSval=29072242 TSecr=3579805
200.199519     10.0.1.2 -> 10.0.1.3     TCP 74 49646 > glrpc [SYN] Seq=0 Win=14600 Len=0 MSS=1460 SACK_PERM=1 TSval=3584806 TSecr=0 WS=64
200.199815     10.0.1.3 -> 10.0.1.2     TCP 74 glrpc > 49646 [SYN, ACK] Seq=0 Ack=1 Win=5792 Len=0 MSS=1460 SACK_PERM=1 TSval=29077232 TSecr=3584806 WS=64
200.199829     10.0.1.2 -> 10.0.1.3     TCP 66 49646 > glrpc [ACK] Seq=1 Ack=1 Win=14656 Len=0 TSval=3584806 TSecr=29077232
229.981222     10.0.1.2 -> 10.0.1.3     TCP 66 49646 > glrpc [FIN, ACK] Seq=9 Ack=350000001 Win=3014784 Len=0 TSval=3592251 TSecr=29084614
230.019659     10.0.1.3 -> 10.0.1.2     TCP 66 glrpc > 49646 [ACK] Seq=350000001 Ack=10 Win=5824 Len=0 TSval=29084687 TSecr=3592251
249.982686     10.0.1.2 -> 10.0.1.3     TCP 74 49655 > glrpc [SYN] Seq=0 Win=14600 Len=0 MSS=1460 SACK_PERM=1 TSval=3597251 TSecr=0 WS=64
249.982968     10.0.1.3 -> 10.0.1.2     TCP 74 glrpc > 49655 [SYN, ACK] Seq=0 Ack=1 Win=5792 Len=0 MSS=1460 SACK_PERM=1 TSval=29089677 TSecr=3597251 WS=64
249.982982     10.0.1.2 -> 10.0.1.3     TCP 66 49655 > glrpc [ACK] Seq=1 Ack=1 Win=14656 Len=0 TSval=3597251 TSecr=29089677
280.074967     10.0.1.2 -> 10.0.1.3     TCP 66 49655 > glrpc [FIN, ACK] Seq=9 Ack=350000001 Win=2988672 Len=0 TSval=3604774 TSecr=29097178
280.111386     10.0.1.3 -> 10.0.1.2     TCP 66 glrpc > 49655 [ACK] Seq=350000001 Ack=10 Win=5824 Len=0 TSval=29097209 TSecr=3604774
300.096674     10.0.1.2 -> 10.0.1.3     TCP 74 49657 > glrpc [SYN] Seq=0 Win=14600 Len=0 MSS=1460 SACK_PERM=1 TSval=3609780 TSecr=0 WS=64
300.096999     10.0.1.3 -> 10.0.1.2     TCP 74 glrpc > 49657 [SYN, ACK] Seq=0 Ack=1 Win=5792 Len=0 MSS=1460 SACK_PERM=1 TSval=29102205 TSecr=3609780 WS=64
300.097016     10.0.1.2 -> 10.0.1.3     TCP 66 49657 > glrpc [ACK] Seq=1 Ack=1 Win=14656 Len=0 TSval=3609780 TSecr=29102205
330.224228     10.0.1.2 -> 10.0.1.3     TCP 66 49657 > glrpc [FIN, ACK] Seq=9 Ack=350000001 Win=3011840 Len=0 TSval=3617312 TSecr=29109714
330.263215     10.0.1.3 -> 10.0.1.2     TCP 66 glrpc > 49657 [ACK] Seq=350000001 Ack=10 Win=5824 Len=0 TSval=29109746 TSecr=3617312
350.235347     10.0.1.2 -> 10.0.1.3     TCP 74 49660 > glrpc [SYN] Seq=0 Win=14600 Len=0 MSS=1460 SACK_PERM=1 TSval=3622314 TSecr=0 WS=64
350.235687     10.0.1.3 -> 10.0.1.2     TCP 74 glrpc > 49660 [SYN, ACK] Seq=0 Ack=1 Win=5792 Len=0 MSS=1460 SACK_PERM=1 TSval=29114738 TSecr=3622314 WS=64
350.235701     10.0.1.2 -> 10.0.1.3     TCP 66 49660 > glrpc [ACK] Seq=1 Ack=1 Win=14656 Len=0 TSval=3622315 TSecr=29114738
380.097195     10.0.1.2 -> 10.0.1.3     TCP 66 49660 > glrpc [FIN, ACK] Seq=9 Ack=350000001 Win=3011840 Len=0 TSval=3629780 TSecr=29122139
380.134948     10.0.1.3 -> 10.0.1.2     TCP 66 glrpc > 49660 [ACK] Seq=350000001 Ack=10 Win=5824 Len=0 TSval=29122213 TSecr=3629780
400.108325     10.0.1.2 -> 10.0.1.3     TCP 74 49662 > glrpc [SYN] Seq=0 Win=14600 Len=0 MSS=1460 SACK_PERM=1 TSval=3634783 TSecr=0 WS=64
400.108658     10.0.1.3 -> 10.0.1.2     TCP 74 glrpc > 49662 [SYN, ACK] Seq=0 Ack=1 Win=5792 Len=0 MSS=1460 SACK_PERM=1 TSval=29127206 TSecr=3634783 WS=64
400.108674     10.0.1.2 -> 10.0.1.3     TCP 66 49662 > glrpc [ACK] Seq=1 Ack=1 Win=14656 Len=0 TSval=3634783 TSecr=29127206
429.866026     10.0.1.2 -> 10.0.1.3     TCP 66 49662 > glrpc [FIN, ACK] Seq=9 Ack=350000001 Win=3011840 Len=0 TSval=3642222 TSecr=29134585
429.902646     10.0.1.3 -> 10.0.1.2     TCP 66 glrpc > 49662 [ACK] Seq=350000001 Ack=10 Win=5824 Len=0 TSval=29134654 TSecr=3642222
449.881839     10.0.1.2 -> 10.0.1.3     TCP 74 49666 > glrpc [SYN] Seq=0 Win=14600 Len=0 MSS=1460 SACK_PERM=1 TSval=3647226 TSecr=0 WS=64
449.882178     10.0.1.3 -> 10.0.1.2     TCP 74 glrpc > 49666 [SYN, ACK] Seq=0 Ack=1 Win=5792 Len=0 MSS=1460 SACK_PERM=1 TSval=29139648 TSecr=3647226 WS=64
449.882192     10.0.1.2 -> 10.0.1.3     TCP 66 49666 > glrpc [ACK] Seq=1 Ack=1 Win=14656 Len=0 TSval=3647226 TSecr=29139648
479.634800     10.0.1.2 -> 10.0.1.3     TCP 66 49666 > glrpc [FIN, ACK] Seq=9 Ack=350000001 Win=3011840 Len=0 TSval=3654664 TSecr=29147023
479.674401     10.0.1.3 -> 10.0.1.2     TCP 66 glrpc > 49666 [ACK] Seq=350000001 Ack=10 Win=5824 Len=0 TSval=29147096 TSecr=3654664
499.699942     10.0.1.2 -> 10.0.1.3     TCP 74 49669 > glrpc [SYN] Seq=0 Win=14600 Len=0 MSS=1460 SACK_PERM=1 TSval=3659681 TSecr=0 WS=64
499.700229     10.0.1.3 -> 10.0.1.2     TCP 74 glrpc > 49669 [SYN, ACK] Seq=0 Ack=1 Win=5792 Len=0 MSS=1460 SACK_PERM=1 TSval=29152102 TSecr=3659681 WS=64
499.700244     10.0.1.2 -> 10.0.1.3     TCP 66 49669 > glrpc [ACK] Seq=1 Ack=1 Win=14656 Len=0 TSval=3659681 TSecr=29152102
529.454668     10.0.1.2 -> 10.0.1.3     TCP 66 49669 > glrpc [FIN, ACK] Seq=9 Ack=350000001 Win=3011840 Len=0 TSval=3667119 TSecr=29159476
529.494094     10.0.1.3 -> 10.0.1.2     TCP 66 glrpc > 49669 [ACK] Seq=350000001 Ack=10 Win=5824 Len=0 TSval=29159550 TSecr=3667119
549.484032     10.0.1.2 -> 10.0.1.3     TCP 74 49672 > glrpc [SYN] Seq=0 Win=14600 Len=0 MSS=1460 SACK_PERM=1 TSval=3672127 TSecr=0 WS=64
549.484365     10.0.1.3 -> 10.0.1.2     TCP 74 glrpc > 49672 [SYN, ACK] Seq=0 Ack=1 Win=5792 Len=0 MSS=1460 SACK_PERM=1 TSval=29164547 TSecr=3672127 WS=64
549.484384     10.0.1.2 -> 10.0.1.3     TCP 66 49672 > glrpc [ACK] Seq=1 Ack=1 Win=14656 Len=0 TSval=3672127 TSecr=29164547
579.239294     10.0.1.2 -> 10.0.1.3     TCP 66 49672 > glrpc [FIN, ACK] Seq=9 Ack=350000001 Win=3011840 Len=0 TSval=3679565 TSecr=29171922
579.277913     10.0.1.3 -> 10.0.1.2     TCP 66 glrpc > 49672 [ACK] Seq=350000001 Ack=10 Win=5824 Len=0 TSval=29171995 TSecr=3679565
599.246930     10.0.1.2 -> 10.0.1.3     TCP 74 49675 > glrpc [SYN] Seq=0 Win=14600 Len=0 MSS=1460 SACK_PERM=1 TSval=3684567 TSecr=0 WS=64
599.247213     10.0.1.3 -> 10.0.1.2     TCP 74 glrpc > 49675 [SYN, ACK] Seq=0 Ack=1 Win=5792 Len=0 MSS=1460 SACK_PERM=1 TSval=29176986 TSecr=3684567 WS=64
599.247226     10.0.1.2 -> 10.0.1.3     TCP 66 49675 > glrpc [ACK] Seq=1 Ack=1 Win=14656 Len=0 TSval=3684567 TSecr=29176986
629.018573     10.0.1.2 -> 10.0.1.3     TCP 66 49675 > glrpc [FIN, ACK] Seq=9 Ack=350000001 Win=3011840 Len=0 TSval=3692010 TSecr=29184365
629.057598     10.0.1.3 -> 10.0.1.2     TCP 66 glrpc > 49675 [ACK] Seq=350000001 Ack=10 Win=5824 Len=0 TSval=29184439 TSecr=3692010
649.031693     10.0.1.2 -> 10.0.1.3     TCP 74 49677 > glrpc [SYN] Seq=0 Win=14600 Len=0 MSS=1460 SACK_PERM=1 TSval=3697014 TSecr=0 WS=64
649.031991     10.0.1.3 -> 10.0.1.2     TCP 74 glrpc > 49677 [SYN, ACK] Seq=0 Ack=1 Win=5792 Len=0 MSS=1460 SACK_PERM=1 TSval=29189432 TSecr=3697014 WS=64
649.032007     10.0.1.2 -> 10.0.1.3     TCP 66 49677 > glrpc [ACK] Seq=1 Ack=1 Win=14656 Len=0 TSval=3697014 TSecr=29189432
678.793744     10.0.1.2 -> 10.0.1.3     TCP 66 49677 > glrpc [FIN, ACK] Seq=9 Ack=350000001 Win=3011840 Len=0 TSval=3704454 TSecr=29196850
678.833306     10.0.1.3 -> 10.0.1.2     TCP 66 glrpc > 49677 [ACK] Seq=350000001 Ack=10 Win=5824 Len=0 TSval=29196882 TSecr=3704454
698.805423     10.0.1.2 -> 10.0.1.3     TCP 74 49679 > glrpc [SYN] Seq=0 Win=14600 Len=0 MSS=1460 SACK_PERM=1 TSval=3709457 TSecr=0 WS=64
698.805702     10.0.1.3 -> 10.0.1.2     TCP 74 glrpc > 49679 [SYN, ACK] Seq=0 Ack=1 Win=5792 Len=0 MSS=1460 SACK_PERM=1 TSval=29201874 TSecr=3709457 WS=64
698.805715     10.0.1.2 -> 10.0.1.3     TCP 66 49679 > glrpc [ACK] Seq=1 Ack=1 Win=14656 Len=0 TSval=3709457 TSecr=29201874
728.561791     10.0.1.2 -> 10.0.1.3     TCP 66 49679 > glrpc [FIN, ACK] Seq=9 Ack=350000001 Win=3011840 Len=0 TSval=3716896 TSecr=29209292
728.602042     10.0.1.3 -> 10.0.1.2     TCP 66 glrpc > 49679 [ACK] Seq=350000001 Ack=10 Win=5824 Len=0 TSval=29209323 TSecr=3716896
748.578869     10.0.1.2 -> 10.0.1.3     TCP 74 49682 > glrpc [SYN] Seq=0 Win=14600 Len=0 MSS=1460 SACK_PERM=1 TSval=3721900 TSecr=0 WS=64
748.579178     10.0.1.3 -> 10.0.1.2     TCP 74 glrpc > 49682 [SYN, ACK] Seq=0 Ack=1 Win=5792 Len=0 MSS=1460 SACK_PERM=1 TSval=29214316 TSecr=3721900 WS=64
748.579196     10.0.1.2 -> 10.0.1.3     TCP 66 49682 > glrpc [ACK] Seq=1 Ack=1 Win=14656 Len=0 TSval=3721900 TSecr=29214316
778.331927     10.0.1.2 -> 10.0.1.3     TCP 66 49682 > glrpc [FIN, ACK] Seq=9 Ack=350000001 Win=3011840 Len=0 TSval=3729339 TSecr=29221704
778.368780     10.0.1.3 -> 10.0.1.2     TCP 66 glrpc > 49682 [ACK] Seq=350000001 Ack=10 Win=5824 Len=0 TSval=29221764 TSecr=3729339
798.333397     10.0.1.2 -> 10.0.1.3     TCP 74 49684 > glrpc [SYN] Seq=0 Win=14600 Len=0 MSS=1460 SACK_PERM=1 TSval=3734339 TSecr=0 WS=64
798.333798     10.0.1.3 -> 10.0.1.2     TCP 74 glrpc > 49684 [SYN, ACK] Seq=0 Ack=1 Win=5792 Len=0 MSS=1460 SACK_PERM=1 TSval=29226754 TSecr=3734339 WS=64
798.333815     10.0.1.2 -> 10.0.1.3     TCP 66 49684 > glrpc [ACK] Seq=1 Ack=1 Win=14656 Len=0 TSval=3734339 TSecr=29226754
828.086607     10.0.1.2 -> 10.0.1.3     TCP 66 49684 > glrpc [FIN, ACK] Seq=9 Ack=350000001 Win=3014784 Len=0 TSval=3741777 TSecr=29234171
828.124545     10.0.1.3 -> 10.0.1.2     TCP 66 glrpc > 49684 [ACK] Seq=350000001 Ack=10 Win=5824 Len=0 TSval=29234202 TSecr=3741777
848.088102     10.0.1.2 -> 10.0.1.3     TCP 74 49687 > glrpc [SYN] Seq=0 Win=14600 Len=0 MSS=1460 SACK_PERM=1 TSval=3746778 TSecr=0 WS=64
848.088392     10.0.1.3 -> 10.0.1.2     TCP 74 glrpc > 49687 [SYN, ACK] Seq=0 Ack=1 Win=5792 Len=0 MSS=1460 SACK_PERM=1 TSval=29239192 TSecr=3746778 WS=64
848.088406     10.0.1.2 -> 10.0.1.3     TCP 66 49687 > glrpc [ACK] Seq=1 Ack=1 Win=14656 Len=0 TSval=3746778 TSecr=29239192
