  0.000000     10.0.1.2 -> 10.0.1.3     TCP 74 48480 > glrpc [SYN] Seq=0 Win=14600 Len=0 MSS=1460 SACK_PERM=1 TSval=1374660 TSecr=0 WS=64
  0.000000     10.0.1.2 -> 10.0.1.3     TCP 74 48481 > glrpc [SYN] Seq=0 Win=14600 Len=0 MSS=1460 SACK_PERM=1 TSval=1377144 TSecr=0 WS=64
  0.000278     10.0.1.3 -> 10.0.1.2     TCP 74 glrpc > 48481 [SYN, ACK] Seq=0 Ack=1 Win=5792 Len=0 MSS=1460 SACK_PERM=1 TSval=26869736 TSecr=1377144 WS=64
  0.000291     10.0.1.2 -> 10.0.1.3     TCP 66 48481 > glrpc [ACK] Seq=1 Ack=1 Win=14656 Len=0 TSval=1377144 TSecr=26869736
  4.255714     10.0.1.2 -> 10.0.1.3     TCP 66 48481 > glrpc [FIN, ACK] Seq=9 Ack=50000001 Win=376512 Len=0 TSval=1378208 TSecr=26870797
  4.294325     10.0.1.3 -> 10.0.1.2     TCP 66 glrpc > 48481 [ACK] Seq=50000001 Ack=10 Win=5824 Len=0 TSval=26870810 TSecr=1378208
  6.296242     10.0.1.2 -> 10.0.1.3     TCP 74 48482 > glrpc [SYN] Seq=0 Win=14600 Len=0 MSS=1460 SACK_PERM=1 TSval=1378718 TSecr=0 WS=64
  6.296567     10.0.1.3 -> 10.0.1.2     TCP 74 glrpc > 48482 [SYN, ACK] Seq=0 Ack=1 Win=5792 Len=0 MSS=1460 SACK_PERM=1 TSval=26871310 TSecr=1378718 WS=64
  6.296582     10.0.1.2 -> 10.0.1.3     TCP 66 48482 > glrpc [ACK] Seq=1 Ack=1 Win=14656 Len=0 TSval=1378718 TSecr=26871310
 10.552042     10.0.1.2 -> 10.0.1.3     TCP 66 48482 > glrpc [FIN, ACK] Seq=9 Ack=50000001 Win=376512 Len=0 TSval=1379782 TSecr=26872370
 10.590805     10.0.1.3 -> 10.0.1.2     TCP 66 glrpc > 48482 [ACK] Seq=50000001 Ack=10 Win=5824 Len=0 TSval=26872384 TSecr=1379782
 12.553489     10.0.1.2 -> 10.0.1.3     TCP 74 48492 > glrpc [SYN] Seq=0 Win=14600 Len=0 MSS=1460 SACK_PERM=1 TSval=1380282 TSecr=0 WS=64
 12.553807     10.0.1.3 -> 10.0.1.2     TCP 74 glrpc > 48492 [SYN, ACK] Seq=0 Ack=1 Win=5792 Len=0 MSS=1460 SACK_PERM=1 TSval=26872874 TSecr=1380282 WS=64
 12.553819     10.0.1.2 -> 10.0.1.3     TCP 66 48492 > glrpc [ACK] Seq=1 Ack=1 Win=14656 Len=0 TSval=1380282 TSecr=26872874
 16.822050     10.0.1.2 -> 10.0.1.3     TCP 66 48492 > glrpc [FIN, ACK] Seq=9 Ack=50000001 Win=373632 Len=0 TSval=1381349 TSecr=26873938
 16.862263     10.0.1.3 -> 10.0.1.2     TCP 66 glrpc > 48492 [ACK] Seq=50000001 Ack=10 Win=5824 Len=0 TSval=26873952 TSecr=1381349
 18.823518     10.0.1.2 -> 10.0.1.3     TCP 74 48495 > glrpc [SYN] Seq=0 Win=14600 Len=0 MSS=1460 SACK_PERM=1 TSval=1381850 TSecr=0 WS=64
 18.823884     10.0.1.3 -> 10.0.1.2     TCP 74 glrpc > 48495 [SYN, ACK] Seq=0 Ack=1 Win=5792 Len=0 MSS=1460 SACK_PERM=1 TSval=26874442 TSecr=1381850 WS=64
 18.823906     10.0.1.2 -> 10.0.1.3     TCP 66 48495 > glrpc [ACK] Seq=1 Ack=1 Win=14656 Len=0 TSval=1381850 TSecr=26874442
 23.084216     10.0.1.2 -> 10.0.1.3     TCP 66 48495 > glrpc [FIN, ACK] Seq=9 Ack=50000001 Win=359104 Len=0 TSval=1382915 TSecr=26875503
 23.123750     10.0.1.3 -> 10.0.1.2     TCP 66 glrpc > 48495 [ACK] Seq=50000001 Ack=10 Win=5824 Len=0 TSval=26875517 TSecr=1382915
 25.085670     10.0.1.2 -> 10.0.1.3     TCP 74 48516 > glrpc [SYN] Seq=0 Win=14600 Len=0 MSS=1460 SACK_PERM=1 TSval=1383415 TSecr=0 WS=64
 25.086010     10.0.1.3 -> 10.0.1.2     TCP 74 glrpc > 48516 [SYN, ACK] Seq=0 Ack=1 Win=5792 Len=0 MSS=1460 SACK_PERM=1 TSval=26876007 TSecr=1383415 WS=64
 25.086027     10.0.1.2 -> 10.0.1.3     TCP 66 48516 > glrpc [ACK] Seq=1 Ack=1 Win=14656 Len=0 TSval=1383415 TSecr=26876007
 29.379224     10.0.1.3 -> 10.0.1.2     TCP 66 [TCP ACKed lost segment] [TCP Previous segment lost] glrpc > 48516 [ACK] Seq=50000001 Ack=10 Win=5824 Len=0 TSval=26877081 TSecr=1384479
 31.343181     10.0.1.2 -> 10.0.1.3     TCP 74 48555 > glrpc [SYN] Seq=0 Win=14600 Len=0 MSS=1460 SACK_PERM=1 TSval=1384980 TSecr=0 WS=64
 31.343469     10.0.1.3 -> 10.0.1.2     TCP 74 glrpc > 48555 [SYN, ACK] Seq=0 Ack=1 Win=5792 Len=0 MSS=1460 SACK_PERM=1 TSval=26877572 TSecr=1384980 WS=64
 31.343478     10.0.1.2 -> 10.0.1.3     TCP 66 48555 > glrpc [ACK] Seq=1 Ack=1 Win=14656 Len=0 TSval=1384980 TSecr=26877572
 35.605565     10.0.1.2 -> 10.0.1.3     TCP 66 48555 > glrpc [FIN, ACK] Seq=9 Ack=50000001 Win=376512 Len=0 TSval=1386045 TSecr=26878633
 35.643711     10.0.1.3 -> 10.0.1.2     TCP 66 glrpc > 48555 [ACK] Seq=50000001 Ack=10 Win=5824 Len=0 TSval=26878647 TSecr=1386045
 37.607015     10.0.1.2 -> 10.0.1.3     TCP 74 48564 > glrpc [SYN] Seq=0 Win=14600 Len=0 MSS=1460 SACK_PERM=1 TSval=1386546 TSecr=0 WS=64
 37.607371     10.0.1.3 -> 10.0.1.2     TCP 74 glrpc > 48564 [SYN, ACK] Seq=0 Ack=1 Win=5792 Len=0 MSS=1460 SACK_PERM=1 TSval=26879137 TSecr=1386546 WS=64
 37.607392     10.0.1.2 -> 10.0.1.3     TCP 66 48564 > glrpc [ACK] Seq=1 Ack=1 Win=14656 Len=0 TSval=1386546 TSecr=26879137
 41.862249     10.0.1.2 -> 10.0.1.3     TCP 66 48564 > glrpc [FIN, ACK] Seq=9 Ack=50000001 Win=376512 Len=0 TSval=1387609 TSecr=26880197
 41.901105     10.0.1.3 -> 10.0.1.2     TCP 66 glrpc > 48564 [ACK] Seq=50000001 Ack=10 Win=5824 Len=0 TSval=26880211 TSecr=1387609
 43.863845     10.0.1.2 -> 10.0.1.3     TCP 74 48565 > glrpc [SYN] Seq=0 Win=14600 Len=0 MSS=1460 SACK_PERM=1 TSval=1388110 TSecr=0 WS=64
 43.864170     10.0.1.3 -> 10.0.1.2     TCP 74 glrpc > 48565 [SYN, ACK] Seq=0 Ack=1 Win=5792 Len=0 MSS=1460 SACK_PERM=1 TSval=26880701 TSecr=1388110 WS=64
 43.864188     10.0.1.2 -> 10.0.1.3     TCP 66 48565 > glrpc [ACK] Seq=1 Ack=1 Win=14656 Len=0 TSval=1388110 TSecr=26880701
 48.119519     10.0.1.2 -> 10.0.1.3     TCP 66 48565 > glrpc [FIN, ACK] Seq=9 Ack=50000001 Win=367808 Len=0 TSval=1389174 TSecr=26881761
 48.157634     10.0.1.3 -> 10.0.1.2     TCP 66 glrpc > 48565 [ACK] Seq=50000001 Ack=10 Win=5824 Len=0 TSval=26881775 TSecr=1389174
 50.121110     10.0.1.2 -> 10.0.1.3     TCP 74 48566 > glrpc [SYN] Seq=0 Win=14600 Len=0 MSS=1460 SACK_PERM=1 TSval=1389674 TSecr=0 WS=64
 50.121401     10.0.1.3 -> 10.0.1.2     TCP 74 glrpc > 48566 [SYN, ACK] Seq=0 Ack=1 Win=5792 Len=0 MSS=1460 SACK_PERM=1 TSval=26882266 TSecr=1389674 WS=64
 50.121414     10.0.1.2 -> 10.0.1.3     TCP 66 48566 > glrpc [ACK] Seq=1 Ack=1 Win=14656 Len=0 TSval=1389674 TSecr=26882266
 54.376584     10.0.1.2 -> 10.0.1.3     TCP 66 48566 > glrpc [FIN, ACK] Seq=9 Ack=50000001 Win=376512 Len=0 TSval=1390738 TSecr=26883326
 54.414119     10.0.1.3 -> 10.0.1.2     TCP 66 glrpc > 48566 [ACK] Seq=50000001 Ack=10 Win=5824 Len=0 TSval=26883339 TSecr=1390738
 56.378259     10.0.1.2 -> 10.0.1.3     TCP 74 48567 > glrpc [SYN] Seq=0 Win=14600 Len=0 MSS=1460 SACK_PERM=1 TSval=1391238 TSecr=0 WS=64
 56.378584     10.0.1.3 -> 10.0.1.2     TCP 74 glrpc > 48567 [SYN, ACK] Seq=0 Ack=1 Win=5792 Len=0 MSS=1460 SACK_PERM=1 TSval=26883830 TSecr=1391238 WS=64
 56.378598     10.0.1.2 -> 10.0.1.3     TCP 66 48567 > glrpc [ACK] Seq=1 Ack=1 Win=14656 Len=0 TSval=1391239 TSecr=26883830
 62.645773     10.0.1.2 -> 10.0.1.3     TCP 74 48573 > glrpc [SYN] Seq=0 Win=14600 Len=0 MSS=1460 SACK_PERM=1 TSval=1392805 TSecr=0 WS=64
 62.646063     10.0.1.3 -> 10.0.1.2     TCP 74 glrpc > 48573 [SYN, ACK] Seq=0 Ack=1 Win=5792 Len=0 MSS=1460 SACK_PERM=1 TSval=26885397 TSecr=1392805 WS=64
 62.646079     10.0.1.2 -> 10.0.1.3     TCP 66 48573 > glrpc [ACK] Seq=1 Ack=1 Win=14656 Len=0 TSval=1392805 TSecr=26885397
 66.907201     10.0.1.2 -> 10.0.1.3     TCP 66 48573 > glrpc [FIN, ACK] Seq=9 Ack=50000001 Win=376512 Len=0 TSval=1393871 TSecr=26886459
 66.947074     10.0.1.3 -> 10.0.1.2     TCP 66 glrpc > 48573 [ACK] Seq=50000001 Ack=10 Win=5824 Len=0 TSval=26886472 TSecr=1393871
 68.908526     10.0.1.2 -> 10.0.1.3     TCP 74 48576 > glrpc [SYN] Seq=0 Win=14600 Len=0 MSS=1460 SACK_PERM=1 TSval=1394371 TSecr=0 WS=64
 68.908807     10.0.1.3 -> 10.0.1.2     TCP 74 glrpc > 48576 [SYN, ACK] Seq=0 Ack=1 Win=5792 Len=0 MSS=1460 SACK_PERM=1 TSval=26886962 TSecr=1394371 WS=64
 68.908825     10.0.1.2 -> 10.0.1.3     TCP 66 48576 > glrpc [ACK] Seq=1 Ack=1 Win=14656 Len=0 TSval=1394371 TSecr=26886962
 73.168753     10.0.1.2 -> 10.0.1.3     TCP 66 48576 > glrpc [FIN, ACK] Seq=9 Ack=50000001 Win=376512 Len=0 TSval=1395436 TSecr=26888024
 73.206548     10.0.1.3 -> 10.0.1.2     TCP 66 glrpc > 48576 [ACK] Seq=50000001 Ack=10 Win=5824 Len=0 TSval=26888037 TSecr=1395436
 75.170221     10.0.1.2 -> 10.0.1.3     TCP 74 48578 > glrpc [SYN] Seq=0 Win=14600 Len=0 MSS=1460 SACK_PERM=1 TSval=1395936 TSecr=0 WS=64
 75.170545     10.0.1.3 -> 10.0.1.2     TCP 74 glrpc > 48578 [SYN, ACK] Seq=0 Ack=1 Win=5792 Len=0 MSS=1460 SACK_PERM=1 TSval=26888527 TSecr=1395936 WS=64
 75.170559     10.0.1.2 -> 10.0.1.3     TCP 66 48578 > glrpc [ACK] Seq=1 Ack=1 Win=14656 Len=0 TSval=1395937 TSecr=26888527
 79.443476     10.0.1.2 -> 10.0.1.3     TCP 66 48578 > glrpc [FIN, ACK] Seq=9 Ack=50000001 Win=376512 Len=0 TSval=1397005 TSecr=26889592
 79.482970     10.0.1.3 -> 10.0.1.2     TCP 66 glrpc > 48578 [ACK] Seq=50000001 Ack=10 Win=5824 Len=0 TSval=26889606 TSecr=1397005
 81.444841     10.0.1.2 -> 10.0.1.3     TCP 74 48582 > glrpc [SYN] Seq=0 Win=14600 Len=0 MSS=1460 SACK_PERM=1 TSval=1397505 TSecr=0 WS=64
 81.445135     10.0.1.3 -> 10.0.1.2     TCP 74 glrpc > 48582 [SYN, ACK] Seq=0 Ack=1 Win=5792 Len=0 MSS=1460 SACK_PERM=1 TSval=26890096 TSecr=1397505 WS=64
 81.445154     10.0.1.2 -> 10.0.1.3     TCP 66 48582 > glrpc [ACK] Seq=1 Ack=1 Win=14656 Len=0 TSval=1397505 TSecr=26890096
 85.725944     10.0.1.2 -> 10.0.1.3     TCP 66 48582 > glrpc [FIN, ACK] Seq=9 Ack=50000001 Win=376512 Len=0 TSval=1398575 TSecr=26891163
 85.764511     10.0.1.3 -> 10.0.1.2     TCP 66 glrpc > 48582 [ACK] Seq=50000001 Ack=10 Win=5824 Len=0 TSval=26891176 TSecr=1398575
 87.727402     10.0.1.2 -> 10.0.1.3     TCP 74 48583 > glrpc [SYN] Seq=0 Win=14600 Len=0 MSS=1460 SACK_PERM=1 TSval=1399076 TSecr=0 WS=64
 87.727711     10.0.1.3 -> 10.0.1.2     TCP 74 glrpc > 48583 [SYN, ACK] Seq=0 Ack=1 Win=5792 Len=0 MSS=1460 SACK_PERM=1 TSval=26891667 TSecr=1399076 WS=64
 87.727723     10.0.1.2 -> 10.0.1.3     TCP 66 48583 > glrpc [ACK] Seq=1 Ack=1 Win=14656 Len=0 TSval=1399076 TSecr=26891667
 92.003693     10.0.1.2 -> 10.0.1.3     TCP 66 48583 > glrpc [FIN, ACK] Seq=9 Ack=50000001 Win=367808 Len=0 TSval=1400145 TSecr=26892732
 92.043947     10.0.1.3 -> 10.0.1.2     TCP 66 glrpc > 48583 [ACK] Seq=50000001 Ack=10 Win=5824 Len=0 TSval=26892746 TSecr=1400145
 94.005129     10.0.1.2 -> 10.0.1.3     TCP 74 48585 > glrpc [SYN] Seq=0 Win=14600 Len=0 MSS=1460 SACK_PERM=1 TSval=1400645 TSecr=0 WS=64
 94.005460     10.0.1.3 -> 10.0.1.2     TCP 74 glrpc > 48585 [SYN, ACK] Seq=0 Ack=1 Win=5792 Len=0 MSS=1460 SACK_PERM=1 TSval=26893236 TSecr=1400645 WS=64
 94.005474     10.0.1.2 -> 10.0.1.3     TCP 66 48585 > glrpc [ACK] Seq=1 Ack=1 Win=14656 Len=0 TSval=1400645 TSecr=26893236
 98.262381     10.0.1.2 -> 10.0.1.3     TCP 66 48585 > glrpc [FIN, ACK] Seq=9 Ack=50000001 Win=370688 Len=0 TSval=1401710 TSecr=26894297
 98.300394     10.0.1.3 -> 10.0.1.2     TCP 66 glrpc > 48585 [ACK] Seq=50000001 Ack=10 Win=5824 Len=0 TSval=26894310 TSecr=1401710
100.263840     10.0.1.2 -> 10.0.1.3     TCP 74 48587 > glrpc [SYN] Seq=0 Win=14600 Len=0 MSS=1460 SACK_PERM=1 TSval=1402210 TSecr=0 WS=64
100.264130     10.0.1.3 -> 10.0.1.2     TCP 74 glrpc > 48587 [SYN, ACK] Seq=0 Ack=1 Win=5792 Len=0 MSS=1460 SACK_PERM=1 TSval=26894800 TSecr=1402210 WS=64
100.264145     10.0.1.2 -> 10.0.1.3     TCP 66 48587 > glrpc [ACK] Seq=1 Ack=1 Win=14656 Len=0 TSval=1402210 TSecr=26894800
104.520420     10.0.1.2 -> 10.0.1.3     TCP 66 48587 > glrpc [FIN, ACK] Seq=9 Ack=50000001 Win=362048 Len=0 TSval=1403274 TSecr=26895861
104.556861     10.0.1.3 -> 10.0.1.2     TCP 66 glrpc > 48587 [ACK] Seq=50000001 Ack=10 Win=5824 Len=0 TSval=26895874 TSecr=1403274
106.522029     10.0.1.2 -> 10.0.1.3     TCP 74 48588 > glrpc [SYN] Seq=0 Win=14600 Len=0 MSS=1460 SACK_PERM=1 TSval=1403774 TSecr=0 WS=64
106.522310     10.0.1.3 -> 10.0.1.2     TCP 74 glrpc > 48588 [SYN, ACK] Seq=0 Ack=1 Win=5792 Len=0 MSS=1460 SACK_PERM=1 TSval=26896365 TSecr=1403774 WS=64
106.522322     10.0.1.2 -> 10.0.1.3     TCP 66 48588 > glrpc [ACK] Seq=1 Ack=1 Win=14656 Len=0 TSval=1403774 TSecr=26896365
110.780407     10.0.1.2 -> 10.0.1.3     TCP 66 48588 > glrpc [FIN, ACK] Seq=9 Ack=50000001 Win=376512 Len=0 TSval=1404839 TSecr=26897426
110.817466     10.0.1.3 -> 10.0.1.2     TCP 66 glrpc > 48588 [ACK] Seq=50000001 Ack=10 Win=5824 Len=0 TSval=26897439 TSecr=1404839
112.781914     10.0.1.2 -> 10.0.1.3     TCP 74 48596 > glrpc [SYN] Seq=0 Win=14600 Len=0 MSS=1460 SACK_PERM=1 TSval=1405339 TSecr=0 WS=64
112.782204     10.0.1.3 -> 10.0.1.2     TCP 74 glrpc > 48596 [SYN, ACK] Seq=0 Ack=1 Win=5792 Len=0 MSS=1460 SACK_PERM=1 TSval=26897930 TSecr=1405339 WS=64
112.782220     10.0.1.2 -> 10.0.1.3     TCP 66 48596 > glrpc [ACK] Seq=1 Ack=1 Win=14656 Len=0 TSval=1405339 TSecr=26897930
117.039748     10.0.1.2 -> 10.0.1.3     TCP 66 48596 > glrpc [FIN, ACK] Seq=9 Ack=50000001 Win=370688 Len=0 TSval=1406404 TSecr=26898991
117.078826     10.0.1.3 -> 10.0.1.2     TCP 66 glrpc > 48596 [ACK] Seq=50000001 Ack=10 Win=5824 Len=0 TSval=26899004 TSecr=1406404
119.041156     10.0.1.2 -> 10.0.1.3     TCP 74 48604 > glrpc [SYN] Seq=0 Win=14600 Len=0 MSS=1460 SACK_PERM=1 TSval=1406904 TSecr=0 WS=64
119.041475     10.0.1.3 -> 10.0.1.2     TCP 74 glrpc > 48604 [SYN, ACK] Seq=0 Ack=1 Win=5792 Len=0 MSS=1460 SACK_PERM=1 TSval=26899494 TSecr=1406904 WS=64
119.041487     10.0.1.2 -> 10.0.1.3     TCP 66 48604 > glrpc [ACK] Seq=1 Ack=1 Win=14656 Len=0 TSval=1406904 TSecr=26899494
123.307686     10.0.1.2 -> 10.0.1.3     TCP 66 48604 > glrpc [FIN, ACK] Seq=9 Ack=50000001 Win=376512 Len=0 TSval=1407971 TSecr=26900558
123.347305     10.0.1.3 -> 10.0.1.2     TCP 66 glrpc > 48604 [ACK] Seq=50000001 Ack=10 Win=5824 Len=0 TSval=26900571 TSecr=1407971
