  1   0.000000     10.0.1.2 -> 10.0.1.3     TCP 74 50121 > glrpc [SYN] Seq=0 Win=14600 Len=0 MSS=1460 SACK_PERM=1 TSval=4703431 TSecr=0 WS=64
  2   0.000288     10.0.1.3 -> 10.0.1.2     TCP 74 glrpc > 50121 [SYN, ACK] Seq=0 Ack=1 Win=5792 Len=0 MSS=1460 SACK_PERM=1 TSval=30195774 TSecr=4703431 WS=64
  3   0.000297     10.0.1.2 -> 10.0.1.3     TCP 66 50121 > glrpc [ACK] Seq=1 Ack=1 Win=14656 Len=0 TSval=4703431 TSecr=30195774
190688  17.026304     10.0.1.2 -> 10.0.1.3     TCP 66 50121 > glrpc [FIN, ACK] Seq=9 Ack=200000001 Win=3085184 Len=0 TSval=4707688 TSecr=30199975
190689  17.065931     10.0.1.3 -> 10.0.1.2     TCP 66 glrpc > 50121 [ACK] Seq=200000001 Ack=10 Win=5824 Len=0 TSval=30200040 TSecr=4707688
  1   0.000000     10.0.1.2 -> 10.0.1.3     TCP 74 50124 > glrpc [SYN] Seq=0 Win=14600 Len=0 MSS=1460 SACK_PERM=1 TSval=4713006 TSecr=0 WS=64
  2   0.000401     10.0.1.3 -> 10.0.1.2     TCP 74 glrpc > 50124 [SYN, ACK] Seq=0 Ack=1 Win=5792 Len=0 MSS=1460 SACK_PERM=1 TSval=30205348 TSecr=4713006 WS=64
  3   0.000416     10.0.1.2 -> 10.0.1.3     TCP 66 50124 > glrpc [ACK] Seq=1 Ack=1 Win=14656 Len=0 TSval=4713006 TSecr=30205348
197905  17.200676     10.0.1.2 -> 10.0.1.3     TCP 66 50124 > glrpc [FIN, ACK] Seq=9 Ack=200000001 Win=3085184 Len=0 TSval=4717306 TSecr=30209594
197906  17.240977     10.0.1.3 -> 10.0.1.2     TCP 66 glrpc > 50124 [ACK] Seq=200000001 Ack=10 Win=5824 Len=0 TSval=30209658 TSecr=4717306
  1   0.000000     10.0.1.2 -> 10.0.1.3     TCP 74 50126 > glrpc [SYN] Seq=0 Win=14600 Len=0 MSS=1460 SACK_PERM=1 TSval=4722828 TSecr=0 WS=64
  2   0.000340     10.0.1.3 -> 10.0.1.2     TCP 74 glrpc > 50126 [SYN, ACK] Seq=0 Ack=1 Win=5792 Len=0 MSS=1460 SACK_PERM=1 TSval=30215169 TSecr=4722828 WS=64
  3   0.000355     10.0.1.2 -> 10.0.1.3     TCP 66 50126 > glrpc [ACK] Seq=1 Ack=1 Win=14656 Len=0 TSval=4722828 TSecr=30215169
195819  17.268196     10.0.1.2 -> 10.0.1.3     TCP 66 50126 > glrpc [FIN, ACK] Seq=9 Ack=200000001 Win=3055296 Len=0 TSval=4727145 TSecr=30219428
195820  17.304724     10.0.1.3 -> 10.0.1.2     TCP 66 glrpc > 50126 [ACK] Seq=200000001 Ack=10 Win=5824 Len=0 TSval=30219495 TSecr=4727145
  1   0.000000     10.0.1.2 -> 10.0.1.3     TCP 74 50127 > glrpc [SYN] Seq=0 Win=14600 Len=0 MSS=1460 SACK_PERM=1 TSval=4732913 TSecr=0 WS=64
  2   0.000305     10.0.1.3 -> 10.0.1.2     TCP 74 glrpc > 50127 [SYN, ACK] Seq=0 Ack=1 Win=5792 Len=0 MSS=1460 SACK_PERM=1 TSval=30225254 TSecr=4732913 WS=64
  3   0.000323     10.0.1.2 -> 10.0.1.3     TCP 66 50127 > glrpc [ACK] Seq=1 Ack=1 Win=14656 Len=0 TSval=4732914 TSecr=30225254
207444  17.248208     10.0.1.2 -> 10.0.1.3     TCP 66 50127 > glrpc [FIN, ACK] Seq=9 Ack=200000001 Win=3055296 Len=0 TSval=4737226 TSecr=30229508
207445  17.288645     10.0.1.3 -> 10.0.1.2     TCP 66 glrpc > 50127 [ACK] Seq=200000001 Ack=10 Win=5824 Len=0 TSval=30229576 TSecr=4737226
  1   0.000000     10.0.1.2 -> 10.0.1.3     TCP 74 50129 > glrpc [SYN] Seq=0 Win=14600 Len=0 MSS=1460 SACK_PERM=1 TSval=4743406 TSecr=0 WS=64
  2   0.000335     10.0.1.3 -> 10.0.1.2     TCP 74 glrpc > 50129 [SYN, ACK] Seq=0 Ack=1 Win=5792 Len=0 MSS=1460 SACK_PERM=1 TSval=30235745 TSecr=4743406 WS=64
  3   0.000352     10.0.1.2 -> 10.0.1.3     TCP 66 50129 > glrpc [ACK] Seq=1 Ack=1 Win=14656 Len=0 TSval=4743406 TSecr=30235745
199175  17.209256     10.0.1.2 -> 10.0.1.3     TCP 66 50129 > glrpc [FIN, ACK] Seq=9 Ack=200000001 Win=3014784 Len=0 TSval=4747708 TSecr=30239989
199176  17.245778     10.0.1.3 -> 10.0.1.2     TCP 66 glrpc > 50129 [ACK] Seq=200000001 Ack=10 Win=5824 Len=0 TSval=30240057 TSecr=4747708
  1   0.000000     10.0.1.2 -> 10.0.1.3     TCP 74 50130 > glrpc [SYN] Seq=0 Win=14600 Len=0 MSS=1460 SACK_PERM=1 TSval=4753489 TSecr=0 WS=64
  2   0.000296     10.0.1.3 -> 10.0.1.2     TCP 74 glrpc > 50130 [SYN, ACK] Seq=0 Ack=1 Win=5792 Len=0 MSS=1460 SACK_PERM=1 TSval=30245828 TSecr=4753489 WS=64
  3   0.000312     10.0.1.2 -> 10.0.1.3     TCP 66 50130 > glrpc [ACK] Seq=1 Ack=1 Win=14656 Len=0 TSval=4753490 TSecr=30245828
198252  17.272938     10.0.1.2 -> 10.0.1.3     TCP 66 50130 > glrpc [FIN, ACK] Seq=9 Ack=200000001 Win=3032128 Len=0 TSval=4757808 TSecr=30250088
198253  17.310655     10.0.1.3 -> 10.0.1.2     TCP 66 glrpc > 50130 [ACK] Seq=200000001 Ack=10 Win=5824 Len=0 TSval=30250156 TSecr=4757808
  1   0.000000     10.0.1.2 -> 10.0.1.3     TCP 74 50134 > glrpc [SYN] Seq=0 Win=14600 Len=0 MSS=1460 SACK_PERM=1 TSval=4763301 TSecr=0 WS=64
  2   0.000291     10.0.1.3 -> 10.0.1.2     TCP 74 glrpc > 50134 [SYN, ACK] Seq=0 Ack=1 Win=5792 Len=0 MSS=1460 SACK_PERM=1 TSval=30255639 TSecr=4763301 WS=64
  3   0.000306     10.0.1.2 -> 10.0.1.3     TCP 66 50134 > glrpc [ACK] Seq=1 Ack=1 Win=14656 Len=0 TSval=4763301 TSecr=30255639
207424  17.258787     10.0.1.2 -> 10.0.1.3     TCP 66 50134 > glrpc [FIN, ACK] Seq=9 Ack=200000001 Win=2985792 Len=0 TSval=4767615 TSecr=30259895
207425  17.297070     10.0.1.3 -> 10.0.1.2     TCP 66 glrpc > 50134 [ACK] Seq=200000001 Ack=10 Win=5824 Len=0 TSval=30259963 TSecr=4767615
  1   0.000000     10.0.1.2 -> 10.0.1.3     TCP 74 50136 > glrpc [SYN] Seq=0 Win=14600 Len=0 MSS=1460 SACK_PERM=1 TSval=4773697 TSecr=0 WS=64
  2   0.000342     10.0.1.3 -> 10.0.1.2     TCP 74 glrpc > 50136 [SYN, ACK] Seq=0 Ack=1 Win=5792 Len=0 MSS=1460 SACK_PERM=1 TSval=30266035 TSecr=4773697 WS=64
  3   0.000360     10.0.1.2 -> 10.0.1.3     TCP 66 50136 > glrpc [ACK] Seq=1 Ack=1 Win=14656 Len=0 TSval=4773697 TSecr=30266035
199126  17.248349     10.0.1.2 -> 10.0.1.3     TCP 66 50136 > glrpc [FIN, ACK] Seq=9 Ack=200000001 Win=3011840 Len=0 TSval=4778009 TSecr=30270288
199127  17.285647     10.0.1.3 -> 10.0.1.2     TCP 66 glrpc > 50136 [ACK] Seq=200000001 Ack=10 Win=5824 Len=0 TSval=30270356 TSecr=4778009
  1   0.000000     10.0.1.2 -> 10.0.1.3     TCP 74 50138 > glrpc [SYN] Seq=0 Win=14600 Len=0 MSS=1460 SACK_PERM=1 TSval=4783483 TSecr=0 WS=64
  2   0.000297     10.0.1.3 -> 10.0.1.2     TCP 74 glrpc > 50138 [SYN, ACK] Seq=0 Ack=1 Win=5792 Len=0 MSS=1460 SACK_PERM=1 TSval=30275819 TSecr=4783483 WS=64
  3   0.000313     10.0.1.2 -> 10.0.1.3     TCP 66 50138 > glrpc [ACK] Seq=1 Ack=1 Win=14656 Len=0 TSval=4783483 TSecr=30275819
200154  17.222669     10.0.1.2 -> 10.0.1.3     TCP 66 50138 > glrpc [FIN, ACK] Seq=9 Ack=200000001 Win=3040832 Len=0 TSval=4787788 TSecr=30280067
200155  17.262658     10.0.1.3 -> 10.0.1.2     TCP 66 glrpc > 50138 [ACK] Seq=200000001 Ack=10 Win=5824 Len=0 TSval=30280135 TSecr=4787788
  1   0.000000     10.0.1.2 -> 10.0.1.3     TCP 74 50141 > glrpc [SYN] Seq=0 Win=14600 Len=0 MSS=1460 SACK_PERM=1 TSval=4793497 TSecr=0 WS=64
  2   0.000332     10.0.1.3 -> 10.0.1.2     TCP 74 glrpc > 50141 [SYN, ACK] Seq=0 Ack=1 Win=5792 Len=0 MSS=1460 SACK_PERM=1 TSval=30285833 TSecr=4793497 WS=64
  3   0.000349     10.0.1.2 -> 10.0.1.3     TCP 66 50141 > glrpc [ACK] Seq=1 Ack=1 Win=14656 Len=0 TSval=4793497 TSecr=30285833
207505  17.237654     10.0.1.2 -> 10.0.1.3     TCP 66 50141 > glrpc [FIN, ACK] Seq=9 Ack=200000001 Win=3075584 Len=0 TSval=4797807 TSecr=30290090
207506  17.276063     10.0.1.3 -> 10.0.1.2     TCP 66 glrpc > 50141 [ACK] Seq=200000001 Ack=10 Win=5824 Len=0 TSval=30290152 TSecr=4797807
  1   0.000000     10.0.1.2 -> 10.0.1.3     TCP 74 50143 > glrpc [SYN] Seq=0 Win=14600 Len=0 MSS=1460 SACK_PERM=1 TSval=4806532 TSecr=0 WS=64
  2   0.000316     10.0.1.3 -> 10.0.1.2     TCP 74 glrpc > 50143 [SYN, ACK] Seq=0 Ack=1 Win=5792 Len=0 MSS=1460 SACK_PERM=1 TSval=30298866 TSecr=4806532 WS=64
  3   0.000337     10.0.1.2 -> 10.0.1.3     TCP 66 50143 > glrpc [ACK] Seq=1 Ack=1 Win=14656 Len=0 TSval=4806532 TSecr=30298866
194494  17.343893     10.0.1.2 -> 10.0.1.3     TCP 66 50143 > glrpc [FIN, ACK] Seq=9 Ack=200000001 Win=3006080 Len=0 TSval=4810868 TSecr=30303147
194495  17.381642     10.0.1.3 -> 10.0.1.2     TCP 66 glrpc > 50143 [ACK] Seq=200000001 Ack=10 Win=5824 Len=0 TSval=30303212 TSecr=4810868
  1   0.000000     10.0.1.2 -> 10.0.1.3     TCP 74 50144 > glrpc [SYN] Seq=0 Win=14600 Len=0 MSS=1460 SACK_PERM=1 TSval=4819067 TSecr=0 WS=64
  2   0.000337     10.0.1.3 -> 10.0.1.2     TCP 74 glrpc > 50144 [SYN, ACK] Seq=0 Ack=1 Win=5792 Len=0 MSS=1460 SACK_PERM=1 TSval=30311401 TSecr=4819067 WS=64
  3   0.000358     10.0.1.2 -> 10.0.1.3     TCP 66 50144 > glrpc [ACK] Seq=1 Ack=1 Win=14656 Len=0 TSval=4819067 TSecr=30311401
207213  17.257344     10.0.1.2 -> 10.0.1.3     TCP 66 50144 > glrpc [FIN, ACK] Seq=9 Ack=200000001 Win=3049536 Len=0 TSval=4823382 TSecr=30315657
207214  17.295744     10.0.1.3 -> 10.0.1.2     TCP 66 glrpc > 50144 [ACK] Seq=200000001 Ack=10 Win=5824 Len=0 TSval=30315725 TSecr=4823382
  1   0.000000     10.0.1.2 -> 10.0.1.3     TCP 74 50148 > glrpc [SYN] Seq=0 Win=14600 Len=0 MSS=1460 SACK_PERM=1 TSval=4831283 TSecr=0 WS=64
  2   0.000330     10.0.1.3 -> 10.0.1.2     TCP 74 glrpc > 50148 [SYN, ACK] Seq=0 Ack=1 Win=5792 Len=0 MSS=1460 SACK_PERM=1 TSval=30323616 TSecr=4831283 WS=64
  3   0.000346     10.0.1.2 -> 10.0.1.3     TCP 66 50148 > glrpc [ACK] Seq=1 Ack=1 Win=14656 Len=0 TSval=4831283 TSecr=30323616
207428  17.197476     10.0.1.2 -> 10.0.1.3     TCP 66 50148 > glrpc [FIN, ACK] Seq=9 Ack=200000001 Win=3061120 Len=0 TSval=4835582 TSecr=30327862
207429  17.236813     10.0.1.3 -> 10.0.1.2     TCP 66 glrpc > 50148 [ACK] Seq=200000001 Ack=10 Win=5824 Len=0 TSval=30327925 TSecr=4835582
  1   0.000000     10.0.1.2 -> 10.0.1.3     TCP 74 50150 > glrpc [SYN] Seq=0 Win=14600 Len=0 MSS=1460 SACK_PERM=1 TSval=4841764 TSecr=0 WS=64
  2   0.000308     10.0.1.3 -> 10.0.1.2     TCP 74 glrpc > 50150 [SYN, ACK] Seq=0 Ack=1 Win=5792 Len=0 MSS=1460 SACK_PERM=1 TSval=30334096 TSecr=4841764 WS=64
  3   0.000323     10.0.1.2 -> 10.0.1.3     TCP 66 50150 > glrpc [ACK] Seq=1 Ack=1 Win=14656 Len=0 TSval=4841764 TSecr=30334096
195967  17.243772     10.0.1.2 -> 10.0.1.3     TCP 66 50150 > glrpc [FIN, ACK] Seq=9 Ack=200000001 Win=2988672 Len=0 TSval=4846075 TSecr=30338349
195968  17.282828     10.0.1.3 -> 10.0.1.2     TCP 66 glrpc > 50150 [ACK] Seq=200000001 Ack=10 Win=5824 Len=0 TSval=30338417 TSecr=4846075
  1   0.000000     10.0.1.2 -> 10.0.1.3     TCP 74 50151 > glrpc [SYN] Seq=0 Win=14600 Len=0 MSS=1460 SACK_PERM=1 TSval=4851503 TSecr=0 WS=64
  2   0.000299     10.0.1.3 -> 10.0.1.2     TCP 74 glrpc > 50151 [SYN, ACK] Seq=0 Ack=1 Win=5792 Len=0 MSS=1460 SACK_PERM=1 TSval=30343835 TSecr=4851503 WS=64
  3   0.000318     10.0.1.2 -> 10.0.1.3     TCP 66 50151 > glrpc [ACK] Seq=1 Ack=1 Win=14656 Len=0 TSval=4851503 TSecr=30343835
204758  17.209480     10.0.1.2 -> 10.0.1.3     TCP 66 50151 > glrpc [FIN, ACK] Seq=9 Ack=200000001 Win=3035008 Len=0 TSval=4855805 TSecr=30348078
204759  17.249961     10.0.1.3 -> 10.0.1.2     TCP 66 glrpc > 50151 [ACK] Seq=200000001 Ack=10 Win=5824 Len=0 TSval=30348147 TSecr=4855805
  1   0.000000     10.0.1.2 -> 10.0.1.3     TCP 74 50161 > glrpc [SYN] Seq=0 Win=14600 Len=0 MSS=1460 SACK_PERM=1 TSval=4861997 TSecr=0 WS=64
  2   0.000299     10.0.1.3 -> 10.0.1.2     TCP 74 glrpc > 50161 [SYN, ACK] Seq=0 Ack=1 Win=5792 Len=0 MSS=1460 SACK_PERM=1 TSval=30354328 TSecr=4861997 WS=64
  3   0.000321     10.0.1.2 -> 10.0.1.3     TCP 66 50161 > glrpc [ACK] Seq=1 Ack=1 Win=14656 Len=0 TSval=4861997 TSecr=30354328
207451  17.236980     10.0.1.2 -> 10.0.1.3     TCP 66 50161 > glrpc [FIN, ACK] Seq=9 Ack=200000001 Win=3014784 Len=0 TSval=4866306 TSecr=30358578
207452  17.278217     10.0.1.3 -> 10.0.1.2     TCP 66 glrpc > 50161 [ACK] Seq=200000001 Ack=10 Win=5824 Len=0 TSval=30358647 TSecr=4866306
  1   0.000000     10.0.1.2 -> 10.0.1.3     TCP 74 50163 > glrpc [SYN] Seq=0 Win=14600 Len=0 MSS=1460 SACK_PERM=1 TSval=4872629 TSecr=0 WS=64
  2   0.000282     10.0.1.3 -> 10.0.1.2     TCP 74 glrpc > 50163 [SYN, ACK] Seq=0 Ack=1 Win=5792 Len=0 MSS=1460 SACK_PERM=1 TSval=30364958 TSecr=4872629 WS=64
  3   0.000300     10.0.1.2 -> 10.0.1.3     TCP 66 50163 > glrpc [ACK] Seq=1 Ack=1 Win=14656 Len=0 TSval=4872629 TSecr=30364958
195242  17.261273     10.0.1.2 -> 10.0.1.3     TCP 66 50163 > glrpc [FIN, ACK] Seq=9 Ack=200000001 Win=3006080 Len=0 TSval=4876944 TSecr=30369215
195243  17.297923     10.0.1.3 -> 10.0.1.2     TCP 66 glrpc > 50163 [ACK] Seq=200000001 Ack=10 Win=5824 Len=0 TSval=30369283 TSecr=4876944
  1   0.000000     10.0.1.2 -> 10.0.1.3     TCP 74 50166 > glrpc [SYN] Seq=0 Win=14600 Len=0 MSS=1460 SACK_PERM=1 TSval=4882448 TSecr=0 WS=64
  2   0.000321     10.0.1.3 -> 10.0.1.2     TCP 74 glrpc > 50166 [SYN, ACK] Seq=0 Ack=1 Win=5792 Len=0 MSS=1460 SACK_PERM=1 TSval=30374777 TSecr=4882448 WS=64
  3   0.000340     10.0.1.2 -> 10.0.1.3     TCP 66 50166 > glrpc [ACK] Seq=1 Ack=1 Win=14656 Len=0 TSval=4882448 TSecr=30374777
207532  17.230540     10.0.1.2 -> 10.0.1.3     TCP 66 50166 > glrpc [FIN, ACK] Seq=9 Ack=200000001 Win=2968448 Len=0 TSval=4886755 TSecr=30379026
207533  17.269538     10.0.1.3 -> 10.0.1.2     TCP 66 glrpc > 50166 [ACK] Seq=200000001 Ack=10 Win=5824 Len=0 TSval=30379094 TSecr=4886755
  1   0.000000     10.0.1.2 -> 10.0.1.3     TCP 74 50168 > glrpc [SYN] Seq=0 Win=14600 Len=0 MSS=1460 SACK_PERM=1 TSval=4892748 TSecr=0 WS=64
  2   0.000402     10.0.1.3 -> 10.0.1.2     TCP 74 glrpc > 50168 [SYN, ACK] Seq=0 Ack=1 Win=5792 Len=0 MSS=1460 SACK_PERM=1 TSval=30385076 TSecr=4892748 WS=64
  3   0.000417     10.0.1.2 -> 10.0.1.3     TCP 66 50168 > glrpc [ACK] Seq=1 Ack=1 Win=14656 Len=0 TSval=4892748 TSecr=30385076
191762  17.255105     10.0.1.2 -> 10.0.1.3     TCP 66 50168 > glrpc [FIN, ACK] Seq=9 Ack=200000001 Win=3085184 Len=0 TSval=4897062 TSecr=30389368
191763  17.295081     10.0.1.3 -> 10.0.1.2     TCP 66 glrpc > 50168 [ACK] Seq=200000001 Ack=10 Win=5824 Len=0 TSval=30389400 TSecr=4897062
  1   0.000000     10.0.1.2 -> 10.0.1.3     TCP 74 50171 > glrpc [SYN] Seq=0 Win=14600 Len=0 MSS=1460 SACK_PERM=1 TSval=4902404 TSecr=0 WS=64
  2   0.000281     10.0.1.3 -> 10.0.1.2     TCP 74 glrpc > 50171 [SYN, ACK] Seq=0 Ack=1 Win=5792 Len=0 MSS=1460 SACK_PERM=1 TSval=30394731 TSecr=4902404 WS=64
  3   0.000299     10.0.1.2 -> 10.0.1.3     TCP 66 50171 > glrpc [ACK] Seq=1 Ack=1 Win=14656 Len=0 TSval=4902404 TSecr=30394731
198261  17.238013     10.0.1.2 -> 10.0.1.3     TCP 66 50171 > glrpc [FIN, ACK] Seq=9 Ack=200000001 Win=3085184 Len=0 TSval=4906713 TSecr=30398983
198262  17.277961     10.0.1.3 -> 10.0.1.2     TCP 66 glrpc > 50171 [ACK] Seq=200000001 Ack=10 Win=5824 Len=0 TSval=30399051 TSecr=4906713
