  1   0.000000     10.0.1.2 -> 10.0.1.3     TCP 74 50575 > glrpc [SYN] Seq=0 Win=14600 Len=0 MSS=1460 SACK_PERM=1 TSval=6314715 TSecr=0 WS=64
  2   0.000330     10.0.1.3 -> 10.0.1.2     TCP 74 glrpc > 50575 [SYN, ACK] Seq=0 Ack=1 Win=5792 Len=0 MSS=1460 SACK_PERM=1 TSval=31806937 TSecr=6314715 WS=64
  3   0.000347     10.0.1.2 -> 10.0.1.3     TCP 66 50575 > glrpc [ACK] Seq=1 Ack=1 Win=14656 Len=0 TSval=6314716 TSecr=31806937
414597  34.031299     10.0.1.2 -> 10.0.1.3     TCP 66 50575 > glrpc [FIN, ACK] Seq=9 Ack=400000001 Win=3011840 Len=0 TSval=6323223 TSecr=31815394
414598  34.068772     10.0.1.3 -> 10.0.1.2     TCP 66 glrpc > 50575 [ACK] Seq=400000001 Ack=10 Win=5824 Len=0 TSval=31815454 TSecr=6323223
  1   0.000000     10.0.1.2 -> 10.0.1.3     TCP 74 50583 > glrpc [SYN] Seq=0 Win=14600 Len=0 MSS=1460 SACK_PERM=1 TSval=6364042 TSecr=0 WS=64
  2   0.000428     10.0.1.3 -> 10.0.1.2     TCP 74 glrpc > 50583 [SYN, ACK] Seq=0 Ack=1 Win=5792 Len=0 MSS=1460 SACK_PERM=1 TSval=31856259 TSecr=6364042 WS=64
  3   0.000449     10.0.1.2 -> 10.0.1.3     TCP 66 50583 > glrpc [ACK] Seq=1 Ack=1 Win=14656 Len=0 TSval=6364042 TSecr=31856259
413217  34.067249     10.0.1.2 -> 10.0.1.3     TCP 66 50583 > glrpc [FIN, ACK] Seq=9 Ack=400000001 Win=3011840 Len=0 TSval=6372558 TSecr=31864713
413218  34.107061     10.0.1.3 -> 10.0.1.2     TCP 66 glrpc > 50583 [ACK] Seq=400000001 Ack=10 Win=5824 Len=0 TSval=31864786 TSecr=6372558
  1   0.000000     10.0.1.2 -> 10.0.1.3     TCP 74 50589 > glrpc [SYN] Seq=0 Win=14600 Len=0 MSS=1460 SACK_PERM=1 TSval=6412702 TSecr=0 WS=64
  2   0.000303     10.0.1.3 -> 10.0.1.2     TCP 74 glrpc > 50589 [SYN, ACK] Seq=0 Ack=1 Win=5792 Len=0 MSS=1460 SACK_PERM=1 TSval=31904916 TSecr=6412702 WS=64
  3   0.000324     10.0.1.2 -> 10.0.1.3     TCP 66 50589 > glrpc [ACK] Seq=1 Ack=1 Win=14656 Len=0 TSval=6412702 TSecr=31904916
384535  34.068140     10.0.1.2 -> 10.0.1.3     TCP 66 50589 > glrpc [FIN, ACK] Seq=9 Ack=400000001 Win=3011840 Len=0 TSval=6421219 TSecr=31913370
384536  34.105108     10.0.1.3 -> 10.0.1.2     TCP 66 glrpc > 50589 [ACK] Seq=400000001 Ack=10 Win=5824 Len=0 TSval=31913442 TSecr=6421219
  1   0.000000     10.0.1.2 -> 10.0.1.3     TCP 74 50596 > glrpc [SYN] Seq=0 Win=14600 Len=0 MSS=1460 SACK_PERM=1 TSval=6453746 TSecr=0 WS=64
  2   0.000332     10.0.1.3 -> 10.0.1.2     TCP 74 glrpc > 50596 [SYN, ACK] Seq=0 Ack=1 Win=5792 Len=0 MSS=1460 SACK_PERM=1 TSval=31945957 TSecr=6453746 WS=64
  3   0.000352     10.0.1.2 -> 10.0.1.3     TCP 66 50596 > glrpc [ACK] Seq=1 Ack=1 Win=14656 Len=0 TSval=6453746 TSecr=31945957
373210  34.036313     10.0.1.2 -> 10.0.1.3     TCP 66 50596 > glrpc [FIN, ACK] Seq=9 Ack=400000001 Win=3011840 Len=0 TSval=6462255 TSecr=31954413
373211  34.077024     10.0.1.3 -> 10.0.1.2     TCP 66 glrpc > 50596 [ACK] Seq=400000001 Ack=10 Win=5824 Len=0 TSval=31954476 TSecr=6462255
  1   0.000000     10.0.1.2 -> 10.0.1.3     TCP 74 50600 > glrpc [SYN] Seq=0 Win=14600 Len=0 MSS=1460 SACK_PERM=1 TSval=6491668 TSecr=0 WS=64
  2   0.000335     10.0.1.3 -> 10.0.1.2     TCP 74 glrpc > 50600 [SYN, ACK] Seq=0 Ack=1 Win=5792 Len=0 MSS=1460 SACK_PERM=1 TSval=31983876 TSecr=6491668 WS=64
  3   0.000353     10.0.1.2 -> 10.0.1.3     TCP 66 50600 > glrpc [ACK] Seq=1 Ack=1 Win=14656 Len=0 TSval=6491668 TSecr=31983876
384961  34.033058     10.0.1.2 -> 10.0.1.3     TCP 66 50600 > glrpc [FIN, ACK] Seq=9 Ack=400000001 Win=3011840 Len=0 TSval=6500176 TSecr=31992320
384962  34.070642     10.0.1.3 -> 10.0.1.2     TCP 66 glrpc > 50600 [ACK] Seq=400000001 Ack=10 Win=5824 Len=0 TSval=31992393 TSecr=6500176
  1   0.000000     10.0.1.2 -> 10.0.1.3     TCP 74 50605 > glrpc [SYN] Seq=0 Win=14600 Len=0 MSS=1460 SACK_PERM=1 TSval=6532700 TSecr=0 WS=64
  2   0.000298     10.0.1.3 -> 10.0.1.2     TCP 74 glrpc > 50605 [SYN, ACK] Seq=0 Ack=1 Win=5792 Len=0 MSS=1460 SACK_PERM=1 TSval=32024905 TSecr=6532700 WS=64
  3   0.000317     10.0.1.2 -> 10.0.1.3     TCP 66 50605 > glrpc [ACK] Seq=1 Ack=1 Win=14656 Len=0 TSval=6532700 TSecr=32024905
390986  34.015290     10.0.1.2 -> 10.0.1.3     TCP 66 50605 > glrpc [FIN, ACK] Seq=9 Ack=400000001 Win=3000256 Len=0 TSval=6541204 TSecr=32033347
390987  34.053609     10.0.1.3 -> 10.0.1.2     TCP 66 glrpc > 50605 [ACK] Seq=400000001 Ack=10 Win=5824 Len=0 TSval=32033418 TSecr=6541204
  1   0.000000     10.0.1.2 -> 10.0.1.3     TCP 74 50609 > glrpc [SYN] Seq=0 Win=14600 Len=0 MSS=1460 SACK_PERM=1 TSval=6575387 TSecr=0 WS=64
  2   0.000328     10.0.1.3 -> 10.0.1.2     TCP 74 glrpc > 50609 [SYN, ACK] Seq=0 Ack=1 Win=5792 Len=0 MSS=1460 SACK_PERM=1 TSval=32067589 TSecr=6575387 WS=64
  3   0.000345     10.0.1.2 -> 10.0.1.3     TCP 66 50609 > glrpc [ACK] Seq=1 Ack=1 Win=14656 Len=0 TSval=6575387 TSecr=32067589
397079  34.017686     10.0.1.2 -> 10.0.1.3     TCP 66 50609 > glrpc [FIN, ACK] Seq=9 Ack=400000001 Win=2974208 Len=0 TSval=6583892 TSecr=32076044
397080  34.055565     10.0.1.3 -> 10.0.1.2     TCP 66 glrpc > 50609 [ACK] Seq=400000001 Ack=10 Win=5824 Len=0 TSval=32076103 TSecr=6583892
  1   0.000000     10.0.1.2 -> 10.0.1.3     TCP 74 50617 > glrpc [SYN] Seq=0 Win=14600 Len=0 MSS=1460 SACK_PERM=1 TSval=6620179 TSecr=0 WS=64
  2   0.000332     10.0.1.3 -> 10.0.1.2     TCP 74 glrpc > 50617 [SYN, ACK] Seq=0 Ack=1 Win=5792 Len=0 MSS=1460 SACK_PERM=1 TSval=32112378 TSecr=6620179 WS=64
  3   0.000350     10.0.1.2 -> 10.0.1.3     TCP 66 50617 > glrpc [ACK] Seq=1 Ack=1 Win=14656 Len=0 TSval=6620179 TSecr=32112378
383771  34.034479     10.0.1.2 -> 10.0.1.3     TCP 66 50617 > glrpc [FIN, ACK] Seq=9 Ack=400000001 Win=3014784 Len=0 TSval=6628688 TSecr=32120823
383772  34.074331     10.0.1.3 -> 10.0.1.2     TCP 66 glrpc > 50617 [ACK] Seq=400000001 Ack=10 Win=5824 Len=0 TSval=32120896 TSecr=6628688
  1   0.000000     10.0.1.2 -> 10.0.1.3     TCP 74 50622 > glrpc [SYN] Seq=0 Win=14600 Len=0 MSS=1460 SACK_PERM=1 TSval=6660530 TSecr=0 WS=64
  2   0.000347     10.0.1.3 -> 10.0.1.2     TCP 74 glrpc > 50622 [SYN, ACK] Seq=0 Ack=1 Win=5792 Len=0 MSS=1460 SACK_PERM=1 TSval=32152726 TSecr=6660530 WS=64
  3   0.000361     10.0.1.2 -> 10.0.1.3     TCP 66 50622 > glrpc [ACK] Seq=1 Ack=1 Win=14656 Len=0 TSval=6660531 TSecr=32152726
411028  34.028938     10.0.1.2 -> 10.0.1.3     TCP 66 50622 > glrpc [FIN, ACK] Seq=9 Ack=400000001 Win=2988672 Len=0 TSval=6669038 TSecr=32161184
411029  34.068299     10.0.1.3 -> 10.0.1.2     TCP 66 glrpc > 50622 [ACK] Seq=400000001 Ack=10 Win=5824 Len=0 TSval=32161243 TSecr=6669038
  1   0.000000     10.0.1.2 -> 10.0.1.3     TCP 74 50630 > glrpc [SYN] Seq=0 Win=14600 Len=0 MSS=1460 SACK_PERM=1 TSval=6708571 TSecr=0 WS=64
  2   0.000332     10.0.1.3 -> 10.0.1.2     TCP 74 glrpc > 50630 [SYN, ACK] Seq=0 Ack=1 Win=5792 Len=0 MSS=1460 SACK_PERM=1 TSval=32200763 TSecr=6708571 WS=64
  3   0.000345     10.0.1.2 -> 10.0.1.3     TCP 66 50630 > glrpc [ACK] Seq=1 Ack=1 Win=14656 Len=0 TSval=6708571 TSecr=32200763
414613  34.020848     10.0.1.2 -> 10.0.1.3     TCP 66 50630 > glrpc [FIN, ACK] Seq=9 Ack=400000001 Win=3014784 Len=0 TSval=6717076 TSecr=32209215
414614  34.059975     10.0.1.3 -> 10.0.1.2     TCP 66 glrpc > 50630 [ACK] Seq=400000001 Ack=10 Win=5824 Len=0 TSval=32209278 TSecr=6717076
  1   0.000000     10.0.1.2 -> 10.0.1.3     TCP 74 50636 > glrpc [SYN] Seq=0 Win=14600 Len=0 MSS=1460 SACK_PERM=1 TSval=6757729 TSecr=0 WS=64
  2   0.000281     10.0.1.3 -> 10.0.1.2     TCP 74 glrpc > 50636 [SYN, ACK] Seq=0 Ack=1 Win=5792 Len=0 MSS=1460 SACK_PERM=1 TSval=32249917 TSecr=6757729 WS=64
  3   0.000295     10.0.1.2 -> 10.0.1.3     TCP 66 50636 > glrpc [ACK] Seq=1 Ack=1 Win=14656 Len=0 TSval=6757729 TSecr=32249917
379238  34.055452     10.0.1.2 -> 10.0.1.3     TCP 66 50636 > glrpc [FIN, ACK] Seq=9 Ack=400000001 Win=3011840 Len=0 TSval=6766243 TSecr=32258409
379239  34.091974     10.0.1.3 -> 10.0.1.2     TCP 66 glrpc > 50636 [ACK] Seq=400000001 Ack=10 Win=5824 Len=0 TSval=32258440 TSecr=6766243
  1   0.000000     10.0.1.2 -> 10.0.1.3     TCP 74 50641 > glrpc [SYN] Seq=0 Win=14600 Len=0 MSS=1460 SACK_PERM=1 TSval=6797120 TSecr=0 WS=64
  2   0.000417     10.0.1.3 -> 10.0.1.2     TCP 74 glrpc > 50641 [SYN, ACK] Seq=0 Ack=1 Win=5792 Len=0 MSS=1460 SACK_PERM=1 TSval=32289305 TSecr=6797120 WS=64
  3   0.000427     10.0.1.2 -> 10.0.1.3     TCP 66 50641 > glrpc [ACK] Seq=1 Ack=1 Win=14656 Len=0 TSval=6797120 TSecr=32289305
374795  34.046028     10.0.1.2 -> 10.0.1.3     TCP 66 50641 > glrpc [FIN, ACK] Seq=9 Ack=400000001 Win=3011840 Len=0 TSval=6805631 TSecr=32297752
374796  34.085309     10.0.1.3 -> 10.0.1.2     TCP 66 glrpc > 50641 [ACK] Seq=400000001 Ack=10 Win=5824 Len=0 TSval=32297826 TSecr=6805631
  1   0.000000     10.0.1.2 -> 10.0.1.3     TCP 74 50647 > glrpc [SYN] Seq=0 Win=14600 Len=0 MSS=1460 SACK_PERM=1 TSval=6835731 TSecr=0 WS=64
  2   0.000310     10.0.1.3 -> 10.0.1.2     TCP 74 glrpc > 50647 [SYN, ACK] Seq=0 Ack=1 Win=5792 Len=0 MSS=1460 SACK_PERM=1 TSval=32327914 TSecr=6835731 WS=64
  3   0.000330     10.0.1.2 -> 10.0.1.3     TCP 66 50647 > glrpc [ACK] Seq=1 Ack=1 Win=14656 Len=0 TSval=6835731 TSecr=32327914
414669  34.031463     10.0.1.2 -> 10.0.1.3     TCP 66 50647 > glrpc [FIN, ACK] Seq=9 Ack=400000001 Win=3011840 Len=0 TSval=6844239 TSecr=32336358
414670  34.069460     10.0.1.3 -> 10.0.1.2     TCP 66 glrpc > 50647 [ACK] Seq=400000001 Ack=10 Win=5824 Len=0 TSval=32336431 TSecr=6844239
  1   0.000000     10.0.1.2 -> 10.0.1.3     TCP 74 50651 > glrpc [SYN] Seq=0 Win=14600 Len=0 MSS=1460 SACK_PERM=1 TSval=6885095 TSecr=0 WS=64
  2   0.000324     10.0.1.3 -> 10.0.1.2     TCP 74 glrpc > 50651 [SYN, ACK] Seq=0 Ack=1 Win=5792 Len=0 MSS=1460 SACK_PERM=1 TSval=32377274 TSecr=6885095 WS=64
  3   0.000336     10.0.1.2 -> 10.0.1.3     TCP 66 50651 > glrpc [ACK] Seq=1 Ack=1 Win=14656 Len=0 TSval=6885095 TSecr=32377274
414739  34.045530     10.0.1.2 -> 10.0.1.3     TCP 66 50651 > glrpc [FIN, ACK] Seq=9 Ack=400000001 Win=3011840 Len=0 TSval=6893606 TSecr=32385731
414740  34.086447     10.0.1.3 -> 10.0.1.2     TCP 66 glrpc > 50651 [ACK] Seq=400000001 Ack=10 Win=5824 Len=0 TSval=32385795 TSecr=6893606
  1   0.000000     10.0.1.2 -> 10.0.1.3     TCP 74 50658 > glrpc [SYN] Seq=0 Win=14600 Len=0 MSS=1460 SACK_PERM=1 TSval=6934190 TSecr=0 WS=64
  2   0.000295     10.0.1.3 -> 10.0.1.2     TCP 74 glrpc > 50658 [SYN, ACK] Seq=0 Ack=1 Win=5792 Len=0 MSS=1460 SACK_PERM=1 TSval=32426365 TSecr=6934190 WS=64
  3   0.000310     10.0.1.2 -> 10.0.1.3     TCP 66 50658 > glrpc [ACK] Seq=1 Ack=1 Win=14656 Len=0 TSval=6934190 TSecr=32426365
396110  34.097727     10.0.1.2 -> 10.0.1.3     TCP 66 50658 > glrpc [FIN, ACK] Seq=9 Ack=400000001 Win=3085184 Len=0 TSval=6942714 TSecr=32434824
396111  34.133807     10.0.1.3 -> 10.0.1.2     TCP 66 glrpc > 50658 [ACK] Seq=400000001 Ack=10 Win=5824 Len=0 TSval=32434898 TSecr=6942714
  1   0.000000     10.0.1.2 -> 10.0.1.3     TCP 74 50664 > glrpc [SYN] Seq=0 Win=14600 Len=0 MSS=1460 SACK_PERM=1 TSval=6978095 TSecr=0 WS=64
  2   0.000318     10.0.1.3 -> 10.0.1.2     TCP 74 glrpc > 50664 [SYN, ACK] Seq=0 Ack=1 Win=5792 Len=0 MSS=1460 SACK_PERM=1 TSval=32470267 TSecr=6978095 WS=64
  3   0.000331     10.0.1.2 -> 10.0.1.3     TCP 66 50664 > glrpc [ACK] Seq=1 Ack=1 Win=14656 Len=0 TSval=6978095 TSecr=32470267
385461  34.031242     10.0.1.2 -> 10.0.1.3     TCP 66 50664 > glrpc [FIN, ACK] Seq=9 Ack=400000001 Win=3011840 Len=0 TSval=6986603 TSecr=32478752
385462  34.071787     10.0.1.3 -> 10.0.1.2     TCP 66 glrpc > 50664 [ACK] Seq=400000001 Ack=10 Win=5824 Len=0 TSval=32478784 TSecr=6986603
  1   0.000000     10.0.1.2 -> 10.0.1.3     TCP 74 50669 > glrpc [SYN] Seq=0 Win=14600 Len=0 MSS=1460 SACK_PERM=1 TSval=7019633 TSecr=0 WS=64
  2   0.000318     10.0.1.3 -> 10.0.1.2     TCP 74 glrpc > 50669 [SYN, ACK] Seq=0 Ack=1 Win=5792 Len=0 MSS=1460 SACK_PERM=1 TSval=32511802 TSecr=7019633 WS=64
  3   0.000340     10.0.1.2 -> 10.0.1.3     TCP 66 50669 > glrpc [ACK] Seq=1 Ack=1 Win=14656 Len=0 TSval=7019633 TSecr=32511802
401742  34.042266     10.0.1.2 -> 10.0.1.3     TCP 66 50669 > glrpc [FIN, ACK] Seq=9 Ack=400000001 Win=3014784 Len=0 TSval=7028144 TSecr=32520252
401743  34.081536     10.0.1.3 -> 10.0.1.2     TCP 66 glrpc > 50669 [ACK] Seq=400000001 Ack=10 Win=5824 Len=0 TSval=32520322 TSecr=7028144
  1   0.000000     10.0.1.2 -> 10.0.1.3     TCP 74 50675 > glrpc [SYN] Seq=0 Win=14600 Len=0 MSS=1460 SACK_PERM=1 TSval=7064989 TSecr=0 WS=64
  2   0.000336     10.0.1.3 -> 10.0.1.2     TCP 74 glrpc > 50675 [SYN, ACK] Seq=0 Ack=1 Win=5792 Len=0 MSS=1460 SACK_PERM=1 TSval=32557154 TSecr=7064989 WS=64
  3   0.000352     10.0.1.2 -> 10.0.1.3     TCP 66 50675 > glrpc [ACK] Seq=1 Ack=1 Win=14656 Len=0 TSval=7064989 TSecr=32557154
410822  34.066696     10.0.1.2 -> 10.0.1.3     TCP 66 50675 > glrpc [FIN, ACK] Seq=9 Ack=400000001 Win=3014784 Len=0 TSval=7073505 TSecr=32565620
410823  34.105270     10.0.1.3 -> 10.0.1.2     TCP 66 glrpc > 50675 [ACK] Seq=400000001 Ack=10 Win=5824 Len=0 TSval=32565680 TSecr=7073505
  1   0.000000     10.0.1.2 -> 10.0.1.3     TCP 74 50681 > glrpc [SYN] Seq=0 Win=14600 Len=0 MSS=1460 SACK_PERM=1 TSval=7113221 TSecr=0 WS=64
  2   0.000354     10.0.1.3 -> 10.0.1.2     TCP 74 glrpc > 50681 [SYN, ACK] Seq=0 Ack=1 Win=5792 Len=0 MSS=1460 SACK_PERM=1 TSval=32605382 TSecr=7113221 WS=64
  3   0.000367     10.0.1.2 -> 10.0.1.3     TCP 66 50681 > glrpc [ACK] Seq=1 Ack=1 Win=14656 Len=0 TSval=7113221 TSecr=32605382
386860  34.026942     10.0.1.2 -> 10.0.1.3     TCP 66 50681 > glrpc [FIN, ACK] Seq=9 Ack=400000001 Win=2991616 Len=0 TSval=7121727 TSecr=32613828
386861  34.067162     10.0.1.3 -> 10.0.1.2     TCP 66 glrpc > 50681 [ACK] Seq=400000001 Ack=10 Win=5824 Len=0 TSval=32613899 TSecr=7121727
  1   0.000000     10.0.1.2 -> 10.0.1.3     TCP 74 50686 > glrpc [SYN] Seq=0 Win=14600 Len=0 MSS=1460 SACK_PERM=1 TSval=7155317 TSecr=0 WS=64
  2   0.000285     10.0.1.3 -> 10.0.1.2     TCP 74 glrpc > 50686 [SYN, ACK] Seq=0 Ack=1 Win=5792 Len=0 MSS=1460 SACK_PERM=1 TSval=32647475 TSecr=7155317 WS=64
  3   0.000303     10.0.1.2 -> 10.0.1.3     TCP 66 50686 > glrpc [ACK] Seq=1 Ack=1 Win=14656 Len=0 TSval=7155317 TSecr=32647475
379981  34.031395     10.0.1.2 -> 10.0.1.3     TCP 66 50686 > glrpc [FIN, ACK] Seq=9 Ack=400000001 Win=3011840 Len=0 TSval=7163825 TSecr=32655919
379982  34.069178     10.0.1.3 -> 10.0.1.2     TCP 66 glrpc > 50686 [ACK] Seq=400000001 Ack=10 Win=5824 Len=0 TSval=32655992 TSecr=7163825
