  0.000000     10.0.1.2 -> 10.0.1.3     TCP 74 48718 > glrpc [SYN] Seq=0 Win=14600 Len=0 MSS=1460 SACK_PERM=1 TSval=1723653 TSecr=0 WS=64
  0.000350     10.0.1.3 -> 10.0.1.2     TCP 74 glrpc > 48718 [SYN, ACK] Seq=0 Ack=1 Win=5792 Len=0 MSS=1460 SACK_PERM=1 TSval=27216219 TSecr=1723653 WS=64
  0.000366     10.0.1.2 -> 10.0.1.3     TCP 66 48718 > glrpc [ACK] Seq=1 Ack=1 Win=14656 Len=0 TSval=1723653 TSecr=27216219
 12.865669     10.0.1.2 -> 10.0.1.3     TCP 66 48718 > glrpc [FIN, ACK] Seq=9 Ack=150000001 Win=2258880 Len=0 TSval=1726869 TSecr=27219410
 12.903394     10.0.1.3 -> 10.0.1.2     TCP 66 glrpc > 48718 [ACK] Seq=150000001 Ack=10 Win=5824 Len=0 TSval=27219445 TSecr=1726869
 17.867174     10.0.1.2 -> 10.0.1.3     TCP 74 48719 > glrpc [SYN] Seq=0 Win=14600 Len=0 MSS=1460 SACK_PERM=1 TSval=1728119 TSecr=0 WS=64
 17.867576     10.0.1.3 -> 10.0.1.2     TCP 74 glrpc > 48719 [SYN, ACK] Seq=0 Ack=1 Win=5792 Len=0 MSS=1460 SACK_PERM=1 TSval=27220685 TSecr=1728119 WS=64
 17.867592     10.0.1.2 -> 10.0.1.3     TCP 66 48719 > glrpc [ACK] Seq=1 Ack=1 Win=14656 Len=0 TSval=1728120 TSecr=27220685
 30.832325     10.0.1.2 -> 10.0.1.3     TCP 66 48719 > glrpc [FIN, ACK] Seq=9 Ack=150000001 Win=2348672 Len=0 TSval=1731361 TSecr=27223901
 30.869734     10.0.1.3 -> 10.0.1.2     TCP 66 glrpc > 48719 [ACK] Seq=150000001 Ack=10 Win=5824 Len=0 TSval=27223936 TSecr=1731361
 35.833889     10.0.1.2 -> 10.0.1.3     TCP 74 48720 > glrpc [SYN] Seq=0 Win=14600 Len=0 MSS=1460 SACK_PERM=1 TSval=1732611 TSecr=0 WS=64
 35.834171     10.0.1.3 -> 10.0.1.2     TCP 74 glrpc > 48720 [SYN, ACK] Seq=0 Ack=1 Win=5792 Len=0 MSS=1460 SACK_PERM=1 TSval=27225177 TSecr=1732611 WS=64
 35.834190     10.0.1.2 -> 10.0.1.3     TCP 66 48720 > glrpc [ACK] Seq=1 Ack=1 Win=14656 Len=0 TSval=1732611 TSecr=27225177
 48.829222     10.0.1.2 -> 10.0.1.3     TCP 66 48720 > glrpc [FIN, ACK] Seq=9 Ack=150000001 Win=2351552 Len=0 TSval=1735860 TSecr=27228400
 48.866112     10.0.1.3 -> 10.0.1.2     TCP 66 glrpc > 48720 [ACK] Seq=150000001 Ack=10 Win=5824 Len=0 TSval=27228435 TSecr=1735860
 53.830617     10.0.1.2 -> 10.0.1.3     TCP 74 48723 > glrpc [SYN] Seq=0 Win=14600 Len=0 MSS=1460 SACK_PERM=1 TSval=1737110 TSecr=0 WS=64
 53.830922     10.0.1.3 -> 10.0.1.2     TCP 74 glrpc > 48723 [SYN, ACK] Seq=0 Ack=1 Win=5792 Len=0 MSS=1460 SACK_PERM=1 TSval=27229676 TSecr=1737110 WS=64
 53.830939     10.0.1.2 -> 10.0.1.3     TCP 66 48723 > glrpc [ACK] Seq=1 Ack=1 Win=14656 Len=0 TSval=1737110 TSecr=27229676
 66.825231     10.0.1.2 -> 10.0.1.3     TCP 66 48723 > glrpc [FIN, ACK] Seq=9 Ack=150000001 Win=2342912 Len=0 TSval=1740359 TSecr=27232898
 66.864413     10.0.1.3 -> 10.0.1.2     TCP 66 glrpc > 48723 [ACK] Seq=150000001 Ack=10 Win=5824 Len=0 TSval=27232934 TSecr=1740359
 71.826723     10.0.1.2 -> 10.0.1.3     TCP 74 48726 > glrpc [SYN] Seq=0 Win=14600 Len=0 MSS=1460 SACK_PERM=1 TSval=1741609 TSecr=0 WS=64
 71.827054     10.0.1.3 -> 10.0.1.2     TCP 74 glrpc > 48726 [SYN, ACK] Seq=0 Ack=1 Win=5792 Len=0 MSS=1460 SACK_PERM=1 TSval=27234174 TSecr=1741609 WS=64
 71.827072     10.0.1.2 -> 10.0.1.3     TCP 66 48726 > glrpc [ACK] Seq=1 Ack=1 Win=14656 Len=0 TSval=1741609 TSecr=27234174
 84.829319     10.0.1.2 -> 10.0.1.3     TCP 66 48726 > glrpc [FIN, ACK] Seq=9 Ack=150000001 Win=2328384 Len=0 TSval=1744860 TSecr=27237399
 84.869779     10.0.1.3 -> 10.0.1.2     TCP 66 glrpc > 48726 [ACK] Seq=150000001 Ack=10 Win=5824 Len=0 TSval=27237435 TSecr=1744860
 89.830897     10.0.1.2 -> 10.0.1.3     TCP 74 48728 > glrpc [SYN] Seq=0 Win=14600 Len=0 MSS=1460 SACK_PERM=1 TSval=1746110 TSecr=0 WS=64
 89.831195     10.0.1.3 -> 10.0.1.2     TCP 74 glrpc > 48728 [SYN, ACK] Seq=0 Ack=1 Win=5792 Len=0 MSS=1460 SACK_PERM=1 TSval=27238675 TSecr=1746110 WS=64
 89.831214     10.0.1.2 -> 10.0.1.3     TCP 66 48728 > glrpc [ACK] Seq=1 Ack=1 Win=14656 Len=0 TSval=1746110 TSecr=27238675
102.793581     10.0.1.2 -> 10.0.1.3     TCP 66 48728 > glrpc [FIN, ACK] Seq=9 Ack=150000001 Win=2302336 Len=0 TSval=1749351 TSecr=27241889
102.830150     10.0.1.3 -> 10.0.1.2     TCP 66 glrpc > 48728 [ACK] Seq=150000001 Ack=10 Win=5824 Len=0 TSval=27241925 TSecr=1749351
107.794945     10.0.1.2 -> 10.0.1.3     TCP 74 48729 > glrpc [SYN] Seq=0 Win=14600 Len=0 MSS=1460 SACK_PERM=1 TSval=1750601 TSecr=0 WS=64
107.795244     10.0.1.3 -> 10.0.1.2     TCP 74 glrpc > 48729 [SYN, ACK] Seq=0 Ack=1 Win=5792 Len=0 MSS=1460 SACK_PERM=1 TSval=27243166 TSecr=1750601 WS=64
107.795263     10.0.1.2 -> 10.0.1.3     TCP 66 48729 > glrpc [ACK] Seq=1 Ack=1 Win=14656 Len=0 TSval=1750601 TSecr=27243166
120.765453     10.0.1.2 -> 10.0.1.3     TCP 66 48729 > glrpc [FIN, ACK] Seq=9 Ack=150000001 Win=2339968 Len=0 TSval=1753844 TSecr=27246382
120.803496     10.0.1.3 -> 10.0.1.2     TCP 66 glrpc > 48729 [ACK] Seq=150000001 Ack=10 Win=5824 Len=0 TSval=27246418 TSecr=1753844
125.766929     10.0.1.2 -> 10.0.1.3     TCP 74 48730 > glrpc [SYN] Seq=0 Win=14600 Len=0 MSS=1460 SACK_PERM=1 TSval=1755094 TSecr=0 WS=64
125.767208     10.0.1.3 -> 10.0.1.2     TCP 74 glrpc > 48730 [SYN, ACK] Seq=0 Ack=1 Win=5792 Len=0 MSS=1460 SACK_PERM=1 TSval=27247658 TSecr=1755094 WS=64
125.767222     10.0.1.2 -> 10.0.1.3     TCP 66 48730 > glrpc [ACK] Seq=1 Ack=1 Win=14656 Len=0 TSval=1755094 TSecr=27247658
138.766446     10.0.1.2 -> 10.0.1.3     TCP 66 48730 > glrpc [FIN, ACK] Seq=9 Ack=150000001 Win=2313920 Len=0 TSval=1758344 TSecr=27250882
138.804845     10.0.1.3 -> 10.0.1.2     TCP 66 glrpc > 48730 [ACK] Seq=150000001 Ack=10 Win=5824 Len=0 TSval=27250918 TSecr=1758344
143.767901     10.0.1.2 -> 10.0.1.3     TCP 74 48732 > glrpc [SYN] Seq=0 Win=14600 Len=0 MSS=1460 SACK_PERM=1 TSval=1759595 TSecr=0 WS=64
143.768190     10.0.1.3 -> 10.0.1.2     TCP 74 glrpc > 48732 [SYN, ACK] Seq=0 Ack=1 Win=5792 Len=0 MSS=1460 SACK_PERM=1 TSval=27252158 TSecr=1759595 WS=64
143.768206     10.0.1.2 -> 10.0.1.3     TCP 66 48732 > glrpc [ACK] Seq=1 Ack=1 Win=14656 Len=0 TSval=1759595 TSecr=27252158
156.795722     10.0.1.2 -> 10.0.1.3     TCP 66 48732 > glrpc [FIN, ACK] Seq=9 Ack=150000001 Win=2392128 Len=0 TSval=1762852 TSecr=27255388
156.834244     10.0.1.3 -> 10.0.1.2     TCP 66 glrpc > 48732 [ACK] Seq=150000001 Ack=10 Win=5824 Len=0 TSval=27255425 TSecr=1762852
161.797331     10.0.1.2 -> 10.0.1.3     TCP 74 48733 > glrpc [SYN] Seq=0 Win=14600 Len=0 MSS=1460 SACK_PERM=1 TSval=1764102 TSecr=0 WS=64
161.797610     10.0.1.3 -> 10.0.1.2     TCP 74 glrpc > 48733 [SYN, ACK] Seq=0 Ack=1 Win=5792 Len=0 MSS=1460 SACK_PERM=1 TSval=27256665 TSecr=1764102 WS=64
161.797624     10.0.1.2 -> 10.0.1.3     TCP 66 48733 > glrpc [ACK] Seq=1 Ack=1 Win=14656 Len=0 TSval=1764102 TSecr=27256665
174.773685     10.0.1.2 -> 10.0.1.3     TCP 66 48733 > glrpc [FIN, ACK] Seq=9 Ack=150000001 Win=2325504 Len=0 TSval=1767346 TSecr=27259883
174.811557     10.0.1.3 -> 10.0.1.2     TCP 66 glrpc > 48733 [ACK] Seq=150000001 Ack=10 Win=5824 Len=0 TSval=27259919 TSecr=1767346
179.775088     10.0.1.2 -> 10.0.1.3     TCP 74 48734 > glrpc [SYN] Seq=0 Win=14600 Len=0 MSS=1460 SACK_PERM=1 TSval=1768596 TSecr=0 WS=64
179.775420     10.0.1.3 -> 10.0.1.2     TCP 74 glrpc > 48734 [SYN, ACK] Seq=0 Ack=1 Win=5792 Len=0 MSS=1460 SACK_PERM=1 TSval=27261159 TSecr=1768596 WS=64
179.775438     10.0.1.2 -> 10.0.1.3     TCP 66 48734 > glrpc [ACK] Seq=1 Ack=1 Win=14656 Len=0 TSval=1768596 TSecr=27261159
192.672529     10.0.1.2 -> 10.0.1.3     TCP 66 48734 > glrpc [FIN, ACK] Seq=9 Ack=150000001 Win=2322624 Len=0 TSval=1771821 TSecr=27264357
192.708936     10.0.1.3 -> 10.0.1.2     TCP 66 glrpc > 48734 [ACK] Seq=150000001 Ack=10 Win=5824 Len=0 TSval=27264393 TSecr=1771821
197.691824     10.0.1.2 -> 10.0.1.3     TCP 74 48736 > glrpc [SYN] Seq=0 Win=14600 Len=0 MSS=1460 SACK_PERM=1 TSval=1773076 TSecr=0 WS=64
197.692138     10.0.1.3 -> 10.0.1.2     TCP 74 glrpc > 48736 [SYN, ACK] Seq=0 Ack=1 Win=5792 Len=0 MSS=1460 SACK_PERM=1 TSval=27265638 TSecr=1773076 WS=64
197.692152     10.0.1.2 -> 10.0.1.3     TCP 66 48736 > glrpc [ACK] Seq=1 Ack=1 Win=14656 Len=0 TSval=1773076 TSecr=27265638
210.656873     10.0.1.2 -> 10.0.1.3     TCP 66 48736 > glrpc [FIN, ACK] Seq=9 Ack=150000001 Win=2342912 Len=0 TSval=1776317 TSecr=27268854
210.695308     10.0.1.3 -> 10.0.1.2     TCP 66 glrpc > 48736 [ACK] Seq=150000001 Ack=10 Win=5824 Len=0 TSval=27268889 TSecr=1776317
215.687291     10.0.1.2 -> 10.0.1.3     TCP 74 48738 > glrpc [SYN] Seq=0 Win=14600 Len=0 MSS=1460 SACK_PERM=1 TSval=1777574 TSecr=0 WS=64
215.687614     10.0.1.3 -> 10.0.1.2     TCP 74 glrpc > 48738 [SYN, ACK] Seq=0 Ack=1 Win=5792 Len=0 MSS=1460 SACK_PERM=1 TSval=27270137 TSecr=1777574 WS=64
215.687628     10.0.1.2 -> 10.0.1.3     TCP 66 48738 > glrpc [ACK] Seq=1 Ack=1 Win=14656 Len=0 TSval=1777575 TSecr=27270137
228.646108     10.0.1.2 -> 10.0.1.3     TCP 66 48738 > glrpc [FIN, ACK] Seq=9 Ack=150000001 Win=2331328 Len=0 TSval=1780814 TSecr=27273351
228.683611     10.0.1.3 -> 10.0.1.2     TCP 66 glrpc > 48738 [ACK] Seq=150000001 Ack=10 Win=5824 Len=0 TSval=27273386 TSecr=1780814
233.647654     10.0.1.2 -> 10.0.1.3     TCP 74 48742 > glrpc [SYN] Seq=0 Win=14600 Len=0 MSS=1460 SACK_PERM=1 TSval=1782065 TSecr=0 WS=64
233.647936     10.0.1.3 -> 10.0.1.2     TCP 74 glrpc > 48742 [SYN, ACK] Seq=0 Ack=1 Win=5792 Len=0 MSS=1460 SACK_PERM=1 TSval=27274627 TSecr=1782065 WS=64
233.647953     10.0.1.2 -> 10.0.1.3     TCP 66 48742 > glrpc [ACK] Seq=1 Ack=1 Win=14656 Len=0 TSval=1782065 TSecr=27274627
246.553606     10.0.1.2 -> 10.0.1.3     TCP 66 48742 > glrpc [FIN, ACK] Seq=9 Ack=150000001 Win=2256000 Len=0 TSval=1785291 TSecr=27277826
246.593958     10.0.1.3 -> 10.0.1.2     TCP 66 glrpc > 48742 [ACK] Seq=150000001 Ack=10 Win=5824 Len=0 TSval=27277863 TSecr=1785291
251.568925     10.0.1.2 -> 10.0.1.3     TCP 74 48743 > glrpc [SYN] Seq=0 Win=14600 Len=0 MSS=1460 SACK_PERM=1 TSval=1786545 TSecr=0 WS=64
251.569243     10.0.1.3 -> 10.0.1.2     TCP 74 glrpc > 48743 [SYN, ACK] Seq=0 Ack=1 Win=5792 Len=0 MSS=1460 SACK_PERM=1 TSval=27279106 TSecr=1786545 WS=64
251.569261     10.0.1.2 -> 10.0.1.3     TCP 66 48743 > glrpc [ACK] Seq=1 Ack=1 Win=14656 Len=0 TSval=1786545 TSecr=27279106
264.481906     10.0.1.2 -> 10.0.1.3     TCP 66 48743 > glrpc [FIN, ACK] Seq=9 Ack=150000001 Win=2383424 Len=0 TSval=1789773 TSecr=27282309
264.519269     10.0.1.3 -> 10.0.1.2     TCP 66 glrpc > 48743 [ACK] Seq=150000001 Ack=10 Win=5824 Len=0 TSval=27282344 TSecr=1789773
269.542270     10.0.1.2 -> 10.0.1.3     TCP 74 48745 > glrpc [SYN] Seq=0 Win=14600 Len=0 MSS=1460 SACK_PERM=1 TSval=1791038 TSecr=0 WS=64
269.542559     10.0.1.3 -> 10.0.1.2     TCP 74 glrpc > 48745 [SYN, ACK] Seq=0 Ack=1 Win=5792 Len=0 MSS=1460 SACK_PERM=1 TSval=27283599 TSecr=1791038 WS=64
269.542576     10.0.1.2 -> 10.0.1.3     TCP 66 48745 > glrpc [ACK] Seq=1 Ack=1 Win=14656 Len=0 TSval=1791038 TSecr=27283599
282.584832     10.0.1.2 -> 10.0.1.3     TCP 66 48745 > glrpc [FIN, ACK] Seq=9 Ack=150000001 Win=2270464 Len=0 TSval=1794299 TSecr=27286831
282.623669     10.0.1.3 -> 10.0.1.2     TCP 66 glrpc > 48745 [ACK] Seq=150000001 Ack=10 Win=5824 Len=0 TSval=27286870 TSecr=1794299
287.586267     10.0.1.2 -> 10.0.1.3     TCP 74 48746 > glrpc [SYN] Seq=0 Win=14600 Len=0 MSS=1460 SACK_PERM=1 TSval=1795549 TSecr=0 WS=64
287.586595     10.0.1.3 -> 10.0.1.2     TCP 74 glrpc > 48746 [SYN, ACK] Seq=0 Ack=1 Win=5792 Len=0 MSS=1460 SACK_PERM=1 TSval=27288110 TSecr=1795549 WS=64
287.586608     10.0.1.2 -> 10.0.1.3     TCP 66 48746 > glrpc [ACK] Seq=1 Ack=1 Win=14656 Len=0 TSval=1795549 TSecr=27288110
300.520631     10.0.1.2 -> 10.0.1.3     TCP 66 48746 > glrpc [FIN, ACK] Seq=9 Ack=150000001 Win=2322624 Len=0 TSval=1798783 TSecr=27291316
300.557063     10.0.1.3 -> 10.0.1.2     TCP 66 glrpc > 48746 [ACK] Seq=150000001 Ack=10 Win=5824 Len=0 TSval=27291353 TSecr=1798783
305.522015     10.0.1.2 -> 10.0.1.3     TCP 74 48747 > glrpc [SYN] Seq=0 Win=14600 Len=0 MSS=1460 SACK_PERM=1 TSval=1800033 TSecr=0 WS=64
305.522313     10.0.1.3 -> 10.0.1.2     TCP 74 glrpc > 48747 [SYN, ACK] Seq=0 Ack=1 Win=5792 Len=0 MSS=1460 SACK_PERM=1 TSval=27292594 TSecr=1800033 WS=64
305.522327     10.0.1.2 -> 10.0.1.3     TCP 66 48747 > glrpc [ACK] Seq=1 Ack=1 Win=14656 Len=0 TSval=1800033 TSecr=27292594
318.465963     10.0.1.2 -> 10.0.1.3     TCP 66 48747 > glrpc [FIN, ACK] Seq=9 Ack=150000001 Win=2244416 Len=0 TSval=1803269 TSecr=27295804
318.503364     10.0.1.3 -> 10.0.1.2     TCP 66 glrpc > 48747 [ACK] Seq=150000001 Ack=10 Win=5824 Len=0 TSval=27295839 TSecr=1803269
323.468094     10.0.1.2 -> 10.0.1.3     TCP 74 48749 > glrpc [SYN] Seq=0 Win=14600 Len=0 MSS=1460 SACK_PERM=1 TSval=1804520 TSecr=0 WS=64
323.468421     10.0.1.3 -> 10.0.1.2     TCP 74 glrpc > 48749 [SYN, ACK] Seq=0 Ack=1 Win=5792 Len=0 MSS=1460 SACK_PERM=1 TSval=27297080 TSecr=1804520 WS=64
323.468437     10.0.1.2 -> 10.0.1.3     TCP 66 48749 > glrpc [ACK] Seq=1 Ack=1 Win=14656 Len=0 TSval=1804520 TSecr=27297080
336.350080     10.0.1.2 -> 10.0.1.3     TCP 66 48749 > glrpc [FIN, ACK] Seq=9 Ack=150000001 Win=2311040 Len=0 TSval=1807740 TSecr=27300275
336.391699     10.0.1.3 -> 10.0.1.2     TCP 66 glrpc > 48749 [ACK] Seq=150000001 Ack=10 Win=5824 Len=0 TSval=27300310 TSecr=1807740
341.351492     10.0.1.2 -> 10.0.1.3     TCP 74 48750 > glrpc [SYN] Seq=0 Win=14600 Len=0 MSS=1460 SACK_PERM=1 TSval=1808990 TSecr=0 WS=64
341.351816     10.0.1.3 -> 10.0.1.2     TCP 74 glrpc > 48750 [SYN, ACK] Seq=0 Ack=1 Win=5792 Len=0 MSS=1460 SACK_PERM=1 TSval=27301550 TSecr=1808990 WS=64
341.351835     10.0.1.2 -> 10.0.1.3     TCP 66 48750 > glrpc [ACK] Seq=1 Ack=1 Win=14656 Len=0 TSval=1808991 TSecr=27301550
354.272569     10.0.1.2 -> 10.0.1.3     TCP 66 48750 > glrpc [FIN, ACK] Seq=9 Ack=150000001 Win=2319744 Len=0 TSval=1812221 TSecr=27304755
354.309042     10.0.1.3 -> 10.0.1.2     TCP 66 glrpc > 48750 [ACK] Seq=150000001 Ack=10 Win=5824 Len=0 TSval=27304790 TSecr=1812221
