  1   0.000000     10.0.1.2 -> 10.0.1.3     TCP 74 50387 > glrpc [SYN] Seq=0 Win=14600 Len=0 MSS=1460 SACK_PERM=1 TSval=5686692 TSecr=0 WS=64
  2   0.000300     10.0.1.3 -> 10.0.1.2     TCP 74 glrpc > 50387 [SYN, ACK] Seq=0 Ack=1 Win=5792 Len=0 MSS=1460 SACK_PERM=1 TSval=31178961 TSecr=5686692 WS=64
  3   0.000318     10.0.1.2 -> 10.0.1.3     TCP 66 50387 > glrpc [ACK] Seq=1 Ack=1 Win=14656 Len=0 TSval=5686692 TSecr=31178961
353214  29.775445     10.0.1.2 -> 10.0.1.3     TCP 66 50387 > glrpc [FIN, ACK] Seq=9 Ack=350000001 Win=2982912 Len=0 TSval=5694136 TSecr=31186342
353215  29.814413     10.0.1.3 -> 10.0.1.2     TCP 66 glrpc > 50387 [ACK] Seq=350000001 Ack=10 Win=5824 Len=0 TSval=31186414 TSecr=5694136
  1   0.000000     10.0.1.2 -> 10.0.1.3     TCP 74 50391 > glrpc [SYN] Seq=0 Win=14600 Len=0 MSS=1460 SACK_PERM=1 TSval=5719439 TSecr=0 WS=64
  2   0.000329     10.0.1.3 -> 10.0.1.2     TCP 74 glrpc > 50391 [SYN, ACK] Seq=0 Ack=1 Win=5792 Len=0 MSS=1460 SACK_PERM=1 TSval=31211705 TSecr=5719439 WS=64
  3   0.000346     10.0.1.2 -> 10.0.1.3     TCP 66 50391 > glrpc [ACK] Seq=1 Ack=1 Win=14656 Len=0 TSval=5719439 TSecr=31211705
343033  29.798590     10.0.1.2 -> 10.0.1.3     TCP 66 50391 > glrpc [FIN, ACK] Seq=9 Ack=350000001 Win=3011840 Len=0 TSval=5726889 TSecr=31219091
343034  29.835831     10.0.1.3 -> 10.0.1.2     TCP 66 glrpc > 50391 [ACK] Seq=350000001 Ack=10 Win=5824 Len=0 TSval=31219164 TSecr=5726889
  1   0.000000     10.0.1.2 -> 10.0.1.3     TCP 74 50476 > glrpc [SYN] Seq=0 Win=14600 Len=0 MSS=1460 SACK_PERM=1 TSval=5750594 TSecr=0 WS=64
  2   0.000353     10.0.1.3 -> 10.0.1.2     TCP 74 glrpc > 50476 [SYN, ACK] Seq=0 Ack=1 Win=5792 Len=0 MSS=1460 SACK_PERM=1 TSval=31242858 TSecr=5750594 WS=64
  3   0.000375     10.0.1.2 -> 10.0.1.3     TCP 66 50476 > glrpc [ACK] Seq=1 Ack=1 Win=14656 Len=0 TSval=5750595 TSecr=31242858
342653  29.792483     10.0.1.2 -> 10.0.1.3     TCP 66 50476 > glrpc [FIN, ACK] Seq=9 Ack=350000001 Win=3011840 Len=0 TSval=5758043 TSecr=31250241
342654  29.831118     10.0.1.3 -> 10.0.1.2     TCP 66 glrpc > 50476 [ACK] Seq=350000001 Ack=10 Win=5824 Len=0 TSval=31250316 TSecr=5758043
  1   0.000000     10.0.1.2 -> 10.0.1.3     TCP 74 50481 > glrpc [SYN] Seq=0 Win=14600 Len=0 MSS=1460 SACK_PERM=1 TSval=5781374 TSecr=0 WS=64
  2   0.000325     10.0.1.3 -> 10.0.1.2     TCP 74 glrpc > 50481 [SYN, ACK] Seq=0 Ack=1 Win=5792 Len=0 MSS=1460 SACK_PERM=1 TSval=31273636 TSecr=5781374 WS=64
  3   0.000340     10.0.1.2 -> 10.0.1.3     TCP 66 50481 > glrpc [ACK] Seq=1 Ack=1 Win=14656 Len=0 TSval=5781375 TSecr=31273636
336152  29.781685     10.0.1.2 -> 10.0.1.3     TCP 66 50481 > glrpc [FIN, ACK] Seq=9 Ack=350000001 Win=3069760 Len=0 TSval=5788820 TSecr=31281033
336153  29.820225     10.0.1.3 -> 10.0.1.2     TCP 66 glrpc > 50481 [ACK] Seq=350000001 Ack=10 Win=5824 Len=0 TSval=31281091 TSecr=5788820
  1   0.000000     10.0.1.2 -> 10.0.1.3     TCP 74 50490 > glrpc [SYN] Seq=0 Win=14600 Len=0 MSS=1460 SACK_PERM=1 TSval=5810522 TSecr=0 WS=64
  2   0.000281     10.0.1.3 -> 10.0.1.2     TCP 74 glrpc > 50490 [SYN, ACK] Seq=0 Ack=1 Win=5792 Len=0 MSS=1460 SACK_PERM=1 TSval=31302781 TSecr=5810522 WS=64
  3   0.000296     10.0.1.2 -> 10.0.1.3     TCP 66 50490 > glrpc [ACK] Seq=1 Ack=1 Win=14656 Len=0 TSval=5810522 TSecr=31302781
340218  29.797969     10.0.1.2 -> 10.0.1.3     TCP 66 50490 > glrpc [FIN, ACK] Seq=9 Ack=350000001 Win=3011840 Len=0 TSval=5817971 TSecr=31310168
340219  29.835472     10.0.1.3 -> 10.0.1.2     TCP 66 glrpc > 50490 [ACK] Seq=350000001 Ack=10 Win=5824 Len=0 TSval=31310240 TSecr=5817971
  1   0.000000     10.0.1.2 -> 10.0.1.3     TCP 74 50497 > glrpc [SYN] Seq=0 Win=14600 Len=0 MSS=1460 SACK_PERM=1 TSval=5840545 TSecr=0 WS=64
  2   0.000294     10.0.1.3 -> 10.0.1.2     TCP 74 glrpc > 50497 [SYN, ACK] Seq=0 Ack=1 Win=5792 Len=0 MSS=1460 SACK_PERM=1 TSval=31332803 TSecr=5840545 WS=64
  3   0.000305     10.0.1.2 -> 10.0.1.3     TCP 66 50497 > glrpc [ACK] Seq=1 Ack=1 Win=14656 Len=0 TSval=5840546 TSecr=31332803
362270  29.774735     10.0.1.2 -> 10.0.1.3     TCP 66 50497 > glrpc [FIN, ACK] Seq=9 Ack=350000001 Win=3014784 Len=0 TSval=5847989 TSecr=31340182
362271  29.814868     10.0.1.3 -> 10.0.1.2     TCP 66 glrpc > 50497 [ACK] Seq=350000001 Ack=10 Win=5824 Len=0 TSval=31340256 TSecr=5847989
  1   0.000000     10.0.1.2 -> 10.0.1.3     TCP 74 50502 > glrpc [SYN] Seq=0 Win=14600 Len=0 MSS=1460 SACK_PERM=1 TSval=5875675 TSecr=0 WS=64
  2   0.000372     10.0.1.3 -> 10.0.1.2     TCP 74 glrpc > 50502 [SYN, ACK] Seq=0 Ack=1 Win=5792 Len=0 MSS=1460 SACK_PERM=1 TSval=31367930 TSecr=5875675 WS=64
  3   0.000386     10.0.1.2 -> 10.0.1.3     TCP 66 50502 > glrpc [ACK] Seq=1 Ack=1 Win=14656 Len=0 TSval=5875675 TSecr=31367930
  1   0.000000     10.0.1.2 -> 10.0.1.3     TCP 74 50506 > glrpc [SYN] Seq=0 Win=14600 Len=0 MSS=1460 SACK_PERM=1 TSval=5905115 TSecr=0 WS=64
  2   0.000369     10.0.1.3 -> 10.0.1.2     TCP 74 glrpc > 50506 [SYN, ACK] Seq=0 Ack=1 Win=5792 Len=0 MSS=1460 SACK_PERM=1 TSval=31397367 TSecr=5905115 WS=64
  3   0.000394     10.0.1.2 -> 10.0.1.3     TCP 66 50506 > glrpc [ACK] Seq=1 Ack=1 Win=14656 Len=0 TSval=5905115 TSecr=31397367
362924  29.802441     10.0.1.2 -> 10.0.1.3     TCP 66 50506 > glrpc [FIN, ACK] Seq=9 Ack=350000001 Win=2982912 Len=0 TSval=5912566 TSecr=31404756
362925  29.842762     10.0.1.3 -> 10.0.1.2     TCP 66 glrpc > 50506 [ACK] Seq=350000001 Ack=10 Win=5824 Len=0 TSval=31404828 TSecr=5912566
  1   0.000000     10.0.1.2 -> 10.0.1.3     TCP 74 50514 > glrpc [SYN] Seq=0 Win=14600 Len=0 MSS=1460 SACK_PERM=1 TSval=5939827 TSecr=0 WS=64
  2   0.000297     10.0.1.3 -> 10.0.1.2     TCP 74 glrpc > 50514 [SYN, ACK] Seq=0 Ack=1 Win=5792 Len=0 MSS=1460 SACK_PERM=1 TSval=31432076 TSecr=5939827 WS=64
  3   0.000318     10.0.1.2 -> 10.0.1.3     TCP 66 50514 > glrpc [ACK] Seq=1 Ack=1 Win=14656 Len=0 TSval=5939827 TSecr=31432076
347255  29.793933     10.0.1.2 -> 10.0.1.3     TCP 66 50514 > glrpc [FIN, ACK] Seq=9 Ack=350000001 Win=3085184 Len=0 TSval=5947275 TSecr=31439503
347256  29.830746     10.0.1.3 -> 10.0.1.2     TCP 66 glrpc > 50514 [ACK] Seq=350000001 Ack=10 Win=5824 Len=0 TSval=31439534 TSecr=5947275
  1   0.000000     10.0.1.2 -> 10.0.1.3     TCP 74 50518 > glrpc [SYN] Seq=0 Win=14600 Len=0 MSS=1460 SACK_PERM=1 TSval=5971195 TSecr=0 WS=64
  2   0.000298     10.0.1.3 -> 10.0.1.2     TCP 74 glrpc > 50518 [SYN, ACK] Seq=0 Ack=1 Win=5792 Len=0 MSS=1460 SACK_PERM=1 TSval=31463443 TSecr=5971195 WS=64
  3   0.000319     10.0.1.2 -> 10.0.1.3     TCP 66 50518 > glrpc [ACK] Seq=1 Ack=1 Win=14656 Len=0 TSval=5971195 TSecr=31463443
331180  29.791648     10.0.1.2 -> 10.0.1.3     TCP 66 50518 > glrpc [FIN, ACK] Seq=9 Ack=350000001 Win=3011840 Len=0 TSval=5978643 TSecr=31470841
331181  29.829444     10.0.1.3 -> 10.0.1.2     TCP 66 glrpc > 50518 [ACK] Seq=350000001 Ack=10 Win=5824 Len=0 TSval=31470900 TSecr=5978643
  1   0.000000     10.0.1.2 -> 10.0.1.3     TCP 74 50525 > glrpc [SYN] Seq=0 Win=14600 Len=0 MSS=1460 SACK_PERM=1 TSval=5999173 TSecr=0 WS=64
  2   0.000314     10.0.1.3 -> 10.0.1.2     TCP 74 glrpc > 50525 [SYN, ACK] Seq=0 Ack=1 Win=5792 Len=0 MSS=1460 SACK_PERM=1 TSval=31491419 TSecr=5999173 WS=64
  3   0.000331     10.0.1.2 -> 10.0.1.3     TCP 66 50525 > glrpc [ACK] Seq=1 Ack=1 Win=14656 Len=0 TSval=5999173 TSecr=31491419
328132  29.775653     10.0.1.2 -> 10.0.1.3     TCP 66 50525 > glrpc [FIN, ACK] Seq=9 Ack=350000001 Win=3011840 Len=0 TSval=6006617 TSecr=31498798
328133  29.815243     10.0.1.3 -> 10.0.1.2     TCP 66 glrpc > 50525 [ACK] Seq=350000001 Ack=10 Win=5824 Len=0 TSval=31498872 TSecr=6006617
  1   0.000000     10.0.1.2 -> 10.0.1.3     TCP 74 50533 > glrpc [SYN] Seq=0 Win=14600 Len=0 MSS=1460 SACK_PERM=1 TSval=6026803 TSecr=0 WS=64
  2   0.000310     10.0.1.3 -> 10.0.1.2     TCP 74 glrpc > 50533 [SYN, ACK] Seq=0 Ack=1 Win=5792 Len=0 MSS=1460 SACK_PERM=1 TSval=31519046 TSecr=6026803 WS=64
  3   0.000334     10.0.1.2 -> 10.0.1.3     TCP 66 50533 > glrpc [ACK] Seq=1 Ack=1 Win=14656 Len=0 TSval=6026803 TSecr=31519046
348098  29.793841     10.0.1.2 -> 10.0.1.3     TCP 66 50533 > glrpc [FIN, ACK] Seq=9 Ack=350000001 Win=2974208 Len=0 TSval=6034252 TSecr=31526473
348099  29.830855     10.0.1.3 -> 10.0.1.2     TCP 66 glrpc > 50533 [ACK] Seq=350000001 Ack=10 Win=5824 Len=0 TSval=31526504 TSecr=6034252
  1   0.000000     10.0.1.2 -> 10.0.1.3     TCP 74 50540 > glrpc [SYN] Seq=0 Win=14600 Len=0 MSS=1460 SACK_PERM=1 TSval=6058072 TSecr=0 WS=64
  2   0.000348     10.0.1.3 -> 10.0.1.2     TCP 74 glrpc > 50540 [SYN, ACK] Seq=0 Ack=1 Win=5792 Len=0 MSS=1460 SACK_PERM=1 TSval=31550313 TSecr=6058072 WS=64
  3   0.000363     10.0.1.2 -> 10.0.1.3     TCP 66 50540 > glrpc [ACK] Seq=1 Ack=1 Win=14656 Len=0 TSval=6058072 TSecr=31550313
350184  29.817048     10.0.1.2 -> 10.0.1.3     TCP 66 50540 > glrpc [FIN, ACK] Seq=9 Ack=350000001 Win=3000256 Len=0 TSval=6065526 TSecr=31557746
350185  29.856241     10.0.1.3 -> 10.0.1.2     TCP 66 glrpc > 50540 [ACK] Seq=350000001 Ack=10 Win=5824 Len=0 TSval=31557777 TSecr=6065526
  1   0.000000     10.0.1.2 -> 10.0.1.3     TCP 74 50543 > glrpc [SYN] Seq=0 Win=14600 Len=0 MSS=1460 SACK_PERM=1 TSval=6090036 TSecr=0 WS=64
  2   0.000330     10.0.1.3 -> 10.0.1.2     TCP 74 glrpc > 50543 [SYN, ACK] Seq=0 Ack=1 Win=5792 Len=0 MSS=1460 SACK_PERM=1 TSval=31582274 TSecr=6090036 WS=64
  3   0.000352     10.0.1.2 -> 10.0.1.3     TCP 66 50543 > glrpc [ACK] Seq=1 Ack=1 Win=14656 Len=0 TSval=6090036 TSecr=31582274
338003  29.782251     10.0.1.2 -> 10.0.1.3     TCP 66 50543 > glrpc [FIN, ACK] Seq=9 Ack=350000001 Win=3008960 Len=0 TSval=6097481 TSecr=31589698
338004  29.819764     10.0.1.3 -> 10.0.1.2     TCP 66 glrpc > 50543 [ACK] Seq=350000001 Ack=10 Win=5824 Len=0 TSval=31589729 TSecr=6097481
  1   0.000000     10.0.1.2 -> 10.0.1.3     TCP 74 50547 > glrpc [SYN] Seq=0 Win=14600 Len=0 MSS=1460 SACK_PERM=1 TSval=6119805 TSecr=0 WS=64
  2   0.000293     10.0.1.3 -> 10.0.1.2     TCP 74 glrpc > 50547 [SYN, ACK] Seq=0 Ack=1 Win=5792 Len=0 MSS=1460 SACK_PERM=1 TSval=31612041 TSecr=6119805 WS=64
  3   0.000310     10.0.1.2 -> 10.0.1.3     TCP 66 50547 > glrpc [ACK] Seq=1 Ack=1 Win=14656 Len=0 TSval=6119805 TSecr=31612041
341021  29.794674     10.0.1.2 -> 10.0.1.3     TCP 66 50547 > glrpc [FIN, ACK] Seq=9 Ack=350000001 Win=3008960 Len=0 TSval=6127254 TSecr=31619468
341022  29.831874     10.0.1.3 -> 10.0.1.2     TCP 66 glrpc > 50547 [ACK] Seq=350000001 Ack=10 Win=5824 Len=0 TSval=31619499 TSecr=6127254
  1   0.000000     10.0.1.2 -> 10.0.1.3     TCP 74 50551 > glrpc [SYN] Seq=0 Win=14600 Len=0 MSS=1460 SACK_PERM=1 TSval=6149766 TSecr=0 WS=64
  2   0.000306     10.0.1.3 -> 10.0.1.2     TCP 74 glrpc > 50551 [SYN, ACK] Seq=0 Ack=1 Win=5792 Len=0 MSS=1460 SACK_PERM=1 TSval=31642000 TSecr=6149766 WS=64
  3   0.000319     10.0.1.2 -> 10.0.1.3     TCP 66 50551 > glrpc [ACK] Seq=1 Ack=1 Win=14656 Len=0 TSval=6149766 TSecr=31642000
  1   0.000000     10.0.1.2 -> 10.0.1.3     TCP 74 50555 > glrpc [SYN] Seq=0 Win=14600 Len=0 MSS=1460 SACK_PERM=1 TSval=6182196 TSecr=0 WS=64
  2   0.000328     10.0.1.3 -> 10.0.1.2     TCP 74 glrpc > 50555 [SYN, ACK] Seq=0 Ack=1 Win=5792 Len=0 MSS=1460 SACK_PERM=1 TSval=31674428 TSecr=6182196 WS=64
  3   0.000348     10.0.1.2 -> 10.0.1.3     TCP 66 50555 > glrpc [ACK] Seq=1 Ack=1 Win=14656 Len=0 TSval=6182197 TSecr=31674428
362936  29.780354     10.0.1.2 -> 10.0.1.3     TCP 66 50555 > glrpc [FIN, ACK] Seq=9 Ack=350000001 Win=3011840 Len=0 TSval=6189642 TSecr=31681809
362937  29.816414     10.0.1.3 -> 10.0.1.2     TCP 66 glrpc > 50555 [ACK] Seq=350000001 Ack=10 Win=5824 Len=0 TSval=31681882 TSecr=6189642
  1   0.000000     10.0.1.2 -> 10.0.1.3     TCP 74 50560 > glrpc [SYN] Seq=0 Win=14600 Len=0 MSS=1460 SACK_PERM=1 TSval=6217278 TSecr=0 WS=64
  2   0.000355     10.0.1.3 -> 10.0.1.2     TCP 74 glrpc > 50560 [SYN, ACK] Seq=0 Ack=1 Win=5792 Len=0 MSS=1460 SACK_PERM=1 TSval=31709507 TSecr=6217278 WS=64
  3   0.000371     10.0.1.2 -> 10.0.1.3     TCP 66 50560 > glrpc [ACK] Seq=1 Ack=1 Win=14656 Len=0 TSval=6217278 TSecr=31709507
341455  29.779173     10.0.1.2 -> 10.0.1.3     TCP 66 50560 > glrpc [FIN, ACK] Seq=9 Ack=350000001 Win=3000256 Len=0 TSval=6224723 TSecr=31716903
341456  29.816337     10.0.1.3 -> 10.0.1.2     TCP 66 glrpc > 50560 [ACK] Seq=350000001 Ack=10 Win=5824 Len=0 TSval=31716961 TSecr=6224723
  1   0.000000     10.0.1.2 -> 10.0.1.3     TCP 74 50566 > glrpc [SYN] Seq=0 Win=14600 Len=0 MSS=1460 SACK_PERM=1 TSval=6247261 TSecr=0 WS=64
  2   0.000343     10.0.1.3 -> 10.0.1.2     TCP 74 glrpc > 50566 [SYN, ACK] Seq=0 Ack=1 Win=5792 Len=0 MSS=1460 SACK_PERM=1 TSval=31739487 TSecr=6247261 WS=64
  3   0.000360     10.0.1.2 -> 10.0.1.3     TCP 66 50566 > glrpc [ACK] Seq=1 Ack=1 Win=14656 Len=0 TSval=6247261 TSecr=31739487
358384  29.777516     10.0.1.2 -> 10.0.1.3     TCP 66 50566 > glrpc [FIN, ACK] Seq=9 Ack=350000001 Win=3014784 Len=0 TSval=6254705 TSecr=31746910
358385  29.814608     10.0.1.3 -> 10.0.1.2     TCP 66 glrpc > 50566 [ACK] Seq=350000001 Ack=10 Win=5824 Len=0 TSval=31746941 TSecr=6254705
  1   0.000000     10.0.1.2 -> 10.0.1.3     TCP 74 50571 > glrpc [SYN] Seq=0 Win=14600 Len=0 MSS=1460 SACK_PERM=1 TSval=6280875 TSecr=0 WS=64
  2   0.000303     10.0.1.3 -> 10.0.1.2     TCP 74 glrpc > 50571 [SYN, ACK] Seq=0 Ack=1 Win=5792 Len=0 MSS=1460 SACK_PERM=1 TSval=31773099 TSecr=6280875 WS=64
  3   0.000318     10.0.1.2 -> 10.0.1.3     TCP 66 50571 > glrpc [ACK] Seq=1 Ack=1 Win=14656 Len=0 TSval=6280875 TSecr=31773099
359675  29.778139     10.0.1.2 -> 10.0.1.3     TCP 66 50571 > glrpc [FIN, ACK] Seq=9 Ack=350000001 Win=3011840 Len=0 TSval=6288320 TSecr=31780479
359676  29.816061     10.0.1.3 -> 10.0.1.2     TCP 66 glrpc > 50571 [ACK] Seq=350000001 Ack=10 Win=5824 Len=0 TSval=31780553 TSecr=6288320
