 16.318159     10.0.1.2 -> 10.0.1.3     TCP 66 48775 > glrpc [FIN, ACK] Seq=1 Ack=190437409 Win=47513 Len=0 TSval=1869668 TSecr=27362166
 21.319696     10.0.1.2 -> 10.0.1.3     TCP 74 48784 > glrpc [SYN] Seq=0 Win=14600 Len=0 MSS=1460 SACK_PERM=1 TSval=1870918 TSecr=0 WS=64
 21.320007     10.0.1.3 -> 10.0.1.2     TCP 74 glrpc > 48784 [SYN, ACK] Seq=0 Ack=1 Win=5792 Len=0 MSS=1460 SACK_PERM=1 TSval=27363474 TSecr=1870918 WS=64
 21.320025     10.0.1.2 -> 10.0.1.3     TCP 66 48784 > glrpc [ACK] Seq=1 Ack=1 Win=14656 Len=0 TSval=1870919 TSecr=27363474
 38.500881     10.0.1.2 -> 10.0.1.3     TCP 66 48784 > glrpc [FIN, ACK] Seq=9 Ack=200000001 Win=3035008 Len=0 TSval=1875214 TSecr=27367747
 38.540395     10.0.1.3 -> 10.0.1.2     TCP 66 glrpc > 48784 [ACK] Seq=200000001 Ack=10 Win=5824 Len=0 TSval=27367779 TSecr=1875214
 43.502226     10.0.1.2 -> 10.0.1.3     TCP 74 48788 > glrpc [SYN] Seq=0 Win=14600 Len=0 MSS=1460 SACK_PERM=1 TSval=1876464 TSecr=0 WS=64
 43.502546     10.0.1.3 -> 10.0.1.2     TCP 74 glrpc > 48788 [SYN, ACK] Seq=0 Ack=1 Win=5792 Len=0 MSS=1460 SACK_PERM=1 TSval=27369019 TSecr=1876464 WS=64
 43.502560     10.0.1.2 -> 10.0.1.3     TCP 66 48788 > glrpc [ACK] Seq=1 Ack=1 Win=14656 Len=0 TSval=1876464 TSecr=27369019
 60.747632     10.0.1.2 -> 10.0.1.3     TCP 66 48788 > glrpc [FIN, ACK] Seq=9 Ack=200000001 Win=3055296 Len=0 TSval=1880775 TSecr=27373286
 60.787057     10.0.1.3 -> 10.0.1.2     TCP 66 glrpc > 48788 [ACK] Seq=200000001 Ack=10 Win=5824 Len=0 TSval=27373340 TSecr=1880775
 65.749023     10.0.1.2 -> 10.0.1.3     TCP 74 48789 > glrpc [SYN] Seq=0 Win=14600 Len=0 MSS=1460 SACK_PERM=1 TSval=1882026 TSecr=0 WS=64
 65.749314     10.0.1.3 -> 10.0.1.2     TCP 74 glrpc > 48789 [SYN, ACK] Seq=0 Ack=1 Win=5792 Len=0 MSS=1460 SACK_PERM=1 TSval=27374580 TSecr=1882026 WS=64
 65.749328     10.0.1.2 -> 10.0.1.3     TCP 66 48789 > glrpc [ACK] Seq=1 Ack=1 Win=14656 Len=0 TSval=1882026 TSecr=27374580
 82.944221     10.0.1.2 -> 10.0.1.3     TCP 66 48789 > glrpc [FIN, ACK] Seq=9 Ack=200000001 Win=2988672 Len=0 TSval=1886325 TSecr=27378822
 82.984706     10.0.1.3 -> 10.0.1.2     TCP 66 glrpc > 48789 [ACK] Seq=200000001 Ack=10 Win=5824 Len=0 TSval=27378889 TSecr=1886325
 87.945651     10.0.1.2 -> 10.0.1.3     TCP 74 48791 > glrpc [SYN] Seq=0 Win=14600 Len=0 MSS=1460 SACK_PERM=1 TSval=1887575 TSecr=0 WS=64
 87.945914     10.0.1.3 -> 10.0.1.2     TCP 74 glrpc > 48791 [SYN, ACK] Seq=0 Ack=1 Win=5792 Len=0 MSS=1460 SACK_PERM=1 TSval=27380129 TSecr=1887575 WS=64
 87.945933     10.0.1.2 -> 10.0.1.3     TCP 66 48791 > glrpc [ACK] Seq=1 Ack=1 Win=14656 Len=0 TSval=1887575 TSecr=27380129
105.127279     10.0.1.2 -> 10.0.1.3     TCP 66 48791 > glrpc [FIN, ACK] Seq=9 Ack=200000001 Win=3008960 Len=0 TSval=1891870 TSecr=27384403
105.165554     10.0.1.3 -> 10.0.1.2     TCP 66 glrpc > 48791 [ACK] Seq=200000001 Ack=10 Win=5824 Len=0 TSval=27384434 TSecr=1891870
110.128683     10.0.1.2 -> 10.0.1.3     TCP 74 48793 > glrpc [SYN] Seq=0 Win=14600 Len=0 MSS=1460 SACK_PERM=1 TSval=1893121 TSecr=0 WS=64
110.128962     10.0.1.3 -> 10.0.1.2     TCP 74 glrpc > 48793 [SYN, ACK] Seq=0 Ack=1 Win=5792 Len=0 MSS=1460 SACK_PERM=1 TSval=27385674 TSecr=1893121 WS=64
110.128975     10.0.1.2 -> 10.0.1.3     TCP 66 48793 > glrpc [ACK] Seq=1 Ack=1 Win=14656 Len=0 TSval=1893121 TSecr=27385674
127.392532     10.0.1.2 -> 10.0.1.3     TCP 66 48793 > glrpc [FIN, ACK] Seq=9 Ack=200000001 Win=2980032 Len=0 TSval=1897437 TSecr=27389931
127.431079     10.0.1.3 -> 10.0.1.2     TCP 66 glrpc > 48793 [ACK] Seq=200000001 Ack=10 Win=5824 Len=0 TSval=27390000 TSecr=1897437
132.394336     10.0.1.2 -> 10.0.1.3     TCP 74 48794 > glrpc [SYN] Seq=0 Win=14600 Len=0 MSS=1460 SACK_PERM=1 TSval=1898687 TSecr=0 WS=64
132.394629     10.0.1.3 -> 10.0.1.2     TCP 74 glrpc > 48794 [SYN, ACK] Seq=0 Ack=1 Win=5792 Len=0 MSS=1460 SACK_PERM=1 TSval=27391240 TSecr=1898687 WS=64
132.394645     10.0.1.2 -> 10.0.1.3     TCP 66 48794 > glrpc [ACK] Seq=1 Ack=1 Win=14656 Len=0 TSval=1898687 TSecr=27391240
149.609226     10.0.1.2 -> 10.0.1.3     TCP 66 48794 > glrpc [FIN, ACK] Seq=9 Ack=200000001 Win=2988672 Len=0 TSval=1902991 TSecr=27395485
149.648737     10.0.1.3 -> 10.0.1.2     TCP 66 glrpc > 48794 [ACK] Seq=200000001 Ack=10 Win=5824 Len=0 TSval=27395554 TSecr=1902991
154.610588     10.0.1.2 -> 10.0.1.3     TCP 74 48797 > glrpc [SYN] Seq=0 Win=14600 Len=0 MSS=1460 SACK_PERM=1 TSval=1904241 TSecr=0 WS=64
154.610948     10.0.1.3 -> 10.0.1.2     TCP 74 glrpc > 48797 [SYN, ACK] Seq=0 Ack=1 Win=5792 Len=0 MSS=1460 SACK_PERM=1 TSval=27396794 TSecr=1904241 WS=64
154.610961     10.0.1.2 -> 10.0.1.3     TCP 66 48797 > glrpc [ACK] Seq=1 Ack=1 Win=14656 Len=0 TSval=1904241 TSecr=27396794
172.003405     10.0.1.2 -> 10.0.1.3     TCP 66 48797 > glrpc [FIN, ACK] Seq=9 Ack=200000001 Win=3008960 Len=0 TSval=1908589 TSecr=27401082
172.043425     10.0.1.3 -> 10.0.1.2     TCP 66 glrpc > 48797 [ACK] Seq=200000001 Ack=10 Win=5824 Len=0 TSval=27401152 TSecr=1908589
177.004814     10.0.1.2 -> 10.0.1.3     TCP 74 48800 > glrpc [SYN] Seq=0 Win=14600 Len=0 MSS=1460 SACK_PERM=1 TSval=1909840 TSecr=0 WS=64
177.005141     10.0.1.3 -> 10.0.1.2     TCP 74 glrpc > 48800 [SYN, ACK] Seq=0 Ack=1 Win=5792 Len=0 MSS=1460 SACK_PERM=1 TSval=27402392 TSecr=1909840 WS=64
177.005153     10.0.1.2 -> 10.0.1.3     TCP 66 48800 > glrpc [ACK] Seq=1 Ack=1 Win=14656 Len=0 TSval=1909840 TSecr=27402392
194.064618     10.0.1.2 -> 10.0.1.3     TCP 66 48800 > glrpc [FIN, ACK] Seq=9 Ack=200000001 Win=3006080 Len=0 TSval=1914105 TSecr=27406635
194.104079     10.0.1.3 -> 10.0.1.2     TCP 66 glrpc > 48800 [ACK] Seq=200000001 Ack=10 Win=5824 Len=0 TSval=27406667 TSecr=1914105
199.081295     10.0.1.2 -> 10.0.1.3     TCP 74 48801 > glrpc [SYN] Seq=0 Win=14600 Len=0 MSS=1460 SACK_PERM=1 TSval=1915359 TSecr=0 WS=64
199.081579     10.0.1.3 -> 10.0.1.2     TCP 74 glrpc > 48801 [SYN, ACK] Seq=0 Ack=1 Win=5792 Len=0 MSS=1460 SACK_PERM=1 TSval=27407911 TSecr=1915359 WS=64
199.081591     10.0.1.2 -> 10.0.1.3     TCP 66 48801 > glrpc [ACK] Seq=1 Ack=1 Win=14656 Len=0 TSval=1915359 TSecr=27407911
216.129928     10.0.1.2 -> 10.0.1.3     TCP 66 48801 > glrpc [FIN, ACK] Seq=9 Ack=200000001 Win=3011840 Len=0 TSval=1919621 TSecr=27412151
216.170750     10.0.1.3 -> 10.0.1.2     TCP 66 glrpc > 48801 [ACK] Seq=200000001 Ack=10 Win=5824 Len=0 TSval=27412183 TSecr=1919621
221.235812     10.0.1.2 -> 10.0.1.3     TCP 74 48803 > glrpc [SYN] Seq=0 Win=14600 Len=0 MSS=1460 SACK_PERM=1 TSval=1920897 TSecr=0 WS=64
221.236218     10.0.1.3 -> 10.0.1.2     TCP 74 glrpc > 48803 [SYN, ACK] Seq=0 Ack=1 Win=5792 Len=0 MSS=1460 SACK_PERM=1 TSval=27413449 TSecr=1920897 WS=64
221.236235     10.0.1.2 -> 10.0.1.3     TCP 66 48803 > glrpc [ACK] Seq=1 Ack=1 Win=14656 Len=0 TSval=1920898 TSecr=27413449
238.467568     10.0.1.2 -> 10.0.1.3     TCP 66 48803 > glrpc [FIN, ACK] Seq=9 Ack=200000001 Win=3085184 Len=0 TSval=1925205 TSecr=27417735
238.507447     10.0.1.3 -> 10.0.1.2     TCP 66 glrpc > 48803 [ACK] Seq=200000001 Ack=10 Win=5824 Len=0 TSval=27417767 TSecr=1925205
243.491044     10.0.1.2 -> 10.0.1.3     TCP 74 48804 > glrpc [SYN] Seq=0 Win=14600 Len=0 MSS=1460 SACK_PERM=1 TSval=1926461 TSecr=0 WS=64
243.491336     10.0.1.3 -> 10.0.1.2     TCP 74 glrpc > 48804 [SYN, ACK] Seq=0 Ack=1 Win=5792 Len=0 MSS=1460 SACK_PERM=1 TSval=27419012 TSecr=1926461 WS=64
243.491353     10.0.1.2 -> 10.0.1.3     TCP 66 48804 > glrpc [ACK] Seq=1 Ack=1 Win=14656 Len=0 TSval=1926461 TSecr=27419012
260.732806     10.0.1.2 -> 10.0.1.3     TCP 66 48804 > glrpc [FIN, ACK] Seq=9 Ack=200000001 Win=3040832 Len=0 TSval=1930772 TSecr=27423264
260.774065     10.0.1.3 -> 10.0.1.2     TCP 66 glrpc > 48804 [ACK] Seq=200000001 Ack=10 Win=5824 Len=0 TSval=27423333 TSecr=1930772
265.734339     10.0.1.2 -> 10.0.1.3     TCP 74 48808 > glrpc [SYN] Seq=0 Win=14600 Len=0 MSS=1460 SACK_PERM=1 TSval=1932022 TSecr=0 WS=64
265.734670     10.0.1.3 -> 10.0.1.2     TCP 74 glrpc > 48808 [SYN, ACK] Seq=0 Ack=1 Win=5792 Len=0 MSS=1460 SACK_PERM=1 TSval=27424573 TSecr=1932022 WS=64
265.734686     10.0.1.2 -> 10.0.1.3     TCP 66 48808 > glrpc [ACK] Seq=1 Ack=1 Win=14656 Len=0 TSval=1932022 TSecr=27424573
283.006348     10.0.1.2 -> 10.0.1.3     TCP 66 48808 > glrpc [FIN, ACK] Seq=9 Ack=200000001 Win=3085184 Len=0 TSval=1936340 TSecr=27428832
283.042791     10.0.1.3 -> 10.0.1.2     TCP 66 glrpc > 48808 [ACK] Seq=200000001 Ack=10 Win=5824 Len=0 TSval=27428900 TSecr=1936340
288.164532     10.0.1.2 -> 10.0.1.3     TCP 74 48810 > glrpc [SYN] Seq=0 Win=14600 Len=0 MSS=1460 SACK_PERM=1 TSval=1937630 TSecr=0 WS=64
288.164827     10.0.1.3 -> 10.0.1.2     TCP 74 glrpc > 48810 [SYN, ACK] Seq=0 Ack=1 Win=5792 Len=0 MSS=1460 SACK_PERM=1 TSval=27430180 TSecr=1937630 WS=64
288.164844     10.0.1.2 -> 10.0.1.3     TCP 66 48810 > glrpc [ACK] Seq=1 Ack=1 Win=14656 Len=0 TSval=1937630 TSecr=27430180
305.281616     10.0.1.2 -> 10.0.1.3     TCP 66 48810 > glrpc [FIN, ACK] Seq=9 Ack=200000001 Win=2971328 Len=0 TSval=1941909 TSecr=27434402
305.321059     10.0.1.3 -> 10.0.1.2     TCP 66 glrpc > 48810 [ACK] Seq=200000001 Ack=10 Win=5824 Len=0 TSval=27434469 TSecr=1941909
310.408287     10.0.1.2 -> 10.0.1.3     TCP 74 48811 > glrpc [SYN] Seq=0 Win=14600 Len=0 MSS=1460 SACK_PERM=1 TSval=1943191 TSecr=0 WS=64
310.408563     10.0.1.3 -> 10.0.1.2     TCP 74 glrpc > 48811 [SYN, ACK] Seq=0 Ack=1 Win=5792 Len=0 MSS=1460 SACK_PERM=1 TSval=27435740 TSecr=1943191 WS=64
310.408574     10.0.1.2 -> 10.0.1.3     TCP 66 48811 > glrpc [ACK] Seq=1 Ack=1 Win=14656 Len=0 TSval=1943191 TSecr=27435740
327.631155     10.0.1.2 -> 10.0.1.3     TCP 66 48811 > glrpc [FIN, ACK] Seq=9 Ack=200000001 Win=2991616 Len=0 TSval=1947496 TSecr=27439987
327.671122     10.0.1.3 -> 10.0.1.2     TCP 66 glrpc > 48811 [ACK] Seq=200000001 Ack=10 Win=5824 Len=0 TSval=27440056 TSecr=1947496
332.729851     10.0.1.2 -> 10.0.1.3     TCP 74 48812 > glrpc [SYN] Seq=0 Win=14600 Len=0 MSS=1460 SACK_PERM=1 TSval=1948771 TSecr=0 WS=64
332.730251     10.0.1.3 -> 10.0.1.2     TCP 74 glrpc > 48812 [SYN, ACK] Seq=0 Ack=1 Win=5792 Len=0 MSS=1460 SACK_PERM=1 TSval=27441320 TSecr=1948771 WS=64
332.730263     10.0.1.2 -> 10.0.1.3     TCP 66 48812 > glrpc [ACK] Seq=1 Ack=1 Win=14656 Len=0 TSval=1948771 TSecr=27441320
349.981692     10.0.1.2 -> 10.0.1.3     TCP 66 48812 > glrpc [FIN, ACK] Seq=9 Ack=200000001 Win=3000256 Len=0 TSval=1953084 TSecr=27445612
350.019804     10.0.1.3 -> 10.0.1.2     TCP 66 glrpc > 48812 [ACK] Seq=200000001 Ack=10 Win=5824 Len=0 TSval=27445643 TSecr=1953084
355.082846     10.0.1.2 -> 10.0.1.3     TCP 74 48814 > glrpc [SYN] Seq=0 Win=14600 Len=0 MSS=1460 SACK_PERM=1 TSval=1954359 TSecr=0 WS=64
355.083208     10.0.1.3 -> 10.0.1.2     TCP 74 glrpc > 48814 [SYN, ACK] Seq=0 Ack=1 Win=5792 Len=0 MSS=1460 SACK_PERM=1 TSval=27446908 TSecr=1954359 WS=64
355.083220     10.0.1.2 -> 10.0.1.3     TCP 66 48814 > glrpc [ACK] Seq=1 Ack=1 Win=14656 Len=0 TSval=1954359 TSecr=27446908
372.328737     10.0.1.2 -> 10.0.1.3     TCP 66 48814 > glrpc [FIN, ACK] Seq=9 Ack=200000001 Win=3085184 Len=0 TSval=1958671 TSecr=27451160
372.365491     10.0.1.3 -> 10.0.1.2     TCP 66 glrpc > 48814 [ACK] Seq=200000001 Ack=10 Win=5824 Len=0 TSval=27451229 TSecr=1958671
377.330185     10.0.1.2 -> 10.0.1.3     TCP 74 48815 > glrpc [SYN] Seq=0 Win=14600 Len=0 MSS=1460 SACK_PERM=1 TSval=1959921 TSecr=0 WS=64
377.330469     10.0.1.3 -> 10.0.1.2     TCP 74 glrpc > 48815 [SYN, ACK] Seq=0 Ack=1 Win=5792 Len=0 MSS=1460 SACK_PERM=1 TSval=27452470 TSecr=1959921 WS=64
377.330482     10.0.1.2 -> 10.0.1.3     TCP 66 48815 > glrpc [ACK] Seq=1 Ack=1 Win=14656 Len=0 TSval=1959921 TSecr=27452470
394.579310     10.0.1.2 -> 10.0.1.3     TCP 66 48815 > glrpc [FIN, ACK] Seq=9 Ack=200000001 Win=3011840 Len=0 TSval=1964233 TSecr=27456724
394.620156     10.0.1.3 -> 10.0.1.2     TCP 66 glrpc > 48815 [ACK] Seq=200000001 Ack=10 Win=5824 Len=0 TSval=27456792 TSecr=1964233
399.591561     10.0.1.2 -> 10.0.1.3     TCP 74 48816 > glrpc [SYN] Seq=0 Win=14600 Len=0 MSS=1460 SACK_PERM=1 TSval=1965486 TSecr=0 WS=64
399.591841     10.0.1.3 -> 10.0.1.2     TCP 74 glrpc > 48816 [SYN, ACK] Seq=0 Ack=1 Win=5792 Len=0 MSS=1460 SACK_PERM=1 TSval=27458035 TSecr=1965486 WS=64
399.591854     10.0.1.2 -> 10.0.1.3     TCP 66 48816 > glrpc [ACK] Seq=1 Ack=1 Win=14656 Len=0 TSval=1965486 TSecr=27458035
416.840968     10.0.1.2 -> 10.0.1.3     TCP 66 48816 > glrpc [FIN, ACK] Seq=9 Ack=200000001 Win=3085184 Len=0 TSval=1969799 TSecr=27462290
416.880836     10.0.1.3 -> 10.0.1.2     TCP 66 glrpc > 48816 [ACK] Seq=200000001 Ack=10 Win=5824 Len=0 TSval=27462357 TSecr=1969799
421.842428     10.0.1.2 -> 10.0.1.3     TCP 74 48821 > glrpc [SYN] Seq=0 Win=14600 Len=0 MSS=1460 SACK_PERM=1 TSval=1971049 TSecr=0 WS=64
421.842853     10.0.1.3 -> 10.0.1.2     TCP 74 glrpc > 48821 [SYN, ACK] Seq=0 Ack=1 Win=5792 Len=0 MSS=1460 SACK_PERM=1 TSval=27463597 TSecr=1971049 WS=64
421.842867     10.0.1.2 -> 10.0.1.3     TCP 66 48821 > glrpc [ACK] Seq=1 Ack=1 Win=14656 Len=0 TSval=1971049 TSecr=27463597
439.135398     10.0.1.2 -> 10.0.1.3     TCP 66 48821 > glrpc [FIN, ACK] Seq=9 Ack=200000001 Win=3011840 Len=0 TSval=1975372 TSecr=27467898
439.174549     10.0.1.3 -> 10.0.1.2     TCP 66 glrpc > 48821 [ACK] Seq=200000001 Ack=10 Win=5824 Len=0 TSval=27467930 TSecr=1975372
