  0.000000     10.0.1.2 -> 10.0.1.3     TCP 74 39952 > websm [SYN] Seq=0 Win=14600 Len=0 MSS=1460 SACK_PERM=1 TSval=12572324 TSecr=0 WS=64
  0.000283     10.0.1.3 -> 10.0.1.2     TCP 74 websm > 39952 [SYN, ACK] Seq=0 Ack=1 Win=5792 Len=0 MSS=1460 SACK_PERM=1 TSval=8836644 TSecr=12572324 WS=64
  0.000301     10.0.1.2 -> 10.0.1.3     TCP 66 39952 > websm [ACK] Seq=1 Ack=1 Win=14656 Len=0 TSval=12572324 TSecr=8836644
  8.506762     10.0.1.2 -> 10.0.1.3     TCP 66 39952 > websm [FIN, ACK] Seq=9 Ack=100000001 Win=689280 Len=0 TSval=12574451 TSecr=8838763
  8.546078     10.0.1.3 -> 10.0.1.2     TCP 66 websm > 39952 [ACK] Seq=100000001 Ack=10 Win=5824 Len=0 TSval=8838781 TSecr=12574451
 11.508736     10.0.1.2 -> 10.0.1.3     TCP 74 39953 > websm [SYN] Seq=0 Win=14600 Len=0 MSS=1460 SACK_PERM=1 TSval=12575201 TSecr=0 WS=64
 11.509168     10.0.1.3 -> 10.0.1.2     TCP 74 websm > 39953 [SYN, ACK] Seq=0 Ack=1 Win=5792 Len=0 MSS=1460 SACK_PERM=1 TSval=8839521 TSecr=12575201 WS=64
 11.509183     10.0.1.2 -> 10.0.1.3     TCP 66 39953 > websm [ACK] Seq=1 Ack=1 Win=14656 Len=0 TSval=12575201 TSecr=8839521
 20.020641     10.0.1.2 -> 10.0.1.3     TCP 66 39953 > websm [FIN, ACK] Seq=9 Ack=100000001 Win=689280 Len=0 TSval=12577329 TSecr=8841641
 20.059877     10.0.1.3 -> 10.0.1.2     TCP 66 websm > 39953 [ACK] Seq=100000001 Ack=10 Win=5824 Len=0 TSval=8841659 TSecr=12577329
 23.022573     10.0.1.2 -> 10.0.1.3     TCP 74 39954 > websm [SYN] Seq=0 Win=14600 Len=0 MSS=1460 SACK_PERM=1 TSval=12578080 TSecr=0 WS=64
 23.023008     10.0.1.3 -> 10.0.1.2     TCP 74 websm > 39954 [SYN, ACK] Seq=0 Ack=1 Win=5792 Len=0 MSS=1460 SACK_PERM=1 TSval=8842399 TSecr=12578080 WS=64
 23.023021     10.0.1.2 -> 10.0.1.3     TCP 66 39954 > websm [ACK] Seq=1 Ack=1 Win=14656 Len=0 TSval=12578080 TSecr=8842399
 31.533196     10.0.1.2 -> 10.0.1.3     TCP 66 39954 > websm [FIN, ACK] Seq=9 Ack=100000001 Win=660288 Len=0 TSval=12580207 TSecr=8844520
 31.571795     10.0.1.3 -> 10.0.1.2     TCP 66 websm > 39954 [ACK] Seq=100000001 Ack=10 Win=5824 Len=0 TSval=8844537 TSecr=12580207
 34.535109     10.0.1.2 -> 10.0.1.3     TCP 74 39955 > websm [SYN] Seq=0 Win=14600 Len=0 MSS=1460 SACK_PERM=1 TSval=12580958 TSecr=0 WS=64
 34.535496     10.0.1.3 -> 10.0.1.2     TCP 74 websm > 39955 [SYN, ACK] Seq=0 Ack=1 Win=5792 Len=0 MSS=1460 SACK_PERM=1 TSval=8845277 TSecr=12580958 WS=64
 34.535510     10.0.1.2 -> 10.0.1.3     TCP 66 39955 > websm [ACK] Seq=1 Ack=1 Win=14656 Len=0 TSval=12580958 TSecr=8845277
 43.042177     10.0.1.2 -> 10.0.1.3     TCP 66 39955 > websm [FIN, ACK] Seq=9 Ack=100000001 Win=660288 Len=0 TSval=12583084 TSecr=8847397
 43.080699     10.0.1.3 -> 10.0.1.2     TCP 66 websm > 39955 [ACK] Seq=100000001 Ack=10 Win=5824 Len=0 TSval=8847414 TSecr=12583084
 46.044127     10.0.1.2 -> 10.0.1.3     TCP 74 39958 > websm [SYN] Seq=0 Win=14600 Len=0 MSS=1460 SACK_PERM=1 TSval=12583835 TSecr=0 WS=64
 46.044558     10.0.1.3 -> 10.0.1.2     TCP 74 websm > 39958 [SYN, ACK] Seq=0 Ack=1 Win=5792 Len=0 MSS=1460 SACK_PERM=1 TSval=8848154 TSecr=12583835 WS=64
 46.044570     10.0.1.2 -> 10.0.1.3     TCP 66 39958 > websm [ACK] Seq=1 Ack=1 Win=14656 Len=0 TSval=12583835 TSecr=8848154
 54.552449     10.0.1.2 -> 10.0.1.3     TCP 66 39958 > websm [FIN, ACK] Seq=9 Ack=100000001 Win=700864 Len=0 TSval=12585962 TSecr=8850274
 54.589455     10.0.1.3 -> 10.0.1.2     TCP 66 websm > 39958 [ACK] Seq=100000001 Ack=10 Win=5824 Len=0 TSval=8850291 TSecr=12585962
 57.554429     10.0.1.2 -> 10.0.1.3     TCP 74 39960 > websm [SYN] Seq=0 Win=14600 Len=0 MSS=1460 SACK_PERM=1 TSval=12586712 TSecr=0 WS=64
 57.554866     10.0.1.3 -> 10.0.1.2     TCP 74 websm > 39960 [SYN, ACK] Seq=0 Ack=1 Win=5792 Len=0 MSS=1460 SACK_PERM=1 TSval=8851032 TSecr=12586712 WS=64
 57.554884     10.0.1.2 -> 10.0.1.3     TCP 66 39960 > websm [ACK] Seq=1 Ack=1 Win=14656 Len=0 TSval=12586713 TSecr=8851032
 66.062208     10.0.1.2 -> 10.0.1.3     TCP 66 39960 > websm [FIN, ACK] Seq=9 Ack=100000001 Win=660288 Len=0 TSval=12588839 TSecr=8853151
 66.102301     10.0.1.3 -> 10.0.1.2     TCP 66 websm > 39960 [ACK] Seq=100000001 Ack=10 Win=5824 Len=0 TSval=8853169 TSecr=12588839
 69.064115     10.0.1.2 -> 10.0.1.3     TCP 74 39961 > websm [SYN] Seq=0 Win=14600 Len=0 MSS=1460 SACK_PERM=1 TSval=12589590 TSecr=0 WS=64
 69.064548     10.0.1.3 -> 10.0.1.2     TCP 74 websm > 39961 [SYN, ACK] Seq=0 Ack=1 Win=5792 Len=0 MSS=1460 SACK_PERM=1 TSval=8853909 TSecr=12589590 WS=64
 69.064559     10.0.1.2 -> 10.0.1.3     TCP 66 39961 > websm [ACK] Seq=1 Ack=1 Win=14656 Len=0 TSval=12589590 TSecr=8853909
 77.571328     10.0.1.2 -> 10.0.1.3     TCP 66 39961 > websm [FIN, ACK] Seq=9 Ack=100000001 Win=706624 Len=0 TSval=12591717 TSecr=8856028
 77.611052     10.0.1.3 -> 10.0.1.2     TCP 66 websm > 39961 [ACK] Seq=100000001 Ack=10 Win=5824 Len=0 TSval=8856046 TSecr=12591717
 80.573413     10.0.1.2 -> 10.0.1.3     TCP 74 39962 > websm [SYN] Seq=0 Win=14600 Len=0 MSS=1460 SACK_PERM=1 TSval=12592467 TSecr=0 WS=64
 80.573789     10.0.1.3 -> 10.0.1.2     TCP 74 websm > 39962 [SYN, ACK] Seq=0 Ack=1 Win=5792 Len=0 MSS=1460 SACK_PERM=1 TSval=8856786 TSecr=12592467 WS=64
 80.573803     10.0.1.2 -> 10.0.1.3     TCP 66 39962 > websm [ACK] Seq=1 Ack=1 Win=14656 Len=0 TSval=12592467 TSecr=8856786
 89.080438     10.0.1.2 -> 10.0.1.3     TCP 66 39962 > websm [FIN, ACK] Seq=9 Ack=100000001 Win=703744 Len=0 TSval=12594594 TSecr=8858904
 89.120112     10.0.1.3 -> 10.0.1.2     TCP 66 websm > 39962 [ACK] Seq=100000001 Ack=10 Win=5824 Len=0 TSval=8858923 TSecr=12594594
 92.082384     10.0.1.2 -> 10.0.1.3     TCP 74 39963 > websm [SYN] Seq=0 Win=14600 Len=0 MSS=1460 SACK_PERM=1 TSval=12595344 TSecr=0 WS=64
 92.082767     10.0.1.3 -> 10.0.1.2     TCP 74 websm > 39963 [SYN, ACK] Seq=0 Ack=1 Win=5792 Len=0 MSS=1460 SACK_PERM=1 TSval=8859663 TSecr=12595344 WS=64
 92.082780     10.0.1.2 -> 10.0.1.3     TCP 66 39963 > websm [ACK] Seq=1 Ack=1 Win=14656 Len=0 TSval=12595345 TSecr=8859663
100.589041     10.0.1.2 -> 10.0.1.3     TCP 66 39963 > websm [FIN, ACK] Seq=9 Ack=100000001 Win=660288 Len=0 TSval=12597471 TSecr=8861782
100.629009     10.0.1.3 -> 10.0.1.2     TCP 66 websm > 39963 [ACK] Seq=100000001 Ack=10 Win=5824 Len=0 TSval=8861800 TSecr=12597471
103.591017     10.0.1.2 -> 10.0.1.3     TCP 74 39964 > websm [SYN] Seq=0 Win=14600 Len=0 MSS=1460 SACK_PERM=1 TSval=12598222 TSecr=0 WS=64
103.591392     10.0.1.3 -> 10.0.1.2     TCP 74 websm > 39964 [SYN, ACK] Seq=0 Ack=1 Win=5792 Len=0 MSS=1460 SACK_PERM=1 TSval=8862540 TSecr=12598222 WS=64
103.591404     10.0.1.2 -> 10.0.1.3     TCP 66 39964 > websm [ACK] Seq=1 Ack=1 Win=14656 Len=0 TSval=12598222 TSecr=8862540
112.097510     10.0.1.2 -> 10.0.1.3     TCP 66 39964 > websm [FIN, ACK] Seq=9 Ack=100000001 Win=660288 Len=0 TSval=12600348 TSecr=8864660
112.137853     10.0.1.3 -> 10.0.1.2     TCP 66 websm > 39964 [ACK] Seq=100000001 Ack=10 Win=5824 Len=0 TSval=8864677 TSecr=12600348
115.099549     10.0.1.2 -> 10.0.1.3     TCP 74 39966 > websm [SYN] Seq=0 Win=14600 Len=0 MSS=1460 SACK_PERM=1 TSval=12601099 TSecr=0 WS=64
115.099987     10.0.1.3 -> 10.0.1.2     TCP 74 websm > 39966 [SYN, ACK] Seq=0 Ack=1 Win=5792 Len=0 MSS=1460 SACK_PERM=1 TSval=8865417 TSecr=12601099 WS=64
115.100003     10.0.1.2 -> 10.0.1.3     TCP 66 39966 > websm [ACK] Seq=1 Ack=1 Win=14656 Len=0 TSval=12601099 TSecr=8865417
123.606643     10.0.1.2 -> 10.0.1.3     TCP 66 39966 > websm [FIN, ACK] Seq=9 Ack=100000001 Win=657408 Len=0 TSval=12603226 TSecr=8867537
123.646619     10.0.1.3 -> 10.0.1.2     TCP 66 websm > 39966 [ACK] Seq=100000001 Ack=10 Win=5824 Len=0 TSval=8867554 TSecr=12603226
126.608573     10.0.1.2 -> 10.0.1.3     TCP 74 39967 > websm [SYN] Seq=0 Win=14600 Len=0 MSS=1460 SACK_PERM=1 TSval=12603976 TSecr=0 WS=64
126.609005     10.0.1.3 -> 10.0.1.2     TCP 74 websm > 39967 [SYN, ACK] Seq=0 Ack=1 Win=5792 Len=0 MSS=1460 SACK_PERM=1 TSval=8868294 TSecr=12603976 WS=64
126.609021     10.0.1.2 -> 10.0.1.3     TCP 66 39967 > websm [ACK] Seq=1 Ack=1 Win=14656 Len=0 TSval=12603976 TSecr=8868294
135.115560     10.0.1.2 -> 10.0.1.3     TCP 66 39967 > websm [FIN, ACK] Seq=9 Ack=100000001 Win=660288 Len=0 TSval=12606103 TSecr=8870413
135.155496     10.0.1.3 -> 10.0.1.2     TCP 66 websm > 39967 [ACK] Seq=100000001 Ack=10 Win=5824 Len=0 TSval=8870431 TSecr=12606103
138.211424     10.0.1.2 -> 10.0.1.3     TCP 74 39969 > websm [SYN] Seq=0 Win=14600 Len=0 MSS=1460 SACK_PERM=1 TSval=12606877 TSecr=0 WS=64
138.211805     10.0.1.3 -> 10.0.1.2     TCP 74 websm > 39969 [SYN, ACK] Seq=0 Ack=1 Win=5792 Len=0 MSS=1460 SACK_PERM=1 TSval=8871195 TSecr=12606877 WS=64
138.211817     10.0.1.2 -> 10.0.1.3     TCP 66 39969 > websm [ACK] Seq=1 Ack=1 Win=14656 Len=0 TSval=12606877 TSecr=8871195
146.717033     10.0.1.2 -> 10.0.1.3     TCP 66 39969 > websm [FIN, ACK] Seq=9 Ack=100000001 Win=715328 Len=0 TSval=12609003 TSecr=8873313
146.756467     10.0.1.3 -> 10.0.1.2     TCP 66 websm > 39969 [ACK] Seq=100000001 Ack=10 Win=5824 Len=0 TSval=8873331 TSecr=12609003
149.737302     10.0.1.2 -> 10.0.1.3     TCP 74 39970 > websm [SYN] Seq=0 Win=14600 Len=0 MSS=1460 SACK_PERM=1 TSval=12609758 TSecr=0 WS=64
149.737735     10.0.1.3 -> 10.0.1.2     TCP 74 websm > 39970 [SYN, ACK] Seq=0 Ack=1 Win=5792 Len=0 MSS=1460 SACK_PERM=1 TSval=8874076 TSecr=12609758 WS=64
149.737749     10.0.1.2 -> 10.0.1.3     TCP 66 39970 > websm [ACK] Seq=1 Ack=1 Win=14656 Len=0 TSval=12609758 TSecr=8874076
158.249081     10.0.1.2 -> 10.0.1.3     TCP 66 39970 > websm [FIN, ACK] Seq=9 Ack=100000001 Win=660288 Len=0 TSval=12611886 TSecr=8876196
158.289149     10.0.1.3 -> 10.0.1.2     TCP 66 websm > 39970 [ACK] Seq=100000001 Ack=10 Win=5824 Len=0 TSval=8876214 TSecr=12611886
161.251125     10.0.1.2 -> 10.0.1.3     TCP 74 39971 > websm [SYN] Seq=0 Win=14600 Len=0 MSS=1460 SACK_PERM=1 TSval=12612637 TSecr=0 WS=64
161.251560     10.0.1.3 -> 10.0.1.2     TCP 74 websm > 39971 [SYN, ACK] Seq=0 Ack=1 Win=5792 Len=0 MSS=1460 SACK_PERM=1 TSval=8876954 TSecr=12612637 WS=64
161.251573     10.0.1.2 -> 10.0.1.3     TCP 66 39971 > websm [ACK] Seq=1 Ack=1 Win=14656 Len=0 TSval=12612637 TSecr=8876954
169.757538     10.0.1.2 -> 10.0.1.3     TCP 66 39971 > websm [FIN, ACK] Seq=9 Ack=100000001 Win=660288 Len=0 TSval=12614763 TSecr=8879073
169.794202     10.0.1.3 -> 10.0.1.2     TCP 66 websm > 39971 [ACK] Seq=100000001 Ack=10 Win=5824 Len=0 TSval=8879090 TSecr=12614763
172.898090     10.0.1.2 -> 10.0.1.3     TCP 74 39973 > websm [SYN] Seq=0 Win=14600 Len=0 MSS=1460 SACK_PERM=1 TSval=12615548 TSecr=0 WS=64
172.898528     10.0.1.3 -> 10.0.1.2     TCP 74 websm > 39973 [SYN, ACK] Seq=0 Ack=1 Win=5792 Len=0 MSS=1460 SACK_PERM=1 TSval=8879866 TSecr=12615548 WS=64
172.898546     10.0.1.2 -> 10.0.1.3     TCP 66 39973 > websm [ACK] Seq=1 Ack=1 Win=14656 Len=0 TSval=12615549 TSecr=8879866
181.405292     10.0.1.2 -> 10.0.1.3     TCP 66 39973 > websm [FIN, ACK] Seq=9 Ack=100000001 Win=660288 Len=0 TSval=12617675 TSecr=8881985
181.442896     10.0.1.3 -> 10.0.1.2     TCP 66 websm > 39973 [ACK] Seq=100000001 Ack=10 Win=5824 Len=0 TSval=8882002 TSecr=12617675
184.407313     10.0.1.2 -> 10.0.1.3     TCP 74 39974 > websm [SYN] Seq=0 Win=14600 Len=0 MSS=1460 SACK_PERM=1 TSval=12618426 TSecr=0 WS=64
184.407659     10.0.1.3 -> 10.0.1.2     TCP 74 websm > 39974 [SYN, ACK] Seq=0 Ack=1 Win=5792 Len=0 MSS=1460 SACK_PERM=1 TSval=8882743 TSecr=12618426 WS=64
184.407673     10.0.1.2 -> 10.0.1.3     TCP 66 39974 > websm [ACK] Seq=1 Ack=1 Win=14656 Len=0 TSval=12618426 TSecr=8882743
192.913909     10.0.1.2 -> 10.0.1.3     TCP 66 39974 > websm [FIN, ACK] Seq=9 Ack=100000001 Win=660288 Len=0 TSval=12620552 TSecr=8884862
192.951950     10.0.1.3 -> 10.0.1.2     TCP 66 websm > 39974 [ACK] Seq=100000001 Ack=10 Win=5824 Len=0 TSval=8884879 TSecr=12620552
195.915826     10.0.1.2 -> 10.0.1.3     TCP 74 39975 > websm [SYN] Seq=0 Win=14600 Len=0 MSS=1460 SACK_PERM=1 TSval=12621303 TSecr=0 WS=64
195.916283     10.0.1.3 -> 10.0.1.2     TCP 74 websm > 39975 [SYN, ACK] Seq=0 Ack=1 Win=5792 Len=0 MSS=1460 SACK_PERM=1 TSval=8885620 TSecr=12621303 WS=64
195.916299     10.0.1.2 -> 10.0.1.3     TCP 66 39975 > websm [ACK] Seq=1 Ack=1 Win=14656 Len=0 TSval=12621303 TSecr=8885620
204.423233     10.0.1.2 -> 10.0.1.3     TCP 66 39975 > websm [FIN, ACK] Seq=9 Ack=100000001 Win=660288 Len=0 TSval=12623430 TSecr=8887739
204.460617     10.0.1.3 -> 10.0.1.2     TCP 66 websm > 39975 [ACK] Seq=100000001 Ack=10 Win=5824 Len=0 TSval=8887756 TSecr=12623430
207.463157     10.0.1.2 -> 10.0.1.3     TCP 74 39977 > websm [SYN] Seq=0 Win=14600 Len=0 MSS=1460 SACK_PERM=1 TSval=12624190 TSecr=0 WS=64
207.463580     10.0.1.3 -> 10.0.1.2     TCP 74 websm > 39977 [SYN, ACK] Seq=0 Ack=1 Win=5792 Len=0 MSS=1460 SACK_PERM=1 TSval=8888506 TSecr=12624190 WS=64
207.463596     10.0.1.2 -> 10.0.1.3     TCP 66 39977 > websm [ACK] Seq=1 Ack=1 Win=14656 Len=0 TSval=12624190 TSecr=8888506
215.970067     10.0.1.2 -> 10.0.1.3     TCP 66 39977 > websm [FIN, ACK] Seq=9 Ack=100000001 Win=709568 Len=0 TSval=12626316 TSecr=8890625
216.009594     10.0.1.3 -> 10.0.1.2     TCP 66 websm > 39977 [ACK] Seq=100000001 Ack=10 Win=5824 Len=0 TSval=8890643 TSecr=12626316
218.972052     10.0.1.2 -> 10.0.1.3     TCP 74 39978 > websm [SYN] Seq=0 Win=14600 Len=0 MSS=1460 SACK_PERM=1 TSval=12627067 TSecr=0 WS=64
218.972490     10.0.1.3 -> 10.0.1.2     TCP 74 websm > 39978 [SYN, ACK] Seq=0 Ack=1 Win=5792 Len=0 MSS=1460 SACK_PERM=1 TSval=8891383 TSecr=12627067 WS=64
218.972504     10.0.1.2 -> 10.0.1.3     TCP 66 39978 > websm [ACK] Seq=1 Ack=1 Win=14656 Len=0 TSval=12627067 TSecr=8891383
227.477967     10.0.1.2 -> 10.0.1.3     TCP 66 39978 > websm [FIN, ACK] Seq=9 Ack=100000001 Win=660288 Len=0 TSval=12629193 TSecr=8893502
227.514359     10.0.1.3 -> 10.0.1.2     TCP 66 websm > 39978 [ACK] Seq=100000001 Ack=10 Win=5824 Len=0 TSval=8893519 TSecr=12629193
