 10.632051     10.0.1.2 -> 10.0.1.3     TCP 66 39979 > websm [FIN, ACK] Seq=1 Ack=125050961 Win=33847 Len=0 TSval=12633683 TSecr=8897974
 13.634036     10.0.1.2 -> 10.0.1.3     TCP 74 39981 > websm [SYN] Seq=0 Win=14600 Len=0 MSS=1460 SACK_PERM=1 TSval=12634433 TSecr=0 WS=64
 13.634476     10.0.1.3 -> 10.0.1.2     TCP 74 websm > 39981 [SYN, ACK] Seq=0 Ack=1 Win=5792 Len=0 MSS=1460 SACK_PERM=1 TSval=8898749 TSecr=12634433 WS=64
 13.634495     10.0.1.2 -> 10.0.1.3     TCP 66 39981 > websm [ACK] Seq=1 Ack=1 Win=14656 Len=0 TSval=12634433 TSecr=8898749
 29.393070     10.0.1.2 -> 10.0.1.3     TCP 74 39982 > websm [SYN] Seq=0 Win=14600 Len=0 MSS=1460 SACK_PERM=1 TSval=12638373 TSecr=0 WS=64
 29.393506     10.0.1.3 -> 10.0.1.2     TCP 74 websm > 39982 [SYN, ACK] Seq=0 Ack=1 Win=5792 Len=0 MSS=1460 SACK_PERM=1 TSval=8902688 TSecr=12638373 WS=64
 29.393522     10.0.1.2 -> 10.0.1.3     TCP 66 39982 > websm [ACK] Seq=1 Ack=1 Win=14656 Len=0 TSval=12638373 TSecr=8902688
 42.150076     10.0.1.2 -> 10.0.1.3     TCP 66 39982 > websm [FIN, ACK] Seq=9 Ack=150000001 Win=2264704 Len=0 TSval=12641562 TSecr=8905852
 42.187813     10.0.1.3 -> 10.0.1.2     TCP 66 websm > 39982 [ACK] Seq=150000001 Ack=10 Win=5824 Len=0 TSval=8905887 TSecr=12641562
 45.152005     10.0.1.2 -> 10.0.1.3     TCP 74 39983 > websm [SYN] Seq=0 Win=14600 Len=0 MSS=1460 SACK_PERM=1 TSval=12642313 TSecr=0 WS=64
 45.152440     10.0.1.3 -> 10.0.1.2     TCP 74 websm > 39983 [SYN, ACK] Seq=0 Ack=1 Win=5792 Len=0 MSS=1460 SACK_PERM=1 TSval=8906628 TSecr=12642313 WS=64
 45.152452     10.0.1.2 -> 10.0.1.3     TCP 66 39983 > websm [ACK] Seq=1 Ack=1 Win=14656 Len=0 TSval=12642313 TSecr=8906628
 57.908718     10.0.1.2 -> 10.0.1.3     TCP 66 39983 > websm [FIN, ACK] Seq=9 Ack=150000001 Win=2232832 Len=0 TSval=12645502 TSecr=8909792
 57.948949     10.0.1.3 -> 10.0.1.2     TCP 66 websm > 39983 [ACK] Seq=150000001 Ack=10 Win=5824 Len=0 TSval=8909827 TSecr=12645502
 60.910714     10.0.1.2 -> 10.0.1.3     TCP 74 39984 > websm [SYN] Seq=0 Win=14600 Len=0 MSS=1460 SACK_PERM=1 TSval=12646252 TSecr=0 WS=64
 60.911129     10.0.1.3 -> 10.0.1.2     TCP 74 websm > 39984 [SYN, ACK] Seq=0 Ack=1 Win=5792 Len=0 MSS=1460 SACK_PERM=1 TSval=8910567 TSecr=12646252 WS=64
 60.911145     10.0.1.2 -> 10.0.1.3     TCP 66 39984 > websm [ACK] Seq=1 Ack=1 Win=14656 Len=0 TSval=12646252 TSecr=8910567
 73.667185     10.0.1.2 -> 10.0.1.3     TCP 66 39984 > websm [FIN, ACK] Seq=9 Ack=150000001 Win=2258880 Len=0 TSval=12649441 TSecr=8913731
 73.706130     10.0.1.3 -> 10.0.1.2     TCP 66 websm > 39984 [ACK] Seq=150000001 Ack=10 Win=5824 Len=0 TSval=8913766 TSecr=12649441
 76.669111     10.0.1.2 -> 10.0.1.3     TCP 74 39986 > websm [SYN] Seq=0 Win=14600 Len=0 MSS=1460 SACK_PERM=1 TSval=12650192 TSecr=0 WS=64
 76.669500     10.0.1.3 -> 10.0.1.2     TCP 74 websm > 39986 [SYN, ACK] Seq=0 Ack=1 Win=5792 Len=0 MSS=1460 SACK_PERM=1 TSval=8914506 TSecr=12650192 WS=64
 76.669513     10.0.1.2 -> 10.0.1.3     TCP 66 39986 > websm [ACK] Seq=1 Ack=1 Win=14656 Len=0 TSval=12650192 TSecr=8914506
 89.426054     10.0.1.2 -> 10.0.1.3     TCP 66 39986 > websm [FIN, ACK] Seq=9 Ack=150000001 Win=2221248 Len=0 TSval=12653381 TSecr=8917670
 89.463232     10.0.1.3 -> 10.0.1.2     TCP 66 websm > 39986 [ACK] Seq=150000001 Ack=10 Win=5824 Len=0 TSval=8917705 TSecr=12653381
 92.427981     10.0.1.2 -> 10.0.1.3     TCP 74 39987 > websm [SYN] Seq=0 Win=14600 Len=0 MSS=1460 SACK_PERM=1 TSval=12654132 TSecr=0 WS=64
 92.428419     10.0.1.3 -> 10.0.1.2     TCP 74 websm > 39987 [SYN, ACK] Seq=0 Ack=1 Win=5792 Len=0 MSS=1460 SACK_PERM=1 TSval=8918446 TSecr=12654132 WS=64
 92.428434     10.0.1.2 -> 10.0.1.3     TCP 66 39987 > websm [ACK] Seq=1 Ack=1 Win=14656 Len=0 TSval=12654132 TSecr=8918446
105.186754     10.0.1.2 -> 10.0.1.3     TCP 66 39987 > websm [FIN, ACK] Seq=9 Ack=150000001 Win=2235712 Len=0 TSval=12657321 TSecr=8921611
105.224514     10.0.1.3 -> 10.0.1.2     TCP 66 websm > 39987 [ACK] Seq=150000001 Ack=10 Win=5824 Len=0 TSval=8921645 TSecr=12657321
108.188733     10.0.1.2 -> 10.0.1.3     TCP 74 39990 > websm [SYN] Seq=0 Win=14600 Len=0 MSS=1460 SACK_PERM=1 TSval=12658072 TSecr=0 WS=64
108.189173     10.0.1.3 -> 10.0.1.2     TCP 74 websm > 39990 [SYN, ACK] Seq=0 Ack=1 Win=5792 Len=0 MSS=1460 SACK_PERM=1 TSval=8922386 TSecr=12658072 WS=64
108.189187     10.0.1.2 -> 10.0.1.3     TCP 66 39990 > websm [ACK] Seq=1 Ack=1 Win=14656 Len=0 TSval=12658072 TSecr=8922386
120.945069     10.0.1.2 -> 10.0.1.3     TCP 66 39990 > websm [FIN, ACK] Seq=9 Ack=150000001 Win=2256000 Len=0 TSval=12661261 TSecr=8925550
120.981702     10.0.1.3 -> 10.0.1.2     TCP 66 websm > 39990 [ACK] Seq=150000001 Ack=10 Win=5824 Len=0 TSval=8925584 TSecr=12661261
123.946963     10.0.1.2 -> 10.0.1.3     TCP 74 39991 > websm [SYN] Seq=0 Win=14600 Len=0 MSS=1460 SACK_PERM=1 TSval=12662011 TSecr=0 WS=64
123.947352     10.0.1.3 -> 10.0.1.2     TCP 74 websm > 39991 [SYN, ACK] Seq=0 Ack=1 Win=5792 Len=0 MSS=1460 SACK_PERM=1 TSval=8926325 TSecr=12662011 WS=64
123.947371     10.0.1.2 -> 10.0.1.3     TCP 66 39991 > websm [ACK] Seq=1 Ack=1 Win=14656 Len=0 TSval=12662011 TSecr=8926325
136.712212     10.0.1.2 -> 10.0.1.3     TCP 66 39991 > websm [FIN, ACK] Seq=9 Ack=150000001 Win=2232832 Len=0 TSval=12665203 TSecr=8929491
136.750807     10.0.1.3 -> 10.0.1.2     TCP 66 websm > 39991 [ACK] Seq=150000001 Ack=10 Win=5824 Len=0 TSval=8929526 TSecr=12665203
140.065673     10.0.1.2 -> 10.0.1.3     TCP 74 39993 > websm [SYN] Seq=0 Win=14600 Len=0 MSS=1460 SACK_PERM=1 TSval=12666041 TSecr=0 WS=64
140.066104     10.0.1.3 -> 10.0.1.2     TCP 74 websm > 39993 [SYN, ACK] Seq=0 Ack=1 Win=5792 Len=0 MSS=1460 SACK_PERM=1 TSval=8930354 TSecr=12666041 WS=64
140.066116     10.0.1.2 -> 10.0.1.3     TCP 66 39993 > websm [ACK] Seq=1 Ack=1 Win=14656 Len=0 TSval=12666041 TSecr=8930354
152.825823     10.0.1.2 -> 10.0.1.3     TCP 66 39993 > websm [FIN, ACK] Seq=9 Ack=150000001 Win=2229952 Len=0 TSval=12669231 TSecr=8933520
152.863913     10.0.1.3 -> 10.0.1.2     TCP 66 websm > 39993 [ACK] Seq=150000001 Ack=10 Win=5824 Len=0 TSval=8933554 TSecr=12669231
155.850047     10.0.1.2 -> 10.0.1.3     TCP 74 39994 > websm [SYN] Seq=0 Win=14600 Len=0 MSS=1460 SACK_PERM=1 TSval=12669987 TSecr=0 WS=64
155.850485     10.0.1.3 -> 10.0.1.2     TCP 74 websm > 39994 [SYN, ACK] Seq=0 Ack=1 Win=5792 Len=0 MSS=1460 SACK_PERM=1 TSval=8934300 TSecr=12669987 WS=64
155.850497     10.0.1.2 -> 10.0.1.3     TCP 66 39994 > websm [ACK] Seq=1 Ack=1 Win=14656 Len=0 TSval=12669987 TSecr=8934300
168.609130     10.0.1.2 -> 10.0.1.3     TCP 66 39994 > websm [FIN, ACK] Seq=9 Ack=150000001 Win=2218368 Len=0 TSval=12673177 TSecr=8937464
168.649101     10.0.1.3 -> 10.0.1.2     TCP 66 websm > 39994 [ACK] Seq=150000001 Ack=10 Win=5824 Len=0 TSval=8937500 TSecr=12673177
171.611301     10.0.1.2 -> 10.0.1.3     TCP 74 39995 > websm [SYN] Seq=0 Win=14600 Len=0 MSS=1460 SACK_PERM=1 TSval=12673927 TSecr=0 WS=64
171.611719     10.0.1.3 -> 10.0.1.2     TCP 74 websm > 39995 [SYN, ACK] Seq=0 Ack=1 Win=5792 Len=0 MSS=1460 SACK_PERM=1 TSval=8938240 TSecr=12673927 WS=64
171.611730     10.0.1.2 -> 10.0.1.3     TCP 66 39995 > websm [ACK] Seq=1 Ack=1 Win=14656 Len=0 TSval=12673927 TSecr=8938240
184.368371     10.0.1.2 -> 10.0.1.3     TCP 66 39995 > websm [FIN, ACK] Seq=9 Ack=150000001 Win=2258880 Len=0 TSval=12677117 TSecr=8941405
184.406521     10.0.1.3 -> 10.0.1.2     TCP 66 websm > 39995 [ACK] Seq=150000001 Ack=10 Win=5824 Len=0 TSval=8941439 TSecr=12677117
187.370304     10.0.1.2 -> 10.0.1.3     TCP 74 39996 > websm [SYN] Seq=0 Win=14600 Len=0 MSS=1460 SACK_PERM=1 TSval=12677867 TSecr=0 WS=64
187.370743     10.0.1.3 -> 10.0.1.2     TCP 74 websm > 39996 [SYN, ACK] Seq=0 Ack=1 Win=5792 Len=0 MSS=1460 SACK_PERM=1 TSval=8942180 TSecr=12677867 WS=64
187.370759     10.0.1.2 -> 10.0.1.3     TCP 66 39996 > websm [ACK] Seq=1 Ack=1 Win=14656 Len=0 TSval=12677867 TSecr=8942180
200.127612     10.0.1.2 -> 10.0.1.3     TCP 66 39996 > websm [FIN, ACK] Seq=9 Ack=150000001 Win=2160448 Len=0 TSval=12681056 TSecr=8945344
200.167562     10.0.1.3 -> 10.0.1.2     TCP 66 websm > 39996 [ACK] Seq=150000001 Ack=10 Win=5824 Len=0 TSval=8945379 TSecr=12681056
203.129585     10.0.1.2 -> 10.0.1.3     TCP 74 39998 > websm [SYN] Seq=0 Win=14600 Len=0 MSS=1460 SACK_PERM=1 TSval=12681807 TSecr=0 WS=64
203.130029     10.0.1.3 -> 10.0.1.2     TCP 74 websm > 39998 [SYN, ACK] Seq=0 Ack=1 Win=5792 Len=0 MSS=1460 SACK_PERM=1 TSval=8946119 TSecr=12681807 WS=64
203.130042     10.0.1.2 -> 10.0.1.3     TCP 66 39998 > websm [ACK] Seq=1 Ack=1 Win=14656 Len=0 TSval=12681807 TSecr=8946119
215.886366     10.0.1.2 -> 10.0.1.3     TCP 66 39998 > websm [FIN, ACK] Seq=9 Ack=150000001 Win=2232832 Len=0 TSval=12684996 TSecr=8949283
215.924757     10.0.1.3 -> 10.0.1.2     TCP 66 websm > 39998 [ACK] Seq=150000001 Ack=10 Win=5824 Len=0 TSval=8949318 TSecr=12684996
218.888328     10.0.1.2 -> 10.0.1.3     TCP 74 39999 > websm [SYN] Seq=0 Win=14600 Len=0 MSS=1460 SACK_PERM=1 TSval=12685747 TSecr=0 WS=64
218.888755     10.0.1.3 -> 10.0.1.2     TCP 74 websm > 39999 [SYN, ACK] Seq=0 Ack=1 Win=5792 Len=0 MSS=1460 SACK_PERM=1 TSval=8950058 TSecr=12685747 WS=64
218.888768     10.0.1.2 -> 10.0.1.3     TCP 66 39999 > websm [ACK] Seq=1 Ack=1 Win=14656 Len=0 TSval=12685747 TSecr=8950058
231.645181     10.0.1.2 -> 10.0.1.3     TCP 66 39999 > websm [FIN, ACK] Seq=9 Ack=150000001 Win=2229952 Len=0 TSval=12688936 TSecr=8953223
231.682039     10.0.1.3 -> 10.0.1.2     TCP 66 websm > 39999 [ACK] Seq=150000001 Ack=10 Win=5824 Len=0 TSval=8953257 TSecr=12688936
234.670039     10.0.1.2 -> 10.0.1.3     TCP 74 safetynetp > websm [SYN] Seq=0 Win=14600 Len=0 MSS=1460 SACK_PERM=1 TSval=12689692 TSecr=0 WS=64
234.670474     10.0.1.3 -> 10.0.1.2     TCP 74 websm > safetynetp [SYN, ACK] Seq=0 Ack=1 Win=5792 Len=0 MSS=1460 SACK_PERM=1 TSval=8954004 TSecr=12689692 WS=64
234.670487     10.0.1.2 -> 10.0.1.3     TCP 66 safetynetp > websm [ACK] Seq=1 Ack=1 Win=14656 Len=0 TSval=12689692 TSecr=8954004
247.429830     10.0.1.2 -> 10.0.1.3     TCP 66 safetynetp > websm [FIN, ACK] Seq=9 Ack=150000001 Win=2232832 Len=0 TSval=12692882 TSecr=8957169
247.467227     10.0.1.3 -> 10.0.1.2     TCP 66 websm > safetynetp [ACK] Seq=150000001 Ack=10 Win=5824 Len=0 TSval=8957203 TSecr=12692882
250.431846     10.0.1.2 -> 10.0.1.3     TCP 74 40001 > websm [SYN] Seq=0 Win=14600 Len=0 MSS=1460 SACK_PERM=1 TSval=12693632 TSecr=0 WS=64
250.432281     10.0.1.3 -> 10.0.1.2     TCP 74 websm > 40001 [SYN, ACK] Seq=0 Ack=1 Win=5792 Len=0 MSS=1460 SACK_PERM=1 TSval=8957944 TSecr=12693632 WS=64
250.432294     10.0.1.2 -> 10.0.1.3     TCP 66 40001 > websm [ACK] Seq=1 Ack=1 Win=14656 Len=0 TSval=12693633 TSecr=8957944
263.196950     10.0.1.2 -> 10.0.1.3     TCP 66 40001 > websm [FIN, ACK] Seq=9 Ack=150000001 Win=2186496 Len=0 TSval=12696824 TSecr=8961110
263.236415     10.0.1.3 -> 10.0.1.2     TCP 66 websm > 40001 [ACK] Seq=150000001 Ack=10 Win=5824 Len=0 TSval=8961145 TSecr=12696824
266.215286     10.0.1.2 -> 10.0.1.3     TCP 74 40003 > websm [SYN] Seq=0 Win=14600 Len=0 MSS=1460 SACK_PERM=1 TSval=12697578 TSecr=0 WS=64
266.215724     10.0.1.3 -> 10.0.1.2     TCP 74 websm > 40003 [SYN, ACK] Seq=0 Ack=1 Win=5792 Len=0 MSS=1460 SACK_PERM=1 TSval=8961889 TSecr=12697578 WS=64
266.215737     10.0.1.2 -> 10.0.1.3     TCP 66 40003 > websm [ACK] Seq=1 Ack=1 Win=14656 Len=0 TSval=12697578 TSecr=8961889
278.972286     10.0.1.2 -> 10.0.1.3     TCP 66 40003 > websm [FIN, ACK] Seq=9 Ack=150000001 Win=2229952 Len=0 TSval=12700768 TSecr=8965054
279.009592     10.0.1.3 -> 10.0.1.2     TCP 66 websm > 40003 [ACK] Seq=150000001 Ack=10 Win=5824 Len=0 TSval=8965088 TSecr=12700768
281.974153     10.0.1.2 -> 10.0.1.3     TCP 74 40005 > websm [SYN] Seq=0 Win=14600 Len=0 MSS=1460 SACK_PERM=1 TSval=12701518 TSecr=0 WS=64
281.974589     10.0.1.3 -> 10.0.1.2     TCP 74 websm > 40005 [SYN, ACK] Seq=0 Ack=1 Win=5792 Len=0 MSS=1460 SACK_PERM=1 TSval=8965829 TSecr=12701518 WS=64
281.974605     10.0.1.2 -> 10.0.1.3     TCP 66 40005 > websm [ACK] Seq=1 Ack=1 Win=14656 Len=0 TSval=12701518 TSecr=8965829
294.731653     10.0.1.2 -> 10.0.1.3     TCP 66 40005 > websm [FIN, ACK] Seq=9 Ack=150000001 Win=2229952 Len=0 TSval=12704707 TSecr=8968993
294.770691     10.0.1.3 -> 10.0.1.2     TCP 66 websm > 40005 [ACK] Seq=150000001 Ack=10 Win=5824 Len=0 TSval=8969028 TSecr=12704707
297.748946     10.0.1.2 -> 10.0.1.3     TCP 74 40006 > websm [SYN] Seq=0 Win=14600 Len=0 MSS=1460 SACK_PERM=1 TSval=12705462 TSecr=0 WS=64
297.749386     10.0.1.3 -> 10.0.1.2     TCP 74 websm > 40006 [SYN, ACK] Seq=0 Ack=1 Win=5792 Len=0 MSS=1460 SACK_PERM=1 TSval=8969772 TSecr=12705462 WS=64
297.749404     10.0.1.2 -> 10.0.1.3     TCP 66 40006 > websm [ACK] Seq=1 Ack=1 Win=14656 Len=0 TSval=12705462 TSecr=8969772
310.506806     10.0.1.2 -> 10.0.1.3     TCP 66 40006 > websm [FIN, ACK] Seq=9 Ack=150000001 Win=2224128 Len=0 TSval=12708651 TSecr=8972937
310.543912     10.0.1.3 -> 10.0.1.2     TCP 66 websm > 40006 [ACK] Seq=150000001 Ack=10 Win=5824 Len=0 TSval=8972971 TSecr=12708651
