 14.580483     10.0.1.2 -> 10.0.1.3     TCP 66 40007 > websm [FIN, ACK] Seq=1 Ack=171530873 Win=47106 Len=0 TSval=12714187 TSecr=8978441
 17.582483     10.0.1.2 -> 10.0.1.3     TCP 74 40009 > websm [SYN] Seq=0 Win=14600 Len=0 MSS=1460 SACK_PERM=1 TSval=12714937 TSecr=0 WS=64
 17.582924     10.0.1.3 -> 10.0.1.2     TCP 74 websm > 40009 [SYN, ACK] Seq=0 Ack=1 Win=5792 Len=0 MSS=1460 SACK_PERM=1 TSval=8979247 TSecr=12714937 WS=64
 17.582937     10.0.1.2 -> 10.0.1.3     TCP 66 40009 > websm [ACK] Seq=1 Ack=1 Win=14656 Len=0 TSval=12714937 TSecr=8979247
 34.591386     10.0.1.2 -> 10.0.1.3     TCP 66 40009 > websm [FIN, ACK] Seq=9 Ack=200000001 Win=3011840 Len=0 TSval=12719189 TSecr=8983447
 34.631015     10.0.1.3 -> 10.0.1.2     TCP 66 websm > 40009 [ACK] Seq=200000001 Ack=10 Win=5824 Len=0 TSval=8983509 TSecr=12719189
 37.593568     10.0.1.2 -> 10.0.1.3     TCP 74 40010 > websm [SYN] Seq=0 Win=14600 Len=0 MSS=1460 SACK_PERM=1 TSval=12719940 TSecr=0 WS=64
 37.593964     10.0.1.3 -> 10.0.1.2     TCP 74 websm > 40010 [SYN, ACK] Seq=0 Ack=1 Win=5792 Len=0 MSS=1460 SACK_PERM=1 TSval=8984249 TSecr=12719940 WS=64
 37.593976     10.0.1.2 -> 10.0.1.3     TCP 66 40010 > websm [ACK] Seq=1 Ack=1 Win=14656 Len=0 TSval=12719940 TSecr=8984249
 54.601630     10.0.1.2 -> 10.0.1.3     TCP 66 40010 > websm [FIN, ACK] Seq=9 Ack=200000001 Win=3008960 Len=0 TSval=12724192 TSecr=8988445
 54.640521     10.0.1.3 -> 10.0.1.2     TCP 66 websm > 40010 [ACK] Seq=200000001 Ack=10 Win=5824 Len=0 TSval=8988511 TSecr=12724192
 57.603617     10.0.1.2 -> 10.0.1.3     TCP 74 40011 > websm [SYN] Seq=0 Win=14600 Len=0 MSS=1460 SACK_PERM=1 TSval=12724942 TSecr=0 WS=64
 57.604054     10.0.1.3 -> 10.0.1.2     TCP 74 websm > 40011 [SYN, ACK] Seq=0 Ack=1 Win=5792 Len=0 MSS=1460 SACK_PERM=1 TSval=8989251 TSecr=12724942 WS=64
 57.604066     10.0.1.2 -> 10.0.1.3     TCP 66 40011 > websm [ACK] Seq=1 Ack=1 Win=14656 Len=0 TSval=12724943 TSecr=8989251
 74.611619     10.0.1.2 -> 10.0.1.3     TCP 66 40011 > websm [FIN, ACK] Seq=9 Ack=200000001 Win=3011840 Len=0 TSval=12729194 TSecr=8993447
 74.649927     10.0.1.3 -> 10.0.1.2     TCP 66 websm > 40011 [ACK] Seq=200000001 Ack=10 Win=5824 Len=0 TSval=8993513 TSecr=12729194
 77.613601     10.0.1.2 -> 10.0.1.3     TCP 74 40014 > websm [SYN] Seq=0 Win=14600 Len=0 MSS=1460 SACK_PERM=1 TSval=12729945 TSecr=0 WS=64
 77.614037     10.0.1.3 -> 10.0.1.2     TCP 74 websm > 40014 [SYN, ACK] Seq=0 Ack=1 Win=5792 Len=0 MSS=1460 SACK_PERM=1 TSval=8994253 TSecr=12729945 WS=64
 77.614052     10.0.1.2 -> 10.0.1.3     TCP 66 40014 > websm [ACK] Seq=1 Ack=1 Win=14656 Len=0 TSval=12729945 TSecr=8994253
 94.631249     10.0.1.2 -> 10.0.1.3     TCP 66 40014 > websm [FIN, ACK] Seq=9 Ack=200000001 Win=3011840 Len=0 TSval=12734199 TSecr=8998452
 94.671544     10.0.1.3 -> 10.0.1.2     TCP 66 websm > 40014 [ACK] Seq=200000001 Ack=10 Win=5824 Len=0 TSval=8998518 TSecr=12734199
 97.633173     10.0.1.2 -> 10.0.1.3     TCP 74 40016 > websm [SYN] Seq=0 Win=14600 Len=0 MSS=1460 SACK_PERM=1 TSval=12734950 TSecr=0 WS=64
 97.633565     10.0.1.3 -> 10.0.1.2     TCP 74 websm > 40016 [SYN, ACK] Seq=0 Ack=1 Win=5792 Len=0 MSS=1460 SACK_PERM=1 TSval=8999258 TSecr=12734950 WS=64
 97.633579     10.0.1.2 -> 10.0.1.3     TCP 66 40016 > websm [ACK] Seq=1 Ack=1 Win=14656 Len=0 TSval=12734950 TSecr=8999258
114.641978     10.0.1.2 -> 10.0.1.3     TCP 66 40016 > websm [FIN, ACK] Seq=9 Ack=200000001 Win=3011840 Len=0 TSval=12739202 TSecr=9003454
114.681069     10.0.1.3 -> 10.0.1.2     TCP 66 websm > 40016 [ACK] Seq=200000001 Ack=10 Win=5824 Len=0 TSval=9003520 TSecr=12739202
117.643919     10.0.1.2 -> 10.0.1.3     TCP 74 40017 > websm [SYN] Seq=0 Win=14600 Len=0 MSS=1460 SACK_PERM=1 TSval=12739952 TSecr=0 WS=64
117.644358     10.0.1.3 -> 10.0.1.2     TCP 74 websm > 40017 [SYN, ACK] Seq=0 Ack=1 Win=5792 Len=0 MSS=1460 SACK_PERM=1 TSval=9004260 TSecr=12739952 WS=64
117.644373     10.0.1.2 -> 10.0.1.3     TCP 66 40017 > websm [ACK] Seq=1 Ack=1 Win=14656 Len=0 TSval=12739953 TSecr=9004260
134.651530     10.0.1.2 -> 10.0.1.3     TCP 66 40017 > websm [FIN, ACK] Seq=9 Ack=200000001 Win=2985792 Len=0 TSval=12744204 TSecr=9008456
134.690445     10.0.1.3 -> 10.0.1.2     TCP 66 websm > 40017 [ACK] Seq=200000001 Ack=10 Win=5824 Len=0 TSval=9008522 TSecr=12744204
137.827563     10.0.1.2 -> 10.0.1.3     TCP 74 40019 > websm [SYN] Seq=0 Win=14600 Len=0 MSS=1460 SACK_PERM=1 TSval=12744998 TSecr=0 WS=64
137.827983     10.0.1.3 -> 10.0.1.2     TCP 74 websm > 40019 [SYN, ACK] Seq=0 Ack=1 Win=5792 Len=0 MSS=1460 SACK_PERM=1 TSval=9009306 TSecr=12744998 WS=64
137.827997     10.0.1.2 -> 10.0.1.3     TCP 66 40019 > websm [ACK] Seq=1 Ack=1 Win=14656 Len=0 TSval=12744999 TSecr=9009306
154.841122     10.0.1.2 -> 10.0.1.3     TCP 66 40019 > websm [FIN, ACK] Seq=9 Ack=200000001 Win=3011840 Len=0 TSval=12749252 TSecr=9013504
154.879991     10.0.1.3 -> 10.0.1.2     TCP 66 websm > 40019 [ACK] Seq=200000001 Ack=10 Win=5824 Len=0 TSval=9013569 TSecr=12749252
157.843104     10.0.1.2 -> 10.0.1.3     TCP 74 40021 > websm [SYN] Seq=0 Win=14600 Len=0 MSS=1460 SACK_PERM=1 TSval=12750002 TSecr=0 WS=64
157.843490     10.0.1.3 -> 10.0.1.2     TCP 74 websm > 40021 [SYN, ACK] Seq=0 Ack=1 Win=5792 Len=0 MSS=1460 SACK_PERM=1 TSval=9014309 TSecr=12750002 WS=64
157.843504     10.0.1.2 -> 10.0.1.3     TCP 66 40021 > websm [ACK] Seq=1 Ack=1 Win=14656 Len=0 TSval=12750002 TSecr=9014309
174.853342     10.0.1.2 -> 10.0.1.3     TCP 66 40021 > websm [FIN, ACK] Seq=9 Ack=200000001 Win=3006080 Len=0 TSval=12754255 TSecr=9018506
174.893589     10.0.1.3 -> 10.0.1.2     TCP 66 websm > 40021 [ACK] Seq=200000001 Ack=10 Win=5824 Len=0 TSval=9018572 TSecr=12754255
177.855260     10.0.1.2 -> 10.0.1.3     TCP 74 40022 > websm [SYN] Seq=0 Win=14600 Len=0 MSS=1460 SACK_PERM=1 TSval=12755005 TSecr=0 WS=64
177.855699     10.0.1.3 -> 10.0.1.2     TCP 74 websm > 40022 [SYN, ACK] Seq=0 Ack=1 Win=5792 Len=0 MSS=1460 SACK_PERM=1 TSval=9019312 TSecr=12755005 WS=64
177.855711     10.0.1.2 -> 10.0.1.3     TCP 66 40022 > websm [ACK] Seq=1 Ack=1 Win=14656 Len=0 TSval=12755005 TSecr=9019312
194.862812     10.0.1.2 -> 10.0.1.3     TCP 66 40022 > websm [FIN, ACK] Seq=9 Ack=200000001 Win=3008960 Len=0 TSval=12759257 TSecr=9023508
194.903171     10.0.1.3 -> 10.0.1.2     TCP 66 websm > 40022 [ACK] Seq=200000001 Ack=10 Win=5824 Len=0 TSval=9023574 TSecr=12759257
197.865605     10.0.1.2 -> 10.0.1.3     TCP 74 40024 > websm [SYN] Seq=0 Win=14600 Len=0 MSS=1460 SACK_PERM=1 TSval=12760008 TSecr=0 WS=64
197.866041     10.0.1.3 -> 10.0.1.2     TCP 74 websm > 40024 [SYN, ACK] Seq=0 Ack=1 Win=5792 Len=0 MSS=1460 SACK_PERM=1 TSval=9024314 TSecr=12760008 WS=64
197.866054     10.0.1.2 -> 10.0.1.3     TCP 66 40024 > websm [ACK] Seq=1 Ack=1 Win=14656 Len=0 TSval=12760008 TSecr=9024314
217.964412     10.0.1.2 -> 10.0.1.3     TCP 74 40025 > websm [SYN] Seq=0 Win=14600 Len=0 MSS=1460 SACK_PERM=1 TSval=12765033 TSecr=0 WS=64
217.964847     10.0.1.3 -> 10.0.1.2     TCP 74 websm > 40025 [SYN, ACK] Seq=0 Ack=1 Win=5792 Len=0 MSS=1460 SACK_PERM=1 TSval=9029339 TSecr=12765033 WS=64
217.964861     10.0.1.2 -> 10.0.1.3     TCP 66 40025 > websm [ACK] Seq=1 Ack=1 Win=14656 Len=0 TSval=12765033 TSecr=9029339
234.974000     10.0.1.2 -> 10.0.1.3     TCP 66 40025 > websm [FIN, ACK] Seq=9 Ack=200000001 Win=3011840 Len=0 TSval=12769285 TSecr=9033534
235.014194     10.0.1.3 -> 10.0.1.2     TCP 66 websm > 40025 [ACK] Seq=200000001 Ack=10 Win=5824 Len=0 TSval=9033601 TSecr=12769285
237.975994     10.0.1.2 -> 10.0.1.3     TCP 74 40026 > websm [SYN] Seq=0 Win=14600 Len=0 MSS=1460 SACK_PERM=1 TSval=12770036 TSecr=0 WS=64
237.976450     10.0.1.3 -> 10.0.1.2     TCP 74 websm > 40026 [SYN, ACK] Seq=0 Ack=1 Win=5792 Len=0 MSS=1460 SACK_PERM=1 TSval=9034341 TSecr=12770036 WS=64
237.976468     10.0.1.2 -> 10.0.1.3     TCP 66 40026 > websm [ACK] Seq=1 Ack=1 Win=14656 Len=0 TSval=12770036 TSecr=9034341
254.985959     10.0.1.2 -> 10.0.1.3     TCP 66 40026 > websm [FIN, ACK] Seq=9 Ack=200000001 Win=3011840 Len=0 TSval=12774288 TSecr=9038537
255.023524     10.0.1.3 -> 10.0.1.2     TCP 66 websm > 40026 [ACK] Seq=200000001 Ack=10 Win=5824 Len=0 TSval=9038603 TSecr=12774288
258.003963     10.0.1.2 -> 10.0.1.3     TCP 74 40029 > websm [SYN] Seq=0 Win=14600 Len=0 MSS=1460 SACK_PERM=1 TSval=12775043 TSecr=0 WS=64
258.004261     10.0.1.3 -> 10.0.1.2     TCP 74 websm > 40029 [SYN, ACK] Seq=0 Ack=1 Win=5792 Len=0 MSS=1460 SACK_PERM=1 TSval=9039348 TSecr=12775043 WS=64
258.004273     10.0.1.2 -> 10.0.1.3     TCP 66 40029 > websm [ACK] Seq=1 Ack=1 Win=14656 Len=0 TSval=12775043 TSecr=9039348
275.011411     10.0.1.2 -> 10.0.1.3     TCP 66 40029 > websm [FIN, ACK] Seq=9 Ack=200000001 Win=3008960 Len=0 TSval=12779294 TSecr=9043544
275.049212     10.0.1.3 -> 10.0.1.2     TCP 66 websm > 40029 [ACK] Seq=200000001 Ack=10 Win=5824 Len=0 TSval=9043609 TSecr=12779294
278.123550     10.0.1.2 -> 10.0.1.3     TCP 74 40030 > websm [SYN] Seq=0 Win=14600 Len=0 MSS=1460 SACK_PERM=1 TSval=12780072 TSecr=0 WS=64
278.123988     10.0.1.3 -> 10.0.1.2     TCP 74 websm > 40030 [SYN, ACK] Seq=0 Ack=1 Win=5792 Len=0 MSS=1460 SACK_PERM=1 TSval=9044377 TSecr=12780072 WS=64
278.124003     10.0.1.2 -> 10.0.1.3     TCP 66 40030 > websm [ACK] Seq=1 Ack=1 Win=14656 Len=0 TSval=12780073 TSecr=9044377
295.131798     10.0.1.2 -> 10.0.1.3     TCP 66 40030 > websm [FIN, ACK] Seq=9 Ack=200000001 Win=3011840 Len=0 TSval=12784324 TSecr=9048608
295.170534     10.0.1.3 -> 10.0.1.2     TCP 66 websm > 40030 [ACK] Seq=200000001 Ack=10 Win=5824 Len=0 TSval=9048639 TSecr=12784324
298.133733     10.0.1.2 -> 10.0.1.3     TCP 74 40031 > websm [SYN] Seq=0 Win=14600 Len=0 MSS=1460 SACK_PERM=1 TSval=12785075 TSecr=0 WS=64
298.134126     10.0.1.3 -> 10.0.1.2     TCP 74 websm > 40031 [SYN, ACK] Seq=0 Ack=1 Win=5792 Len=0 MSS=1460 SACK_PERM=1 TSval=9049379 TSecr=12785075 WS=64
298.134140     10.0.1.2 -> 10.0.1.3     TCP 66 40031 > websm [ACK] Seq=1 Ack=1 Win=14656 Len=0 TSval=12785075 TSecr=9049379
315.142914     10.0.1.2 -> 10.0.1.3     TCP 66 40031 > websm [FIN, ACK] Seq=9 Ack=200000001 Win=3011840 Len=0 TSval=12789327 TSecr=9053575
315.180135     10.0.1.3 -> 10.0.1.2     TCP 66 websm > 40031 [ACK] Seq=200000001 Ack=10 Win=5824 Len=0 TSval=9053641 TSecr=12789327
318.177468     10.0.1.2 -> 10.0.1.3     TCP 74 40032 > websm [SYN] Seq=0 Win=14600 Len=0 MSS=1460 SACK_PERM=1 TSval=12790086 TSecr=0 WS=64
318.177843     10.0.1.3 -> 10.0.1.2     TCP 74 websm > 40032 [SYN, ACK] Seq=0 Ack=1 Win=5792 Len=0 MSS=1460 SACK_PERM=1 TSval=9054390 TSecr=12790086 WS=64
318.177857     10.0.1.2 -> 10.0.1.3     TCP 66 40032 > websm [ACK] Seq=1 Ack=1 Win=14656 Len=0 TSval=12790086 TSecr=9054390
335.185369     10.0.1.2 -> 10.0.1.3     TCP 66 40032 > websm [FIN, ACK] Seq=9 Ack=200000001 Win=3011840 Len=0 TSval=12794338 TSecr=9058599
335.225734     10.0.1.3 -> 10.0.1.2     TCP 66 websm > 40032 [ACK] Seq=200000001 Ack=10 Win=5824 Len=0 TSval=9058652 TSecr=12794338
338.187438     10.0.1.2 -> 10.0.1.3     TCP 74 40034 > websm [SYN] Seq=0 Win=14600 Len=0 MSS=1460 SACK_PERM=1 TSval=12795088 TSecr=0 WS=64
338.187874     10.0.1.3 -> 10.0.1.2     TCP 74 websm > 40034 [SYN, ACK] Seq=0 Ack=1 Win=5792 Len=0 MSS=1460 SACK_PERM=1 TSval=9059392 TSecr=12795088 WS=64
338.187888     10.0.1.2 -> 10.0.1.3     TCP 66 40034 > websm [ACK] Seq=1 Ack=1 Win=14656 Len=0 TSval=12795088 TSecr=9059392
355.206904     10.0.1.2 -> 10.0.1.3     TCP 66 40034 > websm [FIN, ACK] Seq=9 Ack=200000001 Win=3008960 Len=0 TSval=12799343 TSecr=9063592
355.247186     10.0.1.3 -> 10.0.1.2     TCP 66 websm > 40034 [ACK] Seq=200000001 Ack=10 Win=5824 Len=0 TSval=9063657 TSecr=12799343
358.258131     10.0.1.2 -> 10.0.1.3     TCP 74 40035 > websm [SYN] Seq=0 Win=14600 Len=0 MSS=1460 SACK_PERM=1 TSval=12800106 TSecr=0 WS=64
358.258515     10.0.1.3 -> 10.0.1.2     TCP 74 websm > 40035 [SYN, ACK] Seq=0 Ack=1 Win=5792 Len=0 MSS=1460 SACK_PERM=1 TSval=9064409 TSecr=12800106 WS=64
358.258530     10.0.1.2 -> 10.0.1.3     TCP 66 40035 > websm [ACK] Seq=1 Ack=1 Win=14656 Len=0 TSval=12800106 TSecr=9064409
378.322239     10.0.1.2 -> 10.0.1.3     TCP 74 40036 > websm [SYN] Seq=0 Win=14600 Len=0 MSS=1460 SACK_PERM=1 TSval=12805122 TSecr=0 WS=64
378.322616     10.0.1.3 -> 10.0.1.2     TCP 74 websm > 40036 [SYN, ACK] Seq=0 Ack=1 Win=5792 Len=0 MSS=1460 SACK_PERM=1 TSval=9069425 TSecr=12805122 WS=64
378.322633     10.0.1.2 -> 10.0.1.3     TCP 66 40036 > websm [ACK] Seq=1 Ack=1 Win=14656 Len=0 TSval=12805122 TSecr=9069425
395.330469     10.0.1.2 -> 10.0.1.3     TCP 66 40036 > websm [FIN, ACK] Seq=9 Ack=200000001 Win=3008960 Len=0 TSval=12809374 TSecr=9073655
395.370180     10.0.1.3 -> 10.0.1.2     TCP 66 websm > 40036 [ACK] Seq=200000001 Ack=10 Win=5824 Len=0 TSval=9073687 TSecr=12809374
