 19.230961     10.0.1.2 -> 10.0.1.3     TCP 66 40038 > websm [FIN, ACK] Seq=1 Ack=226123929 Win=47060 Len=0 TSval=12815970 TSecr=9080209
 22.250387     10.0.1.2 -> 10.0.1.3     TCP 74 40039 > websm [SYN] Seq=0 Win=14600 Len=0 MSS=1460 SACK_PERM=1 TSval=12816725 TSecr=0 WS=64
 22.250821     10.0.1.3 -> 10.0.1.2     TCP 74 websm > 40039 [SYN, ACK] Seq=0 Ack=1 Win=5792 Len=0 MSS=1460 SACK_PERM=1 TSval=9081027 TSecr=12816725 WS=64
 22.250837     10.0.1.2 -> 10.0.1.3     TCP 66 40039 > websm [ACK] Seq=1 Ack=1 Win=14656 Len=0 TSval=12816725 TSecr=9081027
 43.513250     10.0.1.2 -> 10.0.1.3     TCP 66 40039 > websm [FIN, ACK] Seq=9 Ack=250000001 Win=2997376 Len=0 TSval=12822041 TSecr=9086290
 43.550968     10.0.1.3 -> 10.0.1.2     TCP 66 websm > 40039 [ACK] Seq=250000001 Ack=10 Win=5824 Len=0 TSval=9086352 TSecr=12822041
 46.515162     10.0.1.2 -> 10.0.1.3     TCP 74 40040 > websm [SYN] Seq=0 Win=14600 Len=0 MSS=1460 SACK_PERM=1 TSval=12822791 TSecr=0 WS=64
 46.515594     10.0.1.3 -> 10.0.1.2     TCP 74 websm > 40040 [SYN, ACK] Seq=0 Ack=1 Win=5792 Len=0 MSS=1460 SACK_PERM=1 TSval=9087093 TSecr=12822791 WS=64
 46.515606     10.0.1.2 -> 10.0.1.3     TCP 66 40040 > websm [ACK] Seq=1 Ack=1 Win=14656 Len=0 TSval=12822791 TSecr=9087093
 67.772332     10.0.1.2 -> 10.0.1.3     TCP 66 40040 > websm [FIN, ACK] Seq=9 Ack=250000001 Win=3011840 Len=0 TSval=12828106 TSecr=9092354
 67.811892     10.0.1.3 -> 10.0.1.2     TCP 66 websm > 40040 [ACK] Seq=250000001 Ack=10 Win=5824 Len=0 TSval=9092417 TSecr=12828106
 70.774389     10.0.1.2 -> 10.0.1.3     TCP 74 40042 > websm [SYN] Seq=0 Win=14600 Len=0 MSS=1460 SACK_PERM=1 TSval=12828856 TSecr=0 WS=64
 70.774832     10.0.1.3 -> 10.0.1.2     TCP 74 websm > 40042 [SYN, ACK] Seq=0 Ack=1 Win=5792 Len=0 MSS=1460 SACK_PERM=1 TSval=9093157 TSecr=12828856 WS=64
 70.774847     10.0.1.2 -> 10.0.1.3     TCP 66 40042 > websm [ACK] Seq=1 Ack=1 Win=14656 Len=0 TSval=12828856 TSecr=9093157
 92.032589     10.0.1.2 -> 10.0.1.3     TCP 66 40042 > websm [FIN, ACK] Seq=9 Ack=250000001 Win=3011840 Len=0 TSval=12834171 TSecr=9098421
 92.069766     10.0.1.3 -> 10.0.1.2     TCP 66 websm > 40042 [ACK] Seq=250000001 Ack=10 Win=5824 Len=0 TSval=9098481 TSecr=12834171
 95.034541     10.0.1.2 -> 10.0.1.3     TCP 74 40043 > websm [SYN] Seq=0 Win=14600 Len=0 MSS=1460 SACK_PERM=1 TSval=12834921 TSecr=0 WS=64
 95.034977     10.0.1.3 -> 10.0.1.2     TCP 74 websm > 40043 [SYN, ACK] Seq=0 Ack=1 Win=5792 Len=0 MSS=1460 SACK_PERM=1 TSval=9099222 TSecr=12834921 WS=64
 95.034989     10.0.1.2 -> 10.0.1.3     TCP 66 40043 > websm [ACK] Seq=1 Ack=1 Win=14656 Len=0 TSval=12834921 TSecr=9099222
116.294833     10.0.1.2 -> 10.0.1.3     TCP 66 40043 > websm [FIN, ACK] Seq=9 Ack=250000001 Win=3011840 Len=0 TSval=12840236 TSecr=9104484
116.331566     10.0.1.3 -> 10.0.1.2     TCP 66 websm > 40043 [ACK] Seq=250000001 Ack=10 Win=5824 Len=0 TSval=9104546 TSecr=12840236
119.296770     10.0.1.2 -> 10.0.1.3     TCP 74 40045 > websm [SYN] Seq=0 Win=14600 Len=0 MSS=1460 SACK_PERM=1 TSval=12840987 TSecr=0 WS=64
119.297207     10.0.1.3 -> 10.0.1.2     TCP 74 websm > 40045 [SYN, ACK] Seq=0 Ack=1 Win=5792 Len=0 MSS=1460 SACK_PERM=1 TSval=9105287 TSecr=12840987 WS=64
119.297224     10.0.1.2 -> 10.0.1.3     TCP 66 40045 > websm [ACK] Seq=1 Ack=1 Win=14656 Len=0 TSval=12840987 TSecr=9105287
140.554970     10.0.1.2 -> 10.0.1.3     TCP 66 40045 > websm [FIN, ACK] Seq=9 Ack=250000001 Win=3011840 Len=0 TSval=12846301 TSecr=9110537
140.593290     10.0.1.3 -> 10.0.1.2     TCP 66 websm > 40045 [ACK] Seq=250000001 Ack=10 Win=5824 Len=0 TSval=9110611 TSecr=12846301
143.674946     10.0.1.2 -> 10.0.1.3     TCP 74 40046 > websm [SYN] Seq=0 Win=14600 Len=0 MSS=1460 SACK_PERM=1 TSval=12847081 TSecr=0 WS=64
143.675227     10.0.1.3 -> 10.0.1.2     TCP 74 websm > 40046 [SYN, ACK] Seq=0 Ack=1 Win=5792 Len=0 MSS=1460 SACK_PERM=1 TSval=9111381 TSecr=12847081 WS=64
143.675239     10.0.1.2 -> 10.0.1.3     TCP 66 40046 > websm [ACK] Seq=1 Ack=1 Win=14656 Len=0 TSval=12847081 TSecr=9111381
164.936565     10.0.1.2 -> 10.0.1.3     TCP 66 40046 > websm [FIN, ACK] Seq=9 Ack=250000001 Win=2994496 Len=0 TSval=12852397 TSecr=9116633
164.975011     10.0.1.3 -> 10.0.1.2     TCP 66 websm > 40046 [ACK] Seq=250000001 Ack=10 Win=5824 Len=0 TSval=9116706 TSecr=12852397
168.163611     10.0.1.2 -> 10.0.1.3     TCP 74 40050 > websm [SYN] Seq=0 Win=14600 Len=0 MSS=1460 SACK_PERM=1 TSval=12853203 TSecr=0 WS=64
168.164053     10.0.1.3 -> 10.0.1.2     TCP 74 websm > 40050 [SYN, ACK] Seq=0 Ack=1 Win=5792 Len=0 MSS=1460 SACK_PERM=1 TSval=9117503 TSecr=12853203 WS=64
168.164072     10.0.1.2 -> 10.0.1.3     TCP 66 40050 > websm [ACK] Seq=1 Ack=1 Win=14656 Len=0 TSval=12853204 TSecr=9117503
189.421868     10.0.1.2 -> 10.0.1.3     TCP 66 40050 > websm [FIN, ACK] Seq=9 Ack=250000001 Win=3008960 Len=0 TSval=12858518 TSecr=9122764
189.464972     10.0.1.3 -> 10.0.1.2     TCP 66 websm > 40050 [ACK] Seq=250000001 Ack=10 Win=5824 Len=0 TSval=9122828 TSecr=12858518
192.423832     10.0.1.2 -> 10.0.1.3     TCP 74 40052 > websm [SYN] Seq=0 Win=14600 Len=0 MSS=1460 SACK_PERM=1 TSval=12859268 TSecr=0 WS=64
192.424268     10.0.1.3 -> 10.0.1.2     TCP 74 websm > 40052 [SYN, ACK] Seq=0 Ack=1 Win=5792 Len=0 MSS=1460 SACK_PERM=1 TSval=9123567 TSecr=12859268 WS=64
192.424280     10.0.1.2 -> 10.0.1.3     TCP 66 40052 > websm [ACK] Seq=1 Ack=1 Win=14656 Len=0 TSval=12859269 TSecr=9123567
213.683560     10.0.1.2 -> 10.0.1.3     TCP 66 40052 > websm [FIN, ACK] Seq=9 Ack=250000001 Win=3008960 Len=0 TSval=12864583 TSecr=9128819
213.722876     10.0.1.3 -> 10.0.1.2     TCP 66 websm > 40052 [ACK] Seq=250000001 Ack=10 Win=5824 Len=0 TSval=9128892 TSecr=12864583
216.731420     10.0.1.2 -> 10.0.1.3     TCP 74 40053 > websm [SYN] Seq=0 Win=14600 Len=0 MSS=1460 SACK_PERM=1 TSval=12865345 TSecr=0 WS=64
216.731855     10.0.1.3 -> 10.0.1.2     TCP 74 websm > 40053 [SYN, ACK] Seq=0 Ack=1 Win=5792 Len=0 MSS=1460 SACK_PERM=1 TSval=9129644 TSecr=12865345 WS=64
216.731869     10.0.1.2 -> 10.0.1.3     TCP 66 40053 > websm [ACK] Seq=1 Ack=1 Win=14656 Len=0 TSval=12865345 TSecr=9129644
237.989055     10.0.1.2 -> 10.0.1.3     TCP 66 40053 > websm [FIN, ACK] Seq=9 Ack=250000001 Win=3008960 Len=0 TSval=12870660 TSecr=9134909
238.028512     10.0.1.3 -> 10.0.1.2     TCP 66 websm > 40053 [ACK] Seq=250000001 Ack=10 Win=5824 Len=0 TSval=9134968 TSecr=12870660
241.077141     10.0.1.2 -> 10.0.1.3     TCP 74 40056 > websm [SYN] Seq=0 Win=14600 Len=0 MSS=1460 SACK_PERM=1 TSval=12871432 TSecr=0 WS=64
241.077574     10.0.1.3 -> 10.0.1.2     TCP 74 websm > 40056 [SYN, ACK] Seq=0 Ack=1 Win=5792 Len=0 MSS=1460 SACK_PERM=1 TSval=9135730 TSecr=12871432 WS=64
241.077586     10.0.1.2 -> 10.0.1.3     TCP 66 40056 > websm [ACK] Seq=1 Ack=1 Win=14656 Len=0 TSval=12871432 TSecr=9135730
262.337062     10.0.1.2 -> 10.0.1.3     TCP 66 40056 > websm [FIN, ACK] Seq=9 Ack=250000001 Win=3011840 Len=0 TSval=12876747 TSecr=9140982
262.374441     10.0.1.3 -> 10.0.1.2     TCP 66 websm > 40056 [ACK] Seq=250000001 Ack=10 Win=5824 Len=0 TSval=9141054 TSecr=12876747
265.339079     10.0.1.2 -> 10.0.1.3     TCP 74 40057 > websm [SYN] Seq=0 Win=14600 Len=0 MSS=1460 SACK_PERM=1 TSval=12877497 TSecr=0 WS=64
265.339519     10.0.1.3 -> 10.0.1.2     TCP 74 websm > 40057 [SYN, ACK] Seq=0 Ack=1 Win=5792 Len=0 MSS=1460 SACK_PERM=1 TSval=9141795 TSecr=12877497 WS=64
265.339535     10.0.1.2 -> 10.0.1.3     TCP 66 40057 > websm [ACK] Seq=1 Ack=1 Win=14656 Len=0 TSval=12877497 TSecr=9141795
286.596008     10.0.1.2 -> 10.0.1.3     TCP 66 40057 > websm [FIN, ACK] Seq=9 Ack=250000001 Win=3006080 Len=0 TSval=12882812 TSecr=9147045
286.636171     10.0.1.3 -> 10.0.1.2     TCP 66 websm > 40057 [ACK] Seq=250000001 Ack=10 Win=5824 Len=0 TSval=9147119 TSecr=12882812
289.611858     10.0.1.2 -> 10.0.1.3     TCP 74 40060 > websm [SYN] Seq=0 Win=14600 Len=0 MSS=1460 SACK_PERM=1 TSval=12883565 TSecr=0 WS=64
289.612294     10.0.1.3 -> 10.0.1.2     TCP 74 websm > 40060 [SYN, ACK] Seq=0 Ack=1 Win=5792 Len=0 MSS=1460 SACK_PERM=1 TSval=9147862 TSecr=12883565 WS=64
289.612306     10.0.1.2 -> 10.0.1.3     TCP 66 40060 > websm [ACK] Seq=1 Ack=1 Win=14656 Len=0 TSval=12883566 TSecr=9147862
310.871564     10.0.1.2 -> 10.0.1.3     TCP 66 40060 > websm [FIN, ACK] Seq=9 Ack=250000001 Win=3011840 Len=0 TSval=12888880 TSecr=9153156
310.910228     10.0.1.3 -> 10.0.1.2     TCP 66 websm > 40060 [ACK] Seq=250000001 Ack=10 Win=5824 Len=0 TSval=9153187 TSecr=12888880
313.879327     10.0.1.2 -> 10.0.1.3     TCP 74 40062 > websm [SYN] Seq=0 Win=14600 Len=0 MSS=1460 SACK_PERM=1 TSval=12889632 TSecr=0 WS=64
313.879748     10.0.1.3 -> 10.0.1.2     TCP 74 websm > 40062 [SYN, ACK] Seq=0 Ack=1 Win=5792 Len=0 MSS=1460 SACK_PERM=1 TSval=9153929 TSecr=12889632 WS=64
313.879760     10.0.1.2 -> 10.0.1.3     TCP 66 40062 > websm [ACK] Seq=1 Ack=1 Win=14656 Len=0 TSval=12889632 TSecr=9153929
335.163331     10.0.1.2 -> 10.0.1.3     TCP 66 40062 > websm [FIN, ACK] Seq=9 Ack=250000001 Win=3011840 Len=0 TSval=12894953 TSecr=9159197
335.200037     10.0.1.3 -> 10.0.1.2     TCP 66 websm > 40062 [ACK] Seq=250000001 Ack=10 Win=5824 Len=0 TSval=9159259 TSecr=12894953
338.235534     10.0.1.2 -> 10.0.1.3     TCP 74 40063 > websm [SYN] Seq=0 Win=14600 Len=0 MSS=1460 SACK_PERM=1 TSval=12895721 TSecr=0 WS=64
338.235971     10.0.1.3 -> 10.0.1.2     TCP 74 websm > 40063 [SYN, ACK] Seq=0 Ack=1 Win=5792 Len=0 MSS=1460 SACK_PERM=1 TSval=9160017 TSecr=12895721 WS=64
338.235984     10.0.1.2 -> 10.0.1.3     TCP 66 40063 > websm [ACK] Seq=1 Ack=1 Win=14656 Len=0 TSval=12895722 TSecr=9160017
359.494861     10.0.1.2 -> 10.0.1.3     TCP 66 40063 > websm [FIN, ACK] Seq=9 Ack=250000001 Win=3075584 Len=0 TSval=12901036 TSecr=9165267
359.537362     10.0.1.3 -> 10.0.1.2     TCP 66 websm > 40063 [ACK] Seq=250000001 Ack=10 Win=5824 Len=0 TSval=9165342 TSecr=12901036
362.501657     10.0.1.2 -> 10.0.1.3     TCP 74 40064 > websm [SYN] Seq=0 Win=14600 Len=0 MSS=1460 SACK_PERM=1 TSval=12901788 TSecr=0 WS=64
362.502090     10.0.1.3 -> 10.0.1.2     TCP 74 websm > 40064 [SYN, ACK] Seq=0 Ack=1 Win=5792 Len=0 MSS=1460 SACK_PERM=1 TSval=9166084 TSecr=12901788 WS=64
362.502102     10.0.1.2 -> 10.0.1.3     TCP 66 40064 > websm [ACK] Seq=1 Ack=1 Win=14656 Len=0 TSval=12901788 TSecr=9166084
383.759818     10.0.1.2 -> 10.0.1.3     TCP 66 40064 > websm [FIN, ACK] Seq=9 Ack=250000001 Win=3011840 Len=0 TSval=12907102 TSecr=9171334
383.799702     10.0.1.3 -> 10.0.1.2     TCP 66 websm > 40064 [ACK] Seq=250000001 Ack=10 Win=5824 Len=0 TSval=9171408 TSecr=12907102
386.769067     10.0.1.2 -> 10.0.1.3     TCP 74 40066 > websm [SYN] Seq=0 Win=14600 Len=0 MSS=1460 SACK_PERM=1 TSval=12907855 TSecr=0 WS=64
386.769499     10.0.1.3 -> 10.0.1.2     TCP 74 websm > 40066 [SYN, ACK] Seq=0 Ack=1 Win=5792 Len=0 MSS=1460 SACK_PERM=1 TSval=9172150 TSecr=12907855 WS=64
386.769513     10.0.1.2 -> 10.0.1.3     TCP 66 40066 > websm [ACK] Seq=1 Ack=1 Win=14656 Len=0 TSval=12907855 TSecr=9172150
411.036203     10.0.1.2 -> 10.0.1.3     TCP 74 40067 > websm [SYN] Seq=0 Win=14600 Len=0 MSS=1460 SACK_PERM=1 TSval=12913922 TSecr=0 WS=64
411.036624     10.0.1.3 -> 10.0.1.2     TCP 74 websm > 40067 [SYN, ACK] Seq=0 Ack=1 Win=5792 Len=0 MSS=1460 SACK_PERM=1 TSval=9178216 TSecr=12913922 WS=64
411.036636     10.0.1.2 -> 10.0.1.3     TCP 66 40067 > websm [ACK] Seq=1 Ack=1 Win=14656 Len=0 TSval=12913922 TSecr=9178216
432.293110     10.0.1.2 -> 10.0.1.3     TCP 66 40067 > websm [FIN, ACK] Seq=9 Ack=250000001 Win=3011840 Len=0 TSval=12919236 TSecr=9183466
432.331255     10.0.1.3 -> 10.0.1.2     TCP 66 websm > 40067 [ACK] Seq=250000001 Ack=10 Win=5824 Len=0 TSval=9183540 TSecr=12919236
435.295074     10.0.1.2 -> 10.0.1.3     TCP 74 40069 > websm [SYN] Seq=0 Win=14600 Len=0 MSS=1460 SACK_PERM=1 TSval=12919986 TSecr=0 WS=64
435.295475     10.0.1.3 -> 10.0.1.2     TCP 74 websm > 40069 [SYN, ACK] Seq=0 Ack=1 Win=5792 Len=0 MSS=1460 SACK_PERM=1 TSval=9184281 TSecr=12919986 WS=64
435.295487     10.0.1.2 -> 10.0.1.3     TCP 66 40069 > websm [ACK] Seq=1 Ack=1 Win=14656 Len=0 TSval=12919986 TSecr=9184281
456.553843     10.0.1.2 -> 10.0.1.3     TCP 66 40069 > websm [FIN, ACK] Seq=9 Ack=250000001 Win=3011840 Len=0 TSval=12925301 TSecr=9189533
456.593070     10.0.1.3 -> 10.0.1.2     TCP 66 websm > 40069 [ACK] Seq=250000001 Ack=10 Win=5824 Len=0 TSval=9189605 TSecr=12925301
459.605330     10.0.1.2 -> 10.0.1.3     TCP 74 40071 > websm [SYN] Seq=0 Win=14600 Len=0 MSS=1460 SACK_PERM=1 TSval=12926064 TSecr=0 WS=64
459.605770     10.0.1.3 -> 10.0.1.2     TCP 74 websm > 40071 [SYN, ACK] Seq=0 Ack=1 Win=5792 Len=0 MSS=1460 SACK_PERM=1 TSval=9190358 TSecr=12926064 WS=64
459.605782     10.0.1.2 -> 10.0.1.3     TCP 66 40071 > websm [ACK] Seq=1 Ack=1 Win=14656 Len=0 TSval=12926064 TSecr=9190358
480.865389     10.0.1.2 -> 10.0.1.3     TCP 66 40071 > websm [FIN, ACK] Seq=9 Ack=250000001 Win=3011840 Len=0 TSval=12931379 TSecr=9195612
480.903006     10.0.1.3 -> 10.0.1.2     TCP 66 websm > 40071 [ACK] Seq=250000001 Ack=10 Win=5824 Len=0 TSval=9195682 TSecr=12931379
