  0.000000     10.0.1.2 -> 10.0.1.3     TCP 74 39927 > websm [SYN] Seq=0 Win=14600 Len=0 MSS=1460 SACK_PERM=1 TSval=12535473 TSecr=0 WS=64
  0.000312     10.0.1.3 -> 10.0.1.2     TCP 74 websm > 39927 [SYN, ACK] Seq=0 Ack=1 Win=5792 Len=0 MSS=1460 SACK_PERM=1 TSval=8799796 TSecr=12535473 WS=64
  0.000328     10.0.1.2 -> 10.0.1.3     TCP 66 39927 > websm [ACK] Seq=1 Ack=1 Win=14656 Len=0 TSval=12535473 TSecr=8799796
  4.256446     10.0.1.2 -> 10.0.1.3     TCP 66 39927 > websm [FIN, ACK] Seq=9 Ack=50000001 Win=376512 Len=0 TSval=12536537 TSecr=8800857
  4.293692     10.0.1.3 -> 10.0.1.2     TCP 66 websm > 39927 [ACK] Seq=50000001 Ack=10 Win=5824 Len=0 TSval=8800870 TSecr=12536537
  7.258439     10.0.1.2 -> 10.0.1.3     TCP 74 39928 > websm [SYN] Seq=0 Win=14600 Len=0 MSS=1460 SACK_PERM=1 TSval=12537288 TSecr=0 WS=64
  7.258835     10.0.1.3 -> 10.0.1.2     TCP 74 websm > 39928 [SYN, ACK] Seq=0 Ack=1 Win=5792 Len=0 MSS=1460 SACK_PERM=1 TSval=8801611 TSecr=12537288 WS=64
  7.258851     10.0.1.2 -> 10.0.1.3     TCP 66 39928 > websm [ACK] Seq=1 Ack=1 Win=14656 Len=0 TSval=12537288 TSecr=8801611
 11.516651     10.0.1.2 -> 10.0.1.3     TCP 66 39928 > websm [FIN, ACK] Seq=9 Ack=50000001 Win=376512 Len=0 TSval=12538352 TSecr=8802671
 11.554154     10.0.1.3 -> 10.0.1.2     TCP 66 websm > 39928 [ACK] Seq=50000001 Ack=10 Win=5824 Len=0 TSval=8802685 TSecr=12538352
 14.518560     10.0.1.2 -> 10.0.1.3     TCP 74 39929 > websm [SYN] Seq=0 Win=14600 Len=0 MSS=1460 SACK_PERM=1 TSval=12539103 TSecr=0 WS=64
 14.518906     10.0.1.3 -> 10.0.1.2     TCP 74 websm > 39929 [SYN, ACK] Seq=0 Ack=1 Win=5792 Len=0 MSS=1460 SACK_PERM=1 TSval=8803426 TSecr=12539103 WS=64
 14.518924     10.0.1.2 -> 10.0.1.3     TCP 66 39929 > websm [ACK] Seq=1 Ack=1 Win=14656 Len=0 TSval=12539103 TSecr=8803426
 18.775954     10.0.1.2 -> 10.0.1.3     TCP 66 39929 > websm [FIN, ACK] Seq=9 Ack=50000001 Win=359104 Len=0 TSval=12540167 TSecr=8804486
 18.814853     10.0.1.3 -> 10.0.1.2     TCP 66 websm > 39929 [ACK] Seq=50000001 Ack=10 Win=5824 Len=0 TSval=8804500 TSecr=12540167
 21.777952     10.0.1.2 -> 10.0.1.3     TCP 74 39930 > websm [SYN] Seq=0 Win=14600 Len=0 MSS=1460 SACK_PERM=1 TSval=12540918 TSecr=0 WS=64
 21.778344     10.0.1.3 -> 10.0.1.2     TCP 74 websm > 39930 [SYN, ACK] Seq=0 Ack=1 Win=5792 Len=0 MSS=1460 SACK_PERM=1 TSval=8805240 TSecr=12540918 WS=64
 21.778357     10.0.1.2 -> 10.0.1.3     TCP 66 39930 > websm [ACK] Seq=1 Ack=1 Win=14656 Len=0 TSval=12540918 TSecr=8805240
 26.034088     10.0.1.2 -> 10.0.1.3     TCP 66 39930 > websm [FIN, ACK] Seq=9 Ack=50000001 Win=373632 Len=0 TSval=12541982 TSecr=8806301
 26.071238     10.0.1.3 -> 10.0.1.2     TCP 66 websm > 39930 [ACK] Seq=50000001 Ack=10 Win=5824 Len=0 TSval=8806314 TSecr=12541982
 29.036042     10.0.1.2 -> 10.0.1.3     TCP 74 39931 > websm [SYN] Seq=0 Win=14600 Len=0 MSS=1460 SACK_PERM=1 TSval=12542732 TSecr=0 WS=64
 29.036429     10.0.1.3 -> 10.0.1.2     TCP 74 websm > 39931 [SYN, ACK] Seq=0 Ack=1 Win=5792 Len=0 MSS=1460 SACK_PERM=1 TSval=8807055 TSecr=12542732 WS=64
 29.036441     10.0.1.2 -> 10.0.1.3     TCP 66 39931 > websm [ACK] Seq=1 Ack=1 Win=14656 Len=0 TSval=12542732 TSecr=8807055
 33.292705     10.0.1.2 -> 10.0.1.3     TCP 66 39931 > websm [FIN, ACK] Seq=9 Ack=50000001 Win=376512 Len=0 TSval=12543796 TSecr=8808115
 33.331784     10.0.1.3 -> 10.0.1.2     TCP 66 websm > 39931 [ACK] Seq=50000001 Ack=10 Win=5824 Len=0 TSval=8808129 TSecr=12543796
 36.294700     10.0.1.2 -> 10.0.1.3     TCP 74 39933 > websm [SYN] Seq=0 Win=14600 Len=0 MSS=1460 SACK_PERM=1 TSval=12544547 TSecr=0 WS=64
 36.295131     10.0.1.3 -> 10.0.1.2     TCP 74 websm > 39933 [SYN, ACK] Seq=0 Ack=1 Win=5792 Len=0 MSS=1460 SACK_PERM=1 TSval=8808869 TSecr=12544547 WS=64
 36.295144     10.0.1.2 -> 10.0.1.3     TCP 66 39933 > websm [ACK] Seq=1 Ack=1 Win=14656 Len=0 TSval=12544547 TSecr=8808869
 40.551171     10.0.1.2 -> 10.0.1.3     TCP 66 39933 > websm [FIN, ACK] Seq=9 Ack=50000001 Win=373632 Len=0 TSval=12545611 TSecr=8809930
 40.588359     10.0.1.3 -> 10.0.1.2     TCP 66 websm > 39933 [ACK] Seq=50000001 Ack=10 Win=5824 Len=0 TSval=8809943 TSecr=12545611
 43.553103     10.0.1.2 -> 10.0.1.3     TCP 74 39934 > websm [SYN] Seq=0 Win=14600 Len=0 MSS=1460 SACK_PERM=1 TSval=12546361 TSecr=0 WS=64
 43.553490     10.0.1.3 -> 10.0.1.2     TCP 74 websm > 39934 [SYN, ACK] Seq=0 Ack=1 Win=5792 Len=0 MSS=1460 SACK_PERM=1 TSval=8810684 TSecr=12546361 WS=64
 43.553502     10.0.1.2 -> 10.0.1.3     TCP 66 39934 > websm [ACK] Seq=1 Ack=1 Win=14656 Len=0 TSval=12546361 TSecr=8810684
 47.809846     10.0.1.2 -> 10.0.1.3     TCP 66 39934 > websm [FIN, ACK] Seq=9 Ack=50000001 Win=376512 Len=0 TSval=12547426 TSecr=8811744
 47.848985     10.0.1.3 -> 10.0.1.2     TCP 66 websm > 39934 [ACK] Seq=50000001 Ack=10 Win=5824 Len=0 TSval=8811758 TSecr=12547426
 50.811768     10.0.1.2 -> 10.0.1.3     TCP 74 39936 > websm [SYN] Seq=0 Win=14600 Len=0 MSS=1460 SACK_PERM=1 TSval=12548176 TSecr=0 WS=64
 50.812156     10.0.1.3 -> 10.0.1.2     TCP 74 websm > 39936 [SYN, ACK] Seq=0 Ack=1 Win=5792 Len=0 MSS=1460 SACK_PERM=1 TSval=8812498 TSecr=12548176 WS=64
 50.812170     10.0.1.2 -> 10.0.1.3     TCP 66 39936 > websm [ACK] Seq=1 Ack=1 Win=14656 Len=0 TSval=12548176 TSecr=8812498
 55.069345     10.0.1.2 -> 10.0.1.3     TCP 66 39936 > websm [FIN, ACK] Seq=9 Ack=50000001 Win=356224 Len=0 TSval=12549240 TSecr=8813559
 55.109430     10.0.1.3 -> 10.0.1.2     TCP 66 websm > 39936 [ACK] Seq=50000001 Ack=10 Win=5824 Len=0 TSval=8813573 TSecr=12549240
 58.071233     10.0.1.2 -> 10.0.1.3     TCP 74 39938 > websm [SYN] Seq=0 Win=14600 Len=0 MSS=1460 SACK_PERM=1 TSval=12549991 TSecr=0 WS=64
 58.071671     10.0.1.3 -> 10.0.1.2     TCP 74 websm > 39938 [SYN, ACK] Seq=0 Ack=1 Win=5792 Len=0 MSS=1460 SACK_PERM=1 TSval=8814313 TSecr=12549991 WS=64
 58.071690     10.0.1.2 -> 10.0.1.3     TCP 66 39938 > websm [ACK] Seq=1 Ack=1 Win=14656 Len=0 TSval=12549991 TSecr=8814313
 62.328617     10.0.1.2 -> 10.0.1.3     TCP 66 39938 > websm [FIN, ACK] Seq=9 Ack=50000001 Win=367808 Len=0 TSval=12551055 TSecr=8815374
 62.366085     10.0.1.3 -> 10.0.1.2     TCP 66 websm > 39938 [ACK] Seq=50000001 Ack=10 Win=5824 Len=0 TSval=8815387 TSecr=12551055
 65.330596     10.0.1.2 -> 10.0.1.3     TCP 74 39939 > websm [SYN] Seq=0 Win=14600 Len=0 MSS=1460 SACK_PERM=1 TSval=12551806 TSecr=0 WS=64
 65.331038     10.0.1.3 -> 10.0.1.2     TCP 74 websm > 39939 [SYN, ACK] Seq=0 Ack=1 Win=5792 Len=0 MSS=1460 SACK_PERM=1 TSval=8816128 TSecr=12551806 WS=64
 65.331054     10.0.1.2 -> 10.0.1.3     TCP 66 39939 > websm [ACK] Seq=1 Ack=1 Win=14656 Len=0 TSval=12551806 TSecr=8816128
 69.592017     10.0.1.2 -> 10.0.1.3     TCP 66 39939 > websm [FIN, ACK] Seq=9 Ack=50000001 Win=373632 Len=0 TSval=12552871 TSecr=8817189
 69.630428     10.0.1.3 -> 10.0.1.2     TCP 66 websm > 39939 [ACK] Seq=50000001 Ack=10 Win=5824 Len=0 TSval=8817203 TSecr=12552871
 72.593917     10.0.1.2 -> 10.0.1.3     TCP 74 39940 > websm [SYN] Seq=0 Win=14600 Len=0 MSS=1460 SACK_PERM=1 TSval=12553622 TSecr=0 WS=64
 72.594305     10.0.1.3 -> 10.0.1.2     TCP 74 websm > 39940 [SYN, ACK] Seq=0 Ack=1 Win=5792 Len=0 MSS=1460 SACK_PERM=1 TSval=8817943 TSecr=12553622 WS=64
 72.594321     10.0.1.2 -> 10.0.1.3     TCP 66 39940 > websm [ACK] Seq=1 Ack=1 Win=14656 Len=0 TSval=12553622 TSecr=8817943
 76.850184     10.0.1.2 -> 10.0.1.3     TCP 66 39940 > websm [FIN, ACK] Seq=9 Ack=50000001 Win=341760 Len=0 TSval=12554686 TSecr=8819004
 76.887128     10.0.1.3 -> 10.0.1.2     TCP 66 websm > 39940 [ACK] Seq=50000001 Ack=10 Win=5824 Len=0 TSval=8819017 TSecr=12554686
 79.852083     10.0.1.2 -> 10.0.1.3     TCP 74 39941 > websm [SYN] Seq=0 Win=14600 Len=0 MSS=1460 SACK_PERM=1 TSval=12555436 TSecr=0 WS=64
 79.852469     10.0.1.3 -> 10.0.1.2     TCP 74 websm > 39941 [SYN, ACK] Seq=0 Ack=1 Win=5792 Len=0 MSS=1460 SACK_PERM=1 TSval=8819758 TSecr=12555436 WS=64
 79.852482     10.0.1.2 -> 10.0.1.3     TCP 66 39941 > websm [ACK] Seq=1 Ack=1 Win=14656 Len=0 TSval=12555436 TSecr=8819758
 84.108638     10.0.1.2 -> 10.0.1.3     TCP 66 39941 > websm [FIN, ACK] Seq=9 Ack=50000001 Win=364928 Len=0 TSval=12556500 TSecr=8820818
 84.148697     10.0.1.3 -> 10.0.1.2     TCP 66 websm > 39941 [ACK] Seq=50000001 Ack=10 Win=5824 Len=0 TSval=8820832 TSecr=12556500
 87.110545     10.0.1.2 -> 10.0.1.3     TCP 74 39942 > websm [SYN] Seq=0 Win=14600 Len=0 MSS=1460 SACK_PERM=1 TSval=12557251 TSecr=0 WS=64
 87.110920     10.0.1.3 -> 10.0.1.2     TCP 74 websm > 39942 [SYN, ACK] Seq=0 Ack=1 Win=5792 Len=0 MSS=1460 SACK_PERM=1 TSval=8821572 TSecr=12557251 WS=64
 87.110933     10.0.1.2 -> 10.0.1.3     TCP 66 39942 > websm [ACK] Seq=1 Ack=1 Win=14656 Len=0 TSval=12557251 TSecr=8821572
 91.367107     10.0.1.2 -> 10.0.1.3     TCP 66 39942 > websm [FIN, ACK] Seq=9 Ack=50000001 Win=376512 Len=0 TSval=12558315 TSecr=8822633
 91.404285     10.0.1.3 -> 10.0.1.2     TCP 66 websm > 39942 [ACK] Seq=50000001 Ack=10 Win=5824 Len=0 TSval=8822646 TSecr=12558315
 94.369010     10.0.1.2 -> 10.0.1.3     TCP 74 39944 > websm [SYN] Seq=0 Win=14600 Len=0 MSS=1460 SACK_PERM=1 TSval=12559065 TSecr=0 WS=64
 94.369450     10.0.1.3 -> 10.0.1.2     TCP 74 websm > 39944 [SYN, ACK] Seq=0 Ack=1 Win=5792 Len=0 MSS=1460 SACK_PERM=1 TSval=8823387 TSecr=12559065 WS=64
 94.369468     10.0.1.2 -> 10.0.1.3     TCP 66 39944 > websm [ACK] Seq=1 Ack=1 Win=14656 Len=0 TSval=12559065 TSecr=8823387
 98.626866     10.0.1.2 -> 10.0.1.3     TCP 66 39944 > websm [FIN, ACK] Seq=9 Ack=50000001 Win=367808 Len=0 TSval=12560130 TSecr=8824448
 98.665614     10.0.1.3 -> 10.0.1.2     TCP 66 websm > 39944 [ACK] Seq=50000001 Ack=10 Win=5824 Len=0 TSval=8824461 TSecr=12560130
101.628819     10.0.1.2 -> 10.0.1.3     TCP 74 39945 > websm [SYN] Seq=0 Win=14600 Len=0 MSS=1460 SACK_PERM=1 TSval=12560880 TSecr=0 WS=64
101.629248     10.0.1.3 -> 10.0.1.2     TCP 74 websm > 39945 [SYN, ACK] Seq=0 Ack=1 Win=5792 Len=0 MSS=1460 SACK_PERM=1 TSval=8825202 TSecr=12560880 WS=64
101.629260     10.0.1.2 -> 10.0.1.3     TCP 66 39945 > websm [ACK] Seq=1 Ack=1 Win=14656 Len=0 TSval=12560880 TSecr=8825202
105.886206     10.0.1.2 -> 10.0.1.3     TCP 66 39945 > websm [FIN, ACK] Seq=9 Ack=50000001 Win=376512 Len=0 TSval=12561945 TSecr=8826262
105.925267     10.0.1.3 -> 10.0.1.2     TCP 66 websm > 39945 [ACK] Seq=50000001 Ack=10 Win=5824 Len=0 TSval=8826276 TSecr=12561945
108.888168     10.0.1.2 -> 10.0.1.3     TCP 74 39946 > websm [SYN] Seq=0 Win=14600 Len=0 MSS=1460 SACK_PERM=1 TSval=12562695 TSecr=0 WS=64
108.888597     10.0.1.3 -> 10.0.1.2     TCP 74 websm > 39946 [SYN, ACK] Seq=0 Ack=1 Win=5792 Len=0 MSS=1460 SACK_PERM=1 TSval=8827016 TSecr=12562695 WS=64
108.888609     10.0.1.2 -> 10.0.1.3     TCP 66 39946 > websm [ACK] Seq=1 Ack=1 Win=14656 Len=0 TSval=12562695 TSecr=8827016
113.144649     10.0.1.2 -> 10.0.1.3     TCP 66 39946 > websm [FIN, ACK] Seq=9 Ack=50000001 Win=376512 Len=0 TSval=12563759 TSecr=8828077
113.181716     10.0.1.3 -> 10.0.1.2     TCP 66 websm > 39946 [ACK] Seq=50000001 Ack=10 Win=5824 Len=0 TSval=8828090 TSecr=12563759
116.146556     10.0.1.2 -> 10.0.1.3     TCP 74 39947 > websm [SYN] Seq=0 Win=14600 Len=0 MSS=1460 SACK_PERM=1 TSval=12564510 TSecr=0 WS=64
116.146994     10.0.1.3 -> 10.0.1.2     TCP 74 websm > 39947 [SYN, ACK] Seq=0 Ack=1 Win=5792 Len=0 MSS=1460 SACK_PERM=1 TSval=8828831 TSecr=12564510 WS=64
116.147008     10.0.1.2 -> 10.0.1.3     TCP 66 39947 > websm [ACK] Seq=1 Ack=1 Win=14656 Len=0 TSval=12564510 TSecr=8828831
120.403914     10.0.1.2 -> 10.0.1.3     TCP 66 39947 > websm [FIN, ACK] Seq=9 Ack=50000001 Win=376512 Len=0 TSval=12565574 TSecr=8829892
120.443446     10.0.1.3 -> 10.0.1.2     TCP 66 websm > 39947 [ACK] Seq=50000001 Ack=10 Win=5824 Len=0 TSval=8829905 TSecr=12565574
123.405816     10.0.1.2 -> 10.0.1.3     TCP 74 39949 > websm [SYN] Seq=0 Win=14600 Len=0 MSS=1460 SACK_PERM=1 TSval=12566325 TSecr=0 WS=64
123.406214     10.0.1.3 -> 10.0.1.2     TCP 74 websm > 39949 [SYN, ACK] Seq=0 Ack=1 Win=5792 Len=0 MSS=1460 SACK_PERM=1 TSval=8830645 TSecr=12566325 WS=64
123.406230     10.0.1.2 -> 10.0.1.3     TCP 66 39949 > websm [ACK] Seq=1 Ack=1 Win=14656 Len=0 TSval=12566325 TSecr=8830645
127.662879     10.0.1.2 -> 10.0.1.3     TCP 66 39949 > websm [FIN, ACK] Seq=9 Ack=50000001 Win=324352 Len=0 TSval=12567389 TSecr=8831706
127.703818     10.0.1.3 -> 10.0.1.2     TCP 66 websm > 39949 [ACK] Seq=50000001 Ack=10 Win=5824 Len=0 TSval=8831720 TSecr=12567389
130.819276     10.0.1.2 -> 10.0.1.3     TCP 74 39950 > websm [SYN] Seq=0 Win=14600 Len=0 MSS=1460 SACK_PERM=1 TSval=12568178 TSecr=0 WS=64
130.819711     10.0.1.3 -> 10.0.1.2     TCP 74 websm > 39950 [SYN, ACK] Seq=0 Ack=1 Win=5792 Len=0 MSS=1460 SACK_PERM=1 TSval=8832499 TSecr=12568178 WS=64
130.819723     10.0.1.2 -> 10.0.1.3     TCP 66 39950 > websm [ACK] Seq=1 Ack=1 Win=14656 Len=0 TSval=12568178 TSecr=8832499
138.077917     10.0.1.2 -> 10.0.1.3     TCP 74 39951 > websm [SYN] Seq=0 Win=14600 Len=0 MSS=1460 SACK_PERM=1 TSval=12569993 TSecr=0 WS=64
138.078348     10.0.1.3 -> 10.0.1.2     TCP 74 websm > 39951 [SYN, ACK] Seq=0 Ack=1 Win=5792 Len=0 MSS=1460 SACK_PERM=1 TSval=8834313 TSecr=12569993 WS=64
138.078360     10.0.1.2 -> 10.0.1.3     TCP 66 39951 > websm [ACK] Seq=1 Ack=1 Win=14656 Len=0 TSval=12569993 TSecr=8834313
142.334486     10.0.1.2 -> 10.0.1.3     TCP 66 39951 > websm [FIN, ACK] Seq=9 Ack=50000001 Win=347520 Len=0 TSval=12571057 TSecr=8835374
142.372121     10.0.1.3 -> 10.0.1.2     TCP 66 websm > 39951 [ACK] Seq=50000001 Ack=10 Win=5824 Len=0 TSval=8835387 TSecr=12571057
